,asin,title,brand,Sponsored,Best Seller,Amazon's Choice,Price,Rating,NoofRatings,Discount,Delivery,Prime Delivery,base
277,B0982PCMWZ,"Red Dead Redemption - 2 (PS4)&Nintendo Switch Pokemon Poke Ball Starter Kit with Travel Case, Power Cable & Cleaning Cloth by PDP",Red,0,0,0,"4,478",0,0,0,,1,PlayStation 4
278,B07B3W9WSV,Switch Scratch Guard Screen Guard Protector For Nintendo Switch Console (Free Soft Cloth Included),Switch,0,0,0,268,1.0,1,0,"Tuesday, February 22",1,1
279,B091PPTM49,Street27 For Nintendo Switch Joy-con Pokeball Plus Soft Case Cover Silicone Skin Protector Holder Controller Replacement Part,Street27,0,0,0,527,0,0,0,"Wednesday, March 16",0,Street27
280,B091V8VQBC,"Meyaar Cute Silicone Case Cover with Keychain, 360° Protective Case Compatible with Apple Airpods 2 &1 (Teal Switch-Green)",Meyaar,0,0,0,399,4.3,450,60,"Wednesday, February 23",1,450
281,B07WZDM6NT,"Game Controller Wall Mount Stand Holder (2 Pack) for XBOX ONE SWITCH PS4 STEAM PC NINTENDO, Universal Gamepad Accessories - No screws, Stick on, Black By Brainwavz",Game,0,0,0,699,4.5,"2,131",0,"Tuesday, February 22",1,"2,131"
282,B07K6LWNFG,"EKSA E800 Wired Over Ear Gaming Headphones with Noise Cancelling Mic, 50mm Drivers & LED Light for PC, Mobile, Tablets, Laptop, PS4, PS5, Xbox One, Nintendo Switch, VR(Yellow)",EKSA,0,0,0,"1,599",4.1,"7,472",0,"Wednesday, February 23",1,"7,472"
283,B09NYC9ZV4,MUNSAR 10 In 1 Game Card Case Holder Storage Box Protector for Nintendo Switch NS Accessory Kit,MUNSAR,0,0,0,490,0,0,0,"Monday, February 28",0,Electronic Game
284,B09F6Q334Q,"OFKLADE 24 in 1 Game Card Case Holder Cartridge Box Protector Cover for Nintendo Switch Video Games, Blue",OFKLADE,0,0,0,0,0,0,0,,0,Nintendo Switch
285,B07CZ2HFV4,NF&E Anti-Scratch Protective Travel Pouch Carry Case Cover for Nintendo Switch,NF&E,0,0,0,772,0,0,20,"Thursday, February 24",1,"₹772
₹971 Save ₹199 (20%)"
286,B084KZNKKC,"Stealodeal Red Universal Travel EVA Game Controller Carrying Case Gaming Accessory Box (for Xbox One, Xbox, Xbox 360, PS3, PS4, PS2)",Stealodeal,0,0,0,636,4.7,77,36,"Wednesday, February 23",1,77
287,B0759SS48F,NF&E Anti-scratch Housing Case Cover for Nintendo Switch Joy-Con Controller Pink [video game],NF&E,0,0,0,925,0,0,61,"Wednesday, March 2",0,"₹925
₹2,358 Save ₹1,433 (61%)"
288,B091QCKFZF,"Kawn Game Card Case 24-in-1 Cartridge Storage Box Organizer Compatible with Nintendo Switch, White",Kawn,0,0,0,776,0,0,0,"Thursday, March 10",0,Electronic Game
289,B09F6S13D4,OFKLADE 24 Slot Game Card Cartridge Detachable TF Case Holder Box For Nintendo Switch - Black,OFKLADE,0,0,0,0,0,0,0,,0,Nintendo Switch
290,B089ZW4XPV,"AhaStyle Carrying Case for Nintendo Switch Lite, Professional Protective Case for Nintendo Switch Lite with 5 Holders for Game Cartridges (Switch Logo - Light Gray)",AhaStyle,0,0,0,"1,239",0,0,32,"Saturday, March 5",0,"₹1,239
₹1,819 Save ₹580 (32%)"
291,B09CPV2X3S,"Stealodeal Red Universal Travel EVA Game Controller Carrying Case Gaming Accessory Box (for Xbox One, Xbox, Xbox 360, PS3, PS4, PS2, PS5)",Stealodeal,0,0,0,636,5.0,1,36,"Wednesday, February 23",1,1
292,B09F6R2615,"OFKLADE Game Card Case 24-in-1 Cartridge Storage Box Organizer Compatible with Nintendo Switch, White",OFKLADE,0,0,0,0,0,0,0,,0,Nintendo Switch
293,B07KQSJJF5,MagiDeal For Nintendo Switch Case - Scratch Free And Snaps On Easily TPU Moderate Hardness Clear Protective Cover Case For Nintendo Switch With 4 Thumb Grips C,MagiDeal,0,0,0,927,0,0,52,"Friday, March 11",0,"₹927
₹1,947 Save ₹1,020 (52%)"
294,B09F6QZPF6,OFKLADE 10 In 1 Game Card Case Holder Storage Box Protector for Nintendo Switch Accessory Kit,OFKLADE,0,0,0,0,0,0,0,,0,Nintendo Switch
295,B09RHMGDW7,Cat Care Compatible for AirPods Pro Charging Case Soft Silicone Protective Case 3D Design Shockproof Case Cover with Anti-Lost Metal Keyring (Nintendo Switch),Cat,0,0,0,399,1.0,1,60,"Wednesday, February 23",1,1
296,B09MS8HMWP,Sameo Premium Game Card Case-Zelda Breath of the Wild,Sameo,0,0,0,999,0,0,0,"Thursday, February 24",1,Nintendo Switch
297,B07FGGQ2D3,QUICK POUCH COLLECTION for Nintendo Switch (Super Mario) Luigi,QUICK,0,0,0,"1,880",4.2,13,0,"Thursday, February 24",1,USK Rating: Ages 6 and over
298,B01AI0GLJK,HORI D-Pad Controller (L) (Mario) Officially Licensed - Nintendo Switch,HORI,0,0,0,"4,298",4.4,"1,209",0,"Tuesday, February 22",1,PEGI Rating: Ages 3 and Over
299,B07DMZW465,Microware Silicone Rubber Case Blue Cover for Nintendo Switch Game Controller Anti-scratch,Microware,0,0,0,859,0,0,61,"Wednesday, March 2",0,"₹859
₹2,190 Save ₹1,331 (61%)"
300,B09NYF4WLG,"MUNSAR 24 in 1 Game Card Case Holder Cartridge Box Protector Cover for Nintendo Switch Video Games, Blue",MUNSAR,0,0,0,725,0,0,0,"Monday, February 28",0,Electronic Game
301,B07H5VTHJX,LEGO Harry Potter: Collection - Nintendo Switch (Nintendo Switch),LEGO,0,0,0,"2,530",4.8,"7,201",0,"Wednesday, February 23",1,PEGI Rating: Ages 12 and Over
302,B07K552P9W,Armor3 Travel Kit for Switch (Black),Armor3,0,0,0,496,4.8,5,0,"Monday, February 21",1,Armor3
303,B07F88QWZZ,Leather Switch Game Card Holder/Traveler Case/Up to 10 Game Slots Handmade by Hide & Drink :: Bourbon Brown,Leather,0,0,0,0,4.2,25,0,,0,25
304,B07L4WFY1B,TMG Game Storage Case for Nintendo Switch ( Zelda -Black ),TMG,0,0,0,990,0,0,24,"Thursday, February 24",1,"₹990
₹1,299 Save ₹309 (24%)"
305,B09NYCDGYK,MUNSAR Protective Shell Clear Case Cover for Nintendo Switch Poke Ball Plus Controller -Clear Blue,MUNSAR,0,0,0,672,0,0,0,"Monday, February 28",0,Electronic Game
306,B07NY31DF1,FLAWISH Silicone Protective Shell Case Cover for Nintendo Switch Pro Console Controller White,FLAWISH,0,0,0,746,0,0,61,"Wednesday, March 2",0,"₹746
₹1,900 Save ₹1,154 (61%)"
307,B08FBNDGPW,"Oxlaw Game Capture Cards Audio Video Capture Cards 1080P HDMI to USB Record to DSLR Camcorder Action Cam,Computer for Gaming, Streaming, Teaching, Video Conference or Live Broadcasting (USB 3.0)",Oxlaw,0,1,0,949,3.8,"1,962",59,"Tuesday, February 22",1,"1,962"
308,B09NYG11DM,"MUNSAR Game Card Case 24-in-1 Cartridge Storage Box Organizer Compatible with Nintendo Switch, White",MUNSAR,0,0,0,732,0,0,0,"Monday, February 28",0,Electronic Game
309,B08SLGFFC1,DECOM Airpods pro Case Protective Cover for AirPods Pro (Nintendo Switch),DECOM,0,0,0,339,4.8,4,66,"Thursday, February 24",0,4
310,B09NYBVDYX,MUNSAR 24 Slot Game Card Cartridge Detachable TF Case Holder Box For Nintendo Switch - Black,MUNSAR,0,0,0,729,0,0,0,"Monday, February 28",0,Electronic Game
311,B07DCYDCRL,FLAWISH Protective Snap-on Rubberized Hard Shell Skin Case Cover for Nintendo Switch,FLAWISH,0,0,0,"1,839",0,0,61,"Wednesday, March 2",0,"₹1,839
₹4,685 Save ₹2,846 (61%)"
312,B071NV1C6V,Microware Anti-Slip Gamepad Silicone Rubber Case Cover for Nintendo Switch Pro Game Controller Blue,Microware,0,0,0,694,0,0,61,"Wednesday, March 2",0,"₹694
₹1,770 Save ₹1,076 (61%)"
313,B091QCGNPX,Kawn 24 Slot Game Card Cartridge Detachable TF Case Holder Box For Nintendo Switch - Black,Kawn,0,0,0,772,0,0,0,"Thursday, March 10",0,Electronic Game
