,asin,title,brand,Sponsored,Best Seller,Amazon's Choice,Price,Rating,NoofRatings,Discount,Delivery,Prime Delivery,base
376,B08LQKH4Y8,"MASQ By Q-One Shubh 4 Layer, Reusable, with Ear Adjusters, Anti-Bacterial (BFE>99%) Embroidered Cotton Cloth Face Mask Combo for Women, Girls (includes Mask Bag)(Black-Red-Gold)",MASQ,0,0,0,299,4.4,"2,610",33,,0,"2,610"
377,B096ZYHF93,"VORA VENTURES (Pack of 10) Face Mask - Reusable Premium Fish Willow Shape 3D KF94 Mask for Men and Women, High Filtration, Anti Pollution 4 Layer Mask",VORA,0,0,0,349,3.9,47,50,"Monday, February 14",1,47
378,B097YQC7DG,"INDICARE|KIDS MASK|3 Layer Printed Surgical Mask 3-8 years [TOM & JERRY COLLECTION]|Protection|Anti-Pollution|SITRA, ISO 9001:2015, ISO 13485:2016, CE Certified|BFE 99 Surgical Mask with Nose Clip",INDICARE|KIDS,0,0,0,299,4.2,24,85,,1,24
379,B09MS83GRN,"Weston Non-Woven Fabric 3 Ply Disposable Surgical Mask with Nose Pin, Unisex, Non-Woven Fabric 3 Ply Disposable Surgical Mask with Nose Pin, Ultrasonic Soft Loops Without Valve - Blue",Weston,0,0,0,410,4.4,58,32,,0,58
380,B08P7L5RM4,OxiClear N99 Anti-Pollution Face Mask with 12 Activated Carbon Filters & Detachable Headbands D.R.D.O Certified (NO-VALVE) (Multicolor Light - Pack of 3),OxiClear,1,0,0,999,4.2,"4,171",29,"Tuesday, February 15",1,"4,171"
381,B088MBBMWD,"EUME Protect+ 95 4 Layer Reusable Washable Face Mask for Men and Women with Anti Dust, Anti-Pollution Shield, Adjustable Nose clip and Comfortable Strap with Super Soft, Breathable Cotton Fabric & Personal Name Tag for Home and Office- Made in INDIA",EUME,1,0,0,279,3.8,"3,427",30,"Monday, February 14",0,"3,427"
382,B0893BJFP1,"Hoteon Urevo Mask-3Ply Disposable Face Masks Pack With Built-In Nose Pin, Bacterial Filtration (White, Pack Of 50)",Hoteon,1,0,0,599,4.2,"2,052",25,"Saturday, February 12",1,"2,052"
383,B08XW98BS3,"Promisca Kids 5 Layer Filter N95 Certified Respirator (Blue, 5 Pieces)",Promisca,1,0,0,349,4.2,"1,946",50,"Sunday, February 13",0,"1,946"
384,B09LTWRGJF,"Pack of 100 | 10 Different colour,3 Ply Surgical Protective disposable Face Mask Multi Colour Meltblown Fabric Disposable Masks with Nose Pin | BFE >98% & PFE >95% ISI, BIS, CE & ISO Certified",Pack,0,0,0,399,4.5,12,60,,1,12
385,B08D98JMKK,"Arctic Fox N95 Respirator Mask Gold Series (White and Black, Pack of 2)",Arctic,0,0,0,223,4.3,611,25,"Wednesday, February 16",0,611
386,B098SYVYG3,"PENADIA Cotton Printed 4 Layer 3D Designer Face Mask with Adjustable Earloop for Men & Women,Breathable ,Reuseable, Washable (Pack of 12), Multicolor,Without Valve",PENADIA,1,0,0,449,3.8,518,55,,0,518
387,B09NFWDKK9,"brrf Cooling 7 Layer Mask with inbuilt filter, Cools When Wet, Adjustable Cord, Multi-Purpose Usage, Breathable, Reusable",brrf,1,0,0,499,0,0,29,,0,"₹499
₹699 Save ₹200 (29%)"
388,B09926RMSN,"NATURYZ Kids Cotton Face Mask (5-12 Years) with 5 Layer N95 SITRA Certified filters | Reusable, Washable, Breathable with Comfortable Head loop for Boys, Girls & Children",NATURYZ,1,0,0,699,3.8,178,30,,1,178
389,B08MXBBDRR,"Yuga HexaShield 3D Reusable Washable Cotton Cloth Breathable Fabric Face Mask for Men and Women | 6 layer Protection | Nose Clip | Adjustable Earloop| Anti-Germ|Anti Bacteria|Multicolor, Pack of 6 |",Yuga,1,0,0,698,4.3,264,61,,1,264
