,asin,title,brand,Sponsored,Best Seller,Amazon's Choice,Price,Rating,NoofRatings,Discount,Delivery,Prime Delivery,base
249,B09GMDMW3P,"Men's Seltos-13 Mesh Sports,Running,Walking,Casual,Gym Shoes",ASIAN,0,0,0,799,0,0,20,,1,"₹799
₹999 Save ₹200 (20%)"
250,B09CYWG8W6,Men's Player Idp Sneaker,Puma,0,0,0,"2,064",4.1,222,52,,1,222
251,B09C68Y5PX,Kids & Boys (Combo-(2)-1665-1667) Casual Stylish Sports Shoes,WORLD WEAR FOOTWEAR,0,0,0,538,3.3,67,46,,1,67
252,B08CMWV2LQ,Men's White Sport Shoes-10 UK,SEGA,0,0,0,675,3.9,28,39,,1,28
253,B09CTWGFFL,Women's Stylish Lightweight | Casual Shoes | Sports Shoes,ZAPATOZ,0,0,0,699,3.9,113,30,,1,113
254,B08T6J323H,Women Premium White Casual Shoes Sports Shoes Sneakers,Vendoz,0,0,0,599,3.6,57,40,,1,57
255,B09HMW8SVG,Grey Sports Shoes for Men,Allen Cooper,0,0,0,"1,329",3.8,10,72,,1,10
256,B091Y2RJ55,Unisex-Child Kids Sports Shoes Sneaker,Amazon Brand - Jam & Honey,0,0,0,699,4.0,9,61,,1,9
257,B07FS41YLH,Women's Running Shoe,ASIAN,0,0,0,499,4.0,"7,096",17,,1,"7,096"
258,B08YK6D156,Men's Fashion Sports Running Shoes,Amico,0,0,0,499,3.1,104,67,,1,104
259,B08NF6QV1B,Women's Claire Off PRPL/Pink Running Shoes -6 UK,Campus,0,0,0,909,4.3,122,30,,1,122
260,B09RMH96WP,"Men's Running Shoes,Walking, Gym,Training Shoes for Boys",Ginnie & Jimmie,1,0,0,649,0,0,50,,0,"₹649
₹1,299 Save ₹650 (50%)"
261,B07PB5FLZR,Mens Trainers Athletic Walking Running Gyming Jogging Fitness Sneakers/Sports Shoes,Bacca Bucci,1,0,0,"1,299",3.7,45,48,,1,45
262,B09BZCKYQ6,B-1 Sports Shoes for Mens,Big Fox,1,0,0,799,3.6,27,20,,0,27
263,B08WCCV9FX,Men's Dragon-3 Shoes,Big Fox,1,0,0,649,3.5,384,35,,1,384
264,B081B2XJM1,"Boy's & Kids Outdoor Sports Shoe| for Running, Walking, All Day Casual Wear",TRASE,0,0,0,549,3.9,"1,227",45,,1,"1,227"
265,B08WH6Z158,Men's (9303-9313) Casual Sports Running Shoes,WORLD WEAR FOOTWEAR,0,0,0,544,2.7,104,45,,1,104
266,B07TTCL9RM,Women's White Running Shoes,Amazon Brand - Symactive,0,0,0,799,3.9,378,73,,1,378
267,B07RKKT7N5,Men's NASA Running Shoes,Campus,0,0,0,"1,027",4.1,"4,381",40,,1,"4,381"
268,B08FRHVRP4,9228 Black Exclusive Range of Sports Running Shoes for Men,WORLD WEAR FOOTWEAR,0,0,0,375,2.6,333,62,,0,333
269,B08VJ8L1NK,Men Sport Shoe Navy Blue Sports Shoes - 9 UK,SEGA,0,0,0,675,3.5,74,32,,1,74
270,B094VGYFS9,Men's Energen Lite Running Shoe,Reebok,0,0,0,"2,431",3.8,31,49,,1,31
271,B098LPKHN1,Sports Shoes Walking Runing Sneaker Cool Design for Women & Girls,HimQuen,0,0,0,526,3.6,88,41,,1,88
272,B0865GYR4P,"Captain-13 Running,Walking,Gym,Casual,Canvas Shoes for Men",ASIAN,0,0,0,574,3.8,"1,614",43,,1,"1,614"
273,B09N2PTDVR,"Sports Shoes for Boys, Unisex Kids Sports Shoes, Running Shoes for Boys & Girls, Winter Shoes for Kids, Outdoor Sports Shoes for Kids 4 to 12 Years",addabok,0,0,0,449,3.7,10,25,,0,10
274,B084JCB528,Men's Maxico Running Shoes,Campus,0,0,0,794,3.9,"6,924",39,,1,"6,924"
275,B08WJ1WRL7,Men's Sm-675 Running Shoe,Sparx,0,0,0,0,4.2,"1,029",0,,0,"1,029"
276,B081LGL5QT,Men's Running Shoe,Lancer,0,0,0,725,3.8,"1,282",19,,0,"1,282"
277,B09MD3673G,Sports Shoe for Men,Allen Cooper,0,0,0,"1,329",0,0,73,,1,"₹1,329
₹4,998 Save ₹3,669 (73%)"
278,B09CD88T2D,Men's & Boys Multicolor Running Lifestyle Casual Sports Shoes,White Walkers,0,0,0,599,3.4,48,40,,1,48
279,B08TCFMB8S,Women Sports LACE UP Shoes,DYMO FOOTWEAR,0,0,0,629,3.7,114,58,,1,114
280,B0993P86Q6,Mens Light Weighted Trending and Stylish Comfortable Sports/Outdoors/Casual/Sneakers/Loafers/Running Shoes,KNOOS,0,0,0,599,3.1,48,40,,1,48
281,B09QYXXJPV,Mens Sports Fashion Steel Toe Mesh Synthetic Leather Safety Shoe(Black),BERKINS,0,0,0,0,2.8,30,0,,0,30
282,B09JKQGCZ4,"Sports Shoes for Boys, Kids Sports Shoes, Running Shoes for Boys & Girls, Outdoor Sports Shoes for Kids 4 to 12 Years, Black Shoes, Blue Shoes, Designer Kids Shoes, Kids Shoes for Dance.",xpert,0,0,0,449,3.6,31,25,,0,31
283,B07XGKNJMK,mens W3030 F1016 Walking shoe,FURO by Redchief,0,0,0,"1,895",3.6,55,5,,0,55
284,B07XTMV771,Women's Micam-z51 Running Shoes,Bourge,0,0,0,689,4.2,"6,665",54,,1,"6,665"
285,B00QH30HLQ,Men's Running Shoes,ASIAN,0,0,0,499,3.8,"3,644",17,,1,"3,644"
286,B07D5GVV8Y,Men Running Shoes,Adidas,0,0,0,"3,039",3.8,"1,373",49,,1,"1,373"
287,B07V3GNPZV,Men's Jaunt Idp Running Shoes,Puma,0,0,0,"1,799",4.0,565,55,,1,565
288,B08PWKNW3F,"Zooter Cricket Shoe for Men and Boys, Size-10 UK (White-Blue)",DSC,0,0,0,901,3.9,259,8,"Monday, February 21",1,259
289,B081QLCGB3,Men's Loire-z63 Running Shoes,Bourge,0,0,0,719,4.1,"2,082",58,,1,"2,082"
290,B09CDY7SYT,Men's Running Shoe,Kraasa,0,0,0,499,3.7,"4,393",50,,1,"4,393"
291,B08RJP9QQR,Women's Noor Plus Running Shoes,Campus,0,0,0,679,4.2,217,15,,1,217
292,B0823ZTKWP,mens Sm-614 Running Shoe,Sparx,0,0,0,860,4.0,"1,410",18,,1,"1,410"
293,B094PP8QV6,Men's Adi Rush M Running Shoe,Adidas,0,0,0,"2,149",4.3,93,50,,1,93
294,B09P7F7CKW,Men's Waterproof-13 Synthetic Sports Running Shoes,ASIAN,0,0,0,649,2.9,13,50,,1,13
295,B08TMDV46L,Men's Flex Knit Tr Track and Field Shoe,Reebok,0,0,0,"1,690",4.0,322,53,,1,322
296,B07RT42QYH,Men's Running Shoe,Amazon Brand - Symactive,1,0,0,599,3.9,"2,107",76,,1,"2,107"
297,B08Q4ZL5BH,Boy's Running Shoes,URJO,1,0,0,809,4.1,67,60,,1,67
298,B08Y9G8LWT,"Spark Running Shoes/Trainers for Men for Gyming, Cross Training, Heavy Weight Lifting, Cross-fit with Natural Rubber & Eva Sole and Breathable Upper White",Bacca Bucci,1,0,0,"1,399",3.8,201,53,,1,201
299,B08VF13TQK,"Sports Shoes for Men | Latest Stylish Casual Sneakers for Men | Lace up Lightweight Shoes for Running, Walking, Gym, Trekking, Hiking & Party | Running Shoes for Men | Training Shoes for Men",Kraasa,1,0,0,499,3.6,572,50,,1,572
300,B08HNG87JP,Men's Running Shoe,Bacca Bucci,1,0,0,"1,399",4.0,"1,412",53,,1,"1,412"
301,B08WCTF3CJ,Men's Dragon-3 Shoes,Big Fox,1,0,0,649,3.5,384,35,,1,384
302,B08YCZTS39,"Spark Running Shoes/Trainers for Men for Gyming, Cross Training, Heavy Weight Lifting, Cross-fit with Natural Rubber & Eva Sole and Breathable Upper White",Bacca Bucci,1,0,0,"1,399",3.8,201,53,,1,201
303,B083FKMX5M,Mens Trainers Athletic Walking Running Gyming Jogging Fitness Sneakers/Sports Shoes,Bacca Bucci,1,0,0,"1,199",3.6,43,52,,1,43
304,B07X92S2N8,Men's Casual Shoes in Hip Hop White Color Walking Running Gymwear Sports,Inklenzo,0,0,0,494,3.5,299,51,,1,299
305,B07ZQDS375,Air Casual Sports White Blue Running Shoes for Men's,Maddy,0,0,0,599,3.6,239,40,,1,239
306,B08HV3FR6F,Men's Running Shoe (Set of 2 Pairs),Shoefly,0,0,0,458,3.2,228,54,,1,228
307,B08QD33BQ1,Men's Patrik PRO Running Shoes,Campus,0,0,0,"1,049",3.9,621,0,,1,621
308,B082QJC6SP,Men's Energy Runner Lp FLAGRE/Conavy/None Running Shoe (KYT94),Reebok,0,0,0,"1,617",4.0,981,35,,1,981
309,B07WN941JF,Men's Sx0379s Running Shoes,Sparx,0,0,0,"1,437",4.0,210,15,,1,210
310,B07TNRVRL1,Men's Running Shoe,Amazon Brand - Symactive,0,0,0,879,3.8,335,73,,1,335
311,B09DCX4L3T,Womens Sports Shoes Rose Gold CRYSTAL-FN-104/SA(8UK),Lancer,0,0,0,393,0,0,34,,0,"₹393
₹599 Save ₹206 (34%)"
312,B095HWPDBQ,Men's Korean Style High Top Platform Fashion Sneaker/Sports/Casual Shoes for Men,Bacca Bucci,0,0,0,"1,199",4.0,105,52,,1,105
313,B08K7KQR4J,Men's Running Shoes,Liberty,0,0,0,639,3.8,574,36,,0,574
314,B098QG9D2V,Men's Victori-1 Sports Running Shoes for Men's,BOLTAGO,0,0,0,499,3.3,184,67,,1,184
315,B09JKRDK2C,Women's Rlo070 Walking Shoe,Red Tape,0,0,0,"1,433",4.4,77,74,,1,77
316,B082YD4VN8,Men's Meteor Nu Idp Closed Shoe,Puma,0,0,0,"1,382",3.8,162,61,,1,162
317,B0995P8VJJ,"Men's Grey Walking, Gym Comfortable Casual Symbol Men's Sport Shoes - GRSKP",HRAVSO,0,0,0,499,3.0,433,75,,1,433
318,B07S2G67KD,Men's Walking Shoe,Amazon Brand - Symactive,0,0,0,899,3.9,776,78,,1,776
319,B07XVKKB46,Power Men's Sports Mesh Hook and Loop Walking Running Shoes,BATA,0,0,0,904,4.5,11,10,,0,11
320,B0883LH5FF,Men's Vega Pearl-z2 Running Shoes,Bourge,1,0,0,659,4.2,"56,045",56,,1,"56,045"
321,B09BZCMYHK,B-1 Sports Shoes for Mens,Big Fox,1,0,0,799,3.6,27,20,,1,27
322,B07WHHG558,Men's Running Shoe,Big Fox,1,0,0,699,3.7,30,30,,1,30
323,B08VDF6WG7,"Sports Shoes for Men | Latest Stylish Casual Sneakers for Men | Lace up Lightweight Shoes for Running, Walking, Gym, Trekking, Hiking & Party | Running Shoes for Men | Training Shoes for Men",Kraasa,1,0,0,499,3.6,572,50,,1,572
324,B07Q5V3ZBF,Men's Sports Shoe,GoldStar,0,0,0,549,3.7,196,31,,0,196
325,B01M5CD6B9,Women's,Asian shoes,0,0,0,368,3.4,40,25,,0,40
326,B08D7XZ93B,Runner,SEGA,0,0,0,890,3.8,663,36,,1,663
327,B09BZVDSQS,"Men's Air Wonder Series Mesh Casual Sports Sneakers Shoes for Men & Boys, Walking, Running Shoes/Gymwear, Lightweight Shoes for Daily Use White",kelwin,0,0,0,474,3.9,26,53,,1,26
328,B012CG2A48,Blast Cricket Shoes,Vector X,0,0,0,499,3.8,"1,697",0,"Thursday, February 24",1,"1,697"
329,B085B2LZNK,Men's Sm-632 Running Shoe,Sparx,0,0,0,"1,630",4.1,373,4,,1,373
330,B076FGV1W6,Men Vertigo,Lotto,0,0,0,799,4.0,"14,592",68,,1,"14,592"
331,B09QXMVF77,Women's Running Shoe,ASIAN,0,0,0,299,3.9,425,40,,0,425
332,B08JZDB265,Men's Sports Walking Shoes,Lancer,0,0,0,999,4.3,320,0,,1,320
333,B094SBDW4Q,Men's Varys Tr Training Shoe,Reebok,0,0,0,"1,924",4.1,167,49,,1,167
334,B09DCWQYJ3,Men Sports Shoes Green Indus-263 (7UK),Lancer,0,0,0,599,0,0,0,,1,₹599
335,B09HZCMKX8,Men Sports and Running Shoes BRD-548,Birde,0,0,0,299,0,0,70,,0,"₹299
₹999 Save ₹700 (70%)"
336,B078HS36X5,Synergy Men's Sports Running Shoes Phylon Sole SRF0095,ACTION,0,0,0,898,4.2,5,47,"Monday, February 21",1,5
337,B09Q1X1QT4,Men's Mesh Running Sports Shoes for Men's & Boys 325,ROCKFIELD,0,0,0,499,1.0,1,50,,1,1
338,B07Z891B17,Men Loire-z116 Running Shoes,Bourge,0,0,0,745,4.0,"1,476",63,,1,"1,476"
339,B01N4NLOGT,Asian Unisex-Child Modern Shoes,Asian shoes,0,0,0,499,4.1,209,38,,1,209
340,B08MCV25R5,Men's Running Shoes,Sparx,0,0,0,"1,231",4.3,"2,760",12,,1,"2,760"
341,B099ZYR25T,Child Boy's Unisex Running/Walking Kids Sports Shoes,DAYZ,0,0,0,219,4.0,245,63,,0,245
342,B08WKD1Q3P,Men VISION-15E Blue Sports Shoes,Liberty,0,0,0,779,5.0,2,40,,0,2
343,B09NM1WZT1,Running Walking Gym Sports Shoes for Women,Hot & Knot,0,0,0,499,3.3,30,50,,0,30
344,B08PSHJ166,"Boy's & Kids Outdoor Sports Shoe| for Running, Walking, All Day Casual Wear | Easy to wear | Slip On Shoes",TRASE,0,0,0,599,4.0,"1,087",50,,1,"1,087"
345,B08T1DFXCS,Men's Air Series Mesh Casual Sports Shoes,layasa,0,0,0,399,3.2,101,60,,0,101
346,B08Y71XTJP,Women Stylish Fashionable & Sneaker Shoes for Running/Sports/Outdoors/Morning Walking/Basketball/Trekking/Dance (Black)_ES-5001-108-37,Earth Step,0,0,0,469,3.7,342,53,,1,342
347,B08T61C1B6,Women Premium White Casual Shoes Sports Shoes Sneakers,Vendoz,0,0,0,634,3.8,684,37,,1,684
348,B085B2S65C,Men Sports Shoes,Sparx,0,0,0,"1,144",3.9,"1,345",15,,1,"1,345"
349,B09MTMKVLR,Men's Rso135 Walking Shoe,Red Tape,0,0,0,"1,447",3.4,11,70,,1,11
350,B08CKV31XV,Girl's Vega-zg1 Running Shoes,Bourge,0,0,0,709,4.2,228,53,,1,228
351,B07YR1CG23,Men's Sm-629 Running Shoe,Sparx,0,0,0,"1,274",4.2,41,15,,1,41
352,B089SRHCR6,Women SL-164 Sports Shoes,Sparx,0,0,0,923,4.3,503,12,,1,503
353,B07VX3Q15P,Men's QUBA Running Shoes,Campus,0,0,0,880,3.8,413,32,,1,413
354,B09C1V622V,Kids & Boys (1667-1208-1665) Casual Stylish Sports Shoes (Set of 3 Pair),WORLD WEAR FOOTWEAR,0,0,0,732,3.5,38,51,,1,38
355,B093DVL1NT,Men's Walking Shoe,Amazon Brand - Symactive,0,0,0,513,5.0,3,77,,1,3
356,B087FGJPYP,"Lace Up Walking,Running/Gymwear Casual Shoes for Men's Brown",AZZARO BLACK,1,0,0,899,0,0,55,,1,"₹899
₹1,999 Save ₹1,100 (55%)"
357,B00UJOVGPU,Men's Running Shoes,Unistar,1,0,0,482,3.8,808,3,,0,808
358,B07Y67B7SC,Men's Running Shoes,Bacca Bucci,1,0,0,999,3.7,245,60,,1,245
359,B08KDMTCWK,Men's Pc3513 Brame Deux Running Shoes,Pierre Cardin,1,0,0,"1,299",3.9,18,35,,1,18
360,B07MLQHGS1,Men's Vega Pearl-z2 Running Shoes,Bourge,1,0,0,659,4.2,"56,045",56,,1,"56,045"
361,B08YD917QP,"Spark Running Shoes/Trainers for Men for Gyming, Cross Training, Heavy Weight Lifting, Cross-fit with Natural Rubber & Eva Sole and Breathable Upper White",Bacca Bucci,1,0,0,"1,399",3.8,201,42,,1,201
362,B082564WDB,Men's Running Shoe,Big Fox,1,0,0,699,3.1,77,30,,0,77
363,B08YMXG4X6,Men's Sports Shoe,Kraasa,1,0,0,499,3.5,"1,565",50,,1,"1,565"
364,B08D6G2H75,Men's Rlo0521 Walking Shoe,Red Tape,0,0,0,"1,483",4.1,91,71,,1,91
365,B08JM2QNSV,Men's Trendy & Stylish (9273) Black & Sports Sneakers Running Shoes,TYING,0,0,0,328,2.8,842,67,,0,842
366,B08PZ8C749,Men's Sx0666g Running Shoes,Sparx,0,0,0,"1,239",3.9,153,17,,1,153
367,B08RDPZ73R,Women's Sl-175 Sports Shoes,Sparx,0,0,0,891,4.3,216,15,,1,216
368,B09M8WCLRY,Formal Lace-Up Shoes size11 size12 size13 2512,TENN SPORTS,0,0,0,799,4.2,19,47,,1,19
369,B07LGNZ748,Men Nordic Walking Shoes,Red Tape,0,0,0,"1,120",3.7,582,82,,1,582
370,B09MZ8QBX4,Casual/Outdoor/Walking/Sports Running Shoes for Boys and Men (Black),Boogeyman,0,0,0,366,2.5,54,27,,0,54
371,B08TRK3LC5,unisex-adult Brujas Running Shoe,Puma,0,0,0,"1,599",3.9,87,60,,1,87
372,B08JQ3X61D,Men Black 9273 Running Shoes,Camfoot,0,0,0,367,3.2,5,26,,0,5
373,B071LHNNRV,Men's Running Shoes,Bacca Bucci,0,0,0,914,3.7,540,70,,1,540
374,B08FZTLWX3,Men's Statix M Conavy/LEGGLD/Stone Running Shoe-9 Kids UK (EW5540),Adidas,0,0,0,"1,320",4.2,60,56,,1,60
375,B08MVYJ24L,Men's Rso103 Walking Shoes,Red Tape,0,0,0,"1,720",4.1,411,75,,1,411
376,B09NY83FNF,Girl's Walking Running Training & Gym Lightweight Comfortable Shoe for Women/Girl's,FASHIMO,0,0,0,529,3.0,2,47,,1,2
377,B07Q6Z8RH2,Men's and Women's White Sports Shoes - 8 UK,GoldStar,0,0,0,675,3.6,146,23,,0,146
378,B07W3DB2M9,Men's Sx012bg Running Shoes,Sparx,0,0,0,849,4.0,119,15,,1,119
379,B097383LYB,"Sport Shoes Men | Comfortable for Jogging, Gym and Running Shoes for Men | Stylish Casual Mens Shoe | Footwear for Men Latest New Shoes",IMT,0,0,0,440,0,0,56,,1,"₹440
₹999 Save ₹559 (56%)"
380,B099FC8CPQ,Tesla-44 Running Shoes for Men,Kraasa,1,0,0,499,3.6,294,50,,1,294
381,B08YDDQ9M6,Men's Roadrunner 2.0 Running Shoes for Tuff Surface Run with Natural Rubber & Eva Sole and Breathable Upper,Bacca Bucci,1,0,0,"1,599",3.5,29,47,,1,29
382,B00UJOV3Y4,Men's Running Shoes,Unistar,1,0,0,482,3.8,808,3,,0,808
383,B01MYCZI6S,"Men's Jogging, Walking & Running (Narrow Toe) Shoes 032-black Sneakers",Unistar,1,0,0,482,3.9,272,3,,0,272
384,B01JBSO1T2,Shoes RIYA-01 BLKPNK Canvas Ladies Shoes,ASIAN,0,0,0,488,3.8,132,0,,0,132
385,B091Y61ZZR,Unisex-Child Kids Sports Shoes Sneaker,Amazon Brand - Jam & Honey,0,0,0,599,4.0,14,63,,1,14
386,B08FBDHTWF,Men's Sd-060 Outdoor Sandals,Campus,1,0,0,508,3.7,191,27,,1,191
387,B08HNGK3B7,Men's Running Shoe,Bacca Bucci,1,0,0,"1,399",4.0,"1,412",53,,1,"1,412"
388,B08TY3HN7Q,Men's Casual Mesh Material Running Sports Shoes,Global Rich,1,0,0,"2,660",0,0,11,,1,"₹2,660
₹2,999 Save ₹339 (11%)"
389,B0745FXDYR,Men's Running Shoes,Bacca Bucci,1,0,0,699,3.8,29,72,,1,29
