,asin,title,brand,Sponsored,Best Seller,Amazon's Choice,Price,Rating,NoofRatings,Discount,Delivery,Prime Delivery,base
259,B08P7LMB5G,"Vasukie Rechargeable LED Desk Lamp Touch On/Off Switch, Children Eye Protection, Student Study Reading Dimmer Led Table Lamps, USB Charging Touch Dimmer (White, Pack of 1)",Vasukie,0,0,0,499,4.3,235,67,"Wednesday, February 23",1,235
260,B099PZYSJF,Renyke Rechargeable Desk/Study Lamp Touch On/Off Switch Desk Table Lamp with Mobile Holder Office Desk lamp Touch Dimmer Childeren Eye Protection Desk Lamp (White),Renyke,1,0,0,659,5.0,3,34,"Wednesday, February 23",1,3
261,B08RCT2DNK,"Pick Ur Needs® Rechargeable LED Touch On/Off Study Table Lamp for Children Eye Protection, Student Study Reading Dimmer Rechargeable Led Table Lamps USB Charging (Cap Shape, White, Pack of 1)",Pick,1,0,0,549,4.2,"3,416",31,"Wednesday, February 23",1,"3,416"
262,B07WFKH6TY,TIED RIBBONS Decorative Fancy Bedside Table Lamps (White)Pack of 1,TIED,1,0,0,999,4.2,16,63,"Wednesday, February 23",1,16
263,B07WJ9ZG72,"i GEAR SenseLed Rechargeable Hand Gesture Table Lamp with Eye Protection, 7 Colours (Red/Green/Orange/Daylight/Blue/Pink/Yellow) for Home Ambience Lighting & Motion Sensor Desk Lamp, Pack of 1, White",i,1,0,0,"1,850",4.0,38,26,"Wednesday, February 23",1,38
264,B08T9VW71K,PlyPandit Tripod Table Lamp with All Fresh Color and Finishes (Yellow),PlyPandit,0,0,0,"1,250",4.5,49,58,"Wednesday, February 23",1,49
265,B078YSCHQM,Original Metal LED Table Lamp (Warm White),Original,0,0,0,650,3.9,13,57,"Thursday, February 24",1,13
266,B082F3W8LY,"Creation India Craft Wooden Table Lamp for Bedroom, Living Room Home Decorative Study Bedside Table Lamps for Home Decoration 14 inch Pyramid Shaped Brown Without Bulb 14'' Inch",Creation,0,0,0,899,4.4,152,46,"Wednesday, February 23",1,152
267,B079P4B9K8,ExclusiveLane EL-003-158 'Glowing Reds' Terracotta Decor Floral Handpainted Vessel Shaped Home Decorative Bedside Table Lamps (Red),ExclusiveLane,0,0,0,"1,549",3.9,80,23,"Sunday, February 20",1,80
268,B08KHTKSDH,LIGHT ANGLE Metal Base with Fabric Shade Table Lamp (Yellow),LIGHT,0,0,0,999,3.5,44,41,"Wednesday, February 23",1,44
269,B098SW4MQ7,Diving Deep Round Doctor Flexible Bulb Adjustable Table Lamp- Silver (Bulb not Included),Diving,0,0,0,799,4.1,15,47,"Wednesday, February 23",1,15
270,B096QVXMP5,"EYESHOT Dr Table Lamp Lager & Adjustable Size for Reading / Study / Learning / Work Switch on Base of 23"" Metal Table,Black( Bulb not Included)",EYESHOT,0,0,0,999,5.0,1,50,"Wednesday, February 23",1,1
271,B08WLW11DX,Homesake Modern Farmhouse Metal Diamond Desk Table Lamp with Light Bulb Decorative Bed Table Side Matt Black Light (Beige) Pack of 1,Homesake,0,0,0,"1,599",4.6,7,43,"Wednesday, February 23",1,7
272,B08NPDVLQD,"LED Touch On/Off Switch Desk Lamp with USB Charging Touch Dimmer(White,Pack of 1)",LED,0,0,0,270,3.4,221,66,"Wednesday, February 23",0,221
273,B08W2KM8DD,"Classic Sturdy Metal Body (All Black) Vintage Lamp for Study / Reading / Office / Work / Desk / Table, Pack of 1",Classic,0,0,0,"1,199",3.9,32,33,"Wednesday, February 23",0,32
274,B09Q6G8G1V,"Diktmark Classic-Table-LAMP-Super-Quality Study Lamp (30 cm, Red)",Diktmark,0,0,0,279,0,0,72,"Wednesday, February 23",0,"₹279
₹999 Save ₹720 (72%)"
275,B0826YSLL2,"AABHAYA ARTS Glass Mosaic Dome Shaped Table Lamp (Multicolour, Bulb not Included)",AABHAYA,0,0,0,355,4.1,33,64,"Saturday, February 26",1,33
276,B07DYFBMCQ,Wipro Symphony 6-Watt Rechargeable LED Table Lamp (White)Pack of 1,Wipro,0,0,0,"1,078",4.1,"1,659",28,"Sunday, February 20",1,"1,659"
277,B09PB251FX,New Creation Study lamp Rechargeable Led Touch On Off Switch Student Study Reading Dimmer Led Table Lamps White Desk Light,New,0,0,0,349,0,0,59,"Wednesday, February 23",1,"₹349
₹849 Save ₹500 (59%)"
278,B09D3BFN53,"Tgopit Crystal Table Lamp , Gold , Pack of 1",Tgopit,0,0,0,"1,299",4.2,10,50,"Wednesday, February 23",1,10
279,B09MS1MXKR,Smartone 3 Brightness Rechargeable LED Table lamp for Studies Desk lamp,Smartone,0,0,0,299,5.0,2,70,"Wednesday, February 23",0,2
280,B08TCGQPSB,DIKANSHA Blue Flower Printed Conical Shade and Beautiful Table Lamp for Bedroom and Drawing Room,DIKANSHA,0,0,0,548,5.0,3,58,"Wednesday, February 23",1,3
281,B08R9GCM1X,IDOLESHOP Long Arm Study Desk Light with 3 Shades Touch Control Light Advanced Pen and Mobile Holder Design Table Lamp ((Touch + Pen Stand))Pack of 1,IDOLESHOP,0,0,0,649,4.2,42,66,"Wednesday, February 23",1,42
282,B0172DAEVM,"WEMEX Metal Reading and Study Table Lamp, Black",WEMEX,0,0,0,549,4.0,21,45,"Wednesday, February 23",1,21
283,B097Q4HJ3T,"WOZIT Kennede Gold Rechargeable Modern Table Desk Light with Eye-caring LED Study Table Lamp, 3 Levels Dimming Study Lamp (White, Pack of 1 Light Kit)",WOZIT,0,0,0,499,4.2,26,62,"Monday, February 21",1,26
284,B09L76SMPQ,CINEFX'S Rechargeable Touch Brightness Eye Protection Student Study Control Desk lamp with Touch On-Off (White)Pack of 1,CINEFX'S,0,0,0,599,4.0,26,70,"Thursday, February 24",1,26
285,B097DRDMZ8,SAMVARDHAN Rechargeable LED Touch On/Off Switch Desk Lamp Children Eye Protection Student Study Reading Dimmer Rechargeable Led Table Lamps USB Charging Touch _ Pack of 1 Multicolor,SAMVARDHAN,0,0,0,399,3.6,32,56,"Wednesday, February 23",0,32
286,B00G9TFEU2,"ExclusiveLane Mango Wood Table Lamps, Off-White, Maroon and Cream",ExclusiveLane,0,0,0,"1,075",4.4,38,34,"Sunday, February 20",1,38
287,B07Z2RP9MN,"SR LIGHTING HOUSE Glass Table Lamp, Multicolour, Pack of 1",SR,0,0,0,399,4.1,308,69,"Saturday, February 26",1,308
288,B09BS3J2HX,"Renesmee Adjustable Rechargeable Electric Charging Bulb Emergency Light for Home Office Study Table Lamp Desk, Light Long Battery Life Upto 4 Hrs (Multicolor)",Renesmee,0,0,0,499,4.0,8,50,"Wednesday, February 23",1,8
289,B089VQ6F9G,"Mi Smart Bedside Lamp 2 (16 Million Colors, App-Enabled, Touch Panel)",Mi,0,0,0,"2,899",4.5,"1,127",3,"Sunday, February 20",1,"1,127"
290,B08L6PDXYL,"Nautical Home Decorâ„¢ Natural Teak Wooden Crafter Standard Size Tripod Floor Lamp With Jute Shade Home Decors Gift, Brown, Pack of 1.",Nautical,0,0,0,"1,099",4.3,"2,523",80,"Thursday, February 24",0,"2,523"
291,B07SHCGQBH,XECH Made in India Table Lamp with Adjustable Brightness & Rechargeable Battery T2C LED Desk Light with Pen Stand & Stationery Holder,XECH,0,0,0,899,4.3,33,31,"Thursday, February 24",1,33
292,B08WLVLTFT,Thunder LED Emergency Solar & Electric Rechargeable Portable Lantern Torch Table Lamp with Eye Protection Glass (Orange)Pack of 1,Thunder,0,0,0,399,3.8,13,73,"Saturday, February 26",1,13
293,B08P8ZJFB7,M2 Look Multi Flower Printed Conical Shade and Beautiful Metal Base Table Lamp (Black)Pack of 1,M2,0,0,0,549,3.6,17,54,"Wednesday, February 23",1,17
294,B092MXMZ1N,DIKANSHA Off White Conical Shade and Beautiful Table Lamp for Bedroom and Drawing Room (Red)Pack of 1,DIKANSHA,0,0,0,749,4.1,13,50,"Wednesday, February 23",1,13
295,B09PRGDMZD,"CRAFTVERRE Mushroom Shaped Mosaic Glass Lamp for Home/Office/Festival Decoration (Bulb Not Included) (Table Lamps- 04, 17cm)",CRAFTVERRE,0,0,0,399,5.0,2,79,"Saturday, February 26",0,2
296,B085SDVP91,"Amazon Brand - Solimo Rechargeable Moon Lamp with 3 Lighting Modes, 10 cm(White,Pack of 1)",Amazon,1,0,0,534,3.7,45,51,"Sunday, February 20",1,45
297,B07LCGXBGJ,TIED RIBBONS Fancy Decorative Table Lamp for Living/Bedroom Home Office Decoration (Black),TIED,1,0,0,"1,499",3.3,8,57,"Wednesday, February 23",1,8
298,B09S7ZWSFG,Wooden Table Lamp with Shade Home Decor Gift,Wooden,1,0,0,899,0,0,25,"Friday, February 25",1,"₹899
₹1,200 Save ₹301 (25%)"
299,B09R1P9C94,LED Table Lamp for Bedroom Living Room Modern Linen Bedside Lamp Dimmable Table Lamps Night Light…,LED,1,0,0,"6,500",0,0,35,"Thursday, February 24",0,"₹6,500
₹9,999 Save ₹3,499 (35%)"
300,B09DQ528ND,Crosscut Premium Wooden Bed Side Table lamp (Brown with White),Crosscut,1,0,0,995,4.5,6,50,"Wednesday, February 23",1,6
301,B08T9WWGFN,"PlyPandit Wood Table Lamp, Red, Pack of 1",PlyPandit,1,0,0,"1,250",4.5,49,58,"Wednesday, February 23",1,49
302,B096QB4ZQC,Retro Interio Heavy GI Flanges Table Lamp Paired with E27 Filament Bulb & in-Line Dimmer Switch (Metallic Burgandy),Retro,1,0,0,"1,439",0,0,52,"Thursday, February 24",0,"₹1,439
₹3,000 Save ₹1,561 (52%)"
303,B09DL4V6KH,Crosscut Premium Wooden Bed Side Table lamp in Natural Finish (Natural Jute),Crosscut,1,0,0,995,4.2,14,50,"Wednesday, February 23",1,14
304,B07Z2SQ1R9,R.S Traders Mosaic Style Dome Shaped Glass Table Lamp (Multicolour),R.S,0,0,0,360,4.4,13,72,"Saturday, February 26",1,13
305,B076VNM8XZ,Homesake® Mabel Rustic Wood Table Lamp with Khadi Shade,Homesake®,0,0,0,"1,450",3.8,5,46,"Wednesday, February 23",1,5
306,B09J56Q7F9,"Total Led Light Long Wire with Bed Switch On Off Button for Table Lamps and DIY Projects (1.8 Meter, 60 Inch, Black)",Total,0,0,0,189,5.0,3,68,"Wednesday, February 23",0,3
307,B09DSQMWQM,"FABULASTIC Multi-Functional USB Rechargeable, Study Desk Table Touch Lamp, Power Bank, Pen Holder and Phone Stand with 360° Flexible Metal Hose (White and Warm Light, 1200mAh)",FABULASTIC,0,0,0,"1,189",4.1,13,41,"Tuesday, February 22",1,13
308,B09HPQFWS8,"Royal Brass Antique Trophy Table Lamp with Off White 14 inches Lampshade for Bedside Stylish, Living Room, Bedroom, Home Decoration, Hotel",Royal,0,0,0,"3,775",3.8,4,53,"Wednesday, February 23",0,4
309,B08MWMKZPH,"IDOLESHOP Desk Lamp for Study with 3 Shades Touch Control Light and Mobile Holder Design with Night Light Table Lamp (5 in One Round, White, Pack of 1)",IDOLESHOP,0,0,0,699,4.3,24,63,"Wednesday, February 23",1,24
310,B085W5XTBW,"ExclusiveLane Mango Wood Base, Cambric Cotton Shade Table Lamp for Living Room Bedroom Bedside Lamp (Off-White, Turquoise Base, Cream Shade)Pack of 1",ExclusiveLane,0,0,0,"1,599",4.3,103,20,"Tuesday, February 22",1,103
311,B08DN1B2H4,"Ganglas Glass & Metal Banker'S Style, Green Shade, Brass Finish Table Lamp (Antique, 29X21X42)Pack of 1",Ganglas,0,0,0,"2,599",3.9,18,68,"Saturday, February 26",0,18
312,B09DY5GJDS,"Vowel Rechargeable Led Study Lamp Touch On & Off Eye Protection Student Study Reading Dimmer Switch Desk Table Lamps Usb Charging Touch Dimmer (Desk Light) White, Pack of 1",Vowel,0,0,0,349,3.2,41,50,"Wednesday, February 23",1,41
313,B085KX5543,"ExclusiveLane Iron Bedside Table Lamp for Living Room (Without Bulb) (White, Black) Pack of 1",ExclusiveLane,0,0,0,"1,399",3.7,41,19,"Wednesday, February 23",1,41
314,B09MBVMTQ9,"DEEJET Study lamp Rechargeable Led Touch On Off Switch Student Study Reading Dimmer Led Table Lamps White Desk Light , Children Eye Protection Desk lamp",DEEJET,0,0,0,298,4.7,7,70,"Wednesday, February 23",1,7
315,B07MNRY62S,"VRCT Classic Off-White Khadi Conical Shade and Beautiful Black Base Table Lamp for Bedroom and Drawing Room, Table Lamp (Size: 40 x 26 x 15 cm) (Bulb not Included)(Black,Pack of 1)",VRCT,0,0,0,650,3.4,330,67,"Wednesday, February 23",1,330
316,B079KSQT65,"ExclusiveLane 'The Blueberry Elephant' Madhubani Hand-Painted Wood Square Antique Bedside Table Lamp (Berry Blue and Cream), Pack of 1",ExclusiveLane,0,0,0,"1,349",4.1,13,25,"Tuesday, February 22",1,13
317,B019RZ26XC,"earthenmetal Mushroom Shaped Glass Table lamp for Bedside Living & Home Decoration Turkish Lamp (Red, 6.5 inches, Bulb not Included).",earthenmetal,0,0,0,375,4.2,270,62,"Thursday, February 24",0,270
318,B09LCF8XHS,ELEPHANTBOAT® 3W Portable Wireless Book Reading Light 1800mAh Desk Lamp Hanging LED Table Lamp USB Charging Night Light Stepless Dimming Book Light Book Reading Lamp,ELEPHANTBOAT®,0,0,0,952,2.0,1,25,"Thursday, February 24",1,1
319,B08VD4P7MP,"KAVANA Eye Protection 360° Gooseneck Lamp for Student Rechargeable LED Touch On/Off Switch Desk Lamp / Student Reading Dimmer Led Table Lamp with Pen Holder, Mobile Stand, Study Lamp",KAVANA,0,0,0,449,4.0,285,55,"Thursday, February 24",0,285
320,B09J5B1Y2F,"Glaceon Multifunctional Cute LED Desk Lamp with Wireless Charger, USB Charging Port, 3 Lighting Modes, 3 Brightness Levels, Sensitive Control, Office Lamp",,1,0,0,0,0,0,0,,0,
321,B091P2HWQZ,Creation India Craft Sheesham Wood Table Lamps For Living Rooms Bedroom Study Lamp Bedside Table Lamps for Home Decoration office Desk Lamp for Drawing Room Lamp 14.5 inch Without Bulb,Creation,1,0,0,"1,199",4.1,20,44,"Wednesday, February 23",1,20
322,B08X2V3L6D,"Pick Ur Needs Rechargeable LED Touch On Off Study USB Charging Table Lamp, White, Pack of 1",Pick,1,0,0,675,4.1,22,48,"Wednesday, February 23",1,22
323,B09MS7DJ3Y,AF EXPO Rechargeable LED Touch On/Off Switch Desk Lamp Children Eye Protection Student Study Reading Dimmer Rechargeable Led Table Lamps USB Charging Touch Dimmer(Desk Lights for Study,AF,1,0,0,399,4.5,27,60,"Wednesday, February 23",1,27
324,B06XK78H1W,B22 Brass lamp Holder with 90 Inches Long Wire with On/Off Bed Switch Button Wire for Table lamp or lamp Base,B22,0,0,0,471,3.7,36,41,"Wednesday, February 23",0,36
325,B00G9TESJA,"ExclusiveLane EL-003-003 Wooden Home Decorative Bedside Table Lamps (12.7 cm x 12.7 cm x 35.6 cm, Green and Off White, 14 Inch )Pack of 1",ExclusiveLane,0,0,0,"1,075",4.1,142,34,"Sunday, February 20",1,142
326,B08M67XXBT,"Aditya Handicrafts Wooden Handmade Table Lamp with Creative Design (Brown, 26x17 cm)",Aditya,0,0,0,469,3.1,6,64,"Wednesday, February 23",1,6
327,B09MNPZZKJ,TECHTOP Cute Cartoon Teddy Bear Desk Lamp Rechargeable LED Kids Table lamp for Study / Portable Coulor Changing Home Decor Side Table Night Study lamp with Flexible Adjustable,TECHTOP,0,0,0,399,4.0,1,56,"Friday, February 25",0,1
328,B08LKKJR3D,Addcart Led Book Lights Sturdy Adjustable Reading Lamp Flexible Arm Lightweight Eye-Care Night Clip On Bed Light Perfect For Bookworms And Kids (Multicolour)Pack of 1,Addcart,0,0,0,299,4.3,23,25,"Wednesday, February 23",1,23
329,B071NG4XWJ,"ExclusiveLane Madhubani Handpainted Terracotta Bedside Table Lamps (Black & Red, Without Bulb, 14 Inch), Pack of 1",ExclusiveLane,0,0,0,"1,799",3.9,16,35,"Sunday, February 20",1,16
330,B07D4DVXKM,"Sunsenses Black 29"" Metal Doctor Table Lamp for Reading / Study / Learning / Work, (Pack of 1)",Sunsenses,0,0,0,"1,239",4.4,137,23,"Thursday, February 24",0,137
331,B09NSJVQBM,"KGDA LED Acrylic God Radha and Krishna / Radha Krishna Changing LED Night Table Lamp Night Lamp Night Lamp (10 cm, Multicolor)",KGDA,0,0,0,239,0,0,52,"Wednesday, February 23",0,"₹239
₹499 Save ₹260 (52%)"
332,B09B7QJC89,LIGHT ANGLE Table Lamp (Beige),LIGHT,0,0,0,"1,399",4.4,6,69,"Wednesday, February 23",1,6
333,B07TBR9NGC,"Decent Glass Turkish Home Decor Table Lamp Purse Shape Mosaic Glass Lamps for Home Decoration (19 cm, Multicolour)Pack of 1",Decent,0,0,0,599,4.2,19,70,"Saturday, February 26",1,19
334,B09D51SQ9L,"RONFILD Star Master Rotating 360 Degree Moon Night Light Lamp Projector with Colors and USB Cable,Lamp for Kids Room Night Bulb (Multi)",RONFILD,0,0,0,399,4.1,110,60,"Wednesday, February 23",0,110
335,B08348G1LD,AMUD Plastic Table Lamp (Black) Pack of 1,AMUD,0,0,0,749,4.1,99,32,"Thursday, February 24",1,99
336,B09FFS9KLP,"TECHTOP Rechargeable Reading LED Touch Light for Book, Study Table Night Reading Lamp for in Bedroom, Bed Side Rechargeable USB LED 3 Modes for Kindle, Laptop, Stand (White)",TECHTOP,0,0,0,329,3.8,5,63,"Friday, February 25",0,5
337,B09DKDWRHL,MACVL5 Smart Study Desk/Table Led lamp with Touch Rechargeable Control Light Touch On/Off Switch Desk Lamp Children Eye Protection Student Study Reading Dimmer,MACVL5,0,0,0,299,4.3,10,70,"Wednesday, February 23",0,10
338,B08V24TV3Q,"Pick Ur Needs Rechargeable Foldable Portable LED Light USB Eye Protection Table/Desk Lamp Touch Control (Ring Shape Flexible Lamp, White, Pack of 1)",Pick,0,0,0,699,4.1,578,53,"Wednesday, February 23",1,578
339,B07PRJ7PT8,BonZeaL 3D Green Frog Lamp Valentine Gift for Girlfriend LED Table Night Lamp for Bedroom,BonZeaL,0,0,0,"1,100",4.3,27,50,"Wednesday, February 23",1,27
340,B098SY2NFV,Diving Deep Table Lamp Study Lamp Adjustable Table Lamp Round Doctor Flexible Lamp Bulb Adjustable Bulb not Included,Diving,0,0,0,699,4.5,2,65,"Wednesday, February 23",1,2
341,B0856RQ8HP,"ESN 999 Aluminium Table Lamp, Black, Pack of 1",ESN,0,0,0,459,4.0,81,49,"Wednesday, February 23",0,81
342,B08XPFGCWZ,"Wisely Soft Light LED Desk Lamp with Flexible Gooseneck 3 Level Brightness, Table Lamp 5W Touch Control, Compact Portable lamp for Dorm Study Office Bedroom, Eye-Caring and Energy Saving (Cold White)",Wisely,0,0,0,389,3.8,6,61,"Wednesday, February 23",1,6
343,B09H7HDS6L,"3D Illusion LED Night Lights for 7 Colors Led Bedroom Decoration Lighting Gifts for Boys Girls Kids Baby Friends Love Couple and You are My Life with I Love You Night Lamp(10 cm, Multicolor)",3D,0,0,0,189,3.5,6,62,"Wednesday, February 23",1,6
344,B09P585YJ8,"Ocmoh Rechargeable LED Touch On Off Desk Lamp Night Lamp Children Eye Protection Study lamp USB Charging for Students Study,Bedroom,Living room,Computer,Reading Dimmer Led Table Lamps (White Desk Lights)",,0,0,0,0,0,0,0,,0,
345,B08RCTGBHC,Thunder Home Office Travel Outdoor Camping LED Emergency Light Solar & Electric Rechargeable Portable Lantern Torch Table Lamp with Eye Protection Glass (Multicolour)Pack of 1,Thunder,0,0,0,348,3.7,49,73,"Saturday, February 26",1,49
346,B09NDMKJFH,"DECOWAY Handmade Wicker Table Lamp, Vintage Night Lamp Shade Side Lamps Light Decoration for Home, Living Room, Bedroom Bedside, Hall | Made in India; Color: Beige; (Bulb Not Included)",DECOWAY,0,0,0,"2,299",0,0,57,"Wednesday, February 23",1,"₹2,299
₹5,299 Save ₹3,000 (57%)"
347,B09PGGSDX9,"KVM ENTERPRISE Himalayan Rock Salt Globe Shape Lamp for Home Decor Wellness Natural Healing Max Positive Energy Harmony Purification & Vastu Gift Globe - Orange, 3 to 4 KG",KVM,0,0,0,"1,399",4.0,22,30,"Wednesday, February 23",1,22
348,B07MJ63LRR,Akari Table LAMP 1 - AK-7004B (White),Akari,0,0,0,599,4.6,15,40,"Wednesday, March 2",1,15
349,B08D46K5R6,"tu casa Ntu-115 Jute Shade Table Lamp with Metal Base and B-22 Holder (Beige, Bulb not Included)",tu,0,0,0,650,4.2,15,0,"Tuesday, February 22",1,15
350,B08LDG49GK,"New Battery Operated 3W Wall Mounted led Cordless Cob Night Work Light Bulb Shape Led Switch Light, (White, 1-pcs)",New,0,0,0,339,3.5,138,66,"Wednesday, February 23",1,138
351,B08359DJ5F,"BillieJean Metal Table Lamp, White, Pack of 1",BillieJean,0,0,0,699,4.0,63,30,"Wednesday, February 23",1,63
352,B00G9TFE0M,"ExclusiveLane 14 Inch Wooden Home Decorative Bedroom Living Room Bedside Table Lamps for Home Decoration (12.7 cm x 12.7 cm x 35.6 cm, Turqouise Blue & Cream, Without Bulb) (EL-003-042)Pack of 1",ExclusiveLane,0,0,0,"1,075",4.5,29,34,"Sunday, February 20",1,29
353,B09LYM7MJQ,Black Electric Flexible Table Lamp for Home/Office/Study/Desk/Table/Students,Black,0,0,0,599,3.7,3,40,"Wednesday, February 23",0,3
354,B07PBFPQJQ,"Homesake® Cauldron of Light, 192 Black Crystal Lamp, Decorative Table lamp",Homesake®,0,0,0,999,5.0,4,38,"Wednesday, February 23",1,4
355,B017IR3KF4,"BillieJean Metal Table Lamp, Blue, Pack of 1",BillieJean,0,0,0,699,4.1,348,30,"Wednesday, February 23",1,348
356,B094XDGRTK,CITRA Frosted Ball Shade Gold Base Table Lamp (Warm White),CITRA,1,0,0,"3,999",5.0,1,20,"Wednesday, February 23",1,1
357,B09R4354NS,LED Table Lamp for Bedroom Living Room Modern Linen Bedside Lamp Dimmable Table Lamps Night Light…,LED,1,0,0,"4,199",0,0,58,"Thursday, February 24",0,"₹4,199
₹9,999 Save ₹5,800 (58%)"
358,B09HGZYY9H,RUCON® Study lamp Rechargeable Led Touch On Off Switch Student Study Reading Dimmer Led Table Lamps White Desk Light White,RUCON®,1,0,0,299,3.8,"1,006",70,"Wednesday, February 23",1,"1,006"
359,B08VH68FNQ,"Pick Ur Needs Rechargeable LED Eye-Caring Table Desk Lamp with USB Charging Cable Touch Control Flexible Head, White, Pack of 1",Pick,1,0,0,699,4.2,"3,416",53,"Wednesday, February 23",1,"3,416"
360,B09DQ3MDVZ,Crosscut Premium Wooden Bed Side Table lamp (Walnut with Jute),Crosscut,1,0,0,995,4.5,6,50,"Wednesday, February 23",1,6
361,B08TT96X7Q,"WAKEN LED Cordless Rechargeable Clip Touch Button ON-Off Dimmable, Multi",WAKEN,1,0,0,538,4.2,17,40,"Wednesday, February 23",1,17
362,B09CF4N1BR,India Circus by Krsnaa Mehta Robin Bird Park Hexagonal Lamp,India,1,0,0,"3,514",4.0,1,5,"Sunday, February 27",0,1
363,B09CFKN6YQ,India Circus by Krsnaa Mehta Robin Bird Park Cylindrical Lamp,India,1,0,0,"2,279",0,0,5,"Sunday, February 27",0,"₹2,279
₹2,399 Save ₹120 (5%)"
364,B09RP9LP42,"Glowserie 3D Lamp Room Bedroom Decorative Illusion Night Light, LIYUDL Finger Heart Multi 7 Color Change USB Cable LED Desk Table Light Home Decoration A Great Gift Idea for Boys or Dad",Glowserie,0,0,0,399,5.0,2,33,"Friday, February 25",0,2
365,B07MKJZ5R7,"VRCT Classic Red Conical Shade and Beautiful Black Base Table Lamp for Bedroom and Drawing Room, Table Lamp (Size: 40 x 26 x 15 cm,Pack of 1)",VRCT,0,0,0,695,3.6,165,65,"Wednesday, February 23",1,165
366,B09PLGFKPR,ZURU BUNCH® Rechargeable Touch OnOff Switch Desk Lamp Children Eye Protection Student Study Reading Dimmer Rechargeable Led Table Lamp (Pink),ZURU,0,0,0,249,2.6,5,75,"Saturday, February 19",0,5
367,B015ZJY3V2,Bajaj Softlite TL0015W24VWH LED Table Lamp (Cool Day Light) (Cool Day Light),Bajaj,0,0,0,"1,580",4.4,162,7,,0,162
368,B09K5K4TZH,Total Led Light Switch/Dimmer Wire for Lamps - 1.5 Meters - Table Lamps/Bedside Light/Desk Lamps/Study Lamps (Dimmer Wire) (AC),Total,0,0,0,189,4.5,2,76,"Wednesday, February 23",0,2
369,B07WW1YMMW,"Shopopoye Reading Light For Book,Study Table Night Reading Lamp For Bed Side Rechargeable Usb Led Clip On With 3 Modes, Abs Plastic With 1.8W For Laptop, Stand- Black, Pack of 1",Shopopoye,0,1,0,"1,095",4.3,"1,688",56,"Sunday, February 20",1,"1,688"
370,B08MZ2Y8W1,"Skylofts 7 Color Purple Table Lamp, Rechargable Touch Sensor Moon Night Light for Room, Night Lamps Decoration Piece (with Stand), Romantic Valentine Gift for Girlfriend - Pack of 1",Skylofts,0,0,0,849,4.0,113,58,"Friday, February 25",1,113
371,B09HHRYGFX,"Livato Touch Desk lamp LED Touch On Off Switch Student Study Reading Dimmer Rechargeable Led Table Lamps Eye Protection Lamp ( White,Pack of 1 )",Livato,0,0,0,449,4.2,11,65,"Wednesday, February 23",0,11
372,B09NF3FP1D,ESN 999 Electric Flexible Chrome Black Table Lamp for Home/Office/Study (Black),ESN,0,0,0,469,4.0,1,48,"Wednesday, February 23",0,1
373,B07YJ4891Y,Wowcrafts 15W Table Lamp (Red),Wowcrafts,0,0,0,"1,799",4.1,44,64,"Wednesday, February 23",1,44
374,B09LV75HTJ,"FunBlast LED Table Lamp - Rechargeable Desk Lamp with Pen Holder & Sharpener, LED Lamp for Kids for Study Room / Home / Office (Pack of 1 Pcs, Multicolor) (Pink)",FunBlast,0,0,0,379,4.4,4,24,"Thursday, February 24",0,4
375,B09BLHLH2G,"Katkaria Creations Marble Soapstone Ball Shaped Handmade Table Lamp (Floral, Natural Soapstone)",Katkaria,0,0,0,899,5.0,3,10,"Thursday, February 24",1,3
376,B09MWD3TPV,Homesake® Sculptural Hand Carved Wood Table Lamp with Khadi Square Shade (Antique Black),Homesake®,0,0,0,"1,499",5.0,1,70,"Wednesday, February 23",1,1
377,B09RV4Z6NT,"Tesseract Customized / Personalized Photo Moon Lamp / Night Lamp / Table Lamp with LED (13 cm, White) with Power Adaptor",Tesseract,0,0,0,849,0,0,66,,0,"₹849
₹2,500 Save ₹1,651 (66%)"
378,B08VGHQ982,"ExclusiveLane 'The Warli Tales' Handpainted Terracotta Bedside Table Lamp for Home Decoration (13 Inch, White)Pack of 1",ExclusiveLane,0,0,0,"1,699",4.2,78,24,"Wednesday, February 23",1,78
379,B09FC9FTVR,"Aswal Handicraft White Bedside and 8 Inch Handmade Blue Silk Shade Table Lamp for Bedroom, Living Room, Hall Lighting, Home Decor - with LED Bulb",Aswal,0,0,0,999,5.0,2,33,"Wednesday, February 23",0,2
380,B096QBC2V4,Retro Interio Heavy GI Flanges Table Lamp Paired with E27 Filament Bulb & in-Line Dimmer Switch (Metallic Gold),Retro,1,0,0,"1,439",0,0,52,"Thursday, February 24",0,"₹1,439
₹3,000 Save ₹1,561 (52%)"
381,B09DL4ZKRM,Crosscut Premium Wooden Bed Side Table lamp in Natural Finish (Royal Blue),Crosscut,1,0,0,995,4.2,14,50,"Wednesday, February 23",1,14
382,B09RQW6FVR,"Glaceon Dimmable Modern Led Table Lamp, Spiral Led Table Lamp,12W Modern Minimalist Design,USB Rechargeable,16 Inch Tall,Creative Acrylic Led Modeling Lamp Perfect for Bar, Bedroom Living Room",Glaceon,1,0,0,"2,990",0,0,50,"Wednesday, February 23",1,"₹2,990
₹5,999 Save ₹3,009 (50%)"
383,B0994MRQMJ,"1CLIQKART VIRRMO Work lamp, nickel-plated54 cm (21 "")",1CLIQKART,1,0,0,"4,500",0,0,55,"Wednesday, February 23",1,"₹4,500
₹9,900 Save ₹5,400 (55%)"
384,B09HL2NC21,"MAHGANYA Mosaic Style Dome Shaped Glass Table Lamp Multicolour for Living Room,Bed Room,Desk Mah325",MAHGANYA,0,0,0,329,2.9,2,59,"Saturday, February 26",1,2
385,B09S3PSQ3K,Tirupati Glass Table Lamp (TAD04_Multicolor_6 Inch),Tirupati,0,0,0,799,0,0,20,"Saturday, February 26",0,"₹799
₹999 Save ₹200 (20%)"
386,B096B2YYWT,4 Bulbs LED Vanity Lamp Beauty Makeup Light led Vanity Light Kit Bathroom Mirror Wall Lamp Battery Lampara For Dressing Table,4,1,0,0,499,3.2,180,50,"Thursday, February 24",1,180
387,B09R44LC4D,LED Table Lamp for Bedroom Living Room Modern Linen Bedside Lamp Dimmable Table Lamps Night Light…,LED,1,0,0,"2,300",0,0,71,"Thursday, February 24",0,"₹2,300
₹7,999 Save ₹5,699 (71%)"
388,B08QWC4PX4,LIGHT ANGLE Table Lamps for Bedroom Home Decoration Night Lamp Bedside Lamps for Living Room (Yellow),LIGHT,1,0,0,"1,199",0,0,29,"Wednesday, February 23",1,"₹1,199
₹1,699 Save ₹500 (29%)"
389,B08V21DW58,"Pick Ur Needs Rechargeable Multi-Function Study Reading LED Desk Lamp with Pen Holder Phone Stand, Pack of 1",Pick,1,0,0,699,4.1,578,53,"Wednesday, February 23",1,578
