,asin,title,brand,Sponsored,Best Seller,Amazon's Choice,Price,Rating,NoofRatings,Discount,Delivery,Prime Delivery,base
124,B09BR93ZBC,"HYDRISE (Pack of 10,White) N95/FFP2 Premium Face Mask For Men and Women with Advanced Filtration | Washable mask | Reusable mask | Pollution Mask | Protection Mask | ISO SITRA approved | With Adjuster",HYDRISE,0,0,0,267,4.0,502,73,,1,502
125,B093ZWQRKB,APURK Embroidered face mask for Woman and Ladies Multicolored and Size Wedding mask,APURK,0,0,0,297,4.0,2,70,"Monday, February 14",1,2
126,B09QD11ZX9,"Kids N95 Face Mask (Pack of 25 ), ( ISI ),CE Certified, Ear Loop Style Multicolore",Kids,0,0,0,449,0,0,55,,0,"₹449
₹999 Save ₹550 (55%)"
127,B09FYPJRC6,"HYDRISE (Pack of 15, Black) Premium N95 Mask For Men and Women with Mask Adjuster - Washable mask - Reusable mask - Pollution Mask - Protection Mask - ISI and NIOSH approved - Advanced Filtration",HYDRISE,0,0,0,349,4.0,241,65,,1,241
128,B08NK9MC9R,AeroGrid FFP2 | Pack of 10 | 5 Layers | BIS Certified | Premium N95 Mask for Unisex,AeroGrid,0,0,0,200,4.0,"1,595",87,"Sunday, February 13",0,"1,595"
129,B09HGF1MB4,"PENADIA Cotton Reusable Super Breathable Fabric Face Mask with Adjustable Ear Loop, Anti-Bacterial, Designer Embroidered Cloth Face Mask Combo (Without Valve, Pack of 8) for Women, Girls",PENADIA,0,0,0,388,4.0,335,74,,0,335
130,B08P1W6GY1,"Lee Cooper Lightweight Multi-Layer Printed Design Face Mask For Outdoor Protection, Super Breathable & Reusable Cloth (Pack of 3)",Lee,0,0,0,139,4.1,376,80,,0,376
131,B09MWBS7BP,"VE-MARUSH (PACK OF 10) 5 Layer Kids N-95 Mask For Boys, Kids, Girls Cartoon Printed Mask For 3 To 8-9 Year Old Boys & Girls, Reusable & Washable Face Mask For Kids, Children",VE-MARUSH,0,0,0,199,4.0,3,67,,1,3
132,B09NSSCC25,"HROY Cotton Cloth Face Mask for Women Reusable, Washable, Anti-Bacterial MULTI Layer Embroidered, Fashionable Pack of 6",HROY,0,0,0,329,5.0,1,59,,1,1
133,B09MSGTNFF,"Boldfit N95 Mask For Kids. Children N95 Kids Mask For Boys & Girls. Small Size Stylish N 95 Masks For Kids, Child With Ear Loops For Safety & Protection. Pm 0.3 Filtration Mask Certified By Bureau Of Indian Standards & Iso - Pack Of 6 ( Black, Blue, Yellow ) (N95Kids06)",Boldfit,0,0,0,369,4.2,"1,856",38,"Tuesday, February 15",0,"1,856"
134,B09GKVQZPX,Rarissime AKATSUKI Natuto Printed 2 Ply Face Mask,Rarissime,0,0,0,199,2.8,27,43,,1,27
135,B09Q2472B5,"Bildos Embroidery Designed Face Mask With Adjustable Earloop For Women, Girls (Pack of 6)",Bildos,0,0,0,299,4.7,8,57,,0,8
136,B08T5Q2SBV,LIVYOR Non-Woven Fabric Disposable 3 Layer Surgical Face Mask With Nose Clip and Soft Ear Loops for Unisex,LIVYOR,0,0,0,399,4.2,571,60,,0,571
137,B099Q46VZ9,"BIGXEN Double Layer Premium Cotton Reusable & Washable Digital Cartoon Printed 3D Face Mask (Multicolour, Without Valve, Set of 5) for 3 To 8-9 Year Kids, Boys & Girls",BIGXEN,0,0,0,229,4.2,105,54,,1,105
138,B0989TV4DN,"Shocknshop Non Woven N95 Reusable Washable Face Mask Certified With 5 Layer For Men Over Head Loop Design - Pack of 6, (Black, Grey, White)",Shocknshop,0,0,0,299,4.0,26,70,,0,26
139,B09KN8WFMZ,Weston Non-Woven Fabric 3 Layer Disposable Surgical Face Mask With Nose Clip & Strongly Welded Earloop,Weston,0,0,0,258,3.8,45,68,,0,45
140,B09C8PHHWJ,"OxiClear N99 Handloom Linen Face Mask with 4 Activate Carbon Filters & Detachable Headband, DRDO Certified",OxiClear,1,0,0,299,3.9,297,25,,1,297
141,B08SBWVFY1,"OxiClear Kids N99 Pollution Mask with 4 Activated Carbon Filters, Washable & Reusable, D.R.D.O Certified (Avengers)",OxiClear,1,0,0,299,4.2,"1,733",40,,1,"1,733"
142,B08MXB2NV5,"Yuga HexaShield 3D Reusable Washable Cotton Cloth Breathable Fabric Face Mask for Men and Women | 6 layer Protection | Nose Clip | Adjustable Earloop| Anti-Germ|Anti Bacteria|Multicolor, Pack of 6 |",Yuga,1,0,0,698,4.3,264,61,,1,264
143,B09DGKGKYG,"NEEPRO – Cotton Mask for Men and Women, Reversible, Washable, Anti-Bacterial Mask with Adjustable Ear Loops, Nose Pin and Free Mask Adjuster Strap",NEEPRO,1,0,0,299,4.0,"1,148",50,,0,"1,148"
144,B08R7S4DTV,"Promisca N95 Protective Face Mask, Ear Loop Style Protective 5 Layered Filtration with Melt Blown and Hot Air Cotton Layers (Pack of 5) without valve (Regular, Multicolour)",Promisca,0,0,0,349,4.1,"9,393",50,"Sunday, February 13",0,"9,393"
145,B09HC4NBTX,OCEAN Mask Face Mask for Men and Women surgical mask pack of 100 disposable mask Pack of 100 3ply Mask with soft ear loops,OCEAN,0,0,0,399,3.3,174,60,"Thursday, February 10",0,174
146,B08SBWVFY1,"OxiClear Kids N99 Pollution Mask with 4 Activated Carbon Filters, Washable & Reusable, D.R.D.O Certified (Avengers)",OxiClear,0,0,0,299,4.2,"1,733",40,,1,"1,733"
147,B089FFMMMZ,Giordano Cotton Anti Pollution 6 Layer Reusable Outdoor Face Mask,Giordano,0,0,0,312,3.8,"10,581",48,"Thursday, February 10",0,"10,581"
148,B09PL4FXK6,"Care view 3D disposable face mask with 3 ply 4 layered filtration, SITRA and BIS(ISI) Certified & Incredibly soft with spandex ear loop, N95 mask type shape (Black)",Care,0,0,0,325,4.1,35,35,"Sunday, February 13",0,35
149,B099S23KFV,"KAPIDA Cotton Washable & Reusable 3D Mask with Adjustable Ear Loops and Ear Saver Strap (Multicolour, Without Valve, Pack of 6) for 2 to 7 Year Old Kids, Boys, Girls, Children",KAPIDA,0,0,0,298,3.9,136,57,,1,136
150,B09RB7CYKP,"MEDICOS Medical Face Mask, 3 Ply Disposable Surgical Face Mask, Soft and Breathable Facial Cover with Elastic Earloops, Bike Riding, Travelling Mask for Men and Women",MEDICOS,0,0,0,59,3.5,5,70,,1,5
151,B09Q2YZB87,Kids 3 Ply Panda mask comfortable (Pack of 100) Surgical Mask With Melt Blown Fabric Layer 3 ply for children boys girls FDA CE Approved Carton print disposable mask,Kids,0,0,0,299,5.0,1,57,,0,1
152,B09MFGW876,MAXXPRO COMFY LIFE Pure Black 3D disposable face mask pack of 50 with 4 ply layer black color with wide soft fabric earloop with 2 melt blown layers. largavida for men women kids senior citizens without nose pin,MAXXPRO,0,0,0,400,3.4,22,64,,0,22
153,B0975N918V,"Mush 3 Layered Surgical Disposable Face Mask with Melt-Blown Filter and Softest Ear loop , BFE > 99%",Mush,0,0,0,299,3.8,124,60,,0,124
154,B0963D4CXS,"Vibhu N95 Mask Anti-Virus,Washable and Reusable N95 Masks without Valve, Comfortable Stylish N95 5 Layer Multicolour Combo",Vibhu,0,0,0,399,3.4,156,43,,0,156
155,B08NZZ36RR,ProQ Black Mask | Black Surgical Mask Pack Of 100 | Black Mask For Men & Women | 3ply Mask With Nose,ProQ,0,0,0,349,4.0,"2,842",65,"Saturday, February 12",0,"2,842"
156,B099TNWMV8,"Bleus® Certified Premium KF94 Mask Fish Shape Korean Mask 5 Layer With Melt-Blown Reusable Anti-Pollution, Anti-Virus Breathable Face Mask with Nose Pin BN95WBF Water Resistant, Reusable, Washable, White-Black, Free Size",Bleus®,0,0,0,299,3.5,18,60,,1,18
157,B08GC3SSQR,"Lee Cooper Lightweight Multi-Layer Melange Face Mask Filter With HEIQ VBLOCK For Outdoor Protection, Super Breathable & Reusable Cloth (Pack of 4)",Lee,0,0,0,289,3.7,"8,871",52,"Thursday, February 10",0,"8,871"
158,B09FY2JFH6,KBQ Surgical Mask Disposable Face Mask 3 ply Layer | With Nose Clip Pin | Use And Throw | Pollution And Dust Protection | Men And Women,KBQ,0,0,0,299,3.6,24,67,,1,24
159,B098WQTVPJ,"DEEJET 3 Ply Disposable Face Mask with FABRIC Earloop , Certified by BFE>99% and PFE > 95%, SITRA, DRDO, ISO and CE",DEEJET,0,0,0,331,3.4,"1,269",84,,1,"1,269"
160,B093HBFB5F,"DALUCI Non-Woven Fabric Washable And Reusable 5 Layered N95 Face Mask with Valve for Men And Women (White, Pack of 10)",DALUCI,0,0,0,169,3.7,354,89,,0,354
161,B09KVC4CJC,"Limbjal ® Women's Cotton Reusable Super Breathable Fabric Anti-Bacterial Embroidered Without Valve Cloth Face Mask Combo with Adjustable Ear Loop, Multicolour (PACK OF 6).",Limbjal,0,0,0,297,4.2,148,58,,1,148
162,B09P7GSMZZ,"[Pack of 15] Racklay Premium Black N95 Mask for Men & Women— Washable & Reusable Face Mask — 6 Layer mask DRDO, ISI Certified FFP2 Protection — Pollution Mask — Advanced Filtration — Black Mask",[Pack,0,0,0,379,4.3,16,75,,0,16
163,B08WJFKXVD,"Masq By Q-One Blossom Reusable, Washable, Anti-Bacterial (BFE>99%) 4 Layer Embroidered, Fashionable Cotton Cloth Face Mask for Women with Ear Adjusters and Mask bag (Purple-White-Green)",Masq,0,0,0,299,4.4,"12,278",33,,0,"12,278"
164,B09NRQ4SWY,HYDRISE (Pack of 10) (Grey) Premium N95 Mask For Men and Women with Mask Adjuster - Washable mask - Reusable mask - Pollution Mask - Protection mask - ISO NIOSH approved - Advanced Filtration,HYDRISE,0,0,0,289,3.5,28,71,,1,28
165,B092VZ7KDR,"Naturyz Cotton Printed Reusable & Washable Face Mask with Replaceable N95 SITRA Certified 5 Layer Filters | Nose Pin with Adjustable Earloops (Multicolour, Without Valve, Pack of 3) for Women",Naturyz,0,0,0,399,4.1,114,50,,0,114
166,B09DCP4Y71,HYDRISE (Pack of 20) Premium N95 Mask For Men and Women with Mask Adjuster - Washable mask - Reusable mask - Pollution Mask - Protection Mask - DRDO and NIOSH approved - Advanced Filtration (White),HYDRISE,0,0,0,389,3.8,21,76,,1,21
167,B09H5H7DTM,"KENADIYA Cotton Reusable Super Breathable Fabric Anti-Bacterial Embroidered Cloth Face Mask Combo with Adjustable Ear Loop (Multicolour, Without Valve, Pack of 8) for Women, Girls",KENADIYA,0,0,0,388,4.1,351,74,,0,351
168,B09FF8SZCH,Naturyz N95 NIOSH & ISO Certified Kids Face Mask with 6 Layer Protection | Adjustable Ear Loops & Nose Clip for Boys & Girls | Multicolour,Naturyz,0,1,0,359,4.1,335,64,,0,335
169,B09FGB3TTF,"AMIRATE Printed Mask For Women 3 Layer Pure Cotton Face Mask Reusable Washable Digital Flower Printed Masks for Women, Adjustable Ear Loops Mask For Adult (Pack of 6, Multicolor, Without Valve)",AMIRATE,0,0,0,288,3.6,20,59,,1,20
170,B09G9RFH6J,WELLSTAR 3 Ply Disposable Mask 3Layer Filtration Nonwoven Fabric Face Mask,WELLSTAR,0,0,0,229,3.0,5,77,,1,5
171,B099RZFF45,"Vandelay 3 Ply Surgical Mask with Ultra Soft Ear Loops - UV Sterilized - 3 Layer Face Masks (50 Units, Unisex, Blue)",Vandelay,0,0,0,449,4.4,759,44,,0,759
172,B09J3Y94LB,DIYA ENTERPRISE Face Mask Special event Jrdoshi Comfortable Embroidered Mask 2 Ply Reusable Washable Designer Face Mask For Women (Multicolour Pack of 4),DIYA,0,0,0,359,3.7,19,20,,1,19
173,B093H7SW4J,"Lee Cooper Cotton Reusable Face Mask (Multicolour, Pack of 4) for Unisex",Lee,0,0,0,429,3.9,"1,296",28,"Thursday, February 10",0,"1,296"
174,B09GY32VXP,7SHIELD Kids Size Red dot printed Face Mask with Nose clip and soft fabric ear loop Mask 3 ply disposable filter protection breathable dust proof Water Resistant Surgical Mask,7SHIELD,0,0,0,299,3.9,320,70,,1,320
175,B09M8ZP7PL,Wisezag Black Surgical Mask Pack of 100 Pieces Disposable Masks 3 ply layer with nose clip Meltblown Ultrasonic Use and Throw Masks Pack of 100 Pcs Pin 3Ply Comfortable Fabric Face Mask Earloop.,Wisezag,0,0,0,247,3.9,23,78,,0,23
176,B09DNQFRS1,"Boldfit 3 Ply Layer Disposable Surgical Face Mask with Nose Pin, Breathable, Effective Filtration, Soft on Skin, Facial Cover with Elastic Earloops, Blue, One Size, 50 Count",Boldfit,1,0,0,294,4.5,427,41,"Thursday, February 10",0,427
177,B08X76S23L,"OxiClear Handloom Linen Anti-Pollution Face Mask, 3-Layer Super Breathable, Washable & Reusable (Pack of 5)",OxiClear,1,0,0,399,4.2,"3,238",20,"Thursday, February 10",0,"3,238"
178,B09GYGDB3D,"QUARANT 3 Ply Surgical Disposable Mask, BFE >98% & PFE >95%, ISI, BIS, CE & ISO Certified, Melt Blown - SMMS Layer Fabric with Adjustable Nose Pin (Green, Without Valve, Pack of 100) for Men & Women",QUARANT,1,0,0,399,4.2,140,67,,0,140
179,B09K5CZ94K,"Frido ULTIMATE and ULTIMATE PRO Copper Masks with Adjustable Ear Loops. Copper Treated Layer, Breathable and Washable Fabric, Made in South Korea.",Frido,1,0,0,"2,499",4.5,393,41,,1,393
180,B08P7MDQR9,OxiClear N99 Anti Pollution Face Mask with 4 Activated Carbon Filters & Detachable Headband D.R.D.O Certified (NO-VALVE) (Army Green),OxiClear,1,0,0,399,4.2,"4,171",20,"Thursday, February 10",0,"4,171"
181,B08R5X5YRF,OxiClear Kids N99 Anti Pollution Face Mask with 4 Activated Carbon Filters & Detachable Headband D.R.D.O Certified (Mini Mouse),OxiClear,1,0,0,299,4.2,"1,733",40,"Thursday, February 10",0,"1,733"
182,B09D8HRLGB,"PENADIA Cotton Cloth Face Mask - Reusable, Washable, Anti-Bacterial 4 Layer Embroidered, Fashionable (Multicolour, Without Valve, Pack of 6) for Women",PENADIA,1,0,0,299,4.1,644,70,,0,644
183,B09HGF1MB4,"PENADIA Cotton Reusable Super Breathable Fabric Face Mask with Adjustable Ear Loop, Anti-Bacterial, Designer Embroidered Cloth Face Mask Combo (Without Valve, Pack of 8) for Women, Girls",PENADIA,1,0,0,388,4.0,335,74,,0,335
184,B099RZFF45,"Vandelay 3 Ply Surgical Mask with Ultra Soft Ear Loops - UV Sterilized - 3 Layer Face Masks (50 Units, Unisex, Blue)",Vandelay,0,0,0,449,4.4,759,44,,0,759
185,B08GHMPFJL,"ApePal Non-woven Cute kids Safety face mask, Children's 3 Ply Protective Earloop Disposable Sanitary Face Masks with Cat Print, 50 Pieces, Pink",ApePal,0,0,0,299,3.4,255,40,"Tuesday, February 15",0,255
186,B09FQ3TMX9,"THE MASK LAB 3 Ply Surgical Face Mask- International ASTM Level 3 Certified for virus. ISI CML-9600046017, EN 14683: 2019(Level IIR), ISO 13285:2016 (Pack of 100, Grey (WITH COMFORT BAND))",THE,0,0,0,469,4.5,12,85,,1,12
187,B0965WJ7H9,CoviSafe™ N95 Head Loop type 6 Layers PREMIUM Reusable Face Mask for Men -Ultra Comfortable Crtified (MIX COLOUR),CoviSafe™,0,0,0,351,4.4,51,83,,0,51
188,B09DGTR4SY,"Shivonic Surgical Mask 3 Layer Disposable Protective Surgical Face Mask, BFE >98% & PFE >95%, ISI, BIS, CE & ISO Certified",Shivonic,0,0,0,349,3.9,163,83,,1,163
189,B09KY8KMQ6,"CONTARE® Ultra Comfortable Washable and Reusable Face Mask, UV Protection and Antibacterial, Stretchable Material, Allergy Free and Splash Resistant Protective Face Cover (Pack Of 5)",CONTARE®,0,0,0,229,3.3,129,77,,1,129
190,B08FTGRH1D,"Medohealthy Careview 3 Ply Disposable Face Masks (Pack of 100,Green) with nose pin BIS, (ISI) Certified mask with Melt blown layer",Medohealthy,0,0,0,479,4.1,"5,006",68,"Monday, February 14",0,"5,006"
191,B09715M5WD,Romsons 3D face mask box of 25,Romsons,0,0,0,167,4.3,357,55,"Tuesday, February 15",0,357
192,B08VHHQ64Y,"Weldots【Pack of 5】Fender Premium N95 Mask for Men & Women — Reusable Face Mask — KF94 Mask — 6 Layers DRDO, ISI (BIS) Certified FFP2 Protection — Head Loop — White",Weldots【Pack,0,0,0,559,3.8,515,55,,1,515
193,B089NM4XHY,"ShopAIS Non Woven Elastic Ear-Loop Disposable 3 Ply Face Mask With Nose pin, 100 Pieces",ShopAIS,0,0,0,210,3.7,265,79,"Monday, February 14",0,265
194,B09D3PQ837,"HAKKU Head Loop 3D Cotton Reusable, Washable and Breathable Fabric Face Mask with Melt Blown Layer, Adjustable Ear Loop and Ear Saver Strap For Men and Women (Multicolor) - 5 Pieces",HAKKU,0,0,0,299,4.0,265,77,,1,265
195,B09CDP8NP2,ProQ Black Surgical Mask | Surgical Mask Pack of 100 | Face Mask For Men & Women | Disposable Mask | 3 ply With Nose Pi,ProQ,0,0,0,349,4.1,433,78,,0,433
196,B097Q123M2,BIGXEN Small Boy's and Girl's 3 Layer Premium Cotton Digital Cartoon Printed Reusable & Washable 3D Face Mask Without Valve (Multicolour) - Pack of 10,BIGXEN,0,0,0,299,4.3,435,57,,1,435
197,B093H66DZF,"Lee Cooper Unisex Lightweight Cotton Face Reuseable Mask Without Valve, Multi color, Pack of 3",Lee,0,0,0,349,3.6,696,30,"Thursday, February 10",0,696
198,B09FY939TQ,"Weston9x Unisex Non-Woven Fabric 3 Ply Disposable Surgical Mask with Nose Pin Blue, Ultrasonic Soft Loops without Valve (Blue, Pack of 100)",Weston9x,0,0,0,159,4.5,226,47,,0,226
199,B0977JPQWM,"GreatDio® 3 Layer (1000 Pcs) Disposable Protective Face Masks, Bacterial Filtration Efficiency (BFE)?98.5%,Particle Filtration Efficiency (PEE)?94% | Inbuilt Adjustable Nose Pin (Multicolor)",GreatDio®,0,0,0,"2,199",1.0,1,50,"Sunday, February 13",1,1
200,B0989LCMLR,VStar Cloth Face Mask for Men's and Women's Assorted,VStar,1,0,0,378,3.9,41,10,,0,41
201,B09C8LHDZN,"OxiClear N99 Handloom Linen Face Mask with 4 Activate Carbon Filters & Detachable Headband, DRDO Certified",OxiClear,1,0,0,299,3.9,297,25,,1,297
202,B09J3VCYKD,"NEEPRO Cotton Face Mask for Men and Women, Reversible, Washable, Anti-Bacterial Mask with Adjustable Ear Loops, Nose Pin and Free Mask Adjuster Strap",NEEPRO,1,0,0,579,4.2,88,36,,1,88
203,B088N9H24G,"EUME Protect+ 95 4 Layer Reusable Washable Face Mask for Men and Women with Anti Dust, Anti-Pollution Shield, Adjustable Nose clip and Comfortable Strap with Super Soft, Breathable Cotton Fabric & Personal Name Tag for Home and Office- Made in INDIA",EUME,1,0,0,303,3.8,"3,427",24,"Monday, February 14",0,"3,427"
204,B08V6Y8S65,"Venus (V-1010) Non-Woven Fabric Disposable 3 Layer Face Mask, ISI Certified with Bacterial Filtration Effciency >98% (Blue, Pack of 50, Without Valve) for Unisex",Venus,0,0,0,240,4.4,188,64,,1,188
205,B09GPLQCH3,Naturyz Extra Comfort Reusable 95+ Inventaa Face Mask for Men & Women with 5 Extra Replaceable Filters,Naturyz,0,0,0,139,5.0,17,83,,0,17
206,B08BRK2X6P,"Vandelay 3 Ply Non-Woven Fabric Disposable Surgical Mask - BFE & PFE 99.5% - UV Sterilized - 3 Layer Face Masks (Blue, Without Valve, Pack of 50) for Unisex",Vandelay,0,0,0,439,4.1,"6,733",45,"Thursday, February 10",0,"6,733"
207,B093H7SW4J,"Lee Cooper Cotton Reusable Face Mask (Multicolour, Pack of 4) for Unisex",Lee,0,0,0,429,3.9,"1,296",28,"Thursday, February 10",0,"1,296"
208,B098BJBFFH,Kingfa 3ply Surgical Face mask with Melt-blown Type IIR / Color blue / CE and ISO certified (50/100 /250/500 Qty Available),Kingfa,0,0,0,263,4.4,176,74,,1,176
209,B09FTFPYM8,Themisto Anti Pollution Protective Dispossable Mask BFE >99% & PFE >99% Melt Blown Fabric Disposable Masks with Adjustable Nose Pin,Themisto,0,0,0,149,4.2,143,75,"Thursday, February 10",0,143
210,B09M8PLF5S,Risezag Printed Masks for Women Surgical 3 Layer Masks with Nose Clip Surgical Masks For Women Black Disposable Pack of 100 Pieces 3 Ply Face Masks with Nose Clip 3 Layers Disposable Use and Throw,Risezag,0,0,0,249,5.0,3,81,,1,3
211,B09P7G22T5,"[Pack of 20] Racklay Premium Black N95 Mask for Men & Women— Washable & Reusable Face Mask — 6 Layer mask DRDO, ISI Certified FFP2 Protection — Pollution Mask — Advanced Filtration — Black Mask",[Pack,0,0,0,474,3.5,23,76,,0,23
212,B099PM5X5P,Maple MP-21 Face Mask for Kids | Reusable and Washable | 3 Layer Filtration | Anti Pollution | Cotton Printed Protective | Fashionable kid Mask for Girl Boys Unisex,Maple,0,0,0,299,4.3,116,62,,0,116
213,B096N1VNYR,"Avdip 6 Pcs Fashion Flowers Cloth Face Mask 100% Cotton Mask For Women, Flower Design Sfety Face Mask For Ladies Pack of 6",Avdip,0,0,0,169,3.5,2,58,,1,2
214,B096FX4G4X,"Romsons Nonwoven Fabric Disposable Mask 6 Layer Protection Face Mask with Elastic Ear loop (White, Pack of 50, Without Valve) for Unisex.",Romsons,0,0,0,384,4.3,810,63,,1,810
215,B09P7GMF3C,"[Pack of 5] Racklay Premium N95 Mask for Men & Women— Washable & Reusable Face Mask — 6 Layer mask DRDO, ISI Certified FFP2 Protection — Pollution Mask — Advanced Filtration — Grey Mask",[Pack,0,0,0,189,4.0,48,53,,0,48
216,B096SW68BL,"CENWELL 5 Pcs Pure Cotton Face Mask with Nose Pin, Melt Blown Layer, Adjustable Ear Loop & Ear Saver Strap , Reusable Washable Fabric Mask For Men & Women (Multicolor)",CENWELL,0,0,0,399,4.1,"1,764",60,,0,"1,764"
217,B08CSSNSWL,"WeCool Melt-Blown Disposable Face Mask with adjustable Nose Clip 3ply protection (Blue, Without Valve)",WeCool,0,0,0,299,3.9,"5,042",80,"Wednesday, February 16",0,"5,042"
218,B08LNGHZW1,"MASQ By Q-One Army 4 Layer, Reusable, with Ear Adjusters, Anti-Bacterial (BFE>99%) Cotton Cloth Face Mask Combo for Unisex, Men, Women with Size Adjustable Army Mask Strap (Olive Green)",MASQ,0,0,0,279,4.3,"4,881",6,,0,"4,881"
219,B09MCBCL4N,HYDRISE (Pack of 12) (Black) Premium N95 Mask For Men and Women with Mask Adjuster - Washable mask - Reusable mask - Pollution Mask - Protection mask - ISO NIOSH approved - Advanced Filtration,HYDRISE,0,0,0,299,3.6,28,70,,1,28
220,B08CSMZMGT,OCEAN RACE Cotton Lycra Stretchable 3 Layer Reusable Face Mask,OCEAN,0,0,0,299,3.9,"1,985",50,,0,"1,985"
221,B09HGZXYQB,"CareDone 3D Ultimate Comfort Scuba Cotton Face mask Washable & Reusable Super Breathable Stylish & Antibacterial Stretchable Material, Allergy Free Protective Mask",CareDone,0,0,0,222,3.0,83,84,,1,83
222,B09HBPS367,"CLOCOMFERR Cloth Cotton Reusable Mask with Adjustable Ear Loop (Black, Pack of 3, Without Valve) for Men & Women",CLOCOMFERR,0,0,0,199,4.2,88,80,,1,88
223,B08XXZKC83,"Shaila's Couture Cotton Reusable Face Masks with Head Loop, Adjustable (Black, Navy Blue, Charcoal Grey, Pack of 3, Without Valve) for Unisex",Shaila's,0,0,0,298,3.4,151,50,"Sunday, February 13",0,151
224,B08RJVKJM1,ProQ Surgical Mask Pack of 100 | Disposable Mask | Use and Throw Mask | 3 ply Mask | Face Mask Men & Women,ProQ,0,0,0,349,3.8,"1,643",78,,0,"1,643"
225,B09CVD7GQ2,Be Positive Anti-Pollution 3 Ply Standard Quality Non-Woven Fabric Soft Ear-Loop Face Mask - KFSQ3PLSOFTLOOPMASK (50),Be,0,0,0,249,4.2,44,88,"Sunday, February 13",1,44
226,B09NDYHH3H,Maykaj 3 Ply Black Disposable Mask With Noes Clip And Smooth Straps 3Ply Surgical Disposable Nonwoven Fabric Face Mask With Nose Pin Non Woven Surgical 3 Ply Face Mask Pack of 100,Maykaj,0,0,0,239,4.6,7,76,,1,7
227,B092348DVF,Shree Shree Fashion WEDDING SPECIAL Cloth Face Mask - Washable Light Weight Satin - Cotton Masks (GOLD-RED-BLACK),Shree,0,0,0,297,4.1,199,40,"Monday, February 14",1,199
228,B08GS9XFD5,ARCATRON® 3 Ply Disposable Nonwoven Fabric with Melt Blown Protective Layer Super Breathable Surgical Face Masks,ARCATRON®,0,0,0,249,4.0,"4,220",0,,0,"4,220"
229,B08DLP2M2K,"CareDone N95 Mask (unisex, pack of 20,) soft and comfortable Meltblown and Hot Air Cotton fabric Reusable Particulate Mask Anti Pollution,certified by ISO,FDA, CE, GMP, Daily Needs N95 Face Mask Ear Loop N95 Color black.",CareDone,0,0,0,199,4.5,14,80,"Sunday, February 13",1,14
230,B09M8ZP7PL,Wisezag Black Surgical Mask Pack of 100 Pieces Disposable Masks 3 ply layer with nose clip Meltblown Ultrasonic Use and Throw Masks Pack of 100 Pcs Pin 3Ply Comfortable Fabric Face Mask Earloop.,Wisezag,0,0,0,247,3.9,23,78,,0,23
231,B09C2CR2ZF,"Craze Colleen N95 Face Mask for Men & Women, FFP2 Mask | Washable and Reusable Face Mask - 5 Layer Filteration with Double Meltblown and Hot Air Cotton Layer - N95 Mask",Craze,0,0,0,343,4.5,22,91,,1,22
232,B09FGB3TTF,"AMIRATE Printed Mask For Women 3 Layer Pure Cotton Face Mask Reusable Washable Digital Flower Printed Masks for Women, Adjustable Ear Loops Mask For Adult (Pack of 6, Multicolor, Without Valve)",AMIRATE,0,0,0,288,3.6,20,59,,1,20
233,B096YFHHWC,"voltonix® N95 Reusable Washable Mask Anti Air Pollution,Face Mask, Reusable, Washable Ce & Iso Certified To Protect Mouth Droplets, Dust And Pollution, Mask. Unisex, With 6 Layer For Men Women",voltonix®,0,0,0,199,4.1,"1,351",67,,1,"1,351"
234,B09GQH9QG6,"100% CE FDA Certified face mask with Non Woven Ultrasoft Stretchable Elastic, 3D Disposable UNISEX face mask with 3 Layer protection for Boys Girls Children(Combo of 30 mask)",100%,0,0,0,319,4.5,11,68,,0,11
235,B09K7Q39TD,"CARE VIEW SITRA Approved, 3 Ply Disposable Surgical Mask ,With Built in Metal Nose Pin and 1 Melt Blown Layer",CARE,0,0,0,299,4.2,330,0,,0,330
236,B08MX7WN13,"Yuga HexaShield 3D Reusable Washable Cotton Cloth Breathable Fabric Face Mask for Men and Women | 6 layer Protection | Nose Clip | Adjustable Earloop| Anti-Germ|Anti Bacteria|Multicolor, Pack of 6 |",Yuga,1,0,0,799,4.3,264,56,,1,264
237,B08NK9MC9R,AeroGrid FFP2 | Pack of 10 | 5 Layers | BIS Certified | Premium N95 Mask for Unisex,AeroGrid,1,0,0,200,4.0,"1,595",87,"Sunday, February 13",0,"1,595"
238,B09P17S6LX,"PENADIA Cotton Reusable Super Breathable Fabric Anti-Bacterial 3D Designer Embroidered Cloth Face Mask 4 Layer Combo with Adjustable Ear Loop For Woman ,Girls ,PACK OF 6",PENADIA,1,0,0,399,4.5,42,60,,0,42
239,B09CMGP1TM,"Yuga HexaShield 3D Reusable Washable Cotton Cloth Breathable Fabric Face Mask for Men and Women |6 layer Protection|Nose Clip|Adjustable Earloop|Anti-Germ, Anti Bacteria|Premium|Freesize|Multicolor, Pack of 4",Yuga,1,0,0,488,4.0,"1,143",59,,0,"1,143"
240,B097HPRNNC,Bildos Cotton & Khadi Unisex Without valve Reusable Super Breathable Fabric Cloth Face mask with Adjustable Ear Loop (Multicolour) - Pack of 12,Bildos,1,0,0,330,4.2,"10,485",67,"Saturday, February 12",0,"10,485"
241,B08R57KXSX,"OxiClear Kids N99 Pollution Mask with 4 Activated Carbon Filters, Washable & Reusable, D.R.D.O Certified (Paw Patrol)",OxiClear,1,0,0,299,4.2,"1,733",40,"Thursday, February 10",0,"1,733"
242,B09GL69MXN,"QUARANT 4 Ply Designer Protective Surgical Face Mask with Dual Meltblown - SMMS Layer, BFE & PFE >99%, Disposable Fabric Masks with Adjustable Nose Pin, Fashion That's Safe (Ombre Combo, Without Valve, Pack of 50) for Unisex",QUARANT,1,0,0,499,4.4,"3,192",50,"Thursday, February 10",1,"3,192"
243,B088M9M84X,"EUME Protect+ 95 4 Layer Reusable Washable Face Mask for Men and Women with Anti Dust, Anti-Pollution Shield, Adjustable Nose clip and Comfortable Strap with Super Soft, Breathable Cotton Fabric & Personal Name Tag for Home and Office- Made in INDIA",EUME,1,0,0,279,3.8,"3,427",30,"Monday, February 14",0,"3,427"
244,B09FGB3TTF,"AMIRATE Printed Mask For Women 3 Layer Pure Cotton Face Mask Reusable Washable Digital Flower Printed Masks for Women, Adjustable Ear Loops Mask For Adult (Pack of 6, Multicolor, Without Valve)",AMIRATE,0,0,0,288,3.6,20,59,,1,20
245,B09D3N13H5,"Medinain 3 Ply and Disposable With Soft Elastic Ear Loops With Built-In Adjustable Nose Pin, 95% Particle Filtration CE, and ISO and WHO-GMP Certified and Surgical Face Mask",Medinain,0,0,0,310,4.2,15,47,,0,15
246,B09GQH9QG6,"100% CE FDA Certified face mask with Non Woven Ultrasoft Stretchable Elastic, 3D Disposable UNISEX face mask with 3 Layer protection for Boys Girls Children(Combo of 30 mask)",100%,0,0,0,319,4.5,11,68,,0,11
