,asin,title,brand,Sponsored,Best Seller,Amazon's Choice,Price,Rating,NoofRatings,Discount,Delivery,Prime Delivery,base
139,B08KT8K4JK,Dreamline Sienna Rolling Pack Pillow (41x61),Dreamline,0,0,0,199,3.9,9,60,,0,9
140,B097H8RR2B,"The White Willow Cooling Gel Memory Foam Orthopedic Bed Pillow for Sleeping & Neck Pain Relief for Back Sleeper, Side Sleeper & Stomach Sleeper with Pillow Cover - Pack of 2 (22""L x 15""W x 4""H) Multi",The,1,0,0,"1,959",4.0,667,64,"Sunday, February 13",1,667
141,B08BK1C4Q9,"Urban Basics Ultra Soft Microfibre Pillow, 17""x27"" Inch, White, Set of 4(PIL01_4), polyester",Urban,1,0,0,"1,399",4.1,"2,315",30,"Wednesday, February 16",1,"2,315"
142,B09KVH9235,"Homerz Set of 2 Bamboo Fabric Fiber Pillow, Size 17x27 Inches , 3D Conjugated Fiber Filled, Vacuum Pack",Homerz,1,0,0,849,3.8,5,29,"Thursday, February 17",1,5
143,B08R7MX63N,"SleepyCat 2-Piece Microfiber Cloud Pillow with Adjustable Zipper (27x18 inches, White)",SleepyCat,1,0,0,"1,784",4.3,634,25,"Monday, February 14",1,634
144,B09M8TZZVR,"MY ARMOR Micro Fibre Bolster Bed Pillow, 10 x 25 inch, White , 2 Pieces",MY,0,0,0,799,4.9,46,38,"Friday, February 18",1,46
145,B09JKFB92K,"Lefre Best Sleep Microfiber Cotton 5 Star Hotel Pillow Extra Large King Size 16""*24 (40cm*60cm), White , Set of 4.",,0,0,0,0,0,0,0,,0,
146,B09PBJ6SGS,Zoliva Memory Foam Pillows for Neck Pain and Shoulder Pain Orthopedic Cervical Best Contour Shape Ergonomic Neck Memory Foam Bed Pillow Pack of (1),Zoliva,0,0,0,"1,099",4.9,48,45,"Wednesday, February 16",0,48
147,B08ZSW5TSV,"ANITA CORPORATION Polyester Car Neck Pillow for Headrest Pain Relief, Ergonomic Cervical, Neck Support (Black, 22 x 16 cm) -2 Pieces",ANITA,0,0,0,399,4.0,51,75,"Wednesday, February 16",1,51
148,B0993MZ5WZ,"D S Pillow Microfiber 16 X 24 inch White Sleepping Pillows, Pack of 1 (6)",D,0,0,0,0,3.5,27,0,,0,27
149,B0847M6FK4,"The White Willow Memory Foam Orthopedic Bed Pillow for Sleeping & Neck Pain Relief Suitable for Back Sleeper, Side Sleeper & Stomach Sleeper with Pillow Cover 22"" L x 15"" W x 4"" H ,Multi",The,0,0,0,"1,044",4.0,"2,195",63,"Sunday, February 13",1,"2,195"
150,B099PQ87JB,neetutraders Cotton Blue Star Printed Sleeping Pillow Pack of 4,neetutraders,0,0,0,699,5.0,1,53,"Wednesday, February 16",1,1
151,B092QWG4LM,"Coif Comfort Foam Neck Roll and Cervical Bolster Round Pillow with Removable Washable Soft Cover for Spine and Neck, Back, Lumbar, Leg, Vertebra, Shoulder Relaxer, Pain Relief & Support (18.5"" X 6.5"")",Coif,0,0,0,645,4.0,46,40,"Wednesday, February 16",1,46
152,B0819K6B8L,"MOJOREST Memory Foam Pillow for Neck Pain and Shoulder Pain, Orthopedic Cervical Contour Memory Foam Bed Pillow, with Removable Cover (24x14x4, Grey, White)",MOJOREST,0,0,0,999,4.0,"2,965",60,"Wednesday, February 16",0,"2,965"
153,B096FVLQL3,"MECNIOX Machine Washable Microfiber Luxury Soft Pillow for Sleeping (White Fiber 16 x 24 Inch , 4)",MECNIOX,0,0,0,749,5.0,2,58,"Wednesday, February 16",0,2
154,B09MZJCM1T,"AK -Creation Ultra Soft Microfibre Bed Pillow Set (Standard, 40 x 60 cm, White) -Pack of 2",AK,0,0,0,279,2.2,4,44,"Wednesday, February 16",1,4
155,B00IJRV1GI,"Recron Certified Dr. Ortho Fibre Pillow - 41 cm x 61 cm, White",Recron,0,0,0,610,3.7,"1,317",39,"Sunday, February 20",0,"1,317"
156,B08WRBP832,takiyawala® Hand Embroidery Cotton Fabric with Micro Fiber Filling Bolsters Pillow Compliment for DEEWAN & Sofa (L-24 x D-9 inches) = 13 x 30 Inches (2),takiyawala®,0,0,0,599,4.0,65,58,"Wednesday, February 16",1,65
157,B08FZCCH95,"ATOOTFUSION 100% Recyclable Black Hosiery Gingham Plaid Medium Hard Cotton Bed Pillow for Real Perfect Neck Support (16"" x 26"") Buffalo Check Multicolored Set of 01",ATOOTFUSION,0,0,0,225,4.2,42,77,"Wednesday, February 16",0,42
158,B08QJL5SFH,"The White Willow Memory Foam Infant Baby Pillow for Preventing Head for Flat Head Syndrome Ideal for 0-12 Age -( 9.8"" L X 7.5"" W X 1"" H) Blue",The,0,0,0,649,3.8,175,54,"Wednesday, February 16",1,175
159,B09NVW78J6,Trova Fashion Store Cotton Filled with Microfibre & Polyster Ultra Soft Floral Printed Bed Pillow Sets ( Pack of 6 ),Trova,0,0,0,0,3.7,5,0,,0,5
160,B09FSZHGW3,HFI Urban Arts Striped Fabric Luxury Premium Pillows - Pack of 2 Pcs| 16 x 24 Inches| White | Conjugated Virgin Fiber Filling | Hotel Quality Linen,HFI,0,0,0,625,4.5,58,50,"Wednesday, February 16",1,58
161,B08NW1RPNC,"Shopway Collection Luxury Chenille Bolsters Round Pillow Cover (30""x16"", Coffee)- Set of 2",Shopway,0,0,0,299,3.8,41,57,"Wednesday, February 16",0,41
162,B0992F7KRD,"Sleepsia Memory Foam Pillow for Neck Pain, Stomach Sleepers, Side Sleepers and Sleeping, 21"" x 13.7"" x 3.7"" , Bluish White with Washable Cover and Cooling Gel- Regular (Pack of 1)",Sleepsia,0,0,0,"1,350",4.3,223,73,"Wednesday, February 16",1,223
163,B088P34399,"Kuber Industries Cotton Ultra Soft Hollow Fibre C Shaped Maternity Pillow, Pregnancy Pillow, Body Pillow with Zippered Cover (Grey) - CTKTC045960, Standard",Kuber,0,0,0,"1,499",3.4,590,0,"Sunday, February 13",1,590
164,B08BWL3M1J,"Kanha Polyester Fiber Bolster And Cushion, 10 x 25 inch, 16 x 16 inch, White",Kanha,0,0,0,724,3.2,"1,152",60,"Wednesday, February 16",1,"1,152"
165,B09BTSMKS2,Solid Polyester Fiber Pillow AA1 Best for Heavenly Sleep White Pack of 1,Solid,0,0,0,229,3.1,28,62,"Wednesday, February 16",1,28
166,B09CMC8X96,"Homerz Aloe Vera Cloud Pillow Filled with 3D conjugated Microfiber, White, 17 x 27 inch Set of 2",Homerz,0,0,0,849,4.6,11,56,"Thursday, February 17",1,11
167,B09KH7PJ6W,"JY Queen Pillows for Sleeping Bed Pillows Hotel Quality , Soft Down Alternative Pillows , Hypoallergenic Pillow for Side and Back Sleeper Set of 2 , Size - 16 X 26 , ( White )",JY,0,0,0,349,3.2,13,42,,0,13
168,B097KHPMF9,"ROYALREOX Alternative Fiber Pillow - Hotel Quality White Microfiber pilow 4 Piece - 16x24 Inch (White, Single Pillow )",ROYALREOX,0,0,0,549,2.2,4,63,"Wednesday, February 16",0,4
169,B094G3RYRF,"Great Samrat Microfiber Pillow Pack of 4 (White, Standard Size)",Great,0,0,0,0,3.5,33,0,,0,33
170,B0841M8HWM,"Mom's Moon Premium Microfiber Ultra Soft U Shaped Pregnancy Pillow/Maternity Pillow/ Body Pillow/Lumber Pillow with Cotton Cover and Zippered Cover, Standard Wine",Mom's,0,0,0,"1,399",4.1,282,61,"Wednesday, February 16",1,282
171,B07XC36HH4,"PumPum 1 Piece Textrise Black Microfiber Pillow , 16 x24 inch (White) (85632)",PumPum,0,0,0,149,3.4,714,70,"Wednesday, February 16",0,714
172,B08VRTSQZ8,"ATETO Arm Support Portable Arched Couple Pillow, Pressure Free Memory Foam Pillow Slow | Romantic Couple Sleeping Pillow, Cervical Neck Pillow for Sleeping, U Shaped Ice Silk Fabric Arched Pillow",ATETO,0,0,0,585,3.6,11,10,"Wednesday, February 16",1,11
173,B08F4624KJ,"HOMY DECOR Bombay Dyeing Cotton Cloth, Bolster Round Pillow Filled with Reliance Microfiber, White, 12 X 30 Inch, Set of 2",HOMY,0,0,0,799,3.9,203,58,"Sunday, February 20",1,203
174,B097YXYP97,"Perfect Sleeper Microfiber Breathable Full Body Insert, Soft Large Long Bed Pillow (18 x 54 inch, White, King size)",Perfect,0,0,0,579,5.0,1,66,"Wednesday, February 16",0,1
175,B08L8BWQ43,PumPum Hollow Soft Fiber C Shaped Body Pillow with Cover for Pregnant Women ( Grey ),PumPum,0,0,0,"1,199",3.5,40,0,"Wednesday, February 16",1,40
176,B08Z4946W2,"INDIYANO Standard Size Microfiber Pillows for Bed, 100% Breathable Cotton Sleeping Pillows, Set of 1 Great for Side and Back Support Pillow",INDIYANO,1,0,0,380,4.1,42,37,"Wednesday, February 16",0,42
177,B0736YM33H,"AmazonBasics Polyester Ultra Soft Down Alternative Bed Pillows (20X36 inches, Extra Large) - 2 Pack",AmazonBasics,1,0,0,"1,823",4.0,"10,828",48,,1,"10,828"
178,B08CCVW8B7,"HOMY DECOR Microfiber Pillow (27 x 17 Inch, Grey)",HOMY,1,0,0,425,4.1,412,57,"Sunday, February 20",1,412
179,B096YDPSFG,"Homerz Premium Set of 2 Hotel Quality Super King Size Pillow, 20 x 30 Inch Exact Size, Superior White Cotton Polyester Fabric (2)",Homerz,1,0,0,899,3.8,139,50,"Thursday, February 17",1,139
180,B09GS5KJ1N,"Cloth Fusion Microfiber Bed Pillow Set of 2 Pieces (17x27 Inches, Teal and Grey)",Cloth,1,0,0,629,4.0,11,37,"Wednesday, February 16",1,11
181,B08V5B923X,"SleepyCat 1-Piece Microfiber Cloud Pillow with Adjustable Zipper (32x20 inches, White)",SleepyCat,1,0,0,"1,225",4.3,634,18,"Monday, February 14",1,634
182,B08RC467DY,"MY ARMOR Micro Fibre Pillows , 26"" x 17"" , White , 2 Pieces",MY,1,0,0,750,4.3,289,42,"Friday, February 18",1,289
183,B09PJG3SSJ,"Homerz Body Pillow with Waterproof Pillow Protector Cover, 54 x 20 inch Size (Golden)",Homerz,1,0,0,999,0,0,50,"Thursday, February 17",1,"₹999
₹1,999 Save ₹1,000 (50%)"
184,B0813B53YD,EMBROCO Home Decor Sleeping Bed Pillow Set of 4-45x61,EMBROCO,0,0,0,999,5.0,2,0,"Wednesday, February 16",1,2
185,B07Q3XBPKF,"The White Willow Infant Baby Pillow for Preventing Head for Flat Head Syndrome Ideal for 0-12 Age with Removable Organic Bamboo Cover -( 9.8"" L X 7.5"" W X 1"" H) White",The,0,0,0,707,3.9,"2,043",46,"Wednesday, February 16",1,"2,043"
186,B094QYCMC1,"JY Hotel Collection Bed Pillows for Sleeping - Queen Size, Set of 2 - Soft Allergy Friendly, Cooling, Luxury Gel Pillow for Back, Stomach or Side Sleepers in Cotton Multi Check Size 16*27 inch",JY,0,0,0,369,3.6,119,38,"Saturday, February 19",0,119
187,B08PYQ22WP,"The Sleep Company SmartGRID Premium Hybrid Pillow, The Ultimate Pillow Ever Designed by Science, No Pressure Support, Cotton, White (24x16 Inches) (66x40 cm) - Pack of 1",The,0,0,0,"2,499",4.0,248,0,"Tuesday, February 15",1,248
188,B07RXZ55X8,Everwey Enterprise Medium Hard Cotton Printed Pillows Set of 2/2 Pillows (Size 17 x 27 inches) Multicolour,Everwey,0,0,0,649,4.2,74,48,"Thursday, February 17",1,74
189,B08Z4946W2,"INDIYANO Standard Size Microfiber Pillows for Bed, 100% Breathable Cotton Sleeping Pillows, Set of 1 Great for Side and Back Support Pillow",INDIYANO,0,0,0,380,4.1,42,37,"Wednesday, February 16",0,42
190,B09NM68BYV,"Sumegha Creations Takiya Pillow for Home Microfiber Comfort Pillow Microfiber Pillows for Sleeping Microfiber Pillow Medium Soft Vacuum Packed Pillows (16x24 Inch, White) (5)",Sumegha,0,0,0,0,3.0,1,0,,0,1
191,B084RCCDT3,"PUM PUM Ultra Soft Micro Fiber Body Pillow,Long Slide Sleeping Pillow for Adult and Pregnancy ,(Blue ,20x54 Inch)",PUM,0,0,0,499,3.6,125,0,"Wednesday, February 16",1,125
192,B09C4YG8MG,Homerz Set of 2 Microfiber Snow White Cloud Pillow Filled with 3D conjugated Fiber (17 x 27 inch ),Homerz,0,0,0,848,3.7,106,35,"Thursday, February 17",1,106
193,B08VHYP5DR,PAXTON SALES® Memory Foam Cervical Contour Medical Pillow for Sleeping Orthopedic Pillows for Neck Back Shoulder Support Pain Relief cusion Soft Firm Pillow (Off White),PAXTON,0,0,0,499,3.2,68,67,"Wednesday, February 16",1,68
194,B09M8PZ6XM,Zofey Memory Foam Pillows for Neck Pain and Shoulder Pain Orthopedic Cervical Best Contour Shape Ergonomic Neck Memory Foam Bed Pillow (WHITE-MFP-01),Zofey,0,0,0,799,3.3,5,65,"Wednesday, February 16",0,5
195,B09FHM2GVH,Clasiko® Cotton Bolster Covers; Set of 2; 300 TC; Bird Print On Beige Base; 30x15 Inches,Clasiko®,0,0,0,495,4.2,116,50,"Wednesday, February 16",0,116
196,B07F76KMS9,"Hush Standard Pillow | Softex Fiber Filling | Medium Soft Feel The Zero Headache Polyester Bed Pillow, (Beige, 16 x 24 x 7.25 Inch)",Hush,0,0,0,550,3.9,185,21,"Thursday, February 17",1,185
197,B09LHY9SBN,"Premium Quilted Pillows Filled with Reliance High Density Micro Fiber Super Soft Sleeping Pillows 26"" X 16"" Set of 2 (Golden",Premium,0,0,0,348,3.6,10,42,,0,10
198,B09RSWMHP6,"Cozy Feel Cotton Microfiber Blue Star Printed Sleeping Pillow Sets (Blue ,Size-16 x 24 inch, Pack of 4)",Cozy,0,0,0,399,0,0,60,"Wednesday, February 16",0,"₹399
₹999 Save ₹600 (60%)"
199,B08XVLZNK4,"PumPum Premium Holland Velvet 6 pc Car Set (4 Cushion ,2 Neck Rest Pillow) ,Black",PumPum,0,0,0,799,4.3,13,43,"Wednesday, February 16",1,13
200,B0865RXG6M,"MY ARMOR Orthopedic Memory Foam Pillow for Comfortable Sleep, King Size (Pack of 2)",MY,1,1,0,"2,350",4.1,"11,295",44,"Sunday, February 13",1,"11,295"
201,B09NH4FX1K,"Homerz Set of 2 Reversible Mesh Pillow, 17 x 27 inch",Homerz,1,0,0,999,0,0,50,"Thursday, February 17",1,"₹999
₹1,999 Save ₹1,000 (50%)"
202,B09KW46NYM,"Homerz Set of 2 Imported Conjugated Fiber Pillow, 17x 27 inch Size, Vacuum Pack (White with Yellow Boundary)",Homerz,1,0,0,747,5.0,1,25,"Thursday, February 17",1,1
203,B08P9WHVBL,"Nivedha Mattress- Virgin Gold -100% Organic Silk Cotton/Kapok/Ilavam Panju/Semal Cotton Fiber for Filling Pillows, Cushion,bolsters,Mattress etc (2kg)",Nivedha,1,0,0,"1,400",4.2,20,53,"Wednesday, February 16",1,20
204,B096PQQLT3,JDX Premium Hotel Quality Hollow Fiber Pillow (17x27 Inches) -Set of 2,JDX,0,0,0,604,4.5,2,76,"Wednesday, February 16",1,2
205,B08TK2MSWT,"Amazon Brand - Solimo 7 Piece Microfibre Filled Bolster and Cushion Set for Diwan, 2 Bolsters and 5 Cushions",Amazon,0,0,0,999,3.9,24,38,"Wednesday, February 16",1,24
206,B09JKQR4V4,"JY Home Bed Pillows for Sleeping 2 Pack Standard Size 16 x 26 Inches, Hypoallergenic Pillow for Side and Back Sleeper, Down Alternative Cooling Pillow",JY,0,0,0,299,3.7,39,50,,0,39
207,B07Z4TDW39,"MOJOREST Memory Foam Pillow for Sleeping, Pillow for Neck and Shoulder Pain with Removable Cover, King/Large Size (White)",MOJOREST,0,0,0,999,4.0,"1,380",60,"Wednesday, February 16",1,"1,380"
208,B094383XPH,HOMIBOSS Bombay Dyeing Cotton Bed Pillow for Sleeping White Size 60 x 40 cm Set of 2 Pcs,HOMIBOSS,0,0,0,598,4.0,38,53,"Saturday, February 19",1,38
209,B09R7WY95L,"kamla Enterprises Ultra Soft Microfibre Floral Printed Bed Pillow Sets (Black Cotton, Pack of 6, Size- 40x 60Cm)",kamla,0,0,0,599,0,0,54,"Wednesday, February 16",0,"₹599
₹1,299 Save ₹700 (54%)"
210,B09MC81WW7,"Homerz Premium Set of 2 Organic Cotton Kapas Filled Pillow with Firm Medium Hardness, 16 x 24 Size, 700 gm Pillow",Homerz,0,0,0,749,3.4,4,25,"Thursday, February 17",1,4
211,B097HKSPHZ,"MENICY Microfiber Light Weight Bolster Pillow Compliment for DEEWAN & Sofa - Set of 2 (White, 10'' x 25"")",MENICY,0,0,0,449,3.5,43,65,"Wednesday, February 16",0,43
212,B08916ZHLS,"duroflex Fibre Pillows, 69 X 43 cm, White",duroflex,0,0,0,649,5.0,2,10,"Wednesday, February 16",0,2
213,B0995H22GS,Indore Cotton-Micro Filled Jaipuri Print Cotton Pillow Takiya Combo Set of 2 for Bed Room - 17x27 Inch Size Pillow Set of 2 for Sleeping,Indore,0,0,0,599,3.9,6,50,,1,6
214,B00IE45MDE,Hush Soft Fiber Pillow For Sleeping - (White) (18 x 27 inches),Hush,0,0,0,725,4.2,190,27,"Thursday, February 17",1,190
215,B0963Y31SJ,JY Luxury Bed Sleeping Pillow Microfiber Geometric Stripe Pillows for Home Hotel Collection Good for Side and Back Sleeper Size-26'' x 16'' ( White Pack of 2),JY,0,0,0,349,3.6,105,50,,0,105
216,B09RK85R2K,"Karan Enterprises Ultra Soft Microfibre Floral Bed Pillow Sets (Size-16 x 24 inch, Pack of 2)",Karan,0,0,0,230,0,0,82,"Wednesday, February 16",0,"₹230
₹1,299 Save ₹1,069 (82%)"
217,B08N4VVTXQ,"Home Centre Polyester Corsica Solid Pillows (43 cm x 70 cm, White) - Set of 2 Pcs",Home,0,0,0,499,4.3,24,0,"Wednesday, February 16",1,24
218,B07W1427LK,JDX Soft Hotel Quality Premium Fiber Bolster Set of 2-9x24,JDX,0,0,0,699,4.1,33,65,"Wednesday, February 16",1,33
219,B09F6YBN6S,Solid Polyester Fiber Pillow m1 Best for Heavenly Sleep White Pack of 1,Solid,0,0,0,0,3.1,29,0,,0,29
220,B073726R5M,AmazonBasics Polyester Ultra Soft Down Alternative Bed Pillows Large 2 Pack- 20X26 inches (50.8 cmX66.04 cm),AmazonBasics,0,0,0,"1,345",4.0,"5,601",50,,1,"5,601"
221,B07SG771NZ,"FOVERA Memory Foam Pregnancy Pillow Wedge for Maternity - Supports Belly, Back (Bamboo White)",FOVERA,0,0,0,"1,090",4.5,70,22,"Tuesday, February 15",1,70
222,B08CC38NWZ,"Wakewell Pillow for Bed, Soft Pillow for Sleeping | 61 cm x 41 cm - 1 White Bed Pillow",Wakewell,0,0,0,249,3.4,169,58,"Wednesday, February 16",0,169
223,B099RNRQPZ,Great Samrat Microfiber Sleeping Back Adjustable Hotel Quality Pillow Size 17x27 White Pack of 2,Great,0,0,0,499,4.1,7,44,"Wednesday, February 16",0,7
224,B09RGBR27J,"ATOOTFUSION Luxury Full Body Pillow Insert with Fiber Cover - Ultra Soft Body Pillow for Sleeping - Breathable Long Bed Pillow Insert, 20""x54"" (Navy Blue)",ATOOTFUSION,0,0,0,549,0,0,73,"Wednesday, February 16",1,"₹549
₹1,998 Save ₹1,449 (73%)"
225,B09NVWQL76,Trova Fashion Store Cotton Filled with Microfibre & Polyster Ultra Soft Plain White Bed Pillow Sets ( Pack of 4 ),Trova,0,0,0,0,1.0,2,0,,0,2
226,B08HKFBKZM,"ATOOTFUSION Recyclable Black Hosiery Cotton Medium Firm Hard Bed Pillow for Real Perfect Neck Support (Maroon, 16 x 26 Inches)",ATOOTFUSION,0,0,0,198,3.5,21,80,"Wednesday, February 16",0,21
227,B096SZBLRM,"Homerz Microfiber Platinum Knitted King Size Pillow for Bed, Super Soft 250 GSM Knitted Fabric - 2 PC (Snow White, 17x27 Inch)",Homerz,0,0,0,849,3.9,68,53,"Thursday, February 17",1,68
228,B08ZS19FMG,"Urban Basics Hotel Quality Super Soft Clean Microfiber Premium Sleeping Pillow King Size 20 x 30 Inches (White, Set of 1 Pc)",Urban,0,0,0,499,4.1,231,29,"Wednesday, February 16",1,231
229,B09MNC3XW8,"Ananya Int Microcotton Standard Pillows Luxury Bed Pillow for Sleeping (16X24 Inches, White) -Set of 4 Pieces",Ananya,0,0,0,499,2.1,3,58,"Wednesday, February 16",1,3
230,B09NH4FX1K,"Homerz Set of 2 Reversible Mesh Pillow, 17 x 27 inch",Homerz,0,0,0,999,0,0,50,"Thursday, February 17",1,"₹999
₹1,999 Save ₹1,000 (50%)"
231,B08KLJRR12,JELLEX Sleeping Memory Foam Pillow Cushion Cotton Leg Pillow Back Hip Joint Knee Pain Relief Cushion Leg Pillow and Knee Pillow (WHITE),JELLEX,0,0,0,398,3.9,26,60,"Wednesday, February 16",1,26
232,B08HX4KM76,"OBLIQ Memory Foam Car Headrest Cushion, Neck Rest Seat Pillow for Pain Relief, Ergonomic Cervical Support for All Cars (Black), Pack of 1",OBLIQ,0,0,0,899,4.2,507,40,"Tuesday, February 15",1,507
233,B0863XTP63,"SLEEPEZY Cotton LITE Weight Bolster Pillow Compliment for DEEWAN & Sofa l White Bolster l Hard Bolster l Round Soft Bolster l Back Support Bolster of Size (22'X8), Pack of 1 White",SLEEPEZY,0,0,0,485,4.0,183,68,"Wednesday, February 16",1,183
234,B08K3J234R,"HOME ELITE 210 TC Satin Striped Bolster Covers, Set of 2 (Blue, Standard Size)",HOME,0,0,0,189,3.7,171,62,"Wednesday, February 16",0,171
235,B098NYQFZK,Solid Polyester Fiber Pillow U2 Best for Heavenly Sleep White Pack of 2,Solid,0,0,0,249,3.4,3,29,"Wednesday, February 16",0,3
236,B08135PKF1,"EMBROCO ® Cotton Best Night Sleeping Soft Pillow (16x24 Inches, White) -Set of 2",EMBROCO,1,0,0,0,3.6,12,0,,0,12
237,B08Q8JHCQP,"Morning Owl Soft Latex Pillow, Contour Pillow, eco-INSTITUT Certified 100% Natural Latex Pillow, Rubber Pillow, Best Pillow for Sleeping (58*38* 8 cm/10 cm), 1 Pillow",Morning,1,0,0,"1,755",4.2,58,41,"Tuesday, February 22",1,58
238,B09CDQS4NH,"The Sleep Company SmartGRID Premium Hybrid Pillow, The Ultimate Pillow Ever Designed by Science, No Pressure Support, White (24x16 Inches) (66x40 cm) - Pack of 2, Cotton",The,1,0,0,"3,698",4.0,248,47,"Thursday, February 17",1,248
239,B08CCT13ST,"HOMY DECOR Microfiber Pillow, 27 x 17 Inch, Grey, Pack of 2",HOMY,1,0,0,849,4.1,412,58,"Sunday, February 20",1,412
240,B09GS28LX5,"Cloth Fusion Microfiber Bed Pillow Set of 2 Pieces (17x27 Inches, Black and Grey)",Cloth,1,0,0,629,4.0,11,37,"Tuesday, February 15",1,11
241,B08RC4CJT7,"MY ARMOR Microfibre Pillow , 26"" x 17"" , White , 1 Piece",MY,1,0,0,390,4.3,289,35,"Friday, February 18",0,289
242,B096YF8KD2,"Homerz Premium Hotel Quality Super King Size Pillow, 20 x 30 Inch Exact Size, Superior White Cotton Polyester Fabric (5)",Homerz,1,0,0,"1,799",3.8,139,0,"Thursday, February 17",1,139
243,B08Q8J294N,"Morning Owl Soft Rubber Natural Latex Contour Pillow for Sleeping ( White, 58X38X 8 cm/10 cm) - 2 Pillows -INSTITUT Certified",Morning,1,0,0,"3,295",4.2,58,45,"Tuesday, February 22",1,58
244,B09RK3G1J2,"M/S Kusum & Cheshta Enterprises Ultra Soft Microfibre Blue Jhalar Print Pillow Sets (Size-16 x 24 inch, Pack of 6)",M/S,0,0,0,529,0,0,24,"Wednesday, February 16",0,"₹529
₹699 Save ₹170 (24%)"
245,B092SL1B32,"Lukzer 1PC Memory Foam Car Head Rest Pillow for Neck Support Traveling Cushion for Driving Home, Office, Trips Ergonomic Adjust Sitting Position Pain Relief (Black)",Lukzer,0,0,0,699,3.5,32,30,"Wednesday, February 16",1,32
246,B0993NWVDD,"ALMIGHTY CREATIONS Soft Bolster , Fibre Filling for Back and Neck Support Pillow Compliment for DEEWAN & Sofa- Pack of 1",ALMIGHTY,0,0,0,249,1.0,1,72,"Wednesday, February 16",0,1
247,B09C3PX77Y,"ATOOTFUSION Star Ortho Medical Cervical Pillow and Neck Pillow for Sleeping Button Pillow- Indented Contour Pillow for Sleeping on Back or Side - 41 cm x 61 cm, White, Firm",ATOOTFUSION,0,0,0,498,5.0,1,75,"Wednesday, February 16",0,1
248,B09HCFKGPG,"Sleepyhead Memory Foam Pillow, Pack of 2 (25x16 inches, Grey)",Sleepyhead,0,0,0,"2,299",3.9,82,23,"Thursday, February 17",1,82
249,B096KF3FB7,Cotton Cloth Luxury Hotel Collections Soft Pillow || White || 16 X 26 Inch || Pack of 2,Cotton,0,0,0,238,4.0,17,87,"Wednesday, February 16",0,17
250,B092471FGM,"Israel Memory Foam Pillow Cervical for Neck Pain Orthopedic Contour Medical Pillow Support for Back, Stomach, Side Sleepers Pillow for Pain Relief",Israel,0,0,0,545,5.0,2,39,"Monday, February 21",0,2
251,B09NVY2DFC,Trova Fashion Store Microfibre & Polyster Ultra Soft Blue Stripes Bed Pillow Sets ( 6 Pillow ),Trova,0,0,0,699,4.5,2,46,"Wednesday, February 16",1,2
252,B019GRWZPU,"Story@Home Microfibre Pillow, 16 inch x 24 inch, White, 2 Pieces.",Story@Home,0,0,0,462,3.5,950,71,"Wednesday, February 16",0,950
253,B09JSWW688,"JY Breathable Gusset Bed Soft and Supportive Pillows for Side, Back, Stomach Sleepers (16'' x 26'') -Set of 2, Silk , White",JY,0,0,0,449,3.0,19,55,,0,19
254,B09DG89D4Z,DRIS Swiss Resilient Fiber Stripe Pillow | Extra Soft | Standard Size 16 X 24 Inch | White| (1),DRIS,0,0,0,189,3.3,10,62,"Thursday, February 17",1,10
255,B09RJ4LXSN,"M/S Kusum & Cheshta Enterprises Ultra Soft Microfibre Blue Lining Bed Pillow Sets (Pack of 2, Size- 40x60CM)",M/S,0,0,0,299,0,0,40,"Wednesday, February 16",0,"₹299
₹499 Save ₹200 (40%)"
256,B08W8HWC22,ATOOTFUSION Black and White Check Bolster (30 X 9.5 Inches) Set of 02 (Cotton Hard Bolster Set),ATOOTFUSION,0,0,0,498,3.7,173,75,"Wednesday, February 16",0,173
257,B09PRF4FHX,Youngsters Choice Presents Microfiber & Polyster Ultra Soft Blue Line Pillow for Home (Set of 2),Youngsters,0,0,0,299,0,0,70,"Wednesday, February 16",1,"₹299
₹999 Save ₹700 (70%)"
258,B09BLWBK7S,"Habitat Bed Audrey Pillows for Sleeping 2 Pack Standard Size 17 x 27 Inches, Hypoallergenic Pillow for Side and Back Sleeper, Soft Hotel Pillows Set of 2, Microfiber Pillow-White",Habitat,0,0,0,499,3.5,3,66,"Wednesday, February 16",0,3
259,B0993TW99L,"Bee's Bliss Microfiber Soft & Comfort Sleeping Pillow (16x24-inch, White)",Bee's,0,0,0,250,3.6,11,58,"Wednesday, February 16",0,11
260,B0865KY8KB,"MY ARMOR Orthopedic Memory Foam Pillow for Comfortable Sleep, Couple Pack (King & Queen)",MY,1,1,0,"2,250",4.1,"11,295",45,"Sunday, February 13",1,"11,295"
261,B08FYWDN3G,Homerz Ultra Soft ( Set of 4 ) King Size Fibre Pillows for Bed | 17 x 27 Inch Guaranteed Exact Size | White Cotton Fabric Pillows for Sleeping (4),Homerz,1,0,0,"1,269",3.9,324,33,"Thursday, February 17",1,324
262,B081NZXYXW,"Amazon Brand - Solimo Microfibre & polyester 2-Piece Premium Bed Pillow Set, Microfibre, Brown, 43 X 69 X 17 Cm",Amazon,1,0,0,709,4.1,"4,983",48,"Sunday, February 13",1,"4,983"
263,B093CD2CSZ,Chahit Microfiber Ultra Soft Bed Pillow (Blue) - 2 Piece,Chahit,1,0,0,799,4.0,8,47,"Wednesday, February 16",1,8
264,B09HHT53PL,"JY Hotel Collection Cotton Buffalo Check Soft Allergy Friendly, Cooling, Luxury Gel Pillow for Sleeping - Queen Size, Set of 2 - 16x26 inch, White",JY,0,0,0,349,3.8,13,42,,0,13
265,B09L8H4MCC,"Sleepsia Microfiber Bed Pillow for Sleeping - Down Alternative Ultrasoft Cotton Washable Pillow with Satin Gusset- Queen (Blue, Pack of 1)",Sleepsia,0,0,0,"1,299",4.5,64,78,"Wednesday, February 16",1,64
266,B075QJRSMZ,"JDX 200 TC Hotel Quality Fibre Pillow (Set of 2, White) 16X24 Inches",JDX,0,0,0,454,3.8,227,55,"Wednesday, February 16",1,227
267,B09MMCQWTN,"Privesh Contour Memory Foam Pillow, Adjustable Pillow for Seelping, Ergonomic Cervical Pillows for Neck Pain, Neck Support for Back, Anti-Allergy, Pillow for Pain Relief, Bed Pillows with Cover",Privesh,0,0,0,499,5.0,1,80,"Wednesday, February 16",1,1
268,B09BD4XNKV,"Home Style Micro Fiber Filler Super Soft Multipurpose Cotton Pillow for Sleeping, Back Support During Reading, Sitting || 16 x 26 Inch || White || Set of 2",Home,0,0,0,629,4.0,25,37,"Wednesday, February 16",0,25
269,B095KMJXSV,Mylo Essentials Women's Cotton Blend Essentials Maternity Wedge Pillow - Soft PU HD Foam Pillow - Blue,Mylo,0,0,0,649,4.2,45,17,"Wednesday, February 16",0,45
270,B08SHW8XY5,"Hush Value Pillow | Imported Softex Fiber Filling Soft Feel (17 x 27 x 7.25 Inch, White) | Set of 2",Hush,0,0,0,958,4.4,7,20,"Thursday, February 17",1,7
271,B09M439QWS,"MY ARMOR Microfiber Full Body Pillow Long Side Sleeper Pillows for Use During Pregnancy Velvet Outer Cover (Single Pack) (53"" x 16"") (Grey)",MY,0,0,0,999,5.0,18,50,"Friday, February 18",1,18
272,B09H51LR66,"Habitat Bed Amara Pillows for Sleeping 2 Pack Standard Size 17 x 27 Inches, Hypoallergenic Pillow for Side and Back Sleeper, Soft Hotel Pillows Set of 2, Microfiber Pillow-White",Habitat,0,0,0,499,5.0,2,66,"Wednesday, February 16",0,2
273,B096YDPSFG,"Homerz Premium Set of 2 Hotel Quality Super King Size Pillow, 20 x 30 Inch Exact Size, Superior White Cotton Polyester Fabric (2)",Homerz,0,0,0,899,3.8,139,50,"Thursday, February 17",1,139
274,B09NNLRP2S,"Kurl-On Knitted Fabric Premium Compressed Bamboo Pillow ,68 x 43 x 5 cm, Cream Color,1 Pieces",Kurl-On,0,0,0,699,0,0,0,"Wednesday, February 16",1,₹699
