,asin,title,brand,Sponsored,Best Seller,Amazon's Choice,Price,Rating,NoofRatings,Discount,Delivery,Prime Delivery,base
279,B08PV7X1WW,"® Stainless Steel Copper Bottom Tadka pan Vagaria Saucepan Sauce Pot Milk PAN Teapot Tapeli Patila Bhagona Capacity: - 400ml, Dia: 11.5 cm, Height: 4 cm, Approx. Wt.140gms /Baby cb Stand 11.5cm",®,0,0,0,289,5.0,2,56,"Sunday, February 13",1,2
280,B08WCCW88G,"iVBOX Eco-Series Non-Stick Aluminium Flat Dosa Tawa, 250mm, Maroon (Sliver Grey)",iVBOX,0,0,0,359,3.8,791,62,"Sunday, February 13",0,791
281,B08WKNP256,Jayam Traditional 7 Cavity Iron Appam Patra/Paniyaram Pan/Paniyara kallu with Stainless Steel Turner Rod,Jayam,0,0,0,399,2.7,7,34,"Sunday, February 13",1,7
282,B09NK2571T,Cast Iron Fry PAN 6 inch Pre-Seasoned Cast Iron Skillet (Black),Cast,0,0,0,"1,099",0,0,0,"Monday, February 14",0,"₹1,099"
283,B095WL9299,"Nirlon Non-Stick Fry Pan Bakelite Handle, Virgin Grade Aluminium, PFOA Free, 20cm, 1.1 Litre, Red(Compatible with All Gas & stovetops Only)|26mm Classic_Frying Pan10",Nirlon,0,0,0,497,3.8,103,0,"Wednesday, February 16",0,103
284,B09LVN5WRJ,Dynamic Cookware Premium Cast Iron Appam Pan 10 Inch with Lid (Even matt Finish Pre-Seasoned),Dynamic,0,0,0,"1,399",4.5,2,53,"Wednesday, February 16",1,2
285,B09RGZ8L8K,"Aaghnya Pre-Seasoned Iron Pan, Cast Iron tadka Pan 5inch ( Color - Black, Size - 5 inch )",Aaghnya,0,0,0,499,0,0,50,"Tuesday, February 15",1,"₹499
₹999 Save ₹500 (50%)"
286,B09LZNR7NT,"Stodeal Stainless Steel Copper Bottom Sauce Pan 1L ,2L Combo Set | Milk PAN | Tea Pan (2 Piece Set)",Stodeal,0,0,0,419,4.0,1,58,"Sunday, February 13",1,1
287,B08VBH4D7T,"BlueFinger Stainless Steel Tadka pan with Long Handle, Spice Roasting Tadka Pan, Vagaria with Long Handle Stainless Steel Tadka Frying Pan Spice Heating Pan (Thickness: 3 mm, Capacity: 300 ml) (1)",BlueFinger,0,0,0,699,4.1,8,30,"Saturday, February 12",1,8
288,B08F81K58G,Garden Of Arts Aluminium Tadka Pan | Non Stick Tadka Pan Unbreakable Steel Handle Tadka Pan | Chowka Pan Kadai Vagariya | Aluminium Tadka Kadhai with Steel Handle Aluminium Tadka Pan),Garden,0,0,0,135,3.8,17,58,"Sunday, February 13",0,17
289,B08WPQWHKV,STILBON Full Size Iron Tadka Pan | Black | 12cm | 13 inch |,STILBON,0,0,0,259,4.1,38,48,"Monday, February 14",0,38
290,B09RK48VRX,Diktmark Hard Anodised Plus Cookware Induction Base Roti Tawa|Tawa 10 inch (Iron ),Diktmark,0,0,0,325,0,0,59,"Saturday, February 12",1,"₹325
₹800 Save ₹475 (59%)"
291,B073R6WF5Z,"Carote Granite Non Stick Saucepan/Swiss Coated Milk Pan with Lid, PFOA Free, Suitable for All Stove Including Induction/Gas, 18cm",Carote,0,0,0,"1,819",4.4,293,1,"Friday, February 11",1,293
292,B08CMNNFDX,Nirlon Non Stick Square Grill Pan 24cm,Nirlon,0,0,0,645,3.8,388,29,"Friday, February 11",1,388
293,B095S8GGKB,"Prestige Aluminium Omega Select Plus IB Non-Stick Omni Tawa, 250 mm, Multicolour, Medium",Prestige,0,0,0,649,4.0,252,27,"Tuesday, February 15",1,252
294,B08HYQRHDD,"IBELL Stainless Steel Sauce Pan With Lid, 1.5 L, (Silver)",IBELL,0,0,0,585,3.7,75,38,"Tuesday, February 15",1,75
295,B08Y5YKNJY,"ScentRose Hard Anodized Tadka Pan / Spice Heating Pan / Fry Pan / thalipu karandi with Stainless Steel Handle, 10cm",ScentRose,0,0,0,189,3.8,11,62,"Friday, February 11",0,11
296,B079M76PJH,"Meyer Select Stainless Steel Frypan, 24 cm, Induction and Gas Compatible",Meyer,1,0,0,"2,150",4.3,449,28,"Saturday, February 12",1,449
297,B084ZNRRYL,"Meyer Cast Iron Kadai, Black",Meyer,1,0,0,"3,700",4.1,307,30,"Tuesday, February 8",1,307
298,B097DNPP32,"Meyer Pre-Seasoned Cast Iron Frypan/Skillet (Black, 22cm)",Meyer,1,0,0,"2,140",4.2,484,20,"Tuesday, February 8",1,484
299,B07P7W7QM4,"Amazon Brand - Solimo Hard Anodized Aluminium Roti Tawa with Bakelite Wire Handle (27cm, 4mm thickness), Black",Amazon,1,0,0,769,4.0,232,41,"Tuesday, February 8",1,232
300,B08KS2F7SC,"Meyer Pre-Seasoned Cast Iron Frypan/Skillet, 24 cm , Black",Meyer,1,0,0,"2,200",4.2,484,26,"Tuesday, February 8",1,484
301,B083QM4YR6,Danube Home S.S.Sauce PAN 2PCS Set with Glass LID,Danube,1,0,0,"1,299",4.0,1,35,"Sunday, February 13",1,1
302,B07Y599WP5,"AmazonBasics Aluminium Hard Anodized Non-Stick 2-Piece Frying Pan Set, 24 cm and 27 cm, Turquoise",AmazonBasics,1,0,0,"2,319",4.4,38,48,"Tuesday, February 8",1,38
303,B08YD1V5ZR,"The Indus Valley Natural Cookware Pre-Seasoned Super Smooth Cast Iron Tawa with Long Handle for Dosa/Roti/Chapathi - (Diameter: 26 cm, 1.9 Kg)",The,1,0,0,"1,249",3.8,221,50,"Sunday, February 13",0,221
304,B09R9M39DY,"Stainless Steel Copper Bottom Kitchen Serving,Cooking Bowl Handi Set 5-Pieces Biryani Handi,Biryani, Punjabi Pot Pan Combo Handi Set 5 Piece",Stainless,0,0,0,485,0,0,51,"Monday, February 14",0,"₹485
₹980 Save ₹495 (51%)"
305,B08CMPHGHQ,"Nirlon Nonstick Aluminium Square Grill Pan 22cm, Red & Black",Nirlon,0,0,0,599,3.8,"1,082",0,"Wednesday, February 16",1,"1,082"
306,B07P963JG9,"Amazon Brand - Solimo Ceramic Coated Die-Cast Aluminium Non-stick Appe Pan with Glass Lid, 12 Cavities",Amazon,0,0,0,684,3.0,7,57,"Tuesday, February 8",1,7
307,B08XLQJX19,"Prestige Cast Iron Fry Pan, 250 mm",Prestige,0,0,0,"1,790",4.2,47,18,"Monday, February 14",1,47
308,B07S8CS9P8,"neelam CRSP009P Stainless Steel Sauce Pan, 800ml, 1 Piece (Silver)",neelam,0,0,0,225,3.9,469,0,"Sunday, February 13",0,469
309,B091L8K8H6,Nirlon Kitchen Cooking Non- Stick Aluminium Gas Stove Compatible Fry Pan 26 Diameter Ligh Weight Durable with Steel LID[3_mm_Classic_FP_13],Nirlon,0,0,0,834,3.9,58,13,"Friday, February 11",1,58
310,B08D3B3YC7,kitchen mate Brown Aluminium Saucepan/Tea Pan 1000ml & 1500 ml,kitchen,0,0,0,549,0,0,31,"Saturday, February 12",0,"₹549
₹799 Save ₹250 (31%)"
311,B09N2912YZ,BRODEES Iron Tadka Pan 12 cm,BRODEES,0,0,0,249,0,0,64,"Saturday, February 12",0,"₹249
₹699 Save ₹450 (64%)"
312,B09NBQ4TNW,"XTEND Royal Nonstick Dosa Tawa, Tawa 27.5 cm Diameter (Aluminium, Non-Stick)",XTEND,0,0,0,399,0,0,50,"Sunday, February 13",0,"₹399
₹799 Save ₹400 (50%)"
313,B09499ZRQW,"Holzcord Kiwi Nonstick 12 Cavities Appam Maker | Paniyarrakal | Paniyaram | Ponganalu | Appe with Stainless Steel Lid, 2 Side Handles and a Wooden Picker",Holzcord,0,0,0,285,3.5,35,59,"Sunday, February 13",0,35
314,B097N6LQ1S,"Bergner Elements Pre-Seasoned Cast Iron Grill Pan, 27cm, Induction Friendly (Olive Green)",Bergner,0,0,0,"2,484",4.2,34,28,"Sunday, February 13",1,34
315,B081TFNPG5,"AmazonBasics 6 Piece Non-Stick Aluminium Cookware Set, Saucepan, Fry Pan (without Induction Base), Black",AmazonBasics,0,0,0,"1,799",4.2,"33,269",55,"Tuesday, February 8",1,"33,269"
316,B088C6F3P6,"Cello Classy Hard Anodized Aluminium Frying pan Induction Base Without Lid 27 cm, Black",Cello,0,0,0,798,3.7,56,48,"Sunday, February 13",1,56
317,B08FX1MPTH,Tosaa Non-Stick 12 Cavity Appam Patra with Stainless Steel Lid- Back,Tosaa,0,0,0,373,3.9,98,32,"Tuesday, February 8",0,98
318,B0813JBQ64,"Meyer Induction Base Cast Iron Frying Pan, 20cm, Black, 1 Piece",Meyer,0,0,0,"1,650",4.2,484,31,"Tuesday, February 8",1,484
319,B08KT87GQJ,"Wonderchef Nigella 3-Ply Stainless Steel Fry Pan 24cm, 2Litres, 2.6mm Thickness, Silver, Standard",Wonderchef,0,0,0,"1,506",4.6,24,35,"Tuesday, February 15",1,24
320,B083SKMW19,The Indus Valley Natural Cookware Pre-Seasoned Super Smooth Cast Iron Tawa for Dosa/Roti/Chapati (30cm),The,1,0,0,"1,329",4.0,577,47,"Sunday, February 13",1,577
321,B09H5PNFPD,"Kitchen Chef Red Color Tawa for Roti Chapati Dosa Parantha, 25.5 cm Diameter, 4mm Thickness, Non-Induction, Gas Stove Compatible, Concave Base, Heavy Gauge Aluminium Tava with Heat Resistant Bakelite Handle",Kitchen,1,0,0,649,0,0,40,"Sunday, February 13",0,"₹649
₹1,089 Save ₹440 (40%)"
322,B09GF4YWJB,"Bergner Vega Non Stick Cookware Set 4Pc-Kadhai with Glass Lid 2.6L, Dosa Tawa 28cm,Frypan 24cm 1.8 L with Induction Compatible, Soft Touch Bakelite Handles, PFOA Free, 1 Year Warranty, Purple",Bergner,1,0,0,"1,999",4.3,34,53,"Friday, February 11",1,34
323,B09BFWFVY3,"Borosil Granito Non-Stick Aluminium Fry Pan, Induction Base, Black with Handles, 24 cm",Borosil,1,0,0,"1,040",0,0,5,"Sunday, February 13",1,"₹1,040
₹1,095 Save ₹55 (5%)"
324,B07P35Y9Q8,"Lifelong Hard Anodised Sauce Pan, 1.5 Litres, Induction and Gas Compatible,Black",Lifelong,0,0,0,685,3.9,132,29,"Friday, February 11",1,132
325,B094JD63Z2,"Wonderchef Platinum Plus Non-Stick Cookware Set, 4Pc (Kadhai with Lid, Fry Pan, Dosa Tawa), Induction Bottom, Cool-Touch Bakelite Handle, Pure Grade Aluminium, PFOA/Heavy Metals Free, 1 Year Warranty",Wonderchef,0,0,0,"1,805",3.8,166,55,"Tuesday, February 8",1,166
326,B00EYZV6IW,"Vinod Stainless Steel Two Tone Saucepan with Glass Lid- 16 cm, 1.5 LTR (Induction Friendly)",Vinod,0,0,0,710,3.9,591,0,"Tuesday, February 8",1,591
327,B07GPZHR7S,Prestige Omega Deluxe Fry Pan 200 mm,Prestige,0,0,0,660,4.0,520,8,"Saturday, February 12",1,520
328,B07BT6XG94,"Nirlon Non-Stick Frying Pan and Kadai Combo Kitchen Cooking Essential Set with Steel Lid, 2.6mm_FP10_KD14_DKD(M)",Nirlon,0,0,0,"1,196",3.8,58,64,"Wednesday, February 16",1,58
329,B00J0049HQ,Tuffware Hard Anodised Aluminium Vati Vagharia Tadka Pan - Black,Tuffware,0,0,0,359,3.8,116,0,"Sunday, February 13",0,116
330,B093BF216N,"SKARS Stainless Steel Copper Bottom Saucepan, Induction Base Saucepan, Tea Coffee Pan, Milk Pan, Tapeli Patila, Sauce Pot Cookware with Handle Combo Set of 2 (1 LTR, 2.2 LTR)",SKARS,0,0,0,649,3.4,59,57,"Saturday, February 12",1,59
331,B09J2TWH3Q,"Ashoka Heavy Stainless Steel Sauce Pan, Milk Pan/Tea Pan Milk Pan with Black Handle, Induction (0.5 Liter) Free Coffee/Tea Strainer/ Channi",Ashoka,0,0,0,295,5.0,2,26,"Tuesday, February 15",0,2
332,B07S6BMNLT,"neelam CIBS011W Stainless Steel Sauce Pan, 1600ml, 1 Piece (Silver)",neelam,0,0,0,622,4.4,109,20,"Tuesday, February 8",1,109
333,B08HYPL1QP,"Vinod Legacy Pre-Seasoned Cast Iron Fry pan Grill Pan, 24 cm,Induction Friendly,Black, 1 Piece",Vinod,0,0,0,"2,240",4.3,231,28,"Friday, February 11",1,231
334,B083FZHBWN,Sumeet 2.6 mm 190ml 10cm Dia Aluminium Non Stick Waghariya/Tadka Pan (Silver),Sumeet,0,0,0,311,3.8,11,41,"Sunday, February 13",0,11
335,B09H2NX6V2,"70'S KITCHEN Cast Iron 2 in 1 Cast Iron Reversible Tawa and Griddle Pan - (11.5 inch, Black)",70'S,0,0,0,"1,470",4.3,10,58,"Wednesday, February 16",1,10
336,B09H39PCB7,"Kitchen Chef Marble Frying Pan for Stir Saute Tapper Fry, 18 cm Diameter, 0.5 Litre Capacity, Induction Base, 3 Layer Nonstick Coating, 3.25mm Thickness, Heavy Gauge Aluminium Cookware, Heat Resistant Bakelite Handle, Round Black Bottom Utensil (Induction and Gas Stove Compatible)",Kitchen,0,0,0,599,0,0,40,"Saturday, February 12",0,"₹599
₹999 Save ₹400 (40%)"
337,B01684OIEA,"Prestige Aluminium Milk Pan, Black, Others (30968)",Prestige,0,0,0,"1,399",4.0,56,7,"Friday, February 11",1,56
338,B08XLN4KYQ,"Prestige Cast Iron Fry Pan, 200 mm",Prestige,0,0,0,990,3.9,81,20,"Tuesday, February 8",1,81
339,B08PV6H7LK,"® Stainless Steel Tadka pan Vagaria Saucepan Sauce Pot Milk PAN Teapot Tapeli Patila Bhagona Capacity: -500ml, Dia: 12.5 cm, Height:4 cm, Approx. Wt.160gms .",®,0,0,0,250,3.7,3,25,"Sunday, February 13",1,3
340,B093C29GQ9,"Kitchen Kit 12 Cavity Non-Stick Aluminim Bakelite Side Handle Appam Patra/ Paniyarakkal/ Paniyaram/ Pan Cake Maker with Stainless Steel Lid, Black, Medium (PNP100040)",Kitchen,0,0,0,279,4.2,8,57,"Friday, February 11",0,8
341,B082Q5VTVQ,Cello 12-Cavity Heavy Weight Non Stick Aluminium Appam Maker Pan with Glass Lid (Grey),Cello,0,0,0,850,4.1,222,43,"Sunday, February 13",1,222
342,B09K3XRFRV,MYNAKSHA Natural Cookware Pre-Seasoned Iron Chinese Wok/Pan with Wooden Handle - (10 Inch),MYNAKSHA,0,0,0,999,0,0,50,"Tuesday, February 15",1,"₹999
₹1,999 Save ₹1,000 (50%)"
343,B09M8KQ5B8,"RKE Portable Indoor Barbecue BBQ Grill Pan Smokeless Stove top 12.5"" with Removable Plate Ideal for Electric Gas Stoves, Non Stick, Easy Clean Up for Steak, Fish, Chicken",RKE,0,0,0,849,1.7,3,58,"Sunday, February 13",1,3
344,B081TFSNX6,Cello Non Stick Aluminium 7 Cavity Appam/Uttapam Maker with Round Side Handle (Black),Cello,0,0,0,598,4.1,312,33,"Friday, February 11",1,312
345,B08LDC59MP,"Milton Pro Cook Granito Induction Fry Pan With Lid, 26 Cm, Black",Milton,0,0,0,"1,256",3.7,78,20,"Wednesday, February 9",1,78
346,B09PJR7DTG,Fabartistry Pre-Seasoned Cast Iron Tadka Pan (4.5 inches),Fabartistry,0,0,0,550,5.0,2,42,"Tuesday, February 15",1,2
347,B09LCTTGVK,LAGET® Carbon Steel Lovely Cartoon Shape Mini Non-Stick Egg Frying Pan for omelets (Pack of 1 ),LAGET®,0,0,0,199,2.5,2,50,"Sunday, February 13",1,2
348,B09JFF2SPW,Home Centre Fiesta Black Hard Anodised Tadka Pan - 11cm,Home,0,0,0,199,0,0,0,"Friday, February 11",0,₹199
349,B08X1KHHSH,"Super HK Stainless Steel Induction and Gas Compatible Heavy Base Sauce Pan for Cooking Tea Milk in Kitchen (1 Litre, Silver)",Super,0,0,0,390,3.5,95,61,"Saturday, February 12",0,95
350,B0822CFPDS,"KITCHEN SHOPEE Heavy Base Iron Flat Kadai Fry Pan for Making jalebi, dal tadka, 12 Inches,310 cm Original Iron loha color black 4 Liters",KITCHEN,0,0,0,500,4.0,83,44,"Saturday, February 12",1,83
351,B09P488BS2,"NYRA Stainless Steel Fry Pan with Riveted PVC Handle - Cook, Sauté, Tadka Multi-Purpose Food Grade - Available in 3 Sizes (Small - 500 ML)",NYRA,0,0,0,399,0,0,50,"Saturday, February 12",1,"₹399
₹800 Save ₹401 (50%)"
352,B08RWHWV1X,Dealnicy Stainless Steel Sauce & Milk Pan Tea & Coffee Pot Tapeli Patila 1 Litre Capacity (Multicolor),Dealnicy,0,0,0,269,3.3,77,46,"Sunday, February 13",1,77
353,B08WK68MRL,"Rock Tawa Pre-Seasoned Cast Iron Skillet Square Frying PAN (Black, 5.50 in )",Rock,0,0,0,649,4.0,64,57,"Wednesday, February 16",1,64
354,B08PV7J7FS,"® Stainless Steel Copper Bottom Tadka pan Vagaria Saucepan Sauce Pot Milk PAN Teapot Tapeli Patila Bhagona Capacity: - 250ml, Dia: 10.5cm, Height: 4.0 cm, Approx. Wt.130gms /Baby cb Stand 10.5cm",®,0,0,0,279,4.0,8,57,"Sunday, February 13",1,8
355,B09N7CQ4G3,"Nicolette Presents Non-Stick Mini Egg Frying Pan, Mix Design, Medium Size, Loose Packing , Smily Design (Design Subject to Availability)",Nicolette,0,0,0,185,4.0,1,63,"Monday, February 14",0,1
356,B07MWGLWF3,"Amazon Brand - Solimo Stainless Steel Sautee Pan with Lid, 24 cm, Silver",Amazon,1,0,0,"1,275",4.5,235,42,"Tuesday, February 8",1,235
357,B089NPLPG6,"CAROTE Granite Non Stick Flat Roti Tava, Induction Base Swiss Coated Dosa Pan, Tawa (Black, PFOA Free, 24cm, 5-ply, 4mm Coating)",CAROTE,1,0,0,"1,219",4.3,"1,930",0,"Friday, February 11",1,"1,930"
358,B07D3ZWGFL,AmazonBasics Cookware Set with Lids and Removable Handle -10 Piece,AmazonBasics,1,0,0,"3,129",4.2,"33,269",43,"Tuesday, February 8",1,"33,269"
359,B07ZT9HW4W,"Meyer Aluminium Non Stick Edge-less Flat Tawa, Orange, 30 cm",Meyer,1,0,0,"2,167",4.3,40,19,"Friday, February 11",1,40
360,B09CQD8D9B,Danube Home Napoli Choco Brown Roaster PAN 37X27X4.5CMS - CB00,Danube,1,0,0,749,0,0,17,"Sunday, February 13",1,"₹749
₹903 Save ₹154 (17%)"
361,B07YY64BPF,Meyer Trivantage Stainless Steel 28cm Frypan and 30cm Kadai (Silver) - 3 Piece Cookware Set,Meyer,1,0,0,"7,650",4.4,126,15,"Friday, February 11",1,126
362,B09PGHPQB5,"Vinod Popular Non-Stick Induction Friendly 4 Pcs Cookware Set - Kadai with Lid 24cm (2.4 L), Frypan 24cm, Dosa Tawa 28cm, Saucepan with Lid 16cm (1.3 L) Comes with Sturdy Riveted Bakelite Handle - Red",Vinod,1,0,0,"2,555",5.0,1,40,"Friday, February 11",1,1
363,B07P6R6K66,"Amazon Brand - Solimo Nonstick Frying Pan with Granite Finish and 2-way Non-stick Coating, 24 cm (2.8mm Thickness, Induction Compatible)",Amazon,1,0,0,719,4.3,13,40,"Tuesday, February 8",1,13
364,B07F8CVXQ2,"MK KITCHENWARE Iron Tadka Pan/Kadhai (1.5 L, 10 Inches, 25.5 cm).",MK,0,0,0,504,3.5,92,50,"Wednesday, February 16",0,92
365,B09RK7HR39,PS SHEVIN_@Iron Tawa Induction Base Heavy Wider 10 Inch for Roti Paratha Chapati Phulka Omelette with Stainless Steel Handle Color (Black)_||TIC4,PS,0,0,0,334,0,0,67,"Saturday, February 12",1,"₹334
₹999 Save ₹665 (67%)"
366,B015O7Z6MA,"Tosaa Vagharia Hard Anodized Aluminium Tadka Pan, 100mm, Black",Tosaa,0,0,0,218,4.0,"1,236",27,"Tuesday, February 8",0,"1,236"
367,B083H8KH8C,Better 12 Cavities Non Stick Appam Patra with Lid (Red),Better,0,0,0,199,3.6,64,69,"Tuesday, February 15",0,64
368,B01MS8E6IJ,"Prestige Omega Select Plus Set Non-Stick Dosa Tawa (Black), 31 cm",Prestige,0,0,0,"1,189",4.3,554,15,"Sunday, February 13",1,554
369,B07RW2LQZY,"Healthy Choices Cast Iron Skillet Frying Pan 9 Inch, Black (Compatible with Gas Stove, Electric, Induction, Oven, Ceramic or Over an Open Fire)",Healthy,0,0,0,"1,299",4.1,819,35,"Sunday, February 13",1,819
370,B00MIUZ5BE,"Prestige Select Plus 7 Pit Aluminium Paniyarkal, 160mm, Multicolour",Prestige,0,0,0,525,3.7,92,17,"Friday, February 11",1,92
371,B08H8B2NHS,WokHouse Iron Kadhai 11 inches Iron Wok | Chinese Kadhai with Wooden Handle,WokHouse,0,0,0,569,4.2,215,43,"Sunday, February 13",0,215
372,B091HZL8GV,Kafal Stainless Steel Saucepan with Orange Handle. 1 Litre Capacity.,Kafal,0,0,0,99,3.7,16,80,"Friday, February 11",0,16
373,B09FZS29QW,AIM Frying pan Non Stick Egg deep dosa tawa Frying pan 21.5cm Black,AIM,0,0,0,399,4.1,8,60,"Sunday, February 13",0,8
374,B00O2PCS5O,"Prestige Aluminium Hard Anodised Cookware Saute Pan, Black, 20 cm or 1.7 Litre (35039)",Prestige,0,0,0,"1,008",4.2,203,21,"Tuesday, February 8",1,203
375,B09NH1S2LK,"AXIOM Triply Stainless Steel Deep Frypan Induction Compatible with Silicon Handle. Diameter – 24 cm, Thickness – 3 MM, Silver Frying Pan",AXIOM,0,0,0,"1,890",5.0,1,41,"Tuesday, February 15",1,1
376,B07PB6BW5Q,"Amazon Brand - Solimo Stainless Steel Induction Bottom Kadhai (25cm), Silver",Amazon,0,0,0,489,4.0,"5,021",30,"Tuesday, February 8",0,"5,021"
377,B07MWFSZSQ,"Amazon Brand - Solimo Aluminium Frypan, 20 cm, Brown",Amazon,0,0,0,383,3.4,76,76,"Tuesday, February 8",0,76
378,B09PN4X1S7,"HHMD International Traders Stainless Steel Tea Pan with Copper Bottom Non Stick, Cooking Serving Bowl Biryani, Tea Milk Sauce Pan Tapeli/Patila/Bhagona ( 1.5 Liter )",HHMD,0,0,0,329,0,0,67,"Saturday, February 12",0,"₹329
₹999 Save ₹670 (67%)"
379,B07YCDBG17,"Bergner Argent 5CX 5-Ply Stainless Steel Fry Pan with Riveted Cast Handle & Induction Base (24 cm, Silver)",Bergner,0,0,0,"3,299",4.3,43,45,"Sunday, February 13",1,43
380,B07Y58WCCH,"AmazonBasics Aluminium Hard Anodized Non-Stick 32 cm Frying Pan, Turquoise",AmazonBasics,1,0,0,"1,338",4.5,91,59,"Friday, February 11",1,91
381,B073RX9SP8,"Carote Non Stick Kadhai with Lid, Granite Covered Kadai, Induction&Gas Braiser, Biriyani Pot, 4mm Base 5-ply Nonstick Swiss Coating, 3.8 Liters/28cm",Carote,1,0,0,"2,199",4.5,"1,253",19,"Friday, February 11",1,"1,253"
382,B078XD17RM,"Haneez® Rock Finished Non Stick Frying Pan, 7-Inch, Size 23 cms",Haneez®,1,0,0,490,4.0,3,72,"Monday, February 14",0,3
383,B07Y5CJJW2,"AmazonBasics Ceramic Non-Stick 2-Piece Frying Pan Set, 24 cm and 28 cm, Red",AmazonBasics,1,0,0,"1,174",4.2,34,71,"Tuesday, February 8",1,34
384,B079ZBZ3D5,"Wonderchef Ebony Hard Anodized Nonstick Sauce Pan 16cm, 2L, 3.25 mm, Black and Brown",Wonderchef,0,0,0,899,4.2,128,40,"Tuesday, February 8",1,128
385,B08K9TYSBV,"Tosaa 12 Cavity Appam Patra Side Handle with Lid, 23 cm, Black & Tosaa Square Grill Pan, Black/Red (22Cmx22Cm)",Tosaa,0,0,0,677,3.8,6,48,,1,6
386,B07XD9QS3J,"Meyer Anzen Healthy Ceramic Coated Cookware Frypan, 28cm, Aluminum, Grey",Meyer,1,0,0,"2,329",4.2,191,19,"Friday, February 11",1,191
387,B07YNLBXWW,"Bergner Iris 5 Pcs Cookware Set-Induction Base (Wok-2.4 LTR,24 cm, Frypan-1.3 LTR, 24 cm, Tawa-25 cm, Mini Pan-14 cm) BGIN-2141-BY",Bergner,1,0,0,"2,399",0,0,40,"Tuesday, February 8",1,"₹2,399
₹3,995 Save ₹1,596 (40%)"
388,B07XHQYLWD,"Meyer Trivantage Stainless Steel Triply Cookware Frypan, 24cm",Meyer,1,0,0,"2,400",4.4,188,27,"Friday, February 11",1,188
389,B09GF4LSH1,"Bergner Sherry Non Stick Cookware Set 4Pc-Kadhai with Glass Lid 2.6 L, Dosa Tawa 28cm, Frypan 24cm 1.8 L with Induction Compatible, Soft Touch Bakelite Handles, PFOA Free, 1 Year Warranty, Red",Bergner,1,0,0,"1,999",4.3,34,53,"Friday, February 11",1,34
