,asin,title,brand,Sponsored,Best Seller,Amazon's Choice,Price,Rating,NoofRatings,Discount,Delivery,Prime Delivery,base
275,B0847M6FK4,"The White Willow Memory Foam Orthopedic Bed Pillow for Sleeping & Neck Pain Relief Suitable for Back Sleeper, Side Sleeper & Stomach Sleeper with Pillow Cover 22"" L x 15"" W x 4"" H ,Multi",The,0,0,0,"1,044",4.0,"2,194",63,"Thursday, February 10",1,"2,194"
276,B08HKFBKZM,"ATOOTFUSION Recyclable Black Hosiery Cotton Medium Firm Hard Bed Pillow for Real Perfect Neck Support (Maroon, 16 x 26 Inches)",ATOOTFUSION,0,0,0,198,3.5,21,80,"Monday, February 14",0,21
277,B09RPQYKNV,"D.R.SHIV Memory Foam Pillow for Neck Pain and Shoulder Pain,Orthopedic Cervical Contour Memory Foam Bed Pillow",D.R.SHIV,0,0,0,799,0,0,27,"Monday, February 14",1,"₹799
₹1,099 Save ₹300 (27%)"
278,B09PRF4FHX,Youngsters Choice Presents Microfiber & Polyster Ultra Soft Blue Line Pillow for Home (Set of 2),Youngsters,0,0,0,299,0,0,70,"Sunday, February 13",1,"₹299
₹999 Save ₹700 (70%)"
279,B09Q62ZDQQ,"Kamal Enterprises Furniture Microfibre & Polyester 2-Piece Bed Pillow Set - 40 x 60 cm, White (2)",Kamal,0,0,0,299,1.0,1,63,"Sunday, February 13",1,1
280,B09M439QWS,"MY ARMOR Microfiber Full Body Pillow Long Side Sleeper Pillows for Use During Pregnancy Velvet Outer Cover (Single Pack) (53"" x 16"") (Grey)",MY,0,0,0,999,5.0,18,50,"Wednesday, February 16",1,18
281,B08R93TWLQ,"Nivedha Mattress-Organic Silk Cotton/Kapok/Semal/Ilavam Panju Classic Pillow (27 X 17 Inches),White Striped Pillow.",Nivedha,0,0,0,800,3.9,35,47,"Monday, February 14",1,35
282,B09F6YBN6S,Solid Polyester Fiber Pillow m1 Best for Heavenly Sleep White Pack of 1,Solid,0,0,0,0,3.2,29,0,,0,29
283,B0993TW99L,"Bee's Bliss Microfiber Soft & Comfort Sleeping Pillow (16x24-inch, White)",Bee's,0,0,0,250,3.6,11,58,"Tuesday, February 15",0,11
284,B0922KZGFB,"TRIDENT Comfort Living Pillow 100% Polyester (2-Piece Pillows) Fluffy, Bouncy, Non- Allergic, Washable, Optimum Neck Support, 650 GSM Filling (White)",TRIDENT,0,0,0,749,3.8,24,50,"Monday, February 14",0,24
285,B096SZBLRM,"Homerz Microfiber Platinum Knitted King Size Pillow for Bed, Super Soft 250 GSM Knitted Fabric - 2 PC (Snow White, 17x27 Inch)",Homerz,0,0,0,849,3.8,65,53,"Tuesday, February 15",1,65
286,B09M4R2JQV,Stylbase Cotton Fabric with Grey Poly-Cotton Filling Medium Soft Sleeping Pillow for Bed 16 x 25 Inch (Pack of 2),Stylbase,0,0,0,449,4.7,18,75,"Monday, February 14",0,18
287,B08FZCCH95,"ATOOTFUSION 100% Recyclable Black Hosiery Gingham Plaid Medium Hard Cotton Bed Pillow for Real Perfect Neck Support (16"" x 26"") Buffalo Check Multicolored Set of 01",ATOOTFUSION,0,0,0,225,4.2,42,77,"Monday, February 14",0,42
288,B08P7MQRSJ,"DOCTOR REST Hollow Microfibre Soft Fiber Bed Pillow Set of 4, 16inchx24Inch, White",DOCTOR,0,0,0,849,3.9,39,47,"Monday, February 14",1,39
289,B01N2835PY,"Comfy Kurlon Hosta PU Foam Pillow (24 X 16, White), Pack of 1",Comfy,0,0,0,"1,095",3.6,14,16,"Tuesday, February 15",1,14
290,B09LVC1573,"THE WOOD WHITE Orthopedic Memory Foam Pillow for Sleeping | Cooling technic for Comfortable Sleep with Organic Tencel Hexagonal Cotton Cover. ( Memhexaorganic , 24""x15""x4.5"" Size)",THE,0,0,0,"1,099",5.0,2,48,"Monday, February 14",1,2
291,B0894JG1CT,"duroflex Fibre Pillows ( 69 X 43 cm, White )- Set of 2",duroflex,0,0,0,"1,388",4.2,27,4,"Monday, February 14",0,27
292,B08CL1F688,"ATOOTFUSION 100% Recyclable Black Hosiery Cotton Firm Medium Hard Cotton Bed Pillow for Real Perfect Neck Support (16"" x 26"") Bombay Dying Satin Striped White Pack of 01",ATOOTFUSION,0,0,0,199,3.5,147,80,"Monday, February 14",0,147
293,B09MN9ZTJ4,"Ananya Int Microcotton Standard Pillows Luxury Bed Pillow for Sleeping (16X24 Inches, White) -Set of 1 Pieces",Ananya,0,0,0,189,2.1,3,68,"Sunday, February 13",1,3
294,B09BLWT5SQ,"Habitat Bed Audrey Pillows for Sleeping King Size Pillow 20 x 36 Inch Set of 2, Hollow conjugated Pillow Home & Hotel Collection Fluffy Pillows Soft and Firm Down Alternative Fill, 2 Pack",Habitat,0,0,0,769,3.5,3,68,"Tuesday, February 15",0,3
295,B07Z4TDW39,"MOJOREST Memory Foam Pillow for Sleeping, Pillow for Neck and Shoulder Pain with Removable Cover, King/Large Size (White)",MOJOREST,0,0,0,999,4.0,"1,372",60,"Sunday, February 13",1,"1,372"
296,B089YT41HN,"HOMY DECOR Bombay Dyeing 100% Cotton Cloth, Luxury Hotel Collections Soft Pillow, 17 X 27 Inch, White, Pack of 1",HOMY,1,0,0,399,4.0,397,60,"Thursday, February 17",1,397
297,B081NZXYXW,"Amazon Brand - Solimo Microfibre & polyester 2-Piece Premium Bed Pillow Set, Microfibre, Brown, 43 X 69 X 17 Cm",Amazon,1,0,0,749,4.1,"4,971",45,"Wednesday, February 16",1,"4,971"
298,B08Q8J294N,"Morning Owl Soft Rubber Natural Latex Contour Pillow for Sleeping ( White, 58X38X 8 cm/10 cm) - 2 Pillows -INSTITUT Certified",Morning,1,0,0,"3,295",4.2,58,45,"Sunday, February 20",1,58
299,B08135PKF1,"EMBROCO ® Cotton Best Night Sleeping Soft Pillow (16x24 Inches, White) -Set of 2",EMBROCO,1,0,0,0,3.6,12,0,,0,12
300,B096YF8KD2,"Homerz Premium Hotel Quality Super King Size Pillow, 20 x 30 Inch Exact Size, Superior White Cotton Polyester Fabric (5)",Homerz,1,0,0,"1,799",3.8,139,0,"Tuesday, February 15",1,139
301,B09N2RMGMR,"Homerz Standard 16 x 24 Pillow, White, 3D Conjugate Fiber Filled (Set of 2)",Homerz,1,0,0,599,0,0,63,"Tuesday, February 15",1,"₹599
₹1,599 Save ₹1,000 (63%)"
302,B09QGL6WHF,"Sleepsia Microfiber Bed Pillow for Sleeping - Down Alternative Ultrasoft Cotton Washable Pillow with Satin Gusset- Queen (Blue, Pack of 4)",Sleepsia,1,0,0,"3,850",4.5,60,36,"Sunday, February 13",1,60
303,B0967ZPY3L,"Homerz Premium Set of 4 Fibre Pillows for Bed 16 x 24 inch Size, White Polyester Cotton Fabric (4)",Homerz,1,0,0,"1,199",4.3,6,14,"Tuesday, February 15",1,6
304,B07FYSXPT1,"AmazonBasics Feather Pillows , Standard, 2 Pieces",AmazonBasics,0,0,0,"1,899",4.1,413,49,"Thursday, February 10",1,413
305,B07YX4BRBL,"Dreamfactory Knitted Fabric Fiber Pillow (27 x 17"", White) -Set of 2",Dreamfactory,0,0,0,998,4.1,"2,739",50,,1,"2,739"
306,B096KSGYDZ,"Mashur Fab Cervical Contour Memory Foam Pillow for Sleeping,Orthopedic Pillow for Neck Pain, Support for Back,Stomach,Side Sleepers, with Breathable Zip Cover (19X12X4,Off White) (17 X 27 (2 Piece ))",Mashur,0,0,0,399,4.0,1,60,"Monday, February 14",0,1
307,B0963Y31SJ,JY Luxury Bed Sleeping Pillow Microfiber Geometric Stripe Pillows for Home Hotel Collection Good for Side and Back Sleeper Size-26'' x 16'' ( White Pack of 2),JY,0,0,0,349,3.7,104,50,,0,104
308,B08VHYP5DR,PAXTON SALES® Memory Foam Cervical Contour Medical Pillow for Sleeping Orthopedic Pillows for Neck Back Shoulder Support Pain Relief cusion Soft Firm Pillow (Off White),PAXTON,0,0,0,499,3.2,67,67,"Monday, February 14",1,67
309,B09FT28CCT,HFI Urban Arts Striped Fabric Luxury Premium Pillows - Pack of 2 Pcs| 17 x 27 Inches| White | Conjugated Virgin Fiber Filling | Hotel Quality Linen,HFI,0,0,0,675,4.5,57,50,"Tuesday, February 15",1,57
310,B09NM68BYV,"Sumegha Creations Takiya Pillow for Home Microfiber Comfort Pillow Microfiber Pillows for Sleeping Microfiber Pillow Medium Soft Vacuum Packed Pillows (16x24 Inch, White) (5)",Sumegha,0,0,0,0,3.0,1,0,,0,1
311,B09647D2RQ,"REMCART Microfiber Sleeping Pillow, 40 cm X 60 cm, White Pack of 1pc",REMCART,0,0,0,159,3.3,18,73,"Sunday, February 13",0,18
312,B09MJC4ML1,"Wakeup Betarest Fiber Sleeping Pillow 2 Pieces (Size-27x17 inch),White-68.58 cm x 43.18 cm",Wakeup,0,0,0,875,0,0,46,"Tuesday, February 15",0,"₹875
₹1,624 Save ₹749 (46%)"
313,B09HHT53PL,"JY Hotel Collection Cotton Buffalo Check Soft Allergy Friendly, Cooling, Luxury Gel Pillow for Sleeping - Queen Size, Set of 2 - 16x26 inch, White",JY,0,0,0,349,3.8,13,42,,0,13
314,B07W5C88VH,"Recron Certified Dream Fibre Pillow - 41 x 61 cm, White, 2 Piece & Bliss Pillow (White) Combo",Recron,0,0,0,948,4.2,17,30,,1,17
315,B0813R1DHQ,"Recron Certified Bliss Fibre Pillow - 43 cm x 69 cm, White & Dream Fibre Pillow - 43 cm x 69 cm, Pack of 2, White Combo",Recron,0,0,0,"1,048",4.3,4,32,,1,4
316,B09QJSPDN8,"Shree GANPAT Enterprises Ultra Soft Pillow Sets for Bed (Black Microfibre , Set of 06,Size- 68 x 43Cm)",Shree,0,0,0,599,0,0,14,"Sunday, February 13",0,"₹599
₹699 Save ₹100 (14%)"
317,B09F9FHXKG,"Design World -Hollow Fibre Pillow for Sleeping Bed Set of 1, 18x27 inch, White",Design,0,0,0,299,3.0,1,70,"Monday, February 14",0,1
318,B093GWMGKV,"SOUND SLEEP Microfiber Soft Bed Gel Hypoallergenic Hotel Comfy Pillows 2 Pack Standard Size 17.25""x27.25"" Inches, Set of 2, White",SOUND,0,0,0,399,3.6,65,43,"Tuesday, February 15",0,65
319,B094DGJN6F,LATKALO Sleeping Pillow-Cotton Leg Pillow-Pregnancy Body Memory Foam Pillow-Orthopedic Knee Leg Wedge Pillow-Leg Pillow Only Ventilated Memory Foam (White),LATKALO,0,0,0,689,0,0,31,"Monday, February 14",1,"₹689
₹999 Save ₹310 (31%)"
320,B08CCVW8B7,"HOMY DECOR Microfiber Pillow (27 x 17 Inch, Grey)",HOMY,1,0,0,425,4.1,411,57,"Thursday, February 17",1,411
321,B08Q8DKCF6,"Morning Owl Natural Latex Rubber Medium Firm eco-INSTITUT Certified Pillow (60*40*12.5 cm), 2 Pillows, White",Morning,1,0,0,"3,495",4.0,36,47,"Sunday, February 20",1,36
322,B0865PBL43,"MY ARMOR Orthopedic Memory Foam Pillow for Comfortable Sleep, Queen Size (Pack of 2)",MY,1,1,0,"2,150",4.1,"11,264",45,"Thursday, February 10",1,"11,264"
323,B08KCNY52L,"HOMIBOSS Bombay Dyeing Luxuries Quality Microfiber Pillow Set Insert Satin Fabric (White, 17 x 27 inches) -Pack of 2 Pieces",HOMIBOSS,1,0,0,749,4.2,12,66,"Wednesday, February 16",1,12
324,B01MSWY3B4,"Sleepwell Cotton Pillow, Multicolour, 4 Pieces",Sleepwell,0,0,0,"1,464",3.9,95,21,"Tuesday, February 15",0,95
325,B09BD4XNKV,"Home Style Micro Fiber Filler Super Soft Multipurpose Cotton Pillow for Sleeping, Back Support During Reading, Sitting || 16 x 26 Inch || White || Set of 2",Home,0,0,0,629,4.0,25,30,"Sunday, February 13",0,25
326,B09N1RLF42,takiyawala® Luxury Plush Microfiber Box Pillow 16X26X4 (Pack of 2),takiyawala®,0,0,0,698,4.8,5,53,"Monday, February 14",1,5
327,B08TK2MSWT,"Amazon Brand - Solimo 7 Piece Microfibre Filled Bolster and Cushion Set for Diwan, 2 Bolsters and 5 Cushions",Amazon,0,0,0,949,4.0,23,41,"Wednesday, February 16",1,23
328,B08Y5Y4BTV,"FEATHER COMFORT White Striped 100% Cotton Cloth Luxury Hotel Collection Super Soft Pillow for Sleeping Micro Fibre Filled ( Set of 2) for Bed Room- 16""*26""",FEATHER,0,0,0,599,3.8,4,63,"Tuesday, February 15",0,4
329,B09RG2X689,Little Peach Microfiber C Shape Ultra-Soft Pregnancy Pillow (Charcoal Grey),Little,0,0,0,"1,999",0,0,20,"Sunday, February 13",1,"₹1,999
₹2,499 Save ₹500 (20%)"
330,B09B1V91SG,Comfill Delight Microfiber Hollow Siliconized 60x 40 Pillow (Pack of 1),Comfill,0,0,0,244,5.0,2,51,"Tuesday, February 15",0,2
331,B00IJRV1GI,"Recron Certified Dr. Ortho Fibre Pillow - 41 cm x 61 cm, White",Recron,0,0,0,610,3.7,"1,316",39,"Thursday, February 17",0,"1,316"
332,B07NYS7C7T,Hush Super Soft Plus (Gussetted) Pillow (18 x 27 x 6 Inch) I Imported Micro Fiber Filling I 3 Way Head-Neck-Shoulder Support I Anti-Sag Technology I Medium Soft Feel,Hush,0,0,0,"1,800",4.1,43,20,"Monday, February 14",1,43
333,B09373JPNF,"RTX Luxury Soft Pillow for Sleeping, Machine Washable, - 16"" x 24"" (White Foam) (1)",RTX,0,0,0,199,3.4,9,72,"Sunday, February 13",1,9
334,B097S7PDFX,SOLARA Shredded Memory Foam Pillow,SOLARA,0,0,0,999,3.9,201,38,"Tuesday, February 15",1,201
335,B09PRGY88Y,Youngsters Choice Presents Microfiber & Polyster Ultra Soft Blue Line Pillow for Home (Set of 1),Youngsters,0,0,0,196,0,0,80,"Sunday, February 13",1,"₹196
₹999 Save ₹803 (80%)"
336,B08CNCSW18,Fabroyal India 5 Star Luxury Standard Antique White Cotton Pillow Filler with Fibre for Well Night's Sleep for Home & Hotel (Pack of 3 Pillow),Fabroyal,0,0,0,0,4.2,8,0,,0,8
337,B09878WDYH,"ATOOTFUSION Microfiber Ultra Soft Bed Pillows Set (White, 12X18 Inches) - Pack of 02",ATOOTFUSION,0,0,0,298,3.7,77,70,"Monday, February 14",0,77
338,B09QQTGQS4,"Homerz Premium Set of 2 Bolster Pillow, 15 x 30 Size, 3D conjugated Fiber Filled, Vacuum Pack",Homerz,0,0,0,899,0,0,10,"Tuesday, February 15",1,"₹899
₹999 Save ₹100 (10%)"
339,B08KVW727K,"Wake Up Hollow Cotton Fiber Pillow, 27x17 inch, White, 2 Piece",Wake,0,0,0,495,4.0,407,53,"Tuesday, February 15",0,407
340,B09RK8LRR3,"Karan Enterprises Ultra Soft Microfibre Printed Pillow Sets (Size-16 x 24 inch,Pack of 2)",Karan,0,0,0,299,0,0,77,"Sunday, February 13",0,"₹299
99
₹1,299 Save ₹999.01 (77%)"
341,B08F7B1QFG,"Sleepwell Microfibre Pillow - 21x20x17 cm, Pack of 2, Multicolour",Sleepwell,0,0,0,0,4.0,175,0,,0,175
342,B09RK44RS5,"M/S Kusum & Cheshta Enterprises Ultra Soft Microfibre Blue Jhalar Print Pillow Sets (Size-16 x 24 inch, Pack of 2)",M/S,0,0,0,299,0,0,40,"Sunday, February 13",0,"₹299
₹499 Save ₹200 (40%)"
343,B09C5LX3RQ,"Cottington Lane - Micro Fiber Filled pillow Chacked Sage Cotton Pillow Takiya Combo Set of 2 for Bed Room - 20x30 Inch Queen Size Pillow Set of 2 for Sleeping,Pillow for Comfortable Sleep ,Bed Pillow for Sleeping,Luxurious,Microfiber Bed Pillow Set , Ultra Soft Microfibre Bed Pillow Set ,",Cottington,0,0,0,651,3.9,8,50,"Tuesday, February 15",1,8
344,B09NVWP7XK,Trova Fashion Store Cotton Filled with Microfibre & Polyster Ultra Soft Floral Printed Bed Pillow Sets ( Pack of 5 ),Trova,0,0,0,479,0,0,56,"Sunday, February 13",1,"₹479
₹1,099 Save ₹620 (56%)"
345,B06X9W96FQ,"Portico New York Cotton White Single Sleep Z Pillow, Set of 1",Portico,0,0,0,549,4.0,60,0,"Sunday, February 13",1,60
346,B00QLOM68I,"Kurl-On Polyurethane Foam Pillow Chimera, Single, White, 1 Piece, Cotton",Kurl-On,0,0,0,"1,089",4.0,62,19,"Tuesday, February 15",0,62
347,B096PQQLT3,JDX Premium Hotel Quality Hollow Fiber Pillow (17x27 Inches) -Set of 2,JDX,0,0,0,604,4.5,2,76,"Tuesday, February 15",1,2
348,B093D581T7,"ANTHEM Studio 100 % Organic Buck Wheat Hull Pillow Outer Cover with Cooper Infused Yarn Fabric Inner Cover with 100 % Organic Cotton (41*61*10 cm, Brown)-Single Piece- with One Shopping Bag",ANTHEM,0,0,0,"2,099",0,0,51,"Wednesday, February 16",1,"₹2,099
₹4,299 Save ₹2,200 (51%)"
349,B09CV1R9G3,"UrbanBed High Resilience Foam Base & Memory Foam Comfort Layer Small Size Orthopaedic Wedge Pillow with Removable Cover, 1 Unit (White) 18 x 18 x 11 Inches",UrbanBed,0,0,0,"1,268",4.6,9,37,"Tuesday, February 15",0,9
350,B01H39N7L4,"Kurl-On Polyurethane Foam Pillow, 23"" X 14"" X 4"", White, Pack of 1",Kurl-On,0,0,0,"1,114",3.8,55,55,"Saturday, February 12",0,55
351,B09DG89D4Z,DRIS Swiss Resilient Fiber Stripe Pillow | Extra Soft | Standard Size 16 X 24 Inch | White| (1),DRIS,0,0,0,199,3.3,10,60,"Monday, February 14",1,10
352,B09B2C5Z5J,"FEXNIO Bed Pillow l Washable Pillow for Bed l Pillows l Two Piece Pillow ( 40x60 cm, White )",FEXNIO,0,0,0,499,0,0,55,"Tuesday, February 15",0,"₹499
₹1,099 Save ₹600 (55%)"
353,B08LBD9W9J,"SOHO Wedge Foam Pillow for Sleeping, Reading, Working, Rest or Elevation Breathable and Washable Cover (Grey, White)",SOHO,0,0,0,"2,629",4.3,148,56,"Tuesday, February 15",1,148
354,B08YZ23RN5,"Gowri Tex Soft Microfiber Pillow, 17 x 27 inch, Multicolor Pack of 1",Gowri,0,0,0,249,5.0,1,79,"Thursday, February 17",0,1
355,B09NVWT15T,Trova Fashion Store Cotton Filled with Microfibre & Polyster Ultra Soft Blue Star Printed Bed Pillow Sets ( Pack of 6 ),Trova,0,0,0,699,1.0,1,46,"Sunday, February 13",1,1
356,B08BWW56LT,"Homy Decor Bombay Dyeing Polyester Pillow (17 x 27 inch, White) - Pack of 2",Homy,1,0,0,749,3.9,54,35,"Thursday, February 17",1,54
357,B08BRRJM11,"SKYLINA Cotton Sleep Star Pillows for Sleeping, Hotel Quality Bed Pillow King Size, Down Alternative Hypoallergenic Pillow with Ultra Soft Fiber Fill (White, 18x27 Inch, Single)",SKYLINA,1,0,0,"1,699",0,0,43,"Sunday, February 13",1,"₹1,699
₹2,999 Save ₹1,300 (43%)"
358,B09MTVFRY3,Sleepsia Bamboo Pillow (Queen) - Shredded Memory Foam Pillow for Sleeping with Washable Pillow Cover - (Adjustable Size - 28”X17”) (Pack of 1),Sleepsia,1,0,0,"1,699",4.3,219,66,"Sunday, February 13",1,219
359,B09NNLRP2S,"Kurl-On Knitted Fabric Premium Compressed Bamboo Pillow ,68 x 43 x 5 cm, Cream Color,1 Pieces",Kurl-On,1,0,0,699,0,0,0,"Monday, February 14",1,₹699
360,B0933NFJ88,"VG MATTRESS-Organic Silk Cotton/kapok/Ilavam Sleeping Soft White Striped Classic Pillows, Size 27"" X 17"" inches (OFFWHITE, 1)",VG,1,0,0,750,4.0,1,52,"Monday, February 14",1,1
361,B08V53S7J5,"SleepyCat 2-Piece Microfiber Cloud Pillow with Adjustable Zipper (32x20 inches, White)",SleepyCat,1,0,0,"2,191",4.3,632,26,,1,632
362,B096YD5XZR,"Homerz Premium Hotel Quality Super King Size Pillow, 20 x 30 Inch Exact Size, Superior White Cotton Polyester Fabric (4)",Homerz,1,0,0,"1,499",3.8,139,17,"Tuesday, February 15",1,139
363,B093QFY959,VG MATTRESS-Organic Silk Cotton/Semal/Ilavam Panju/Kapok Natural Orthopedic Contouring Sleeping Pillow(20 X 25 inches) Standard Size White (Pack of 2 Pillows ),VG,1,0,0,"2,400",0,0,52,"Monday, February 14",1,"₹2,400
₹4,999 Save ₹2,599 (52%)"
364,B072LNS9JN,"AVI Microfiber Pillow, 20 Inch X 36 Inch, White, 2 Pieces",AVI,0,0,0,799,3.7,57,60,"Sunday, February 13",1,57
365,B099C5W9M7,"Sofrest Premium Bombay Dyeing Luxury Hotel Collections Reliance Fiber Soft Pillow (17 X 27 Inch, White) -Set of 2 Pieces",Sofrest,0,0,0,"1,329",4.0,60,47,"Sunday, February 13",1,60
366,B097YGV4G7,JY Microfiber Satin Stripe Fabric Bed Pillow for Sleeping 16''x 24'' White Set of 2,JY,0,0,0,379,4.0,66,62,,0,66
367,B09BLG7RB4,"Habitat Bed Dylan Pillows for Sleeping King Size Pillow 20 x 36 Inch Set of 2, Hollow conjugated Pillow Home & Hotel Collection Fluffy Pillows Soft, 2 Pack-White",Habitat,0,0,0,769,4.0,8,68,"Tuesday, February 15",0,8
368,B07WK2LD17,"SWEETSAGA Sleeprich Vacuum Packed Microfiber Pillows (16x24 Inch, Standard Size, White) - Pack of 2",SWEETSAGA,0,0,0,439,3.6,13,71,"Monday, February 14",1,13
369,B08Q8JHCQP,"Morning Owl Soft Latex Pillow, Contour Pillow, eco-INSTITUT Certified 100% Natural Latex Pillow, Rubber Pillow, Best Pillow for Sleeping (58*38* 8 cm/10 cm), 1 Pillow",Morning,0,0,0,"1,755",4.2,58,41,"Sunday, February 20",1,58
370,B09NC1P2VY,"Momsyard High Premium Hollow Fibre Quilt Pillow (17x 27, White ) - 1 Piece Extra Soft Pillow",Momsyard,0,0,0,399,0,0,60,"Monday, February 14",1,"₹399
₹999 Save ₹600 (60%)"
371,B093LQF5VS,KPS Combo of Premium Comfort Micro Fiber Filled Pillow for Bedroom ( White) (Set of 2),KPS,0,0,0,0,4.2,28,0,,0,28
372,B08ZSSGM8T,"Urban Basics Hotel Quality Super Soft Clean Microfiber Premium Sleeping Pillow King Size 20 x 30 Inches (White, Set of 3 Pcs)",Urban,0,0,0,"1,299",4.1,230,38,"Sunday, February 13",1,230
373,B08YMWDQKW,"REGIUS Hollow Microfibre Pillow, Set of 2, 16x26 Inches, White",REGIUS,0,0,0,459,3.5,14,54,"Monday, February 14",1,14
374,B08916ZHLS,"duroflex Fibre Pillows, 69 X 43 cm, White",duroflex,0,0,0,649,5.0,2,10,"Tuesday, February 15",0,2
375,B09GMBHYPV,"Microfiber Pillow, takiya Set of 2 Chacked Sage Pillow | Takiya | Bed Pillow for Sleeping & Neck Pain Relief for Back Sleeper, Side Sleeper & Stomach Sleeper for Living Room - 16 x 24 Inch Size Pillow",Microfiber,0,0,0,599,4.2,40,14,"Saturday, February 12",1,40
376,B08P7M4JWB,DOCTOR REST Hollow Microfibre Fiber Bed Pillow Set of 5 16x24 Inch White,DOCTOR,0,0,0,"1,099",3.8,93,45,"Monday, February 14",1,93
377,B08WJGKNH1,"GPGP Pure Semal Cotton Pillows - Sleeping Pillows (Filled with Silk Cotton), White - Set of 2",GPGP,0,0,0,"1,999",3.8,7,0,"Tuesday, February 15",0,7
378,B0851LZGJK,"flo Extra Support Adjustable Polyester Aloe Vera Gel Pillow with Washable Cover (White, 17"" x 27""), Set of 1",flo,0,0,0,890,4.0,108,10,"Monday, February 14",1,108
379,B097HKSPHZ,"MENICY Microfiber Light Weight Bolster Pillow Compliment for DEEWAN & Sofa - Set of 2 (White, 10'' x 25"")",MENICY,0,0,0,449,3.6,41,65,"Tuesday, February 15",0,41
380,B08G8RDN8Y,"MY ARMOR Orthopedic Memory Foam Pillow for Comfortable Sleep, Queen Size with Removable Outer Cover (23"" x 14"" x 4.5"")",MY,1,1,0,"1,450",4.1,"11,264",50,"Thursday, February 10",1,"11,264"
381,B08DP297RY,"MM FOAM Snuggle Pillow - 100% Natural Latex, High Bounceback, Hypoallergenic Thick Pillow -6"" (25.5 x 16.75 x 6 inches)",MM,1,0,0,"2,500",4.4,98,0,"Sunday, February 13",1,98
382,B09QD1FRD5,"Sleepsia Microfiber Bed Pillow for Sleeping - Down Alternative Ultrasoft Cotton Washable Pillow with Satin Gusset- Queen (Red, Pack of 2)",Sleepsia,1,0,0,"2,250",4.5,60,62,"Sunday, February 13",1,60
383,B08CCT13ST,"HOMY DECOR Microfiber Pillow, 27 x 17 Inch, Grey, Pack of 2",HOMY,1,0,0,849,4.1,411,58,"Thursday, February 17",1,411
384,B09B5FGCYZ,"JY Ultra Soft Fluffy Luxurious Satin Hug Body Pillows Set (White, 26 x 16) - Pack of 02",JY,0,0,0,349,3.8,10,56,,0,10
385,B09NL2ST5Y,Krishna Sales & Marketing Microfibre & Polyster Ultra Soft SquareWhite Pillow Sets _43 cm X 68 cm (2 Piece),Krishna,0,0,0,299,0,0,40,"Sunday, February 13",0,"₹299
₹499 Save ₹200 (40%)"
386,B089K2Y25G,"JDX 200 TC Polyester Fibre Solid Sleeping Pillow (Set of 2, White)…",JDX,1,0,0,299,3.8,235,70,"Tuesday, February 15",0,235
387,B093QG5WS5,"VG MATTRESS Organic Silk Cotton/Kapok/Ilavam panju Soft Sleeping Classic Pillows (White, 27"" X 17"" inches)",VG,1,0,0,800,3.9,10,50,"Monday, February 14",1,10
388,B09RKH33Q5,"Sleepsia Supersoft Kids Pillows - 12"" X 18"" Breathable Bamboo Pillows for Sleeping - Ultra Supportive Microfiber Premium Fill Toddler Pillows, White",Sleepsia,1,0,0,499,0,0,75,"Sunday, February 13",1,"₹499
₹1,999 Save ₹1,500 (75%)"
389,B08R428VPR,"NIVEDHA MATTRESS Silk Cotton with Vetiver, Ramacham, Khus Fiber Bed Pillow (25 x 15 inches)",NIVEDHA,1,0,0,700,3.4,9,53,"Monday, February 14",1,9
