,asin,title,brand,Sponsored,Best Seller,Amazon's Choice,Price,Rating,NoofRatings,Discount,Delivery,Prime Delivery,base
0,B095H3NYGW,"QUARANT 3 Ply Protective Surgical Face Mask, ISI, BIS, CE & ISO Certified, Melt Blown - SMMS Layer Fabric Disposable Masks with Adjustable Nose Pin (Blue, Without Valve, Pack of 100) for Unisex",QUARANT,1,0,0,399,4.3,"7,082",67,"Thursday, February 10",0,"7,082"
1,B09988CJSJ,"Careview 3 Ply Disposable Surgical Face Mask Box with FABRIC Earloop and built in Nose Pin, Certified by BFE>99% and PFE > 95%, SITRA, DRDO, ISO and CE (Pack of 100, WHITE)",Careview,1,0,0,508,4.0,"3,751",66,"Thursday, February 10",1,"3,751"
2,B09523WDF3,"QUARANT 3 Ply Disposable Surgical Face Mask, UV Sterilized, ISI, BIS, CE & ISO Certified, ASTM Level 3, Meltblown Layer Fabric Masks with Adjustable Nose Pin (Blue, Without Valve, Pack of 100) for Unisex",QUARANT,1,0,0,569,4.4,"2,518",64,"Thursday, February 10",1,"2,518"
3,B089S6347T,"Bildos 3Ply Non-Woven Fabric Disposable Surgical Dust Mask With Nose Clip (Blue, Without Valve, Pack of 100) for Unisex",Bildos,1,0,0,269,3.8,"15,259",73,"Saturday, February 12",0,"15,259"
4,B09HZYQVFG,MEDICOS Unisex Nonwoven Fabric Surgical Disposable Masks 3 Ply Layer with Nose Clip Meltblown Ultrasonic Use Without Valve and Throw Masks Pin Certified by CE ISO GMP Best for Men Women,MEDICOS,0,0,0,49,3.7,270,51,,1,270
5,B097DLV7V4,"Bildos® Non-Woven Fabric 3 Layer Disposable Surgical Face Mask With Nose Clip CE, GMP & ISO Certified Masks",Bildos®,0,1,0,269,3.7,"7,135",73,"Saturday, February 12",0,"7,135"
6,B08BTRHF78,"SISO Unisex ISI Mark/BIS Certified N95 5 Layer Face Mask FFP2 (White, Pack of 10)",SISO,0,1,0,285,4.1,"4,111",76,,0,"4,111"
7,B097HPRNNC,Bildos Cotton & Khadi Unisex Without valve Reusable Super Breathable Fabric Cloth Face mask with Adjustable Ear Loop (Multicolour) - Pack of 12,Bildos,0,0,0,330,4.2,"10,485",67,"Saturday, February 12",0,"10,485"
8,B089S6347T,"Bildos 3Ply Non-Woven Fabric Disposable Surgical Dust Mask With Nose Clip (Blue, Without Valve, Pack of 100) for Unisex",Bildos,0,0,0,269,3.8,"15,259",73,"Saturday, February 12",0,"15,259"
9,B08B1TVYT1,"Asgard Melt-Blown Fabric Disposable 3 Ply Surgical Mask (Blue, Without Valve, Pack of 100) for Unisex",Asgard,0,1,0,399,4.1,"30,449",60,"Thursday, February 10",0,"30,449"
10,B096NQWLZR,"Lee Cooper Cotton Washable and Reusable Face Mask (Multicolour, Without Valve, Pack of 3) for Unisex-Adult",Lee,0,0,0,299,3.8,"3,954",50,"Thursday, February 10",0,"3,954"
11,B08DD8NMF8,Jockey Unisex's Cotton Face Mask (Pack of 2),Jockey,0,1,0,269,4.4,"48,872",0,,0,"48,872"
12,B09QD41X98,"Elemensis face mask 3 Layer With Nose Clip, 3ply disposable mask, surgical mask pack of 100 face mask for men, women.",Elemensis,0,0,0,249,4.6,16,50,,0,16
13,B095H3NYGW,"QUARANT 3 Ply Protective Surgical Face Mask, ISI, BIS, CE & ISO Certified, Melt Blown - SMMS Layer Fabric Disposable Masks with Adjustable Nose Pin (Blue, Without Valve, Pack of 100) for Unisex",QUARANT,0,0,0,399,4.3,"7,082",67,"Thursday, February 10",0,"7,082"
14,B08NK7CCNK,AeroGrid FFP2 | Pack of 10 | 6 Layers | BIS Certified | Premium N95 Adjustable Head Loop Mask for Unisex,AeroGrid,0,0,0,249,4.1,"1,382",83,"Sunday, February 13",0,"1,382"
15,B09B9KKZFC,"Diligent-We Care For Your Life® 3Ply Non-Woven Ultrasonically Sealed With Nose Pin and Soft Earloop Disposable FDA,ISO,WHO-GMP,CE Certified Three Layer Pharmaceutical Breathable Surgical Pollution Face Mask For All Men, Women, Kids (Black-Blue-White)",Diligent-We,0,0,0,159,4.0,513,54,,1,513
16,B09QKVZ7HY,"PENADIA Cotton Cloth Face Mask For Men And Woman, Reusable Washable Super Breathable Fabric Stylish With Adjustable Ear loop Pack Of 6",PENADIA,0,0,0,279,4.8,27,72,,0,27
17,B08BFXSM4B,Boldfit N95 face mask for men and women (Pack of 5) N95 mask PM 0.3 Filtration BIS Approved Masks N95 Masks Reusable and Comfortable for protection from Pollution,Boldfit,0,1,0,351,4.1,"16,192",53,"Thursday, February 10",0,"16,192"
18,B09BZR8YN9,"3M 9513 Respirator KN95 with Comfortable 3D Design & 3M™ Advanced Electrostatic Media certified to filter at least 95% airborne particulates and allergens (Face Mask, 5 Units, White)",3M,0,0,0,495,4.4,"1,194",10,"Thursday, February 10",0,"1,194"
19,B098JQM8PR,"Dentostar Comfit 3D 4 Layers Face Mask with 2 Melt-Blown Filter & Softest Ear Loops, 25 Pcs/Pack, (Pack of 4) 100 pcs",Dentostar,0,0,0,689,4.0,162,47,"Tuesday, February 15",0,162
20,B092ZW2N8F,"Romsons FFP1 Certified Disposable Respirator (White, Melt-Blown Filter, 50 Pcs) for Unisex",Romsons,1,0,0,409,4.3,"1,566",61,,1,"1,566"
21,B09K5CBBHN,"Frido ULTIMATE and ULTIMATE PRO Copper Masks with Adjustable Ear Loops. Copper Treated Layer, Breathable and Washable Fabric, Made in South Korea.",Frido,1,0,0,699,4.5,393,42,,1,393
22,B08P7JFGPK,OxiClear N99 Anti Pollution Face Mask with 4 Activated Carbon Filters & Detachable Headband D.R.D.O Certified (NO-VALVE) (Black),OxiClear,1,0,0,399,4.2,"4,171",20,"Thursday, February 10",0,"4,171"
23,B08B1W5QN5,"Asgard Melt-Blown Fabric Disposable Face Mask with Nose Clip (Blue, Without Valve, Pack of 50) for Unisex",Asgard,1,1,0,249,4.1,"30,449",50,"Thursday, February 10",0,"30,449"
24,B098DXG5S6,Prayati Polypropylene Disposable 3 ply layer with nose clip Meltblown Ultrasonic Surgical mask for Men and Women Pin Certified by CE ISO GMP (Black) - pack of 50 pieces,Prayati,0,0,0,198,3.9,324,60,,1,324
25,B08QVR7MKF,AeroGrid 3 Ply Protective Surgical Face Mask with Built-in Nose Pin and Headband Converter Strips (Pack of 50),AeroGrid,0,0,0,140,4.0,67,72,"Friday, February 18",1,67
26,B098LGVWWB,"DEEJET Non-Woven Fabric 3 Ply Disposable Surgical Face Mask Protective Layer for Men and Women | Use and Throw Face Masks (Black, Pack of 50, Without Valve)",DEEJET,0,0,0,189,3.9,377,62,"Monday, February 14",1,377
27,B08S6S7SWW,"Medinain 3 Ply Disposable With Adjustable Nose Pin, 95%Particle Filtration Efficiency (PEE), CE and ISO and WHOGMP Certified Pharmaceutical Surgical Face Masks",Medinain,0,0,0,299,4.2,"1,580",50,,0,"1,580"
28,B098XN3C4G,"Indiana as offered by nature Unisex Non-Woven Fabric 3 Ply Disposable Surgical Mask with Nose Pin, Ultrasonic Soft Loops Without Valve - Blue - Pack of 100",Indiana,0,0,0,185,4.4,"1,426",38,,0,"1,426"
29,B09MVQK2P8,Risezag Black Pink Surgical Mask Pack of 100 Pieces Disposable Masks 3 ply layer with nose clip Meltblown Use and Throw Masks Pack of 100 Pcs Pin 3 Ply Comfortable Fabric Pink Kid Face Mask Earloop.,Risezag,0,0,0,249,4.5,56,79,,1,56
30,B09CLDBSTH,"QUARANT 3 Ply Black Surgical Face Mask, ISI, BIS, CE & ISO Certified, Melt Blown - SMMS Layer Fabric Disposable Masks with Adjustable Nose Pin (Black, Without Valve, Pack of 100) for Unisex",QUARANT,0,0,0,399,4.3,833,67,,0,833
31,B09CL93C3Y,"Careview Kids N95 Face Mask (Pack of 5 + 1 Free), MIX Colors,5 Layered Filtration, DRDO, BIS (ISI),CE Certified, Ear Loop Style, MULTICOLOR (KIDS-N95-MASK)",Careview,0,0,0,362,4.1,949,27,"Thursday, February 10",0,949
32,B09QQQG1CT,Bildos Unisex Dark Colored Pure Cotton Mask With Adjustable Earloop - Pack of 12,Bildos,0,0,1,349,4.2,4,65,,0,4
33,B09FSRNG28,7Shield Non-Woven Fabric disposable Surgical 3Ply Unisex mask With Soft fabric ear loop for extra comfort Blue Surgical mask With Inbuilt Plastic Nose pin and CE and ISO Certified mask (Blue),7Shield,0,0,0,299,4.2,278,70,,1,278
34,B08H5L4NMF,"Sassoon BIS Approved N95 Face Mask Combo (Unisex, Multicolor) - Cotton Reuseable & Washable Mask with 5 Layer Protection (Available in Pack of 5 & 10)",Sassoon,0,1,0,495,3.9,"5,435",83,"Thursday, February 10",0,"5,435"
35,B09HKRZ49C,"Control D 3 layered / 3 ply Breathable Surgical Face masks Anti Pollution with Internal Nose-pin Ultra Soft Ultrasonically Welded Earloops, Disposable Masks (Blue, Free Size, Pack of 100)",Control,0,0,0,199,3.8,233,80,"Monday, February 14",0,233
36,B096B99BDW,"CARE VIEW 3 Ply Disposable Surgical Face Mask Box with FABRIC Earloop and built in Nose Pin, Certified by BFE>99% and PFE > 95%, SITRA, DRDO, ISO and CE (Pack of 100, BLUE)",CARE,0,0,0,499,4.0,"3,751",67,"Sunday, February 13",1,"3,751"
37,B09KRWPG2V,"OxiClear Mash Face Mask, 3-Layer with NanoFilter (Pack of 5)",OxiClear,0,0,0,299,4.1,359,40,,1,359
38,B09MVRT6RP,"Risezag Pack of 100 3 Ply Printed Designer Masks for Women and Men Surgical Protective disposable Face Mask Pharmaceutical Men Meltblown Printed Disposable Masks with Nose Pin BFE>98% PFE>95% ISI,ISO",Risezag,0,0,0,249,4.1,41,77,,1,41
39,B09PZ5G5FC,PENADIA Cloth Masks for Men And Women Pure Cotton Washable Stylish Face Cover With Adjustable Ear loop (Pack of 12)(Multi Colour),PENADIA,0,0,0,399,4.8,100,73,,0,100
40,B09HKDJSC4,"Kinematic KF94 Mask Fish Shape Korean Mask 5 Layer With Melt-Blown Reusable Anti-Pollution, Anti-Virus Breathable Face Mask with Nose Pin, Water Resistant, Reusable, Washable(Pack of 06)",Kinematic,0,0,0,249,3.6,20,50,"Monday, February 14",1,20
41,B09P7GSJQX,"[Pack of 10] Racklay Premium Black N95 Mask for Men & Women— Washable & Reusable Face Mask — 6 Layer mask DRDO, ISI Certified FFP2 Protection — Pollution Mask — Advanced Filtration — Black Mask",[Pack,0,0,0,284,3.8,33,72,,0,33
42,B09GFQ2SD6,"CareDone N95 Mask (unisex, pack of 20,) soft and comfortable Meltblown and Hot Air Cotton fabric Reusable Particulate Mask Anti Pollution,certified by ISO,FDA, CE, GMP, Daily Needs N95 Face Mask Ear Loop N95 Multi Color grey and medical blue.",CareDone,0,0,0,199,3.9,36,78,,1,36
43,B09MSDKL4Z,"Boldfit N95 Mask For Men & Women. 5 Layer PM 0.3 Filtaration N95 Mask For Protection From Pollution Approved By Bureau Of Indian Standards & ISO Standards - Pack Of 5 (Black), (KN9505Black)",Boldfit,0,0,0,420,4.5,294,44,"Sunday, February 13",0,294
44,B09NQ1Z766,7Shield Non-Woven Fabric disposable 3Ply Unisex mask With Black Soft fabric ear loop for extra comfort Black Surgical mask With Inbuilt Plastic Nose pin and CE and ISO Certified mask (Black),7Shield,0,0,0,309,3.9,96,69,,1,96
45,B08XYXW4QM,"Weldots Premium N95 Mask for Men & Women — Reusable Mask — KF94 Face Mask — 6 Layer DRDO, ISI (BIS) Certified FFP2 Protection — Head Loop Style — Grey",Weldots,0,1,0,319,3.8,"8,496",57,,0,"8,496"
46,B09P7GXPW7,"[Pack of 10] Racklay Premium N95 Mask for Men & Women— Washable & Reusable Face Mask — 6 Layer mask DRDO, ISI Certified FFP2 Protection — Pollution Mask — Advanced Filtration — Grey Mask",[Pack,0,0,0,284,3.9,28,72,,0,28
47,B09Q3DJPK4,"GM Cool 4-Way Stretch, Reuseable, Anti-Bacterial, Unisex Face Mask ( Pack of 4),Black, Navy blue, Grey, Blue,One size,GM-FM-BLACK-04",GM,0,0,0,349,0,0,12,"Tuesday, February 15",0,"₹349
₹396 Save ₹47 (12%)"
48,B09J8292Y3,HYDRISE (Pack of 10) (Black) Premium N95 Mask For Men and Women with Mask Adjuster - Washable mask - Reusable mask - Pollution Mask - Protection mask - ISO NIOSH approved - Advanced Filtration,HYDRISE,0,0,0,289,4.0,135,71,,1,135
49,B09JG63YQN,"VLSA Mask Surgical Face Mask with Nose Clip & Melt blown Protective layer with Dispenser Box, ISO, CE, GMP, FDA Certified, and Lab Tested, with (BFE) > 99%",VLSA,0,0,0,145,3.9,245,79,,1,245
50,B09KS4L1H4,"HEALTH SAFE Ultra Light Weight Surgical Face Mask (Blue,Pack of 100) (HS-SUR-MASK)",HEALTH,0,0,0,289,3.8,258,42,"Monday, February 14",0,258
51,B093H6BDNF,"Lee Cooper Lightweight Cotton Face Mask for Outdoor Protection, Super Breathable & Resuable Cloth, 2 Count",Lee,0,0,0,249,3.6,"1,884",38,"Thursday, February 10",0,"1,884"
52,B0966TS6FH,"DEEJET Meltblown Fabric Surgical Disposable Masks 3 Ply Layer with Nose Clip, Ultrasonic Use and Throw Masks, Certified by CE ISO GMP (Black, Without Valve, Pack of 100) for Men & Women",DEEJET,0,0,0,284,3.7,"3,526",84,"Monday, February 14",1,"3,526"
53,B08K3CPQSH,"Gear OXYMAX G95 Adult Unisex Reusable & Washable 6 Layer NABL Certified Outdoor Protection Face Mask (Pack of 3) Black, Dark Grey, Moroccan Blue",Gear,0,0,0,199,3.8,"1,019",56,,0,"1,019"
54,B09815RLDS,Sun LifeCare Multicolor N95 face mask (Pack of 10),Sun,0,0,0,220,4.4,3,45,"Sunday, February 13",0,3
55,B08HWLJ55J,"Mango People Non-Woven Fabric 3 Ply Ultrasonic Disposable Breathable Pollution Face Mask (Pink, Grey, Seafoam Green, Blue, Without Valve, Pack of 100, Free Size) for Unisex",Mango,0,0,0,229,3.8,"1,872",81,,0,"1,872"
56,B09N1HFJP5,Bildos Unisex Breathable Embroidery Designed Face Mask with Adjustable Ear Loop (Multicolour) - Pack of 12,Bildos,1,0,0,399,4.3,16,60,"Tuesday, February 15",0,16
57,B09QQQG1CT,Bildos Unisex Dark Colored Pure Cotton Mask With Adjustable Earloop - Pack of 12,Bildos,1,0,1,349,4.2,4,65,,0,4
58,B09C8QNDJY,"OxiClear N99 Handloom Linen Face Mask with 4 Activate Carbon Filters & Detachable Headband, DRDO Certified",OxiClear,1,0,0,299,3.9,297,25,,1,297
59,B09Q2472B5,"Bildos Embroidery Designed Face Mask With Adjustable Earloop For Women, Girls (Pack of 6)",Bildos,1,0,0,299,4.7,8,57,,0,8
60,B092L9QK6T,OCEAN RACE Cotton Anti Pollution 3 Layer Reusable Face Mask,OCEAN,1,0,0,499,4.2,627,38,,1,627
61,B08P7KF81W,OxiClear N99 Anti Pollution Face Mask with 4 Activated Carbon Filters & Detachable Headband D.R.D.O Certified (NO-VALVE) (Combat),OxiClear,1,0,0,399,4.2,"4,171",20,"Saturday, February 12",0,"4,171"
62,B0952CNC67,"QUARANT 4 Ply Designer Protective Surgical Face Mask with Dual Meltblown - SMMS Layer, BFE & PFE >99%, Disposable Fabric Masks with Adjustable Nose Pin, Fashion That's Safe (Camo Combo, Without Valve, Pack of 50) for Unisex",QUARANT,1,0,0,479,4.4,"3,192",52,"Thursday, February 10",0,"3,192"
63,B09PZ5G5FC,PENADIA Cloth Masks for Men And Women Pure Cotton Washable Stylish Face Cover With Adjustable Ear loop (Pack of 12)(Multi Colour),PENADIA,1,0,0,399,4.8,100,73,,0,100
64,B09NL4G4L9,"Diligent-We Care For Your Life® budget-friendly 100 pcs 3Ply surgical mask pack of 100 masks For All Men,Women,Kids (Black-white-blue-pink-Grey-Green)",Diligent-We,0,0,0,259,3.6,35,48,,1,35
65,B09K5TLBSK,"PITRESHWAR 3 PCS Black Face Mask Covers with Elastic Ear Loop Cover Full Face Anti-Dust, Unisex, Washable, Breathable, and Reusable",PITRESHWAR,0,0,0,199,4.0,1,88,,1,1
66,B09G3CMM2M,Maykaj Black Disposable Mask With Noes Clip And Smooth Straps 3Ply Surgical Disposable Mask Nonwoven Fabric Face Mask With Nose Clip And Smooth Straps Surgical 3 Ply Face Mask,Maykaj,0,0,0,159,3.8,129,68,,1,129
67,B08K38JRT4,"Gear OXYMAX G95 Adult Unisex Reusable & Washable 6 Layer NABL Certified Outdoor Protection Face Mask (Pack of 3) Black, Light Grey, Navy Blue",Gear,0,0,0,199,3.8,205,56,,0,205
68,B09LFBMDFM,Risezag Pink Surgical Masks For Women Pack of 100 Pieces 100 GSM Melt Blown Fabric 3 Layer Masks with Nose Clip 3 Ply Pink Face Masks Pollution Disposable Mask with Nose Clip 3 Layers Use and Throw,Risezag,0,0,0,249,3.9,26,77,,1,26
69,B097B9TM1W,3 PLY MASK PACK OF 100 PCS ULTRASONIC WITH NOSEWIRE CERTIFIED BY CE AND ISO,3,0,0,0,119,3.1,36,88,"Wednesday, February 16",0,36
70,B08K3FB46M,"Gear OXYMAX G95 Adult Unisex Reusable & Washable 6 Layer NABL Certified Outdoor Protection Face Mask (Pack of 5) Black, Light Grey, Dark Grey",Gear,0,0,0,349,3.7,104,53,,0,104
71,B08CMLBHJJ,"Daluci Anti Pollution N95 Reusable Unisex Face Mask, Ear Loop Style (Pack of 10) Protective Fold Flat Mask With 5 Layered Filtration",Daluci,0,0,0,299,4.0,"8,380",77,"Thursday, February 10",0,"8,380"
72,B09P5LLS4F,Wisezag Dotted Black Surgical Mask Pack of 100 Pieces Disposable Masks 3 ply layer with nose clip Meltblown Ultrasonic Use and Throw Masks Pack of 100 Pcs Pin 3Ply Comfortable Fabric Face Mask,Wisezag,0,0,0,248,5.0,3,79,,0,3
73,B09LTBFN5H,Risezag Printed Masks for Women Surgical 3 Layer Masks with Nose Clip Surgical Masks For Women White Disposable Pack of 100 Pieces 3 Ply Face Masks with Nose Clip 3 Layers Disposable Use and Throw,Risezag,0,0,0,247,3.7,34,78,,1,34
74,B09711VCC5,VORA VENTURES™|(Pack of 10)| KF94 3D Face Mask Washable & Reusable Premium Fish Willow Shape | Breathable High Filtration | Comfortable Earloop & Inbuilt Nosepin | Anti Pollution 4 Layer Mask | ISO CE FDA Certified Mask for Unisex,VORA,0,0,0,399,4.0,89,33,"Monday, February 14",1,89
75,B09P7FZWL4,"[Pack of 5] Racklay Premium Black N95 Mask for Men & Women— Washable & Reusable Face Mask — 6 Layer mask DRDO, ISI Certified FFP2 Protection — Pollution Mask — Advanced Filtration — Black Mask",[Pack,0,0,0,189,3.8,46,62,,0,46
76,B09MW1Y1M8,DIPZON VILLA Surgical mask pack of 100 pieces Disposable Masks 3 ply layer with nose clip Meltblown Ultrasonic Use and Throw Masks Certified by CE ISO GMP Best for Men Women(100-black),DIPZON,0,0,0,299,3.4,55,70,,1,55
77,B08HDR7NQ1,"Savlon Mask | BIS Certified FFP2 S Mask For Men and Women (Comparable to N95) | Earloop | Pack Of 4, (Product may slightly vary in color (White/Grey))",Savlon,0,0,0,273,4.3,"5,348",24,,0,"5,348"
78,B09GRJSN57,"WELLSTAR 3Ply Disposable Face Masks (Pack of 100-25 Each Color) Export Quality Non Woven Multicolor Combo Fabric Mask Pack of 100-25 Each Color Yellow, Orange, Green, Pink",WELLSTAR,0,0,0,239,4.2,19,76,,1,19
79,B09GR7VX22,"WELLSTAR 3Ply Disposable Face Masks (Pack of 100-25 Each Color) Export Quality Non Woven Multicolor Combo Fabric Mask Pack of 100-20 Blue, Pink, White, Green, Black",WELLSTAR,0,0,0,239,3.7,8,78,,1,8
80,B09CLDBSTH,"QUARANT 3 Ply Black Surgical Face Mask, ISI, BIS, CE & ISO Certified, Melt Blown - SMMS Layer Fabric Disposable Masks with Adjustable Nose Pin (Black, Without Valve, Pack of 100) for Unisex",QUARANT,1,0,0,399,4.3,833,67,,0,833
81,B08SBJ3QG5,"NEEPRO – Cotton Face Mask for Men and Women, Reversible, Washable, Anti-Bacterial Mask with Adjustable Ear Loops, Nose Pin and Free Mask Adjuster Strap",NEEPRO,1,0,0,299,4.0,"2,279",50,,0,"2,279"
82,B08X7H2CXM,"OxiClear Handloom Linen Anti-Pollution Face Mask, 3-Layer Super Breathable, Washable & Reusable (Pack of 7)",OxiClear,1,0,0,499,4.2,"3,238",17,"Saturday, February 12",1,"3,238"
83,B0989G3GBK,VStar Cloth Face Mask for Men's and Women's Assorted,VStar,1,0,0,405,3.9,41,10,,0,41
84,B08CVSK3ZK,"Careview Anti Pollution Cotton N95 Reuseable Unisex Face Mask, Ear Loop Style (Pack of 10) Protective Fold Flat Mask with 6 Layered Filtration(With Head Mask Extender)",Careview,0,1,0,649,4.2,"11,008",66,"Monday, February 14",1,"11,008"
85,B08HQQLX4W,"Mango People Spandex disposable surgical mask for men and women with nose strips UV Sterilized, BFE & PFE >98%, ISI, BIS, CE & ISO Certified - pack of 100",Mango,0,0,0,229,3.8,234,81,,0,234
86,B094XNMNVC,SINGULAR N95 Face Mask Reusable and Washable Pack of 10 pcs Multicolor Combo Pack of Mixed Colors,SINGULAR,0,0,0,269,4.0,"1,344",73,,0,"1,344"
87,B09Q282L9M,The Midle Skool Akatsuki Itachi Trigram Printed Anime Face Mask,The,0,0,0,399,0,0,43,,1,"₹399
₹699 Save ₹300 (43%)"
88,B08K39T3HW,"Gear OXYMAX Plus G95+ Adult Unisex Reusable & Washable 6 Layer NABL Certified Outdoor Protection Face Mask with Smart Headband (Pack of 5) Black, Moroccan Blue, Navy Blue",Gear,0,0,0,399,4.2,"3,287",60,,0,"3,287"
89,B09MS6BN2Q,"Weston Unisex Non-Woven Fabric 3 Ply Disposable Surgical Mask with Nose Pin, Ultrasonic Soft Loops Without Valve - Blue",Weston,0,0,0,298,4.5,15,63,,0,15
90,B09DKHPVN1,"Careview 3 Dimensional Disposable Face Mask with 4 Layered Filtration, SITRA and BIS(ISI) certified & Incredibly Soft Spandex Non Woven Fabric Ear loop (MEDICAL BLUE, PACK OF 50) (CV 3D Face Mask)",Careview,0,0,0,538,3.8,"1,637",46,"Thursday, February 10",1,"1,637"
91,B09QK3LMZD,Aivety Surgical Mask Pack of 100 black mask for menं Use And Throw Masks Disposable Mask Pack of 100 3ply Meltblown Ultrasonic Certified by CE ISO GMP Comfortable Fit on Face Mask With Soft Earloops.,Aivety,0,0,0,289,5.0,3,64,,0,3
92,B092ZW2N8F,"Romsons FFP1 Certified Disposable Respirator (White, Melt-Blown Filter, 50 Pcs) for Unisex",Romsons,0,0,0,409,4.3,"1,566",61,,1,"1,566"
93,B097L84L43,"Savlon Mask, Adjustable Earloop Grey, BIS Certified FFP2 S Mask, comparable to N95, Pack of 4",Savlon,0,0,0,324,3.5,94,10,"Tuesday, February 15",1,94
94,B08L1QMR3X,"STAR WORK Face Mask Reusable Adjustable Washable Cotton Masks for Adult (6 Pcs, Fashion Flowers)",STAR,0,0,0,246,4.1,"7,435",51,,0,"7,435"
95,B092SLQ4Q3,"Venus V-4400 Flat Fold Respirator N95 Mask, Pack of 10 (Strap Color May Vary).",Venus,0,0,0,325,3.6,81,66,,1,81
96,B095KL3YPJ,"BIGXEN Barbie's Cloth Face Mask Reusable & Washable Pure Cotton Masks, Cute Cartoon Breathable Cloth Face Covering Full Mask (Multicolour, Without Valve, Pack of 10) for Kids Boy/Girls",BIGXEN,0,0,0,299,4.1,89,57,,1,89
97,B08LNL2DFH,"Daluci Nonwoven Fabric Disposable 3Ply Surgical Face Mask (Blue, Without Valve, Pack of 100) for Unisex",Daluci,0,0,0,259,3.7,"13,357",0,,0,"13,357"
98,B09M3RR39D,"DISPO GUARD DISPOSABLE FACE MASK ,NON WOVEN EARLOOPS (PACK OF 50) (1)",DISPO,0,0,0,234,3.1,8,53,,1,8
99,B09Q3NHHJS,"SIXSIGMA® Cotton Reusable Breathable Fabric Anti-Bacterial Embroidered Cloth Face Mask Combo with Adjustable Ear Loop for Women, Girls (Pack Of 8)",SIXSIGMA®,0,0,0,349,5.0,8,56,,1,8
100,B09QKSZ42M,HYDRISE (Pack of 12) (Grey) Premium N95 Mask For Men and Women with Mask Adjuster - Washable mask - Reusable mask - Pollution Mask - Protection mask - ISO NIOSH approved - Advanced Filtration,HYDRISE,0,0,0,299,5.0,1,70,,1,1
101,B09KLQJYT8,"OSIRIS 3Ply Non-Woven Fabric Disposable Surgical Dust Mask With Nose Clip, CE, ISO, GMP & FDA Certified Masks(Black,Without Valve, Pack of 100) for Unisex",OSIRIS,0,0,0,269,3.8,48,73,,0,48
102,B09MJ5SGZM,7SHIELD Kids Size Black dot printed Face Mask with Nose clip and soft fabric ear loop Mask 3 ply disposable filter protection breathable dust proof Water Resistant Surgical Mask,7SHIELD,0,0,0,299,3.6,41,70,,1,41
103,B096SWNPGL,"CENWELL ® Pure Cotton Reusable, Washable & Breathable Cloth Face Mask with Melt Blown Layer, Adjustable Ear Loop and Ear Saver Strap and Without Valve for Men & Women",CENWELL,0,0,0,349,4.3,"1,411",56,,0,"1,411"
104,B09D3PQ837,"HAKKU Head Loop 3D Cotton Reusable, Washable and Breathable Fabric Face Mask with Melt Blown Layer, Adjustable Ear Loop and Ear Saver Strap For Men and Women (Multicolor) - 5 Pieces",HAKKU,0,0,0,299,4.0,265,77,,1,265
105,B08GXZZJ7X,"Lioncrown 5-Layer N95 Reusable, Washable Health Anti-Viral, Bacterial Face Mask",Lioncrown,0,1,0,331,3.8,"2,542",87,"Thursday, February 10",0,"2,542"
106,B09JWWS75H,"CONTARE® Ultra Comfortable Washable and Reusable Face Mask, UV Protection and Antibacterial, Stretchable Material, Allergy Free and Splash Resistant Protective Face Cover (Pack Of 5)",CONTARE®,0,0,0,199,2.8,81,80,,0,81
107,B08WRPXWD2,"ASGARD Nonwoven Fabric Disposable 3 Ply Surgical Mask (Black, Without Valve, Pack of 100) for Unisex",ASGARD,0,0,0,399,4.2,"2,047",60,"Sunday, February 13",0,"2,047"
108,B08KY78X41,"CENWELL Reusable, Washable Designer Fabric Cotton 3D Printed 6 Layer Face Mask with Adjustable Earloop, Ear Saver Strap, Melt Blown and Without Valve Filter for Men & Women.",CENWELL,0,0,0,399,4.2,"6,946",60,"Thursday, February 10",0,"6,946"
109,B096Y3XMB1,"BIGXEN Kid's Cotton Digital Cartoon 3D Printed Reusable Cloth Face Mask without Valve (Assorted Colour, 3 To 8 Years, Pack of 5)",BIGXEN,0,0,0,229,4.2,185,71,,1,185
110,B09CMQH7G3,"Fclues Women And Men For Marriage Golden Function Mask, Wedding, Party, Casual, Safty Protection, Reusable, Free Size, Multicolor Tree Gold Ltpk ( Pack Of 2, Without Valve)",Fclues,0,0,0,299,4.4,37,70,,1,37
111,B09KPW3WZY,"Cenwell ®️ 3 Ply Surgical Face Mask, ISI, BIS, CE & ISO Certified Pharmaceutical Disposable Masks with Adjustable Nose Pin, Meltblown Filter & Ear Saver Strap",Cenwell,0,0,0,299,4.4,79,70,,0,79
112,B08CSHCZ2J,PUMA Face Mask II (Set of 2),PUMA,0,0,0,599,4.4,887,14,,1,887
113,B08F713X4T,"Medinain 3 Ply Disposable Built-IN Nose Pin, Particle Filtration Efficiency (PEE), CE and ISO and WHOGMP Certified Pharmaceutical Surgical Face Masks",Medinain,0,0,0,299,4.2,"6,167",75,,0,"6,167"
114,B091F5KMLY,"Romsons Dispo Guard 3 Ply Mask With Softest Ear Loops, 50Pcs/Pack (Pack of 3), 150 Pcs, Blue",Romsons,0,0,0,401,4.5,759,60,"Sunday, February 13",1,759
115,B08K37ZCXH,"Gear OXYMAX Plus G95+ Adult Unisex Reusable & Washable 6 Layer NABL Certified Outdoor Protection Face Mask with Smart Headband (Pack of 3) Black, Moroccan Blue, Navy Blue",Gear,0,0,0,249,4.2,599,62,,0,599
116,B09C8MXH4N,"OxiClear N99 Handloom Linen Face Mask with 4 Activate Carbon Filters & Detachable Headband, DRDO Certified",OxiClear,1,0,0,299,3.9,297,25,,1,297
117,B09K5CSWB1,"Frido ULTIMATE and ULTIMATE PRO Copper Masks with Adjustable Ear Loops. Copper Treated Layer, Breathable and Washable Fabric, Made in South Korea.",Frido,1,0,0,"1,299",4.5,393,41,,1,393
118,B099RZFF45,"Vandelay 3 Ply Surgical Mask with Ultra Soft Ear Loops - UV Sterilized - 3 Layer Face Masks (50 Units, Unisex, Blue)",Vandelay,1,0,0,449,4.4,759,44,,0,759
119,B08B1TVYT1,"Asgard Melt-Blown Fabric Disposable 3 Ply Surgical Mask (Blue, Without Valve, Pack of 100) for Unisex",Asgard,1,1,0,399,4.1,"30,449",60,"Thursday, February 10",0,"30,449"
120,B098159556,"QUARANT 4 Ply Designer Protective Surgical Face Mask with Dual Meltblown - SMMS Layer, BFE & PFE >99%, Disposable Fabric Masks with Adjustable Nose Pin, Fashion That's Safe (Mixed Combo, Without Valve, Pack of 50) for Unisex",QUARANT,1,0,0,499,4.4,"3,192",50,"Thursday, February 10",1,"3,192"
121,B0929H6PHR,OCEAN RACE Cotton Anti Pollution 3 Layer Reusable Face Mask,OCEAN,1,0,0,366,4.2,627,39,,0,627
122,B08P7JWJ5Q,OxiClear N99 Anti Pollution Face Mask with 4 Activated Carbon Filters & Detachable Headband D.R.D.O Certified (NO-VALVE) (Maroon),OxiClear,1,0,0,399,4.2,"4,171",20,"Saturday, February 12",0,"4,171"
123,B09J3V9234,"NEEPRO Cotton Face Mask for Men and Women, Reversible, Washable, Anti-Bacterial Mask with Adjustable Ear Loops, Nose Pin and Free Mask Adjuster Strap",NEEPRO,1,0,0,299,4.2,88,50,,0,88
