,asin,title,brand,Sponsored,Best Seller,Amazon's Choice,Price,Rating,NoofRatings,Discount,Delivery,Prime Delivery,base
0,B07T9FV9YP,Redgear Cloak Wired RGB Gaming Headphones with Microphone for PC,Redgear,1,0,0,999,4.1,"9,248",44,"Sunday, February 13",1,"9,248"
1,B09KC22C6J,"Redgear Cosmo Spectre Wired Gaming Headphone with 40mm Drivers,7 Color Breathing LEDs, Adjustable Headband, Over-Ear Design with Extra Soft Earmuffs, VOX Tech Mic with 3.5 MM Jack for PC(Black)",Redgear,1,0,0,999,3.9,29,50,"Sunday, February 13",1,29
2,B08D6G521Y,Ant Esports H530 Multi-Platform Pro RGB LED Wired Gaming Headset for PC/ PS4 / Xbox One/Nintendo Switch/Android/iOS - Black - Blue,Ant,0,0,0,999,3.7,"5,484",67,"Sunday, February 13",1,"5,484"
3,B07Y8LF4LK,"Cosmic Byte H11 Gaming Wired Over-ear Headset with Microphone (Black/Orange, Pack Of 1)",Cosmic,0,0,1,799,4.1,"5,475",0,"Sunday, February 13",1,"5,475"
4,B0859KTNZ8,"Cosmic Byte GS430 Gaming wired over ear Headphone, 7 Color RGB LED and Microphone for PC, PS5, Xbox, Mobiles, Tablets, Laptops (with mic,Black)",Cosmic,0,0,0,799,4.1,"9,110",0,"Sunday, February 13",1,"9,110"
5,B081Q85RTF,Ant Esports H520W World of Warships Edition Wired Gaming Headset for PC / PS4 / Xbox One/Nintendo Switch/Computer and Mobile - Black,Ant,0,0,0,549,3.7,"5,484",78,"Tuesday, February 15",1,"5,484"
6,B07T9FV9YP,Redgear Cloak Wired RGB Gaming Headphones with Microphone for PC,Redgear,0,0,0,999,4.1,"9,248",44,"Sunday, February 13",1,"9,248"
7,B08D5ZK45K,Ant Esports H530 Multi-Platform Pro RGB LED Wired Gaming Headset for PC/ PS4 / Xbox One/Nintendo Switch/Android/iOS – Black - Red,Ant,0,0,0,999,3.7,"5,484",67,"Sunday, February 13",1,"5,484"
8,B085DQ3ZLG,Cosmic Byte H11 Gaming Headset with Microphone (Black/Blue),Cosmic,0,0,0,799,4.1,"5,475",0,"Sunday, February 13",1,"5,475"
9,B07BB3PYD8,"HyperX Cloud Stinger Core - Gaming Headset for PlayStation 4 and PlayStation 5, Over-Ear Wired Headset with Mic, Passive Noise Cancelling, In-Line Audio Control, Black (HX-HSCSC-BK)",HyperX,0,0,0,"3,029",4.2,"12,460",37,"Tuesday, February 15",1,"12,460"
10,B083X24CFF,"JBL Quantum 100, Wired Over Ear Gaming Headphones with Detachable Mic for PC, Mobile, Laptop, PS4, Xbox, Nintendo Switch, VR (Black)",JBL,1,1,0,"2,285",4.0,"3,336",43,"Sunday, February 13",1,"3,336"
11,B09J57MGMC,"Noise Combat with Ultra Low Latency, ENC with Dual mic, Super-Fast Charging and Breathing LED Lights; Bluetooth Headset (Thunder Black)",Noise,1,0,0,"1,799",3.9,"14,296",55,"Sunday, February 13",1,"14,296"
12,B08WHTPNVZ,boAt Immortal IM-200 7.1 Wired Channel USB Gaming Headphone with RGB Breathing LEDs & 50mm Drivers (Active Black),boAt,0,0,0,"1,499",4.2,"1,184",70,"Sunday, February 13",1,"1,184"
13,B07Y8L2BTY,Cosmic Byte H11 Gaming wired over ear Headset with Microphone (Black/Purple),Cosmic,0,0,0,799,4.1,"5,475",0,"Sunday, February 13",1,"5,475"
14,B083X24VG9,"JBL Quantum 100, Wired Over Ear Gaming Headset with Detachable Mic for PC, Mobile, Laptop, PS4, Xbox, Nintendo Switch, VR (Blue)",JBL,0,0,0,"2,573",4.0,"1,948",36,"Sunday, February 13",1,"1,948"
15,B089K72JNW,"EKSA E900 Wired Stereo Gaming Headset-Over Ear Headphones with Noise Canceling Mic, Detachable Headset Compatible with PS4, PS5, Xbox One, PC, Mac, Laptop (Red)",EKSA,0,0,0,"2,350",4.2,"5,410",42,"Thursday, February 17",1,"5,410"
16,B09DZ295TQ,"Cosmic Byte Oberon 7.1 RGB Gaming Headset with Dual Input- USB and 3.5mm Jack, Detachable Microphone, 90° Rotatable Earcups (Black)",Cosmic,0,0,0,"1,499",3.9,348,50,"Tuesday, February 15",1,348
17,B083X24CFF,"JBL Quantum 100, Wired Over Ear Gaming Headphones with Detachable Mic for PC, Mobile, Laptop, PS4, Xbox, Nintendo Switch, VR (Black)",JBL,0,1,0,"2,285",4.0,"3,336",43,"Sunday, February 13",1,"3,336"
18,B07K6LWNFG,"EKSA E800 Wired Over Ear Gaming Headphones with Noise Cancelling Mic, 50mm Drivers & LED Light for PC, Mobile, Tablets, Laptop, PS4, PS5, Xbox One, Nintendo Switch, VR(Yellow)",EKSA,0,0,0,"1,599",4.1,"7,397",0,"Thursday, February 17",1,"7,397"
19,B079S811J3,"Redgear Cosmo 7.1 USB Wired Gaming Headphones with RGB LED Effect, Mic and in-line Controller for PC (Black)",Redgear,0,0,0,"1,790",4.4,"10,149",40,"Tuesday, February 15",1,"10,149"
20,B09DZ295TQ,"Cosmic Byte Oberon 7.1 RGB Gaming Headset with Dual Input- USB and 3.5mm Jack, Detachable Microphone, 90° Rotatable Earcups (Black)",Cosmic,1,0,0,"1,499",3.9,348,50,"Tuesday, February 15",1,348
21,B097TRBDZM,"Redgear Cosmo Nova Wired Gaming Headphone with 50mm Drivers, Over-Ear Design, Omnidirectional Mic for PC (Black)",Redgear,1,0,0,"1,099",3.9,77,45,"Sunday, February 13",1,77
22,B083Q6Q41G,"HyperX Cloud Stinger Core with in-line Audio Control Headphones for PC (HX-HSCSC2-BK/WW), Black",HyperX,1,0,0,"3,490",4.2,"11,308",24,"Tuesday, February 15",1,"11,308"
23,B089K72JNW,"EKSA E900 Wired Stereo Gaming Headset-Over Ear Headphones with Noise Canceling Mic, Detachable Headset Compatible with PS4, PS5, Xbox One, PC, Mac, Laptop (Red)",EKSA,1,0,0,"2,350",4.2,"5,410",42,"Thursday, February 17",1,"5,410"
24,B09NDJ34RS,Ant Esports H1100 Pro RGB Wired Over-Ear Gaming Headset for PC / PS4 / PS5 / Xbox One / Switch1 – Frost White,Ant,0,0,0,"1,249",3.8,204,69,"Sunday, February 13",1,204
25,B09FXBHYM6,"Ant Esports H560 RGB LED Gaming Headset for PC /PS5/ PS4 / Xbox One/Nintendo Switch, Mac, Over-Ear Headphones with Mic",Ant,0,0,0,849,3.8,204,58,"Wednesday, February 16",1,204
26,B09HR1H2J1,Cosmic Byte Titania RGB Gaming Headset with Flexible Microphone with Separate Audio and Mic Jack (Black),Cosmic,0,0,0,764,3.3,11,36,"Sunday, February 13",1,11
27,B07Y8JYRD1,"Cosmic Byte Equinox Europa 7.1 USB Dual Driver Gaming Wired Over-ear Headset with mic, Software, Spectra RGB LED and ENC Microphone (Black, Pack Of 1)",Cosmic,0,0,0,"2,436",4.1,"1,283",0,"Tuesday, February 15",1,"1,283"
28,B097RB53LM,"EKSA E900 Pro Gaming Headset Xbox One Headset with Virtual 7.1 Surround Sound, PS4 Headset Noise Cancelling Over Ear Headphones with Mic&LED Light, Compatible with PC, PS4, PS5, Xbox One Controller, Xbox_one, windows, playstation4 (Green)",EKSA,0,0,0,"2,779",4.1,"7,397",21,"Thursday, February 17",1,"7,397"
29,B08VJCYLHP,"EKSA T8 PS4 Headset Gaming Headphone with Noise Canceling Mic, Wired PC Headset with Surround Stereo Sound, Flame LED Light, Soft Memory Foam Earmuffs for PS4, PS5, PC, Xbox One, Laptop, Tablet, Mobile (Flame Red)",EKSA,0,0,0,"1,299",3.9,"1,448",38,"Wednesday, February 16",1,"1,448"
30,B088R9S84B,Redgear Cosmo 7.1 Wired On Ear Headphones with Mic (White),Redgear,0,0,0,"1,999",4.4,"10,149",33,"Sunday, February 13",1,"10,149"
31,B08WHS6QJ6,boAt Immortal IM-200 7.1 Channel Wired USB Gaming Headphone with RGB Breathing LEDs & 50mm Drivers (Furious Blue),boAt,0,0,0,"1,499",4.2,"1,184",70,"Sunday, February 13",1,"1,184"
32,B08HQW9SGP,HyperX Cloud Core 7.1 Wired Gaming Headphones with Mic Black,HyperX,1,0,0,"6,490",4.4,"1,929",24,"Sunday, February 13",1,"1,929"
33,B07415FCR1,Cosmic Byte Over the Ear Headsets with Mic & LED - G2000 Edition (Black/Red) Rubberized Texture,Cosmic,1,0,0,999,4.0,"1,005",39,"Sunday, February 13",1,"1,005"
34,B08LFNBNR3,"Nitho JANUS STEREO GAMING HEADSET PS5 THEMED, Compatible with PS4/PS5/Xbox One/XBOX series X/Switch/Phones",Nitho,0,0,0,979,3.9,340,0,"Tuesday, February 15",1,340
35,B07JLFFTY1,"Redragon H120 Wired Over-Ear Gaming Headset with Microphone and Volume Control for Mobiles/Smart Devices, PC and PS4 (Black)",Redragon,0,0,0,749,3.7,"2,210",24,"Thursday, February 17",1,"2,210"
36,B0947C585P,"Lenovo IdeaPad H100 Gaming Headset, 50mm Drivers, Stereo Over Ear Headphones, Padded Earcups, On-Board Volume Control, Noise Cancelling Mic, Light Weight, Designed for Work and Play - GXD1C67963",Lenovo,0,0,0,"1,899",4.2,344,60,"Sunday, February 13",1,344
37,B095XGCJYK,"boAt Immortal IM1000D Dual Channel Gaming Headphones with 7.1 Channel Surround Audio, Dolby Atmos, 50mm Drivers & RGB Breathing LEDs(Black Sabre)",boAt,0,0,0,"2,499",4.2,"1,318",58,"Sunday, February 13",1,"1,318"
38,B09DZP3QL2,"Cosmic Byte CB-EP-05 Gaming Earphone with Detachable Microphone for PC, PS4, Mobiles, Tablets (Black)",Cosmic,0,0,0,449,3.5,219,25,"Sunday, February 13",1,219
39,B08BZR2FDW,"Cosmic Byte CB-EP-03 Gaming Wired in-ear Earphone with mic for PC, PS4, Mobiles, Tablets (Black, Pack Of 1)",Cosmic,0,0,0,649,3.6,"1,778",0,"Tuesday, February 15",1,"1,778"
40,B0982GF5TP,"Cosmic Byte Equinox Orion 7.1 Surround RGB USB Gaming Headset for PC, PS4, PS5 (Black)",Cosmic,0,0,0,"2,038",4.1,23,0,"Tuesday, February 15",1,23
41,B00Z924M58,Kotion Each Wired Over the Ear Headsets with Mic & LED - G2000 Edition (Black/Blue),Kotion,0,0,0,"1,199",4.0,"3,351",0,"Sunday, February 13",1,PEGI Rating: Ages 7 and Over
42,B079S811J3,"Redgear Cosmo 7.1 USB Wired Gaming Headphones with RGB LED Effect, Mic and in-line Controller for PC (Black)",Redgear,1,0,0,"1,790",4.4,"10,149",40,"Tuesday, February 15",1,"10,149"
43,B0987Y1MBZ,"Logitech G335 Wired Lightweight Gaming Headset with Flip to Mute Microphone, 3.5mm Audio Jack, Memory Foam Earpads, Compatible with PC, Playstation, Xbox, Nintendo Switch (Black)",Logitech,1,0,0,"6,095",4.2,160,10,"Sunday, February 13",1,160
44,B07BB3PYD8,"HyperX Cloud Stinger Core - Gaming Headset for PlayStation 4 and PlayStation 5, Over-Ear Wired Headset with Mic, Passive Noise Cancelling, In-Line Audio Control, Black (HX-HSCSC-BK)",HyperX,1,0,0,"3,029",4.2,"12,460",37,"Tuesday, February 15",1,"12,460"
45,B08VJDFGFD,"EKSA T8 PS4 Headset Gaming Headphone with Noise Canceling Mic, Wired PC Headset with Surround Stereo Sound, Flame LED Light, Soft Memory Foam Earmuffs for PS4, PS5, PC, Xbox One, Laptop, Tablet, Mobile (Flame Blue)",EKSA,1,0,0,"1,299",3.9,"1,448",38,"Wednesday, February 16",1,"1,448"
46,B08TCCP2M6,"Zebronics Zeb-Rush Premium Gaming Headphone with 40mm Neodymium Drivers, RGB LED, Dual 3.5mm Jack, Single pin Converter, 2m Braided Cable, Padded Headband, Flexible mic and Soft Ear Cushions (Blue)",Zebronics,0,0,0,999,3.5,"1,309",60,"Sunday, February 13",1,"1,309"
47,B08TCB84ZX,"Zebronics Zeb-Rush Premium Gaming Headphone with 40mm Neodymium Drivers, RGB LED, Dual 3.5mm Jack, Single pin Converter, 2m Braided Cable, Padded Headband, Flexible mic and Soft Ear Cushions (Red)",Zebronics,0,0,0,999,3.5,"1,309",60,"Tuesday, February 15",1,"1,309"
48,B0741F2R51,"Cosmic Byte Over the Ear Wired Headsets with Mic & LED - G4000 Edition (Blue, Pack Of 1)",Cosmic,0,0,0,860,4.0,"6,157",28,"Sunday, February 13",1,"6,157"
49,B098758K67,"Cosmic Byte Equinox Phobos 7.1 RGB Dual Input USB/3.5mm Gaming Headset with Detachable Microphone for PC, Laptop, Mobiles, PS4, PS5, Xbox with Carrying case and Software (Black)",Cosmic,0,0,0,"3,449",3.9,160,0,"Sunday, February 13",1,160
50,B074123WSD,"Cosmic Byte GS410 Wired Over-ear Headphones with Mic and for PS5, PS4, Xbox One, Laptop, PC, iPhone and Android Phones (Black/Blue, Pack Of 1)",Cosmic,0,0,0,717,4.1,"18,767",32,"Sunday, February 13",1,"18,767"
51,B08RXYJD7P,(Renewed) Ant Esports HD RGB LED Gaming Headset (H530 - Black & Red),(Renewed),0,0,0,664,2.8,25,33,"Tuesday, February 15",1,25
52,B08KXXY44S,"Cosmic Byte GS430 Gaming Headphone, 7 Color RGB LED and Microphone for PC, PS5, Xbox, Mobiles, Tablets, Laptops (Red)",Cosmic,0,0,0,799,4.1,"9,110",0,"Sunday, February 13",1,"9,110"
53,B09H7SZQYC,"Cosmic Byte Uranus Gaming Headset with Flexible Microphone for PC, PS5, Xbox, Mobiles, Tablets, Laptops (Starling Purple)",Cosmic,0,0,0,884,4.0,35,38,"Sunday, February 13",1,35
54,B01LWN4BME,HyperX Cloud Stinger Wired Over Ear Gamming Headphones with Mic Black,HyperX,1,0,0,"4,450",4.2,"2,886",7,"Sunday, February 13",1,"2,886"
55,B09P1NFWZH,"Zebronics Zeb-Demon Gaming Headphone Stand with RGB LED, Dual USB Ports, 3.5mm Headphone Jack, ABS Material, 1.5 Meter USB Cable, Anti-Skid Bottom Grip and Compact Design",Zebronics,1,0,0,"1,634",4.8,17,59,"Sunday, February 13",1,17
56,B08D75R3Z1,"pTron Boom Ultima 4D Dual Driver, In Ear Gaming Wired Headphones with Mic, Volume Control & Passive Noise Cancelling Boom 3 Earphones - (Dark Blue)",pTron,0,0,0,399,3.6,"13,110",79,"Sunday, February 13",1,"13,110"
57,B07TJG47VD,Ant Esports H707 HD RGB Wired Gaming Headset | Noise Cancelling Over-Ear Headphones with Mic for PC / PS4 / Xbox One/Nintendo Switch/Mac,Ant,0,0,0,"1,249",3.7,"5,484",69,"Sunday, February 13",1,"5,484"
58,B08G1HPPST,"Cosmic Byte Stardust Headset with Flexible Mic for PS4, Xbox One, Laptop, PC, iPhone and Android Phones (Black/Red)",Cosmic,0,0,0,699,4.0,"4,248",39,"Tuesday, February 15",1,"4,248"
59,B09KC22C6J,"Redgear Cosmo Spectre Wired Gaming Headphone with 40mm Drivers,7 Color Breathing LEDs, Adjustable Headband, Over-Ear Design with Extra Soft Earmuffs, VOX Tech Mic with 3.5 MM Jack for PC(Black)",Redgear,0,0,0,999,3.9,29,50,"Sunday, February 13",1,29
60,B09H4BV59P,"Matlek Gaming Headphones with Adjustable Mic | Surround Sound | Deep Bass | Works with All Mobile Phones, PS5, PS4, Xbox One, Blue-Black (GH-16)",Matlek,0,0,0,599,4.0,76,39,"Sunday, February 13",1,76
61,B08RRRYNFT,(Renewed) Ant Esports HD RGB LED Gaming Headset (H520W Red),(Renewed),0,0,0,384,3.6,13,30,,0,13
62,B0966RSBCX,"Coconut Enigma GH1 Gaming Headphone with Flexible Mic Wired Over The Ear | RGB Gaming Headset for PC, PS4, Xbox One, Laptop (Black)",Coconut,0,0,0,"1,499",4.0,76,29,"Tuesday, February 15",1,76
63,B09P1LHNTH,"Zebronics Zeb-Blitz USB Gaming Headphone with Dolby Atmos, RGB LED, Windows Software, Simulated 7.1 Surround Sound, 2.4 Meter Braided Cable, Flexible mic, Padded Headband and Ear Cushions(White)",Zebronics,0,0,0,"2,111",4.4,27,65,"Sunday, February 13",1,27
64,B09J913ZWM,"Cosmic Byte Stardust Headset with Flexible Mic for PS4, Xbox One, Laptop, PC, iPhone and Android Phones (White)",Cosmic,1,0,0,699,4.0,"4,248",39,"Tuesday, February 15",1,"4,248"
65,B09HR1H2J1,Cosmic Byte Titania RGB Gaming Headset with Flexible Microphone with Separate Audio and Mic Jack (Black),Cosmic,1,0,0,764,3.3,11,36,"Sunday, February 13",1,11
66,B09P1LHNTH,"Zebronics Zeb-Blitz USB Gaming Headphone with Dolby Atmos, RGB LED, Windows Software, Simulated 7.1 Surround Sound, 2.4 Meter Braided Cable, Flexible mic, Padded Headband and Ear Cushions(White)",Zebronics,1,0,0,"2,111",4.4,27,65,"Sunday, February 13",1,27
67,B0859KTNZ8,"Cosmic Byte GS430 Gaming wired over ear Headphone, 7 Color RGB LED and Microphone for PC, PS5, Xbox, Mobiles, Tablets, Laptops (with mic,Black)",Cosmic,1,0,0,799,4.1,"9,110",0,"Sunday, February 13",1,"9,110"
68,B08L41W6B3,Ant Esports H1000 Pro RGB Wired Over-Ear Gaming Headset for PC / PS4 / PS5 / Xbox One / Switch1 - Black,Ant,0,0,0,"1,299",3.8,204,68,"Sunday, February 13",1,204
69,B01LWN4BME,HyperX Cloud Stinger Wired Over Ear Gamming Headphones with Mic Black,HyperX,0,0,0,"4,450",4.2,"2,886",7,"Sunday, February 13",1,"2,886"
70,B07VQHCKBL,"CLAW ONIKUMA K1B Stereo Gaming Headset with Mic, Controls and LED Light for PC, PS4, Xbox and Mobiles (Black/Red)",CLAW,0,0,0,899,3.9,198,40,"Thursday, February 17",1,198
71,B07TK68B8R,"PowerA FUSION Wired Stereo Gaming Headset with Mic for PlayStation 4 (PS4), Xbox One, X, Xbox One S, Xbox 360, Nintendo Switch, PC, Mac, VR, Android, and iOS, White",PowerA,0,0,0,808,3.9,124,0,"Tuesday, February 15",1,PEGI Rating: Ages 3 and Over
72,B08G1GHJ2X,"Cosmic Byte Stardust Headset with Flexible Mic for PS4, Xbox One, Laptop, PC, iPhone and Android Phones (Black/Blue)",Cosmic,0,0,0,699,4.0,"4,248",39,"Tuesday, February 15",1,"4,248"
73,B08PV67DZL,"iClever Headphones with Mic, Kid Headphone Rotatable Extendable Mic 94 dB Volume Safe Headset for Kids, Foldable Wired Headphone for Boys Headset for Online Class/PC/Tablet,Blue",iClever,0,0,0,"1,199",4.3,189,40,"Thursday, February 17",1,189
74,B097TRCZXM,Redgear Trident Wired Over Ear Headphones with Mic (Black),Redgear,0,0,0,"1,499",4.1,153,44,"Sunday, February 13",1,153
75,B0982FXN1Z,"Cosmic Byte Equinox Polaris 7.1 Surround RGB USB Gaming Headset for PC, PS4, PS5 (Black)",Cosmic,0,0,0,"2,689",4.2,120,0,"Thursday, February 17",1,120
76,B098758K67,"Cosmic Byte Equinox Phobos 7.1 RGB Dual Input USB/3.5mm Gaming Headset with Detachable Microphone for PC, Laptop, Mobiles, PS4, PS5, Xbox with Carrying case and Software (Black)",Cosmic,1,0,0,"3,449",3.9,160,0,"Sunday, February 13",1,160
77,B09FXBHYM6,"Ant Esports H560 RGB LED Gaming Headset for PC /PS5/ PS4 / Xbox One/Nintendo Switch, Mac, Over-Ear Headphones with Mic",Ant,1,0,0,849,3.8,204,58,"Wednesday, February 16",1,204
78,B08GHMD3LK,Ant Esports H520W World of Warships Edition Wired Over Ear Gaming Headset for PC / PS4 / Xbox One/Nintendo Switch/Computer and Mobile - Green,Ant,0,0,0,549,3.7,"5,484",78,"Wednesday, February 16",1,"5,484"
79,B097HHX828,"Lenovo Legion H200 Gaming Headset, 50mm Drivers, Breathable on-Ear earcup Cushions, Flip-to-Mute Mic Control, Lightweight, Unidirectional Noise Cancellation, Designed for Gaming, GXD1B87065",Lenovo,0,0,0,"2,649",4.0,430,58,"Tuesday, February 15",1,430
80,B07CH9JDKM,HP H100 Over-Ear Gaming Headset with Mic (Black),HP,0,0,0,849,3.9,309,15,"Sunday, February 13",1,309
81,B09H7S63L9,"Cosmic Byte Uranus Gaming Headset with Flexible Microphone for PC, PS5, Xbox, Mobiles, Tablets, Laptops (Orange Demon)",Cosmic,0,0,0,999,4.0,35,30,"Sunday, February 13",1,35
82,B08498BYVG,HP H150 Gaming Headset with Portable Plug-in Microphone(5YR85AA),HP,0,0,0,998,3.6,81,33,"Wednesday, February 16",1,81
83,B08KZVWDC6,"Amazon Brand - Eono USB PC Gaming Headphones- Surround Sound with Noise-Cancelling Boom mic, Stereo Sound Wired Over Ear Headphones with RGB Light for PC, Computer, Mac,PS5, PS4 Console,Laptop with 3.5mm jack",Amazon,0,0,0,999,3.8,233,50,"Wednesday, February 16",1,233
84,B07VBCCH8Z,Corsair HS35 Stereo Gaming Headset - Headphones Designed for PC and Mobile – Blue,Corsair,0,0,0,"3,009",4.1,"1,013",49,"Sunday, February 13",1,"1,013"
85,B08HQW9SGP,HyperX Cloud Core 7.1 Wired Gaming Headphones with Mic Black,HyperX,0,0,0,"6,490",4.4,"1,929",24,"Sunday, February 13",1,"1,929"
86,B0966RSBCX,"Coconut Enigma GH1 Gaming Headphone with Flexible Mic Wired Over The Ear | RGB Gaming Headset for PC, PS4, Xbox One, Laptop (Black)",Coconut,1,0,0,"1,499",4.0,76,29,"Tuesday, February 15",1,76
87,B08D6G521Y,Ant Esports H530 Multi-Platform Pro RGB LED Wired Gaming Headset for PC/ PS4 / Xbox One/Nintendo Switch/Android/iOS - Black - Blue,Ant,1,0,0,999,3.7,"5,484",67,"Sunday, February 13",1,"5,484"
88,B0982PQTXP,Cosmic Byte G1500 7.1 Channel USB Headset for PC with RGB LED Lights (Black/Red)&Minecraft Master Collection - Xbox One,Cosmic,1,0,0,"4,991",0,0,29,,1,"₹4,991
₹7,099 Save ₹2,108 (29%)"
89,B098JYS7SL,"OneOdio A71D PC Headsets with Microphone, Multifunctional Headset with Boom Mic Studio Headphones for Mac Laptop Office Zoom Conference, Wired Over Ear Headset with Volume Control for Gaming",OneOdio,1,0,0,"2,089",4.2,"3,467",37,"Wednesday, February 16",1,"3,467"
90,B08D5XFTQW,Ant Esports H520W World of Warships Edition Wired Over Ear Gaming Headset for PC / PS4 / Xbox One/Nintendo Switch/Computer and Mobile - Red,Ant,0,0,0,549,3.7,"5,484",78,"Tuesday, February 15",1,"5,484"
91,B07RMBB4HM,Razer Kraken X Multi-Platform Wired Gaming Headset with Bendable Cardioid Microphone - Black - RZ04-02890100-R3M1,Razer,0,0,0,"3,999",3.9,"19,594",23,"Tuesday, February 15",1,"19,594"
92,B09BNZLTDZ,"pTron Bassbuds Jade Gaming True Wireless Headphone with 40Hrs Total Playtime with Case, Low Latency, Deep Bass, BT5.0, Touch Control, Dual Mic, Passive Noise Cancellation & IPX4 Waterproof (Black)",pTron,0,1,0,"1,499",4.0,"5,023",59,"Sunday, February 13",1,"5,023"
93,B095XHFFDY,"boAt Immortal IM1000D Dual Channel Gaming Headphones with 7.1 Channel Surround Audio, Dolby Atmos, 50mm Drivers & RGB Breathing LEDs(White Sabre)",boAt,0,0,0,"2,499",4.2,"1,318",58,"Sunday, February 13",1,"1,318"
94,B09BMQBXZW,"Verilux® Gaming Headphone with Removable Cat Ears, Headphones with Mic for Girls Gift Gaming Headset for PS5, PS4, Xbox One (Adapter Not Included), Switch, PC, RGB LED Light & Noise Canceling Mic",Verilux®,0,0,0,"1,633",3.5,7,24,"Thursday, February 17",1,7
95,B098JYS7SL,"OneOdio A71D PC Headsets with Microphone, Multifunctional Headset with Boom Mic Studio Headphones for Mac Laptop Office Zoom Conference, Wired Over Ear Headset with Volume Control for Gaming",OneOdio,0,0,0,"2,089",4.2,"3,467",37,"Wednesday, February 16",1,"3,467"
96,B09BJYV134,"(Renewed) Logitech G335 Wired Gaming Headset, with Flip to Mute Microphone, 3.5mm Audio Jack, Memory Foam Earpads, Lightweight, Compatible with PC, Playstation, Xbox, Nintendo Switch - White",(Renewed),0,0,0,0,2.8,4,0,,0,4
97,B01M4S08T5,"Kotion Each GS410 Wired Over-Ear Headphones with Mic and for PS4, Xbox One, Laptop, PC, iPhone and Android Phones(Blue)",Kotion,0,0,0,712,4.0,"2,885",38,"Sunday, February 13",1,"2,885"
98,B085DQ3ZLG,Cosmic Byte H11 Gaming Headset with Microphone (Black/Blue),Cosmic,1,0,0,799,4.1,"5,475",0,"Sunday, February 13",1,"5,475"
99,B07Z8WK4PC,Corsair HS45-7.1 Wired Virtual Surround Sound PC Gaming Headset USB DAC Memory Foam Earcups (Black),Corsair,1,0,0,"3,999",4.1,"1,013",43,"Tuesday, February 15",0,"1,013"
100,B09P1KK9K1,"ZEBRONICS Zeb-Blitz USB Gaming Headphone with Dolby Atmos, RGB LED, Windows Software, Simulated 7.1 Surround Sound, 2.4 Meter Braided Cable, Flexible mic, Padded Headband and Ear Cushions(Black)",ZEBRONICS,0,0,0,"2,111",4.4,27,65,"Sunday, February 13",1,27
101,B07X8G7ZG5,"EKSA E3000 Gaming Headphones Wired with Stereo, Gaming Headset with Noise Cancelling Mic, LED Light, Over-Ear Headphones with for Mobile, Laptop, PC, PS4, Xbox One, PS5, PUBG (Dark Black)",EKSA,0,0,0,"1,899",4.1,"2,687",37,"Thursday, February 17",1,"2,687"
102,B07QD651MX,"Logitech G331 Wired Gaming Headset, 50 mm Audio Drivers, Rotating Leatherette Ear Cups, 3.5 mm Audio Jack, Flip-to-Mute Mic, Lightweight for PC, Mac, Xbox One, PS4, Nintendo Switch - Black",Logitech,0,0,0,"4,400",4.0,660,32,"Wednesday, February 16",1,660
103,B07K6M3GR4,"EKSA E800 Wired Over Ear Gaming Headphones with Noise Cancelling Mic, 50mm Drivers & LED Light for PC, Mobile, Tablets, Laptop, PS4, PS5, Xbox One, Nintendo Switch, VR(Blue)",EKSA,0,0,0,"1,799",4.1,"7,397",0,"Thursday, February 17",1,"7,397"
104,B09MLG1NCJ,"(Renewed) Ant Esports H560 RGB LED Gaming Headset for PC /PS5/ PS4 / Xbox One/Nintendo Switch, Mac, Over-Ear Headphones with Mic",(Renewed),0,0,0,629,3.0,1,25,"Wednesday, February 16",1,1
105,B08WHJ8NL9,boAt Immortal IM-200 7.1 Channel USB Gaming Headphone with RGB Breathing LEDs & 50mm Drivers(Raging Red),boAt,0,0,0,"1,499",4.2,"1,184",70,"Sunday, February 13",1,"1,184"
106,B07Z8WTTC3,"Corsair HS50 PRO Stereo Wired Gaming Headset Adjustable Memory Foam Ear Cups, Lightweight, Noise-Cancelling Detachable Microphone with PC, PS4, Xbox One, Switch and Mobile Compatibility (Carbon)",Corsair,0,0,0,"4,799",4.2,"1,850",30,"Sunday, February 13",1,"1,850"
107,B09GFYV9YJ,"Logitech G435 Lightspeed and Bluetooth Wireless Gaming Headset - Lightweight Over-Ear Headphones, Built-in mics, 18h Battery, Compatible with Dolby Atmos, PC, PS4, PS5, Mobile - Black",Logitech,0,0,0,"6,995",4.3,42,7,"Sunday, February 13",1,42
108,B09P1KK9K1,"ZEBRONICS Zeb-Blitz USB Gaming Headphone with Dolby Atmos, RGB LED, Windows Software, Simulated 7.1 Surround Sound, 2.4 Meter Braided Cable, Flexible mic, Padded Headband and Ear Cushions(Black)",ZEBRONICS,1,0,0,"2,111",4.4,27,65,"Sunday, February 13",1,27
109,B08D5ZK45K,Ant Esports H530 Multi-Platform Pro RGB LED Wired Gaming Headset for PC/ PS4 / Xbox One/Nintendo Switch/Android/iOS – Black - Red,Ant,1,0,0,999,3.7,"5,484",67,"Sunday, February 13",1,"5,484"
110,B07Y8JYRD1,"Cosmic Byte Equinox Europa 7.1 USB Dual Driver Gaming Wired Over-ear Headset with mic, Software, Spectra RGB LED and ENC Microphone (Black, Pack Of 1)",Cosmic,1,0,0,"2,436",4.1,"1,283",0,"Tuesday, February 15",1,"1,283"
111,B08VJCYLHP,"EKSA T8 PS4 Headset Gaming Headphone with Noise Canceling Mic, Wired PC Headset with Surround Stereo Sound, Flame LED Light, Soft Memory Foam Earmuffs for PS4, PS5, PC, Xbox One, Laptop, Tablet, Mobile (Flame Red)",EKSA,1,0,0,"1,299",3.9,"1,448",38,"Wednesday, February 16",1,"1,448"
112,B09HZFCB89,"WeCool Moonwalk M4 Gaming Earphones, 60 ms Low Latency Earbuds with Microphone, Stereo Sound Deep Bass Bluetooth Earbuds, 24 Hours Playtime, Auto Gaming Mode, Auto Pairing, Touch Control Earphones",WeCool,0,0,0,"1,399",4.2,"1,936",72,"Sunday, February 13",1,"1,936"
113,B088H19FRM,"Hunterspider Gaming Headset- PS4 Headset Xbox one Headset Gaming Headphone with Surround Sound, LED Light & Noise Canceling Microphone for PS4,PC,Mac,Xbox One(Adapter Not Included)",Hunterspider,0,0,0,"1,999",4.5,966,33,"Wednesday, February 16",1,966
114,B08HF514SL,"NiTHO JANUS STEREO GAMING HEADSET 7.1 SURROUND SOUND, Compatible with PC/PS4/Xbox One/Switch (USB Adapter Included)",NiTHO,0,0,0,499,3.4,14,0,"Thursday, February 17",1,14
115,B07413RMMP,"Cosmic Byte GS410 Headphones with Mic and for PS5, PS4, Xbox One, Laptop, PC, iPhone and Android Phones (Black/Red)",Cosmic,0,0,0,799,4.1,"18,767",24,"Sunday, February 13",1,"18,767"
116,B081D4XWWB,Cosmic Byte Spider Gaming Headphone with Microphone & LED for PC/PS4/Xbox/Mobiles/Tablets (Red),Cosmic,0,0,0,"1,139",4.0,"1,316",19,"Sunday, February 13",1,"1,316"
117,B0779SDX2R,Cosmic Byte G1500 7.1 Channel USB Headset for PC with RGB LED Lights and Vibration (Black/Red),Cosmic,0,0,0,"1,399",4.1,"1,429",0,"Sunday, February 13",1,"1,429"
118,B07GG2VNW9,"SteelSeries Arctis 5 | RGB Illumination | DTS Headphone: X v2.0 Surround | USB ChatMix Dial | Discord-Certified ClearCast Mic | PC, Playstation 5, PS4, Mobile - Black",SteelSeries,0,0,0,"8,999",4.5,"6,418",38,"Sunday, February 13",1,"6,418"
119,B0987XKJYL,"Logitech G335 Wired Lightweight Gaming Headset with Flip to Mute Microphone, 3.5mm Audio Jack, Memory Foam Earpads, Compatible with PC, Playstation, Xbox, Nintendo Switch (White)",Logitech,0,0,0,"6,095",4.2,160,10,"Sunday, February 13",1,160
