,asin,title,brand,Sponsored,Best Seller,Amazon's Choice,Price,Rating,NoofRatings,Discount,Delivery,Prime Delivery,base
241,B09PGDP1B3,"DigiReach® HDMI Cable 3 Meter 4K UHD - HDMI 2.0 - ARC - HDCP 2.2 - 4K 4:4:4 60FPS - HDR - 18Gbps - Gold Plated Connector - Premium HDMI for TV - Projectors -AVR - PS4 - PS5 - Apple TV - Bluray (4K UHD, 3 Meter) - (HD3-4K)",DigiReach®,0,0,0,592,5.0,1,52,"Monday, February 21",1,1
242,B0746T5YG4,Bigben SONY OFFICIAL HDMI 2.0 CABLE,Bigben,0,0,0,"1,187",4.3,44,0,"Sunday, February 20",1,PEGI Rating: Ages 3 and Over
243,B0060AU5MW,BlueRigger High Speed Micro HDMI to HDMI cable (NOT Micro-USB) with Ethernet (6 feet / 1.8 Meters),BlueRigger,0,0,0,633,4.2,"10,563",30,"Sunday, February 20",1,"10,563"
244,B099ZWCJM8,"XONTEN 3 in 1 HDMI Adapter 1080p, Type-C/Lightning/Micro USB to HDMI, MHL & Non MHL Phone to HDMI, Mirroring Phone to TV/Monitor /Projector Compatible with Android 9 & iOS 5 Above Versions",XONTEN,0,0,0,"1,699",3.9,118,32,"Monday, February 21",1,118
245,B08RMNFCWX,"CableCreation 8K 48Gbps Ultra High Speed HDMI Cable 6.6ft, 4K120 8K 60 144Hz eARC HDR HDCP 2.2 2.3 Compatible with PS5 PS4 Xbox Series X Roku TV 4K LG Samsung TV RTX 3080",CableCreation,0,0,0,"1,299",4.6,372,61,"Tuesday, February 22",1,372
246,B014I8SX4Y,"AmazonBasics High-Speed HDMI Cable, 6 Feet (2-Pack),Black",AmazonBasics,1,0,0,400,4.4,"310,967",71,"Sunday, February 20",1,"310,967"
247,B09GVYY1KW,"AGARO HDMI to HMDI Cable 5 Meters, HDMI 2.0, Ultra High Speed, 48Gbps 4K@60Hz Support Dynamic HDR, 3D, eARC, HDCP 2.2, Cotton Braided HDMI Cord for PS5/PS4/Xbox/Apple TV/Projector, Black (33569)",AGARO,1,0,0,817,4.5,63,49,"Sunday, February 20",1,63
248,B06XJYQ6MX,"Storin Gold Plated DisplayPort(DP) Male to HDMI Female Cable Converter Adapter for Equipped 4K Ultra HD Monitors, displays and HDTV's - 3 Month Warranty",Storin,0,0,0,249,3.6,11,75,"Tuesday, February 22",0,11
249,B005LJQO9G,BlueRigger High Speed HDMI to DVI Adapter Cable (10 Feet / 3 Meters),BlueRigger,0,0,0,879,4.2,"12,929",27,"Sunday, February 20",1,"12,929"
250,B084ZNVZFT,"Storite 2 Pack 30cm Short Length 19 Pin HDMI Male to Female 4K Extension Cable for fire tv stick, Laptop/PC,Xbox, PS3/PS4 - (Specially Designed for Wall mountable tv) Black",Storite,0,0,0,399,4.1,625,69,"Friday, February 18",1,625
251,B09CCKR8N3,"Storite 2 Pack High Speed Right Angle 90 Degree Hdmi Male to Female Extension Cable for fire tv stick, Laptop/PC, LCD/LED TV, Xbox, PS3/PS4– 50 cm",Storite,0,0,0,399,4.5,42,69,"Friday, February 18",1,42
252,B08KTMK8BG,"Hdmi Cable,hdmi Cable for Laptop to tv, Hdmi Cable (3m)",Hdmi,0,0,0,299,4.0,55,63,"Monday, February 21",1,55
253,B08R5VBPRP,TERABYTE Display Port to HDMI Cable; DP Display Port to HDMI Converter Cable Gold-Plated Cord Compatible for Laptop,TERABYTE,0,0,0,525,4.1,10,47,"Monday, February 21",0,10
254,B00B2HORKE,UGREEN Micro HDMI to HDMI Cable Male to Female Micro HDMI Adapter Supports 4K 3D for GoPro Hero 5,UGREEN,0,0,0,549,4.4,"10,323",27,"Wednesday, February 23",1,"10,323"
255,B098F7HM9K,"Storite 2 Pack High Speed 19 pin HDMI Male to Male Cable for LED/LCD TV, PC Monitor, Setup Box – 45cm",Storite,0,0,0,349,4.2,17,73,"Friday, February 18",1,17
256,B01FM51WYK,"CableCreation DisplayPort to HDMI Cable 3 Feet, Gold Plated DP to HDMI Cable 4K & 3D Audio/Video Converter Black",CableCreation,1,0,0,999,4.5,536,77,"Tuesday, February 22",1,536
257,B01FM51SHG,"CableCreation DVI Male to HDMI Male Cable, 5 Feet Bi-Directional HDMI Male to DVI(24+1) Male Cable Support 1080P for Raspberry Pi, Roku, Xbox One, Laptop, Graphics Card, Blue-ray, 1.5M/Black",CableCreation,1,0,0,459,4.2,"5,751",28,"Tuesday, February 22",1,"5,751"
258,B09KPW9897,"Rec Trade HDMI Female To HDMI Female Adapter, HDMI Extender 4K Female to Female Connector Compatible With extended reach when connecting Blu-ray players, Fire TV, HDTV, PS4, PS3, X-Box one, X-box 360, computers, and other HDMI-enabled devices to TVs, displays, A/V receivers, and more. (RTT-CVT-0153)",Rec,1,0,0,189,4.1,9,81,"Tuesday, February 22",1,9
259,B099WNTF16,"Rec Trade HDMI to HDMI 90 Degree Adapter, Right Angle L Shape HDMI Male to HDMI Female Gold Plated Cable Adapter Compatible with HDTV 1080P HDMI Cable Connector.(RTT-CVT-0148)",Rec,1,0,0,199,3.5,2,80,"Tuesday, February 22",1,2
260,B08KTMK8BG,"Hdmi Cable,hdmi Cable for Laptop to tv, Hdmi Cable (3m)",Hdmi,0,0,0,299,4.0,55,63,"Monday, February 21",1,55
261,B00B2HORKE,UGREEN Micro HDMI to HDMI Cable Male to Female Micro HDMI Adapter Supports 4K 3D for GoPro Hero 5,UGREEN,0,0,0,549,4.4,"10,323",27,"Wednesday, February 23",1,"10,323"
262,B015OW3P1O,"AmazonBasics DisplayPort (not USB port) to HDMI Cable - 10 Feet, Black",AmazonBasics,0,0,0,"1,618",4.1,"28,090",15,"Friday, February 18",1,"28,090"
263,B09CCKR8N3,"Storite 2 Pack High Speed Right Angle 90 Degree Hdmi Male to Female Extension Cable for fire tv stick, Laptop/PC, LCD/LED TV, Xbox, PS3/PS4– 50 cm",Storite,0,0,0,399,4.5,42,69,"Friday, February 18",1,42
264,B00SRF8AAW,"PremiumAV HDMI Male to Male Cable (10M, Black)",PremiumAV,0,0,0,649,4.0,"3,678",19,"Monday, February 21",1,"3,678"
265,B09KS39PKC,"Storite 1.5m 4K UHD HDMI Cable High Speed 18Gbps HDMI 2.0 Cord Supports 4K@60Hz UHD, 2160p, 1080p, Ethernet, 3D, Audio Return(ARC) Compatible for TV, Laptop, PC, Monitor & Projector",Storite,0,0,0,599,4.2,7,40,,0,7
266,B06XJYQ6MX,"Storin Gold Plated DisplayPort(DP) Male to HDMI Female Cable Converter Adapter for Equipped 4K Ultra HD Monitors, displays and HDTV's - 3 Month Warranty",Storin,0,0,0,249,3.6,11,75,"Tuesday, February 22",0,11
267,B08SKMH7JR,"L Type HDMI Male to HDMI Female Jointer Connector (Black)-1 PCS 0 m HDMI Adapter (Compatible with LED Tv, Laptop, Black, One Cable)",L,0,0,0,167,3.5,24,44,"Friday, February 25",0,24
268,B09MQNVM15,Rec Trade 4 Way HDMI Powered Splitter 1 in 4 Out 1X4 4 Ports HDMI Audio and Video Splitter HDMI Splitter Amplifier Switch Full HD 1080P. (HDMI 1x4 Splitter) (RTT-SPT-0099),Rec,1,0,0,"1,094",0,0,56,"Tuesday, February 22",1,"₹1,094
₹2,499 Save ₹1,405 (56%)"
269,B09PRNL55S,Rec Trade 3x1 HDMI Splitter Cable Pig Tail Cable 1080P Resolution Video Switcher Adapter 3 Input 1 Output Switch for X-Box PS4 DVD HDTV PC Laptop TV. (RTT-CBL-0051),Rec,1,0,0,649,0,0,57,"Tuesday, February 22",1,"₹649
₹1,499 Save ₹850 (57%)"
270,B09DD5KNGP,Infideals Mini HDMI to Standard HDMI Cable 1.5Meter and do HDMI to Mini HDMI - Ultra High Speed 18Gbps Support 4K HDR and ARC Compatible with All Digital Camera of All Major Brand,Infideals,0,0,0,249,5.0,2,64,"Monday, February 21",1,2
271,B08X3FVP9Y,SAMZHE 1.5 Meter HDMI Male to Male Cable (Black) (MST-758-1),SAMZHE,0,0,0,211,4.5,2,74,"Friday, February 18",1,2
272,B09HCH3JZG,"BESTOR® 8K HDMI 2.1 Cable 48Gbps 9.80FT/ Ultra High Speed HDMI Braided Cord-4K@120Hz 8K@60Hz, DTS:X, HDCP 2.2 & 2.3, HDR 10 Compatible with Roku TV/PS5/HDTV/Blu-ray (1 Meter)",BESTOR®,0,0,0,899,4.4,10,53,"Monday, February 21",1,10
273,B01HJVI3Z6,C&E CNE585734 CL3 Rated Ultra HDMI Cable with Ethernet (Gold),C&E,0,0,0,499,4.2,444,41,"Sunday, February 20",1,444
274,B074GYZWG4,PremiumAV HDMI Male to VGA Female Video Converter Adapter Cable (Black),PremiumAV,0,0,0,299,3.6,"3,020",40,"Monday, February 21",1,"3,020"
275,B08FRKK8CM,"Storite VGA to HDMI with Power and Audio Compatible with Metal Connector, VGA to HDMI Cable- Unidirectional for Computer, Desktop Monitor, Projector, HDTV LCD/LED TV - (Grey,1.5M)",Storite,0,0,0,"1,699",3.9,167,58,"Friday, February 18",1,167
276,B074GZD9VP,"PremiumAV HDMI Male to Male Cable (5M, Black) (171184652637)",PremiumAV,0,0,0,349,4.0,"1,371",42,"Sunday, February 20",1,"1,371"
277,B0995V64T2,"DHIVIS Royce 8K Certified HDMI 2.1, (1 Meters) 4K@120hz, 48Gbps, VRR, eARC, HDR 10 and Dolby Vision, HDCP 2.2, 2.3, Support 4K -120Hz Tested with 4K OLED TV, PS5, RTX3080/3090, Xbox Series X.",DHIVIS,0,0,0,"2,599",4.4,374,57,"Monday, February 21",1,374
278,B077PHJLHG,"CableCreation USB C to HDMI Cable, 3FT USB Type C to 4K HDMI Cable Adapter for Home Office, Compatible with MacBook Pro/iPad Pro 2020 2019 (Black)",CableCreation,1,0,0,"1,067",3.8,"7,885",24,"Tuesday, February 22",1,"7,885"
279,B09QQ72T39,"HDMI Cable, High-Speed Ultra HD HDMI 2.0 Cable, Supports 3D Formats with Audio Return Compatible with Fire TV HDMI 2.0/1.4, Blu-ray/PS4/PS5/Xbox Series X/Switch HD 1080p PC 1.5M (Green-Gold Plated)",HDMI,1,0,0,199,4.7,9,50,"Monday, February 21",0,9
280,B09C1PBFK5,Rec Trade HDMI 90 Degree Adapter Right Angle L Shape Male to Female Converter Extender Compatible with PS4 HDTV Projector Laptop Monitor etc. (RTT-CVT-0148),Rec,1,0,0,199,4.0,1,80,"Tuesday, February 22",1,1
281,B09J1DFC7F,"Techati Ultra High Speed HDMI cable - 3 meters (HDMI 2.1 standard) - Supports 8K 60Hz / 4K 120Hz / 48 Gbps / 3D / Ethernet - compatible with TV, computer, monitor, PS5, Xbox 360 and more",Techati,1,0,0,"1,199",4.6,16,40,"Wednesday, February 23",1,16
282,B084ZNVZFT,"Storite 2 Pack 30cm Short Length 19 Pin HDMI Male to Female 4K Extension Cable for fire tv stick, Laptop/PC,Xbox, PS3/PS4 - (Specially Designed for Wall mountable tv) Black",Storite,0,0,0,399,4.1,625,69,"Friday, February 18",1,625
283,B07HLW8N15,"Tizum High Speed HDMI Cable “Ultra”- HDMI 2.0 -Gold Plated-High Speed Data 18Gbps, 3D, 4K, HD 2160p (16 Ft/ 5M-Grey)",Tizum,0,0,0,579,4.0,"1,113",59,"Friday, February 18",1,"1,113"
284,B086D42F83,"CableCreation 8K HDMI Cable, High Speed 48Gbps 8K 60Hz Ultra HD, HDCP 2.2,4:4:4 HDR, eARC, Compatible for PS5, PS4, Xbox One/Xbox Series X, QLED TV,Roku TV, VIZIO TV(3.2ft)",CableCreation,0,0,0,"1,199",4.4,"1,396",56,"Tuesday, February 22",1,"1,396"
285,B09N6M6B59,"Etzin HDMI to VGA With 3.5mm Aux Cable Compatible With Computer, Desktop, Laptop, PC, Monitor, Projector, Full HDTV, Media Players, XboxHigh-Speed 1080P Active HDTV etc.",Etzin,0,0,0,249,1.0,1,83,"Tuesday, February 22",1,1
286,B09MLSPQRK,"C & E Ultra Series BLUE 4K HDMI Cable HDMI Cord 50 FT / 15.24 Meters, HDMI to HDMI, TOP Series Gold",C,0,0,0,"3,499",0,0,5,"Sunday, February 20",1,"₹3,499
₹3,699 Save ₹200 (5%)"
287,B09F6WQWJT,Generic HDMI to VGA Adapter Converter Cable Male to Female 4K 1080P for Monitor PC Desktop Laptop HDTV Black (Pack of-1),Generic,0,0,0,249,0,0,50,"Monday, February 21",1,"₹249
₹499 Save ₹250 (50%)"
288,B092PMCJP9,"HOSS® 8K Certified HDMI 2.1 Cable, 48Gbps Ultra High Speed 8K HDMI Cable, Support 8K@60Hz,4K@120Hz, Dynamic HDR, Dolby Vision, 3D, ARC,eARC Compatible with Apple TV, LG TV, Xbox, PS4, PS5, Fire TV- 6.6 Feet/2M",HOSS®,0,0,0,"1,699",4.4,48,15,"Sunday, February 20",1,48
289,B06XTQNJD9,PremiumAV HD15V14P 3M HDMI Male to Male Cable (Black)…,PremiumAV,0,0,0,299,4.0,"3,678",63,"Monday, February 21",1,"3,678"
290,B08TCDJS1B,"ONCRO® New Version 3 Port 4K HDMI Switcher, HDMI Switch, 3 in 1 Out Multi Switcher Splitter HUB with 1080P HD 4K 3D Splitter Pigtail Cable Supports for HDTV, Projector, Computer, Monitors",ONCRO®,1,0,0,645,3.2,23,62,"Monday, February 21",1,23
291,B07H89FX8Q,DTECH Fiber Optic HDMI Cable 100 Feet 4K 60Hz 444 Chroma Subsampling 18Gbps High Speed Ultra HD with Dual Micro HDMI and Standard HDMI Connector,DTECH,1,0,0,"10,000",0,0,40,"Tuesday, February 22",1,"₹10,000
₹16,800 Save ₹6,800 (40%)"
292,B08RDF4P87,"TERABYTE 30 Meter HDMI Male to HDMI Male Cable TV Lead 1.4V High Speed Ethernet 3D Full HD 1080p HDMI Cable (Black For Computer, Laptop, Tablet)",TERABYTE,0,0,0,"2,299",4.4,11,8,"Monday, February 21",1,11
293,B09DSC9GYK,"Kinsound 4K HDMI Cable, High Speed HDMI Cable with Ethernet Supports 3D, 4K,1080P Compatible with TV, Projector, Nintendo Switch, PS, Xbox, All HDMI Devices, 1M",Kinsound,0,0,0,699,4.8,14,38,"Sunday, February 20",1,14
294,B085HKXVVR,"USB C to HDMI Cable 6FT with HDR 4K@60Hz, 2K@144Hz, 2K@120Hz, CableCreation USB Type C to HDMI Cable Thunderbolt 3 Compatible for MacBook Pro/Air, iMac, iPad Pro 2020, Galaxy S20 S10/Note 10",USB,0,0,0,"1,605",4.3,332,6,"Tuesday, February 22",1,332
295,B08VWL2ZPP,"Storite 2 Pack Gold-Plated High-Speed Premium Series 19 Pin HDMI Male to Male Cable 1.5 Meter -Supports 3D,4K 30Hz, Video 4K 2160p 1080p- Compatible with Laptop, PC, Projector & TV-Black",Storite,0,0,0,499,4.3,313,80,"Friday, February 18",1,313
296,B015OW3QVS,AmazonBasics DisplayPort (not USB port) to HDMI Cable - 15 Feet,AmazonBasics,0,0,0,"1,399",4.1,"28,090",33,"Friday, February 18",1,"28,090"
297,B004GW25WY,"BlueRigger in-Wall High Speed 10.2Gbps HDMI Cable - CL3 Rated - Supports 4K 30Hz, Ultra HD, 3D, 1080p, Ethernet and Audio Return (Latest Standard) (50 Feet (15 Meters)",BlueRigger,0,0,0,"3,099",4.4,"37,386",0,"Friday, February 18",1,"37,386"
298,B09HQXBL4L,UNMCORE Ultra 8K Tv To Audio & Video HDMI Male To HDMI Male Cable Supports 8K 120HZ 1080p 48gbps FullHD UHD/Ultra HD 3D With Ethernet ARC For PS4 XBOX HDTV Roku QLED TV PS4 Nintendo Switch Xbox One (3M),UNMCORE,0,0,0,459,2.0,2,69,"Monday, February 21",1,2
299,B01332A05G,WireSwipe™ 1.4 Meter HDMI Male to Male 1.4V High Speed Ethernet Cable,WireSwipe™,0,0,0,150,3.9,"1,535",70,"Friday, February 25",0,"1,535"
300,B08XQCKS9P,"REC Trade HDMI Switch with Remote 5 in 1 Out 4Kx2K HDMI Auto Switcher, Support UHD, HDR10, Dolby Vision, Atmos, YCbCr 4:4:4, HDCP2.2 and CEC.(RTT-SWT-0076)",REC,1,0,0,"2,191",1.0,1,56,"Tuesday, February 22",1,1
301,B07KSDB25X,"AmazonBasics Premium Flexible HDMI Cable and Micro HDMI Adapter, 6 Feet, Black",AmazonBasics,1,0,0,359,4.6,"1,702",55,"Friday, February 18",1,"1,702"
302,B081YVHX6Q,"DTECH 10m Fiber Optic HDMI Cable with 4K 30Hz and 1080p 60Hz HD Video 3D ARC HDCP CEC High Speed Supported (35Feet, Black)",DTECH,1,0,0,"6,280",3.6,10,14,"Thursday, February 24",1,10
303,B09BVG2RQG,Rec Trade Mini HDMI to HDMI Converter Adapter Mini HDMI Adapter HDMI V1.4 Ethernet 1080P Both Side HDMI Female HDMI Cable Wire Connector (RTT-CVT-0154),Rec,1,0,0,199,0,0,80,"Tuesday, February 22",1,"₹199
₹999 Save ₹800 (80%)"
304,B07G5NZ7DZ,iVoltaa High Speed 4K 60 Hz HDMI 2.0 Cable - 10 Feet (3 Meters) - Black,iVoltaa,0,0,0,349,4.1,489,30,"Friday, February 18",1,489
305,B09DRZGSCZ,"Kinsound 4K HDMI Cable, High Speed HDMI Cable with Ethernet Supports 3D, 4K,1080P Compatible with TV, Projector, Nintendo Switch, PS, Xbox, All HDMI Devices, 3M",Kinsound,0,0,0,999,4.8,14,38,"Sunday, February 20",1,14
306,B08RC1D7J9,"TERABYTE 15 Meter HDMI Male to HDMI Male Cable TV Lead 1.4V High Speed Ethernet 3D Full HD 1080p HDMI Cable (Black For Computer, Laptop, Tablet)",TERABYTE,0,0,0,699,3.9,17,53,"Monday, February 21",1,17
307,B07NVPFCVG,"C&E 25 FT(7.6M) High Speed Ultra 4K HDMI Cable with Ethernet Gold (25 Feet/7.6 Meters) Supports 4Kx2K@60HZ, 18 Gbps - 24 AWG - 3D / ARC/CEC/HDCP 2.2 / CL3 - Xbox PS4 PC HDTV",C&E,0,0,0,695,4.1,14,54,"Friday, February 18",1,14
308,B09G6DN37L,TERABYTE HDMI to VGA Adapter 1080P With 3.5 mm Audio Sound HD Video Cable Adapter for PC Desktops Laptop (Black)10,TERABYTE,0,0,0,349,0,0,65,"Monday, February 21",1,"₹349
₹999 Save ₹650 (65%)"
309,B09RPLLGRK,FEEPO Hi- Speed HDMI cable with Audio Return Channel (ARC) (1.5mtr),FEEPO,0,0,0,249,5.0,3,58,"Wednesday, February 23",0,3
310,B08RBVP1S2,"TERABYTE 5 Meter HDMI Male to HDMI Male Cable TV Lead 1.4V High Speed Ethernet 3D Full HD 1080p HDMI Cable (Black For Computer, Laptop, Tablet)",TERABYTE,0,0,0,270,3.7,30,55,"Monday, February 21",1,30
311,B08RDBL5ZX,"TERABYTE 25 Meter HDMI Male to HDMI Male Cable TV Lead 1.4V High Speed Ethernet 3D Full HD 1080p HDMI Cable (Black For Computer, Laptop, Tablet)",TERABYTE,0,0,0,"1,299",1.9,2,35,"Monday, February 21",1,2
312,B089GM4JGK,"CableCreation 4K Micro HDMI to HDMI Cable Adapter, 4K 60Hz Ethernet 3D Audio Return, Compatible with GoPro Hero 8/7/6/5, Raspberry Pi 4, A6000, A6300, Nikon Camera, Lenovo Yoga 3 Pro, Yoga 710, 6ft",CableCreation,1,0,0,563,4.4,190,67,"Tuesday, February 22",1,190
313,B095P57X4J,"Storite 2 Pack 90cm 19pin High Speed HDMI Cable, Male to Male HDMI Cord Supports 4K@30Hz, 2160p, 1080p & 3D for TV, Laptop, PC, Monitor & Projector - Black",Storite,1,0,0,349,4.0,"1,525",71,"Friday, February 18",1,"1,525"
314,B08QZDB4RQ,"BKN® 4K Ultra High Speed Full HD HDMI Male to Female Cable (1.5 Meter) for TV, Computer, Laptop, Projector, Satellite TV Box.",BKN®,0,0,0,249,3.8,41,69,"Monday, February 21",1,41
315,B09P4BL265,"Insflug Universal HDMI Cable Adapter,1080P HDMI Video AV Connector Screen Mirroring Device 'Plug and Play' on HD TV Projector for i-Phone/i-Pad, Android Smartphone/Tablets Type C, Micro USB",Insflug,0,0,0,"1,099",0,0,63,"Monday, February 21",1,"₹1,099
₹2,999 Save ₹1,900 (63%)"
316,B09SB86LBQ,Rhymestore High Speed HDMI Male to Female Swivel Adapter HDMI Extension Cable for Google Chrome Cast -10cm (Black),Rhymestore,0,0,0,199,0,0,72,"Monday, February 21",1,"₹199
₹699 Save ₹500 (72%)"
317,B00NHFQUIG,"PremiumAV HDMI Male to Male Cable (1.5M, Black)",PremiumAV,0,0,0,199,4.0,"3,678",75,"Sunday, February 20",1,"3,678"
318,B07BHNYTBG,Posh HDMI to VGA Gold Plated High-Speed 1080P Active HDTV HDMI to VGA Adapter Converter Male to Female with Audio and Micro USB Charging Cable,Posh,0,0,0,315,3.7,626,68,"Friday, February 18",1,626
319,B08RMTQSVK,"CableCreation 8K 48Gbps Ultra High Speed HDMI Cable 6.6ft, 4K120 8K 60 144Hz eARC HDR HDCP 2.2 2.3 Compatible with PS5 PS4 Xbox Series X Roku TV 4K LG Samsung TV RTX 3080",CableCreation,0,0,0,"1,299",4.6,372,61,"Tuesday, February 22",1,372
320,B09J3XC2ZW,"ikis 1.5m - High Speed HDMI Cable Male to Male Cable for LED/LCD TV, PC Monitor, Setup Box - 1.5m HDMI Male to Male Cable for 3D PS3, Xbox 360, Blueray, HDTV, Plasma TV, LED and LCD (Black)",ikis,0,0,0,80,0,0,81,"Tuesday, February 22",0,"₹80
₹415 Save ₹335 (81%)"
321,B08CR2ZF9Z,"Active DP to HDMI Cable HDR 4K@60Hz 2K@144Hz 1080P@144Hz, CableCreation 8FT Unidirectional DisplayPort to HDMI Monitor Cable, DP 1.4 to HDMI 4K Braided Support Eyefinity Multi-Display Alumium",Active,0,0,0,"1,699",4.1,332,66,"Tuesday, February 22",1,332
322,B09PRJZ1VJ,"Storite 5m HDMI Male to Male Cable High Speed 18Gbps HDMI 2.0 Cord Supports 4K Ultra HD, 3D, 1080p, Ethernet Compatible for TV, Laptop, PC, Monitor & Projector (Black)",Storite,1,0,0,999,0,0,47,"Friday, February 18",1,"₹999
₹1,899 Save ₹900 (47%)"
323,B06XDMKQKJ,"CableCreation USB C to HDMI Cable for Home Office, 6ft USB 3.1 Type C to HDMI 4K Thunderbolt 3 Compatible with MacBook Pro/Air/iPad Pro 2020 2019, Surface Book 2, Dell XPS 15, Galaxy S20/S10, More Type C Devices with Display Port Alternate Mode Required",CableCreation,1,0,0,"1,115",3.8,"7,885",30,"Tuesday, February 22",1,"7,885"
324,B09PGCRWRV,"DigiReach® HDMI Cable 1.5 Meter FullHD 1080P - HDMI 1.4 - ARC - HDCP 1.4 - Gold Plated Connector - Premium HDMI for TV - Projectors -AVR - PS4 - PS5 - Apple TV - Bluray (1080P, 1.5 Meter) - (HD1-1080)",DigiReach®,1,0,0,229,5.0,1,69,"Monday, February 21",1,1
325,B09HQX73JL,UNMCORE Ultra 8KTv To Audio & Video HDMI Male To HDMI Male Cable Supports 8K 120HZ 1080p 48gbps FullHD UHD/Ultra HD 3D With Ethernet ARC For PS4 XBOX HDTV Roku QLED TV PS4 Nintendo Switch Xbox One (5M),UNMCORE,1,0,0,792,0,0,60,"Monday, February 21",1,"₹792
₹1,999 Save ₹1,207 (60%)"
326,B08FF4VJR4,"INICIO 8K HDMI 2.1 Cable [ 6.6ft / 2m, Zinc Alloy Shell ] 8K@60Hz 4K@120Hz Ultra HD 48Gbps Bandwidth; 3D; 4320P; 2160P; 1080P; Ethernet; Enhanced Audio Return eARC for UHD TV; Monitor; PS4; PS3; PC",INICIO,0,0,0,999,4.4,48,50,"Monday, February 21",1,48
327,B09GVYZP6T,"AGARO HDMI to HMDI Cable 10 Meters, HDMI 2.0, Ultra High Speed, 48Gbps 4K@60Hz Support Dynamic HDR, 3D, eARC, HDCP 2.2, Cotton Braided HDMI Cord for PS5/PS4/Xbox/Apple TV/Projector, Black (33570)",AGARO,0,0,0,"1,813",4.5,63,30,"Saturday, February 19",1,63
328,B005LJQM3Y,"BlueRigger in-Wall High Speed 10.2Gbps HDMI Cable - CL3 Rated - Supports 4K 30Hz, Ultra HD, 3D, 1080p, Ethernet and Audio Return (Latest Standard) (35 Feet (10.5 Meters)",BlueRigger,0,0,0,"2,069",4.4,"37,386",68,"Sunday, February 20",1,"37,386"
329,B08RBQB63D,"TERABYTE 3 Meter HDMI Male to HDMI Male Cable TV Lead 1.4V High Speed Ethernet 3D Full HD 1080p HDMI Cable (Black For Computer, Laptop, Tablet)",TERABYTE,0,0,0,236,4.1,23,53,"Monday, February 21",1,23
330,B089GLXRHB,"CableCreation Mini HDMI to HDMI Cable, Support 4K 60Hz Ultra HD, 3D, High Speed, 6 Feet",CableCreation,0,0,0,798,4.5,324,78,"Tuesday, February 22",1,324
331,B075V5JK36,"USB C to HDMI Cable(4K@60Hz), uni USB Type-C to HDMI Cable [Thunderbolt 3 Compatible] for MacBook Pro 2018/2017, iPad Pro/MacBook Air 2018, Surface Book 2, Samsung S9, and More - Gray - 6FT/1.8m",USB,0,0,0,"3,610",4.5,"9,202",40,"Monday, February 21",1,"9,202"
332,B08HYS2KMM,"CableCreation USB C to HDMI Cable, Aluminum 3FT USB Type C to 4K HDMI Cable Adapter Thunderbolt 3 Compatible for MacBook Pro/Air 2018, iPad Pro, XPS 15/13, Surface Book 2",CableCreation,0,0,0,"1,399",4.0,50,48,"Tuesday, February 22",1,50
333,B01CZNRCRS,"Cables Kart 3 Port HDMI Switch 4k Auto Smart Hub box with 3 Input and 1 output for HDTV to Multi gadgets such as Bluray players, Game Consoles, Set top box, Music system etc",Cables,0,0,0,549,3.5,230,45,"Monday, February 21",1,230
334,B09RSY2XRV,"Ultronix High Speed HDMI Cable Male to Male TV-Out Cable Cord Wire hdmi to hdmi cable for TV, PC, PlayStation, 3 Meter(9.8 FEET).",Ultronix,1,0,0,357,0,0,64,"Monday, February 21",1,"₹357
₹999 Save ₹642 (64%)"
335,B09GVYZP6T,"AGARO HDMI to HMDI Cable 10 Meters, HDMI 2.0, Ultra High Speed, 48Gbps 4K@60Hz Support Dynamic HDR, 3D, eARC, HDCP 2.2, Cotton Braided HDMI Cord for PS5/PS4/Xbox/Apple TV/Projector, Black (33570)",AGARO,1,0,0,"1,813",4.5,63,30,"Saturday, February 19",1,63
336,B09KTYBZN3,"TECH-X HDMI Male to Female Adapter Pack Of 2, HDMI Swivel Extender Extension Converter 4K & 3D 1080P Support Google Chrome Cast, TV Stick, LCD/LED TV, HDTV, Laptop and PC, 10cm/4inch (PACK OF 2)",TECH-X,0,0,0,329,4.4,4,34,"Monday, February 21",1,4
337,B01332A05G,WireSwipe™ 1.4 Meter HDMI Male to Male 1.4V High Speed Ethernet Cable,WireSwipe™,0,0,0,150,3.9,"1,535",70,"Friday, February 25",0,"1,535"
338,B077PR4N8C,"CableCreation USB C to HDMI 4K 10ft/3M Long Cable 4K60Hz, Type C to HDMI Thunderbolt 3 Compatible for MacBook Pro/Air/iPad Pro 2020 2019, Surface Go, XPS 15 13, Yoga 920, Galaxy S20/10/9, LG V30",CableCreation,0,0,0,"1,499",4.2,"1,793",44,"Tuesday, February 22",1,"1,793"
339,B09LV3V2T1,"likes of india 4MTR_HDMI CABLE (GOLD PLATED) 4 m HDMI Cable Compatible with Laptop,TV,PC,Tablet,Set Of Box,VDR,Black,One Cable)",likes,0,0,0,349,3.0,2,42,"Monday, February 21",1,2
340,B08RBXS3KQ,"TERABYTE 10 Meter HDMI Male to HDMI Male Cable TV Lead 1.4V High Speed Ethernet 3D Full HD 1080p HDMI Cable (Black For Computer, Laptop, Tablet)",TERABYTE,0,0,0,497,4.2,10,50,"Monday, February 21",1,10
341,B08FZNZNK4,"UltraProlink UL1029-0200 High-Speed HDMI 2.0 Cable Supports Ethernet,3D,4K @ 60Hz Video,Gold Plated,Data Speed 18Gbps HD 2160P,Audio Return,(2m/6.5Ft) HDMI Cable with Screen Cleaning Kit Combo",UltraProlink,0,0,0,399,4.0,8,60,"Sunday, February 20",1,8
342,B09Q218FWV,ELECTRO WOLF Mini HDMI to Standard HDMI Cable - Ultra High Speed 18Gbps Support 4K HDR and ARC Compatible with All Digital Camera - 1 Meter,ELECTRO,0,0,0,399,0,0,56,"Tuesday, February 22",1,"₹399
₹899 Save ₹500 (56%)"
343,B097RQQFH9,SPIN CART HDMI Extension Cable Male to Female Support 3D 4K x 2K Resolution HDMI Cable Extender 1.5m,SPIN,0,0,0,279,3.8,3,60,"Sunday, February 20",1,3
344,B01FM51TT8,"CableCreation HDMI to DVI Cable, 6.6 Feet HDMI Male to DVI 24+1 Male Cable, Gold Plated HDTV to DVI Cable Support 1080P 3D for Raspberry Pi, Roku, Xbox One, Graphics Card, Blue-ray, Nintendo Switch",CableCreation,1,0,0,459,4.2,"5,751",29,"Tuesday, February 22",1,"5,751"
345,B07S26XX3V,"AmazonBasics High-Speed 4K HDMI Cable with Braided Cord, 6 Feet, Black",AmazonBasics,1,0,0,449,4.7,"1,106",50,"Friday, February 18",1,"1,106"
346,B094DGR59G,"REC Trade HDMI to Dual HDMI Adapter, 1x2 HDMI Y Splitter Cable Adapter, 2 Way HDMI Splitter Cable Converter for DVD Plays/PS3/HDTV, LCD Monitor and Projectors, 1x2 HDMI Splitter Cable. (RTT-CBL-0041)",REC,1,0,0,499,1.0,1,67,"Tuesday, February 22",1,1
347,B093Q5874Z,"LOGIC HDMI 2.0 Cable 1.8 Meter (6 feet) Male to Male 4K@60 Hz 24K Gold Plated, Supports EDID & CEC",LOGIC,1,0,0,480,4.5,27,10,"Monday, February 21",1,27
348,B019ILULM8,"C&E 4K HDMI Cable (20 feet/6 Meters) High Speed 10.2Gbps HDMI Cable – 4K HDR, 3D, 2160P, 1080P, Ethernet – 28AWG PVC HDMI Cord – Audio Return(ARC) Compatible HD TV, Blu-ray, Xbox, PS4/3, PC, Fire TV",C&E,0,0,0,761,4.1,884,34,,1,884
349,B08FRJ1WXG,"FEDUS Gold Plated HDMI Male to Female Converter Connector Adapter 270 Degree L Shape Upward Angle Converter, HDMI L Shape Flat Extender, for HDTV, Plasma TV, LED, LCD Pack of 2 – Black",FEDUS,0,0,0,289,3.9,11,42,"Monday, February 21",1,11
350,B09MFW8WPC,Canzafury High Speed HDMI Cable(1.5 Meter),Canzafury,0,0,0,115,0,0,77,"Tuesday, February 22",0,"₹115
₹499 Save ₹384 (77%)"
351,B09HB5XWM9,"HDMI Adapter for iPhone,HDMI Sync Screen Converter, 1080P HDMI Digital Audio AV Adapter with Charing Port,Compatible with iPhone, iPad/iPod to HD TV/Monitor/Projector. [No Need Power]",HDMI,0,0,0,"2,599",4.0,1,48,"Tuesday, February 22",1,1
352,B07XTHMSQS,"4K High-Speed HDMI Cable 15 Meters (45 Feet) for HD-TV,LED/LCD TV, PC/Laptop, Projector, DVD, Home Theater, DVR Box, Set-Top Box, A/V Receiver.",4K,0,0,0,899,0,0,44,"Monday, February 21",0,4K
353,B08V5FSGDY,"CARE CASE® HDMI Male to VGA Female with Audio Cable Converter Adapter HDMI To VGA 1080P Gold-plated Adapter Compatible with HDTV, Computer, Laptops, Black, One Cable",CARE,0,0,0,245,3.7,26,75,"Tuesday, February 22",1,26
354,B09LSH5XV6,"1Goal HDMI Cable Splitter 1 in 2 Out HDMI Adapter Cable HDMI Male to Dual HDMI Female 1 to 2 Way, Support Two TVs at The Same Time, Signal One in Two Out",1Goal,0,0,0,399,0,0,60,"Tuesday, February 22",0,1Goal
