,asin,title,brand,Sponsored,Best Seller,Amazon's Choice,Price,Rating,NoofRatings,Discount,Delivery,Prime Delivery,base
0,B08RC467DY,"MY ARMOR Micro Fibre Pillows , 26"" x 17"" , White , 2 Pieces",MY,1,0,0,712,4.3,288,45,"Wednesday, February 16",1,288
1,B08R7MX63N,"SleepyCat 2-Piece Microfiber Cloud Pillow with Adjustable Zipper (27x18 inches, White)",SleepyCat,1,0,0,"1,784",4.3,632,25,,1,632
2,B08BK1C4Q9,"Urban Basics Ultra Soft Microfibre Pillow, 17""x27"" Inch, White, Set of 4(PIL01_4), polyester",Urban,1,0,0,"1,399",4.1,"2,306",30,"Sunday, February 13",1,"2,306"
3,B08CSLJMM4,"MY ARMOR Orthopedic Memory Foam Pillow for Comfortable Sleep (Thin Pillow) (24.5"" x 15.5"" x 3.5"")",MY,1,1,0,"1,250",4.1,"11,264",43,"Thursday, February 10",1,"11,264"
4,B07L6GZYDV,"Wakefit Hollow Fibre Pillow ( 68.58 cm X 40.64 cm, White and Grey )- 2 Pieces",Wakefit,0,0,1,719,4.4,"35,653",26,"Tuesday, February 15",1,"35,653"
5,B08T65ZNDV,"Wakefit Hollow Fibre Pillow (White and Grey, 68.58 cm X 40.64 cm) - 4 Pieces",Wakefit,0,0,0,"1,349",4.5,"5,434",12,"Tuesday, February 15",1,"5,434"
6,B016D7UJMW,"Recron Certified Dream Fibre Pillow (16""x24"")",Recron,0,0,0,385,4.0,"28,575",53,"Thursday, February 10",0,"28,575"
7,B08VNHK9TG,JY Satin Stripes Reliance Microfiber Pillows in White Color Set of 4 Pic(16''× 26''),JY,0,0,0,649,4.0,64,35,,1,64
8,B07XLLG72F,"Kuber Industries Luxurious 1 Piece Microfibre Pillow Filler - 16X24 Inch , White - Ctktc22178",Kuber,0,0,0,169,3.4,"3,808",32,"Thursday, February 10",0,"3,808"
9,B09HBDY3TT,"RYLAN Cervical Contour Memory Foam Pillow,Orthopedic Pillow for Neck Pain,Orthopedic Contour Pillow Support for Back,Stomach,Side Sleepers,Anti-Snoring Neck Pillow (pillow-2022)",RYLAN,0,0,0,899,4.3,577,25,"Monday, February 14",1,577
10,B09829QP99,Takiyawala 100% Cotton Filling Natural Orthopedic Pillow with 100% Cotton - Hand Embroidery Cotton Fabric Sleeping Pillow | White | 16 x 25 inches (41X62.5 cm | Pack of 3,Takiyawala,0,0,0,698,4.3,233,53,"Monday, February 14",1,233
11,B08CMJG8Q5,Fabroyal India 5 Star Hotel Cotton Pillow Filler with Fibre for Well Night's Sleep in White Colour for Home & Hotel (Pack of 2 Pillow),Fabroyal,0,0,0,0,2.9,2,0,,0,2
12,B081NZXYXW,"Amazon Brand - Solimo Microfibre & polyester 2-Piece Premium Bed Pillow Set, Microfibre, Brown, 43 X 69 X 17 Cm",Amazon,0,0,0,749,4.1,"4,971",45,"Wednesday, February 16",1,"4,971"
13,B083FK4HWF,"MY ARMOR Orthopedic Memory Foam Pillow for Comfortable Sleep, Queen Size (23"" x 14"" x 4.5"")",MY,0,1,0,"1,150",4.1,"11,264",42,"Thursday, February 10",1,"11,264"
14,B091TTRV47,"takiyawala Microfiber Bed Pillow Bolster, 12 x 30 inch, White, Set of 2",takiyawala,0,0,0,599,4.1,118,60,"Monday, February 14",0,118
15,B09QJRFZ2N,"Shree GANPAT Enterprises Ultra Soft White Fibre Pillow Sets for Bed (White-Set of 6, Size- 60*40 Inch)",Shree,0,0,0,589,1.0,2,67,"Sunday, February 13",0,2
16,B08HD8C2QC,DClub Memory Foam Cervical Contour Medical Pillow for Sleeping Orthopedic Pillows for Neck Back Pain Relief (White),DClub,0,0,0,599,3.5,129,68,"Monday, February 14",1,129
17,B09BLD4NFC,JY Soft Uniformly Microfiber Filled Pillow 26'' x 16'' 'Color-White (Pack of 4),JY,0,0,0,599,3.9,153,40,,1,153
18,B09PMJV4BM,Cloth Fusion Microfiber Bed Pillow Set of 2 Pieces (17x27 Inches) (Maroon & Navy),Cloth,0,0,0,649,3.9,9,35,"Saturday, February 12",1,9
19,B089K2Y25G,"JDX 200 TC Polyester Fibre Solid Sleeping Pillow (Set of 2, White)…",JDX,0,0,0,299,3.8,235,70,"Tuesday, February 15",0,235
20,B07L6GZYDV,"Wakefit Hollow Fibre Pillow ( 68.58 cm X 40.64 cm, White and Grey )- 2 Pieces",Wakefit,1,0,1,719,4.4,"35,653",26,"Tuesday, February 15",1,"35,653"
21,B08T65ZNDV,"Wakefit Hollow Fibre Pillow (White and Grey, 68.58 cm X 40.64 cm) - 4 Pieces",Wakefit,1,0,0,"1,349",4.5,"5,434",12,"Tuesday, February 15",1,"5,434"
22,B0847LWLKF,"The White Willow Memory Foam Cooling Gel Orthopedic Bed Pillow for Sleeping & Neck Pain Relief Suitable for Back Sleeper, Side Sleeper & Stomach Sleeper with Pillow Cover (22"" L x 15"" W x 4"" H,Multi)",The,1,0,0,"1,139",3.9,"4,636",58,"Thursday, February 10",1,"4,636"
23,B096RWZKMC,"SleepyCat Air Gel Memory Foam Pillow for Sleeping and Neck Support with Removable Zipper Cover (White, 28x18 inches) 2-Piece",SleepyCat,1,0,0,"3,891",4.1,"1,031",22,"Tuesday, February 15",1,"1,031"
24,B08TJ18JK5,"Wakewell Soft Fibre Pillow for Bed, 61 x 41 cm, White, Pack of 2 Pillows",Wakewell,0,0,0,459,3.6,"1,571",58,"Tuesday, February 15",0,"1,571"
25,B00IJRV3AC,"Recron Certified Joy Fibre Pillow - 41 cm x 61 cm, Pack of 2, White",Recron,0,0,0,709,4.0,"1,147",0,"Saturday, February 12",1,"1,147"
26,B097H8RR2B,"The White Willow Cooling Gel Memory Foam Orthopedic Bed Pillow for Sleeping & Neck Pain Relief for Back Sleeper, Side Sleeper & Stomach Sleeper with Pillow Cover - Pack of 2 (22""L x 15""W x 4""H) Multi",The,0,0,0,"1,959",4.0,659,64,"Thursday, February 10",1,659
27,B075QK83BJ,"JDX Premium Hotel Quality Soft Polyester Blend Fiber Pillow, White -Set of 2 Size 16x24 Inches",JDX,0,0,0,449,3.8,"1,383",55,"Tuesday, February 15",0,"1,383"
28,B08Q441VS3,"takiyawala ® 300TC Poly-Cotton Breathable Fabric with Down Alternative Fiber Filled Pillow for Sleeping (King Size - 16"" x 26"" x4"" ) -Pack of 2, White",takiyawala,0,0,0,699,3.9,199,64,"Monday, February 14",1,199
29,B09B67RX4W,"JY Hollow Microfibre Standard Luxury Bed Pillow for Sleeping (16x26 Inches, White) -Set of 3",JY,0,0,0,395,3.7,151,51,"Tuesday, February 15",0,151
30,B00IJRV2D0,"Recron Certified Bliss Fibre Pillow - 43 cm x 69 cm, White",Recron,0,0,0,549,4.1,"4,041",0,"Thursday, February 10",1,"4,041"
31,B08TK2R3NP,"Amazon Brand - Solimo Premium Microfiber Bed Pillow Set (Blue and White, 43 x 69 cm , Standard) - 2 Piece",Amazon,0,0,0,749,4.1,462,38,"Wednesday, February 16",1,462
32,B098JLVMPQ,Milford Memory Foam Pillow Standard Size Neck & Back Support for Sleeping (White),Milford,0,0,0,599,3.9,745,50,"Monday, February 14",0,745
33,B07F5KZC2X,"Sleepwell Synthetic Pillow, Single, White, 2 Pieces",Sleepwell,0,0,0,0,3.7,363,0,,0,363
34,B09QJRSRV9,"Anju Enterprises Microfiber Blue Star Printed Pillow Sets (Black Cotton,Set of 4,16 x 24 inch )",Anju,0,0,0,399,0,0,69,"Sunday, February 13",1,"₹399
99
₹1,299 Save ₹899.01 (69%)"
35,B09GVLPH85,"AARVI Soft Memory Foam Pillow,Cervical Pillow for Neck Pain,Orthopedic Contour Pillow Support for Back,Stomach,Side Sleepers,Anti-Snoring Relief Neck Pillow,Anti-Allergy,Pillow for Pain Relief",AARVI,0,0,0,609,3.8,54,39,"Monday, February 14",0,54
36,B08L3CMFS9,"JY Reliance Microfiber with Sateen Strip Fiber Filled 2 Piece Pillow Set - 16"" x 27 , Antique White",JY,0,0,0,349,3.5,65,56,"Tuesday, February 15",0,65
37,B09KH9NFY2,"JY Standard Fresh Microfiber Super Soft Bed Pillow for Sleeping Set of 3 Size - 16 "" X 26 """,JY,0,0,0,449,3.8,30,55,,0,30
38,B09RN1NV3B,"Momsyard (Original) Microfiber Pillow, White Cushion, Head Pillow, Sleeping Pillow, Bed Pillow (16X24, Pair of 2)",Momsyard,0,0,0,245,0,0,51,"Monday, February 14",1,"₹245
₹499 Save ₹254 (51%)"
39,B09RK6LMHS,"Karan Enterprises Ultra Soft Microfibre Floral Print Pillow Sets (Size-16 x 24 inch,Pack of 5)",Karan,0,0,0,460,0,0,65,"Sunday, February 13",0,"₹460
₹1,299 Save ₹839 (65%)"
40,B09QL2JFCD,"S K S Enterprises Ultra Soft Microfibre Floral Printed Bed Pillow Sets (Black Cotton,Pack of 1, Size- 40 x 60 cm )",S,0,0,0,199,0,0,88,"Sunday, February 13",0,"₹199
₹1,599 Save ₹1,400 (88%)"
41,B09NNLB7H3,RK TRADERS Microfibre & Polyster Ultra Soft Blue Stripes Bed Pillow Sets ( 4 Piece ),RK,0,0,0,0,3.7,15,0,,0,15
42,B00IJRV32U,"Recron Certified Joy Fibre Pillow - 41 cm x 61 cm, White",Recron,0,0,0,379,3.9,"1,171",0,"Saturday, February 12",0,"1,171"
43,B09QLFKWNP,Larrito Memory Foam Cervical Contour Medical Pillow for Sleeping Orthopedic Pillows for Neck Back Shoulder Support Pain Relief cusion Soft Firm Pillow (Off White) (Pillow-1),Larrito,0,0,0,699,4.6,32,42,"Monday, February 14",1,32
44,B07VRRXGRP,"HealthSense Soft-Spot CP 30 Orthopedic Memory Foam Cervical Pillow for Neck, Shoulder, Sleeping Pain with Premium Bamboo Fibre Fabric Cover",HealthSense,0,0,0,"1,399",4.1,720,39,"Thursday, February 10",1,720
45,B09RK3CPXT,"M/S Kusum & Cheshta Enterprises Ultra Soft Microfibre Blue Bed Pillow Sets (Size-16 x 24 inch, Set of 2)",M/S,0,0,0,299,0,0,25,"Sunday, February 13",0,"₹299
₹399 Save ₹100 (25%)"
46,B09RH1QSF2,Memory Foam Cervical Contour Medical Pillow - DClub Orthopedic Pillows for Neck Back Pain Relief for Slipping. (1),Memory,0,0,0,589,3.7,3,83,"Monday, February 14",1,3
47,B09NY1Y8GV,Cloth Fusion Microfiber Bed Pillow Set of 2 Pieces (17x27 Inches),Cloth,0,0,0,649,3.9,9,35,"Saturday, February 12",1,9
48,B08KQHYRFG,Livpure Smart Cloud Microfiber Extra Soft Pillow with Standard Size 27 X 18 Inch - White ( Pack of 1 ),Livpure,0,0,0,599,3.9,413,69,"Thursday, February 10",1,413
49,B09RMPGNWW,"kamla Enterprises Ultra Soft Microfibre White Pillow Sets (White ,Size-16 x 24 inch, Pack of 4)",kamla,0,0,0,349,0,0,61,"Sunday, February 13",0,"₹349
₹899 Save ₹550 (61%)"
50,B09LMHPTWJ,JY Reliance Microfiber Feeling Satin Stripe White Fabric Bed Pillow for Sleeping (Pack of 2) ( 16'' X 26'' ),JY,0,0,0,349,3.5,14,42,"Tuesday, February 15",0,14
51,B09RQLT8CY,"Pillow Set of 2,Pillow Set of 2 for Sleeping,Cotton,Soft,Printed Pillows Set of 2,Pillow 17 x 27 inches,,Printed _ Blue Stripe_02",Pillow,0,0,0,620,0,0,38,"Tuesday, February 15",1,"₹620
₹999 Save ₹379 (38%)"
52,B01L94IXXG,"Amazon Brand - Solimo Ultra Soft Microfibre Bed Pillow Set (Standard, 43 x 69 cm, White) -2 Piece",Amazon,0,0,0,709,4.0,"3,401",29,"Thursday, February 10",1,"3,401"
53,B09R9X2SBN,"THE WOOD WHITE Micro-Fibre with Extra Filling Pillow Set of 2 | 16""x24"" Inches Premium Ultra–Soft Pillow for Sleeping (White Pillow Pack of 2).",THE,0,0,0,449,5.0,1,75,"Monday, February 14",1,1
54,B09RK85R2K,"Karan Enterprises Ultra Soft Microfibre Floral Bed Pillow Sets (Size-16 x 24 inch, Pack of 2)",Karan,0,0,0,230,0,0,82,"Sunday, February 13",0,"₹230
₹1,299 Save ₹1,069 (82%)"
55,B08Y6N7FGP,"ATOOTFUSION 100% Cotton Fabric Black Hosiery Medium Hard Cotton Bed Pillow for Real Perfect Neck Support (16"" x 26"") Set of 02 Checkered Multicolour",ATOOTFUSION,0,0,0,324,3.8,466,68,"Monday, February 14",0,466
56,B09L8H4MCC,"Sleepsia Microfiber Bed Pillow for Sleeping - Down Alternative Ultrasoft Cotton Washable Pillow with Satin Gusset- Queen (Blue, Pack of 1)",Sleepsia,1,0,0,"1,299",4.5,60,78,"Sunday, February 13",1,60
57,B09CMC8X96,"Homerz Aloe Vera Cloud Pillow Filled with 3D conjugated Microfiber, White, 17 x 27 inch Set of 2",Homerz,1,0,0,849,4.6,10,56,"Tuesday, February 15",1,10
58,B09CMVW897,"Homerz Nirvana Pillow Filled with 3D Conjugated Fiber, 17 x 27 inch Exact Size, Cotton Fabric, White -Set of 2",Homerz,1,0,0,749,3.9,112,53,"Tuesday, February 15",1,112
59,B09GS5KJ1N,"Cloth Fusion Microfiber Bed Pillow Set of 2 Pieces (17x27 Inches, Teal and Grey)",Cloth,1,0,0,649,3.9,9,35,"Sunday, February 13",1,9
60,B09LMDLN3N,"Sleepsia Microfiber Bed Pillow for Sleeping - Down Alternative Ultrasoft Cotton Washable Pillow with Satin Gusset- Queen (Blue, Pack of 2)",Sleepsia,1,0,0,"2,250",4.5,60,44,"Sunday, February 13",1,60
61,B083FKYLFG,"MY ARMOR Orthopedic Memory Foam Pillow for Comfortable Sleep, King Size (24"" x 15""x 5"")",MY,1,1,0,"1,250",4.1,"11,264",43,"Thursday, February 10",1,"11,264"
62,B097DXNFF6,"MY ARMOR Micro Fibre Pillows , 26"" x 17"" , White and Grey , 2 Pieces",MY,1,0,0,940,4.3,288,37,"Wednesday, February 16",1,288
63,B08K94WBJG,"Urban Basics Microfiber Pillow, 16x24 Inch, White, Set of 6",Urban,1,0,0,"1,799",3.8,717,40,"Sunday, February 13",1,717
64,B0837VT7FX,"The Cushion Company Soft Microfibre Pillows for Sleeping (White, 16 x 24 Inch) - Pack of 2",The,0,0,0,549,4.0,85,31,"Sunday, February 13",1,85
65,B0847LWLKF,"The White Willow Memory Foam Cooling Gel Orthopedic Bed Pillow for Sleeping & Neck Pain Relief Suitable for Back Sleeper, Side Sleeper & Stomach Sleeper with Pillow Cover (22"" L x 15"" W x 4"" H,Multi)",The,0,0,0,"1,139",3.9,"4,636",58,"Thursday, February 10",1,"4,636"
66,B09K34ZBBQ,"THE WOOD WHITE Ultra-Soft Premium Microfiber Pillows Set of 4 | 18""x28"" Inches Large Size of Luxurious Quality Softness Pillow for Home ( Pure White )",THE,0,0,0,999,4.3,56,74,"Monday, February 14",1,56
67,B09RH2M733,"Woomzy Orthopedic Memory Foam Pillow for Comfortable Sleep Bed Pillow for Sleeping & Neck Pain Relief Suitable for Back Sleeper, Side Sleeper & Stomach Sleeper Ergonomic Cervical Pillows (Pack of 1)",Woomzy,0,0,0,799,5.0,9,84,,1,9
68,B08ZLYR5Z3,"REMCART Microfiber Sleeping Pillow, 40 cm X 60 cm, White (Pack of 1PC)",REMCART,0,0,0,169,2.8,17,72,"Sunday, February 13",0,17
69,B09QJSJGPQ,"Anju Enterprises Ultra Soft Whitefibre Floral Printed Bed Pillow Sets (White Cotton,Pack of 2, Size- 40 x 60 cm )",Anju,0,0,0,248,5.0,1,38,"Sunday, February 13",0,1
70,B08RC467DY,"MY ARMOR Micro Fibre Pillows , 26"" x 17"" , White , 2 Pieces",MY,0,0,0,712,4.3,288,45,"Wednesday, February 16",1,288
71,B09RKH33Q5,"Sleepsia Supersoft Kids Pillows - 12"" X 18"" Breathable Bamboo Pillows for Sleeping - Ultra Supportive Microfiber Premium Fill Toddler Pillows, White",Sleepsia,0,0,0,499,0,0,75,"Sunday, February 13",1,"₹499
₹1,999 Save ₹1,500 (75%)"
72,B09RK8RF2K,"Karan Enterprises Ultra Soft Microfibre Blue Star Bed Pillow Sets (Size-16 x 24 inch, Pack of 1)",Karan,0,0,0,160,0,0,88,"Sunday, February 13",0,"₹160
₹1,299 Save ₹1,139 (88%)"
73,B09C4YG8MG,Homerz Set of 2 Microfiber Snow White Cloud Pillow Filled with 3D conjugated Fiber (17 x 27 inch ),Homerz,0,0,0,848,3.6,105,35,"Tuesday, February 15",1,105
74,B0993CV5Z2,"D S Pillow Sleepping Microfiber Size 17x27 inch White Sleeping Pillows, , Set of 6",D,0,0,0,0,2.8,9,0,,0,9
75,B08ZS81CXJ,"Hush Slim Pillow (16 x 24 x 6 Inch) I Imported Softex Filling I Anti-Sag Technology I Medium Soft Feel, Cotton, White",Hush,0,0,0,460,4.5,10,26,"Monday, February 14",1,10
76,B08JVP6QCX,"Fun Homes Microfibre Pillow Filler (16x24 inch, White)",Fun,0,0,0,249,3.4,535,38,"Sunday, February 13",0,535
77,B099KH3TKV,Haus Alchemy Luxury Premium Pillows Ultrasoft 100% Virgin Microfiber Filling with 100% Terry Cotton Pillow Cover King Size Hotel Pillows 1Pc (L-69cm x B-40cm)(L-27 x B-16 in) White,Haus,0,0,0,429,3.9,23,64,"Monday, February 14",0,23
78,B08S7KTTNN,Takiyawala Cotton Fabric with Grey Poly-Cotton Filling Medium Soft Sleeping Pillow for Bed 16 x 25 Inch Pack of 3,Takiyawala,0,0,0,599,4.1,902,40,"Monday, February 14",0,902
79,B09828Z3P9,Takiyawala Cotton Pillow with Fresh White cotton16 x 25 Inch Pack of 3,Takiyawala,0,0,0,639,4.0,63,64,"Monday, February 14",1,63
80,B097H8RR2B,"The White Willow Cooling Gel Memory Foam Orthopedic Bed Pillow for Sleeping & Neck Pain Relief for Back Sleeper, Side Sleeper & Stomach Sleeper with Pillow Cover - Pack of 2 (22""L x 15""W x 4""H) Multi",The,1,0,0,"1,959",4.0,659,64,"Thursday, February 10",1,659
81,B09PMJV4BM,Cloth Fusion Microfiber Bed Pillow Set of 2 Pieces (17x27 Inches) (Maroon & Navy),Cloth,1,0,0,649,3.9,9,35,"Saturday, February 12",1,9
82,B09C4YG8MG,Homerz Set of 2 Microfiber Snow White Cloud Pillow Filled with 3D conjugated Fiber (17 x 27 inch ),Homerz,1,0,0,848,3.6,105,35,"Tuesday, February 15",1,105
83,B08V5B923X,"SleepyCat 1-Piece Microfiber Cloud Pillow with Adjustable Zipper (32x20 inches, White)",SleepyCat,1,0,0,"1,225",4.3,632,18,,1,632
84,B09BK1VZ9Q,"JY Orthopedic Memory Foam Gel Pillow, Soft Foam Pillows, Supportive Pillow, Ventilated Pillows for Sleeping, Pillow Back Sleeper & Pillow Side Sleeper, (26 x 16 x 5 inches, White)",JY,0,0,0,899,4.2,10,55,"Thursday, February 17",1,10
85,B08BK1C4Q9,"Urban Basics Ultra Soft Microfibre Pillow, 17""x27"" Inch, White, Set of 4(PIL01_4), polyester",Urban,0,0,0,"1,399",4.1,"2,306",30,"Sunday, February 13",1,"2,306"
86,B09RPJ7GVK,"HEGZI Pillow for Kids - 1 to 5 Years - Decorative Pillows - Extra Pillow Cotton Cover - (Pack of 2, Elephant)",HEGZI,0,0,0,649,0,0,78,"Monday, February 14",1,"₹649
₹2,999 Save ₹2,350 (78%)"
87,B083BWFZHP,"PumPum Microfiber Pillow Set, 16x24 inch, White, 1 Piece, Pack of 1",PumPum,0,0,0,139,3.5,250,44,"Sunday, February 13",0,250
88,B0822SXQGH,"SleepyCat 1-Piece Air Gel Memory Foam Pillow for Sleeping & Neck Support with Removable Zipper Cover (25x16 inches, White)",SleepyCat,0,0,0,"1,691",4.1,"1,031",15,"Tuesday, February 15",1,"1,031"
89,B09GMDNFYB,Zoliva Ergonomic Memory Foam Pillows for Neck Pain and Shoulder Pain Orthopedic Cervical (1),Zoliva,0,0,0,"1,099",5.0,5,45,"Tuesday, February 15",0,5
90,B08LGVS26D,"Samrat Microfiber Bolster, Standard, White, Set Of 2 Pcs",Samrat,0,0,0,393,4.1,263,67,"Tuesday, February 15",0,263
91,B00IJRV2KI,"Recron Certified Bliss Fibre Pillow - 40 cm x 61 cm, White",Recron,0,0,0,452,3.9,258,11,"Thursday, February 10",0,258
92,B09GYLV5V1,Micro Filled Cotton Pillow Combo Set of 2 Takiya for Sleeping - (17x27 Inch Size_Stripe Ivory Print),Micro,0,0,0,630,5.0,1,37,"Tuesday, February 15",1,1
93,B09JKFB92K,"Lefre Best Sleep Microfiber Cotton 5 Star Hotel Pillow Extra Large King Size 16""*24 (40cm*60cm), White , Set of 4.",Lefre,0,0,0,499,0,0,67,"Sunday, February 13",0,"₹499
₹1,499 Save ₹1,000 (67%)"
94,B07NKPLB98,"Flamo- Organic Silk Cotton / Kapok/ Ilavam Panju Semal Cotton Sleeping Pillow, Size: 25 x 15 inches,Multicolor.",Flamo-,0,0,0,700,4.4,7,53,"Monday, February 14",0,7
95,B075R5Q1CH,JDX Premium Hotel Quality Hollow Fiber Pillow Set of 2-16x24,JDX,0,0,0,299,3.8,"1,287",81,"Monday, February 14",1,"1,287"
96,B09M3P66Z3,"Mahi Fab Memory Foam Cervical Pillow for Neck Pain and Spondylitis Contour Pillow Support for Back, Side Sleepers",Mahi,0,0,0,599,0,0,63,"Monday, February 14",1,"₹599
₹1,599 Save ₹1,000 (63%)"
97,B09P1BJCZS,"Proliva Cervical Contour Memory Foam Pillow,Orthopedic Pillow for Neck Pain,Orthopedic Contour Pillow Support for Back,Stomach,Side Sleepers,Anti-Snoring Neck Pillow (Pack of 1)",Proliva,0,0,0,899,5.0,7,55,"Tuesday, February 15",0,7
98,B07WC33VL3,"HSR Collection Chenille Luxury Bolster Cover, Bolster Pillow Cover Set of 2, Round Pillow Cover Set of 2 - 32 x 16 inches | Maroon",HSR,0,1,0,256,3.8,"4,588",49,"Tuesday, February 15",0,"4,588"
99,B09KH7PJ6W,"JY Queen Pillows for Sleeping Bed Pillows Hotel Quality , Soft Down Alternative Pillows , Hypoallergenic Pillow for Side and Back Sleeper Set of 2 , Size - 16 X 26 , ( White )",JY,0,0,0,349,3.2,13,42,,0,13
100,B09GYH2WTJ,"Sleepyhead Hollow Fibre Pillow (Slate Grey & Orange, 26x16 inches) -Set of 2",Sleepyhead,0,0,0,899,4.6,16,31,"Tuesday, February 15",1,16
101,B08PYQ22WP,"The Sleep Company SmartGRID Premium Hybrid Pillow, The Ultimate Pillow Ever Designed by Science, No Pressure Support, Cotton, White (24x16 Inches) (66x40 cm) - Pack of 1",The,0,0,0,"2,499",4.0,248,0,"Saturday, February 12",1,248
102,B09CT3V4LJ,"H B MSALA Luxury Full Body Pillow Insert - Ultra Soft Body Pillow for Sleeping - Breathable Long Bed Pillow Insert, 20""x54""(Navy Blue)",H,0,0,0,499,0,0,75,"Monday, February 14",0,"₹499
99
₹1,999 Save ₹1,499.01 (75%)"
103,B09C3S5JW8,Sleeping Pillow - Micro Fiber Filled Dark Grey Plain Cotton Pillow Takiya Combo Set of 2 for Bed Room - 17x27 Inch Size Pillow Set of 2 for Sleeping,Sleeping,0,0,0,599,4.3,114,50,"Tuesday, February 15",1,114
104,B00QLOMIO0,Kurlon pillow Kalpana Economy-White Colour,Kurlon,0,0,0,310,3.4,78,13,"Saturday, February 12",0,78
105,B07TP8FM5P,"Apurva interiors SLEEPWELL Norma Cotton Flexi Puff Foam Pillow (White, XL)",Apurva,0,0,0,715,3.2,18,11,"Thursday, February 17",0,18
106,B08S3H5G3H,DOCTOR REST Hotel & Home Premium Microfiber Soft Fibre Bed Pillow Set of 2 16x24 inch White,DOCTOR,0,0,0,699,3.9,10,59,"Monday, February 14",1,10
107,B09M8TZZVR,"MY ARMOR Micro Fibre Bolster Bed Pillow, 10 x 25 inch, White , 2 Pieces",MY,0,0,0,799,4.9,46,38,"Wednesday, February 16",1,46
108,B073726R5M,AmazonBasics Polyester Ultra Soft Down Alternative Bed Pillows Large 2 Pack- 20X26 inches (50.8 cmX66.04 cm),AmazonBasics,0,0,0,"1,345",4.0,"5,586",50,,1,"5,586"
109,B09PRGW7YX,Youngsters Choice Presents Microfiber & Polyster Ultra Soft Blue Line Pillow for Home (Set of 6),Youngsters,0,0,0,699,0,0,65,"Sunday, February 13",1,"₹699
₹1,999 Save ₹1,300 (65%)"
110,B07VNT4D81,Tishnagi Designer Ultra Soft Body Pillow Long Side Sleeper Pillows for Use During Pregnancy - 100% Cotton Soft White Stripes Cover Shell with Soft Polyester Filling (Single Pack),Tishnagi,0,0,0,749,4.5,"2,803",66,"Monday, February 14",1,"2,803"
111,B08R7MX63N,"SleepyCat 2-Piece Microfiber Cloud Pillow with Adjustable Zipper (27x18 inches, White)",SleepyCat,0,0,0,"1,784",4.3,632,25,,1,632
112,B08KT8K4JK,Dreamline Sienna Rolling Pack Pillow (41x61),Dreamline,0,0,0,199,3.9,9,60,,0,9
113,B09H515Z6J,"Habitat Bed Amara Pillows for Sleeping King Size Pillow 20 x 36 Inch Set of 2, Hollow conjugated Pillow Home & Hotel Collection Fluffy Pillows Soft and Firm Down Alternative Fill, 2 Pack",Habitat,0,0,0,769,5.0,2,68,"Tuesday, February 15",0,2
114,B08SHW8XY5,"Hush Value Pillow | Imported Softex Fiber Filling Soft Feel (17 x 27 x 7.25 Inch, White) | Set of 2",Hush,0,0,0,"1,010",4.4,6,16,"Monday, February 14",1,6
115,B09NJVMQBR,"Shivay Fashion Memory Foam Cervical Pillow for Neck Pain and Spondylitis Contour Pillow Support for Back, Side Sleepers",Shivay,0,0,0,699,3.1,7,56,"Monday, February 14",1,7
116,B09NDSBTW5,Casa Haus YYY Collection- 5 Pack Pillows Fillers/Inserts (16 x 24 inches) - White,Casa,1,0,0,999,4.9,17,33,"Wednesday, February 16",1,17
117,B09KVH9235,"Homerz Set of 2 Bamboo Fabric Fiber Pillow, Size 17x27 Inches , 3D Conjugated Fiber Filled, Vacuum Pack",Homerz,1,0,0,849,3.8,5,29,"Tuesday, February 15",1,5
118,B089YTMMJP,"HOMY DECOR Bombay Dyeing 100% Cotton Cloth, Luxury Hotel Collections Soft Pillow, White, 17 X 27 Inch, Pack of 2",HOMY,1,0,0,799,4.0,397,60,"Thursday, February 17",1,397
119,B0822SXQGH,"SleepyCat 1-Piece Air Gel Memory Foam Pillow for Sleeping & Neck Support with Removable Zipper Cover (25x16 inches, White)",SleepyCat,1,0,0,"1,691",4.1,"1,031",15,"Tuesday, February 15",1,"1,031"
120,B08PYQ22WP,"The Sleep Company SmartGRID Premium Hybrid Pillow, The Ultimate Pillow Ever Designed by Science, No Pressure Support, Cotton, White (24x16 Inches) (66x40 cm) - Pack of 1",The,1,0,0,"2,499",4.0,248,0,"Saturday, February 12",1,248
121,B09NY1Y8GV,Cloth Fusion Microfiber Bed Pillow Set of 2 Pieces (17x27 Inches),Cloth,1,0,0,649,3.9,9,35,"Saturday, February 12",1,9
122,B096SZBLRM,"Homerz Microfiber Platinum Knitted King Size Pillow for Bed, Super Soft 250 GSM Knitted Fabric - 2 PC (Snow White, 17x27 Inch)",Homerz,1,0,0,849,3.8,65,53,"Tuesday, February 15",1,65
123,B09NDRCGJZ,Casa Haus YYY Collection - Soft Pillows Fillers/Inserts - White (17X27 inch)- Pack of 5,Casa,1,0,0,"1,199",4.9,17,40,"Wednesday, February 16",1,17
124,B09QJSM86H,"Anju Enterprises WhiteFiber Blue Star Printed Pillow Sets (White Cotton,Set of 3,16 x 24 inch )",Anju,0,0,0,310,0,0,76,"Sunday, February 13",1,"₹310
₹1,299 Save ₹989 (76%)"
125,B08CC38NWZ,"Wakewell Pillow for Bed, Soft Pillow for Sleeping | 61 cm x 41 cm - 1 White Bed Pillow",Wakewell,0,0,0,259,3.4,169,57,"Tuesday, February 15",0,169
126,B09G6BCQYV,"Hari Shankar Trading Company Bombay Dyeing Cotton Cloth, Bolster Round Pillow Filled with Reliance Microfiber, White, 16X 32 Inch, Set of 2",Hari,0,0,0,349,3.2,6,42,"Tuesday, February 15",1,6
127,B09LHY9SBN,"Premium Quilted Pillows Filled with Reliance High Density Micro Fiber Super Soft Sleeping Pillows 26"" X 16"" Set of 2 (Golden",Premium,0,0,0,348,3.6,10,42,,0,10
128,B09P85MC82,"CHEMAX Contour Memory Foam Pillow for Sleeping, Orthopedic Pillow for Neck Pain, Support for Back, Stomach, Side Sleepers, with Breathable Zip Cover Pack of - (1)",CHEMAX,0,0,0,549,4.5,18,45,"Monday, February 14",0,18
129,B098P97P3M,"ATOOTFUSION Microfiber Luxury Ultra Soft Full Body Breathable Long Bed Pillow Insert (Grey, 20""x54"")",ATOOTFUSION,0,0,0,595,3.8,51,70,"Monday, February 14",1,51
130,B09BL8C1QV,"JY Reliance Microfiber Feeling Satin Stripe Fabric Bed Pillow for Sleeping ( 16'' X 26'' , White line , Set of 2 )",JY,0,0,0,299,3.6,112,57,,0,112
131,B07R5BQ5G9,"Royalking Microfiber Bed Pillow Bolster, 12 x 30 inch, White, Set Of 2",Royalking,0,0,0,650,4.0,"1,419",57,"Tuesday, February 15",1,"1,419"
132,B09RPX2W2X,Atootfusion Natural Orthopedic Pillow Luxurious Quality Pillow Filler with Fibre Microfiber Pillow 16X25 Inch Count 02 Checkered Pillow (Black and White Check) (Reliance Microfiber Soft Plush Pillow),Atootfusion,0,0,0,349,0,0,83,"Monday, February 14",0,"₹349
₹1,998 Save ₹1,649 (83%)"
133,B07Y1W9D1Q,"TCC Soft Sleeping Fibre Pillow for Bedroom, Single,16""x27"", White",TCC,0,0,0,399,2.7,3,20,"Sunday, February 13",0,3
134,B07VBXF4GH,"PumPum Polyester Fiber Hill Hard Bed Bolster Pillows for Sleeping (White, 27 x 9 Inches , 5236)",PumPum,0,0,0,219,3.5,294,0,"Sunday, February 13",0,294
135,B09NVW78J6,Trova Fashion Store Cotton Filled with Microfibre & Polyster Ultra Soft Floral Printed Bed Pillow Sets ( Pack of 6 ),Trova,0,0,0,0,4.2,4,0,,0,4
136,B09JPDTMB7,"ADRIAN Cervical Contour Memory Foam Pillow,Orthopedic Pillow for Neck Pain,Orthopedic Contour Pillow Support for Back,Stomach,Side Sleepers,Anti-Snoring Neck Pillow (Multi)",ADRIAN,0,0,0,749,4.4,39,42,"Monday, February 14",1,39
137,B08RHLFQXB,"SCPmarts Create Your Desire Micro-Satin Pillow Cover with Filler, (12 Inch x 12 Inch)",SCPmarts,0,0,0,299,3.9,16,57,"Monday, February 14",1,16
138,B09BTSMKS2,Solid Polyester Fiber Pillow AA1 Best for Heavenly Sleep White Pack of 1,Solid,0,0,0,229,3.2,27,62,"Sunday, February 13",1,27
139,B096FVLQL3,"MECNIOX Machine Washable Microfiber Luxury Soft Pillow for Sleeping (White Fiber 16 x 24 Inch , 4)",MECNIOX,0,0,0,749,5.0,2,58,"Tuesday, February 15",0,2
140,B07S14N5K9,SleepX Flexi Pillow,SleepX,1,0,0,"1,699",3.7,6,10,"Tuesday, February 15",0,6
