,asin,title,brand,Sponsored,Best Seller,Amazon's Choice,Price,Rating,NoofRatings,Discount,Delivery,Prime Delivery,base
0,B07KSMBL2H,"AmazonBasics Flexible Premium HDMI Cable (4K@60Hz, 18Gbps), 3-Foot",AmazonBasics,1,0,0,399,4.4,"310,967",43,"Monday, February 21",1,"310,967"
1,B01H7M6YKI,"AmazonBasics 6-Feet High-Speed HDMI 2.0 Cable, Pack of 3",AmazonBasics,1,0,0,692,4.6,"9,051",37,"Friday, February 18",1,"9,051"
2,B087CXB6JX,"NISHTECH (1.5 Meter) 4K Ultra HD HDMI Male to Male Cable (Black) -Compatible with Laptop, PC, Projector & TV",NISHTECH,0,0,1,149,4.0,456,79,"Monday, February 21",1,456
3,B014I8SX4Y,"AmazonBasics High-Speed HDMI Cable, 6 Feet (2-Pack),Black",AmazonBasics,0,0,0,400,4.4,"310,967",71,"Sunday, February 20",1,"310,967"
4,B07KSMBL2H,"AmazonBasics Flexible Premium HDMI Cable (4K@60Hz, 18Gbps), 3-Foot",AmazonBasics,0,0,0,399,4.4,"310,967",43,"Monday, February 21",1,"310,967"
5,B01M4GGIVU,"Tizum High Speed HDMI Cable with Ethernet | Supports 3D, 4K | for All HDMI Devices, Laptop, Computer, Gaming Console, TV, Set Top Box (1.5 Meter/ 5 Feet)",Tizum,0,0,0,199,4.0,"12,876",72,"Friday, February 18",1,"12,876"
6,B08WRSMVKW,"ZEBRONICS Zeb-HAA3020 (3 Meter/9 feet) HDMI Cable Supports 3D, ARC & CEC Extension, Compatible with HDMI-Enabled TV, Blu-ray, Playstation (Gold Plated Connectors)",ZEBRONICS,0,0,0,319,4.4,639,65,"Friday, February 18",1,639
7,B00316263Y,"BlueRigger High Speed HDMI Cable with Ethernet - Supports 3D, 4K 60Hz, Audio Return - Latest Version (6.6 Feet / 2 Meters)",BlueRigger,0,0,0,529,4.4,"37,386",24,"Friday, February 18",1,"37,386"
8,B085194JFL,"Tizum HDMI to VGA Adapter Cable 1080P for Projector, Computer, Laptop, TV, Projectors & TV",Tizum,0,1,0,279,4.0,"12,876",44,"Friday, February 18",1,"12,876"
9,B00GG59HU2,"BlueRigger High Speed HDMI Cable with Ethernet - Supports 3D, 4K 60Hz and Audio Return - Latest Version (3 Feet / 0.9 Meter)",BlueRigger,0,0,0,549,4.4,"37,386",8,"Friday, February 18",1,"37,386"
10,B07RX14W22,"AmazonBasics High-Speed 4K HDMI Cable with Braided Cord, 6 Feet, Red",AmazonBasics,1,0,0,390,4.5,618,60,"Friday, February 18",1,618
11,B01D5H93FW,"AmazonBasics 3-Feet High-Speed HDMI 2.0 Cable, Pack of 3",AmazonBasics,1,0,0,599,4.2,"4,652",50,"Friday, February 18",1,"4,652"
12,B01MECSWM2,"Tizum Aura Gold Plated 1.5M HD 1080P HDMI Cable High Speed Data 10.2Gbps, 3D, 4K, 5 Ft",Tizum,0,0,0,228,4.2,"2,558",67,"Sunday, February 20",1,"2,558"
13,B01NCKAR6H,"Belkin High Speed HDMI Cable Supports Ethernet, 3D, 4K, 1080p, Audio Return (1 Meter, Black)",Belkin,0,0,0,369,4.4,"4,367",38,"Friday, February 18",1,"4,367"
14,B0060B7NCG,"BlueRigger Ultra Series (Braided-Nylon) 4K HDMI Cable/HDMI Cord (6 feet / 1.8 Meters, HDMI to HDMI, TOP Series) supports (4K@60HZ,1080p FullHD, UHD/Ultra HD, 3D, High Speed with Ethernet, ARC, PS4, XBOX, HDTV)",BlueRigger,0,0,0,619,4.4,"16,527",38,"Sunday, February 20",1,"16,527"
15,B079R1MNZM,HP 4VW10PA HDMI to HDMI 1.0m Cable (Black),HP,0,0,0,285,4.3,156,71,"Tuesday, February 22",0,156
16,B08PPHFXG3,Posh 1.5 Meter High Speed Gold Plated HDMI Male to Female Extension Cable (Black),Posh,0,0,0,199,4.3,634,80,"Friday, February 18",1,634
17,B01M4GG9J3,"Tizum High Speed HDMI Cable with Ethernet | Supports 3D, 4K Compatible with All HDMI Devices (1.5 Meter/ 5 Feet)",Tizum,0,0,0,189,4.3,"1,647",81,"Friday, February 18",1,"1,647"
18,B07S14G6N1,"AmazonBasics High-Speed 4K HDMI Cable with Braided Cord, 6 Feet, Light Grey",AmazonBasics,0,0,0,499,4.5,523,49,"Friday, February 18",1,523
19,B01N4C3XFT,"Belkin High Speed HDMI Cable Supports Ethernet, 3D, 4K, 1080p, Audio Return (2 Meter,Black)",Belkin,0,0,0,399,4.4,"4,367",47,"Friday, February 18",1,"4,367"
20,B07KSNXF64,"AmazonBasics Premium Flexible HDMI Cable and Mini HDMI Adapter, 6-Feet, Black, NOT Compatible with Mobile Phones and Laptops",AmazonBasics,1,0,0,271,3.9,886,61,"Friday, February 18",1,886
21,B01HQ2H2XM,"CableCreation Ultra Thin HDMI Male to Male, 3.3ft HDMI 4K High-Speed Ultra Slim Low Profile Cable, Support 3D, 4K@60Hz, Audio Return (Last Standard) Compatible with PS4, X-Box etc, Braided, 1M",CableCreation,1,0,0,649,4.5,"1,067",35,"Tuesday, February 22",1,"1,067"
22,B014I8SP4W,"AmazonBasics High-Speed HDMI Cable, 3 Feet (2-Pack) - Supports Ethernet, 3D, 4K video",AmazonBasics,0,0,0,509,4.4,"310,967",54,"Friday, February 18",1,"310,967"
23,B08WRFHBW2,"ZEBRONICS Zeb-HAA5020 (5 Meter/ 16 feet) HDMI Cable Supports 3D, ARC & CEC Extension, Compatible with HDMI-Enabled TV, Blu-ray, Playstation (Gold Plated Connectors) HDMI Cable",ZEBRONICS,0,0,0,429,4.4,639,71,"Sunday, February 20",1,639
24,B07KSNXF64,"AmazonBasics Premium Flexible HDMI Cable and Mini HDMI Adapter, 6-Feet, Black, NOT Compatible with Mobile Phones and Laptops",AmazonBasics,0,0,0,271,3.9,886,61,"Friday, February 18",1,886
25,B01M5967SY,"Tizum Aura Gold Plated 3M HD 1080P HDMI Cable High Speed Data 10.2Gbps, 3D, 4K, 10 Ft",Tizum,0,0,0,379,4.2,"2,558",62,"Friday, February 18",1,"2,558"
26,B00GG57JO8,"BlueRigger High Speed HDMI Cable with Ethernet - Supports 3D, 4K 60Hz, Audio Return - Latest Version (10 Feet / 3 Meters)",BlueRigger,0,0,0,760,4.4,"37,386",31,"Friday, February 18",1,"37,386"
27,B07RX14W22,"AmazonBasics High-Speed 4K HDMI Cable with Braided Cord, 6 Feet, Red",AmazonBasics,0,0,0,390,4.5,618,60,"Friday, February 18",1,618
28,B00REG4NOC,"Belkin High Speed HDMI Cable Supports Ethernet, 4KGold Plated Audio Return (6.6 Feet,Black)",Belkin,0,0,0,499,4.4,"4,367",44,"Friday, February 18",1,"4,367"
29,B0718ZN31Q,Rts™ High Speed 3D Full HD 1080p Support (10 Meters) HDMI Male to HDMI Male Cable TV Lead 1.4V for All Hdmi Devices- Black (10M - 30 FEET),Rts™,0,0,0,598,4.2,525,88,"Sunday, February 20",1,525
30,B08RBYHFW7,"TERABYTE 10 Meter HDMI Male to HDMI Male Cable TV Lead 1.4V High Speed Ethernet 3D Full HD 1080p HDMI Cable (Black For Computer, Laptop, Tablet)",TERABYTE,0,0,0,488,4.1,177,51,"Monday, February 21",1,177
31,B08MYB46L8,"Live Tech High Speed HDMI Cable with Ethernet - Supports 3D, 4K and Audio Return (1.8 Meter/ 6 Feet)- Flix (Black, Metal)",Live,0,0,0,217,4.3,247,64,"Friday, February 18",1,247
32,B08PKYJWG7,Hybite® High Speed Full HD HDMI Male to HDMI Male Cable (15 Meter),Hybite®,0,0,0,650,4.7,7,66,"Tuesday, February 22",1,7
33,B09GW2J76K,"AGARO HDMI to HMDI Cable 2 Meters, HDMI 2.0, Ultra High Speed, 48Gbps 4K@60Hz Support Dynamic HDR, 3D, eARC, HDCP 2.2, Cotton Braided HDMI Cord for PS5/PS4/Xbox/Apple TV/Projector, Black (33567)",AGARO,0,0,0,352,4.5,63,50,"Sunday, February 20",1,63
34,B0873Y1XWQ,"JGD PRODUCTS High-Speed (1.5 Meter) 4K Ultra HD HDMI Male to Male Cable (Black) -Compatible with Laptop, PC, Projector & TV",JGD,0,0,0,145,3.9,48,79,"Monday, February 21",1,48
35,B09PD4GRLV,"ZeniQ 4K HDMI 2.0b Certified, 2Meters, ARC Priority, 18Gbps 4K@60hz, 8K@30Hz, HDCP 2.2, Dolby Vision 4:4:4 HDR, Compatible for PS4, Xbox Series S, QLED TV [ 4K@60hz Certified ]",ZeniQ,0,0,0,999,4.6,221,50,"Monday, February 21",1,221
36,B094NH3BZG,Viaxos Hdmi to vga Adapter Cable HDMI Male to VGA Female Video Converter Adapter Cable,Viaxos,0,0,0,238,3.8,46,40,"Friday, February 25",0,46
37,B08CSD1YHH,DIGIFLOOR (Pack of 2) HDMI Female to HDMI Female Cable Adapter Extender Coupler (Gold),DIGIFLOOR,0,0,0,189,3.8,134,37,"Monday, February 21",1,134
38,B015OW3QVS,AmazonBasics DisplayPort (not USB port) to HDMI Cable - 15 Feet,AmazonBasics,1,0,0,"1,399",4.1,"28,090",33,"Friday, February 18",1,"28,090"
39,B014I8T4MO,AmazonBasics High-Speed HDMI Cable - 10 Feet (2-Pack) (Latest Standard),AmazonBasics,1,0,0,969,4.4,"310,967",53,"Friday, February 18",1,"310,967"
40,B09HK4R3Y5,"Electroline 1.5 Meter HDMI Male to HDMI Male Cable TV Lead High Speed 3D Full HD 1080p HDMI Cable (Black For Computer, Laptop)",Electroline,0,0,0,139,5.0,1,30,"Thursday, February 24",0,1
41,B009W8EWOG,BlueRigger High Speed HDMI to DVI Adapter Cable (3 Feet / 0.9 Meter),BlueRigger,0,0,0,459,4.2,"12,929",49,"Sunday, February 20",1,"12,929"
42,B09M8BHT72,"Storite Short Length 19 Pin HDMI Male to Female 4K Extension Cable,High Speed HDMI Extension Cable Male to Female Adapter for Laptop/PC - (10 cm,Black)",Storite,0,0,0,199,5.0,5,80,"Friday, February 18",1,5
43,B01M61V3LV,"Tizum High Speed HDMI Cable “Ultra”- HDMI 2.0 -Gold Plated-High Speed Data 18Gbps, 3D, 4K, HD 2160p (1.5-Meter)",Tizum,0,0,0,279,4.0,"1,113",63,"Friday, February 18",1,"1,113"
44,B08ZY635ZX,"Etzin DVI to HDMI Adapter Bi-Directional DVI Male to HDMI Female Converter HDTV (24+1) Support 1080P, 3D for PS3,PS4,TV Box,Blu-ray,Projector",Etzin,0,0,0,179,4.2,90,88,"Monday, February 21",1,90
45,B08JM4YJ5T,"Storite (10cm-100mm) High Speed 19 Pin HDMI Male to Female Extension Cable HDMI Extender for Google Chrome Cast, fire tv Stick, Laptop/PC, LCD/LED TV, Xbox, PS3/PS4- Black",Storite,0,0,0,169,4.2,524,76,"Friday, February 18",0,524
46,B08RBWDJF1,"TERABYTE 5 Meter HDMI Male to HDMI Male Cable TV Lead 1.4V High Speed Ethernet 3D Full HD 1080p HDMI Cable (Black For Computer, Laptop, Tablet)",TERABYTE,0,0,0,299,4.0,117,50,"Monday, February 21",0,117
47,B08SDZTFRS,"QAADO High Speed Hdmi Cable Male to Male 3D, 4K Video and Audio Return (1.5M) Black (SML-0110-hdmi Cable 1.5 M)",QAADO,0,0,0,195,4.5,11,61,"Friday, February 18",1,11
48,B075ZWHNJT,AmazonBasics Braided HDMI Cable - 25-Feet,AmazonBasics,1,0,0,"1,365",4.6,"2,389",45,"Friday, February 18",1,"2,389"
49,B01H7M782G,"AmazonBasics T0YQ3 10-Feet High-Speed HDMI 2.0 Cable, Pack of 3",AmazonBasics,1,0,0,810,4.4,"3,918",68,"Friday, February 18",1,"3,918"
50,B09MN3192B,"iSOUL HDMI Cable, High-Speed Ultra HD HDMI 2.0 Cable, Supports 3D Formats with Audio Return Compatible with Fire TV HDMI 2.0/1.4, Blu-ray/PS4/PS5/Xbox Series X/Switch HD 1080p PC 1.5 Meter Silver Plated",iSOUL,0,0,0,177,4.7,9,61,"Tuesday, February 22",0,9
51,B01H7M6YKI,"AmazonBasics 6-Feet High-Speed HDMI 2.0 Cable, Pack of 3",AmazonBasics,0,0,0,692,4.6,"9,051",37,"Friday, February 18",1,"9,051"
52,B09DSHFLPZ,"Kinsound 4K HDMI Cable, High Speed HDMI Cable with Ethernet Supports 3D, 4K,1080P Compatible with TV, Projector, Nintendo Switch, PS, Xbox, All HDMI Devices, 1.5M",Kinsound,0,0,0,799,4.8,14,38,"Sunday, February 20",1,14
53,B07Q11QBHT,OXYURA High-Speed HDMI Cable (1.5 Meter),OXYURA,0,0,0,0,3.8,56,0,,0,56
54,B06XDMKQKJ,"CableCreation USB C to HDMI Cable for Home Office, 6ft USB 3.1 Type C to HDMI 4K Thunderbolt 3 Compatible with MacBook Pro/Air/iPad Pro 2020 2019, Surface Book 2, Dell XPS 15, Galaxy S20/S10, More Type C Devices with Display Port Alternate Mode Required",CableCreation,0,0,0,"1,115",3.8,"7,885",30,"Tuesday, February 22",1,"7,885"
55,B08JQMHT9H,"Live Tech HDMI to VGA with 1PC Audio Cable (Extra 1PC Free), Gold-Plated HDMI to VGA Adapter (Male to Female) for Computer, Laptop, HDTV, Xbox - [NOT for VGA to HDMI] (1 Year Warranty) (Black/White)",Live,0,0,0,289,4.0,"2,582",79,"Sunday, February 20",1,"2,582"
56,B09FGVLMZ4,"Storite 35cm High Speed HDMI Cable Male to Male Cable for LED/LCD TV, PC Monitor, Setup Box (Pack of 2)",Storite,0,0,0,299,4.3,36,77,"Friday, February 18",1,36
57,B08RC583GR,"TERABYTE 20 Meter HDMI Male to HDMI Male Cable TV Lead 1.4V High Speed Ethernet 3D Full HD 1080p HDMI Cable (Black For Computer, Laptop, Tablet)",TERABYTE,0,0,0,948,4.0,32,27,"Tuesday, February 22",1,32
58,B01HQ2H3YU,"CableCreation Ultra Thin HDMI Male to Male, 10ft HDMI 4K High-Speed Ultra Slim Low Profile Cable, Support 3D, 4K@60Hz, Audio Return (Last Standard), Latest Version for PS4, X-Box etc, Braided, 3M",CableCreation,1,0,0,644,4.5,"1,067",23,"Tuesday, February 22",1,"1,067"
59,B086D42F83,"CableCreation 8K HDMI Cable, High Speed 48Gbps 8K 60Hz Ultra HD, HDCP 2.2,4:4:4 HDR, eARC, Compatible for PS5, PS4, Xbox One/Xbox Series X, QLED TV,Roku TV, VIZIO TV(3.2ft)",CableCreation,1,0,0,"1,199",4.4,"1,396",56,"Tuesday, February 22",1,"1,396"
60,B06XRKKC1K,"Avolon High-Speed HDMI Cable Latest Version - 1.5 Meters ( 5 Feet ) Supports Ethernet, 3D, 4K And Audio Return",Avolon,1,0,0,299,4.4,56,40,"Wednesday, February 23",1,56
61,B09PRGLBNF,"Storite 20M HDMI Male to Male Cable High Speed 18Gbps HDMI 2.0 Cord Supports 4K Ultra HD, 3D, 1080p, Ethernet Compatible for TV, Laptop, PC, Monitor & Projector (Black)",Storite,1,0,0,"2,599",0,0,10,"Sunday, February 20",1,"₹2,599
₹2,899 Save ₹300 (10%)"
62,B00S0ABFI8,"BlueRigger HDMI Cable Extension Male to Female HDMI Extender Cord 4K Compatible for TV Stick, Roku Stick, Chromecast, Nintendo Switch Wii U, Xbox One 360, PS4 PS3, Blu Ray Player, HDTV, Laptop PC (1.5 FT)",BlueRigger,0,0,0,435,4.5,178,38,"Friday, February 18",1,178
63,B08S755PXM,"Storite Gold-Plated High-Speed Premium Series 19 Pin HDMI Male to Male Cable 1.5 Meter -Supports 3D,4K 30Hz, Video 4K 2160p 1080p- Compatible with Laptop, PC, Projector & TV-Black",Storite,0,0,0,299,4.3,313,85,"Friday, February 18",1,313
64,B09GVYY1KW,"AGARO HDMI to HMDI Cable 5 Meters, HDMI 2.0, Ultra High Speed, 48Gbps 4K@60Hz Support Dynamic HDR, 3D, eARC, HDCP 2.2, Cotton Braided HDMI Cord for PS5/PS4/Xbox/Apple TV/Projector, Black (33569)",AGARO,0,0,0,817,4.5,63,49,"Sunday, February 20",1,63
65,B083Q283J8,"UGREEN HDMI Cable 4K Braided High Speed HDMI Cord 18Gbps with Ethernet Support 4K 60HZ Compatible for UHD TV, Monitor, Computer, Xbox 360, PS4, Blu-ray and More (6FT)",UGREEN,0,0,0,639,4.7,"3,676",25,"Wednesday, February 23",1,"3,676"
66,B004GW5PTY,"BlueRigger Ultra Series (Braided-Nylon) 4K HDMI Cable/HDMI Cord (3 feet / 0.9 Meters, HDMI to HDMI, TOP Series) supports (4K@60HZ,1080p FullHD, UHD/Ultra HD, 3D, High Speed with Ethernet, ARC, PS4, XBOX, HDTV)",BlueRigger,0,0,0,544,4.4,"16,527",22,"Friday, February 18",1,"16,527"
67,B08GLW3NND,"BlueRigger Ultra Series 8K HDMI to HDMI Cable with 48Gbps Speed, (10 Feet / 3 Meters) Supports 8K@60HZ,1080p FullHD, UHD/Ultra HD, 3D, High Speed with Ethernet, ARC, PS4, Xbox, HDTV",BlueRigger,0,0,0,"1,539",4.3,272,49,"Sunday, February 20",1,272
68,B01MF5I7AF,"Tizum High Speed HDMI Cable Aura -Gold Plated-High Speed Data 10.2Gbps, 3D, 4K, HD 1080P (16 Ft/ 5 M)",Tizum,0,0,0,519,4.2,"2,558",48,,1,"2,558"
69,B014I8T4MO,AmazonBasics High-Speed HDMI Cable - 10 Feet (2-Pack) (Latest Standard),AmazonBasics,0,0,0,969,4.4,"310,967",53,"Friday, February 18",1,"310,967"
70,B08HYS1DR8,"cableCreation USB C to HDMI Cable 4K 6ft for Home Office, Braided USB Type C to HDMI Cable [Thunderbolt 3 Compatible], for MacBook/ Pro/ Air, iPad Pro 2020, Surface Book 2, Galaxy S20/S10, Aluminum",cableCreation,1,0,0,"1,238",3.8,"7,885",59,"Tuesday, February 22",1,"7,885"
71,B089GLXRHB,"CableCreation Mini HDMI to HDMI Cable, Support 4K 60Hz Ultra HD, 3D, High Speed, 6 Feet",CableCreation,1,0,0,798,4.5,324,78,"Tuesday, February 22",1,324
72,B07BCCRFW4,"PremiumAV 4K Ultra HD HDMI Male to Male Cable (1.5, Black)",PremiumAV,0,0,0,199,4.1,"5,300",75,"Monday, February 21",1,"5,300"
73,B08TTY4WFJ,"Kinsound 8K HDMI Cable, HDMI Cable 2.1 Ultra High Speed 48Gbps 8K/60Hz HDR eARC HDMI Cable for TV, Roku, Samsung, Sony, LG, Nintendo Switch, PS, Xbox 2M",Kinsound,0,0,0,"1,399",4.3,70,39,"Sunday, February 20",1,70
74,B01M09PT7O,"CableCreation Displayport to HDMI Adapter, 4K 3D Gold Plated DP to HDMI Converter Male to Female 1.4V Black",CableCreation,0,0,0,514,4.2,"3,515",36,"Tuesday, February 22",1,"3,515"
75,B09MFQCFHR,"JAMUS Gold Plated 20 Meter 1.4v 4k for 3D/led/Plasma Tv, hdmi Cable 20 Meter Full hd Heavy Male to Male HDMI Cable",JAMUS,0,0,0,860,3.0,3,20,"Wednesday, February 23",0,3
76,B00CBFS2T8,"Belkin High Speed HDMI Cable Supports Ethernet, 3D, 4K, 1080p,Gold Plated Audio Return (3.3 Feet,Black)",Belkin,0,0,0,459,4.4,"4,367",37,"Friday, February 18",1,"4,367"
77,B09FGH54YM,"MAYUMI Hi Speed HDMI CABLE 1.5 meter 5 feet Supports Ethernet, 3D, 4K Video",MAYUMI,0,0,0,149,5.0,1,70,"Wednesday, February 23",1,1
78,B00P67T436,"Storite 90cm 19pin High Speed HDMI Cable, Male to Male HDMI Cord Supports 4K@30Hz, 2160p, 1080p & 3D and Audio Return for TV, Laptop, PC, Monitor & Projector - Black",Storite,0,0,0,199,4.0,"1,525",80,"Friday, February 18",1,"1,525"
79,B09JSPQ1M1,"likes of india TV-out Cable 10cm High Speed HDMI Male to Female Extension Cable HDMI Extender for Google Chrome Cast, fire tv Stick, Laptop/PC, LCD/LED TV, Xbox, PS3/PS4- Black (Black, For Laptop)",likes,0,0,0,148,0,0,75,"Monday, February 21",1,"₹148
₹599 Save ₹451 (75%)"
80,B015OW3P1O,"AmazonBasics DisplayPort (not USB port) to HDMI Cable - 10 Feet, Black",AmazonBasics,1,0,0,"1,618",4.1,"28,090",15,"Friday, February 18",1,"28,090"
81,B014I8TFR8,"AmazonBasics 3 Feet and 15 Feet High-Speed HDMI Cable, Pack of 2 (Black) - Supports Ethernet, 3D, 4K video",AmazonBasics,1,0,0,999,4.4,"310,967",0,"Friday, February 18",1,"310,967"
82,B09GKYZ2XQ,"APM HDMI Splitter Amplifier Repeater 1080p 4K 4 Port Hub 3D 1 in 4 out Extender Multi Ports for TV, Xbox One, Roku 3, HD TV Xbox PS3 PS4",APM,1,0,0,"1,000",2.4,4,17,"Monday, February 21",0,4
83,B07X4QHZHF,"AmazonBasics High-Speed Fiber Optic HDMI Cable (18 Gpbs - 4k/60Hz), Supports Ethernet, 3D, 4K and ARC - 30-Foot",AmazonBasics,1,0,0,"3,171",4.4,157,63,"Friday, February 18",1,157
84,B09GVZJ3NJ,"AGARO HDMI to HMDI Cable 3 Meters, HDMI 2.0, Ultra High Speed, 48Gbps 4K@60Hz Support Dynamic HDR, 3D, eARC, HDCP 2.2, Cotton Braided HDMI Cord for PS5/PS4/Xbox/Apple TV/Projector, Black (33568)",AGARO,0,0,0,525,4.5,63,52,"Friday, February 18",1,63
85,B09NVWJHW8,"Storite 60cm High Speed HDMI Cable Male to Male Cable for LED/LCD TV, PC Monitor, Setup Box (Pack of 2)",Storite,0,0,0,0,5.0,1,0,,0,1
86,B08276QLHM,"UGREEN 8K HDMI Cable Ultra HD High Speed 48Gbps HDMI 2.1 8K 60Hz Support Dynamic HDR, Dolby Vision, eARC, Compatible for Xbox One, Nintendo Switch, PS4 Pro, Samsung TV, Roku, Nylon Braided (3FT)",UGREEN,0,0,0,869,4.6,"1,193",28,"Wednesday, February 23",1,"1,193"
87,B09KGYXLQB,"Etzin HDMI Male to Dual HDMI Female HDMI Cable (Compatible with TV, Black)",Etzin,0,0,0,290,3.6,8,81,"Tuesday, February 22",1,8
88,B0752V3ZNV,"PRUTHVIK High Speed 3D Full HD 1080p Support (10 Meters) HDMI Male to HDMI Male Cable TV Lead 1.4V for All Hdmi Devices Supports All HDMI Devices, High Speed 3D, 4K, Full HD 1080p - Black (10M - 30 FEET)",PRUTHVIK,0,0,0,579,4.3,309,88,"Sunday, February 20",1,309
89,B08HYS1DR8,"cableCreation USB C to HDMI Cable 4K 6ft for Home Office, Braided USB Type C to HDMI Cable [Thunderbolt 3 Compatible], for MacBook/ Pro/ Air, iPad Pro 2020, Surface Book 2, Galaxy S20/S10, Aluminum",cableCreation,0,0,0,"1,238",3.8,"7,885",59,"Tuesday, February 22",1,"7,885"
90,B085HC43Q9,"USB C to HDMI Cable with HDR 4K@60Hz, 2K@144Hz, 2K@120Hz, CableCreation USB Type C to HDMI Adapter Thunderbolt 3 Compatible for MacBook Pro/Air, iMac, iPad Pro 2020, Galaxy S20 S10/Note 10 and More",USB,0,0,0,"1,299",4.3,332,35,"Tuesday, February 22",1,332
91,B08HJXH1WN,"Live Tech HDMI to VGA with 1PC Audio Cable (Extra 1PC Free), Gold-Plated HDMI to VGA Adapter (Male to Female) for Computer, Laptop, HDTV, Xbox - [NOT for VGA to HDMI] (1 Year Warranty) (Black)",Live,0,0,0,289,4.0,"2,582",79,"Friday, February 18",1,"2,582"
92,B07S14G6N1,"AmazonBasics High-Speed 4K HDMI Cable with Braided Cord, 6 Feet, Light Grey",AmazonBasics,1,0,0,499,4.5,523,49,"Friday, February 18",1,523
93,B06XRGXCDS,"Avolon High-Speed HDMI Cable - 3 Meters (10 Feet) Supports Ethernet, 3D, 4K and Audio Return, With Gold Plated Connector",Avolon,1,0,0,399,4.4,64,20,"Wednesday, February 23",1,64
94,B07KYDRJTC,Terabyte Tera Byte 3Mtr 4K Ultra HD HDMI to HDMI Cable (Black),Terabyte,0,0,0,205,4.0,64,59,"Monday, February 21",1,64
95,B08L7P6YB8,"Tobo HDMI Female to DVI D Adapter 24 + 1 Pin Male HDMI2DVI Cable Switch Converter for PC, PS3, Projector, TV Box, LCD, HDTV.",Tobo,0,0,0,199,4.0,74,60,"Tuesday, February 22",1,74
96,B08RC1ZK87,"TERABYTE 15 Meter HDMI Male to HDMI Male Cable TV Lead 1.4V High Speed Ethernet 3D Full HD 1080p HDMI Cable (Black For Computer, Laptop, Tablet)",TERABYTE,0,0,0,613,4.1,68,39,"Tuesday, February 22",1,68
97,B00QRYW5N8,"Terabyte PNP High Speed 1.4 Version HDMI Cable (5 m , Black)",Terabyte,0,0,0,499,4.1,786,50,"Monday, February 21",1,786
98,B07QFQQDN5,"Storite High Speed Gold Plated Right Angle 90 Degree Hdmi Male to Female Extension Cable for fire tv stick, Laptop/PC, LCD/LED TV, Xbox, PS3/PS4– 22cm",Storite,0,0,0,269,4.3,851,73,"Friday, February 18",1,851
99,B079ND7V5C,"Storite Short Length 19 Pin HDMI Male to Female 4K Extension Cable for fire tv stick, Laptop/PC,Xbox, PS3/PS4 - Black",Storite,0,0,0,299,4.1,625,70,"Friday, February 18",1,625
100,B095NCP4Z3,"GITRU Metal HDMI Splitter 1 in 2 Out, 4K HDMI Splitter for Dual Monitors Duplicate/Mirror Only, 1x2 HDMI Splitter 1 to 2 Amplifier for Full HD 1080P 3D with HDMI Cable (1 Source onto 2 Displays)",GITRU,0,0,0,865,1.8,3,33,"Sunday, February 20",1,3
101,B06XRKKC1K,"Avolon High-Speed HDMI Cable Latest Version - 1.5 Meters ( 5 Feet ) Supports Ethernet, 3D, 4K And Audio Return",Avolon,0,0,0,299,4.4,56,40,"Wednesday, February 23",1,56
102,B014I8SP4W,"AmazonBasics High-Speed HDMI Cable, 3 Feet (2-Pack) - Supports Ethernet, 3D, 4K video",AmazonBasics,1,0,0,509,4.4,"310,967",54,"Friday, February 18",1,"310,967"
103,B01LZGO3HP,Honeywell HDMI 1.4 Cable with Ethernet - 2M,Honeywell,1,0,0,599,4.5,876,8,"Friday, February 18",1,876
104,B09HKW7J48,"Rec Trade 4K HDMI Switch 2 Ports Bi-Directional HDMI Switcher Splitter Supports Compatible with HDTV, DVD, Blu-Ray, Satellite, DVR. (RTT-SWT-0077)",Rec,1,0,0,852,0,0,43,"Tuesday, February 22",1,"₹852
₹1,499 Save ₹647 (43%)"
105,B09PGCJ5BB,"DigiReach® HDMI Cable 2 Meter 4K UHD - HDMI 2.0 - ARC - HDCP 2.2 - 4K 4:4:4 60FPS - HDR - 18Gbps - Gold Plated Connector - Premium HDMI for TV - Projectors -AVR - PS4 - PS5 - Apple TV - Bluray (4K UHD, 2 Meter) - (HD2-4K)",DigiReach®,1,0,0,498,5.0,1,50,"Monday, February 21",1,1
106,B094XM2JKG,"LOGIC HDMI 2.0 Cable 3 Meter (10 Feet) Male to Male 4K@60 Hz 24K Gold Plated, Supports EDID & CEC",LOGIC,0,0,0,499,4.5,27,37,"Wednesday, February 23",1,27
107,B01MYXXGQQ,"Belkin High Speed HDMI Cable Supports Ethernet, 3D, 4K, 1080p, Audio Return (5 Meter,Black)",Belkin,0,0,0,899,4.4,"4,367",36,"Friday, February 18",1,"4,367"
108,B014I8TRXA,"AmazonBasics High-Speed HDMI CL3 Cable, 25 Feet",AmazonBasics,0,0,0,975,4.4,"16,880",73,"Friday, February 18",1,"16,880"
109,B08HD35V62,Techworld Computers Service Terabyte 1.5 mtr HDMI Cable,Techworld,0,0,0,104,3.7,23,79,"Monday, February 21",0,23
110,B09PGCJ5BB,"DigiReach® HDMI Cable 2 Meter 4K UHD - HDMI 2.0 - ARC - HDCP 2.2 - 4K 4:4:4 60FPS - HDR - 18Gbps - Gold Plated Connector - Premium HDMI for TV - Projectors -AVR - PS4 - PS5 - Apple TV - Bluray (4K UHD, 2 Meter) - (HD2-4K)",DigiReach®,0,0,0,498,5.0,1,50,"Monday, February 21",1,1
111,B095WRLV63,"Yanmai 1.5-Meter HDMI Male to Male Cable (Black), MST-758",Yanmai,0,0,0,198,0,0,74,"Friday, February 18",1,"₹198
₹749 Save ₹551 (74%)"
112,B00REG4POK,"Belkin High Speed HDMI Cable Supports Ethernet, 3D, 4K, 1080p,Gold Plated Audio Return (5M/16 Feet, Black)",Belkin,0,0,0,"1,300",4.4,"4,367",57,"Monday, February 21",1,"4,367"
113,B09J1DFC7F,"Techati Ultra High Speed HDMI cable - 3 meters (HDMI 2.1 standard) - Supports 8K 60Hz / 4K 120Hz / 48 Gbps / 3D / Ethernet - compatible with TV, computer, monitor, PS5, Xbox 360 and more",Techati,0,0,0,"1,199",4.6,16,40,"Wednesday, February 23",1,16
114,B06ZZ68SBZ,"AmazonBasics High-Speed 4K HDMI Cable, 10 Feet, 10-Pack",AmazonBasics,1,0,0,"3,199",4.4,"310,967",47,"Friday, February 18",1,"310,967"
115,B01M09PT7O,"CableCreation Displayport to HDMI Adapter, 4K 3D Gold Plated DP to HDMI Converter Male to Female 1.4V Black",CableCreation,1,0,0,514,4.2,"3,515",36,"Tuesday, February 22",1,"3,515"
116,B07F2D5KJ1,"Upix® HDMI Cable (Male to Male) 4.5 Meters (15 Feet) - Supports All HDMI Devices, High Speed 3D, 4K, Full HD 1080p",Upix®,0,0,0,359,3.9,34,3,"Monday, February 21",1,34
117,B01LZGO3HP,Honeywell HDMI 1.4 Cable with Ethernet - 2M,Honeywell,0,0,0,599,4.5,876,8,"Friday, February 18",1,876
118,B081RVG4H4,QIU YE YUAN HDMI Cables High Speed with Ethernet HDMI Cable 4K UHD HDMI Cables V2.0 Support 4Kx2K 32 Audio Channels Audio Return 18Gbps Ethernet CEC 3D for OnePlus Mi TV (1 m),QIU,0,0,0,499,4.0,4,64,"Monday, February 21",1,4
119,B07HL5R9D3,"Tizum High Speed HDMI Cable “Ultra”- HDMI 2.0 -Gold Plated-High Speed Data 18Gbps, 3D, 4K, HD 2160p (10 Ft/ 3M-Grey)",Tizum,0,0,0,379,4.0,"1,113",64,"Friday, February 18",1,"1,113"
120,B005LQ83EI,"BlueRigger in-Wall High Speed 18Gbps HDMI Cable - CL3 Rated - Supports 4K 60Hz, Ultra HD, 3D, 1080p, Ethernet and Audio Return (Latest Standard) (25 Feet (7.5 Meters)",BlueRigger,0,0,0,"1,655",4.4,"37,386",8,"Friday, February 18",1,"37,386"
121,B09CDX8ZZ3,"WETEK 4K Ultra High Speed Full HD HDMI Male to Female Cable (33 cm) for TV, Computer, Laptop, Projector, Satellite TV Box.",WETEK,0,0,0,149,3.2,9,75,"Monday, February 21",0,9
122,B073VL88C5,"Storite 45cm High Speed 19 Pin HDMI Cable Male to Male Cable With Audio Return for LED/LCD TV, PC Monitor, Setup Box (Pack of 2)",Storite,0,0,0,349,4.0,481,73,"Friday, February 18",1,481
123,B01FM51WYK,"CableCreation DisplayPort to HDMI Cable 3 Feet, Gold Plated DP to HDMI Cable 4K & 3D Audio/Video Converter Black",CableCreation,0,0,0,999,4.5,536,77,"Tuesday, February 22",1,536
124,B014I8TC4E,AmazonBasics High-Speed HDMI Cable - 25 Feet (Latest Standard),AmazonBasics,1,0,0,"1,399",4.3,"31,214",61,"Friday, February 18",1,"31,214"
125,B09PRGXTC5,"Storite 3m HDMI Male to Male Cable High Speed 18Gbps HDMI 2.0 Cord Supports 4K Ultra HD, 3D, 1080p, Ethernet Compatible for TV, Laptop, PC, Monitor & Projector (Black)",Storite,1,0,0,699,0,0,56,"Friday, February 18",1,"₹699
₹1,599 Save ₹900 (56%)"
126,B097Y3MNF5,"Rec Trade 4K 120M HDMI Extender Cascade Connection Via Cat5e CAT6 RJ45 Ethernet Network Cable TX RX Kit for PS4, DVD Player, TV Box, PC to TV. (RTT-EXT-0089)",Rec,1,0,0,"6,173",0,0,64,"Tuesday, February 22",1,"₹6,173
₹16,999 Save ₹10,826 (64%)"
