,asin,title,brand,Sponsored,Best Seller,Amazon's Choice,Price,Rating,NoofRatings,Discount,Delivery,Prime Delivery,base
278,B0922KZGFB,"TRIDENT Comfort Living Pillow 100% Polyester (2-Piece Pillows) Fluffy, Bouncy, Non- Allergic, Washable, Optimum Neck Support, 650 GSM Filling (White)",TRIDENT,0,0,0,749,3.8,25,50,"Thursday, February 17",0,25
279,B08W8HWC22,ATOOTFUSION Black and White Check Bolster (30 X 9.5 Inches) Set of 02 (Cotton Hard Bolster Set),ATOOTFUSION,0,0,0,498,3.7,173,75,"Wednesday, February 16",0,173
280,B01MZ5TZIS,"Sleepwell Microfiber Pillow (White, L) - Pack of 2",Sleepwell,0,0,0,860,3.6,30,14,"Monday, February 21",0,30
281,B089N717YP,"HOMY DECOR Microfiber Pillow, 17 X 27 Inch, White, 1 Piece",HOMY,0,0,0,430,4.2,404,52,"Monday, February 21",1,404
282,B096PQQLT3,JDX Premium Hotel Quality Hollow Fiber Pillow (17x27 Inches) -Set of 2,JDX,0,0,0,604,3.6,3,76,"Thursday, February 17",1,3
283,B08SC4PD7G,DOCTOR REST Comfort King Premium Microfiber Soft Fibre Bed Pillow 18x27 inch White,DOCTOR,0,0,0,449,3.8,18,36,"Thursday, February 17",1,18
284,B09JCHJF8S,"H B MSALA Luxury Full Body Pillow Insert - Ultra Soft Body Pillow for Sleeping - Breathable Long Bed Pillow Insert, 20""x54""",H,0,0,0,499,0,0,75,"Wednesday, February 16",0,"₹499
₹1,998 Save ₹1,499 (75%)"
285,B07Z4TDW39,"MOJOREST Memory Foam Pillow for Sleeping, Pillow for Neck and Shoulder Pain with Removable Cover, King/Large Size (White)",MOJOREST,0,0,0,999,4.0,"1,385",60,"Wednesday, February 16",1,"1,385"
286,B07R5BQ5G9,"Royalking Microfiber Bed Pillow Bolster, 12 x 30 inch, White, Set Of 2",Royalking,0,0,0,650,4.0,"1,427",57,"Thursday, February 17",1,"1,427"
287,B09NNLRP2S,"Kurl-On Knitted Fabric Premium Compressed Bamboo Pillow ,68 x 43 x 5 cm, Cream Color,1 Pieces",Kurl-On,0,0,0,699,0,0,0,"Thursday, February 17",1,₹699
288,B09NVWP7XK,Trova Fashion Store Cotton Filled with Microfibre & Polyster Ultra Soft Floral Printed Bed Pillow Sets ( Pack of 5 ),Trova,0,0,0,479,0,0,56,"Wednesday, February 16",1,"₹479
₹1,099 Save ₹620 (56%)"
289,B09HCFKGPG,"Sleepyhead Memory Foam Pillow, Pack of 2 (25x16 inches, Grey)",Sleepyhead,0,0,0,"2,299",4.0,84,23,"Friday, February 18",1,84
290,B08HLRFN1W,SWEETSAGA Sleeping Playing Soft Fiber Filled White Pillow (17x27 Inch) - 2 Pillows Made in India,SWEETSAGA,0,0,0,598,3.6,5,60,"Thursday, February 17",1,5
291,B09RQLT8CY,"Pillow Set of 2,Pillow Set of 2 for Sleeping,Cotton,Soft,Printed Pillows Set of 2,Pillow 17 x 27 inches,,Printed _ Blue Stripe_02",Pillow,0,0,0,620,0,0,38,"Thursday, February 17",1,"₹620
₹999 Save ₹379 (38%)"
292,B08P8KGQ3J,DOCTOR REST Comfort King Luxury Microfibre Fiber Bed Pillow Set of 2 18x27 inch White Stripe,DOCTOR,0,0,0,799,3.9,46,53,"Thursday, February 17",1,46
293,B09824TQKY,"ROYALREOX Reliance Microfiber, Machine Washable Pillow for Sleeping (16 x 24 White Fibre) (4)",ROYALREOX,0,0,0,549,0,0,63,"Thursday, February 17",0,"₹549
₹1,499 Save ₹950 (63%)"
294,B093CF24X3,"Chahit Microfiber Pillow Insert/Filler Pack of 1 (20 X 36, Light Grey)",Chahit,0,0,0,649,5.0,1,50,"Wednesday, February 16",1,1
295,B08916ZHLS,"duroflex Fibre Pillows, 69 X 43 cm, White",duroflex,0,0,0,649,5.0,2,10,"Thursday, February 17",0,2
296,B09CDQS4NH,"The Sleep Company SmartGRID Premium Hybrid Pillow, The Ultimate Pillow Ever Designed by Science, No Pressure Support, White (24x16 Inches) (66x40 cm) - Pack of 2, Cotton",The,1,0,0,"3,698",4.0,255,47,"Thursday, February 17",1,255
297,B09N1J18CL,"Spread Spain® 100% Bamboo fibers Shredded Memory Foam Luxury Pillow Ultra Soft, Cool and Soothing Effect, Super Supportive Breathable Pillow (45 x 68 cm )",Spread,1,0,0,"5,649",0,0,0,"Wednesday, February 16",1,"₹5,649
₹5,650"
298,B07PJQHD15,"Spread Spain® Doctor Plus Pillow for Cervical Contoured Neck Memory Foam Pillow-Neck Support for Back Or Shoulder Pain 45 x 68 cm, White (Pack of 2 - Standard)",Spread,1,0,0,"7,190",3.8,25,14,"Wednesday, February 16",1,25
299,B096YD5XZR,"Homerz Premium Hotel Quality Super King Size Pillow, 20 x 30 Inch Exact Size, Superior White Cotton Polyester Fabric (4)",Homerz,1,0,0,"1,499",3.8,139,17,"Friday, February 18",1,139
300,B08R93TWLQ,"Nivedha Mattress-Organic Silk Cotton/Kapok/Semal/Ilavam Panju Classic Pillow (27 X 17 Inches),White Striped Pillow.",Nivedha,1,0,0,800,3.9,37,47,"Wednesday, February 16",1,37
301,B09GS28LX5,"Cloth Fusion Microfiber Bed Pillow Set of 2 Pieces (17x27 Inches, Black and Grey)",Cloth,1,0,0,629,3.8,14,37,"Friday, February 18",1,14
302,B08Q8JHCQP,"Morning Owl Soft Latex Pillow, Contour Pillow, eco-INSTITUT Certified 100% Natural Latex Pillow, Rubber Pillow, Best Pillow for Sleeping (58*38* 8 cm/10 cm), 1 Pillow",Morning,1,0,0,"1,755",4.2,58,41,"Thursday, February 24",1,58
303,B096YG8QCH,"Homerz Premium Hotel Quality Super King Size Pillow, 20 x 30 Inch Exact Size, Superior White Cotton Polyester Fabric (3)",Homerz,1,0,0,"1,249",3.8,139,31,"Friday, February 18",1,139
304,B09RK7HHD5,"Karan Enterprises Ultra Soft Microfibre Blue Star Bed Pillow Sets (Size-16 x 24 inch, Pack of 2)",Karan,0,0,0,219,0,0,83,"Wednesday, February 16",0,"₹219
₹1,299 Save ₹1,080 (83%)"
305,B08N4VVTXQ,"Home Centre Polyester Corsica Solid Pillows (43 cm x 70 cm, White) - Set of 2 Pcs",Home,0,0,0,499,4.3,25,0,"Thursday, February 17",1,25
306,B09BD4XNKV,"Home Style Micro Fiber Filler Super Soft Multipurpose Cotton Pillow for Sleeping, Back Support During Reading, Sitting || 16 x 26 Inch || White || Set of 2",Home,0,0,0,629,4.0,25,37,"Wednesday, February 16",0,25
307,B09RSL2CT1,"ATOOTFUSION Luxurious 2 Piece Medium Hard Perfect for Neck Pillow Filler - 16X24 Inch , White (Medium Hard Cotton Pillow)",ATOOTFUSION,0,0,0,298,0,0,85,"Wednesday, February 16",0,"₹298
₹1,998 Save ₹1,700 (85%)"
308,B08R93TWLQ,"Nivedha Mattress-Organic Silk Cotton/Kapok/Semal/Ilavam Panju Classic Pillow (27 X 17 Inches),White Striped Pillow.",Nivedha,0,0,0,800,3.9,37,47,"Wednesday, February 16",1,37
309,B09CMVW897,"Homerz Nirvana Pillow Filled with 3D Conjugated Fiber, 17 x 27 inch Exact Size, Cotton Fabric, White -Set of 2",Homerz,0,0,0,749,3.9,114,53,"Friday, February 18",1,114
310,B095ND7NR5,"Home Centre Symphony Cotton Solid Pillows (43 x 68 cm, White, Standard) - Set of 2",Home,0,0,0,699,3.5,5,0,"Thursday, February 17",1,5
311,B09QJT1SSZ,"Shree GANPAT Enterprises Ultra Soft Pillow Sets for Bed (Black Microfibre , Set of 04,Size- 68x 43Cm)",Shree,0,0,0,479,0,0,4,"Wednesday, February 16",0,"₹479
₹499 Save ₹20 (4%)"
312,B08HKDPW54,"Atootfusion Black Hosiery Medium Hard Cotton Bed Pillow for Perfect Neck Support (16"" x 25"") Hard Pillow Textured Brown Count 01",Atootfusion,0,0,0,249,3.4,24,75,"Wednesday, February 16",0,24
313,B096KF3FB7,Cotton Cloth Luxury Hotel Collections Soft Pillow || White || 16 X 26 Inch || Pack of 2,Cotton,0,0,0,238,4.0,18,87,"Thursday, February 17",0,18
314,B096QR6N6Z,"JY Soft Reliance Microfiber Satin Stripe Fabric Bed Pillow - Set of 3, White ( 16'' X 26'' )",JY,0,0,0,599,3.8,266,40,"Monday, February 21",0,266
315,B0983V8H2L,Portico New York White Celebration Pillow,Portico,0,0,0,568,4.0,1,5,"Thursday, February 17",0,1
316,B092HZPNR2,"Heart Home Leaf Design Premium Cotton Bolster Covers, 16 x 30 inch, Set of 2 (Cream)",Heart,0,0,0,269,4.2,135,10,"Monday, February 14",0,135
317,B08HLRFN1W,SWEETSAGA Sleeping Playing Soft Fiber Filled White Pillow (17x27 Inch) - 2 Pillows Made in India,SWEETSAGA,0,0,0,598,3.6,5,60,"Thursday, February 17",1,5
318,B09RNBL27K,"Outlay Home Luxury chennile Bolster Cover||Round Pillow Cover Set of 2 || Masand Cover - 32*16 inches, Navy Blue",Outlay,0,0,0,225,0,0,55,"Thursday, February 17",0,"₹225
₹499 Save ₹274 (55%)"
319,B09JBQCQYC,"H B MSALA Full Body Pillow Insert, Large Soft Body Pillows for Adults - White Breathable Long Side Sleeper Pillow for Sleeping, 20×54 inch",H,0,0,0,495,0,0,75,"Wednesday, February 16",0,"₹495
₹1,998 Save ₹1,503 (75%)"
320,B08G8RDN8Y,"MY ARMOR Orthopedic Memory Foam Pillow for Comfortable Sleep, Queen Size with Removable Outer Cover (23"" x 14"" x 4.5"")",MY,1,1,0,"1,450",4.1,"11,338",50,"Monday, February 14",1,"11,338"
321,B08WJGKNH1,"GPGP Pure Semal Cotton Pillows - Sleeping Pillows (Filled with Silk Cotton), White - Set of 2",GPGP,1,0,0,"1,999",3.8,7,0,"Friday, February 18",0,7
322,B08DP297RY,"MM FOAM Snuggle Pillow - 100% Natural Latex, High Bounceback, Hypoallergenic Thick Pillow -6"" (25.5 x 16.75 x 6 inches)",MM,1,0,0,"2,500",4.4,98,0,"Wednesday, February 16",1,98
323,B09PJFW9YQ,"Homerz Body Pillow with Waterproof Pillow Protector Cover, 54 x 20 inch Size (White)",Homerz,1,0,0,999,0,0,50,"Friday, February 18",1,"₹999
₹1,999 Save ₹1,000 (50%)"
324,B09JSXT9KH,"MKH Enterprises Uncle Chips Printed Kids Toy Pillow Single Piece for Kids Room, Play Way and Kids Valley (11X17 Inches)",MKH,0,0,0,180,4.5,4,48,"Thursday, February 17",0,4
325,B08TVMMMML,"ATOOTFUSION Microfiber Full Body Pillow Insert Without Cover,Large Body Pillow for Adults,Breathable Long Side Sleeper Pillow for Sleeping (21 x 58 Inch)-Black & White Check Big Soft Body Hug Pillow",ATOOTFUSION,0,0,0,476,3.5,89,76,"Wednesday, February 16",0,89
326,B08PYQ22WP,"The Sleep Company SmartGRID Premium Hybrid Pillow, The Ultimate Pillow Ever Designed by Science, No Pressure Support, Cotton, White (24x16 Inches) (66x40 cm) - Pack of 1",The,0,0,0,"2,499",4.0,255,0,"Wednesday, February 16",1,255
327,B01MSWY3B4,"Sleepwell Cotton Pillow, Multicolour, 4 Pieces",Sleepwell,0,0,0,"1,464",3.8,97,21,"Saturday, February 19",0,97
328,B09L4NF6JT,Bear Panda Love Couples Throw Pillow for him | Valentine Pillow for Couple | Best Gift for Couple | Best Gift for Girlfriend,Bear,0,0,0,359,5.0,1,64,"Thursday, February 17",0,1
329,B09R9RVQW7,"M/s Shekhawati E-Com Solutions Ultra Soft Microfibre Plain Bed Pillow(Black Cotton,Piece of 6, Size- 40 x 60 cm )",M/s,0,0,0,699,0,0,13,"Wednesday, February 16",0,"₹699
₹799 Save ₹100 (13%)"
330,B075QJRSMZ,"JDX 200 TC Hotel Quality Fibre Pillow (Set of 2, White) 16X24 Inches",JDX,0,0,0,454,3.8,227,55,"Wednesday, February 16",1,227
331,B09H537FZ6,"Habitat Bed Amara Pillows for Sleeping 2 Pack Standard Size 16 x 24 Inches, Hypoallergenic Pillow for Side and Back Sleeper, Soft Hotel Pillows Set of 2, Microfiber Pillow-White",Habitat,0,0,0,419,4.6,3,65,"Thursday, February 17",0,3
332,B09LVC1573,"THE WOOD WHITE Orthopedic Memory Foam Pillow for Sleeping | Cooling technic for Comfortable Sleep with Organic Tencel Hexagonal Cotton Cover. ( Memhexaorganic , 24""x15""x4.5"" Size)",THE,0,0,0,"1,099",5.0,3,48,"Wednesday, February 16",1,3
333,B084FYDMTJ,"Dreamfactory Knitted Fabric Fibre Pillow (27 x 17"", White) Pack of 1",Dreamfactory,0,0,0,499,4.1,"2,744",38,,1,"2,744"
334,B08VRPLT71,Samrat Reliance Microfiber Satin Striped Bolster Filler Set of 2 - White (Size 23 X 9 Inches),Samrat,0,0,0,490,3.9,52,62,"Wednesday, February 16",1,52
335,B01MZ5TZIS,"Sleepwell Microfiber Pillow (White, L) - Pack of 2",Sleepwell,0,0,0,860,3.6,30,14,"Monday, February 21",0,30
336,B08CCVW8B7,"HOMY DECOR Microfiber Pillow (27 x 17 Inch, Grey)",HOMY,0,0,0,425,4.1,413,57,"Monday, February 21",1,413
337,B09CZ57PS6,"JDX Polyester Ultra Soft Fluffy Luxurious Bed Pillows Set for Sleeping (White, 16 x 24 Inch ) - Pack of 2",JDX,0,0,0,507,4.0,1,49,"Wednesday, February 16",1,1
338,B0967Z3TFQ,"Homerz Premium Set of 2 Fibre Pillows for Bed 16 x 24 inch Size, White Polyester Cotton Fabric (2)",Homerz,0,0,0,599,3.4,63,57,"Friday, February 18",1,63
339,B09J1BTLWY,"Kanu Creation Cervical Contour Memory Foam Pillow,Orthopedic Pillow for Neck Pain,Orthopedic Contour Pillow Support for Back,Stomach,Side Sleepers,Anti-Snoring Neck Pillow (White) (1)",Kanu,0,0,0,549,3.7,9,45,"Thursday, February 17",0,9
340,B09CZ4T577,"VARDHAMAN ,Bombay Dyeing Cotton Cloth RELAINCE Fibre , Luxury Hotel Collections Soft Pillow, Color White, 17 X 27 Inch, Pack of 1",VARDHAMAN,0,0,0,375,3.7,4,37,"Sunday, February 20",0,4
341,B07N4BPFKK,"Sleepwell Ploy Fibre Senses Pillow (White, 68 X 43 X 10 Cm)",Sleepwell,0,0,0,899,4.0,139,10,"Friday, February 18",1,139
342,B08WJDZ84G,"Heart Home Comfort Polyester Microfiber Filled Pillow for Bed Room F_26_HEARTH016838, 16x24 Inches (Maroon)",Heart,0,0,0,166,4.0,13,33,"Wednesday, February 16",0,13
343,B09PBVZLVY,"Bien Living Extra Soft Microfiber Filled Plush Pillow, Down Alternative Hypoallergenic Pillow, 17 x 27 Inches, White (Pack of 2)",Bien,0,0,0,"1,199",5.0,1,37,"Wednesday, February 16",1,1
344,B0993HVH98,"D S Pillow Ultra Soft Microfibre Pillow (White, 16""x24"") - Set of 6",D,0,0,0,0,3.2,55,0,,0,55
345,B09G6BCQYV,"Hari Shankar Trading Company Bombay Dyeing Cotton Cloth, Bolster Round Pillow Filled with Reliance Microfiber, White, 16X 32 Inch, Set of 2",Hari,0,0,0,349,3.3,7,42,"Saturday, February 19",1,7
346,B084LBTW1N,Sevia Pressure Free Memory Foam Pillow Slow Rebound Neck/Shoulder/Head/Arm/Back Support Bed Sleeping Pillow | Arms Protector Pillow for Unisex Organizer,Sevia,0,0,0,589,4.2,4,41,"Wednesday, February 16",1,4
347,B091PKZR8R,"YAMAN Microfiber Sleeping Pillow, 40 cm X 60 cm, Polyester Fibre Floral Printed Multicolour Soft Sleeping Pillow (Pack of 1)",YAMAN,0,0,0,259,3.0,13,63,"Wednesday, February 16",0,13
348,B09NC1P2VY,"Momsyard High Premium Hollow Fibre Quilt Pillow (17x 27, White ) - 1 Piece Extra Soft Pillow",Momsyard,0,0,0,399,0,0,60,"Thursday, February 17",1,"₹399
₹999 Save ₹600 (60%)"
349,B099PQVBJN,neetutraders Cotton Blue Star Sleeping Pillow of 3,neetutraders,0,0,0,435,2.7,4,71,"Wednesday, February 16",1,4
350,B098NYQFZK,Solid Polyester Fiber Pillow U2 Best for Heavenly Sleep White Pack of 2,Solid,0,0,0,249,3.4,3,29,"Wednesday, February 16",0,3
351,B082Z6BSV2,HORCH 18 x 18 Pillow Inserts (Set of 4) - Throw Pillow Inserts with 100% Cotton Cover - 18 Inch Square Interior Sofa Pillow Inserts - Decorative Pillow Insert Pair - White Couch Pillow,HORCH,0,0,0,399,1.0,1,56,"Wednesday, February 16",1,1
352,B08ZYYXPS3,JDX Premium Hotel Quality Hollow Fibre Pillow (Set of 2-16x20 Inches),JDX,0,0,0,302,3.6,11,88,"Wednesday, February 16",1,11
353,B072LNS9JN,"AVI Microfiber Pillow, 20 Inch X 36 Inch, White, 2 Pieces",AVI,0,0,0,799,3.7,57,60,"Wednesday, February 16",1,57
354,B09GYW4ZYY,Everwey Enterprise Medium Hard Cotton Printed Pillows 17 x 27 Inches 2 Pillows,Everwey,0,0,0,649,4.0,1,46,"Thursday, February 17",1,1
355,B09C666VWH,Premium 5 Pack Pillows Fillers/Inserts (16 x 24 inches) - White Moon,Premium,0,0,0,549,4.0,6,8,"Wednesday, February 16",0,6
356,B09681WBKQ,"Homerz Premium (Set of 5) Fibre Pillows for Bed 16 x 24 inch Size, White Polyester Cotton Fabric (5)",Homerz,1,0,0,"1,298",3.8,10,7,"Friday, February 18",1,10
357,B091J1YZVZ,Quilt Comfort Microfiber U Shape Ultra-Soft Pregnancy Pillow (Misty Grey),Quilt,1,0,0,"2,548",3.9,12,36,"Wednesday, February 16",1,12
358,B09CMSSYKV,"Homerz Paradise Floral Pillow Filled with 3D Conjugated Fiber, 17 x 27 inches Exact Size, White -Set of 2",Homerz,1,0,0,749,3.9,12,56,"Friday, February 18",1,12
359,B098R5GZ6R,"Aalingan® Set of 2 Premium Quilted Pillow Charcoal, Hypoallergenic Sleeping Pillow with Cotton Fabric, Soft and Neck Supportive",Aalingan®,1,0,0,0,3.5,4,0,,0,4
360,B07P33JB3W,"Hush Fiber Pillow, 20 x 32 x 6 inch, White.",Hush,1,0,0,"2,400",4.1,43,20,"Thursday, February 17",1,43
361,B09MTVFRY3,Sleepsia Bamboo Pillow (Queen) - Shredded Memory Foam Pillow for Sleeping with Washable Pillow Cover - (Adjustable Size - 28”X17”) (Pack of 1),Sleepsia,1,0,0,"1,699",4.3,228,66,"Wednesday, February 16",1,228
362,B09KW76683,"Homerz Set of 2 Imported Conjugated Fiber Pillow, 17x 27 inch Size, Vacuum Pack (White)",Homerz,1,0,0,747,5.0,1,25,"Friday, February 18",1,1
363,B0933MTJPH,"VG MATTRESS-Organic Silk Cotton/kapok/Ilavam Sleeping Soft White Striped Classic Pillows, Size 27"" X 17"" inches (Off White, 2)",VG,1,0,0,"1,500",4.0,1,50,"Wednesday, February 16",1,1
364,B08T7NKZPY,"YJ Cotton Pillow (16x25 inch) - Set of 2, Multicolor",YJ,0,0,0,449,3.7,27,55,"Wednesday, February 16",0,27
365,B09MJC4ML1,"Wakeup Betarest Fiber Sleeping Pillow 2 Pieces (Size-27x17 inch),White-68.58 cm x 43.18 cm",Wakeup,0,0,0,875,4.0,1,46,"Friday, February 18",0,1
366,B08CC38NWZ,"Wakewell Pillow for Bed, Soft Pillow for Sleeping | 61 cm x 41 cm - 1 White Bed Pillow",Wakewell,0,0,0,249,3.4,169,58,"Thursday, February 17",0,169
367,B09Q7CJ2D7,BUDGET Pure Cotton & Microfiber Filling 2-Piece Bed Pillow Set (40 x 60 cm Or 16 x 24 inch; 500 GSM) White,BUDGET,0,0,0,594,0,0,52,"Friday, February 18",0,"₹594
₹1,249 Save ₹655 (52%)"
368,B092DBXXCC,"AVI Microfiber Pillow, 20 Inch X 30 Inch, White, 1 Pieces",AVI,0,0,0,369,4.4,4,65,"Wednesday, February 16",0,4
369,B09NSLLDMS,"Royal Looking Ultra Soft Microfibre Pillow, 17""x27"" Inch, White, Set of 4(PIL01_4), polyesterVIRGO/PILLOW-2/179",Royal,0,0,0,349,0,0,50,"Thursday, February 17",0,"₹349
₹699 Save ₹350 (50%)"
370,B00QLOM68I,"Kurl-On Polyurethane Foam Pillow Chimera, Single, White, 1 Piece, Cotton",Kurl-On,0,0,0,"1,089",4.0,62,19,"Saturday, February 19",0,62
371,B0851LG12R,"flo Extra Soft Adjustable Polyester Microfibre Pillow for Stomach and Back Sleepers Aloe Vera Gel Washable Cover (White, 17"" x 27"")",flo,0,0,0,890,4.0,102,10,"Friday, February 18",1,102
372,B08524SJLX,"Durafeel Soft Microfiber Quilted Pillow for Sleeping, 17x27 inch, White, Single",Durafeel,0,0,0,480,3.5,62,40,"Wednesday, February 16",0,62
373,B09999CM6N,"MECNIOX India 5 Star Luxury Standard Cotton Pillow Filler with Fibre for Well Night's Sleep Pack of 3 (White Foam, 16 x 24)",MECNIOX,0,0,0,649,0,0,50,"Thursday, February 17",0,"₹649
₹1,299 Save ₹650 (50%)"
374,B07XC36HH4,"PumPum 1 Piece Textrise Black Microfiber Pillow , 16 x24 inch (White) (85632)",PumPum,0,0,0,149,3.4,715,70,"Wednesday, February 16",0,715
375,B01N2RRPC2,"Sleepwell Polyester Fibre Pillow, King, White, 2 Pieces",Sleepwell,0,0,0,0,3.8,398,0,,0,398
376,B07W75LMQX,"duroflex Polyester Pillow, 27 x 17 inch, White, Off-white, 1 piece",duroflex,0,0,0,0,4.1,115,0,,0,115
377,B097S7PDFX,SOLARA Shredded Memory Foam Pillow,SOLARA,0,0,0,999,3.9,203,38,"Friday, February 18",0,203
378,B08KLJRR12,JELLEX Sleeping Memory Foam Pillow Cushion Cotton Leg Pillow Back Hip Joint Knee Pain Relief Cushion Leg Pillow and Knee Pillow (WHITE),JELLEX,0,0,0,398,3.9,27,60,"Wednesday, February 16",1,27
379,B08VMYV6BX,"Kuber Industries Soft Throw Inserts with Microfiber Filled, Full Back & Lumbar Support Decorative Pillow with Disney Printed Cover for Sofa Bed Couch & Chairs,16""x24""(Cream)-KUBMART15942, Standard",Kuber,0,0,0,299,4.5,9,0,"Wednesday, February 16",0,9
380,B0865PBL43,"MY ARMOR Orthopedic Memory Foam Pillow for Comfortable Sleep, Queen Size (Pack of 2)",MY,1,1,0,"2,150",4.1,"11,338",45,"Monday, February 14",1,"11,338"
381,B09C91ZS28,"Homerz Set of 2 Golden Cream Cloud Pillow Filled with 3D conjugated Fiber, 17 x 27 inch Size…",Homerz,1,0,0,848,3.0,2,15,"Friday, February 18",1,2
382,B07FYSXPT1,"AmazonBasics Feather Pillows , Standard, 2 Pieces",AmazonBasics,1,0,0,"1,819",4.1,413,51,"Monday, February 14",1,413
383,B09NNLRP2S,"Kurl-On Knitted Fabric Premium Compressed Bamboo Pillow ,68 x 43 x 5 cm, Cream Color,1 Pieces",Kurl-On,1,0,0,699,0,0,0,"Thursday, February 17",1,₹699
384,B091MG4KDL,"YAMAN Polyester Fibre Solid Sleeping Pillow , White Pillow , Hotel Quality Polyester Fiber, Medium Sized Ultra Soft Pillow, 16 X 24 Inch (Pack of 5)",YAMAN,0,0,0,599,3.2,22,50,"Wednesday, February 16",1,22
385,B09QL2JFCD,"S K S Enterprises Ultra Soft Microfibre Floral Printed Bed Pillow Sets (Black Cotton,Pack of 1, Size- 40 x 60 cm )",S,0,0,0,199,0,0,88,"Wednesday, February 16",0,"₹199
₹1,599 Save ₹1,400 (88%)"
386,B09KWFN6BL,"Homerz Orignal Set of 2 Yellow Piping Pillow, 17 x 27 inch Size, Filled with Imported 3D conjygated Fiber, Vacuum Pack",Homerz,1,0,0,748,3.9,3,25,"Friday, February 18",1,3
387,B09FSZHGW3,HFI Urban Arts Striped Fabric Luxury Premium Pillows - Pack of 2 Pcs| 16 x 24 Inches| White | Conjugated Virgin Fiber Filling | Hotel Quality Linen,HFI,1,0,0,625,4.5,58,50,"Thursday, February 17",1,58
388,B09D7LT7X4,"Shri Vyas Linen 100% Pure Goose Down On Top & Bottom ( Chamber Pillows ) with 5 Years Warranty(Set of 2, 21 x 36 Inches) (Chamber Pillow) | Made in India",Shri,1,0,0,"2,999",4.1,32,63,"Wednesday, February 16",1,32
389,B09CF51F2N,"Homerz Set of 4 Premium Yellow Piping Pillow, Filled with 3D Hollow conjugated Fiber, 17 x 27 inch Exact Size (4)",Homerz,1,0,0,"1,299",3.1,10,19,"Friday, February 18",1,10
