,asin,title,brand,Sponsored,Best Seller,Amazon's Choice,Price,Rating,NoofRatings,Discount,Delivery,Prime Delivery,base
0,B08GTJ4KVP,"NiTHO SWITCH / SWITCH LITE ARMOUR CASE XL, Carry Case Compatible with Nintendo Switch / Lite Console & Accessories Black Protective Hard Portable Travel Case Shell Pouch",NiTHO,1,1,0,999,4.1,20,0,"Monday, February 21",1,20
1,B0734HDH65,AmazonBasics Ultimate Storage Case for Nintendo Switch - Red,AmazonBasics,1,0,0,"1,799",4.2,261,0,"Wednesday, February 23",1,261
2,B08GTJ4KVP,"NiTHO SWITCH / SWITCH LITE ARMOUR CASE XL, Carry Case Compatible with Nintendo Switch / Lite Console & Accessories Black Protective Hard Portable Travel Case Shell Pouch",NiTHO,0,1,0,999,4.1,20,0,"Monday, February 21",1,20
3,B078HD5YTN,"UGREEN Switch Carrying Case for Nintendo Switch, Hard Shell Travel Case Pouch Protective Cover Bag with 9 Game Cartridges Card Slots for Nintendo Switch Console Pro Controller Accessories",UGREEN,0,0,0,"1,499",4.2,21,25,"Tuesday, February 22",1,21
4,B07TDLRFKK,mumba Dockable TPU Grip Protective Cover Case for Nintendo Switch and Joy-Con Controller (Black),mumba,0,0,0,"1,699",4.6,"15,116",58,"Sunday, February 20",1,"15,116"
5,B08C5FBQLK,"UGREEN Carrying Case for Nintendo Switch, W/Carved Protective Foam Lining Shockproof Travel Case Bag for Nintendo Switch Console, Dock, AC Wall Charger, Grip and Joy-con, 20 Game Cards, Cables Large",UGREEN,0,1,0,"1,699",4.2,18,43,"Tuesday, February 22",1,18
6,B01MY9JB2U,Nintendo Switch Game Traveler Case,Nintendo,0,0,0,0,4.8,"11,901",0,,0,PEGI Rating: Ages 3 and Over
7,B094N3HMKT,"OIVO Switch Carrying Case for Nintendo Switch OLED Mode, Protable Travel Case Cover with Game Card Slots, Upgraded Console Stand Holder for Nintendo Switch/Switch OLED Accessories",OIVO,0,0,0,"1,199",4.9,63,0,"Thursday, February 24",0,63
8,B08F44FJG3,"PowerA Protection Gaming Console Kit Case for Nintendo Switch or Nintendo Switch Lite with Accessories Storage, Animal Crossing (Officially Licensed)",PowerA,0,0,0,"1,353",4.8,"4,326",0,"Monday, February 21",1,PEGI Rating: Ages 3 and Over
9,B0734HDH65,AmazonBasics Ultimate Storage Case for Nintendo Switch - Red,AmazonBasics,0,0,0,"1,799",4.2,261,0,"Wednesday, February 23",1,261
10,B07GXKCPJT,"PowerA GameCube Style Wired Gaming Controller for Nintendo Switch, Black (Officially Licensed)",PowerA,1,0,0,637,4.0,"3,276",0,"Sunday, February 20",1,PEGI Rating: Ages 3 and Over
11,B07TDLRFKK,mumba Dockable TPU Grip Protective Cover Case for Nintendo Switch and Joy-Con Controller (Black),mumba,1,0,0,"1,699",4.6,"15,116",58,"Sunday, February 20",1,"15,116"
12,B0973CTYVJ,"PowerA Protection Gaming Console Kit Case for Nintendo Switch or Nintendo Switch Lite with Accessories Storage, Super Mario Bros, Mario Red/White (Officially Licensed)",PowerA,0,0,0,"1,440",5.0,1,0,"Wednesday, February 23",1,PEGI Rating: Ages 3 and Over
13,B081T5SBQ2,New World Carry Case for Nintendo Switch Lite - Portable Travel Carry Case Hard Pouch with storage for Switch Lite Games & Accessories- Black,New,0,0,0,799,4.2,13,38,"Thursday, February 24",0,13
14,B07ZT8XYJZ,"UGREEN Protective Case for Nintendo Switch, Grip Case TPU Cover Protector Accessories with Shock-Absorption Design (Black)",UGREEN,0,0,0,899,4.2,142,0,"Tuesday, February 22",1,PEGI Rating: Ages 12 and Over
15,B072WPBPBG,Amzer Shockproof Rugged Silicone Skin Jelly Case for Nintendo Switch Joy Con - Blue,Amzer,0,0,0,619,2.1,8,38,"Sunday, February 20",1,8
16,B07712RKFM,Hyperkin The Voyager Carry Case for Switch and Joy-Con,Hyperkin,0,0,0,"1,699",4.8,26,0,,1,PEGI Rating: Ages 3 and Over
17,B01N10SBT4,Nintendo Switch Zelda Breath of the Wild Premium Travel Case for Console and Games by PDP,Nintendo,0,0,0,549,4.8,"1,370",0,"Friday, February 25",0,"1,370"
18,B07WWXV5BZ,PowerA Stealth Case for Nintendo Switch - Super Mario,PowerA,0,0,0,"1,099",4.2,21,0,"Tuesday, February 22",1,PEGI Rating: Ages 3 and Over
19,B09QRP3LGT,"New world Storage Carry Case Bag for Switch OLED Console , Travel case for Nintendo Switch and New Switch OLED Console",New,0,0,0,999,5.0,1,33,,0,1
20,B07WCCN92L,"PowerA Enhanced Wired Gaming Controller for Nintendo Switch, The Legend of Zelda, Link (Officially Licensed)",PowerA,1,0,0,"1,399",4.4,758,0,"Friday, February 25",1,PEGI Rating: Ages 3 and Over
21,B08F433YYQ,"PowerA Wired Gaming Controller for Nintendo Switch, White (Officially Licensed)",PowerA,1,0,0,"2,028",4.4,516,0,"Tuesday, February 22",1,PEGI Rating: Ages 3 and Over
22,B08V8KJ83L,"Ugreen Nintendo Switch /Lite Game Card Storage Box with TF Memory Card Storage, Large Capacity Carry 12 Game + 12TF Card, Red and Blue Classic",Ugreen,1,0,0,699,4.5,5,65,"Tuesday, February 22",1,5
23,B0792VHHGZ,Digital Gaming World® New Design Zip Pouch Case for Switch Console (Color: Red) (Console not included),Digital,1,0,0,"1,399",0,0,46,"Tuesday, February 22",1,"₹1,399
₹2,599 Save ₹1,200 (46%)"
24,B09RRNHV9P,"New World Transparent Crystal case cover for Nintendo Switch OLED , Crystal Clear Protective Cover for Switch Oled Model Console",New,0,0,0,999,0,0,0,"Thursday, February 24",0,Nintendo Switch
25,B09RS6GSGN,"New World Storage Bag Carry Case Bag for Switch OLED Console , Travel Carry Case Bag with Game Storage Compatible for Nintendo Switch and New Switch OLED Console",New,0,0,0,"1,149",0,0,23,,0,"₹1,149
₹1,499 Save ₹350 (23%)"
26,B081QG4YPS,New World TPU Protector Grip Case Cover With 2 Game Card Storage Slots and Hand Grip For Nintendo Switch Lite -Yellow,New,0,0,0,599,5.0,1,40,"Wednesday, February 23",1,1
27,B07W61XX2L,Hyperkin Protective TPU Grip Case for Nintendo Switch Lite (Gray),Hyperkin,0,0,0,755,3.8,24,0,"Tuesday, February 22",1,PEGI Rating: Ages 3 and Over
28,B09RKTWKL9,"New World Protective Cover Case for Nintendo Switch OLED , Silicon Cover Case for Nintendo Switch OLED Console -White",New,0,0,0,899,0,0,0,"Thursday, February 24",0,Nintendo Switch
29,B08BXPMYGY,Protective Grip Case for Nintendo Switch Lite (White) - Hyperkin,Protective,0,0,0,854,4.7,8,0,"Tuesday, February 22",1,8
30,B08JDQGW2P,"PowerA Protection Gaming Console Kit Case for Nintendo Switch or Nintendo Switch Lite with Accessories Storage, Super Mario Bros, Running Mario (Officially Licensed)",PowerA,0,0,0,"1,440",4.2,8,0,"Tuesday, February 22",1,PEGI Rating: Ages 3 and Over
31,B07ZKK22LW,PowerA Stealth Case Kit for Nintendo Switch Lite - Super Mario,PowerA,0,0,0,"1,299",4.7,246,0,"Sunday, February 20",1,PEGI Rating: Ages 3 and Over
32,B07XD9VZSN,"Large protection pouch for Nintendo Switch Mini to store the console, 2 Joy-Con and charging cable. Blue.",Large,0,0,0,329,5.0,2,0,"Tuesday, February 22",1,PEGI Rating: Ages 3 and Over
33,B081QDLSBL,New World TPU Protector Grip Case Cover With 2 Game Card Storage Slots and Hand Grip For Nintendo Switch Lite - Green,New,0,0,0,690,5.0,1,31,"Wednesday, February 23",1,1
34,B09R9D1X5L,"New World Storage Carry Case Bag for Switch OLED Console , Travel Carry Case Bag with Game Storage Compatible for Nintendo Switch and New Switch OLED Console",New,0,0,0,"1,149",0,0,23,,0,"₹1,149
₹1,490 Save ₹341 (23%)"
35,B08V8KJ83L,"Ugreen Nintendo Switch /Lite Game Card Storage Box with TF Memory Card Storage, Large Capacity Carry 12 Game + 12TF Card, Red and Blue Classic",Ugreen,0,0,0,699,4.5,5,65,"Tuesday, February 22",1,5
36,B07SY8YKS3,"Dobe Protective Case Protector Case for Nintendo Switch Lite, Hard Clear Crystal Case for Nintendo Switch Lite",Dobe,0,0,0,547,2.9,3,0,"Tuesday, February 22",1,PEGI Rating: Ages 7 and Over
37,B094JSW9KD,Maxcom® Protective Travel Carry Bag Felt Pouch for Nintendo Switch Lite and Switch Game Case Games & Accessories,Maxcom®,0,0,0,799,0,0,60,"Wednesday, February 23",1,"₹799
₹1,999 Save ₹1,200 (60%)"
38,B084S5KG9L,Foldable Case and Screen Protector Set for Nintendo Switch Lite (Turquoise) - Hyperkin,Foldable,0,0,0,899,4.2,26,0,"Tuesday, February 22",1,26
39,B099YRX4LC,CASEOLOGY Spigen Tempered Glass Screen Guard Protector Compatible with Nintendo Switch OLED - 2 Pack,CASEOLOGY,0,0,0,"1,198",4.5,69,0,"Sunday, February 20",1,69
40,B09FP26WHX,Spigen EZ Fit Tempered Glass Screen Protector Guard for Nintendo Switch OLED (2021) - 2 Pack,Spigen,0,0,0,"1,098",4.6,153,0,"Sunday, February 20",1,153
41,B081XWJBTM,Plus Tempered Glass Screen Guard Protector for 6.2 inch Nintendo Switch 2017,Plus,0,0,0,199,4.3,47,60,"Tuesday, February 22",1,47
42,B09BYVZ427,"Charging Dock for Nintendo Switch Lite and for Nintendo Switch, Compact Charger Stand Station with Type C Port Compatible with Nintendo Switch Lite",Charging,0,0,0,559,4.5,2,69,"Wednesday, February 23",1,2
43,B09N6SB9FJ,"Mumba Case for Nintendo Switch OLED 2021, [Thunderbolt Series] Protective Clear Cover with TPU Grip Compatible with Nintendo New Switch OLED 7 Inch Console and Joy-Con Controller (FrostBlack)",Mumba,0,0,0,"2,299",4.6,181,0,"Monday, February 21",1,181
44,B07G4XY77Q,PowerA NSW Protection Kit - LOZ,PowerA,0,0,0,"1,299",4.4,9,0,"Sunday, February 20",1,PEGI Rating: Ages 3 and Over
45,B07CBGT4BP,"RDS Industries Nintendo Switch GoPlay Game Traveler Accessory Pack, Comes with Case, Grip Stand, Cleansing Cloth and Multi-Game cases",RDS,0,0,0,"3,099",4.6,970,0,"Tuesday, February 22",1,PEGI Rating: Ages 3 and Over
46,B07XB6W61X,Polycarbonate transparent case for Nintendo Switch Mini. Allows the protection of the console and Joy-Cons.,Polycarbonate,0,0,0,630,3.0,11,0,"Monday, February 21",1,PEGI Rating: Ages 3 and Over
47,B01N22YBVY,PowerA Hybrid Cover/Travel Case for Nintendo Switch,PowerA,0,0,0,"1,163",4.6,341,0,"Tuesday, February 22",1,PEGI Rating: Ages 3 and Over
48,B08GMT55C9,"NiTHO SWITCH 2x TEMPERED SCREEN PROTECTOR 9H, Double Glass Protector for Nintendo Switch 6.2 Inch Display Twin Pack Anti Scratch",NiTHO,0,0,0,360,4.1,28,0,"Sunday, February 20",1,28
49,B071PB1BBH,AmazonBasics Starter Kit for Nintendo Switch (Red),AmazonBasics,0,0,0,"1,499",4.2,"1,081",0,"Sunday, February 20",1,"1,081"
50,B07CJMDF1B,Bigben Protective Hard Case for Nintendo Switch Console Size Large - Blue,Bigben,0,0,0,"1,099",4.7,13,0,"Wednesday, February 23",1,PEGI Rating: Ages 3 and Over
51,B07ZS54PV4,Spigen Rugged Armor Back Cover Case Compatible with Nintendo Switch Lite - Matte Black,Spigen,0,0,0,"1,899",4.8,699,37,"Sunday, February 20",1,699
52,B079L1RN77,CamKix Compatible Game Case Replacement for Nintendo Switch - Fits up to 24 Nintendo Switch Games - Protective Storage System - Game Card Organizer - Travel Container Box - Hard Shell with 24 Slots,CamKix,0,0,0,0,4.1,533,0,,0,533
53,B081QFM9T1,New World TPU Protector Grip Case Cover With 2 Game Card Storage Slots and Hand Grip For Nintendo Switch Lite -White,New,0,0,0,699,5.0,3,22,"Friday, February 25",0,3
54,B07D2D4T1P,Smatree Hard Protective Case for Nintendo Switch-Comfort Handheld Back Cover for Nintendo Switch Console,Smatree,0,0,0,0,4.6,550,0,,0,550
55,B09GPLP8W5,Tobo Silicone Case Compatible with Ninte-ndo Switch Lite - Dark Green Silicone Console(TNS 19099),Tobo,0,0,0,899,0,0,70,"Thursday, February 24",1,"₹899
₹2,999 Save ₹2,100 (70%)"
56,B07PDJ3LDF,"PowerA Protection Gaming Console Kit Case for Nintendo Switch with Accessories Storage, NERF Elite, Blue (Officially Licensed)",PowerA,0,0,0,"1,899",4.8,87,0,"Tuesday, February 22",1,PEGI Rating: Ages 3 and Over
57,B073VSRM16,PowerA Hybrid Cover/Travel Case for Nintendo Switch – Splatoon 2,PowerA,0,0,0,590,4.5,70,0,"Wednesday, February 23",0,PEGI Rating: Ages 3 and Over
58,B07VG45KHD,"SpunKo Game Card Case for Nintendo Switch, Aluminum, Portable & Thin Game Card Storage Holder Box with 6 Cartridge Slots",SpunKo,0,0,0,"2,779",4.7,795,30,"Wednesday, March 9",0,795
59,B07X6DVCJJ,Spigen Glas.tR Slim Tempered Glass Screen Protector Guard for Nintendo Switch - 2 Pack,Spigen,0,0,0,899,4.7,490,0,"Monday, February 21",1,490
60,B08H123WCV,TCOS TECH Switch Carry Case Shockproof Storage Case Hard Shell Cover Bag Pouch For Nintendo Switch,TCOS,0,0,0,0,5.0,1,0,,0,1
61,B08MCDT9DL,"MrDeal 7 in 1 Switch Lite Accessories Bundle Kit, Case & Screen Protector for Nintendo Switch Lite, Storage Soft Bag Box Set with Soft TPU Case, Screen Protector and Thumb-Grip Jointed-Arm Cap",MrDeal,0,0,0,699,3.8,11,53,"Wednesday, February 23",1,11
62,B07TR7H11H,8-in-1 Retro-Style Cartridge Case for Nintendo Switch - Hyperkin,8-in-1,0,0,0,599,4.6,13,0,,1,8-in-1
63,B07BYP3X61,Nintendo Switch Donkey Kong Carrying Case Protective Deluxe Travel Case PU Leather Exterior Official Nintendo Licensed Product,Nintendo,0,0,0,"1,799",4.8,370,0,"Tuesday, February 22",1,PEGI Rating: Ages 12 and Over
64,B07DPS45PH,4 in 1 Protective Kit for Nintendo Switch EVA Hard Travel Games Case Pouch with LCD Screen Protector,4,0,0,0,999,4.2,2,60,"Thursday, February 24",0,4
65,B08F451HF5,"PowerA Everywhere Messenger Protection Bag for Nintendo Switch or Nintendo Switch Lite with Acessories Storage, Brown (Officially Licensed)",PowerA,0,0,0,"2,999",4.8,669,0,"Friday, February 25",0,PEGI Rating: Ages 3 and Over
66,B01MR5Y7ZL,Nintendo Switch Zelda Breath of the Wild Secure Game Case For Up to 6 Games by PDP,Nintendo,0,0,0,768,4.5,141,0,"Sunday, February 20",1,141
67,B0859QBX4N,Spigen Rugged Armor Back Cover Case Compatible with Nintendo Switch Lite - Frost Clear,Spigen,0,0,0,"1,899",4.7,133,37,"Sunday, February 20",1,133
68,B07538J9CT,PowerA Hybrid Cover/Travel Case for Nintendo Switch – Super Mario,PowerA,0,0,0,334,4.5,82,0,"Tuesday, February 22",1,82
69,B07PNXLMMP,TCOS TECH Nintendo Switch Lite Full Silicone Case Cover Grip Skin for Nintendo Switch Lite Console,TCOS,0,0,0,499,4.0,2,0,"Wednesday, February 23",1,2
70,B09N6VY5B4,"SUPCASE Unicorn Beetle Forma Series Case for Nintendo Switch OLED Model (2021), Rugged Slim Protective Case with Dustproof Front Cover & 5 Game Card Storage Slots",SUPCASE,0,0,0,"2,499",4.9,14,38,"Tuesday, February 22",1,14
71,B08787FGJJ,"JJC Deluxe Switch Game Case Game Cartridges Storage Holder for 12 Nintendo Switch Games & 12 Sandisk microSDXC microSD on Nintendo Switch & Nintendo Switch Lite, Compact, Shock-resistance & Waterproof",JJC,0,0,0,0,4.7,159,0,,0,159
72,B0848T4224,"Dobe Protective Case Protector case for Nintendo Switch Lite, Hard Clear Crystal Case for Nintendo Switch Lite",Dobe,0,0,0,749,3.8,3,6,"Friday, February 25",0,3
73,B07W8NCLTQ,"TiMOVO Cover for Nintendo Switch Lite Case, Anti-Slip Soft Silicone Cover Case Protective Shell for Nintendo Switch Lite Console - Turquoise",TiMOVO,0,0,0,"1,199",4.6,681,0,"Thursday, February 24",1,681
74,B077GC2R64,Blade Fr-tec DragonBall Super Design Nintendo Switch Protective Case with Grips Combo Pack for Video Game,Blade,0,0,0,699,4.2,203,0,"Wednesday, February 23",0,PEGI Rating: Ages 3 and Over
75,B08FTRGYHY,"NiTHO SWITCH BATTLE ROYAL PACK, Protective Grip Case for Nintendo Switch Joy Con – Skin Grips, Thumb Grips - Black",NiTHO,0,0,0,499,3.6,4,0,"Sunday, February 20",1,4
76,B084S5BX8X,Foldable Case and Screen Protector Set for Nintendo Switch Lite (Yellow) - Hyperkin,Foldable,0,0,0,"1,299",3.6,7,0,"Tuesday, February 22",1,7
77,B09RZNRK5T,"New World Crystal Case Cover for Nintendo Switch OLED ,Transparent Crystal Clear Case Protective Cover for Nintendo Switch OLED",New,0,0,0,999,0,0,44,"Thursday, February 24",0,"₹999
₹1,799 Save ₹800 (44%)"
78,B09KNKJ4K6,GADGETSWRAP 1 Set Silicone Case Protective Cover Compatible with Nintendo Switch Gaming Controller - Black,GADGETSWRAP,0,0,0,299,0,0,70,"Wednesday, February 23",1,"₹299
₹1,001 Save ₹702 (70%)"
79,B0759XJGGB,Segolike 3 In 1 Protective Cover Case For Nintendo Switch Gamepad Controller Clear,Segolike,0,0,0,928,0,0,61,"Wednesday, March 2",0,"₹928
₹2,365 Save ₹1,437 (61%)"
80,B09GLVKW2J,Tobo Switch Joy-Con Silicon Case (Rubber Plug) TNS-1708 DO-BE Nint-endo Switch Joy-Con Silicon Case (Rubber Plug) + Dust-Proof Cover Kit for NS,Tobo,0,0,0,999,0,0,67,"Thursday, February 24",1,"₹999
₹2,999 Save ₹2,000 (67%)"
81,B09HGTW7RQ,"SUPCASE Unicorn Beetle Pro Series Case for Nintendo Switch OLED Model (2021), Dockable Rugged Protective Case Compatible with Nintendo Switch Console (Black)",SUPCASE,0,0,0,"1,999",4.1,65,50,"Sunday, February 20",1,65
82,B091H1GJNW,ELTON Nintendo Switch Console Silicone Case Kit 7PCS,ELTON,0,0,0,999,0,0,0,"Wednesday, February 23",1,Windows Server 2011
83,B08LYHMH7G,Verilux® Hard PU+EVA Protective Case Box Storage Bag Holder for Nintendo Switch Game Black,Verilux®,0,0,0,823,0,0,29,"Thursday, February 24",1,"₹823
₹1,155 Save ₹332 (29%)"
84,B09GPNR7QQ,Tobo Silicone Case Compatible with Ninte-nda Switch Lite - Dark Gray Silicone Console(TNS 19099),Tobo,0,0,0,899,0,0,70,"Thursday, February 24",1,"₹899
₹2,999 Save ₹2,100 (70%)"
85,B08F44QTJQ,"PowerA Folio Case for Nintendo Switch or Nintendo Switch Lite with Accessories Storage, Brown (Officially Licensed)",PowerA,0,0,0,"1,999",4.4,118,0,"Friday, February 25",0,PEGI Rating: Ages 3 and Over
86,B0773JXVZ9,"Dobe - Nintendo Switch Hard Carry Case with 10 Game Cartridge, Carry Shell Pouch for Nintendo Switch Console& Accessories, Black",Dobe,0,0,0,0,5.0,2,0,,0,2
87,B08R7RR2ZY,PABULUM Compatible with AirPods Pro 2019 Case Protective Cover (Nintendo Switch),PABULUM,0,0,0,349,3.8,130,65,"Wednesday, February 23",1,130
88,B09S4XCXWX,"New World Crystal Case Cover for Nintendo Switch OLED ,Transparent Crystal Clear Case Protective Cover for Nintendo Switch OLED Model",New,0,0,0,999,0,0,0,"Thursday, February 24",0,Nintendo Switch
89,B081Q9WY92,New World Premium Soft Silicone Cover Rubber Protective Case Cover For Nintendo Switch Lite Full Body Silicon Protector Case -Yellow,New,0,0,0,549,4.1,12,39,"Thursday, February 24",0,12
90,B09CPY72XQ,"PSS Protective Case Cover for Nintendo Switch Lite, Silicone Protective Rubber Cover, Shock-Absorption Anti-Scratch Non-Slip Case for Nintendo Switch Lite Console - Yellow",PSS,0,0,0,0,4.0,2,0,,0,2
91,B07XB6XPCZ,Accessori Vari Switch Big Ben Transport Case - S per Switch Lite,Accessori,0,0,0,"1,399",5.0,1,0,"Sunday, February 20",1,PEGI Rating: Ages 3 and Over
92,B0756YWYTP,QUICK POUCH COLLECTION for Nintendo Switch Super Mario Type-A,QUICK,0,0,0,"1,199",4.3,20,0,"Thursday, February 24",1,20
93,B07D5CN74D,Hytech Plus Nintendo Switch Travel Carrying Case (Black),Hytech,0,0,0,895,5.0,3,0,"Thursday, February 24",1,3
94,B07NTG5LPX,Dobe Carrying Case Hard EVA Carry Shell Travel Case Game Traveler Deluxe For Nintendo Switch,Dobe,0,0,0,890,0,0,64,"Thursday, February 24",1,"₹890
₹2,499 Save ₹1,609 (64%)"
95,B082MVZ92M,Spigen Klasden Cover Case Compatible With Nintendo Switch Lite (2019) - Charcoal Gray,Spigen,0,0,0,"2,499",4.7,67,49,"Sunday, February 20",1,67
96,B07X559WXY,Official Nintendo Switch Travel Case (Mario Maker),Official,0,0,0,0,4.8,"1,111",0,,0,PEGI Rating: Ages 3 and Over
97,B06XC8M985,Blade Fr-tec Nintendo Switch VR Universal Storage and Carrying Case VR (PSVR) Headset and Accessories Bag,Blade,0,0,0,"1,199",4.5,5,0,"Wednesday, February 23",0,5
98,B08T252SV8,"MYCHEER Cover Case Compatible with Nintendo Switch,PC Material Macaron Solid Frosted Protective Cover Creative Accessory, Anti-Drop Separable Handle Case Can Inserted Base Protective Shell (Pink)",MYCHEER,0,0,0,0,5.0,2,0,,0,2
99,B09QJZ3H5P,GET IN THE GAME Premium Game Card Case for Nintendo Switch - POKEBALL,GET,0,0,0,0,0,0,0,,0,Nintendo Switch
100,B07L3V4L4J,"24x7 eMall Cover Only For Nintendo Switch, TPU Protective Heavy Duty Cover Case for Nintendo Switch with Shock-Absorption and Anti-Scratch Surface. (Nintendo Switch not included)",24x7,0,0,0,999,3.7,29,50,"Sunday, February 20",1,24x7
101,B09FPXRQ3N,"PSS Carrying Case for Nintendo Switch, Protective Hard Shell Middle Travel Carry Bag for Nintendo Switch Console Pro Controller and Accessories, Rubberized Handle and Shoulder Strap-Black.",PSS,0,0,0,"1,690",0,0,58,"Wednesday, February 23",1,"₹1,690
₹3,999 Save ₹2,309 (58%)"
102,B091J1Z8XD,ELTON Nintendo Switch Joycon Soft Silicone Protective Skin Case Cover (L+R),ELTON,0,0,0,899,0,0,0,"Wednesday, February 23",1,Windows Server 2011
103,B01N23OP50,RDS Industries Nintendo Switch System Carrying Case Protective Deluxe Travel System Case Black Ballistic Nylon Exterior Official Nintendo Licensed Product,RDS,0,0,0,0,4.8,"4,132",0,,0,"4,132"
104,B07BYP4D6V,Bigben Protective Hard Case for Nintendo Switch Console Size Large - Pink,Bigben,0,0,0,"1,099",4.6,13,0,"Tuesday, February 22",1,PEGI Rating: Ages 3 and Over
105,B09QXPPNK4,TCOS TECH Switch Soft Pouch Carry Case Storage Case Soft Shell Cover Bag Pouch For Nintendo Switch,TCOS,0,0,0,0,0,0,0,,0,Nintendo Switch
106,B07HRR3KN4,"Thankscase Shoulder Bag Protective Case for Nintendo Switch, Genuine Leather Case for Switch, Stand Cover with 4 Game Card Holders with Detachable Shoulder Strap for Nintendo Switch (Black)",Thankscase,0,0,0,"1,000",5.0,2,0,"Wednesday, February 23",1,2
107,B0746RC5TK,"Bigben Large Pouch for Nintendo Switch to Store the Console, 2 Joy-Con and Cables",Bigben,0,0,0,"1,099",5.0,1,0,"Tuesday, February 22",1,PEGI Rating: Ages 3 and Over
108,B09RZPVNZS,,,0,0,0,0,0,0,0,,0,
109,B09CPQHPCK,"PSS TPU Case Cover Compatible with Switch Lite, Flexible Soft Protective Cover Case Compatible with Switch lite - Turquoise",PSS,0,0,0,0,0,0,0,,0,Nintendo Switch
110,B09KGZM8SV,Sameo Premium Game Card Case-Minecraft Creeper (Nintendo Switch),Sameo,0,0,0,999,0,0,0,"Thursday, February 24",1,Nintendo Switch
111,B07ZS21LQ6,AMZER Silicone Skin Jelly Case Pack of 2 for Nintendo Switch Joy Con - Black & Blue,AMZER,0,0,0,844,0,0,44,"Tuesday, February 22",1,"₹844
₹1,499 Save ₹655 (44%)"
112,B09MLQ1K2G,"SUPCASE Unicorn Beetle Pro Forma Series Case for Nintendo Switch OLED Model (2021), Rugged Slim Protective Case with Dustproof Front Cover & 5 Game Card Storage Slots (FrostBlack)",SUPCASE,0,0,0,"2,499",4.3,64,38,"Sunday, February 20",1,64
113,B0792VHHGZ,Digital Gaming World® New Design Zip Pouch Case for Switch Console (Color: Red) (Console not included),Digital,0,0,0,"1,399",0,0,46,"Tuesday, February 22",1,"₹1,399
₹2,599 Save ₹1,200 (46%)"
114,B09MS97STH,Sameo Premium Game Card Case-Monster Hunter Rise,Sameo,0,0,0,999,0,0,0,"Thursday, February 24",1,Nintendo Switch
115,B08NXHTHYY,Games Storage Case for Nintendo Switch - Video Game Card Holder Protective Storage System Game Card Organizer Travel Container Box Hard Shell with 16 Game Card Slots (Minecraft Green),Games,0,0,0,0,4.6,332,0,,0,332
116,B091HDS3NB,ELTON Nintendo Switch Joycon Soft Silicone Protective Skin Case Cover (L+R) 2,ELTON,0,0,0,799,1.0,1,0,"Wednesday, February 23",1,1
117,B07W6267HY,PowerA Stealth Case Kit for Nintendo Switch Lite,PowerA,0,0,0,"2,188",4.5,128,0,"Tuesday, March 8",0,PEGI Rating: Ages 3 and Over
118,B094VYB42J,Verilux® JoyCon Grip Compatible with Switch and Racing Steering Wheel 4 Pack Game Switch Controller Handle Case Kit for Switch JoyCon Compatible with Mario Kart 8(Black),Verilux®,0,0,0,"1,499",0,0,29,"Thursday, February 24",1,"₹1,499
₹2,105 Save ₹606 (29%)"
119,B09KM2Z554,Sameo Premium Game Card Case-Pokemon Sword-Shield(Black) (Nintendo Switch),Sameo,0,0,0,999,0,0,0,"Thursday, February 24",1,Nintendo Switch
120,B07P8WYTFY,The Voyager Journeymate Messenger Bag for Nintendo Switch/Nintendo Switch Lite - Hyperkin,The,0,0,0,"2,499",4.8,4,0,"Wednesday, February 23",1,USK Rating: No age limitation
121,B08JCKH3T2,Nintend Switch Lite 2 in 1 TPU Case Protection Case Cover Protective Case Hand grip handle Stand Holder For Nintendo Switch Lite-Yellow,Nintend,0,0,0,799,3.0,1,20,"Friday, February 25",0,1
122,B09FF8GWC3,36 NS + 72 MSD: KIWIFOTOS 108 Slots Switch Game Card Memory Card Carrying Case Organizer for TF MSD MicroSD MicroSDHC MicroSDXC for Nintendo Switch Game Card NS Cards Storage Holder Keeper,36,0,0,0,"1,200",0,0,15,"Friday, February 25",1,36
123,B09GPJPSDJ,Tobo TNS 19099 Silicone Case Compatible with New Nintendo Switch (Yellow) Soft Rubber Protective Grip Cover,Tobo,0,0,0,899,0,0,70,"Thursday, February 24",1,"₹899
₹2,999 Save ₹2,100 (70%)"
124,B09KH2G189,Sameo Premium Game Card Case-Pack Man (Black) (Nintendo Switch),Sameo,0,0,0,999,0,0,0,"Thursday, February 24",1,Nintendo Switch
125,B089M2K8HF,"Deluxe Accessory Bundle for Nintendo Switch Lite: Includes Carrying Case, Tempered Glass Protector, TPU Case, Thumb Grips, Playstand, and More (Turquoise)",Deluxe,0,0,0,"5,261",4.7,233,30,"Wednesday, March 9",0,233
126,B09KH34LZ4,Sameo Premium Game Card Case-Mario Maker (RED) (Nintendo Switch),Sameo,0,0,0,999,0,0,0,"Thursday, February 24",1,Nintendo Switch
127,B09JWLRYTR,Sameo Super Shoulder Handle Water Proof Mario Switch Bag for Nintendo Switch,Sameo,0,0,0,"2,250",0,0,25,,1,"₹2,250
₹2,999 Save ₹749 (25%)"
128,B09KH2FDXZ,Sameo Premium Game Card Case-Super Mario Odyssey (Nintendo Switch),Sameo,0,0,0,999,0,0,0,"Thursday, February 24",1,Nintendo Switch
129,B0833PCTDK,"""SideKick"" Connector and Stand for Nintendo Switch (2-Pack) - Hyperkin","""SideKick""",0,0,0,699,4.8,23,0,"Tuesday, February 22",1,23
130,B08DPCBRWB,Game Card Holder for Switch-ORB,Game,0,0,0,399,4.3,4,0,"Thursday, February 24",1,4
131,B09KM23PVX,Sameo Premium Game Card Case-Super Mario(Green) (Nintendo Switch),Sameo,0,0,0,999,0,0,0,"Thursday, February 24",1,Nintendo Switch
132,B079RDH4BJ,"New World Water Resistant Nintendo Switch Cases, Travel Carrying Pouch Holder Protective Storage Bag for Nintendo Switch Gaming Console And Joy-cons",New,0,0,0,570,4.6,3,0,"Sunday, February 20",1,3
133,B07ZFYQ7V5,Fr-Tec GLOW IN THE DARK SILICONE SKIN + GRIPS GAMING Luminous PlayStation Console Protective Cover Silicone Case Gaming Sleeve Nintendo Switch Lite,Fr-Tec,0,0,0,549,5.0,1,0,"Wednesday, February 23",0,PEGI Rating: Ages 7 and Over
134,B091GYBQLG,ELTON Nintendo switch lite Carry bag with hand strap,ELTON,0,0,0,999,0,0,0,"Wednesday, February 23",1,Windows Server 2011
135,B09QKTQGH9,GET IN THE GAME Premium Game Card Case for Nintendo Switch,GET,0,0,0,0,0,0,0,,0,Nintendo Switch
