,asin,title,brand,Sponsored,Best Seller,Amazon's Choice,Price,Rating,NoofRatings,Discount,Delivery,Prime Delivery,base
136,B08DNL1Y5V,"Carry Case for Nintendo Switch,Leaf Crossing Hard Shell Storage Case for NS Console and Accessories,Slim Protective Portable Carrying Case with 10 Game Card Slots,Green",Carry,0,0,0,"3,998",4.8,213,30,"Wednesday, March 9",0,213
137,B091QCJD1Y,Kawn 10 In 1 Game Card Case Holder Storage Box Protector for Nintendo Switch Replacement Part,Kawn,0,0,0,526,0,0,0,"Thursday, March 10",0,Electronic Game
138,B07X93H3K5,Silicon glove for Nintendo Switch Mini.  Allows the protection of the console and Joy-Cons.,Silicon,0,0,0,241,0,0,0,"Tuesday, February 22",1,PEGI Rating: Ages 3 and Over
139,B01NAUKS62,"Orzly Carry Case Compatible with Nintendo Switch, Black (Case Only - Video Games & Console are NOT Included)",Orzly,0,0,0,"3,799",4.6,"53,343",0,"Thursday, February 24",1,"53,343"
140,B07XPBJLTP,Blade Fr-Tec Full Body Silicone Skin + thumb Grips for Nintendo Switch Lite (blue) | Protective Case Gaming,Blade,0,0,0,599,1.0,1,0,"Wednesday, February 23",0,PEGI Rating: Ages 7 and Over
141,B07GX7MBB7,"Nintendo Switch Pokemon Poke Ball Starter Kit with Travel Case, Power Cable & Cleaning Cloth by PDP",Nintendo,0,0,0,"2,279",4.8,455,0,"Sunday, February 20",1,455
142,B08DTXX3SH,Careflection Silicone Protective Case Cover with Free Thumb Stick Grip (Red & Blue) for Nintendo Switch Pro Game Console,Careflection,0,0,0,599,0,0,40,"Saturday, February 19",0,"₹599
₹999 Save ₹400 (40%)"
143,B081YFPSNV,HASTHIP® 6Pair Controller Joystick Thumbstick Cover Caps Grips for PS4,HASTHIP®,0,0,0,299,3.9,262,14,"Thursday, February 24",1,262
144,B07TWC17Q8,"Nintendo Switch Accessories Bundle, Kit with Carrying Case, Screen Protector, Compact Playstand, Switch Game Case, Joystick Cap, Charging Dock, Grip and Steering Wheel for Nintendo Switch, (18 in 1)",Nintendo,0,0,0,0,4.7,"3,685",0,,0,"3,685"
145,B07W8ZPZKT,"Carrying Case for Nintendo Switch Lite with 2 Pack Screen Protector, iVoler Ultra Slim Portable Hard Shell Pouch Travel Game Bag for Switch Lite Console Accessories Holds 10 Game Cards, Yellow",Carrying,0,0,0,0,4.8,"4,616",0,,0,"4,616"
146,B07983CJDX,RDS Nintendo Switch Game Traveller Deluxe Travel Case (Zelda Breath of the Wild) - Brown,RDS,0,0,0,0,4.8,"1,853",0,,0,PEGI Rating: Ages 3 and Over
147,B079Y1LF3D,CAMKIX Nintendo Switch Tpu Case (Black Transparent) + Screen Protector Games Card Thumb Grips (Black) Cleaning Cloth (Controller Sleeve & Grip Bundle),CAMKIX,0,0,0,0,4.1,128,0,,0,128
148,B09CQ641JX,"PSS Universal Travel EVA Game Controller Carrying Case Bag Gaming Accessory (for PS5,XBOX Series,Switch Pro, Xbox One, Xbox, Xbox 360, PS3, PS4, PS2) Controller BAG (RED)",PSS,0,0,0,0,3.8,8,0,,0,8
149,B01A0SGA8M,Hori Splatoon 2 Hard Pouch (Switch),Hori,0,0,0,837,4.7,127,0,"Sunday, February 20",1,PEGI Rating: Ages 3 and Over
150,B07X1QZ959,"ACdream Carrying Case Switch Lite 2019 Release, Protective Travel Carrying Pouch Bag for Small Nintendo Switch Lite 5.5 inch, 8 Game Cards Console & Accessories, Black",ACdream,0,0,0,0,4.6,185,0,,0,185
151,B08DTNBJNW,"BRHE Pink Travel Carrying Case Accessories Kit for Nintendo Switch with Hard Protective Cover, Glass Screen Protector, Ultra-Thin Adjustable Stand and Thumb Grip Caps 10 in 1",BRHE,0,0,0,"6,185",4.6,"1,378",0,"Monday, March 7",0,"1,378"
152,B07DMFDC6W,Nintendo Pokemon: Sword (Switch),Nintendo,0,0,0,"4,435",4.7,"11,043",0,"Sunday, February 20",1,PEGI Rating: Ages 7 and Over
153,B07H8GRYMP,Digital Gaming World® New Design Zip Pouch Case for Switch Console (Black Color) (Console not included) Quality Upgraded,Digital,0,0,0,"1,399",0,0,46,"Tuesday, February 22",1,"₹1,399
₹2,599 Save ₹1,200 (46%)"
154,B09RX1W8X7,Nintendo switch starter kit with travel case screen protector joy can guards and Earbuds by pdp,Nintendo,0,0,0,0,0,0,0,,0,Nintendo Switch
155,B01MS8NIVF,Hori Card case 12 + 2 for Nintendo Switch,Hori,0,0,0,"1,699",4.3,324,0,"Tuesday, February 22",1,PEGI Rating: Ages 12 and Over
156,B07XD9WK3Q,Accessori Vari Switch Big Ben Transport Case - S per Switch Lite,Accessori,0,0,0,"1,399",4.7,5,0,"Wednesday, February 23",1,PEGI Rating: Ages 3 and Over
157,B01NAWKYZ0,Nintendo Switch Pro Controller,Nintendo,0,0,0,"6,300",4.8,"49,267",0,"Wednesday, February 23",1,"49,267"
158,B06XFTXJWR,Hyperkin Charge Cable for Nintendo Switch,Hyperkin,0,0,0,137,4.0,105,0,"Sunday, February 20",1,PEGI Rating: Ages 18 and Over
159,B08T6V4H4Z,"MYCHEER Cover Case Compatible with Nintendo Switch,PC Pattern Hyrule Warriors Frosted Protective Cover Creative Accessory,Anti-Shock Anti-Drop Separable Handle Case Can Inserted Base Protective Shell",MYCHEER,0,0,0,"4,510",4.7,138,31,"Friday, March 4",0,138
160,B09QGXF8ZM,Nintendo Switch OLED model With White Joy-Con Bundled With MICROMINI X-Ninja Nintendo Bag (Black),Nintendo,0,0,0,"39,999",0,0,0,"Friday, February 25",1,Nintendo Switch
161,B091Q9NMNY,Kawn 10 In 1 Game Card Case Holder Storage Box Protector for Nintendo Switch NS Accessory Kit,Kawn,0,0,0,519,0,0,0,"Thursday, March 10",0,Electronic Game
162,B07NZ1NMRM,FLAWISH Anti-Shock Hard Protector Carry Case Cover Pouch for Nintendo Switch Console Black,FLAWISH,0,0,0,614,0,0,61,"Wednesday, March 2",0,"₹614
₹1,565 Save ₹951 (61%)"
163,B07VGGLB2W,Pull-N-Go Case - Elite Edition - Nintendo Switch,Pull-N-Go,0,0,0,0,4.8,770,0,,0,PEGI Rating: Ages 3 and Over
164,B09C62FG39,Case Hard Cover Protective Carry Travel Console for Nintendo Switch Lite Blue,Case,0,0,0,0,0,0,0,,0,Nintendo Switch
165,B01A9UATHE,HORI AlumiCase Metal Vault Case for Nintendo Switch,HORI,0,0,0,0,4.7,"1,002",0,,0,PEGI Rating: Ages 3 and Over
166,B078NB6TWZ,"Dockable Case Compatible with Nintendo Switch,FYOUNG Protective Accessories Cover Case Compatible with Nintendo Switch and Nintendo Switch Joy-Con with a Tempered Glass Screen Protector - Clear",Dockable,0,0,0,0,4.4,"3,001",0,,0,"3,001"
167,B01N4NWKRI,"Nintendo Switch Starter Kit with Travel Case, Screen Protector, Joy Con Guards and Earbuds by PDP",Nintendo,0,0,0,0,4.6,427,0,,0,427
168,B09KH3QDWC,Sameo Premium Game Card Case-Luigi (Nintendo Switch),Sameo,0,0,0,999,0,0,0,"Thursday, February 24",1,Nintendo Switch
169,B07H7GNKRV,"PAKESI for Nintendo Switch case, Soft Case for Nintendo Switch With Two Thumb Grip Set Joystick Cap -Black",PAKESI,0,0,0,0,4.6,38,0,,0,38
170,B09KH4BVQ8,"Sameo Premium Game Card Case-Pikachu,Poke Ball and Eevee (Nintendo Switch)",Sameo,0,0,0,999,0,0,0,"Thursday, February 24",1,Nintendo Switch
171,B01MR9RKAT,Nintendo Switch Game Traveler Deluxe Travel Case- Zelda Breath of the Wild - Sheikah Eye - Blue,Nintendo,0,0,0,0,5.0,1,0,,0,1
172,B091HZQDBN,ELTON N-switch lite 10 IN 1 protective kit,ELTON,0,0,0,"1,199",0,0,0,"Wednesday, February 23",1,Windows Server 2011
173,B07WQ2QWKM,"CoBak Carrying Case for Nintendo Switch Lite - Get 1 Extra Screen Protector for Free, Ultra Slim EVA Travel Pouch Protective Cover, 8 Game Cartridges, Green",CoBak,0,0,0,0,4.8,"1,943",0,,0,"1,943"
174,B08K2VM7KW,"Carrying Case for Nintendo Switch, Hard Shell Game Switch Case Fit AC Adapter Charger with 19 Game Cartridges for Switch Console and Accessories,Red",Carrying,0,0,0,0,4.9,52,0,,0,52
175,B06WGSKRKL,"ButterFox Carrying Case for Nintendo Switch, 19 Game Card Holders and Large Accessories Pouch",ButterFox,0,0,0,0,4.7,585,0,,0,585
176,B08996D2PX,"Large Carrying Storage Case for Nintendo Switch,Protective Travel Hard Shell Messenger Bag for Switch Console, Pro Controller, Accessories Switch Dock, AC Adapter with 16 Game Cards and Shoulder Strap",Large,0,0,0,0,4.6,143,0,,0,143
177,B0741MFLZ3,Segolike 29 Slots EVA Hard Case Cover Shockproof Storage Carrying Bag for Nintendo Switch Conreoller,Segolike,0,0,0,"1,462",5.0,1,52,"Friday, March 11",0,1
178,B071XPJPG9,TCOS TECH Nintendo Switch Anti-slip Silicone Case Cover Skin for Nintendo Switch Joy Con Controller - Black,TCOS,0,0,0,449,2.4,3,55,"Wednesday, February 23",1,3
179,B091HC4F4J,ELTON Switch Joy Controller Controller non-slip silicone case,ELTON,0,0,0,799,0,0,0,"Wednesday, February 23",1,Windows Server 2011
180,B07HBR66TR,LEGO Harry Potter Collection (Nintendo Switch),LEGO,0,0,0,"2,565",4.8,"5,546",0,"Wednesday, February 23",1,PEGI Rating: Ages 7 and Over
181,B083W2NXY7,,,0,0,0,0,0,0,0,,0,
182,B091GZXS52,ELTON Silicone case for Nintendo switch Lite (gray color),ELTON,0,0,0,999,0,0,0,"Wednesday, February 23",1,Windows Server 2011
183,B091PPPP7J,"Street27 24 in 1 Game Card Case Holder Cartridge Box Protector Cover for Nintendo Switch Video Games, Blue",Street27,0,0,0,747,0,0,0,"Wednesday, March 16",0,Street27
184,B091QC3X94,Kawn 10 In 1 Game Card Case Holder Storage Box Protector for Nintendo Switch Accessory Kit,Kawn,0,0,0,513,0,0,0,"Thursday, March 10",0,Electronic Game
185,B08X26QYLC,15 CompactFlash XQD + 30 SD Memory Card Case Holder Organizer Keeper Storage Protector for CF XQD SD SDHC SDXC Cfexpress Type A Camera Memory Cards for Sony PSV PS Vita and Nintendo Switch Game Cards,15,0,0,0,0,4.1,10,0,,0,15
186,B075FF6HDN,"PowerA Joy-Con & Pro Gaming Controller Charging Dock for Nintendo Switch, Black (Officially Licensed)",PowerA,0,0,0,"1,897",4.6,"2,745",0,"Sunday, February 20",1,PEGI Rating: Ages 3 and Over
187,B09QJXSDM5,"GET IN THE GAME Premium Game Card Case,Holder Carrying Storage Case Box，The Switch Game Case for 12 Games Cards Case and SD Cards (Yellow)",GET,0,0,0,0,0,0,0,,0,Nintendo Switch
188,B098423FDZ,Nintendo Switch Version 2 Console Bundled With Micromini X-Ninja Travel Case for Nintendo Switch,Nintendo,0,0,0,"30,799",5.0,1,0,"Tuesday, February 22",1,1
189,B07WPBGG75,"Case Cover for Nintendo Switch Lite,OIVO Soft TPU Protective Case Cover for Nintendo Switch Lite- Glass Screen Protector Included",Case,0,0,0,0,4.7,"1,456",0,,0,"1,456"
190,B09KM2R8CZ,Sameo Premium Game Card Case-Captain America(Black)(Nintendo Switch),Sameo,0,0,0,999,0,0,0,"Thursday, February 24",1,Nintendo Switch
191,B07WMQ62FN,Dockable Case for Nintendo Switch - Mumba TPU Grip Protective Cover Case Compatible with Nintendo Switch Console and Joy-Con Controller (Blue),Dockable,0,0,0,0,4.6,"2,725",0,,0,"2,725"
192,B07L5Q9BQK,"TMG Silicone Case for Poke Ball Plus Controller, Accessories Rubber Skin Protector Case Compatible with Nintendo Switch Pokemon Lets Go Pikachu Lets Go Eevee Poke Ball Plus - Brown",TMG,0,0,0,240,0,0,52,"Thursday, February 24",1,"₹240
₹499 Save ₹259 (52%)"
193,B091PPVYHR,"Street27 Game Card Case 24-in-1 Cartridge Storage Box Organizer Compatible with Nintendo Switch, White",Street27,0,0,0,750,0,0,0,"Wednesday, March 16",0,Street27
194,B01NASY99Z,HORI Officially Licensed Nintendo: Game Card Case (Switch),HORI,0,0,0,0,4.8,"9,018",0,,0,"9,018"
195,B09CPZNYWX,"PSS TPU Case Cover Compatible with Switch Lite, Flexible Soft Protective Cover Case Compatible with Switch lite - Yellow",PSS,0,0,0,0,0,0,0,,0,Nintendo Switch
196,B083W1WMHS,"NA Protective Case for Nintendo Switch Lite, Grip Case Cover for Nintendo Switch Lite, Grip Cover in Silicone with Anti-Scratch and Shock-Absorption Soft TPU (Grip Case and Carrycase, Turquoise)",NA,0,0,0,"8,989",0,0,0,"Saturday, March 12",0,"₹8,989
39"
197,B07YCM34PZ,"Carrying Case for Nintendo Switch, SPERVS Portable Carry Cases & Storage with 20 Game Cartridges Hard Shell Pouch for Nintendo Switch Console & Accessories Included AC Adapter Switch Travel Case",Carrying,0,0,0,0,4.8,625,0,,0,625
198,B09CQFDYGN,"MICROMINI X-Ninja Travel Case for Oculus Quest 2 bag VR Gaming Headset Controllers Accessories Carrying Bag,Carrying Case for Quest 2",MICROMINI,0,1,0,"3,297",4.5,47,0,"Tuesday, February 22",1,47
199,B07GXG12ZR,QUN FENG Carry Case Compatible with Nintendo Switch - Black Protective Hard Portable Travel Carry Case Shell Pouch for Nintendo Switch Console & Accessories(Black),QUN,0,0,0,999,5.0,4,50,"Monday, April 4",0,4
200,B0792QJ28Y,Accessories Kit for Nintendo Switch Games Bundle Wheel Grip Caps Carrying Case Screen Protector Controller Charger (17 In 1),Accessories,0,0,0,0,4.5,"10,083",0,,0,"10,083"
201,B077ZKVRTR,Nyko Thin Case - Nintendo Switch - Smoke,Nyko,0,0,0,"3,274",4.5,"2,678",0,"Thursday, March 10",0,"2,678"
202,B083W83Z68,,,0,0,0,0,0,0,0,,0,
203,B098RKWHHZ,Nintendo Switch OLED model With White set,Nintendo,0,0,0,"39,990",4.8,"3,086",0,"Wednesday, February 23",1,"3,086"
204,B07WNRZ8DJ,"Orzly Switch Lite Accessories Bundle - Includes Carry case & Screen Protector for Nintendo Switch Lite Console (2019), USB Cable, Games Holder, Comfort Grip Case, Headphones, Thumb-Grip Pack & more included [Orzly Gift Pack Edition - Pink]",Orzly,0,0,0,0,4.8,"19,408",0,,0,"19,408"
205,B07VVWQV3T,Carrying Case for Nintendo Switch Lite - Black,Carrying,0,0,0,0,4.5,84,0,,0,84
206,B07K57VQYM,Armor3 Party Kit for Switch (Black),Armor3,0,0,0,"2,599",3.8,16,0,"Tuesday, February 22",1,Armor3
207,B01N4R100H,Hyperkin Screen Protector for Nintendo Switch,Hyperkin,0,0,0,249,3.2,27,0,"Friday, February 25",0,27
208,B09PYL3HN1,Garboil® Compatible with AirPods Pro 2019 Case Protective Cover (Nintendo Switch),Garboil®,0,0,0,295,0,0,58,"Thursday, February 24",0,"₹295
₹699 Save ₹404 (58%)"
209,B083DG4FGD,Switch lite case Cover TPU,Switch,0,0,0,0,4.8,471,0,,0,471
210,B07P397J9Z,"Stealodeal Universal Travel EVA Game Controller Carrying Case Gaming Accessory Box (for Xbox One, Xbox, Xbox 360, PS3, PS4, PS2)",Stealodeal,0,1,0,636,4.6,330,36,"Tuesday, February 22",1,330
211,B074V8QKHX,Segolike 12 Slot Game Memory Card Holder Storage Case Anti-scratch Box For Nintendo Switch Console Black,Segolike,0,0,0,699,0,0,52,"Friday, March 11",0,"₹699
₹1,468 Save ₹769 (52%)"
212,B074DVJJWB,"daydayup Hestia Goods Switch Case and Tempered Glass Screen Protector for Nintendo Switch - Deluxe Hard Shell Travel Carrying Case, Pouch Case for Nintendo Switch Console & Accessories, Streak Red",daydayup,0,0,0,0,4.8,"3,107",0,,0,"3,107"
213,B01N12U0IF,Snakebyte Game Case - Nintendo Switch;,Snakebyte,0,0,0,0,4.5,126,0,,0,126
214,B07VT1ZVMV,M.G.R.J® Tempered Glass Screen Protector for Nintendo Switch Lite 2019,M.G.R.J®,0,0,0,299,4.3,46,70,"Tuesday, February 22",1,46
215,B09L8YHYRH,M.G.R.J® Tempered Glass Screen Protector for Nintendo Switch OLED 2021,M.G.R.J®,0,0,0,299,4.9,13,85,"Tuesday, February 22",1,13
216,B07DR1K264,Blade Fr-tec Switch Carrying Case WWE Design Cover Carrying Portable EVA Bag Storage Case Protective Cover Pouch for Switch Console,Blade,0,0,0,950,5.0,2,0,"Wednesday, February 23",0,PEGI Rating: Ages 3 and Over
217,B07BN9RPVZ,"Case for Nintendo Switch,Fit The Dock Station, Protective Accessories Cover Case for Nintendo Switch and Joy-Con Controller - Dockable with a Tempered Glass Screen Protector,Crystal Clear Blue",Case,0,0,0,0,4.5,"6,702",0,,0,"6,702"
218,B075JH815L,Segolike All In 1 Carry Storage Case with Screen Film Protector + Stereo Headset + Controller Silicon Guards & Accessories Kits For Nintendo Switch,Segolike,0,0,0,"1,827",0,0,52,"Friday, March 11",0,"₹1,827
₹3,837 Save ₹2,010 (52%)"
219,B01J7FX1AY,Joycon Cover Protector Joy Cons Grip Gel Guard Switch Joy Cons Controllers Silicone Skin Anti-Slip Joy-Con Skin Joycons Case with 4 Analog Thumb Caps Joystick Thumbstick Button Stick Black Jamont,Joycon,0,0,0,0,4.1,939,0,,0,939
220,B091QBDFXJ,Kawn 6x Silicone Cap Thumb Grip Stick Cap Cover Joystick Thumbstick Caps for Nintendo Switch Poke Ball Plus Controller - Red,Kawn,0,0,0,455,0,0,0,"Thursday, March 10",0,Electronic Game
221,B07DJ1SS29,"Pokemon: Let’s Go, Eevee! (Nintendo Switch)",Pokemon:,0,0,0,"4,450",4.7,"3,545",0,"Wednesday, February 23",1,PEGI Rating: Ages 7 and Over
222,B01N5T26EP,RDS Nintendo Switch Game Traveller Deluxe Travel Case (Zelda Breath of the Wild) - Grey,RDS,0,0,0,0,0,0,0,,0,Nintendo Switch
223,B06ZYJVT9H,Microware Durable Silicone Rubber Soft Case Skin Grip Cover for Nintendo Switch Gamepad Black,Microware,0,0,0,620,0,0,52,"Friday, March 11",0,"₹620
₹1,302 Save ₹682 (52%)"
224,B08ZYVXQSL,"TMG Carrying Case Large Accessories,10 Game Card Holders for Nintendo Switch and Silicone Skin Case Anti-Slip Full Body Protective Case Cover",TMG,0,0,0,"1,999",0,0,50,"Thursday, February 24",1,"₹1,999
₹3,999 Save ₹2,000 (50%)"
225,B07L3S12G2,24x7 emall tempered glass screen protector for nintendo switch tough ~ heavy duty Black,24x7,0,0,0,349,4.5,4,83,"Sunday, February 20",1,24x7
226,B07DN1MKRN,FLAWISH Eva Hard Shockproof Carry Storage Travel Case Box For Nintendo Switch Red,FLAWISH,0,0,0,"1,533",0,0,61,"Wednesday, March 2",0,"₹1,533
₹3,905 Save ₹2,372 (61%)"
227,B09RGTDYC8,Meyaar Compatible with Air Pods 3 Case Cover for Air Pods 3rd Generation Charging Case 2021 Silicone Protective Accessories Skin with Keychain| Front LED Visible | Nin-tendo Switch,Meyaar,0,0,0,399,0,0,60,"Wednesday, February 23",1,"₹399
₹999 Save ₹600 (60%)"
228,B07CYYK883,FLAWISH 29 Slots EVA Hard Case Cover Shockproof Storage Carrying Bag for Nintendo Switch Conreoller,FLAWISH,0,0,0,"1,472",0,0,61,"Wednesday, March 2",0,"₹1,472
₹3,750 Save ₹2,278 (61%)"
229,B09GLYCW56,Etzin TNS-19099 Game Console Silicone Cover with Grip Protective Case Game Accessories(Turquoise)…,Etzin,0,0,0,"1,499",0,0,50,"Thursday, February 24",1,"₹1,499
₹2,999 Save ₹1,500 (50%)"
230,B09KM2XVX6,Sameo Premium Game Card Case-Mario(Red_Ctr) (Nintendo Switch),Sameo,0,0,0,999,0,0,0,"Thursday, February 24",1,Nintendo Switch
231,B09KH48XW7,Sameo Premium Game Card Case-FIRE EMBLEM (Nintendo Switch),Sameo,0,0,0,999,0,0,0,"Thursday, February 24",1,Nintendo Switch
232,B0778LSVNZ,MagiDeal White Protective TPU Cover Case Clear Anti-scratch for Nintendo Switch Console,MagiDeal,0,0,0,"1,041",0,0,61,"Wednesday, March 2",0,"₹1,041
₹2,653 Save ₹1,612 (61%)"
233,B07DN259BJ,NF&E 6 In1 Anti-Slip Soft Silicone Cover Case With Buttons For Nintendo Switch,NF&E,0,0,0,548,0,0,61,"Wednesday, March 2",0,"₹548
₹1,398 Save ₹850 (61%)"
234,B01N13YIQJ,Hyperkin EVA Hard Shell Carrying Case for Nintendo Switch,Hyperkin,0,0,0,0,4.4,123,0,,0,123
235,B00MYTSN18,UGREEN USB Ethernet Adapter USB 3.0 to 10 100 1000 Gigabit Ethernet LAN Network Adapter Ethernet Compatible for Nintendo Switch MacBook Surface Pro Laptop PC Black (FBA_20256),UGREEN,0,0,0,"1,478",4.1,34,22,"Wednesday, February 23",0,34
236,B06XYS5PSQ,Segolike Protective Rubber Gel Case Thumb Stick Caps for Nintendo Switch Joy-Con Red,Segolike,0,0,0,545,0,0,52,"Friday, March 11",0,"₹545
₹1,145 Save ₹600 (52%)"
237,B07L5RXMP9,"TMG Silicone Case for Poke Ball Plus Controller, Accessories Rubber Skin Protector Case Compatible with Nintendo Switch Pokemon Lets Go Pikachu Lets Go Eevee Poke Ball Plus - Red",TMG,0,0,0,299,0,0,40,"Thursday, February 24",1,"₹299
₹499 Save ₹200 (40%)"
238,B09NQN23VW,"Cat Care Soft Silicone Cartoon Character Cover with Keychain, 360° Protective Case Compatible with Airpods 3 Case Cover ( 2021 ) (Airpods 3 RD, Nintendo Switch)",Cat,0,0,0,399,3.8,14,60,"Wednesday, February 23",1,14
239,B07L8R9WWR,Bionik Commuter Bag for Nintendo Switch,Bionik,0,0,0,"9,497",5.0,5,0,"Wednesday, March 9",0,5
240,B07NY2MJ73,FLAWISH 24 Game Card Holder for Nintendo Switch Protable Cartridge Storage Box Grey Carrying Case,FLAWISH,0,0,0,902,0,0,61,"Wednesday, March 2",0,"₹902
₹2,298 Save ₹1,396 (61%)"
241,B07DN3HWDR,FLAWISH 4 In 1 Game Card Storage Box For Nintendo Switch Case Cover Protection Gray,FLAWISH,0,0,0,417,0,0,61,"Wednesday, March 2",0,"₹417
₹1,060 Save ₹643 (61%)"
242,B071VQX3SP,Portable Bag Carrying Case With Handle Compatible With Nintendo Switch Console Joy-Con Pink,Portable,0,0,0,"1,845",0,0,61,"Wednesday, March 2",0,"₹1,845
₹4,700 Save ₹2,855 (61%)"
243,B01NBVACKX,"PowerA Joy-Con Controllers Comfort Grip for Nintendo Switch, Red (Officially Licensed)",PowerA,0,0,0,0,4.6,"5,856",0,,0,PEGI Rating: Ages 3 and Over
244,B06XZMLY48,"PDP Nintendo Switch Play & Charge Car Adapter, 500-040",PDP,0,0,0,660,4.6,173,0,"Monday, February 21",1,173
245,B004J22VIE,Legend of Zelda Link's Awakening - Nintendo Switch Standard Edition,Legend,0,0,0,"4,499",4.3,31,0,"Thursday, February 24",1,31
246,B07NY2YVWD,FLAWISH Ergonomic Protective Aluminum Hard Case Protector for Nintendo Switch Red,FLAWISH,0,0,0,630,0,0,61,"Wednesday, March 2",0,"₹630
₹1,605 Save ₹975 (61%)"
247,B088K1SCHR,"Cell Phone Stand, Phone Stand, Fully Foldable, Adjustable Desktop Phone Holder Cradle Dock Compatible with Phone 11 Pro Xs Xs Max Xr X 8, iPad Mini, Nintendo Switch, All Phones",Cell,0,0,0,599,4.3,20,59,"Wednesday, February 23",1,20
248,B06XZ1PCKK,"FASTSNAIL Grips Compatible with Nintendo Switch Joy-Con, Wear-resistant Handle Kit Compatible with Switch Joy Cons Controllers, 2 Pack (Black)",FASTSNAIL,0,0,0,0,4.8,"7,101",0,,0,"7,101"
249,B09P6LQHKP,"AAVE Stylish for Airpods Pro (2019) Compatible Soft Silicone Cartoon Character Case Cover with Keychain, 360° Protective Case (Nintendo Switch)",AAVE,0,0,0,399,3.0,1,60,"Wednesday, February 23",1,1
250,B01MT91910,Nintendo Switch Super Mario Brothers Secure Game Case For Up to 6 Games by PDP,Nintendo,0,0,0,0,4.1,59,0,,0,59
251,B08FJ82W64,Hori Nintendo Switch Split Pad Pro (Blue) Ergonomic Controller for Handheld Mode - Officially Licensed By Nintendo - Nintendo Switch,Hori,0,0,0,"5,990",4.6,"2,202",0,"Wednesday, February 23",0,"2,202"
252,B09KM24L9Z,Sameo Premium Game Card Case-Super Smash Bros Ultimate(Black),Sameo,0,0,0,999,0,0,0,"Thursday, February 24",1,Nintendo Switch
253,B07416D5BN,Segolike Aluminum Hard Protective Skin Case Cover For Nintendo Switch NS Silver,Segolike,0,0,0,951,0,0,52,"Friday, March 11",0,"₹951
₹1,997 Save ₹1,046 (52%)"
254,B0911RWY21,"Meyaar Cute Silicone Case Cover with Keychain, 360° Protective Case Compatible with Apple Airpods 2 &1 (Nintendo-Switch)",Meyaar,0,0,0,399,4.3,450,60,"Wednesday, February 23",1,450
255,B07K764HM4,"Hyperkin Silicone Trainer Shields for Poké Ball Plus (Multicolor, 3-Pack)",Hyperkin,0,0,0,697,3.6,95,0,"Sunday, February 20",1,95
256,B08CHXZK3L,Hori Aluminum Case for Nintendo Switch Pikachu-Cool,Hori,0,0,0,"4,298",0,0,0,"Tuesday, February 22",1,Nintendo Switch
257,B076KLRCP5,MagiDeal Split Design Anti-Scratch Protective Case Cover Crystal for Nintendo Switch,MagiDeal,0,0,0,"1,479",0,0,61,"Wednesday, March 2",0,"₹1,479
₹3,770 Save ₹2,291 (61%)"
258,B081Y11YFR,MrDeal For Nintendo Switch Lite Console Storage Bag With Thumbstick cap (Green Colour),MrDeal,0,0,0,0,3.9,4,0,,0,4
259,B07L5QTQL5,"TMG Silicone Case for Poke Ball Plus Controller, Accessories Rubber Skin Protector Case Compatible with Nintendo Switch Pokemon Lets Go Pikachu Lets Go Eevee Poke Ball Plus - Black",TMG,0,0,0,290,1.0,1,59,"Thursday, February 24",1,1
260,B092VT1JGD,Nintendo Switch Lite-Blue Console,Nintendo,0,0,0,"19,470",4.7,668,0,"Tuesday, February 22",1,668
261,B085T81CL2,FLAWISH 7 in 1 Silicone Case Anti-Slip Protective Cover for Switch (Blue),FLAWISH,0,0,0,"1,035",0,0,61,"Wednesday, March 2",0,"₹1,035
₹2,638 Save ₹1,603 (61%)"
262,B07DD17315,FLAWISH Travel Carrying Case Protective Storage Bag PU Leather for Nintendo Switch Gold,FLAWISH,0,0,0,"1,175",0,0,61,"Wednesday, March 2",0,"₹1,175
₹2,993 Save ₹1,818 (61%)"
263,B07PLLZD78,"HEYSTOP Switch Case for Nintendo Switch Case Dockable with Screen Protector, Clear Protective Case Cover for Nintendo Switch and JoyCon Controller with a Switch Tempered Glass Screen Protector",HEYSTOP,0,0,0,0,4.4,"8,921",0,,0,"8,921"
264,B07MS5BM7G,MagiDeal Pokeball Plus Silicone Protector Case Grip for Nintendo Switch Soft Skin Housing Comfortable Feeling - Camouflage Blue,MagiDeal,0,0,0,483,0,0,52,"Friday, March 11",0,"₹483
₹1,014 Save ₹531 (52%)"
265,B089ZW8FHX,"AhaStyle Carrying Case for Nintendo Switch Lite, Professional Protective Case for Nintendo Switch Lite with 5 Holders for Game Cartridges (Switch Logo - Light Gray)",AhaStyle,0,0,0,"1,239",0,0,32,"Saturday, March 5",0,"₹1,239
₹1,819 Save ₹580 (32%)"
266,B08MQ978KV,"Tablet Stand, Phinistec Foldable Tablet Holder Dock for Desk, Adjustable Desktop Phone Stand Compatible with iPad Pro 9.7, 10.5, 12.9 Air Mini 4 3/Phones/Kindle/Tablet/Nintendo Switch/E-Reader(White)",Tablet,0,0,0,399,4.6,41,80,"Wednesday, February 23",1,41
267,B079RC49NJ,"New World Nintendo Switch Protective Kit Travel Case Pouch Screen Protector Joy-Con Grip Dust proof Rubber Plug ,Thumb Stick cover complete accessory kit",New,0,0,0,"1,198",1.0,1,0,"Wednesday, February 23",1,1
268,B09RH5PQSX,Valente Silicone Shock Proof Protection Sleeve Skin / Tough Cover Case Compatible with AirPods 3 2021 (Cover Only) (Nintendo Switch),Valente,0,0,0,349,0,0,30,"Wednesday, February 23",0,"₹349
₹499 Save ₹150 (30%)"
269,B09C617X7L,New Carry Bag Case Nylon Shell Game Console Protective Shell for Nintendo,New,0,0,0,0,0,0,0,,0,Nintendo Switch
270,B08KGXSN3N,Hori Nintendo Switch Split Pad Pro (Pac-Man) Ergonomic Controller for Handheld Mode,Hori,0,0,0,"6,199",4.6,382,0,,1,382
271,B07DN4JJQN,NF&E Silicon Case Protective Cover Skin Thumb Stick Caps For Nintendo Switch Blue,NF&E,0,0,0,682,0,0,61,"Wednesday, March 2",0,"₹682
₹1,738 Save ₹1,056 (61%)"
272,B09NRT5D4J,GET IN THE GAME Game Storage Stand Host Disc Double Layer Storage Box for Ps5/Ps4/Ps3/Xbox Series/Xbox One/Switch. Store 12 Card /Disc,GET,0,0,0,0,0,0,0,,0,PlayStation
273,B07DW1M5Q1,QUICK POUCH COLLECTION for Nintendo Switch (splatoon 2) Squid: Bright Blu,QUICK,0,0,0,"1,496",4.1,10,0,"Thursday, February 24",1,10
274,B01N22YAIP,"PowerA Everywhere Messenger Protection Bag for Nintendo Switch with Acessories Storage, Grey (Officially Licensed)",PowerA,0,0,0,0,4.7,139,0,,0,PEGI Rating: Ages 3 and Over
275,B07DN3H867,NF&E Anti-Scratch Protective Skin Case Cover Bumper For Nintendo Switch Console Blue,NF&E,0,0,0,613,0,0,61,"Wednesday, March 2",0,"₹613
₹1,560 Save ₹947 (61%)"
276,B09KCHS16P,Sameo Premium Game Card Case-Pikachu #Let's Go20 (Nintendo Switch),Sameo,0,0,0,999,0,0,0,"Thursday, February 24",1,Nintendo Switch
