,asin,title,brand,Sponsored,Best Seller,Amazon's Choice,Price,Rating,NoofRatings,Discount,Delivery,Prime Delivery,base
0,B089B4QPQ2,"AmazonBasics 9W, Dimming Halo Rechargeable Table Lamp, 3 Colors (Cool Day Light, Neutral White and Warm White)Pack of 1",AmazonBasics,1,0,0,899,4.3,"2,984",40,,1,"2,984"
1,B07QKCM5LL,TISVA J’AIME TL1015 Borosilicate Glass Table Lamp 1 x 7W INBUILT LED (White),TISVA,1,0,0,"6,799",0,0,9,"Wednesday, February 23",1,"₹6,799
₹7,490 Save ₹691 (9%)"
2,B07QLQVLXP,TISVA J’AIME TG1001 Fusion Range Table Lamp 3 x 3W LED (White),TISVA,1,0,0,"6,990",0,0,0,"Wednesday, February 23",1,"₹6,990"
3,B07QJ9PWZT,TISVA J’AIME TL1016 Borosilicate Glass Table Lamp 1 x 7W INBUILT LED (Smoke Finish),TISVA,1,0,0,"7,299",0,0,9,"Wednesday, February 23",1,"₹7,299
₹7,990 Save ₹691 (9%)"
4,B09R4MX1M2,One94store Study lamp Rechargeable Led Touch On Off Switch Student Study Reading Dimmer Led Table Lamps White Desk Light Lamp (Multicolor),One94store,0,1,0,284,3.4,49,72,"Tuesday, February 22",0,49
5,B07ZP7PF8P,"SaleOn Touch Desk lamp LED Touch On Off Switch Student Study Reading Dimmer Rechargeable Led Table Lamps Eye Protection Lamp ( White,Pack of 1 )",SaleOn,0,0,1,635,4.1,"2,867",58,"Monday, February 21",1,"2,867"
6,B089B4QPQ2,"AmazonBasics 9W, Dimming Halo Rechargeable Table Lamp, 3 Colors (Cool Day Light, Neutral White and Warm White)Pack of 1",AmazonBasics,0,0,0,899,4.3,"2,984",40,,1,"2,984"
7,B09NNJ4D3X,RUCON® Study lamp Rechargeable Led Touch On Off Switch Student Study Reading Dimmer Led Table Lamps White Desk Light Lamp,RUCON®,0,0,0,299,4.3,286,63,"Wednesday, February 23",1,286
8,B08LLY5R9T,"Wipro 5W Led Table Lamp with Smooth Dimming, Use As Emergency Light with Power Bank Or with Laptop USB Port (White) Pack of 1",Wipro,0,1,0,766,4.3,"1,529",41,"Sunday, February 20",1,"1,529"
9,B07C9KQ7KR,"Wipro Garnet 6W LED Table Lamp - 3 Grade Dimming and Color Changing (Pack of 1, Cool Day Light/Neutral White/Warm White)",Wipro,0,0,0,"1,499",4.5,"14,223",0,"Sunday, February 20",1,"14,223"
10,B09R7W94X7,SaleOn Desk Lamp USB Charging Eye Protection Mini Desk Lamp Bedroom Bedside Table 3 Step Touch Dimmer - Mix Colors,SaleOn,0,0,0,219,4.5,2,73,"Thursday, February 24",1,2
11,B089B1XBMG,"AmazonBasics Sleek Rechargeable Table Lamp, 8W, Dimming, White, Pack of 1",AmazonBasics,0,0,0,589,4.3,611,41,"Sunday, February 20",1,611
12,B094JTNRJY,"Wipro Re-Chargeable LED Table Lamp, White, Standard (E10013) - Pack of 1",Wipro,0,0,0,599,4.2,905,45,"Sunday, February 20",1,905
13,B09HGZYY9H,RUCON® Study lamp Rechargeable Led Touch On Off Switch Student Study Reading Dimmer Led Table Lamps White Desk Light White,RUCON®,0,0,0,299,3.8,"1,005",70,"Wednesday, February 23",1,"1,005"
14,B091N6919B,PRIMESKY® 3D Moon Lamp 7 Multi Colors Changing Touch Sensor with Wooden Stand Moon Night Table Lamp for Bedroom 13cm,PRIMESKY®,0,0,0,720,4.3,682,52,"Wednesday, February 23",1,682
15,B09DGNTS7G,"PHILIPS Orbit 5W Colour Changing Warm White to Natural White to Cool White & Rechargeable Touch Controlled Table Lamp / Desk Light with Brightness Control (White), Standard",PHILIPS,0,0,0,"1,485",4.2,202,22,"Wednesday, February 23",1,202
16,B089B5LG79,"AmazonBasics Classic Rechargeable Table Lamp (Black, Pack of 1)",AmazonBasics,0,0,0,799,4.1,728,39,"Sunday, February 20",1,728
17,B01D2SCZKO,"BillieJean Matte Black Reading And Studying Table Lamp, Pack of 1",BillieJean,0,0,0,669,4.2,"1,521",33,"Wednesday, February 23",1,"1,521"
18,B07HY5Z5G7,"Wooum Rechargeable led Desk Lamp Touch Control On Off Student Study Table Lamps Touch Dimmer Night Reading Lamp for Children Eye Protection Lamp(White,Pack of 1)",Wooum,0,0,0,284,4.0,"2,234",81,"Thursday, February 24",1,"2,234"
19,B08D3ZZNHV,"tu casa Metal-Iron Lamp, White,Pack of 1",tu,0,0,0,696,4.0,202,48,"Sunday, February 20",1,202
20,B09RSS2MMF,Ritmo Table Lamp Home Office Luxury Cordless Crystal Table Lamp Modern Living Room Sofas Bedroom Touch Dimming Reading Lamps with USB Charging Bedside Desk Lamp,Ritmo,1,0,0,"1,999",0,0,50,"Wednesday, February 23",1,"₹1,999 (₹1,999/count)
₹3,999 Save ₹2,000 (50%)"
21,B089B5LG79,"AmazonBasics Classic Rechargeable Table Lamp (Black, Pack of 1)",AmazonBasics,1,0,0,799,4.1,728,39,"Sunday, February 20",1,728
22,B094JTNRJY,"Wipro Re-Chargeable LED Table Lamp, White, Standard (E10013) - Pack of 1",Wipro,1,0,0,599,4.2,905,45,"Sunday, February 20",1,905
23,B08LLY5R9T,"Wipro 5W Led Table Lamp with Smooth Dimming, Use As Emergency Light with Power Bank Or with Laptop USB Port (White) Pack of 1",Wipro,1,1,0,766,4.3,"1,529",41,"Sunday, February 20",1,"1,529"
24,B07QC5YT69,"ESN 999 Table Lamp, Red, Pack of 1",ESN,0,0,0,299,4.0,"2,940",67,"Wednesday, February 23",1,"2,940"
25,B076VBRZP8,"Homesake Wood Table Lamp, Black, Pack of 1",Homesake,0,0,0,"1,450",4.3,"2,051",42,"Wednesday, February 23",1,"2,051"
26,B016VYB624,"PHILIPS Plastic LED Desk light, White",PHILIPS,0,0,0,825,4.4,"12,335",31,"Sunday, February 20",1,"12,335"
27,B017CN3HRA,"earthenmetal Glass Table Lamp, Multicolor",earthenmetal,0,0,0,639,4.2,"1,771",51,"Wednesday, February 23",1,"1,771"
28,B09MK8N24D,"SAPPHIRE INDIA Desk Lamps for Study Table - Rechargeable USB Warm Light LED Children Eye Protection Lamps, Desk Lamp for Work from Home, Available with RGB Night Light, Yellow Color Light, 3 Watt",SAPPHIRE,0,0,0,464,4.7,11,64,"Wednesday, February 23",0,11
29,B0966KGV2T,PRIMESKY® Study lamp Rechargeable Led Touch On Off Switch Student Study Reading Dimmer Led Table Lamps White,PRIMESKY®,0,0,0,299,3.8,"1,397",70,"Wednesday, February 23",1,"1,397"
30,B09Q93WG46,"Pick Ur Needs® Eye Protection Lamp for Student Rechargeable LED Touch On/Off Switch Desk Lamp / Student Reading Dimmer Led Table Lamp with Pen Holder, Mobile Stand, Study Lamp, Night Light",Pick,0,0,0,999,5.0,5,50,"Wednesday, February 23",1,5
31,B07NGG8NCG,"Azacus Rechargeable LED Touch On/Off Switch Desk Lamp, Children Eye Protection Student Reading Dimmer Led Table Lamp (Pen Holder, Mobile Stand, Study Lamp, Night Light, USB Charging)-White, Pack of 1",Azacus,0,0,0,649,4.2,795,41,"Wednesday, February 23",1,795
32,B08D42QZ6H,"tu casa Mango Wood Table Lamp, White, Offwhite",tu,0,0,0,700,4.3,8,0,"Monday, February 21",1,8
33,B09QXL1HRT,FORMONIX Study lamp Rechargeable Led Touch On Off Switch Student Study Reading Dimmer Led Table Lamps White Desk Light Lamp(Multicolour),FORMONIX,0,0,0,299,5.0,6,70,"Wednesday, February 23",0,6
34,B09PK4KG7D,RYLAN Rechargeable LED Touch On/Off Switch Desk Lamp Children Eye Protection Student Study Reading Dimmer Rechargeable Led Table Lamps USB Charging Light for Study (White),RYLAN,0,0,0,519,4.6,123,60,"Wednesday, February 23",1,123
35,B08Y8HD7XN,Dev Exports LED Touch On/Off Switch Desk Lamp/Student Study Reading Dimmer Rechargeable Led Table Lamps(White),Dev,0,0,0,198,0,0,78,"Thursday, February 24",0,"₹198
₹899 Save ₹701 (78%)"
36,B09NW9RMDC,XGMO Student Study/Book Reading Desk/Table Lamp with Rechargeable LED Touch On Off Switch Study Reading Dimmer Light (White)Pack of 1,XGMO,0,0,0,295,5.0,3,63,"Wednesday, February 23",1,3
37,B09RQJZKT9,SENDROSE Study lamp Rechargeable Led Touch On Off Switch Student Study Reading Dimmer Led Table Lamps White,SENDROSE,0,0,0,299,0,0,63,"Wednesday, February 23",0,"₹299
₹799 Save ₹500 (63%)"
38,B0941YXMNR,"Bulfyss USB Flexible Reading LED Light Clip-on Beside Bed Table Desk Lamp (Black, Pack of 1)",Bulfyss,0,0,0,599,4.1,466,40,"Wednesday, February 23",1,466
39,B077D71JVS,Homesake® Antique White Twister Wooden Table Lamp with Khadi Drum Shade,Homesake®,0,0,0,"1,399",4.8,6,30,"Wednesday, February 23",0,6
40,B09MWJ6J2V,Madams Gallery Study Lamp | Study Lamp For Students | USB Desk Lamp | Digital Touch On/Off Switch Table Lamp | Unique Digital Desk Lamp For Students | Imported Quality Desk lamp | Table Lamp Study lamp Rechargeable Led Touch On Off Switch Student Study Reading Dimmer Led Table Lamps White Desk Light Lamp,Madams,0,0,0,489,4.3,11,51,"Wednesday, February 23",0,11
41,B08WCM9Q2H,"ESN 999 Stylish Black Adjustable Table Lamp for Home/Office/Study (Bulb not Included, Pack of 1)",ESN,0,0,0,299,4.1,"1,140",67,"Wednesday, February 23",1,"1,140"
42,B07PDQMZ7G,"ESN 999 Metal Table Lamp, Black, Pack of 1",ESN,0,0,0,299,4.0,"3,303",67,"Wednesday, February 23",1,"3,303"
43,B09MLVQNMC,FIGMENT Cute Dinosaur Rechargeable LED Touch On/Off Table Lamp Desk Light Led White Light Eye Protection 360° Rotation Eye Protection Student Study Reading Dimmer Table Lamps USB Charging Light for Study(Dinosaur light),FIGMENT,0,0,0,499,4.5,95,50,"Tuesday, February 22",1,95
44,B08DBHJ7GQ,"ESN 999 Aluminium Lamp, Black, Pack of 1",ESN,0,0,0,479,4.0,663,47,"Wednesday, February 23",0,663
45,B07VR81DGC,Pick Ur Needs® Rechargeable Study LED Desk Table Lamp with Pen Holder USB Charging Touch Control,Pick,0,0,0,695,4.2,"3,416",42,"Tuesday, February 22",1,"3,416"
46,B079MF4F31,"NYRWANA DELIVERING SMILES IN INIDA Cute Dog LED Table Lamp for Living Room (Black & White, Pack of 1)",NYRWANA,0,0,0,"1,160",4.5,144,0,"Wednesday, February 23",1,144
47,B09HCR1H1F,Wooum Rechargeable Touch On Off Desk Lamp /Cupboard Lamp / Wall Lamp / Bedroom Lamp / Study Lamp / Table Lamp Children Eye Protection Adjustable Angle,Wooum,0,0,0,379,3.5,19,75,"Tuesday, February 22",0,19
48,B09NH1ZXRT,SaleOn Small Size Rechargeable Study Desk Led Lamp Reading Lamp Toy for Children Eye Protection Table Lamp with Pencil Sharpner Children Lamp Pen Holder Led Table - Mix Colors (1633),SaleOn,0,0,0,284,3.2,4,68,"Thursday, February 24",1,4
49,B07KDJ28R8,DEVBEADS Multi-Color Decorative Glass Mosaic Table Lamp 17cm,DEVBEADS,0,0,0,335,5.0,1,66,"Thursday, February 24",1,1
50,B098SWVHKB,"Diving Deep Round Doctor Flexible Study Table Lamp Without Bulb, Black, Pack of 1",Diving,0,0,0,549,4.0,95,63,"Wednesday, February 23",1,95
51,B09BB1XQF5,Renyke Rechargeable USB Charging LED Touch On/Off Switch Desk Lamp with Children Eye Protection Student Study Reading Dimmer Lamps (White) - 5 in One,Renyke,0,0,0,659,4.5,12,49,"Wednesday, February 23",1,12
52,B09CQFM7F8,Ajauni 4 In 1 Night Table Lamp with Pencil Sharpener Pen Stand Mobile Stand (Battery not Required)Pack of 1,Ajauni,0,0,0,380,4.4,6,37,"Wednesday, February 23",1,6
53,B091182B6Q,Homenique Black Traditional Farmhouse Table Lamps with Fabric Orange Flower Shade (Bulb not Included)Pack of 1,Homenique,0,0,0,550,3.7,148,72,"Wednesday, February 23",1,148
54,B089ZCZZLW,"Home Centre Ceramic Table Lamp, Purple, 1 Piece",Home,0,0,0,499,4.3,87,0,"Thursday, February 24",1,87
55,B09C2BFY9P,"Betlex 10W Sewing Machine Light With 30 LED's, Magnetic Mounting Base Working Lamp for Home Study,Reading book lamp,Bedside lamp,Flexible,Night Work & Desk light, 360 Degree Movable Lamp With Toggle Switch – White Color -(Indian Plug )",Betlex,0,0,0,564,4.7,8,57,"Wednesday, February 23",1,8
56,B076VBRZP8,"Homesake Wood Table Lamp, Black, Pack of 1",Homesake,1,0,0,"1,450",4.3,"2,051",42,"Wednesday, February 23",1,"2,051"
57,B089B1XBMG,"AmazonBasics Sleek Rechargeable Table Lamp, 8W, Dimming, White, Pack of 1",AmazonBasics,1,0,0,589,4.3,611,41,"Sunday, February 20",1,611
58,B09FBT7493,"Aswal Handicraft Attractive Bedside Black Metal Base with Handmade Off-White Pleated Cotton Fabric Shade Table Night with Complementary Bulb (12 Inch , Off-White)",Aswal,1,0,0,"1,549",5.0,2,40,"Wednesday, February 23",1,2
59,B09RSQCH9Q,"Ritmo Table Lamp Acrylic Crystal Desk Lamp, Acrylic Night Light, Touch Control Desk Lamp Battery Operated with Dimmable Color, Nightstand Decorative Lamp for Living Room Bedroom Atmosphere Lamps,(01)",Ritmo,1,0,0,"1,999",0,0,50,"Wednesday, February 23",1,"₹1,999
₹3,999 Save ₹2,000 (50%)"
60,B09RST2XJ2,"Ritmo Table Lamp Acrylic Crystal Desk Lamp, Acrylic Night Light, Touch Control Desk Lamp Battery Operated with Dimmable Color, Nightstand Decorative Lamp for Living Room Bedroom Atmosphere Lamps,",Ritmo,1,0,0,"1,999",0,0,50,"Wednesday, February 23",1,"₹1,999
₹3,999 Save ₹2,000 (50%)"
61,B09RPL4DWL,"Ritmo LED Desk Lamp, Crystal Lamp, USB Rechargeable Table Light, Touch Control Table Lamp, Romantic Diamond Rose Shade Nightstand Lamp for Bedroom Bar Restaurant, ( 16 Colors Changing Mode )",Ritmo,1,0,0,"2,599",0,0,50,"Wednesday, February 23",1,"₹2,599
₹5,199 Save ₹2,600 (50%)"
62,B07C9KQ7KR,"Wipro Garnet 6W LED Table Lamp - 3 Grade Dimming and Color Changing (Pack of 1, Cool Day Light/Neutral White/Warm White)",Wipro,1,0,0,"1,499",4.5,"14,223",0,"Sunday, February 20",1,"14,223"
63,B07L2VJNKV,"Homesake Table Lamp Shade Empire, Table Night Lamps for Bedroom, Home Decoration Bedside Living Room, Hall Lighting, Home Decor Items with Khadi Shade - Off White, Pack of 1",Homesake,1,0,0,"1,499",4.3,"2,051",57,"Wednesday, February 23",1,"2,051"
64,B09HCH3BW1,Disha Enterprise LED Touch On/Off Switch Desk Lamp Children Eye Protection Student Study Reading Dimmer Rechargeable Led Table Lamps USB Charging Touch Dimmer (Multicolour)Pack of 1,Disha,0,0,0,329,3.5,43,67,"Wednesday, February 23",1,43
65,B076VRGP3R,Homesake® Mabel Rustic Wood Table Lamp with Blue Shade,Homesake®,0,0,0,"1,450",0,0,46,"Wednesday, February 23",1,"₹1,450
₹2,700 Save ₹1,250 (46%)"
66,B09PJGYFP4,"Classic Electric Table Lamp White Calming Light, Pack of 1, Lamp_427",Classic,0,0,0,799,0,0,47,"Wednesday, February 23",0,"₹799
₹1,499 Save ₹700 (47%)"
67,B08G8TNB82,"VRCT Khadi Shade and Beautiful Table Lamp for Bedroom and Drawing Room (Black,Pack of 1)",VRCT,0,0,0,540,3.7,425,72,"Wednesday, February 23",1,425
68,B084C2MC2N,"AABHAYA ARTS Glass Table Lamp, Blue, Pack of 1",AABHAYA,0,0,0,440,4.6,25,63,"Saturday, February 26",1,25
69,B095X2CW1Z,"Hopdezyo Italian Lamp with Jute Drum Shade, Bulb, Wiring, E27 Holder Included, Pack of 1",Hopdezyo,0,1,0,"1,190",4.4,"1,051",63,"Thursday, February 24",1,"1,051"
70,B09MT8X19X,"SHOPOPOYE Table Lamp for Study Led Light- Study Table Lamps for Study Room- Study Lamp for Students Rechargeable Table Lamp - 7W, 3 Modes, Warm Light, ABS Plastic- Night Reading (007)",SHOPOPOYE,0,0,0,785,4.5,62,69,"Wednesday, February 23",1,62
71,B096LWZ9XF,"Pigeon Pixo Rechargeable LED Reading Lamps with Flicker-Free USB Charging Touch 3 Stage dimming, 14716 (White, Medium)",Pigeon,0,0,0,405,4.1,208,59,"Tuesday, February 22",0,208
72,B09NBRHBYX,"Artistic Gifts Wooden Rechargeable Portable Dog Shape Desk Table Night Lamp, Adjustable Lovely Gift for Kids (Warm White 3000k, Natural White 4000k, Cold White 6000k) (Walnut Wood)",Artistic,0,0,0,"1,399",5.0,11,33,"Wednesday, February 23",0,11
73,B08TZVBXQH,DIKANSHA Conical Shade and Beautiful Table Lamp (White),DIKANSHA,0,0,0,540,3.7,8,58,"Wednesday, February 23",1,8
74,B07Q11V6PB,Pick Ur Needs Rechargeable LED Touch On/Off Switch Desk Lamp Children Eye Protection Student Study Reading Dimmer Rechargeable Led Table Lamps USB Charging Touch (White)Pack of 1,Pick,0,0,0,722,3.7,53,64,"Wednesday, February 23",1,53
75,B098DN5NSK,AVIGNA Table Lamp/Study Lamp (White)Pack of 1,AVIGNA,0,0,0,259,4.2,295,74,"Wednesday, February 23",0,295
76,B07RK99JPP,"FLIPXEN Led Desk Lamp Desktop Lamp with USB Charging Port &Color Night Light, Girl Study Lamps for Kids, Eye Caring Table Lamp,10W White",FLIPXEN,0,0,0,299,3.6,12,50,"Friday, February 25",0,12
77,B09PNL8M68,ZIXAD Desk Lamp Led On Off Switch Student Study Reading Dimmer Rechargeable Flexible Head with Pen Stand Led Table Lamps Eye Protection Lamp,ZIXAD,0,0,0,449,4.0,24,78,"Wednesday, February 23",1,24
78,B08ZNKB238,"NKMD Vintage Light Bulb Holder Screw Type Holder, E27 Black Ring Type for Table Lamps Lights (Pack of 2)",NKMD,0,0,0,209,3.7,14,87,"Wednesday, February 23",1,14
79,B09L772Q2D,"CINEFX'S Rechargeable White Table lamp for Table-top Reading Student Study Dimming Halo Small Ring LED Touch On/Off Switch Eye Protection, Desk Lamp (Pack of 1)",CINEFX'S,0,0,0,499,3.8,4,75,"Thursday, February 24",1,4
80,B08WLT1QHZ,Homesake Modern Farmhouse Metal Diamond Desk Table Lamp with Light Bulb - Matt Black (Diamond Red),Homesake,1,0,0,"1,599",0,0,43,"Wednesday, February 23",1,"₹1,599
₹2,800 Save ₹1,201 (43%)"
81,B0866HY6B3,Bajaj Softlite Mini LED RC Portable Table Lamp - White,Bajaj,1,0,0,"1,077",4.3,"1,073",9,"Sunday, February 20",1,"1,073"
82,B07RXQQZ56,Green Girgit Ancient Art Wooden Lamp (Multicolor),Green,1,0,0,"1,299",5.0,1,35,"Wednesday, February 23",0,1
83,B09RSWJ5ZY,"Ritmo Crystal Table Lamp, Touch Control Atmosphere Nightstand Lamp with USB Charging line, 3-Ways Dimmable Bedside Desk Light for Bedroom Living Room Home (01)",Ritmo,1,0,0,"1,999",0,0,50,"Wednesday, February 23",1,"₹1,999 (₹1,999/count)
₹3,999 Save ₹2,000 (50%)"
84,B09HL5S4PJ,"MAHGANYA Mosaic Style Dome Shaped Glass Table Lamp Multicolour for Living Room,Bed Room,Desk Mah347 , Pack of 1",MAHGANYA,0,0,0,379,3.9,27,53,"Saturday, February 26",1,27
85,B09MNR7PDF,TECHTOP USB LED Cute Kids Desk Lamp Rechargeable LED Cartoon Teddy Bear Table lamp for Study / Portable Coulor Changing Home Decor Side Table Night Study lamp with Flexible Adjustable,TECHTOP,0,0,0,399,5.0,3,56,"Friday, February 25",0,3
86,B07ZRG78CB,"SaleOn Portable Led Rechargeable Touch On-Off Switch Desk Lamp Study Reading Dimmer Table Lamps USB Charging Touch Dimmer Children Eye Protective Light ( White, Pack of 1 )",SaleOn,0,0,0,474,4.1,"1,891",47,"Sunday, February 20",0,"1,891"
87,B078S5CYNQ,BonZeaL Doctor Dog Yellow LED Night Light Bedside Desk Table Lamp for Kids Children Bedroom,BonZeaL,0,0,0,"1,100",3.7,8,50,"Wednesday, February 23",1,8
88,B09RPXC6PW,ASTRECA Attractive Sense Light 0.5W Full Automatic Sensor Smart Decorative LED Plug Night Lamp for Bedroom | Gift | Office | Livingroom- Made in India || Pack of 1|| (Orange),ASTRECA,0,0,0,269,5.0,1,73,"Wednesday, February 23",1,1
89,B09MJ5LSWJ,Improvhome Traditional Table Lamps Red Color Shade Table Lamp with Black Metal Base for Decor for Living Room Bedroom House Bedside Nightstand Home Office Entryway Family - Regency Hill,Improvhome,0,0,0,699,4.0,2,61,"Wednesday, February 23",1,2
90,B09JG2HLVZ,"KWT Rechargeable LED Touch On/Off Switch Desk Lamp Children Eye Protection Student Study Reading Dimmer Rechargeable Led Table Lamps USB Charging Touch Dimmer, Desk Lights for Study- (White)Pack of 1",KWT,0,0,0,499,4.2,122,50,"Wednesday, February 23",1,122
91,B089ZCYKY9,Home Centre Ceramic Table Lamp ( Blue ),Home,0,0,0,499,4.3,119,0,"Wednesday, February 23",1,119
92,B09QCRWP8P,"Pick Ur Needs® Eye Protection 360° Gooseneck Lamp for Student Rechargeable LED Touch On/Off Switch Desk Lamp / Student Reading Dimmer Led Table Lamp with Pen Holder, Mobile Stand, Study Lamp",Pick,0,0,0,995,5.0,6,50,"Wednesday, February 23",1,6
93,B096Y6F5XZ,"KAVANA Rechargeable led Desk Lamp Touch Control On Off Student Study Table Lamps Touch Dimmer Night Reading Lamp for Children Eye Protection Lamp(White,Pack of 1)",KAVANA,0,0,0,649,4.3,127,35,"Thursday, February 24",1,127
94,B08SMHRGCZ,"Saleon Rechargeable Led Touch/On Off Student Eye Protection Study Touch Lamp Dimmable Light Ideal For Desk, Table, Bedroom Or Office, Led Model Led Night Light For Cupboard, White, Pack of 1",Saleon,0,0,0,419,3.5,95,72,"Sunday, February 20",0,95
95,B09KHCMMRB,WALVIA Cute Dinosaur Rechargeable LED Touch On/Off Table Lamp Desk Light Led White Light Eye Protection 360° Rotation Eye Protection Student Study Reading Dimmer Table Lamps USB Charging Light for Study (Dinosaur Multi-Color)(1 Piece),WALVIA,0,0,0,499,4.6,123,38,"Wednesday, February 23",1,123
96,B095LPGGND,"Made for you Multifunctional USB Charging Table Lamp Night Lamp Led Desk Table Lamp with Pencil Sharpener Pen Pencil Container and Mobile Phone Holder, Pack of 1Pcs. (Random Color)",Made,0,0,0,396,3.1,4,60,"Wednesday, February 23",1,4
97,B097N6MNR4,"PHILIPS Sky 5W Rechargeable Touch Controlled Table Lamp with Brightness Control, White and Chrome",PHILIPS,0,0,0,"1,327",4.4,277,26,"Tuesday, February 22",1,277
98,B09MC1KYCG,QUXIS® Study lamp Rechargeable Led Touch On Off Switch Student Study Reading Dimmer Led Table Lamps White Desk Light,QUXIS®,0,0,0,0,4.1,311,0,,0,311
99,B073G224LC,"make in modern Wood with Finish Table Lamp with Natural Jute Shade (Black, 4 Inch X 4 Inch X 10 Inch)Pack of 1",make,0,0,0,919,4.3,121,60,"Sunday, February 20",1,121
100,B09PRKQ168,"Global Traders Mosaic Glass Night Table Lamp/Desk Lamp with Round Shape Wooden Fitting for Home Decoration,Living Room,Bedside,Study Room,Reading Pack of 1",Global,0,0,0,479,0,0,40,"Saturday, February 26",0,"₹479
₹800 Save ₹321 (40%)"
101,B07B93RFST,AKR Rocklight RL 8888 Rechargeable Touch Dimmer Plastic LED Study Table Lamp (White),AKR,0,0,0,420,3.8,8,24,"Thursday, February 24",0,8
102,B09DYSDJZ4,GJSHOP Multifunctional Camera Style Table lamp Piggy Desk Lamp with Pencil Sharpener (Multicolor),GJSHOP,0,0,0,399,0,0,80,"Thursday, February 24",0,"₹399
₹2,000 Save ₹1,601 (80%)"
103,B09G6VYM74,ZOSOE Rechargeable LED Touch On/Off Switch Desk Lamp Children Eye Protection Student Study Reading Dimmer Rechargeable Led Table Lamps USB Charging Light for Study (Multicolour)Pack of 1,ZOSOE,0,0,0,499,4.0,182,44,"Wednesday, February 23",1,182
104,B09P56Y1DX,ZOSTER Rechargeable LED Touch On/Off Switch Desk Lamp Children Eye Protection Student Study Reading Dimmer Rechargeable Led Table Lamps USB Charging Touch Dimmer(Desk Lights for Study)- White,ZOSTER,0,0,0,349,3.5,2,30,"Thursday, February 24",0,2
105,B09NRFBVFR,"ELVIES Rechargeable led Desk Lamp Touch Control On Off Student Study Table Lamps Touch Dimmer Night Reading Lamp for Children Eye Protection Lamp(Multi Colour,Pack of 1)",ELVIES,0,0,0,299,4.0,6,70,"Friday, February 25",0,6
106,B09RTMLJMW,Ignitate Study Desk Lamp Rechargeable LED Touch On-Off Switch Dimmable Student Study Reading Led Table Lamps with 3 Brightness Modes (White),Ignitate,0,0,0,299,0,0,70,"Friday, February 25",0,"₹299
₹999 Save ₹700 (70%)"
107,B09HSRHYTD,THE ACE STORE Plastic ABS 7 Color Changing Sensor Touch 3D Moon Crystal Night Lamp with Wooden Stand (Multicolor),THE,0,0,0,649,4.0,67,35,"Thursday, February 24",0,67
108,B08BQVC1YK,Home Centre Ceramic Table Lamp ( Peach ),Home,0,0,0,499,4.3,114,0,"Wednesday, February 23",1,114
109,B017IRDEVO,"BillieJean Matte Black 777 Reading & Studying Table Lamp, Pack of 1",BillieJean,0,0,0,699,4.2,109,30,"Wednesday, February 23",1,109
110,B078YSFMRW,Original LED Table Lamp (Warm White),Original,0,0,0,650,4.3,11,57,"Thursday, February 24",0,11
111,B09RB823QP,Gesto Study lamp Rechargeable Led Touch On Off Switch Student Study Reading Dimmer Led Table Lamps White Desk Light Lamp,Gesto,0,0,0,499,0,0,75,"Wednesday, February 23",1,"₹499
₹1,999 Save ₹1,500 (75%)"
112,B08L94FNQ2,"Desidiya 3D 7 Color Changing Moon Night Rechargeable Lamp with Stand for Bedroom Lights for Adults and Kids Home Room Beautiful Indoor Lighting - 15 cm, Pack of 1",Desidiya,0,1,0,949,4.0,"12,875",53,"Sunday, February 20",1,"12,875"
113,B09FC7S8XW,"Attractive Bedside White Metal Base with 8 Inch Handmade White Silk Fabric Shade Table Lamp for Night Light, Bedroom, Decorative Living Room, Hall Lighting and Home Decor (White) [Complementary Bulb Included]",Attractive,0,0,0,999,5.0,3,33,"Wednesday, February 23",1,3
114,B08VJCF7XY,"RK Lighting House Mashroom , Dome Shaped B22 Holder Table lamp (White)",RK,0,0,0,380,3.7,65,79,"Saturday, February 26",1,65
115,B09ND57Y92,"ITRUE Night Light, Table Lamps with Bluetooth Speaker Handy Dimmable LED Bedside Lamp Rechargeable Warm White Light 3 Levels Brightness& 6 Color Changing, Smart Lamp for Bedrooms or Outside",ITRUE,0,0,0,629,3.7,9,55,"Wednesday, February 23",1,9
116,B08XXZKZ5M,"@home By Nilkamal Venus Mango Wood 14 inch Table Lamp for Home Decoration Without Bulb -Beige, Brown, Medium, (15 cm x 15 cm x 36.5 cm)",@home,1,0,0,930,4.2,139,53,"Sunday, February 27",1,139
117,B09RSR7WYX,Ritmo Office Room Desk Lamp Luxury Cordless Crystal Table Lamp Modern Living Room Sofas Bedroom Touch Dimming Reading Lamps with USB Charging Bedside Table Lamp,Ritmo,1,0,0,"1,999",0,0,50,"Wednesday, February 23",1,"₹1,999
₹3,999 Save ₹2,000 (50%)"
118,B09RPFPCLP,"Ritmo Table Lamp Crystal Diamond Lamp ( 3 Color USB Touch Lamp ) LED Light Desk Lamp Decor for Bedroom, Living Room, Guest Room",,1,0,0,0,0,0,0,,0,
119,B013QTS9G8,Green Girgit Metal Lamp (Multicolour),Green,1,0,0,999,5.0,2,33,"Thursday, February 24",0,2
120,B07G9YNDNP,"Homesake Ceramic Table Lamp with Shade, Off-White, Pack of 1",Homesake,1,0,0,"1,850",4.3,"2,051",34,"Wednesday, February 23",1,"2,051"
121,B09RPHMHN9,"Ritmo Table Lamps for Bedroom Living Room Study Office Crystal Diamond Table lamp Touch Control Decorative Table Light, with USB Port, Battery Powered ( 3 - Color Dimmable Lamp )",Ritmo,1,0,0,"2,299",0,0,50,"Wednesday, February 23",1,"₹2,299
₹4,599 Save ₹2,300 (50%)"
122,B09RPPR7GY,"Ritmo Table Lamps for Bedroom Living Room Study Office Crystal Diamond Table lamp Touch Control Decorative Table Light, with USB Port,Battery Powered ( 3-Color Dimmable )",Ritmo,1,0,0,"2,299",0,0,50,"Wednesday, February 23",1,"₹2,299
₹4,599 Save ₹2,300 (50%)"
123,B08WLT4D5C,Homesake Modern Farmhouse Metal Diamond Desk Table Lamp with Light Bulb Decorative Bed Table Side Matt Black Light (Diamond White),Homesake,1,0,0,"1,599",2.7,2,43,"Wednesday, February 23",1,2
124,B09NRBHC8C,REFULGIX 3D 7 Color Changing 15 cm Moon Night Rechargeable Lamp with Stand for Bedroom Lights for Adults and Kids Gifts Beautiful Indoor Lighting,REFULGIX,0,0,0,699,3.5,25,30,"Tuesday, February 22",1,25
125,B0866HY6B3,Bajaj Softlite Mini LED RC Portable Table Lamp - White,Bajaj,0,0,0,"1,077",4.3,"1,073",9,"Sunday, February 20",1,"1,073"
126,B071RJRJBV,"Sunsenses Black 23"" Doctor Table Lamp for Reading / Study / Learning / Work, Pack of 1",Sunsenses,0,0,0,978,4.3,593,21,"Thursday, February 24",0,593
