,asin,title,brand,Sponsored,Best Seller,Amazon's Choice,Price,Rating,NoofRatings,Discount,Delivery,Prime Delivery,base
0,B08GKFVRFK,"Joyfit Vinyl Coated Dumbbells - Highly Durable Hexagon Dumbbells, Color-Coded Hand Weights for Fitness and Strength Training at Home/Gym Exercise - Ideal for Beginners and Advanced Users [Pair]",Joyfit,1,0,0,999,4.4,44,50,"Thursday, February 17",1,44
1,B09J8Y5RY6,"Official Flexnest® Pair Of 2 Adjustable Dumbbells Set (2.5Kg To 24Kg) For Men And Women, German Design, Easy Weight Adjustment, Home Workout, Gym Exercise Set",Official,1,0,0,"16,998",4.2,17,59,"Thursday, February 17",0,17
2,B07FNXDYR4,AmazonBasics Vinyl Dumbbells,AmazonBasics,1,0,0,819,4.5,"11,740",52,"Sunday, February 13",1,"11,740"
3,B08TLTYKTQ,"Lifelong PVC Dumbbells Pack of 2 10Kg(2*5Kg) for Home Gym Equipment Fitness Barbell|Gym Exercise|Home Workout, Gym Dumbbells|Dumbbells Weights for Men & Women (6 Months Warranty)",Lifelong,1,0,0,619,3.9,345,48,"Sunday, February 13",1,345
4,B07WNGQ8Q1,"Aurion Dumbbells (Boxed in Pair) (Choose of 1KG, 2KG, 3KG, 4KG, 5KG,6 KG) for Home Gym Exercise, Fitness and Weights for Women and Men Dumbbells Set",Aurion,0,0,0,472,3.8,"8,327",50,"Sunday, February 20",0,"8,327"
5,B089DY5NNL,Kore PVC 20 KG Spare Weight Plates Combo,Kore,0,0,0,799,3.6,"8,657",68,"Thursday, February 17",1,"8,657"
6,B07PM1ZMHK,"Unisex Hexagon Vinyl Dumbbell - Pair Set Hand Weights for Strength Training - Weight Loss, Workout Bench, Gym Dumbbells, and Home Workouts - Set of 2, 1 kg Pink",Unisex,0,0,0,477,4.3,161,52,"Thursday, February 17",1,161
7,B09FZ6Y8Z5,"Aurion 12kg Dumbbell Workout Weight Set Including Stand - PVC Coated Exercise & Fitness Dumbbell for Home Gym Equipment Workouts Strength Training for Women, Men.(1 kg+2kg+3kg)",Aurion,0,0,0,999,4.2,52,0,"Sunday, February 13",1,52
8,B07X3VK7CD,Aurion Weight Plate disc Vinyl Standard Weights Plates Set for Weight Lifting Dumbbell Bars Strength Training Home Gym Fitness Workout(4 KG to 30 kg),Aurion,0,0,0,199,3.9,"1,421",0,"Sunday, February 20",0,"1,421"
9,B09MW2SMMZ,GYM BANDITS Home Gym Combo 3Ft Straight Rod One Pair Dumbbell Rods PVC Dumbbell Plates Home Gym Kit Weight Plates Fitness Exercise Set Gym Accessories,GYM,0,0,0,999,3.4,4,50,"Friday, February 18",0,4
10,B089DF1PXS,Kore PVC 10-30 Kg Home Gym Set with One 3 Ft Curl and One Pair Dumbbell Rods with Gym Accessories,Kore,0,0,0,"1,429",3.5,"26,043",65,"Thursday, February 17",1,"26,043"
11,B09PQSKBZN,"Rapidotzz PVC Dumbbell Weights | Exercise, Fitness | Home Gym | Pair of 2 | 1 - 5 Kg | Youthful Colours | Men & Women",Rapidotzz,0,0,0,199,0,0,90,"Wednesday, February 16",0,"₹199
₹1,999 Save ₹1,800 (90%)"
12,B09NRWHR43,"Zustle Unisex Pack of 2 Dumbbells Weights for Men and Women, Can be Used in Home and Gym (Unisex – Indoor & Outdoor)",Zustle,0,0,0,349,4.7,23,56,"Wednesday, February 16",0,23
13,B096VVBJCY,Aurion PVC Dumbbells Weights Exercise Barbell for Men & Women,Aurion,0,0,0,335,3.9,"4,572",0,"Sunday, February 13",0,"4,572"
14,B07K475JTD,"Facto Power Home Gym with Curl Rod, Dumbbell Rods and 1 Accessory for Fitness, Weight Lifting, Body Shaping and Body Toning",Facto,0,0,0,697,2.1,9,59,"Thursday, February 17",1,9
15,B08DS5SC8H,Kore Home gym & Fitness Kit,Kore,0,0,0,799,3.5,"10,582",70,"Thursday, February 17",1,"10,582"
16,B08JKBK2KR,Liffo® 15-inch Dumbbell Rod with Plastic Nuts Weight Lifting Bar Black (Pack of 2 Pcs),Liffo®,0,0,0,325,4.1,706,57,"Thursday, February 17",1,706
17,B09K1LZSK4,"CORSO PVC Dumbbell Plates Home Gym Combo (8Kg to 20 Kg), PVC Dumbbell Set, PVC Dumbbell Plates, Adjustable Dumbbells, Weight Plates, Home Gym Equipments for Men, Exercise Set",CORSO,0,0,0,549,0,0,57,"Thursday, February 17",1,"₹549
₹1,279 Save ₹730 (57%)"
18,B08JPXZW91,"Gym Insane PVC Dumbbell Set for Weight Lifting Training Fitness Equipment, for Men and Women Gym Accessories Home Workout Gym Dumbbells. 4kg(2 kg x2, blue)",Gym,0,0,0,245,3.4,11,65,"Thursday, February 17",0,11
19,B07GWJQ3ZH,Kakss Cast Iron Vinyl Coated Dumbbells,Kakss,0,0,0,339,4.4,"1,636",43,"Wednesday, February 16",0,"1,636"
20,B09HHDNHP4,FitBox Sports 3 In 1 Convertible Dumbbells kit,FitBox,1,0,0,"1,299",3.5,27,70,"Wednesday, February 16",1,27
21,B07DM5YFGQ,Kakss Best Home Gym Training (10 Kg to 200 Kg) Home Gym Set with Exclusive Neoprene Coated Weight Plates with 3 ft Curl (25MM) + 5 ft Plain Rod (25MM) (Proudly Made in India),Kakss,1,0,0,"8,998",4.2,183,50,"Thursday, February 17",0,183
22,B01I7ZGSB4,"Aurion DB20 Plastic Dumbell Set Combo, 20Kg (Black)",Aurion,1,0,0,"1,074",3.9,96,23,"Thursday, February 17",1,96
23,B098JV1SNN,FitBox Sports Octa PVC Dumbbells,FitBox,1,0,0,199,3.3,36,20,"Wednesday, February 16",0,36
24,B09FZ68ZPF,Aurion Dumbbell Weight Stand for Home Gym Equipment Workouts Strength Training Only Dumbbell Stand),Aurion,0,1,0,356,3.1,25,11,"Sunday, February 13",0,25
25,B09M8WNBJX,Home gym set Dumbell,Home,0,0,0,"1,998",3.6,4,9,"Wednesday, February 16",1,4
26,B09QB4RK1S,"Skudgear Pair of 2 Chrome Dumbbell Weights | Cushioned handles | Exercise, Fitness | Home Gym | Barbell | Women & Men",Skudgear,0,0,0,849,0,0,58,"Wednesday, February 16",1,"₹849
₹1,999 Save ₹1,150 (58%)"
27,B0963CJ4XH,"FirstFit Dumbbell Set of 2, Non-Slip, Free Weights Set for Muscle Toning, Strength Building, Weight Loss for Women and Men",FirstFit,0,0,0,299,4.2,9,57,"Wednesday, February 16",1,9
28,B09P55HTWQ,"Forgesy PVC & Vinyl Dumbbells Weights for Men & Women, 1 KG Each, (YELLOW) (Pack of 2)",Forgesy,0,0,0,490,0,0,51,"Thursday, February 17",1,"₹490
₹999 Save ₹509 (51%)"
29,B0963CTWTD,"Wearslim® Exercise & Fitness PVC Dumbbell Set of 2, Home Gym Equipment Workouts Free Weight Fixed Rubberized Muscle Gain for Unisex Multi-Color",Wearslim®,0,0,0,299,4.1,20,57,"Wednesday, February 16",0,20
30,B09Q244KK2,VICTORY HEXA -Pair PVC Dumbbell for Home Gym & Fitness Fixed Weight Dumbbell Black,VICTORY,0,0,0,379,0,0,62,"Thursday, February 17",0,"₹379
₹999 Save ₹620 (62%)"
31,B08K3G4HN7,"Lifelong PVC Dumbbells Pack of 2 2Kg-4Kg for Home Gym Equipment Fitness Barbell|Home Workout, Gym Dumbbells|Easy Grip & Anti- Slip Dumbbells|Dumbbells Weights for Men & Women (6 Months Warranty)",Lifelong,0,0,1,199,4.1,"1,779",60,"Sunday, February 13",0,"1,779"
32,B09MS7W965,"ALLYSON FITNESS HEAVY DUTY 3-Tier 38'' Width Dumbbell Barbell Weight Rack, 1300 lbs Weight Capacity Storage Stand with Reinforced Tube for Home Gym, Bonus 4 Barbell",ALLYSON,0,0,0,"4,899",1.0,1,30,"Saturday, February 19",1,1
33,B07PG6NRFR,Aurion Set of 2 PVC Dumbbells Weights Fitness Home Gym Exercise Barbell (Pack of 2) Light Heavy for Women & Men’s Dumbbell,Aurion,0,0,0,293,4.0,"17,287",58,"Sunday, February 20",0,"17,287"
34,B091Q5CXR8,"FitBox Sports Intruder 4Kg Kettlebell Weights with 2kg x 2 Dumbbells, Black",FitBox,0,0,0,524,5.0,1,0,"Wednesday, February 16",1,1
35,B09PRNT9V3,"Lifelong LLDR02 Dumbbell Rods with Connectors|Barbell Rods Weight Lifting Strength Training & Exercise Fitness, Gym Equipment for Home Gym Workout (6 Months Warranty, Black)",Lifelong,0,0,0,595,0,0,1,"Sunday, February 13",1,"₹595
₹599 Save ₹4 (1%)"
36,B09DSQ2LZQ,Apurvaa Sports 20kg (5kg x 2 +2.5kg x 4) PVC A Grade Quality Weights Plates Filled with Sand Set for Weight Lifting Dumbbell Bars Strength Training Home Gym Fitness Workout,Apurvaa,0,0,0,700,0,0,65,"Thursday, February 17",0,"₹700
₹1,999 Save ₹1,299 (65%)"
37,B09RGQVJKK,"Aurion PVC Encase Coating Free Weight Dumbbell Set for Strength Training, Home Gym Fitness and Full Body Workout",Aurion,0,0,0,499,3.6,234,0,"Thursday, February 17",1,234
38,B08B24GDHQ,"FitBox Sports Blend Intruder 20 Kg Weight Plates, 5 Kg X 4 (Black)",FitBox,0,0,0,725,3.7,353,70,"Wednesday, February 16",1,353
39,B098MHD14G,Kore PVC DM 1-5 Kg (Set of Two) Combo 161 (Round / Hex) Dumbbells Set and Fitness Kit for Men and Women Whole Body Workout,Kore,0,1,0,349,3.7,687,0,"Sunday, February 20",0,687
40,B09DKLD2ZN,YORBAX® Set of 2 kg X 2 Pieces Fixed Weight Steel Dumbbell for Men/Women (4 KG),YORBAX®,0,0,0,669,4.2,9,33,"Friday, February 18",0,9
41,B074DZ65J3,"AmazonBasics Rubber Encased Hex Dumbbell Weight - 10.7 x 4 x 3.5 Inches, 4.5 kg",AmazonBasics,0,0,0,760,4.5,"2,724",49,"Sunday, February 13",1,"2,724"
42,B08NJXJPGH,"Fratii's Rubber Hex Dumbbells for Unisex {Boxed in Pair} Choose of 2.5 kg, 5 kg, 7.5 kg, 10 kg, 12.5 kg, 15 kg for Home Gym Exercise, Fitness and Weights",Fratii's,0,0,0,"2,349",4.6,481,61,"Thursday, February 17",1,481
43,B07B91CQH6,Protoner Pair of 5kg Each PVC Dumbbells Set,Protoner,0,1,0,499,3.6,"2,993",73,"Thursday, February 17",1,"2,993"
44,B09BQCRWD3,YORBAX® Set of 2.5 kg X 2 Pieces Fixed Weight Steel Dumbbell for Men/Women (5 KG),YORBAX®,0,0,0,760,5.0,3,49,"Friday, February 18",0,3
45,B09H3BQ735,"K.D. Fitness Dumbbell Rod bar 14 Inches with 4 Iron Bolt Nuts Weight Lifting Strength Training & Exercise Fitness, Gym Equipment for Home Gym Workout",K.D.,0,0,0,300,4.5,27,75,"Thursday, February 17",0,27
46,B09PN65WQW,"BULLAR Rubber Home Gym Set with 4Ft Curl 5Ft Straight Rod, Pair of Dumbbell Rods, Rubber Weight Plates Combo, Gym Equipment for Workout Fitness Exercise Kit",BULLAR,0,0,0,0,4.0,7,0,,0,7
47,B08WH7RV2X,Kore PVC 20-50 Kg Home Gym Set with One Plain + One Curl and One Pair Dumbbell Rods with Gym Accessories and PVC Dumbbells,Kore,0,1,0,"2,399",3.4,"8,627",0,"Thursday, February 17",1,"8,627"
48,B07B8MMQC8,"Protoner 20kg Adjustable Dumbbell Set for Adult, PVC",Protoner,0,0,0,899,3.4,"1,786",78,"Monday, February 28",0,"1,786"
49,B09CDSYRTC,SAPPHIRE Non Toxic Neoprene Coated Dumbbells Available in Weights for Home/Gym Use 1 to 9 kg,SAPPHIRE,0,0,0,897,4.1,44,10,"Thursday, February 17",1,44
50,B09BR3HKWN,"Unisex Hexagon Vinyl Dumbbell - Pair Set Hand Weights for Strength Training - Weight Loss, Workout Bench, Gym Dumbbells, and Home Workouts - Set of 2, 1 kg Pink�",Unisex,0,0,0,499,4.8,7,33,"Thursday, February 17",0,7
51,B08ZY6STMT,"Protoner 3 in 1 Dumbbell Rack, Plate Stand and bar Holder (Black and Yellow)",Protoner,0,0,0,"3,749",4.1,185,63,"Friday, February 18",1,185
52,B071HSCWRM,Kore Professional (Hexa / Steel)  1 - 20 Kg (Set of Two) Dumbbells Home Gym Exercise Equipment for Men & Women,Kore,0,0,0,"2,899",4.4,790,51,"Thursday, February 17",1,790
53,B07D73Z45Y,"AURION M3+SOTGRIP-X 1 Hand Dumbbells Weights Fitness Home Gym Exercise Barbell 1kg, 2kg, 3kg, 4kg, 5kg (Blue, Pack of 2)",AURION,0,0,0,514,3.0,11,36,"Sunday, February 20",1,11
54,B074DYLY5V,"AmazonBasics Rubber Encased Hex Dumbbell Weight - 13.3 x 5.7 x 4.8 Inches, 13.6 kg",AmazonBasics,0,0,0,"1,393",4.6,"2,113",67,"Sunday, February 13",1,"2,113"
55,B08N4JYQ4X,"SC 2 X 1 Kg Steel Dumbell Set, Fixed Weight Dumbbells, Dumbbell Set 1 Pair",SC,0,0,0,425,4.5,6,50,"Friday, February 18",0,6
56,B097SWJRNQ,"BULLAR Steel Home Gym Set with 4Ft Curl, 5Ft Straight Rod, Pair Star nut Dumbbell Rods, Steel Weight Plates Combo, Gym Equipment for Workout Fitness Exercise Kit(10kg-70Kg)",BULLAR,1,0,0,"5,649",3.9,24,29,"Monday, February 14",0,24
57,B08W4W1H9K,"Joyfit Stackable Dumbbell Set with cast Iron Weights, Handlebars and Carry Box for arms, Chest, Back and Leg Workouts, Strength and Fitness Training at Home and Gym (1 Set)",Joyfit,1,0,0,"4,999",3.5,4,50,"Thursday, February 17",1,4
58,B0993QJDS5,"FitBox Sports Gym Combo 8kg - 20kg with Barbell Rod, Dumbbells & Gym Accessories",FitBox,1,0,0,"1,249",3.3,5,43,"Wednesday, February 16",1,5
59,B078XXSXRX,"AmazonBasics Neoprene Dumbbell Pair, 2 x 5Kg",AmazonBasics,1,0,0,"1,999",4.7,"1,493",38,"Sunday, February 13",1,"1,493"
60,B08K3F7Y3D,"Lifelong PVC Dumbbells Pack of 2 2Kg-4Kg for Home Gym Equipment Fitness Barbell|Home Workout, Gym Dumbbells|Easy Grip & Anti- Slip Dumbbells|Dumbbells Weights for Men & Women (6 Months Warranty)",Lifelong,1,0,0,199,4.1,"1,779",60,"Sunday, February 13",0,"1,779"
61,B08TMH44P3,"Lifelong PVC Dumbbells Pack of 2 10Kg(2*5Kg) for Home Gym Equipment Fitness Barbell|Gym Exercise|Home Workout, Gym Dumbbells|Dumbbells Weights for Men & Women (6 Months Warranty)",Lifelong,1,0,0,619,3.9,345,48,"Sunday, February 13",1,345
62,B09NBSKQBZ,"Lifelong Olympic Barbell Rubber Weight Plates with 50mm Internal Dia and 3 Holes Hand Grip (Packed in Pair 5Kg-20Kg) Set for Weight Lifting, Dumbbell Bars, Strength Training and Home Gym Fitness Workout",Lifelong,1,0,0,"1,190",0,0,56,"Sunday, February 13",1,"₹1,190
₹2,699 Save ₹1,509 (56%)"
63,B07FNPJB3R,AmazonBasics Vinyl Dumbbells,AmazonBasics,1,0,0,"2,789",4.5,"11,739",48,"Sunday, February 13",1,"11,739"
64,B08HZ5G8F3,Lifelong Set of 2 Neoprene Cast Iron Dumbbells Weights Fitness Home Gym Exercise Barbell Light Heavy for Women & Men’s Dumbbell,Lifelong,0,0,0,"1,160",4.5,89,61,"Sunday, February 13",1,89
65,B09N9V1YH4,"Lifelong Rubber Weight Plates 30mm Diameter 5Kg-20Kg Set for Weight Lifting, Dumbbell Bars, Strength Training and Home Gym Fitness Workout (6 Months Warranty, Black)",Lifelong,0,0,0,999,5.0,1,57,"Sunday, February 13",1,1
66,B07BYZ2QPN,"Bodygrip BG123819 Dumbbell, 2Kg Pack of 2",Bodygrip,0,0,0,489,4.1,"1,166",90,"Thursday, February 17",0,"1,166"
67,B07RB4LDFC,Kakss Solid Neoprene Coated Weight Plates (1 to 10 Kg) (30 MM Center Hole) (Proudly Made in India),Kakss,0,0,0,999,4.5,245,41,"Wednesday, February 16",1,245
68,B08W4W1H9K,"Joyfit Stackable Dumbbell Set with cast Iron Weights, Handlebars and Carry Box for arms, Chest, Back and Leg Workouts, Strength and Fitness Training at Home and Gym (1 Set)",Joyfit,0,0,0,"4,999",3.5,4,50,"Thursday, February 17",1,4
69,B07N51YW1V,RV PVC 8 KG Dumbbell Weight Plate Set for Home Gym,RV,0,0,0,599,3.6,7,40,"Friday, February 18",1,7
70,B08H1YB7H5,"DS Fitness Hex Dumbbell of 5kg Each, Set of 2 Dumbbells Each 5kg, Total Weight 10kg (5kgÃ?2pcs)",DS,0,0,0,"1,380",3.6,11,61,"Thursday, February 17",0,11
71,B09M83RZHS,"WATSON Rubber Weight Plates, 14 inches cast Iron Dumbbells rods 25mm with Metal Nuts, Gym Equipment Set Iron rods for Home Workout Iron Nuts, Home Gym kit Rubber Plates Combos",WATSON,0,0,0,"2,499",4.3,34,50,"Thursday, February 17",0,34
72,B09N17RWC3,"DEALS UNLIMITED HEAVY DUTY 3-Tier 38'' Width Dumbbell Barbell Weight Rack, 1300 lbs Weight Capacity Storage Stand with Reinforced Tube for Home Gym, Bonus 4 Barbell With Side Rods",DEALS,0,0,0,"4,799",0,0,31,"Wednesday, February 16",1,"₹4,799
₹6,999 Save ₹2,200 (31%)"
73,B097Z2FN6K,SFZ 2.5kg Single Steel Chrome Dumbbell / 2.5kg×1 piece / Dumbell With Cushion Grip / Home Gym Kit Dumbell 2.5kg Weights,SFZ,0,0,0,499,0,0,75,"Thursday, February 17",1,"₹499
₹1,999 Save ₹1,500 (75%)"
74,B09P5GYNHB,Fitness Bulls Set TopMad e Neoprene Iron Dumbbells Hand Weight Set Barbell Exercise Fitness Hex Dumbbell Free Weight for Women Men Home Gym,Fitness,0,0,0,590,5.0,1,41,"Wednesday, February 16",0,1
75,B08B23766F,FitBox Sports Intruder 10 Kg Blend Weight Plates - 2.5 Kg X 4 (Black),FitBox,0,0,0,399,3.7,55,77,"Wednesday, February 16",0,55
76,B07K28CGLP,RUBX Rubber Coated Professional Exercise Hex Dumbbells (Pack of Two),RUBX,0,0,0,"1,018",4.7,"4,333",43,"Sunday, February 13",1,"4,333"
77,B089NWGPGJ,"Gym Insane Dumbbell Rod bar 14 Inches with 4 Iron Bolt Nuts Weight Lifting Strength Training & Exercise Fitness, Gym Equipment for Home Gym Workout",Gym,0,0,0,335,4.0,547,74,"Thursday, February 17",0,547
78,B096N2HDD6,"SUS PRODUCTS Home Gym Combo Home Gym Set Dumbbell Set 10 KG, with One Pair Dumbbell Rods, PVC Dumbbell Plates, Home Gym Kit, Heavy Weight Plates, Fitness Exercise Set {2.5KG X 4=10 KG}",SUS,0,0,0,649,3.1,26,76,"Wednesday, February 16",0,26
79,B09QPL96XL,"WiseLife Vinyl Coated Dumbell Hand Weight for Men & Women-1 kg, 3 kg, 5 kg (Set of 2) With Dumbell Holder Rack | Easy to Carry, Non-Slippery Dumbell For Home Gym",WiseLife,0,0,0,495,0,0,40,"Wednesday, February 16",0,"₹495
₹825 Save ₹330 (40%)"
80,B09N9SBH7K,"Lifelong Rubber Weight Plates 30mm Diameter 5Kg-20Kg Set for Weight Lifting, Dumbbell Bars, Strength Training and Home Gym Fitness Workout (6 Months Warranty, Black)",Lifelong,1,0,0,733,5.0,1,44,"Sunday, February 13",1,1
81,B08F7XK3LV,"ALLYSON FITNESSAdjustable Incline, Decline and Flat Bench for Home and Professional Gym Utility Exercise Bench for Weight Strength Training, Sit Up - Weight Capacity 350 Kg",ALLYSON,1,1,0,"3,499",3.9,605,56,"Wednesday, February 16",1,605
82,B0933C5S1N,VAISHNAVI FITNESS 20 in 1 Home Gym Bench with 34KG Rubber Dumbbell Plates Weight Adjustable Weight Lifting Bench,VAISHNAVI,1,0,0,"13,499",4.0,1,40,"Thursday, February 17",0,1
83,B08GKFKVJZ,"Joyfit Vinyl Coated Dumbbells - Highly Durable Hexagon Dumbbells, Color-Coded Hand Weights for Fitness and Strength Training at Home/Gym Exercise - Ideal for Beginners and Advanced Users [Pair]",Joyfit,1,0,0,"1,799",4.4,44,40,"Thursday, February 17",1,44
84,B09P8WK7K2,"RSN PVC Hex Dumbbells for Men & Women, PVC Dumbbell Plates Home Gym Combo, PVC Dumbbell Set, Adjustable Dumbbells, Weight Plates",RSN,0,0,0,609,2.0,2,75,"Thursday, February 17",1,2
85,B09QQQGG97,"SUS PRODUCTS Hex Dumbbells (1KG To 5KG) PVC Encase Coating Free Weight Dumbbell Set for Strength Training, Home Gym Fitness and Full Body Workout",SUS,0,0,0,749,0,0,75,"Wednesday, February 16",1,"₹749
₹2,999 Save ₹2,250 (75%)"
86,B093T244CJ,"BOND WAY TO FITNESS Vinyl Dumbbells (Pair) for Men & Women, Vinyl Dumbells for Weight Lifting, Training Fitness Barbell Bench Press Exercise, Home and Gym Equipment, 2 KG to 5 KG Set",BOND,0,0,0,"1,600",4.4,8,20,"Wednesday, February 16",0,8
87,B077QR8JSD,BodyFit Home Gym Weight Lifting Adjustable Dumbbells Exercise Sets (20 Kg),BodyFit,0,0,0,890,3.7,11,69,"Friday, February 25",0,11
88,B08TLTYKTQ,"Lifelong PVC Dumbbells Pack of 2 10Kg(2*5Kg) for Home Gym Equipment Fitness Barbell|Gym Exercise|Home Workout, Gym Dumbbells|Dumbbells Weights for Men & Women (6 Months Warranty)",Lifelong,0,0,0,619,3.9,345,48,"Sunday, February 13",1,345
89,B083LKYJQB,FITSY Adjustable Dumbbell Set - 20 kg PVC Dumbbell and Rod Set for Home Gym Workout with Extension Barbell Rod [AR-2693],FITSY,0,0,0,"2,799",4.1,219,20,"Wednesday, February 16",1,219
90,B0991GW8RF,Gym Hero Captain America Dumbbells Gym 2.5kg Set / 2.5kg×2 Piece / Bouncer Dumbell Pair / Exercise Dambal / 5kg Weight,Gym,0,0,0,"1,199",3.5,3,56,"Thursday, February 17",1,3
91,B0954NX8W5,"SFZ Bouncer dumbbell 7.5kg sets , 7.5kg×2 pcs , Rubber Coated Dumbbell , Round Rubber Home Gym Kit Dumbbells (Pack Of Two) 15kg Weights",SFZ,0,0,0,"1,999",5.0,1,64,"Friday, February 18",0,1
92,B075F7KXBY,"Aurion Hand Dumbbells Weights Fitness Home Gym Exercise Barbell 1Kg, 2Kg, 3Kg, 4Kg, 5Kg Set (Pack of 2) Light Heavy Ladies Mens Dumbbells with Hand Gripper",Aurion,0,0,0,246,3.9,860,24,"Sunday, February 20",0,860
93,B09N2GDX49,Aurion Weight Plates –28mm Spare PVC Vinyl Weights Discs - Bumper Plates for Strength Training Gym Home and Weightlifting - Dumbbell Plates (2.5 KG x 4 = 10KG),Aurion,0,0,0,389,5.0,1,0,"Sunday, February 13",0,1
94,B00RCL1PB8,Bouncer Dumbbells 7.5kg Set | 7.5kg x 2pcs Pair | Bouncer dumbell | Rubber Coated Dumbles | Home Gym kit Dumbells | (Pack of 2) | Fixed Weight damball | 15 Weights,Bouncer,0,0,0,"2,099",5.0,2,53,"Thursday, February 17",0,2
95,B07FNPJB3R,AmazonBasics Vinyl Dumbbells,AmazonBasics,0,0,0,"2,789",4.5,"11,739",48,"Sunday, February 13",1,"11,739"
96,B09NRKMD9C,"S&P TechoWorld Barbell grip Gym Dumbbell and Barbell Grips | Fat Grip fit Standard Barbell, Dumbell Handles, Bicep, Pull Up Bar, Rope Grips for Weight Lifting Fitness Training (Pack of 2) (Blue)",S&P,0,0,0,499,0,0,0,"Wednesday, February 16",1,"₹499
₹500"
97,B098QWNYRR,ALLYSON FITNESS 3 Tier Metal Steel Home Workout Gym Dumbbell Heavy Weight Rack Storage Stand For Home Gym,ALLYSON,0,0,0,"4,249",4.5,2,39,"Saturday, February 19",1,2
98,B09J8Y5RY6,"Official Flexnest® Pair Of 2 Adjustable Dumbbells Set (2.5Kg To 24Kg) For Men And Women, German Design, Easy Weight Adjustment, Home Workout, Gym Exercise Set",Official,0,0,0,"16,998",4.2,17,59,"Thursday, February 17",0,17
99,B0981YWQ6T,SUS Products PVC 10 Kg Weight Plates Combo ( 5 Kg x 2 ) Dumbbell Plates.(),SUS,0,0,0,599,5.0,3,80,"Wednesday, February 16",1,3
100,B09NBSKQBZ,"Lifelong Olympic Barbell Rubber Weight Plates with 50mm Internal Dia and 3 Holes Hand Grip (Packed in Pair 5Kg-20Kg) Set for Weight Lifting, Dumbbell Bars, Strength Training and Home Gym Fitness Workout",Lifelong,0,0,0,"1,190",0,0,56,"Sunday, February 13",1,"₹1,190
₹2,699 Save ₹1,509 (56%)"
101,B08WRVZ9QZ,Kiraro Pair of 5KG X 2 Steel Dumbbells Fixed Weight Dumbbell (10 kg),Kiraro,0,0,0,"1,599",4.0,94,54,"Thursday, February 17",1,94
102,B09QCDNRHR,"Skudgear Pair of 2 Hex Dumbbell Weights | Rubber coated | Exercise, Fitness | Home Gym | Barbell | Women & Men",Skudgear,0,0,0,849,0,0,58,"Wednesday, February 16",1,"₹849
₹1,999 Save ₹1,150 (58%)"
103,B09DT3MPM5,"ASP Home Gym Combo, Set, (10 KG DUMBLE),1+ One Pair Dumbbell Rods+ PVC Dumbbell Plates, Weight Plates, Fitness Exercise Set. ((2.5X4 DUMBLE 10 KG)",ASP,0,0,0,725,2.7,4,76,"Wednesday, February 16",0,4
104,B08X17HRHH,"BODYFIT Home Gym Combo Dumbbell Set, Dumbbell Plates, Home Gym Set, Adjustable Dumbbells, Weight Plates, Home Gym Equipments for Men, Exercise Set.",BODYFIT,0,0,0,499,3.6,94,76,"Friday, February 25",0,94
105,B09LS1DKCG,ALLYSON FITNESS 3 Tier Metal Steel Home Workout Gym Dumbbell Heavy Weight Rack Storage Stand For Home Gym,ALLYSON,0,0,0,"4,249",0,0,47,"Saturday, February 19",1,"₹4,249
₹7,999 Save ₹3,750 (47%)"
106,B098JV1SNN,FitBox Sports Octa PVC Dumbbells,FitBox,0,0,0,199,3.3,36,20,"Wednesday, February 16",0,36
107,B08VWPRQN4,BK SPORTS Steel Dumbbells 2.5kgx2 Total Weight 5kg Fitness Equipment for Exercise,BK,0,0,0,790,4.2,17,74,"Thursday, February 17",1,17
108,B0967Z79WC,SUS Products™ PVC 10 Kg Weight Plates Combo ( 5 Kg x 2 ) Dumbbell Plates,SUS,0,0,0,599,3.4,52,63,"Wednesday, February 16",1,52
109,B07P55QLM7,Aurion PVC Coated Dumbbells Weights Fitness Home Gym Exercise Barbell (Pack of 2) Light Heavy Ladies Mens Dumbbells,Aurion,0,0,0,299,3.7,421,50,"Thursday, February 17",1,421
110,B08DMQ42DF,"Unisex Hexagon Vinyl 1 kg Pink Dumbbell - Pair Set Hand Weights for Strength Training - Weight Loss, Workout Bench, Gym Equipment, and Home Workouts - Set of 2 (Pink)",Unisex,0,0,0,485,4.5,23,31,"Thursday, February 17",1,23
111,B09B3LMMR9,KNK®Hex Dumbbell 1kg-4kg Rubber Coated Hexagonal Shape Caste Iron Weight Lifting Body Building Exercise Workout Fitness Set.,KNK®Hex,0,0,0,"1,100",4.7,7,48,"Thursday, February 17",1,7
112,B08GKFVRFK,"Joyfit Vinyl Coated Dumbbells - Highly Durable Hexagon Dumbbells, Color-Coded Hand Weights for Fitness and Strength Training at Home/Gym Exercise - Ideal for Beginners and Advanced Users [Pair]",Joyfit,0,0,0,999,4.4,44,50,"Thursday, February 17",1,44
113,B08L5BPRMM,SHONE Steel Dumbbells 3kg Set | 3kg x 2pcs Pair | Steel Dumbbell | Dumbles with Cushion Grip | Home Gym kit Dumbells | Exercise Dumbbell (Pack of 2) | 6kg Weights,SHONE,0,0,0,"1,149",4.8,14,54,"Thursday, February 17",1,14
114,B08WHXCN2H,Kore PVC 20-100 Kg Home Gym Set with One 4 Ft Plain + One 3 Ft Curl and One Pair Dumbbell Rods,Kore,0,0,0,"2,099",3.3,825,6,"Thursday, February 17",1,825
115,B07K3QPY8N,"Facto Power Home Gym, Curl Rod, Dumbell Rods & 1 Accessory for Fitness, Weight Lifting, Muscles Building, Body Toning & Body Shaping",Facto,0,0,0,632,3.2,9,59,"Thursday, February 17",1,9
116,B0747KN9FQ,AmazonBasics Cast Iron Hexagon Dumbbell,AmazonBasics,1,0,0,"3,299",4.4,"1,660",38,"Sunday, February 13",1,"1,660"
117,B0993Q7NSH,"FitBox Sports Gym Combo 8kg - 20kg with Barbell Rod, Dumbbells & Gym Accessories",FitBox,1,0,0,"1,099",3.3,5,46,"Wednesday, February 16",1,5
118,B09LYYQWNF,anythingbasic. PVC Dumbbell Set,,1,0,0,0,0,0,0,,0,
119,B09NBW7BXC,"Lifelong PVC Home Gym Set 10kg -20kg Plate with Extension Barbell Rod and Dumbbells Rods with Gym Accessories for Home Workouts; Fitness at Home ( Black , 6 Months Warranty )",Lifelong,1,0,0,"1,199",3.1,14,63,"Sunday, February 13",1,14
120,B08K3G4HN7,"Lifelong PVC Dumbbells Pack of 2 2Kg-4Kg for Home Gym Equipment Fitness Barbell|Home Workout, Gym Dumbbells|Easy Grip & Anti- Slip Dumbbells|Dumbbells Weights for Men & Women (6 Months Warranty)",Lifelong,1,0,1,199,4.1,"1,779",60,"Sunday, February 13",0,"1,779"
121,B06Y43NF94,Protoner Home Gym Set with Accessories,Protoner,1,0,0,"1,199",3.6,"3,004",60,"Thursday, February 17",1,"3,004"
122,B095NXW8DM,SAPPHIRE Non Toxic Neoprene Coated Dumbbells Available in Weights for Home/Gym Use 1 to 9 kg,SAPPHIRE,1,0,0,845,4.1,44,15,"Thursday, February 17",1,44
123,B09QKJDHTM,anythingbasic. PVC 20-60 Kg 3-5ft Without Accessories,,1,0,0,0,0,0,0,,0,
124,B07K3QPY8N,"Facto Power Home Gym, Curl Rod, Dumbell Rods & 1 Accessory for Fitness, Weight Lifting, Muscles Building, Body Toning & Body Shaping",Facto,0,0,0,632,3.2,9,59,"Thursday, February 17",1,9
125,B09B15Z4PH,CORSO PVC Hex Dumbbells For Men & Women Strength Training Set 1kg 2kg 3kg 4kg 5kg Pair Hex Dumbbells Set,CORSO,0,0,0,407,3.8,57,59,"Thursday, February 17",1,57
126,B07X3DGDRH,Kobo Vinyl Coated Iron Integrated Dumbbells Grippy Weights All-Purpose Color Coded Dumbbell for Strength Training (Pair),Kobo,0,0,0,499,3.9,31,23,"Wednesday, February 16",1,31
127,B09GF33XBK,Eagle Star(PVC 2kg Black Dumbbells Weights Exercise Barbell for Men & Women (Pack of 2),Eagle,0,0,0,439,0,0,63,"Thursday, February 17",0,"₹439
₹1,200 Save ₹761 (63%)"
128,B07N67BMMX,Aurion Oval Shape PVC Coated Dumbbells Set Fitness/Weights for Men & Women 4 KG (2 KG X 2),Aurion,0,0,0,484,3.9,510,39,"Sunday, February 20",0,510
129,B09LR2T913,FIT & FITNESS Hex Dumbbells Set and Fitness Kit for Men and Women Whole Body Workout,FIT,0,0,0,699,3.8,94,68,"Thursday, February 17",1,94
130,B09MLTP229,"Rioff® Oval Dumbbell (2kg+2kg =4kg) Home Gym Exercise, Fitness and Weights for Women and Men Dumbbells Set (2KgX2=4Kg)",Rioff®,0,0,0,435,2.9,5,56,"Thursday, February 17",1,5
