,asin,title,brand,Sponsored,Best Seller,Amazon's Choice,Price,Rating,NoofRatings,Discount,Delivery,Prime Delivery,base
247,B08CBN5RFL,"Maple Anti-Pollution 3 Layer Filtration System Cotton Breathable Washable And Reusable face Mask For Kids Boys/Girl Unisex Multi Colour Kids ,Make in India",Maple,0,0,0,299,4.0,"1,222",62,"Sunday, February 13",0,"1,222"
248,B09PHMKL1G,MEELANA Anti Pollution Non Woven Fabric Reusable & Washable N95 Mask Combo for Men & Women with 5 Layer Protection,MEELANA,0,0,0,219,3.9,18,78,,0,18
249,B099PN2JT2,Maple MP-23 Face Mask for Kids | Reusable and Washable | 3 Layer Filtration System | Anti Pollution | Cotton Protective | Fashionable kid Mask for Girl Boys Unisex,Maple,0,0,0,299,4.4,16,62,,0,16
250,B09H5H7DTM,"KENADIYA Cotton Reusable Super Breathable Fabric Anti-Bacterial Embroidered Cloth Face Mask Combo with Adjustable Ear Loop (Multicolour, Without Valve, Pack of 8) for Women, Girls",KENADIYA,0,0,0,388,4.1,351,74,,0,351
251,B09NW23GF8,HYDRISE (Pack of 15) (Grey) Premium N95 Mask For Men and Women with Mask Adjuster - Washable mask - Reusable mask - Pollution Mask - Protection mask - ISO NIOSH approved - Advanced Filtration,HYDRISE,0,0,0,349,3.5,2,65,,1,2
252,B08JPL5HPB,"MASQ By Q-One 4 Layer, Reusable Anti-Bacterial Cotton Cloth Face Mask (7-12 Years, Denim Blue-Pink-Peach, Pack of 3, Without Valve) for Kids",MASQ,0,0,0,299,4.5,662,33,,0,662
253,B09FY939TQ,"Weston9x Unisex Non-Woven Fabric 3 Ply Disposable Surgical Mask with Nose Pin Blue, Ultrasonic Soft Loops without Valve (Blue, Pack of 100)",Weston9x,0,0,0,159,4.5,226,47,,0,226
254,B09N79L5P3,"Duraplus Kids Non woven Ear Loop Style Protective 5 layered filtration with genuine Melt Blown and Hot Air Cotton Layers N95 Face Mask (Multi Design Small, Pack of 5+1(free))",Duraplus,0,0,0,299,3.7,4,40,,1,4
255,B09QYYXWG7,"Indiana Non-Woven 3 Ply Mask With Nose Pin White, Ultrasonic Soft Loops Pack of 100)",Indiana,0,0,0,130,0,0,57,,0,"₹130
₹300 Save ₹170 (57%)"
256,B08W32MXYC,"CHITRA exports N95 MULTI COLOR mask reusable, washable, breathable 5 layer mask with EAR loop (Multicolor, Free Size, Pack of 10)",CHITRA,0,0,0,199,5.0,1,75,,1,1
257,B08GKQT57G,PureMe Kids Cotton Reusable N95 Cloth Mask and 2 Filters without Valve (Cars print),PureMe,0,0,0,269,4.3,"3,277",4,"Sunday, February 13",1,"3,277"
258,B09J42Z4GW,Wisezag Dot Printed Masks for Women Surgical 3 Layer Masks with Nose Clip White Disposable Pack of 100 Pieces Pcs Pin 3 Ply Face Masks Comfortable Earloop 3 Layers Use and Throw Face Masks 3Ply,Wisezag,0,0,0,289,4.2,3,71,,0,3
259,B09QJQHRC2,"PENADIA Cotton Reusable Super Breathable Fabric Cloth Face mask with Adjustable Ear Loop For Man And Woman ,Multicolor -PACK OF 12",PENADIA,0,0,0,399,5.0,17,73,,0,17
260,B08P7KFJ1M,"OxiClear N99 Pollution Mask with 4 Activated Carbon Filters, Washable & Reusable, D.R.D.O Certified (NO-VALVE) (Royal Blue)",OxiClear,1,0,0,399,4.2,"4,171",20,"Saturday, February 12",0,"4,171"
261,B09FT2NS3K,Duraplus 3PLY Inner Loop Disposable Non Woven Face Mask (100pc) Box,Duraplus,1,0,0,379,1.0,1,62,,1,1
262,B09NGCBB4C,"brrf Cooling 7 Layer Mask with inbuilt filter, Cools When Wet, Adjustable Cord, Multi-Purpose Usage, Breathable, Reusable",brrf,1,0,0,499,5.0,1,29,,0,1
263,B08X74KGR2,"OxiClear Handloom Linen Anti-Pollution Face Mask, 3-Layer Super Breathable, Washable & Reusable (Pack of 3)",OxiClear,1,0,0,299,4.2,"3,238",25,"Thursday, February 10",0,"3,238"
264,B0936YLL8T,Positive N99 Reusable Face Mask | Fog-Free | Octo Protect | Jet Black,Positive,0,0,0,199,3.8,37,0,,1,37
265,B09HV6T2FY,"Aucklien ® Unisex Ultra Comfortable, Stretchable, Reusable & Washable Upto 60 Times Pure Cotton Stylish Cloth Face Mask with Valve For Wedding, Party, College, office, Daily Use (Black) - Pack of 5",Aucklien,0,0,0,250,3.5,52,89,,1,52
266,B09QKXTZCC,"Pro-Ensure24 Nonwoven Fabric Disposable 3Ply Surgical Face Mask (Blue, Without Valve) for Unisex",Pro-Ensure24,0,0,0,179,5.0,4,88,,0,4
267,B09CCLZCRF,"Tri-Activ 5 Layer Protective Face Masks/Tested as per N95 standard, 99% Bacterial and Particulate Filtration Efficiency, Pack of 5 white mask with adjustable Ear Loop, Free Size",Tri-Activ,0,0,0,242,3.7,127,59,"Friday, February 11",0,127
268,B0979NVFP5,"GreatDio® 3 Layer (1500 Pcs Sealed Box) Disposable Protective Face Masks, Bacterial Filtration Efficiency (BFE)?98.5%,Particle Filtration Efficiency (PEE)?95% | Inbuilt Adjustable Nose Pin (Blue)",GreatDio®,0,0,0,"2,999",0,0,50,"Sunday, February 13",1,"₹2,999 (₹2/count)
₹5,998 Save ₹2,999 (50%)"
269,B08F9G7MMM,"Kawach Mask by IIT Delhi Startup, Washable and Reusable, Face Mask with Adjustable Ear Loop, 99% Protective Mask for Men/Women/Kid (Multicolor), Size XS, S & M )",Kawach,0,0,0,299,4.0,453,60,,1,453
270,B09M7GMMMG,Risezag Dotted Black Surgical Mask Pack of 100 Pieces Disposable Masks 3 ply layer with nose clip Meltblown Ultrasonic Use and Throw Masks Pack of 100 Pcs Pin 3Ply Comfortable Fabric Face Mask,Risezag,0,0,0,248,4.4,4,79,,1,4
271,B09HX8PJHZ,"Amazon Brand Doctor Plus 3 Ply Meltblown surgical mask with nose wire, 3 Layer Use & Throw Masks for Men / Women",Amazon,0,0,0,310,3.7,66,79,,0,66
272,B08JPMNHBX,"MASQ By Q-One Annular 4 Layer, Reusable, with Lanyard & Ear Adjusters, Anti-Bacterial, BFE>99% Embroidered Cotton Cloth Face Mask for Kids (7-12 Years, Black-Navy-White, Pack of 3, Without Valve)",MASQ,0,0,0,299,4.5,751,33,,0,751
273,B08XVWZGPQ,Cenwell Boy's and Girl's Cotton Cute Designer Reusable Washable Breathable Face Mask with Adjustable Earloops Without Valve (Multicolour),Cenwell,0,0,0,399,4.3,"1,554",60,"Thursday, February 10",0,"1,554"
274,B09LKRLRSN,HYDRISE (Pack of 12) Premium N95 Mask For Men and Women with Mask Adjuster - Washable mask - Reusable mask - Pollution Mask - Protection Mask - ISO and NIOSH approved - Advanced Filtration (White),HYDRISE,0,0,0,299,3.8,26,70,,1,26
275,B08BLDP31D,"Safeshield Meltblown Fabric Disposable 3 Ply Surgical Face Mask with Nose Pin and Ear Loops (Blue, Without Valve, Pack of 50) for Unisex",Safeshield,0,0,0,474,4.5,883,41,,1,883
276,B09PYNVH8J,Naruto Anime Akatsuki Kurama Face jinchuriki Smile Face masks - Pack of 3,Naruto,0,0,0,499,0,0,50,,0,"₹499
₹999 Save ₹500 (50%)"
277,B08XVQXP6J,Promisca Kids Non woven Ear Loop Style Protective 5 layered filtration with genuine Melt Blown and Hot Air Cotton Layers N95 Face Mask (Multicolour Small) -Pack of 5/10+2,Promisca,0,0,0,411,4.2,"1,946",41,"Thursday, February 10",0,"1,946"
278,B09KJCDQ7F,"PITRESHWAR Washable and Reusable Face Mask, UV Protection and Antibacterial, Stretchable Material, Allergy Free and Splash Resistant Protective Face Cover",PITRESHWAR,0,0,0,249,3.6,21,84,,1,21
279,B098FD3WRZ,OCEAN Mask Face Mask for Men and Women surgical mask pack of 100 disposable mask Pack of 100 3ply Mask with soft ear loops,OCEAN,0,0,0,399,3.7,494,60,,0,494
280,B08GKQPYDK,"Risque Cotton Reuseable Face Mask (Orange, Red & Blue, Without Valve, Pack of 3) for Kids",Risque,0,0,0,899,4.2,395,28,"Monday, February 14",1,395
281,B09FHJGGM4,IRONMEX WEDDING SPECIAL Cloth Face Mask - Washable Light Weight Satin - Cotton Masks,IRONMEX,0,0,0,449,3.7,12,36,,1,12
282,B097RJFR3M,"Suchi 3 Ply Disposable Surgical Face Mask with Broad Soft Fabric Earloop, Meltblown Filter and Nose Pin Pullout Mask BFE>97% and PFE > 95% for Men and Women (mask pack of 50 100 150 200 500)",Suchi,0,0,0,350,3.8,37,56,,0,37
283,B09CDQ721D,"(PACK OF 15) 5 Layer Kids N-95 Mask For Boys, Kids Mask For Girls Cartoon Printed Face Mask For 3 To 8-9 Year Old Boys & Girls, Reusable & Washable Face Mask For Kids, Children",(PACK,0,0,0,299,3.6,22,57,,1,22
284,B095PJFDM5,"DEEJET Nonwoven Fabric 3 Ply Layer Meltblown Ultrasonic Disposable Surgical Mask with Nose clip Pin and Elastic Earloops Dustproof Filter Cover Without Valve for Men Women (Black, Pack of 100 Pieces)",DEEJET,0,0,0,299,3.6,767,70,,1,767
285,B09PD4QY6X,"SIXSIGMA® (Pack of 11) Cotton Basic Reusable Cloth Face Mask Adult , Women ,Men Pack of 11, Soft Washable 100% Cotton Unisex Face Cover (multi colour)",SIXSIGMA®,0,0,0,295,4.8,8,58,,1,8
286,B09GZLXCTT,"RK TRADERS 3 Ply Non-Woven Fabric Surgical Disposable Printed Designer Masks, Meltblown with Nose Pin BFE>98% PFE>95% ISI,ISO (Multicolour, Without Valve, Pack of 100) for Men & Women",RK,0,0,0,399,4.3,209,60,,1,209
287,B09M7838LC,FabricPandit Cotton Linen Reusable Adjustable 3 Layered Unisex Face Masks (Only Blues I Insist - Pack of 7),FabricPandit,0,0,0,348,4.3,27,0,"Tuesday, February 15",0,27
288,B09CKZPBLK,"Careview KIDS 4 Ply Disposable Surgical Face Masks Pack of 50, Green Color, PFE>95%,BFE>99%, SITRA, BIS (ISI), and CE certified (KIDS-4PLY-MASK)",Careview,0,0,0,279,4.3,455,44,"Monday, February 14",0,455
289,B08K46FD4W,"Sumit Surgical 3 Ply Disposable Built-IN Nose Pin, Particle Filtration Efficiency (PEE), CE and ISO and WHOGMP Certified Pharmaceutical Surgical Face Masks",Sumit,0,0,0,263,4.1,857,47,,0,857
290,B09M3YHPS3,FabricPandit Cotton Linen Reusable Adjustable 3 Layered Unisex Face Masks (Be My Valentine - Pack of 5),FabricPandit,0,0,0,299,3.9,23,0,"Tuesday, February 15",0,23
291,B096YFHHWC,"voltonix® N95 Reusable Washable Mask Anti Air Pollution,Face Mask, Reusable, Washable Ce & Iso Certified To Protect Mouth Droplets, Dust And Pollution, Mask. Unisex, With 6 Layer For Men Women",voltonix®,0,0,0,199,4.1,"1,351",67,,1,"1,351"
292,B09HDSLH6M,"MASQ By Q-One 4 Layer Washable, Reusable, Size Adjustable, Anti-Bacterial (BFE>99%) Embroidered Cotton Cloth Face Mask Combo for Women, Girls with 1 Detachable Chain (Multicolor, Pack of 3)",MASQ,0,0,0,299,4.4,36,33,,0,36
293,B09HTM4X6H,HYDRISE (Pack of 10) (White) (Black) Premium N95 Mask For Men and Women with Mask Adjuster - Washable mask - Reusable mask - Pollution Mask - Protection mask - ISO SITRA approved - Advanced Filtration,HYDRISE,0,0,0,299,4.1,14,70,,1,14
294,B093ZNFGXS,sejvan Men and Women N95 Mask and Neem Tulsi Herbal soap (Multicolor) -Pack of 20,sejvan,0,0,0,199,3.3,133,60,,1,133
295,B09Q5G73L1,KAWACH Mask (Model: Vardi Mask) | Reusable and Washable | Army Mask | Protective Cotton Face Mask for Women/Men | Anti-Pollution,KAWACH,0,0,0,299,4.3,59,34,,1,59
296,B097NF4HY4,SAN ZONE Unisex Polycarbonate Goggle Style Anti-Fog Face Shield with 180° Safety Coverage,SAN,1,1,0,399,4.0,160,60,"Monday, February 14",0,160
297,B08V4T37YM,"Yuga HexaShield 3D Reusable Washable Cotton Cloth Breathable Fabric Face Mask for Men and Women | 6 layer Protection | Nose Clip | Adjustable Earloop| Anti-Germ|Anti Bacteria|Multicolor, Pack of 6 |",Yuga,1,0,0,698,4.3,264,61,,1,264
298,B08TW3DY76,"FREECULTR Printed Unisex Face Mask Bamboo Bandana for Dust Protection & Sun, Anti Bacterial Multipurpose Headband -100% Try On Guarantee",FREECULTR,1,0,0,499,3.9,216,0,,1,216
299,B08XBN2R1V,"NEEPRO – Cotton Face Mask for Men and Women, Reversible, Washable, Anti-Bacterial Mask with Adjustable Ear Loops, Nose Pin and Free Mask Adjuster Strap",NEEPRO,1,0,0,579,4.0,"2,279",47,,1,"2,279"
300,B089DG6LFD,Flying Berry Comfortable Washable Cloth Mask,Flying,1,0,0,329,3.6,341,78,,0,341
301,B0966X35Y8,"RNG EKO GREEN KN95 Reusable 5 Layered with 95% Filtration Respirator Unisex Face Mask (White, Pack of 20)",RNG,1,0,0,915,4.1,25,63,,1,25
302,B088V4W4RQ,The Vertical Unisex's Cotton 5-Layer Reusable Outdoor Face Mask (Pack of 3) (VR/ENSHROUDMASK08PC3_Teal_Free Size),The,1,0,0,225,3.4,7,50,,1,7
303,B099WQPH31,"brrf 7 Layer Gaiter Mask with Inbuilt Filter, Adjustable Cord, Multi-Purpose Usage, Breathable Fabric, Reusable, 30 + UPF Sun Protection",brrf,1,0,0,399,4.0,2,34,,0,2
304,B098QYJNHB,"MASQ By Q-One Wings 4 Layer, Reusable, with Ear Adjusters, Anti-Bacterial (BFE>99%) Cotton Cloth Face Mask for Men, Boys (Maroon-Black-Grey-Denim-Navy)",MASQ,0,0,0,299,4.3,286,33,,0,286
305,B099PM5X5P,Maple MP-21 Face Mask for Kids | Reusable and Washable | 3 Layer Filtration | Anti Pollution | Cotton Printed Protective | Fashionable kid Mask for Girl Boys Unisex,Maple,0,0,0,299,4.3,116,62,,0,116
306,B0966VM5YN,"CHINTNAM Multi Layer Cotton Fabrics Cartoon Reusable & Washable 3D Face Mask (Multicolour, Without Valve, Pack of 10) for Kids",CHINTNAM,0,0,0,299,4.3,942,60,,1,942
307,B08T63JLB3,"LIVYOR Non-Woven Fabric Disposable Surgical Mask With Nose Clip and Soft Ear Loops (Grey, Pack of 100) for Unisex",LIVYOR,0,0,0,379,4.4,460,62,,0,460
308,B08MQT67S3,Kawach Face Mask for Kids (Product of IIT Delhi Startup) | Reusable and Washable | 99% Filtration| Cotton Protective Mask | Fashionable and Reversible (Assorted),Kawach,0,0,0,275,4.0,"3,156",30,,0,"3,156"
309,B099QK4WNG,"ANY SALES Cotton Washable & Reusable 3D Mask with Adjustable Ear Loops & Ear Saver Strap, Size 8 to 14 Year Old Kids Mask for Boys, Girls, Children (Multicolour, Without Valve, Pack of 6)",ANY,0,0,0,298,3.8,254,57,,1,254
310,B09G9WBF9Q,"7Shield 3 Ply Disposable Face Mask Box with FABRIC Ear loop, Certified by BFE>99% and PFE > 95%, SITRA, DRDO, ISO and CE (White)",7Shield,0,0,0,299,4.0,30,70,,0,30
311,B0883CG5Y9,Van Heusen Men's Cotton Face Mask (Pack of 4) (VHMSBRGPH53287_Assorted color_Free Size),Van,0,0,0,399,3.9,"6,287",20,,0,"6,287"
312,B01N952VHF,OxiClear N99 Anti Pollution Face Mask with 4 Activated Carbon Filters & Detachable Headband D.R.D.O Certified (Black),OxiClear,0,0,0,375,4.0,"7,260",25,"Thursday, February 10",0,"7,260"
313,B08NQ1X5XF,"THE MASK LAB 3 Ply Surgical Face Mask- ASTM Level 3 Certified for virus. ISI CML-9600046017, EN 14683: 2019(Level IIR), ISO 13285:2016",THE,0,0,0,489,4.3,"2,520",51,,0,"2,520"
314,B09PQMWV5Q,ZAMBET Leather Reusable Face Mask,ZAMBET,0,0,0,199,0,0,50,,0,"₹199
₹399 Save ₹200 (50%)"
315,B09JLVYH3Q,Ocean Race 4 Ply Disposable Surgical Face Masks with Nose Clip Pack of-50 (BLACK-50 Pcs),Ocean,0,0,0,299,4.0,6,50,,0,6
316,B095LPYZJ6,OCEAN RACE Cotton Anti Pollution 3 Layer Reusable Face Mask,OCEAN,0,0,0,299,4.2,627,50,,0,627
317,B093LH4ZYH,boxprize4U Surgical mask Disposable Masks 3 ply layer with nose clip Melt blown Ultrasonic Use and Throw Masks Certifie Best for Men Women ( pack of 50 ),boxprize4U,0,0,0,175,4.1,45,65,,1,45
318,B09N1QY8W6,"AVVIC MART Premium Embroidery Flower Fency Design Face Mask For Women's Face Protective , Reusable , Washable , Breathable Skin Friendly |Pack of 9 Multicolor|",AVVIC,0,0,0,418,5.0,13,30,,0,13
319,B09Q3HZ153,"Limbjal® Premium Embroidery Flower Fency Design Face Mask For Women's Face Protective , Reusable , Washable , Breathable Skin Friendly- Multicolor-[Pack of 6]",Limbjal®,0,0,0,298,5.0,10,50,,1,10
320,B088X3Q7L8,"EUME Protect+ 95 4 Layer Reusable Washable Face Mask for Men and Women with Anti Dust, Anti-Pollution Shield, Adjustable Nose clip and Comfortable Strap with Super Soft, Breathable Cotton Fabric & Personal Name Tag for Home and Office- Made in INDIA",EUME,1,0,0,279,3.7,26,30,"Monday, February 14",0,26
321,B0989LSL9Q,VStar Cloth Face Mask for Men's and Women's Assorted_VSMS16,VStar,1,0,0,225,4.7,5,10,,0,5
322,B09QJQHRC2,"PENADIA Cotton Reusable Super Breathable Fabric Cloth Face mask with Adjustable Ear Loop For Man And Woman ,Multicolor -PACK OF 12",PENADIA,1,0,0,399,5.0,17,73,,0,17
323,B098XS7VNX,CENWELL Pure Cotton Face Mask with Adjustable Ear Loop & Free Ear Saver Strap. Washable Reusable & Breathable Mask for Men & Women,CENWELL,1,0,0,399,4.2,643,60,,0,643
324,B09NDYHH3H,Maykaj 3 Ply Black Disposable Mask With Noes Clip And Smooth Straps 3Ply Surgical Disposable Nonwoven Fabric Face Mask With Nose Pin Non Woven Surgical 3 Ply Face Mask Pack of 100,Maykaj,0,0,0,239,4.6,7,76,,1,7
325,B098R1SZ8D,"MASQ By Q-One 4 Layer Reusable, Washable with Detachable Chain & Ear Adjusters",MASQ,0,0,0,299,4.5,219,33,,0,219
326,B09CLPWSS3,HYDRISE (Pack of 25) Premium N95 Mask For Men and Women with Mask Adjuster - Washable mask - Reusable mask - Pollution Mask - Virus Protection mask - ISO NIOSH approved - Advanced Filtration (White),HYDRISE,0,0,0,449,3.8,43,72,"Sunday, February 13",1,43
327,B09BL58DLG,"Qwarty Set of 12 Light Weight & Comfortable Pure Cotton Reusable Face Mask for Unisex Cloth Face Mask Washable Cotton Masks for Adult (Multi color, Without Valve, Pack of 12)",Qwarty,0,0,0,288,3.9,65,74,,1,65
328,B0994SL7C2,"Weldots【Pack of 3】Premium N95 Mask for Men & Women — Reusable Face Mask — KF94 Mask — 6 Layers DRDO, ISI (BIS) Certified FFP2 Protection — Head Loop — White",Weldots【Pack,0,0,0,359,3.9,79,52,,0,79
329,B09QC7DZBM,Ubersweet® 4 Layer High Filtration Japanese Willow Mask KF94 High Level Protective Face Mask for Adult | 3D Designer Ultra Breathable Anti Pollution Premium Mask |Black | Pack of 10,Ubersweet®,0,0,0,389,4.0,1,76,"Sunday, February 13",0,1
330,B08PKTGLGX,"Storescent Nonwoven Fabric Disposable 3 Ply Surgical Mask (Black, Without Valve) for Unisex",Storescent,0,0,0,265,4.0,511,67,,0,511
331,B09LF9X6CY,Risezag Pink Surgical Masks For Women Pack of 50 Pieces GSM 100 Melt Blown Fabric 3 Layer Masks with Nose Clip 3 Ply Pink Face Masks Pollution Disposable Mask with Nose Clip 3 Layers Use and Throw,Risezag,0,0,0,199,4.4,3,80,,1,3
332,B09MW22R1D,"KBQ Non-Woven Fabric 3 Layer Disposable Surgical Face Mask With Nose Clip Meltblown Ultrasonic Use and Throw Masks CE, GMP & ISO Certified Masks",KBQ,0,0,0,189,4.5,49,81,,1,49
333,B0977KSX8X,"GreatDio® (1000 Pcs) Disposable 3 Ply Earloop Face Masks, Suitable for Home, School, Office and Outdoors (Green)",GreatDio®,0,0,0,"2,499",0,0,7,"Sunday, February 13",1,"₹2,499 (₹2.50/count)
₹2,699 Save ₹200 (7%)"
334,B09JMSZWM4,Divine Pack of 10 Multicolor Printed Kids N95 Mask Earloop for kids 3 to 8 year Reusable & Washable mask (certified by ISO CE),Divine,0,0,0,299,3.9,6,50,,1,6
335,B0872PF4WP,Amazon Brand - Solimo Non-Woven Fabric Disposable Surgical Mask with Meltblown Filter Without Valve for Unisex (Pack of 50),Amazon,0,0,0,200,4.0,"3,504",75,"Thursday, February 10",0,"3,504"
336,B09BR9QGZ6,HYDRISE (Pack of 40) Premium N95 Mask For Men and Women with Mask Adjusters - Washable mask - Reusable mask - Pollution Mask - Protection Mask - ISO SITRA approved - Advanced Filtration (White),HYDRISE,0,0,0,599,4.2,30,75,,1,30
337,B09NH62VGN,FACE MASK [Pack Of 15] High Filtration FFP2 Certified Japanese Willow Shape Premium N95 Anti Pollution and protective Face Mask For Men & Women| Reusable,FACE,0,0,0,499,4.7,4,66,,1,4
338,B08BNWZZ4F,Wildcraft SUPERMASK W95 Plus Reusable Outdoor Respirator Mask - POINTEL (Large) Pack of 5,Wildcraft,0,0,0,160,4.0,"1,193",84,"Sunday, February 13",0,"1,193"
339,B09523WDF3,"QUARANT 3 Ply Disposable Surgical Face Mask, UV Sterilized, ISI, BIS, CE & ISO Certified, ASTM Level 3, Meltblown Layer Fabric Masks with Adjustable Nose Pin (Blue, Without Valve, Pack of 100) for Unisex",QUARANT,0,0,0,569,4.4,"2,518",64,"Thursday, February 10",1,"2,518"
340,B08V7D8ZFX,"SWASA Kids N95 Children's Mask FFP2 Class (Without Valve, Pack of 4)",SWASA,0,0,0,399,4.2,426,53,,0,426
341,B092MP9X3T,PUMA Adjustable Topo AOP Face Mask for Adult- Set of Two,PUMA,0,0,0,419,4.3,20,30,,0,20
342,B09G6VV7BF,Ocean Race 4 Layer Disposable Surgical Face Masks with Nose Clip (GREY-100 Pcs),Ocean,0,0,0,399,3.9,36,50,,0,36
343,B09F6CH7TP,"Indicare|Printed Surgical Kids Mask (3-8 Yrs)|Printed Surgical Teenagers Mask|Printed Disposable Adults Mask|SITRA, ISO 9001 & 13485, CE Certified|BFE >99% Filtration| Individual Pack",Indicare|Printed,0,0,0,299,4.1,10,70,,1,10
344,B096NZ4JYS,Swasa N95 Certified Reusable PM2.5 Mask Without Valve with Nose Pin (White) - Pack of 5,Swasa,0,0,0,349,4.5,48,46,"Saturday, February 12",0,48
345,B09K4YKLRN,"Pitreshwar Black Face Mask Covers with Elastic Ear Loop Cover Full Face Anti-Dust, Washable, Breathable, and Reusable Mask for Unisex (Pack of 3, Without Valve)",Pitreshwar,0,0,0,199,3.8,43,88,,1,43
346,B08WZBYKJ6,ProQ Surgical Mask Pack of 100 | Disposable Mask | Use and Throw Mask | 3 ply Mask | Face Mask Men & Women,ProQ,0,0,0,349,4.0,804,78,,0,804
347,B08FYBS2XW,"Black Disposable Face Masks - 50 Pack, Black -Soft on Skin - 3 Ply Protectors with Elastic Earloops",Black,0,0,0,299,3.7,"30,320",63,,0,"30,320"
348,B08SQ649K8,"Mcovid CE and ISO Certified N-95 Anti Pollution, Reusable, Washable Protective Men/Women Face Mask with Head loop (White) -Pack of 10",Mcovid,0,0,0,249,3.4,191,92,,0,191
349,B09F3JP1FS,"MASQ By Q-One Swords 4 Layer, Reusable, with Ear Adjusters, Anti-Bacterial (BFE>99%) Cotton Cloth Face Mask for Men, Boys (Black-Olive Green)",MASQ,0,0,0,279,4.4,39,6,,0,39
350,B0994FD1F1,"N95 15 Pis. Kids Face Safety Carton Designing Combo Mask,Flexible Ear Loop-Without Noise Built Pin For Children Safety Purpose, Breathable Washable Air Pollution For Kids, Children",N95,0,0,0,259,3.8,101,78,,1,101
351,B099GS7271,"Bleus® Certified Premium KF94 Fish Shape Korean Mask 5 Layer With Melt-Blown Reusable Anti - Pollution , Anti - Virus Breathable Face Mask with Nose Pin BN95WF Water Resistant, Reusable, Washable, Multicolour",Bleus®,0,0,0,179,3.2,16,20,,1,16
352,B08BPGXFX2,"Wildcraft Polypropylene Reuseable Respirator Mask (Blue, Without Valve, Pack of 3) for Unisex",Wildcraft,0,0,0,110,4.1,"2,104",82,"Sunday, February 13",1,"2,104"
353,B09NDV9BQM,Limbakshit Kids Mask Cotton Mask for Boys and Girls Reusable and Washable Mask for Boys Kids Mask for Girls 3 Layer Cartoon Digital Print Mask Set of 8,Limbakshit,0,0,0,288,4.1,28,28,,0,28
354,B08GFWGXNC,"ARCATRON® N95 Face Mask 95% High Filtration, 4 layers protection against PM2.5 Particles, Dust, Smoke and Nose Clip for Fog Proof and Ergonomic Fit (Adult Size - Universal) – Pack of 10",ARCATRON®,0,0,0,299,4.1,"1,215",79,"Tuesday, February 15",0,"1,215"
355,B08MPTLZTY,"H.A.C PLUS Polypropylene Disposable KF94 Face Mask,(Without Valve, Pack of 10 or 50) for Unisex",H.A.C,0,0,0,500,4.2,338,75,,1,338
356,B0989HTJLB,VStar Cloth Face Mask for Men's and Women's Assorted,VStar,1,0,0,405,3.9,41,10,,0,41
357,B08P7LMDZW,"OxiClear N99 Pollution Mask with 20 Activated Carbon Filters, Washable & Reusable, D.R.D.O Certified (NO-VALVE) (Multicolor - Pack of 5)",OxiClear,1,0,0,"1,499",4.2,"4,171",25,"Tuesday, February 15",1,"4,171"
358,B09B16JSHD,RNG EKO GREEN Unisex 3 Ply Disposable Face Mask (Pack of 50 Pcs) with Ear Loop for Men & Women- [Non-Woven & Melt-Blown Fabric] (Pink),RNG,1,0,0,375,4.3,6,69,"Sunday, February 13",0,6
359,B095HWWS8Z,OxiClear Kids N99 Anti-Pollution Face Mask with 12 Activated Carbon Filters & Detachable Headband D.R.D.O Certified (Multicolor) (Pack of 3),OxiClear,1,0,0,899,4.2,"1,733",10,,1,"1,733"
360,B09K5CV5XY,"Frido ULTIMATE and ULTIMATE PRO Copper Masks with Adjustable Ear Loops. Copper Treated Layer, Breathable and Washable Fabric, Made in South Korea.",Frido,1,0,0,699,4.5,393,42,,1,393
361,B09PLMNHCN,"AeroGrid Lite FFP2 | 5 Layers | BIS Cetrified | Premium N95 Earloop Mask for Unisex with Headband Converter Strip (Pack of 100, White)",AeroGrid,1,0,0,"1,000",0,0,80,,1,"₹1,000
₹5,000 Save ₹4,000 (80%)"
362,B092TCBVNS,"ALENZA EXPORT's provide White Color N95 Mask, Reuseable and Washable (white Color - pack of 10, 25 and 50)",ALENZA,1,0,0,499,4.1,99,69,,1,99
363,B08TW4WZKL,"FREECULTR Printed Unisex Face Mask Bamboo Bandana for Dust Protection & Sun, Anti Bacterial Multipurpose Headband -100% Try On Guarantee",FREECULTR,1,0,0,474,3.9,216,5,,0,216
364,B08QRVFJ6F,"Attic Salt Gold sequins mask Cotton + Luxury + Fashion Face Mask ""Reusable Washable"" Face Cover - Adjustable with Ear Cord Locks for Women _ for Running Cycling Outdoor Office Home_Stylish",Attic,0,0,0,249,4.1,84,36,"Saturday, February 12",0,84
365,B09NQ5569T,HYDRISE (Pack of 40) (Black) Premium N95 Mask For Men and Women with Mask Adjuster - Washable mask - Reusable mask - Pollution Mask - Protection mask - ISO NIOSH approved - Advanced Filtration,HYDRISE,0,0,0,699,4.1,7,56,,1,7
366,B09BM2NJBW,"CoviSafe™ Ear Loop adjustable N95 Reusable ULTRA SOFT Face Mask (CE, ISI, ISO, BIS, FDA and WHO-GMP Complied) With 6 Layer For Men & Women Over Ear Loop / Mix Colour",CoviSafe™,0,0,0,329,4.3,37,83,,0,37
367,B08KZN6JCT,Romsons Dispo Guard 3 Ply Mask With Softest Ear Loops,Romsons,0,0,0,407,4.5,"3,109",59,,1,"3,109"
368,B09L7NJFMV,"SIXSIGMA® Cotton Reusable Breathable Fabric Anti-Bacterial Embroidered Cloth Face Mask Combo with Adjustable Ear Loop for Women, Girls (Pack Of 6)",SIXSIGMA®,0,0,0,299,4.4,49,63,,1,49
369,B09DSTBBLR,"CareDone N95 Mask (unisex, pack of 20,) soft and comfortable Meltblown and Hot Air Cotton fabric Reusable Particulate Mask Anti Pollution,certified by ISO,FDA, CE, GMP, Daily Needs N95 Face Mask Ear Loop N95 Multi Color grey and black.",CareDone,0,0,0,199,5.0,1,72,,1,1
370,B097TQ2NRD,"LaMitra Men's and Women's Melt Blown, Non Woven Fabric 5 Layered Reusable Washable Outdoor N95 Face Mask with Improved Ear Loops without Valve , Multi Color - Pack of 20",LaMitra,0,0,0,185,3.6,37,81,,0,37
371,B08MQBMLJY,"Marc Loire 100% Pure Cotton 6-Layered Super Soft Reuseable Washable Protection Cloth Face Mask (Multicolor, Without Valve, Pack of 4) for Men, Women, Unisex Adults",Marc,0,0,0,289,3.8,"1,975",28,"Monday, February 14",0,"1,975"
372,B096QWL94F,"Risezag Non Woven 75 GSM Melt Blown Fabric 3 Layer 3 Ply Cotton Surgical Disposable Use and Throw Face Mask with Nose Clip Without Valve For Women (Baby Pink , Pack of 100 Pieces )",Risezag,0,0,0,298,4.1,232,77,,1,232
373,B097RTK12Y,"LaMitra Melt Blown and Nonwoven Fabric Reusable & Washable 5 Layered Outdoor Protection N95 Face Mask without Valve for Men and Women (Multicolour , Free Size ) - Pack of 30",LaMitra,0,0,0,250,3.9,32,81,,0,32
374,B09CYLDBBW,"SWASA PLUS PM0.3 Nanofiber Reuseable N95 Mask (Grey, Without Valve, Pack of 5) for Unisex",SWASA,0,0,0,549,4.5,148,16,"Saturday, February 12",1,148
375,B096G7VSP4,"Shocknshop Non Woven N95 Reusable Washable Face Mask CE, ISO, FDA and WHO-GMP Certified With 5 Layer For Men Over Head Loop - Pack of 6, (Grey)",Shocknshop,0,0,0,299,4.8,10,70,,0,10
