,asin,title,brand,Sponsored,Best Seller,Amazon's Choice,Price,Rating,NoofRatings,Discount,Delivery,Prime Delivery,base
127,B09GVZMCWR,"AGARO HDMI to HMDI Cable 20 Meters, HDMI 2.0, Ultra High Speed, 48Gbps 4K@60Hz Support Dynamic HDR, 3D, eARC, HDCP 2.2, Cotton Braided HDMI Cord for PS5/PS4/Xbox/Apple TV/Projector, Black (33571)",AGARO,1,0,0,"4,770",4.5,63,32,"Friday, February 18",1,63
128,B00608XLUM,BlueRigger High Speed Mini HDMI(NOT Micro) to HDMI cable with Ethernet (10 Feet / 3 Meters),BlueRigger,0,0,0,712,4.3,"5,991",41,"Friday, February 18",1,"5,991"
129,B009W9RXVO,BlueRigger High Speed Micro HDMI to HDMI cable (NOT Micro-USB) with Ethernet (3 Feet / 0.9 Meters),BlueRigger,0,0,0,479,4.2,"10,563",31,"Friday, February 18",1,"10,563"
130,B01HQ2H3YU,"CableCreation Ultra Thin HDMI Male to Male, 10ft HDMI 4K High-Speed Ultra Slim Low Profile Cable, Support 3D, 4K@60Hz, Audio Return (Last Standard), Latest Version for PS4, X-Box etc, Braided, 3M",CableCreation,0,0,0,644,4.5,"1,067",23,"Tuesday, February 22",1,"1,067"
131,B01D5H93FW,"AmazonBasics 3-Feet High-Speed HDMI 2.0 Cable, Pack of 3",AmazonBasics,0,0,0,599,4.2,"4,652",50,"Friday, February 18",1,"4,652"
132,B06ZZ68SBZ,"AmazonBasics High-Speed 4K HDMI Cable, 10 Feet, 10-Pack",AmazonBasics,0,0,0,"3,199",4.4,"310,967",47,"Friday, February 18",1,"310,967"
133,B098DHP73H,"Sounce DisplayPort to HDMI Adapter, Gold-Plated Display Port to HDMI Converter, DP to HDMI Cord (Male to Female) Compatible with Computer, Desktop, Laptop, PC, Monitor, Projector, HDTV - Black",Sounce,0,0,0,399,3.9,"1,823",79,"Friday, February 18",1,"1,823"
134,B07MR3VR9Z,"BlueRigger HDMI Cable Extension Male to Female HDMI Extender Cord 4K Compatible for TV Stick, Roku Stick, Chromecast, Nintendo Switch Wii U, Xbox One 360, PS4 PS3, Blu Ray Player, HDTV, Laptop PC (3 FT)",BlueRigger,0,0,0,559,4.4,"37,386",30,"Sunday, February 20",1,"37,386"
135,B0876RM5RW,"CableCreation 8K HDMI Ultra HD High Speed 48Gbps Cable,8K 60Hz, HDCP 2.2,4:4:4 HDR, eARC, Compatible with QLED TV, Roku TV, PS5, PS4, Nintendo Switch, Xbox One/Xbox Series X(6.6ft)",CableCreation,0,0,0,"1,079",4.4,"1,396",60,"Tuesday, February 22",1,"1,396"
136,B014I8T8FC,"AmazonBasics 15 Feet High-Speed HDMI Cable (Black) - Supports Ethernet, 3D, 4K video",AmazonBasics,1,0,0,981,4.3,"31,214",57,"Friday, February 18",1,"31,214"
137,B099WMK8Z7,Rec Trade HDMI Female to HDMI Female Connector Extender Converter Adapter HDMI Cable Extension Adapter Compatible with HDTV Projector Monitor 1080P.(RTT-CVT-0153),Rec,1,0,0,189,0,0,62,"Tuesday, February 22",1,"₹189
₹499 Save ₹310 (62%)"
138,B09LVPYKSS,"Top Trends® 4K Ultra HD High-Speed HDMI Male to Male Cable (Black) -Compatible with Laptop, PC, Projector & TV 3D, 4K 60Hz, Audio Return (1.5 Meter)",Top,0,0,0,199,3.8,3,72,"Monday, February 21",1,3
139,B08HYQ3VZM,"Angle USB C to HDMI Cable 4K@60Hz, CableCreation 6ft Right Angle Type-C to HDMI Adapter Support HDR 18Gbps, Compatible for MacBook Pro Air 2020/2018, iPad Air 2020, iPad Pro, LG G7/G8, Galaxy S20/S10",Angle,0,0,0,"1,221",4.2,"1,793",59,"Tuesday, February 22",1,"1,793"
140,B08GLV4QC5,"BlueRigger Ultra Series 8K HDMI to HDMI Cable with 48Gbps Speed, (3.3 Feet / 1 Meter) Supports 8K@60HZ,1080p FullHD, UHD/Ultra HD, 3D, High Speed with Ethernet, ARC, PS4, Xbox, HDTV",BlueRigger,0,0,0,"1,020",4.3,272,57,"Friday, February 18",1,272
141,B0876SHMD3,"CableCreation HDMI 8K Cable 3.2ft, 8K HDMI Ultra HD High-Speed 48Gbps Cable, 8K 60Hz, HDCP 2.2, 4:4:4, ARC, Compatible with PS5, PS4, Xbox One/Xbox Series X, Nintendo Switch, QLED TV, Roku TV",CableCreation,0,0,0,"1,069",4.4,"1,396",60,"Tuesday, February 22",1,"1,396"
142,B09JZMJVDW,Rvike HDMI Cable with Ethernet Supports Video and Audio Return 1.3 Meter Suitable for Desktop PC Projector LED LCD TV Set Top Box,Rvike,0,0,0,125,0,0,37,"Monday, February 21",1,"₹125
₹199 Save ₹74 (37%)"
143,B005KWHJES,"BlueRigger in-Wall High Speed 18Gbps HDMI Cable - CL3 Rated - Supports 4K 60Hz, Ultra HD, 3D, 1080p, Ethernet and Audio Return (Latest Standard) (15 Feet (4.5 Meters)",BlueRigger,0,0,0,989,4.4,"37,386",29,"Friday, February 18",1,"37,386"
144,B09CCWHH8R,"Storite High Speed Right Angle 90 Degree Hdmi Male to Female Extension Cable for fire tv stick, Laptop/PC, LCD/LED TV, Xbox, PS3/PS4– 50 cm",Storite,0,0,0,279,4.5,42,72,"Friday, February 18",1,42
145,B077PHJLHG,"CableCreation USB C to HDMI Cable, 3FT USB Type C to 4K HDMI Cable Adapter for Home Office, Compatible with MacBook Pro/iPad Pro 2020 2019 (Black)",CableCreation,0,0,0,"1,067",3.8,"7,885",24,"Tuesday, February 22",1,"7,885"
146,B01MZ81RQ0,"AmazonBasics High-Speed 4K HDMI Cable, 6 Feet, 24-Pack",AmazonBasics,1,0,0,"4,999",4.4,"310,967",62,"Friday, February 18",1,"310,967"
147,B09PRJPR8Z,"Storite 15m HDMI Male to Male Cable High Speed 18Gbps HDMI 2.0 Cord Supports 4K Ultra HD, 3D, 1080p, Ethernet Compatible for TV, Laptop, PC, Monitor & Projector (Black)",Storite,1,0,0,"2,099",0,0,16,"Sunday, February 20",1,"₹2,099
₹2,499 Save ₹400 (16%)"
148,B09KS39PKC,"Storite 1.5m 4K UHD HDMI Cable High Speed 18Gbps HDMI 2.0 Cord Supports 4K@60Hz UHD, 2160p, 1080p, Ethernet, 3D, Audio Return(ARC) Compatible for TV, Laptop, PC, Monitor & Projector",Storite,1,0,0,599,4.2,7,40,,0,7
149,B09FGVLMZ4,"Storite 35cm High Speed HDMI Cable Male to Male Cable for LED/LCD TV, PC Monitor, Setup Box (Pack of 2)",Storite,1,0,0,299,4.3,36,77,"Friday, February 18",1,36
150,B01HQ2H2XM,"CableCreation Ultra Thin HDMI Male to Male, 3.3ft HDMI 4K High-Speed Ultra Slim Low Profile Cable, Support 3D, 4K@60Hz, Audio Return (Last Standard) Compatible with PS4, X-Box etc, Braided, 1M",CableCreation,0,0,0,649,4.5,"1,067",35,"Tuesday, February 22",1,"1,067"
151,B079NVGPLH,"Tizum High Speed HDMI Cable “Ultra”- HDMI 2.0 -Gold Plated-High Speed Data 18Gbps, 3D, 4K, HD 2160p (33 Ft/ 10M-Grey)",Tizum,0,0,0,799,4.0,"1,113",53,"Friday, February 18",1,"1,113"
152,B07QDMVT5P,"Storite 2 Pack High Speed Gold Plated Right Angle 90 Degree Hdmi Male to Female Extension Cable for fire tv stick, Laptop/PC, LCD/LED TV, Xbox, PS3/PS4– 22cm",Storite,0,0,0,399,4.3,851,69,"Friday, February 18",1,851
153,B08RD9MXZK,"TERABYTE 25 Meter HDMI Male to HDMI Male Cable TV Lead 1.4V High Speed Ethernet 3D Full HD 1080p HDMI Cable (Black For Computer, Laptop, Tablet)",TERABYTE,0,0,0,"1,399",3.7,24,30,"Monday, February 21",1,24
154,B08FBZH84R,Stela High Speed Mini HDMI(NOT Micro) to HDMI Cable,Stela,0,0,0,149,2.0,1,85,"Monday, February 21",1,1
155,B08PPKL3ZK,Posh HDMI Female to HDMI Female Cable Adapter Extender Coupler,Posh,0,0,0,180,4.9,14,82,"Monday, February 21",1,14
156,B09MNFPM32,"World Shopper TERABYTE 10meter HDMI Cable 4K Ultra HD HDMI Male to Male Cable (10m, Black)",World,0,0,0,399,0,0,60,"Tuesday, February 22",0,"₹399
₹999 Save ₹600 (60%)"
157,B08TT372Y6,"Kinsound 8K HDMI Cable, HDMI Cable 2.1 Ultra High Speed 48Gbps 8K/60Hz HDR eARC HDMI Cable for TV, Roku, Samsung, Sony, LG, Nintendo Switch, PS, Xbox 3M",Kinsound,0,0,0,"1,439",4.3,70,45,"Sunday, February 20",1,70
158,B09MWDHMCY,Rec Trade HDMI 2.0 HDTV Switch Switcher Splitter Bi-Direction Hub HDCP 2x1 1x2 in Out 4K HDCP 3D 1080p 4K HDMI Adapter. (RTT-SWT-0077),Rec,1,0,0,852,0,0,43,"Tuesday, February 22",1,"₹852
₹1,499 Save ₹647 (43%)"
159,B09GKLQFXK,"Rec Trade Wii to HDMI Adapter, Wii2HDMI Converter Audio Output Adapter 1080p Full HD Compatible with PC, TV, Monitor, Display.(RTT-CVT-0178)",Rec,1,0,0,670,0,0,55,"Tuesday, February 22",1,"₹670
₹1,499 Save ₹829 (55%)"
160,B08JTX887R,"Storite 50cm High Speed HDMI Male to Female Extension Cable HDMI Extender for fire tv Stick, Laptop/PC, LCD/LED TV, Xbox, PS3/PS4- Black",Storite,0,0,0,299,4.1,625,75,"Friday, February 18",1,625
161,B089GM4JGK,"CableCreation 4K Micro HDMI to HDMI Cable Adapter, 4K 60Hz Ethernet 3D Audio Return, Compatible with GoPro Hero 8/7/6/5, Raspberry Pi 4, A6000, A6300, Nikon Camera, Lenovo Yoga 3 Pro, Yoga 710, 6ft",CableCreation,0,0,0,563,4.4,190,67,"Tuesday, February 22",1,190
162,B089GMG6BM,"CableCreation Micro HDMI to HDMI Cable Male to Female with Ethernet Support 4K 60Hz 3D Compatible with Raspberry Pi 4, GoPro Hero, and Other Action Camera/Cam",CableCreation,0,0,0,643,4.4,190,83,"Tuesday, February 22",1,190
163,B09LS8HGN5,"likes of india TV-out Cable HDMI to HDMI 90 Degree Adapter, Right Angle L Shape HDMI Male to HDMI Female Gold Plated Cable Adapter Compatible with HDTV 1080P HDMI Cable Connector. (Black, For Laptop)",likes,0,0,0,155,0,0,78,"Monday, February 21",1,"₹155
₹699 Save ₹544 (78%)"
164,B00KMPPFMQ,PremiumAV HD15V14P 5M HDMI Male to Male Cable (Black)…,PremiumAV,0,0,0,299,4.0,"3,678",63,"Monday, February 21",1,"3,678"
165,B09C3BN2BW,"MVTECH 90 Degree Right Angle HDMI Adapter Male to Female, 90 Degree HDMI Bend, L-Shaped HDMI Jointer",MVTECH,0,0,0,109,3.7,15,73,"Monday, February 21",0,15
166,B094X4ZF64,"LOGIC HDMI 2.0 Cable 5 Meter (16 Feet) Male to Male 4K@60 Hz 24K Gold Plated, Supports EDID & CEC",LOGIC,0,0,0,699,4.5,27,36,"Wednesday, February 23",1,27
167,B08TTCZ43G,CARE CASE® HDMI TO HDMI CABLE With Ethernet High speed HDMI 2.0 Ultra HD 4k/ 3D/1080p 60Hz HDTV Cable. (1m),CARE,0,0,0,199,5.0,1,60,"Tuesday, February 22",1,1
168,B08MYB46L8,"Live Tech High Speed HDMI Cable with Ethernet - Supports 3D, 4K and Audio Return (1.8 Meter/ 6 Feet)- Flix (Black, Metal)",Live,1,0,0,217,4.3,247,64,"Friday, February 18",1,247
169,B09M8BHT72,"Storite Short Length 19 Pin HDMI Male to Female 4K Extension Cable,High Speed HDMI Extension Cable Male to Female Adapter for Laptop/PC - (10 cm,Black)",Storite,1,0,0,199,5.0,5,80,"Friday, February 18",1,5
170,B099S4ZJC4,"Rec Trade Mini HDMI to HDMI Converter Adapter, Gold-Plated 1.4 3D Extension Adapter 1080P Converter for HDTV/ Camera etc.(RTT-CVT-0154)",Rec,1,0,0,199,0,0,80,"Tuesday, February 22",1,"₹199
₹999 Save ₹800 (80%)"
171,B09PGDP1B3,"DigiReach® HDMI Cable 3 Meter 4K UHD - HDMI 2.0 - ARC - HDCP 2.2 - 4K 4:4:4 60FPS - HDR - 18Gbps - Gold Plated Connector - Premium HDMI for TV - Projectors -AVR - PS4 - PS5 - Apple TV - Bluray (4K UHD, 3 Meter) - (HD3-4K)",DigiReach®,1,0,0,592,5.0,1,52,"Monday, February 21",1,1
172,B08276R624,"UGREEN 8K HDMI Cable Ultra HD High Speed 48Gbps HDMI 2.1 8K 60Hz Support Dynamic HDR, Dolby Vision, eARC, Compatible for Xbox One, Nintendo Switch, PS4 Pro, Samsung TV, Roku, Nylon Braided (6FT)",UGREEN,0,0,0,"1,009",4.6,"1,193",28,"Wednesday, February 23",1,"1,193"
173,B014I8TC4E,AmazonBasics High-Speed HDMI Cable - 25 Feet (Latest Standard),AmazonBasics,0,0,0,"1,399",4.3,"31,214",61,"Friday, February 18",1,"31,214"
174,B09DBWNWWS,WETEK Gold Plated 90 Degree HDMI Male to Female Adapter/Converter Extender L Shape HDMI Band Cable Converter Support(Pack of 2),WETEK,0,0,0,169,4.0,5,66,"Monday, February 21",0,5
175,B08PPKGZDR,Posh Micro HDMI Male to HDMI Female Port Saver Converter Adapter,Posh,0,0,0,199,3.5,37,80,"Monday, February 21",1,37
176,B09DD5732T,Infideals High Speed HDMI to Micro HDMI Cable (Micro HDMI to HDMI) 4K Resolution Ready - 1.5 Meter,Infideals,0,0,0,279,4.5,4,60,"Monday, February 21",1,4
177,B09HCSPJJW,"MX HDMI 2.0, 3 Meter HDMI Male to HDMI Male Cable TV Lead High Speed 3D Full HD 1080p HDMI Cable (Black For Computer, Laptop)",MX,0,0,0,399,0,0,43,"Thursday, February 24",0,"₹399
₹699 Save ₹300 (43%)"
178,B099PL6CWY,CARE CASE® HDMI Cable 4K High Speed Ethernet and Audio Gold Plated Connectors 1.5 Meter Black,CARE,0,0,0,149,0,0,70,"Tuesday, February 22",1,"₹149
₹499 Save ₹350 (70%)"
179,B08K5PN3TS,BigPlayer 15-Meter HDMI Male to Male Cable (Black),BigPlayer,0,0,0,799,4.3,30,60,"Sunday, February 20",1,30
180,B09PRHSHBB,"Storite 1.5m HDMI Male to Male Cable High Speed 18Gbps HDMI 2.0 Cord Supports 4K Ultra HD, 3D, 1080p, Ethernet Compatible for TV, Laptop, PC, Monitor & Projector (Black)",Storite,1,0,0,499,0,0,50,"Friday, February 18",1,"₹499
₹999 Save ₹500 (50%)"
181,B08XQ6V8K6,"REC Trade HDMI 2.0 Bi-Direction Switch 2 Input to 1 Output or 1 in to 2 Out, Supports 4K/3D/1080/HDCP Pass Through-HDMI Switcher for HDTV/Blu-Ray Player/DVD/DVR/Gaming Console etc. (RTT-SWT-0077)",REC,1,0,0,852,2.5,3,43,"Tuesday, February 22",1,3
182,B08R75DCZF,"TERABYTE HDMI to VGA 1080P HDMI Male to VGA Female Video Converter Adapter Cable for PC Laptop HDTV Projectors and More Devices with HDMI Input (Black, White) Colour May Vary",TERABYTE,0,0,0,251,3.7,99,75,"Monday, February 21",1,99
183,B088F8YSC3,"CableCreation 8K HDMI Cable 10 FT, HDMI 8K Ultra HD High-Speed Cable 48Gbps, 8K 60Hz, HDCP 2.2, 4:4:4 HDR, ARC Compatible with PS5, PS4, Xbox Series X, Xbox One, QLED TV, Roku TV",CableCreation,0,0,0,"1,499",4.4,"1,396",59,"Tuesday, February 22",1,"1,396"
184,B00TB3R47O,"C&E Latest Technology 4K HD HDMI Cable 28 AWG (30ft) High Speed 3D Full HD 1080p Support (9.1 Meters) Compatible HD TV, Blu-ray, Xbox, PS4/3, PC, Fire TV- Black",C&E,0,0,0,899,4.5,"1,178",49,"Friday, February 18",1,"1,178"
185,B07J5N15LT,"rts High-Speed HDMI Cable – 20 Meter (Latest Version Standard) Supports Ethernet,1080p full HD, 3D, 4K 60Hz video, Audio Return Black for Computer, Laptop, tablets projector Set Top Box, Dish TV Box projectors HDTVs",rts,0,0,0,"1,299",3.8,115,74,"Sunday, February 20",1,115
186,B08K5L56Q1,BigPlayer 3 MTR HDMI v1.4 Male to Male Cable 3D LED Plasma LCD Full HD Copper,BigPlayer,0,0,0,248,4.1,19,50,"Friday, February 18",1,19
187,B07M9TNNWW,"BlueRigger HDMI Cable Extension Male to Female HDMI Extender Cord 4K Compatible for TV Stick, Roku Stick, Chromecast, Nintendo Switch Wii U, Xbox One 360, PS4 PS3, Blu Ray Player, HDTV, Laptop PC (6 FT)",BlueRigger,0,0,0,679,4.4,"37,386",32,"Friday, February 18",1,"37,386"
188,B08GLTSXW6,"BlueRigger Ultra Series 8K HDMI to HDMI Cable with 48Gbps Speed, (6.6 Feet / 2 Meters) Supports 8K@60HZ,1080p FullHD, UHD/Ultra HD, 3D, High Speed with Ethernet, ARC, PS4, Xbox, HDTV",BlueRigger,0,0,0,"1,232",4.3,272,48,"Friday, February 18",1,272
189,B082C6J69S,"USB C to HDMI 4k 6ft HDR Supported Cable Adapter, Compatible with MacBook Pro 2020 2019, MacBook Air/iPad Pro 2019, Surface Book 2, Dell XPS 13, Samsung S10 to TV, Projector, Monitor, Black",USB,0,0,0,"1,099",3.9,87,35,"Tuesday, February 22",1,87
190,B09HH927JH,"Verilux® HDMI 2.1 Cable 1.5m,8K hdmi Cable Snowkids Ultra HD hdmi 48Gbps High Speed 8K@60Hz,4K@120Hz,eARC HDR10 4:4:4|21:9,HDCP 2.2/2.3 Dolby,3D,VRR",Verilux®,1,0,0,"1,008",5.0,1,28,"Tuesday, February 22",1,1
191,B01M044EAQ,Honeywell HDMI 1.4 Cable with Ethernet - 3M,Honeywell,1,0,0,769,4.5,876,23,,0,876
192,B09MN3192B,"iSOUL HDMI Cable, High-Speed Ultra HD HDMI 2.0 Cable, Supports 3D Formats with Audio Return Compatible with Fire TV HDMI 2.0/1.4, Blu-ray/PS4/PS5/Xbox Series X/Switch HD 1080p PC 1.5 Meter Silver Plated",iSOUL,1,0,0,177,4.7,9,61,"Tuesday, February 22",0,9
193,B07SVMBPGV,"DHIVIS Certified HDMI 2.1, 2 Meters, 8K Diamond Series, 48Gbps - 4K (4096 x 2160) 120hz - HDCP 2.2, 2.3, HDR10+ and Dolby Vision, Atmos, SKU: DH002",DHIVIS,1,0,0,"3,100",4.4,374,58,"Monday, February 21",1,374
194,B09P6S248R,"Insflug Universal HDMI Cable Adapter and 3 in 1 connecting cable,1080P HDMI Video AV Connector Screen Mirroring on HD TV Projector for i-Phone/i-Pad, Android Smartphone/Tablet Type C, Micro USB,D148",Insflug,0,0,0,"1,199",0,0,70,"Monday, February 21",1,"₹1,199
₹3,999 Save ₹2,800 (70%)"
195,B01FM51SHG,"CableCreation DVI Male to HDMI Male Cable, 5 Feet Bi-Directional HDMI Male to DVI(24+1) Male Cable Support 1080P for Raspberry Pi, Roku, Xbox One, Laptop, Graphics Card, Blue-ray, 1.5M/Black",CableCreation,0,0,0,459,4.2,"5,751",28,"Tuesday, February 22",1,"5,751"
196,B09DSC9GYK,"Kinsound 4K HDMI Cable, High Speed HDMI Cable with Ethernet Supports 3D, 4K,1080P Compatible with TV, Projector, Nintendo Switch, PS, Xbox, All HDMI Devices, 1M",Kinsound,0,0,0,699,4.8,14,38,"Sunday, February 20",1,14
197,B003XM1WE0,"BlueRigger Ultra Series (Braided-Nylon) 4K HDMI Cable/HDMI Cord (10 feet / 3 Meters, HDMI to HDMI, TOP Series) supports (4K@60HZ,1080p FullHD, UHD/Ultra HD, 3D, High Speed with Ethernet, ARC, PS4, XBOX, HDTV)",BlueRigger,0,0,0,824,4.4,"16,527",31,"Tuesday, February 22",1,"16,527"
198,B08ML1396D,"Gadgets Appliances Mobile Phone to HD TV MHL 11Pin to HDMI Media Adapter Micro USB to HDMI Adapter Cable Compitable for iPhone 5, 5c 5s,6, Plus -Set of 1",Gadgets,0,0,0,"1,099",3.6,8,35,"Wednesday, February 23",0,8
199,B09PDDGRNF,"ZeniQ 4K HDMI 2.0b Certified, 3Meters, ARC Priority, 18Gbps 4K@60hz, 8K@30Hz, HDCP 2.2, Dolby Vision 4:4:4 HDR, Compatible for PS4, Xbox Series S, QLED TV [ 4K@60hz Certified ]",ZeniQ,0,0,0,"1,199",4.6,221,60,"Sunday, February 20",1,221
200,B09PD1K597,APE HDMI Cable 3 Meter (HDMI Male to HDMI Male),APE,0,0,0,230,0,0,42,"Thursday, February 24",0,"₹230
₹399 Save ₹169 (42%)"
201,B095P57X4J,"Storite 2 Pack 90cm 19pin High Speed HDMI Cable, Male to Male HDMI Cord Supports 4K@30Hz, 2160p, 1080p & 3D for TV, Laptop, PC, Monitor & Projector - Black",Storite,0,0,0,349,4.0,"1,525",71,"Friday, February 18",1,"1,525"
202,B09PDNZQ63,"Verilux® HDMI to DVI Cable Bi-Directional Adapter Cable,Audio & Video Sync Transmission,6 ft, Black Compatible with Computer,Mointor, TV",Verilux®,1,0,0,599,0,0,41,"Tuesday, February 22",1,"₹599
₹1,007 Save ₹408 (41%)"
203,B09GVZJ3NJ,"AGARO HDMI to HMDI Cable 3 Meters, HDMI 2.0, Ultra High Speed, 48Gbps 4K@60Hz Support Dynamic HDR, 3D, eARC, HDCP 2.2, Cotton Braided HDMI Cord for PS5/PS4/Xbox/Apple TV/Projector, Black (33568)",AGARO,1,0,0,525,4.5,63,52,"Friday, February 18",1,63
204,B07BZJ33R2,Storite High Speed 19 Pin HDMI Male to Female Extension Cable HDMI Extender (10cm 2 Pack),Storite,0,0,0,229,4.2,524,77,"Friday, February 18",1,524
205,B01HQ2H6OW,"CableCreation Mini-HDMI Male to HDMI Female Converter Adapter Cable (0.5 Feet), Support 3D, 1080P Resolution, 0.15 m/Black",CableCreation,0,0,0,438,4.3,920,12,"Tuesday, February 22",1,920
206,B08RF25R79,enreta™ 1.5m 2m 3m 5m 10 Meter HDMI Cable HIGH SPEED Long Lead with Ethernet ARC Full HD 1080p PS4 Xbox One Sky HD TV Black & Gold Plated (2 Meter),enreta™,0,0,0,199,3.7,14,67,"Wednesday, February 23",0,14
207,B07Q6XPJJK,"TULMAN 50 CM High Speed HDMI Male to Female Extension Cable HDMI Extender for fire tv stick, Laptop/PC, LCD/LED TV, Xbox, PS3/PS4",TULMAN,0,0,0,279,4.1,715,72,"Sunday, February 20",1,715
208,B01FM51TT8,"CableCreation HDMI to DVI Cable, 6.6 Feet HDMI Male to DVI 24+1 Male Cable, Gold Plated HDTV to DVI Cable Support 1080P 3D for Raspberry Pi, Roku, Xbox One, Graphics Card, Blue-ray, Nintendo Switch",CableCreation,0,0,0,459,4.2,"5,751",29,"Tuesday, February 22",1,"5,751"
209,B08P4P8CP7,"Super HDMI Cable All in One High Speed (HD TV, LED, LCD & 4K HD, Box),Cable for Computer/Laptop/Led/Tv/Projector (Male to Male) 1.5 Meter/4.92 Feet",Super,0,0,0,167,4.2,8,16,"Monday, February 21",0,8
210,B09DSD94PZ,"Kinsound 4K HDMI Cable, High Speed HDMI Cable with Ethernet Supports 3D, 4K,1080P Compatible with TV, Projector, Nintendo Switch, PS, Xbox, All HDMI Devices, 2M",Kinsound,0,0,0,899,4.8,14,38,"Sunday, February 20",1,14
211,B09C3C17JR,"MVTECH (Pack Of 2) HDMI to HDMI 90 Degree Adapter, Right Angle L Shape HDMI Male to HDMI Female Gold Plated Cable Adapter Compatible with HDTV 1080P HDMI Cable Connector.",MVTECH,0,0,0,175,3.7,15,75,"Monday, February 21",0,15
212,B094NMS84Z,Rec Trade HDMI Male to HDMI Male 3m Cable TV Lead 1.4V High Speed Ethernet 3D Full HD 1080p for HDTV X-Box PS3 Computer. (RTT-CBL-0039),Rec,1,0,0,369,3.5,2,59,"Tuesday, February 22",1,2
213,B09MJ8V161,"Rec Trade HDMI2HDMI + Audio, Mini HDMI2HDMI Adapter Support 1080P Full HD Audio Convert, (RTT-CVT-0194)",Rec,1,0,0,"1,199",0,0,60,"Tuesday, February 22",1,"₹1,199
₹2,999 Save ₹1,800 (60%)"
214,B082D9DZ1X,"USB C to HDMI Adapter with 4K@60Hz HDR, CableCreation HDMI to USB Type C Converter, Compatible with MacBook Pro, iPad Pro 2020, Surface Go, XPS 13, Yoga 910, Galaxy S10 or Dex to TV, Monitor",USB,1,0,0,"1,399",3.9,87,53,"Tuesday, February 22",1,87
215,B09KM3X7RS,"Rec Trade HDMI Female to HDMI Female Adapter, HDMI Cable Adapter Compatible with Extended Reach When Connecting Blu-ray Players, Fire TV, HDTV, PS4, PS3, X-Box one, X-Box 360. (RTT-CVT-0153)",Rec,1,0,0,189,1.0,1,62,"Tuesday, February 22",1,1
216,B082C6J69S,"USB C to HDMI 4k 6ft HDR Supported Cable Adapter, Compatible with MacBook Pro 2020 2019, MacBook Air/iPad Pro 2019, Surface Book 2, Dell XPS 13, Samsung S10 to TV, Projector, Monitor, Black",USB,0,0,0,"1,099",3.9,87,35,"Tuesday, February 22",1,87
217,B01MF55YSV,"Tizum Fusion Gold Plated Flat 3M High Speed HD 1080p HDMI Black Cable (Data 18Gbps, 3D, 4K, 10 Ft)",Tizum,0,0,0,449,4.1,"1,106",72,"Sunday, February 20",1,"1,106"
218,B014I8T8FC,"AmazonBasics 15 Feet High-Speed HDMI Cable (Black) - Supports Ethernet, 3D, 4K video",AmazonBasics,0,0,0,981,4.3,"31,214",57,"Friday, February 18",1,"31,214"
219,B0873ZZ7F8,JGD Products Mini HDmi2Av Up Scaler 1080P HD Video Converter Media Streaming Device,JGD,0,0,0,209,3.7,"1,605",79,"Monday, February 21",1,"1,605"
220,B08K5QZ9ZZ,"BigPlayer HDMI Male to Male Cable (5M, Black)",BigPlayer,0,0,0,318,4.3,30,60,"Friday, February 18",1,30
221,B08RF25R79,enreta™ 1.5m 2m 3m 5m 10 Meter HDMI Cable HIGH SPEED Long Lead with Ethernet ARC Full HD 1080p PS4 Xbox One Sky HD TV Black & Gold Plated (2 Meter),enreta™,0,0,0,199,3.7,14,67,"Wednesday, February 23",0,14
222,B07BZJ33R2,Storite High Speed 19 Pin HDMI Male to Female Extension Cable HDMI Extender (10cm 2 Pack),Storite,0,0,0,229,4.2,524,77,"Friday, February 18",1,524
223,B08KYB97J5,N.A. HDMI to Scaler Adapter HD Video Composite Converter Box HDMI to RCA /CVSB L/R Video 1080P Mini HDMI2AV Support NTSC PAL New,N.A.,0,0,0,539,3.4,64,62,"Monday, February 21",1,64
224,B09GW2J76K,"AGARO HDMI to HMDI Cable 2 Meters, HDMI 2.0, Ultra High Speed, 48Gbps 4K@60Hz Support Dynamic HDR, 3D, eARC, HDCP 2.2, Cotton Braided HDMI Cord for PS5/PS4/Xbox/Apple TV/Projector, Black (33567)",AGARO,1,0,0,352,4.5,63,50,"Sunday, February 20",1,63
225,B08HGYX1XJ,"CableCreation HDMI to DisplayPort Converter with USB Power, 4K x 2K@30Hz HDMI Male to DP Female Adapter/Converter for Xbox One, Compliant with VESA Dual-Mode DisplayPort 1.2, HDMI 1.4",CableCreation,1,0,0,"1,899",4.2,147,53,"Tuesday, February 22",1,147
226,B08TTJWM5D,"Techgadget High Speed 1080p HDMI Cable Male to Male Full HD TV-Out Cable Supports 3D, 4K, Ethernet and Audio Return (1.5 Meter) (N-1022)",Techgadget,0,0,0,225,3.8,11,62,"Tuesday, February 22",1,11
227,B09QQ64Q19,"HDMI Cable, High-Speed Ultra HD HDMI 2.0 Cable, Supports 3D Formats with Audio Return Compatible with Fire TV HDMI 2.0/1.4, Blu-ray/PS4/PS5/Xbox Series X/Switch HD 1080p PC 1.5 Meter (Gold Plated)",HDMI,0,0,0,199,4.7,9,67,"Monday, February 21",0,9
228,B08PPHDQTC,LS LAPSTER Quality Assured 50 cm Short Length Plated HDMI Male to Female Extension Cable - (Specially Designed for Wall mountable tv) Black (LST-HDMI-M2F-50CM-02),LS,0,0,0,199,4.1,39,80,"Friday, February 18",1,39
229,B09KS1NC34,"Storite 3m 4K UHD HDMI Cable High Speed 18Gbps HDMI 2.0 Cord Supports 4K@60Hz UHD, 2160p, 1080p, Ethernet, 3D, Audio Return(ARC) Compatible for TV, Laptop, PC, Monitor & Projector",Storite,0,0,0,899,5.0,1,70,"Friday, February 18",1,1
230,B095P57X4J,"Storite 2 Pack 90cm 19pin High Speed HDMI Cable, Male to Male HDMI Cord Supports 4K@30Hz, 2160p, 1080p & 3D for TV, Laptop, PC, Monitor & Projector - Black",Storite,0,0,0,349,4.0,"1,525",71,"Friday, February 18",1,"1,525"
231,B09KPWCZZ4,"Rec Trade Micro HDMI To HDMI Adapter, 3 in 1 HDMI Female to Mini HDMI Male + Micro HDMI Male Adapter Connector Compatible With HDTV DVs / Cameras / Game Consoles to your HDTV with a true HD connection. (RTT-CVT-0070)",Rec,0,0,0,349,4.1,9,65,"Tuesday, February 22",1,9
232,B09F9QZ83R,IRONFIX® High Speed HDMI Cable Male to male Cable (5 feet),IRONFIX®,0,0,0,199,2.2,4,43,,1,4
233,B08K5L56Q1,BigPlayer 3 MTR HDMI v1.4 Male to Male Cable 3D LED Plasma LCD Full HD Copper,BigPlayer,0,0,0,248,4.1,19,50,"Friday, February 18",1,19
234,B09KPVDBB5,"Rec Trade HDMI 90 Degree Adapter, HDMI 90 degree right-angle adapter HDMI male to female HDMI elbow connector Compatible With HD-DVD recorder, Blu-ray, Set Top Box, monitor, projector, etc..(RTT-CVT-0148)",Rec,1,0,0,199,4.1,9,80,"Tuesday, February 22",1,9
235,B09MS6DXCR,"Rec Trade 120M 4K HDMI Extender Cascade Connection Via Cat5e CAT6 RJ45 Ethernet Network Cable TX RX Kit for PS4, DVD Player, TV Box, PC to TV. (RTT-EXT-0089)",Rec,1,0,0,"6,173",0,0,64,"Tuesday, February 22",1,"₹6,173
₹16,999 Save ₹10,826 (64%)"
236,B0876SHMD3,"CableCreation HDMI 8K Cable 3.2ft, 8K HDMI Ultra HD High-Speed 48Gbps Cable, 8K 60Hz, HDCP 2.2, 4:4:4, ARC, Compatible with PS5, PS4, Xbox One/Xbox Series X, Nintendo Switch, QLED TV, Roku TV",CableCreation,1,0,0,"1,069",4.4,"1,396",60,"Tuesday, February 22",1,"1,396"
237,B08S755PXM,"Storite Gold-Plated High-Speed Premium Series 19 Pin HDMI Male to Male Cable 1.5 Meter -Supports 3D,4K 30Hz, Video 4K 2160p 1080p- Compatible with Laptop, PC, Projector & TV-Black",Storite,1,0,0,299,4.3,313,85,"Friday, February 18",1,313
238,B09PGCRWRV,"DigiReach® HDMI Cable 1.5 Meter FullHD 1080P - HDMI 1.4 - ARC - HDCP 1.4 - Gold Plated Connector - Premium HDMI for TV - Projectors -AVR - PS4 - PS5 - Apple TV - Bluray (1080P, 1.5 Meter) - (HD1-1080)",DigiReach®,0,0,0,229,5.0,1,69,"Monday, February 21",1,1
239,B08VWL2ZPP,"Storite 2 Pack Gold-Plated High-Speed Premium Series 19 Pin HDMI Male to Male Cable 1.5 Meter -Supports 3D,4K 30Hz, Video 4K 2160p 1080p- Compatible with Laptop, PC, Projector & TV-Black",Storite,0,0,0,499,4.3,313,80,"Friday, February 18",1,313
240,B08PPFZR97,"Lapster HDMI Male to Female Extension Cable high Speed Cable for LED/LCD TV, Laptop - 10 cm Black",Lapster,0,0,0,149,3.7,22,85,"Friday, February 18",1,22
