,asin,title,brand,Sponsored,Best Seller,Amazon's Choice,Price,Rating,NoofRatings,Discount,Delivery,Prime Delivery,base
208,B08ZKSHNK9,"Women Skinny Belt for Dresses Retro Stretch Chic Ladies Elastic Waist Belt 27""-35""",MASSMART,0,0,0,339,4.1,116,43,,0,116
209,B07TM3W2RW,"Reversible PU Leather Belt, Turn to switch color, Black and Brown (RSTX-04T)",ZORO,0,0,0,254,3.6,"1,541",83,,0,"1,541"
210,B09JKMCLF5,Fashion PU Waist Belt Women's Metal Buckle Design Belt Interlocking Buckle Vintage Blouse Blazer Dress Belt (Black),PALAY,0,0,0,599,0,0,32,,1,"₹599
₹875 Save ₹276 (32%)"
211,B08ZGQ5V5G,Luxury Lion Autolock Buckle Ratchet Black Leather Belt for Men (Free Size),Ammvi Creations,0,0,0,797,3.8,30,68,,1,30
212,B099X49BTB,Men's Leather Slim Buckle Reversible Free Size Formal Belt,Ammvi Creations,0,0,0,777,4.3,14,35,,1,14
213,B09QQHRYYR,Waist Dress Belt Skinny Belt for Women Dress Waist Belt Metal Plain Mirror Elastic Belt Adjustable Metal Golden Belt for Ladies,Akszone,0,0,0,399,5.0,5,47,,1,5
214,B092S5R6S1,"Green Golden Beaded Designer Tasselled Cloth Waist Saree Belt and Kamarbandh for Women (Green, 1)",Duchess,0,0,0,998,4.4,61,55,,1,61
215,B07H86QK18,Brown Perforated Casual Leather Belt for Men,URBAN FOREST,0,0,0,599,3.3,18,70,,1,18
216,B09P51CLJM,Pranaam product saree waist belt for women waist size 32 to 40 inches l,Generic,0,0,0,790,0,0,43,"Wednesday, February 16",0,"₹790 (₹790/count)
₹1,390 Save ₹600 (43%)"
217,B085TSTLRX,Men's and Women's Stretchable Flexible Cotton Canvas Belt (Black),ZORO,0,0,0,249,3.7,17,75,,0,17
218,B095YXPMF6,Lugo Duo 30Mm Satin (Reversible) Black Color Leather Belt For Men,Cross,0,0,0,815,4.0,22,49,,1,22
219,B09B3DYMKG,Reversible Formal Leather Belt for Men I Durable Buckle I Heavy Duty,WildHorn,0,0,0,480,4.4,5,70,,0,5
220,B093YV1R3W,Stretchable Adjustable Belt for kids Boys and Girls (Suitable for 3 to 7 Years Old) (Black),Kutumbh,0,0,0,314,3.6,16,48,,1,16
221,B09686R9V8,Women Belt,Fabme,0,0,0,129,3.9,33,57,,0,33
222,B07VXWMFRV,"Women's Faux Leather Belt ( White , Free Size )",Zacharias,0,0,0,235,3.9,93,61,,0,93
223,B0981CW3P9,Brown Genuine Leather Wallet And Belt Combo Gift Set For Men (SPT-2202 EXE-02),MARKQUES,0,0,0,699,0,0,75,,1,"₹699
₹2,799 Save ₹2,100 (75%)"
224,B07YG7Y41W,Unisex Nylon & Canvas Waist Belt,EDIFIER,0,0,0,399,3.8,88,73,,0,88
225,B08H11VDLP,Men's Reversible Buckle For Belt (35 mm),Generic,0,0,0,195,3.9,20,44,,1,20
226,B085TS298Y,"Men's Stretchable Stylish Flexible Belt, (BROWN, TAN SCB30)",ZORO,0,0,0,237,3.9,73,87,,0,73
227,B09Q6LJYYK,"DiscoverTrends Stretchable braided cotton belt for men and women,flexible unisex belt Elastic Woven Canvas(Black)",Generic,0,0,0,129,0,0,74,,0,"₹129
₹499 Save ₹370 (74%)"
228,B09MMX8B2L,No Buckle Invisible UNISEX Comfortable Elastic Stretch Belt for Women Fits waist Invisible Buckless Belt for Jeans Pants,TREXEE,0,0,0,295,5.0,1,67,,0,1
229,B09NL8QX5J,Casual Tan Color Genuine Leather Belt with Double Prong Buckle for Jeans and Casual Wear belt for men stylish Leather for Men's/Boys ||CSBL-BRBKL-05||,CLUB SPUNKY,0,0,0,499,4.6,4,77,,1,4
230,B0919LV3QP,Men's Genuine Leather Auto-Lock Buckle With Reversible Belt,BlacKing,0,0,0,499,4.1,74,74,,1,74
231,B09LYR9F6G,"Elastic Belt for Women, Bohemian Style Braided Belt, Straw Woven Elastic Waist Belt for Women",Electomania,0,0,0,389,3.6,6,35,,0,6
232,B08V1WWQZS,Women's Nylon & PU Belt,Alitrade,0,0,0,369,4.1,261,63,,0,261
233,B07W142ZCL,Men's Leather Belt,KAEZRI,0,0,0,359,4.0,"2,049",82,,0,"2,049"
234,B085M9KDL6,Women's Leather Belt,Futurekart,0,0,0,379,4.2,574,62,,1,574
235,B09QXHH3GZ,"Frunix brand Nylon fabric Belt, Hole free plastic flap buckle Canvas Waist Belt (pack of 2) black and green",Generic,0,0,0,0,0,0,0,,0,
236,B094YK5BLG,Formal/Casual Genuine Leather Belts For Men Brown,GETOREE,1,0,0,440,5.0,2,78,,0,2
237,B082HYKF4J,Men's Leather Belt,CHURCHILL & COMPANY,1,0,0,"2,399",3.0,4,35,,1,4
238,B09DVXK5QL,"Men's Formal Belts, Handmade Pure Italian Quality Genuine Leather Belt with Antique Buckle For Casual/Formal/Office purpose.",Cavaldii ITALIA,1,0,0,499,4.0,148,55,,1,148
239,B09QPQ81R1,"Men's Imported Leather Belts With Textured Print, For Casual and Formal Wear.",Cavaldii ITALIA,1,0,0,499,5.0,2,80,,1,2
240,B083QP1MPB,WILDBUF Pin Hole Men's Genuine Leather Belt,WILDBUFF,1,0,0,500,4.3,4,64,,0,4
241,B07RRHZRWQ,Timber Lane Genuine Leather Belt for Men,WILDBUFF,1,0,0,500,3.4,7,64,,0,7
242,B07RTNCKKW,Diamond Men's Leather Belt (WBN407),WILDBUFF,1,0,0,500,5.0,1,64,,0,1
243,B0919Q6VN1,Men's Genuine Leather Auto-Lock Buckle With Reversible Belt,BlacKing,1,0,0,499,4.1,74,74,,1,74
244,B07WWMRD6K,women XXXL OVERSIZE PLUS SIZE nevyblue denim material jeans belt,Generic,0,0,0,320,3.9,11,29,,0,11
245,B07N3T8DQQ,Men's Leather Belt,WildHorn,0,0,0,480,3.4,29,70,,0,29
246,B07MMTXFKF,unisex Black stretchable suspender,Sunshopping,0,0,0,199,4.0,292,50,,0,292
247,B09LCXPPY7,Genuine Leather Men’s Formal/Casual Tan Belt | BL8001,HAMMONDS FLYCATCHER,0,0,0,454,4.0,14,77,,0,14
248,B01BHQ15RW,Striking Blue Beads Handmade Women Belt,Anaya,0,0,0,"1,599",0,0,0,,0,"₹1,599"
249,B0793SSFR1,Men's Tactical Belt Military Style Webbing Nylon Belt for Men with Metal Buckle,JELINDA,0,0,0,449,4.0,990,70,,0,990
250,B08Y5K8Z3S,Women Golden Buckel Elastic Embellished Leaf helix Waist Belt,FSFTTRAD,0,0,0,339,4.0,88,66,,0,88
251,B09PTMH256,"Belts for Women Dresses, Women's Leather Belt, Women's Elastic Belt",Electomania,0,0,0,389,0,0,35,,0,"₹389
₹599 Save ₹210 (35%)"
252,B09DD4GK2R,Formal Reversible Leather Belt for Men | Color- Black & Brown | 48 inches length || Waist upto 44 inches I,WildHorn,0,0,0,480,4.8,6,70,,0,6
253,B09CQCZXTH,Women's Leather Lace-up Tied Waspie Corset Belt,Eastern eagle,0,0,0,388,3.7,49,61,,0,49
254,B08DL1GWT5,Synthetic Quick Release Buckle Nylon Belt for Men | Men's Nylon Belt (Free Size),CONTACTS,0,0,0,498,4.0,327,72,,0,327
255,B09GGYH4CN,ART-REEL Leather Black Belts Boys/Kids Waist 20-24-28-30 Inch 3|5|7|9|11 Yrs,Generic,0,0,0,349,3.9,8,42,,0,8
256,B07ZZ6286K,Combo Men's Wallet with Reversible Belt Combo Pack (PW1+PBLT1),Swiss Military,0,0,0,"1,091",3.8,71,54,,0,71
257,B08XBJ64WC,"Women's Metal Adjustable Belt for Saree, Western Dress, Traditional Dress, Party Designer wear (Hollow Design, 4 cm wide)",Fabme,0,0,0,396,3.8,106,60,,0,106
258,B09NZH7PTT,Ladies Women Stretch Elasticated Waist Belt Gold Buckle With Love Fashion Especially Designed for Women Suitable for Adults,Electomania,0,0,0,369,4.3,286,38,,0,286
259,B09DD4DB97,Reversible Leather Formal Belt for Men | Color- Black & Brown | 48 inches length || Waist upto 44 inches I,WildHorn,0,0,0,480,3.6,3,70,,0,3
260,B07QDND1JX,Men's Leather Reversible Belt,CHURCHILL & COMPANY,1,0,0,"2,399",3.3,20,35,,1,20
261,B01NCP1BL3,Men's Classic Reversible Black & Brown Leather Belt,Pacific Gold,1,0,0,429,3.6,102,64,,1,102
262,B094W77RP8,Gatsby Textured Cognac leather belt (Brown),CHURCHILL & COMPANY,1,0,0,"2,499",0,0,32,,1,"₹2,499
₹3,699 Save ₹1,200 (32%)"
263,B09NL9LWTX,Casual Tan Color Genuine Leather Belt with Double Prong Buckle for Jeans and Casual Wear belt for men stylish Leather for Men's/Boys ||CSBL-BRBKL-05||,CLUB SPUNKY,1,0,0,499,4.6,4,77,,1,4
264,B09HXXZ615,Women's Dress Stretchable Cummerband Belt Wide 20 MM (SB-1101_Black),Zacharias,0,0,0,399,4.4,4,60,,1,4
265,B09RP1M74F,Women Belt Casual Thin Belt Female Belts Dress Skirt Waist Elegant Peart Pearl Ladies Designer Waistband,REDHORNS,0,0,0,385,0,0,61,,1,"₹385
₹999 Save ₹614 (61%)"
266,B09NL3J4VR,Pearl Waist Chain Belt Adjustable Decorative Belt Hollowed Tassel Waist Belts - Free Size,Syga,0,0,0,319,4.3,57,60,,1,57
267,B0868XY8WD,Men Belt,Tommy Hilfiger,0,0,0,"1,959",3.8,21,30,,1,21
268,B07CYK6TPV,"Men's Jaguar Belt Buckle (Black and Silver, Free Size)",YASHISH,0,0,0,290,3.5,53,81,,0,53
269,B07Y22PLWZ,Jackson Leather Belt for Men,HIDE & SKIN,0,0,0,497,4.1,77,75,,0,77
270,B08QZ9DX4Y,Women's Metal Adjustable kanduro Wide Plate Belts Pack of 1 (Wide Plate_Gold),SATYAM KRAFT,0,0,0,399,3.9,9,67,,0,9
271,B08TLVFNSV,Women's Metal kanduro Stretchable Belt Pack of 1 (Gold),SATYAM KRAFT,0,0,0,299,4.2,232,75,,0,232
272,B0799HS4L9,"Girl's PU Leather Belt (KRY-WOM-BLK-BELT, Black, Free Size)",Krystle,0,0,0,175,3.7,84,53,,0,84
273,B085WM9S1M,Women's Elastic Belt,Electomania,0,0,0,369,4.3,441,38,,1,441
274,B09FQ6J5WQ,"Reversible PU Leather Belt, Turn to switch color, Black and Brown Formal Casual Belt for Men Two in One Belt(V-Belt057-Black/Brown Belt)",Veteran,0,0,0,249,5.0,1,83,,1,1
275,B07YCR4JX6,"PU leather (Pack of 1) Adjustable Buckle Belts Fashion Waist Strap BELTS For Casual and Formal - Belt For Men and Boys, color Design For Daily Use",EDIFIER,0,0,0,399,3.9,289,16,,0,289
276,B07QMSKMX1,Men's Leather Buckle Belt,HIDE & SKIN,0,0,0,557,3.9,"1,694",72,,1,"1,694"
277,B00PW3LCB6,Black and Antique Silver Buckle Leather Men's Belt,Puma,0,0,0,651,4.0,8,62,,1,8
278,B078FTGX66,"Women's Metal stretchable Bow Belt-kanduro Pack of 1 (Bow Belt, Golden)",SATYAM KRAFT,0,0,0,299,4.2,659,75,,0,659
279,B09NGGKN45,"Crocky Cut To Fit Reversable Black And Brown Color Belt, One Size",Cross,0,0,0,"1,346",0,0,60,,1,"₹1,346
₹3,399 Save ₹2,053 (60%)"
280,B09QL2MZ51,Waist Dress Belt Skinny Belt for Women Dress Waist Belt Metal.,ZINLEY,0,0,0,339,5.0,4,57,,1,4
281,B08CF61G32,Men's Leather Belt,Tommy Hilfiger,0,0,0,"1,731",3.5,19,28,,1,19
282,B09BDF4RKN,Canvas Elastic Fabric Woven Stretch Multicolored Braided Belts (Size Upto 34 Inches of Waist Size),USL,0,0,0,199,3.8,28,72,,1,28
283,B08W1W9WWJ,Police Inspector Belt replica ;Leather ; Free Size,FancyDressWale,0,0,0,399,3.4,28,60,,1,28
284,B08VF3DLJC,Women Girls Belt Fashion Bowknot Design Waist Belt Chic Elastic Stretch Waist Band,Inrali,0,0,0,368,4.2,64,8,,0,64
285,B08Z8CFV24,Men's PU Leather Reversible Belt (Pack of 1),Zacharias,0,0,0,499,3.6,53,50,,1,53
286,B08DZC299K,Men's Combo of Black PU Leather Belt And Tan Color Wallet,Imperior,0,0,0,299,3.1,4,77,,0,4
287,B09J4PPX2R,"1 Pcs Cute Bowknot Metal Buckle Skinny Stretch Waist Belt For Dress (Gold, 1 Piece)",SATYAM KRAFT,0,0,0,259,4.2,6,78,,0,6
288,B07NS17SBT,"Men's Army Tactical Waist Belt Automatic Buckle Nylon Canvas Survival Strap, Blue Colour, BL-49",ZORO,0,0,0,237,4.1,249,84,,0,249
289,B09NGSSKVQ,"Brocky Cut To Fit Reversable Black And Brown Color Belt, One Size",Cross,0,0,0,"1,333",4.0,2,61,,1,2
290,B0862G63LB,Shirt Tucker belt strap Maximum Strech (Size 28 to 46) for Men/Women/Boys/Girls (Unisex) - Black Color,CLUB SPUNKY,0,0,0,299,3.7,231,83,,1,231
291,B09MRZTT1G,Women Belt Casual Thin Belt For Dress Skirt Waist Pearl Ladies Designer Waistband LD003,REDHORNS,0,0,0,395,5.0,3,70,,1,3
292,B07QVG8YL8,"PU leather (Pack of 1) Adjustable Buckle Belts Fashion Waist Strap BELTS For Casual and Formal - Belt For Men and Boys, color Design For Daily Use",EDIFIER,0,0,0,399,4.0,360,33,,0,360
293,B085DYGKLK,Men's Faux Leather Belt Autolock Buckle (Black; Free Size),Zacharias,0,0,0,299,3.8,50,70,,1,50
294,B01N2HOOWW,Men's Brown Wallet and Belt Combo | Gift Set for Men | Mens Leather Wallet,HORNBULL,0,0,0,899,4.0,556,73,,1,556
295,B08JM1BJMB,Men's Synthetic Quick Release Buckle Nylon Belt | Nylon Belt for Men (Free Size),CONTACTS,0,0,0,498,3.8,179,72,,0,179
296,B0957V5186,Genuine Leather Ratchet Black Dress Belts for Men And Boys with Autolock Buckle,Pacific Gold,1,0,0,899,4.1,113,75,,1,113
297,B09NMKDDM6,"Highpoint Men's PU Leather Belt for men casual, formal wear | Free Size | Adjustable",ALINA ENTERPRISES,1,0,0,349,5.0,1,61,,1,1
298,B08F384KCJ,Men's leather Formal Non Reversible Belt,Amazon Brand - Symbol,1,0,0,449,3.7,162,68,,0,162
299,B09PKJ9T6J,"Black Men's PU Leather Belt for men casual, formal wear | Free Size | Adjustable",Generic,1,0,0,349,0,0,61,,1,"₹349
₹899 Save ₹550 (61%)"
300,B0919LV3QP,Men's Genuine Leather Auto-Lock Buckle With Reversible Belt,BlacKing,1,0,0,499,4.1,74,74,,1,74
301,B07PH9N5S6,Unisex Leather Belt,URFA,1,0,0,269,3.3,68,81,,1,68
302,B013DSUF96,Reversible Stitched Vegan Leather Belt for Men,SCHARF,1,0,0,347,4.1,8,68,,0,8
303,B099MY5N65,Trent Casual Textured Leather Belts for Men,URBAN FOREST,1,0,0,455,3.3,13,77,,0,13
304,B07RBB12CS,Men's Synthetic Belt,Pacific Gold,0,0,0,629,5.0,1,61,,1,1
305,B08JCGHCM5,Men's Faux Leather Belt Combo of 2 (Black & Brown; Free Size),Zacharias,0,0,0,425,3.2,53,57,,0,53
306,B09NGPJ8GK,Women Belt Casual Thin Belt For Dress Skirt Waist Pearl Ladies Designer Waistband LD7603 White,REDHORNS,0,0,0,445,5.0,1,72,,1,1
307,B0831DG54P,Unisex Cotton Belt,ZORO,0,0,0,224,4.2,669,78,,0,669
308,B08N1C49FL,Brown Coloured Mens Belt (Size: 2XL)-SPY-MBL-01BJ-03,Spykar,0,0,0,419,1.0,1,65,,0,1
309,B07WCS5ZRL,Men's Leather Reversible Belt,Bacca Bucci,0,0,0,799,4.1,641,60,,1,641
310,B079L7K5T7,Women's Belt,Lino Perros,0,0,0,379,4.0,7,23,,0,7
311,B096861T2X,Women Belt,Fabme,0,0,0,399,3.6,42,43,,0,42
312,B07SG634S7,Men's Leather Belt,Bacca Bucci,0,0,0,799,4.0,994,60,,1,994
313,B0967VBVN2,Automatic Buckle Sliding Belt for Men in Gift Box,Reetack,0,0,0,349,3.2,25,77,,0,25
314,B09K58SPF1,Double-row Rivet Woman Man Fashion Waist Belt Leather Belt Jeans Pants Belt Dresses Waist Belt Women Leather Belt Slim Fit Sweater Slim Belt Punk Belt,PALAY,0,0,0,599,2.5,2,29,,1,2
315,B07TYHQLS9,Black Genuine Leather Wallet And Belt Combo Gift Set For Men (SPT-2201 EXE-01),MARKQUES,0,0,0,699,3.5,6,75,,1,6
316,B07HHCPX5D,"Reversible PU Leather Belt, Formal black/Brown_RSTX-01",Urban alfami,0,0,0,259,3.6,564,83,,0,564
317,B09PZ1Y3DG,Boy's Synthetic Leather Belt for kids (Brown; 8-12 Years) WF-01,Zacharias,0,0,0,199,0,0,67,,1,"₹199
₹599 Save ₹400 (67%)"
318,B00KE0BWZ8,"Workwear HH Logo Webbing Belt, Black, Standard",Helly Hansen,0,0,0,0,4.2,29,0,,0,29
319,B09NGL3L1X,Women Belt Casual Thin Belt For Dress Skirt Waist Pearl Ladies Designer Waistband,REDHORNS,0,0,0,295,1.0,1,70,,1,1
320,B07TG5S7W4,"Men's Belt, Italian Leather Reversible Belt for Men Black/Brown Dress Belt Auto Rotate Buckle Gift Box",Vincent xavier,1,0,0,499,4.0,18,79,,1,18
321,B01MYY9K98,Reversible Stitched Vegan Leather Belt for Men,SCHARF,1,0,0,347,3.4,211,75,,0,211
322,B07QDNC55Z,Men's Leather Reversible Belt,CHURCHILL & COMPANY,1,0,0,"2,399",3.3,20,35,,1,20
323,B07QSTDLMZ,Men's Leather Belt,HIDE & SKIN,1,0,0,557,4.0,"2,573",72,,1,"2,573"
324,B08PZ65WNX,Double Grommet Belt for Women Men - PU Leather Double Prong Buckle Vintage Punk Rock Jeans Belts (1 Meter),GUSTAVE,0,0,0,745,4.4,114,17,,1,114
325,B09FY34CBM,Embroidered White Silver Sequin Beaded Cloth Waist Saree Belt and Kamarbandh for Women,Duchess,0,0,0,"1,198",4.1,10,46,,1,10
326,B099K6CG6B,Womens & Girls Belt |Women & Girl Office Belt | Office Belt For Ladies| Belt For ladies jeans | Plain Belt For ladies | Ladies Belt | Width 1inch.,Delight Belts,0,0,0,199,3.3,18,80,,1,18
327,B09FHXPR1Z,"Women Belt for Jeans, Party & Casual Wear||Ladies belt for women|| Ladies Belt for jeans||Belt for women stylish|| ||Leather Belt stylish for Ladies/Girls/Women||Black colour|| Size 40inch Upto",Generic,0,0,0,100,0,0,87,,0,"₹100
₹799 Save ₹699 (87%)"
328,B01GFQ8L5S,"Women's Waist Belt (E_55003006,Black,Free Size)",Generic,0,0,0,349,4.2,509,50,,1,509
329,B00SGLJAOM,"Black Leather Men's Belt (5260603-L), black-brushed gold, large",Puma,0,0,0,939,3.7,7,45,,1,7
330,B09LYQVVTN,"Belt for Women, Braided belt for women jeans, Boho Belt with Wooden Style Buckle",Electomania,0,0,0,379,4.0,2,62,,0,2
331,B01N4Q416V,Men's Belt (susbow120_Multi-Coloured_Free Size),WHOLESOME DEAL,0,0,0,325,4.1,731,54,,0,731
332,B08Y6N3HL6,Women's Artificial PU Leather Belt Pack of 1 (Dark Brown),SATYAM KRAFT,0,0,0,222,3.9,234,82,,0,234
333,B08THBYRBG,"AX-5303 Men's Faux Leather Autolock Buckle Belt (Black, Free Size)",Zacharias,0,0,0,499,3.7,50,50,,1,50
334,B09HZKS8GF,"1 Pcs Twist Shape Women Stretchy Metal Belt for Dresses (Gold, 1 Piece)",SATYAM KRAFT,0,0,0,259,4.0,2,78,,0,2
335,B07R397S2V,1 Pcs Women's Metal Stretchable Bow Design kanduro-Belt (Golden),SATYAM KRAFT,0,0,0,259,4.2,352,78,,0,352
336,B08CF61943,Men's Leather Belt (TH/WILLAMETTENREV01XLCR_Black_X-Large),Tommy Hilfiger,0,0,0,"2,199",3.9,10,0,,1,10
337,B012RMDUKA,Polyester Unisex Belt,Puma,0,0,0,493,4.0,1,62,,0,1
338,B09KHFMD8X,Men's Genuine Leather Pin Buckle Belt,CONTACTS,0,0,0,749,4.2,22,58,,1,22
339,B09FXZTFN3,Golden Handembroidered Cloth Waist Saree/Lehenga Belt and Kamarbandh for Women,Duchess,0,0,0,"1,199",4.4,9,45,,0,9
340,B08VR9XHV4,"Stretchable braided cotton belt for women,Men, ladies belt,Black,and Brown, color Combo of 2 pcs(Stretch Belt-019)",Veteran,0,0,0,335,3.8,93,58,,1,93
341,B08YKC219S,Women Belt,Duchess,0,0,0,498,3.8,29,75,,0,29
342,B07N12DXTH,"Men's Tactical Nylon Military Style Webbing Belt with Metal Buckle (Blue, Free Size)",ZORO,0,0,0,379,3.8,90,75,,0,90
343,B08HWZ8T8P,Safety Security Reflective Adjustable Vest Belt Gear Stripe Night Running,C (DEVICE),0,0,0,145,4.3,72,85,,0,72
344,B084DTFFKR,Men's Synthetic Belt,Peter England,0,0,0,765,3.9,6,36,,1,6
345,B00PW3KX8O,Chocolate Brown Leather Men's Belt,Puma,0,0,0,"1,038",3.5,22,62,,1,22
346,B08W58R4Y7,Snabs Belt For Men Stretchable Braided Belt For Jeans and Trousers,Generic,0,0,0,279,4.0,4,44,,0,4
347,B08F39ZQGG,Men's leather Formal Non Reversible Belt,Amazon Brand - Symbol,0,0,0,449,3.7,162,68,,0,162
348,B09815TRF9,Cotton Belt For Women's & Girls | Belt For Jeans | Casual & Formal Belt For Ladies | Combo of Two Belt ( Black & Blue) Colour.,Delight Belts,0,0,0,249,4.4,35,69,,1,35
349,B098P762M1,Delight Stretchable Belt For Men & Women's.Belt For Jeans.,Delight Belts,0,0,0,249,3.8,16,72,,1,16
350,B079L7Z1M9,Women's Belt,Lino Perros,0,0,0,359,4.2,12,27,,0,12
351,B074RMK9SS,Men Belt,CREATURE,0,0,0,589,3.9,385,71,,1,385
352,B09HCHBCCK,Women Slim Leather Belts Ladies Girls Faux Leather Jeans Skirt Belt with Double O-Ring Buckle,bilAnca,0,0,0,235,3.3,16,48,,1,16
353,B00JYF2JSS,Silver Belt (5260802-S),Puma,0,0,0,692,3.3,4,59,,1,4
354,B08MTPSTH3,"Stretchable braided cotton belt for men and women,flexible unisex belt color Tan (size fits on upto 36 inch of waist.)",UNIQ WORLD,0,0,0,229,4.6,3,69,,0,3
355,B07JL4SV3G,"Boy's PU Leather Belt (Brown and Blue, Free Size) -Combo Pack of 2 upto for kids only 6 year",Boy's,0,0,0,245,3.9,46,59,,1,Forever99
356,B094YK3CLD,Formal/Casual Genuine Leather Belts For Men Tan,GETOREE,1,0,0,440,2.9,3,78,,0,3
357,B07N3T8DQQ,Men's Leather Belt,WildHorn,1,0,0,480,3.4,29,70,,0,29
358,B09NL7SH8S,Casual Tan Color Genuine Leather Belt with Double Prong Buckle for Jeans and Casual Wear belt for men stylish Leather for Men's/Boys ||CSBL-BRBKL-05||,CLUB SPUNKY,1,0,0,499,4.6,4,77,,1,4
359,B08P83GFYX,"Leather Belts For Men - With Pin Point Buckle - Full Grain Leather Mens Belt - Best for Jeans, Trousers, Casual ,Cowboy & Work Wear -Waist Fit, 40mm Wide",SKENZBI,1,0,0,599,4.1,78,40,,1,78
360,B08Z1L47CW,"Explorer Tactical Activity Belts (Black, Nylon)",Cougar Motorsport,1,0,0,699,4.3,5,22,,1,5
361,B08Z1L2BP9,"Explorer Tactical Activity Belts (Green, Nylon)",Cougar Motorsport,1,0,0,699,3.4,2,22,,1,2
362,B09QPJRK31,"Men's Imported Leather Belts With Textured Print, For Casual and Formal Wear.",Cavaldii ITALIA,1,0,0,499,5.0,2,80,,1,2
363,B08THG3M36,Men's Faux Leather Belt Autolock Buckle AX-5310 (Black; Free Size),Zacharias,1,0,0,499,3.5,36,50,,1,36
364,B07KCYRQP3,Women Belt Stylish Bow Buckel Elastic Embellished Waist Belt Decorative Stretch Waist Band (White),Futurekart,0,0,0,379,4.1,271,37,,1,271
365,B07YG51312,Unisex Nylon & Canvas Waist Belt (BLT063_03_Beige & Black),EDIFIER,0,0,0,319,4.1,134,68,,0,134
366,B07TJ6CGXQ,Leatherette Womens Belt,Lino Perros,0,0,0,359,5.0,5,24,,0,5
367,B08CMS4PPV,Men's PU Leather Belt,ZORO,0,0,0,524,4.1,31,71,,1,31
368,B08PKLLT7C,Men's/Women's Stretchable Braided Cotton Belt Combo of 2 Pieces (Tan and Black),Veteran,0,0,0,299,3.8,249,67,,1,249
369,B095PJD1JV,"Waist Belt for Women for Jeans Buckle Free Adjustable ，Belts for Women Dresses,Elastic Belt Women for Jeans Stylish,Ladies Belt for Girls,1 Pc Black Stripe",Eastern eagle,0,0,0,388,4.0,39,61,,0,39
370,B08P64STRJ,"Men's Italian Leather Reversible Black & Brown Belt & Rotate Buckle Gift Box (Vx06, Black, 40)",Vincent xavier,0,0,0,499,5.0,3,79,,1,3
371,B07LDPTD7B,Belts for Men Reversible Leather 1.25 Waist Strap Fashion Dress Buckle Eliz Luxe - 1 Year Warranty,ELIZ LUXE,0,0,0,399,4.1,539,64,,1,539
372,B07KRCTR16,Men's Combo Pack of Wallet & Belt Gift set,Amicraft,0,0,0,499,3.3,6,72,,1,6
373,B099K71K3M,Men Belt,Peter England,0,0,0,999,4.1,6,0,,1,6
374,B07VYZRQBC,Women's Faux Leather Belt (TAN; Free Size; SQ-004),Zacharias,0,0,0,249,3.8,36,58,,0,36
375,B085TQ7PRN,Unisex Elastic Adjustable Tucker Belt ( Black ),Aferelle,0,0,0,199,3.9,413,75,,1,413
376,B08CL1DW33,"Men's Artificial Leather Belt (Black , 959)",LAER,0,0,0,110,3.1,12,45,,0,12
377,B07YG7TRRQ,Unisex Nylon & Canvas Waist Belt (BLT063_04_Black),EDIFIER,0,0,0,319,4.1,57,68,,0,57
378,B084SZL7NS,Unisex Rubber Belt (CSSP-SHTKR-GRKRP_Black),CLUB SPUNKY,0,0,0,295,3.2,53,80,,1,53
379,B09MKF6RPT,Women's Stretchy Belt,FDSHIP,0,0,0,399,4.4,4,60,,0,4
380,B072PYKF9Z,Reversible Stitched Vegan Leather Belt for Men,SCHARF,1,0,0,347,2.9,15,68,,0,15
381,B094YJSFSZ,Formal/Casual Genuine Leather Belt For Men's Tan,GETOREE,1,0,0,440,4.5,2,78,,0,2
382,B083GYWJ63,Genuine Leather Belt,TEE ESS,1,0,0,374,0,0,69,,0,"₹374
₹1,199 Save ₹825 (69%)"
383,B0919HMVNS,Men's Genuine Leather Auto-Lock Buckle With Reversible Belt,BlacKing,1,0,0,499,4.1,74,74,,1,74
384,B07SK88B5H,Men's Leather Belt,Bacca Bucci,0,0,0,799,4.2,438,60,,1,438
385,B07L68W3NZ,"Men's Combo Pack of Faux Leather Wallet and Belt (Black,Free Size)",Amicraft,0,0,0,449,3.4,19,75,,0,19
386,B09MTYW73W,Genuine Leather Men's Black Wallet & Black Belt Gift Combo |GS502_8001_BLK,HAMMONDS FLYCATCHER,1,0,0,884,4.6,3,71,,1,3
387,B08THF6JPF,Men's Faux Leather Belt Autolock Buckle AX-53 (Black; Free Size),Zacharias,1,0,0,499,3.1,6,50,,1,6
388,B08MQFYFPK,Men's Faux Leather Belt Autolock Buckle (Black BB-05S),Zacharias,1,0,0,375,4.4,6,62,,1,6
389,B08F3BNWV6,Men's leather Formal Non Reversible Belt,Amazon Brand - Symbol,1,0,0,449,3.7,162,68,,0,162
