,asin,title,brand,Sponsored,Best Seller,Amazon's Choice,Price,Rating,NoofRatings,Discount,Delivery,Prime Delivery,base
242,B08L8P6V7H,Corsair HS60 Haptic Wired Over Ear Headset with Mic (Arctic Camo),Corsair,1,0,0,"11,999",4.0,14,37,"Tuesday, February 15",1,14
243,B07Z8WQZVK,"Corsair HS50 PRO Wired Stereo Gaming Headset Adjustable Memory Foam Ear Cups, Lightweight, Noise-Cancelling Detachable Microphone with PC, PS4, Xbox One, Switch and Mobile Compatibility (Blue)",Corsair,1,0,0,"4,799",4.2,"1,850",30,"Tuesday, February 15",1,"1,850"
244,B08WHPG3N8,"AirSound Alpha-5 Stereo Gaming Headset for Noise Cancelling Over-Ear Headphones with Mic, RBG LED, Bass Surround, Soft Memory Earmuffs for All Laptop",AirSound,0,0,0,"1,099",3.0,18,45,"Sunday, February 13",1,18
245,B07VNRMZJ8,Nx120s Stereo Headset With Foldable Microphone,Nx120s,0,0,0,699,3.6,274,0,"Sunday, February 13",1,Nx120s
246,B09J2LCHP1,"Gaming Headset with Mic for PS5, PS4, Xbox, Nintendo Switch and PC, Microware Over-Ear Headphones, Skin-Friendly Earmuffs, Lightweight and Breathable, Multi-Platform, White (TY-0820)",Gaming,0,0,0,"1,499",0,0,57,"Thursday, February 17",1,"₹1,499
₹3,499 Save ₹2,000 (57%)"
247,B09FT7BN55,"ONIKUMA K5 Wired Gaming Headset with Base Sound and True Noise Cancellation, LED Light and 3.5mm Audio Plug, Nintendo New 3DS LL/3DS,Mac OS PC, iOS Device, Android Device, PS4, PS5 Xbox (Black Grey)",ONIKUMA,0,0,0,"1,763",5.0,1,41,"Wednesday, February 16",1,1
248,B07K7XRJTZ,"Cosmic Byte GS410 Headphones with Mic and for PS5, PS4, Xbox One, Laptop, PC, iPhone and Android Phones (Grey)",Cosmic,0,0,0,799,4.1,"18,767",0,"Sunday, February 13",1,"18,767"
249,B07MST9Y5K,"Razer Kraken Multi-Platform Wired Gaming Headset with Cooling Gel-Infused Cushions (Green, RZ04-02830200-R3M1)",Razer,0,0,0,"5,990",4.2,"3,412",25,"Sunday, February 13",1,"3,412"
250,B09JBRFM3R,"Cosmic Byte GS411 Starlight Headset with Flexible Mic for PS4, PS5 Xbox, Laptop, PC, Mobiles (CB Amber)",Cosmic,0,0,0,699,3.5,14,42,"Sunday, February 13",1,14
251,B07Z8WK4PC,Corsair HS45-7.1 Wired Virtual Surround Sound PC Gaming Headset USB DAC Memory Foam Earcups (Black),Corsair,0,0,0,"3,999",4.1,"1,013",43,"Tuesday, February 15",0,"1,013"
252,B08KXXY44S,"Cosmic Byte GS430 Gaming Headphone, 7 Color RGB LED and Microphone for PC, PS5, Xbox, Mobiles, Tablets, Laptops (Red)",Cosmic,1,0,0,799,4.1,"9,110",0,"Sunday, February 13",1,"9,110"
253,B09BNZLTDZ,"pTron Bassbuds Jade Gaming True Wireless Headphone with 40Hrs Total Playtime with Case, Low Latency, Deep Bass, BT5.0, Touch Control, Dual Mic, Passive Noise Cancellation & IPX4 Waterproof (Black)",pTron,1,1,0,"1,499",4.0,"5,023",59,"Sunday, February 13",1,"5,023"
254,B09NDJC3PX,Ant Esports H1100 Pro RGB Wired Over-Ear Gaming Headset for PC / PS4 / PS5 / Xbox One / Switch1 – Carbon Black,Ant,0,0,0,"1,249",3.8,204,69,"Sunday, February 13",1,204
255,B08HP4HCT9,"havit H2011d Breathable Soft Fabric & Memory Foam Wired Gaming Headset with Boom Mic, Red LED Light and 3D Surround Sound (Black)",havit,0,0,0,899,3.4,627,43,"Thursday, February 17",1,627
256,B08HF6THS4,"NiTHO TITAN STEREO GAMING HEADSET, Compatible with PC/PS4/Xbox One/Switch (PC Adapter Included)",NiTHO,0,0,0,993,3.6,84,0,"Sunday, February 13",1,84
257,B08R6H4R93,"(Renewed) CLAW G9X Single Driver Gaming Earphones with Adjustable Boom & in-line Mic, Volume Control, Mute Switch & 3D Stereo Sound for iPhone & Android Phones, Tablets, PC, Laptop, PS4, PS5, Xbox (Camo Grey)",(Renewed),0,0,0,540,3.3,66,35,"Thursday, February 17",1,66
258,B08HYH6RGB,"EKSA E1000 PC RGB Gaming Headset 7.1 Surround Sound, PS4 USB Headset with Mic, Gaming Grade 50mm Drivers, Mic/Volume Control, Soft Earmuffs LED Over-Ear Headphones only for PC/PS4 - (Green)",EKSA,0,0,0,"2,499",4.4,32,32,"Sunday, February 13",1,32
259,B089V5GTZH,"Onikuma Combatwing M180Pro 7.1 Gaming Headset, Noise Cancelling Over Ear Gaming Headphones with Mic, Compatible with Ps4, Xbox One, Nintendo Switch, Pc, Mac, Laptop",Onikuma,0,0,0,"2,399",4.0,26,73,"Wednesday, February 16",1,26
260,B0951ZRNX4,"MFTEK Gaming Headphone Noise Cancellation and Volume Control Gaming Headset with Mic LED Light Over-Ear Headphone, 3.5mm Wired, 40mm Driver Unit, Double bass, red Colour",MFTEK,0,0,0,"1,549",0,0,48,"Wednesday, February 16",1,"₹1,549
₹2,999 Save ₹1,450 (48%)"
261,B09NHWH4JT,"(Renewed) Redgear Cosmo Spectre Wired Gaming Headphone with 40mm Drivers,7 Color Breathing LEDs, Adjustable Headband, Over-Ear Design with Extra Soft Earmuffs, VOX Tech Mic with 3.5 MM Jack for PC(Black)",(Renewed),0,0,0,699,0,0,30,"Tuesday, February 15",1,"₹699
₹999 Save ₹300 (30%)"
262,B09DZZ16S2,"Cosmic Byte CB-EP-04 Gaming Earphone with Detachable Microphone for PC, PS4, Mobiles, Tablets (Black/Silver)",Cosmic,1,0,0,749,3.9,262,25,"Sunday, February 13",1,262
263,B09RSVGVB9,NYX FOLD Wireless Headphone Gaming Sound Headphone with Big Battery,NYX,1,0,0,"1,599",0,0,60,"Friday, February 11",0,"₹1,599
₹3,999 Save ₹2,400 (60%)"
264,B07Y8J794K,Cosmic Byte G1500 7.1 Channel USB Headset for PC with RGB LED Lights and Vibration (Black/Blue),Cosmic,1,0,0,"1,399",4.1,"1,429",0,"Sunday, February 13",1,"1,429"
265,B07Z8WS5JV,"Corsair Void Elite Surround Gaming Headset (7.1 Surround Sound, Optimised Omnidirection Microphone with PC, PS4, Xbox One, Switch and Mobile Compatibility) Red (CA-9011206-AP)",Corsair,1,0,0,"7,899",3.8,97,34,"Sunday, February 13",1,97
266,B09NHWH4JT,"(Renewed) Redgear Cosmo Spectre Wired Gaming Headphone with 40mm Drivers,7 Color Breathing LEDs, Adjustable Headband, Over-Ear Design with Extra Soft Earmuffs, VOX Tech Mic with 3.5 MM Jack for PC(Black)",(Renewed),0,0,0,699,0,0,30,"Tuesday, February 15",1,"₹699
₹999 Save ₹300 (30%)"
267,B097Y3S66F,"EKSA E3 Mobile Headphones Virtual 7.1 Surround Gaming Headphones-3.5mm for Switch, Computer Headset with Detachable Noise Cancelling Mic, Ultra Lightweight Comfortable USB Gaming Headset for Mobile, PC, PS4/PS5, Xbox One, Laptop (Red)",EKSA,0,0,0,"1,799",4.1,"2,687",40,"Wednesday, February 16",1,"2,687"
268,B0799MN5TB,"Mengshen Wired Gaming Headset for PS4/ Xbox one/Xbox One S/PC/Mac/Laptop/Cell Phone - Gaming Headphone with Mic, LED Light, Bass Surround, Noise Cancelling, Soft Earmuffs, Red",Mengshen,0,0,0,0,4.3,247,0,,0,247
269,B08R6H4R93,"(Renewed) CLAW G9X Single Driver Gaming Earphones with Adjustable Boom & in-line Mic, Volume Control, Mute Switch & 3D Stereo Sound for iPhone & Android Phones, Tablets, PC, Laptop, PS4, PS5, Xbox (Camo Grey)",(Renewed),0,0,0,540,3.3,66,35,"Thursday, February 17",1,66
270,B0916V78T4,"Gaming Headset Xbox One Headset with Stereo Surround Sound,PS4 Gaming Headset with Mic & LED Light Noise Cancelling Over Ear Headphones Compatible with PC, PS4, PS5,Xbox One Controller",Gaming,0,0,0,"1,899",3.9,39,27,"Wednesday, February 16",1,39
271,B08WH9QL6Y,"AirSound Alpha-4 Stereo Gaming Headset for Noise Cancelling Over-Ear Headphones| Adjustable Mic, Bass Surround, Soft Memory Earmuffs for All Laptop",AirSound,0,0,0,799,3.2,30,60,"Sunday, February 13",1,30
272,B07ZNR3BMB,"ASUS TUF H3 Gaming Headset (Gun Metal), TeamSpeak Certified |7.1 Surround Sound | Gaming Headphones with Boom Microphone for PC, Playstation 4, Nintendo Switch, Xbox One, Mobile Devices",ASUS,0,0,0,"3,950",4.5,357,17,"Wednesday, February 16",1,357
273,B09RWWJST4,"MFTEK Gaming Headset and Gaming Mouse Combo, Pro Gaming Headset for PC, Laptop, Mobile with Mic, LED, Over-Ear Headphone, 3.5mm Wired Ergonomic Headphone with USB Gaming Mouse - Blue Color",MFTEK,0,0,0,"1,899",0,0,46,"Wednesday, February 16",1,"₹1,899
₹3,499 Save ₹1,600 (46%)"
274,B00Z924M58,Kotion Each Wired Over the Ear Headsets with Mic & LED - G2000 Edition (Black/Blue),Kotion,1,0,0,"1,199",4.0,"3,351",0,"Sunday, February 13",1,PEGI Rating: Ages 7 and Over
275,B07K6LWNFG,"EKSA E800 Wired Over Ear Gaming Headphones with Noise Cancelling Mic, 50mm Drivers & LED Light for PC, Mobile, Tablets, Laptop, PS4, PS5, Xbox One, Nintendo Switch, VR(Yellow)",EKSA,1,0,0,"1,599",4.1,"7,397",0,"Thursday, February 17",1,"7,397"
276,B08F4GRXR4,"Cyclotronix G8002 Black Stereo Gaming Headset for PS4, PS5, PC, Xbox One Controller, Noise Cancelling Over Ear Headphones with Mic, Bass Surround, Soft, Comfortable, Flexible, Light Weight!",Cyclotronix,0,0,0,"2,299",4.5,2,72,"Wednesday, February 16",1,2
277,B07NPGKX62,"XPG EMIX H20 Wired Virtual 7.1 Surround Sound 50mm Drivers RGB Gaming Headset with Adjustable Microphone (Red, Black)",XPG,0,0,0,"2,999",2.6,23,47,"Wednesday, February 16",1,23
278,B07G2D87BV,Nacon official Sony licensed gaming headset for PS4 and PC,Nacon,0,0,0,"1,746",3.9,380,0,"Sunday, February 13",1,USK Rating: No age limitation
279,B098F783NL,"Nitho TITAN PRO 7.1 USB Surround Gaming Headset with Build-in Soundcard, Noise Cancelling Mic & RGB LED Light, Compatible with PC, Laptop, PS4, PS5",Nitho,0,0,0,"2,132",0,0,0,"Tuesday, February 15",1,Windows
280,B0799LSVQ4,"Mengshen Gaming Wired Headset for PS4/ Xbox one/Xbox One S/PC/Mac/Laptop/Cell Phone - Gaming Headphone with Mic, LED Light, Bass Surround, Noise Cancelling, Soft Earmuffs, Blue",Mengshen,0,0,0,0,4.4,346,0,,0,346
281,B01F5ZNQUU,Kotion Each: Over The Ear Wired Headsets With Mic & Led - G9000 Edition For Pc/ Ipad/ Iphone/ Tablets/ Mobile Phones (Black/Blue),Kotion,0,0,0,"1,156",4.1,822,0,"Sunday, February 13",1,PEGI Rating: Ages 12 and Over
282,B08HF6THS4,"NiTHO TITAN STEREO GAMING HEADSET, Compatible with PC/PS4/Xbox One/Switch (PC Adapter Included)",NiTHO,0,0,0,993,3.6,84,0,"Sunday, February 13",1,84
283,B09PG8VJZX,"Auxigen Bassbuds Jade True Wireless Gaming Headphone with 40Hrs Total Playtime with Case, Low Latency, Deep Bass, BT5.0, Touch Control, Dual Mic, Pass,Perfect Valentine Gift (Black)",Auxigen,0,0,0,"1,199",4.2,13,60,"Thursday, February 17",1,13
284,B07QB2Y272,"Logitech G431 Wired Gaming Headset, 7.1 Surround Sound, DTS Headphone:X 2.0, 50 mm Audio Drivers, USB and 3.5 mm Audio Jack, Flip-to-Mute Mic, Lightweight, PC/Mac/Xbox One/PS4/Nintendo Switch - Black",Logitech,1,0,0,"6,495",4.0,194,19,"Sunday, February 13",1,194
285,B08G1GHJ2X,"Cosmic Byte Stardust Headset with Flexible Mic for PS4, Xbox One, Laptop, PC, iPhone and Android Phones (Black/Blue)",Cosmic,1,0,0,699,4.0,"4,248",39,"Tuesday, February 15",1,"4,248"
286,B07WMPW27R,"Brainwavz BigJ Headphone Stand (2 Pack) Under Desk Hanger for Headphones, Gaming Headsets, Mobiles Accessories, Stick On, No Screws, Black",Brainwavz,1,0,0,699,4.6,449,30,"Wednesday, February 16",1,449
287,B07Z8WTTC3,"Corsair HS50 PRO Stereo Wired Gaming Headset Adjustable Memory Foam Ear Cups, Lightweight, Noise-Cancelling Detachable Microphone with PC, PS4, Xbox One, Switch and Mobile Compatibility (Carbon)",Corsair,1,0,0,"4,799",4.2,"1,850",30,"Sunday, February 13",1,"1,850"
288,B09FXNZ28K,"Ant Esports H580 Pro LED Gaming Headset for PC / PS5 / PS4 / Xbox One, Nintendo Switch, Computer and Mobile – Black",Ant,0,0,0,949,3.8,204,55,"Sunday, February 13",1,204
289,B07NQX1J99,Turtle Beach Recon 70P Gaming Headset - Black/Blue (Multi),Turtle,0,0,0,"2,299",4.4,"12,543",0,"Wednesday, February 16",1,"12,543"
290,B08NRWTNQR,Cosmic Byte H11 Gaming Headset with Microphone (Black/Blue)&Cosmic Byte H11 Gaming Headset with Microphone (Black/Orange),Cosmic,0,0,0,"1,598",2.8,3,27,,1,3
291,B08HDLQQ99,"JBL Quantum 50 by Harman Wired in-Ear Gaming Headphone with Twist Lock Technology, Inline Voice Focus Microphone and Master Volume Slider (White)",JBL,0,0,0,"1,299",3.7,"1,999",48,"Sunday, February 13",1,"1,999"
292,B09KQFTM5C,(Renewed) Cosmic Byte Titania RGB Gaming Headset with Flexible Microphone with Separate Audio and Mic Jack (Black),(Renewed),0,0,0,554,0,0,27,"Sunday, February 13",1,"₹554
₹764 Save ₹210 (27%)"
293,B0881TS5QH,(Renewed) Razer Thresher – Wireless and Wired Gaming Headset for PS4™ - RZ04-02580100-R3G1,(Renewed),0,0,0,"5,999",0,0,54,"Saturday, February 19",1,"₹5,999
₹13,239 Save ₹7,240 (54%)"
294,B09MSLXXG6,"MFTEK RGB Gaming Headphones with Mic and Gaming Mouse Combo, Pro Gaming Headset for PC Laptop Pung Mobile Game LED, Lightweight, Durable and DPI Upto 2000 3.5mm Wired Ergonomic USB Gaming Mouse (blue)",MFTEK,0,0,0,"1,899",0,0,14,"Wednesday, February 16",1,"₹1,899
₹2,199 Save ₹300 (14%)"
295,B09QSZC6VJ,"PunnkFunnk A20 Gaming Headset, PC Gaming Headphone with Mic, RGB Headset with LED Light Wired Headphone for Nintendo Switch PS4 Xbox One PC Computer",PunnkFunnk,0,0,0,"1,499",0,0,70,"Wednesday, February 16",1,"₹1,499
₹4,999 Save ₹3,500 (70%)"
296,B08FMDLNXT,"Cosmic Byte GS430 Gaming Headphone, 7 Color RGB LED and Microphone for PC, PS5, Xbox, Mobiles, Tablets, Laptops (Camo Black)",Cosmic,1,0,0,949,4.1,"9,110",0,"Sunday, February 13",1,"9,110"
297,B0741F2R51,"Cosmic Byte Over the Ear Wired Headsets with Mic & LED - G4000 Edition (Blue, Pack Of 1)",Cosmic,1,0,0,860,4.0,"6,157",28,"Sunday, February 13",1,"6,157"
298,B091Z79MCS,"RPM Euro Games Gaming Headphones with Adjustable Mic | Surround Sound | Works with All Mobile Phones, PS5, PS4, Xbox One | Red | Wired",RPM,0,0,0,699,3.7,272,65,"Sunday, February 13",1,272
299,B08YZ9NMB5,"EPOS H3 Closed Acoustic Gaming Headset with Noise-Cancelling Microphone - Plug & Play Audio - Around The Ear - Adjustable, Ergonomic - for PC, Mac, PS4, PS5, Switch, Xbox - Onyx Black",EPOS,0,0,0,"4,870",3.9,40,51,"Sunday, February 13",1,40
300,B07B7KQMVK,"Cosmic Byte GS420 Headphones with Mic, RGB LED lights and Audio Splitter for PS4, Xbox One, Laptop, PC, iPhone and Android Phones (Black/Blue)",Cosmic,0,0,0,849,4.1,833,0,"Thursday, February 17",1,833
301,B08ZS9KW49,"(Renewed) AirSound A100 Gaming Earphone with Dual Mic, 3D Stereo Sound for iPhone & Android Phones, MacBook, Tablets, PC, Laptop",(Renewed),0,0,0,525,2.9,8,30,"Sunday, February 13",1,8
302,B07WFGXY67,"Nitho ATLAS STEREO GAMING HEADSET 7.1 SURROUND SOUND, Compatible with PC/PS4/Xbox One/Switch (USB Adapter Included)",Nitho,0,0,0,799,3.8,34,0,"Thursday, February 17",0,34
303,B09RWWLZBV,"MFTEK LED Gaming Headphone with mic, Pro Gaming Headset, Noise Cancellation, Microphone Headset, Wired Headphone- Blue",MFTEK,0,0,0,"1,549",0,0,48,"Wednesday, February 16",1,"₹1,549
₹2,999 Save ₹1,450 (48%)"
304,B082X8LLP7,"Alienware Wired Stereo Gaming Headset 310H, AW310H",Alienware,0,0,0,0,3.8,185,0,,0,185
305,B09HSHXYCR,Xbox Wireless Headset,Xbox,0,0,0,"8,990",4.6,11,0,"Friday, February 18",0,11
306,B09JBSSJTG,"Cosmic Byte GS411 Starlight Headset with Flexible Mic for PS4, PS5 Xbox, Laptop, PC, Mobiles (Royal Blue)",Cosmic,1,0,0,699,3.5,14,42,"Sunday, February 13",1,14
307,B0982FSGDG,"Cosmic Byte Equinox Ceres 7.1 Surround RGB USB Gaming Headset for PC, PS4, PS5 (Black/Silver)",Cosmic,1,0,0,"1,899",3.0,11,0,"Tuesday, February 15",1,11
308,B07GB8SBLZ,"Cosmic Byte G3300 Saturn Rings Gaming Headphone with Mic, 7 Color RGB LED (Blue)",Cosmic,1,0,0,"1,171",4.1,301,0,"Sunday, February 13",1,301
309,B07K7YR8SP,"Cosmic Byte GS410 Wired Over-Ear Headphones with mic and for PS5, PS4, Xbox One, Laptop, PC, iPhone and Android Phones (Black/Green)",Cosmic,1,0,0,799,4.1,"18,767",0,"Tuesday, February 15",1,"18,767"
310,B09GR9WTJW,"(Renewed) Cosmic Byte Oberon 7.1 RGB Gaming Headset with Dual Input- USB and 3.5mm Jack, Detachable Microphone, 90° Rotatable Earcups (Black)",(Renewed),0,0,0,"1,049",3.4,27,30,"Tuesday, February 15",1,27
311,B07DWH2J25,Rapoo VH150 Gaming Headset USB Surround Sound Breathing LED Backlight Headphone with Microphone for Gamer,Rapoo,0,0,0,"2,599",3.8,130,13,"Monday, February 14",0,130
312,B09FDJLNQF,CHIPTRONEX Breeze X USB Wired RGB Gaming Headphone with Microphone for PC,CHIPTRONEX,0,0,0,"1,299",0,0,57,"Tuesday, February 15",1,"₹1,299
99
₹2,999 Save ₹1,699.01 (57%)"
313,B08NRMDXCL,"Cosmic Byte GS410 Headphones with Mic and for PS4, Xbox One, Laptop, PC, iPhone and Android Phones (&Cosmic Byte GS410 Headphones with Mic and for PS4, Xbox One, Laptop, PC, iPhone and Android Phones",Cosmic,0,0,0,"1,698",0,0,34,,1,"₹1,698
₹2,598 Save ₹900 (34%)"
314,B084MK7YDF,(Renewed) Cosmic Byte Wired Spider Gaming Headphone with Microphone and LED for PC/PS4/Xbox/Mobiles/Tablets (Red),(Renewed),0,0,0,769,4.2,26,32,"Sunday, February 20",1,26
315,B09M77RX6X,"(Renewed) Cosmic Byte H3 Gaming Headphone with Mic for PC, Laptops, Mobiles, PS4, Xbox One (Camo Black)",(Renewed),0,0,0,"1,199",5.0,2,8,"Thursday, February 17",1,2
316,B091S9PMTG,Redgear Cloak RGB Gaming Wired Headset with A-15 RGB Gaming Mouse,Redgear,0,0,0,"1,598",4.1,"9,248",38,,1,"9,248"
317,B09QGHJYZG,"(Renewed) Wings Viper Gaming with 65 ms Latency Bluetooth Gaming Headset (Black, True Wireless)",(Renewed),0,0,0,"1,999",0,0,60,"Thursday, February 17",0,"₹1,999
₹4,999 Save ₹3,000 (60%)"
318,B09165HHDB,"Cosmic Byte GS430 Gaming Wired Over Ear Headphone with mic, 7 Color RGB LED and Microphone for PC, PS5, Xbox, Mobiles, Tablets, Laptops (Grey)",Cosmic,1,0,0,799,4.1,"9,110",0,"Sunday, February 13",1,"9,110"
319,B09RWX6K8V,"MFTEK Gaming Headphone Noise Cancellation and Volume Control Gaming Headset with Mic LED Light Over-Ear Headphone, 3.5mm Wired, 40mm Driver Unit, Double bass- Blue",MFTEK,1,0,0,"1,549",0,0,48,"Wednesday, February 16",1,"₹1,549
₹2,999 Save ₹1,450 (48%)"
320,B07GB87G3T,"Cosmic Byte H3 Gaming Wired over ear Headphone With Mic For Pc, Laptops, Mobiles, Ps4, Xbox One (Blue)",Cosmic,0,0,0,"1,227",4.0,"1,605",28,"Tuesday, February 15",1,"1,605"
321,B07VDHNVTG,Corsair HS35 Stereo Gaming Headset - Headphones Designed for PC and Mobile – Red,Corsair,0,0,0,"2,920",4.1,"1,013",49,"Sunday, February 13",1,"1,013"
322,B09BJYRVYQ,"ROG Strix Go Core Moonlight White gaming headset delivers immersive gaming audio and incredible comfort, and supports PC, Mac, mobile phones, PlayStation® 5, Xbox® Series X and S, and Nintendo Switch™",ROG,0,0,0,"7,990",5.0,1,20,"Monday, February 14",1,1
323,B00LIW8I2Q,SteelSeries The SIMs 4 51161 Gaming Headset,SteelSeries,0,0,0,"1,899",3.9,859,5,"Tuesday, February 15",1,859
324,B08JYW73G1,"Donerton Gaming Headset, Over-Ear Gaming Headphones with Noise Canceling Mic, Stereo Bass Surround Sound, LED Light, Soft Memory Earmuffs PS4 Gaming Headset Compatible with PC, Laptop,Tablet",Donerton,0,0,0,"2,988",4.3,353,35,"Wednesday, February 16",1,353
325,B09P1NM5VY,,,0,0,0,0,0,0,0,,0,
326,B09PN7BLM2,"Rivano (Pack of 2) Wired Headphones Original Earphone with Mic, Super bass Ear phone's for All Android and iOS Devices, headsets for Laptop, Gaming, handsfree/Leed for Girls.(White, Combo)",Rivano,0,0,0,649,0,0,57,"Thursday, February 17",0,"₹649
₹1,499 Save ₹850 (57%)"
327,B09MJ3Y29W,"BENCO Air1 Bluetooth TWS Earbuds, Gaming Earbuds with Bluetooth 5.1, Dedicated Gaming Mode,Less Than 60ms Latency and 12mm Drivers, with mic and Voice Assistant",BENCO,0,0,0,999,2.6,52,72,"Wednesday, February 16",1,52
328,B09RWXRYSG,"MFTEK Gaming Headphone Noise Cancellation and Volume Control Gaming Headset with Mic LED Light Over-Ear Headphone, 3.5mm Wired, 40mm Driver Unit, Double bass- RED",MFTEK,1,0,0,"1,549",0,0,48,"Wednesday, February 16",1,"₹1,549
₹2,999 Save ₹1,450 (48%)"
329,B0982GF5TP,"Cosmic Byte Equinox Orion 7.1 Surround RGB USB Gaming Headset for PC, PS4, PS5 (Black)",Cosmic,1,0,0,"2,038",4.1,23,0,"Tuesday, February 15",1,23
330,B08ZL32FJ3,"Cosmic Byte G2050 RGB 7.1 Surround Sound USB Gaming Headphone for PS5, PC with Software and Gel Microphone (Blue)",Cosmic,1,0,0,"1,899",4.0,243,0,"Thursday, February 17",1,243
331,B07LBM7ML1,"Creative Sound BlasterX H6 RGB Lighting USB Wired Gaming Headset with 7.1 Virtual Surround Sound and Memory Foam Fabric Earpads for PS4, Xbox One, Nintendo Switch, PC (Black)",Creative,1,0,0,"7,091",4.1,470,36,"Sunday, February 13",1,470
332,B087QVCHV5,HP X1000 Wireless Gaming Headset with 7.1 Surround Sound and Flexible Boom Microphone,HP,0,0,0,"5,900",3.6,6,41,"Sunday, February 20",1,6
333,B07VMS65WX,"Logitech G PRO X Gaming-Headset, Over-Ear Headphones with Blue VO!CE Mic, DTS Headphone:X 7.1, 50mm PRO-G Drivers, 7.1 Surround Sound for Esports Gaming, PC/PS/Xbox/VR/Nintendo Switch - Black",Logitech,0,0,0,"14,995",4.4,326,6,"Sunday, February 13",1,326
334,B08BJDXMN6,"Cosmic Byte Blazar Wired Over-Ear Headphone with Mic for PC, Mobiles, PS5, PS4, Xbox One, Tablets (Red)",Cosmic,0,0,0,799,4.0,"3,777",0,"Tuesday, February 15",1,"3,777"
335,B0896WVPZR,"SADES SA936 Gaming Headset for Xbox One, PS4, PC Gaming Headset Over Ear Headphones with Mic Light Weight Design Volume Control (Black&Blue)",SADES,0,0,0,"3,999",4.2,65,33,"Wednesday, February 16",1,65
336,B084873G49,Turtle Beach Recon 70 Gaming Headset - Silver (Multi),Turtle,0,0,0,"3,198",4.0,1,0,"Sunday, February 13",1,1
337,B097K79B7B,"XO GE-02 Flexible Wired Headset Gaming Headphone with Mic, Powerful Bass, RGB Lights,50mm Drivers,3.5mm Audio & Microphone Jack Compatible with iPad, PC, Laptop, Xbox One Controller, Switch - Black",XO,0,0,0,"1,239",5.0,1,58,"Tuesday, February 15",1,1
338,B081D8TPZZ,HyperX Cloud Alpha S Wired Gaming Headset 7.1 Surround Sound Bass Adjustment Slider - Black (HX-HSCAS-BK/WW),HyperX,0,0,0,"11,000",4.3,"8,965",23,"Tuesday, February 15",1,"8,965"
339,B09QX7CNR8,Thomas Way Gaming Headset in Ear (HD-12),Thomas,0,0,0,999,0,0,0,"Sunday, February 20",1,₹999
340,B07B7LGL1L,Cosmic Byte Over the Ear Headphone with Mic & LED - G4000 Edition (Red),Cosmic,1,0,0,876,4.0,"6,157",27,"Sunday, February 13",1,"6,157"
341,B09MWMK485,truke Buds BTG3 True Wireless Earbuds with AI-Powered Noise Cancellation | Auto Play/Pause | 55ms Low Latency | Gaming Core Chipset | 48hrs Playtime | Gaming Characterized Design| Bluetooth 5.1 | IPX4,truke,1,0,0,"1,299",4.1,406,57,"Tuesday, February 15",1,406
342,B09F6TK51Z,"(Renewed) AirSound Alpha-7 Stereo Gaming Headset for Noise Cancelling Over-Ear Headphones with Mic, Neon LED, Bass Surround, Soft Memory Earmuffs for All Laptop",(Renewed),0,0,0,699,0,0,30,"Tuesday, February 15",1,"₹699
₹999 Save ₹300 (30%)"
343,B07ZMBWHHX,"SteelSeries Arctis 1 Wireless Gaming Headset – USB-C Wireless – Detachable ClearCast Microphone – PC, Playstation 5 & 4, Mobile Gaming | 20+ Hour Battery Life | Lossless 2.4GHz Wireless",SteelSeries,0,0,0,"11,999",4.3,"6,030",40,"Tuesday, February 15",1,"6,030"
344,B09M1N5VYC,"ASUS TUF Gaming H1 Wired Headset | Discord Certified Mic, 7.1 Surround Sound, 40mm Drivers, 3.5mm, Lightweight, for PC, Switch, PS4, PS5, Xbox One, Xbox Series X | S, and Mobile Devices – Black",ASUS,0,0,0,"3,699",0,0,27,"Wednesday, February 16",1,"₹3,699
₹5,077 Save ₹1,378 (27%)"
345,B07GFW7GYX,"SteelSeries Arctis 7 Lossless 2.4GHz Wireless Gaming Headset with DTS Headphone:X v2.0 Surround for PC, Playstation 5, Playstation 4 | 24 Hour Battery Life | Discord-Certified ClearCast Mic - White",SteelSeries,0,0,0,"15,999",4.5,"12,833",32,"Sunday, February 13",1,"12,833"
346,B07HYXPMSY,(Renewed) Acer Predator Gaming Headset,(Renewed),0,0,0,"1,999",5.0,1,80,"Sunday, February 20",1,1
347,B09CTNX5VS,"PSS Gaming Headset Xbox One Headset with Stereo Surround Sound,PS4 Gaming Headset with Mic & LED Light Noise Cancelling Over Ear Headphones Compatible with PC, PS4,PS5, Xbox One,Mac",PSS,0,0,0,"1,299",0,0,68,"Wednesday, February 16",1,"₹1,299
₹3,999 Save ₹2,700 (68%)"
348,B07WLRDKS1,(Renewed) Logitech G431 7.1 Surround Sound Gaming Headset with DTS Headphone (Black),(Renewed),0,0,0,"4,196",3.5,6,35,"Sunday, February 13",1,6
349,B0865YFT7F,"Cosmic Byte GS410 Headphones with Mic and for PS5, PS4, Xbox One, Laptop, PC, iPhone and Android Phones (Camo Black)",Cosmic,0,0,0,849,4.1,"18,767",0,"Tuesday, February 15",1,"18,767"
350,B08TCB84ZX,"Zebronics Zeb-Rush Premium Gaming Headphone with 40mm Neodymium Drivers, RGB LED, Dual 3.5mm Jack, Single pin Converter, 2m Braided Cable, Padded Headband, Flexible mic and Soft Ear Cushions (Red)",Zebronics,1,0,0,999,3.5,"1,309",60,"Tuesday, February 15",1,"1,309"
351,B07VMS65WX,"Logitech G PRO X Gaming-Headset, Over-Ear Headphones with Blue VO!CE Mic, DTS Headphone:X 7.1, 50mm PRO-G Drivers, 7.1 Surround Sound for Esports Gaming, PC/PS/Xbox/VR/Nintendo Switch - Black",Logitech,1,0,0,"14,995",4.4,326,6,"Sunday, February 13",1,326
352,B09NDJC3PX,Ant Esports H1100 Pro RGB Wired Over-Ear Gaming Headset for PC / PS4 / PS5 / Xbox One / Switch1 – Carbon Black,Ant,1,0,0,"1,249",3.8,204,69,"Sunday, February 13",1,204
353,B09MWM3TS3,truke Buds BTG3 True Wireless Earbuds with AI-Powered Noise Cancellation | Auto Play/Pause | 55ms Low Latency | Gaming Core Chipset | 48hrs Playtime | Gaming Characterized Design| Bluetooth 5.1 | IPX4,truke,1,0,0,"1,299",4.1,406,57,"Sunday, February 13",1,406
354,B09JBR9WB7,"Cosmic Byte GS411 Starlight Headset with Flexible Mic for PS4, PS5 Xbox, Laptop, PC, Mobiles (Jazzy Red)",Cosmic,0,0,0,603,3.5,14,50,"Sunday, February 13",1,14
355,B097TLRHJ4,"X33 PUBG Over Ear Wired Gaming Headset with Adjustable Boom Mic, Volume Control",X33,0,0,0,799,0,0,50,"Sunday, February 20",0,X33
356,B09QKXK48P,"Auxigen Bassbuds Jade True Wireless Gaming Headphone with 40Hrs Total Playtime with Case, Low Latency, Deep Bass, BT5.0, Touch Control, Dual Mic, Passive Noise Cancellation & IPX4 Waterproof(White)",Auxigen,0,0,0,"1,199",4.2,13,60,"Thursday, February 17",1,13
357,B09JZ7WM6N,TOP Selling P-47 Gaming Headphone 3D Game Sound Effects Wired 360° Stereo Surround Gaming Headset with Mic for All Mobile Phone Laptop Desktop TV & All Bluetooth inbuilt Device,TOP,0,0,0,0,4.0,2,0,,0,2
358,B08HMF198J,"NiTHO NX120 GAMING HEADSET, Compatible with PC/PS4/Xbox One/Switch (PC Adapter Included)",NiTHO,0,0,0,"1,099",3.6,274,0,"Sunday, February 13",1,274
359,B09JYNRW6B,JIK Store Handsfree Headset Music with 3.5mm Jack Hi-Fi Gaming Sound Music Wired in-line Mic Best High Sound Quality YR Earphone - White,JIK,0,0,0,239,0,0,52,"Wednesday, February 16",0,"₹239
₹499 Save ₹260 (52%)"
