,asin,title,brand,Sponsored,Best Seller,Amazon's Choice,Price,Rating,NoofRatings,Discount,Delivery,Prime Delivery,base
0,B014SZPFKW,"Duracell Ultra Alkaline 9V Battery, 1 Pc",Duracell,1,0,0,261,4.4,"2,107",5,"Monday, February 21",1,"2,107"
1,B014SZOORC,"Duracell Ultra Alkaline AA Battery, 4 Pieces",Duracell,1,0,0,136,4.5,"3,062",20,"Friday, February 18",1,"3,062"
2,B014SZO90Y,"Duracell Ultra Alkaline AA Battery, 8 Pcs",Duracell,0,0,1,261,4.5,"15,904",11,"Friday, February 18",1,"15,904"
3,B014SZORQA,"Duracell Ultra Alkaline AAA Battery, 4 Pcs",Duracell,0,0,0,130,4.5,"3,445",0,"Friday, February 18",1,"3,445"
4,B014SZOORC,"Duracell Ultra Alkaline AA Battery, 4 Pieces",Duracell,0,0,0,136,4.5,"3,062",20,"Friday, February 18",1,"3,062"
5,B00ZRBWZNW,"Eveready Alkaline Batteries - Red AA, 10 Battery Pack",Eveready,0,0,0,179,4.4,793,11,"Monday, February 28",0,793
6,B08KWK3P8Y,"Duracell Alkaline AA Battery Chhota Power, 2 Pcs",Duracell,0,0,0,49,4.4,48,0,"Tuesday, February 22",1,48
7,B00O869QUC,AmazonBasics AAA Performance Alkaline Non-Rechargeable Batteries (8-Pack) - Appearance May Vary,AmazonBasics,0,0,0,189,4.2,"15,516",36,,0,"15,516"
8,B00BN5SNF0,"ENVIE® (AA10004PLNi-CD) AA Rechargeable Batteries, Low Self Discharge, AA 1000mAh Ni-CD (Pack of 4)",ENVIE®,0,0,0,249,4.0,"19,015",0,"Sunday, February 20",1,"19,015"
9,B08TBKLVWC,Panasonic Gold Plus AA Batteries (10 Count),Panasonic,0,0,0,123,4.3,169,23,"Thursday, February 24",0,169
10,B09N8XJDTC,,,1,0,0,0,0,0,0,,0,
11,B0774D64LT,AmazonBasics 9 Volt Everyday Alkaline Batteries (4-Pack),AmazonBasics,1,0,0,369,4.4,"111,069",39,"Saturday, February 19",1,"111,069"
12,B07JLBCH8L,"AmazonBasics LR44 Alkaline Button Coin Cell Batteries, Pack of 6",AmazonBasics,0,0,0,149,4.1,"16,269",26,"Friday, February 18",1,"16,269"
13,B07QBP8LH3,Panasonic Cr2032 3 Volt Lithium Coin Battery - Pack of 2,Panasonic,0,0,0,100,4.2,"1,401",0,"Saturday, February 19",0,"1,401"
14,B014SZPBM4,"Duracell Ultra Alkaline D Battery, 2 Pcs",Duracell,0,0,0,299,4.4,"1,367",25,"Saturday, February 19",1,"1,367"
15,B003B0048O,"Duracell Rechargeable AAA 750mAh Batteries, 2 Pcs",Duracell,0,0,0,220,4.3,"64,295",0,"Friday, February 18",1,"64,295"
16,B0774LQ8NG,AmazonBasics C Cell Everyday Alkaline Batteries (4-Pack),AmazonBasics,0,0,0,279,4.2,"75,856",44,"Saturday, February 19",1,"75,856"
17,B01DJJVFPC,"Duracell Ultra Alkaline AAA Battery, 8 Pcs",Duracell,0,0,0,320,4.5,"7,620",0,"Friday, February 18",1,"7,620"
18,B014SZPFKW,"Duracell Ultra Alkaline 9V Battery, 1 Pc",Duracell,0,0,0,261,4.4,"2,107",5,"Monday, February 21",1,"2,107"
19,B07Y24GN3H,Energizer Max Alkaline AAA Batteries - Pack of 6,Energizer,0,0,0,175,4.3,"3,827",0,"Saturday, February 19",1,"3,827"
20,B08WBVYBQQ,"Panasonic EVOLTA Alkaline AA Battery, Pack of 8",Panasonic,1,0,0,360,4.4,"2,585",0,"Friday, February 18",1,"2,585"
21,B07JM6YZ2K,AmazonBasics Lithium CR2 3V Batteries - 4-Pack,AmazonBasics,1,0,0,539,4.3,"11,999",46,"Saturday, February 19",1,"11,999"
22,B0774P9G4W,AmazonBasics D Cell Everyday Alkaline Batteries (4-Pack),AmazonBasics,1,0,0,379,4.4,"68,873",53,"Sunday, February 20",1,"68,873"
23,B014SZORQA,"Duracell Ultra Alkaline AAA Battery, 4 Pcs",Duracell,1,0,0,130,4.5,"3,445",0,"Friday, February 18",1,"3,445"
24,B00LH3DREU,AmazonBasics AAAA Everyday Alkaline Batteries (4-Pack) - Appearance May Vary,AmazonBasics,0,0,0,179,4.2,"16,024",40,"Wednesday, February 23",1,"16,024"
25,B0044D9ZI2,Energizer E96BP AAAA Alkaline Battery (2 Pieces),Energizer,0,0,0,149,4.4,"4,028",0,"Monday, February 21",1,"4,028"
26,B00ZRBWPA0,Eveready AAA Heavy Duty Batteries - 10 Pieces (Red),Eveready,0,0,0,200,4.3,504,4,"Monday, February 28",0,504
27,B07GNMFLKH,AmazonBasics A23 Alkaline Batteries (4-Pack),AmazonBasics,0,0,0,219,4.2,"10,631",56,"Friday, February 18",1,"10,631"
28,B00BATBOT6,"Duracell Rechargeable AA 1300mAh Batteries, 2Pcs",Duracell,0,0,0,299,4.3,"64,295",8,"Friday, February 18",1,"64,295"
29,B096K52RM5,"Duracell Alkaline AAA Battery Chhota Power, 8 Pcs",Duracell,0,0,0,170,4.4,242,11,"Friday, February 18",1,242
30,B014SZP8MW,"Duracell Ultra Alkaline C Battery, 2 pcs",Duracell,0,0,0,261,4.3,"1,178",5,"Saturday, February 19",1,"1,178"
31,B014SZOLWK,Duracell Alkaline AAA Battery with Duralock Technology - 2 Pieces,Duracell,0,0,0,84,4.5,265,0,"Friday, February 25",0,265
32,B014SZO90Y,"Duracell Ultra Alkaline AA Battery, 8 Pcs",Duracell,1,0,1,261,4.5,"15,904",11,"Friday, February 18",1,"15,904"
33,B00MH4QM1S,AmazonBasics 9 Volt Everyday Alkaline Batteries (8-Pack) - Appearance May Vary,AmazonBasics,1,0,0,689,4.4,"111,069",14,"Monday, February 21",1,"111,069"
34,B09689JGC4,"Duracell Alkaline AA Battery Chhota Power, 8 Pcs",Duracell,0,0,0,181,4.5,224,5,"Monday, February 21",1,224
35,B078N2J6MP,"Maxell LR44 Battery , 1.5V Micro Alkaline Button Coin Cell (Pack of 6 Batteries)",Maxell,0,0,0,103,4.1,"1,014",48,"Wednesday, February 23",1,"1,014"
36,B07VL4ZHDF,"Energizer Max Long Lasting High Performance Batteries AAA, Pack of 12",Energizer,0,0,0,340,4.4,"1,114",0,"Friday, February 18",1,"1,114"
37,B08TW2D66S,"SR626SW LR 626 377A 364A AG1 1.5v Watches Alkaline Button Coin Cell Batteries, Pack of 20 (SR626SW / 377A / 364A -20 Unit)",SR626SW,0,0,0,179,3.9,820,80,"Tuesday, February 22",1,SR626SW
38,B07JLMXW95,"AmazonBasics CR2025 Lithium Coin Cell, 2-Pack",AmazonBasics,0,0,0,79,4.3,"7,463",61,"Monday, February 21",1,"7,463"
39,B00FOQA6UO,Duracell Alkaline AAA Battery with Duralock Technology - 2 Pieces,Duracell,0,0,0,84,4.3,47,0,"Sat, Feb 19",0,47
40,B0847BP83Q,"TONSY 1.5V Alkaline Button Batteries 377A, LR626, SR626SW, 364A AG4 Universal Watch Battery Cells 364A LR60 SR60 364A (Pack of 30) Suitable for Unisex Wrist Watches",TONSY,0,0,0,189,3.9,820,68,"Tuesday, February 22",1,820
41,B00SA1HNZG,"Exide 12 Volt/ 7 Ah Powersafe Battery (Sealed),Original Replacement To Ups Battery",Exide,0,0,0,970,3.4,336,68,"Wednesday, March 2",0,336
42,B00E3DVQFS,"Duracell Rechargeable AA 2500mAh Batteries, 4 Pcs",Duracell,1,0,0,949,4.3,"64,295",14,"Saturday, February 19",1,"64,295"
43,B00LH3DTYS,AmazonBasics AAAA Everyday Alkaline Batteries for Stylus (8-Pack) - Appearance May Vary,AmazonBasics,1,0,0,235,4.2,"17,487",57,"Sunday, February 20",1,"17,487"
44,B00LH3DMUO,AmazonBasics AAA Performance Alkaline Non-rechargeable Batteries (36 Count) - Appearance May Vary,AmazonBasics,1,0,0,589,4.4,"10,217",15,"Monday, February 21",1,"10,217"
45,B07JLBCH8L,"AmazonBasics LR44 Alkaline Button Coin Cell Batteries, Pack of 6",AmazonBasics,1,0,0,149,4.1,"16,269",26,"Friday, February 18",1,"16,269"
46,B011KPY1BW,"Generic 9V HI-Watt Battery, Pack of 5 by Robokart",Generic,0,0,0,175,3.9,440,12,"Friday, February 25",0,440
47,B09HBYL3XG,DURACELL LR44 Coin  Alkaline Battery (Coin Cell)(Pack of 2),DURACELL,0,0,0,131,3.8,9,27,,1,9
48,B07JLN3WG1,"AmazonBasics CR1620 Lithium Coin Cell, 2-Pack",AmazonBasics,0,0,0,79,4.1,"6,467",61,"Monday, February 21",1,"6,467"
49,B00WW6JSCQ,Duracell R 03 AAA Alkaline Long Lasting Batteries (Pack of 6),Duracell,0,0,0,0,4.3,231,0,,0,231
50,B08QJKR916,Eveready AAA Batteries Cells (Pack of 10),Eveready,0,0,0,94,4.0,32,6,"Monday, February 21",0,32
51,B08HKNTH8Z,Nippo Hyper R20P (UM-1UH) 1.5V Zinc-Carbon Battery Heavy Duty Battery - D Size (Big Battery) (Pack of 4 Battery),Nippo,0,0,0,197,4.2,63,34,"Wednesday, February 23",1,63
52,B08QJKLSHX,Eveready AAA Batteries Cells (Pack of 10),Eveready,0,0,0,99,0,0,1,"Wednesday, February 23",0,"₹99
₹100 Save ₹1 (1%)"
53,B00LH3DTYS,AmazonBasics AAAA Everyday Alkaline Batteries for Stylus (8-Pack) - Appearance May Vary,AmazonBasics,0,0,0,235,4.2,"17,487",57,"Sunday, February 20",1,"17,487"
54,B0774LQ8NG,AmazonBasics C Cell Everyday Alkaline Batteries (4-Pack),AmazonBasics,1,0,0,279,4.2,"75,856",44,"Saturday, February 19",1,"75,856"
55,B01DJJVF1Q,"Duracell Ultra Alkaline AA Battery, 12 Pcs",Duracell,1,0,0,485,4.5,"15,904",5,"Monday, February 21",1,"15,904"
56,B07ZJHYYTM,Panasonic Gold Plus AA - Pack of 20 pcs,Panasonic,0,0,0,309,4.4,247,3,"Monday, February 21",1,247
57,B015ZXUDD0,"Duracell Rechargeable AA 1300mAh Batteries, 4Pcs",Duracell,0,0,0,546,4.3,"64,295",9,"Saturday, February 19",1,"64,295"
58,B0038YHSXW,Panasonic CR2032 3V Coin Cell Batteries (Silver) - Pack of 2,Panasonic,0,0,0,99,4.2,"2,192",1,"Friday, March 4",0,"2,192"
59,B00O647892,"Maxell LR1130 Battery, 1.5V Micro Alkaline Button Coin Cell (10 Pieces)",Maxell,0,0,0,205,4.1,398,41,"Monday, February 21",0,398
60,B08SWK9BWV,Amptek AT6-4.5 6V 4.5AH SMF/VRLA Battery | Sealed Lead Acid Battery | Strong ABS | Wide Temperature Range | Battery for Electronic Weighing Scales | Medical Electronic Test Equipments,Amptek,0,0,0,624,3.9,254,38,"Monday, February 28",0,254
61,B0774P9G4W,AmazonBasics D Cell Everyday Alkaline Batteries (4-Pack),AmazonBasics,0,0,0,379,4.4,"68,873",53,"Sunday, February 20",1,"68,873"
62,B002FTUQAI,Energizer Max E95FP-8 D Alkaline Batteries 8 Pack,Energizer,0,0,0,0,4.6,17,0,,0,17
63,B08PBVCP8T,Maxell LR41 AG3 LR736 392 392a 192 SR41 Button Coin Cell Battery - Pack of 10,Maxell,0,0,0,183,3.9,209,48,"Monday, February 21",0,209
64,B015ZXUDD0,"Duracell Rechargeable AA 1300mAh Batteries, 4Pcs",Duracell,1,0,0,546,4.3,"64,295",9,"Saturday, February 19",1,"64,295"
65,B078PMSF1X,"AmazonBasics 8 Pack AA Ni-MH Pre-Charged Rechargeable Batteries, 1000 Recharge Cycles (Typical 2000mAh, Minimum 1900mAh) - Packaging May Vary",AmazonBasics,1,0,0,849,4.3,313,53,"Friday, February 18",1,313
66,B09MDH4C21,Smartcell AA Alkaline Non-Rechargeable Mini Series Battery Pack of 10,Smartcell,1,0,0,164,4.0,12,9,"Monday, February 21",1,12
67,B01B8R6V2E,AmazonBasics AAA Performance Alkaline Non-rechargeable Batteries (100-Pack) - Appearance May Vary,AmazonBasics,1,0,0,"1,599",4.7,"30,622",11,"Saturday, February 19",1,"30,622"
68,B09Q9YFF9N,"KP 400935 3.7v 250mAh Rechargeable Battery for Bluetooth Neckband, Headset, 250 mah 3.7 v",KP,0,0,0,249,0,0,50,"Monday, February 28",0,"₹249
₹499 Save ₹250 (50%)"
69,B07HDBJPJ7,"PANASONIC, Gold Plus AAA Battery is for WHO Think Smart- Pack of 20 no's","PANASONIC,",0,0,0,300,4.2,449,14,"Wednesday, February 23",1,449
70,B078HQ1H2T,TRP TRADERS GP Royal 27A GP 12V Alkaline Battery - Pack of 5,TRP,0,0,0,197,4.0,220,67,"Tuesday, February 22",1,220
71,B014SZOX96,"Duracell Ultra Alkaline AAA Battery, 6 Pcs",Duracell,0,0,0,227,4.5,"7,620",16,"Saturday, February 19",1,"7,620"
72,B07H5Q2J9T,"Duracell Specialty 2032 Lithium Coin Battery 3V, Pack of 2 (DL2032/CR2032) Designed for use in keyfobs, Scales, wearables and Medical Devices",Duracell,0,0,0,154,4.3,"5,150",23,"Monday, February 21",0,"5,150"
73,B07RYVVW8X,"Panasonic eneloop BQ-CC61N Portable Charger with USB Cable for AA & AAA Rechargeable Batteries, White",Panasonic,0,0,0,680,4.3,"8,477",0,"Friday, February 18",1,"8,477"
74,B06X9ZGSF4,Panasonic Rechargable Ni-MH AAA Rechargable Battery For Cordless Phone And Toys (Pack Of 2 Pcs),Panasonic,0,0,0,354,4.3,"1,684",56,"Tuesday, February 22",1,"1,684"
75,B09RWQD8BF,"ICR 18650 Lithium-ion Battery (3.7v, 2000mAh)",ICR,0,0,0,199,0,0,50,"Tuesday, February 22",0,"₹199
₹400 Save ₹201 (50%)"
76,B01DJJVGBA,"Duracell Ultra Alkaline AAA Battery, 12 Pcs",Duracell,1,0,0,484,4.5,"7,620",5,"Friday, February 18",1,"7,620"
77,B00BATBOT6,"Duracell Rechargeable AA 1300mAh Batteries, 2Pcs",Duracell,1,0,0,299,4.3,"64,295",8,"Friday, February 18",1,"64,295"
78,B01EGRZHYG,Seizaiken SR721SW (362) Silver Oxide Watch Battery (Pack of 5),Seizaiken,0,0,0,240,4.1,150,52,"Monday, February 21",0,150
79,B0774D64LT,AmazonBasics 9 Volt Everyday Alkaline Batteries (4-Pack),AmazonBasics,0,0,0,369,4.4,"111,069",39,"Saturday, February 19",1,"111,069"
80,B07XKS31B3,MILAN TRADING GP Super 23A 12V Alkaline Battery High Voltage - Pack of 5 Pieces,MILAN,0,0,0,210,4.2,339,16,"Friday, February 18",0,339
81,B00005T3DV,Duracell CR2032 3V Lithium Button Battery,Duracell,0,0,0,95,4.3,"6,950",53,"Monday, February 21",0,"6,950"
82,B0031JYRCY,Energizer Rechargeable Batteries NiMH D 2500 mAH (Per 2),Energizer,0,0,0,"3,078",4.4,"3,743",30,"Tuesday, March 8",0,"3,743"
83,B0031YLTSY,"Duracell Rechargeable AAA 900mAh Batteries, 4 Pcs",Duracell,0,0,0,799,4.3,"64,295",20,"Saturday, February 19",1,"64,295"
84,B00BN62EZY,"ENVIE® AAA Rechargeable Batteries, High-Capacity Ni-MH 1100 mAh, Low Self Discharge, Pre-Charged (Pack of 2) (AAA11002PL)",ENVIE®,0,0,0,299,4.1,"5,570",0,"Sunday, February 20",1,"5,570"
85,B003B00484,"Duracell Rechargeable AAA 750mAh Batteries, 4 Pcs",Duracell,0,0,0,449,4.3,"64,295",10,"Saturday, February 19",1,"64,295"
86,B094MVCG8R,"Duracell Ultra Alkaline AA Battery, 20 Pcs",Duracell,1,0,0,834,4.5,"15,904",1,"Sunday, February 20",1,"15,904"
87,B09HH4M237,GP Greencell Heavy Duty Zinc Batteries 1.5V AA Pack of 2,GP,1,0,0,300,5.0,1,0,"Tuesday, February 22",1,1
88,B01GYQPCTW,Panasonic AAA Rechargeable Battery (2 piece),Panasonic,1,0,0,390,4.2,484,35,"Tuesday, February 22",1,484
89,B01B8R6PF2,AmazonBasics AA Performance Alkaline Non-rechargeable Batteries (100-Pack) - Appearance May Vary,AmazonBasics,1,0,0,"2,499",4.6,"3,761",0,"Monday, February 21",1,"3,761"
90,B09MDGG2HG,Smartcell 1.5V AAA Non-Rechargeable Alkaline Mini Series Battery Pack of 10,Smartcell,0,0,0,164,4.3,9,9,"Monday, February 21",1,9
91,B09MDH4C21,Smartcell AA Alkaline Non-Rechargeable Mini Series Battery Pack of 10,Smartcell,0,0,0,164,4.0,12,9,"Monday, February 21",1,12
92,B09MDC161P,Smartcell AA Alkaline Non-Rechargeable Mini Series Battery Pack of 4,Smartcell,0,0,0,68,4.0,12,6,"Monday, February 21",1,12
93,B09NFTS47R,Mobatree Bluetooth Battery | 451722p Battres 3.7V 300mAh Lopo Batteries Small Lithium Polymer Battery,Mobatree,0,0,0,299,0,0,40,"Monday, February 28",0,"₹299
₹499 Save ₹200 (40%)"
94,B00LH3DMUO,AmazonBasics AAA Performance Alkaline Non-rechargeable Batteries (36 Count) - Appearance May Vary,AmazonBasics,0,0,0,589,4.4,"10,217",15,"Monday, February 21",1,"10,217"
95,B08KTF9J2X,"Eveready Rechargeable Battery, 02 Pieces Pack, White (1000 Series, BP4 700 NIMH) (Pack of 1, AA Battery)",Eveready,0,0,0,169,3.8,50,1,"Wednesday, February 23",0,50
96,B01LX5SGGH,CR2032 Lithium Button Cell Battery,CR2032,0,0,0,100,4.6,3,44,"Saturday, February 26",0,CR2032
97,B00MH4QM1S,AmazonBasics 9 Volt Everyday Alkaline Batteries (8-Pack) - Appearance May Vary,AmazonBasics,0,0,0,689,4.4,"111,069",14,"Monday, February 21",1,"111,069"
98,B003B0048O,"Duracell Rechargeable AAA 750mAh Batteries, 2 Pcs",Duracell,1,0,0,220,4.3,"64,295",0,"Friday, February 18",1,"64,295"
99,B094MPFSGB,"Duracell Ultra Alkaline AAA Battery, 20 Pcs",Duracell,1,0,0,809,4.5,"7,620",5,"Sunday, February 20",1,"7,620"
100,B078N1XGH7,"MAXELL Lr41 Ag3 Lr736 392 392a 192 Sr41 BUTTON COIN CELL BATTERY (for watches,toys.digital thermometer) 5 PIECES",MAXELL,0,0,0,175,4.0,504,30,"Monday, February 21",0,504
101,B08WB3XGRP,"Panasonic EVOLTA Alkaline AA Battery, Pack of 4",Panasonic,0,0,0,180,4.4,"2,585",0,"Saturday, February 19",1,"2,585"
102,B081CKTHNT,Welch Allyn 3.5V PROFESSIONAL HPX STREAK RETINOSCOPE (ONLY HARD CARRYING CASE BY OTICA),Welch,0,0,0,"3,999",4.2,9,0,"Tuesday, February 22",1,9
103,B010UMWK1O,Eveready Heavy Duty 1050 R20 Battery (Pack of 2),Eveready,0,0,0,64,4.2,344,29,"Monday, February 21",0,344
104,B09C87DJRY,"Unique India Sales Eve Er14250 Lithium Battery 1/2AA Capacity: 1200, Voltage: 3.6 Pack of 2",Unique,0,0,0,199,4.7,4,50,"Friday, February 25",0,4
105,B00MH4QI26,AmazonBasics C Size Cell Everyday Alkaline Batteries (12-Pack) - Appearance May Vary,AmazonBasics,0,0,0,749,4.2,"75,856",25,"Monday, February 21",1,"75,856"
106,B00BGIW5AS,Duracell Quantum DL2032 230 mAh Lithium Coin Battery (Grey),Duracell,0,0,0,75,4.3,124,63,"Thursday, February 24",0,124
107,B0033B5TRW,"Duracell Rechargeable AAA 900mAh Batteries, 2 Pcs",Duracell,0,0,0,499,4.3,"64,295",9,"Friday, February 18",1,"64,295"
108,B07GNMFLKH,AmazonBasics A23 Alkaline Batteries (4-Pack),AmazonBasics,1,0,0,219,4.2,"10,631",56,"Friday, February 18",1,"10,631"
109,B09MDC161P,Smartcell AA Alkaline Non-Rechargeable Mini Series Battery Pack of 4,Smartcell,1,0,0,68,4.0,12,6,"Monday, February 21",1,12
110,B084D1MQW8,ORIGINAL MART Battery Tester for AA/AAA/C/D/9-volt Rectangular and Button Cell Batteries (Black),ORIGINAL,1,0,0,311,4.1,134,58,"Tuesday, February 22",0,134
111,B01DJJVFPC,"Duracell Ultra Alkaline AAA Battery, 8 Pcs",Duracell,1,0,0,320,4.5,"7,620",0,"Friday, February 18",1,"7,620"
112,B07G7KRQQ5,Duracell - 2032 3V Lithium Coin Battery - Long Lasting Battery - 2 Count,Duracell,0,0,0,165,4.6,"8,884",18,"Monday, February 21",0,"8,884"
113,B0747PYHSL,Renata 3V Lithium Coin Battery,Renata,0,0,0,325,4.1,18,46,"Saturday, February 26",1,18
114,B098K5F82W,EXME 3.7V Rechargeable Lithium ion Battery Power Bank Cell use for LED Light Bluetooth Speaker Emergency Light (2000 mah) Pack of 2,EXME,0,0,0,449,3.5,7,55,"Friday, February 25",0,7
115,B08WB167X5,"Panasonic EVOLTA Alkaline AAA Battery, Pack of 6",Panasonic,0,0,0,223,4.4,"2,585",12,"Tuesday, February 22",1,"2,585"
116,B09M7H37ZV,Gloerzz 3.7V 1200mAh Rechargeable Lithium Ion Battery for Multipurpose Use with Wired (1),Gloerzz,0,0,0,139,5.0,1,77,"Friday, February 25",0,1
117,B006T9APEM,Energizer Alkaline Battery Max 522BP1 '9V',Energizer,0,0,0,200,4.2,267,0,"Monday, February 21",1,267
118,B09MDGHM3K,Smartcell 1.5V AAA Non-Rechargeable Alkaline Mini Series Battery Pack of 4,Smartcell,0,0,0,68,4.3,9,6,"Sunday, February 20",1,9
119,B00E3DVQFS,"Duracell Rechargeable AA 2500mAh Batteries, 4 Pcs",Duracell,0,0,0,949,4.3,"64,295",14,"Saturday, February 19",1,"64,295"
120,B0031YLTSY,"Duracell Rechargeable AAA 900mAh Batteries, 4 Pcs",Duracell,1,0,0,799,4.3,"64,295",20,"Saturday, February 19",1,"64,295"
121,B014SZPBM4,"Duracell Ultra Alkaline D Battery, 2 Pcs",Duracell,1,0,0,299,4.4,"1,367",25,"Saturday, February 19",1,"1,367"
122,B08WBVYBQQ,"Panasonic EVOLTA Alkaline AA Battery, Pack of 8",Panasonic,0,0,0,360,4.4,"2,585",0,"Friday, February 18",1,"2,585"
123,B094MVFGC7,"Duracell Ultra Alkaline C Battery, 4 Pcs",Duracell,0,0,0,523,4.3,"1,178",5,"Monday, February 21",1,"1,178"
124,B08KWHQTBG,"Duracell Alkaline AA Battery Chhota Power, 4 Pcs",Duracell,0,0,0,95,4.4,48,0,"Monday, February 21",1,48
125,B07MXP6YP4,Renata 2450N Cr 2450 3V Swiss Made Lithium Battery Coin Cell (Silver) Blister Pack of 2 Pieces,Renata,0,0,0,470,3.9,104,15,"Friday, February 18",0,104
126,B09FGVN8QB,3.7v 300mah LiPo Battery Lithium Polymer 300mah Rechargeable Battery,3.7v,0,0,0,315,5.0,1,68,"Friday, February 25",0,3.7v
127,B08JGMMBLD,Eveready 1050 Battery (Pack of 8 Battery),Eveready,0,0,0,309,4.1,16,14,"Wednesday, February 23",0,16
128,B01IP5268A,"Eveready Ultima AA Battery, Pack of 4",Eveready,0,0,0,125,4.5,20,11,"Friday, February 18",0,20
129,B096K6HTTF,"Duracell Alkaline AAA Battery Chhota Power, 12 Pcs",Duracell,0,0,0,270,4.4,242,5,"Friday, February 18",1,242
130,B00LH3DREU,AmazonBasics AAAA Everyday Alkaline Batteries (4-Pack) - Appearance May Vary,AmazonBasics,1,0,0,179,4.2,"16,024",40,"Wednesday, February 23",1,"16,024"
131,B07JLMXW95,"AmazonBasics CR2025 Lithium Coin Cell, 2-Pack",AmazonBasics,1,0,0,79,4.3,"7,463",61,"Monday, February 21",1,"7,463"
132,B08C9WQFWZ,GP GREENCELL Extra Heavy Duty Battery 1.5V AAA 10 Pack of 2,GP,1,0,0,340,4.2,20,0,"Tuesday, February 22",1,20
133,B078PPCFC2,"AmazonBasics 4 Pack AA Ni-MH Pre-Charged Rechargeable Batteries, 1000 Recharge Cycles, (Typical 2000mAh, Minimum 1900mAh) - Packaging May Vary",AmazonBasics,1,0,0,649,4.2,880,35,"Sunday, February 20",1,880
134,B09KNK6Y96,QURA 3.7V Rechargeable Lithium ion Battery Power Bank Cell use for LED Light Bluetooth Speaker Emergency Light Pack of 1 (1000 mAh),QURA,0,0,0,279,3.9,13,65,"Saturday, February 26",0,13
135,B00VM80JCS,"Duracell Ultra Alkaline 9V Battery, 2 Pcs",Duracell,0,0,0,456,4.4,"2,107",5,"Monday, February 21",1,"2,107"
136,B07GN2H8XC,1.5V Silver Oxide Battery,1.5V,0,0,0,"1,518",4.7,"2,366",29,"Tuesday, March 8",0,1.5V
137,B09NGDVFFY,Mobatree Bluetooth Battery | 402035p Battres 3.7V 350mAh Lopo Batteries Small Lithium Polymer Battery,Mobatree,0,0,0,320,0,0,36,"Monday, February 28",0,"₹320
₹499 Save ₹179 (36%)"
138,B01EVCFWYG,Seizaiken SR516SW (317) Silver Oxide Watch Battery (Pack of 5),Seizaiken,0,0,0,350,4.1,150,22,"Friday, February 18",0,150
139,B078FY5JZT,Renata CR2450N 3V Lithium Battery (1pc Blister Pack),Renata,0,0,0,289,3.8,42,28,"Friday, February 18",0,42
140,B00006JPHI,"Duracell Specialty N Alkaline Battery 1,5V, Pack of 2 (E90 / LR1) Suitable for use in flashlights, calculators and Bike Lights (MN9100B2PK)",Duracell,0,0,0,183,4.7,"4,706",27,"Monday, February 21",1,"4,706"
141,B00ABKXVB4,Duracell LR1 1.5V Alkaline Batteries,Duracell,0,0,0,399,4.3,109,50,"Tuesday, February 22",1,109
142,B0033B5TRW,"Duracell Rechargeable AAA 900mAh Batteries, 2 Pcs",Duracell,1,0,0,499,4.3,"64,295",9,"Friday, February 18",1,"64,295"
143,B00MH4QKP6,AmazonBasics D Cell Everyday Alkaline Batteries (12-Pack),AmazonBasics,1,0,0,"1,039",4.4,"68,873",65,"Friday, February 18",1,"68,873"
144,B09GM3TCKC,Dkian Replacement 3.7V 150 Mah Battery for Bluetooth Device handsfree Size 37x10x5,Dkian,0,0,0,349,2.0,1,50,"Monday, February 28",0,1
145,7884890364,Maxell LR44 Batteries 10 Pack,Maxell,0,0,0,88,4.1,320,56,"Tuesday, February 22",0,320
146,B07QWYH7LT,SaleOn™ GP Super 23A Pack of 10 Pieces 12V Alkaline Battery High Voltage Cell Car Remote Battery(10pc),SaleOn™,0,0,0,379,4.2,715,58,"Friday, February 18",1,715
147,B08W9ZYYHS,"Panasonic EVOLTA Alkaline AA Battery, Pack of 6",Panasonic,0,0,0,223,4.4,"2,585",12,"Tuesday, February 22",1,"2,585"
148,B07Y1KLMS1,Agnes Amptek 6V 1.3AH / 20HR Sealed Rechargeable Battery,Agnes,0,0,0,645,3.7,78,46,"Monday, February 28",0,78
149,B07MXG4WXJ,Renata 377 Sr 626 SW Button Cell Battery Silver 1.55V for Wrist Watch Swiss Made -2 Pieces,Renata,0,0,0,190,4.2,370,24,"Friday, February 18",0,370
150,B09NYLY4V3,Gloerzz 3.7V 1200mAh Rechargeable Lithium Ion Battery for Multipurpose Use with Wired (4),Gloerzz,0,0,0,339,5.0,1,43,"Friday, February 25",0,1
151,B08R31JCW1,"Magpie Maxell LR 41 Battery, 1.5V Micro Alkaline Button Coin Cell- 10Cell",Magpie,0,0,0,299,3.8,8,25,"Sunday, February 27",1,8
152,B09P5FVVNP,"KEBILSHOP 2 Pcs 1.2 Volt 5000 mAh D Size Ni-cd Rechargeable Batterry Cell Heavy Duty for Toys,Torches,Radios,Industrial use All Purpose use (2)",KEBILSHOP,1,0,0,900,0,0,40,"Tuesday, February 22",1,"₹900
₹1,500 Save ₹600 (40%)"
153,B08LDL1KHZ,Smartcell CHR6R03-4 NimH AA/AAA/R22 9V Rechargeable Battery Charger + 2 AA 2500mAH + 2 AA 800mAH Rechargeable Battery,Smartcell,1,0,0,654,3.6,109,40,"Monday, February 21",1,109
154,B09P5HGJ24,"KEBILSHOP 1.2 Volt 5000 mAh D Size Ni-cd Rechargeable Batterry Cell Heavy Duty for Toys,Torches,Radios,Industrial use All Purpose use (1)",KEBILSHOP,1,0,0,450,0,0,40,"Tuesday, February 22",1,"₹450
₹750 Save ₹300 (40%)"
155,B09JC4CZT1,CR2032 Flat 3V Lithium Battery 10 pcs/2 Cards,CR2032,1,0,0,300,3.9,7,0,"Friday, February 25",1,CR2032
156,B094MVCG8R,"Duracell Ultra Alkaline AA Battery, 20 Pcs",Duracell,0,0,0,834,4.5,"15,904",1,"Sunday, February 20",1,"15,904"
157,B00EQCFYWM,DEWALT DCB183-18V 2Ah XR Li-ion Battery Pack,DEWALT,0,0,0,0,4.6,325,0,,0,325
158,B005HSW33C,Strip of 5 Genuine Sony CR2032 3v Lithium 2032 Coin Batteries Freshly Packed by Sony,Strip,0,0,0,240,4.6,"4,923",40,"Monday, February 21",0,"4,923"
159,B09QJQH93M,100pcs 18650 Holder Lithium Battery Spacer Plastic Holder for DIY Battery Pack Making,100pcs,0,0,0,150,5.0,1,70,"Wednesday, February 23",0,100pcs
160,B09KJF4BYX,KP SM-2P 1000mAh 3.7v Rechargeable Connector Battery,KP,0,0,0,299,5.0,1,40,"Monday, February 28",0,1
161,B09PHFB2SY,QURA 3.7V 1200mah Lithium-ion Rechargeable Battery,QURA,0,0,0,350,0,0,68,"Saturday, February 26",0,"₹350
₹1,099 Save ₹749 (68%)"
162,B07GN8ZYZR,Duracell - 2032 3V Lithium Coin Battery - Long Lasting Battery - 1 Count,Duracell,0,0,0,120,4.6,"13,480",60,"Friday, February 18",0,"13,480"
163,B0827PVZPL,INVENTO 14.4V 1500 mAh Polymer Ni-Cd Rechargeable 12 AA Cell Battery Pack for cordless phone Toy Car DIY Project,INVENTO,0,0,0,"1,699",4.7,3,11,"Monday, February 21",1,3
164,B08LDLPR88,Smartcell CHR6R03-4 NimH AA/AAA/R22 9V Rechargeable Battery Charger with 4 AA 800mAH Rechargeable Battery,Smartcell,1,0,0,810,3.6,109,40,"Monday, February 21",1,109
165,B00MH4QI26,AmazonBasics C Size Cell Everyday Alkaline Batteries (12-Pack) - Appearance May Vary,AmazonBasics,1,0,0,749,4.2,"75,856",25,"Monday, February 21",1,"75,856"
166,B081VL4TR9,TA Technology Ahead Eb-9Vbat-Kit 9V Hi - Watt Battery with Battery Clip Connector (1 Piece),TA,0,0,0,199,3.6,5,60,"Wednesday, February 23",1,5
167,B09NYLVZ44,Gloerzz 3.7V 1200mAh Rechargeable Lithium Ion Battery for Multipurpose Use with Wired (2),Gloerzz,0,0,0,189,5.0,1,68,"Friday, February 25",0,1
168,B000TUOFE8,Maxell Watch Battery Button Cell LR41 AG3 192 Pack of 10 Batteries,Maxell,0,0,0,214,4.1,"2,467",57,"Friday, February 18",0,"2,467"
169,B0843PCPQJ,SaleON GP Super 23A Pack of 5 Pieces 12V Alkaline Battery High Voltage Cell Car Remote Battery,SaleON,0,0,0,237,4.2,715,74,"Wednesday, February 23",1,715
170,B01FWAM226,Imported 10pcs Clear Case Cover Holder AA / AAA Battery Storage Box-51000653MG,Imported,0,0,0,199,4.0,270,56,"Wednesday, February 23",1,270
171,B08WB3XGSH,"Panasonic EVOLTA Alkaline AAA Battery, Pack of 4",Panasonic,0,0,0,180,4.4,"2,585",0,"Friday, February 18",1,"2,585"
172,B00EZLY55G,"Panasonic Alkaline 9V Battery, Pack of 1",Panasonic,0,0,0,140,4.2,665,0,"Friday, February 18",1,665
173,B00KS33B14,"ENVIE® (AA2100 4PL) Pack of 4, AA Ni-Mh 2100mAh Capacity Rechargeable Battery",ENVIE®,0,0,0,549,4.0,"19,015",0,"Tuesday, February 22",1,"19,015"
174,B07JLN3WG1,"AmazonBasics CR1620 Lithium Coin Cell, 2-Pack",AmazonBasics,1,0,0,79,4.1,"6,467",61,"Monday, February 21",1,"6,467"
175,B09RQNQHV6,,,1,0,0,0,0,0,0,,0,
