,asin,title,brand,Sponsored,Best Seller,Amazon's Choice,Price,Rating,NoofRatings,Discount,Delivery,Prime Delivery,base
360,B093Z4J286,"MFTEK LED Gaming Headphone with mic, Pro Gaming Headset, Noise Cancellation, Microphone Headset, Wired Headphone (Blue Colour)",MFTEK,0,0,0,"1,549",3.0,1,48,"Wednesday, February 16",1,1
361,B07GR6Y61F,"(Renewed) Kotion Each G9000 Over Ear Gaming Headphones with Mic and LED-compatible with PC, iPad, iPhone, Tablets, Mobile Phones (Black/Red)",(Renewed),0,0,0,949,5.0,1,40,"Thursday, February 17",0,1
362,B07GB87G3T,"Cosmic Byte H3 Gaming Wired over ear Headphone With Mic For Pc, Laptops, Mobiles, Ps4, Xbox One (Blue)",Cosmic,1,0,0,"1,227",4.0,"1,605",28,"Tuesday, February 15",1,"1,605"
363,B091643DVT,"Cosmic Byte GS430 Gaming Headphone, 7 Color RGB LED and Microphone for PC, PS5, Xbox Series 5, Mobiles, Tablets, Laptops (Green)",Cosmic,1,0,0,799,4.1,"9,110",0,"Tuesday, February 15",1,"9,110"
364,B08HT6FTXG,Amigo Nedis Wired Over-Ear Gaming Headset | with Impressive Surround Sound |with 3.5 MM Connector | |High Bass (Black),Amigo,0,0,0,658,3.0,1,79,"Sunday, February 13",1,1
365,B075YCY3SS,Razer RZ04-02230100-R3M1 Thresher 7.1 Wireless Gaming Headset with Leatherette Ear Cushions,Razer,0,0,0,"10,416",4.2,"1,088",24,"Sunday, February 13",1,"1,088"
366,B089NLZNLQ,"EKSA E1000S Gaming Headphone with RGB Light for Phone, PS4, Xbox One, Nintendo Switch, Mac, Laptop - Green",EKSA,0,0,0,"2,199",4.2,9,27,"Friday, February 18",0,9
367,B08YJT275P,"Caxon Stereo Headset 3.5mm Wired Gaming Headset (Black, On The Ear)",Caxon,0,0,0,499,0,0,50,"Wednesday, February 16",1,"₹499
₹999 Save ₹500 (50%)"
368,B07WSDHF2H,"Cosmic Byte GS410 wired over ear Headphones with Mic and for PS5, PS4, Xbox One, Laptop, PC, iPhone and Android Phones (Camo Grey)",Cosmic,0,0,0,849,4.1,"18,767",0,"Sunday, February 13",1,"18,767"
369,B08GPN8DS1,"yopah j1 3.5 mm high Performance Gaming Headset with Noise Cancellation, RGB LED Lights,Boom mic for PC,Laptop, PS4,x Box,Tablets (Yellow Green Camou Flag Pattern)",yopah,0,0,0,"1,499",5.0,1,48,"Sunday, February 20",0,1
370,B08TJ9T4TN,"Zebronics Zeb-Iron Head Premium Gaming Headphone with 50mm Neodymium Drivers, RGB LED, Dual 3.5mm connectors, 2m Braided Cable, Soft Ear Cushions, Suspended Headband, Flexible mic and Lightweight",Zebronics,0,0,0,999,4.1,502,64,"Tuesday, February 15",1,502
371,B09D6WV3LF,"K11 Over Ear Gaming Headphone, 7.1 Gaming Headsets with Mic for Xbox, PC, Ps4 (K11)",K11,0,0,0,"2,499",4.0,26,72,"Wednesday, February 16",1,K11
372,B09H7S63L9,"Cosmic Byte Uranus Gaming Headset with Flexible Microphone for PC, PS5, Xbox, Mobiles, Tablets, Laptops (Orange Demon)",Cosmic,1,0,0,999,4.0,35,30,"Sunday, February 13",1,35
373,B08G1HPPST,"Cosmic Byte Stardust Headset with Flexible Mic for PS4, Xbox One, Laptop, PC, iPhone and Android Phones (Black/Red)",Cosmic,1,0,0,699,4.0,"4,248",39,"Tuesday, February 15",1,"4,248"
374,B08ZL2WXK8,"Cosmic Byte G2050 RGB 7.1 Surround Sound USB Gaming Headphone for PS5, PC with Software and Gel Microphone (Red)",Cosmic,1,0,0,"1,399",4.0,243,0,"Sunday, February 13",1,243
375,B074123WSD,"Cosmic Byte GS410 Wired Over-ear Headphones with Mic and for PS5, PS4, Xbox One, Laptop, PC, iPhone and Android Phones (Black/Blue, Pack Of 1)",Cosmic,1,0,0,717,4.1,"18,767",32,"Sunday, February 13",1,"18,767"
376,B08CC8QSC7,(Renewed) JBL Quantum 300 Hybrid Wired Over-Ear Gaming Headset with QuantumSurround & Flip-up Mic (Black),(Renewed),0,0,0,"2,799",3.6,27,40,"Wednesday, February 16",1,27
377,B07WSDHF2H,"Cosmic Byte GS410 wired over ear Headphones with Mic and for PS5, PS4, Xbox One, Laptop, PC, iPhone and Android Phones (Camo Grey)",Cosmic,0,0,0,849,4.1,"18,767",0,"Sunday, February 13",1,"18,767"
378,B07JYJM4L8,HyperX Cloud Wired Gaming Headset for Playstation 4 - Black and Blue (HX-HSCLS-BL/EM),HyperX,0,0,0,"7,490",4.5,"6,221",25,"Tuesday, February 15",1,"6,221"
379,B097K844XB,"XO MKF04 Round Wired Stereo Sound Earphone Gaming Headset with Boom Mic, 3.5 MM Splitter Cable, Double Wheat Design is a & Clear Transmission for iOS & Android Mobile Phones – Red",XO,0,0,0,"1,051",5.0,3,53,"Sunday, February 13",1,3
380,B08TJ9T4TN,"Zebronics Zeb-Iron Head Premium Gaming Headphone with 50mm Neodymium Drivers, RGB LED, Dual 3.5mm connectors, 2m Braided Cable, Soft Ear Cushions, Suspended Headband, Flexible mic and Lightweight",Zebronics,0,0,0,999,4.1,502,64,"Tuesday, February 15",1,502
381,B09D6WV3LF,"K11 Over Ear Gaming Headphone, 7.1 Gaming Headsets with Mic for Xbox, PC, Ps4 (K11)",K11,0,0,0,"2,499",4.0,26,72,"Wednesday, February 16",1,K11
382,B09PVHBT6T,"MFTEK LED Gaming Headset with Mic and connecter for PC, Laptop, Mobile Game, Over-Ear Headphone, 3.5mm Wired Jack,Noise Cancellation and Volume Control Gaming Headset, Double bass (Red)",MFTEK,0,0,0,"1,499",0,0,63,"Wednesday, February 16",1,"₹1,499
₹3,999 Save ₹2,500 (63%)"
383,B09MSLXXG6,"MFTEK RGB Gaming Headphones with Mic and Gaming Mouse Combo, Pro Gaming Headset for PC Laptop Pung Mobile Game LED, Lightweight, Durable and DPI Upto 2000 3.5mm Wired Ergonomic USB Gaming Mouse (blue)",MFTEK,0,0,0,"1,899",0,0,14,"Wednesday, February 16",1,"₹1,899
₹2,199 Save ₹300 (14%)"
384,B08PWNT7D9,"Punnk Funnk Punnkfunnk (K20) Gaming Headset, Over Ear Gaming Headphones with Mic, Compatible with Ps4, Xbox One, Nintendo Switch, Pc, Mac, Laptop, Black",Punnk,1,0,0,"1,199",3.6,5,70,"Sunday, February 13",1,5
385,B07WQY99PS,"Cosmic Byte H3 Gaming Headphone with Mic for PC, Laptops, Mobiles, PS4, Xbox One (Camo Black)",Cosmic,1,0,0,"1,308",4.0,"1,605",0,"Tuesday, February 15",1,"1,605"
386,B081D57HB3,Cosmic Byte Spider Gaming Headphone with Microphone & LED for PC/PS4/Xbox/Mobiles/Tablets (Blue),Cosmic,0,0,0,"1,189",4.0,"1,316",15,"Sunday, February 13",1,"1,316"
387,B09BD74KNC,Razer BlackShark V2 Pro - Wireless Gaming Headset - White Edition - RZ04-03220300-R3M1,Razer,0,0,0,"17,999",4.0,11,10,"Sunday, February 13",1,11
388,B09R4KSDFL,"PunnkFunnk A10 Gaming Headset, PC Gaming Headphone with Mic, RGB Headset with LED Light Wired Headphone for Nintendo Switch PS4 Xbox One PC Computer",PunnkFunnk,0,0,0,"1,499",0,0,70,"Wednesday, February 16",1,"₹1,499
₹4,999 Save ₹3,500 (70%)"
389,B07GFRPR2D,"SteelSeries Arctis 7 Lossless 2.4GHz Wireless Gaming Headset with DTS Headphone:X v2.0 Surround for PC, Playstation 5, Playstation 4 | 24 Hour Battery Life | Discord-Certified ClearCast Mic - Black",SteelSeries,0,0,0,"15,999",4.5,"12,833",9,"Sunday, February 13",1,"12,833"
390,B08R72PX3V,"(Renewed) HyperX Cloud Core + 7.1 Wired Black Gaming Headset for PC, PS4, Xbox One, Nintendo Switch, and Mobile Devices (HX-HSCC-2-BK/WW)",(Renewed),0,0,0,"3,703",4.2,86,42,"Tuesday, February 15",1,86
391,B08WHTH9W4,AirSound Alpha-1 Wired Over Ear Headphone with Mic (Black),AirSound,0,0,0,"1,499",2.9,20,25,"Sunday, February 13",1,20
392,B09MRW25FG,"boAt Immortal IM1000D Dual Channel Gaming Headphones with 7.1 Channel Surround Audio, Dolby Atmos, 50mm Drivers & RGB Breathing LEDs(Viper Green)",boAt,0,0,0,"2,699",4.2,"1,318",55,"Sunday, February 13",1,"1,318"
393,B091FBWFYF,Razer BlackShark V2 - Wired Gaming Headset + USB Sound Card - Special Edition - RZ04-03230200-R3M1,Razer,0,0,0,"13,267",4.4,27,12,"Tuesday, February 15",1,27
394,B07X8G7ZG5,"EKSA E3000 Gaming Headphones Wired with Stereo, Gaming Headset with Noise Cancelling Mic, LED Light, Over-Ear Headphones with for Mobile, Laptop, PC, PS4, Xbox One, PS5, PUBG (Dark Black)",EKSA,1,0,0,"1,899",4.1,"2,687",37,"Thursday, February 17",1,"2,687"
395,B09RWWLZBV,"MFTEK LED Gaming Headphone with mic, Pro Gaming Headset, Noise Cancellation, Microphone Headset, Wired Headphone- Blue",MFTEK,1,0,0,"1,549",0,0,48,"Wednesday, February 16",1,"₹1,549
₹2,999 Save ₹1,450 (48%)"
396,B08BJFBZQ8,"Cosmic Byte Blazar Wired Over-Ear Headphone with mic for PC, Mobiles, PS5, PS4, Xbox One, Tablets (Blue)",Cosmic,1,0,0,799,4.0,"3,777",0,"Tuesday, February 15",1,"3,777"
397,B07B7KQMVK,"Cosmic Byte GS420 Headphones with Mic, RGB LED lights and Audio Splitter for PS4, Xbox One, Laptop, PC, iPhone and Android Phones (Black/Blue)",Cosmic,1,0,0,849,4.1,833,0,"Thursday, February 17",1,833
398,B078N6QBPM,AmazonBasics Mono Chat Headset for PlayStation 4 (Officially Licensed) - Blue,AmazonBasics,0,0,0,431,3.7,237,0,"Sunday, February 13",1,237
399,B09HXN6J9K,(Renewed) Cosmic Byte H11 Gaming Headset with Microphone (Black/Purple),(Renewed),0,0,0,0,4.0,3,0,,0,3
400,B088GYLL3B,"Hunterspider PS4 Headset -Gaming Headset Xbox one Headset Gaming Headphone with Surround Sound, RGB LED Light & Noise Canceling Microphone for PS4,PC,Mac,Xbox One(Adapter Not Included)",Hunterspider,0,0,0,"1,999",4.3,515,33,"Wednesday, February 16",1,515
401,B09RWX6K8V,"MFTEK Gaming Headphone Noise Cancellation and Volume Control Gaming Headset with Mic LED Light Over-Ear Headphone, 3.5mm Wired, 40mm Driver Unit, Double bass- Blue",MFTEK,0,0,0,"1,549",0,0,48,"Wednesday, February 16",1,"₹1,549
₹2,999 Save ₹1,450 (48%)"
402,B09RWWPNMM,"(Renewed) Redragon Hylas H260 RGB Gaming Headset with Microphone, Wired, Compatible with Xbox One, Nintendo Switch, PS4, PS5, PCs, Laptops and Nintendo Switch, Black",(Renewed),0,0,0,"1,190",0,0,15,"Thursday, February 17",1,"₹1,190
₹1,412 Save ₹222 (15%)"
403,B08FMV6CLJ,Razer RZ04-03230100-R3M1 BlackShark V2 Wired Gaming Headset with USB Sound Card (Black),Razer,0,0,0,"10,499",4.5,63,16,"Tuesday, February 15",1,63
404,B08DD7DDLP,Razer BlackShark V2 Pro - Wireless Gaming Headset - RZ04-03220100-R3M1,Razer,0,0,0,"17,060",4.3,907,15,"Thursday, February 17",1,907
405,B07G1TYXRQ,RIG 300HX gaming headset. Wired stereo gaming headset for Xbox One.,RIG,0,0,0,"1,482",4.4,74,0,"Wednesday, February 16",1,USK Rating: No age limitation
406,B09H7VMR4R,"Cosmic Byte Uranus RGB Gaming Headset with Flexible Microphone for PC, PS5, Xbox, Mobiles, Tablets, Laptops (Fathom Blue)",Cosmic,1,0,0,"1,099",4.0,35,31,"Sunday, February 13",1,35
407,B0797762M1,AmazonBasics Wired Over-Ear Gaming Headset with mic - Green,AmazonBasics,1,0,0,"1,999",3.7,710,0,"Sunday, February 13",1,710
408,B09239HV7Y,Razer Barracuda X - Wireless Multi-Platform Gaming and Mobile Headset - RZ04-03800100-R3M1,Razer,0,0,0,"10,799",4.4,491,14,"Tuesday, February 15",1,491
409,B09RWXRYSG,"MFTEK Gaming Headphone Noise Cancellation and Volume Control Gaming Headset with Mic LED Light Over-Ear Headphone, 3.5mm Wired, 40mm Driver Unit, Double bass- RED",MFTEK,0,0,0,"1,549",0,0,48,"Wednesday, February 16",1,"₹1,549
₹2,999 Save ₹1,450 (48%)"
410,B0799MJV4X,"Mengshen Wired Gaming Headset - with Mic, Volume Control and Cool LED Lights - Compatible with PC, Laptop, Smartphone, PS4 and Xbox One Controller (Blue)",Mengshen,0,0,0,0,4.1,74,0,,0,74
411,B09HXMMG4B,"(Renewed) Cosmic Byte GS430 Gaming Headphone, 7 Color RGB LED and Microphone for PC, PS5, Xbox, Mobiles, Tablets, Laptops (Red)",(Renewed),0,0,0,0,3.0,4,0,,0,4
412,B08LFL9XKS,"Nitho JANUS STEREO GAMING HEADSET XBOX THEMED, Compatible with PS4/PS5/Xbox One/XBOX series X/Switch/Phones",Nitho,0,0,0,"1,002",3.9,340,0,"Tuesday, February 15",1,340
413,B08R7HT5FX,"(Renewed) havit H2011d Wired Gaming Headset with Boom Mic, Red LED Light and 3D Surround Sound for PC, Laptop, PS4, Xbox, Switch",(Renewed),0,0,0,790,3.5,2,12,"Thursday, February 17",1,2
414,B08H4VBR68,"SteelSeries Arctis 9X Wireless Gaming Headset – Integrated Xbox Wireless + Bluetooth – 20+ Hour Battery Life – for Xbox One, Series X & PC",SteelSeries,0,0,0,"26,999",4.4,"1,323",13,"Tuesday, February 15",1,"1,323"
415,B09GY4LQ89,"Zoook Panther Professional Gaming Headset,Over-Ear Gaming Headphones with Soft Memory Earmuffs for PC, Mac, Laptop, Green-Black (ZK-Panther-Green)",Zoook,0,0,0,"1,177",0,0,51,"Tuesday, February 15",1,"₹1,177
₹2,399 Save ₹1,222 (51%)"
416,B078NYL1JT,"Zebronics ZEB-ORION USB Headphone with simulated 7.1 surround sound, 40mm driver, RGB LED, Advanced Windows software, 2m Braided cable, In-line control pod, Flexible mic and Suspended headbands",Zebronics,1,0,0,"2,184",4.1,502,56,"Sunday, February 13",1,502
417,B08HHXS598,"EKSA E900 Wired Stereo Gaming Headset-Over Ear Headphones with Noise Canceling Mic, Detachable Headset Compatible with PS4, PS5, Xbox One, PC, Mac, Laptop (Green)",EKSA,1,0,0,"2,299",4.2,"5,410",23,"Thursday, February 17",1,"5,410"
418,B078N66Y2M,AmazonBasics Gaming Headset - Black,AmazonBasics,1,0,0,"1,899",4.2,724,0,"Tuesday, February 15",1,724
419,B07413RMMP,"Cosmic Byte GS410 Headphones with Mic and for PS5, PS4, Xbox One, Laptop, PC, iPhone and Android Phones (Black/Red)",Cosmic,1,0,0,799,4.1,"18,767",24,"Sunday, February 13",1,"18,767"
420,B08JZB15KT,"Zoook Sniper Professional Gaming Headset for Xbox One PS4 Headset,LED Light, Over-Ear Gaming Headphones with Soft Memory Earmuffs for PC, Mac, Laptop, Nintendo Switch, Red-Black (ZK-Sniper)",Zoook,0,0,0,"1,170",5.0,2,41,"Tuesday, February 15",1,2
421,B08TCCP2M6,"Zebronics Zeb-Rush Premium Gaming Headphone with 40mm Neodymium Drivers, RGB LED, Dual 3.5mm Jack, Single pin Converter, 2m Braided Cable, Padded Headband, Flexible mic and Soft Ear Cushions (Blue)",Zebronics,1,0,0,999,3.5,"1,309",60,"Sunday, February 13",1,"1,309"
422,B08ZSLWQ1V,Logitech G333 Gaming Earphones with Gaming-Grade Dual Drivers with USB-C Adapter & in-line Mic and Volume Control with 3.5mm aux - Purple,Logitech,1,0,0,"4,295",3.8,201,14,"Sunday, February 13",1,201
423,B08RDVS6ZP,Fire-Boltt BGH1200 Wired Over the Ear Headphone with Mic (Black),Fire-Boltt,0,0,0,"1,999",4.1,159,60,"Thursday, February 17",1,159
424,B097R7ZLPD,"EKSA E900 Wired Stereo Gaming Headset-Over Ear Headphones with Noise Canceling Mic, Detachable Headset Compatible with PS4, PS5, Xbox One, PC, Mac, Laptop (Blue)",EKSA,1,0,0,"2,299",4.2,"5,410",23,"Thursday, February 17",1,"5,410"
425,B095C7MYXD,"EvoFox Antares Wired Gaming Headphone with Lightweight Design, Soft Protein Ear Cushions, Adjustable Headband, Red Backlighting and Durable Photon Cable (1.8 metres) (with mic, Red/Black)",EvoFox,1,0,0,"1,199",4.0,20,33,"Wednesday, February 16",1,20
