,asin,title,brand,Sponsored,Best Seller,Amazon's Choice,Price,Rating,NoofRatings,Discount,Delivery,Prime Delivery,base
244,B08Y71XTJP,Women Stylish Fashionable & Sneaker Shoes for Running/Sports/Outdoors/Morning Walking/Basketball/Trekking/Dance (Black)_ES-5001-108-37,Earth Step,0,0,0,469,3.7,313,53,,1,313
245,B09BCWJRMJ,Crose Sports Running Shoes for Men,BLACKTOWN,0,0,0,499,3.6,738,62,,1,738
246,B09BN4KW9C,Men's T-02 Running Shoe,URJO,0,0,0,809,3.7,99,46,,1,99
247,B08X2BY7BZ,Women's Black Textile Slip-On Lightweight Running Walking Shoes,ZAPATOZ,0,0,0,499,3.6,"1,435",50,,1,"1,435"
248,B091XR73RX,Unisex Kids Sports Shoes Sneaker,Amazon Brand - Jam & Honey,0,0,0,499,4.8,7,64,,1,7
249,B09GFTS33W,mens Sandoz Combo Sneaker,Ethics,0,0,0,649,5.0,1,35,,1,1
250,B08K7MB9C6,Men's Running Shoes,Liberty,0,0,0,798,3.8,554,20,,1,554
251,B091Y951H7,Unisex-Child Kids Sports Shoes Sneaker,Amazon Brand - Jam & Honey,0,0,0,599,4.2,22,65,,1,22
252,B07TVJ9GQM,Men's Walking Shoe,Amazon Brand - Symactive,0,0,0,699,4.0,"1,170",72,,1,"1,170"
253,B09DCXGBVF,Women Sports Shoes Wine Crystal-103 (5UK),Lancer,0,0,0,599,5.0,1,0,,1,1
254,B07Q1CV4NP,Men's NASA Running Shoes,Campus,0,0,0,"1,245",4.2,"4,238",27,,1,"4,238"
255,B095X8K1WL,Women's N Walk Calm Running Shoe,Power,0,0,0,899,3.8,63,40,,1,63
256,B094VGP947,Women's Stride Runner W Running Shoe,Reebok,0,0,0,"1,172",4.4,379,38,,1,379
257,B082X8FR5X,Force10 Men's Jme-17e Maroon Running Shoes,Liberty,0,0,0,"1,199",3.9,873,25,,0,873
258,B07Q8WH3QK,Men's Sports Shoe,GoldStar,0,0,0,795,3.7,190,20,,0,190
259,B098LPKHN1,Sports Shoes Walking Runing Sneaker Cool Design for Women & Girls,HimQuen,0,0,0,526,3.5,72,41,,1,72
260,B08DKXFLVQ,Men's Walking Shoe,Bacca Bucci,1,0,0,"1,399",3.6,246,53,,1,246
261,B091MHZ44L,"Spark Running Shoes/Trainers for Men for Gyming, Cross Training, Heavy Weight Lifting, Cross-fit with Natural Rubber & Eva Sole and Breathable Upper",Bacca Bucci,1,0,0,"1,399",4.0,132,53,,1,132
262,B09QSKWZWM,Men's Perfect Style|Stylish Look Mesh Lace up Sport|Running|Walking Shoe,Onivixo,1,0,0,749,0,0,58,,0,"₹749
₹1,799 Save ₹1,050 (58%)"
263,B07YSVRG7X,Men's Running Shoe,Bacca Bucci,1,0,0,"1,399",4.0,"1,416",44,,1,"1,416"
264,B091YK2Z4C,Unisex-Child Kids Sports Shoes Sneaker,Amazon Brand - Jam & Honey,0,0,0,649,4.5,24,64,,1,24
265,B09NY8PWHV,Girl's Walking Running Training & Gym Lightweight Comfortable Shoe for Women/Girl's,FASHIMO,0,0,0,529,3.0,2,47,,1,2
266,B09KBQDQM9,Men's Rso130 Walking Shoe,Red Tape,0,0,0,"1,529",4.7,22,70,,1,22
267,B081R1XQ8N,unisex-adult 90s Runner Nu Wave Closed shoe Puma White-Puma White-Aqua Gray 8 UK,Puma,0,0,0,"2,250",3.5,18,55,,1,18
268,B08PWKNW3F,Zooter Cricket Shoe for Men and Boys,DSC,0,0,0,909,3.9,251,7,"Sunday, February 13",1,251
269,B07S7MTB5G,Men's Sneaker,Bacca Bucci,0,0,0,"1,199",3.9,"2,519",52,,1,"2,519"
270,B09P72L5VJ,TANUJ Men's Sports Shoes Running |Gym Traning |Cricket | Sports |Classic Sneaker | Cycling Sports Shoes Multicolored,Generic,0,0,0,699,4.0,2,67,,0,2
271,B0968KS2S5,Men's Sm 651 Industrial Shoe,Sparx,0,0,0,0,4.3,478,0,,0,478
272,B09HMW8SVG,Grey Sports Shoes for Men,Allen Cooper,0,0,0,"1,329",4.0,6,72,,1,6
273,B08JCN9V3W,Men's Rso0825 Walking Shoe,Red Tape,0,0,0,"2,189",4.1,154,70,,1,154
274,B09PR9LYWP,Men SM-523 Sports Shoes,Sparx,0,0,0,"1,249",5.0,1,0,,1,1
275,B01LZQ9ZO1,Men's Lionel Running Shoes,Power,0,0,0,692,3.8,"2,323",37,,1,"2,323"
276,B08VD7LVP9,"Sports Shoes for Men | Latest Stylish Casual Sneakers for Men | Lace up Lightweight Shoes for Running, Walking, Gym, Trekking, Hiking & Party | Running Shoes for Men | Training Shoes for Men",Kraasa,0,0,0,499,3.6,565,50,,1,565
277,B07M871FCV,Men's Drogo M Running Shoes,Adidas,0,0,0,"1,648",4.2,326,39,,1,326
278,B09CTWGFFL,Women's Stylish Lightweight | Casual Shoes | Sports Shoes,ZAPATOZ,0,0,0,699,4.0,107,30,,1,107
279,B08CC2B396,Sneakers for Men,Kraasa,0,0,0,499,3.0,"1,377",50,,1,"1,377"
280,B07DXYYZ3L,"PRIME-01 Walking Shoes, Running Shoes, Sports Shoes, Gym Shoes, Training Shoes, Tracking Shoes, Casual Shoes, Combo Shoes for Men…",ASIAN,0,0,0,725,3.9,"3,594",27,,1,"3,594"
281,B0914M88KG,Men's 11g-787-g-blk-red-$p Running Shoes,Campus,0,0,0,"1,619",4.0,"2,427",10,,1,"2,427"
282,B012CG2A48,Blast Cricket Shoes,Vector X,0,0,0,499,3.8,"1,683",0,"Tuesday, February 15",1,"1,683"
283,B07L8LB87S,Women's Perry (L) Running Shoes,Campus,0,0,0,519,4.1,562,26,,1,562
284,B08Y6ZK23F,Women Stylish Fashionable & Sneaker Shoes for Running/Sports/Outdoors/Morning Walking/Basketball/Trekking/Dance (Black)_ES-5001-108-37,Earth Step,0,0,0,465,3.5,63,53,,1,63
285,B081ZYRBMM,Men's Wisdom Running Shoes,Campus,0,0,0,"1,071",4.0,"1,896",29,,1,"1,896"
286,B08VJ8L1NK,Men Sport Shoe Navy Blue Sports Shoes - 9 UK,SEGA,0,0,0,675,3.6,71,29,,1,71
287,B08VS3GJNL,Men's 11g-772 Shoes,Campus,0,0,0,"1,619",4.0,841,10,,1,841
288,B08SHSDVKL,Women's Sl-164 Running Shoe,Sparx,0,0,0,930,4.4,"1,426",15,,1,"1,426"
289,B091XZXN32,Unisex-Child Kids Sports Shoes Sneaker,Amazon Brand - Jam & Honey,0,0,0,616,4.2,20,66,,1,20
290,B091Y61ZZR,Unisex-Child Kids Sports Shoes Sneaker,Amazon Brand - Jam & Honey,0,0,0,599,3.7,10,63,,1,10
291,B07NDXBR6V,Mens Rapid Sports Casual Running Shoes Walking Jogging Gym Sneakers Comfortable Breathable Trainers Athletic (Size UK-6 to 12),Bacca Bucci,0,0,0,"1,199",3.6,114,52,,1,114
292,B07KF6QYW1,mens Prime-01 Loafer Flat,ASIAN,0,0,0,499,3.7,100,50,,1,100
293,B08537N24P,Men's Barley Running Shoes,Campus,0,0,0,766,3.9,264,41,,1,264
294,B08YJZ8VF2,"Men's Air Wonder Series Mesh Casual Sports Sneakers Shoes for Men & Boys, Walking, Running Shoes/Gymwear, Lightweight Shoes for Daily Use White",TYFARZ,0,0,0,439,2.9,364,56,,0,364
295,B0865BN9ZM,Men's Equalizer 4.0-Phairme Sneakers,Skechers,0,0,0,"2,805",4.8,6,53,,1,6
296,B09R1QBJC6,Men's Comfortable|Air Series Febric|Textile Lace up Sport|Running|Walking Shoe,Onivixo,1,0,0,749,0,0,50,,0,"₹749
₹1,499 Save ₹750 (50%)"
297,B07NDXJ3KN,Mens Rapid Sports Casual Running Shoes Walking Jogging Gym Sneakers Comfortable Breathable Trainers Athletic (Size UK-6 to 12),Bacca Bucci,1,0,0,"1,199",4.0,37,52,,1,37
298,B08JJ359NK,Men's Running Shoes,Global Rich,1,0,0,"1,904",3.1,18,37,,1,18
299,B08Y9F8JMN,Men's Roadrunner 2.0 Running Shoes for Tuff Surface Run with Natural Rubber & Eva Sole and Breathable Upper,Bacca Bucci,1,0,0,"1,599",3.5,29,47,,1,29
300,B08L6G79LH,MiracleFly Grey Sky Lace Up Running Sports Shoes,Columbus,1,0,0,"1,199",0,0,0,,1,"₹1,199"
301,B08TY5682S,Men's Casual Mesh Material Running Sports Shoes,Global Rich,1,0,0,619,3.9,3,79,,1,3
302,B09R1Q7Q7F,Men's New Series|Light Weight Mesh Lace up Sport|Running|Walking Shoe,ORIESTAR,1,0,0,749,0,0,58,,1,"₹749
₹1,799 Save ₹1,050 (58%)"
303,B01MYCZI6S,"Men's Jogging, Walking & Running (Narrow Toe) Shoes 032-black Sneakers",Unistar,1,0,0,482,3.9,265,3,,0,265
304,B0865BN9ZM,Men's Equalizer 4.0-Phairme Sneakers,Skechers,0,0,0,"2,805",4.8,6,53,,1,6
305,B09HBWH4DB,Sports Shoes for Men,Allen Cooper,0,0,0,"1,281",3.8,19,73,,1,19
306,B07HRD2CYW,Women's Sx0124l Running Shoes,Sparx,0,0,0,849,4.3,"2,260",15,,1,"2,260"
307,B07P7KWD78,Men's Sx0406g Black Running Shoes-9 UK (SM406_BKBK009),Sparx,0,0,0,892,4.2,481,15,,1,481
308,B07HKHFNYX,Men's Xtream Running Shoes,Fusefit,0,0,0,829,3.9,"4,769",70,,1,"4,769"
309,B0836NDYWD,Men's (9310) Grey Casual Sports Running Shoes,Camfoot,0,0,0,298,1.5,5,40,,0,5
310,B094VHNFNQ,Men's Rout2 Running Shoe,Reebok,0,0,0,"1,607",4.1,281,38,,1,281
311,B07W4L5J6T,Men's Mesh Green Running Sport Shoes (10),SEGA,0,0,0,675,4.2,40,29,,1,40
312,B07N9HRPY9,Men Sweep Runner Running Shoes,Reebok,0,0,0,"1,408",4.0,350,50,,1,350
313,B07S9QZ4NR,boys Lionel Running Shoes,Power,0,0,0,599,4.1,23,40,,1,23
314,B08D7XZ93B,Runner,SEGA,0,0,0,850,3.8,653,39,,1,653
315,B0842QNN47,Men's Running Sports Shoes,aadi,0,0,0,398,3.6,"3,041",60,,0,"3,041"
316,B097TMR4SW,Men's Rso125 Walking Shoe,Red Tape,0,0,0,"1,434",4.2,107,80,,1,107
317,B08PZ8C749,Men's Sx0666g Running Shoes,Sparx,0,0,0,"1,209",3.9,145,19,,1,145
318,B08F3L67RK,Men's Running Shoes,Campus,0,0,0,"1,349",4.1,"3,379",10,,1,"3,379"
319,B09B3ZS8YG,Kids & Boys (1666) Casual Stylish Sports Shoes,WORLD WEAR FOOTWEAR,0,0,0,403,2.5,6,19,,0,6
320,B084WWP814,Men's Running Shoe,Bacca Bucci,1,0,0,"1,299",3.2,33,57,,1,33
321,B08YDKPWTN,Men's Roadrunner 2.0 Running Shoes for Tuff Surface Run with Natural Rubber & Eva Sole and Breathable Upper,Bacca Bucci,1,0,0,"1,599",3.5,29,47,,1,29
322,B07DTJ7Y3N,Men's Walking Shoes,Bacca Bucci,1,0,0,"1,099",4.5,11,56,,1,11
323,B093DT41WK,Men Running Shoe Walking,Amazon Brand - Symactive,1,0,0,799,3.8,43,65,,1,43
324,B08YF4D9N9,Men's Glide-Step Sport-New Appeal Sneaker,Skechers,0,0,0,"2,620",4.3,160,56,,1,160
325,B095T1BY4V,Men's Terminator (N) Running Shoes,Campus,0,0,0,"1,403",4.0,349,22,,1,349
326,B08TMQC59Z,Men's Energy Runner 2.0 Running Shoe,Reebok,0,0,0,"1,150",4.0,87,50,,1,87
327,B09RBCM8H2,Sea Green Marathon/Running Sports Shoes for Men (C Green),SEGA,0,0,0,675,0,0,29,,1,"₹675
₹949 Save ₹274 (29%)"
328,B07VX538FG,Men's Sm-406 Running Shoe,Sparx,0,0,0,880,4.1,871,16,,1,871
329,B07SW3LTLF,Women's Alexa Running Shoes,Campus,0,0,0,968,4.2,"3,582",43,,1,"3,582"
330,B01AQPHKC4,Men's Running Shoes,Sparx,0,0,0,"1,124",4.0,"3,194",25,,1,"3,194"
331,B083GX7G6B,Men's Running Shoes,AFROJACK,0,0,0,449,3.3,122,78,,0,122
332,B07ZQDS375,Air Casual Sports White Blue Running Shoes for Men's,Maddy,0,0,0,569,3.6,236,43,,1,236
333,B092DNCNX5,Men's Rso111 Walking Shoes,Red Tape,0,0,0,"1,799",4.2,909,70,,1,909
334,B08WRV51MJ,Men's Pacer Balance Idp Running Shoe,Puma,0,0,0,"1,720",4.3,13,60,,1,13
335,B084VFT1PW,Mesh Shoe Scorer 4.0 Wht/Navy/Silver,SG,0,0,0,953,3.9,49,5,"Tuesday, February 15",1,49
336,B08K9R3WRM,Men's Black Golden Running Shoes-6 (SX0648G_BKGO0006),Sparx,0,0,0,809,5.0,1,10,,1,1
337,B0978WVXWJ,Men's Casual Running Shoes Walking Sock Slip on Lightweight Breathable Sneakers Athletic Fashion Sports Shoes - AR3P,Arivo,0,0,0,649,3.2,128,64,,1,128
338,B09QYWY1VC,Men's Plasma-09 Running Shoes for Men I Sport Shoes for Boys with Eva Sole for Extra Jump I Casual Shoes for Men,ASIAN,0,0,0,599,0,0,40,,1,"₹599
₹999 Save ₹400 (40%)"
339,B08WWX4TLQ,Sports Running Shoes for Men (Black),Camfoot,0,0,0,374,3.3,104,25,,0,104
340,B07FCP36CW,Men's Flex O Fusion LP Blk/Wild Orange Running Shoes-9 UK (EGX60),Reebok,0,0,0,"1,540",3.1,30,65,,1,30
341,B07H7S9DVX,Mens LS-2005 Sports Shoes,Liberty,0,0,0,849,3.8,542,19,,0,542
342,B08VGKTDZ8,Men's (9228-9279-1243) Casual Sports Running Shoes,WORLD WEAR FOOTWEAR,0,0,0,732,2.5,141,51,,1,141
343,B08DDGFHNK,Original Men's Blue Juno Outdoor Sports Shoes,SEGA,0,0,0,835,4.0,61,44,,1,61
344,B088FTRSPW,Men's Running Shoe,ASIAN,0,0,0,699,3.9,"1,260",30,,1,"1,260"
345,B01LWYFHO7,Men's Gallop Running Shoes,Power,0,0,0,714,4.1,"2,112",45,,1,"2,112"
346,B07TTCJ5L6,Women's Running Shoes,Amazon Brand - Symactive,0,0,0,849,4.1,221,74,,1,221
347,B094PZ7Y61,Men's Adi Zoom M Running Shoe,Adidas,0,0,0,"1,409",3.7,41,57,,1,41
348,B08TMC143C,mens Hybrid Woke Running Shoe,Puma,0,0,0,"2,709",4.6,5,58,,1,5
349,B082QHDVN2,Men's Guide Stride Run Lp Conavy/REDRUS/None Shoes-9 UK (10 US) (FV9559),Reebok,0,0,0,"1,725",4.1,515,38,,1,515
350,B09DCXRFHV,Men Sports Shoes Black V-103,Lancer,0,0,0,257,0,0,57,,0,"₹257
₹599 Save ₹342 (57%)"
351,B09Q3GDNLF,Women's Sports Running Shoes Outdoor Lightweight Gym Shoes,Longwalk,0,0,0,599,0,0,50,,1,"₹599
₹1,199 Save ₹600 (50%)"
352,B08WWV6HWT,Cool Sports Shoes Design M Sticker On for Women & Girls,HimQuen,0,0,0,546,3.8,665,39,,1,665
353,B08Y726ZKM,Women Stylish Fashionable & Sports Shoes for Running ||Walking||Sports||Outdoors ES-Off WHI,Earth Step,0,0,0,479,4.1,82,52,,1,82
354,B08ZSM3VG9,Women's (5050-5051-5052) Multicolor Casual Sports Running Shoes (Set of 3 Pair),WORLD WEAR FOOTWEAR,0,0,0,657,0,0,56,,1,"₹657
₹1,497 Save ₹840 (56%)"
355,B08RDPZ73R,Women's Sl-175 Sports Shoes,Sparx,0,0,0,996,4.3,205,20,,1,205
356,B08CKTRBBH,Men's Vega Pearl-z2 Running Shoes,Bourge,1,0,0,769,4.2,"55,268",49,,1,"55,268"
357,B07RC9RPW3,Men's Running Shoe,Bacca Bucci,1,0,0,"1,199",4.4,94,52,,1,94
358,B083FLMWXV,Mens Trainers Athletic Walking Running Gyming Jogging Fitness Sneakers/Sports Shoes,Bacca Bucci,1,0,0,"1,199",2.6,7,52,,1,7
359,B08G27GJBN,Men's Running Shoes,Global Rich,1,0,0,586,1.0,1,41,,1,1
360,B09R1S5NRJ,Men's Decent Look|Perfect Style Mesh Lace up Sport|Running|Walking Shoe,ORIESTAR,1,0,0,749,0,0,58,,1,"₹749
₹1,799 Save ₹1,050 (58%)"
361,B01N274EYI,"Men's Jogging, Walking & Running (Narrow Toe) Shoes 032-black Sneakers",Unistar,1,0,0,482,3.9,265,3,,0,265
362,B08TY518R6,Men's Casual Mesh Material Running Sports Shoes,Global Rich,1,0,0,"2,342",0,0,22,,1,"₹2,342
₹2,999 Save ₹657 (22%)"
363,B09QSKHMM7,Men's Decent Look|Perfect Style Mesh Lace up Sport|Running|Walking Shoe,Bogg Man Shop,1,0,0,749,0,0,58,,1,"₹749
₹1,799 Save ₹1,050 (58%)"
364,B08PWZ51NS,Men's Sm-646 Running Shoe,Sparx,0,0,0,679,4.1,334,15,,1,334
365,B09P6JB966,"Xpert Sports Shoes for Boys, Kids Sports Shoes, Running Shoes for Boys & Girls, Outdoor Sports Shoes for Kids 4 to 12 Years, Navy Shoes, Blue Shoes, Designer Kids Shoes, Kids Shoes for Dance.",xpert,0,0,0,449,3.5,3,25,,0,3
366,B085B2MMSG,Men's Sm-632 Running Shoe,Sparx,0,0,0,"1,430",4.1,356,16,,1,356
367,B07WS1FZDH,"Men Black Model-1200 Loafers,Sneakers,Sports Shoes, Running Shoes for Men,Cricket Shoes,Casual Shoes,Trekking Shoes,Comfortable for Men's",WORLD WEAR FOOTWEAR,0,0,0,281,3.1,32,44,,0,32
368,B071LHNNRV,Men's Running Shoes,Bacca Bucci,0,0,0,914,3.7,539,70,,1,539
369,B096VHSJVG,Tarshika Men's Sports Running Shoes,Tarshika,0,0,0,422,3.3,670,81,,0,670
370,B08TM8Y21R,Women's Conor Running Shoe,Reebok,0,0,0,"1,300",4.3,64,50,,1,64
371,B09G6FR128,Unisex Jaffa 22 Cricket Shoes,DSC,0,0,0,"1,880",4.3,116,6,"Monday, February 14",1,116
372,B07M872H94,Men's Hyperon-1.0-m Running Shoe,Adidas,0,0,0,"1,205",3.9,876,60,,1,876
373,B09815G5KY,"Women's Tokyo-01 Sports,Running,Walking & Casual Sneakers Shoes…",ASIAN,0,0,0,499,3.9,875,50,,1,875
374,B09C29Q9M7,mens Sports Shoes Sports,BRUTON,0,0,0,309,2.8,10,76,,1,10
375,B07T23RLHC,Men's Running Shoe,ASIAN,0,0,0,499,4.1,317,17,,1,317
376,B01MSJNMFE,mens Sx-277 Running Shoes,Sparx,0,0,0,877,4.1,"2,554",10,,1,"2,554"
377,B07VMD4STG,Men's Sx0443g Sports Shoes,Sparx,0,0,0,"1,133",3.8,619,33,,1,619
378,B09C1V622V,Kids & Boys (1667-1208-1665) Casual Stylish Sports Shoes (Set of 3 Pair),WORLD WEAR FOOTWEAR,0,0,0,732,3.4,35,51,,1,35
379,B08ZL22X32,Men's (1242-9310-5011) Multicolor Casual Sports Running Shoes (Set of 3 Pair),WORLD WEAR FOOTWEAR,0,0,0,713,3.1,244,52,,1,244
380,B07RS767G7,Men's Vega Pearl-z2 Running Shoes,Bourge,1,0,0,729,4.2,"55,268",51,,0,"55,268"
381,B099FC8CPQ,Tesla-44 Running Shoes for Men,Kraasa,1,0,0,499,3.6,256,50,,1,256
382,B08YDHLD5T,Men's Roadrunner 2.0 Running Shoes for Tuff Surface Run with Natural Rubber & Eva Sole and Breathable Upper,Bacca Bucci,1,0,0,"1,599",3.5,29,47,,1,29
383,B082Z6RL7L,Men's Running Shoe,Bacca Bucci,1,0,0,"1,234",1.5,2,59,,1,2
384,B09DCVZ7M3,Women Sports Shoes Black Crystal-102 (6UK),Lancer,0,0,0,599,0,0,0,,1,₹599
385,B09B5XJTG7,Men's Korean Style High Top Platform Fashion Sneakers/Sports/Casual Shoes for Men || Ankle Casual Shoes for Men Latest,Zixer,0,0,0,699,3.5,560,65,,1,560
386,B08DKXF5VT,Men's Walking Shoe,Bacca Bucci,1,0,0,"1,399",3.6,246,53,,1,246
387,B093DT82GG,Men Running Shoe Walking,Amazon Brand - Symactive,1,0,0,799,3.8,43,65,,1,43
388,B093DTR6MM,Men Running Shoe Walking,Amazon Brand - Symactive,1,0,0,749,4.0,36,64,,1,36
389,B07D159YJC,Mens Trainers Athletic Walking Running Gyming Jogging Fitness Sneakers/Sports Shoes,Bacca Bucci,1,0,0,"1,198",3.9,127,52,,1,127
