,asin,title,brand,Sponsored,Best Seller,Amazon's Choice,Price,Rating,NoofRatings,Discount,Delivery,Prime Delivery,base
0,B07GVVCQY6,Presto! 2 Ply Kitchen Tissue/Towel Paper Roll - 6 Rolls (60 Pulls Per Roll),Presto!,1,0,1,379,4.4,"14,092",10,"Friday, February 18",1,"14,092"
1,B07MJF5THB,Amazon Brand - Solimo 2 Ply Kitchen Tissue Paper Roll - 4 Rolls (60 Pulls Per Roll),Amazon,1,0,0,257,4.4,"12,055",8,"Sunday, February 20",1,"12,055"
2,B07GVYG2L3,Amazon Brand - Solimo 2 Ply Kitchen Tissue/Towel Paper Roll - 2 Rolls (60 Pulls Per Roll),Amazon,1,0,0,144,4.4,"5,857",10,"Friday, February 18",1,"5,857"
3,B07GVV8C7Z,Amazon Brand - Solimo 2 Ply Kitchen Tissue/Towel Paper Roll - 6 Rolls (60 Pulls Per Roll),Amazon,1,0,0,379,4.4,"1,971",10,"Friday, February 18",1,"1,971"
4,B07GVVCQY6,Presto! 2 Ply Kitchen Tissue/Towel Paper Roll - 6 Rolls (60 Pulls Per Roll),Presto!,0,0,1,379,4.4,"14,092",10,"Friday, February 18",1,"14,092"
5,B07MJF5THB,Amazon Brand - Solimo 2 Ply Kitchen Tissue Paper Roll - 4 Rolls (60 Pulls Per Roll),Amazon,0,0,0,257,4.4,"12,055",8,"Sunday, February 20",1,"12,055"
6,B07GVV8C7Z,Amazon Brand - Solimo 2 Ply Kitchen Tissue/Towel Paper Roll - 6 Rolls (60 Pulls Per Roll),Amazon,0,0,0,379,4.4,"1,971",10,"Friday, February 18",1,"1,971"
7,B07GVYG2L3,Amazon Brand - Solimo 2 Ply Kitchen Tissue/Towel Paper Roll - 2 Rolls (60 Pulls Per Roll),Amazon,0,0,0,144,4.4,"5,857",10,"Friday, February 18",1,"5,857"
8,B07PJQX981,"Beco Reusable Kitchen Towel Roll, Natural & Organic Cleaning Bamboo Cloth – ""Not a Tree Paper Napkin"" – Ecofriendly and Biodegradable, (20 Sheets) (Replaces 6 Months of Paper Rolls)",Beco,0,0,0,239,4.5,"2,342",20,"Friday, February 18",1,"2,342"
9,B09B7W9P6M,Washable and Reusable - 2 Ply Kitchen Printed Tissue/Towel Paper Roll - Washable and Reusable- 1 Roll (140 Pulls Per Roll)- 60 GSM,Washable,0,0,0,157,3.8,28,69,"Monday, February 21",0,28
10,B06XJ4Y466,Selpak Imported Paper Towel Kitchen Roll 3 Ply - 6 Rolls,Selpak,0,0,0,578,4.6,"1,224",14,"Tuesday, February 22",1,"1,224"
11,B09G4865L7,Palshiv Non-Woven Reusable and Washable Kitchen Printed Tissue Roll Non-stick Oil Absorbing Paper Roll Kitchen Special Paper Towel Wipe Paper Dish Cloth Cleaning Cloth 25x25cm (50pcs per roll),Palshiv,0,0,0,399,4.4,8,56,"Monday, February 21",0,8
12,B09LHTJ9KT,Phoenix Multifold Hand Towel / M-fold Tissue Paper-1000 Pieces From Rokoo,Phoenix,0,0,0,399,4.4,18,60,"Wednesday, February 23",1,18
13,B0756QTWTP,Scott Multi-Fold Paper Towel 28610 - 1 Pack x 250 Sheets (White Colour - Sheet Size 24 cm X 23.1 cm),Scott,0,0,0,209,4.4,403,0,"Friday, February 18",0,403
14,B07JQPJVZH,Dhwani Enterprise M Fold Tissue Paper - 1300 Piece PACK OF 10 Packets,Dhwani,0,0,0,405,4.3,999,3,"Monday, February 21",0,999
15,B08FQVW64B,Pack of 2 Rolls - 2 Ply Kitchen Tissue/Towel Paper Roll Washable- 2 rolls (140 Pulls Per Roll)- 60 GSM- Total 280 Pulls,Pack,0,0,0,260,3.7,31,35,"Monday, February 21",1,31
16,B09R7K5DCJ,Qolixs Non-Woven Reusable and Washable Kitchen Printed Tissue Roll Non-stick Oil Absorbing Paper Roll Kitchen Special Paper Towel Wipe Paper Dish Cloth Cleaning Cloth ( 50 sheets) pack of 1,Qolixs,0,0,0,149,5.0,5,70,"Monday, February 21",1,5
17,B07GVNFVDT,Amazon Brand - Presto! Non-woven Kitchen Towel Roll - 80 Pulls (Red),Amazon,0,0,0,180,4.4,"4,009",10,"Sunday, February 20",1,"4,009"
18,B00E3QW8ES,Origami 2 Ply Absorbent Kitchen Towel - 60 pulls per roll - Pack of 4 rolls - Total 240 pulls,Origami,0,0,0,235,4.3,292,11,"Tuesday, February 22",1,292
19,B083FWFJ2P,SELPAK Paper Towel Tissue Kitchen Roll 3ply 5+1 Rolls FREE On Pack Promo,SELPAK,0,0,0,399,4.7,282,43,"Monday, February 21",0,282
20,B08KR1VBHJ,Scott Essential Multi Fold Hand Towel 38002C - M Fold Towel - 16 Packs x 250 Sheets - White Folded Towel Sheets 22.3 X 20.4 cm (4000 Total),Scott,1,0,0,"1,953",4.3,41,11,"Sunday, February 20",1,41
21,B09F3T1S9H,"Coze Kitchen Tissue Roll (2 Ply, 120 Pulls) | Pack of 2 | FDA approved, OBA free | 2x absorption | For granite, steel, glass, tile, wood | Kitchen Roll | Kitchen Tissue Paper Roll | Kitchen Towel Roll",Coze,1,0,0,229,4.2,132,8,"Monday, February 21",1,132
22,B07PJQX981,"Beco Reusable Kitchen Towel Roll, Natural & Organic Cleaning Bamboo Cloth – ""Not a Tree Paper Napkin"" – Ecofriendly and Biodegradable, (20 Sheets) (Replaces 6 Months of Paper Rolls)",Beco,1,0,0,239,4.5,"2,342",20,"Friday, February 18",1,"2,342"
23,B08P7CPGD9,Origami Good Karma kitchen towel-2in1-3 pack of 6 rolls,Origami,1,0,0,600,4.3,144,0,"Monday, February 21",1,144
24,B0756JQ9TX,Scott Multi-Fold Paper Towel 28620-1 Pack x 250 Sheets (White Colour - Sheet Size 24 cm X 19.6 cm),Scott,0,0,0,189,4.0,243,17,"Friday, February 18",0,243
25,B07MVPY62K,Selpak Kitchen Towel Paper - 3Ply (4 Rolls/Pack),Selpak,0,0,0,390,4.7,720,0,"Wednesday, February 23",0,720
26,B09F3T1S9H,"Coze Kitchen Tissue Roll (2 Ply, 120 Pulls) | Pack of 2 | FDA approved, OBA free | 2x absorption | For granite, steel, glass, tile, wood | Kitchen Roll | Kitchen Tissue Paper Roll | Kitchen Towel Roll",Coze,0,0,0,229,4.2,132,8,"Monday, February 21",1,132
27,B09MS5FPZJ,"Rusabl Bamboo Kitchen Towel Roll for Cleaning | Reusable | No-Tree Paper, Kitchen Cloth | Eco-friendly and Biodegradable | Chlorine-free (1 Roll of 50 Sheets | 11"" x 12"" Perforated Sheets)",Rusabl,0,0,0,198,4.7,47,1,"Friday, February 18",1,47
28,B096XL8JWT,"Shrayati Kitchen Tissue Paper Rolls / Towel, 4 Ply, Pack of 2 Rolls",Shrayati,0,0,0,269,4.0,28,55,"Thursday, February 24",0,28
29,B08HHZZC58,Softouch 4 Ply Kitchen Tissue Paper Roll - 2 Rolls (58 Pulls Per Roll),Softouch,0,0,0,149,3.8,283,25,"Sunday, February 20",1,283
30,B07MVGHFXL,Selpak Kitchen Towel Paper - 3Ply (2 Rolls/Pack),Selpak,0,0,0,229,4.4,419,0,"Friday, February 18",1,419
31,B077G25NLV,Selpak Paper Towel Kitchen Roll Tissue 3ply (3 rolls),Selpak,0,0,0,278,4.6,174,1,"Tuesday, February 22",1,174
32,B09NW2CKDC,SELPAK Paper Towel Tissue Kitchen Roll 3 Ply 3 +1 Roll Free on Promo Pack,SELPAK,0,0,0,360,5.0,1,8,"Tuesday, February 22",1,1
33,B08R6C47LK,SELPAK Deluxe Paper Towel Bamboo Enriched 3ply 2rolls/pack (30255),SELPAK,0,0,0,230,4.6,69,0,"Friday, February 18",1,69
34,B09H6PX3W7,Washable Kitchen Printed Tissue Towels - Non-Woven Reusable and Washable Kitchen Printed Tissue Roll - 1 Roll - 120 Wipes Pulls,Washable,0,0,0,160,2.9,6,68,"Monday, February 21",0,6
35,B095WXKVKX,Fiber + Non-Woven Multipurpose Kitchen Towel Roll Big Size (Pack of 2),Fiber,0,0,0,198,4.2,104,43,"Monday, February 21",0,104
36,B00W1SO1A4,Origami So Soft Non-Woven Washable Kitchen Wipes - 2 Rolls - 80 Wipes Per Roll - Total 160 Wipes,Origami,0,0,0,316,4.4,"5,788",17,"Friday, February 18",1,"5,788"
37,B09HXXRVVP,F A B L A S Non-Woven Washable Kitchen Wipes - 1 Roll - 80 Wipes per roll,F,0,0,0,170,5.0,1,13,"Tuesday, February 22",0,1
38,B0785N5DV2,Origami NonWoven Reusable and Washable Kitchen Wipes - 3 Rolls - 80 Wipes per roll - Total 240 Wipes,Origami,0,0,0,570,4.3,"3,166",0,"Friday, February 18",1,"3,166"
39,B08MZRLZNJ,F A B L A S Non-Woven Kitchen Wipes for Cleaning | Pack of 2 Kitchen Rolls | Washable & Reusable Tissue Roll for Kitchen | Kitchen Cleaning Wipes | Kitchen Roll Reusable | 80 Wipes per roll | Total 160 Wipes,F,0,0,0,290,4.2,"1,039",26,"Tuesday, February 22",0,"1,039"
40,B09KH9B5Q4,"CareDone Kitchen Towel Roll Reusable Washable for Multipurpose Super Absorbent, Dish Towels, Soft Touch Handy Wipes,Alternative - Eco Friendly (Magenta Pink, 80 Pulls, Pack of 1 )",CareDone,0,0,0,159,3.7,3,82,"Monday, February 21",1,3
41,B07952M39M,"Beeta Coloured Kitchen Tissue Towel Roll |Pack of 3, 106 pulls x 3 ply (Assorted or Identical Col.)",Beeta,0,0,0,296,3.9,169,34,"Monday, February 21",1,169
42,B078WPMVZ1,Selpak Z Fold Paper Towel 2ply 200sheets,Selpak,0,0,0,161,4.4,45,20,"Sunday, February 20",1,45
43,B00E3QW6P4,"Origami Kitchen Paper Rolls, 2-in-1, 60 Pulls",Origami,0,0,0,125,4.3,236,11,"Tuesday, February 22",1,236
44,B09RZKSC5N,2 Ply Kitchen Towel Paper Roll - 2 Rolls 2 PLY (80 Pulls ),2,0,0,0,229,0,0,53,"Monday, February 21",0,"₹229
₹490 Save ₹261 (53%)"
45,B07MGRCQKT,Selpak Calorie Absorber Kitchen Towel Paper Tissue - 3 Roll,Selpak,0,0,0,366,4.5,209,7,"Tuesday, February 22",1,209
46,B0992J5VGJ,"PAGHADI Kitchen Tissue Paper,Non-stick Oil Absorbing Paper Roll Kitchen Special Paper Towel Wipe Paper Dish Cloth Cleaning Pack Of ( 1 )",PAGHADI,0,0,0,339,3.6,13,52,"Monday, February 21",1,13
47,B094JRX2TX,"MasKing Kitchen Dry Cleaning Wipes, Tissue, Towel Roll Reusable Washable Super Absorbent Multipurpose Cleaning tissue 50 Pulls Per Roll (Pack of 2)",MasKing,0,0,0,300,3.7,19,67,"Wednesday, February 23",1,19
48,B08P7CPGD9,Origami Good Karma kitchen towel-2in1-3 pack of 6 rolls,Origami,0,0,0,600,4.3,144,0,"Monday, February 21",1,144
49,B09FXL9JVT,"Century Kitchen Towel Tissue Rolls (21X22cm) Food Safe 2 Ply - 60 Pulls Per Roll | Made up of 100% Virgin Pulp, OBA-Free, FDA Certified and 100% Hygienic (Pack of 2, White)",Century,0,0,0,260,4.0,1,13,"Monday, February 21",0,1
50,B017K6AKKQ,Ezee M Fold Tissue Paper - 260 Pieces,Ezee,0,0,0,202,3.8,391,6,"Friday, February 18",1,391
51,B08WRWRTHW,Origami 2 Ply Kitchen Towel Roll - 21x22cm - 60 Pulls Per Roll - Pack of 6 Single Rolls - 360 Pulls,Origami,0,0,0,0,3.7,41,0,,0,41
52,B09B7V6LX9,Super Absorbent 2 Ply Kitchen Printed Tissue/Towel Paper Roll - Washable and Reusable- 1 Roll (140 Pulls Per Roll)- 60 GSM,Super,0,0,0,190,4.5,2,0,"Monday, February 21",1,2
53,B09DW8G3P8,"Mondo Kitchen Wipes for Cleaning (1 Ply, 80 Pulls) | Pack of 2 Kitchen Rolls | Washable & Reusable Tissue Roll for Kitchen | Soaks Oil Spills Quickly | Kitchen Cleaning Wipes | Kitchen Roll Reusable",Mondo,0,0,0,379,4.7,51,12,"Monday, February 21",1,51
54,B09GW4SQGP,Real Deal High Absorbent 1500 Sheets Pack of 10 M Fold Tissue Paper White Folded Towel Sheets 22.3 X 20.4 cm Model Number #312331,Real,0,0,0,499,0,0,38,"Monday, February 21",0,"₹499
₹799 Save ₹300 (38%)"
55,B08GM268R6,"Jovial Paper Kitchen Towel 4 Ply, 60 Pulls (Pack of 5)",Jovial,0,0,0,425,5.0,3,15,"Wednesday, February 23",1,3
56,B09P1JYBM8,"Kleenex VIVA Kitchen Towel - Paper Towel/Multi-use Cleaning Towels - 2 Rolls x 60 Pulls Per Roll (120 Towels) From Kimberly Clark- Made in Australia,White,44301",Kleenex,1,0,0,260,2.0,1,0,"Friday, February 18",0,1
57,B09P1HQY3R,"Kleenex VIVA Kitchen Towel - Paper Towel/Multi-use Cleaning Towels - 4 Rolls x 60 Pulls Per Roll (240 Towels) From Kimberly Clark - Made in Australia,White,44301A",Kleenex,1,0,0,381,0,0,15,"Friday, February 18",0,"₹381
₹449 Save ₹68 (15%)"
58,B096XL8JWT,"Shrayati Kitchen Tissue Paper Rolls / Towel, 4 Ply, Pack of 2 Rolls",Shrayati,1,0,0,269,4.0,28,55,"Thursday, February 24",0,28
59,B09P1J58XY,"Kleenex VIVA Kitchen Towel - Paper Towel/Multi-use Cleaning Towels - 6 Rolls x 60 Pulls Per Roll (360 Towels) From Kimberly Clark - Made in Australia,White,44301B",Kleenex,1,0,0,579,0,0,11,"Friday, February 18",1,"₹579
₹649 Save ₹70 (11%)"
60,B07GVNGGM1,Presto! 2 Ply Kitchen Tissue/Towel Paper Roll - 2 Rolls (60 Pulls Per Roll),Presto!,1,1,0,144,4.4,"14,092",10,"Friday, February 18",1,"14,092"
61,B0756QTWTP,Scott Multi-Fold Paper Towel 28610 - 1 Pack x 250 Sheets (White Colour - Sheet Size 24 cm X 23.1 cm),Scott,1,0,0,209,4.4,403,0,"Friday, February 18",0,403
62,B0756JQ9TX,Scott Multi-Fold Paper Towel 28620-1 Pack x 250 Sheets (White Colour - Sheet Size 24 cm X 19.6 cm),Scott,1,0,0,189,4.0,243,17,"Friday, February 18",0,243
63,B0839QVLLS,"Scott Multifold Paper Towels with Fast-Drying Absorbency Pockets, White, 30 Packs per Case, 150 M-Fold towels per Pack, 4500 M Fold sheets (1222A)",Scott,1,0,0,"2,062",4.3,40,14,"Friday, February 18",1,40
64,B09H8Q1P7B,ALOUD CREATIONS Paper Towel Kitchen Roll 3 Ply - 4 Rolls (66 Pulls Per Roll),ALOUD,0,0,0,315,2.5,5,2,"Monday, February 21",1,5
65,B08L9GGNSP,"Globomotive 2 Ply Kitchen Tissue/Towel Paper Roll (Pack of 12,60 Pulls Per Roll)",Globomotive,0,0,0,669,3.7,45,33,"Monday, February 21",1,45
66,B07XKCBRKP,Paseo Elegent Plain Paper Towel Kitchen Roll 2 Ply (8 Rolls),Paseo,0,0,0,464,4.4,61,45,"Monday, February 21",1,61
67,B094JRCFFV,"MasKing Nonwoven Kitchen Wipe Towel Tissue Paper Roll Reusable Washable Multi-purpose Dry Cleaning Roll, 50 Pulls Per Roll (Combo Pack of 3)",MasKing,0,0,0,405,4.2,88,55,"Wednesday, February 23",1,88
68,B08DR71MVW,Jasmine | 3000 Sheets | Pack Of 20 Piece | M Fold Tissue Paper | High Absorbent | Large Size Tissue | White Folded Towel Sheets | 22.3 X 20.4 cm | Model Number #3400810,Jasmine,0,0,0,899,4.1,188,40,"Monday, February 21",1,188
69,B07P1D2SC5,"Premier Kitchen Towel, Pack of 4, 60 Count Pouch with FunFoil, 9 m",Premier,0,0,0,270,4.3,822,0,"Monday, February 21",1,822
70,B079H9C69Y,Premier Kitchen Towel - 60 Count Pouch (Pack of 4),Premier,0,0,0,189,4.1,196,5,"Monday, February 21",1,196
71,B08GHZ79CP,Biogreen Kitchen Tissue/Towel 2 Ply Kitchen Tissue/Towel Paper Roll - 2 Rolls,Biogreen,0,0,0,145,0,0,3,"Tuesday, February 22",1,"₹145
₹149 Save ₹4 (3%)"
72,B09LMGZCJC,Washable and Reusable - 1 Ply Kitchen Printed Tissue/Towel Paper Roll - Washable and Reusable(Pack Of 2),Washable,0,0,0,259,0,0,57,"Monday, February 21",1,"₹259
₹599 Save ₹340 (57%)"
73,B07MK3PFGZ,Premier Kitchen Towel-120 Pulls Pack of 2 (3 2 Get Fun Foil),Premier,0,0,0,135,4.0,98,0,"Monday, February 21",1,98
74,B08H2F2SG6,Selpak 3 Ply Kitchen Tissue Paper Roll - 6 Rolls (80 Pulls Per Roll) - Pack of 2,Selpak,0,0,0,"1,070",4.8,42,20,"Tuesday, February 22",1,42
75,B07PR4KHK6,SELPAK Deluxe Bamboo Enriched Kitchen Towel Paper Tissue 2 Rolls/Pack,SELPAK,0,0,0,218,4.4,120,5,"Thursday, February 24",0,120
76,B08FLZWYR3,Xuro Paseo strong and Natural Kitchen Towels - 4 Rolls,Xuro,0,0,0,286,4.3,149,18,"Monday, February 21",1,149
77,B09B7VXMDX,Highly Absorbent 2 Ply Kitchen Printed Tissue/Towel Paper Roll - Washable and Reusable- 1 Roll (140 Pulls Per Roll)- 60 GSM,Highly,0,0,0,0,3.4,8,0,,0,8
78,B09Q3BNC5V,Phoenix M Fold Tissue Paper-1250 Pieces,Phoenix,0,0,0,360,1.0,2,28,"Tuesday, March 1",0,2
79,B09KXJCRKT,UDAZE Non Woven Reusable Kitchen Towel Rolls Reusable & Washable Wipes| Absorbent Cleaning Wipes,UDAZE,0,0,0,290,4.2,7,15,"Wednesday, February 23",0,7
80,B013R6EDEM,"Scott Slim Hand Tissue Roll with Fast-Drying Absorbency Pockets(HRT Roll), 176 m per roll, pack of 6 rolls, White color-12388K",Scott,1,0,0,"3,290",4.7,7,15,"Tuesday, February 22",1,7
81,B004JJMWH2,"Scott Slimroll Hard Roll Paper Towels (12388) with Fast-Drying Absorbency Pockets (HRT Roll), 176 m per roll, Pack of 6 rolls, White color-12388K",Scott,1,0,0,"3,142",4.2,18,4,"Friday, February 18",1,18
82,B08KR2FPRG,Scott Essential Multi Fold Hand Towel 32152 - M Fold Towel - 40 Packs x 150 Sheets - White Folded Towel Sheets 21 cm X 20 cm (6000 Total),Scott,1,0,0,"2,590",3.6,13,0,"Friday, February 18",1,13
83,B002XJOKNY,"Scott Essential High Capacity Hard Roll Paper Towels (1005), White, 1000' (305 m)/ Roll, 6 Paper Towel Rolls/Convenience Case",Scott,1,0,0,"3,767",4.3,16,16,"Tuesday, February 22",1,16
84,B07951VHZ8,Beeta Kitchen Towel Roll 10 Inches - Jumbo Thick 100pulls x 4 ply (Pack of 2),Beeta,0,0,0,310,4.2,14,36,"Monday, February 21",1,14
85,B09K7VLLP9,"RUDRAX PRODUCTION Reusable Kitchen Tissue Paper, J&L Durable Non-stick Oil Absorbing Paper Roll Kitchen Special Paper Towel Wipe Paper Dish Cloth Cleaning Cloth (Set of 3)",RUDRAX,0,0,0,649,4.4,4,28,"Monday, February 21",1,4
86,B09RGKHJ46,"BKT-Homemate Luxurious Premium 2 Ply Kitchen Towel/Tissue Roll (80 Pulls Per Roll), High Absorbency, High Thickness in Jumbo Pack , Pack of 4 Rolls With Complimentary BKT Cotton Kitchen Towel",BKT-Homemate,0,0,0,249,5.0,1,50,"Tuesday, February 22",1,1
87,B08XW5L28H,Kressa 2 Ply Paper Towel | Kitchen Tissue | Towel Paper Roll | 4 Rolls 60 Pulls Per Roll Total 240 Pulls Made of Natural Virgin Pulp,Kressa,0,0,0,299,4.6,16,25,"Monday, February 21",1,16
88,B09R7H1XVS,Xtrandz Washable and Reusable - 2 Ply Kitchen Printed Tissue/Towel Paper Roll - Washable and Reusable- 1 Roll (140 Pulls Per Roll)- 200 GSM,Xtrandz,0,0,0,199,0,0,50,"Wednesday, February 23",1,"₹199
₹399 Save ₹200 (50%)"
89,B00W1SOFH8,Origami Absorbent 2 ply Kitchen Towels/Kitchen Tissue Rolls/Kitchen roll/Tissue Paper for Kitchen - 60 pulls per roll - Pack of 6-360 pulls,Origami,0,0,0,399,4.1,758,5,"Tuesday, February 22",1,758
90,B09HPVB4W8,BKT-HOMEMATE 2 Ply Absorbent Kitchen Towel/Tissue |60 Pulls Pack of 6 Rolls| with Complimentary BKT-HOMEMATE Cotton Kitchen Towel,BKT-HOMEMATE,0,0,0,295,3.7,10,34,"Tuesday, February 22",1,10
91,B07SQMG59W,R Tee Non Woven Kitchen Towel Roll Wipe for Cleaning,R,0,0,0,345,3.6,340,28,"Monday, February 21",1,340
92,B09P4TQ8Z2,Pack of 10 Kitchen Tissue Rolls - Kitchen Musts - Washable and Reusable - 2 Ply Kitchen Printed Tissue/Towel Paper Roll - Washable and Reusable- 10 Roll (1400 Pulls Per Roll)- 60 GSM,Pack,0,0,0,0,5.0,1,0,,0,1
93,B08KR1VBHJ,Scott Essential Multi Fold Hand Towel 38002C - M Fold Towel - 16 Packs x 250 Sheets - White Folded Towel Sheets 22.3 X 20.4 cm (4000 Total),Scott,0,0,0,"1,953",4.3,41,11,"Sunday, February 20",1,41
94,B095SQ74X5,"MAXMY SHOP Reusable Kitchen Tissue Paper, J&L Durable Non-stick Oil Absorbing Paper Roll Kitchen Special Paper Towel Wipe Paper Dish Cloth Cleaning Cloth Pack Of (2)",MAXMY,0,0,0,499,4.3,18,29,"Monday, February 21",1,18
95,B075FS194K,Ezee 2 Ply Kitchen Tissue Paper Roll/Towel Roll - Pack of 4 (100 Pulls Per Roll),Ezee,0,0,0,270,3.5,61,0,"Friday, February 18",1,61
96,B010VK7H4K,Premier Tissues Kitchen Tissue 60 Pulls 2 Ply Roll 4x1 Pack,Premier,0,0,0,186,4.3,534,7,"Monday, February 21",1,534
97,B09QLX3S9T,SAMRDH® Kitchen Tissue/Towel Roll 4 Ply Premium Pack Of 3 Extra Strong & Absorbent Kitchen Roll ( 75 Pulls Per Roll ),SAMRDH®,0,0,0,299,0,0,46,"Tuesday, February 22",0,"₹299
₹549 Save ₹250 (46%)"
98,B08N59QLYH,Kosher C-Fold Paper Tissue/Restroom Towel Pack of 6-150 Sheets each - (Total 900 Sheets),Kosher,0,0,0,380,4.0,3,10,"Thursday, February 24",0,3
99,B08D3SHJ13,"Wintex NEXXT 4 Ply Kitchen Paper Towels/Rolls Value Pack (White) (3 packs of 2 Rolls, Total 6 Rolls)",Wintex,0,0,0,529,4.0,40,24,"Monday, February 21",0,40
100,B08Y8Z1YGX,Kressa Jumbo Multipurpose Paper Tissue Roll | Kitchen Roll 2 Rolls Total 600 Sheets 2 Ply 100% Natural Virgin Pulp,Kressa,0,0,0,510,0,0,27,"Tuesday, February 22",0,"₹510
₹700 Save ₹190 (27%)"
101,B08NWXD11W,"K-Star Non Woven Multi Purpose Premium Reusable Kitchen Towel Roll for Home, Pack of 3-80 Pulls",K-Star,0,0,0,335,4.1,22,40,"Tuesday, February 22",0,22
102,B07GXRBSWR,Biogreen Kitchen Paper Tissue/Towel 2 ply 100 Sheets Per Roll (White) - Pack of 2,Biogreen,0,0,0,149,3.2,11,0,"Tuesday, February 22",1,11
103,B09DVTK2G8,Claret 4 Ply Premium Kitchen Tissue/Towel Paper Roll- Set of 2 rolls (60 Pulls Per Roll),Claret,0,0,0,249,3.0,1,22,"Tuesday, February 22",0,1
104,B07DJ8QJYH,Jackson Facial Tissue Party Paper (Large) Pack of 6 -100 Napkins Per Pack,Jackson,0,0,0,444,4.6,199,0,"Tuesday, February 22",0,199
105,B07DFGTW53,Cellox C Fold Tissue Paper Towel - 600 Tissues Guaranteed- Set of 4 Packets - 150 Tissues/Packet,Cellox,0,0,0,372,3.6,25,0,"Tuesday, February 22",0,25
106,B09J2LK345,"Linowipes Kitchen Wipes | Perforated Rolls, Tough Material Does not Tear Easily | Ideal for Surface Cleaning | Can be used as Canister Refills | Pack of 2 Rolls offering 200 Pulls, 100 Pulls each",Linowipes,0,0,0,249,0,0,17,"Monday, February 21",0,"₹249
₹300 Save ₹51 (17%)"
107,B094JPSJBL,"MasKing Kitchen Dry Cleaning Wipes, Tissue, Towel Roll Reusable Washable Super Absorbent Multipurpose Cleaning tissue 50 Pulls Per Roll (Pack of 2)",MasKing,0,0,0,248,4.5,13,59,"Wednesday, February 23",1,13
108,B08MWQ82XT,Rokoo Reusable Washable Kitchen Printed Tissue Roll - 2 Roll - 120 Wipes,Rokoo,0,0,0,239,3.4,182,40,"Friday, February 25",0,182
109,B09C65CPZF,TLISMI Reusable Kitchen Tissue Paper Durable Non-stick Oil Absorbing Paper Roll Kitchen Special Paper Towel Wipe Paper Dish Cloth Cleaning Cloth 50 Wipes in 1 Roll Random Print (Pack of 4),TLISMI,0,0,0,639,0,0,47,"Tuesday, February 22",1,"₹639
₹1,199 Save ₹560 (47%)"
110,B08M3NZC8T,Limpiar premium 2 Ply Kitchen Tissue/Towel Paper Roll(Pack of 1),Limpiar,0,0,0,66,2.3,3,12,"Friday, February 25",0,3
111,B09RSSCSRF,Fregar 4 Ply Kitchen Tissue Paper Roll - Pack Of 4 (1040 Sheets),Fregar,0,0,0,350,0,0,3,"Monday, February 21",0,"₹350
₹360 Save ₹10 (3%)"
112,B09SCYVD5P,Nurven Reusable Kitchen Printed Tissue Paper Sheets Durable Non-stick Oil Absorbing Paper Roll Kitchen Special Paper Towel Wipe Paper Dish Cloth Cleaning (3),Nurven,0,0,0,549,0,0,21,"Monday, February 21",0,"₹549
₹699 Save ₹150 (21%)"
113,B08HJ1Y1BR,Jovial Kitchen Towel Non-Woven 2 Roll with Paper Towel 4 Ply 60 Pulls Single Pack,Jovial,0,0,0,399,0,0,23,"Wednesday, February 23",1,"₹399 (₹1.81/count)
₹520 Save ₹121 (23%)"
114,B094DKM2S4,ALOKRUPSWAM Disposable Cleaning Towel Paper Towels Multipurpose Fabric Non-Woven Kitchen Disposable Cleaning Nonstick Wiping Rag House Cleaning Cloth Washcloth Towel (Set of 2),ALOKRUPSWAM,0,0,0,359,0,0,55,"Monday, February 21",1,"₹359
₹799 Save ₹440 (55%)"
115,B08V4SNJ68,One Packet Kitchen Printed Tissue Towels - Non-Woven Reusable and Washable Kitchen Printed Tissue Roll - 1 Roll - 120 Wipes Pulls,One,0,0,0,170,3.7,23,11,"Monday, February 21",1,23
116,B08KRBS8BS,Scott Multi Fold Hand Towel 28610 - M Fold Towel - 16 Packs x 250 Sheets - White Folded Towel Sheets 24 cm X 23.1 cm (4000 Total),Scott,1,0,0,"2,917",4.2,19,11,"Friday, February 18",1,19
117,B08D3SGMZR,Wintex ULTRA 4 Ply Kitchen Paper Towels/Rolls (White) (Set of 4 Rolls),Wintex,1,0,0,400,4.2,38,0,"Monday, February 21",1,38
118,B00W1SO1A4,Origami So Soft Non-Woven Washable Kitchen Wipes - 2 Rolls - 80 Wipes Per Roll - Total 160 Wipes,Origami,1,0,0,316,4.4,"5,788",17,"Friday, February 18",1,"5,788"
119,B096KXGBS4,Amazon Brand - Presto! Non-woven Kitchen Towel Roll - 80 Pulls (Pack of 4),Amazon,1,0,0,690,4.4,"4,009",1,"Sunday, February 20",1,"4,009"
120,B09LHTJ9KT,Phoenix Multifold Hand Towel / M-fold Tissue Paper-1000 Pieces From Rokoo,Phoenix,1,0,0,399,4.4,18,60,"Wednesday, February 23",1,18
121,B09MKKJH5M,Amazon Brand - Presto! Non-woven Kitchen Towel Roll - 80 Pulls (Blue) & Presto! Dishwash Gel Lemon - 1 L,Amazon,1,0,0,309,0,0,22,,1,"₹309
₹399 Save ₹90 (22%)"
122,B079WWFQDX,ORIGAMI Luxuria 3 Ply Printed Kitchen Towel Roll (50 Sheets Per Set) - Packs of 2,ORIGAMI,1,0,0,286,4.0,78,5,"Friday, February 18",1,78
123,B09SFCV3KS,BUDGET Premium (Pack of 3 / 180 pulls) Kitchen Tissue Paper / Paper Towels Rolls: Solid White,BUDGET,1,0,0,333,0,0,33,"Wednesday, February 23",0,"₹333
₹499 Save ₹166 (33%)"
124,B09M41RFB6,VIPREKHO Absorbent Microfiber Cleaning Wipes Roll Kitchen Tissue/Towel Tissue Roll Reusable Washable,VIPREKHO,0,0,0,289,0,0,42,"Monday, February 21",1,"₹289
₹499 Save ₹210 (42%)"
125,B08NDM711V,"XURO, PASEO M FOLD FINE QUALITY TISSUE PAPER, PACK OF 10 (1250 SHEETS)","XURO,",0,0,0,504,3.0,6,44,"Monday, February 21",1,6
126,B082GD5HXH,PAVITR SHOP MYZON Reusable Super Absorbent Cleaning Wipes Roll Paper/Towel Holder for Kitchen and Bathroom (50 Pieces Sheet),PAVITR,0,0,0,299,5.0,2,40,"Monday, February 21",1,2
127,B09BZ6N5X3,Softouch Non-Woven Washable Kitchen Wipes- 85 Wipes,Softouch,0,0,0,189,4.4,13,5,"Friday, February 18",1,13
128,B08HJ1Y1BR,Jovial Kitchen Towel Non-Woven 2 Roll with Paper Towel 4 Ply 60 Pulls Single Pack,Jovial,0,0,0,399,0,0,23,"Wednesday, February 23",1,"₹399 (₹1.81/count)
₹520 Save ₹121 (23%)"
129,B09C69N4J8,Homfine® Non-Woven Heavy Duty Kitchen Wipes/Towel | Tissue Paper Roll Washable/Reusable for Multipurpose Cleaning (70Pulls in Each Roll) - Colour May Vary (2),Homfine®,0,0,0,375,0,0,46,"Monday, February 21",1,"₹375
₹699 Save ₹324 (46%)"
130,B00NPVV2LC,Origami Single Non Woven Kitchen Towel 80Pulls and Kitchen Towel Plain 4 in 1 Pack,Origami,0,0,0,427,4.3,207,1,"Friday, February 18",1,207
131,B0839QVLLS,"Scott Multifold Paper Towels with Fast-Drying Absorbency Pockets, White, 30 Packs per Case, 150 M-Fold towels per Pack, 4500 M Fold sheets (1222A)",Scott,0,0,0,"2,062",4.3,40,14,"Friday, February 18",1,40
132,B07MPNDF57,Pro Hygenix Washable Resuable 2 ply kitchen cleaning Towel roll (1) (Blue),Pro,0,0,0,95,4.1,360,37,"Monday, February 21",0,360
133,B08L873YH2,Origami Absorbent 2 ply Kitchen Towels/Kitchen Tissue Rolls/Kitchen roll/Tissue Paper for Kitchen - 60 pulls per roll - Pack of 4-240 pulls,Origami,0,0,0,209,4.5,4,48,"Monday, February 21",0,4
134,B096W28JPK,"Care Touch Premium Quality 100% plastic free Kitchen Paper Towel Roll Extra Soft, Ultra Strong 4 Ply ( Pack of 4)",Care,0,0,0,369,4.5,20,25,"Monday, February 21",1,20
135,B085F1HSHS,"GINNI Kitchen Swipe Rolls Non Woven Fabric, Kitchen Tissue/Towel Tissue Roll Reusable & Washable (Multi-Purpose Household Sheets) - 30 x 25 Cm (200 Pulls)",GINNI,0,0,0,529,4.4,73,47,"Monday, February 21",0,73
136,B06XSD97RS,"Paseo Kitchen Towels - Printed, 60Sheets, 4 Rolls, 2Ply Pack",Paseo,0,0,0,286,4.4,14,5,"Wednesday, February 23",0,14
137,B079WWFQDX,ORIGAMI Luxuria 3 Ply Printed Kitchen Towel Roll (50 Sheets Per Set) - Packs of 2,ORIGAMI,0,0,0,286,4.0,78,5,"Friday, February 18",1,78
138,B098TGHMYV,ZURU BUNCH®Non-Woven Reusable and Washable Kitchen Printed Tissue Roll Non-stick Oil Absorbing Paper Roll Kitchen Special Paper Towel Wipe Paper Dish Cloth Cleaning Cloth ( 50 sheets) pack of 1,ZURU,0,0,0,249,0,0,75,"Monday, February 21",0,"₹249
₹999 Save ₹750 (75%)"
139,B09F6RTFLQ,YASH VISION - NIC - Embossed 1 Ply Kitchen Towel / Tissue Paper Roll - 27 x 20 cms - 150 pulls,YASH,0,0,0,115,1.0,1,23,"Tuesday, February 22",0,1
140,B08D6QZHQM,Biogreen || Hard roll Paper Towel || Fast Drying || Highly Absorbent || 150 Meters per roll - Pack of 2,Biogreen,1,0,0,649,3.9,12,0,"Tuesday, February 22",1,12
