,asin,title,brand,Sponsored,Best Seller,Amazon's Choice,Price,Rating,NoofRatings,Discount,Delivery,Prime Delivery,base
218,B07N3T8DQQ,Men's Leather Belt,WildHorn,0,0,0,480,3.4,29,70,,0,29
219,B09FXZTFN3,Golden Handembroidered Cloth Waist Saree/Lehenga Belt and Kamarbandh for Women,Duchess,0,0,0,"1,199",4.4,10,45,,0,10
220,B07HHJCJM5,"Reversible PU Leather Belt, Formal black/Brown_RSTX-01",Urban alfami,0,0,0,259,3.6,570,83,,0,570
221,B07QPTW1CQ,Men's Leather Belt,HIDE & SKIN,0,0,0,557,3.9,889,72,,1,889
222,B01BHR5Y46,Amazing Blue Belt For Ladies Jeans Belt,Anaya,0,0,0,799,0,0,0,,0,₹799
223,B09FY34CBM,Embroidered White Silver Sequin Beaded Cloth Waist Saree Belt and Kamarbandh for Women,Duchess,0,0,0,"1,215",4.2,11,45,,1,11
224,B078FTGX66,"Women's Metal stretchable Bow Belt-kanduro for valentine gift Pack of 1 (Bow Belt, Golden)",SATYAM KRAFT,0,0,0,299,4.2,666,75,,0,666
225,B01GA7DOFO,Men's Leather Belt (Camel | Size 32),Woodland,0,0,0,499,3.7,267,29,,0,267
226,B07255HBTY,Men's Leather Belt & Wallet Combo Gift Set,Cross,0,0,0,"1,699",4.1,42,51,,1,42
227,B09R6H3XG3,"Women's,Ladies's,Girl's Belt For Jeans,Formal Casual Belts For Women/Girls Faux Leather Belt Free Size Synthetic Leather (PLN-3-CR-)",FLOTEX,0,0,0,199,0,0,67,,1,"₹199
₹599 Save ₹400 (67%)"
228,B09HNN65V8,Breathable Webbing Nylon Military Style Tactical Canvas Men Women Waist Belt with Heavy-Duty Quick-Release Metal Buckle 1.5 Inches Wide,EDIFIER,0,0,0,399,5.0,5,69,,0,5
229,B09RJK4QXX,DiscoverTrends Double GG Faux Leather Belt with Golden Buckle For Girls/Women,Generic,0,0,0,199,0,0,80,,0,"₹199
₹999 Save ₹800 (80%)"
230,B08HWZ8T8P,Safety Security Reflective Adjustable Vest Belt Gear Stripe Night Running,C (DEVICE),0,0,0,145,4.3,75,85,,0,75
231,B09MMX8B2L,No Buckle Invisible UNISEX Comfortable Elastic Stretch Belt for Women Fits waist Invisible Buckless Belt for Jeans Pants,TREXEE,0,0,0,295,5.0,1,67,,0,1
232,B084QBHG29,"Unisex Tucker Shirt Stay Belt (Black, Adjustable Size)",ANEMONE,0,0,0,199,3.9,343,80,,1,343
233,B08P5GZH9Y,Men's Leather Auto Lock Belt,Labnoft,0,0,0,499,4.0,315,50,,1,315
234,B07YG6NRZ8,Unisex Nylon & Canvas Belt (BLT063_08_Black & Beige),EDIFIER,0,0,0,319,4.0,144,68,,0,144
235,B08ZKSHNK9,"Women Skinny Belt for Dresses Retro Stretch Chic Ladies Elastic Waist Belt 27""-35""",MASSMART,0,0,0,339,4.1,117,43,,0,117
236,B07TG5S7W4,"Men's Belt, Italian Leather Reversible Belt for Men Black/Brown Dress Belt Auto Rotate Buckle Gift Box",Vincent xavier,1,0,0,499,4.0,18,79,,1,18
237,B085M5FK5V,"Men's PU Leather Autolock Belt, Free Size",Labnoft,1,0,0,699,4.2,116,30,,1,116
238,B09K5GG8HN,"Mens Leather Belt, Handmade Pure Italian Quality Mens Formal Belt",Cavaldii ITALIA,1,0,0,499,4.0,16,80,,0,16
239,B096BG31F7,"Formal Casual Genuine Leather Top Grain Color Black,BrownTan",ELITE CRAFTS,1,0,0,399,0,0,77,,0,"₹399
₹1,699 Save ₹1,300 (77%)"
240,B013DSUF96,Reversible Stitched Vegan Leather Belt for Men,SCHARF,1,0,0,347,4.1,8,68,,0,8
241,B0919Q6VN1,Men's Genuine Leather Auto-Lock Buckle With Reversible Belt,BlacKing,1,0,0,499,4.0,93,74,,1,93
242,B07YFPRX81,Reversible Stitched Vegan Leather Belt for Men,SCHARF,1,0,0,347,3.0,4,75,,0,4
243,B09NL7SH8S,Casual Tan Color Genuine Leather Belt with Double Prong Buckle for Jeans and Casual Wear belt for men stylish Leather for Men's/Boys ||CSBL-BRBKL-05||,CLUB SPUNKY,1,0,0,499,4.7,5,77,,1,5
244,B09F9FH7JQ,Women Tan Stretchable Wide Belt For Ladies,Romp Fashion,0,0,0,399,0,0,50,,1,"₹399
₹798 Save ₹399 (50%)"
245,B09J4PPX2R,"1 Pcs Cute Bowknot Metal Buckle Skinny Stretch Waist Belt For valentine gift (Gold, 1 Piece)",SATYAM KRAFT,0,0,0,259,4.2,6,78,,0,6
246,B098TTGBP4,Brown Belt,Peter England,0,0,0,688,4.3,6,31,,1,6
247,B09C3TSGTB,Belts for Men Reversible Leather 1.25 Waist Strap Fashion Dress Buckle Eliz Luxe - 1 Year Warranty,ELIZ LUXE,0,0,0,399,4.0,75,69,,1,75
248,B07N3T8DQQ,Men's Leather Belt,WildHorn,0,0,0,480,3.4,29,70,,0,29
249,B0846KP5HR,Men's Leather belt (Formal/Casual) (Colour -Brown) Buckle Adjustable Size Genuine Leather (BR2129),Flyer,0,0,0,497,3.9,111,67,,1,111
250,B09JKMCLF5,Fashion PU Waist Belt Women's Metal Buckle Design Belt Interlocking Buckle Vintage Blouse Blazer Dress Belt (Black),PALAY,0,0,0,599,0,0,32,,1,"₹599
₹875 Save ₹276 (32%)"
251,B09DP118F9,Formal/Casual Branded Stylish Genuine Leather Belts For Men (Brown Color) ||CSBL-05||,CLUB SPUNKY,0,0,0,369,3.8,50,81,,1,50
252,B07R183R9P,Men's Leather belt (Formal/Casual) (Colour -Brown/Black) Buckle Adjustable Size Genuine Leather (B908) (Pack of 1),Flyer,0,0,0,347,3.9,"5,659",73,,0,"5,659"
253,B09BN1VZF7,Women Belt Bow-Knot Shape Buckle Elastic Decorative Belt Stretchy Belt for Dresses Elastic Wide Waist Belt (Black),PALAY,0,0,0,417,0,0,20,,0,"₹417
₹522 Save ₹105 (20%)"
254,B08Z32F8DJ,"Women Stretchy Belt, Butterfly Wide Belt,Ladies Dress Stretchy Belt (Suitable Waist 25""-31"")",Electomania,0,0,0,399,4.4,51,60,,0,51
255,B09B3DYMKG,Reversible Formal Leather Belt for Men I Durable Buckle I Heavy Duty,WildHorn,0,0,0,480,4.4,5,70,,0,5
256,B09P6KQ144,Pearl Waist Chain Belt Adjustable Decorative Belt Hollowed Tassel Waist Belts - Free Size,Syga,0,0,0,319,0,0,68,,1,"₹319
₹999 Save ₹680 (68%)"
257,B093YV1R3W,Stretchable Adjustable Belt for kids Boys and Girls (Suitable for 3 to 7 Years Old) (Black),Kutumbh,0,0,0,313,3.8,19,48,,1,19
258,B09HCHBCCK,Women Slim Leather Belts Ladies Girls Faux Leather Jeans Skirt Belt with Double O-Ring Buckle,bilAnca,0,0,0,235,3.3,16,48,,1,16
259,B08X775F29,Woodland Yellow Leather Belt For Men's,Genuine Leather,0,0,0,499,3.6,37,60,,0,37
260,B079P6LH1W,Men's Leather Belt,KAEZRI,1,0,0,499,4.0,"2,063",75,,1,"2,063"
261,B095X2NVTS,PU Leather Ratchet Black Dress Belts for Men And Boys with Autolock Buckle,Pacific Gold,1,0,0,899,2.0,2,75,,1,2
262,B08P32R968,Carter Classic Leather Belt For Men,WildHorn,1,0,0,480,3.4,76,63,,0,76
263,B09QPQ81R1,"Men's Imported Leather Belts With Textured Print, For Casual and Formal Wear.",Cavaldii ITALIA,1,0,0,499,3.0,3,80,,1,3
264,B0814Z28G3,Men's Leather Auto Lock Belt,Labnoft,0,0,0,629,4.2,788,37,,1,788
265,B0944CBLWY,Men Belt,Peter England,0,0,0,566,3.6,5,19,,1,5
266,B07N11RQZ3,Men's Woven Tactical Belt with Metal Buckle NB-51-GD,ZORO,0,0,0,379,4.0,67,75,,0,67
267,B07255HBTY,Men's Leather Belt & Wallet Combo Gift Set,Cross,0,0,0,"1,699",4.1,42,51,,1,42
268,B09CQCZXTH,Women's Leather Lace-up Tied Waspie Corset Belt,Eastern eagle,0,0,0,388,3.7,49,61,,0,49
269,B07YG51312,Unisex Nylon & Canvas Waist Belt (BLT063_03_Beige & Black),EDIFIER,0,0,0,319,4.1,136,68,,0,136
270,B07GV14TZW,"Men's Leather Belt (Camel, 34)",Woodland,0,0,0,499,3.5,76,29,,0,76
271,B09FZ4D722,Men's Leather Executive Pattern Free Size Autolock Buckle Ratchet Belt,Ammvi Creations,0,0,0,798,3.8,24,58,,1,24
272,B085WM9S1M,Women's Elastic Belt,Electomania,0,0,0,369,4.3,445,38,,1,445
273,B09LYQVVTN,"Belt for Women, Braided belt for women jeans, Boho Belt with Wooden Style Buckle",Electomania,0,0,0,379,4.4,3,62,,0,3
274,B085GFFJ52,Women's Elastic Belt,Electomania,0,0,0,519,4.3,231,13,,1,231
275,B099K6CG6B,Womens & Girls Belt |Women & Girl Office Belt | Office Belt For Ladies| Belt For ladies jeans | Plain Belt For ladies | Ladies Belt | Width 1inch.,Delight Belts,0,0,0,199,3.4,21,80,,1,21
276,B088S2JN7Z,Men's Belt,Tommy Hilfiger,0,0,0,"1,788",3.9,76,19,,1,76
277,B09QQHRYYR,Waist Dress Belt Skinny Belt for Women Dress Waist Belt Metal Plain Mirror Elastic Belt Adjustable Metal Golden Belt for Ladies,Akszone,0,0,0,399,5.0,5,47,,1,5
278,B0862G63LB,Shirt Tucker belt strap Maximum Strech (Size 28 to 46) for Men/Women/Boys/Girls (Unisex) - Black Color,CLUB SPUNKY,0,0,0,299,3.7,238,83,,1,238
279,B08DYH3DMW,Men's Combo of Tan Color Belt And Tan Color Leather Wallet,Imperior,0,0,0,0,2.8,18,0,,0,18
280,B07YCR4JX6,"PU leather (Pack of 1) Adjustable Buckle Belts Fashion Waist Strap BELTS For Casual and Formal - Belt For Men and Boys, color Design For Daily Use",EDIFIER,0,0,0,399,3.9,290,16,,0,290
281,B085VHTY7P,Women's Metal Belt,REHTRAD,0,0,0,259,4.2,86,57,,1,86
282,B07Q7NSX3B,Canvas Belt Men with Black Double D-ring Buckle Web Military Tactical Belt for Mens,maikun,0,0,0,499,4.1,"3,961",38,,1,"3,961"
283,B07D8X1KM8,"Men's Dhoti Belt (White, X-Large)",Ramraj,0,0,0,249,4.4,34,30,,1,34
284,B08PZ5VX9Q,2pcs Women Elastic Waist Belt Thin Belt Waist Cinch Belt for Women Girls Accessories-Black&Brown,GUSTAVE,0,0,0,499,4.1,83,29,,1,83
285,B09M73S2WR,"Auto Lock Grip Leather Black Leather Belt For Men Formal Gifting Gift Set (GRPCRS, Waist Upto -42 Inches)",RIZORO,0,0,0,329,4.3,5,91,,0,5
286,B079L7Z1M9,Women's Belt,Lino Perros,0,0,0,371,4.2,13,25,,0,13
287,B07G5QDNBX,Trevor Brown RFID Blocking Leather Wallet & Brown Casual Belt Combo Gift Set for Men,URBAN FOREST,0,0,0,892,3.9,151,64,,1,151
288,B0799HS4L9,"Girl's PU Leather Belt (KRY-WOM-BLK-BELT, Black, Free Size)",Krystle,0,0,0,159,3.7,85,56,,0,85
289,B06XRPDHV3,"Girl's PU Leather Belts Combo of 3 (Black,Brown & White)(GLA/WOMENBELTS1/BKBRWH)",Glamio,0,0,0,275,3.5,497,58,,1,497
290,B01BHOREHO,Striking Yellow Womens Belt,Anaya,0,0,0,"1,599",0,0,0,,0,"₹1,599"
291,B08VJHFF5K,"Stretchable braided cotton belt for men and women,flexible unisex belt (Black-Blue Combo Colore-Belt0SB12)(Size 28 To 36 Inch)",UNIQ WORLD,0,0,0,329,4.5,4,65,,0,4
292,B08KQDY4V5,Men's PU Leather Belt,ZORO,0,0,0,307,3.7,208,83,,0,208
293,B08RRXKN3Y,Men's Black Stretchable Braided Belts For Men and Women Unisex Belt with Leather End,MUTAQINOTI,0,0,0,349,4.1,451,83,,0,451
294,B08Z8CFV24,Men's PU Leather Reversible Belt (Pack of 1),Zacharias,0,0,0,499,3.6,54,50,,1,54
295,B09QXHH3GZ,"Frunix brand Nylon fabric Belt, Hole free plastic flap buckle Canvas Waist Belt (pack of 2) black and green",Generic,0,0,0,0,5.0,1,0,,0,1
296,B01NCP1BL3,Men's Classic Reversible Black & Brown Leather Belt,Pacific Gold,1,0,0,429,3.6,102,64,,1,102
297,B092S6V2Y5,Clara Mens Leather Belt | Leather Belt For Men | Formal Mens Leather Belt,HORNBULL,1,0,0,499,3.7,47,75,,1,47
298,B09DVXK5QL,"Men's Formal Belts, Handmade Pure Italian Quality Genuine Leather Belt with Antique Buckle For Casual/Formal/Office purpose.",Cavaldii ITALIA,1,0,0,499,4.0,153,80,,1,153
299,B09B55TMH2,"Men's Formal Belts, Handmade Pure Italian Quality Genuine Leather Belt with Antique Buckle For Casual/Formal/Office Purpose.",Cavaldii ITALIA,1,0,0,499,3.9,107,80,,1,107
300,B07W58522C,"Men's Belt, Italian plain Leather Black and Brown Reversible Belt for Men/Gift Box",Vincent xavier,1,0,0,495,3.7,62,78,,1,62
301,B096WH374Z,Jason Mens Leather Belt | Leather Belt For Men | Formal Mens Leather Belt,HORNBULL,1,0,0,499,3.9,131,75,,1,131
302,B0919LV3QP,Men's Genuine Leather Auto-Lock Buckle With Reversible Belt,BlacKing,1,0,0,499,4.0,93,74,,1,93
303,B07QGW4LST,Men's Leather Belt,CHURCHILL & COMPANY,1,0,0,"2,399",3.8,9,35,,1,9
304,B08PZ5VX9Q,2pcs Women Elastic Waist Belt Thin Belt Waist Cinch Belt for Women Girls Accessories-Black&Brown,GUSTAVE,0,0,0,499,4.1,83,29,,1,83
305,B09M73S2WR,"Auto Lock Grip Leather Black Leather Belt For Men Formal Gifting Gift Set (GRPCRS, Waist Upto -42 Inches)",RIZORO,0,0,0,329,4.3,5,91,,0,5
306,B091KJL7QG,Men's Reversible Leather Belt and Wallet Combo,Labnoft,0,0,0,999,4.4,3,50,,1,3
307,B06XRPDHV3,"Girl's PU Leather Belts Combo of 3 (Black,Brown & White)(GLA/WOMENBELTS1/BKBRWH)",Glamio,0,0,0,275,3.5,497,58,,1,497
308,B08VJHFF5K,"Stretchable braided cotton belt for men and women,flexible unisex belt (Black-Blue Combo Colore-Belt0SB12)(Size 28 To 36 Inch)",UNIQ WORLD,0,0,0,329,4.5,4,65,,0,4
309,B08KQDY4V5,Men's PU Leather Belt,ZORO,0,0,0,307,3.7,208,83,,0,208
310,B08RRXKN3Y,Men's Black Stretchable Braided Belts For Men and Women Unisex Belt with Leather End,MUTAQINOTI,0,0,0,349,4.1,451,83,,0,451
311,B09R6H3XG3,"Women's,Ladies's,Girl's Belt For Jeans,Formal Casual Belts For Women/Girls Faux Leather Belt Free Size Synthetic Leather (PLN-3-CR-)",FLOTEX,0,0,0,199,0,0,67,,1,"₹199
₹599 Save ₹400 (67%)"
312,B08Z8CFV24,Men's PU Leather Reversible Belt (Pack of 1),Zacharias,0,0,0,499,3.6,54,50,,1,54
313,B09QXHH3GZ,"Frunix brand Nylon fabric Belt, Hole free plastic flap buckle Canvas Waist Belt (pack of 2) black and green",Generic,0,0,0,0,5.0,1,0,,0,1
314,B01N2HOOWW,Men's Brown Wallet and Belt Combo | Gift Set for Men | Mens Leather Wallet,HORNBULL,0,0,0,899,4.0,556,73,,1,556
315,B08VX9MHCQ,Women's Faux Leather 30 MM Belt (Black; Free Size) Heart-01,Zacharias,0,0,0,299,3.6,21,63,,1,21
316,B08W58R4Y7,Snabs Belt For Men Stretchable Braided Belt For Jeans and Trousers,Generic,0,0,0,279,4.0,4,44,,0,4
317,B096861T2X,Women Belt,Fabme,0,0,0,399,3.7,45,43,,0,45
318,B08JM1BJMB,Men's Synthetic Quick Release Buckle Nylon Belt | Nylon Belt for Men (Free Size),CONTACTS,0,0,0,498,3.8,182,72,,0,182
319,B07L9DPPZ7,"Girls PU Leather Belt | Free Size (Black, upto 40 Size)",Brussel,0,0,0,220,3.6,465,78,,0,465
320,B08P64STRJ,"Men's Italian Leather Reversible Black & Brown Belt & Rotate Buckle Gift Box (Vx06, Black, 40)",Vincent xavier,1,0,0,499,5.0,3,79,,1,3
321,B072PYKF9Z,Reversible Stitched Vegan Leather Belt for Men,SCHARF,1,0,0,347,2.9,15,68,,0,15
322,B079NZGM7Z,Men's Leather Belt,KAEZRI,1,0,0,499,4.0,"2,063",75,,1,"2,063"
323,B07Y6HGKCD,Reversible Stitched Vegan Leather Belt for Men,SCHARF,1,0,0,347,4.0,5,75,,0,5
324,B07TJ6CGXQ,Leatherette Womens Belt,Lino Perros,0,0,0,359,5.0,5,24,,0,5
325,B09BN1VZF7,Women Belt Bow-Knot Shape Buckle Elastic Decorative Belt Stretchy Belt for Dresses Elastic Wide Waist Belt (Black),PALAY,0,0,0,417,0,0,20,,0,"₹417
₹522 Save ₹105 (20%)"
326,B091TT2NJJ,Men Belt,United Colors of Benetton,0,0,0,813,0,0,49,,0,"₹813
₹1,599 Save ₹786 (49%)"
327,B07N12F6FB,"Men's Nylon Tactical Military Style Webbing Belt with Metal Buckle (Green, Free Size)",ZORO,0,0,0,379,3.9,248,75,,0,248
328,B0981CW3P9,Brown Genuine Leather Wallet And Belt Combo Gift Set For Men (SPT-2202 EXE-02),MARKQUES,0,0,0,699,0,0,75,,1,"₹699
₹2,799 Save ₹2,100 (75%)"
329,B08294L9ZH,Leather Casual Belt For Men,woodland leather belt,0,0,0,748,4.0,94,50,,0,94
330,B09FHXPR1Z,"Women Belt for Jeans, Party & Casual Wear||Ladies belt for women|| Ladies Belt for jeans||Belt for women stylish|| ||Leather Belt stylish for Ladies/Girls/Women||Black colour|| Size 40inch Upto",Generic,0,0,0,100,0,0,87,,0,"₹100
₹799 Save ₹699 (87%)"
331,B09815TRF9,Cotton Belt For Women's & Girls | Belt For Jeans | Casual & Formal Belt For Ladies | Combo of Two Belt ( Black & Blue) Colour.,Delight Belts,0,0,0,249,4.4,37,69,,1,37
332,B084KSK4X3,FEAST Synthetic Women Red Belt (36),Lavie,0,0,0,336,3.4,3,48,,0,3
333,B08GKKMG2X,Men's Pu Leather Belt,ZORO,0,0,0,446,4.1,102,70,,0,102
334,B09Q6LJYYK,"DiscoverTrends Stretchable braided cotton belt for men and women,flexible unisex belt Elastic Woven Canvas(Black)",Generic,0,0,0,129,0,0,74,,0,"₹129
₹499 Save ₹370 (74%)"
335,B0799HS4L9,"Girl's PU Leather Belt (KRY-WOM-BLK-BELT, Black, Free Size)",Krystle,0,0,0,159,3.7,85,56,,0,85
336,B07Z94WBPJ,Black Leather Men's Wallet & Belt Combo set (LW29-P1),Swiss Military,0,0,0,"1,312",4.3,"1,161",61,,0,"1,161"
337,B07NRWY59V,Men's Nylon Belt,ZORO,0,0,0,230,4.0,161,85,,0,161
338,B0846KP5HR,Men's Leather belt (Formal/Casual) (Colour -Brown) Buckle Adjustable Size Genuine Leather (BR2129),Flyer,0,0,0,497,3.9,111,67,,1,111
339,B07VYZRQBC,Women's Faux Leather Belt (TAN; Free Size; SQ-004),Zacharias,0,0,0,249,3.8,36,58,,0,36
340,B085TS298Y,"Men's Stretchable Stylish Flexible Belt, (BROWN, TAN SCB30)",ZORO,0,0,0,237,4.0,74,87,,0,74
341,B07JL4SV3G,"Boy's PU Leather Belt (Brown and Blue, Free Size) -Combo Pack of 2 upto for kids only 6 year",Boy's,0,0,0,245,3.8,48,59,,1,Forever99
342,B07NCZ18MQ,Men's Leather Belt,EDIFIER,0,0,0,187,3.2,92,81,,0,92
343,B07T133Z47,"Women's Belt For Jeans, Women's Belt for Dresses Casual Formal 2 Belt Combo 28-36 (Free Size) Tan and Blue color",Aakriti,0,0,0,199,3.6,194,67,,0,194
344,B07YTKXSH2,"Breathable Webbing 1.5 Inches Wide Nylon Military Style Tactical Canvas Men's and Women's Waist Belt with Metal Buckle (Black, Free Size)",EDIFIER,0,0,0,425,3.7,172,57,,0,172
345,B0944CBLWY,Men Belt,Peter England,0,0,0,566,3.6,5,19,,1,5
346,B09DVXK5QL,"Men's Formal Belts, Handmade Pure Italian Quality Genuine Leather Belt with Antique Buckle For Casual/Formal/Office purpose.",Cavaldii ITALIA,0,0,0,499,4.0,153,80,,1,153
347,B011IT06MI,Women's Belt,Puma,0,0,0,448,4.5,4,70,,0,4
348,B0967VBVN2,Automatic Buckle Sliding Belt for Men in Gift Box,Reetack,0,0,0,349,3.3,26,77,,0,26
349,B08K8TJZCJ,"Men's Reversible PU-Leather Formal Belt, Watches and Sunglasses (Black/Brown)",Sheomy,0,0,0,449,3.6,671,85,,1,671
350,B012RMDUKA,Polyester Unisex Belt,Puma,0,0,0,493,4.0,1,62,,0,1
351,B07CYK6TPV,"Men's Jaguar Belt Buckle (Black and Silver, Free Size)",YASHISH,0,0,0,280,3.5,53,81,,0,53
352,B08THBYRBG,"AX-5303 Men's Faux Leather Autolock Buckle Belt (Black, Free Size)",Zacharias,0,0,0,499,3.7,50,50,,1,50
353,B08VF3DLJC,Women Girls Belt Fashion Bowknot Design Waist Belt Chic Elastic Stretch Waist Band,Inrali,0,0,0,368,4.2,64,8,,0,64
354,B07WWMT3J4,women XXXL OVERSIZE PLUS SIZE grey nerrow denim material belt,Generic,0,0,0,329,4.5,7,67,,0,7
355,B07QMSKMX1,Men's Leather Buckle Belt,HIDE & SKIN,0,0,0,557,3.9,"1,706",72,,1,"1,706"
356,B08LY6MW14,"Men's Belt, Italian Leather Reversible Belt for Men Black/Brown Dress Belt Rotate Buckle Gift Box",Vincent xavier,1,0,0,499,3.6,35,80,,1,35
357,B07TCYZZFX,"Men's Belt, Italian Leather Reversible Belt for Men Black/Brown Dress Belt Rotate Buckle Gift Box",Vincent xavier,1,0,0,499,3.8,18,79,,1,18
358,B07TF4BPX5,"Men's Belt, Leather Reversible Belt for Men Black/Brown Dress Belt Rotate Buckle Gift Box",Vincent xavier,1,0,0,545,3.6,26,78,,1,26
359,B09B549RTG,"Men's Formal Belts, Handmade Pure Italian Quality Genuine Leather Belt with Antique Buckle For Casual/Formal/Office purpose.",Cavaldii ITALIA,1,0,0,499,4.0,153,55,,1,153
360,B096WGS4GC,Robert Mens Leather Belt | Leather Belt For Men |Top Grain Formal Mens Leather Belt,HORNBULL,1,0,0,499,3.5,163,75,,1,163
361,B08ZN8QSL7,Jason Mens Leather Belt | Leather Belt For Men | Formal Mens Leather Belt,HORNBULL,1,0,0,499,3.9,131,75,,1,131
362,B08F3BFYKM,Men's leather Casual Non Reversible Belt,Amazon Brand - Symbol,1,0,0,383,4.3,84,80,,0,84
363,B09BNRJWK6,Auto lock Buckle Adjustable Belts Free Size,ELITE CRAFTS,1,0,0,379,4.0,13,71,,1,13
364,B01N5RK1SD,"Girl's PU Leather Belts Combo of 4 (Black,Brown,White & Pink)(GLA/WOMENBELTS/BKBRWHPI)",Glamio,0,0,0,325,3.7,122,59,,1,122
365,B085M5FK5V,"Men's PU Leather Autolock Belt, Free Size",Labnoft,0,0,0,699,4.2,116,30,,1,116
366,B08VR9XHV4,"Stretchable braided cotton belt for women,Men, ladies belt,Black,and Brown, color Combo of 2 pcs(Stretch Belt-019)",Veteran,0,0,0,335,3.8,94,58,,1,94
367,B07FXM6WNS,Men's Black Leather Wallet and Reversible Belt Combo,Amicraft,0,0,0,499,3.2,18,72,,1,18
368,B09C6GSLXY,Men Belt,Peter England,0,0,0,998,2.6,4,33,,1,4
369,B08H1CWMSL,Women's Faux Leather Belt,Woomcraft,0,0,0,249,4.1,"1,397",69,,0,"1,397"
370,B01BHQ15RW,Striking Blue Beads Handmade Women Belt,Anaya,0,0,0,"1,599",0,0,0,,0,"₹1,599"
371,B085M9KDL6,Women's Leather Belt,Futurekart,0,0,0,379,4.2,584,62,,0,584
372,B0919LV3QP,Men's Genuine Leather Auto-Lock Buckle With Reversible Belt,BlacKing,0,0,0,499,4.0,93,74,,1,93
373,B07YCQQM7C,"PU leather (Pack of 1) Adjustable Buckle Belts Fashion Waist Strap BELTS For Casual and Formal - Belt For Men and Boys, color Design For Daily Use",EDIFIER,0,0,0,399,3.7,67,33,,0,67
374,B07LH5SM6S,men's brown synthetic leather auto lock buckle belt(DFG-AAA-001),Sunshopping,0,0,0,220,3.7,127,45,,0,127
375,B08T1HVL8S,Men Belt,Peter England,0,0,0,664,3.8,20,34,,1,20
376,B07PTC11S2,Men's Leather Belt,ELIZ LUXE,0,0,0,399,4.0,"5,055",60,,1,"5,055"
377,B09KVGYFYT,"Women's Western/Ethnic One Piece Embellished Lace Adjustable Elastic Stretchable Ladies Belt For Women Stylish Fancy Fashion Accessories Girl Belts Button Closure (Black, Silver, Gold, White)",DEEBACO,0,0,0,404,4.3,10,80,,0,10
378,B07Z9KQ273,Men BELT,Tommy Hilfiger,0,0,0,"1,768",3.8,23,37,,1,23
379,B07PP24HZY,"Reversible Belts PU-Leather Formal Black/Brown Belt For Men free (Color-Black/Brown) belt for men, reversible belt combo for men, gift for gents, Gents belt, mens belt with BRN Brown Watch 58-691F-ZTBC",Sheomy,0,0,0,449,3.2,331,85,,1,331
380,B09DP118F9,Formal/Casual Branded Stylish Genuine Leather Belts For Men (Brown Color) ||CSBL-05||,CLUB SPUNKY,1,0,0,369,3.8,50,81,,1,50
381,B07QDNCWBN,Men's Leather Reversible Belt,CHURCHILL & COMPANY,1,0,0,"2,399",3.2,21,35,,1,21
382,B09HXY63DS,"Men's Formal Belts, Handmade Pure Italian Quality Genuine Leather Belt with Antique Buckle For Casual/Formal/Office Purpose.",Cavaldii ITALIA,1,0,0,499,3.9,107,55,,1,107
383,B09B78ZDG7,Canvas Belts For Men Elastic Belt For Mens,Farrago,1,0,0,479,4.3,8,76,,0,8
384,B07YG85XS2,Unisex Nylon & Canvas Waist Belt,EDIFIER,0,0,0,225,4.1,384,72,,0,384
385,B08K8SYNH5,"Reversible Belts PU-Leather Formal Black/Brown Belt For Men free (Color-Black/Brown) belt for men, formal belt, gift for gents, Gents belt, mens belt (Belt-003)",Sheomy,0,0,0,239,3.7,68,66,,0,68
386,B09JM8ZJ89,Petersen Mens Leather Belt | Leather Belt For Men | Casual Mens Leather Belt,HORNBULL,1,0,0,499,4.3,36,80,,1,36
387,B0919HMVNS,Men's Genuine Leather Auto-Lock Buckle With Reversible Belt,BlacKing,1,0,0,499,4.0,93,74,,1,93
388,B09BQVQ3MX,Men's Genuine Leather Belts 3501,Black Banana,1,0,0,598,3.9,3,60,,1,3
389,B0957V5186,Genuine Leather Ratchet Black Dress Belts for Men And Boys with Autolock Buckle,Pacific Gold,1,0,0,899,4.1,114,75,,1,114
