,asin,title,brand,Sponsored,Best Seller,Amazon's Choice,Price,Rating,NoofRatings,Discount,Delivery,Prime Delivery,base
0,B07H5NZ5DY,Men's Auto Lock Leather Belt,Labnoft,1,0,0,629,4.3,"1,279",37,,1,"1,279"
1,B07MZ3B4SS,Men's Reversible PU Leather Belt,Labnoft,1,0,0,584,4.0,"2,244",42,,1,"2,244"
2,B0814Z28G3,Men's Leather Auto Lock Belt,Labnoft,1,0,0,629,4.2,774,37,,1,774
3,B084QBHG29,"Unisex Tucker Shirt Stay Belt (Black, Adjustable Size)",ANEMONE,1,0,0,199,3.8,330,80,,1,330
4,B06XHGX8KZ,Reversible Pu-Leather Formal Belt For Men(Color-Black/Brown||BL-01|| 46 inches lenght|| Waist upto -40 inches),CREATURE,0,1,0,372,3.9,"8,445",75,,1,"8,445"
5,B0854J6N67,Men's PU Leather Black Autolock Grip Belt,ZORO,0,0,0,268,3.7,"1,762",82,,0,"1,762"
6,B0824PLNV5,Leather Belt for Men,URBAN FOREST,0,0,0,455,4.0,"3,477",77,,0,"3,477"
7,B083XSX3HK,Unisex Nylon & Canvas Waist Belt (Pack of 2),ZORO,0,0,0,292,4.2,517,90,,0,517
8,B07ZX36FHN,Men's Leather Belt (Pack of 3),SORSHORE,0,0,0,140,3.0,"1,600",53,,0,"1,600"
9,B088TFL5W4,Men's Leather Belt,URBAN FOREST,0,0,0,455,4.0,"3,033",77,,0,"3,033"
10,B0854P4TH9,"Stretchable Braided Woven Fabric Belt for Men and Women, Fits on upto 40 inch waist size",ZORO,0,0,0,230,4.2,897,77,,0,897
11,B07LD783TM,"Men's Artificial PU Leather Casual and Formal Reversible Belt (Black/Brown , Size 28-44 )",Axe Style,0,0,0,289,3.8,"2,331",81,,1,"2,331"
12,B06XJD52FZ,Formal/Casual Brown Genuine Leather Belts For Men (BL-03),CREATURE,0,0,0,331,3.9,"3,977",78,,0,"3,977"
13,B0811JVLCK,Men's Nylon Belt,ZORO,0,0,0,379,3.9,500,75,,0,500
14,B0747WD32Q,"Reversible PU-Leather Formal Black/Brown Belt For Men (Color-Black/Brown) belt for men, formal belt, gift for gents, Gents belt, mens belt.",CLUB SPUNKY,0,0,0,298,3.7,"2,016",83,,1,"2,016"
15,B07ZH15G21,"Men's Genuine Leather Auto Lock Buckle Belt (Free Size, Black)",CONTACTS,0,0,0,749,4.2,"1,780",58,,1,"1,780"
16,B07MZ3B4SS,Men's Reversible PU Leather Belt,Labnoft,0,0,0,584,4.0,"2,244",42,,1,"2,244"
17,B07NRY1VZ2,"Men's Nylon woven fabric Belt, Hole free plastic flap buckle",ZORO,0,0,0,230,4.1,"3,765",85,,0,"3,765"
18,B07SJGR95G,Men's Artificial Leather Belt,VOGARD,0,0,0,498,3.9,"2,558",59,,0,"2,558"
19,B083JCLDZH,1 Pcs Women's Metal Wide Plate Adjustable Ladies kanduro-Belt (2 cm Wide) (Golden),SATYAM KRAFT,0,0,0,349,4.3,"2,689",71,,0,"2,689"
20,B082HYQN1W,Men's Leather Belt,CHURCHILL & COMPANY,1,0,0,"2,399",3.3,19,35,,1,19
21,B07W58522C,"Men's Belt, Italian plain Leather Black and Brown Reversible Belt for Men/Gift Box",Vincent xavier,1,0,0,495,3.7,62,78,,1,62
22,B096BG31F7,"Formal Casual Genuine Leather Top Grain Color Black,BrownTan",ELITE CRAFTS,1,0,0,399,0,0,77,,0,"₹399
₹1,699 Save ₹1,300 (77%)"
23,B09B3DYMKG,Reversible Formal Leather Belt for Men I Durable Buckle I Heavy Duty,WildHorn,1,0,0,480,4.4,5,70,,0,5
24,B07H5NZ5DY,Men's Auto Lock Leather Belt,Labnoft,0,0,0,629,4.3,"1,279",37,,1,"1,279"
25,B07ZGXRGFG,Men's Genuine Leather Auto lock Buckle Belt | Lealther Belt for Men,Contacts,0,0,0,749,4.2,"3,564",58,,1,"3,564"
26,B07HXRPN1F,Men's PU Leather Reversible Belt (ZR-ALB35-RSTX-21_Black & Brown),ZORO,0,0,0,261,3.6,209,83,,0,209
27,B07QSTDLMZ,Men's Leather Belt,HIDE & SKIN,0,0,0,557,4.0,"2,573",72,,1,"2,573"
28,B078BGC1X1,Women's Metal kanduro Skinny Stretch Leaf Belt Pack of 1 (Leaf Belt_Golden),SATYAM KRAFT,0,0,0,249,4.2,"3,002",79,,0,"3,002"
29,B07Y8B19ZG,"Women's Faux Leather Belt ( Black , Free Size )",Zacharias,0,0,0,248,4.2,245,59,,0,245
30,B08GZD2J5G,"AB-001 Men's Faux Leather Automatic Buckle Belt (Black, Free Size)",Zacharias,0,0,0,289,3.7,"1,291",71,,0,"1,291"
31,B082ZJPCC6,Men's Leather Belt,HIDE & SKIN,0,0,0,496,4.0,482,75,,0,482
32,B08Y6TSG3R,Women's Retro Elastic Stretchy Metal Buckle Skinny Waist Belt 1 inch Wide,SATYAM KRAFT,0,0,0,259,4.3,879,78,,0,879
33,B07Y88YW16,G3E Women's Faux Leather Belt,Zacharias,0,0,0,245,4.1,"2,093",58,,0,"2,093"
34,B07NBDHYNP,Women's Leather Belt,Electomania,0,0,0,399,4.3,"2,764",33,,0,"2,764"
35,B07GV14TZW,"Men's Leather Belt (Camel, 34)",Woodland,0,0,0,499,3.5,74,29,,0,74
36,B07TF55T6Z,"Cotton D ring buckle belt for men, Gifting solution, Leather free, light weight",ZORO,0,0,0,148,4.1,"1,144",85,,0,"1,144"
37,B08XZ9LYHM,Andrew Formal Reversible Belt for Men,URBAN FOREST,0,0,0,499,3.9,231,75,,1,231
38,B083JD4RRY,1 Pcs Women's Metal Wide Plate Adjustable Ladies kanduro-Belt (3.5 cm Wide) (Golden),SATYAM KRAFT,0,0,0,399,4.1,"1,599",67,,0,"1,599"
39,B08YK5ZF38,Gold sequin embellished tasseled saree Waist Belt and Kamarbandh for Women and Girls,Duchess,0,0,0,498,3.6,54,75,,0,54
40,B07ZHD6131,Men's Genuine Leather Pin Buckle Belt | Leather Belt for Men,CONTACTS,0,0,0,699,4.3,184,61,,1,184
41,B09JM8ZJ89,Petersen Mens Leather Belt | Leather Belt For Men | Casual Mens Leather Belt,HORNBULL,0,0,0,499,4.3,32,80,,1,32
42,B07YNS2CPC,Women's Vegan Leather Belt (Pack of 2),SIDEWOK,0,1,0,295,3.8,"1,399",70,,0,"1,399"
43,B06XJP8QCV,Reversible Pu-Leather Formal Belt For Men(Color-Black/Brown||Length-46 inches upto waist 40 inches||BL-06),CREATURE,0,0,0,298,3.8,"2,008",80,,1,"2,008"
44,B09DTNVG39,"Fashionable Women Belt for Jeans, Colour Black, Party & Casual Wear||Ladies belt for women|| Ladies Belt for jeans||Belt for women stylish|| ||Leather Belt stylish for Ladies/Girls/Women||Black colour|| Size Upto 40inch",Generic,0,0,0,100,3.6,50,87,,0,50
45,B083JDJLW2,1 Pcs Women's Metal 3.5 cm Wide Hollow Design Plate Adjustable Ladies kanduro Belt (Golden),SATYAM KRAFT,0,0,0,399,4.2,"2,144",67,,0,"2,144"
46,B09C3TSGTB,Belts for Men Reversible Leather 1.25 Waist Strap Fashion Dress Buckle Eliz Luxe - 1 Year Warranty,ELIZ LUXE,0,0,0,399,4.0,71,69,,1,71
47,B0837XH16Y,Men's Woven Stretchable Flexible belt,ZORO,0,0,0,237,4.0,"1,565",76,,0,"1,565"
48,B0814Z28G3,Men's Leather Auto Lock Belt,Labnoft,0,0,0,629,4.2,774,37,,1,774
49,B085M5FK5V,"Men's PU Leather Autolock Belt, Free Size",Labnoft,0,0,0,699,4.1,109,30,,1,109
50,B07WV994J2,Men's Genuine Braided Leather Belt (Free Size),VOGARD,0,0,0,749,4.2,"1,807",69,,1,"1,807"
51,B07DJKXWNS,Men's Belt,Tommy Hilfiger,0,0,0,"1,505",4.1,31,35,,1,31
52,B07H6L4B4D,Formal/Casual Black Color Genuine Leather Belts For Men (Length- 46 inches||35MM||BL-037),CREATURE,0,0,0,388,3.9,553,81,,0,553
53,B09NGNJRYF,Green Apple Inc Stretchable Party Occasional Adjustable Premium Black Women Belt (Pack of 1),Generic,0,0,0,220,0,0,60,,1,"₹220
₹549 Save ₹329 (60%)"
54,B07YC64RDF,Gothic Leather Waist Belt Punk Rock Grommet Belt for Jeans Party Body Jewelry Accessories for Women and Girls,PALAY,0,0,0,599,4.3,398,47,,1,398
55,B09PZ2N2WH,Boy's Synthetic Leather Belt for kids (Black; 8-12 Years) WF-01,Zacharias,0,0,0,199,5.0,1,67,,1,1
56,B07TBXYVCV,"Men's Belt, Italian Leather Reversible Belt for Men Black/Brown Dress Belt Rotate Buckle Gift Box",Vincent xavier,1,0,0,499,3.6,35,80,,1,35
57,B07TF4LY74,Men's Leather Reversible Belt,Vincent xavier,1,0,0,499,3.8,146,79,,1,146
58,B07N3R7ZLF,Men's Leather Belt,WildHorn,1,0,0,540,3.8,558,66,,1,558
59,B0919Q2LLZ,Men's Genuine Leather Auto-Lock Buckle With Reversible Belt,BlacKing,1,0,0,499,4.1,74,74,,1,74
60,B09LD17LMR,Genuine Leather Men’s Formal/Casual Tan Belt | BL8001,HAMMONDS FLYCATCHER,1,0,0,454,4.0,14,77,,0,14
61,B0919N8K87,Men's Genuine Leather Auto-Lock Buckle With Reversible Belt,BlacKing,1,0,0,499,4.1,74,74,,1,74
62,B08P2ZLP4W,Carter Classic Leather Belt For Men,WildHorn,1,0,0,399,3.4,76,69,,0,76
63,B09B55TMH2,"Men's Formal Belts, Handmade Pure Italian Quality Genuine Leather Belt with Antique Buckle For Casual/Formal/Office Purpose.",Cavaldii ITALIA,1,0,0,499,4.0,100,80,,1,100
64,B07ZHDNMYD,Men's Genuine Leather Auto Lock Buckle Belt | Leather Belt for Men,CONTACTS,0,0,0,749,4.2,347,58,,1,347
65,B09HZM6SCP,"1 Pcs Angel Wings Women Stretchy Metal Belt for Dresses (Gold, 1 Piece)",SATYAM KRAFT,0,0,0,279,4.2,10,77,,0,10
66,B08P5GZH9Y,Men's Leather Auto Lock Belt,Labnoft,0,0,0,499,4.0,315,50,,1,315
67,B08K8TJZCJ,"Men's Reversible PU-Leather Formal Belt, Watches and Sunglasses (Black/Brown)",Sheomy,0,0,0,449,3.6,665,85,,1,665
68,B09GVDD7PF,"1 Pcs Women Stretchy Metal kanduro Belt for Dresses Vintage Elastic Wide Waist Belt (Black, 1 Piece)",SATYAM KRAFT,0,0,0,349,3.6,16,71,,0,16
69,B09HL64RZM,sabyanshi black gold tiger belt 32-36,Generic,0,0,0,999,5.0,4,67,,0,4
70,B07KMXK47B,Unisex Synthetic Belt,CONTACTS,0,0,0,498,3.9,"1,515",72,,0,"1,515"
71,B09QPL7MGJ,Latest Fashion Celebrity Inspired Adjustable Metal Plate Type Golden Kamarband Waist Belt for Women and Girls,Yellow Chimes,0,0,0,299,0,0,76,"Thursday, February 17",0,"₹299
₹1,251 Save ₹952 (76%)"
72,B09HHMMYG1,Women's Mirror Stretch Waist Dress Belt Skinny Belt for Women Dress Waist Belt Metal Plain Mirror Elastic Belt Adjustable Metal Golden Belt for Ladies,MARZIX,0,0,0,299,4.0,11,54,,1,11
73,B086XTQGCZ,Men's Belt (AN FB 01 BK 38_Black_Large),Alpha Nemesis,0,0,0,154,3.7,23,78,,0,23
74,B09H7CMZ1V,"Belts for Women Dresses Jumpsuit Dress Belts Vintage Elastic Wide Leaf Waist Belt Waistband(Black,68cm)",PALAY,0,0,0,499,4.1,7,31,,1,7
75,B088T32W9M,Men's Leather Belt,URBAN FOREST,0,0,0,455,3.9,637,77,,0,637
76,B01KI3VOW6,"Ladies Women Stretch Elasticated Waist Belt Buckle Fashion Women Belt - camel, 61cm*6cm",Generic,0,0,0,325,4.2,107,51,,1,107
77,B01GA7DOFO,Men's Leather Belt (Camel | Size 32),Woodland,0,0,0,499,3.7,264,29,,0,264
78,B08QY9RRS9,Women's Elastic & PU leather Belt,Electomania,0,0,0,399,4.4,473,60,,0,473
79,B07Y59G2LS,"Men's Faux Leather Formal and Casual Belt (Brown, Upto 42 Size)",Generic,0,0,0,95,3.2,89,52,,0,89
80,B06VSSTCXH,Men Belt,Pacific Gold,1,0,0,"1,099",3.8,56,50,,1,56
81,B08NXYRVKG,Belts for Men with Designer Automatic Buckle Belts For Women Belt for Mens Formal/Casual Men's Vegan(PU) Artificial Leather,Farrago,1,0,0,398,3.1,12,80,,0,12
82,B08P5GCMKM,Men's Leather Auto Lock Belt,Labnoft,1,0,0,699,4.1,314,30,,1,314
83,B07QGW8J8D,Men's Leather Reversible Belt,CHURCHILL & COMPANY,1,0,0,"2,399",3.3,20,35,,1,20
84,B08TWK4DS1,Women's Adjustable Pearl Belt Belly Chain Waist Belt kamarband Pack of 1 (Gold),SATYAM KRAFT,0,0,0,269,3.9,54,78,,0,54
85,B09C3FQ572,Harvey Formal Leather Belt for Men,URBAN FOREST,0,0,0,499,3.5,53,75,,1,53
86,B01MG1CDKS,men's black non leather belt with auto lock buckle(Q1301-WR-13),Sunshopping,0,0,0,199,3.7,418,60,,0,418
87,B07N12F6FB,"Men's Nylon Tactical Military Style Webbing Belt with Metal Buckle (Green, Free Size)",ZORO,0,0,0,379,3.9,243,75,,0,243
88,B07N11RQZ3,Men's Woven Tactical Belt with Metal Buckle NB-51-GD,ZORO,0,0,0,379,4.0,66,75,,0,66
89,B095TL52G6,"Belts for Women Dresses,Retro Lace-up Corset Belt Women,Waist Belt for Women Stylish,Ladies Belt-Black",Eastern eagle,0,0,0,298,3.0,29,70,,0,29
90,B01N2R13TV,Robert Mens Leather Belt | Leather Belt For Men |Top Grain Formal Mens Leather Belt,HORNBULL,0,0,0,499,3.8,128,75,,1,128
91,B08YK7QM4H,Black sequin embellished tasseled saree Waist Belt and Kamarbandh for Women and Girls,Duchess,0,0,0,498,4.0,51,75,,0,51
92,B07QLY42KV,Men's Leather Belt,HIDE & SKIN,0,0,0,557,4.0,708,72,,1,708
93,B09HKSMBK9,1 Pcs Women's Metal Wide Plate Adjustable Ladies Belt Women's Waist Belt Polished Shiny Metal Adjustable Chain,JULEX,0,0,0,310,4.5,24,56,,1,24
94,B06XRMB789,CONTACTS Men's Genuine Leather Braided Belt | Leather Belt for Men,VOGARD,0,0,0,749,4.1,950,69,,1,950
95,B084KN7TVP,"most popular Elastic Stretchable buckle braided rope Belts for kids Boys and Girls for jeans, pants, frocks, shorts (Black Free Size))",Generic,0,0,0,181,3.7,15,74,,1,15
96,B07Y826432,Brian Redwood Leather Wallet & Redwood Casual Textured Belt Combo Gift Set for Men,URBAN FOREST,0,0,0,892,4.2,981,64,,1,981
97,B0834QVC31,Women's Metal Leaf Design Belt-kanduro Pack of 1 (Gold),SATYAM KRAFT,0,0,0,259,4.3,610,78,,0,610
98,B09HV4HHZZ,Women's Mirror Stretch Waist Dress Belt Skinny Belt for Women Dress Waist Belt Metal Plain Metal Wide Plate Adjustable Ladies Belt,Akszone,0,0,0,349,0,0,50,,1,"₹349
₹699 Save ₹350 (50%)"
99,B09FFRP97Z,Fashionable Belt for Jeans Party & Casual Wear||Ladies belt for women|| Ladies Belt for jeans||Belt for women stylish|| ||Leather Belt stylish for Ladies/Girls/Women||Black colour|| Size Upto 40inch,Generic,0,0,0,100,3.4,28,80,,0,28
100,B09QZ63L88,"Adjustable Women's Mirror Stretch Waist Dress Belt Skinny Belt Metal Waist Belt for Women Saree, Dress, Traditional Cloth, Jewelry Shiny Gold for Girls Bridal with Button (Golden - Free Size)",SILENCIO,0,0,0,279,0,0,72,,1,"₹279
₹999 Save ₹720 (72%)"
101,B09JC7S8K4,KRIAEX Womens Full Metal Sleek Mirror Plate Waistband Belt Chain Dress Decorated Skinny Golden Belt,RMJ,0,0,0,329,4.1,7,59,"Wednesday, February 16",1,7
102,B09M73S2WR,"Auto Lock Grip Leather Black Leather Belt For Men Formal Gifting Gift Set (GRPCRS, Waist Upto -42 Inches)",RIZORO,0,0,0,329,4.5,2,91,,0,2
103,B09HZWH9N3,Women's kanduro Adjustable Tassel Hollow Circle Waist Chain Belt Pack of 1,SATYAM KRAFT,0,0,0,319,4.6,18,73,,0,18
104,B07YG6NRZ8,Unisex Nylon & Canvas Belt (BLT063_08_Black & Beige),EDIFIER,0,0,0,319,4.0,143,68,,0,143
105,B07N3WN6Y4,Men's Leather Belt,WildHorn,0,0,0,540,3.8,558,66,,1,558
106,B084S5BZ1K,"Corset Belt,Corset Belt for Women,Broad Belt for Women,Stylish Belt for Women for Women's",Electomania,0,0,0,398,4.2,"1,038",34,,0,"1,038"
107,B098TN6T33,Tan Belt,Peter England,0,0,0,754,0,0,25,,1,"₹754
₹999 Save ₹245 (25%)"
108,B00CLOTKYU,"Belt, Men's",Puma,0,0,0,587,4.0,47,61,,1,47
109,B085YBKL65,Women's Elastic Belt,Electomania,0,0,0,399,4.3,554,33,,0,554
110,B00PW3KRXU,Black Leather Men's Belt,Puma,0,0,0,"1,060",3.8,48,61,,1,48
111,B09NFSYJJ4,1 Pcs Metal Chain Buckle Skinny Stretch Waist Belt For Dress,SATYAM KRAFT,0,0,0,399,5.0,4,67,,0,4
112,B00LX5C57C,Men's reversible Black leather Belt (PBL-01),SPAIROW,0,0,0,299,3.3,59,80,,0,59
113,B07ZVXBXNK,Women's Vegan Leather Belt (Pack of 3),SIDEWOK,0,0,0,295,3.7,"1,180",70,,0,"1,180"
114,B00SGLKJZG,Brown Leather Men's Belt (5260604-M),Puma,0,0,0,691,3.0,34,59,,1,34
115,B09QPVCFR3,Latest Fashion Adjustable Metal Plate Type Design Golden Kamarband Waist Belt for Women and Girls,Yellow Chimes,0,0,0,299,0,0,76,"Thursday, February 17",0,"₹299
₹1,251 Save ₹952 (76%)"
116,B085M5FK5V,"Men's PU Leather Autolock Belt, Free Size",Labnoft,1,0,0,699,4.1,109,30,,1,109
117,B07QDNBSGH,Men's Leather Belt,CHURCHILL & COMPANY,1,0,0,"2,399",3.8,9,35,,1,9
118,B095X2RR83,Genuine Leather Autolock Buckle Dress Black Belts for Men And Boys,Pacific Gold,1,0,0,999,4.0,80,58,,1,80
119,B097ZVZ88G,Formal Black Texas Leatherite Reversible Belt for Men,WildHorn,1,0,0,380,3.8,47,76,,0,47
120,B0919MV9WR,Men's Genuine Leather Auto-Lock Buckle With Reversible Belt,BlacKing,1,0,0,499,4.1,74,74,,1,74
121,B09LCXPPY7,Genuine Leather Men’s Formal/Casual Tan Belt | BL8001,HAMMONDS FLYCATCHER,1,0,0,454,4.0,14,77,,0,14
122,B09BNRJWK6,Auto lock Buckle Adjustable Belts Free Size,ELITE CRAFTS,1,0,0,379,3.9,12,71,,1,12
123,B09NL8QX5J,Casual Tan Color Genuine Leather Belt with Double Prong Buckle for Jeans and Casual Wear belt for men stylish Leather for Men's/Boys ||CSBL-BRBKL-05||,CLUB SPUNKY,1,0,0,499,4.6,4,77,,1,4
124,B00UJEFVWO,Leather Women's Belt,Lino Perros,0,0,0,495,3.9,6,0,,0,6
125,B085TMPXCX,Women's Cotton Belt (Pack of 2),ZORO,0,0,0,230,4.3,533,77,,0,533
126,B00JYF2ML2,Men's Antique Silver Black Steel Grey Belt,Puma,0,0,0,446,4.3,37,55,,0,37
127,B09FHYN22H,"Women Belt for Jeans,||Ladies belt for women|| Ladies Belt for jeans||Belt for women stylish|| ||Leather Belt stylish for Ladies/Girls/Women||Black colour|| Size 40inch O ring buckle",Generic,0,0,0,100,3.8,25,89,,0,25
128,B09NJLCZW8,1 Pcs Bowknot Design Women Stretchy Belt for Dresses Vintage Elastic Wide Waist Belt,SATYAM KRAFT,0,0,0,269,4.4,8,78,,0,8
129,B08QZ68X5R,Reversible Black And Brown Leather Belt for Men TWO IN ONE BELT,TEDSPRAY,0,0,0,399,3.8,189,60,,0,189
130,B07N475WP2,Men's Leather Belt,WildHorn,0,0,0,540,4.2,22,66,,1,22
131,B09FHXF5PD,"Women Belt for Jeans,||Ladies belt for women|| Ladies Belt for jeans||Belt for women stylish|| ||Artificial Belt stylish for Ladies/Girls/Women||Black colour|| Size 40inch",Generic,0,0,0,150,3.7,14,79,,0,14
132,B08QYLJY8Z,Women's Elastic & PU leather Belt,Electomania,0,0,0,398,4.3,307,60,,0,307
133,B07M95MSS1,Men's Synthetic Reversible Belt (BELT 69_Black & Brown),FRIENDSKART,0,0,0,275,3.5,132,45,,1,132
134,B07ZHD14JG,"Mens Genuine Leather Pin Buckle Belt (Free Size, Dark Brown)",CONTACTS,0,0,0,599,3.6,13,67,,1,13
135,B0922PJH62,Men's Genuine Leather Auto Lock Buckle Belt | Leather Belt for Men (Free Size),CONTACTS,0,0,0,798,4.4,178,56,,1,178
136,B00BDBZRB2,"Belt, Men's (Red), x (5241901-X)",Puma,0,0,0,579,4.1,35,61,,1,35
137,B0759L2W3B,Men's Belt (Camel_32),Woodland,0,0,0,499,3.7,88,29,,0,88
138,B06VV61561,Men's Combo Pack Of Wallet & Belt,Amicraft,0,0,0,499,3.8,46,72,,1,46
139,B07KQ61GNZ,Women's Belt Fashion Bowknot Design Chic Elastic Stretch Waist Band (Black),Electomania,0,0,0,389,4.3,"1,104",35,,0,"1,104"
140,B07QDNCWBN,Men's Leather Reversible Belt,CHURCHILL & COMPANY,1,0,0,"2,399",3.3,20,35,,1,20
141,B07W78D5B7,"Men's Casual Formal Evening Artificial Reversible Belt (Black, Free Size)",Nitrogen,1,0,0,229,3.7,4,86,,0,4
142,B095X2NVTS,PU Leather Ratchet Black Dress Belts for Men And Boys with Autolock Buckle,Pacific Gold,1,0,0,899,2.0,2,75,,1,2
143,B08P32R968,Carter Classic Leather Belt For Men,WildHorn,1,0,0,480,3.4,76,63,,0,76
144,B096FQRBC2,Women's Lace-up Cinch Belt Corset Style Elastic Waist Belt(Black),Cute Critters,0,0,0,378,3.8,92,62,,0,92
145,B09JCN2Y1V,Metal Waistband Skinny Belt Adjustable Waist Strap Belt for Dress Metal Waist Belt Shiny Adjustable Mirror Waist Belt For Women,Anugrah,0,0,0,299,4.1,6,46,,1,6
146,B08X775F29,Woodland Yellow Leather Belt For Men's,Genuine Leather,0,0,0,499,3.5,35,60,,0,35
147,B07XVM6FD9,XXXL OVERSIZE PLUS SIZE women formal fabric belt black microprint for jeans and trouser,Generic,0,0,0,329,4.3,4,75,,1,4
148,B07V637X8W,"Cotton D ring buckle belt for men | Leather free, light weight, (PACK OF 3) |",ZORO,0,0,0,265,4.3,372,73,,0,372
149,B08DYH3DMW,Men's Combo of Tan Color Belt And Tan Color Leather Wallet,Imperior,0,0,0,375,2.9,17,71,,0,17
150,B09R9VH7X2,FS1 Belt For Women (Most Trending),Generic,0,0,0,240,1.0,1,45,,0,1
151,B07YG7LHT8,Unisex Nylon & Canvas Waist Belt,EDIFIER,0,0,0,225,4.1,380,72,,0,380
152,B07G5QDNBX,Trevor Brown RFID Blocking Leather Wallet & Brown Casual Belt Combo Gift Set for Men,URBAN FOREST,0,0,0,892,3.9,150,64,,1,150
153,B07YG7LVXC,Unisex Nylon & Canvas Waist Belt (BLT063_05_Black & Green),EDIFIER,0,0,0,319,4.2,54,68,,0,54
154,B078BXMDTT,1 Pcs Women's Golden Skinny Stretch Metal Ladies kanduro Belt (lock 3),SATYAM KRAFT,0,0,0,259,4.1,307,78,,0,307
155,B09RHN2SKH,"Frunix brand Nylon Belt, Hole free plastic flap buckle Canvas Waist Belt (pack of 3) blue, brown and golden",Generic,0,0,0,0,0,0,0,,0,
156,B085MB1NRY,Women Belt Stylish Silver Buckel Elastic Embellished Waist Belt Decorative Stretch Waist Band,Futurekart,0,0,0,429,4.3,"1,081",28,,0,"1,081"
157,B096WH374Z,Jason Mens Leather Belt | Leather Belt For Men | Formal Mens Leather Belt,HORNBULL,0,0,0,499,3.9,126,75,,1,126
158,B071452YQP,Men's Genuine Leather Black & Brown Reversible Belt(Colour-Black & Brown||Italian Leather||E-002||REVERSIBLE),CREATURE,0,0,0,589,4.1,"2,112",71,,1,"2,112"
159,B07K2T599H,Women's Leather Belt,Electomania,0,0,0,399,4.2,903,33,,0,903
160,B01M6A9VZB,Leather Wallet and Belt Gift Hamper for Men | Mens Combo Gift Set | Leather Wallets for Men | Men's Wallet BW93118,HORNBULL,0,0,0,899,4.0,"2,736",73,,1,"2,736"
161,B07QZTGFWZ,Men's Genuine Leather Reversible Belt,Bacca Bucci,0,0,0,849,4.1,825,58,,1,825
162,B08P5GCMKM,Men's Leather Auto Lock Belt,Labnoft,0,0,0,699,4.1,314,30,,1,314
163,B08ML7CFT6,Belt for Men Women PU Leather Black / Brown Reversible Formal Casual Free Size with Buckle Genuine Color Belts Adjustable Waist (Fits Boys & Men),CRUMPLED,0,0,0,316,3.7,409,76,,0,409
164,B01BHQU8CA,Beautiful Black colored Women Waist Belt,Anaya,0,0,0,"1,599",0,0,0,,0,"₹1,599"
165,B07PTYJSW7,Girls/Ladies PU Leather Belt -Brown (upto 40 Size),Brussel,0,0,0,199,3.4,297,80,,0,297
166,B07YCQQM7C,"PU leather (Pack of 1) Adjustable Buckle Belts Fashion Waist Strap BELTS For Casual and Formal - Belt For Men and Boys, color Design For Daily Use",EDIFIER,0,0,0,399,3.7,63,33,,0,63
167,B084QBHG29,"Unisex Tucker Shirt Stay Belt (Black, Adjustable Size)",ANEMONE,0,0,0,199,3.8,330,80,,1,330
168,B07R183R9P,Men's Leather belt (Formal/Casual) (Colour -Brown/Black) Buckle Adjustable Size Genuine Leather (B908) (Pack of 1),Flyer,0,0,0,347,3.9,"5,620",73,,0,"5,620"
169,B08YJZSNX5,"Women Stretchy Belt, Women Belts for Dresses,Ladies Dress Stretchy Belt",Electomania,0,0,0,399,4.3,132,60,,0,132
170,B09QPJBW9R,Latest Fashion Black Retro Elastic Stretchy Metal Buckle Kamarband Waist Belt for Women and Girls,Yellow Chimes,0,0,0,275,0,0,73,"Thursday, February 17",0,"₹275
₹1,035 Save ₹760 (73%)"
171,B07LGDTJGM,Belts for Men Reversible Leather 1.25 Waist Strap Fashion Dress Buckle Eliz Luxe - 1 Year Warranty,ELIZ LUXE,0,0,1,399,4.0,69,60,,1,69
172,B08KQDY4V5,Men's PU Leather Belt,ZORO,0,0,0,307,3.7,206,83,,0,206
173,B07YC1W41J,Women's Elastic Waist Belt,PALAY,0,0,0,458,4.1,427,34,,0,427
174,B06XRD1ZXD,Leather Wallet and Classic Belt Combo for Men,WildHorn,0,0,0,899,3.9,290,55,,1,290
175,B098TTGBP4,Brown Belt,Peter England,0,0,0,688,4.3,6,31,,1,6
176,B082J14PDN,Men's Leather Belt,CHURCHILL & COMPANY,1,0,0,"2,399",3.3,19,35,,1,19
177,B09B549RTG,"Men's Formal Belts, Handmade Pure Italian Quality Genuine Leather Belt with Antique Buckle For Casual/Formal/Office purpose.",Cavaldii ITALIA,1,0,0,499,4.0,148,55,,1,148
178,B07QGW4LST,Men's Leather Belt,CHURCHILL & COMPANY,1,0,0,"2,399",3.8,9,35,,1,9
179,B09JM8ZJ89,Petersen Mens Leather Belt | Leather Belt For Men | Casual Mens Leather Belt,HORNBULL,1,0,0,499,4.3,32,80,,1,32
180,B0919NFLWH,Men's Genuine Leather Auto-Lock Buckle With Reversible Belt,BlacKing,1,0,0,499,4.1,74,74,,1,74
181,B09K5G2CNF,"Mens Leather Belt, Handmade Pure Italian Quality Mens Formal Belt.",Cavaldii ITALIA,1,0,0,499,3.9,29,80,,1,29
182,B09FGG3SK7,Brown Texas Formal Leather Belt for Men | 48 inches length || Waist upto 44 inches I,WildHorn,1,0,0,475,3.0,2,70,,0,2
183,B09K5GVS1S,"Mens Leather Belt, Handmade Pure Italian Quality Mens Formal Belt.",Cavaldii ITALIA,1,0,0,499,4.4,12,80,,1,12
184,B08W2FYQ24,"Men Reversible Solid Texas Leatherite Belt with Auto Turning Buckle (BLACK, BROWN)",ZEVORA,0,0,0,299,4.0,55,77,,0,55
185,B098TDYKXQ,Delight Belt For Boys. Baby Belt for small kids up to 5 years.,Delight Belts,0,1,0,179,4.3,33,78,,1,33
186,B07PP24HZY,"Reversible Belts PU-Leather Formal Black/Brown Belt For Men free (Color-Black/Brown) belt for men, reversible belt combo for men, gift for gents, Gents belt, mens belt with BRN Brown Watch 58-691F-ZTBC",Sheomy,0,0,0,449,3.2,328,85,,1,328
187,B09H7HVTQF,Belts for Women Dresses Jumpsuit Dress Belts Gold Buttons Elastic Wide Leaf Waist Belt Waistband(Black),PALAY,0,0,0,466,4.6,3,26,"Wednesday, February 16",1,3
188,B08XBBS15H,"Women's Metal Adjustable Belt for Saree, Western Dress, Traditional Dress, Party Designer wear (Plain, 3.5 cm wide)",Fabme,0,0,0,360,4.0,292,64,,0,292
189,B088926DJH,Men's Leather Belt (TH/BINTANREV0103LCR_Black/Brown_L-100 cm),Tommy Hilfiger,0,0,0,"2,399",4.3,23,0,,1,23
190,B08CNNNYKK,Men Black Artificial Leather Belt & Wallet For Men,LAER,0,0,0,145,3.4,31,42,,0,31
191,B08TTXXNKD,"Women's Stretchable Belt Pack of 1 Black,Free Size",Generic,0,0,0,110,3.3,3,35,,0,3
192,B09FZ4D722,Men's Leather Executive Pattern Free Size Autolock Buckle Ratchet Belt,Ammvi Creations,0,0,0,798,3.9,20,58,,1,20
193,B09DP118F9,Formal/Casual Branded Stylish Genuine Leather Belts For Men (Brown Color) ||CSBL-05||,CLUB SPUNKY,0,0,0,369,3.8,47,81,,1,47
194,B08PZ5VX9Q,2pcs Women Elastic Waist Belt Thin Belt Waist Cinch Belt for Women Girls Accessories-Black&Brown,GUSTAVE,0,0,0,499,4.1,78,29,,1,78
195,B08Z32F8DJ,"Women Stretchy Belt, Butterfly Wide Belt,Ladies Dress Stretchy Belt (Suitable Waist 25""-31"")",Electomania,0,0,0,399,4.4,51,60,,0,51
196,B09GTMKM5K,"Elastic Skinny Belts for Women,Golden Leaf Buckle for Dresses Coat Fashion Elastic Wide Waist -(66-90cm Waist",PALAY,0,0,0,456,4.7,8,30,,0,8
197,B08TMBD6RG,Women's Metal kanduro Stretchable Belt Pack of 1 (Golden),SATYAM KRAFT,0,0,0,269,4.2,108,78,,0,108
198,B07HB484PB,Carter Green Leather Wallet & Grey Leather Belt Combo Gift Set for Men,URBAN FOREST,0,0,0,939,4.0,511,62,,1,511
199,B07PTC11S2,Men's Leather Belt,ELIZ LUXE,0,0,0,399,4.0,"5,030",60,,1,"5,030"
200,B07QCPMSTK,Men's Leather Reversible Belt,CHURCHILL & COMPANY,1,0,0,"2,399",3.3,20,35,,1,20
201,B092S6V2Y5,Clara Mens Leather Belt | Leather Belt For Men | Formal Mens Leather Belt,HORNBULL,1,0,0,499,3.7,47,75,,1,47
202,B09DD49TYC,Blue Textured Leather Belt for Men | Free Size | Adjustable I 48 inches length || Waist upto 44 inches I,WildHorn,1,0,0,480,5.0,1,70,,0,1
203,B09GFYX275,Shirt Tucker Lock Belt Strap | Adjustable Elastic Stay Clamps Holder Keeps Shirt Tucked in Vest Maximum Stretch (Size 28 to 45) For Men And Women (Black),Doomsday,1,0,0,299,0,0,63,,1,"₹299
₹799 Save ₹500 (63%)"
204,B09HNN65V8,Breathable Webbing Nylon Military Style Tactical Canvas Men Women Waist Belt with Heavy-Duty Quick-Release Metal Buckle 1.5 Inches Wide,EDIFIER,0,0,0,399,5.0,4,69,,0,4
205,B06XRPDHV3,"Girl's PU Leather Belts Combo of 3 (Black,Brown & White)(GLA/WOMENBELTS1/BKBRWH)",Glamio,0,0,0,275,3.5,493,58,,1,493
206,B09NFSHGWZ,1 Pcs Women's Adjustable Metal Chain kanduro Belt with Buckle (Gold),SATYAM KRAFT,0,0,0,279,4.5,2,77,,0,2
207,B07W4ZMDQ8,Men's Leather belt (Formal/Casual) (Colour -Brown/Tan) Buckle Adjustable Size Genuine Leather (BR1512) (Pack of 1),Flyer,0,0,0,898,4.0,"1,464",55,,1,"1,464"
