,asin,title,brand,Sponsored,Best Seller,Amazon's Choice,Price,Rating,NoofRatings,Discount,Delivery,Prime Delivery,base
0,B07L6GZYDV,"Wakefit Hollow Fibre Pillow ( 68.58 cm X 40.64 cm, White and Grey )- 2 Pieces",Wakefit,1,1,0,719,4.4,"35,755",26,"Wednesday, February 16",1,"35,755"
1,B09RJ4QGGW,"Sofrest Microfiber Cloud Pillow for Sleeping, Bombay Dyeing Luxury Hotel Collections Microfiber Soft Pillow Pack of 1, 27 X 17 Inch (Pack of 1)",Sofrest,1,0,0,"1,199",4.1,60,40,"Wednesday, February 16",1,60
2,B08T65ZNDV,"Wakefit Hollow Fibre Pillow (White and Grey, 68.58 cm X 40.64 cm) - 4 Pieces",Wakefit,1,0,0,"1,349",4.5,"5,474",12,"Wednesday, February 16",1,"5,474"
3,B0847LWLKF,"The White Willow Memory Foam Cooling Gel Orthopedic Bed Pillow for Sleeping & Neck Pain Relief Suitable for Back Sleeper, Side Sleeper & Stomach Sleeper with Pillow Cover (22"" L x 15"" W x 4"" H,Multi)",The,1,0,0,"1,139",3.9,"4,656",58,"Sunday, February 13",1,"4,656"
4,B07L6GZYDV,"Wakefit Hollow Fibre Pillow ( 68.58 cm X 40.64 cm, White and Grey )- 2 Pieces",Wakefit,0,1,0,719,4.4,"35,755",26,"Wednesday, February 16",1,"35,755"
5,B016D7UJMW,"Recron Certified Dream Fibre Pillow (16""x24"")",Recron,0,0,0,399,4.0,"28,642",51,"Sunday, February 13",0,"28,642"
6,B08T65ZNDV,"Wakefit Hollow Fibre Pillow (White and Grey, 68.58 cm X 40.64 cm) - 4 Pieces",Wakefit,0,0,0,"1,349",4.5,"5,474",12,"Wednesday, February 16",1,"5,474"
7,B07XLLG72F,"Kuber Industries Luxurious 1 Piece Microfibre Pillow Filler - 16X24 Inch , White - Ctktc22178",Kuber,0,0,0,169,3.4,"3,830",32,"Sunday, February 13",0,"3,830"
8,B08VNHK9TG,JY Satin Stripes Reliance Microfiber Pillows in White Color Set of 4 Pic(16''× 26''),JY,0,0,0,649,4.0,65,35,,1,65
9,B083FKYLFG,"MY ARMOR Orthopedic Memory Foam Pillow for Comfortable Sleep, King Size (24"" x 15""x 5"")",MY,0,1,0,"1,250",4.1,"11,295",43,"Sunday, February 13",1,"11,295"
10,B09HBDY3TT,"RYLAN Cervical Contour Memory Foam Pillow,Orthopedic Pillow for Neck Pain,Orthopedic Contour Pillow Support for Back,Stomach,Side Sleepers,Anti-Snoring Neck Pillow (pillow-2022)",RYLAN,0,0,0,899,4.2,588,25,"Wednesday, February 16",1,588
11,B081NZXYXW,"Amazon Brand - Solimo Microfibre & polyester 2-Piece Premium Bed Pillow Set, Microfibre, Brown, 43 X 69 X 17 Cm",Amazon,0,0,0,709,4.1,"4,983",48,"Sunday, February 13",1,"4,983"
12,B00IJRV3AC,"Recron Certified Joy Fibre Pillow - 41 cm x 61 cm, Pack of 2, White",Recron,0,0,0,709,4.0,"1,150",0,"Sunday, February 13",1,"1,150"
13,B09829QP99,Takiyawala 100% Cotton Filling Natural Orthopedic Pillow with 100% Cotton - Hand Embroidery Cotton Fabric Sleeping Pillow | White | 16 x 25 inches (41X62.5 cm | Pack of 3,Takiyawala,0,0,0,698,4.2,237,53,"Wednesday, February 16",1,237
14,B08CMJG8Q5,Fabroyal India 5 Star Hotel Cotton Pillow Filler with Fibre for Well Night's Sleep in White Colour for Home & Hotel (Pack of 2 Pillow),Fabroyal,0,0,0,0,2.9,3,0,,0,3
15,B09QLFKWNP,Larrito Memory Foam Cervical Contour Medical Pillow for Sleeping Orthopedic Pillows for Neck Back Shoulder Support Pain Relief cusion Soft Firm Pillow (Off White) (Pillow-1),Larrito,0,0,0,699,4.6,33,42,"Wednesday, February 16",1,33
16,B07F5KZC2X,"Sleepwell Synthetic Pillow, Single, White, 2 Pieces",Sleepwell,0,0,0,719,3.7,364,37,"Friday, February 18",0,364
17,B00IJRV2D0,"Recron Certified Bliss Fibre Pillow - 43 cm x 69 cm, White",Recron,0,0,0,520,4.1,"4,046",26,"Sunday, February 20",0,"4,046"
18,B08HD8C2QC,DClub Memory Foam Cervical Contour Medical Pillow for Sleeping Orthopedic Pillows for Neck Back Pain Relief (White),DClub,0,0,0,549,3.5,136,45,"Wednesday, February 16",0,136
19,B09BLD4NFC,JY Soft Uniformly Microfiber Filled Pillow 26'' x 16'' 'Color-White (Pack of 4),JY,0,0,0,649,3.9,153,35,,1,153
20,B083FKYLFG,"MY ARMOR Orthopedic Memory Foam Pillow for Comfortable Sleep, King Size (24"" x 15""x 5"")",MY,1,1,0,"1,250",4.1,"11,295",43,"Sunday, February 13",1,"11,295"
21,B09NDSBTW5,Casa Haus YYY Collection- 5 Pack Pillows Fillers/Inserts (16 x 24 inches) - White,Casa,1,0,0,999,4.9,18,33,"Friday, February 18",1,18
22,B09PMJV4BM,Cloth Fusion Microfiber Bed Pillow Set of 2 Pieces (17x27 Inches) (Maroon & Navy),Cloth,1,0,0,629,4.0,11,37,"Tuesday, February 15",1,11
23,B0166F5ZX4,"Spread Spain® Doctor Plus Pillow for Cervical/ Contoured Neck Memory Foam Pillow, Pillow for Neck Pain and Shoulder Pain(45 x 68 cm, White, Pack of 1 )",Spread,1,0,0,"3,595",3.8,25,14,"Wednesday, February 16",1,25
24,B08TJ18JK5,"Wakewell Soft Fibre Pillow for Bed, 61 x 41 cm, White, Pack of 2 Pillows",Wakewell,0,0,0,448,3.6,"1,578",59,"Wednesday, February 16",0,"1,578"
25,B00IJRV32U,"Recron Certified Joy Fibre Pillow - 41 cm x 61 cm, White",Recron,0,0,0,379,3.9,"1,171",0,"Sunday, February 13",0,"1,171"
26,B097H8RR2B,"The White Willow Cooling Gel Memory Foam Orthopedic Bed Pillow for Sleeping & Neck Pain Relief for Back Sleeper, Side Sleeper & Stomach Sleeper with Pillow Cover - Pack of 2 (22""L x 15""W x 4""H) Multi",The,0,0,0,"1,959",4.0,667,64,"Sunday, February 13",1,667
27,B09PMJV4BM,Cloth Fusion Microfiber Bed Pillow Set of 2 Pieces (17x27 Inches) (Maroon & Navy),Cloth,0,0,0,629,4.0,11,37,"Tuesday, February 15",1,11
28,B091TTRV47,"takiyawala Microfiber Bed Pillow Bolster, 12 x 30 inch, White, Set of 2",takiyawala,0,0,0,599,4.1,121,60,"Wednesday, February 16",0,121
29,B09B67RX4W,"JY Hollow Microfibre Standard Luxury Bed Pillow for Sleeping (16x26 Inches, White) -Set of 3",JY,0,0,0,395,3.7,151,51,"Thursday, February 17",0,151
30,B075R5Q1CH,JDX Premium Hotel Quality Hollow Fiber Pillow Set of 2-16x24,JDX,0,0,0,299,3.8,"1,290",81,"Wednesday, February 16",1,"1,290"
31,B09P5HQ3X1,"Wakewell Pillow for Bed, Soft Pillow for Sleeping | 61 cm x 41 cm - 1 Cotton Pillow",Wakewell,0,0,0,239,3.3,15,53,"Wednesday, February 16",0,15
32,B09QJRFZ2N,"Shree GANPAT Enterprises Ultra Soft White Fibre Pillow Sets for Bed (White-Set of 6, Size- 60*40 Inch)",Shree,0,0,0,569,1.0,2,19,"Wednesday, February 16",0,2
33,B08Q441VS3,"takiyawala ® 300TC Poly-Cotton Breathable Fabric with Down Alternative Fiber Filled Pillow for Sleeping (King Size - 16"" x 26"" x4"" ) -Pack of 2, White",takiyawala,0,0,0,699,3.9,202,64,"Wednesday, February 16",1,202
34,B09C3S5JW8,Sleeping Pillow - Micro Fiber Filled Dark Grey Plain Cotton Pillow Takiya Combo Set of 2 for Bed Room - 17x27 Inch Size Pillow Set of 2 for Sleeping,Sleeping,0,0,0,599,4.3,117,50,"Wednesday, February 16",1,117
35,B09QJRSRV9,"Anju Enterprises Microfiber Blue Star Printed Pillow Sets (Black Cotton,Set of 4,16 x 24 inch )",Anju,0,0,0,399,0,0,69,"Wednesday, February 16",1,"₹399
99
₹1,299 Save ₹899.01 (69%)"
36,B09QJSJGPQ,"Anju Enterprises Ultra Soft Whitefibre Floral Printed Bed Pillow Sets (White Cotton,Pack of 2, Size- 40 x 60 cm )",Anju,0,0,0,245,3.0,2,39,"Wednesday, February 16",0,2
37,B09NNLB7H3,RK TRADERS Microfibre & Polyster Ultra Soft Blue Stripes Bed Pillow Sets ( 4 Piece ),RK,0,0,0,0,3.7,17,0,,0,17
38,B08LGVS26D,"Samrat Microfiber Bolster, Standard, White, Set Of 2 Pcs",Samrat,0,0,0,379,4.1,264,78,"Friday, February 18",0,264
39,B09RH2M733,"Woomzy Orthopedic Memory Foam Pillow for Comfortable Sleep Bed Pillow for Sleeping & Neck Pain Relief Suitable for Back Sleeper, Side Sleeper & Stomach Sleeper Ergonomic Cervical Pillows (Pack of 1)",Woomzy,0,0,0,799,5.0,20,84,,1,20
40,B075QK83BJ,"JDX Premium Hotel Quality Soft Polyester Blend Fiber Pillow, White -Set of 2 Size 16x24 Inches",JDX,0,0,0,449,3.8,"1,386",55,"Wednesday, February 16",0,"1,386"
41,B09K3SPLRD,"THE WOOD WHITE Soft Premium Microfiber Cloud Pillows Set of 2 | 18""x28"" Inches Large Size of Luxurious Quality Pillows for Home. (Pure White)",THE,0,0,0,531,4.3,67,72,"Wednesday, February 16",1,67
42,B083BWFZHP,"PumPum Microfiber Pillow Set, 16x24 inch, White, 1 Piece, Pack of 1",PumPum,0,0,0,139,3.5,251,44,"Wednesday, February 16",0,251
43,B08Y6N7FGP,"ATOOTFUSION 100% Cotton Fabric Black Hosiery Medium Hard Cotton Bed Pillow for Real Perfect Neck Support (16"" x 26"") Set of 02 Checkered Multicolour",ATOOTFUSION,0,0,0,324,3.8,466,68,"Wednesday, February 16",0,466
44,B09NY1Y8GV,Cloth Fusion Microfiber Bed Pillow Set of 2 Pieces (17x27 Inches),Cloth,0,0,0,629,4.0,11,37,"Wednesday, February 16",1,11
45,B09CT3V4LJ,"H B MSALA Luxury Full Body Pillow Insert - Ultra Soft Body Pillow for Sleeping - Breathable Long Bed Pillow Insert, 20""x54""(Navy Blue)",H,0,0,0,499,0,0,75,"Wednesday, February 16",0,"₹499
99
₹1,999 Save ₹1,499.01 (75%)"
46,B098JLVMPQ,"Milford Orthopedic Memory Foam Pillow for Comfortable Sleep,Standard Size Neck & Back Support Sleeping Pillow",Milford,0,0,0,599,3.9,750,50,"Wednesday, February 16",0,750
47,B08ZLYR5Z3,"REMCART Microfiber Sleeping Pillow, 40 cm X 60 cm, White (Pack of 1PC)",REMCART,0,0,0,189,2.8,17,68,"Wednesday, February 16",0,17
48,B08TK2R3NP,"Amazon Brand - Solimo Premium Microfiber Bed Pillow Set (Blue and White, 43 x 69 cm , Standard) - 2 Piece",Amazon,0,0,0,719,4.1,469,40,"Thursday, February 17",1,469
49,B08L3CMFS9,"JY Reliance Microfiber with Sateen Strip Fiber Filled 2 Piece Pillow Set - 16"" x 27 , Antique White",JY,0,0,0,349,3.5,67,56,"Thursday, February 17",0,67
50,B09KH9NFY2,"JY Standard Fresh Microfiber Super Soft Bed Pillow for Sleeping Set of 3 Size - 16 "" X 26 """,JY,0,0,0,449,3.8,31,55,,0,31
51,B09P85MC82,"CHEMAX Contour Memory Foam Pillow for Sleeping, Orthopedic Pillow for Neck Pain, Support for Back, Stomach, Side Sleepers, with Breathable Zip Cover Pack of - (1)",CHEMAX,0,0,0,549,4.5,18,45,"Wednesday, February 16",0,18
52,B08KQHYRFG,Livpure Smart Cloud Microfiber Extra Soft Pillow with Standard Size 27 X 18 Inch - White ( Pack of 1 ),Livpure,0,0,0,599,3.9,418,69,"Sunday, February 13",1,418
53,B09NJVMQBR,"Shivay Fashion Memory Foam Cervical Pillow for Neck Pain and Spondylitis Contour Pillow Support for Back, Side Sleepers",Shivay,0,0,0,699,3.1,7,56,"Wednesday, February 16",1,7
54,B097BZMHYK,"LAWERA Neck Support, Anti Bacterial Cotton Fabric, Ultra Soft 300 Thread Count Soft Touch Fiber Pillow Set for Bed (White, Vacuum Packed) - Pack of 6",LAWERA,0,0,0,699,3.8,33,65,"Friday, February 18",0,33
55,B09M3ZLSCX,Ozoy Contour Memory Foam Pillow Adjustable for Sleeping Ergonomic Cervical Pillows Neck Pain Support Back Anti-Allergy Relief Bed with Cover (Memory Foam Pillow- (White)),Ozoy,0,0,0,799,3.8,80,60,"Wednesday, February 16",1,80
56,B09L8H4MCC,"Sleepsia Microfiber Bed Pillow for Sleeping - Down Alternative Ultrasoft Cotton Washable Pillow with Satin Gusset- Queen (Blue, Pack of 1)",Sleepsia,1,0,0,"1,299",4.5,64,78,"Wednesday, February 16",1,64
57,B08PYQ22WP,"The Sleep Company SmartGRID Premium Hybrid Pillow, The Ultimate Pillow Ever Designed by Science, No Pressure Support, Cotton, White (24x16 Inches) (66x40 cm) - Pack of 1",The,1,0,0,"2,499",4.0,248,0,"Tuesday, February 15",1,248
58,B07TZRGC53,"SleepX Noodle Foam and Fibre Pillow, White",SleepX,1,0,0,719,4.1,9,10,"Thursday, February 17",0,9
59,B08Q8HD919,"Morning Owl™ Latex Pillow - Medium Firm Pillow, eco-INSTITUT Certified 100% Natural Latex Pillow, Rubber Pillow, Best Pillow for Sleeping (60*40*12.5 cm), 1 Pillow",Morning,1,0,0,"1,995",4.0,36,39,"Tuesday, February 22",1,36
60,B09LMDLN3N,"Sleepsia Microfiber Bed Pillow for Sleeping - Down Alternative Ultrasoft Cotton Washable Pillow with Satin Gusset- Queen (Blue, Pack of 2)",Sleepsia,1,0,0,"2,250",4.5,64,44,"Wednesday, February 16",1,64
61,B09MTVFRY3,Sleepsia Bamboo Pillow (Queen) - Shredded Memory Foam Pillow for Sleeping with Washable Pillow Cover - (Adjustable Size - 28”X17”) (Pack of 1),Sleepsia,1,0,0,"1,699",4.3,223,66,"Wednesday, February 16",1,223
62,B09NY1Y8GV,Cloth Fusion Microfiber Bed Pillow Set of 2 Pieces (17x27 Inches),Cloth,1,0,0,629,4.0,11,37,"Wednesday, February 16",1,11
63,B083FK4HWF,"MY ARMOR Orthopedic Memory Foam Pillow for Comfortable Sleep, Queen Size (23"" x 14"" x 4.5"")",MY,1,1,0,"1,150",4.1,"11,295",42,"Sunday, February 13",1,"11,295"
64,B0847LWLKF,"The White Willow Memory Foam Cooling Gel Orthopedic Bed Pillow for Sleeping & Neck Pain Relief Suitable for Back Sleeper, Side Sleeper & Stomach Sleeper with Pillow Cover (22"" L x 15"" W x 4"" H,Multi)",The,0,0,0,"1,139",3.9,"4,656",58,"Sunday, February 13",1,"4,656"
65,B07VRRXGRP,"HealthSense Soft-Spot CP 30 Orthopedic Memory Foam Cervical Pillow for Neck, Shoulder, Sleeping Pain with Premium Bamboo Fibre Fabric Cover",HealthSense,0,0,0,"1,399",4.1,722,39,"Tuesday, February 15",1,722
66,B09P1BJCZS,"Proliva Cervical Contour Memory Foam Pillow,Orthopedic Pillow for Neck Pain,Orthopedic Contour Pillow Support for Back,Stomach,Side Sleepers,Anti-Snoring Neck Pillow (Pack of 1)",Proliva,0,0,0,899,5.0,8,55,"Wednesday, February 16",0,8
67,B09G6BCQYV,"Hari Shankar Trading Company Bombay Dyeing Cotton Cloth, Bolster Round Pillow Filled with Reliance Microfiber, White, 16X 32 Inch, Set of 2",Hari,0,0,0,349,3.2,6,42,"Friday, February 18",1,6
68,B08ZS81CXJ,"Hush Slim Pillow (16 x 24 x 6 Inch) I Imported Softex Filling I Anti-Sag Technology I Medium Soft Feel, Cotton, White",Hush,0,0,0,481,4.5,10,36,"Wednesday, February 16",0,10
69,B09LMHPTWJ,JY Reliance Microfiber Feeling Satin Stripe White Fabric Bed Pillow for Sleeping (Pack of 2) ( 16'' X 26'' ),JY,0,0,0,349,3.5,14,42,"Thursday, February 17",0,14
70,B09GVLPH85,"AARVI Soft Memory Foam Pillow,Cervical Pillow for Neck Pain,Orthopedic Contour Pillow Support for Back,Stomach,Side Sleepers,Anti-Snoring Relief Neck Pillow,Anti-Allergy,Pillow for Pain Relief",AARVI,0,0,0,649,3.9,55,35,"Thursday, February 17",0,55
71,B07VNT4D81,Tishnagi Designer Ultra Soft Body Pillow Long Side Sleeper Pillows for Use During Pregnancy - 100% Cotton Soft White Stripes Cover Shell with Soft Polyester Filling (Single Pack),Tishnagi,0,0,0,749,4.5,"2,814",66,"Wednesday, February 16",1,"2,814"
72,B09PRGW7YX,Youngsters Choice Presents Microfiber & Polyster Ultra Soft Blue Line Pillow for Home (Set of 6),Youngsters,0,0,0,699,2.0,1,65,"Wednesday, February 16",1,1
73,B07R5BQ5G9,"Royalking Microfiber Bed Pillow Bolster, 12 x 30 inch, White, Set Of 2",Royalking,0,0,0,650,4.0,"1,424",57,"Wednesday, February 16",1,"1,424"
74,B09BL8C1QV,"JY Reliance Microfiber Feeling Satin Stripe Fabric Bed Pillow for Sleeping ( 16'' X 26'' , White line , Set of 2 )",JY,0,0,0,299,3.6,115,57,,0,115
75,B09NVXVQQS,Trova Fashion Store Cotton Filled with Microfibre & Polyster Ultra Soft Blue Star Printed Bed Pillow Sets ( Pack of 4 ),Trova,0,0,0,419,4.0,1,16,"Wednesday, February 16",0,1
76,B09M3P66Z3,"Mahi Fab Memory Foam Cervical Pillow for Neck Pain and Spondylitis Contour Pillow Support for Back, Side Sleepers",Mahi,0,0,0,599,0,0,63,"Wednesday, February 16",1,"₹599
₹1,599 Save ₹1,000 (63%)"
77,B09M4R2JQV,Stylbase Cotton Fabric with Grey Poly-Cotton Filling Medium Soft Sleeping Pillow for Bed 16 x 25 Inch (Pack of 2),Stylbase,0,0,0,449,4.7,18,75,"Wednesday, February 16",0,18
78,B09PBHY671,"Zoliva Memory Foam Cervical Pillow for Neck Pain and Spondylitis Contour Pillow Support for Back, Side Sleepers Memory Foam Pillow (Pack of 1)",Zoliva,0,0,0,899,5.0,47,55,"Wednesday, February 16",0,47
79,B09748RDVD,"MECNIOX Bedroom Round Polyester Bolster Luxury Pillows for Hotel - Set of 2 Pieces (10X25-inches, White)",MECNIOX,0,0,0,399,3.4,17,73,"Wednesday, February 16",0,17
80,B09C4YG8MG,Homerz Set of 2 Microfiber Snow White Cloud Pillow Filled with 3D conjugated Fiber (17 x 27 inch ),Homerz,1,0,0,848,3.7,106,35,"Thursday, February 17",1,106
81,B096RWZKMC,"SleepyCat Air Gel Memory Foam Pillow for Sleeping and Neck Support with Removable Zipper Cover (White, 28x18 inches) 2-Piece",SleepyCat,1,0,0,"3,891",4.1,"1,032",22,"Thursday, February 17",1,"1,032"
82,B08K94WBJG,"Urban Basics Microfiber Pillow, 16x24 Inch, White, Set of 6",Urban,1,0,0,"1,799",3.8,719,40,"Wednesday, February 16",1,719
83,B09CMVW897,"Homerz Nirvana Pillow Filled with 3D Conjugated Fiber, 17 x 27 inch Exact Size, Cotton Fabric, White -Set of 2",Homerz,1,0,0,749,3.9,113,53,"Thursday, February 17",1,113
84,B08S76VKSN,Momsyard Women's (Original) Full Body Pregnancy/Maternity Made of Velvet Pillow Cover - C Shaped - Gray/Silver,Momsyard,0,0,0,"1,299",4.0,"3,091",65,"Thursday, February 17",1,"3,091"
85,B00QLOMIO0,Kurlon pillow Kalpana Economy-White Colour,Kurlon,0,0,0,310,3.4,78,13,"Tuesday, February 15",0,78
86,B09JPDTMB7,"ADRIAN Cervical Contour Memory Foam Pillow,Orthopedic Pillow for Neck Pain,Orthopedic Contour Pillow Support for Back,Stomach,Side Sleepers,Anti-Snoring Neck Pillow (Multi)",ADRIAN,0,0,0,749,4.1,43,42,"Wednesday, February 16",1,43
87,B00IJRV2KI,"Recron Certified Bliss Fibre Pillow - 40 cm x 61 cm, White",Recron,0,0,0,445,4.0,259,5,"Sunday, February 20",0,259
88,B08BK1C4Q9,"Urban Basics Ultra Soft Microfibre Pillow, 17""x27"" Inch, White, Set of 4(PIL01_4), polyester",Urban,0,0,0,"1,399",4.1,"2,315",30,"Wednesday, February 16",1,"2,315"
89,B09Q1BNDLT,"Dormyo Memory Foam Contour Cervical Pillow for Sleeping, Relief from Neck Pain, Shoulder Pain, Back Pain (20x12x4 inches), 50-D Memory Foam Bed Pillow with 400 GSM Cover",Dormyo,0,0,0,699,5.0,3,65,"Wednesday, February 16",1,3
90,B01H089NHA,"Sleepwell Memory Foam Pillow, 24 x 16, Multicolour, 2 Pieces",Sleepwell,0,0,0,810,3.6,214,19,"Sunday, February 20",0,214
91,B098L591YB,Proliva Cervical Contour Soft Memory Foam Pillow for Sleeping (Butterfly Pillow),Proliva,0,0,0,899,3.7,9,55,"Wednesday, February 16",0,9
92,B098P97P3M,"ATOOTFUSION Microfiber Luxury Ultra Soft Full Body Breathable Long Bed Pillow Insert (Grey, 20""x54"")",ATOOTFUSION,0,0,0,595,3.8,51,70,"Wednesday, February 16",1,51
93,B09GYH2WTJ,"Sleepyhead Hollow Fibre Pillow (Slate Grey & Orange, 26x16 inches) -Set of 2",Sleepyhead,0,0,0,899,4.6,16,31,"Thursday, February 17",1,16
94,B09N9SPNPQ,"Fairy Down Hollow Fibre Pillow, Soft Pillow for Sleeping, Pillows Set 2 ( 40 X 60 cm)",Fairy,0,0,0,449,3.6,11,78,"Thursday, February 17",1,11
95,B09RH1QSF2,Memory Foam Cervical Contour Medical Pillow - DClub Orthopedic Pillows for Neck Back Pain Relief for Slipping. (1),Memory,0,0,0,589,3.7,3,83,"Wednesday, February 16",1,3
96,B08VDGWCRT,JY Premium Polyester Quilted Filled Reliance High Density Micro Fiber Super Soft Sleeping Pillows - 16x26 Inch - Set of 4 (White and Sky Blue),JY,0,0,0,599,3.8,391,40,,1,391
97,B07WC33VL3,"HSR Collection Chenille Luxury Bolster Cover, Bolster Pillow Cover Set of 2, Round Pillow Cover Set of 2 - 32 x 16 inches | Maroon",HSR,0,1,0,269,3.8,"4,594",46,"Wednesday, February 16",0,"4,594"
98,B07Q1BJ6Z4,"Tishnagi Designer Pregnant Women's Cotton Soft Stripes Body Pillow for Maternity Back Support Lumbar Pillow with Microfiber Filling (18 x 54 inch, Satin Stripe, White)",Tishnagi,0,0,0,699,4.6,382,59,"Wednesday, February 16",1,382
99,B01L94IXXG,"Amazon Brand - Solimo Ultra Soft Microfibre Bed Pillow Set (Standard, 43 x 69 cm, White) -2 Piece",Amazon,0,0,0,709,4.0,"3,408",29,"Sunday, February 13",1,"3,408"
100,B06X9W96FQ,"Portico New York Cotton White Single Sleep Z Pillow, Set of 1",Portico,0,0,0,549,4.0,61,0,"Wednesday, February 16",1,61
101,B09828Z3P9,Takiyawala Cotton Pillow with Fresh White cotton16 x 25 Inch Pack of 3,Takiyawala,0,0,1,639,4.0,66,64,"Wednesday, February 16",1,66
102,B09R9Z4Q3V,B C Comforts Stripes Reliance Microfiber Pillows Set of 2 Pic (16''X 26''),B,0,0,0,249,0,0,58,"Wednesday, February 16",0,"₹249
₹599 Save ₹350 (58%)"
103,B088NYHTY1,"ATOOTFUSION 100% Recyclable Dust free Black Hosiery Firm Medium Hard Cotton Pillow for real perfect neck support (16"" x 26"") Firm Medium Hard Pillow Checkered Multicolored Pack of 02",ATOOTFUSION,0,0,0,324,3.8,409,78,"Wednesday, February 16",0,409
104,B09QQTGQS4,"Homerz Premium Set of 2 Bolster Pillow, 15 x 30 Size, 3D conjugated Fiber Filled, Vacuum Pack",Homerz,0,0,0,899,0,0,10,"Thursday, February 17",1,"₹899
₹999 Save ₹100 (10%)"
105,B09MLZWDB5,"takiyawala Microfiber Quilted Pillow for Sleeping, 17x27 inch, White, Pack of 2",takiyawala,0,0,0,699,4.8,9,46,"Wednesday, February 16",1,9
106,B08S7KTTNN,Takiyawala Cotton Fabric with Grey Poly-Cotton Filling Medium Soft Sleeping Pillow for Bed 16 x 25 Inch Pack of 3,Takiyawala,0,0,0,599,4.1,906,40,"Wednesday, February 16",0,906
107,B089YTMMJP,"HOMY DECOR Bombay Dyeing 100% Cotton Cloth, Luxury Hotel Collections Soft Pillow, White, 17 X 27 Inch, Pack of 2",HOMY,0,0,0,799,4.0,397,60,"Sunday, February 20",1,397
108,B099KH3TKV,Haus Alchemy Luxury Premium Pillows Ultrasoft 100% Virgin Microfiber Filling with 100% Terry Cotton Pillow Cover King Size Hotel Pillows 1Pc (L-69cm x B-40cm)(L-27 x B-16 in) White,Haus,0,0,0,429,3.9,23,64,"Thursday, February 17",0,23
109,B07VBXF4GH,"PumPum Polyester Fiber Hill Hard Bed Bolster Pillows for Sleeping (White, 27 x 9 Inches , 5236)",PumPum,0,0,0,219,3.5,294,0,"Wednesday, February 16",0,294
110,B08PKBNT77,Prime Cart Orthopedic Memory Foam Pillow for Comfortable Sleep( White). (Pack of 1),Prime,0,0,0,599,3.3,46,73,"Wednesday, February 16",0,46
111,B098JSRZK8,Solid Polyester Fiber Pillow F3 Best for Heavenly Sleep White Pack of 3,Solid,0,0,0,0,3.4,7,0,,0,7
112,B09GMDNFYB,Zoliva Ergonomic Memory Foam Pillows for Neck Pain and Shoulder Pain Orthopedic Cervical (1),Zoliva,0,0,0,"1,099",5.0,5,45,"Wednesday, February 16",0,5
113,B08R7MX63N,"SleepyCat 2-Piece Microfiber Cloud Pillow with Adjustable Zipper (27x18 inches, White)",SleepyCat,0,0,0,"1,784",4.3,634,25,"Monday, February 14",1,634
114,B09J8ZW8ND,Donda Brother's Microfibre & Polyster Ultra Soft Blue Stripes Bed Pillow Sets ( 1 Piece ),Donda,0,0,0,199,0,0,33,"Wednesday, February 16",0,"₹199
₹299 Save ₹100 (33%)"
115,B09J1BTLWY,"Kanu Creation Cervical Contour Memory Foam Pillow,Orthopedic Pillow for Neck Pain,Orthopedic Contour Pillow Support for Back,Stomach,Side Sleepers,Anti-Snoring Neck Pillow (White) (1)",Kanu,0,0,0,549,3.7,9,45,"Wednesday, February 16",0,9
116,B09NDRCGJZ,Casa Haus YYY Collection - Soft Pillows Fillers/Inserts - White (17X27 inch)- Pack of 5,Casa,1,0,0,"1,199",4.9,18,40,"Friday, February 18",1,18
117,B09CMC8X96,"Homerz Aloe Vera Cloud Pillow Filled with 3D conjugated Microfiber, White, 17 x 27 inch Set of 2",Homerz,1,0,0,849,4.6,11,56,"Thursday, February 17",1,11
118,B08Q8DKCF6,"Morning Owl Natural Latex Rubber Medium Firm eco-INSTITUT Certified Pillow (60*40*12.5 cm), 2 Pillows, White",Morning,1,0,0,"3,495",4.0,36,47,"Tuesday, February 22",1,36
119,B09PJH12R8,"Homerz Body Pillow with Waterproof Pillow Protector Cover, 54 x 20 inch Size (Grey)",Homerz,1,0,0,999,0,0,50,"Thursday, February 17",1,"₹999
₹1,999 Save ₹1,000 (50%)"
120,B08CSLJMM4,"MY ARMOR Orthopedic Memory Foam Pillow for Comfortable Sleep (Thin Pillow) (24.5"" x 15.5"" x 3.5"")",MY,1,1,0,"1,250",4.1,"11,295",43,"Sunday, February 13",1,"11,295"
121,B09GS1WHDW,"Cloth Fusion Microfiber Bed Pillow Set of 2 Pieces (17x27 Inches, Maroon and Grey)",Cloth,1,0,0,629,4.0,11,37,"Tuesday, February 15",1,11
122,B096SZBLRM,"Homerz Microfiber Platinum Knitted King Size Pillow for Bed, Super Soft 250 GSM Knitted Fabric - 2 PC (Snow White, 17x27 Inch)",Homerz,1,0,0,849,3.9,68,53,"Thursday, February 17",1,68
123,B097DXNFF6,"MY ARMOR Micro Fibre Pillows , 26"" x 17"" , White and Grey , 2 Pieces",MY,1,0,0,990,4.3,289,34,"Friday, February 18",1,289
124,B09C1Z5HZB,"Zoliva Memory Foam Cervical Contour Pillow for Neck Pain and Spondylitis, Back Support, Side Sleepers (1)",Zoliva,0,0,0,899,3.9,120,55,"Wednesday, February 16",0,120
125,B08JVP6QCX,"Fun Homes Microfibre Pillow Filler (16x24 inch, White)",Fun,0,0,0,189,3.4,538,73,"Tuesday, February 15",0,538
126,B09NDSBTW5,Casa Haus YYY Collection- 5 Pack Pillows Fillers/Inserts (16 x 24 inches) - White,Casa,0,0,0,999,4.9,18,33,"Friday, February 18",1,18
127,B07QSR6B6Y,"Sleepwell Feather Pillow, 27 x 17, White, Set of 1",Sleepwell,0,0,0,597,3.9,29,12,"Thursday, February 17",1,29
128,B08B3ZS3WZ,"The White Willow Cervical Orthopedic Memory Foam Cooling Gel Regular Size Contour Neck Support Sleeping Bed Pillow with Removable Zip Cover (20"" L x 13"" W x 4"" H) - Multi",The,0,0,0,"1,099",4.0,"1,176",68,"Wednesday, February 16",1,"1,176"
129,B08TVMMMML,"ATOOTFUSION Microfiber Full Body Pillow Insert Without Cover,Large Body Pillow for Adults,Breathable Long Side Sleeper Pillow for Sleeping (21 x 58 Inch)-Black & White Check Big Soft Body Hug Pillow",ATOOTFUSION,0,0,0,476,3.5,87,76,"Wednesday, February 16",0,87
130,B0822SXQGH,"SleepyCat 1-Piece Air Gel Memory Foam Pillow for Sleeping & Neck Support with Removable Zipper Cover (25x16 inches, White)",SleepyCat,0,0,0,"1,691",4.1,"1,032",15,"Thursday, February 17",1,"1,032"
131,B0993CV5Z2,"D S Pillow Sleepping Microfiber Size 17x27 inch White Sleeping Pillows, , Set of 6",D,0,0,0,0,2.8,9,0,,0,9
132,B07WSPQ7CR,"Proliva Contour Memory Foam Pillow, Adjustable Pillow for Seelping, Ergonomic Cervical Pillows Neck Pain, Support Back, Anti-Allergy, Pain Relief, Bed with Cover (White)",Proliva,0,0,0,899,3.8,116,55,"Wednesday, February 16",0,116
133,B09878WDYH,"ATOOTFUSION Microfiber Ultra Soft Bed Pillows Set (White, 12X18 Inches) - Pack of 02",ATOOTFUSION,0,0,0,298,3.7,77,70,"Wednesday, February 16",0,77
134,B08RC467DY,"MY ARMOR Micro Fibre Pillows , 26"" x 17"" , White , 2 Pieces",MY,0,0,0,750,4.3,289,42,"Friday, February 18",1,289
135,B09RKH33Q5,"Sleepsia Supersoft Kids Pillows - 12"" X 18"" Breathable Bamboo Pillows for Sleeping - Ultra Supportive Microfiber Premium Fill Toddler Pillows, White",Sleepsia,0,0,0,499,5.0,2,75,"Wednesday, February 16",1,2
136,B09JP437KT,"KWT Plastic Cervical Contour Memory Foam Pillow Support for Neck Pain, Orthopedic, Back, Stomach, Side Sleepers, Anti-Snoring (White)",KWT,0,0,0,789,4.3,136,21,"Wednesday, February 16",1,136
137,B08YNMPF2M,"REGIUS Premium Hotel Quality Hollow Microfibre Pillow (16x26 Inches, White) -Set of 2",REGIUS,0,0,0,459,3.4,12,54,"Wednesday, February 16",1,12
138,B09FYHZT24,"Design World -Hollow Fibre Pillow for Sleeping Bed Set of 1, 18x27 inch, White",Design,0,0,0,295,3.1,5,70,"Friday, February 18",0,5
