,asin,title,brand,Sponsored,Best Seller,Amazon's Choice,Price,Rating,NoofRatings,Discount,Delivery,Prime Delivery,base
275,B096KSGYDZ,"Mashur Fab Cervical Contour Memory Foam Pillow for Sleeping,Orthopedic Pillow for Neck Pain, Support for Back,Stomach,Side Sleepers, with Breathable Zip Cover (19X12X4,Off White) (17 X 27 (2 Piece ))",Mashur,0,0,0,399,4.0,1,60,"Wednesday, February 16",0,1
276,B09RNBL27K,"Outlay Home Luxury chennile Bolster Cover||Round Pillow Cover Set of 2 || Masand Cover - 32*16 inches, Navy Blue",Outlay,0,0,0,225,0,0,55,"Wednesday, February 16",0,"₹225
₹499 Save ₹274 (55%)"
277,B09LNH64KT,Home Centre Travel Blue Printed Bean Fill Neck Pillow - 28x28cm,Home,0,0,0,399,0,0,0,"Wednesday, February 16",0,₹399
278,B09N1RLF42,takiyawala® Luxury Plush Microfiber Box Pillow 16X26X4 (Pack of 2),takiyawala®,0,0,0,698,4.8,5,53,"Wednesday, February 16",1,5
279,B00QLOMCYQ,"Kurl-On Microfiber Pillow, Single, White, 1 Piece",Kurl-On,0,0,0,575,4.0,83,65,"Tuesday, February 15",0,83
280,B09NVWT15T,Trova Fashion Store Cotton Filled with Microfibre & Polyster Ultra Soft Blue Star Printed Bed Pillow Sets ( Pack of 6 ),Trova,0,0,0,699,1.0,1,46,"Wednesday, February 16",1,1
281,B09C666VWH,Premium 5 Pack Pillows Fillers/Inserts (16 x 24 inches) - White Moon,Premium,0,0,0,549,4.0,6,8,"Wednesday, February 16",0,6
282,B09NM3312S,Krishna Sales & Marketing AGENCY's Microfibre & Polyster Ultra Soft Floral Printed Bed Pillow Sets ( Multi 5 PC. ),Krishna,0,0,0,558,0,0,60,"Wednesday, February 16",0,"₹558
₹1,399 Save ₹841 (60%)"
283,B095MMDW1V,"Milford Memory Foam Pillow Standard Size Neck & Back Support for Sleeping with Removable Zipper Cover Pillow,Cervical Pain,Orthopedic Contour Back,Stomach,Side Sleepers,Anti-Snoring Relief Pillow,Anti-Allergy,Pillow Pain",Milford,0,0,0,599,3.5,5,60,,0,5
284,B08621LH39,"Heart Home Pillow Filler, 16x24 inch, White, 1 Piece",Heart,0,0,0,209,3.4,38,16,"Sunday, February 13",0,38
285,B09QJSPDN8,"Shree GANPAT Enterprises Ultra Soft Pillow Sets for Bed (Black Microfibre , Set of 06,Size- 68 x 43Cm)",Shree,0,0,0,599,0,0,14,"Wednesday, February 16",0,"₹599
₹699 Save ₹100 (14%)"
286,B09H4BNYJF,"Cushows Memory Foam Classic Orthopedic Pillow for Sleeping for Back and Side Sleepers (14x24x4 inches, 1)",Cushows,0,0,0,"1,249",4.9,16,48,"Tuesday, February 15",1,16
287,B07XV7G2WQ,"Mom's Moon 2nd Generation Ultra Soft U Shaped Body Maternity Pillow with Cotton Zippered Cover (32 x 50 Inches, Dark Blue)",Mom's,0,0,0,"1,379",4.0,924,56,"Wednesday, February 16",1,924
288,B082Y9G683,Mom's Moon Premium Multipurpose Microfiber Pregnancy Pillow for Pregnant Women with 100% Cotton Zippered Cover Pack of 1 Dark Blue,Mom's,0,0,0,"1,499",3.8,522,63,"Wednesday, February 16",1,522
289,B09647D2RQ,"REMCART Microfiber Sleeping Pillow, 40 cm X 60 cm, White Pack of 1pc",REMCART,0,0,0,189,3.3,18,68,"Wednesday, February 16",0,18
290,B095ND7NR5,"Home Centre Symphony Cotton Solid Pillows (43 x 68 cm, White, Standard) - Set of 2",Home,0,0,0,699,3.5,5,0,"Wednesday, February 16",1,5
291,B09QL2LPDN,"S K S Enterprises Ultra Soft Microfibre Lining Bed Pillow (Black Cotton,Set of 1, Size- 40 x 60 cm )",S,0,0,0,199,0,0,88,"Wednesday, February 16",0,"₹199
₹1,599 Save ₹1,400 (88%)"
292,B07HB1RYKV,METRON Women's Medical Grade Medium Soft Pure Foam Handy Multi Purpose Pregnancy Pillow (Random Colors),METRON,0,0,0,995,4.0,149,50,"Tuesday, February 15",1,149
293,B08R93TWLQ,"Nivedha Mattress-Organic Silk Cotton/Kapok/Semal/Ilavam Panju Classic Pillow (27 X 17 Inches),White Striped Pillow.",Nivedha,0,0,0,800,3.9,36,47,"Wednesday, February 16",1,36
294,B08Y926C94,Sassoon Laika Memory Foam Pillow for Neck Pain and Shoulder Pain Relief (White),Sassoon,0,0,0,"1,199",4.4,34,43,"Wednesday, February 16",1,34
295,B088M7Q17V,"MUKESH HANDICRAFTS 100% Cotton & Soft Polyester Filler Large Size Body Pillow | Maternity Sleeper Pillows for Use During Pregnancy |Soft White Stripes Cover Shell | Pack of 1 - 20 x 54 Inch, White",MUKESH,0,0,0,599,3.7,9,63,"Wednesday, February 16",1,9
296,B0967ZPY3L,"Homerz Premium Set of 4 Fibre Pillows for Bed 16 x 24 inch Size, White Polyester Cotton Fabric (4)",Homerz,1,0,0,"1,199",4.3,6,14,"Thursday, February 17",1,6
297,B09PRJVVSZ,Youngsters Choice Presents Microfiber & Polyster Ultra Soft Pink Flower Pillow for Home (Set of 4),Youngsters,1,0,0,499,0,0,75,"Wednesday, February 16",1,"₹499
₹1,999 Save ₹1,500 (75%)"
298,B09RKH33Q5,"Sleepsia Supersoft Kids Pillows - 12"" X 18"" Breathable Bamboo Pillows for Sleeping - Ultra Supportive Microfiber Premium Fill Toddler Pillows, White",Sleepsia,1,0,0,499,5.0,2,75,"Wednesday, February 16",1,2
299,B08CCV3JSF,"HOMY DECOR 400 GSM Melange Double Jacquard Knitted Breathable Fabric Luxury Hotel Collections Super Soft and Fluffy Pillow for Sleeping Oeko-TEX® Certified (Grey and White, 17""X 27"" inch) - Pack of 3",HOMY,1,0,0,"1,494",4.1,412,50,"Sunday, February 20",1,412
300,B09PMMY3S1,Cloth Fusion Microfiber Bed Pillow Set of 2 Pieces (17x27 Inches) (Magenta & Grey),Cloth,1,0,0,629,4.0,11,37,"Wednesday, February 16",1,11
301,B08R93TWLQ,"Nivedha Mattress-Organic Silk Cotton/Kapok/Semal/Ilavam Panju Classic Pillow (27 X 17 Inches),White Striped Pillow.",Nivedha,1,0,0,800,3.9,36,47,"Wednesday, February 16",1,36
302,B093CC7K8N,"Chahit 2 Piece Ultra Soft Bed Pillow (20 X 36, White)",Chahit,1,0,0,"1,249",4.0,8,48,"Wednesday, February 16",1,8
303,B096YD5XZR,"Homerz Premium Hotel Quality Super King Size Pillow, 20 x 30 Inch Exact Size, Superior White Cotton Polyester Fabric (4)",Homerz,1,0,0,"1,499",3.8,139,17,"Thursday, February 17",1,139
304,B07VYT9B33,"Sleepwell Memory Foam Pillow, 27 x 17, White, Pack Of 1",Sleepwell,0,0,0,357,3.8,42,35,"Sunday, February 20",0,42
305,B09QJT1SSZ,"Shree GANPAT Enterprises Ultra Soft Pillow Sets for Bed (Black Microfibre , Set of 04,Size- 68x 43Cm)",Shree,0,0,0,479,0,0,4,"Wednesday, February 16",0,"₹479
₹499 Save ₹20 (4%)"
306,B09NLZWB9Z,Krishna Sales & Marketing AGENCY's Microfibre & Polyster Ultra Soft Rose Printed Bed Pillow Sets ( 4 Piece ),Krishna,0,0,0,469,0,0,57,"Wednesday, February 16",0,"₹469
₹1,099 Save ₹630 (57%)"
307,B09LYMZB76,BAJAJ TEXTILE Air Pillow Camping Air Pillow Ultralight Portable Ergonomic Pillow Air Cushion Sleeping Bag Backpacking Pillow Soft Comfortable Air Inflatable Travel Pillow Blue(Pack of 1),BAJAJ,0,0,0,220,4.5,2,12,"Wednesday, February 16",1,2
308,B09QKR2TSV,"Shree GANPAT Enterprises Ultra Soft White Fibre Pillow Sets for Bed (White , Set of - 02,Size- 43 x 69 cm)",Shree,0,0,0,0,1.0,1,0,,0,1
309,B09QL2JFCD,"S K S Enterprises Ultra Soft Microfibre Floral Printed Bed Pillow Sets (Black Cotton,Pack of 1, Size- 40 x 60 cm )",S,0,0,0,199,0,0,88,"Wednesday, February 16",0,"₹199
₹1,599 Save ₹1,400 (88%)"
310,B09JKFPX1S,"Lefre Best Sleep Microfiber Cotton 5 Star Hotel Black Star Pillow Extra Large King Size 16""*24 (40cm*60cm), White , Set of 4.",Lefre,0,0,0,0,3.0,2,0,,0,2
311,B09PRNK2JL,"vaio creation Memory Foam Cervical Pillow for Neck Pain and Spondylitis Contour Pillow Support for Back, Side Sleepers",vaio,0,0,0,669,0,0,52,"Wednesday, February 16",1,"₹669
₹1,399 Save ₹730 (52%)"
312,B07CRMSZZ6,"Sleepwell Polyester Fibre Pillow, King, White, Set of 1",Sleepwell,0,0,0,376,3.7,98,42,"Thursday, February 17",0,98
313,B00QLOM68I,"Kurl-On Polyurethane Foam Pillow Chimera, Single, White, 1 Piece, Cotton",Kurl-On,0,0,0,"1,089",4.0,62,19,"Friday, February 18",0,62
314,B0894JG1CT,"duroflex Fibre Pillows ( 69 X 43 cm, White )- Set of 2",duroflex,0,0,0,"1,386",4.2,28,4,"Thursday, February 17",0,28
315,B07BGBYL38,"Sleepyhead Microfiber Pillow, King, White, Set of 1",Sleepyhead,0,0,0,999,4.2,"1,588",17,"Thursday, February 17",1,"1,588"
316,B094DGJ8P1,"DECOR Polycotton Comfort Foam Pillow, White, Standard - Pack of 2",DECOR,0,0,0,999,3.6,101,50,"Wednesday, February 16",0,101
317,B07TP8FM5P,"Apurva interiors SLEEPWELL Norma Cotton Flexi Puff Foam Pillow (White, XL)",Apurva,0,0,0,715,3.2,18,11,"Sunday, February 20",0,18
318,B09MFJ94D4,Narayan™ Cotton Pillow for Home Pillow for Home Decor Pillow for Hotel Pillow for Bedroom Quality Fibre Pillow | Best Collections of Pillows Sleeping Pillows for Bedrooms White16x24 Inch Pack of 5,,0,0,0,0,0,0,0,,0,
319,B09RK7HHD5,"Karan Enterprises Ultra Soft Microfibre Blue Star Bed Pillow Sets (Size-16 x 24 inch, Pack of 2)",Karan,0,0,0,219,0,0,83,"Wednesday, February 16",0,"₹219
₹1,299 Save ₹1,080 (83%)"
320,B09PRJTHX4,Youngsters Choice Presents Microfiber & Polyster Ultra Soft Pink Flower Pillow for Home (Set of 2),Youngsters,1,0,0,299,0,0,70,"Wednesday, February 16",1,"₹299
₹999 Save ₹700 (70%)"
321,B09NNLRP2S,"Kurl-On Knitted Fabric Premium Compressed Bamboo Pillow ,68 x 43 x 5 cm, Cream Color,1 Pieces",Kurl-On,1,0,0,699,0,0,0,"Wednesday, February 16",1,₹699
322,B08WJGKNH1,"GPGP Pure Semal Cotton Pillows - Sleeping Pillows (Filled with Silk Cotton), White - Set of 2",GPGP,1,0,0,"1,999",3.8,7,0,"Thursday, February 17",0,7
323,B08DP297RY,"MM FOAM Snuggle Pillow - 100% Natural Latex, High Bounceback, Hypoallergenic Thick Pillow -6"" (25.5 x 16.75 x 6 inches)",MM,1,0,0,"2,500",4.4,98,0,"Tuesday, February 15",1,98
324,B095PNRCPT,HETARTH ENTERPRISE Soft Memory Foam Pillow (White),HETARTH,0,0,0,628,4.0,59,37,"Thursday, February 17",0,59
325,B08CL1F688,"ATOOTFUSION 100% Recyclable Black Hosiery Cotton Firm Medium Hard Cotton Bed Pillow for Real Perfect Neck Support (16"" x 26"") Bombay Dying Satin Striped White Pack of 01",ATOOTFUSION,0,0,0,199,3.5,148,80,"Wednesday, February 16",0,148
326,B08P7MQRSJ,"DOCTOR REST Hollow Microfibre Soft Fiber Bed Pillow Set of 4, 16inchx24Inch, White",DOCTOR,0,0,0,799,3.9,40,20,"Wednesday, February 16",0,40
327,B01MSWY3B4,"Sleepwell Cotton Pillow, Multicolour, 4 Pieces",Sleepwell,0,0,0,"1,464",3.8,96,21,"Friday, February 18",0,96
328,B0851LZGJK,"flo Extra Support Adjustable Polyester Aloe Vera Gel Pillow with Washable Cover (White, 17"" x 27""), Set of 1",flo,0,0,0,890,4.0,109,10,"Thursday, February 17",1,109
329,B09RK8LRR3,"Karan Enterprises Ultra Soft Microfibre Printed Pillow Sets (Size-16 x 24 inch,Pack of 2)",Karan,0,0,0,299,0,0,77,"Wednesday, February 16",0,"₹299
99
₹1,299 Save ₹999.01 (77%)"
330,B09B2C5Z5J,"FEXNIO Bed Pillow l Washable Pillow for Bed l Pillows l Two Piece Pillow ( 40x60 cm, White )",FEXNIO,0,0,0,499,0,0,55,"Wednesday, February 16",0,"₹499
₹1,099 Save ₹600 (55%)"
331,B09GYQW917,"JY Premium Quilted Satin Pillows Filled with Reliance High Density Micro Fiber Super Soft Sleeping Pillows (White, 16"" X 26"") - Set of 2",JY,0,0,0,299,3.2,19,50,,0,19
332,B08Y7VWN69,"Aarvi fab Memory Foam Cervical Contour Medical Pillow for Sleeping Orthopedic Pillows for Neck Back Pain, Pillow for Sleeping, Pillow for Neck Pain",Aarvi,0,0,0,629,3.9,21,45,"Thursday, February 17",0,21
333,B09RPL67KW,"RYLAN Cervical Contour Memory Foam Pillow,Orthopedic Pillow for Neck Pain,Orthopedic Contour Pillow Support for Back,Stomach,Side Sleepers,Anti-Snoring Neck Pillow (Pillow)",RYLAN,0,0,0,949,5.0,2,21,"Wednesday, February 16",1,2
334,B0972RXQG9,"Sleeprest Ultra Soft Luxury Quilted Pillow Sleeping Pillow for Home Bed Fiber Filled - Organic Cotton Fabric with Premium Microfiber Filling - 17x27 Inches, White",Sleeprest,0,0,0,599,3.7,8,63,"Wednesday, February 16",1,8
335,B09MRMJSTY,"HAPPY TREDS Memory Foam Pillow,Cervical Pillow for Neck Pain,Orthopedic Contour Pillow Support for Back,Stomach,Side Sleepers,Anti-Snoring Relief Neck Pillow,Anti-Allergy,Pillow for Pain Relief",HAPPY,0,0,0,499,0,0,62,"Monday, February 21",0,"₹499
₹1,299 Save ₹800 (62%)"
336,B09RFKK6JN,"SIAN FABRICS Hollow Fiber Pillow, Soft Pillow for Sleeping, Pillows Set 2 ( 40 X 60 cm)",SIAN,0,0,0,449,0,0,78,"Thursday, February 17",0,"₹449
₹1,999 Save ₹1,550 (78%)"
337,B08VRPLT71,Samrat Reliance Microfiber Satin Striped Bolster Filler Set of 2 - White (Size 23 X 9 Inches),Samrat,0,0,0,490,3.9,52,62,"Wednesday, February 16",1,52
338,B09G6RW7Q7,"WROXTY Foam Neck Roll and Cervical Bolster Round Pillow with Removable Washable Soft Cover for Spine and Neck, Back, Lumbar, Leg, Vertebra, Shoulder Relaxer, Pain Relief & Support (18.5"" X 6.5"")",WROXTY,0,0,0,649,3.3,3,39,"Wednesday, February 16",1,3
339,B09RG2X689,Little Peach Microfiber C Shape Ultra-Soft Pregnancy Pillow (Charcoal Grey),Little,0,0,0,"1,999",0,0,20,"Wednesday, February 16",1,"₹1,999
₹2,499 Save ₹500 (20%)"
340,B09GXCGF1H,"SOWKOS Luxury Hotel Quality Soft Bed Pillow, Microfiber Pillow, 16 inch X 24 inch ( White, Pack of 5 )",SOWKOS,0,0,0,620,0,0,69,"Wednesday, February 16",0,"₹620
₹1,999 Save ₹1,379 (69%)"
341,B09JC1TZ5H,"Coif Cervical Pillow for Neck Pain Stretcher, Orthopedic Contour Support, Side Sleepers, Back, Stomach, Shoulder Relaxer, Pain Relief & Spine Alignment, Alleviates Spondylitis Pillow (Universal Size)",Coif,0,0,0,649,4.3,8,39,"Wednesday, February 16",1,8
342,B07WHWWT1Z,"SWEETSAGA Durable Super Soft Power Sleeping Bed Home Pillow, Unique White 16X24 Inch 2 Set Pillows, 2022 Offer, Microfibre",SWEETSAGA,0,0,0,329,3.8,39,78,"Thursday, February 17",1,39
343,B07JMQ9CNJ,"Gowri Tex Microfiber Soft Big Size Pillow (Printed Green, 17.5 x 27.5-inch)",Gowri,0,0,0,499,4.3,67,75,"Saturday, February 19",1,67
344,B097S7PDFX,SOLARA Shredded Memory Foam Pillow,SOLARA,0,0,0,999,3.9,201,38,"Thursday, February 17",0,201
345,B01N2RRPC2,"Sleepwell Polyester Fibre Pillow, King, White, 2 Pieces",Sleepwell,0,0,0,0,3.8,398,0,,0,398
346,B08ZCJ44RF,"Pickfashion Microfiber Bed Pillow Bolster Pillows, 10 x 25 inch, White Bolster, Set of 2",Pickfashion,0,0,0,489,4.3,3,59,"Wednesday, February 16",0,3
347,B097YGV4G7,JY Microfiber Satin Stripe Fabric Bed Pillow for Sleeping 16''x 24'' White Set of 2,JY,0,0,0,379,4.0,67,62,,0,67
348,B07N4BPFKK,"Sleepwell Ploy Fibre Senses Pillow (White, 68 X 43 X 10 Cm)",Sleepwell,0,0,0,899,3.9,137,10,"Thursday, February 17",1,137
349,B09824TQKY,"ROYALREOX Reliance Microfiber, Machine Washable Pillow for Sleeping (16 x 24 White Fibre) (4)",ROYALREOX,0,0,0,549,0,0,63,"Wednesday, February 16",0,"₹549
₹1,499 Save ₹950 (63%)"
350,B079VTR75Z,"The White Willow Orthopedic Memory Foam Ultra Slim Bed Pillow for Sleeping (24 ""L x 14"" W x 1.5"") Off White",The,0,0,0,"1,449",4.2,258,50,"Sunday, February 13",1,258
351,B01MZ5TZIS,"Sleepwell Microfiber Pillow (White, L) - Pack of 2",Sleepwell,0,0,0,860,3.6,30,14,"Sunday, February 20",0,30
352,B07M8R836B,Metron Donut Ring Pillow for Piles Haemorrhoid Coccyx Sciatic Nerve Pregnancy Tailbone Fistula Prostate Back Pain Relief Post Surgery Relief Chair & Car Seat Firm Comfort Cushion | Pack of 1 Pc,Metron,0,0,0,"1,189",4.0,515,60,"Tuesday, February 15",1,515
353,B08R5Y3FLZ,Sulana Foam Ultrasoft Pillow - Set of 1,Sulana,0,0,0,149,0,0,85,"Thursday, February 17",0,"₹149
₹999 Save ₹850 (85%)"
354,B08JYMX1W7,"MEXFY U Shaped Orthopedic Pressure Free Pillow - Cervical Pillow for Neck Pain - Head Improve Sleep Protect Arms, Anti-Hand Numb Pillow - Neck Massage Pillow (Multi Color)",MEXFY,0,0,0,599,5.0,1,40,"Wednesday, February 16",1,1
355,B09GMBHYPV,"Microfiber Pillow, takiya Set of 2 Chacked Sage Pillow | Takiya | Bed Pillow for Sleeping & Neck Pain Relief for Back Sleeper, Side Sleeper & Stomach Sleeper for Living Room - 16 x 24 Inch Size Pillow",Microfiber,0,0,0,599,4.2,40,14,"Tuesday, February 15",1,40
356,B0822SXQGH,"SleepyCat 1-Piece Air Gel Memory Foam Pillow for Sleeping & Neck Support with Removable Zipper Cover (25x16 inches, White)",SleepyCat,1,0,0,"1,691",4.1,"1,032",15,"Thursday, February 17",1,"1,032"
357,B09QD1KTXF,"Sleepsia Microfiber Bed Pillow for Sleeping - Down Alternative Ultrasoft Cotton Washable Pillow with Satin Gusset- Queen (Green, Pack of 1)",Sleepsia,1,0,0,"1,299",4.5,64,78,"Wednesday, February 16",1,64
358,B09PRH9NQW,Youngsters Choice Presents Microfiber & Polyster Ultra Soft Blue Line Pillow for Home (Set of 4),Youngsters,1,0,0,499,0,0,75,"Wednesday, February 16",1,"₹499
₹1,999 Save ₹1,500 (75%)"
359,B09PRGK2CV,Youngsters Choice Presents Microfiber & Polyster Ultra Soft Blue Star Pillow for Home (Set of 4),Youngsters,1,0,0,499,0,0,75,"Wednesday, February 16",1,"₹499
₹1,999 Save ₹1,500 (75%)"
360,B091J1YZVZ,Quilt Comfort Microfiber U Shape Ultra-Soft Pregnancy Pillow (Misty Grey),Quilt,1,0,0,"2,548",3.9,12,36,"Wednesday, February 16",1,12
361,B073726R5M,AmazonBasics Polyester Ultra Soft Down Alternative Bed Pillows Large 2 Pack- 20X26 inches (50.8 cmX66.04 cm),AmazonBasics,1,0,0,"1,345",4.0,"5,601",50,,1,"5,601"
362,B09PJFW9YQ,"Homerz Body Pillow with Waterproof Pillow Protector Cover, 54 x 20 inch Size (White)",Homerz,1,0,0,999,0,0,50,"Thursday, February 17",1,"₹999
₹1,999 Save ₹1,000 (50%)"
363,B093CBZHZZ,"Chahit 2 Piece Ultra Soft Bed Pillow (17 X 27, Brown)",Chahit,1,0,0,799,4.0,8,47,"Wednesday, February 16",1,8
364,B01H39N7L4,"Kurl-On Polyurethane Foam Pillow, 23"" X 14"" X 4"", White, Pack of 1",Kurl-On,0,0,0,"1,114",3.8,55,55,"Tuesday, February 15",0,55
365,B08CYB6DSP,"A Decor Embroidered Cotton Bolster Round Pillow Covers 1 Pair or 2 Pieces, Size: 75x38x2 (cm), Weight: 300 GMS (Brown)",A,0,0,0,279,3.5,32,33,"Wednesday, February 16",1,32
366,B07JX8RW88,"Gowri Tex Microfiber Soft Pillow 17.5 x 27.5 inch, Multicolour, Set of 2 and Door Mat, Pack of 2",Gowri,0,0,0,499,4.1,29,75,"Saturday, February 19",0,29
367,B0837VT7FX,"The Cushion Company Soft Microfibre Pillows for Sleeping (White, 16 x 24 Inch) - Pack of 2",The,0,0,0,549,4.0,85,31,"Wednesday, February 16",1,85
368,B09JWX4638,ELSTERFIT CONTOURED CERVICAL PILLOW NECK SUPPORT (grey),ELSTERFIT,0,0,0,309,4.0,2,76,"Wednesday, February 16",0,2
369,B09Q62MGKC,"Kamal Enterprises Furniture Microfibre & Polyester 2-Piece Bed Pillow Set - 40 x 60 cm, White (1)",Kamal,0,0,0,199,1.0,1,75,"Wednesday, February 16",1,1
370,B089ZHBPLX,"GS Furnishing Kid's Soft Velvet Fabric Cushion Cum Book with English and Hindi Alphabets, Numbers, Animals Names and Pictures & Colors (Red; White, 13 x 20 inch)",GS,0,0,0,214,3.6,49,61,"Thursday, February 17",1,49
371,B08WJDZ84G,"Heart Home Comfort Polyester Microfiber Filled Pillow for Bed Room F_26_HEARTH016838, 16x24 Inches (Maroon)",Heart,0,0,0,199,4.0,13,20,"Tuesday, February 15",0,13
372,B09MZCXZ77,"FEXNIO Soft Organic Cotton Memory Foam Sleeping Pillow - Pack of 2 (M, 16x24 inches), White",FEXNIO,0,0,0,499,0,0,62,"Wednesday, February 16",0,"₹499
₹1,299 Save ₹800 (62%)"
373,B07FYG9FNB,"AmazonBasics Feather Pillows , Queen, 2 Pieces",AmazonBasics,0,0,0,"1,749",4.2,372,50,"Sunday, February 13",1,372
374,B092DNJ1PQ,"Kuber Industries Set of 4 Flower Design Soft & Smooth Cotton Bolster Cover 16 x 30 inch (Blue), Standard (HS_37_KUBMART020003)",Kuber,0,0,0,545,4.2,52,9,"Sunday, February 13",1,52
375,B09RPX2W2X,Atootfusion Natural Orthopedic Pillow Luxurious Quality Pillow Filler with Fibre Microfiber Pillow 16X25 Inch Count 02 Checkered Pillow (Black and White Check) (Reliance Microfiber Soft Plush Pillow),Atootfusion,0,0,0,349,0,0,83,"Wednesday, February 16",0,"₹349
₹1,998 Save ₹1,649 (83%)"
376,B08HRQSHLC,"Wake Up Comfy Buddy Fiber Sleeping Pillow- White, 68.58 cm x 43.18 cm",Wake,0,0,0,265,4.0,409,50,"Thursday, February 17",0,409
377,B085L61LL6,"ROYAL TREND Velvet Fiber Bolster (12 x 30 inch, White) -Set of 2",ROYAL,0,0,0,498,4.0,191,67,"Wednesday, February 16",1,191
378,B08D6PNDZH,"Sleepsia Cervical Contour Memory Foam Pillow, Gel Pillow with Washable Cover (Regular, Pack of 1)",Sleepsia,0,0,0,"1,350",4.2,297,66,"Wednesday, February 16",1,297
379,B09P79W6QL,"HSR Collection Luxury chennile Attractive Design Pattern Bolster Cover,2 Pieces - 32*16 inches, Maroon",HSR,0,0,0,225,5.0,1,77,"Wednesday, February 16",0,1
380,B08NVFRXBM,"Nivedha Mattress Organic Silk Cotton/Kapok/Ilavam Panju/Semal Soft Sleeping Pillow (Green, 24 x 14 inches)",Nivedha,1,0,0,650,3.3,7,64,"Wednesday, February 16",1,7
381,B07F76KMS9,"Hush Standard Pillow | Softex Fiber Filling | Medium Soft Feel The Zero Headache Polyester Bed Pillow, (Beige, 16 x 24 x 7.25 Inch)",Hush,1,0,0,550,3.9,185,21,"Thursday, February 17",1,185
382,B09PZ3TL1X,Amazon NEXTGO Pillows Standard Pillow Soft Down - 2 - Pack (Standard 18 inches by 28 inches 46 cm by 71 cm),Amazon,1,0,0,"1,499",0,0,29,"Thursday, February 17",0,"₹1,499
₹2,100 Save ₹601 (29%)"
383,B09CMSSYKV,"Homerz Paradise Floral Pillow Filled with 3D Conjugated Fiber, 17 x 27 inches Exact Size, White -Set of 2",Homerz,1,0,0,749,3.9,12,56,"Thursday, February 17",1,12
384,B08LBK72Y5,Amazon Brand - Umi Microfiber Pillow Insert/Filler 17 Inches by 27 Inches - White (Pack of 2),Amazon,0,0,0,699,4.0,226,65,"Thursday, February 17",1,226
385,B07W75LMQX,"duroflex Polyester Pillow, 27 x 17 inch, White, Off-white, 1 piece",duroflex,0,0,0,0,4.1,115,0,,0,115
386,B09PRF4FHX,Youngsters Choice Presents Microfiber & Polyster Ultra Soft Blue Line Pillow for Home (Set of 2),Youngsters,1,0,0,299,0,0,70,"Wednesday, February 16",1,"₹299
₹999 Save ₹700 (70%)"
387,B07P33JB3W,"Hush Fiber Pillow, 20 x 32 x 6 inch, White.",Hush,1,0,0,"2,400",4.1,43,20,"Thursday, February 17",1,43
388,B09PRHDRTT,Youngsters Choice Presents Microfiber & Polyster Ultra Soft Blue Star Pillow for Home (Set of 2),Youngsters,1,0,0,299,0,0,70,"Wednesday, February 16",1,"₹299
₹999 Save ₹700 (70%)"
389,B093C8MW2P,"Chahit Microfiber Pillow Insert/Filler Pack of 1 (17 X 27, Light Grey)",Chahit,1,0,0,449,5.0,1,65,"Wednesday, February 16",1,1
