,asin,title,brand,Sponsored,Best Seller,Amazon's Choice,Price,Rating,NoofRatings,Discount,Delivery,Prime Delivery,base
0,B07H5NZ5DY,Men's Auto Lock Leather Belt,Labnoft,1,0,0,629,4.3,"1,316",37,,1,"1,316"
1,B07MZ3B4SS,Men's Reversible PU Leather Belt,Labnoft,1,0,0,584,4.0,"2,272",42,,1,"2,272"
2,B079P79PXC,Men's Leather Belt,KAEZRI,1,0,0,499,4.0,"2,063",75,,1,"2,063"
3,B0814Z28G3,Men's Leather Auto Lock Belt,Labnoft,1,0,0,629,4.2,788,37,,1,788
4,B0824PLNV5,Leather Belt for Men,URBAN FOREST,0,0,0,455,4.0,"3,536",77,,0,"3,536"
5,B06XHGX8KZ,Reversible Pu-Leather Formal Belt For Men(Color-Black/Brown||BL-01|| 46 inches lenght|| Waist upto -40 inches),CREATURE,0,1,0,372,3.9,"8,545",75,,1,"8,545"
6,B0854J6N67,Men's PU Leather Black Autolock Grip Belt,ZORO,0,0,0,268,3.7,"1,808",82,,0,"1,808"
7,B088TFL5W4,Men's Leather Belt,URBAN FOREST,0,0,0,455,3.9,"3,065",77,,0,"3,065"
8,B083XSX3HK,Unisex Nylon & Canvas Waist Belt (Pack of 2),ZORO,0,0,0,292,4.2,549,90,,0,549
9,B07ZX36FHN,Men's Leather Belt (Pack of 3),SORSHORE,0,0,0,140,3.0,"1,634",86,,0,"1,634"
10,B07TRD4DYD,"Reversible PU Leather Belt, Turn to switch color, Black and Brown (RSTX-04T)",ZORO,0,0,0,254,3.6,"1,550",83,,0,"1,550"
11,B0854P4TH9,"Stretchable Braided Woven Fabric Belt for Men and Women, Fits on upto 40 inch waist size",ZORO,0,0,0,230,4.2,915,77,,0,915
12,B0747WD32Q,"Reversible PU-Leather Formal Black/Brown Belt For Men (Color-Black/Brown) belt for men, formal belt, gift for gents, Gents belt, mens belt.",CLUB SPUNKY,0,0,0,298,3.7,"2,036",83,,1,"2,036"
13,B07NRY1VZ2,"Men's Nylon woven fabric Belt, Hole free plastic flap buckle",ZORO,0,0,0,230,4.1,"3,802",85,,0,"3,802"
14,B07LD783TM,"Men's Artificial PU Leather Casual and Formal Reversible Belt (Black/Brown , Size 28-44 )",Axe Style,0,0,0,289,3.8,"2,348",81,,1,"2,348"
15,B07MZ3B4SS,Men's Reversible PU Leather Belt,Labnoft,0,0,0,584,4.0,"2,272",42,,1,"2,272"
16,B07SJ7PLRC,Men's Leather Belt,Bacca Bucci,0,0,0,799,4.0,"1,009",60,,1,"1,009"
17,B06XJD52FZ,Formal/Casual Brown Genuine Leather Belts For Men (BL-03),CREATURE,0,0,0,331,3.9,"4,010",78,,0,"4,010"
18,B083JCLDZH,1 Pcs Women's Metal Wide Plate Adjustable Ladies kanduro-Belt Valentines Day Gifts (2 cm Wide) (Golden),SATYAM KRAFT,0,0,0,349,4.3,"2,744",71,,0,"2,744"
19,B07ZH15G21,"Men's Genuine Leather Auto Lock Buckle Belt (Free Size, Black)",CONTACTS,0,0,0,749,4.2,"1,804",58,,1,"1,804"
20,B09LD17LMR,Genuine Leather Men’s Formal/Casual Tan Belt | BL8001,HAMMONDS FLYCATCHER,1,0,0,454,3.8,18,77,,0,18
21,B09B3DYMKG,Reversible Formal Leather Belt for Men I Durable Buckle I Heavy Duty,WildHorn,1,0,0,480,4.4,5,70,,0,5
22,B08NXYRVKG,Belts for Men with Designer Automatic Buckle Belts For Women Belt for Mens Formal/Casual Men's Vegan(PU) Artificial Leather,Farrago,1,0,0,398,3.1,12,80,,0,12
23,B09CG4BN1J,"Men's Genuine Leather Auto Lock Buckle Belt (Free Size, Black Brown/Tan)",GAINX,1,0,0,699,4.0,56,78,,1,56
24,B07SJGR95G,Men's Artificial Leather Belt,VOGARD,0,0,0,498,3.9,"2,583",59,,0,"2,583"
25,B082ZJPCC6,Men's Leather Belt,HIDE & SKIN,0,0,0,496,4.0,496,75,,0,496
26,B07NBDHYNP,Women's Leather Belt,Electomania,0,0,0,399,4.3,"2,807",33,,0,"2,807"
27,B07YNQYYV5,"PU leather (Pack of 2) Buckle Belts Fashion Waist Strap BELTS For Casual and Formal - Belt For Men and Boys, color Design For Daily Use",EDIFIER,0,0,0,299,3.3,60,75,,0,60
28,B07ZGXRGFG,Men's Genuine Leather Auto lock Buckle Belt | Lealther Belt for Men,Contacts,0,0,0,749,4.2,"3,604",58,,1,"3,604"
29,B07Y8B19ZG,"Women's Faux Leather Belt ( Black , Free Size )",Zacharias,0,0,0,248,4.2,265,59,,0,265
30,B078BGC1X1,Women's Metal kanduro Skinny Stretch Leaf Belt for valentine gift Pack of 1 (Leaf Belt_Golden),SATYAM KRAFT,0,0,0,249,4.2,"3,045",79,,0,"3,045"
31,B07Y88YW16,G3E Women's Faux Leather Belt,Zacharias,0,0,0,249,4.1,"2,114",58,,0,"2,114"
32,B0811JVLCK,Men's Nylon Belt,ZORO,0,0,0,379,4.0,528,75,,0,528
33,B09JM8ZJ89,Petersen Mens Leather Belt | Leather Belt For Men | Casual Mens Leather Belt,HORNBULL,0,0,0,499,4.3,36,80,,1,36
34,B09NGNJRYF,Green Apple Inc Stretchable Party Occasional Adjustable Premium Black Women Belt (Pack of 1),Generic,0,0,0,139,0,0,86,,0,"₹139
₹999 Save ₹860 (86%)"
35,B088T32W9M,Men's Leather Belt,URBAN FOREST,0,0,0,455,3.9,643,77,,0,643
36,B08QYLJY8Z,Women's Elastic & PU leather Belt,Electomania,0,0,0,398,4.3,314,60,,0,314
37,B07ZHD6131,Men's Genuine Leather Pin Buckle Belt | Leather Belt for Men,CONTACTS,0,0,0,699,4.3,196,61,,1,196
38,B07WV994J2,Men's Genuine Braided Leather Belt (Free Size),VOGARD,0,0,0,749,4.2,"1,819",69,,1,"1,819"
39,B07VY4MFS4,Men's Leather Belt,HIDE & SKIN,0,0,0,557,4.0,"2,594",72,,1,"2,594"
40,B07D8TRVXP,"Men's Dhoti Belt (White, Large)",Ramraj,0,0,0,189,4.3,24,31,,1,24
41,B06XJP8QCV,Reversible Pu-Leather Formal Belt For Men(Color-Black/Brown||Length-46 inches upto waist 40 inches||BL-06),CREATURE,0,0,0,298,3.8,"2,020",80,,1,"2,020"
42,B07DJKSR76,Men's Belt,Tommy Hilfiger,0,0,0,"1,530",4.1,31,33,,1,31
43,B07D8W16CY,"Men's Dhoti Belt (White, Medium)",Ramraj,0,0,0,249,4.2,34,24,,1,34
44,B095YXPMF6,Lugo Duo 30Mm Satin (Reversible) Black Color Leather Belt For Men,Cross,0,0,0,815,4.0,23,49,,1,23
45,B08YK7QM4H,Black sequin embellished tasseled saree Waist Belt and Kamarbandh for Women and Girls,Duchess,0,0,0,499,3.9,53,75,,0,53
46,B083JD4RRY,1 Pcs Women's Metal Wide Plate Adjustable Ladies kanduro-Belt for Valentine Gift (3.5 cm Wide) (Golden),SATYAM KRAFT,0,0,0,399,4.1,"1,615",67,,0,"1,615"
47,B07H5NZ5DY,Men's Auto Lock Leather Belt,Labnoft,0,0,0,629,4.3,"1,316",37,,1,"1,316"
48,B07KMXK47B,Unisex Synthetic Belt,CONTACTS,0,0,0,498,3.9,"1,529",72,,0,"1,529"
49,B08Y6TSG3R,Women's Retro Elastic Stretchy Metal Buckle Skinny Waist Belt for Valentine gift1 inch Wide,SATYAM KRAFT,0,0,0,259,4.3,909,78,,0,909
50,B086XTQGCZ,Men's Belt (AN FB 01 BK 38_Black_Large),Alpha Nemesis,0,0,0,154,3.7,23,78,,0,23
51,B07H6L4B4D,Formal/Casual Black Color Genuine Leather Belts For Men (Length- 46 inches||35MM||BL-037),CREATURE,0,0,0,388,3.9,559,81,,0,559
52,B07YNS2CPC,Women's Vegan Leather Belt (Pack of 2),SIDEWOK,0,1,0,295,3.8,"1,423",70,,0,"1,423"
53,B083JDJLW2,1 Pcs Women's Metal 3.5 cm Wide Hollow Design Plate Adjustable Ladies kanduro Belt for Valentine Gift (Golden),SATYAM KRAFT,0,0,0,399,4.2,"2,165",67,,0,"2,165"
54,B09QPVCFR3,Latest Fashion Adjustable Metal Plate Type Design Golden Kamarband Waist Belt for Women and Girls,Yellow Chimes,0,0,0,299,5.0,1,76,"Monday, February 21",0,1
55,B07HXRPN1F,Men's PU Leather Reversible Belt (ZR-ALB35-RSTX-21_Black & Brown),ZORO,0,0,0,261,3.5,217,83,,0,217
56,B09R2FGLW9,Men's Leather Belt,YASHISH,1,0,0,390,4.0,1,61,,0,1
57,B07QDNBSGH,Men's Leather Belt,CHURCHILL & COMPANY,1,0,0,"2,399",3.8,9,35,,1,9
58,B0919Q2LLZ,Men's Genuine Leather Auto-Lock Buckle With Reversible Belt,BlacKing,1,0,0,499,4.0,93,74,,1,93
59,B08P5GCMKM,Men's Leather Auto Lock Belt,Labnoft,1,0,0,699,4.1,316,30,,1,316
60,B0919N8K87,Men's Genuine Leather Auto-Lock Buckle With Reversible Belt,BlacKing,1,0,0,499,4.0,93,74,,1,93
61,B079P6WRJR,Men's Leather Belt,KAEZRI,1,0,0,499,4.0,"2,063",75,,1,"2,063"
62,B07N3R7ZLF,Men's Leather Belt,WildHorn,1,0,0,540,3.8,559,66,,1,559
63,B084QBHG29,"Unisex Tucker Shirt Stay Belt (Black, Adjustable Size)",ANEMONE,1,0,0,199,3.9,343,80,,1,343
64,B07ZHDNMYD,Men's Genuine Leather Auto Lock Buckle Belt | Leather Belt for Men,CONTACTS,0,0,0,749,4.2,354,58,,1,354
65,B09H7CMZ1V,"Belts for Women Dresses Jumpsuit Dress Belts Vintage Elastic Wide Leaf Waist Belt Waistband(Black,68cm)",PALAY,0,0,0,499,4.1,9,31,,1,9
66,B08ZN8QSL7,Jason Mens Leather Belt | Leather Belt For Men | Formal Mens Leather Belt,HORNBULL,0,0,0,499,3.9,131,75,,1,131
67,B07NS17SBT,"Men's Army Tactical Waist Belt Automatic Buckle Nylon Canvas Survival Strap, Blue Colour, BL-49",ZORO,0,0,0,237,4.1,253,84,,0,253
68,B07TL9SBDQ,Leatherette Womens Belt,Lino Perros,0,0,0,371,4.2,7,21,,0,7
69,B09D3RFN7D,Men's Genuine Leather Auto Lock Buckle Belt | Leather Belt for Men (Free Size),CONTACTS,0,0,0,798,4.4,193,56,,1,193
70,B0837XH16Y,Men's Woven Stretchable Flexible belt,ZORO,0,0,0,237,4.1,"1,587",76,,0,"1,587"
71,B085TQ7PRN,Unisex Elastic Adjustable Tucker Belt ( Black ),Aferelle,0,0,0,199,3.9,421,75,,1,421
72,B07XZTNH7Y,Men Belt,Tommy Hilfiger,0,0,0,"1,847",3.4,7,42,,1,7
73,B08PKLLT7C,Men's/Women's Stretchable Braided Cotton Belt Combo of 2 Pieces (Tan and Black),Veteran,0,0,0,299,3.8,251,67,,1,251
74,B07ZMZHHPW,Men's Leather Belt,HIDE & SKIN,0,0,0,557,4.1,714,72,,1,714
75,B01KI3VOW6,"Ladies Women Stretch Elasticated Waist Belt Buckle Fashion Women Belt - camel, 61cm*6cm",Generic,0,0,0,325,4.2,107,51,,1,107
76,B09HHMMYG1,Women's Mirror Stretch Waist Dress Belt Skinny Belt for Women Dress Waist Belt Metal Plain Mirror Elastic Belt Adjustable Metal Golden Belt for Ladies,MARZIX,0,0,0,299,4.0,13,54,,1,13
77,B09QZ63L88,"Adjustable Women's Mirror Stretch Waist Dress Belt Skinny Belt Metal Waist Belt for Women Saree, Dress, Traditional Cloth, Jewelry Shiny Gold for Girls Bridal with Button (Golden - Free Size)",SILENCIO,0,0,0,279,5.0,3,72,,1,3
78,B09DTNVG39,"Fashionable Women Belt for Jeans, Colour Black, Party & Casual Wear||Ladies belt for women|| Ladies Belt for jeans||Belt for women stylish|| ||Leather Belt stylish for Ladies/Girls/Women||Black colour|| Size Upto 40inch",Generic,0,0,0,100,3.5,52,87,,0,52
79,B07NS12Z44,"Men's Army Tactical Automatic Buckle Nylon Canvas Survival Strap Waist Belt (BG-49, Beige)",ZORO,0,0,0,230,3.8,105,85,,0,105
80,B06VSSTCXH,Men Belt,Pacific Gold,1,0,0,"1,099",3.8,57,50,,1,57
81,B07QDNBYT4,Men's Leather Reversible Belt,CHURCHILL & COMPANY,1,0,0,"2,399",3.2,21,35,,1,21
82,B09LCXPPY7,Genuine Leather Men’s Formal/Casual Tan Belt | BL8001,HAMMONDS FLYCATCHER,1,0,0,454,3.8,18,77,,0,18
83,B07W78D5B7,"Men's Casual Formal Evening Artificial Reversible Belt (Black, Free Size)",Nitrogen,1,0,0,229,3.7,4,86,,0,4
84,B09HL64RZM,sabyanshi black gold tiger belt 32-36,Generic,0,0,0,899,4.8,6,70,,0,6
85,B08GZD2J5G,"AB-001 Men's Faux Leather Automatic Buckle Belt (Black, Free Size)",Zacharias,0,0,0,289,3.7,"1,309",71,,0,"1,309"
86,B08DL1GWT5,Synthetic Quick Release Buckle Nylon Belt for Men | Men's Nylon Belt (Free Size),CONTACTS,0,0,0,498,4.0,333,72,,0,333
87,B07N3R7ZLF,Men's Leather Belt,WildHorn,0,0,0,540,3.8,559,66,,1,559
88,B07V637X8W,"Cotton D ring buckle belt for men | Leather free, light weight, (PACK OF 3) |",ZORO,0,0,0,265,4.3,382,73,,0,382
89,B08XZ9LYHM,Andrew Formal Reversible Belt for Men,URBAN FOREST,0,0,0,499,3.9,240,75,,1,240
90,B0834QVC31,Women's Metal Leaf Design Belt-kanduro valentines day gifts Pack of 1 (Gold),SATYAM KRAFT,0,0,0,259,4.3,619,78,,0,619
91,B08YK5ZF38,Gold sequin embellished tasseled saree Waist Belt and Kamarbandh for Women and Girls,Duchess,0,0,0,499,3.6,57,75,,0,57
92,B01N2R13TV,Robert Mens Leather Belt | Leather Belt For Men |Top Grain Formal Mens Leather Belt,HORNBULL,0,0,0,499,3.8,130,75,,1,130
93,B08Y5K8Z3S,Women Golden Buckel Elastic Embellished Leaf helix Waist Belt,FSFTTRAD,0,0,0,339,4.0,89,66,,0,89
94,B00JYF2ML2,Men's Antique Silver Black Steel Grey Belt,Puma,0,0,0,446,4.3,37,55,,0,37
95,B08QY9RRS9,Women's Elastic & PU leather Belt,Electomania,0,0,0,399,4.4,484,60,,0,484
96,B00LX5C57C,Men's reversible Black leather Belt (PBL-01),SPAIROW,0,0,0,299,3.3,60,80,,0,60
97,B08TWK4DS1,Women's Adjustable Pearl Belt Belly Chain Waist Belt kamarband for Valentine gift Pack of 1 (Gold),SATYAM KRAFT,0,0,0,269,3.9,56,78,,0,56
98,B00CLOTKYU,"Belt, Men's",Puma,0,0,0,589,4.0,47,61,,1,47
99,B084S5BZ1K,"Corset Belt,Corset Belt for Women,Broad Belt for Women,Stylish Belt for Women for Women's",Electomania,0,0,0,398,4.2,"1,044",34,,0,"1,044"
100,B0759L2W3B,Men's Belt (Camel_32),Woodland,0,0,0,499,3.7,89,29,,0,89
101,B098TDYKXQ,Delight Belt For Boys. Baby Belt for small kids up to 5 years.,Delight Belts,0,1,0,179,4.1,35,78,,1,35
102,B084KN7TVP,"most popular Elastic Stretchable buckle braided rope Belts for kids Boys and Girls for jeans, pants, frocks, shorts (Black Free Size))",Generic,0,0,0,175,3.6,16,56,,0,16
103,B07GTZP37D,"Skytouch Men's Nylon Canvas Breathable Military Tactical Waist Belt with Plastic Buckle (Black, Free Size)",Generic,0,0,0,139,4.1,297,65,,0,297
104,B07TF55T6Z,"Cotton D ring buckle belt for men, Gifting solution, Leather free, light weight",ZORO,0,0,0,148,4.1,"1,161",85,,0,"1,161"
105,B07Y826432,Brian Redwood Leather Wallet & Redwood Casual Textured Belt Combo Gift Set for Men,URBAN FOREST,0,0,0,892,4.2,985,64,,1,985
106,B095TL52G6,"Belts for Women Dresses,Retro Lace-up Corset Belt Women,Waist Belt for Women Stylish,Ladies Belt-Black",Eastern eagle,0,0,0,298,3.0,29,70,,0,29
107,B06XRMB789,CONTACTS Men's Genuine Leather Braided Belt | Leather Belt for Men,VOGARD,0,0,0,749,4.1,956,69,,1,956
108,B09FHYN22H,"Women Belt for Jeans,||Ladies belt for women|| Ladies Belt for jeans||Belt for women stylish|| ||Leather Belt stylish for Ladies/Girls/Women||Black colour|| Size 40inch O ring buckle",Generic,0,0,0,100,3.8,25,89,,0,25
109,B00SGLKJZG,Brown Leather Men's Belt (5260604-M),Puma,0,0,0,691,3.0,34,59,,1,34
110,B094VYR3VR,Men Belt,Van Heusen,0,0,0,"1,147",0,0,32,,1,"₹1,147
₹1,699 Save ₹552 (32%)"
111,B09FFRP97Z,Fashionable Belt for Jeans Party & Casual Wear||Ladies belt for women|| Ladies Belt for jeans||Belt for women stylish|| ||Leather Belt stylish for Ladies/Girls/Women||Black colour|| Size Upto 40inch,Generic,0,0,0,100,3.4,34,80,,0,34
112,B09NFSYJJ4,1 Pcs Metal Chain Buckle Skinny Stretch Waist Belt For valentine gift,SATYAM KRAFT,0,0,0,399,5.0,5,67,,0,5
113,B07YST2WB6,Mens Leather Buckle Closure Formal Web Belt,Titan,0,0,0,957,3.0,1,40,,1,1
114,B079Q3YHL5,"Prime Men's PU Leather Belt (KRY-MEN-BLK-BELT, Black, Free Size)",Krystle,0,0,0,159,3.3,837,56,,0,837
115,B08YKC219S,Women Belt,Duchess,0,0,0,499,3.8,31,75,,0,31
116,B09NL8QX5J,Casual Tan Color Genuine Leather Belt with Double Prong Buckle for Jeans and Casual Wear belt for men stylish Leather for Men's/Boys ||CSBL-BRBKL-05||,CLUB SPUNKY,1,0,0,499,4.7,5,77,,1,5
117,B097ZVZ88G,Formal Black Texas Leatherite Reversible Belt for Men,WildHorn,1,0,0,380,3.8,47,76,,0,47
118,B08P2ZLP4W,Carter Classic Leather Belt For Men,WildHorn,1,0,0,399,3.4,76,69,,0,76
119,B082J14PDN,Men's Leather Belt,CHURCHILL & COMPANY,1,0,0,"2,399",3.4,20,35,,1,20
120,B0919MV9WR,Men's Genuine Leather Auto-Lock Buckle With Reversible Belt,BlacKing,1,0,0,499,4.0,93,74,,1,93
121,B079P7HKH6,Men's Leather Belt,KAEZRI,1,0,0,499,4.0,"2,063",75,,1,"2,063"
122,B094YJSFSZ,Formal/Casual Genuine Leather Belt For Men's Tan,GETOREE,1,0,0,440,4.5,2,78,,0,2
123,B094YK5BLG,Formal/Casual Genuine Leather Belts For Men Brown,GETOREE,1,0,0,440,5.0,2,78,,0,2
124,B079Q3YHL5,"Prime Men's PU Leather Belt (KRY-MEN-BLK-BELT, Black, Free Size)",Krystle,0,0,0,159,3.3,837,56,,0,837
125,B08YKC219S,Women Belt,Duchess,0,0,0,499,3.8,31,75,,0,31
126,B085TMPXCX,Women's Cotton Belt (Pack of 2),ZORO,0,0,0,230,4.2,541,77,,0,541
127,B07ZHD14JG,"Mens Genuine Leather Pin Buckle Belt (Free Size, Dark Brown)",CONTACTS,0,0,0,599,3.6,13,67,,1,13
128,B09NFSHGWZ,1 Pcs Women's Adjustable Metal Chain kanduro Belt with Buckle for valentine gift (Gold),SATYAM KRAFT,0,0,0,279,4.5,2,77,,0,2
129,B09JC7S8K4,KRIAEX Womens Full Metal Sleek Mirror Plate Waistband Belt Chain Dress Decorated Skinny Golden Belt,RMJ,0,0,0,329,4.1,7,59,"Saturday, February 19",1,7
130,B099X49BTB,Men's Leather Slim Buckle Reversible Free Size Formal Belt,Ammvi Creations,0,0,0,777,4.2,15,35,,1,15
131,B09HZM6SCP,"1 Pcs Angel Wings Women Stretchy Metal Belt for valentine gift (Gold, 1 Piece)",SATYAM KRAFT,0,0,0,279,4.3,14,77,,0,14
132,B096FQRBC2,Women's Lace-up Cinch Belt Corset Style Elastic Waist Belt(Black),Cute Critters,0,0,0,378,3.8,98,62,,0,98
133,B085YBKL65,Women's Elastic Belt,Electomania,0,0,0,399,4.4,562,33,,0,562
134,B09C3FQ572,Harvey Formal Leather Belt for Men,URBAN FOREST,0,0,0,499,3.6,57,75,,1,57
135,B07H86QK18,Brown Perforated Casual Leather Belt for Men,URBAN FOREST,0,0,0,599,3.3,18,70,,1,18
136,B09NJLCZW8,1 Pcs Bowknot Design Women Stretchy Belt for Dresses Vintage Elastic Wide Waist Belt for valentine gift,SATYAM KRAFT,0,0,0,269,4.5,10,78,,0,10
137,B07Y22PLWZ,Jackson Leather Belt for Men,HIDE & SKIN,0,0,0,497,4.1,77,75,,0,77
138,B07YST2WB6,Mens Leather Buckle Closure Formal Web Belt,Titan,0,0,0,957,3.0,1,40,,1,1
139,B00BDBZRB2,"Belt, Men's (Red), x (5241901-X)",Puma,0,0,0,579,4.1,35,61,,1,35
140,B07W3PXJTX,Men's Leather Belt,Vincent xavier,1,0,0,499,4.0,233,79,,1,233
141,B09NKVM3HR,Greens Inc 1.5 Inch Wide Elegant Trendy Fashionable Unisex Suspender Belt for Above 12+ Age,Generic,1,0,0,349,0,0,36,,1,"₹349
₹549 Save ₹200 (36%)"
142,B094YK3CLD,Formal/Casual Genuine Leather Belts For Men Tan,GETOREE,1,0,0,440,2.9,3,78,,0,3
143,B095X2RR83,Genuine Leather Autolock Buckle Dress Black Belts for Men And Boys,Pacific Gold,1,0,0,999,4.0,84,58,,1,84
144,B08P488SHL,Unisex Belt,maikun,0,0,0,499,4.2,151,38,,1,151
145,B00UJEFVWO,Leather Women's Belt,Lino Perros,0,0,0,495,3.9,6,0,,0,6
146,B09HZWMCM1,Women's kanduro Adjustable Tassel Hollow Circle Waist Chain Belt for valentine gift Pack of 1,SATYAM KRAFT,0,0,0,319,4.6,19,73,,0,19
147,B07YC2QX5M,Women's Elastic Waist Belt,PALAY,0,0,0,499,4.1,431,30,,1,431
148,B07ZVXBXNK,Women's Vegan Leather Belt (Pack of 3),SIDEWOK,0,0,0,295,3.7,"1,192",70,,0,"1,192"
149,B09MKF6RPT,"Women's Stretchy Belt (Black, Elastic & PU leather)",FDSHIP,0,0,0,399,4.0,2,60,,0,2
150,B095PJD1JV,"Waist Belt for Women for Jeans Buckle Free Adjustable ，Belts for Women Dresses,Elastic Belt Women for Jeans Stylish,Ladies Belt for Girls,1 Pc Black Stripe",Eastern eagle,0,0,0,288,4.0,39,71,,0,39
151,B07QZTGFWZ,Men's Genuine Leather Reversible Belt,Bacca Bucci,0,0,0,849,4.1,832,58,,1,832
152,B00PW3KX8O,Chocolate Brown Leather Men's Belt,Puma,0,0,0,"1,038",3.5,22,62,,1,22
153,B09JKL31YG,"Fashion PU Width Belt,Women's Metal Buckle Design Belt Interlocking Buckle Vintage Blouse Blazer Dress Belt (Brown,23-33 inches)",PALAY,0,0,0,667,5.0,3,29,,1,3
154,B01BHQU8CA,Beautiful Black colored Women Waist Belt,Anaya,0,0,0,"1,599",0,0,0,,0,"₹1,599"
155,B06VV61561,Men's Combo Pack Of Wallet & Belt,Amicraft,0,0,0,499,3.9,47,72,,1,47
156,B08WLVZ2FH,"Unisex Shirt Tucker Stays Lock Belt Strap Adjustable Elastic Wrinkle-Free Non-Garters Stay Clamps holder Keeps (Black,Free Size)",Purabelle,0,0,0,329,3.7,162,67,,0,162
157,B00JYF2HAI,Men's Black Matt Black Buckle Leather Belt,Puma,0,0,0,655,2.6,8,61,,1,8
158,B09QL2MZ51,Waist Dress Belt Skinny Belt for Women Dress Waist Belt Metal.,ZINLEY,0,0,0,339,5.0,4,57,,1,4
159,B075RBX464,Men's Combo Pack Of Wallet & Belt (Brown) Gift Set,Amicraft,0,0,0,499,3.6,10,72,,1,10
160,B09JCN2Y1V,Metal Waistband Skinny Belt Adjustable Waist Strap Belt for Dress Metal Waist Belt Shiny Adjustable Mirror Waist Belt For Women,Anugrah,0,0,0,299,4.1,6,46,,1,6
161,B06XRD1ZXD,Leather Wallet and Classic Belt Combo for Men,WildHorn,0,0,0,899,3.9,291,55,,1,291
162,B092S5R6S1,"Green Golden Beaded Designer Tasselled Cloth Waist Saree Belt and Kamarbandh for Women (Green, 1)",Duchess,0,0,0,"1,015",4.4,62,54,,1,62
163,B01M6A9VZB,Leather Wallet and Belt Gift Hamper for Men | Mens Combo Gift Set | Leather Wallets for Men | Men's Wallet BW93118,HORNBULL,0,0,0,899,4.0,"2,747",73,,1,"2,747"
164,B09F9FH7JQ,Women Tan Stretchable Wide Belt For Ladies,Romp Fashion,0,0,0,399,0,0,50,,1,"₹399
₹798 Save ₹399 (50%)"
165,B08F39NDNS,Men's leather Formal Non Reversible Belt,Amazon Brand - Symbol,0,0,0,348,4.1,85,75,,0,85
166,B08DZC299K,Men's Combo of Black PU Leather Belt And Tan Color Wallet,Imperior,0,0,0,0,3.1,4,0,,0,4
167,B09PTMH256,"Belts for Women Dresses, Women's Leather Belt, Women's Elastic Belt",Electomania,0,0,0,389,5.0,1,35,,0,1
168,B06XZKG67Z,Men's Leather Belt,Tommy Hilfiger,0,0,0,"1,562",4.0,68,32,,1,68
169,B07N475WP2,Men's Leather Belt,WildHorn,0,0,0,540,4.2,22,66,,1,22
170,B09686QY5P,Women Belt,Fabme,0,0,0,179,4.0,36,40,,0,36
171,B085MB1NRY,Women Belt Stylish Silver Buckel Elastic Embellished Waist Belt Decorative Stretch Waist Band,Futurekart,0,0,0,429,4.3,"1,096",28,,0,"1,096"
172,B08XBBS15H,"Women's Metal Adjustable Belt for Saree, Western Dress, Traditional Dress, Party Designer wear (Plain, 3.5 cm wide)",Fabme,0,0,0,399,4.0,300,60,,0,300
173,B09PFTSZWC,"G3E Alano Women's Faux Leather Black Belt Golden Ring , Free Size",Alano Creations,0,0,0,235,5.0,1,61,,0,1
174,B07Y58CMDT,Unisex Cotton Belt,ZORO,0,0,0,230,4.2,674,77,,0,674
175,B09HV4HHZZ,Women's Mirror Stretch Waist Dress Belt Skinny Belt for Women Dress Waist Belt Metal Plain Metal Wide Plate Adjustable Ladies Belt,Akszone,0,0,0,349,2.5,3,50,,1,3
176,B09NL9LWTX,Casual Tan Color Genuine Leather Belt with Double Prong Buckle for Jeans and Casual Wear belt for men stylish Leather for Men's/Boys ||CSBL-BRBKL-05||,CLUB SPUNKY,1,0,0,499,4.7,5,77,,1,5
177,B09K5G2CNF,"Mens Leather Belt, Handmade Pure Italian Quality Mens Formal Belt.",Cavaldii ITALIA,1,0,0,499,4.0,33,80,,1,33
178,B09C3LTNXT,Harvey Formal Leather Belt for Men,URBAN FOREST,1,0,0,649,3.6,57,68,,1,57
179,B083GYWJ63,Genuine Leather Belt,TEE ESS,1,0,0,374,0,0,69,,0,"₹374
₹1,199 Save ₹825 (69%)"
180,B083QP1MPB,WILDBUF Pin Hole Men's Genuine Leather Belt,WILDBUFF,1,0,0,500,4.3,4,64,,0,4
181,B079P5CK6R,Men's Leather Belt,KAEZRI,1,0,0,499,4.0,"2,063",75,,1,"2,063"
182,B0919NFLWH,Men's Genuine Leather Auto-Lock Buckle With Reversible Belt,BlacKing,1,0,0,499,4.0,93,74,,1,93
183,B09NHWD4B7,Casual Tan Color Genuine Leather Belt with Double Prong Buckle for Jeans and Casual Wear belt for men stylish Leather for Men's/Boys ||CSBL-BRBKL-05||,CLUB SPUNKY,1,0,0,499,4.7,5,77,,1,5
184,B08YJZSNX5,"Women Stretchy Belt, Women Belts for Dresses,Ladies Dress Stretchy Belt",Electomania,0,0,0,399,4.3,135,60,,0,135
185,B09HKSMBK9,1 Pcs Women's Metal Wide Plate Adjustable Ladies Belt Women's Waist Belt Polished Shiny Metal Adjustable Chain,JULEX,0,0,0,310,4.5,25,56,,1,25
186,B08W2FYQ24,"Reversible PU-Leather Formal Black/Brown Belt For Men (Color-Black/Brown) Belt for men, Formal belt, gift for gents, Gents belt, mens belt.",ZEVORA,0,0,0,299,4.3,32,77,,0,32
187,B08CNNNYKK,Men Black Artificial Leather Belt & Wallet For Men,LAER,0,0,0,145,3.4,33,42,,0,33
188,B09JKL31YG,"Fashion PU Width Belt,Women's Metal Buckle Design Belt Interlocking Buckle Vintage Blouse Blazer Dress Belt (Brown,23-33 inches)",PALAY,0,0,0,667,5.0,3,29,,1,3
189,B09LYR9F6G,"Elastic Belt for Women, Bohemian Style Braided Belt, Straw Woven Elastic Waist Belt for Women",Electomania,0,0,0,389,3.7,12,35,,0,12
190,B07VG8FDKB,Ladies Women Stretch Elasticated Waist Belt Gold Buckle With Love Fashion Especially Designed for Women Suitable for Adults,Electomania,0,0,0,389,4.3,289,35,,0,289
191,B08TTXXNKD,"Women's Stretchable Belt Pack of 1 Black,Free Size",Generic,0,0,0,129,3.3,3,74,,0,3
192,B078BXMDTT,1 Pcs Women's Golden Skinny Stretch Metal Ladies kanduro Belt for valentine gift (lock 3),SATYAM KRAFT,0,0,0,259,4.1,311,78,,0,311
193,B07XVM6FD9,XXXL OVERSIZE PLUS SIZE women formal fabric belt black microprint for jeans and trouser,Generic,0,0,0,329,4.3,4,75,,1,4
194,B07KQ61GNZ,Women's Belt Fashion Bowknot Design Chic Elastic Stretch Waist Band (Black),Electomania,0,0,0,389,4.3,"1,114",35,,0,"1,114"
195,B09GVDD7PF,"1 Pcs Women Stretchy Metal kanduro Belt for Dresses Vintage Elastic Wide Waist Belt for valentine gift(Black, 1 Piece)",SATYAM KRAFT,0,0,0,349,3.7,17,71,,0,17
196,B00PW3KRXU,Black Leather Men's Belt,Puma,0,0,0,"1,036",3.8,49,62,,1,49
197,B07VPFDBM9,Unisex Nylon Belt,ZORO,0,0,0,230,4.1,166,85,,1,166
198,B071452YQP,Men's Genuine Leather Black & Brown Reversible Belt(Colour-Black & Brown||Italian Leather||E-002||REVERSIBLE),CREATURE,0,0,0,589,4.1,"2,117",71,,1,"2,117"
199,B09DD4GK2R,Formal Reversible Leather Belt for Men | Color- Black & Brown | 48 inches length || Waist upto 44 inches I,WildHorn,0,0,0,480,4.8,6,70,,0,6
200,B07RRHZRWQ,Timber Lane Genuine Leather Belt for Men,WILDBUFF,1,0,0,500,3.4,7,64,,0,7
201,B07RTNCKKW,Diamond Men's Leather Belt (WBN407),WILDBUFF,1,0,0,500,5.0,1,64,,0,1
202,B09CFXXKFV,"Men's Genuine Leather Auto Lock Buckle Belt (Free Size, Black Brown/Tan)",GAINX,1,0,0,699,4.0,56,78,,1,56
203,B09K5GVS1S,"Mens Leather Belt, Handmade Pure Italian Quality Mens Formal Belt.",Cavaldii ITALIA,1,0,0,499,4.0,14,80,,1,14
204,B07HVHCYZM,Women's Leather Belt,Futurekart,0,0,0,399,4.3,454,33,,0,454
205,B09R9VH7X2,FS1 Belt For Women (Most Trending),Generic,0,0,0,240,1.0,1,45,,0,1
206,B09NHV3JC9,Pearl Waist Chain Belt Adjustable Decorative Belt Hollowed Tassel Waist Belts - Free Size,Syga,0,0,0,249,4.3,60,64,,1,60
207,B0793SSFR1,Men's Tactical Belt Military Style Webbing Nylon Belt for Men with Metal Buckle,JELINDA,0,0,0,449,4.0,999,70,,0,999
208,B08TLVFNSV,Women's Metal kanduro Stretchable Belt for valentine gift Pack of 1 (Gold),SATYAM KRAFT,0,0,0,299,4.2,237,75,,0,237
209,B01B4V7Z8I,Men's leather Belt,Puma,0,0,0,730,3.7,14,62,,1,14
210,B08W1W9WWJ,Police Inspector Belt replica ;Leather ; Free Size,FancyDressWale,0,0,0,399,3.4,28,60,,1,28
211,B09DD4DB97,Reversible Leather Formal Belt for Men | Color- Black & Brown | 48 inches length || Waist upto 44 inches I,WildHorn,0,0,0,480,3.6,3,70,,0,3
212,B09LCY8YQW,"No Buckle Elastic Stretch Belts for Men and Women, Eastern Eagle Comfortable Invisible Belts for Jeans Pants",Eastern eagle,0,0,0,199,2.1,5,80,,0,5
213,B07MMTXFKF,unisex Black stretchable suspender,Sunshopping,0,0,0,199,3.9,295,50,,0,295
214,B08Y1BK4NS,Gothic Leather Waist Belt Punk Rock Grommet Belt for Jeans Party Body Jewelry Accessories for Women and Girls,PALAY,0,0,0,568,4.3,402,28,,1,402
215,B07Y39J1NS,Men's Vegan Leather Formal Belt (Black and Brown),Auraki,0,0,0,326,3.7,310,80,,1,310
216,B07K2T599H,Women's Leather Belt,Electomania,0,0,0,399,4.2,910,33,,0,910
217,B08QZ68X5R,Reversible Black And Brown Leather Belt for Men TWO IN ONE BELT,TEDSPRAY,0,0,0,399,3.8,189,60,,0,189
