,asin,title,brand,Sponsored,Best Seller,Amazon's Choice,Price,Rating,NoofRatings,Discount,Delivery,Prime Delivery,base
141,B0865RXG6M,"MY ARMOR Orthopedic Memory Foam Pillow for Comfortable Sleep, King Size (Pack of 2)",MY,1,1,0,"2,350",4.1,"11,264",44,"Thursday, February 10",1,"11,264"
142,B09N1J18CL,"Spread Spain® 100% Bamboo fibers Shredded Memory Foam Luxury Pillow Ultra Soft, Cool and Soothing Effect, Super Supportive Breathable Pillow (45 x 68 cm )",Spread,1,0,0,"5,649",0,0,0,"Sunday, February 13",1,"₹5,649
₹5,650"
143,B0166F5ZX4,"Spread Spain® Doctor Plus Pillow for Cervical/ Contoured Neck Memory Foam Pillow, Pillow for Neck Pain and Shoulder Pain(45 x 68 cm, White, Pack of 1 )",Spread,1,0,0,"3,595",3.8,25,14,"Sunday, February 13",1,25
144,B01H089NHA,"Sleepwell Memory Foam Pillow, 24 x 16, Multicolour, 2 Pieces",Sleepwell,0,0,0,810,3.6,212,19,"Thursday, February 17",0,212
145,B09NVXVQQS,Trova Fashion Store Cotton Filled with Microfibre & Polyster Ultra Soft Blue Star Printed Bed Pillow Sets ( Pack of 4 ),Trova,0,0,0,439,4.0,1,51,"Sunday, February 13",1,1
146,B097KHPMF9,"ROYALREOX Alternative Fiber Pillow - Hotel Quality White Microfiber pilow 4 Piece - 16x24 Inch (White, Single Pillow )",ROYALREOX,0,0,0,549,2.2,4,63,"Tuesday, February 15",0,4
147,B08524D54S,"Durafeel Soft Microfiber Quilted Pillow for Sleeping, 17x27 inch, White, Pack of 2",Durafeel,0,0,0,"1,084",3.6,60,53,"Sunday, February 13",1,60
148,B09NH4FX1K,"Homerz Set of 2 Reversible Mesh Pillow, 17 x 27 inch",Homerz,0,0,0,999,0,0,50,"Tuesday, February 15",1,"₹999
₹1,999 Save ₹1,000 (50%)"
149,B09PBHY671,"Zoliva Memory Foam Cervical Pillow for Neck Pain and Spondylitis Contour Pillow Support for Back, Side Sleepers Memory Foam Pillow (Pack of 1)",Zoliva,0,0,0,899,5.0,48,55,"Tuesday, February 15",0,48
150,B09QJQTSVF,"Daksh Out Fit Ultra Soft Microfiber Blue Star Printed Bed Pillow (Black Cotton,Set of 1, Size- 40 x 60 cm )",,0,0,0,0,0,0,0,,0,
151,B08PKBNT77,Prime Cart Orthopedic Memory Foam Pillow for Comfortable Sleep( White). (Pack of 1),Prime,0,0,0,599,3.3,44,73,"Monday, February 14",0,44
152,B09RN9YLWT,"Outlay Home Luxury chennile Bolster Cover|| Bolster Pillow Cover Set of 2|| Round Pillow Cover Set of 2 || Masand Cover - 32*16 inches, Coffee",Outlay,0,0,0,225,0,0,55,"Tuesday, February 15",0,"₹225
₹499 Save ₹274 (55%)"
153,B08VDGWCRT,JY Premium Polyester Quilted Filled Reliance High Density Micro Fiber Super Soft Sleeping Pillows - 16x26 Inch - Set of 4 (White and Sky Blue),JY,0,0,0,599,3.8,390,40,,1,390
154,B09N9SPNPQ,"Fairy Down Hollow Fibre Pillow, Soft Pillow for Sleeping, Pillows Set 2 ( 40 X 60 cm)",Fairy,0,0,0,449,3.5,10,78,"Tuesday, February 15",1,10
155,B094QYCMC1,"JY Hotel Collection Bed Pillows for Sleeping - Queen Size, Set of 2 - Soft Allergy Friendly, Cooling, Luxury Gel Pillow for Back, Stomach or Side Sleepers in Cotton Multi Check Size 16*27 inch",JY,0,0,0,369,3.6,119,38,"Thursday, February 17",0,119
156,B084RCCDT3,"PUM PUM Ultra Soft Micro Fiber Body Pillow,Long Slide Sleeping Pillow for Adult and Pregnancy ,(Blue ,20x54 Inch)",PUM,0,0,0,499,3.7,125,0,"Sunday, February 13",1,125
157,B09R8T6WCY,"SleepX OWl Rotto Fabric Reliance Fiber Luxury Hotel Collection Super Soft Pillow for Sleeping Oeko-TEX® Certified (Single) (17""X 27"" INCH) Set of 2",SleepX,0,0,0,499,0,0,50,"Thursday, February 17",1,"₹499
₹999 Save ₹500 (50%)"
158,B09NVWQL76,Trova Fashion Store Cotton Filled with Microfibre & Polyster Ultra Soft Plain White Bed Pillow Sets ( Pack of 4 ),Trova,0,0,0,0,1.0,2,0,,0,2
159,B09748RDVD,"MECNIOX Bedroom Round Polyester Bolster Luxury Pillows for Hotel - Set of 2 Pieces (10X25-inches, White)",MECNIOX,0,0,0,499,3.4,17,67,"Tuesday, February 15",0,17
160,B09MZJCM1T,"AK -Creation Ultra Soft Microfibre Bed Pillow Set (Standard, 40 x 60 cm, White) -Pack of 2",AK,0,0,0,279,1.0,1,44,"Sunday, February 13",1,1
161,B07MQKM349,"Homescape Fiber Bed Pillow (16x26 inch, White) - 2 Pieces.",Homescape,0,0,0,599,3.6,95,50,"Tuesday, February 15",1,95
162,B08S76VKSN,Momsyard Women's (Original) Full Body Pregnancy/Maternity Made of Velvet Pillow Cover - C Shaped - Gray/Silver,Momsyard,0,0,0,"1,299",4.0,"3,084",65,"Monday, February 14",1,"3,084"
163,B08R5Y3FLZ,Sulana Foam Ultrasoft Pillow - Set of 1,Sulana,0,0,0,149,0,0,85,"Tuesday, February 15",0,"₹149
₹999 Save ₹850 (85%)"
164,B097BZMHYK,"LAWERA Neck Support, Anti Bacterial Cotton Fabric, Ultra Soft 300 Thread Count Soft Touch Fiber Pillow Set for Bed (White, Vacuum Packed) - Pack of 6",LAWERA,0,0,0,789,3.8,32,54,"Sunday, February 13",0,32
165,B098JSRZK8,Solid Polyester Fiber Pillow F3 Best for Heavenly Sleep White Pack of 3,Solid,0,0,0,0,3.5,6,0,,0,6
166,B09F9GC5BW,"Design World -Hollow Fibre Pillow for Sleeping Bed Set of 2, 16inch X 24inch or 41cm X 61cm, White",Design,0,0,0,449,0,0,10,"Monday, February 14",0,"₹449
₹498 Save ₹49 (10%)"
167,B09LYMZB76,BAJAJ TEXTILE Air Pillow Camping Air Pillow Ultralight Portable Ergonomic Pillow Air Cushion Sleeping Bag Backpacking Pillow Soft Comfortable Air Inflatable Travel Pillow Blue(Pack of 1),BAJAJ,0,0,0,220,4.5,2,12,"Sunday, February 13",1,2
168,B096YDPSFG,"Homerz Premium Set of 2 Hotel Quality Super King Size Pillow, 20 x 30 Inch Exact Size, Superior White Cotton Polyester Fabric (2)",Homerz,0,0,0,899,3.8,139,50,"Tuesday, February 15",1,139
169,B09QJT1SSZ,"Shree GANPAT Enterprises Ultra Soft Pillow Sets for Bed (Black Microfibre , Set of 04,Size- 68x 43Cm)",Shree,0,0,0,479,0,0,4,"Sunday, February 13",0,"₹479
₹499 Save ₹20 (4%)"
170,B098L591YB,Proliva Cervical Contour Soft Memory Foam Pillow for Sleeping (Butterfly Pillow),Proliva,0,0,0,899,4.4,8,55,"Tuesday, February 15",0,8
171,B09JSWW688,"JY Breathable Gusset Bed Soft and Supportive Pillows for Side, Back, Stomach Sleepers (16'' x 26'') -Set of 2, Silk , White",JY,0,0,0,449,3.1,18,55,,0,18
172,B08YNMPF2M,"REGIUS Premium Hotel Quality Hollow Microfibre Pillow (16x26 Inches, White) -Set of 2",REGIUS,0,0,0,459,3.4,12,54,"Monday, February 14",1,12
173,B0813RMSTK,"Recron Certified Dream Fibre Pillow - 41 cm x 61 cm, White, 2 Piece & Dream Fibre Pillow - 43 cm x 69 cm, Pack of 2, White Combo",Recron,0,0,0,0,4.0,12,0,,0,12
174,B0849MGR8M,"Vroxy Memory Foam Pillow Cervical for Neck Pain Orthopedic Contour Medical Pillow Support for Back, Stomach, Side Sleepers, Anti-Snoring Relief Neck Pillow, Anti-Allergy, Pillow for Pain Relief",Vroxy,0,0,0,649,0,0,35,"Monday, February 14",1,"₹649
₹999 Save ₹350 (35%)"
175,B0995H22GS,Indore Cotton-Micro Filled Jaipuri Print Cotton Pillow Takiya Combo Set of 2 for Bed Room - 17x27 Inch Size Pillow Set of 2 for Sleeping,Indore,0,0,0,599,3.9,6,50,,1,6
176,B09F679JF6,"Spread Spain® Medium Firm Everyday Pillow with Fiber Filling for Comfortable Sleep, 5 Star Hotel Pillow (President Size , 56 x 85 cm, 1)",Spread,1,0,0,"2,295",4.0,25,10,"Tuesday, February 15",0,25
177,B0736YM33H,"AmazonBasics Polyester Ultra Soft Down Alternative Bed Pillows (20X36 inches, Extra Large) - 2 Pack",AmazonBasics,1,0,0,"1,823",4.0,"10,818",48,,1,"10,818"
178,B08Q8HD919,"Morning Owl™ Latex Pillow - Medium Firm Pillow, eco-INSTITUT Certified 100% Natural Latex Pillow, Rubber Pillow, Best Pillow for Sleeping (60*40*12.5 cm), 1 Pillow",Morning,1,0,0,"1,995",4.0,36,39,"Sunday, February 20",1,36
179,B09QCZY92D,"Sleepsia Microfiber Bed Pillow for Sleeping - Down Alternative Ultrasoft Cotton Washable Pillow with Satin Gusset- Queen (Red, Pack of 1)",Sleepsia,1,0,0,"1,299",4.5,60,78,"Sunday, February 13",1,60
180,B09GS1WHDW,"Cloth Fusion Microfiber Bed Pillow Set of 2 Pieces (17x27 Inches, Maroon and Grey)",Cloth,1,0,0,649,3.9,9,35,"Saturday, February 12",1,9
181,B083FK4HWF,"MY ARMOR Orthopedic Memory Foam Pillow for Comfortable Sleep, Queen Size (23"" x 14"" x 4.5"")",MY,1,1,0,"1,150",4.1,"11,264",42,"Thursday, February 10",1,"11,264"
182,B09NH4FX1K,"Homerz Set of 2 Reversible Mesh Pillow, 17 x 27 inch",Homerz,1,0,0,999,0,0,50,"Tuesday, February 15",1,"₹999
₹1,999 Save ₹1,000 (50%)"
183,B09QGJX753,"Sleepsia Microfiber Bed Pillow for Sleeping - Down Alternative Ultrasoft Cotton Washable Pillow with Satin Gusset- Queen (Red, Pack of 4)",Sleepsia,1,0,0,"3,850",4.5,60,36,"Sunday, February 13",1,60
184,B09QD1KTXF,"Sleepsia Microfiber Bed Pillow for Sleeping - Down Alternative Ultrasoft Cotton Washable Pillow with Satin Gusset- Queen (Green, Pack of 1)",Sleepsia,0,0,0,"1,299",4.5,60,78,"Sunday, February 13",1,60
185,B094383XPH,HOMIBOSS Bombay Dyeing Cotton Bed Pillow for Sleeping White Size 60 x 40 cm Set of 2 Pcs,HOMIBOSS,0,0,0,598,4.0,38,53,"Wednesday, February 16",1,38
186,B088P34399,"Kuber Industries Cotton Ultra Soft Hollow Fibre C Shaped Maternity Pillow, Pregnancy Pillow, Body Pillow with Zippered Cover (Grey) - CTKTC045960, Standard",Kuber,0,0,0,"1,229",3.4,587,18,"Thursday, February 10",1,587
187,B09JN3GRZC,SIROKI BOND Polyester Fiber Solid Pregnancy Pillow Pack of 1,SIROKI,0,0,0,799,0,0,67,"Wednesday, February 9",0,"₹799
₹2,399 Save ₹1,600 (67%)"
188,B09J91KR9Q,Donda Brother's Microfibre & Polyster Ultra Soft Blue Stripes Bed Pillow Sets ( 6 Piece ),Donda,0,0,0,599,0,0,14,"Sunday, February 13",0,"₹599
₹699 Save ₹100 (14%)"
189,B09G87BX7T,Nilkamal Comfy Pillow (Set of 2pcs Pillow),Nilkamal,0,0,0,600,2.0,1,14,"Monday, February 14",0,1
190,B0993MZ5WZ,"D S Pillow Microfiber 16 X 24 inch White Sleepping Pillows, Pack of 1 (6)",D,0,0,0,0,3.6,26,0,,0,26
191,B09RJ4LXSN,"M/S Kusum & Cheshta Enterprises Ultra Soft Microfibre Blue Lining Bed Pillow Sets (Pack of 2, Size- 40x60CM)",M/S,0,0,0,299,0,0,40,"Sunday, February 13",0,"₹299
₹499 Save ₹200 (40%)"
192,B092471FGM,"Israel Memory Foam Pillow Cervical for Neck Pain Orthopedic Contour Medical Pillow Support for Back, Stomach, Side Sleepers Pillow for Pain Relief",Israel,0,0,0,545,5.0,2,39,"Saturday, February 19",0,2
193,B0813B53YD,EMBROCO Home Decor Sleeping Bed Pillow Set of 4-45x61,EMBROCO,0,0,0,699,5.0,2,30,"Monday, February 14",1,2
194,B07QSR6B6Y,"Sleepwell Feather Pillow, 27 x 17, White, Set of 1",Sleepwell,0,0,0,597,3.9,29,12,"Tuesday, February 15",1,29
195,B09C1Z5HZB,"Zoliva Memory Foam Cervical Contour Pillow for Neck Pain and Spondylitis, Back Support, Side Sleepers (1)",Zoliva,0,0,0,899,3.9,119,55,"Tuesday, February 15",0,119
196,B09JKQR4V4,"JY Home Bed Pillows for Sleeping 2 Pack Standard Size 16 x 26 Inches, Hypoallergenic Pillow for Side and Back Sleeper, Down Alternative Cooling Pillow",JY,0,0,0,299,3.7,39,50,,0,39
197,B09M3ZLSCX,Ozoy Contour Memory Foam Pillow Adjustable for Sleeping Ergonomic Cervical Pillows Neck Pain Support Back Anti-Allergy Relief Bed with Cover (Memory Foam Pillow- (White)),Ozoy,0,0,0,799,3.8,80,60,"Monday, February 14",1,80
198,B089YTMMJP,"HOMY DECOR Bombay Dyeing 100% Cotton Cloth, Luxury Hotel Collections Soft Pillow, White, 17 X 27 Inch, Pack of 2",HOMY,0,0,0,799,4.0,397,60,"Thursday, February 17",1,397
199,B08FYWDN3G,Homerz Ultra Soft ( Set of 4 ) King Size Fibre Pillows for Bed | 17 x 27 Inch Guaranteed Exact Size | White Cotton Fabric Pillows for Sleeping (4),Homerz,0,0,0,"1,269",3.9,323,33,"Tuesday, February 15",1,323
200,B09CDQS4NH,"The Sleep Company SmartGRID Premium Hybrid Pillow, The Ultimate Pillow Ever Designed by Science, No Pressure Support, White (24x16 Inches) (66x40 cm) - Pack of 2, Cotton",The,1,0,0,"3,698",4.0,248,47,"Monday, February 14",1,248
201,B08P9WHVBL,"Nivedha Mattress- Virgin Gold -100% Organic Silk Cotton/Kapok/Ilavam Panju/Semal Cotton Fiber for Filling Pillows, Cushion,bolsters,Mattress etc (2kg)",Nivedha,1,0,0,"1,400",4.2,20,53,"Monday, February 14",1,20
202,B08RC4CJT7,"MY ARMOR Microfibre Pillow , 26"" x 17"" , White , 1 Piece",MY,1,0,0,370,4.3,288,38,"Wednesday, February 16",0,288
203,B08FYWDN3G,Homerz Ultra Soft ( Set of 4 ) King Size Fibre Pillows for Bed | 17 x 27 Inch Guaranteed Exact Size | White Cotton Fabric Pillows for Sleeping (4),Homerz,1,0,0,"1,269",3.9,323,33,"Tuesday, February 15",1,323
204,B09CMVW897,"Homerz Nirvana Pillow Filled with 3D Conjugated Fiber, 17 x 27 inch Exact Size, Cotton Fabric, White -Set of 2",Homerz,0,0,0,749,3.9,112,53,"Tuesday, February 15",1,112
205,B09J1BTLWY,"Kanu Creation Cervical Contour Memory Foam Pillow,Orthopedic Pillow for Neck Pain,Orthopedic Contour Pillow Support for Back,Stomach,Side Sleepers,Anti-Snoring Neck Pillow (White) (1)",Kanu,0,0,0,549,3.6,8,45,"Tuesday, February 15",0,8
206,B0819JWVSL,"MOJOREST Memory Foam Pillow for Neck Pain and Shoulder Pain, Orthopedic Cervical Contour with Removable Cover (19X12X4, Grey, White)",MOJOREST,0,0,0,898,4.0,"2,956",64,"Sunday, February 13",1,"2,956"
207,B09NVXH7MS,Trova Fashion Store Microfibre & Polyster Ultra Soft Blue Stripes Bed Pillow Sets ( 4 Pillow ),Trova,0,0,0,499,4.5,2,44,"Sunday, February 13",1,2
208,B094G3RYRF,"Great Samrat Microfiber Pillow Pack of 4 (White, Standard Size)",Great,0,0,0,0,3.5,33,0,,0,33
209,B0972RXQG9,"Sleeprest Ultra Soft Luxury Quilted Pillow Sleeping Pillow for Home Bed Fiber Filled - Organic Cotton Fabric with Premium Microfiber Filling - 17x27 Inches, White",Sleeprest,0,0,0,599,3.7,8,63,"Sunday, February 13",1,8
210,B08QJL5SFH,"The White Willow Memory Foam Infant Baby Pillow for Preventing Head for Flat Head Syndrome Ideal for 0-12 Age -( 9.8"" L X 7.5"" W X 1"" H) Blue",The,0,0,0,649,3.9,171,54,"Sunday, February 13",1,171
211,B09Q1BNDLT,"Dormyo Memory Foam Contour Cervical Pillow for Sleeping, Relief from Neck Pain, Shoulder Pain, Back Pain (20x12x4 inches), 50-D Memory Foam Bed Pillow with 400 GSM Cover",Dormyo,0,0,0,699,5.0,3,65,"Monday, February 14",1,3
212,B09RNB3HN4,"Outlay Home Luxury chennile Bolster Cover, Bolster Pillow Cover Set of 2, Round Pillow Cover Set of 2, Masand Cover - 32*16 inches, Maroon",Outlay,0,0,0,225,0,0,55,"Tuesday, February 15",0,"₹225
₹499 Save ₹274 (55%)"
213,B09JP437KT,"KWT Plastic Cervical Contour Memory Foam Pillow Support for Neck Pain, Orthopedic, Back, Stomach, Side Sleepers, Anti-Snoring (White)",KWT,0,0,0,789,4.4,135,21,"Monday, February 14",1,135
214,B09BZJKGBB,Solid Polyester Fiber Pillow EE2 Best for Heavenly Sleep White Pack of 2,Solid,0,0,0,299,2.4,13,50,"Sunday, February 13",1,13
215,B09QJZ6RCK,Little Peach Microfiber C Shape Ultra-Soft Pregnancy Pillow (Charcoal Grey),Little,0,0,0,"1,999",0,0,20,"Sunday, February 13",1,"₹1,999
₹2,499 Save ₹500 (20%)"
216,B07WHWWT1Z,"SWEETSAGA Durable Super Soft Power Sleeping Bed Home Pillow, Unique White 16X24 Inch 2 Set Pillows, 2022 Offer, Microfibre",SWEETSAGA,0,0,0,329,3.8,39,78,"Monday, February 14",1,39
217,B09RB6YLZH,"Oyasumi Ultra Soft Premium Fiber Quilted Bed/Sleeping Pillow with Zipper Handle Bag for Home, Size - 17""x27"" Inches (White) - Pack of 2",Oyasumi,0,0,0,697,0,0,77,"Monday, February 14",1,"₹697
₹2,999 Save ₹2,302 (77%)"
218,B09MLZWDB5,"takiyawala Microfiber Quilted Pillow for Sleeping, 17x27 inch, White, Pack of 2",takiyawala,0,0,0,699,4.8,9,46,"Monday, February 14",1,9
219,B09M8PZ6XM,Zofey Memory Foam Pillows for Neck Pain and Shoulder Pain Orthopedic Cervical Best Contour Shape Ergonomic Neck Memory Foam Bed Pillow (WHITE-MFP-01),Zofey,0,0,0,799,3.3,5,65,"Monday, February 14",0,5
220,B09FYHZT24,"Design World -Hollow Fibre Pillow for Sleeping Bed Set of 1, 18x27 inch, White",Design,0,0,0,299,3.1,5,40,"Monday, February 14",0,5
221,B07Q1BJ6Z4,"Tishnagi Designer Pregnant Women's Cotton Soft Stripes Body Pillow for Maternity Back Support Lumbar Pillow with Microfiber Filling (18 x 54 inch, Satin Stripe, White)",Tishnagi,0,0,0,699,4.6,377,59,"Monday, February 14",1,377
222,B08TVMMMML,"ATOOTFUSION Microfiber Full Body Pillow Insert Without Cover,Large Body Pillow for Adults,Breathable Long Side Sleeper Pillow for Sleeping (21 x 58 Inch)-Black & White Check Big Soft Body Hug Pillow",ATOOTFUSION,0,0,0,476,3.5,86,76,"Monday, February 14",0,86
223,B09J8ZW8ND,Donda Brother's Microfibre & Polyster Ultra Soft Blue Stripes Bed Pillow Sets ( 1 Piece ),Donda,0,0,0,199,0,0,33,"Sunday, February 13",0,"₹199
₹299 Save ₹100 (33%)"
224,B09QBXW1R4,"Kamal Enterprises Furniture Microfibre & Polyester 2-Piece Bed Pillow Set - 40 x 60 cm, White (40x65)",Kamal,0,0,0,299,0,0,63,"Sunday, February 13",1,"₹299
₹799 Save ₹500 (63%)"
225,B09CNSG3XG,"JY Reliance Microfiber Feeling Satin Stripe Fabric Bed Pillow for Sleeping (White, 16'' X 26'' ) - Set of 2",JY,0,0,0,389,3.7,73,44,,0,73
226,B08XVLZNK4,"PumPum Premium Holland Velvet 6 pc Car Set (4 Cushion ,2 Neck Rest Pillow) ,Black",PumPum,0,0,0,799,4.3,13,43,"Sunday, February 13",1,13
227,B09PBJ6SGS,Zoliva Memory Foam Pillows for Neck Pain and Shoulder Pain Orthopedic Cervical Best Contour Shape Ergonomic Neck Memory Foam Bed Pillow Pack of (1),Zoliva,0,0,0,"1,099",5.0,45,45,"Tuesday, February 15",0,45
228,B08X2JX6HD,"Bombay Dyeing Cotton & Fibre Comfy Pillows (White, Large) - Pack of 2",Bombay,0,0,0,"1,575",4.0,9,12,"Thursday, February 17",0,9
229,B088NYHTY1,"ATOOTFUSION 100% Recyclable Dust free Black Hosiery Firm Medium Hard Cotton Pillow for real perfect neck support (16"" x 26"") Firm Medium Hard Pillow Checkered Multicolored Pack of 02",ATOOTFUSION,0,0,0,324,3.8,409,84,"Monday, February 14",0,409
230,B09Q7CJ2D7,BUDGET Pure Cotton & Microfiber Filling 2-Piece Bed Pillow Set (40 x 60 cm Or 16 x 24 inch; 500 GSM) White,BUDGET,0,0,0,594,0,0,52,"Tuesday, February 15",0,"₹594
₹1,249 Save ₹655 (52%)"
231,B09MC81WW7,"Homerz Premium Set of 2 Organic Cotton Kapas Filled Pillow with Firm Medium Hardness, 16 x 24 Size, 700 gm Pillow",Homerz,0,0,0,749,3.4,4,25,"Tuesday, February 15",1,4
232,B095MMDW1V,"Milford Memory Foam Pillow Standard Size Neck & Back Support for Sleeping with Removable Zipper Cover Pillow,Cervical Pain,Orthopedic Contour Back,Stomach,Side Sleepers,Anti-Snoring Relief Pillow,Anti-Allergy,Pillow Pain",Milford,0,0,0,599,3.5,5,60,,0,5
233,B09RFJP64D,"ATOOTFUSION Luxury Full Body Pillow Insert with Fiber Cover - Ultra Soft Body Pillow for Sleeping - Breathable Long Bed Pillow Insert, 20""x54"" (Grey)",ATOOTFUSION,0,0,0,549,0,0,73,"Monday, February 14",1,"₹549
₹1,998 Save ₹1,449 (73%)"
234,B099DD3KWT,"QUBOX Premium Hotel Quality Hollow Micro Fiber Pillow (Size 16 X 24 Inch, White) - Pack of 2 Pillow",QUBOX,0,0,0,298,4.0,1,70,"Sunday, February 13",1,1
235,B07WCHG2FC,SONNASOFT 16 x 16 Pillow Inserts (Set of 4) - Throw Pillow Inserts with 100% Cotton Cover - 16 Inch Square Interior Sofa Pillow Inserts - Decorative Pillow Insert Pair - White Couch Pillow,SONNASOFT,0,0,0,549,4.2,10,39,"Monday, February 14",1,10
236,B09PJH12R8,"Homerz Body Pillow with Waterproof Pillow Protector Cover, 54 x 20 inch Size (Grey)",Homerz,1,0,0,999,0,0,50,"Tuesday, February 15",1,"₹999
₹1,999 Save ₹1,000 (50%)"
237,B08NVFRXBM,"Nivedha Mattress Organic Silk Cotton/Kapok/Ilavam Panju/Semal Soft Sleeping Pillow (Green, 24 x 14 inches)",Nivedha,1,0,0,650,3.3,7,64,"Monday, February 14",1,7
238,B089N5YDB1,"HOMY DECOR Microfiber Pillow, 17 X 27 Inch, White, Pack of 2",HOMY,1,0,0,860,4.2,402,57,"Thursday, February 17",1,402
239,B099NY6WS8,"Homerz Hollow Cotton Fiber Pillow Set, (White, 2)",Homerz,1,0,0,599,2.0,3,67,"Tuesday, February 15",1,3
240,B09PJG3SSJ,"Homerz Body Pillow with Waterproof Pillow Protector Cover, 54 x 20 inch Size (Golden)",Homerz,1,0,0,999,0,0,50,"Tuesday, February 15",1,"₹999
₹1,999 Save ₹1,000 (50%)"
241,B08R93TWLQ,"Nivedha Mattress-Organic Silk Cotton/Kapok/Semal/Ilavam Panju Classic Pillow (27 X 17 Inches),White Striped Pillow.",Nivedha,1,0,0,800,3.9,35,47,"Monday, February 14",1,35
242,B09QD1KTXF,"Sleepsia Microfiber Bed Pillow for Sleeping - Down Alternative Ultrasoft Cotton Washable Pillow with Satin Gusset- Queen (Green, Pack of 1)",Sleepsia,1,0,0,"1,299",4.5,60,78,"Sunday, February 13",1,60
243,B09KW46NYM,"Homerz Set of 2 Imported Conjugated Fiber Pillow, 17x 27 inch Size, Vacuum Pack (White with Yellow Boundary)",Homerz,1,0,0,747,5.0,1,25,"Tuesday, February 15",1,1
244,B08RXQZY3R,SCPmarts Create Your Desire SCP255 Satin Blackpink Kpop BTS Pillow Blackpink Kpop BTS Fan Cover with Filler Size (12 Inch x 12 Inch),SCPmarts,0,0,0,299,3.5,2,57,"Monday, February 14",1,2
245,B083RBSNPF,"Cloth Fusion Cloudix Microfiber Bed Pillow, 17X27 Inches, White, Set of 2",Cloth,0,0,0,599,3.8,68,40,"Sunday, February 13",1,68
246,B09JKFPX1S,"Lefre Best Sleep Microfiber Cotton 5 Star Hotel Black Star Pillow Extra Large King Size 16""*24 (40cm*60cm), White , Set of 4.",Lefre,0,0,0,499,3.0,1,67,"Sunday, February 13",0,1
247,B095YZ9NML,"Oyasumi Polyester Super Soft Washable Pillow (16""X24"", White) - Pack of 4",Oyasumi,0,0,0,816,3.2,10,49,"Monday, February 14",1,10
248,B07F76KMS9,"Hush Standard Pillow | Softex Fiber Filling | Medium Soft Feel The Zero Headache Polyester Bed Pillow, (Beige, 16 x 24 x 7.25 Inch)",Hush,0,0,0,550,3.9,185,21,"Monday, February 14",1,185
249,B094DGJ8P1,"DECOR Polycotton Comfort Foam Pillow, White, Standard - Pack of 2",DECOR,0,0,0,999,3.6,101,33,"Monday, February 14",0,101
250,B099PQ87JB,neetutraders Cotton Blue Star Printed Sleeping Pillow Pack of 4,neetutraders,0,0,0,699,5.0,1,53,"Sunday, February 13",1,1
251,B09824TQKY,"ROYALREOX Reliance Microfiber, Machine Washable Pillow for Sleeping (16 x 24 White Fibre) (4)",ROYALREOX,0,0,0,549,0,0,63,"Tuesday, February 15",0,"₹549
₹1,499 Save ₹950 (63%)"
252,B09J8ZMRM8,Donda Brother's Microfibre & Polyster Ultra Soft Blue Deep Bed Pillow Sets ( 2 Piece ),Donda,0,0,0,319,0,0,20,"Sunday, February 13",0,"₹319
₹399 Save ₹80 (20%)"
253,B07Q3XBPKF,"The White Willow Infant Baby Pillow for Preventing Head for Flat Head Syndrome Ideal for 0-12 Age with Removable Organic Bamboo Cover -( 9.8"" L X 7.5"" W X 1"" H) White",The,0,0,0,705,3.9,"2,038",46,"Sunday, February 13",1,"2,038"
254,B09GXFW5JV,"SOWKOS Luxury Hotel Quality Soft Bed Pillow, Microfiber Pillow, 16 inch X 24 inch ( White, Pack of 4 )",SOWKOS,0,0,0,549,0,0,61,"Sunday, February 13",0,"₹549
₹1,399 Save ₹850 (61%)"
255,B08LBK72Y5,Amazon Brand - Umi Microfiber Pillow Insert/Filler 17 Inches by 27 Inches - White (Pack of 2),Amazon,0,0,0,699,4.0,227,65,"Tuesday, February 15",1,227
256,B099NK7GQM,WELIV Homes Cotton Printed Pillow Filling Rotary Print Grey ( *12*20 Inches ) Pack of 1,WELIV,0,0,0,349,0,0,30,"Saturday, February 12",0,"₹349
₹499 Save ₹150 (30%)"
257,B07WSPQ7CR,"Proliva Contour Memory Foam Pillow, Adjustable Pillow for Seelping, Ergonomic Cervical Pillows Neck Pain, Support Back, Anti-Allergy, Pain Relief, Bed with Cover (White)",Proliva,0,0,0,899,3.8,116,55,"Tuesday, February 15",0,116
258,B08B3ZS3WZ,"The White Willow Cervical Orthopedic Memory Foam Cooling Gel Regular Size Contour Neck Support Sleeping Bed Pillow with Removable Zip Cover (20"" L x 13"" W x 4"" H) - Multi",The,0,0,0,"1,099",4.0,"1,170",68,"Sunday, February 13",1,"1,170"
259,B07R69FPKG,"Royal Trend Fiber Cotton Single Excellent Comfort and Durable Standard Microfibre Pillow (17x27 inch, White)",Royal,0,0,0,499,0,0,62,"Tuesday, February 15",1,"₹499
₹1,299 Save ₹800 (62%)"
260,B0865KY8KB,"MY ARMOR Orthopedic Memory Foam Pillow for Comfortable Sleep, Couple Pack (King & Queen)",MY,1,1,0,"2,250",4.1,"11,264",45,"Thursday, February 10",1,"11,264"
261,B09PMMY3S1,Cloth Fusion Microfiber Bed Pillow Set of 2 Pieces (17x27 Inches) (Magenta & Grey),Cloth,1,0,0,649,3.9,9,35,"Sunday, February 13",1,9
262,B07F76KMS9,"Hush Standard Pillow | Softex Fiber Filling | Medium Soft Feel The Zero Headache Polyester Bed Pillow, (Beige, 16 x 24 x 7.25 Inch)",Hush,1,0,0,550,3.9,185,21,"Monday, February 14",1,185
263,B096YDPSFG,"Homerz Premium Set of 2 Hotel Quality Super King Size Pillow, 20 x 30 Inch Exact Size, Superior White Cotton Polyester Fabric (2)",Homerz,1,0,0,899,3.8,139,50,"Tuesday, February 15",1,139
264,B07XC36HH4,"PumPum 1 Piece Textrise Black Microfiber Pillow , 16 x24 inch (White) (85632)",PumPum,0,0,0,149,3.4,714,70,"Saturday, February 12",0,714
265,B097YXYP97,"Perfect Sleeper Microfiber Breathable Full Body Insert, Soft Large Long Bed Pillow (18 x 54 inch, White, King size)",Perfect,0,0,0,579,5.0,1,66,"Tuesday, February 15",0,1
266,B08KCNY52L,"HOMIBOSS Bombay Dyeing Luxuries Quality Microfiber Pillow Set Insert Satin Fabric (White, 17 x 27 inches) -Pack of 2 Pieces",HOMIBOSS,0,0,0,749,4.2,12,66,"Wednesday, February 16",1,12
267,B07RXZ55X8,Everwey Enterprise Medium Hard Cotton Printed Pillows Set of 2/2 Pillows (Size 17 x 27 inches) Multicolour,Everwey,0,0,0,649,4.2,74,48,"Monday, February 14",1,74
268,B09R7VBJVP,"kamla Enterprises Ultra Soft Microfibre Floral Printed Bed Pillow Sets (Black Cotton, Pack of 1, Size- 40x 60Cm)",kamla,0,0,0,199,0,0,43,"Sunday, February 13",0,"₹199
₹350 Save ₹151 (43%)"
269,B0851LG12R,"flo Extra Soft Adjustable Polyester Microfibre Pillow for Stomach and Back Sleepers Aloe Vera Gel Washable Cover (White, 17"" x 27"")",flo,0,0,0,890,4.0,101,10,"Monday, February 14",1,101
270,B07W6RV6TH,METRON- Medium Soft Handy Multi Purpose Pregnancy Pillow for Women Helps in Sitting Sleeping Back Pain Relief & Leg Spacer,METRON-,0,0,0,995,0,0,41,"Monday, February 14",1,"₹995
₹1,687 Save ₹692 (41%)"
271,B09R3X8V8C,"MY ARMOR Orthopedic Memory Foam Pillow for Comfortable Sleep ,Thin Pillow (24"" x 16"" x 1.5"") (Inner Cover Only, Ultra Thin Pillow)",MY,0,0,0,"1,290",0,0,41,"Wednesday, February 16",1,"₹1,290
₹2,199 Save ₹909 (41%)"
272,B09NDSBTW5,Casa Haus YYY Collection- 5 Pack Pillows Fillers/Inserts (16 x 24 inches) - White,Casa,0,0,0,999,4.9,17,33,"Wednesday, February 16",1,17
273,B01MZ5TZIS,"Sleepwell Microfiber Pillow (White, L) - Pack of 2",Sleepwell,0,0,0,860,3.6,30,14,"Thursday, February 17",0,30
274,B09PBVZLVY,"Bien Living Extra Soft Microfiber Filled Plush Pillow, Down Alternative Hypoallergenic Pillow, 17 x 27 Inches, White (Pack of 2)",Bien,0,0,0,"1,199",0,0,37,"Sunday, February 13",1,"₹1,199
₹1,899 Save ₹700 (37%)"
