,asin,title,brand,Sponsored,Best Seller,Amazon's Choice,Price,Rating,NoofRatings,Discount,Delivery,Prime Delivery,base
0,B07L6GZYDV,"Wakefit Hollow Fibre Pillow ( 68.58 cm X 40.64 cm, White and Grey )- 2 Pieces",Wakefit,1,1,0,719,4.4,"35,912",26,"Friday, February 18",1,"35,912"
1,B08T65ZNDV,"Wakefit Hollow Fibre Pillow (White and Grey, 68.58 cm X 40.64 cm) - 4 Pieces",Wakefit,1,0,0,"1,349",4.5,"5,537",12,"Friday, February 18",1,"5,537"
2,B09L8H4MCC,"Sleepsia Microfiber Bed Pillow for Sleeping - Down Alternative Ultrasoft Cotton Washable Pillow with Satin Gusset- Queen (Blue, Pack of 1)",Sleepsia,1,0,0,"1,299",4.4,67,78,"Wednesday, February 16",1,67
3,B0847LWLKF,"The White Willow Memory Foam Cooling Gel Orthopedic Bed Pillow for Sleeping & Neck Pain Relief Suitable for Back Sleeper, Side Sleeper & Stomach Sleeper with Pillow Cover (22"" L x 15"" W x 4"" H,Multi)",The,1,0,0,"1,139",3.9,"4,676",58,"Monday, February 14",1,"4,676"
4,B07L6GZYDV,"Wakefit Hollow Fibre Pillow ( 68.58 cm X 40.64 cm, White and Grey )- 2 Pieces",Wakefit,0,1,0,719,4.4,"35,912",26,"Friday, February 18",1,"35,912"
5,B016D7UJMW,"Recron Certified Dream Fibre Pillow (16""x24"")",Recron,0,0,0,399,4.0,"28,739",51,"Monday, February 14",0,"28,739"
6,B08T65ZNDV,"Wakefit Hollow Fibre Pillow (White and Grey, 68.58 cm X 40.64 cm) - 4 Pieces",Wakefit,0,0,0,"1,349",4.5,"5,537",12,"Friday, February 18",1,"5,537"
7,B07XLLG72F,"Kuber Industries Luxurious 1 Piece Microfibre Pillow Filler - 16X24 Inch , White - Ctktc22178",Kuber,0,0,0,169,3.4,"3,849",32,"Monday, February 14",0,"3,849"
8,B08VNHK9TG,JY Satin Stripes Reliance Microfiber Pillows in White Color Set of 4 Pic(16''× 26''),JY,0,0,0,649,4.0,67,35,,1,67
9,B09QJRSRV9,"Anju Enterprises Microfiber Blue Star Printed Pillow Sets (Black Cotton,Set of 4,16 x 24 inch )",Anju,0,0,0,399,0,0,69,"Wednesday, February 16",1,"₹399
99
₹1,299 Save ₹899.01 (69%)"
10,B09HBDY3TT,"RYLAN Cervical Contour Memory Foam Pillow,Orthopedic Pillow for Neck Pain,Orthopedic Contour Pillow Support for Back,Stomach,Side Sleepers,Anti-Snoring Neck Pillow (pillow-2022)",RYLAN,0,0,0,899,4.2,602,25,"Wednesday, February 16",1,602
11,B081NZXYXW,"Amazon Brand - Solimo Microfibre & polyester 2-Piece Premium Bed Pillow Set, Microfibre, Brown, 43 X 69 X 17 Cm",Amazon,0,0,0,749,4.1,"5,010",45,"Thursday, February 17",1,"5,010"
12,B09C3S5JW8,Sleeping Pillow - Micro Fiber Filled Dark Grey Plain Cotton Pillow Takiya Combo Set of 2 for Bed Room - 17x27 Inch Size Pillow Set of 2 for Sleeping,Sleeping,0,0,0,599,4.3,124,50,"Thursday, February 17",1,124
13,B09829QP99,Takiyawala 100% Cotton Filling Natural Orthopedic Pillow with 100% Cotton - Hand Embroidery Cotton Fabric Sleeping Pillow | White | 16 x 25 inches (41X62.5 cm | Pack of 3,Takiyawala,0,0,0,698,4.2,247,53,"Wednesday, February 16",1,247
14,B09K34ZBBQ,"THE WOOD WHITE Ultra-Soft Premium Microfiber Pillows Set of 4 | 18""x28"" Inches Large Size of Luxurious Quality Softness Pillow for Home ( Pure White )",THE,0,0,0,999,4.3,71,74,"Wednesday, February 16",1,71
15,B075R5Q1CH,JDX Premium Hotel Quality Hollow Fiber Pillow Set of 2-16x24,JDX,0,0,0,299,3.8,"1,291",88,"Thursday, February 17",0,"1,291"
16,B09BLD4NFC,JY Soft Uniformly Microfiber Filled Pillow 26'' x 16'' 'Color-White (Pack of 4),JY,0,0,0,649,3.9,158,35,,1,158
17,B08HD8C2QC,DClub Memory Foam Cervical Contour Medical Pillow for Sleeping Orthopedic Pillows for Neck Back Pain Relief (White),DClub,0,0,0,548,3.5,145,71,"Wednesday, February 16",1,145
18,B075QK83BJ,"JDX Premium Hotel Quality Soft Polyester Blend Fiber Pillow, White -Set of 2 Size 16x24 Inches",JDX,0,0,0,449,3.8,"1,395",55,"Thursday, February 17",0,"1,395"
19,B09QJRFZ2N,"Shree GANPAT Enterprises Ultra Soft White Fibre Pillow Sets for Bed (White-Set of 6, Size- 60*40 Inch)",Shree,0,0,0,0,2.5,3,0,,0,3
20,B083FK4HWF,"MY ARMOR Orthopedic Memory Foam Pillow for Comfortable Sleep, Queen Size (23"" x 14"" x 4.5"")",MY,1,1,0,"1,150",4.1,"11,338",42,"Monday, February 14",1,"11,338"
21,B09NDSBTW5,Casa Haus YYY Collection- 5 Pack Pillows Fillers/Inserts (16 x 24 inches) - White,Casa,1,0,0,999,4.9,18,33,"Saturday, February 19",1,18
22,B09PMJV4BM,Cloth Fusion Microfiber Bed Pillow Set of 2 Pieces (17x27 Inches) (Maroon & Navy),Cloth,1,0,0,629,3.8,14,37,"Friday, February 18",1,14
23,B09RJ7FLPT,"Sofrest Microfiber Cloud Pillow for Sleeping, Bombay Dyeing Luxury Hotel Collections Microfiber Soft Pillow Set of 2, 27 X 17 Inch (Pack of 2)",Sofrest,1,0,0,"2,199",4.0,62,27,"Thursday, February 17",1,62
24,B09GS5KJ1N,"Cloth Fusion Microfiber Bed Pillow Set of 2 Pieces (17x27 Inches, Teal and Grey)",Cloth,0,0,0,629,3.8,14,37,"Thursday, February 17",1,14
25,B09QLFKWNP,Larrito Memory Foam Cervical Contour Medical Pillow for Sleeping Orthopedic Pillows for Neck Back Shoulder Support Pain Relief cusion Soft Firm Pillow (Off White) (Pillow-1),Larrito,0,0,0,699,4.6,34,42,"Thursday, February 17",1,34
26,B08KQHYRFG,Livpure Smart Cloud Microfiber Extra Soft Pillow with Standard Size 27 X 18 Inch - White ( Pack of 1 ),Livpure,0,0,0,599,3.9,424,69,"Monday, February 14",1,424
27,B089K2Y25G,"JDX 200 TC Polyester Fibre Solid Sleeping Pillow (Set of 2, White)…",JDX,0,0,0,299,3.9,236,70,"Thursday, February 17",0,236
28,B08TJ18JK5,"Wakewell Soft Fibre Pillow for Bed, 61 x 41 cm, White, Pack of 2 Pillows",Wakewell,0,0,0,459,3.6,"1,584",58,"Thursday, February 17",0,"1,584"
29,B091TTRV47,"takiyawala Microfiber Bed Pillow Bolster, 12 x 30 inch, White, Set of 2",takiyawala,0,0,0,599,4.1,124,60,"Wednesday, February 16",0,124
30,B08CMJG8Q5,Fabroyal India 5 Star Hotel Cotton Pillow Filler with Fibre for Well Night's Sleep in White Colour for Home & Hotel (Pack of 2 Pillow),Fabroyal,0,0,0,0,2.9,3,0,,0,3
31,B08Q441VS3,"takiyawala ® 300TC Poly-Cotton Breathable Fabric with Down Alternative Fiber Filled Pillow for Sleeping (King Size - 16"" x 26"" x4"" ) -Pack of 2, White",takiyawala,0,0,0,699,3.9,204,64,"Wednesday, February 16",1,204
32,B09B67RX4W,"JY Hollow Microfibre Standard Luxury Bed Pillow for Sleeping (16x26 Inches, White) -Set of 3",JY,0,0,0,449,3.8,152,44,,0,152
33,B09GVLPH85,"AARVI Soft Memory Foam Pillow,Cervical Pillow for Neck Pain,Orthopedic Contour Pillow Support for Back,Stomach,Side Sleepers,Anti-Snoring Relief Neck Pillow,Anti-Allergy,Pillow for Pain Relief",AARVI,0,0,0,649,3.9,56,35,"Thursday, February 17",0,56
34,B09NNLB7H3,RK TRADERS Microfibre & Polyster Ultra Soft Blue Stripes Bed Pillow Sets ( 4 Piece ),RK,0,0,0,0,3.6,22,0,,0,22
35,B09PRGW7YX,Youngsters Choice Presents Microfiber & Polyster Ultra Soft Blue Line Pillow for Home (Set of 6),Youngsters,0,0,0,699,2.5,2,65,"Wednesday, February 16",1,2
36,B09KH9NFY2,"JY Standard Fresh Microfiber Super Soft Bed Pillow for Sleeping Set of 3 Size - 16 "" X 26 """,JY,0,0,0,449,3.8,31,55,,0,31
37,B09NVXVQQS,Trova Fashion Store Cotton Filled with Microfibre & Polyster Ultra Soft Blue Star Printed Bed Pillow Sets ( Pack of 4 ),Trova,0,0,0,415,4.0,1,54,"Wednesday, February 16",1,1
38,B09RJ53T56,"M/S Kusum & Cheshta Enterprises Ultra Soft Microfibre Blue Lining Bed Pillow Sets (Pack of 6, Size- 40x60CM)",M/S,0,0,0,529,0,0,24,"Wednesday, February 16",0,"₹529
₹699 Save ₹170 (24%)"
39,B09R9W6C13,"THE WOOD WHITE Microfiber Pillow Set of 1|Extra Soft Luxurious Quality Softness Pillows Size 16""x24"" Inches (1 Piece of White Pillow).",THE,0,0,0,299,5.0,3,70,"Wednesday, February 16",1,3
40,B099PQ87JB,neetutraders Cotton Blue Star Printed Sleeping Pillow Pack of 4,neetutraders,0,0,0,699,5.0,1,53,"Wednesday, February 16",1,1
41,B09P5HQ3X1,"Wakewell Pillow for Bed, Soft Pillow for Sleeping | 61 cm x 41 cm - 1 Cotton Pillow",Wakewell,0,0,0,299,3.3,15,41,"Thursday, February 17",0,15
42,B09RKH33Q5,"Sleepsia Supersoft Kids Pillows - 12"" X 18"" Breathable Bamboo Pillows for Sleeping - Ultra Supportive Microfiber Premium Fill Toddler Pillows, White",Sleepsia,0,0,0,499,5.0,2,75,"Wednesday, February 16",1,2
43,B0847LWLKF,"The White Willow Memory Foam Cooling Gel Orthopedic Bed Pillow for Sleeping & Neck Pain Relief Suitable for Back Sleeper, Side Sleeper & Stomach Sleeper with Pillow Cover (22"" L x 15"" W x 4"" H,Multi)",The,0,0,0,"1,139",3.9,"4,676",58,"Monday, February 14",1,"4,676"
44,B08L3CMFS9,"JY Reliance Microfiber with Sateen Strip Fiber Filled 2 Piece Pillow Set - 16"" x 27 , Antique White",JY,0,0,0,349,3.5,68,56,"Friday, February 18",0,68
45,B09QJSJGPQ,"Anju Enterprises Ultra Soft Whitefibre Floral Printed Bed Pillow Sets (White Cotton,Pack of 2, Size- 40 x 60 cm )",Anju,0,0,0,245,2.7,3,39,"Wednesday, February 16",0,3
46,B09N9SPNPQ,"Fairy Down Hollow Fibre Pillow, Soft Pillow for Sleeping, Pillows Set 2 ( 40 X 60 cm)",Fairy,0,0,0,449,3.8,14,78,"Friday, February 18",1,14
47,B098JLVMPQ,"Milford Orthopedic Memory Foam Pillow for Comfortable Sleep,Standard Size Neck & Back Support Sleeping Pillow",Milford,0,0,0,599,3.9,751,50,"Wednesday, February 16",0,751
48,B08ZS81CXJ,"Hush Slim Pillow (16 x 24 x 6 Inch) I Imported Softex Filling I Anti-Sag Technology I Medium Soft Feel, Cotton, White",Hush,0,0,0,481,4.5,10,36,"Wednesday, February 16",0,10
49,B09RH2M733,"Woomzy Orthopedic Memory Foam Pillow for Comfortable Sleep Bed Pillow for Sleeping & Neck Pain Relief Suitable for Back Sleeper, Side Sleeper & Stomach Sleeper Ergonomic Cervical Pillows (Pack of 1)",Woomzy,0,0,0,999,4.9,34,80,,1,34
50,B00IJRV3AC,"Recron Certified Joy Fibre Pillow - 41 cm x 61 cm, Pack of 2, White",Recron,0,0,0,709,4.0,"1,155",0,"Monday, February 14",1,"1,155"
51,B07F5KZC2X,"Sleepwell Synthetic Pillow, Single, White, 2 Pieces",Sleepwell,0,0,0,719,3.7,369,37,"Saturday, February 19",0,369
52,B09NY1Y8GV,Cloth Fusion Microfiber Bed Pillow Set of 2 Pieces (17x27 Inches),Cloth,0,0,0,629,3.8,14,37,"Friday, February 18",1,14
53,B083FK4HWF,"MY ARMOR Orthopedic Memory Foam Pillow for Comfortable Sleep, Queen Size (23"" x 14"" x 4.5"")",MY,0,1,0,"1,150",4.1,"11,338",42,"Monday, February 14",1,"11,338"
54,B097H8RR2B,"The White Willow Cooling Gel Memory Foam Orthopedic Bed Pillow for Sleeping & Neck Pain Relief for Back Sleeper, Side Sleeper & Stomach Sleeper with Pillow Cover - Pack of 2 (22""L x 15""W x 4""H) Multi",The,0,0,0,"1,999",4.0,676,63,"Saturday, February 19",0,676
55,B09RSWMHP6,"Cozy Feel Cotton Microfiber Blue Star Printed Sleeping Pillow Sets (Blue ,Size-16 x 24 inch, Pack of 4)",Cozy,0,0,0,449,0,0,10,"Wednesday, February 16",0,"₹449
₹499 Save ₹50 (10%)"
56,B09CMC8X96,"Homerz Aloe Vera Cloud Pillow Filled with 3D conjugated Microfiber, White, 17 x 27 inch Set of 2",Homerz,1,0,0,849,4.6,11,56,"Friday, February 18",1,11
57,B0166F5ZX4,"Spread Spain® Doctor Plus Pillow for Cervical/ Contoured Neck Memory Foam Pillow, Pillow for Neck Pain and Shoulder Pain(45 x 68 cm, White, Pack of 1 )",Spread,1,0,0,"3,595",3.8,25,14,"Wednesday, February 16",1,25
58,B081NZXYXW,"Amazon Brand - Solimo Microfibre & polyester 2-Piece Premium Bed Pillow Set, Microfibre, Brown, 43 X 69 X 17 Cm",Amazon,1,0,0,749,4.1,"5,010",45,"Thursday, February 17",1,"5,010"
59,B08PYQ22WP,"The Sleep Company SmartGRID Premium Hybrid Pillow, The Ultimate Pillow Ever Designed by Science, No Pressure Support, Cotton, White (24x16 Inches) (66x40 cm) - Pack of 1",The,1,0,0,"2,499",4.0,255,0,"Wednesday, February 16",1,255
60,B08CSLJMM4,"MY ARMOR Orthopedic Memory Foam Pillow for Comfortable Sleep (Thin Pillow) (24.5"" x 15.5"" x 3.5"")",MY,1,1,0,"1,250",4.1,"11,338",43,"Monday, February 14",1,"11,338"
61,B09NY1Y8GV,Cloth Fusion Microfiber Bed Pillow Set of 2 Pieces (17x27 Inches),Cloth,1,0,0,629,3.8,14,37,"Friday, February 18",1,14
62,B09LMDLN3N,"Sleepsia Microfiber Bed Pillow for Sleeping - Down Alternative Ultrasoft Cotton Washable Pillow with Satin Gusset- Queen (Blue, Pack of 2)",Sleepsia,1,0,0,"2,250",4.4,67,44,"Wednesday, February 16",1,67
63,B097DXNFF6,"MY ARMOR Micro Fibre Pillows , 26"" x 17"" , White and Grey , 2 Pieces",MY,1,0,0,990,4.3,290,34,"Saturday, February 26",1,290
64,B0993CV5Z2,"D S Pillow Sleepping Microfiber Size 17x27 inch White Sleeping Pillows, , Set of 6",D,0,0,0,0,2.8,9,0,,0,9
65,B09828Z3P9,Takiyawala Cotton Pillow with Fresh White cotton16 x 25 Inch Pack of 3,Takiyawala,0,0,1,639,4.0,68,64,"Wednesday, February 16",1,68
66,B08ZLYR5Z3,"REMCART Microfiber Sleeping Pillow, 40 cm X 60 cm, White (Pack of 1PC)",REMCART,0,0,0,189,2.7,18,68,"Wednesday, February 16",0,18
67,B08TK2R3NP,"Amazon Brand - Solimo Premium Microfiber Bed Pillow Set (Blue and White, 43 x 69 cm , Standard) - 2 Piece",Amazon,0,0,0,749,4.1,478,38,"Thursday, February 17",1,478
68,B0813B53YD,EMBROCO Home Decor Sleeping Bed Pillow Set of 4-45x61,EMBROCO,0,0,0,999,5.0,2,50,"Wednesday, February 16",1,2
69,B08Y6N7FGP,"ATOOTFUSION 100% Cotton Fabric Black Hosiery Medium Hard Cotton Bed Pillow for Real Perfect Neck Support (16"" x 26"") Set of 02 Checkered Multicolour",ATOOTFUSION,0,0,0,349,3.9,470,65,"Wednesday, February 16",0,470
70,B08LGVS26D,"Samrat Microfiber Bolster, Standard, White, Set Of 2 Pcs",Samrat,0,0,0,379,4.1,264,78,"Saturday, February 19",0,264
71,B09CT3V4LJ,"H B MSALA Luxury Full Body Pillow Insert - Ultra Soft Body Pillow for Sleeping - Breathable Long Bed Pillow Insert, 20""x54""(Navy Blue)",H,0,0,0,499,0,0,75,"Wednesday, February 16",0,"₹499
99
₹1,999 Save ₹1,499.01 (75%)"
72,B097H8RR2B,"The White Willow Cooling Gel Memory Foam Orthopedic Bed Pillow for Sleeping & Neck Pain Relief for Back Sleeper, Side Sleeper & Stomach Sleeper with Pillow Cover - Pack of 2 (22""L x 15""W x 4""H) Multi",The,0,0,0,"1,999",4.0,676,63,"Saturday, February 19",0,676
73,B09NVW78J6,Trova Fashion Store Cotton Filled with Microfibre & Polyster Ultra Soft Floral Printed Bed Pillow Sets ( Pack of 6 ),Trova,0,0,0,0,3.7,5,0,,0,5
74,B09RK3G1J2,"M/S Kusum & Cheshta Enterprises Ultra Soft Microfibre Blue Jhalar Print Pillow Sets (Size-16 x 24 inch, Pack of 6)",M/S,0,0,0,529,0,0,24,"Wednesday, February 16",0,"₹529
₹699 Save ₹170 (24%)"
75,B07VNT4D81,Tishnagi Designer Ultra Soft Body Pillow Long Side Sleeper Pillows for Use During Pregnancy - 100% Cotton Soft White Stripes Cover Shell with Soft Polyester Filling (Single Pack),Tishnagi,0,0,0,749,4.5,"2,825",66,"Wednesday, February 16",1,"2,825"
76,B09LMHPTWJ,JY Reliance Microfiber Feeling Satin Stripe White Fabric Bed Pillow for Sleeping (Pack of 2) ( 16'' X 26'' ),JY,0,0,0,349,3.5,14,42,"Friday, February 18",0,14
77,B09NM68BYV,"Sumegha Creations Takiya Pillow for Home Microfiber Comfort Pillow Microfiber Pillows for Sleeping Microfiber Pillow Medium Soft Vacuum Packed Pillows (16x24 Inch, White) (5)",Sumegha,0,0,0,0,2.0,2,0,,0,2
78,B08S7KTTNN,Takiyawala Cotton Fabric with Grey Poly-Cotton Filling Medium Soft Sleeping Pillow for Bed 16 x 25 Inch Pack of 3,Takiyawala,0,0,0,599,4.1,907,40,"Wednesday, February 16",0,907
79,B09GYH2WTJ,"Sleepyhead Hollow Fibre Pillow (Slate Grey & Orange, 26x16 inches) -Set of 2",Sleepyhead,0,0,0,999,4.6,17,23,"Friday, February 18",1,17
80,B096RWZKMC,"SleepyCat Air Gel Memory Foam Pillow for Sleeping and Neck Support with Removable Zipper Cover (White, 28x18 inches) 2-Piece",SleepyCat,1,0,0,"3,891",4.1,"1,036",22,"Friday, February 18",1,"1,036"
81,B08K94WBJG,"Urban Basics Microfiber Pillow, 16x24 Inch, White, Set of 6",Urban,1,0,0,"1,799",3.8,722,40,"Wednesday, February 16",1,722
82,B097H8RR2B,"The White Willow Cooling Gel Memory Foam Orthopedic Bed Pillow for Sleeping & Neck Pain Relief for Back Sleeper, Side Sleeper & Stomach Sleeper with Pillow Cover - Pack of 2 (22""L x 15""W x 4""H) Multi",The,1,0,0,"1,999",4.0,676,63,"Saturday, February 19",0,676
83,B08BK1C4Q9,"Urban Basics Ultra Soft Microfibre Pillow, 17""x27"" Inch, White, Set of 4(PIL01_4), polyester",Urban,1,0,0,"1,399",4.1,"2,326",30,"Wednesday, February 16",1,"2,326"
84,B083BWFZHP,"PumPum Microfiber Pillow Set, 16x24 inch, White, 1 Piece, Pack of 1",PumPum,0,0,0,139,3.5,253,44,"Wednesday, February 16",0,253
85,B09FSZHGW3,HFI Urban Arts Striped Fabric Luxury Premium Pillows - Pack of 2 Pcs| 16 x 24 Inches| White | Conjugated Virgin Fiber Filling | Hotel Quality Linen,HFI,0,0,0,625,4.5,58,50,"Thursday, February 17",1,58
86,B00IJRV32U,"Recron Certified Joy Fibre Pillow - 41 cm x 61 cm, White",Recron,0,0,0,379,3.9,"1,175",0,"Monday, February 14",0,"1,175"
87,B00IJRV2D0,"Recron Certified Bliss Fibre Pillow - 43 cm x 69 cm, White",Recron,0,0,0,520,4.1,"4,056",26,"Monday, February 21",0,"4,056"
88,B094QYCMC1,"JY Hotel Collection Bed Pillows for Sleeping - Queen Size, Set of 2 - Soft Allergy Friendly, Cooling, Luxury Gel Pillow for Back, Stomach or Side Sleepers in Cotton Multi Check Size 16*27 inch",JY,0,0,0,369,3.6,120,38,"Monday, February 21",0,120
89,B09BL8C1QV,"JY Reliance Microfiber Feeling Satin Stripe Fabric Bed Pillow for Sleeping ( 16'' X 26'' , White line , Set of 2 )",JY,0,0,0,299,3.7,119,57,,0,119
90,B09439BCSH,HOMIBOSS Bombay Dyeing Cotton Bed Pillow for Sleeping White Size 60 x 40 cm Set of 1 Pcs,HOMIBOSS,0,0,0,329,4.0,38,54,"Sunday, February 20",1,38
91,B098JSRZK8,Solid Polyester Fiber Pillow F3 Best for Heavenly Sleep White Pack of 3,Solid,0,0,0,0,3.4,7,0,,0,7
92,B097KHPMF9,"ROYALREOX Alternative Fiber Pillow - Hotel Quality White Microfiber pilow 4 Piece - 16x24 Inch (White, Single Pillow )",ROYALREOX,0,0,0,549,2.2,4,63,"Thursday, February 17",0,4
93,B08JVP6QCX,"Fun Homes Microfibre Pillow Filler (16x24 inch, White)",Fun,0,0,0,249,3.4,540,38,"Wednesday, February 16",0,540
94,B09MLZWDB5,"takiyawala Microfiber Quilted Pillow for Sleeping, 17x27 inch, White, Pack of 2",takiyawala,0,0,0,699,4.8,9,46,"Wednesday, February 16",1,9
95,B07Q3XBPKF,"The White Willow Infant Baby Pillow for Preventing Head for Flat Head Syndrome Ideal for 0-12 Age with Removable Organic Bamboo Cover -( 9.8"" L X 7.5"" W X 1"" H) White",The,0,0,0,708,3.9,"2,048",45,"Wednesday, February 16",1,"2,048"
96,B09R9Z4Q3V,B C Comforts Stripes Reliance Microfiber Pillows Set of 2 Pic (16''X 26''),B,0,0,0,249,0,0,58,"Wednesday, February 16",0,"₹249
₹599 Save ₹350 (58%)"
97,B01L94IXXG,"Amazon Brand - Solimo Ultra Soft Microfibre Bed Pillow Set (Standard, 43 x 69 cm, White) -2 Piece",Amazon,0,0,0,749,4.0,"3,412",25,"Monday, February 14",1,"3,412"
98,B094G3RYRF,"Great Samrat Microfiber Pillow Pack of 4 (White, Standard Size)",Great,0,0,0,0,3.5,33,0,,0,33
99,B09RFKK6JN,"SIAN FABRICS Hollow Fiber Pillow, Soft Pillow for Sleeping, Pillows Set 2 ( 40 X 60 cm)",SIAN,0,0,0,449,0,0,78,"Friday, February 18",0,"₹449
₹1,999 Save ₹1,550 (78%)"
100,B09JKFB92K,"Lefre Best Sleep Microfiber Cotton 5 Star Hotel Pillow Extra Large King Size 16""*24 (40cm*60cm), White , Set of 4.",,0,0,0,0,0,0,0,,0,
101,B088NYHTY1,"ATOOTFUSION 100% Recyclable Dust free Black Hosiery Firm Medium Hard Cotton Pillow for real perfect neck support (16"" x 26"") Firm Medium Hard Pillow Checkered Multicolored Pack of 02",ATOOTFUSION,0,0,0,349,3.8,409,76,"Wednesday, February 16",0,409
102,B0972RXQG9,"Sleeprest Ultra Soft Luxury Quilted Pillow Sleeping Pillow for Home Bed Fiber Filled - Organic Cotton Fabric with Premium Microfiber Filling - 17x27 Inches, White",Sleeprest,0,0,0,599,3.7,8,63,"Wednesday, February 16",1,8
103,B09C1Z5HZB,"Zoliva Memory Foam Cervical Contour Pillow for Neck Pain and Spondylitis, Back Support, Side Sleepers (1)",Zoliva,0,0,0,899,3.9,121,55,"Thursday, February 17",0,121
104,B09NLZWB9Z,Krishna Sales & Marketing AGENCY's Microfibre & Polyster Ultra Soft Rose Printed Bed Pillow Sets ( 4 Piece ),Krishna,0,0,0,469,4.0,1,57,"Wednesday, February 16",0,1
105,B09KH7PJ6W,"JY Queen Pillows for Sleeping Bed Pillows Hotel Quality , Soft Down Alternative Pillows , Hypoallergenic Pillow for Side and Back Sleeper Set of 2 , Size - 16 X 26 , ( White )",JY,0,0,0,349,3.2,13,42,,0,13
106,B08BWL3M1J,"Kanha Polyester Fiber Bolster And Cushion, 10 x 25 inch, 16 x 16 inch, White",Kanha,0,0,0,724,3.2,"1,155",60,"Thursday, February 17",1,"1,155"
107,B00QLOMIO0,Kurlon pillow Kalpana Economy-White Colour,Kurlon,0,0,0,310,3.4,78,13,"Tuesday, February 15",0,78
108,B08VDGWCRT,JY Premium Polyester Quilted Filled Reliance High Density Micro Fiber Super Soft Sleeping Pillows - 16x26 Inch - Set of 4 (White and Sky Blue),JY,0,0,0,599,3.8,391,40,,1,391
109,B09MC81WW7,"Homerz Premium Set of 2 Organic Cotton Kapas Filled Pillow with Firm Medium Hardness, 16 x 24 Size, 700 gm Pillow",Homerz,0,0,0,749,3.3,5,25,"Friday, February 18",1,5
110,B09HHT53PL,"JY Hotel Collection Cotton Buffalo Check Soft Allergy Friendly, Cooling, Luxury Gel Pillow for Sleeping - Queen Size, Set of 2 - 16x26 inch, White",JY,0,0,0,349,3.8,13,42,,0,13
111,B099RNRQPZ,Great Samrat Microfiber Sleeping Back Adjustable Hotel Quality Pillow Size 17x27 White Pack of 2,Great,0,0,0,499,4.1,7,44,"Wednesday, February 16",0,7
112,B01H089NHA,"Sleepwell Memory Foam Pillow, 24 x 16, Multicolour, 2 Pieces",Sleepwell,0,0,0,810,3.6,215,19,"Monday, February 21",0,215
113,B08Z4946W2,"INDIYANO Standard Size Microfiber Pillows for Bed, 100% Breathable Cotton Sleeping Pillows, Set of 1 Great for Side and Back Support Pillow",INDIYANO,0,0,0,355,4.1,42,41,"Wednesday, February 16",0,42
114,B09BTSMKS2,Solid Polyester Fiber Pillow AA1 Best for Heavenly Sleep White Pack of 1,Solid,0,0,0,229,3.1,28,62,"Wednesday, February 16",1,28
115,B09R7W28D4,"kamla Enterprises Ultra Soft Microfibre Floral Printed Bed Pillow Sets (Black Cotton, Pack of 2, Size- 40x 60Cm)",kamla,0,0,0,299,0,0,40,"Wednesday, February 16",0,"₹299
₹500 Save ₹201 (40%)"
116,B09CMVW897,"Homerz Nirvana Pillow Filled with 3D Conjugated Fiber, 17 x 27 inch Exact Size, Cotton Fabric, White -Set of 2",Homerz,1,0,0,749,3.9,114,53,"Friday, February 18",1,114
117,B08R7MX63N,"SleepyCat 2-Piece Microfiber Cloud Pillow with Adjustable Zipper (27x18 inches, White)",SleepyCat,1,0,0,"1,784",4.3,637,25,"Tuesday, February 15",1,637
118,B09C4YG8MG,Homerz Set of 2 Microfiber Snow White Cloud Pillow Filled with 3D conjugated Fiber (17 x 27 inch ),Homerz,1,0,0,848,3.7,108,35,"Friday, February 18",1,108
119,B09NH4FX1K,"Homerz Set of 2 Reversible Mesh Pillow, 17 x 27 inch",Homerz,1,0,0,999,0,0,50,"Friday, February 18",1,"₹999
₹1,999 Save ₹1,000 (50%)"
120,B08Q8HD919,"Morning Owl™ Latex Pillow - Medium Firm Pillow, eco-INSTITUT Certified 100% Natural Latex Pillow, Rubber Pillow, Best Pillow for Sleeping (60*40*12.5 cm), 1 Pillow",Morning,1,0,0,"1,995",4.0,36,39,"Thursday, February 24",1,36
121,B09NDRCGJZ,Casa Haus YYY Collection - Soft Pillows Fillers/Inserts - White (17X27 inch)- Pack of 5,Casa,1,0,0,"1,199",4.9,18,40,"Saturday, February 19",1,18
122,B096SZBLRM,"Homerz Microfiber Platinum Knitted King Size Pillow for Bed, Super Soft 250 GSM Knitted Fabric - 2 PC (Snow White, 17x27 Inch)",Homerz,1,0,0,849,3.9,69,53,"Friday, February 18",1,69
123,B07TZRGC53,"SleepX Noodle Foam and Fibre Pillow, White",SleepX,1,0,0,719,4.1,9,10,"Thursday, February 17",0,9
124,B08QJL5SFH,"The White Willow Memory Foam Infant Baby Pillow for Preventing Head for Flat Head Syndrome Ideal for 0-12 Age -( 9.8"" L X 7.5"" W X 1"" H) Blue",The,0,0,0,649,3.9,176,54,"Wednesday, February 16",1,176
125,B09BLWBK7S,"Habitat Bed Audrey Pillows for Sleeping 2 Pack Standard Size 17 x 27 Inches, Hypoallergenic Pillow for Side and Back Sleeper, Soft Hotel Pillows Set of 2, Microfiber Pillow-White",Habitat,0,0,0,499,3.5,3,66,"Thursday, February 17",0,3
126,B06X9W96FQ,"Portico New York Cotton White Single Sleep Z Pillow, Set of 1",Portico,0,0,0,549,4.0,61,0,"Wednesday, February 16",1,61
127,B09P1BJCZS,"Proliva Cervical Contour Memory Foam Pillow,Orthopedic Pillow for Neck Pain,Orthopedic Contour Pillow Support for Back,Stomach,Side Sleepers,Anti-Snoring Neck Pillow (Pack of 1)",Proliva,0,0,0,899,4.8,10,55,"Thursday, February 17",0,10
128,B099KH3TKV,Haus Alchemy Luxury Premium Pillows Ultrasoft 100% Virgin Microfiber Filling with 100% Terry Cotton Pillow Cover King Size Hotel Pillows 1Pc (L-69cm x B-40cm)(L-27 x B-16 in) White,Haus,0,0,0,429,3.9,24,64,"Thursday, February 17",0,24
129,B09RK8LRR3,"Karan Enterprises Ultra Soft Microfibre Printed Pillow Sets (Size-16 x 24 inch,Pack of 2)",Karan,0,0,0,299,0,0,77,"Wednesday, February 16",0,"₹299
99
₹1,299 Save ₹999.01 (77%)"
130,B088M7Q17V,"MUKESH HANDICRAFTS 100% Cotton & Soft Polyester Filler Large Size Body Pillow | Maternity Sleeper Pillows for Use During Pregnancy |Soft White Stripes Cover Shell | Pack of 1 - 20 x 54 Inch, White",MUKESH,0,0,0,599,3.6,10,63,"Wednesday, February 16",1,10
131,B08YNMPF2M,"REGIUS Premium Hotel Quality Hollow Microfibre Pillow (16x26 Inches, White) -Set of 2",REGIUS,0,0,0,459,3.4,12,54,"Thursday, February 17",1,12
132,B09MZJCM1T,"AK -Creation Ultra Soft Microfibre Bed Pillow Set (Standard, 40 x 60 cm, White) -Pack of 2",AK,0,0,0,279,2.2,4,44,"Wednesday, February 16",1,4
133,B09J8ZW8ND,Donda Brother's Microfibre & Polyster Ultra Soft Blue Stripes Bed Pillow Sets ( 1 Piece ),Donda,0,0,0,199,2.0,1,33,"Wednesday, February 16",0,1
134,B08R7MX63N,"SleepyCat 2-Piece Microfiber Cloud Pillow with Adjustable Zipper (27x18 inches, White)",SleepyCat,0,0,0,"1,784",4.3,637,25,"Tuesday, February 15",1,637
135,B09NVWT15T,Trova Fashion Store Cotton Filled with Microfibre & Polyster Ultra Soft Blue Star Printed Bed Pillow Sets ( Pack of 6 ),Trova,0,0,0,699,1.0,1,46,"Wednesday, February 16",1,1
136,B09M4R2JQV,Stylbase Cotton Fabric with Grey Poly-Cotton Filling Medium Soft Sleeping Pillow for Bed 16 x 25 Inch (Pack of 2),Stylbase,0,0,0,449,4.7,18,75,"Wednesday, February 16",0,18
137,B09NVXH7MS,Trova Fashion Store Microfibre & Polyster Ultra Soft Blue Stripes Bed Pillow Sets ( 4 Pillow ),Trova,0,0,0,499,4.5,2,44,"Wednesday, February 16",1,2
138,B09GMDNFYB,Zoliva Ergonomic Memory Foam Pillows for Neck Pain and Shoulder Pain Orthopedic Cervical (1),Zoliva,0,0,0,"1,099",5.0,6,45,"Thursday, February 17",0,6
139,B09LHY9SBN,"Premium Quilted Pillows Filled with Reliance High Density Micro Fiber Super Soft Sleeping Pillows 26"" X 16"" Set of 2 (Golden",Premium,0,0,0,348,3.6,10,42,,0,10
