,asin,title,brand,Sponsored,Best Seller,Amazon's Choice,Price,Rating,NoofRatings,Discount,Delivery,Prime Delivery,base
140,B083FKYLFG,"MY ARMOR Orthopedic Memory Foam Pillow for Comfortable Sleep, King Size (24"" x 15""x 5"")",MY,1,1,0,"1,250",4.1,"11,338",43,"Monday, February 14",1,"11,338"
141,B09PMMY3S1,Cloth Fusion Microfiber Bed Pillow Set of 2 Pieces (17x27 Inches) (Magenta & Grey),Cloth,1,0,0,629,3.8,14,37,"Friday, February 18",1,14
142,B09PJH12R8,"Homerz Body Pillow with Waterproof Pillow Protector Cover, 54 x 20 inch Size (Grey)",Homerz,1,0,0,999,0,0,50,"Friday, February 18",1,"₹999
₹1,999 Save ₹1,000 (50%)"
143,B08V5B923X,"SleepyCat 1-Piece Microfiber Cloud Pillow with Adjustable Zipper (32x20 inches, White)",SleepyCat,1,0,0,"1,225",4.3,637,18,"Tuesday, February 15",1,637
144,B09C4YG8MG,Homerz Set of 2 Microfiber Snow White Cloud Pillow Filled with 3D conjugated Fiber (17 x 27 inch ),Homerz,0,0,0,848,3.7,108,35,"Friday, February 18",1,108
145,B09RK85R2K,"Karan Enterprises Ultra Soft Microfibre Floral Bed Pillow Sets (Size-16 x 24 inch, Pack of 2)",Karan,0,0,0,230,0,0,82,"Wednesday, February 16",0,"₹230
₹1,299 Save ₹1,069 (82%)"
146,B08RC4CJT7,"MY ARMOR Microfibre Pillow , 26"" x 17"" , White , 1 Piece",MY,0,0,0,390,4.3,290,35,"Saturday, February 26",0,290
147,B097YXYP97,"Perfect Sleeper Microfiber Breathable Full Body Insert, Soft Large Long Bed Pillow (18 x 54 inch, White, King size)",Perfect,0,0,0,579,5.0,1,66,"Thursday, February 17",0,1
148,B09FYHZT24,"Design World -Hollow Fibre Pillow for Sleeping Bed Set of 1, 18x27 inch, White",Design,0,0,0,295,3.1,5,70,"Saturday, February 19",0,5
149,B094DGJ8P1,"DECOR Polycotton Comfort Foam Pillow, White, Standard - Pack of 2",DECOR,0,0,0,999,3.6,101,33,"Wednesday, February 16",0,101
150,B09QL2LPDN,"S K S Enterprises Ultra Soft Microfibre Lining Bed Pillow (Black Cotton,Set of 1, Size- 40 x 60 cm )",S,0,0,0,199,0,0,88,"Wednesday, February 16",0,"₹199
₹1,599 Save ₹1,400 (88%)"
151,B07VRRXGRP,"HealthSense Soft-Spot CP 30 Orthopedic Memory Foam Cervical Pillow for Neck, Shoulder, Sleeping Pain with Premium Bamboo Fibre Fabric Cover",HealthSense,0,0,0,"1,399",4.1,724,39,"Tuesday, February 15",1,724
152,B0993M7BB5,"D S Pillow Microfiber 16 X 24 inch White Sleepping Pillows, Pack of 1 (3)",D,0,0,0,275,3.5,28,8,"Wednesday, February 16",0,28
153,B09QJSPDN8,"Shree GANPAT Enterprises Ultra Soft Pillow Sets for Bed (Black Microfibre , Set of 06,Size- 68 x 43Cm)",Shree,0,0,0,599,0,0,14,"Wednesday, February 16",0,"₹599
₹699 Save ₹100 (14%)"
154,B09JSWW688,"JY Breathable Gusset Bed Soft and Supportive Pillows for Side, Back, Stomach Sleepers (16'' x 26'') -Set of 2, Silk , White",JY,0,0,0,449,3.0,19,55,,0,19
155,B096FVLQL3,"MECNIOX Machine Washable Microfiber Luxury Soft Pillow for Sleeping (White Fiber 16 x 24 Inch , 4)",MECNIOX,0,0,0,749,5.0,2,58,"Thursday, February 17",0,2
156,B00IJRV2KI,"Recron Certified Bliss Fibre Pillow - 40 cm x 61 cm, White",Recron,0,0,0,445,4.0,259,5,"Sunday, February 20",0,259
157,B09J8ZMRM8,Donda Brother's Microfibre & Polyster Ultra Soft Blue Deep Bed Pillow Sets ( 2 Piece ),Donda,0,0,0,319,0,0,20,"Wednesday, February 16",0,"₹319
₹399 Save ₹80 (20%)"
158,B07RXZ55X8,Everwey Enterprise Medium Hard Cotton Printed Pillows Set of 2/2 Pillows (Size 17 x 27 inches) Multicolour,Everwey,0,0,0,649,4.2,74,48,"Thursday, February 17",1,74
159,B09M3ZLSCX,Ozoy Contour Memory Foam Pillow Adjustable for Sleeping Ergonomic Cervical Pillows Neck Pain Support Back Anti-Allergy Relief Bed with Cover (Memory Foam Pillow- (White)),Ozoy,0,0,0,799,3.8,82,60,"Wednesday, February 16",1,82
160,B09JKFPX1S,"Lefre Best Sleep Microfiber Cotton 5 Star Hotel Black Star Pillow Extra Large King Size 16""*24 (40cm*60cm), White , Set of 4.",Lefre,0,0,0,0,3.0,2,0,,0,2
161,B09JKQR4V4,"JY Home Bed Pillows for Sleeping 2 Pack Standard Size 16 x 26 Inches, Hypoallergenic Pillow for Side and Back Sleeper, Down Alternative Cooling Pillow",JY,0,0,0,299,3.7,39,50,,0,39
162,B09RPX2W2X,Atootfusion Natural Orthopedic Pillow Luxurious Quality Pillow Filler with Fibre Microfiber Pillow 16X25 Inch Count 02 Checkered Pillow (Black and White Check) (Reliance Microfiber Soft Plush Pillow),Atootfusion,0,0,0,349,0,0,83,"Wednesday, February 16",0,"₹349
₹1,998 Save ₹1,649 (83%)"
163,B09JBQXF95,"H B MSALA Microfiber Insert Soft Long Bed Breathable Full Body Pillow for Adult Side Sleeper (White, 20 x 54 inch)",H,0,0,0,495,0,0,83,"Wednesday, February 16",0,"₹495
₹2,998 Save ₹2,503 (83%)"
164,B09MZCXZ77,"FEXNIO Soft Organic Cotton Memory Foam Sleeping Pillow - Pack of 2 (M, 16x24 inches), White",FEXNIO,0,0,0,499,0,0,62,"Thursday, February 17",0,"₹499
₹1,299 Save ₹800 (62%)"
165,B0963Y31SJ,JY Luxury Bed Sleeping Pillow Microfiber Geometric Stripe Pillows for Home Hotel Collection Good for Side and Back Sleeper Size-26'' x 16'' ( White Pack of 2),JY,0,0,0,349,3.6,106,50,,0,106
166,B08BK1C4Q9,"Urban Basics Ultra Soft Microfibre Pillow, 17""x27"" Inch, White, Set of 4(PIL01_4), polyester",Urban,0,0,0,"1,399",4.1,"2,326",30,"Wednesday, February 16",1,"2,326"
167,B09NJVMQBR,"Shivay Fashion Memory Foam Cervical Pillow for Neck Pain and Spondylitis Contour Pillow Support for Back, Side Sleepers",Shivay,0,0,0,699,2.7,9,56,"Wednesday, February 16",1,9
168,B0993TW99L,"Bee's Bliss Microfiber Soft & Comfort Sleeping Pillow (16x24-inch, White)",Bee's,0,0,0,250,3.7,12,58,"Thursday, February 17",0,12
169,B08ZSWWHTD,"Urban Basics Hotel Quality Super Soft Clean Microfiber Premium Sleeping Pillow King Size 20 x 30 Inches (White, Set of 2 Pcs)",Urban,0,0,0,899,4.1,231,36,"Wednesday, February 16",1,231
170,B07R69FPKG,"Royal Trend Fiber Cotton Single Excellent Comfort and Durable Standard Microfibre Pillow (17x27 inch, White)",Royal,0,0,0,499,0,0,62,"Thursday, February 17",1,"₹499
₹1,299 Save ₹800 (62%)"
171,B09JP437KT,"KWT Plastic Cervical Contour Memory Foam Pillow Support for Neck Pain, Orthopedic, Back, Stomach, Side Sleepers, Anti-Snoring (White)",KWT,0,0,0,789,4.3,139,21,"Wednesday, February 16",1,139
172,B09NDSBTW5,Casa Haus YYY Collection- 5 Pack Pillows Fillers/Inserts (16 x 24 inches) - White,Casa,0,0,0,999,4.9,18,33,"Saturday, February 19",1,18
173,B096YDPSFG,"Homerz Premium Set of 2 Hotel Quality Super King Size Pillow, 20 x 30 Inch Exact Size, Superior White Cotton Polyester Fabric (2)",Homerz,0,0,0,899,3.8,139,50,"Friday, February 18",1,139
174,B09B2C5Z5J,"FEXNIO Bed Pillow l Washable Pillow for Bed l Pillows l Two Piece Pillow ( 40x60 cm, White )",FEXNIO,0,0,0,499,0,0,55,"Thursday, February 17",0,"₹499
₹1,099 Save ₹600 (55%)"
175,B07QSR6B6Y,"Sleepwell Feather Pillow, 27 x 17, White, Set of 1",Sleepwell,0,0,0,597,3.9,29,12,"Friday, February 18",1,29
176,B096YDPSFG,"Homerz Premium Set of 2 Hotel Quality Super King Size Pillow, 20 x 30 Inch Exact Size, Superior White Cotton Polyester Fabric (2)",Homerz,1,0,0,899,3.8,139,50,"Friday, February 18",1,139
177,B08FYWDN3G,Homerz Ultra Soft ( Set of 4 ) King Size Fibre Pillows for Bed | 17 x 27 Inch Guaranteed Exact Size | White Cotton Fabric Pillows for Sleeping (4),Homerz,1,0,0,"1,269",3.9,327,33,"Friday, February 18",1,327
178,B09KW46NYM,"Homerz Set of 2 Imported Conjugated Fiber Pillow, 17x 27 inch Size, Vacuum Pack (White with Yellow Boundary)",Homerz,1,0,0,747,5.0,1,25,"Friday, February 18",1,1
179,B09RJ4QGGW,"Sofrest Microfiber Cloud Pillow for Sleeping, Bombay Dyeing Luxury Hotel Collections Microfiber Soft Pillow Pack of 1, 27 X 17 Inch (Pack of 1)",Sofrest,1,0,0,"1,199",4.0,62,40,"Thursday, February 17",1,62
180,B08RC467DY,"MY ARMOR Micro Fibre Pillows , 26"" x 17"" , White , 2 Pieces",MY,1,0,0,750,4.3,290,42,"Saturday, February 26",1,290
181,B0736YM33H,"AmazonBasics Polyester Ultra Soft Down Alternative Bed Pillows (20X36 inches, Extra Large) - 2 Pack",AmazonBasics,1,0,0,"1,823",4.0,"10,836",48,,1,"10,836"
182,B0865KY8KB,"MY ARMOR Orthopedic Memory Foam Pillow for Comfortable Sleep, Couple Pack (King & Queen)",MY,1,1,0,"2,250",4.1,"11,338",45,"Monday, February 14",1,"11,338"
183,B08V53S7J5,"SleepyCat 2-Piece Microfiber Cloud Pillow with Adjustable Zipper (32x20 inches, White)",SleepyCat,1,0,0,"2,191",4.3,637,26,"Tuesday, February 15",1,637
184,B089YTMMJP,"HOMY DECOR Bombay Dyeing 100% Cotton Cloth, Luxury Hotel Collections Soft Pillow, White, 17 X 27 Inch, Pack of 2",HOMY,0,0,0,820,4.0,390,59,"Monday, February 21",1,390
185,B08YN9N2ZN,REGIUS Premium Hotel Quality Hollow Microfibre Pillow Set of 2 for Sleeping - 16x26 Inches,REGIUS,0,0,0,459,3.2,6,54,"Thursday, February 17",1,6
186,B09N1RLF42,takiyawala® Luxury Plush Microfiber Box Pillow 16X26X4 (Pack of 2),takiyawala®,0,0,0,698,4.8,5,53,"Wednesday, February 16",1,5
187,B096YDPSFG,"Homerz Premium Set of 2 Hotel Quality Super King Size Pillow, 20 x 30 Inch Exact Size, Superior White Cotton Polyester Fabric (2)",Homerz,0,0,0,899,3.8,139,50,"Friday, February 18",1,139
188,B09RG2X689,Little Peach Microfiber C Shape Ultra-Soft Pregnancy Pillow (Charcoal Grey),Little,0,0,0,"1,999",0,0,20,"Wednesday, February 16",1,"₹1,999
₹2,499 Save ₹500 (20%)"
189,B098L591YB,Proliva Cervical Contour Soft Memory Foam Pillow for Sleeping (Butterfly Pillow),Proliva,0,0,0,899,3.5,13,55,"Thursday, February 17",0,13
190,B07F76KMS9,"Hush Standard Pillow | Softex Fiber Filling | Medium Soft Feel The Zero Headache Polyester Bed Pillow, (Beige, 16 x 24 x 7.25 Inch)",Hush,0,0,0,550,3.9,186,21,"Thursday, February 17",1,186
191,B09QJQTSVF,"Daksh Out Fit Ultra Soft Microfiber Blue Star Printed Bed Pillow (Black Cotton,Set of 1, Size- 40 x 60 cm )",,0,0,0,0,0,0,0,,0,
192,B0822SXQGH,"SleepyCat 1-Piece Air Gel Memory Foam Pillow for Sleeping & Neck Support with Removable Zipper Cover (25x16 inches, White)",SleepyCat,0,0,0,"1,691",4.1,"1,036",15,"Friday, February 18",1,"1,036"
193,B07TP8FM5P,"Apurva interiors SLEEPWELL Norma Cotton Flexi Puff Foam Pillow (White, XL)",Apurva,0,0,0,715,3.2,18,11,"Monday, February 21",0,18
194,B09NVWQL76,Trova Fashion Store Cotton Filled with Microfibre & Polyster Ultra Soft Plain White Bed Pillow Sets ( Pack of 4 ),Trova,0,0,0,0,2.1,3,0,,0,3
195,B084RCCDT3,"PUM PUM Ultra Soft Micro Fiber Body Pillow,Long Slide Sleeping Pillow for Adult and Pregnancy ,(Blue ,20x54 Inch)",PUM,0,0,0,499,3.6,125,0,"Wednesday, February 16",1,125
196,B07WHWWT1Z,"SWEETSAGA Durable Super Soft Power Sleeping Bed Home Pillow, Unique White 16X24 Inch 2 Set Pillows, 2022 Offer, Microfibre",SWEETSAGA,0,0,0,329,3.8,39,78,"Thursday, February 17",1,39
197,B09RSL2CT1,"ATOOTFUSION Luxurious 2 Piece Medium Hard Perfect for Neck Pillow Filler - 16X24 Inch , White (Medium Hard Cotton Pillow)",ATOOTFUSION,0,0,0,298,0,0,85,"Wednesday, February 16",0,"₹298
₹1,998 Save ₹1,700 (85%)"
198,B08QD2RSMZ,DOCTOR REST Printed Microfibre Sleeping Pillow Filled with Racron Fibre Inside - 41cm X 61cm Milky White Pack of 2 pcs.,DOCTOR,0,0,0,399,4.2,27,53,"Thursday, February 17",1,27
199,B09BL2VX1L,"Soft Cotton Pillow JDXROYAL Hotel Quality Premium Polyester Blend Fiber Pillow, White -Set of 2, 16x24 Inches",Soft,0,0,0,299,0,0,73,"Wednesday, February 16",0,"₹299
₹1,099 Save ₹800 (73%)"
200,B0822SXQGH,"SleepyCat 1-Piece Air Gel Memory Foam Pillow for Sleeping & Neck Support with Removable Zipper Cover (25x16 inches, White)",SleepyCat,1,0,0,"1,691",4.1,"1,036",15,"Friday, February 18",1,"1,036"
201,B08P9WHVBL,"Nivedha Mattress- Virgin Gold -100% Organic Silk Cotton/Kapok/Ilavam Panju/Semal Cotton Fiber for Filling Pillows, Cushion,bolsters,Mattress etc (2kg)",Nivedha,1,0,0,"1,400",4.2,20,53,"Wednesday, February 16",1,20
202,B08Q8DKCF6,"Morning Owl Natural Latex Rubber Medium Firm eco-INSTITUT Certified Pillow (60*40*12.5 cm), 2 Pillows, White",Morning,1,0,0,"3,495",4.0,36,47,"Thursday, February 24",1,36
203,B09GS5KJ1N,"Cloth Fusion Microfiber Bed Pillow Set of 2 Pieces (17x27 Inches, Teal and Grey)",Cloth,1,0,0,629,3.8,14,37,"Thursday, February 17",1,14
204,B097YGV4G7,JY Microfiber Satin Stripe Fabric Bed Pillow for Sleeping 16''x 24'' White Set of 2,JY,0,0,0,379,3.9,68,62,,0,68
205,B08P7MQRSJ,"DOCTOR REST Hollow Microfibre Soft Fiber Bed Pillow Set of 4, 16inchx24Inch, White",DOCTOR,0,0,0,799,3.9,40,20,"Wednesday, February 16",0,40
206,B09GXCGF1H,"SOWKOS Luxury Hotel Quality Soft Bed Pillow, Microfiber Pillow, 16 inch X 24 inch ( White, Pack of 5 )",SOWKOS,0,0,0,620,0,0,69,"Wednesday, February 16",0,"₹620
₹1,999 Save ₹1,379 (69%)"
207,B096SZBLRM,"Homerz Microfiber Platinum Knitted King Size Pillow for Bed, Super Soft 250 GSM Knitted Fabric - 2 PC (Snow White, 17x27 Inch)",Homerz,0,0,0,849,3.9,69,53,"Friday, February 18",1,69
208,B09CH2DD2X,DPG Smart Cloud Microfiber Pillow | Extra Soft | Standard Size 16 X 24 Inch | White| Pack of (1),DPG,0,0,0,249,0,0,75,"Wednesday, February 16",0,"₹249
₹999 Save ₹750 (75%)"
209,B09R7WY95L,"kamla Enterprises Ultra Soft Microfibre Floral Printed Bed Pillow Sets (Black Cotton, Pack of 6, Size- 40x 60Cm)",kamla,0,0,0,599,0,0,54,"Wednesday, February 16",0,"₹599
₹1,299 Save ₹700 (54%)"
210,B09HSGC4NY,MELWO 150 GSM White Premium Satin Stripes Hotel Luxury Collections Super Soft and Fluffy Pillows (Pack of 2) (17 x 27 Inch),MELWO,0,0,0,499,0,0,63,"Monday, February 21",0,"₹499
99
₹1,359 Save ₹859.01 (63%)"
211,B09PBHY671,"Zoliva Memory Foam Cervical Pillow for Neck Pain and Spondylitis Contour Pillow Support for Back, Side Sleepers Memory Foam Pillow (Pack of 1)",Zoliva,0,0,0,899,5.0,47,55,"Thursday, February 17",0,47
212,B08KT8K4JK,Dreamline Sienna Rolling Pack Pillow (41x61),Dreamline,0,0,0,199,3.9,9,60,,0,9
213,B07WC33VL3,"HSR Collection Chenille Luxury Bolster Cover, Bolster Pillow Cover Set of 2, Round Pillow Cover Set of 2 - 32 x 16 inches | Maroon",HSR,0,1,0,269,3.9,"4,609",46,"Thursday, February 17",0,"4,609"
214,B08TK2MSWT,"Amazon Brand - Solimo 7 Piece Microfibre Filled Bolster and Cushion Set for Diwan, 2 Bolsters and 5 Cushions",Amazon,0,0,0,949,3.8,29,41,"Thursday, February 17",1,29
215,B09QQTGQS4,"Homerz Premium Set of 2 Bolster Pillow, 15 x 30 Size, 3D conjugated Fiber Filled, Vacuum Pack",Homerz,0,0,0,899,0,0,10,"Friday, February 18",1,"₹899
₹999 Save ₹100 (10%)"
216,B08N4VVTXQ,"Home Centre Polyester Corsica Solid Pillows (43 cm x 70 cm, White) - Set of 2 Pcs",Home,0,0,0,499,4.3,25,0,"Thursday, February 17",1,25
217,B09MFJ94D4,Narayan™ Cotton Pillow for Home Pillow for Home Decor Pillow for Hotel Pillow for Bedroom Quality Fibre Pillow | Best Collections of Pillows Sleeping Pillows for Bedrooms White16x24 Inch Pack of 5,,0,0,0,0,0,0,0,,0,
218,B09DG89D4Z,DRIS Swiss Resilient Fiber Stripe Pillow | Extra Soft | Standard Size 16 X 24 Inch | White| (1),DRIS,0,0,0,199,3.3,10,60,"Thursday, February 17",1,10
219,B09RK7HHD5,"Karan Enterprises Ultra Soft Microfibre Blue Star Bed Pillow Sets (Size-16 x 24 inch, Pack of 2)",Karan,0,0,0,219,0,0,83,"Wednesday, February 16",0,"₹219
₹1,299 Save ₹1,080 (83%)"
220,B09QJZ6RCK,Little Peach Microfiber C Shape Ultra-Soft Pregnancy Pillow (Charcoal Grey),Little,0,0,0,"1,999",0,0,20,"Wednesday, February 16",1,"₹1,999
₹2,499 Save ₹500 (20%)"
221,B09CMC8X96,"Homerz Aloe Vera Cloud Pillow Filled with 3D conjugated Microfiber, White, 17 x 27 inch Set of 2",Homerz,0,0,0,849,4.6,11,56,"Friday, February 18",1,11
222,B07VBXF4GH,"PumPum Polyester Fiber Hill Hard Bed Bolster Pillows for Sleeping (White, 27 x 9 Inches , 5236)",PumPum,0,0,0,219,3.5,295,0,"Wednesday, February 16",0,295
223,B09L8H4MCC,"Sleepsia Microfiber Bed Pillow for Sleeping - Down Alternative Ultrasoft Cotton Washable Pillow with Satin Gusset- Queen (Blue, Pack of 1)",Sleepsia,0,0,0,"1,299",4.4,67,78,"Wednesday, February 16",1,67
224,B09KS1MLNW,"Fresh Up Microfiber Pillow, 27x17Inches for Sleeping with Adjustable Height Zipper (White, Pack of 1)",Fresh,0,0,0,899,5.0,2,59,"Wednesday, February 16",1,2
225,B08R5Y3FLZ,Sulana Foam Ultrasoft Pillow - Set of 1,Sulana,0,0,0,149,0,0,85,"Friday, February 18",0,"₹149
₹999 Save ₹850 (85%)"
226,B09JBQCQYC,"H B MSALA Full Body Pillow Insert, Large Soft Body Pillows for Adults - White Breathable Long Side Sleeper Pillow for Sleeping, 20×54 inch",H,0,0,0,495,0,0,75,"Wednesday, February 16",0,"₹495
₹1,998 Save ₹1,503 (75%)"
227,B09MNC3XW8,"Ananya Int Microcotton Standard Pillows Luxury Bed Pillow for Sleeping (16X24 Inches, White) -Set of 4 Pieces",Ananya,0,0,0,499,2.5,3,58,"Wednesday, February 16",1,3
228,B07VYT9B33,"Sleepwell Memory Foam Pillow, 27 x 17, White, Pack Of 1",Sleepwell,0,0,0,357,3.8,42,35,"Monday, February 21",0,42
229,B09878WDYH,"ATOOTFUSION Microfiber Ultra Soft Bed Pillows Set (White, 12X18 Inches) - Pack of 02",ATOOTFUSION,0,0,0,298,3.7,77,70,"Wednesday, February 16",0,77
230,B075WDHTHW,JDX Reliance Fibre Soft Bolster (White) - Set of 2,JDX,0,0,0,599,4.0,"1,248",40,"Wednesday, February 16",1,"1,248"
231,B09RK6LMHS,"Karan Enterprises Ultra Soft Microfibre Floral Print Pillow Sets (Size-16 x 24 inch,Pack of 5)",Karan,0,0,0,460,0,0,65,"Wednesday, February 16",0,"₹460
₹1,299 Save ₹839 (65%)"
232,B09C5LX3RQ,"Cottington Lane - Micro Fiber Filled pillow Chacked Sage Cotton Pillow Takiya Combo Set of 2 for Bed Room - 20x30 Inch Queen Size Pillow Set of 2 for Sleeping,Pillow for Comfortable Sleep ,Bed Pillow for Sleeping,Luxurious,Microfiber Bed Pillow Set , Ultra Soft Microfibre Bed Pillow Set ,",Cottington,0,0,0,651,3.9,8,50,"Thursday, February 17",1,8
233,B08KVW727K,"Wake Up Hollow Cotton Fiber Pillow, 27x17 inch, White, 2 Piece",Wake,0,0,0,495,4.0,412,53,"Friday, February 18",0,412
234,B09Q62MGKC,"Kamal Enterprises Furniture Microfibre & Polyester 2-Piece Bed Pillow Set - 40 x 60 cm, White (1)",Kamal,0,0,0,199,1.0,1,75,"Wednesday, February 16",1,1
235,B09LYMZB76,BAJAJ TEXTILE Air Pillow Camping Air Pillow Ultralight Portable Ergonomic Pillow Air Cushion Sleeping Bag Backpacking Pillow Soft Comfortable Air Inflatable Travel Pillow Blue(Pack of 1),BAJAJ,0,0,0,220,4.5,2,12,"Wednesday, February 16",1,2
236,B09PJG3SSJ,"Homerz Body Pillow with Waterproof Pillow Protector Cover, 54 x 20 inch Size (Golden)",Homerz,1,0,0,999,0,0,50,"Friday, February 18",1,"₹999
₹1,999 Save ₹1,000 (50%)"
237,B09KVH9235,"Homerz Set of 2 Bamboo Fabric Fiber Pillow, Size 17x27 Inches , 3D Conjugated Fiber Filled, Vacuum Pack",Homerz,1,0,0,849,4.0,6,29,"Friday, February 18",1,6
238,B08NVFRXBM,"Nivedha Mattress Organic Silk Cotton/Kapok/Ilavam Panju/Semal Soft Sleeping Pillow (Green, 24 x 14 inches)",Nivedha,1,0,0,650,3.3,7,64,"Wednesday, February 16",1,7
239,B096YF8KD2,"Homerz Premium Hotel Quality Super King Size Pillow, 20 x 30 Inch Exact Size, Superior White Cotton Polyester Fabric (5)",Homerz,1,0,0,"1,799",3.8,139,0,"Friday, February 18",1,139
240,B09GS1WHDW,"Cloth Fusion Microfiber Bed Pillow Set of 2 Pieces (17x27 Inches, Maroon and Grey)",Cloth,1,0,0,629,3.8,14,37,"Wednesday, February 16",1,14
241,B08RC4CJT7,"MY ARMOR Microfibre Pillow , 26"" x 17"" , White , 1 Piece",MY,1,0,0,390,4.3,290,35,"Saturday, February 26",0,290
242,B09F679JF6,"Spread Spain® Medium Firm Everyday Pillow with Fiber Filling for Comfortable Sleep, 5 Star Hotel Pillow (President Size , 56 x 85 cm, 1)",Spread,1,0,0,"2,295",4.0,25,10,"Thursday, February 17",0,25
243,B08Q8J294N,"Morning Owl Soft Rubber Natural Latex Contour Pillow for Sleeping ( White, 58X38X 8 cm/10 cm) - 2 Pillows -INSTITUT Certified",Morning,1,0,0,"3,295",4.2,58,45,"Thursday, February 24",1,58
244,B09R8T6WCY,"SleepX OWl Rotto Fabric Reliance Fiber Luxury Hotel Collection Super Soft Pillow for Sleeping Oeko-TEX® Certified (Single) (17""X 27"" INCH) Set of 2",SleepX,0,0,0,499,0,0,50,"Monday, February 21",1,"₹499
₹999 Save ₹500 (50%)"
245,B09JN3GRZC,SIROKI BOND Polyester Fiber Solid Pregnancy Pillow Pack of 1,SIROKI,0,0,0,759,0,0,68,"Saturday, February 12",0,"₹759
₹2,399 Save ₹1,640 (68%)"
246,B08NVJQFSW,DOCTOR REST-Wonderland Fibre Pillow Filled with Racron Luxury Microfibre Inside - 46cm X 69cm White Pack of 1 pcs,DOCTOR,0,0,0,449,4.0,2,31,"Thursday, February 17",1,2
247,B09DYZ2SYH,Fiber Filling Cozy Comfortable Recron Pillows 27x17 a Pack of 2,Fiber,0,0,0,499,5.0,2,44,"Saturday, February 19",0,2
248,B09R7W5J29,"kamla Enterprises Ultra Soft Microfibre Blue Dotted Bed Pillow Sets (Black Cotton, Pack of 3, Size- 40 x 60 cm)",kamla,0,0,0,349,0,0,50,"Wednesday, February 16",0,"₹349
₹699 Save ₹350 (50%)"
249,B07BGBYL38,"Sleepyhead Microfiber Pillow, King, White, Set of 1",Sleepyhead,0,0,0,999,4.2,"1,592",17,"Friday, February 18",1,"1,592"
250,B09RN1NV3B,"Momsyard (Original) Microfiber Pillow, White Cushion, Head Pillow, Sleeping Pillow, Bed Pillow (16X24, Pair of 2)",Momsyard,0,0,0,245,0,0,51,"Thursday, February 17",1,"₹245
₹499 Save ₹254 (51%)"
251,B09748RDVD,"MECNIOX Bedroom Round Polyester Bolster Luxury Pillows for Hotel - Set of 2 Pieces (10X25-inches, White)",MECNIOX,0,0,0,399,3.4,17,73,"Thursday, February 17",0,17
252,B09M8TZZVR,"MY ARMOR Micro Fibre Bolster Bed Pillow, 10 x 25 inch, White , 2 Pieces",MY,0,0,0,799,4.8,47,38,"Saturday, February 26",1,47
253,B08CL1F688,"ATOOTFUSION 100% Recyclable Black Hosiery Cotton Firm Medium Hard Cotton Bed Pillow for Real Perfect Neck Support (16"" x 26"") Bombay Dying Satin Striped White Pack of 01",ATOOTFUSION,0,0,0,199,3.5,148,80,"Wednesday, February 16",0,148
254,B09C3FJ697,"Shri Vyas Linen Standard Pillow Shri Vyas Linen Microfiber Pillows Set of 2 Pcs Pillows Comfortable for Sleeping/Hotel/Bedroom (Down Alternate Microfiber 2 Pcs Pillow, Set of 2, 20 x 36 Inches)",Shri,0,0,0,799,4.1,32,47,"Wednesday, February 16",1,32
255,B0995JGVMV,Indore Cotton- Micro Filled Double Stripe Print Cotton Pillow/Takiya Combo Set of 2 for Bed Room - 17x27 Inch,Indore,0,0,0,599,3.9,6,50,,1,6
256,B07JMQ9CNJ,"Gowri Tex Microfiber Soft Big Size Pillow (Printed Green, 17.5 x 27.5-inch)",Gowri,0,0,0,499,4.3,67,75,"Sunday, February 20",1,67
257,B09PBJ6SGS,Zoliva Memory Foam Pillows for Neck Pain and Shoulder Pain Orthopedic Cervical Best Contour Shape Ergonomic Neck Memory Foam Bed Pillow Pack of (1),Zoliva,0,0,0,"1,099",4.9,47,45,"Thursday, February 17",0,47
258,B09RH1QSF2,Memory Foam Cervical Contour Medical Pillow - DClub Orthopedic Pillows for Neck Back Pain Relief for Slipping. (1),Memory,0,0,0,589,3.7,3,83,"Wednesday, February 16",1,3
259,B09MHF7JDB,Sumegha Pillow for Home Pillow for Home Decor Pillow for Sofa Pillow for Hotel Pillow for Bedroom Quality Fibre Pillow | Best Collections of Pillows Sleeping Pillows for Bedrooms16x24 (Pack of 3) (2),Sumegha,0,0,0,389,1.0,1,51,"Wednesday, February 16",0,1
260,B0865RXG6M,"MY ARMOR Orthopedic Memory Foam Pillow for Comfortable Sleep, King Size (Pack of 2)",MY,1,1,0,"2,350",4.1,"11,338",44,"Monday, February 14",1,"11,338"
261,B08135PKF1,"EMBROCO ® Cotton Best Night Sleeping Soft Pillow (16x24 Inches, White) -Set of 2",EMBROCO,1,0,0,0,3.7,13,0,,0,13
262,B09RKH33Q5,"Sleepsia Supersoft Kids Pillows - 12"" X 18"" Breathable Bamboo Pillows for Sleeping - Ultra Supportive Microfiber Premium Fill Toddler Pillows, White",Sleepsia,1,0,0,499,5.0,2,75,"Wednesday, February 16",1,2
263,B0967ZPY3L,"Homerz Premium Set of 4 Fibre Pillows for Bed 16 x 24 inch Size, White Polyester Cotton Fabric (4)",Homerz,1,0,0,"1,199",4.4,7,14,"Friday, February 18",1,7
264,B09Q1BNDLT,"Dormyo Memory Foam Contour Cervical Pillow for Sleeping, Relief from Neck Pain, Shoulder Pain, Back Pain (20x12x4 inches), 50-D Memory Foam Bed Pillow with 400 GSM Cover",Dormyo,0,0,0,699,5.0,3,65,"Wednesday, February 16",1,3
265,B08P9W39VW,"Nivedha Mattress- Virgin Gold -100% Organic Silk Cotton/Kapok/Ilavam Panju/Semal Cotton for Filling Pillows, Cushion,bolsters,Mattress etc (1kg)",Nivedha,0,0,0,700,4.6,72,30,"Wednesday, February 16",1,72
266,B09QKR2TSV,"Shree GANPAT Enterprises Ultra Soft White Fibre Pillow Sets for Bed (White , Set of - 02,Size- 43 x 69 cm)",Shree,0,0,0,0,1.0,1,0,,0,1
267,B08RP5B6RP,"Urban Basics Ultra Soft Microfibre Pillow, 20'x30' Inch, White, Set of 2 (PIL11_2)",Urban,0,0,0,799,0,0,43,"Wednesday, February 16",1,"₹799
₹1,399 Save ₹600 (43%)"
268,B09RK3CPXT,"M/S Kusum & Cheshta Enterprises Ultra Soft Microfibre Blue Bed Pillow Sets (Size-16 x 24 inch, Set of 2)",M/S,0,0,0,299,0,0,25,"Wednesday, February 16",0,"₹299
₹399 Save ₹100 (25%)"
269,B08J7FSTRB,Livpure Smart Memory Foam Cool Gel Infused Pillow with Standard Size 16 x 24 Inch - White ( Pack of 1 ),Livpure,0,0,0,"1,449",4.0,185,50,"Saturday, February 19",0,185
270,B00IE45MDE,Hush Soft Fiber Pillow For Sleeping - (White) (18 x 27 inches),Hush,0,0,0,724,4.2,190,27,"Thursday, February 17",1,190
271,B073726R5M,AmazonBasics Polyester Ultra Soft Down Alternative Bed Pillows Large 2 Pack- 20X26 inches (50.8 cmX66.04 cm),AmazonBasics,0,0,0,"1,345",4.0,"5,610",50,,1,"5,610"
272,B08S76VKSN,Momsyard Women's (Original) Full Body Pregnancy/Maternity Made of Velvet Pillow Cover - C Shaped - Gray/Silver,Momsyard,0,0,0,"1,299",4.0,"3,105",65,"Thursday, February 17",1,"3,105"
273,B09FHM2GVH,Clasiko® Cotton Bolster Covers; Set of 2; 220 TC; Bird Print On Beige Base; 30x15 Inches,Clasiko®,0,0,0,495,4.2,119,50,"Wednesday, February 16",0,119
274,B08K964799,HOMY DECOR Super Soft Body Pillow - Long Side Breathable Sleeper Pillow Rotto Cover with Soft Reliance Fiber Filling (Single Pack) White (20 x 54 inch),HOMY,0,0,0,599,4.1,101,70,"Monday, February 21",1,101
275,B09GYQW917,"JY Premium Quilted Satin Pillows Filled with Reliance High Density Micro Fiber Super Soft Sleeping Pillows (White, 16"" X 26"") - Set of 2",JY,0,0,0,299,3.3,20,50,,0,20
276,B09GXFW5JV,"SOWKOS Luxury Hotel Quality Soft Bed Pillow, Microfiber Pillow, 16 inch X 24 inch ( White, Pack of 4 )",SOWKOS,0,0,0,549,0,0,61,"Wednesday, February 16",0,"₹549
₹1,399 Save ₹850 (61%)"
277,B09647D2RQ,"REMCART Microfiber Sleeping Pillow, 40 cm X 60 cm, White Pack of 1pc",REMCART,0,0,0,189,3.4,19,68,"Wednesday, February 16",0,19
