,asin,title,brand,Sponsored,Best Seller,Amazon's Choice,Price,Rating,NoofRatings,Discount,Delivery,Prime Delivery,base
0,B09Q1K6F1C,ZEPOLI - Wall Clock Silent Battery Operated Round Wall Clock Modern Simple Style Decor Clock Non-Ticking (Pastel Clock),ZEPOLI,1,0,0,595,4.3,65,46,"Saturday, February 19",0,65
1,B076VG6LF3,"Amazon Brand - Solimo 12-inch Plastic & Glass Wall Clock - Different Strokes (Step Movement, Black Frame)",Amazon,1,0,0,639,4.3,"3,848",36,"Friday, February 18",1,"3,848"
2,B076VF43GG,"Amazon Brand - Solimo 12-inch Plastic & Glass Wall Clock - Classic Roulette (Silent Movement, Black Frame)",Amazon,1,0,0,639,4.2,"14,647",42,"Wednesday, February 16",1,"14,647"
3,B082DRZ3PD,"Amazon Brand - Solimo 12-inch Plastic & Glass Wall Clock - Victorian Bliss (Silent Movement), Black",Amazon,1,0,0,639,3.9,"2,005",57,,1,"2,005"
4,B01N6OOW52,"Ajanta Abstract Metal Quartz Wall Clock (32 cm x 32 cm x 3.5 cm, White)",Ajanta,0,0,1,489,4.3,"42,444",0,"Wednesday, February 16",0,"42,444"
5,B00PXJWJJI,Ajanta AQ-2147 Quartz Glass Abstract Blue Office Clock (214 x 44 x 215 mm ),Ajanta,0,0,0,175,3.9,"33,607",0,"Friday, February 18",0,"33,607"
6,B01MS642JN,"Ajanta Abstract Plastic Round Wall Clock (20.5 cm x 20.5 cm x 3.5 cm, Pink)",Ajanta,0,0,0,175,3.9,"5,307",0,"Friday, February 18",0,"5,307"
7,B0184B9110,"Ajanta Plastic Abstract Round Wall Clock (18.8 cm x 18.8 cm x 3.5 cm, Ivory)",Ajanta,0,0,0,165,3.7,"3,323",0,"Friday, February 18",0,"3,323"
8,B09BB9Q36Q,"Starmoon Round Roman Wooden Clock, Wood Carving MDF Design Wall Clock, Perfect for Office, Classroom, Bedroom, Living Room, Kitchen, Restaurant,Hotel etc.(30 x 30 cm)",Starmoon,0,0,0,399,3.7,101,78,"Saturday, February 19",0,101
9,B076VF43GG,"Amazon Brand - Solimo 12-inch Plastic & Glass Wall Clock - Classic Roulette (Silent Movement, Black Frame)",Amazon,0,0,0,639,4.2,"14,647",42,"Wednesday, February 16",1,"14,647"
10,B01GTX6I3E,"Ajanta Plastic Quartz Abstract Wall Clock (Gold, 32 cm x 32 cm x 3.5 cm)",Ajanta,0,0,0,465,4.2,"9,021",0,"Wednesday, February 16",0,"9,021"
11,B07VGHBH91,"Oreva AQ 6197 Plastic Wooden Look Designer Wall Clock (32.5 x 32.5 x 4.8 cm), Brown",Oreva,0,0,0,384,4.3,"7,824",3,"Sunday, February 20",0,"7,824"
12,B0716NTF52,"Ajanta Plastic Abstract Wall Clock (28 cm x 28 cm x 3.5 cm, White)",Ajanta,0,0,0,270,3.8,"3,544",0,"Friday, February 18",0,"3,544"
13,B09KCK82V5,"VOLANTIS 12 Inch Modern Stylish Plastic Wall Clock Non Ticking Silent Decorative Wall Clocks for Home, Living Room, Hall, Office, and Bedroom (Rose Gold & Black)",VOLANTIS,0,0,0,649,4.0,303,46,"Saturday, February 19",0,303
14,B09Q1K6F1C,ZEPOLI - Wall Clock Silent Battery Operated Round Wall Clock Modern Simple Style Decor Clock Non-Ticking (Pastel Clock),ZEPOLI,0,0,0,595,4.3,65,46,"Saturday, February 19",0,65
15,B07281JH99,"Ajanta Plastic Abstract Quartz Wall Clock - Model No.957 (260mm x 260mm x 33mm, Ivory )",Ajanta,0,0,0,269,4.0,"5,118",0,"Wednesday, February 16",0,"5,118"
16,B0982ZYTRS,"Heart Home Simple Numerical Round Shaped Wooden 10"" Wall Clock (White, Standard - 25cm x 25cm)",Heart,0,0,0,189,3.4,140,5,"Friday, February 18",0,140
17,B095BPBBWZ,STAR WORK - Black Wall Clock - 12 Inch Rose Gold Silent Non Ticking Quality Quartz Battery Operated Easy to Read Decorative Modern Design for Home/Office/Kitchen/Bedroom/Living Room,STAR,0,0,0,595,3.9,"3,154",40,"Saturday, February 19",1,"3,154"
18,B09MM7MXZ6,"Naturel 10 inch Round Shaped Wall Clock with Glass for Home/Living Room/Bedroom/Kitchen/Office-Simpal White (Black Frame,24 cm x 24 cm x 3.5 cm)",Naturel,0,0,0,345,4.6,6,74,"Tuesday, February 22",0,6
19,B093DF6VJ2,"kk craft Plastic Wall Clock (Brown , 35 x 24 x 5 cms)",kk,0,0,0,395,3.5,"1,475",75,"Thursday, February 17",0,"1,475"
20,B092R6T6SM,"The Next Decor Roman Modern Round Metal with Silent Machine Wall Clock for Wall Decor (Matte Black, 15 Inch)",The,1,0,0,"1,799",4.3,230,10,"Friday, February 18",1,230
21,B095BPBBWZ,STAR WORK - Black Wall Clock - 12 Inch Rose Gold Silent Non Ticking Quality Quartz Battery Operated Easy to Read Decorative Modern Design for Home/Office/Kitchen/Bedroom/Living Room,STAR,1,0,0,595,3.9,"3,154",40,"Saturday, February 19",1,"3,154"
22,B091FLC9Z2,"The Next Decor Metal Heavy Analog Wall Clock with Silent Sweep Noiseless Technology Wall Decor for Home and Office (Matte Black, 15 Inch)",The,1,0,0,"1,799",4.4,19,10,"Friday, February 18",1,19
23,B09CLHDJ52,"The Next Decor Stylish Round Metal Wall Clock with Noiseless Machine Wall Décor for Living Study Hall Dining and Bedroom Roman Modern Time Piece(Matte Black, 18 Inch)",The,1,0,0,"2,049",5.0,1,32,"Friday, February 18",1,1
24,B08B8QL6MF,Circadian Ajanta Wooden Analog Wall Clock Design for Home Hall Living Room Decor Office Kids Bedroom Stylish Ethnic Antique Decorative Multicolour Peacock 33*35 cm ( Pack Of 1 ),Circadian,0,0,0,589,3.8,877,61,"Saturday, February 19",1,877
25,B09MM97N5W,"Naturel Round Shaped Wall Clock with Glass for Home/Living Room/Bedroom/Kitchen/Office-Yellow Flower (Black Frame,24 cm x 24 cm x 3.5 cm)",Naturel,0,0,0,339,5.0,2,74,"Tuesday, February 22",0,2
26,B07ZZ3CFNC,"Click n ship pendulum Plastic Wall Clock For Home size (36cm 27cm 7cm) (Brown, Small)",Click,0,0,0,405,3.8,"2,876",59,"Saturday, February 19",1,"2,876"
27,B09LS28Y58,E DEALS Plastic Classic Blue and Grey Round Shaped Designer Silent Movement Wall Clock with Glass -PWC-706 (Multicolour),E,0,0,0,349,3.3,56,65,"Saturday, February 19",1,56
28,B09FPJFSZ9,"Dinine Craft ® Plastic Big Size Stylish Wall Clock (31Cm X 31Cm, Brown)",Dinine,0,0,0,499,3.7,163,67,"Thursday, February 17",1,163
29,B08ZST7976,ARTINEST Brown Wall Clocks for Bedroom | Wall Clock for Living Room | Wall Clock for Stylish Wall | Designer Wooden Tree Bird Clocks for Home/Wall Decor 13 Inch,ARTINEST,0,0,0,350,3.0,2,73,"Saturday, February 19",1,2
30,B09NW5Q51Q,ayatul kursi/Islam Religious Wall Clock (Antique)…,ayatul,0,0,0,329,4.3,7,70,"Saturday, February 19",0,7
31,B09RPSFHWW,"APS Art Plus Store Wall Decorative Wall Clock, Wall Clocks for Living Room, 5 Face Big Size Wall Clock, with Stone, with Glass, Copper ( 33 cm X 23 cm)",APS,0,0,0,349,0,0,79,"Saturday, February 19",0,"₹349
₹1,699 Save ₹1,350 (79%)"
32,B09LT8HSKB,Naturel Plastic Round Shape Printed FloweTree Design Wall Clock with Black Frame (24 cm x 24 cm x 3.5 cm) (2009),Naturel,0,0,0,339,3.7,6,74,"Tuesday, February 22",0,6
33,B094BL1628,OREX Plastic Stylish Wall Clock for Home/Living Room/Bedroom/Office/Kids Room/Shop (White),OREX,0,0,0,499,3.7,50,58,"Tuesday, February 22",0,50
34,B09F96T6H7,"MELANA MDF Wooden Attractive Square Shape Silent Wall Clock with Classic Numerals (Light Brown, White)",MELANA,0,0,0,589,3.9,26,51,"Saturday, February 19",1,26
35,B01N6N6NJN,"Your Choice Metal Double-sided Wall Clock (Black, 12 Inch X 3 Inch X 12 Inch)",Your,0,0,0,758,4.1,293,62,"Saturday, February 19",1,293
36,B09LT9MR66,Naturel Plastic Round Shape Multicolor Wall Clock with Black Frame (2007),Naturel,0,0,0,339,4.0,1,74,"Tuesday, February 22",0,1
37,B099DML4HX,Arabs Wooden Round Designer Analog Wall Clock Without Glass (Wood),Arabs,0,0,0,429,3.5,13,57,"Sunday, February 20",1,13
38,B08HDBK3H3,CraftEmporio Plastic Handmade Anchor Wall Clock with Mobile Pouch (Maroon),CraftEmporio,0,0,0,399,2.9,20,60,"Sunday, February 20",0,20
39,B09BF6RD65,"ROYAL STEP Acrylic Foam DIY Creative 3D Stickers Analogue Plastic Wall Clock (Black, Circumference: 10cm, Maximum Reference Size: 70cm)",ROYAL,0,0,0,699,3.7,42,56,"Saturday, February 19",1,42
40,B07GLWRLS7,"Story@Home 12-inch Vintage Collection Round Shape Plastic Wall Clock (30 cm x 30 cm x 1.5 cm, Beige and Turquoise)",Story@Home,0,0,0,299,3.6,"2,597",80,"Saturday, February 19",0,"2,597"
41,B08V8H7DBD,"Webelkart Premium Plastic Designer Stones Lord Ganesha Wall Clock (Copper, 12 Inch)",Webelkart,0,0,0,299,3.7,"1,742",85,"Wednesday, February 16",0,"1,742"
42,B08F2JK7PY,"PHOENIX Analog Quartz Official Designer Big Size Plastic Wall Clock for Home, Hall, Office (42 X 42 cms Colour-Wood and White)",PHOENIX,0,0,0,770,4.0,67,61,"Thursday, February 17",1,67
43,B09LSGRLS5,NATUREL Plastic Round Shape Flower Designer Wall Clock with Black Frame - Pink (2021),NATUREL,0,0,0,339,4.2,41,74,"Tuesday, February 22",0,41
44,B09M8N2QKW,Dianna Sales Non-Ticking Silent Battery Operated Round Wall Clock Modern Style Decor Clock for Home/Office/School/Kitchen/Bedroom/Living Room (Grey Digital),Dianna,0,0,0,949,4.0,3,80,"Saturday, February 19",1,3
45,B01GEG4X92,"Divine Crafts Wood Peacock Birds Theme Wall Clock (Multicolour, 14 x 12 Inch)",Divine,0,0,0,499,3.9,"1,203",80,"Saturday, February 19",1,"1,203"
46,B07VP1X9B9,"Oreva Plastic Wooden Look Designer Abstract Silent Wall Clock (35.8 x 35.8 x 4 cm, Wood, AQ 6287 SS)",Oreva,0,0,0,565,4.2,"1,598",0,"Sunday, February 20",1,"1,598"
47,B082DSKPT5,"Amazon Brand - Solimo 12-inch Plastic & Glass Wall Clock - Pie (Silent Movement), Black",Amazon,0,0,0,543,4.2,915,64,"Friday, February 18",1,915
48,B09J56ST7Z,"Freny Exim 10"" Inch Wooden Wall Clock (Wenge, Small Size, 25cm x 25cm)-028",Freny,0,0,0,348,3.8,47,77,"Saturday, February 19",0,47
49,B08XM414JJ,"Unique Craft 3D Wooden Antique Design Wall Clock, Brown, MD_UNQ-006",Unique,0,0,0,729,4.1,346,61,"Saturday, February 19",1,346
50,B094FFWDXK,"Artle Media Customized/Personalized Wooden Wall Clock with 1 Photo for Birthday for Your Love (12 Inch x 12 Inch, Black)",Artle,0,0,0,479,4.1,28,47,"Sunday, February 20",0,28
51,B08FQYZQ51,"invision1 Plastic 3D Acrylic Tree Birds Coffee Cup On Jhula Design Wall Clock (Black, 69.9 x 41.9 x 1.3 cm)",invision1,0,0,0,695,4.2,"2,286",50,"Saturday, February 19",1,"2,286"
52,B09M75WXNY,PMGCARES Plastic Modern Womaniya Designer 3D DIY Wall Clock Self Adhesive Wall Sticker of Large Size DIY Frameless (Black),PMGCARES,0,0,0,599,3.7,8,33,"Saturday, February 19",1,8
53,B095SFHNQ2,kk craft Plastic Designer Wall Clock (Brown),kk,0,0,0,395,3.3,56,70,"Friday, February 18",0,56
54,B0982ZLVQP,"Heart Home Roman Number Round Shaped Wooden 10"" Wall Clock (Brown, Standard - 25cm x 25cm)",Heart,0,0,0,199,2.8,581,0,"Wednesday, February 16",0,581
55,B09LYQGGNG,Urban Born Metal Wall Clock for Home Decor and Hall 19 inches (44 x 44cm) Home Big Size Living Room Hall Bedroom Stylish Clock (Black Finish) CL003,Urban,0,0,0,"1,099",4.6,9,45,"Monday, February 21",0,9
56,B00N2J2QNU,"Casio Analog Wall Clock (IQ-59-1BDF, Black, 26 x 26 x 4.2 cm)",Casio,1,0,0,"1,196",4.4,257,20,"Saturday, February 19",1,257
57,B07454M93T,"Amazon Brand - Solimo Wood Abstract 12"" Silent Movement Wall Clock (Sheer Black Frame)",Amazon,1,0,0,699,4.0,"2,535",42,"Wednesday, February 16",1,"2,535"
58,B091GB8V1K,"The Next Decor Heavy Metal Analog Wall Clock with Silent Sweep Noiseless Technology Wall Décor for Home & Office(Matte Black, 15 Inch)",The,1,0,0,"1,799",4.3,6,10,"Friday, February 18",1,6
59,B091Q48T4W,L A Deep Glass Wall Clock Antique Style Antique Wall Clock (08 inch),L,1,0,0,690,4.5,2,76,"Tuesday, February 22",0,2
60,B07BDHRXTG,"Ajanta Plastic Abstract Round Wall Clock (2147, 20.5 cm x 20.5 cm x 3.5 cm, Red)",Ajanta,0,0,0,175,3.9,"1,626",0,"Wednesday, February 16",0,"1,626"
61,B08XZJJK1N,"E DEALS Vintage Classic Roulette Plastic Printed Round Shaped Designer Silent Movement Wall Clock with Glass (Black Frame, 10 Inches) Small PWC-401",E,0,0,0,329,3.5,808,67,"Saturday, February 19",1,808
62,B09P7CCGFD,"Marklif Wall Clock, 12 Inch Quality Quartz Battery Operated Round Easy to Read Modern Simple Style Decorative Clock for Home Office School Bedroom Living Room",Marklif,0,0,0,499,4.8,183,75,"Friday, February 18",1,183
63,B09MC45QBG,Sandrose 10 Inch Plastic Wall Clock with Glass for Home Kitchen Living Room Bedroom Office - 3D Multicolor Dail (24 x 24 x 4 cm),Sandrose,0,0,0,348,3.7,19,77,"Saturday, February 19",0,19
64,B0949TMP34,OREX Plastic Stylish Wall Clock (Black),OREX,0,0,0,500,4.6,98,72,"Tuesday, February 22",0,98
65,B091Q48T4W,L A Deep Glass Wall Clock Antique Style Antique Wall Clock (08 inch),L,0,0,0,690,4.5,2,76,"Tuesday, February 22",0,2
66,B08P1JHLSJ,"Ajanta Glass Handpainted Analog Wall Clock (Blue, Green, Red, 33 cm X 33 cm)",Ajanta,0,0,0,534,3.6,54,41,"Saturday, February 19",1,54
67,B07NGXC8B4,"Oreva Roman Figure Round Plastic Analog Abstract Wall Clock (28 x 28x 3.9 cm, Silver, AQ-1457)",Oreva,0,0,0,455,4.3,"3,062",0,"Sunday, February 20",0,"3,062"
68,B07RD7L8QN,"Ajanta Quartz Abstract Plastic Digital LED Rectangle Wall Clock (OLC - 104, Black, 39.6 cm x 29.6 cm x 4.5 cm)",Ajanta,0,0,0,"1,630",3.5,49,7,"Monday, February 21",0,49
69,B09LT7QSKT,Naturel Plastic Round Shape Printed FloweTree Design Wall Clock with Black Frame (24 cm x 24 cm x 3.5 cm) (2019),Naturel,0,0,0,339,0,0,74,"Tuesday, February 22",0,"₹339
₹1,329 Save ₹990 (74%)"
70,B097ZTBQQC,"Nautical Art Handmade Wood, Glass, Aluminium Antique Vintage-Style Wooden Wall Clock ( Brown , 16 inches )",Nautical,0,0,0,995,3.4,25,50,"Tuesday, February 22",0,25
71,B07CQ37PR2,Efinito 12 Inch Dial Vintage Antique Black Station Double Sided Wall Clock for Home/Living Room/Bedroom/Office Silent Movement,Efinito,0,0,0,"1,694",3.8,"1,035",49,"Saturday, February 19",1,"1,035"
72,B084GSQ6NN,sheee Mathematics Designer Plastic Acrylic Frameless Wall Clock & Decor for Living Room/Kitchen/Bedroom/Office - (Not A Sticker),sheee,0,0,0,699,4.2,13,65,"Tuesday, February 22",1,13
73,B07WFPQBJ6,"IIK COLLECTION Analogue Round Abstract Plastic Wall Clock with Glass (Multicolour, 28 x 28 x 6 cm)",IIK,0,0,0,689,3.6,284,54,"Saturday, February 19",1,284
74,B08ZSX9LGC,"ARTINEST Engineered Wood Abstract Round Roman Numerals Craft Wall Clock 12.50-Inches, Brown",ARTINEST,0,0,0,350,0,0,73,"Saturday, February 19",1,"₹350
₹1,299 Save ₹949 (73%)"
75,B098TDZD1C,"Craftique Metal Wall Clock,60 cm,Black Medium",Craftique,0,0,0,"1,499",4.2,145,50,"Monday, February 21",1,145
76,B09DNQLQGB,"RYLAN 12"" Silent Quartz Decorative Wall Clock Non-Ticking Classic Digital Clock Battery Operated Round Easy to Read Room/Home/Kitchen/Bedroom/Office/School- (Rose Gold Black)",RYLAN,0,0,0,599,4.3,721,40,"Saturday, February 19",1,721
77,B07D4J8MRV,"Ajanta Plastic Abstract Wall Clock (21.6 cm x 21.6 cm x 3.2 cm, Black)",Ajanta,0,0,0,195,4.1,"4,405",0,,0,"4,405"
78,B0777LHKY9,"Ajanta Quartz Plastic Abstract Digital Red LED Rectangle Wall Clock OLC - 105 (39.6 cm x 29.6 cm x 3.5 cm, Black)",Ajanta,0,0,0,"1,745",4.1,"2,917",12,"Wednesday, February 16",1,"2,917"
79,B07PCPLDYW,"Oreva AQ 1457 SS Plastic Round Sweep Wall Clock (30.6 x 4.38 x 30.6 cm, Cola)",Oreva,0,0,0,465,3.9,398,21,"Sunday, February 20",0,398
80,B08TWQ71L7,"Webelkart Roman Beautiful Round Wood Wall Clock without Glass (12 Inch x 12 Inch, Brown)",Webelkart,0,0,0,329,3.3,401,87,"Saturday, February 19",0,401
81,B08WKD4WR8,"Clarco Plastic Big Size Designer Analogue Round Wall Clock with Glass (Navy Blue, 12 x 12 Inch)",Clarco,0,0,0,589,4.0,757,61,"Saturday, February 19",1,757
82,B06XRXKNF7,Sehaz Artworks Brown Wall Clocks for Bedroom | Wall Clock for Living Room | Designer Wooden Treebird Clocks for Home/Wall Decor 10 Inch,Sehaz,0,0,0,359,3.7,"1,431",76,"Wednesday, February 16",0,"1,431"
83,B07Z7K6M1Z,"Creative Creation Vinyl Personalized and Customized Photo Hanging Wall Decor Clock Picture Frame (Black, 28cm x 28cm)",Creative,0,0,0,385,4.2,134,68,"Saturday, February 19",1,134
84,B07Q34MCHH,"e-india Wood Guitar Wall Clock (Brown, 20 Inch X 24 Inch)",e-india,0,0,0,555,4.0,18,82,"Monday, February 21",0,18
85,B098RPTTPM,"Home Centre Marble Look Round Wall Clock - 30 cm, White, Standard (CASABLANCA-191007A)",Home,0,0,0,999,2.5,2,0,"Sunday, February 20",1,2
86,B08D9LFDGC,Sapphire Quartz Home and Office Analogue Wall Clock (Golden),Sapphire,0,0,0,365,3.6,67,54,"Friday, February 18",0,67
87,B09Q94LC3J,"Morden Frameless 3D DIY Wall Clock, Big Size MDF Geometry Sticker Numbers Wall Clock Self Adhesive for Living Room Bedroom Office, School and Home DIY-MDF-CLOCK-02",Morden,0,0,0,599,0,0,50,"Saturday, February 19",1,"₹599
₹1,199 Save ₹600 (50%)"
88,B08KM239Y1,Circadian Ajanta Wooden Round Analog Wall Clock Design for Home Hall Living Room Decor Office Kids Bedroom Stylish Ethnic Antique Decorative Black Colour 31 * 31 cm (Pack of 1),Circadian,0,0,0,495,3.6,41,67,"Saturday, February 19",1,41
89,B081547HDL,"Creative Creation Vinyl Personalized and Customized Hanging Photo Frame with Wood Wall Clock (Black, 28cm x 28cm)",Creative,0,0,0,399,5.0,7,67,"Saturday, February 19",1,7
90,B076VCP1LH,"Amazon Brand - Solimo 12 inch Plastic & Glass Wall Clock - Vintage Paneling (Silent Movement, Black Frame)",Amazon,0,0,0,744,4.0,"1,040",38,"Wednesday, February 16",1,"1,040"
91,B08G8P36SB,"Ajanta Quartz Plastic Vintage Wall Clock (Light Oak, 406 x 406 x 61 mm)",Ajanta,0,0,0,"1,095",4.3,182,15,"Saturday, February 19",1,182
92,B08TCFF78D,"LYONIC Ajanta Mfg.Quartz Superhero Sweep & Silent Movement Plastic Machine for Wall Clock without Needle (Black, Made in India)",LYONIC,0,0,0,235,4.1,152,61,"Friday, February 18",0,152
93,B09QCXGZB3,Acrylic DIY Frameless 3D Mirror Sticker Large Wall Clock for Home Office Decorations (Black),Acrylic,0,0,0,599,5.0,1,40,"Saturday, February 19",1,1
94,B07T9T2WNB,Circadian Ajanta Wooden Round Analog Wall Clock Design for Home Hall Living Room Decor Office Kids Bedroom Stylish Ethnic Antique Decorative White Colour 31 * 31 cm (Pack of 1),Circadian,0,0,0,495,3.6,189,67,"Saturday, February 19",1,189
95,B09GPBT76H,"D'CLOCK Combo of Ajanta Mfg. Battery Operated Plastic Ticking Wall Clock Movement Machine with Hands (Needles : Antique Maroon, Gold) (Made in India 100%)",D'CLOCK,0,0,0,249,4.2,24,75,"Saturday, February 19",1,24
96,B09NF12KN7,Squar Round Shape Decorative Wall Clock with Glass for Home/Kitchen/Living Room/Bedroom/Office-White Print (24 cm x 24 cm 3.4 cm),Squar,0,0,0,299,3.8,4,79,"Tuesday, February 22",0,4
97,B07CSLF2Q8,"Design Connection MDF Wooden Abstract Wall Clock (28 x 28 cm, Multicolour)",Design,0,0,0,399,4.3,244,67,"Saturday, February 19",1,244
98,B08ZL4P3XZ,Circadian Ajanta Wooden Analog Wall Clock Design for Home Hall Living Room Decor Office Kids Bedroom Stylish Ethnic Antique Decorative Multi Colour Peacock 36 * 36 cm (Pack of 1),Circadian,0,0,0,589,4.8,6,61,"Saturday, February 19",1,6
99,B08L1S8CDG,SRS Trends Plastic Wall Clock for Home Living Room Bedroom and Office (Round 25.4 X 25.4 cm) (Cadbury Design) Black & Brown with Glass,SRS,0,0,0,299,5.0,2,47,"Saturday, February 19",0,2
100,B098P61Z52,Urban Born Metal Wall Clock for Home and Hall 17 inches (44 x 44cm) Home Big Size Living Room Hall Bedroom Stylish Clock (Black),Urban,0,0,0,"1,099",4.0,260,31,"Monday, February 21",0,260
101,B09DDKTH6M,"OREX Plastic Stylish Wall Clock for Home/Living Room/Bedroom/Kitchen/Hall/Office/Kids Room/Shop (34, Black)",OREX,0,0,0,499,4.2,26,58,"Tuesday, February 22",0,26
102,B07454M93T,"Amazon Brand - Solimo Wood Abstract 12"" Silent Movement Wall Clock (Sheer Black Frame)",Amazon,0,0,0,699,4.0,"2,535",42,"Wednesday, February 16",1,"2,535"
103,B07QS2ZYQG,"EFINITO Plastic Silent Movement Abstract Designer Sun Wall Clock (Dark Brown, 18 Inch)",EFINITO,0,0,0,829,3.4,273,72,"Sunday, February 20",0,273
104,B09MJ2ZDWW,Ajanta Wall Clock Designer 14 Inches Wall Clock for Home Bedroom Living Room Hall,Ajanta,0,0,0,"1,095",3.8,7,8,"Saturday, February 19",1,7
105,B09NRLS933,"Odlora Big Size Designer Analogue Round Wall Clock for Kids (Silent Movement, 12 x 12 Inch, KDS-004)",Odlora,0,0,0,499,0,0,67,"Saturday, February 19",0,"₹499
₹1,499 Save ₹1,000 (67%)"
106,B08MFJZS9G,"asian multistore hub Ajanta Diamond Stylish Big Size Wall Clock (Pitamber Yellow, 12 x 12 Inch, Wood)",asian,0,0,0,549,3.7,197,58,"Saturday, February 19",1,197
107,B07DLXYBGQ,"Ajanta Plastic Wall Clock (31.9 cm x 28 cm x 3.5 cm, Ivory), Abstract",Ajanta,0,0,0,405,4.0,97,0,"Saturday, February 19",0,97
108,B09Q1GNY1S,ZEPOLI - Wall Clock Silent Battery Operated Round Wall Clock Modern Simple Style Decor Clock Non-Ticking (Golden Leaf),ZEPOLI,1,0,0,595,4.3,65,46,"Saturday, February 19",0,65
109,B09LT8HSKB,Naturel Plastic Round Shape Printed FloweTree Design Wall Clock with Black Frame (24 cm x 24 cm x 3.5 cm) (2009),Naturel,1,0,0,339,3.7,6,74,"Tuesday, February 22",0,6
110,B09Q38VT74,Sandrose Designer Analogue Round Wall Clock with Glass for Home/Kitchen Clock Size 24 cm (3D-WOOD-61),Sandrose,1,0,0,345,5.0,2,51,"Tuesday, February 22",0,2
111,B09PZ5CLJW,Squar Round Shape Wall Clock with Glass for Home/Kitchen/Living Room/Bedroom/Office-Dark Yellow (24 cm x 24 cm 3.4 cm),Squar,1,0,0,299,0,0,79,"Tuesday, February 22",0,"₹299
₹1,400 Save ₹1,101 (79%)"
112,B09LT9MR66,Naturel Plastic Round Shape Multicolor Wall Clock with Black Frame (2007),Naturel,0,0,0,339,4.0,1,74,"Tuesday, February 22",0,1
113,B09MJ2ZDWW,Ajanta Wall Clock Designer 14 Inches Wall Clock for Home Bedroom Living Room Hall,Ajanta,0,0,0,"1,095",3.8,7,8,"Saturday, February 19",1,7
114,B09NRLS933,"Odlora Big Size Designer Analogue Round Wall Clock for Kids (Silent Movement, 12 x 12 Inch, KDS-004)",Odlora,0,0,0,499,0,0,67,"Saturday, February 19",0,"₹499
₹1,499 Save ₹1,000 (67%)"
115,B07DLXYBGQ,"Ajanta Plastic Wall Clock (31.9 cm x 28 cm x 3.5 cm, Ivory), Abstract",Ajanta,0,0,0,405,4.0,97,0,"Saturday, February 19",0,97
116,B07QS2ZYQG,"EFINITO Plastic Silent Movement Abstract Designer Sun Wall Clock (Dark Brown, 18 Inch)",EFINITO,0,0,0,829,3.4,273,72,"Sunday, February 20",0,273
117,B08P9562NJ,"Steven Quartz LED Light Round Silent Moment No Tic Tic Plastic Wall Clock (Blue, 31cm x 31cm)",Steven,0,0,0,650,3.2,25,69,"Monday, February 21",1,25
118,B01MT11MKL,"ANTIQUE Plastic Round Shape Wall Clock with Glass (Black Frame, Mix color)",ANTIQUE,0,0,0,339,3.2,13,77,"Tuesday, February 22",0,13
119,B09K6MGHCR,"NATUREL Plastic Round Shape Wall Clock with Black Frame - Vintage Flower, 24 cm x 24 cm x 3.5 cm (2041)",NATUREL,0,0,0,345,4.0,13,74,"Tuesday, February 22",0,13
120,B092R64F9Z,"The Next Decor Roman Modern Round Metal with Noiseless Machine Wall Clock for Wall Decor (Matte Black, 15 Inch)",The,0,0,0,"1,799",4.3,230,10,"Friday, February 18",1,230
121,B07BSX186H,"Ajanta Plastic Abstract Sweep Clock (30.3 cm x 30.3 cm x 4.5 cm, Brown)",Ajanta,0,0,0,0,3.9,385,0,,0,385
122,B09MJFMMKW,"Naturel for shed Printed Round Shaped Designer Wall Clock with Glass for Home/Living Room/Bedroom/Kitchen/Office (Black Frame,24 cm x 24 cm x 3.5 cm)",Naturel,0,0,0,345,4.0,22,74,"Tuesday, February 22",0,22
123,B09H37YKL7,Ajanta Quartz Plastic Digital Wall Clock for Home and Office (Green Led),Ajanta,0,0,0,"1,495",4.4,16,0,"Saturday, February 19",1,16
124,B09CNGGZ4P,AERINA ACRYLIC WORLD Foam DIY Creative 3D Stickers Analogue Plastic Wall Clock (1101 Black),AERINA,0,0,0,849,3.8,116,47,"Saturday, February 19",1,116
125,B09D2VY346,"Nautical Collection Wooden Wall Clock Antique Style Art Unique Decorative, Brown, 12 inch",Nautical,0,0,0,"1,187",3.8,82,76,"Monday, February 21",0,82
126,B091CX1T76,Circadian Plastic Analog Islamic Allah Wall Clock Design for Home Hall Living Room Decor Office Bedroom Kids Antique Stylish Black Colour 28*28 cm Clocks ( Pack Of 1 ),Circadian,0,0,0,318,3.8,363,68,"Saturday, February 19",0,363
127,B08W2BNNBR,"CraftEmporio Plastic Pendulum Wall Clock (Brown, 35 x 27 x 7 cm)",CraftEmporio,0,0,0,399,3.4,172,60,"Sunday, February 20",0,172
128,B07ZXXLDPW,A One Shoppe MDF Wall Clock for Living Room Bedroom & Office Home Clock (40 x 40 x 2 .5 cm) (White Colour Fancy)(Quantity - 01 Piece),A,1,0,0,997,3.8,54,67,"Monday, February 21",1,54
129,B01718WT7U,Vintage Clock Double Side Iron Wall Clock / 8 Inches Size / 1 Year Warranty,Vintage,1,0,0,"1,495",4.4,"3,221",74,"Saturday, February 19",1,"3,221"
130,B092SMGYQ8,Elica 12-inch - Vintage Style Classic Wall Clock Big Size (Gold-RF),Elica,1,0,0,445,4.1,7,66,"Friday, February 18",0,7
131,B08LQPZPH1,Sapphire Quartz Home and Office Designer Analogue Wall Clock (COLA),Sapphire,1,0,0,399,4.2,66,69,"Friday, February 18",0,66
132,B08VHMXKYM,SAREE HOUSE 12 Inch Metal Analog Vintage Railway Station Antique Style Double Sided Wall Clock (Black),SAREE,0,0,0,"1,649",4.5,9,50,"Saturday, February 19",1,9
133,B07NGVTKT4,"Oreva Round Plastic Abstract Wall Clock (32 x 32 x 2 cm, White Dial And Silver Rim AQ-1687)",Oreva,0,0,0,490,3.8,"1,747",0,"Thursday, February 17",0,"1,747"
134,B07BSWXZG6,"Ajanta Plastic Abstract Wall Clock (28 cm x 28 cm x 3.4 cm, White)",Ajanta,0,0,0,320,4.0,"2,093",0,,0,"2,093"
135,B078RP2H4K,Story@Home 10-inch Round Shape Wall Clock with Glass for Home/Kitchen/Living Room/Bedroom/Office (Purple),Story@Home,0,0,0,199,3.6,55,75,"Saturday, February 19",0,55
136,B097C2NV2Q,"Shopvilla Metal Antique Big Hanging Decorative Watch with Silent Movement (40 cm, Matte Black)",Shopvilla,0,0,0,"1,199",4.2,78,40,"Monday, February 21",0,78
137,B09C43Q4CJ,"SRS Trends Stylish Blue Map Printed Plastic Wall Clock Round Shaped Designer Wall Clock with Glass, Size 25.4 X 25.4 cm for Home/Living Room/Bedroom/Kitchen/Office, Black Frame",SRS,0,0,0,299,2.3,6,47,"Thursday, February 24",0,6
138,B098RPTTPM,"Home Centre Marble Look Round Wall Clock - 30 cm, White, Standard (CASABLANCA-191007A)",Home,0,0,0,999,2.5,2,0,"Sunday, February 20",1,2
139,B09DJ8C1N8,"ANTIQUE 10 inch Round Shape Wall Clock with Plastic and Glass for Home/Kitchen/Living Room/Bedroom/Office, Black Multicolor (25.4 x 25.4 x 4 cm)",ANTIQUE,0,0,0,348,4.1,59,77,"Tuesday, February 22",0,59
140,B09PLH8VRS,"Sehaz Artworks Printed Wall Clocks | Wall Clock for Home Decor (11 Inch, Old_own_London)",Sehaz,0,0,0,329,1.0,1,78,"Friday, February 18",0,1
141,B09FHJ68M6,"Auromin Designer Stylish Metal Wall Clock for Living Room, Bedroom, Office, Kitchen, Home and Hall, Fancy Big Size Modern Wall Watch for Home Decor(40 cm, Matte Black)",Auromin,0,0,0,"1,299",4.2,83,35,"Monday, February 21",0,83
