,asin,title,brand,Sponsored,Best Seller,Amazon's Choice,Price,Rating,NoofRatings,Discount,Delivery,Prime Delivery,base
0,B09NVR4FQG,"Kraft Bazaar's Solid Wooden Merlin Large TV Cabinet | TV Stand with Metal Doors and Handles | TV Unit for Living Room | Finish- Light Brown, PU Black",Kraft,1,0,0,"15,005",0,0,46,"Friday, March 4",0,"₹15,005
₹27,999 Save ₹12,994 (46%)"
1,B09PBSQ96Y,"Bluewud Primax Neo Engineered Wood Tv Wall Unit, Set Top Box Stand, Wenge & White, Standard, for Upto 42""",Bluewud,1,0,0,"3,099",0,0,33,"Tuesday, February 22",1,"₹3,099
₹4,599 Save ₹1,500 (33%)"
2,B09RB4HHVZ,"ESTANTERIA Diamond Engineered Wood TV Stand Entertainment Unit with Storage Display Rack - TV Cabinet for Living Room, Office (Wenge Finish)",ESTANTERIA,1,0,0,"2,699",0,0,50,"Wednesday, February 23",0,"₹2,699
₹5,399 Save ₹2,700 (50%)"
3,B09QYGNCW6,"ESTANTERIA Brande Engineered Wood TV Stand Entertainment Unit with Storage Display Rack - TV Cabinet for Living Room, Office (Wenge)",ESTANTERIA,1,0,0,"2,999",0,0,49,"Wednesday, February 23",0,"₹2,999
₹5,899 Save ₹2,900 (49%)"
4,B08S3YDC23,AAROORA Gaya-H3 Engineered Wood TV Table Unit Display Storage Cabinet Rack with Decor 3 Shelf (Wenge Finish),AAROORA,0,0,1,"2,499",4.1,126,68,"Saturday, February 26",1,126
5,B096VN8BDG,"Furnifry Wooden TV Entertainment Unit with 2 Wall Shelf/Wall Set Top Box Shelf Stand/TV Cabinet for Wall/Set Top Box Holder for Home/Living Room Ideal for TV Upto 42"" (Black/White)",Furnifry,0,0,0,0,3.4,430,0,,0,430
6,B07RGH2XMH,Future Generation v Group TV Setup Box and Remote Stand,Future,0,0,0,599,3.5,26,76,"Tuesday, February 22",0,26
7,B07D6SJYVN,"Bluewud Coober Engineered Wood Tv Entertainment Wall Unit Wenge, Large, for Upto 42""",Bluewud,0,0,0,"2,149",4.4,"1,918",43,"Wednesday, February 23",1,"1,918"
8,B07B2YN3BH,AAROORA Engineered Wood TV Table Unit Display Storage Cabinet Rack with Decor Shelf (Wenge Finish),AAROORA,0,0,0,"2,199",4.0,484,68,"Thursday, February 24",1,484
9,B09PL7WGVH,"Furnifry Wooden TV Entertainment Unit/TV Cabinet for Wall/Wall Set Top Box Shelf Stand/Wall Mounted TV Stand/Set Top Box Holder for Home/Living Room/Bedroom Ideal for TV Upto 42"" (White/Grey)",Furnifry,0,0,0,"2,499",2.4,17,67,"Wednesday, February 23",1,17
10,B07RS2L6TV,"Bluewud Primax Engineered Wood Tv Entertainment Wall Unit Wenge & White, Standard, for Upto 42""",Bluewud,0,1,0,"2,999",4.2,"2,781",53,"Tuesday, February 22",1,"2,781"
11,B09HNPT3FZ,"DAS Volker Engineered Wood Wall Mount TV Entertainment Unit/with Set Top Box Stand | 6 Wall Shelf Display Rack for Living Room Flowery Wenge Large (Ideal for up to 55"") Screen",DAS,0,0,0,"2,699",4.2,37,61,"Monday, February 21",1,37
12,B07DCVL34G,"DeckUp Uniti TV Stand and Home Entertainment Unit (Walnut, Matte Finish)",DeckUp,0,0,0,"7,149",4.5,"2,232",51,"Saturday, February 26",0,"2,232"
13,B09PHCV4XW,"Furnifry Wooden Wall Mounted Floating TV Stand/TV Entertainment Unit/TV Cabinet with Rack for Set Top Box & Decorative Objects/TV Stand Unit for Living Room with Storage Shelf (90x8x11 Cm, Black & White)",Furnifry,0,0,0,"1,349",3.1,13,66,"Wednesday, February 23",1,13
14,B08D4S69X1,"Ereteken ART TV Entertainment Unit/Wall Set Top Box Stand Shelf (Standard,Black)",Ereteken,0,0,0,399,3.8,43,73,"Wednesday, February 23",0,43
15,B09NNG5W6M,"Furnifry Wooden TV Panel/TV Entertainment Unit with 2 Wall Shelf/Wall Set Top Box Shelf Stand/TV Panel for Wall/TV Panel Cabinet for Home/Living Room/Ideal for TV Upto 42"" (Black and White)",Furnifry,0,0,0,"1,799",3.2,19,55,"Wednesday, February 23",1,19
16,B06WGS759B,"Bluewud Oliver Engineered Wood Tv Entertainment Unit Cabinet with Storage, Wenge, for Upto 42""",Bluewud,0,0,0,"2,699",4.0,702,59,"Tuesday, February 22",1,702
17,B08L7BGWG8,"DAS Wall Mount TV Entertainment Unit/with Set Top Box Stand and 3 Wall Shelves Display Rack Classic Walnut (Ideal for up to 43"") Screen- Zeenat",DAS,0,0,0,"1,849",3.9,91,63,"Monday, February 21",1,91
18,B08J2JKCY9,"DeckUp TV9040A Tube-N-Turn Engineered Wood 2 Door TV Entertainment Unit (Dark Wenge, Engineered Wood)",DeckUp,0,0,0,"2,849",3.7,89,43,"Monday, February 21",1,89
19,B099RMVS3C,Doliva Foldable Screen Top Stand Adjustable Non Slip TV Screen Top Shelf Computer Display Setup Box Storage Desk Home Office Desktop Organizer Shelf,Doliva,0,0,0,399,3.5,28,43,"Monday, February 21",1,28
20,B08B1HRFBQ,"Demiwall Wooden Entertainment Tv Unit for Living Room | Television Stand with 3 Drawer & Shelf Storage for Home | Mango Wood, Natural Teak Finish",Demiwall,1,0,0,"18,500",3.8,5,47,,1,5
21,B08LMLSS2T,"ETIQUETTE ART TV Entertainment Unit Set Top Box Stand Wall Mounted Shelf Racks Wooden tv cabinets for Home Living Room Floating Shelves for Living Room, Bedroom (Set of 1 ,Brown)",ETIQUETTE,1,0,0,999,4.1,38,67,"Wednesday, February 23",0,38
22,B08B1J148G,"Demiwall Wooden Entertainment Tv Unit for Living Room | Television Stand with 3 Drawer & Shelf Storage for Home | Sheesham Wood, Rustic Teak Finish",Demiwall,1,0,0,"19,000",4.1,10,30,,1,10
23,B09N3VQQNZ,"INDIAN DECOR 46120 TV Stand, Soundbar Riser. HI-FI Media Storage Shelf. Sound System Docking Station. Industrial, Heavy-Duty Furniture. Modern Minimal Style - Black",INDIAN,1,0,0,"4,999",0,0,50,"Friday, February 25",0,"₹4,999
₹9,999 Save ₹5,000 (50%)"
24,B08PZJBTGF,"Dime Store Wooden Wall Mounted TV Unit, TV Cabinet for Wall, TV Stand for Wall, TV Stand Unit Wall Shelf for Living Room, Set Top Box Stand (Large, Total Brown)",Dime,0,0,0,"2,199",3.8,"1,013",56,"Wednesday, February 23",1,"1,013"
25,B08L1PM6VP,"DAS Engineered Wood Wall Mount TV Entertainment Unit with Set Top Box Stand and 6 Wall Shelves - Ideal for up to 48"" (Black and White )",DAS,0,0,0,"3,149",4.0,74,61,"Monday, February 21",1,74
26,B07V3H9VBF,"Bluewud Primax Engineered Wood Tv Entertainment Wall Unit Wenge & White, Large, for Upto 55""",Bluewud,0,0,0,"3,449",4.2,"2,080",47,"Tuesday, February 22",1,"2,080"
27,B09GKR2V7H,"Anikaa Charley Engineered Wood Wall Mount TV Unit/TV Stand/Wall Set Top Box Stand/TV Cabinet/TV Entertainment Unit (Wenge/White)(Ideal for Upto 52"")(D.I.Y)",Anikaa,0,0,0,"4,399",3.9,59,63,"Monday, February 21",1,59
28,B09D2QR2R6,"Lu Sea Wud TV Cabinet Wall Shelves, Smart LED TV Entertainment Unit Wooden Set Top Box Stand | TV Stand Wall Shelf for Living Room Stylish | Hanging Rack Organizer | Home Decor Furniture - Ideal Upto 32"" LED TV (Colour- Brown)",Lu,0,0,0,748,4.4,14,63,"Tuesday, February 22",1,14
29,B099RV9Q1V,"Anikaa Tyron Engineered Wood TV Entertainment Unit, Wall Mounted TV Unit/Wall Mounted Stand for Set Top Box (Wenge)(Ideal for Upto 42"")(D.I.Y)",Anikaa,0,0,0,"4,299",4.3,47,52,"Monday, February 21",1,47
30,B09LYZJVQB,WooDinto® Wall Rack| Wall Mounted Stand| Wall Holder| TV Unit Wooden| TV Unit Shelf| TV Unit Rack| TV Unit Wall Mount| TV Units| TV Unit Shelves,WooDinto®,0,0,0,"1,299",4.1,6,48,"Wednesday, February 23",0,6
31,B08XXJPLN3,"Furnifry Wooden Wall Mounted Floating TV Stand/TV Entertainment Unit/TV Cabinet with Racks for Set Top Box & Decorative Objects/TV Stand Unit for Living Room with Storage Shelf(43.3x9.2x9.2 In, Wenge)",Furnifry,0,0,0,"1,749",3.7,48,71,"Wednesday, February 23",1,48
32,B07873RXV9,Klaxon Z Shape Engineered Wood TV Unit/Display Storage Cabinet Rack with Decor Shelf (Brown),Klaxon,0,0,0,"3,066",3.8,429,57,"Monday, February 21",1,429
33,B09B5XF7NL,"DAS Bolivar High Strength & Durable Wall Mount TV Entertainment Unit/with Set Top Box Stand and 6 Wall Shelf Display Rack for Living Room Flowery Wenge Large (Ideal for up to 55"") Screen",DAS,0,0,0,"3,749",4.0,24,49,"Monday, February 21",1,24
34,B08622Q6KQ,Anikaa Revolt Engineered Wood Wall Mount TV Unit/TV Stand/Wall Set Top Box Stand/TV Cabinet/TV Entertainment Unit (Wenge)(Ideal for 42.52 Inch)(D.I.Y),Anikaa,0,0,0,"2,774",3.9,107,55,"Monday, February 21",1,107
35,B08LZPNHZJ,"ANTICO WOODENIA® Engineered Wood TV Unit Rack| TV Units| TV Unit Shelf| TV Unit Wall Mount | Wooden Cabinet| Floating Shelves For Home Décor (Glossy , Umbra Furbish Black )",ANTICO,0,0,0,839,4.0,360,62,"Tuesday, February 22",0,360
36,B079FZ4T9D,Klaxon Sigma Engineered Wood TV Unit/Display Storage Cabinet Rack with Decor Shelf (Black),Klaxon,0,0,0,"2,869",3.7,119,56,"Tuesday, February 22",1,119
37,B09R22ZGSH,"Furnifry Wall Mounted 3 Tier TV Entertainment Unit/Table Storage & Decor Wood TV Cabinet for Living Room, Bedroom/Wall Set Top Box Floating Shelf Nightstand Cabinet/3 Tier Drawer (36x8x4.5 in, White)",Furnifry,0,0,0,"1,994",5.0,1,60,"Wednesday, February 23",1,1
38,B08ZJH2TGQ,Anikaa Carlet Engineered Wood Wall Mount TV Unit/TV Stand/Wall Set Top Box Stand/TV Cabinet/TV Entertainment Unit (Wenge/White)(Ideal for 32-40 Inch)(D.I.Y),Anikaa,0,0,0,"2,174",3.8,87,57,"Monday, February 21",1,87
39,B079FMB62R,Klaxon Deacon Engineered Wood TV Unit/Display Storage Cabinet Rack with Decor Shelf (Walnut),Klaxon,0,0,0,"2,879",3.3,130,60,"Friday, February 18",1,130
40,B097LVSFW4,.TV Setup Box & Remote Stand Wooden Wall Shelf Wooden Wall Shelf/Setup Box Stand for Home Wall Stylish,.TV,0,0,0,647,4.0,1,35,"Tuesday, February 22",1,1
41,B097LWP424,"Wooden Set Top Box Stand Wall Mounted TV Cabinets Wall Selves Holds Speaker, Cable Boxes, Streaming Device, Game Console, Remote, WiFi Router and More.",Wooden,0,0,0,645,3.0,1,35,"Tuesday, February 22",1,1
42,B09HVDKHB8,NR DECOR TV Entertainment Unit Set Top Box Stand Wall Mounted Shelf Racks Wooden tv cabinets for Home Living Room Floating Shelves for Bedroom Brown,NR,0,0,0,649,3.1,17,54,"Thursday, February 24",0,17
43,B08PFRXH87,"ANTICO WOODENIA® Dual Length Engineered Wood Set top Box Stand|TV Unit Shelf| TV Unit Rack| TV Unit Wall Mount For Home Decor ( Glossy ,Umbra Furbish Black)",ANTICO,0,0,0,839,3.6,465,62,"Tuesday, February 22",0,465
44,B08PCCKLSB,Incredible Hub TV Entertainment Unit/Wall Set Top Box Stand/Set Top Box Holder/Shelf/Rack (Brown),Incredible,0,0,0,"1,299",4.0,11,68,"Tuesday, February 22",1,11
45,B08DHFL16Q,"Bluewud Aero Engineered Wood Tv Entertainment Wall Unit White, Standard, for Upto 32""",Bluewud,0,0,0,"1,149",4.0,35,54,"Wednesday, February 23",1,35
46,B08LMLSS2T,"ETIQUETTE ART TV Entertainment Unit Set Top Box Stand Wall Mounted Shelf Racks Wooden tv cabinets for Home Living Room Floating Shelves for Living Room, Bedroom (Set of 1 ,Brown)",ETIQUETTE,0,0,0,999,4.1,38,67,"Wednesday, February 23",0,38
47,B07RRYJ31V,"Bluewud Millie Engineered Wood Tv Wall Unit, Set Top Box Stand Wenge, for Upto 42""",Bluewud,0,0,0,"1,249",4.2,176,42,"Wednesday, February 23",1,176
48,B09PNJP9LC,"Furnifry Engineered Wood TV Entertainment Unit/TV Stand/Storage Cabinet/Storage Unit/Set-Top Box Stand for Home/TV Table Centre Unit/Living Room/Bedroom (109 x 33.5 x 45.5 cm, Walnut-White)",Furnifry,0,0,0,"2,599",0,0,57,"Wednesday, February 23",1,"₹2,599
₹5,999 Save ₹3,400 (57%)"
49,B09R9F6219,"PLANTZY Wooden TV Entertainment Unit/Wall Set Top Box Shelf Stand/TV Cabinet for Wall/Set Top Box Holder for Home/Living Room Ideal for TV Upto 42"" (White/Walnut)",PLANTZY,0,0,0,"2,599",0,0,65,"Thursday, February 24",0,"₹2,599
₹7,499 Save ₹4,900 (65%)"
50,B09LVC54ZL,"Redwud Hazel Engineered Wood TV Entertainment Unit/TV Cabinet/Wall Mounted TV Unit/TV Stand for Wall/TV Stand Unit Wall Shelf for Home Living Room(White) - Ideal for Upto 50"" (D.I.Y)",Redwud,0,0,0,"2,998",5.0,2,67,"Monday, February 21",1,2
51,B07D7VHCPG,"Bluewud Kunsua Engineered Wood Tv Entertainment Wall Unit Wenge, Standard, for Upto 32""",Bluewud,0,0,0,"1,599",4.0,883,47,"Wednesday, February 23",1,883
52,B079FZHX5F,Klaxon Vector Engineered Wood TV Unit/Display Storage Cabinet Rack with Decor Shelf (Walnut),Klaxon,0,0,0,"3,379",3.9,243,50,"Sunday, February 20",1,243
53,B01LYFUNIA,"Home Sparkle Wall Mounted TV Entertainment Unit with 2 Wooden Carved Open Shelf Storage for Set Top Box and Wi-Fi Router Ideal for Living Room, Bedroom (Black)",Home,0,0,0,"1,068",4.2,"1,399",66,"Friday, February 18",1,"1,399"
54,B09GKNCMWP,"Redwud Henley Engineered Wood TV Entertainment Unit, TV Cabinet with Wall Shelves, Wall Mounted TV Unit, TV Cabinet with Shelf (Wenge White) - Ideal for Upto 52""",Redwud,0,0,0,"4,339",4.0,26,64,"Monday, February 21",1,26
55,B091GWK9S1,"SAROHA DECORE TV Entertainment Unit Set Top Box Stand Wall Mounted Shelf Racks Wooden tv cabinets for Home Living Room Floating Shelves for Living Room, Bedroom (Set of 1 , Brown)",SAROHA,0,0,0,740,3.7,69,26,"Tuesday, February 22",0,69
56,B08J7GY6L1,"Inmarwar Wooden Entertainment TV Unit for Living Room | TV Stand with 2 Doors Cabinet & 2 Shelf Storage| Mango Wood & Iron, Dark Brown Mango Wood Finish",Inmarwar,1,0,0,"18,399",5.0,7,40,,1,7
57,B0976X7QX2,"Demiwall Wooden Entertainment Tv Cabinet Unit for Living Room | Television Stand with 2 Shelf, 2 Drawers & Door Cabinet Storage for Bedroom & Home | Sheesham Wood, Natural Brown",Demiwall,1,0,0,"23,000",0,0,28,"Tuesday, March 8",0,"₹23,000
₹32,000 Save ₹9,000 (28%)"
58,B06WGS759C,"Bluewud Leo Engineered Wood Tv Entertainment Unit Cabinet with Storage, Walnut, for Upto 42""",Bluewud,1,0,0,"3,949",3.7,373,51,"Tuesday, February 22",1,373
59,B08JLWHH5K,"Kundi Engineered Wood Floating TV Stand Wall Mounted Media Console Entertainment Storage Shelf (Set of 1 ,White)",Kundi,1,0,0,"1,199",4.1,"1,282",40,"Wednesday, February 23",0,"1,282"
60,B09JSKKMC2,Heera Moti Corporation Prides TV Entertainment Wall Mount Unit/Wall Panel for tv Unit (Finish : Black Matt),Heera,1,0,0,"9,999",3.1,3,33,"Monday, February 21",1,3
61,B08B1LHJHW,"Demiwall Wooden Entertainment Tv Unit for Living Room | Television Stand with Cabinet, Drawer & Shelf Storage for Home | Sheesham Wood, Rustic Teak Finish",Demiwall,1,0,0,"18,999",3.8,5,42,,1,5
62,B08J7ZDV73,"Inmarwar Wooden Entertainment TV Unit for Living Room | TV Stand with 2 Drawers & Shelf Storage| Mango Wood & Iron, Dark Brown Mango Wood Finish",Inmarwar,1,0,0,"14,899",5.0,7,40,,1,7
63,B08ZKK99T2,"Demiwall Solid Wood Entertainment Tv Cabinet for Living Room | Television Stand with 2 Drawer & Open Shelf Storage for Home | Mango Wood, Rustic Brown",Demiwall,1,0,0,"15,001",0,0,47,"Friday, March 25",0,"₹15,001
₹28,169 Save ₹13,168 (47%)"
64,B08LNWXZ4M,"DAS Wall Mount TV Entertainment Unit/with Set Top Box Stand for Living Room Wenge (Ideal for up to 42"") Screen- Alfric",DAS,0,0,0,"1,449",4.0,34,53,"Monday, February 21",1,34
65,B08G8Q32WM,"DECORVAIZ Wooden Wall Mounted TV Unit, TV Cabinet for Wall, TV Stand for Wall, TV Stand Unit for Wall for Living Room | Ideal for TV Upto 42"" (Black/Brown, Accessories Included)",DECORVAIZ,0,0,0,"3,141",4.0,345,60,"Wednesday, February 23",1,345
66,B08XN1Y6QY,ASMI Traders TV Entertainment Unit Set Top Box Stand Wall Mounted Shelf Racks Wooden tv cabinets for Home Living Room Floating Shelves for Bedroom,ASMI,0,0,0,699,3.5,10,46,"Friday, February 25",0,10
67,B09B5XT3JY,"DAS Bolivar High Strength & Durable Wall Mount TV Entertainment Unit/with Set Top Box Stand and 6 Wall Shelf Display Rack for Living Room Black & White Large (Ideal for up to 55"") Screen",DAS,0,0,0,"3,749",4.1,55,49,"Monday, February 21",1,55
68,B07P3VNFD4,Anikaa Ester Engineered Wood Wall Mount TV Unit/TV Stand/Wall Set Top Box Stand/TV Cabinet/TV Entertainment Unit (Walnut)(D.I.Y),Anikaa,0,0,0,"1,114",3.7,2,55,"Monday, February 21",1,2
69,B0836QB2R7,"FABULO Wooden Floating TV Entertainment Unit - Wall Mounted Stand for Set Top Box, Wall Hanging Storage Shelf/Cabinet/Rack for Home, Bedroom, Living Room – Black",FABULO,0,0,0,979,3.8,652,76,"Wednesday, February 23",1,652
70,B06WGS6FNS,"Bluewud Victor Engineered Wood Tv Entertainment Unit Cabinet with Storage, Wenge, for Upto 42""",Bluewud,0,0,0,"3,699",4.1,372,43,"Tuesday, February 22",1,372
71,B08R9L5MBR,"Driftingwood Wooden Entertainment Tv Unit for Living Room | Television Stand with 2 Door Cabinet, 2 Drawers & Shelf Storage for Bedroom | Sheesham Wood, Teak Brown",Driftingwood,0,0,0,"12,349",4.3,56,52,,1,56
72,B06VX47DM9,"Bluewud Reynold Engineered Wood Tv Entertainment Wall Unit Walnut, Large, for Upto 50""",Bluewud,0,0,0,"2,949",4.4,"1,266",44,"Tuesday, February 22",1,"1,266"
73,B08DL7SYGF,"Heera Moti Corporation Anamic TV Stand Entertainment Center Unit for Decorative Furniture Standard, Upto 50 in(Finish :-White pre- laminted Matt)",Heera,0,0,0,"2,999",3.7,14,57,"Monday, February 21",1,14
74,B09FB1PZ6K,Abhika Arts Floating Wall Mount Tv Entertainment Unit for Set top Box Stand (Black),Abhika,0,0,0,399,3.7,20,50,"Tuesday, February 22",0,20
75,B08L78FRHG,"DAS Wall Mount TV Entertainment Unit/with Set Top Box Stand and 3 Wall Shelves Display Rack Wenge (Ideal for up to 43"") Screen- Zeenat",DAS,0,0,0,"1,849",3.9,140,63,"Monday, February 21",1,140
76,B06XMXN38X,"Bluewud Leo Engineered Wood Tv Entertainment Unit Cabinet with Storage, Wenge, for Upto 42""",Bluewud,0,0,0,"3,949",3.7,373,51,"Tuesday, February 22",1,373
77,B08422MWH2,Furinno sheesham wood standard tv entertainment unit multipurpose display storage cabinet with 2 door and 2 shelf for living room bedroom home office hotel (natural brown finish),Furinno,0,0,0,"15,994",4.5,33,35,"Friday, February 25",0,33
78,B08JLWHH5K,"Kundi Engineered Wood Floating TV Stand Wall Mounted Media Console Entertainment Storage Shelf (Set of 1 ,White)",Kundi,0,0,0,"1,199",4.1,"1,282",40,"Wednesday, February 23",0,"1,282"
79,B01HRIIV80,"AVF SDC600CMBB-A TV Stand with Cable Management for up to 32-inch TVs, Black Glass, Black Legs",AVF,0,0,0,0,4.3,182,0,,0,182
80,B08S3YDC23,AAROORA Gaya-H3 Engineered Wood TV Table Unit Display Storage Cabinet Rack with Decor 3 Shelf (Wenge Finish),AAROORA,1,0,1,"2,499",4.1,126,68,"Saturday, February 26",1,126
81,B08DL5Q1SM,"Heera Moti Corporation Bruna TV Stand Entertainment Center Unit for Decorative Furniture Standard, Upto 50 in(Finish :-White pre- laminted Matt)",Heera,1,0,0,"3,999",3.3,9,43,"Monday, February 21",1,9
82,B09PCY7CQN,"Kraft Bazaar's Solid Wood Oval TV Cabinet for Living Room | TV Unit with 2 Drawers (Finish- Platina Grey, Design 9)",Kraft,1,0,0,"15,005",0,0,37,"Friday, March 4",0,"₹15,005
₹23,999 Save ₹8,994 (37%)"
83,B08G1PY8FG,"Inmarwar Wooden Entertainment TV Unit for Living Room | TV Stand with 2 Doors Cabinet & 2 Drawer Storage | Mango Wood & Iron, Agara Brown",Inmarwar,1,0,0,"23,299",4.3,6,47,,1,6
84,B09LVB2S4R,"Redwud Hazel Engineered Wood TV Entertainment Unit/TV Cabinet/Wall Mounted TV Unit/TV Stand for Wall/TV Stand Unit Wall Shelf for Home Living Room(Wenge White) - Ideal for Upto 50"" (D.I.Y)",Redwud,0,0,0,"2,998",3.4,4,67,"Monday, February 21",1,4
85,B07873W6ND,"Klaxon Engineered Wood, Matt Finish Oscar TV Unit/Display Storage Cabinet Rack with Decor Shelf (Brown, Set of 1)",Klaxon,0,0,0,"2,533",3.7,44,57,"Monday, February 21",1,44
86,B09KPGLV6N,"Desire Decor Wooden TV Cabinet Wall Shelves, Smart LED TV Entertainment Unit Set Top Box Stand |",Desire,0,0,0,749,5.0,2,25,"Tuesday, February 22",1,2
87,B09GKKNG2F,"Anikaa Charley Engineered Wood Wall Mount TV Unit/TV Stand/Wall Set Top Box Stand/TV Cabinet/TV Entertainment Unit (Walnut)(Ideal for Upto 52"")(D.I.Y)",Anikaa,0,0,0,"4,349",3.3,5,64,"Monday, February 21",1,5
88,B08TVL395S,"M/s Excellent wooden enterprise Set top Box Wall Stand Rack Shelves for Living/Bedroom Decoration (White/Pink; 6x40x5 inches) Home Decoration (MDF-Medium Density Fiber, Set of 1) TV Entertainment Unit",M/s,0,0,0,999,2.3,19,50,"Tuesday, February 22",0,19
89,B09QM56NHR,"Furnifry Wooden TV Entertainment Unit/Wall Set Top Box Shelf Stand/TV Cabinet for Wall/Set Top Box Holder for Home/Living Room Ideal for TV Upto 42"" (Black/Walnut)",Furnifry,0,0,0,"2,999",3.8,343,60,"Wednesday, February 23",1,343
90,B09PN8F3ZQ,"Papper Humra Wooden TV Cabinet Wall Shelves, Smart LED TV Entertainment Unit Set Top Box Stand | TV Stand Wall Shelf for Living Room Stylish | Hanging Rack Organizer | Home Decor Furniture (Colour- Brown)",Papper,0,0,0,799,0,0,60,"Wednesday, February 23",0,"₹799
₹1,999 Save ₹1,200 (60%)"
91,B07CZJ3G93,"Bluewud Tital Engineered Wood Tv Unit, Set Top Box Stand, Wenge, Standard",Bluewud,0,0,0,649,4.2,414,44,"Wednesday, February 23",1,414
92,B09B3Y86DC,"Redwud Skyler Engineered Wood TV Entertainment Unit/TV Cabinet/TV Stand/Entertainment Center Table/Display Storage Cabinet Rack (Wenge) - Ideal for Upto 52""",Redwud,0,0,0,"3,999",3.4,9,67,"Monday, February 21",1,9
93,B083R8L8RF,"HEERA MOTI CORPORATION Sample Engineered Wood TV Entertainment Unit ,White",HEERA,0,0,0,"2,999",3.5,171,50,"Monday, February 21",1,171
94,B07C6KDDF8,Anikaa Cavin Engineered Wood Wall Mount TV Unit/TV Stand/Wall Set Top Box Stand/TV Cabinet/TV Entertainment Unit (Wenge)(D.I.Y),Anikaa,0,0,0,"1,014",4.0,238,61,"Monday, February 21",1,238
95,B07QLFT2BC,Anikaa Ricos Engineered Wood Wall Mount TV Unit/TV Stand/Wall Set Top Box Stand/TV Cabinet/TV Entertainment Unit (Wenge)(D.I.Y),Anikaa,0,0,0,"1,649",4.1,605,64,"Monday, February 21",1,605
96,B09PBSNBQB,"Bluewud Primax Grande Engineered Wood Tv Wall Unit, Set Top Box Stand, Wenge & White, Standard, for Upto 42""",Bluewud,0,0,0,"3,799",4.7,5,34,"Thursday, February 24",0,5
97,B09KPNSX91,"Sylvan Artistry Wooden TV Cabinet Wall Shelves, Smart LED TV Entertainment Unit Set Top Box Stand, TV Stand Wall Shelf for Living Room, Hanging Rack Organizer, Home Decor Furniture (Color- Brown)",Sylvan,0,0,0,990,3.0,1,67,"Wednesday, February 23",1,1
98,B08RZDV25P,AAROORA Gaya H2 V1 Engineered Wood TV Table Display Decor Shelf Storage Cabinet Wenge Colour,AAROORA,0,0,0,"2,549",3.3,20,67,"Tuesday, February 22",1,20
99,B09PBSQ96Y,"Bluewud Primax Neo Engineered Wood Tv Wall Unit, Set Top Box Stand, Wenge & White, Standard, for Upto 42""",Bluewud,0,0,0,"3,099",0,0,33,"Tuesday, February 22",1,"₹3,099
₹4,599 Save ₹1,500 (33%)"
100,B077GYR3XD,Klaxon Z Shape Engineered Wood TV Unit/Display Storage Cabinet Rack with Decor Shelf (Black),Klaxon,0,0,0,"3,379",3.9,517,45,"Friday, February 18",1,517
101,B08JKXG51D,"Ereteken ART TV, Set Top Box Entertainment Unit Wall Stand Shelf Rack (Brown)",Ereteken,0,0,0,899,4.1,126,55,"Friday, February 25",0,126
102,B08W3LHV6Q,"Splendid Decor Console Wall Mounted TV Entertainment Unit, TV Cabinet for Wall, TV Stand Unit Wall Shelf for Living Room, Set Top Box Stand (Black & White)",Splendid,0,0,0,"1,999",5.0,2,58,"Wednesday, February 23",0,2
103,B075FYXZLC,"DeckUp Dusun Engineered Wood TV Entertainment Unit (Dark Wenge, Matte Finish)",DeckUp,0,0,0,"2,849",4.3,497,53,"Saturday, February 26",0,497
104,B08RSNHRFY,aaRF Engineered Wood TV Entertainment Wall Unit/Set-Top Box Stand Engineered Wood TV Entertainment Wall Unit/Set-Top Box Stand (Standard Black),aaRF,0,0,0,918,4.4,5,54,"Tuesday, February 22",0,5
105,B09QYHLBG3,"Anikaa Heider Engineered Wood TV Unit/TV Stand/Floor Standing TV Unit/TV Cabinet/TV Entertainment Unit (Walnut) - Ideal for Upto 52"" (D.I.Y) Matte Finish",Anikaa,0,0,0,"6,749",0,0,58,"Monday, February 21",1,"₹6,749
₹15,999 Save ₹9,250 (58%)"
106,B08JWHSL32,"Ereteken ART Engineered Wood TV Entertainment Unit Set Top Box Holder/Shelf/Rack (Set of 1 ,Brown)",Ereteken,0,0,0,949,3.9,209,53,"Wednesday, February 23",0,209
107,B08ZSTRX5B,Anikaa Roxy Engineered Wood Wall Mount TV Unit/TV Stand/Wall Set Top Box Stand/TV Cabinet/TV Entertainment Unit (Wenge/White)(Ideal for 32-40 Inch)(D.I.Y),Anikaa,0,0,0,"1,874",3.6,8,63,"Monday, February 21",1,8
108,B09RWR5DLG,Anikaa James Engineered Wood Wall Mount TV Unit/TV Stand/Wall Set Top Box Stand/TV Cabinet/TV Entertainment Unit (Wenge/White)(Upto 60 Inch)(D.I.Y),Anikaa,0,0,0,"2,449",0,0,73,"Monday, February 21",1,"₹2,449
₹8,999 Save ₹6,550 (73%)"
109,B09RWPVFSF,Anikaa Adam Engineered Wood Wall Mount TV Unit/TV Stand/Wall Set Top Box Stand/TV Cabinet/TV Entertainment Unit (White)(Upto 75 Inch)(D.I.Y),Anikaa,0,0,0,"2,999",0,0,70,,1,"₹2,999
₹9,999 Save ₹7,000 (70%)"
110,B08TVT7CX7,"Dime Store Wooden Wall Mounted TV Unit Stand TV Cabinet Set Top Box/Setup Box Stand Wall Shelf for Home Living Room and Home Decor Items (Standard, Black , Set of 1)",Dime,0,0,0,999,3.5,155,23,"Wednesday, February 23",1,155
111,B08HV8KXX9,"Amazon Brand - Solimo Bygny MDF Engineered Wood TV Unit ( Brown , Walnut)",Amazon,0,0,0,"3,779",3.8,28,24,"Fri, 18 Feb, 7:00 am - 9:00 pm",0,28
112,B097ZYM4S4,"THEWOODMART Wooden Wall Mounted TV Unit TV Stand Unit Wall Shelf for Living Room, Set Top Box Stand (Black&White)",THEWOODMART,0,0,0,"1,699",2.8,40,58,"Wednesday, February 23",1,40
113,B09LV99LFT,"Redwud Luna Engineered Wood TV Entertainment Unit/TV Cabinet/Wall Mounted TV Unit/TV Stand for Wall/TV Stand Unit Wall Shelf for Home Living Room(Wenge) - Ideal for Upto 52"" (D.I.Y)",Redwud,0,0,0,"3,198",3.0,2,64,"Monday, February 21",1,2
114,B08CXPTT6H,"Bluewud Novah Engineered Wood Tv Entertainment Unit Cabinet with Storage, Dual Tone, Wenge & White, for Upto 50""",Bluewud,0,0,0,"5,199",4.0,72,35,"Tuesday, February 22",1,72
115,B09B5Y2F8T,"DAS Bolivar High Strength & Durable Wall Mount TV Entertainment Unit/with Set Top Box Stand and 6 Wall Shelf Display Rack for Living Room Frosty White Large (Ideal for up to 55"") Screen",DAS,0,0,0,"3,749",4.0,19,49,"Monday, February 21",1,19
116,B09DSRT8J5,Heera Moti Corporation Nent Tv Stand up to 50 Inches (Finish :-White pre- Laminated Matt),Heera,1,0,0,"5,999",0,0,40,"Monday, February 21",1,"₹5,999
₹10,000 Save ₹4,001 (40%)"
117,B07X4ZVN96,Heera Moti Corporation Boat Tv Unit Wall Mount Tv Unit TVs up to 70'' (Finish:-White & Hot Pink Gloss Laminted),Heera,1,0,0,"36,639",3.3,4,8,"Monday, February 21",0,4
118,B09NY99YJC,Gvnd Wooden TV Stand Media Storage TV Console Living Room Entertainment Center Home Television Stands with Drawers and Open Storage Shelves Low Profile Media Console Bedside Table End Table,Gvnd,1,0,0,"1,193",0,0,59,"Monday, February 21",1,"₹1,193
₹2,899 Save ₹1,706 (59%)"
