,asin,title,brand,Sponsored,Best Seller,Amazon's Choice,Price,Rating,NoofRatings,Discount,Delivery,Prime Delivery,base
0,B08HNB3M38,AWG Men's Cotton Regular Fit Solid Polo Neck T-Shirt,AWG ALL WEATHER GEAR,1,0,0,349,3.6,"6,845",77,,0,"6,845"
1,B093BCQY2Q,Men's Regular Fit Organic Cotton T-Shirt,Woodwose Organic Clothing,1,0,0,569,4.2,65,5,,1,65
2,B07TCH58VH,Polo T-Shirt Short Sleeves for Men,NASH,1,0,0,999,0,0,29,,0,"₹999
₹1,399 Save ₹400 (29%)"
3,B091FLT2YK,Men's Polycotton Collar Neck Polo T-Shirt Combo Pack of 3,Wear Your Opinion,1,0,0,999,3.9,527,67,,1,527
4,B09CNYR7ZS,Men's Cotton Half Sleeve Regular Fit Striped T-Shirt,RodZen,0,0,0,299,3.8,22,80,,0,22
5,B084L8XZTV,Men's Regular Fit T-Shirt (Pack of 3),Scott International,0,1,0,429,3.8,"24,948",82,,0,"24,948"
6,B06Y2BZJN6,Men's Polo,Allen Solly,0,1,0,570,4.1,"43,723",37,,1,"43,723"
7,B07B2X6LDJ,Men's Regular Fit T-Shirt (Pack of 4),AWG ALL WEATHER GEAR,0,0,0,499,3.5,"6,975",84,,1,"6,975"
8,B09CV399D5,Regular Fit Half Sleeve Men's T-Shirt,LEOTUDE,0,0,0,329,3.4,"1,546",70,,0,"1,546"
9,B07CXXHLY2,Men's Regular fit T-Shirt,U.S. POLO ASSN.,0,0,0,411,4.0,"5,205",31,,0,"5,205"
10,B08CDR8CDG,Men T-Shirt,EYEBOGLER,0,0,0,369,3.9,"6,286",72,,0,"6,286"
11,B096VZY3GX,Men's Slim T-Shirt,Integriti,0,0,0,133,3.7,40,87,,0,40
12,B096VX79X2,Men's Slim T-Shirt,Integriti,0,0,0,117,3.7,31,88,,0,31
13,B09QHRDB82,Regular Fit Half Sleeve Polo Men's T-Shirt,LEOTUDE,0,0,0,299,1.4,3,73,,0,3
14,B08L9FWQ3G,Regular Fit Half Sleeve Men's Polo T-Shirt,LEOTUDE,0,0,0,329,3.6,331,70,,0,331
15,B07FBM7W3R,Men's Slim Fit T-Shirt,Maniac,0,0,0,356,3.8,"5,569",71,,0,"5,569"
16,B08662JK2H,Men's Slim Fit Polo T-Shirt,Alan Jones Clothing,0,0,0,419,4.0,856,58,,0,856
17,B098K2L2P5,Regular Fit Cotton Printed Men's T-Shirt,LEOTUDE,0,0,0,299,3.4,971,73,,0,971
18,B08TH92K4Q,Regular Fit Half Sleeve Polo Men's T-Shirt,LEOTUDE,0,0,0,329,3.6,"1,074",70,,0,"1,074"
19,B08JQKJ5FH,Men's Printed Full Sleeve Slim Fit Cotton T-Shirt,Urbano Fashion,0,0,0,399,3.8,"1,862",64,,0,"1,862"
20,B092ZWY17Z,Supima Cotton Mens and Boys Solid Cotton Drop Cut T-Shirts,The Souled Store,1,0,0,839,4.2,12,44,,1,12
21,B07QV91PC6,Men's Polycotton Stylist Slim Fit Collar Neck Polo T-Shirt,Wear Your Opinion,1,0,0,379,3.9,"3,917",75,,0,"3,917"
22,B07TK4RHXF,Men's Regular fit T-Shirt,U.S. POLO ASSN.,1,0,0,649,4.0,81,35,,1,81
23,B099ZYWRTZ,Men's Regular T-Shirt,Amazon Brand - House & Shields,1,0,0,359,3.9,20,72,,0,20
24,B089B3C74D,Regular Men's Cotton Designer T-Shirt (EB1T67),EYEBOGLER,0,0,0,320,3.4,"2,173",75,,0,"2,173"
25,B098L9LJT8,"Men's Hooded Cotton Blend Checked T-Shirt : Black, White",LEWEL,0,0,0,349,3.6,170,83,,0,170
26,B07TRH5FRH,Men's Cotton T-Shirt,AELOMART,0,0,0,447,3.9,"7,831",70,,0,"7,831"
27,B09RPFF6R3,Men's Loose Fit Solid Oversized 3/4 Sleeves Cotton T-Shirt,FUBURA,0,0,0,249,0,0,75,,0,"₹249
₹999 Save ₹750 (75%)"
28,B07W1FFQ7Z,Men's Regular Fit T-Shirt,GRITSTONES,0,0,0,309,3.8,"1,078",76,,0,"1,078"
29,B012STPYJC,Men's Regular Fit Round Neck Half Sleeved T-Shirt,Jockey,0,0,0,321,4.3,"14,574",37,,0,"14,574"
30,B07C9BDYHV,Men's Solid Regular Fit T-Shirt,EYEBOGLER,0,0,0,335,3.8,"7,362",74,,0,"7,362"
31,B09QHV3FY2,Regular Fit Full Sleeve Men's T-Shirt,LEOTUDE,0,0,0,299,3.1,5,73,,0,5
32,B0892VNQP7,Men's Slim Fit T-Shirt (Pack of 3),BULLMER,0,0,0,589,3.5,"1,157",61,,1,"1,157"
33,B06W9HQHBW,Men's Regular Fit T-Shirt (Pack of 3),Scott International,0,0,0,429,3.6,"4,724",82,,0,"4,724"
34,B09C2JBSSC,Men's Slim T Shirt (Pack of 3),BULLMER,0,0,0,599,3.5,656,60,,1,656
35,B09KBJY64Y,Men's T Shirt-(Amt250105-P_Green),AELOMART,0,0,0,447,4.0,83,70,,0,83
36,B09N3NHLVF,Regular Fit Full Sleeve Men's T-Shirt (Color : Maroon),LEOTUDE,0,0,0,299,3.6,39,73,,0,39
37,B08JQLCS7Y,Men's Dark Green Printed Slim Fit Cotton T-Shirt,Urbano Fashion,0,0,0,359,4.0,117,64,,0,117
38,B08MCF7XTV,Men's Cotton Regular Fit Full Sleeves T-Shirt,CHKOKKO,0,0,0,189,3.9,"1,838",91,,0,"1,838"
39,B08SHTK9WD,Mens Regular Fit Printed Cotton Polo Tshirt,BULLMER,0,0,0,439,4.1,852,56,,0,852
40,B08N55WRSX,Men's Regular Fit T-Shirt,EYEBOGLER,0,0,0,318,3.8,824,76,,0,824
41,B09PNJNGTM,Oversized Mens Cotton Blend Half Sleeve T-Shirts,LEOTUDE,0,0,0,299,1.0,1,73,,0,1
42,B096W7D1M7,Men's Slim T-Shirt (Pack of 3),Integriti,0,0,0,770,3.8,184,67,,1,184
43,B08NXHW761,Batman: 3D Logo Mens and Womens 3D Embossed Cotton T-Shirt Black,The Souled Store,0,0,0,629,4.3,284,30,,1,284
44,B01HTCFYG6,Men's Regular fit T-Shirt,wear your mind,0,0,0,499,4.7,4,55,,1,4
45,B09RSTM57S,Couple Men's & Women's Cotton Striped Regular Fit Tshirt - Pack of 2,RodZen,0,0,0,499,0,0,67,,1,"₹499
₹1,499 Save ₹1,000 (67%)"
46,B07YDJKLFB,Regular Fit Men's Cotton T-Shirt (EBT229-NBLM),EYEBOGLER,0,0,0,359,3.8,"3,613",72,,0,"3,613"
47,B08ZG9337F,Men's Slim T-Shirt,EASYBUY,0,0,0,299,3.5,7,0,,0,7
48,B09MTTCJQ2,Printed Men's Round Neck Black T-Shirt,London Hills,0,0,0,349,4.4,6,73,,0,6
49,B076CJMHB7,Men's Solid Regular Fit Polo,Van Heusen,0,0,0,535,4.0,"20,872",40,,1,"20,872"
50,B08Z41K8HV,Mens Regular Fit Striped Cotton Polo Tshirt/Collared Tshirt,BULLMER,0,0,0,439,4.0,114,56,,0,114
51,B07DPR2Y9W,Men's Regular Fit Polos,AMERICAN CREW,0,0,0,612,4.1,"6,664",59,,1,"6,664"
52,B098TTSCDF,Men's Regular T-Shirt,Puma,0,0,0,524,4.1,30,65,,1,30
53,B08HNB7WR7,AWG Men's Cotton Regular Fit Solid Polo Neck T-Shirt,AWG ALL WEATHER GEAR,0,0,0,349,3.6,"6,845",77,,0,"6,845"
54,B079KGF18M,Men's Regular Fit T Shirt (Pack of 5),AWG ALL WEATHER GEAR,0,0,0,649,3.5,629,78,,1,629
55,B09QHR5GK1,Regular Fit Half Sleeve Men's Polo T-Shirt,LEOTUDE,0,0,0,299,4.2,3,73,,0,3
56,B081VMQN26,Men's Regular T-Shirt,Amazon Brand - Symbol,1,0,0,529,4.0,"6,122",62,,1,"6,122"
57,B09JP52KXY,Black Camo Mens and Boys Solids Cotton Full Sleeve T-Shirts,The Souled Store,1,0,0,629,5.0,1,37,,1,1
58,B09DD3BGXZ,Step Hem T-Shirt: Olive Green Mens and Boys Solid Cotton T-Shirts,The Souled Store,1,0,0,432,0,0,57,,0,"₹432
₹999 Save ₹567 (57%)"
59,B08VWTPTSV,Eco-Friendly Men's 50/50 Blend Double Coloured Polo T-Shirt,ECOLINE Clothing,1,0,0,609,4.1,15,21,,1,15
60,B09QSXKTW5,Oversized t-Shirt for Men,Veirdo,0,0,0,399,5.0,1,67,,0,1
61,B09BFWXX9Y,Men's Regular T-Shirt,Levi's,0,0,0,539,4.0,193,55,,1,193
62,B083C2KRLD,Men's Regular fit T-Shirt,Van Heusen Athleisure,0,0,0,799,4.1,394,6,,0,394
63,B08PV6S2WF,Regular Fit Cotton Men's T-Shirt Combo (Pack of 2),LEOTUDE,0,0,0,499,3.7,"2,897",55,,1,"2,897"
64,B084GB4K2B,Men's Regular Fit T-Shirt,Austin Wood,0,0,0,399,3.8,"1,047",73,,1,"1,047"
65,B0855MKXPT,Band Collar Men's T-Shirt(EBT325 & EBT325HS),EYEBOGLER,0,0,0,416,3.6,"3,213",68,,0,"3,213"
66,B08KTZDXMG,Men's Regular Fit Polo,Allen Solly,0,0,0,659,4.2,278,45,,1,278
67,B091CW26ZD,Men T-Shirt (104Men1_Pack of 1),SHAUN,0,0,0,319,3.6,12,60,,1,12
68,B082XV7W83,Men's Regular Fit T-Shirt,AMERICAN CREW,0,0,0,802,4.1,232,68,,1,232
69,B09H7JP1HV,Printed Men Round Neck Full Sleeve T-Shirt,London Hills,0,0,0,349,3.6,459,73,,0,459
70,B06XBXRLX4,Men's Cotton T-Shirt,fanideaz,0,0,0,499,3.5,"3,408",80,,1,"3,408"
71,B09JZBWT7M,Oversized Mens Cotton Blend Half Sleeve Mens T-Shirts,LEOTUDE,0,0,0,299,3.5,162,73,,0,162
72,B099FC2ZWV,Men's Slim T-Shirt,Jack & Jones,0,0,0,299,4.2,10,70,,0,10
73,B00RGV7U8G,Polo T-Shirts for Men,AMERICAN CREW,0,0,0,517,4.0,"1,922",74,,1,"1,922"
74,B07DWJWNCY,Men's Solid Regular Fit T-Shirt,U.S. POLO ASSN.,0,0,0,"1,139",4.0,285,43,,1,285
75,B08N714Q2T,Men's Solid Regular fit T-Shirt,EYEBOGLER,0,0,0,349,3.7,"3,877",73,,0,"3,877"
76,B096SMYW2B,"Cotton Regular Fit Half Sleeves Basic Printed T-Shirt T-Shirt for Mens - Yellow, Black (X-Large, Combo of 2)",STATUS MANTRA,0,0,0,479,3.4,179,72,,0,179
77,B08THCQLCM,Regular Fit Half Sleeve Men's Polo T-Shirt,LEOTUDE,0,0,0,299,3.6,"1,342",73,,0,"1,342"
78,B0862D2D64,Men's Slim Fit Polo T-Shirt,GHPC,0,0,0,399,4.0,385,60,,0,385
79,B08JHX6F6W,"Men's Round Neck Full Sleeves Tshirt Navyblue,Maroon,Grey (Pack of 2)",BLIVE,0,0,0,472,3.8,480,76,,0,480
80,B09LM6YYV5,181920 Men's Basic Printed Cotton Regular T-Shirts for Men Combo,THE BLAZZE,0,0,0,499,2.8,13,50,,1,13
81,B08F2C76Q2,Men's Regular Fit Striped Round Neck T-Shirt,EYEBOGLER,0,0,0,343,3.9,"7,668",74,,0,"7,668"
82,B07QY8GVDW,Men's Polycotton Stylist Slim Fit Collar Neck Polo T-Shirt,Wear Your Opinion,0,0,0,379,3.9,"3,917",75,,0,"3,917"
83,B0819ZQM5G,Men's Striped Regular fit T-Shirt,U.S. POLO ASSN.,0,0,0,639,4.0,"1,210",20,,1,"1,210"
84,B073WCLVSC,Men's Solid Regular fit T-Shirt,Van Heusen Athleisure,0,0,0,500,4.1,"1,713",27,,1,"1,713"
85,B08R5WR668,"Men's Cotton T Shirt (AWT1272-PN,Green)",AELOMART,0,0,0,448,3.9,619,70,,0,619
86,B08353M893,Men's Slim Polo,Max,0,0,0,399,4.1,"7,983",11,,0,"7,983"
87,B07L58BFXT,Men's Regular Fit T-Shirt (Pack of 2),London Hills,0,0,0,454,3.8,747,83,,0,747
88,B092SLGRYH,Cotton Camouflage Printed Regular Fit Men's Tshirt,LEOTUDE,0,0,0,299,3.8,"2,256",73,,0,"2,256"
89,B0855CGJY5,Mens Cotton Half Sleeve Striped Polo T Shirt with Collar,fanideaz,0,0,0,712,3.7,"3,386",72,,1,"3,386"
90,B095SW13JR,Men's Slim Fit T-Shirts,Spykar,0,0,0,350,4.1,90,65,,0,90
91,B06XHFTP47,Men's 100% Cotton Biowash Round Neck T-Shirt,Scott International,0,0,0,299,3.9,"1,388",70,,0,"1,388"
92,B01HTCHFIG,Men's Printed Regular fit T-Shirt,wear your mind,0,0,0,359,0,0,67,,0,"₹359
₹1,099 Save ₹740 (67%)"
93,B07BDZ75YG,Men's Regular Polo Shirt,Amazon Brand - Symbol,0,0,0,589,3.9,"5,409",41,,1,"5,409"
94,B07KRYBNSV,Tan dye Hooded T-Shirt GSHDOMB2029-P,GRITSTONES,0,0,0,349,3.9,"1,862",65,,0,"1,862"
95,B07XVM5D9S,Men's Round Neck Regular Fit T-Shirt (Pack of 2),London Hills,0,0,0,399,3.9,473,69,,0,473
96,B079KFXZX5,Men's Polyester Round Neck T-Shirts - Pack of 5,AWG ALL WEATHER GEAR,0,0,0,649,3.5,"1,065",78,,1,"1,065"
97,B08V5LCW5D,Men's Regular T-Shirt,Puma,0,0,0,519,3.0,1,60,,1,1
98,B08T7G1QFR,Men's Regular Fit Printed Full Sleeve Soft & Strong Hooded T-Shirt,London Hills,0,0,0,399,3.8,626,69,,0,626
99,B08T6HJNWQ,Round Neck Men's Cotton T-Shirt(AMT039-P),AELOMART,0,0,0,499,3.7,161,67,,1,161
100,B0876SW6DK,Men's Regular T-Shirt,Max,0,0,0,309,3.7,37,11,,0,37
101,B08Y6LXVZL,Compression Swimming t Shirt Full Sleevs for Men,NEVER LOSE,0,0,0,499,3.9,24,38,,1,24
102,B08FTBVG26,Spider-Man: The Suit Mens Graphic Printed Cotton Drop Cut T-Shirt Red,The Souled Store,0,0,0,649,4.3,176,78,,1,176
103,B08R76YMTD,Men's Slim T-Shirt,EASYBUY,0,0,0,299,3.8,7,0,,0,7
104,B0953S12SZ,Marvel: Comic Strip Mens and Boys Graphic Printed Cotton T-Shirts Multi-Colored,The Souled Store,0,0,0,734,4.4,28,18,,1,28
105,B08V518MXT,Regular Fit Full Sleeve Men's T-Shirt Combo (Pack of 2),LEOTUDE,0,0,0,549,3.6,923,66,,1,923
106,B08XW1CQL2,Men's Solid Cotton Round Neck Regular Fit Half Sleeves T-Shirt,CHKOKKO,0,0,0,199,4.0,688,90,,0,688
107,B073X3Y7D8,Men's Regular Polo Shirt,Amazon Brand - Symbol,0,0,0,309,3.9,"12,297",61,,0,"12,297"
108,B0861Z4N8L,Men's Polycotton Stylist Slim Fit Collar Neck Polo T-Shirt Combo Pack of 2,Wear Your Opinion,1,0,0,649,3.8,"2,780",68,,1,"2,780"
109,B098LBT95T,Step Hem T-Shirt: Grey Melange Mens and Boys Solid Cotton Grey,The Souled Store,1,0,0,419,5.0,1,58,,0,1
110,B07TL4X59G,Men's Regular fit T-Shirt,U.S. POLO ASSN.,1,0,0,547,4.0,81,45,,1,81
111,B08HNCKD6K,AWG Men's Cotton Regular Fit Solid Polo Neck T-Shirt,AWG ALL WEATHER GEAR,1,0,0,349,3.6,"6,845",77,,0,"6,845"
112,B08FTBVG26,Spider-Man: The Suit Mens Graphic Printed Cotton Drop Cut T-Shirt Red,The Souled Store,0,0,0,649,4.3,176,78,,1,176
113,B08R76YMTD,Men's Slim T-Shirt,EASYBUY,0,0,0,299,3.8,7,0,,0,7
114,B0953S12SZ,Marvel: Comic Strip Mens and Boys Graphic Printed Cotton T-Shirts Multi-Colored,The Souled Store,0,0,0,734,4.4,28,18,,1,28
115,B08V518MXT,Regular Fit Full Sleeve Men's T-Shirt Combo (Pack of 2),LEOTUDE,0,0,0,549,3.6,923,66,,1,923
116,B08XW1CQL2,Men's Solid Cotton Round Neck Regular Fit Half Sleeves T-Shirt,CHKOKKO,0,0,0,199,4.0,688,90,,0,688
117,B073X3Y7D8,Men's Regular Polo Shirt,Amazon Brand - Symbol,0,0,0,309,3.9,"12,297",61,,0,"12,297"
118,B08KS3KCKL,Men's Cotton Half Sleeve Printed Polo T-Shirt,Veirdo,0,0,0,399,4.1,549,67,,0,549
119,B07MQ11SMH,Men's Plain Vest,Jockey,0,0,0,279,4.2,698,15,,0,698
120,B08SW3YNM9,Justice League: Logo Mens and Boys Graphic Printed Cotton Drop Cut T-Shirts Navy Blue,The Souled Store,0,0,0,734,4.0,442,18,,1,442
121,B083FHPYRQ,Regular Fit Men's Cotton T-Shirt,EYEBOGLER,0,0,0,349,3.5,533,73,,0,533
122,B079W561LM,Multicolour Cotton Full Sleeve T-Shirt for Men,ADRO,0,0,0,449,4.0,"2,241",75,,0,"2,241"
123,B08Z44SKBM,Mens Regular Fit Striped Cotton Polo Tshirt/Collared Tshirt,BULLMER,0,0,0,439,4.0,530,56,,0,530
124,B07RY2N76L,Men's Regular Fit T-Shirt,Wrath,0,0,0,324,3.7,"2,731",78,,0,"2,731"
125,B09B4YFR9W,Men Half Sleeve Round Neck White,Pepe Jeans,0,0,0,500,3.0,4,50,,1,4
126,B01LB53LPS,Men's Regular Fit T-Shirt,AMERICAN CREW,0,0,0,564,3.9,"13,207",72,,1,"13,207"
127,B08RDV81ND,Men's Half Sleeve Regular Fit T-Shirt,Veirdo,0,0,0,399,4.0,660,67,,0,660
128,B08KYGGBT5,Plus Size Men's Polo T-Shirt,Bigbanana,1,0,0,729,4.0,23,64,,1,23
129,B09C3SNKT7,Official The Flintstones: Pattern Mens and Boys Graphic Printed Cotton Oversized T-Shirts White,The Souled Store,1,0,0,734,4.6,3,43,,1,3
130,B097DVH768,Don't Make Me Do Stuff Mens and Boys Graphic Printed Cotton T-Shirts Blue,The Souled Store,1,0,0,524,0,0,42,,1,"₹524
₹899 Save ₹375 (42%)"
131,B07CXR7ZND,Men's Regular fit T-Shirt,U.S. POLO ASSN.,1,0,0,420,4.0,"5,205",23,,0,"5,205"
132,B0979539JC,Round Neck Regular Fit Cotton T-Shirt,Amazon Brand - Symbol,0,0,0,294,3.8,72,71,,0,72
133,B07JJ2CBND,Men's Slim Fit T-Shirt,WC Right,0,0,0,365,3.8,"2,079",63,,0,"2,079"
134,B094FNF4YL,Men's Plus Size Polo Collar Neck T-Shirt,Wear Your Opinion,0,0,0,499,4.0,285,67,,1,285
135,B099FC2HL1,Men's Slim T-Shirt,Jack & Jones,0,0,0,286,3.9,73,78,,0,73
136,B07B2VVHNT,Men's Regular Fit T-Shirt,Maniac,0,0,0,217,4.0,"1,489",79,,0,"1,489"
137,B09B9ZJHTM,Men's Slim Polo Shirt,Peter England,0,0,0,552,3.9,526,39,,1,526
138,B092PSZHLG,Men's Printed Halfsleeve Round Neck Olive Cotton Tshirt,Maniac,0,0,0,294,3.7,57,78,,0,57
139,B07NKKYN2D,Men's Polyester Round Neck T-Shirts - Pack of 2,AWG ALL WEATHER GEAR,0,0,0,349,3.5,"3,843",78,,0,"3,843"
140,B08VN24M92,Men's Slim T-Shirt,Pepe Jeans,0,0,0,629,4.0,34,37,,1,34
141,B09C8KF7BV,Regular Fit Half Sleeve Men's T-Shirt Cotton Blend Combo (Pack of 2),LEOTUDE,0,0,0,499,3.4,196,69,,1,196
142,B094RG6KCZ,Men's Slim Polo Shirt,Reebok,0,0,0,499,4.0,10,50,,1,10
143,B0983GS17Q,"Plus Size Men's Organic Cotton Polo T-Shirt with Contrast Tipped Collar & Cuff, (DCPLUS-SP1, Colour Red)",JOSH DANIEL,0,0,0,899,0,0,40,,1,"₹899
₹1,499 Save ₹600 (40%)"
144,B07WVBPTFS,Men's Regular Fit T-Shirt,Fashion Gallery,0,0,0,299,3.4,367,80,,1,367
145,B08KQF2RC4,"Solid, Striped, Sports Men Round Neck T-Shirt (Pack of 2)",London Hills,0,0,0,399,3.8,214,85,,0,214
146,B01DT8KDOW,Men's Classic Fit T-Shirt,ARISE,0,0,0,399,0,0,20,,0,"₹399
₹499 Save ₹100 (20%)"
147,B0922TZG2K,KiwiCaves Polo Collar Neck Sports Cotton T-Shirt for Men and Boys,Generic,0,0,0,348,3.4,117,68,,1,117
148,B07PNC3CM2,Men's Polo T-Shirts,ADRO,0,0,0,449,4.0,"1,328",75,,0,"1,328"
149,B09C67Z9JL,Men's Regular T-Shirt,Max,0,0,0,749,4.0,224,17,,1,224
150,B08ZL5Z4W5,Men’s Full Sleeve Cotton Black and White Striped Polo T Shirt,fanideaz,0,0,0,679,3.6,284,73,,1,284
151,B09PHBZ3H2,"Men Performance TEE,Blue",Puma,0,0,0,579,0,0,55,,1,"₹579
₹1,299 Save ₹720 (55%)"
152,B096VHD9SC,Men's Regular T-Shirt,Arrow,0,0,0,887,5.0,3,51,,1,3
153,B01LERKQ9C,Men's Polo Collar Half Sleeve Striped Cotton Melange Colors T Shirts for Men,AMERICAN CREW,0,0,0,707,3.8,902,65,,1,902
154,B09PNT2NP6,Captain America Mens Printed Hoodies/Mens Sweatshirts,ADRO,0,0,0,349,3.9,129,77,,0,129
155,B08XMH1FCC,All Over Printed Men's Halfsleeve Round Neck White Cotton Tshirt,Maniac,0,0,0,314,3.8,49,76,,0,49
156,B09CNKG4ZX,Men's High and Turtle Neck Cotton T-Shirt,NORTHWIND,0,0,0,795,4.0,650,47,,1,650
157,B0828NYSFM,Regular Fit Full Sleeve Men's T-Shirt,LEOTUDE,0,0,0,329,3.6,635,70,,0,635
158,B09JZGPXL3,Men Cotton Black/Maroon Hooded T-Shirt,GRITSTONES,0,0,0,332,4.2,40,63,,0,40
159,B07MXJDQTC,Men's Regular Fit T-Shirt,Veirdo,0,0,0,199,3.7,"1,255",83,,0,"1,255"
160,B096VZ9KYT,Men's Slim T-Shirt,Integriti,0,0,0,200,3.6,38,80,,0,38
161,B082G3S7GC,"Men's Cotton Full Sleeve T Shirt-(Amt1125-N,Olive)",AELOMART,0,0,0,497,4.0,"3,692",67,,0,"3,692"
162,B09F9KNZTX,Men's Regular T-Shirt,Puma,0,0,0,519,5.0,2,65,,1,2
163,B0793FCY3T,Men's Regular fit T-Shirt,U.S. POLO ASSN.,0,0,0,398,4.0,"2,185",20,,0,"2,185"
164,B095CL1YGR,TBBT: Supervillain Sheldon! Mens and Boys Graphic Printed Cotton T-Shirts Black,The Souled Store,1,0,0,439,5.0,3,51,,0,3
165,B09KPTGLTX,Men's Cotton Round Neck Half Sleeve Floral Printed Combo T-Shirts(Pack of 3),Veirdo,1,0,0,599,4.0,19,83,,1,19
166,B0964Z3PNN,Marvel: Wanda Vision Mens and Boys Graphic Printed Cotton T-Shirts Black,The Souled Store,1,0,0,420,5.0,1,53,,0,1
167,B09JP5WDSH,Official Courage: Face Mens and Boys Graphic Printed Cotton T-Shirts Blue,The Souled Store,1,0,0,629,0,0,37,,1,"₹629
₹999 Save ₹370 (37%)"
168,B0861YXW2W,Men's Polycotton Stylist Slim Fit Collar Neck Polo T-Shirt Combo Pack of 2,Wear Your Opinion,1,0,0,649,3.8,"2,780",68,,1,"2,780"
169,B08HNB7WR7,AWG Men's Cotton Regular Fit Solid Polo Neck T-Shirt,AWG ALL WEATHER GEAR,1,0,0,349,3.6,"6,845",77,,0,"6,845"
170,B07CXQZ5YV,Men's Regular fit T-Shirt,U.S. POLO ASSN.,1,0,0,411,4.0,"5,205",31,,0,"5,205"
171,B07PMDKPV5,Men's Polo,ONN,1,0,0,492,4.0,444,1,,0,444
172,B07MXJDQTC,Men's Regular Fit T-Shirt,Veirdo,0,0,0,199,3.7,"1,255",83,,0,"1,255"
173,B096VZ9KYT,Men's Slim T-Shirt,Integriti,0,0,0,200,3.6,38,80,,0,38
174,B082G3S7GC,"Men's Cotton Full Sleeve T Shirt-(Amt1125-N,Olive)",AELOMART,0,0,0,497,4.0,"3,692",67,,0,"3,692"
175,B09F9KNZTX,Men's Regular T-Shirt,Puma,0,0,0,519,5.0,2,65,,1,2
176,B0793FCY3T,Men's Regular fit T-Shirt,U.S. POLO ASSN.,0,0,0,398,4.0,"2,185",20,,0,"2,185"
177,B097DZ8GN8,Men's Regular Fit AS M NK DF SUPERSET TOP SS,Nike,0,0,0,499,3.8,51,71,,1,51
178,B07VR12VST,Men's Regular Fit T-Shirt,Veirdo,0,0,0,299,3.9,"2,847",75,,0,"2,847"
179,B092RMLKVZ,Men's Regular Fit T-Shirt (NM143_Dark Green ),Generic,0,0,0,479,3.7,308,70,,1,308
180,B07SDPKMT2,Men's Regular T-Shirt,Puma,0,0,0,449,3.5,2,70,,0,2
181,B09795KW8V,Round Neck Regular Fit Cotton T-Shirt,Amazon Brand - Symbol,0,0,0,283,0,0,72,,0,"₹283
₹999 Save ₹716 (72%)"
182,B08N71VMWX,Regular Fit Men's Cotton T-Shirt,EYEBOGLER,0,0,0,299,3.8,"3,157",77,,0,"3,157"
183,B099FDZHGB,Men's Slim T-Shirt,Jack & Jones,0,0,0,198,3.0,2,80,,0,2
184,B09DCS9PDY,Men's High Turtle Neck Cotton T-Shirt,NORTHWIND,0,0,0,795,4.0,499,60,,1,499
185,B093LNCWB4,Men's Regular Fit T-Shirt,U.S. POLO ASSN.,0,0,0,401,0,0,36,,0,"₹401
₹629 Save ₹228 (36%)"
186,B07B6RPYHQ,Boy's Slim Fit T-shirt,Maniac,0,0,0,334,3.7,"9,537",69,,0,"9,537"
187,B08QDJFXML,Printed Men's Fullsleeve Hooded Neck White Cottton Tshirt,Maniac,0,0,0,390,3.9,23,78,,0,23
188,B097DW8PSL,Don't Make Me Do Stuff Mens and Boys Graphic Printed Cotton T-Shirts Blue,The Souled Store,1,0,0,524,0,0,42,,1,"₹524
₹899 Save ₹375 (42%)"
189,B098TNMNKQ,WWE: Triple H The King's Skull Mens and Boys Graphic Printed Cotton T-Shirts Black,The Souled Store,1,0,0,382,5.0,6,58,,0,6
190,B093BS51JH,Tie Dye : Faded Teal Mens and Boys Cotton T-Shirts Multi-Colored,The Souled Store,1,0,0,629,4.3,5,37,,1,5
191,B0974PDCDQ,Supima Cotton Mens and Boys Solid Cotton Drop Cut T-Shirts,The Souled Store,1,0,0,839,4.2,12,44,,1,12
192,B08KTWJZCQ,Men T-Shirt,Allen Solly,0,0,0,629,4.3,229,48,,1,229
193,B07MFVCK67,Winter Wear Cotton Plain Full Sleeve Turtle Neck T Shirt for Men,CHKOKKO,0,0,0,645,4.0,"3,238",77,,1,"3,238"
194,B08NQY6RCL,Men's Regular fit Polo,Van Heusen,0,0,0,404,3.2,7,55,,0,7
195,B07PNPKLHT,Men's Slim Fit T-Shirt,Maniac,0,0,0,294,3.7,511,77,,0,511
196,B09GG36YZK,Better Basics Half Crew Solid T Shirt - (100% Guarantee if not Satisfied)- Made in India,DAMENSCH,0,0,0,479,4.1,101,20,,0,101
197,B09BJ2FQGW,Men's White Full Sleeve T-Shirt,Austin Wood,0,0,0,349,0,0,78,,1,"₹349
₹1,599 Save ₹1,250 (78%)"
198,B09135B8CK,Regular Fit Full Sleeve Men's T-Shirt,LEOTUDE,0,0,0,329,3.4,387,70,,0,387
199,B01F0XE7FU,Men's Organic Cotton Polo T-Shirt,Scott International,0,0,0,449,4.1,42,70,,0,42
200,B07MQDJ54N,Tshirts for Men Man's Clothing Gents Stylish Tees Cotton Regular Branded T-Shirt Latest Collection Men's Cotton Half Sleeve Combo Pack Plain T-Shirt,STATUS MANTRA,0,0,0,139,3.5,183,85,,0,183
201,B01HTCHPVI,Men's Regular Fit T-Shirt,wear your mind,0,0,0,499,0,0,55,,1,"₹499
₹1,099 Save ₹600 (55%)"
202,B08PL32B57,Men's Cotton Solid Baby Full Sleeves | Round Neck | Regular Fit T-Shirt/Tee,Bewakoof,0,0,0,449,4.0,29,10,,0,29
203,B07T9GHB59,Men's Regular T-Shirt,Deniklo,0,0,0,169,4.1,75,86,,0,75
204,B081VM5MZW,Men's Regular T-Shirt,Amazon Brand - Symbol,0,0,0,849,4.1,"9,034",76,,1,"9,034"
205,B0842HCX9Q,Men's Regular Fit T-Shirt,Jockey,0,0,0,649,4.2,"1,047",0,,1,"1,047"
206,B09P1GVV8S,Men's t-Shirt Combo Pack of 5 Original 100% Cotton Blended,CUSTOMSCART,0,0,0,699,0,0,72,,0,"₹699
₹2,499 Save ₹1,800 (72%)"
207,B08D7NPNZR,Men's Solid Mandarin Collar Slim Fit Cotton T-Shirt,Urbano Fashion,0,0,0,365,3.8,636,67,,0,636
208,B08GYNWDFG,Men's Slim Fit T-Shirts,Spykar,0,0,0,404,3.0,2,69,,0,2
209,B085BMJ2N7,Men's Regular fit T-Shirt,Jockey,0,0,0,619,4.3,380,0,,1,380
210,B0992CRKSR,Men's Regular Short Sleeve T-Shirt,Nike,0,0,0,661,0,0,26,,1,"₹661
₹895 Save ₹234 (26%)"
211,B09774GPMG,Men's Color Block Round Neck Multi-Colored T-Shirt,London Hills,0,0,0,499,3.2,132,81,,1,132
212,B085BM8FYZ,Men's Classic Fit T-Shirt,Jockey,0,0,0,562,4.3,955,6,,1,955
213,B09BFVR2G5,Men's Regular Polo Shirt,Levi's,0,0,0,699,3.5,20,50,,1,20
214,B08QNJ45LN,Men's Solid Mandarin Collar Regular Fit Cotton T-Shirt,Urbano Plus,0,0,0,469,3.8,447,61,,0,447
215,B08XQTSYFF,Men's Regular Polo Shirt,Van Heusen,0,0,0,618,4.0,498,48,,1,498
216,B099F9XL3W,Men's Slim T-Shirt,Jack & Jones,0,0,0,238,4.0,14,78,,0,14
217,B073X4KMH6,Men's Regular T-Shirt,Amazon Brand - Symbol,0,0,0,299,3.9,"1,622",57,,0,"1,622"
218,B08VDVMXRC,Men's Cotton Henley Neck Full Sleeve Regular Fit T-Shirt,Veirdo,0,0,0,299,4.2,307,75,,0,307
219,B09797Q3GD,Round Neck Regular Fit Cotton T-Shirt,Amazon Brand - Inkast Denim Co.,0,0,0,369,4.1,12,72,,0,12
220,B09DSYTKTB,Official WWE: Authentic John Cena Earn it Mens and Boys Graphic Printed Cotton T-Shirts Black,The Souled Store,0,0,0,430,4.4,12,57,,0,12
221,B08S3NBVS8,Mens Cotton Mask Hooded T-Shirt,Katso,0,0,0,299,3.9,283,79,,0,283
222,B083C2TDPW,Men's Regular fit T-Shirt,Van Heusen Athleisure,0,0,0,649,4.1,826,0,,1,826
223,B07NDYK421,Men's Regular Fit Polos,AMERICAN CREW,0,0,0,649,3.8,557,57,,1,557
224,B09FLMM937,Mushroom Mens and Boys Solid Cotton Supima Drop Cut T-Shirts,The Souled Store,1,0,0,839,0,0,44,,1,"₹839
₹1,499 Save ₹660 (44%)"
225,B09MQW1SCY,"Mens Polo T-Shirt Emb,",Clothe Funn,1,0,0,499,4.4,9,75,,1,9
226,B09HXWLM46,Morning Mist Mens and Boys Solid Supima Cotton T-Shirts,The Souled Store,1,0,0,734,0,0,18,,1,"₹734
₹899 Save ₹165 (18%)"
227,B0793HPJTG,Men's Regular fit T-Shirt,U.S. POLO ASSN.,1,0,0,489,3.8,"6,647",2,,1,"6,647"
228,B0861YH5L3,Men's Polycotton Stylist Slim Fit Collar Neck Polo T-Shirt Combo Pack of 2,Wear Your Opinion,1,0,0,699,3.8,"2,780",65,,1,"2,780"
229,B08HNC9YX4,AWG Men's Cotton Regular Fit Solid Polo Neck T-Shirt,AWG ALL WEATHER GEAR,1,0,0,349,3.6,"6,845",77,,0,"6,845"
230,B0731QRRTS,Men's Polo,ONN,1,0,0,449,3.9,"1,153",0,,0,"1,153"
231,B0974MZ1DF,Supima Cotton Mens and Boys Solid Cotton Drop Cut T-Shirts,The Souled Store,1,0,0,839,4.2,12,44,,1,12
232,B07NDYK421,Men's Regular Fit Polos,AMERICAN CREW,0,0,0,649,3.8,557,57,,1,557
233,B08KRW25GM,Men's Regular Fit Polo Multi Color T Shirt (Pack of 3),LEOTUDE,0,0,0,799,3.5,"1,268",50,,1,"1,268"
234,B099ZXV9SS,Men's Regular T-Shirt,Amazon Brand - Inkast Denim Co.,0,0,0,329,4.0,18,67,,0,18
235,B085WWXW7B,N404 Men T-Shirt(N404M3_P$_Pack of 3),ACTIQUE,0,0,0,614,3.9,665,69,,1,665
236,B09BFV47WM,Men's Regular T-Shirt,Levi's,0,0,0,669,4.3,14,44,,1,14
237,B08TV2VT97,Avengers T-Shirt for Men Half Sleave Solid White Graphic Printed Funny Typography Casual Round Neck. Sports & Gym wear Stylish Cotton Branded Tshirt for Attitude Boys,Tocayo,0,0,0,229,3.7,96,77,,0,96
238,B07KRZ1JTT,Men's Plain Regular Fit T-Shirt,GRITSTONES,0,0,0,349,4.0,807,65,,0,807
239,B08HPW15P8,Men's Cotton Regular Fit Solid Polo Neck T-Shirt,Scott International,0,0,0,349,3.5,"8,093",77,,0,"8,093"
240,B0917S6XNN,Plain Black T-Shirt for Men | 100% Cotton | Sports-Wear,Decathlon,0,0,0,199,4.0,34,0,,0,34
241,B08KTYMMTL,Men's Plain Regular Fit Polo,Allen Solly,0,0,0,648,4.2,"1,905",44,,1,"1,905"
242,B08V8R2KL6,Men's Cotton Regular Fit Half Sleeves Round Neck T-Shirt,CHKOKKO,0,0,0,199,3.9,166,90,,0,166
243,B09JKPSZ43,Military/Army Dark Green Collared Uri Style Zip T-Shirt for Men,OMEE GOLD,0,0,0,498,4.0,39,62,,0,39
244,B07RMYK9Z5,Men's Slim Fit T-Shirt,JUGULAR,0,0,0,284,3.6,"1,273",0,,0,"1,273"
245,B07RN75LZ8,Men's Classic Fit Vest,JUGULAR,0,0,0,199,3.9,"1,306",78,,0,"1,306"
246,B08KG4DTPL,Men's Regular Fit T-Shirt,Allen Solly,0,0,0,0,4.1,"2,070",0,,0,"2,070"
247,B09HKZMTQJ,Men's Multicolour Polo T-Shirt-4421A,AUSTIVO,0,0,0,549,4.1,12,70,,1,12
248,B096Y4ZJL4,Loki: for President! Mens and Boys Graphic Printed Cotton T-Shirts Black,The Souled Store,1,0,0,629,4.7,6,30,,1,6
249,B098LCF1R9,Rick and Morty: Get Schwifty Mens and Boys Graphic Printed Cotton Oversized T-Shirts Multi-Colored,The Souled Store,1,0,0,944,4.9,4,27,,1,4
250,B08ZNDC1BS,Supima Mens and Womens Solid Cotton Henley T-Shirts,The Souled Store,1,0,0,839,3.9,7,44,,1,7
251,B09137V9MN,Men's Polycotton Collar Neck Polo T-Shirt Combo Pack of 3,Wear Your Opinion,1,0,0,999,3.9,527,67,,1,527
252,B093SQLCV8,0017 T-Shirts for Men's,THE BLAZZE,0,0,0,399,3.3,622,64,,1,622
