,asin,title,brand,Sponsored,Best Seller,Amazon's Choice,Price,Rating,NoofRatings,Discount,Delivery,Prime Delivery,base
133,B09965M66W,UrbanLeaf Super Soft Microfiber Designer Hand Towels (Multicolours) - 4 Pieces,UrbanLeaf,0,0,0,459,4.3,161,33,"Saturday, February 12",0,161
134,B018IG2I3O,"Story@Home Cotton Bath and Hand Towel Set 450 GSM (Lime and Navy, Set of 6 Piece)",Story@Home,0,0,0,899,4.0,"3,348",65,"Tuesday, February 8",1,"3,348"
135,B09BW39HSB,Casa Haus Cotton Eternal Collection 430 GSM Premium Medium Bath Towel Size 60 x 120 cm (Pack of 4) - Toffee/Beige/Grey/Purple,Casa,0,0,0,999,4.0,42,50,"Monday, February 14",0,42
136,B09G185YNY,"R K Textiles 100% Cotton Hand Towel - 350 GSM, Cabana Ultra Soft and Super Absorbent ( Size 12 X 18 Inches Set of 6 Pieces) (12 x 18, 6)",R,0,0,0,259,3.3,16,83,"Tuesday, February 15",1,16
137,B09CTM3CX2,"Goldsangsa Korean Exfoliating Towels(4 pcs-Green) Asian Exfoliating Bath Washcloth, Korean Exfoliating Mitt, Korean exfoliating , Shower Towels/ Made in Korean Known as Korean Italy Towels (Green)",Goldsangsa,0,0,0,390,3.5,2,49,"Saturday, February 12",0,2
138,B09KLTY5C8,"Lovis Burton Cotton Bath Towel for Men & Women Ultra Soft 100% Zero Twist 400 GSM Large Size, Absorbent & Quick Dry for Bath, Beach, Pool, Travel, Spa and Shower (Size - 70 x140 cm, Color - Red)",Lovis,0,0,0,499,5.0,8,23,"Saturday, February 12",1,8
139,B09MP9G6B5,Sellsworld Quick Turban Hair-Drying Absorbent Microfiber Towel/Dry Shower Caps/Bathrobe Hat/Magic Hair Wrap for Women (Multi Color)(Set of 1),Sellsworld,0,0,0,184,4.1,36,69,"Sunday, February 13",1,36
140,B07CWB65DY,"Mush 600 GSM Bath Towel 1 - Pink | 100% Bamboo |Ultra Soft, Absorbent & Quick Dry Towel for Bath, Beach, Pool, Travel, Spa & Shower | 29 x 59 Inches",Mush,1,0,0,"1,499",4.2,605,17,"Sunday, February 13",1,605
141,B0855X6T4X,"Mush Bamboo-derived rayon Turkish Towel (Beige, 29 x 59 Inches)",Mush,1,0,0,799,4.3,"1,576",20,"Saturday, February 12",1,"1,576"
142,B09JC2WLDR,"Haber Premium Light Weight 100% Cotton Bath Towel with Unique Micro Waffle Texture for Active Feel, Quick Absorption and Faster Drying Towel (Green, Heather & Plum, Pack of 3)",Haber,1,0,0,"1,799",4.2,719,20,"Friday, February 11",1,719
143,B0166CQIR4,"Amazon Brand - Solimo Cotton 6 Piece Towel Set, 500 GSM (Spanish Red and Sunshine Yellow)",Amazon,1,0,0,976,4.3,"3,794",35,"Tuesday, February 8",1,"3,794"
144,B09H7KPVYZ,"Outfit Collections Luxury Microfiber Bath Towel, Super Absorbent, Ultra-Soft, 375 GSM , Fade Resistant, Zig-Zag Design , 70 cm x 140 cm ( 27"" x 54"" inch ) , for Men , Women & Kids (Pink)",Outfit,0,0,0,499,4.0,15,50,"Sunday, February 13",0,15
145,B099X7F3PF,Skevera Microfiber Absorbent Hair-Drying Quick Dry Shower Caps Bathrobe Magic Warp Super Quick-Drying Bath Cap Salon Towel (Multicolor),Skevera,0,0,0,141,3.8,147,69,"Sunday, February 13",0,147
146,B097JP4F38,"Reny trade | 2 Pieces Cotton Quick Turban Hair Towel for Women Hair Drying Absorbent Towel, Dry Shower Caps, Magic Hair Towel Wrap for Women ( Color - Grey and Pink)",Reny,0,0,0,398,4.0,666,69,"Sunday, February 13",1,666
147,B09G15NJ8D,Reny Trade Women's Plush Cotton Long Thick Curly Hair Fast Drying Frizzy Free Strong Absorbent Wet Hair Towel Wrap Turban Cap (Grey),Reny,0,0,0,299,3.9,20,70,"Sunday, February 13",1,20
148,B09PD48XT7,Reny Trade Cotton 500 GSM Pack of 2 Bathroom Towel Combo for Women Grey Flannel (Bath Towel and Hair Towel),Reny,0,0,0,449,5.0,2,65,"Sunday, February 13",1,2
149,B08RYLSDTR,"Keniro Microfibre Bath Towel Hair Dry Cap Salon Towel (Pack of 2, Multicolour)",Keniro,0,0,0,299,4.0,136,40,"Monday, February 14",0,136
150,B09QZSJKPL,DHVAJA Cotton Quick Absorbent Hair Drying Magic Hair Towel Wrap for Women,DHVAJA,0,0,0,124,0,0,50,"Sunday, February 13",1,"₹124
₹249 Save ₹125 (50%)"
151,B094HBJX4J,"House Beauty Ultra Soft, Absorbent Luxury Microfiber Face Towel 300 GSM, 25 cm x 25 cm, Pack of 10 (Multicolour)",House,0,0,0,385,4.0,31,52,"Monday, February 14",0,31
152,B0899TW7GR,"Yellow Weaves Microfiber Face Towel 350 GSM (Set of 4, Multicolour)",Yellow,0,0,0,299,4.3,391,36,"Saturday, February 12",0,391
153,B09LTBT8Z3,"House Beauty Luxury Microfiber Super Absorbent, Anti-Bacterial, Ultra Soft Bath Towel for Men, Women and Kids 70 cm x 140 cm Pack of 1 Solid(Blue)",House,0,0,0,449,4.0,1,47,"Monday, February 14",1,1
154,B07W6ZCTWX,Mothi cotton Bath Towel (Set of 2),Mothi,0,0,0,419,4.0,49,30,"Monday, February 14",0,49
155,B09QX3TBTK,Madake Bamboo Bath Towel- Aqua Lines 160*75cm,Madake,0,0,0,799,0,0,47,"Tuesday, February 15",0,"₹799
₹1,499 Save ₹700 (47%)"
156,B083D59XT6,"Home Spaces Cotton Bamboo Bath Towels for Home, Hotel & Spa, Super Soft Absorbent Antibacterial, 30 x 60 Inches, Full Large Size (Green)",Home,0,0,0,449,0,0,78,"Saturday, February 12",1,"₹449
₹1,999 Save ₹1,550 (78%)"
157,B08R1LN3N9,"Yellow Weaves Super Soft Microfiber Hand Towels, Gym & Workout Towels 400 GSM(Pack of 4, Multi Colors)",Yellow,0,0,0,429,4.2,120,32,"Saturday, February 12",0,120
158,B09HV7XM2C,SK RAYAN Microfiber Hair-Drying Quick Dry Shower Caps Bathrobe Magic Hair Warp Towel Super Quick-Drying Bath Towel - Multicolor - 2 Piece,SK,0,0,0,299,4.2,102,63,"Sunday, February 13",1,102
159,B08DRMH15N,"LushHavenDecor Big Men Bath Towel for Man and Woman Pure Cotton Towels Size 30 x 60 inch (2.5x5 feet)- Color Green, Set of 1",LushHavenDecor,0,0,0,394,5.0,3,21,"Saturday, February 12",1,3
160,B08JYMRHWS,"GONSGADAPP Soft, Absorbent, Anti-Microbial 500 GSM Jacquard Bath Towel Size 75Cm × 150Cm",GONSGADAPP,0,0,0,499,3.5,2,42,"Tuesday, February 15",0,2
161,B091Q5824J,VORDVIGO Cotton 400 GSM 6 Pieces Full Size Bath Towel Set 60x30 (White),VORDVIGO,0,0,0,"1,299",5.0,2,41,"Tuesday, February 15",0,2
162,B09C2JMK7C,"House Beauty Luxury Microfiber Super Absorbent, Ultra Soft and Anti-Bacterial Hand Towel for Multiple uses Like Gym, House use Pack of 6(Multi)",House,0,0,0,699,4.8,13,50,"Friday, February 11",1,13
163,B09PKD6YN8,Tanya Textile Creation Elegant Wearable Magic Towel Microfiber Cotton 400 GSM,Tanya,0,0,0,689,0,0,37,"Monday, February 14",0,"₹689
₹1,089 Save ₹400 (37%)"
164,B09DBKVJXG,"Desi Basics – 100% Cotton Daily Use Towels for Bathroom (3 Towels) - Ultra Soft, Absorbent & Quick Dry Towel for Bath (Men/Women/Kids : Size 30x60 : Large, 3 Pack, Assorted Colours)",Desi,0,0,0,390,4.1,8,35,"Tuesday, February 15",1,8
165,B0913959KR,"COZY FURNISH 500 GSM Hand Towels Ultra-Soft for Sensitive Skins,Highly Absorbent & 100% Cotton Zero Twist Towels,Size 13 x 19 inch (SkyBlue 6)",COZY,0,0,0,355,3.7,12,64,"Saturday, February 12",0,12
166,B09JCMK7ZK,"UrbanLeaf Super Soft Microfiber Bath Towel s- 70 x 140 cm, Brown Color",UrbanLeaf,0,0,0,419,4.5,36,35,"Saturday, February 12",0,36
167,B08QTCJNMJ,"Kuber Industries Cotton Bath Towel 400 GSM (Pack of 1, Black)",Kuber,0,0,0,299,3.0,200,0,"Tuesday, February 8",0,200
168,B01LZUG245,Athom Living Disney Elsa 350 GSM 100% Cotton Kids Bath Towel 60x120 cm,Athom,0,0,0,387,4.4,538,22,"Tuesday, February 8",0,538
169,B09FQ1YT62,Vepary Hair Towel Wrap Absorbent Towel Hair-Drying Quick Dry Shower Caps Bathrobe Magic Hair Warp Towel Super Quick-Drying Microfiber Bath Towel Hair Dry Cap Salon Towel (Multicolor),Vepary,0,0,0,189,3.5,57,79,"Sunday, February 13",1,57
170,B08QTY67RR,selinta Set of 2 Hair Towel Wrap Absorbent Towel Hair-Drying Quick Dry Shower Caps Bathrobe Magic Hair Warp Towel Super Quick-Drying Microfiber Bath Towel Hair Dry Cap (Multicolor) {pack of 2},selinta,0,0,0,269,3.7,225,55,"Sunday, February 13",0,225
171,B0993RWHVD,Bengal Trend™ Gamcha Cotton Bath Towel for Men & Women Large Size Stylish Soft Bengali Towels XXXL Combo Set of 3,Bengal,0,0,0,450,4.4,4,55,"Friday, February 11",0,4
172,B018LZW17K,"Sathiyas Cotton Bath Towel 240 gsm (Set of 3 Pieces, Multicolor)",Sathiyas,0,0,0,399,3.9,698,47,"Wednesday, February 16",0,698
173,B09PJL3YKC,Aerobic Cotton Quick Absorbent Hair Drying Magic Hair Towel Wrap for Women Quick-Drying Microfiber Bath Towel Hair Dry Cap (Multicolor) Pack of 1,Aerobic,0,0,0,149,0,0,70,"Sunday, February 13",1,"₹149
₹499 Save ₹350 (70%)"
174,B08WJPPHWR,"KhuHap Magic Quick Microfiber Absorbent Light Weight Free Size high GSM Soft Fast Absorption Dry Hair wrap Turban Bath Towel/Shower Cap hat Head Bathrobe Towels, Women Girls Ladies,Multicolor,1 No",KhuHap,0,0,0,197,3.0,17,61,"Sunday, February 13",0,17
175,B08Z848V18,"AMRO HOME NEEDS Pure Cotton Bath Towels, Fast Absorbing, Light Weight, Kerala Bath Towel, Large Size, Combo Set Pack of 2 Pieces (Hot Washable) 75 X 150 cm, White",AMRO,0,0,0,248,3.9,154,69,"Tuesday, February 15",1,154
176,B07RCYD2QZ,"Heelium Bamboo Bath Towel and Hand Towel 600 GSM, Super Absorbent & Soft, Antibacterial (Set of 2 Bath & 2 Hand Towel, White)",Heelium,1,0,0,"2,699",4.3,147,33,"Tuesday, February 8",1,147
177,B09MSB7FBQ,Casa Copenhagen Germany Design - He & She Collection 100% Super Soft Cotton Bath Towel Set - Spring Green & Iris Blue,Casa,1,0,0,799,3.9,61,60,"Tuesday, February 15",1,61
178,B0166CP7J4,"Amazon Brand - Solimo 100% Cotton 10 Piece Towel Set, 500 GSM (Iris Blue and Spanish Red)",Amazon,1,0,0,"1,289",4.2,"2,293",28,"Friday, February 11",1,"2,293"
179,B07JG6QVD9,"Amazon Brand - Solimo 100% Cotton 3 Piece Towel Set, 500 GSM (Iris Blue)",Amazon,1,0,0,729,4.3,500,27,"Friday, February 11",1,500
180,B072JC3SFW,"Amazon Brand - Solimo 100% Cotton 2 Piece Bath Towel Set, 500 GSM (White)",Amazon,1,1,0,899,4.3,"15,969",28,"Friday, February 11",1,"15,969"
181,B07C7H1T4X,"Haber Authentic Cotton Bath Towel, Blue-Pack of 1",Haber,1,0,0,699,4.2,"1,220",0,"Friday, February 11",1,"1,220"
182,B09JNYK458,"Haber Premium Light Weight 100% Cotton Bath Towel with Unique Micro Waffle Texture for Active Feel, Quick Absorption and Faster Drying Towel (Heather, Pack of 1)",Haber,1,0,0,699,4.2,719,7,"Saturday, February 12",1,719
183,B09D3VP1VK,"Haber Light Weight 100% Cotton Bath Towel with Super Absorb Texture, Quick Absorption and Faster Drying Towel - Chevron Collection (Yellow, Pack of 1)",Haber,1,0,0,699,4.1,334,7,,0,334
184,B07JFBZBQY,"Amazon Brand - Solimo 100% Cotton 3 Piece Towel Set, 500 GSM (Spanish Red)",Amazon,0,0,0,729,4.3,500,27,"Tuesday, February 8",1,500
185,B0166CPBJA,"Amazon Brand - Solimo 100% Cotton 6 Piece Towel Set, 500 GSM (Iris Blue and Spanish Red)",Amazon,0,0,0,"1,011",4.3,"3,794",33,"Tuesday, February 8",1,"3,794"
186,B08GJ3B11R,Mens Cotton Gamcha/towel/Easy dry (Pack of 1) (Multicolored),Mens,0,0,0,70,2.4,3,86,,0,3
187,B09Q23TBG4,JS Quick Turban Hair-Drying Absorbent Microfiber Towel/Dry Shower Caps/Bathrobe Hat/Magic Hair Wrap for Women (Multi Color),JS,0,0,0,108,0,0,64,"Monday, February 14",0,"₹108 (₹108/metre)
₹297 Save ₹189 (64%)"
188,B09K7WSM3J,"Casa Copenhagen, Designed in Denmark, 500 GSM, 2 Large Bath Towels Set (70 x 140 cm),Super Soft and Absorbent 100% Turkish Cotton Towels for Bathroom,Kitchen & Shower - Granite Grey & Mirage Grey",Casa,0,0,0,799,3.5,32,47,"Tuesday, February 15",1,32
189,B08YYYK3CQ,Sellsworld Hair Towel Wrap Absorbent Towel Hair-Drying Quick Dry Shower Caps Bathrobe Magic Hair Warp Towel Hair Dry Cap Salon Towel (Multicolor-Pack of 1),Sellsworld,0,0,0,210,3.9,182,74,"Sunday, February 13",1,182
190,B08FMT1TKN,"Cloth Fusion Brookwella 100% Cotton 2 Piece Bath Towel Set ,500 GSM (Teal & Navy)",Cloth,0,0,0,699,4.1,443,46,"Sunday, February 13",1,443
191,B088P4CCTQ,Kuber Industries Hanging Cotton 2 Pieces Cotton Washbasin Napkin/Hand Towel for Kitchen and Bathroom (Multi) - CTKTC45549,Kuber,0,0,0,129,3.6,67,13,"Tuesday, February 8",0,67
192,B0918BLG5H,Khadi White Cotton Bath Towels Manufactured SIRCILLA 36 * 72 inches (Pack of 4). Pure Cotton Towels Suitable for All Men and womenLARGE Size,Khadi,0,0,0,599,4.8,7,30,"Tuesday, February 15",0,7
193,B07KXRZ5ZK,"Heelium Bamboo Bath Towel, Super Absorbent & Soft, Antibacterial, 600 GSM, 55 inch x 27 inch, Pack of 1, Grey",Heelium,0,0,0,999,4.2,943,33,"Tuesday, February 8",1,943
194,B09LSZ2TFJ,Bombay Dyeing Flora Large Size Bath Towel (Rose),Bombay,0,0,0,499,0,0,0,"Wednesday, February 16",0,₹499
195,B084Q5Q7V9,"KSC Shop Royal Multicolour Cotton Hand Towel 500 GSM, Set of 6, Multicolor | Hand Towels | Bathroom Towel | Bathroom Napkins",KSC,0,0,0,499,4.2,720,50,"Saturday, February 12",1,720
196,B085371J6P,"ABONY Cotton Bath Towel 500 GSM (Pack of 1, White)",ABONY,0,0,0,185,3.9,82,63,"Tuesday, February 15",0,82
197,B09GYJQ5CB,"Outfit Collections Poly Cotton Bath Towel, Super Absorbent, Lightweight Soft, 270 GSM , Fade Resistant, 75 cm x 145 cm Large , for Kids Boys / Girls , Pack of 2 (Pink & Blue)",Outfit,0,0,0,499,4.4,10,58,"Sunday, February 13",0,10
198,B01GEF6QL6,"Akin Towel Royal Multicolour Cotton Hand Towel 50 GSM, Set of 6",Akin,0,0,0,495,4.0,"1,406",50,"Saturday, February 12",0,"1,406"
199,B08QJ1D32H,"Welspun Health Cotton Large Bath Towel Anti-Bacterial Bright Colors High Absorbency (Solid, 75 cm x 150 cm, Berry)",Welspun,0,0,0,369,4.0,232,0,"Monday, February 14",0,232
200,B09NRNJYJX,"Casa Copenhagen - Egyptian Cotton Elite 2 Pcs Large Bath Towel (75 x 150 cm) Colour : - Pink, Toffee",Casa,1,0,0,799,4.2,50,0,"Tuesday, February 15",1,50
201,B071SHDWDT,"Amazon Brand - Solimo 100% Cotton 6 Piece Towel Set, 500 GSM (Olive Green and Turquoise Blue)",Amazon,1,0,0,"1,229",4.3,"3,794",18,"Tuesday, February 8",1,"3,794"
202,B09MRTNFWC,"Mush Extra Large Cabana Style Turkish Towel 100% Bamboo - (90 x 160 cms) - Ideal for Beach, Bath, Pool etc (Blue-Dark Green & Peach-Turquoise , 2)",Mush,1,0,0,"1,799",4.4,10,31,"Sunday, February 13",1,10
203,B07GCHY9HX,"Mush 600 GSM Bath Towel 1 - Sky Blue | 100% Bamboo |Ultra Soft, Absorbent & Quick Dry Towel for Bath, Beach, Pool, Travel, Spa & Shower | 29 x 59 Inches",Mush,1,0,0,"1,499",4.2,605,17,"Sunday, February 13",1,605
204,B09QLZNM3J,nissi Cotton Large Size Bath Towel for Men and Women Pack of 1,nissi,0,0,0,125,0,0,58,"Wednesday, February 16",0,"₹125
₹299 Save ₹174 (58%)"
205,B08B56T5VW,VRT Cute Rabbit Dry Hair Cap/Ultra-Soft Hair Dry Hat Towels/ Microfiber Hair Towel. Hair Drying Towel with Button/ Dry Hair (Pink and Green) (Pack of 2),VRT,0,0,0,389,5.0,3,61,"Saturday, February 12",0,3
206,B09NRNLJKD,"Casa Copenhagen - Egyptian Cotton Eternal 2 Pcs Large Bath Towel (75 x 150 cm) Colour : - Beige, Toffee",Casa,0,0,0,799,4.2,50,0,"Tuesday, February 15",1,50
207,B093WWRJ87,Keniro Set of 2 Hair Towel Wrap Absorbent Towel Hair-Drying Quick Dry Shower Caps Bathrobe Magic Hair Warp Towel Super Quick-Drying Microfiber Bath Towel Hair Dry Cap Salon Towel (Multicolor)(pack of 2),Keniro,0,0,0,259,3.6,172,57,"Monday, February 14",0,172
208,B07Z5YWFLV,HD Creations Cotton Bath Towel 220 GSM (Multicolour),HD,0,0,0,0,3.9,124,0,,0,124
209,B081Q3P77N,"SHARABANI Hand Loom Cotton Bath Checks Towels 65 inches /31 inches, 2.7 feet / 5.5 feet, 80 cms / 165 cms, Pack of 3, Multicolour",SHARABANI,0,0,0,399,4.1,"2,118",60,"Sunday, February 13",1,"2,118"
210,B09NRL6PS5,"Home Cloud Towel Towel, Colorful ,Coral Velvet Women Bath Towel Sets ,Soft Fluffy, face Wash | Hair Towel Includes Multi (Dots Grey)",Home,0,0,0,489,4.2,54,51,"Sunday, February 13",0,54
211,B01M1D8FE2,"SOFTSPUN Microfiber Bath & Hair, Care Towel Set of 1 Piece, 70x140 Cms 340 GSM (Purple). Super Soft & Comfortable, Quick Drying, Ultra Absorbent in Large Size.",SOFTSPUN,0,0,0,449,4.3,"1,502",46,"Saturday, February 12",0,"1,502"
212,B09RG4SMS9,"BKT-HOMEMATE Luxurious Premium | Hand Towel | Face Towel | Gym Towel| (40 cm x 60 cm) Multicolor, Pack of 2",BKT-HOMEMATE,0,0,0,235,4.3,2,53,"Sunday, February 13",1,2
213,B09F5PL8HR,"Mush 600 GSM Hand Towel Set of 2 | 100% Bamboo |Ultra Soft, Absorbent & Quick Dry Towel for Bath, Gym, Pool, Travel, Spa and Yoga | 29.5 x 14 Inches (Navy Blue & Grey)",Mush,0,0,0,699,4.2,490,30,"Sunday, February 13",1,490
214,B08XY6TG9M,AHMADUN Pure Cotton Stylish Men's Stoles towel Large size Soft and comfortable for Bathing Bhagwa Gamcha Modi Style Light Orange(Kesariya) colour size 180 * 85cm Pack of 1,AHMADUN,0,0,0,219,0,0,56,,1,"₹219
₹499 Save ₹280 (56%)"
215,B09FGGC83X,MJN Women's Cotton Quick Absorbent Hair Drying Magic Hair Towel Wrap (Mulitcolor),MJN,0,0,0,169,3.4,275,83,"Sunday, February 13",1,275
216,B0813WFNHF,"SUNAM Microfiber Quick Dry Travel Towel - Comes with Fast Dry Hand Towel - Our Super Absorbent Dry Towel is So Soft, Lightweight and Compact - for Camping, Gym or a Beach Towel",SUNAM,0,0,0,599,0,0,54,"Sunday, February 13",1,"₹599
₹1,299 Save ₹700 (54%)"
217,B097JSFS1D,"TRIDENT Bath Towel, 1 Piece Bathroom Towel, 100% Cotton, Highly Absorbent, Super Soft, Soft and Plush, 500 GSM (Nile Blue)",TRIDENT,0,0,0,639,4.1,450,68,"Tuesday, February 15",0,450
218,B08HVJNYGV,Cotton Zone Cotton Bath Towel (Orange),Cotton,0,0,0,185,4.0,15,38,"Tuesday, February 15",0,15
219,B09P8KTJQ3,"TIQH Organic Cotton 600 GSM Thick and Plush Hand, Gym & Workout Hand Towel - Set of 4 (Navy)",TIQH,0,0,0,549,0,0,63,"Saturday, February 12",1,"₹549
₹1,500 Save ₹951 (63%)"
220,B08JPXHSH9,"Beauty Towels Bankura's Special Pure Soft Cotton Bath Towel 150 GSM for Men and Women, Multicolour, Large Size - Set of 2",Beauty,0,0,0,328,4.3,36,65,"Friday, February 11",0,36
221,B09P3QZ1QQ,Shopperszen Microfibre Dry Towel for Gym Towel- Free Delivered- Multipurpose Usage for All Exercises Multicolor -350 GSM (Grey),Shopperszen,0,0,0,130,0,0,63,"Sunday, February 13",0,"₹130
₹350 Save ₹220 (63%)"
222,B095HP91NW,"VORDVIGO™ 100% Cotton Large Full Size White Bath Towels for Hotel and Spa, Super Soft Absorbent Antibacterial, 350 GSM, Full Large Size-60 inch x 30 inch or 152 cm x 76 cm ( 6 Piece)",VORDVIGO™,0,0,0,"1,199",3.9,18,40,"Tuesday, February 15",0,18
223,B09FT2CKHK,"Welspun 100% Cotton Quik Dry Bath Towel (Solid, 70CMX150CM) - Green, Standard (1054463)",Welspun,0,0,0,329,5.0,1,0,"Tuesday, February 8",0,1
224,B07KXTNJHR,"Heelium Bamboo Hand Towel for Sports & Gym, Super Absorbent & Soft, Antibacterial, 600 GSM, 25 inch x 15 inch, Pack of 2 (Blue, Grey)",Heelium,0,0,0,699,4.4,"1,132",30,"Tuesday, February 8",1,"1,132"
225,B07NQMSX6R,Athom Living Light Weight Cotton Premium Waffle Border Bath Towel 75x150 cm Pack of 4,Athom,0,0,0,527,4.3,106,12,"Friday, February 11",1,106
226,B08P54JMSX,"Nikyanka Cotton Hand Towel 125 gms (Pack of 6, Multicolour)",Nikyanka,0,0,0,269,3.8,186,46,"Wednesday, February 16",0,186
227,B09PV7L97L,Khillayox Unisex Microfiber Large Size Bath Towel - 400 GSM / Extra Soft and Super Absorbent Bath Towels for Men and Women Set of 1 (140x70 cm) - Green,Khillayox,0,0,0,299,4.0,1,40,"Saturday, February 12",1,1
228,B098BBPMN9,"Bengal Trend ™ Gamcha Cotton Soft Bengali Bath Towel for Men & Women (Multicolour , Full Size Large XXXL) - Combo Set of 2",Bengal,0,0,0,346,4.3,24,57,"Friday, February 11",0,24
229,B00VR73002,"Bombay Dyeing Tulip Plain Dyed Cotton Bath Towel, 450 GSM - Lilac",Bombay,0,0,0,574,0,0,13,"Saturday, February 12",0,"₹574
₹659 Save ₹85 (13%)"
230,B09NYCTG6Z,"MAFATLAL Daffodil Series - Cotton Bath & Hand Towel Set for Adults/Couples, Set of 4 Towels for Men & Women Full Size 600 GSM Towels for Bath & Hand/Face (Sea Green)",MAFATLAL,0,0,0,"1,699",0,0,13,"Saturday, February 12",1,"₹1,699
₹1,947 Save ₹248 (13%)"
231,B09BR6VZH1,"PADHUMAM Cotton Bath Towels (Brown and Beige, 75cm x 150cm) - Set of 2",PADHUMAM,0,0,0,370,4.2,69,47,"Wednesday, February 16",1,69
232,B092ZXZ937,Leaf Dew 100% Cotton Bath Towels (500GSM/150 x 75CM) Large Size Towel for Men & Women (Mint Green),Leaf,0,0,0,399,4.0,663,33,"Tuesday, February 15",1,663
233,B09MN5N13F,"Spillbox Soft Cotton Hand Towel,Face Towel,Kitchen Towel, Dish Towel Cloth Quick Absorption and Faster Drying Multicolor (Pack -4) (Black-Yellow-Blue-Green)",Spillbox,0,0,0,189,0,0,62,"Monday, February 14",0,"₹189
₹499 Save ₹310 (62%)"
234,B07PH6S8XF,Bombay Dyeing cotton Bath Towel 450 GSM (Blue),Bombay,0,0,0,609,3.9,37,8,"Saturday, February 12",0,37
235,B08RXZJ5L6,"AHMADUN Handloom Khadi Cotton Bath Towel in Combo Size 30*70 Inches, Multicolour, Pack of 4 Khadi Bhandar",AHMADUN,0,0,0,399,3.7,35,11,"Sunday, February 13",1,35
236,B09QZSJZQW,Tharunsha Elite Pure Cotton 500 GSM Large Size Terry Towel / Bath Towel / Beach Towel / Hair Towel / Gym Towel /Swimming Pool Towel - Combo 2 pc( 140 cm x 70 cm ) Yellow Biscuit,Tharunsha,1,0,0,548,0,0,73,"Tuesday, February 15",0,"₹548
₹2,000 Save ₹1,452 (73%)"
237,B093GYN3F3,"Spaces Atrium Plus High Absorbency Soft Quik to Dry Easy Care Solid Cotton Hand Towel (Grape Fruit/Midnight Blue, 40cmX60cm)",Spaces,1,0,0,698,5.0,6,50,"Saturday, February 12",1,6
238,B093GXSPFR,"Spaces Atrium Soft Feel Cotton High Absorbency Quik to Dry, Easy Care Face Towel (Red & Midnight Blue, Solid, 30 X30 cm )",Spaces,1,0,0,500,4.3,34,50,"Tuesday, February 8",1,34
239,B09PDHT58N,"Cloth Fusion Brookwella 100% Cotton 2 Piece Bath Towel Set ,500 GSM (Pink & Blue)",Cloth,1,0,0,699,4.1,443,46,"Sunday, February 13",1,443
240,B09P411GK5,"Home Cloud Towel Soft Towel, Colorful ,Coral Velvet Women Bath Towel Sets, with Beautiful Net Wrap Packaging (1 Bath & 1 Hand Towel Combo) (dot Blue)",Home,1,0,0,489,4.2,54,51,"Friday, February 11",0,54
241,B09NM7RQWD,"Home Cloud Towel ZICZAC Towel, Colorful ,Coral Velvet Women Bath Towel Sets ,Soft Fluffy, face Wash | Hair Towel Includes Sky Blue_1",Home,1,0,0,489,3.9,17,51,"Friday, February 11",0,17
242,B09MDPJSB1,"Mush Extra Large Cabana Style Turkish Towel 100% Bamboo - (90 x 160 cms) - Ideal for Beach, Bath, Pool etc (Light Green & Grey, 1)",Mush,1,0,0,999,4.4,10,23,"Sunday, February 13",1,10
243,B07FXTPMZ3,"HABER Cotton Bath Towel (Set of 2, Yellow)",HABER,1,0,0,"1,199",4.2,"1,220",14,"Friday, February 11",1,"1,220"
244,B09P83SGVH,Growth Alley - Hair Towel wrap for Women Long Hair Cotton 500 GSM Pack of 2(Pink-Grey),Growth,0,0,0,333,4.5,5,67,"Sunday, February 13",1,5
245,B08QJ1BJYW,"Welspun Health Cotton Large Face Towel 380 GSM, Anti-Bacterial Bright Colors High Absorbency (Solid, 30 cm x 30 cm, Set of 4, Teal)",Welspun,0,0,0,149,3.9,290,0,"Friday, February 11",0,290
246,B07R7CJNXB,"Welspun Cotton Bath Towel 375 GSM (Set Of 1, Coral)",Welspun,0,0,0,0,4.1,"2,250",0,,0,"2,250"
247,B08HSBDDMD,"Krisha Craft Cotton Red Gamcha, Angocha, Striped, Bath Towel (135 cm X 65 cm) (2)",Krisha,0,0,0,165,3.0,1,79,"Tuesday, February 15",0,1
248,B088P5PL67,Kuber Industries Hanging Cotton 2 Pieces Cotton Washbasin Napkin/Hand Towel for Kitchen and Bathroom (Multi) - CTKTC45537,Kuber,0,0,0,129,3.4,149,13,"Friday, February 11",0,149
249,B08JQGF9Z7,Supreme Bazar Handloom 100% Pure Cotton Towels 1 Year Guarantee XXXL 36inches/72inches(3 feet/6feet) 90cms/180cms (Pack:2) 800 GSM Multi Color,Supreme,0,0,0,230,3.0,11,77,"Tuesday, February 15",0,11
250,B09B2HJ8R9,"PADHUMAM Cotton Bath Towels (Pink and Grey, 75cm x 150cm) - Set of 2",PADHUMAM,0,0,0,370,4.0,58,47,"Wednesday, February 16",1,58
251,B097ZXKBX1,"Kuber Industries Premium Super Soft, Fluffy, and Absorbent, Cotton Bath Towel Perfect for Daily Use, 30""x60"" (Blue), Standard (HS39KUBMART023838)",Kuber,0,0,0,299,4.0,20,0,"Saturday, February 12",0,20
252,B096SMX1XP,"Uber World Microfiber 250 GSM Bath Towels for Kids (Multicolour, 100 x 55 cm) Pack of 3",Uber,0,0,0,699,3.8,44,30,"Sunday, February 13",1,44
253,B0987JQRWP,MINISO Soft Hair Wrap Towel (Brown),MINISO,0,0,0,195,4.0,157,3,"Sunday, February 13",1,157
254,B0126ZASPI,"Amazon Brand - Solimo 100% Cotton 10 Piece Towel Set, 500 GSM (Iris Blue and Paradise Pink)",Amazon,0,0,0,"1,030",4.2,"2,293",43,"Tuesday, February 8",1,"2,293"
255,B07FXT1KT9,"Haber Premium Cotton Bath Towel, Yellow | Pack of 1",Haber,0,0,0,649,4.2,"1,220",7,"Friday, February 11",1,"1,220"
256,B09JNPWPQQ,"Bamboo 100% Pure Cotton Bath Towel Piece, 500 GSM (Aqua Blue)",Bamboo,0,0,0,549,0,0,21,"Sunday, February 13",1,"₹549
₹699 Save ₹150 (21%)"
257,B0974X1QRC,Khillayox™ Super Soft Bath Towel for Women's & Kids (24x48 inch) (Sky Blue),Khillayox™,0,0,0,299,3.9,23,57,"Saturday, February 12",0,23
258,B07873YNDM,Core Designed by Spaces Solid 2 Piece 400 GSM Cotton Hand Towel Set - Cobalt,Core,0,0,0,199,3.9,3,0,"Sunday, February 13",0,3
259,B09R4NZ55Q,Bombay Dyeing Towel - Ultx 650 Zero Twist Towel - Premium Premium Range - White,Bombay,0,0,0,"1,599",0,0,5,"Tuesday, February 15",1,"₹1,599
₹1,689 Save ₹90 (5%)"
260,B082Q1BGLP,"HABER Cotton Bath Towel with Super Absorb Texture and Light Weight with Quick Absorption, Faster Drying Towel Pack of 1 - Chevron Collection (Coral)",HABER,1,0,0,699,4.1,334,7,"Saturday, February 12",1,334
261,B09JC1WFB7,"Haber Premium Light Weight 100% Cotton Bath Towel with Unique Micro Waffle Texture for Active Feel, Quick Absorption and Faster Drying Towel, Pack of 1- Myriad Collection (Aqua and Plum, Pack of 2)",Haber,1,0,0,"1,299",4.2,719,13,"Saturday, February 12",1,719
262,B0855VTWS6,"Mush Bamboo-derived Rayon Towel (Set of 1, Grey) |Ultra Soft, Absorbent & Quick Dry Towel for Bath, Beach, Pool, Travel, Spa and Yoga | 29 x 59 Inches, 250 gsm",Mush,1,0,0,799,4.3,"1,576",0,"Saturday, February 12",1,"1,576"
263,B0166CQ4DM,"Amazon Brand - Solimo Cotton 6 Piece Towel Set, 500 GSM (Paradise Pink and Sunshine Yellow)",Amazon,1,0,0,951,4.3,"3,794",37,"Tuesday, February 8",1,"3,794"
264,B08S3LSTPP,Leaf Dew 100% Cotton Bath Towel (400GSM/140 x 70cm) Large Size Towel for Men & Women (Navy Blue),Leaf,0,0,0,329,4.1,380,40,"Tuesday, February 15",0,380
265,B076Q4V4DR,Athom Living Marvel Blue 350 GSM 100% Cotton Kids Bath Towel 60x120 cm,Athom,0,0,0,472,4.2,197,53,"Friday, February 11",0,197
266,B077TZZW2R,Milap Cotton Hand Towels (White) - Set of 12.,Milap,0,0,0,345,3.8,59,65,"Tuesday, February 15",0,59
267,B096T4CT92,House Beauty Luxury Microfiber Towel Ultra Soft Anti-Bacterial (Grey and Sky Blue)-Pack of 2,House,0,0,0,699,4.1,85,56,"Friday, February 11",1,85
268,B08YRKBDZJ,"RATAN CART Cleaning Cloth Multipurpose Cotton Kitchen Towel (Set of 3, Yellow, Blue)",RATAN,0,0,0,299,4.6,5,57,"Saturday, February 12",0,5
