,asin,title,brand,Sponsored,Best Seller,Amazon's Choice,Price,Rating,NoofRatings,Discount,Delivery,Prime Delivery,base
0,B09NMDPF2Y,Philips BT3231/15 Smart Beard Trimmer - Power adapt technology for precise trimming- Fast Charge; 20 settings; 60 min run time,Philips,1,0,0,"1,895",4.9,84,5,"Friday, February 18",1,84
1,B08VK1NKTW,"Philips MG5740/15, 12-in-1, Face, Hair and Body - Multi Grooming Kit. Dual Cut Blades for Maximum Precision, 80 Mins Run Time (Silver)",Philips,1,0,0,"2,223",4.3,"4,164",26,"Friday, February 18",1,"4,164"
2,B09NMD96QD,Philips BT3241/15 Smart Beard Trimmer - Power adapt technology for precise trimming- 20 settings; 90 min run time,Philips,1,0,0,"2,370",4.9,80,5,"Friday, February 18",1,80
3,B098P775HY,"BSC Cordless Beard & Hair Trimmer for Men | Waterproof, Flash Charging, 2yr Warranty",BSC,1,0,0,"1,299",4.1,237,35,"Friday, February 18",1,237
4,B096RN9V8V,"PHILIPS BT1232/15 Skin-friendly Beard Trimmer - DuraPower Technology, Cordless Rechargeable with USB Charging, Charging indicator, Travel lock, No Oil Needed, Blue",PHILIPS,0,0,1,885,4.1,"16,595",6,"Friday, February 18",1,"16,595"
5,B08PS2KXJP,"MI Cordless Beard Trimmer 1C, with 20 Length Settings, 60 Minutes of Usage, & USB Fast Charging, Black",MI,0,1,0,999,4.3,"33,465",17,"Sunday, February 20",1,"33,465"
6,B07D1HRHLV,Philips BT3211/15 corded & cordless Beard Trimmer with Fast Charge; 20 settings; 60 min run time,Philips,0,0,0,"1,516",4.4,"48,530",20,"Friday, February 18",1,"48,530"
7,B07ZTKM6R8,SYSKA HT200U Beard Pro Trimmer Runtime: 40 Mins Cordless Use (Black),SYSKA,0,0,0,621,4.1,"14,140",17,"Sunday, February 20",1,"14,140"
8,B07T8HLV1W,Mi Corded & Cordless Waterproof Beard Trimmer with Fast Charging - 40 Length Settings,Mi,0,0,0,"1,399",4.2,"60,399",7,"Sunday, February 20",1,"60,399"
9,B08JDDTPD8,"SYSKA HT900 BeardPro Corded & Cordless Trimmer with Fast Charge, 120 Min Runtime, 40 Length Settings (Black)",SYSKA,0,0,0,980,4.0,145,51,"Friday, February 18",1,145
10,B07NGTRRPN,Philips QP2525/10 Cordless One Blade Hybrid Trimmer and Shaver with 3 Trimming Combs,Philips,0,0,0,"1,688",4.2,"28,897",23,"Friday, February 18",1,"28,897"
11,B07CXB2ZVB,Philips BT3203/15 cordless rechargeable Beard Trimmer - 10 length settings; 45 min run time,Philips,0,0,0,"1,398",4.3,"48,036",6,"Friday, February 18",1,"48,036"
12,B07D17R2PP,Philips BT3221/15 corded & cordless Titanium blade Beard Trimmer - 20 length settings; 90 min run time,Philips,0,0,0,"1,891",4.4,"44,882",19,"Friday, February 18",1,"44,882"
13,B07JM1PJ3H,Nova NHT 1073 USB Rechargeable and Cordless: 60 Minutes Runtime Professional Hair Clipper for Men,Nova,0,1,0,570,4.0,"7,476",43,"Monday, February 21",1,"7,476"
14,B09375VWV2,NOVA NHT 1046 BLK Pro Series Hair Trimmer (Black),NOVA,0,0,0,378,3.4,"6,833",71,"Friday, February 18",1,"6,833"
15,B08VK5F2RG,"Philips MG3747/15, 9-in-1, Face, Hair and Body - Multi Grooming Kit. Self Sharpening Stainless Steel Blades, No Oil Needed, 70 Mins Run Time (Black)",Philips,0,0,0,"1,591",4.3,"8,579",16,"Friday, February 18",1,"8,579"
16,B07JLBFYX7,Nova NHT 1076 Cordless: 30 Minutes Runtime Trimmer for Men (Black),Nova,0,0,0,399,3.6,"14,427",56,"Friday, February 18",1,"14,427"
17,B07QGW4C1S,"Lifelong Trimmer- Runtime 50 minutes, 20 Length Settings | Cordless Beard Trimmer| Trimmer with Charging Indicator with 1 Year Warranty (LLPCM05, Black)",Lifelong,0,0,0,649,4.1,"12,915",57,"Friday, February 18",1,"12,915"
18,B09K5JLMFN,"Zebronics ZEB-HT101 Cordless/Cord use Trimmer with up to 90mins backup, USB fast charge, Rounded tip stainless steel blade, 4 guide combs, Washable attachments, LED indicator and ABS material(Black)",Zebronics,0,1,0,699,4.2,141,56,"Friday, February 18",1,141
19,B08JNP488Z,"VGR V-055 Professional Cordless Rechargeable Beard Trimmer Clippers for Men with Guide Combs Brush, Black",VGR,0,1,0,695,4.1,"3,210",72,"Friday, February 18",1,"3,210"
20,B09R21XTC5,"Faddish 4.3v ultra fast USB charging cable compatible with most philips trimmer, shavers, body groomers & multi grooming models (Replacement for A00390 Charger N4)",Faddish,1,0,0,319,5.0,1,68,"Tuesday, February 22",0,1
21,B07S373MSL,SYSKA Syska HT4000K Cord Cordless Rechargeable Beard Trimmer,SYSKA,1,0,0,"1,796",4.2,"3,197",38,"Friday, February 18",1,"3,197"
22,B08963M5Q8,Kubra KB-309 Professional Cordless Rechargeable LED Display Hair Clipper Heavy Duty for Hair and Beard Cut (White),Kubra,1,0,0,"1,399",4.1,"8,057",18,"Sunday, February 20",1,"8,057"
23,B0844G4KGZ,"Kubra KB-1001 USB Fast charging, 90 min runtime, Adjustable 38 Length Setting, Ultra Sleek Beard Trimmer for Men (Black)",Kubra,1,0,0,749,4.1,"5,776",53,"Sunday, February 20",1,"5,776"
24,B0183I7K1W,Nova NHT-1071 Titanium Coated Cordless: 45 Minutes USB Trimmer for Men (Black/Blue),Nova,0,0,0,599,3.9,"19,889",60,"Tuesday, February 22",1,"19,889"
25,B01NBDSYIX,Nova NG 1150 Cordless and Rechargeable Multi Grooming Trimmer for Men Runtime: 60 Mins (Black),Nova,0,0,0,"1,099",3.9,"3,964",45,"Tuesday, February 22",1,"3,964"
26,B09FGMVYQ8,"LIONWY Portable eyebrow trimmer for women, epilator for women, facial hair remover for women,Face, Lips, Nose Hair Removal Electric Trimmer with Light- (Multi)",LIONWY,0,0,0,379,4.6,82,58,"Monday, February 21",1,82
27,B085MN1V6P,NOVA NG 1152 Cordless Rechargeable: 60 Minutes Runtime Multi Grooming Trimmer for Men (Blue),NOVA,0,0,0,"1,199",4.0,"1,839",40,"Tuesday, February 22",1,"1,839"
28,B084YXVFZR,"Swiss Military Cordless Nose Trimmer Unisex Suitable for Nose, Ear and Eyebrow with Protective Cap, Stainless Steel Washable Blade, 120 minutes Battery Run time, 2 Years Warranty SHV-8 (Black)",Swiss,0,0,0,699,3.8,188,30,"Saturday, February 19",1,188
29,B09P77491L,"Fowles Portable eyebrow trimmer for women, epilator for women, facial hair remover for women, Face, Lips, Nose Hair Removal Electric Trimmer",Fowles,0,0,0,349,4.1,50,50,"Monday, February 21",1,50
30,B08BHZD7WB,"Lifelong LLPCW30 Rechargeable Eyebrow, Underarms and Bikini Trimmer, Female Trimmer, Portable Eyebrow Trimmer with and without Comb (White) with 1 Hour Runtime (1 Year Warranty)",Lifelong,0,0,0,949,3.9,"4,806",21,"Friday, February 18",1,"4,806"
31,B0844G4KGZ,"Kubra KB-1001 USB Fast charging, 90 min runtime, Adjustable 38 Length Setting, Ultra Sleek Beard Trimmer for Men (Black)",Kubra,0,0,0,749,4.1,"5,776",53,"Sunday, February 20",1,"5,776"
32,B08VK1NKTW,"Philips MG5740/15, 12-in-1, Face, Hair and Body - Multi Grooming Kit. Dual Cut Blades for Maximum Precision, 80 Mins Run Time (Silver)",Philips,0,0,0,"2,223",4.3,"4,164",26,"Friday, February 18",1,"4,164"
33,B07GBVL54J,One-Stop-Shop Nose/Ear/Eyebrow Hair Trimmer Black New Design AA Battery Included,One-Stop-Shop,0,0,0,299,3.3,14,47,"Saturday, February 19",1,14
34,B09J97SB6K,"realme Trimmer (Cordless) with 20 Length Settings,120min Battery & USB Type-C Fast Charge",realme,0,0,0,"1,285",4.0,197,29,"Friday, February 18",1,197
35,B09Q16NXZJ,VEWIKZY | Rechargeable Cordless Men Trimmer Shaver Machine for Beard & Hair Styling with 3 Extra Clips | Hair Clipper for Men & Boys | Multi-color | Pack of 1,VEWIKZY,0,0,0,359,4.8,5,60,"Monday, February 21",1,5
36,B09NMDPF2Y,Philips BT3231/15 Smart Beard Trimmer - Power adapt technology for precise trimming- Fast Charge; 20 settings; 60 min run time,Philips,0,0,0,"1,895",4.9,84,5,"Friday, February 18",1,84
37,B00TO7K08C,Philips BG1025/15 Showerproof Body Groomer for Men,Philips,0,0,0,"1,340",4.1,"26,757",10,"Friday, February 18",1,"26,757"
38,B08KSW28TR,"Philips Nose Trimmer Nt3650/16, Cordless Nose, Ear & Eyebrow Trimmer with Protective Guard System, Fully Washable, Including AA Battery, 2 Eyebrow Combs, Pouch (Gray)",Philips,0,0,0,963,3.9,"3,652",19,,0,"3,652"
39,B09GVYMJJ2,"Xiaomi Corded + Cordless Beard Trimmer 2 with Type-C Fast Charging, LED Display, Waterproof, 40 Length Settings, Stainless Steel Blades, 90 mins Cordless Runtime, Travel Lock, Black (2021)",Xiaomi,0,0,0,"1,799",4.4,"1,263",49,"Sunday, February 20",1,"1,263"
40,B08D1SG79X,"GENWEI Men's Hair Clippers, Hair Trimmer Professional Kit, Cordless Hair Trimmer USB Rechargeable, for Men/Kids/Baby/Barber",GENWEI,0,0,0,675,4.1,778,66,"Tuesday, February 22",0,778
41,B09499H6YF,Palaxy Eyebrow/Nose/Neck/Ear Hair Remover Trimmer for Men and Women (Green),Palaxy,0,0,0,299,5.0,2,63,"Monday, February 21",1,2
42,B09N7NN6PH,"Fiyavi Portable eyebrow trimmer for women, epilator for women, facial hair remover for women,Face, Lips, Nose Hair Removal Electric Trimmer with Light (Rainbow) (GOLD TRIMMER)",Fiyavi,0,0,0,399,4.3,44,50,"Monday, February 21",1,44
43,B09HBGNN88,"R A Products NS-216 Rechargeable Cordless Beard Trimmer for Men, (Multicolor, Pack of3 trimmers).",R,0,0,0,297,2.7,29,63,"Monday, February 21",1,29
44,B09NMD96QD,Philips BT3241/15 Smart Beard Trimmer - Power adapt technology for precise trimming- 20 settings; 90 min run time,Philips,0,0,0,"2,370",4.9,80,5,"Friday, February 18",1,80
45,B08D34RWM6,Kubra KB-2028 Rechargeable Cordless 50 Minutes Runtime Hair and Beard Trimmer for Men (Black),Kubra,0,0,0,479,3.5,"1,309",52,"Sunday, February 20",1,"1,309"
46,B09PHNFVP2,"Kintota Portable eyebrow trimmer for women, epilator for women, facial hair remover for women, Face, Lips, Nose Hair Removal Electric Trimmer with Light (color may vary)",Kintota,0,0,0,349,4.1,97,77,"Monday, February 21",1,97
47,B09B9DJZNP,C (DEVICE) HTC Professional Hair Clipper & Trimmer For Men and Women (AT 522 BLACK),C,0,0,0,399,3.6,53,60,"Tuesday, February 22",1,53
48,B082PNCNNP,"Lifelong Trimmer- 45 Minutes Runtime; 20 Length Settings | Cordless, Rechargeable Trimmer with 1 Year Warranty (LLPCM13, Black)",Lifelong,0,0,0,520,3.8,"7,839",57,"Friday, February 18",1,"7,839"
49,B09BD7NL76,"Philips BT1230/15 Skin-friendly Beard trimmer Dura Power Technology, Cordless Rechargeable with USB Charging, Charging indicator, Travel lock",Philips,0,0,0,809,3.9,251,10,"Saturday, February 19",1,251
50,B08963M5Q8,Kubra KB-309 Professional Cordless Rechargeable LED Display Hair Clipper Heavy Duty for Hair and Beard Cut (White),Kubra,0,0,0,"1,399",4.1,"8,057",18,"Sunday, February 20",1,"8,057"
51,B09PHRVKZY,"JB Portable eyebrow trimmer for women, epilator for women, facial hair remover for women, Face, Lips, Nose Hair Removal Electric Trimmer with Light Rose Gold",JB,0,0,0,379,4.5,26,62,"Monday, February 21",0,26
52,B0885RNX3P,"VGR Professional Rechargeable Cordless Beard Hair Trimmer Kit with Guide Combs Brush USB Cord for Men, Family or Pets",VGR,0,0,0,750,4.2,"13,518",66,"Sunday, February 20",1,"13,518"
53,B078H1XKBY,"Veet Sensitive Touch Expert Trimmer for Face, Underarms and Bikini line – Battery & Carry Pouch included",Veet,0,0,0,"1,499",4.0,"15,882",33,"Friday, February 18",1,"15,882"
54,B071XJ4F1S,Kemei Original KM-809A Hair Trimmer for Men (White),Kemei,0,0,0,"1,099",4.2,"3,216",42,"Monday, February 21",1,"3,216"
55,B08KGQK561,LEKZED HEAVY DUTY PROFESSIONAL ELECTRIC HAIR CLIPPER NP Runtime: 0 Trimmer for Men & Women (Multicolor) Hair Trimmer,LEKZED,0,0,0,705,3.6,"1,361",65,"Friday, February 18",1,"1,361"
56,B08MQRT3PN,AmazonBasics Cordless Body Grooming Kit for Men,AmazonBasics,1,0,0,"1,469",4.2,37,41,"Friday, February 18",1,37
57,B08C14GL5B,Amazon Basics G-264L Cordless Beard Trimmer with 19 length settings,Amazon,1,0,0,799,3.7,488,47,"Friday, February 18",1,488
58,B082R8T2MX,"SYSKA HB100 Ultraclip Hair Clipper and Trimmer Support Super Fast Charging, Runtime-90Mins, 20 Length Settings with 4 Stubble Guided Comb (Black)",SYSKA,1,0,0,"1,299",4.3,"6,064",52,"Friday, February 18",1,"6,064"
59,B084TCJ5GD,SYSKA HT3333K Corded & Cordless Stainless Steel Blade Grooming Trimmer with 60 Minutes Working Time; 10 Length Settings (Black),SYSKA,1,0,0,"1,429",4.0,"15,617",35,"Friday, February 18",1,"15,617"
60,B092MPDRHZ,"Ambrane Cord-Cordless Trimmer Kit for Men with 10 Adjustable Combs, 60 Mins Runtime, 26 Length Settings, Face, Hair and Body Grooming, Stainless & Washable Blades (Cruiser Mini, Black)",Ambrane,1,0,0,999,4.1,289,41,"Sunday, February 20",1,289
61,B08D34RWM6,Kubra KB-2028 Rechargeable Cordless 50 Minutes Runtime Hair and Beard Trimmer for Men (Black),Kubra,1,0,0,479,3.5,"1,309",52,"Sunday, February 20",1,"1,309"
62,B08M6PPRV3,"VEGA Men X1 Beard Trimmer For Men With Quick Charge, 90 Mins Run-time, Waterproof, For Cord & Cordless Use And 40 Length Settings, (VHTH-16)",VEGA,1,0,0,"1,045",4.1,"4,015",30,"Friday, February 18",1,"4,015"
63,B082PNCNNP,"Lifelong Trimmer- 45 Minutes Runtime; 20 Length Settings | Cordless, Rechargeable Trimmer with 1 Year Warranty (LLPCM13, Black)",Lifelong,1,0,0,520,3.8,"7,839",57,"Friday, February 18",1,"7,839"
64,B078K5CBX7,Nova NG 1151 All in One 100% Waterproof Corded n Cordless: 60 Minutes Runtime Grooming Kit For Men (Black),Nova,0,0,0,"1,395",4.0,"1,793",37,"Friday, February 18",1,"1,793"
65,B073RGFFVL,Nova NLS 530 Sensi-Trim Bikini & Facial Trimmer for Women ( Battery Included ) (White),Nova,0,0,0,795,3.8,"2,874",39,"Tuesday, February 22",1,"2,874"
66,B093L1HH85,"CONCEPT RACING Heavy Duty Professional Hair Trimmer F-Y-C Rf-666 Electric Hair Clipper Np Runtime, Hair Trimmer for Men & Women (Maroon)",CONCEPT,0,0,0,649,3.6,20,28,"Monday, February 21",1,20
67,B07D82R9JT,Nova Rechargeable Cordless: 30 Minutes Runtime Beard Trimmer for Men (Black),Nova,0,0,0,399,3.6,713,71,"Friday, February 18",1,713
68,B09MCWJ5LN,Ashpo Rechargeable hair trimmer for men 19 speed adjustment and choice of trim length between 04mm to 8.5mm for shave beard Mixcolor,Ashpo,0,0,0,490,4.2,37,66,"Tuesday, February 22",0,37
69,B097RRMTKS,Nova NG 1146 Rechargeable: 120 Minutes Runtime Multi Grooming Trimmer for Men (Blue),Nova,0,0,0,899,3.9,355,44,"Tuesday, February 22",1,355
70,B07MXB26DS,Kemei KM-809A Professional Design Perfect Shaver Hair Clipper and Trimmer with Cord and Cordless Use (White),Kemei,0,0,0,898,4.1,770,42,"Tuesday, February 22",0,770
71,B09QKW45SG,DD Men's All in One Personal Ear Nose Neck Eyebrow Hair Trimmer Remover Plastics Green All-In-One Personal Micro Touches Touch Ear Nose Neck Eyebrow Precision Hair Trimmer,DD,0,0,0,299,0,0,40,"Monday, February 21",0,"₹299 (₹299/count)
₹499 Save ₹200 (40%)"
72,B07C6CSF6K,Havells BT5100C Micro USB Rechargeable Beard & Moustache Trimmer with Hypoallergenic Stainless Steel Blades Allows Zero Trim with .5 mm Precision,Havells,0,0,0,920,3.9,"2,709",38,"Sunday, February 20",1,"2,709"
73,B09Q5YTT39,"Caresmith Bloom Face & Body Hair Trimmer for Women | 3 Heads- Face Trimmer, Eyebrow Trimmer, Body Trimmer & Shaver | Rechargeable | Hair Removal Machine for Women",Caresmith,0,0,0,999,5.0,2,57,"Sunday, February 20",1,2
74,B08CJ34LBW,"Philips Touch-Up HP6388 Eyebrows, Facial & Body Trimmer (White)",Philips,0,0,0,"1,249",4.0,"4,129",22,"Friday, February 18",1,"4,129"
75,B09G6SFFSV,"VEGA Feather Touch 4 In 1 Trimmer for Women: Suitable for Trimming Eyebrows, Nose, Face & Private Area (VHBT-03), White",VEGA,0,0,0,"1,295",3.5,127,28,"Friday, February 18",1,127
76,B08C7RP13L,Philips BT3102/15 Cordless Beard Trimmer (Black and Grey),Philips,0,0,0,"1,345",4.2,"3,280",10,"Tuesday, February 22",1,"3,280"
77,B0744L38KK,Philips BT1212/15 USB charging cordless rechargeable Beard Trimmer,Philips,0,0,0,925,4.1,"83,318",2,"Wednesday, February 23",1,"83,318"
78,B08MQRT3PN,AmazonBasics Cordless Body Grooming Kit for Men,AmazonBasics,0,0,0,"1,469",4.2,37,41,"Friday, February 18",1,37
79,B08M6PPRV3,"VEGA Men X1 Beard Trimmer For Men With Quick Charge, 90 Mins Run-time, Waterproof, For Cord & Cordless Use And 40 Length Settings, (VHTH-16)",VEGA,0,0,0,"1,045",4.1,"4,015",30,"Friday, February 18",1,"4,015"
80,B08CN7YXK9,"Kubra KB-1014 USB 45 min runtime, Adjustable 20 Length Setting, Ultra Sleek Beard Trimmer for Men (Black)",Kubra,1,0,0,549,3.6,"1,815",45,"Tuesday, February 22",1,"1,815"
81,B07C6CSF6K,Havells BT5100C Micro USB Rechargeable Beard & Moustache Trimmer with Hypoallergenic Stainless Steel Blades Allows Zero Trim with .5 mm Precision,Havells,1,0,0,920,3.9,"2,709",38,"Sunday, February 20",1,"2,709"
82,B094JPRYYV,"MENHOOD Men's WaterProof Cordless Grooming Trimmer for Men, Suitable for Beard, Body Private Part Shaving, Head and Pubic Hair, 90min Run Time (Black)",MENHOOD,1,0,0,"3,899",3.7,223,51,"Sunday, February 20",1,223
83,B07QGW4C1S,"Lifelong Trimmer- Runtime 50 minutes, 20 Length Settings | Cordless Beard Trimmer| Trimmer with Charging Indicator with 1 Year Warranty (LLPCM05, Black)",Lifelong,1,0,0,649,4.1,"12,915",57,"Friday, February 18",1,"12,915"
84,B073QVYX1L,Philips BT1215/15 Usb Cordless Beard Trimmer (Black),Philips,0,0,0,"1,170",4.2,"8,302",2,"Tuesday, February 22",1,"8,302"
85,B00QNOZ7GO,Wahl 9243-4724 Home Cut Complete Hair Cutting Clipper (Black),Wahl,0,0,0,"1,799",3.8,"11,889",10,"Thursday, February 24",1,"11,889"
86,B08NX1NTBH,TRUESHOP Rechargeable Cordless Beard Trimmer for Men Professional Hair clippers/Painless Hair Trimmer/Beard trimmer Rechargeable hair cutting machine,TRUESHOP,0,0,0,0,3.3,15,0,,0,15
87,B08PDD9LRP,Jemei Men's Direct AC Power Professional Hair Trimmer Razor Shaving Machine (Random Colour ),Jemei,0,0,0,345,3.0,29,65,"Monday, February 21",1,29
88,B08XZ5THMM,"Painless Eyebrow Trimmer for Women, 2 in 1 Rechargeable Facial Hair Remover with Replaceable Heads, Professional Painless Personal Hair Removal Eyebrow Razor with Indicator Lights",Painless,0,0,0,794,4.1,326,47,"Sunday, February 20",1,326
89,B07BT71XX5,Maxelnova Electric Trimmer For Men (Color May Vary),Maxelnova,0,0,0,349,3.4,159,65,"Sunday, February 20",1,159
90,B09RNBHTLQ,"Fiyavi facial hair remover and eyebrow trimmer for women(COMBO) epilator for women, facial hair remover for women,Face, Lips, (Pink) (2022 Eyebrow Trimmer New)",Fiyavi,0,0,0,299,5.0,3,63,"Monday, February 21",1,3
91,B07QFR6F7X,"Lifelong LLPCM03 Rechargeable Nose and Ear Trimmer; 40 minutes Runtime and Washable; For Men, Woman Ear Hair Trimmer, Waterproof Stainless Steel Nose Hair Trimmer for Men & Women (1 Year Warranty)",Lifelong,0,0,0,569,4.0,"1,697",43,"Friday, February 18",1,"1,697"
92,B08H5HPWXS,WELOCITY PROFESSIONAL Eyebrow trimmer for women usb charging (color may vary) Replacement Warranty,WELOCITY,0,0,0,599,3.5,"1,508",40,"Tuesday, February 22",1,"1,508"
93,B09RK2BQYT,"SAM MOHAN Portable eyebrow trimmer for women, epilator for women, facial hair remover for women,Face, Lips, Nose Hair Removal Electric Trimmer with Light (with usb cable) (rainbow)",SAM,0,0,0,399,0,0,50,"Monday, February 21",1,"₹399
₹799 Save ₹400 (50%)"
94,B094DHK7C5,Perfect Nova (Hair-Trimmer-Clippers) PNHT-518B Runtime: 45 Min Trimmer For Men (Silver),Perfect,0,0,0,369,3.4,39,63,"Tuesday, February 22",1,39
95,B09KPPQ5WQ,PUNZONE Plastics Green All-In-One Personal Micro Touches Touch Ear Nose Neck Eyebrow Precision Hair Trimmer,PUNZONE,0,0,0,299,3.7,24,70,"Monday, February 21",1,24
96,B09BD8W3Z8,"Philips BT1235/15 Skin-friendly Beard trimmer Dura Power Technology, Cordless Rechargeable with USB Charging, Charging indicator, Travel lock",Philips,0,0,0,"1,049",4.1,118,12,"Tuesday, February 22",1,118
97,B09JKP8YNY,"GarLeaf NEW Hair Remover For Women Skincare Lipstick Shape Mini Epilator trimmer Machine for face, Upper Lip, Chin, Eyebrow, etc. with Battery (White)",GarLeaf,0,0,0,285,4.5,5,68,"Monday, February 21",1,5
98,B08CZ8TGKY,candyfouse Hair s，Electric Pro Li Outliner Cordless Rechargeable Grooming Kits T-Blade Close Cutting Trimmer for Men Zero Gap Baldhead Beard Shaver Barbershop Professional (Bronze),candyfouse,0,0,0,"1,099",3.9,347,63,"Tuesday, February 22",1,347
99,B07HW3YZGW,"VEGA Silk Touch Eyebrow, Underarms & Bikini Trimmer for Women, (VHBT-01)",VEGA,0,0,0,739,3.4,735,33,"Friday, February 18",1,735
100,B091Z2LXZT,SYSKA HT1210 Beard Trimmer Cordless and Corded Rechargeable Trimmer - 5 Length Settings; 40 min Runtime (Black),SYSKA,0,0,0,762,4.2,76,20,"Friday, February 18",1,76
101,B08BQ18P3S,"VEGA Men T3 Beard Trimmer For Men With Quick Charge, 90 Mins Run-time, For Cord & Cordless Use And 20 Length Settings, (VHTH-19)",VEGA,0,0,0,949,4.1,"4,735",27,"Sunday, February 20",1,"4,735"
102,B09JW8TJBX,"Pick Ur Needs® Hair Trimmer Professional Shaver With Clipper and 3 in 1 Beard, Nose and Ear Waterproof Hair Trimmer for Men",Pick,0,0,0,783,3.8,6,61,"Monday, February 21",1,6
103,B09RMFRV87,QITIS All in One Personal Trimmer Personal Cordless Micro Touches Max Nose Hair Trimmer for Men and Women (Green),QITIS,0,0,0,339,5.0,1,32,"Monday, February 21",1,1
104,B085HWTPYY,Syska HT200 PRO Beard Pro Cordless Rechargeable Trimmer - 10 Length Settings; 45 Min Runtime (Black),Syska,0,0,0,770,4.1,"4,217",23,"Sunday, February 20",1,"4,217"
105,B09GKPDG58,"AGARO 2107 Rechargeable Multi Trimmer for Women, Eyebrow, Underarms and Bikini Trimmer, 1 Hour Usage, White (33622)",AGARO,0,0,0,999,4.5,22,16,"Tuesday, February 22",1,22
106,B07ZD6NKZZ,"Havells NE6322 Nose & Ear Hair Trimmer, Battery Operated & Easy to Carry (Black)",Havells,0,0,0,0,3.1,302,0,,0,302
107,B09BZPQ44G,iGRiD Nose Hair Trimmer for Men | 3 in 1 | Ear | Nose | Hair Trimmer for Men & Women | Rechargeable | Dual-edge Blades | Painless Electric Nose Ear Trimmer Eyebrow Clipper | IG-1093 |,iGRiD,0,0,0,799,3.5,70,47,"Friday, February 18",1,70
108,B09F3BBB26,"DELLABLE Trimmer NS-216 Rechargeable Cordless Men Trimmer Shaver Machine for Beard & Hair Styling For Men (Multi-color), 3 Extra Clips",DELLABLE,0,0,0,369,4.5,16,47,"Monday, February 21",1,16
109,B09K5P7XLS,"Zebronics ZEB-HT106 6 in 1 Grooming kit with Cordless/Cord use Trimmer, Styling tools,  90mins backup, fast charge, IPX6, 2 speed modes, Rounded tip blade, 4 guide combs, Washable add-ons and ABS(Black)",Zebronics,0,0,0,"1,699",3.8,160,58,"Friday, February 18",1,160
110,B093SXP1L1,"Painless Electric Razor for Women, 2 in 1 Womens Shaver for Pubic Hair Wet & Dry Bikini Trimmer for Legs Underarms and Bikini Line Painless Lady Hair Removal with Comb Attachment, Multi",Painless,0,0,0,499,3.3,287,50,"Sunday, February 20",1,287
111,B0992BF9Y3,"EVOLT Electric Hair trimmer for men Clipper Shaver Rechargeable Hair Machine adjustable for men Beard Hair Trimmer, beard trimmers for men, beard trimmer for men with 4 combs (Black)",EVOLT,0,0,0,479,4.3,431,84,"Monday, February 21",0,431
112,B09RPKGWTD,Navya Export Eyebrow Hair Remover Precision Eyebrow Trimmer Eyebrow Razor Tool For Face Lips Nose Facial Hair Removal for Men Women (White-Gold) (White),Navya,0,0,0,199,5.0,2,75,"Monday, February 21",1,2
113,B09RQW25GH,"Delcy facial hair remover and eyebrow trimmer for women(COMBO) epilator for women, facial hair remover for women,Face, Lips, (2022 Eyebrow Trimmer New)",Delcy,0,0,0,299,5.0,1,63,"Monday, February 21",1,1
114,B09FZMDPY4,KISMAT Big Finishing Touch With Adaptor Instant and Pain Free Hand Held Hair Remover & Trimmer Specially for Women,KISMAT,0,0,0,499,5.0,5,67,"Monday, February 21",1,5
115,B08FHQY3P7,VGR Men's Professional Rechargeable LED Display Hair Clippers Beard Trimmer Kit,VGR,0,0,0,806,4.0,327,73,"Sunday, February 20",1,327
116,B0822YPXFQ,"Braun 6-in-1 All-in-one Trimmer 3 MGK3221, Beard Trimmer, Hair Clipper & Face- Ear/Nose Trimmer, 5 attachments, upto 13 length settings, Black/Volt Green, 50 min run time",Braun,1,0,0,"2,302",4.0,"9,933",15,"Friday, February 18",1,"9,933"
117,B08R4QR15Z,SYSKA HT3500K Ultratrim Corded & Cordless Trimmer with Fast Charge; 120 Min Runtime; 20 Length Settings (Gray),SYSKA,1,0,0,"1,729",4.1,834,31,"Monday, February 21",1,834
118,B09K5K8N7J,"Zebronics ZEB-HT102 Cordless/Cord use Trimmer with up to 120mins backup, USB fast charge, LED display, 3 speed modes, Rounded tip stainless steel blade, 4 guide combs, Washable attachments and ABS(Black)",Zebronics,1,0,0,999,3.9,216,44,"Friday, February 18",1,216
119,B089642XQC,"Kubra KB-5300 5 in 1 Multifunctional Grooming Kit for Body Grooming, Beard & Moustache, Nose, Ear & Eyebrow, LED Display, 19 Length Setting, 90 Minutes Runtime and Fast Charging (Black)",Kubra,1,0,0,"1,449",3.8,"5,517",28,,1,"5,517"
120,B08XPCSJ6P,FURR By Pee Safe Chromium and PTFE Coated Reusable Blade Bikini Line Trimming Razor with Protective Sleeve & Anti Slip Grip for Women,FURR,1,0,0,123,4.3,681,17,"Friday, February 18",1,681
121,B09GPPRVQT,"Braun Series XT5 – Beard Trimmer, Shaver and Electric Razor for Men, Body Grooming Kit for Manscaping, Durable One Blade, One Tool for Stubble, Hair, Groin, Underarms, XT5100 (81753429)",Braun,1,0,0,"2,974",4.0,191,15,"Sunday, February 20",1,191
122,B09DMMZXZM,"VEGA Men 9-in-1 Multi-Grooming Set with Beard/Hair Trimmer, Nose Trimmer & Body Groomer And Shaver, (VHTH-21), Black",VEGA,1,0,0,"1,749",3.8,59,24,"Sunday, February 20",1,59
123,B08LRHSGTH,"Bombay Shaving Company Valentine’s Day Magic | 6-in-1 Beard Grooming Kit for Men | Face and Beard wash, Beard Growth Oil, Beard Softener, Beard Beard, Brush Comb and Scissors | Valentine Day Gift For Boyfriend, Husband",Bombay,1,0,0,949,4.3,653,43,"Friday, February 18",1,653
124,B0992BF9Y3,"EVOLT Electric Hair trimmer for men Clipper Shaver Rechargeable Hair Machine adjustable for men Beard Hair Trimmer, beard trimmers for men, beard trimmer for men with 4 combs (Black)",EVOLT,0,0,0,479,4.3,431,84,"Monday, February 21",0,431
125,B09GYL1JF5,"3 in 1 Multipurpose Beard, Nose, Ear, hair trimmer & Shaver zero machine grooming kit for Men & Women (Gold, Black) Runtime: 60 min Trimmer for Men & Women",3,0,0,0,739,3.8,4,43,"Monday, February 21",0,4
126,B09RQW25GH,"Delcy facial hair remover and eyebrow trimmer for women(COMBO) epilator for women, facial hair remover for women,Face, Lips, (2022 Eyebrow Trimmer New)",Delcy,0,0,0,299,5.0,1,63,"Monday, February 21",1,1
127,B08FHQY3P7,VGR Men's Professional Rechargeable LED Display Hair Clippers Beard Trimmer Kit,VGR,0,0,0,806,4.0,327,73,"Sunday, February 20",1,327
128,B09R1X5J4T,"APRIME ADDA Painless Electric Eyebrow Trimmer for Nose,Lips,Ear, Facial Hair Remover.White and rose gold body (1)",APRIME,0,0,0,249,5.0,7,46,"Monday, February 21",1,7
