,asin,title,brand,Sponsored,Best Seller,Amazon's Choice,Price,Rating,NoofRatings,Discount,Delivery,Prime Delivery,base
265,B07YMZC4QV,Men's Regular Fit T-Shirt,Jockey,0,0,0,649,4.2,"1,056",2,,1,"1,056"
266,B07RTQB4DH,Men's Regular Fit T-Shirt,Madwares,0,0,0,190,3.4,339,62,,1,339
267,B08GYTB44G,Men Off White Short Sleeve Brand Print T-Shirt,AEROPOSTALE,0,0,0,477,4.2,3,52,,0,3
268,B08D7NKGNM,Men's Solid Mandarin Collar Slim Fit Cotton T-Shirt,Urbano Fashion,0,0,0,369,3.8,656,66,,0,656
269,B09BGBVG2M,Men's Regular T-Shirt,Levi's,0,0,0,599,4.0,25,50,,1,25
270,B0862D2D64,Men's Slim Fit Polo T-Shirt,GHPC,0,0,0,399,4.0,389,60,,0,389
271,B07TRH5FRH,Men's Cotton T-Shirt,AELOMART,0,0,0,447,3.9,"7,881",70,,0,"7,881"
272,B07SX61H3L,Plus Size Men's Henley T-Shirt,Bigbanana,0,0,0,645,3.9,689,57,,1,689
273,B08N28MVS1,Men's Regular Fit T-Shirt,EYEBOGLER,0,0,0,364,3.9,11,72,,0,11
274,B0855CGJY5,Mens Cotton Half Sleeve Striped Polo T Shirt with Collar,fanideaz,0,0,0,712,3.7,"3,396",72,,1,"3,396"
275,B01GLHAPFK,AWG All Weather Gear Men's Polyester Round Neck T-Shirt,Scott International,0,0,0,219,3.4,310,73,,0,310
276,B098TTSCDF,Men's Regular T-Shirt,Puma,0,0,0,599,4.0,33,60,,1,33
277,B09CH1N889,Men T-Shirt,Maniac,0,0,0,474,3.9,38,78,,0,38
278,B098FC6ZKR,Men's Regular Fit Polo Multi Color T Shirt (Pack of 3),LEOTUDE,0,0,0,799,3.5,"1,285",50,,1,"1,285"
279,B08YX417MR,Regular Fit Cotton Men's T-Shirt Combo (Pack of 2),LEOTUDE,0,0,0,499,3.6,"2,937",69,,1,"2,937"
280,B073FKXQ9H,Solid Men's Shawl Collar Regular Fit T-Shirt,EYEBOGLER,0,0,0,329,3.6,"10,677",77,,1,"10,677"
281,B08W8QKNMZ,Regular fit Solid Men's Henley Neck Full Sleeve T-Shirt | Cotton Blend T Shirts,BLIVE,0,0,0,299,3.6,550,79,,0,550
282,B09PBYS47Q,Men's Round Neck Full Sleeves T-Shirt | Color Block Full Sleeve T-Shirt,BLIVE,0,0,0,269,2.3,5,87,,0,5
283,B08SBTSVJM,Men's Regular Fit T-Shirt (Pack of 3),fanideaz,0,0,0,949,3.7,152,73,,1,152
284,B09KBZJPKZ,Smoke Grey Mens and Boys Solid Supima Cotton Full Sleeve T-Shirts,The Souled Store,1,0,0,839,0,0,44,,1,"₹839
₹1,499 Save ₹660 (44%)"
285,B09DD57JGY,Official Loki: Variant Mens and Boys Graphic Printed Cotton T-Shirts Brown,The Souled Store,1,0,0,524,4.8,6,48,,1,6
286,B093BS9VZY,Drink and Forget Things Mens and Boys Graphic Printed Cotton T-Shirts Grey,The Souled Store,1,0,0,629,4.5,2,30,,1,2
287,B09KJB58N7,Polo Collar 100% Cotton Yarn Dyed Striped T-Shirt for Men,AMERICAN CREW,1,0,0,999,0,0,60,,1,"₹999
₹2,499 Save ₹1,500 (60%)"
288,B08C8XB4VP,Men's Tipping Collar Polo with Chest Embroidery,Celsius,1,0,0,745,0,0,17,,1,"₹745
₹895 Save ₹150 (17%)"
289,B091FKRYN7,Men's Polycotton Collar Neck Polo T-Shirt Combo Pack of 3,Wear Your Opinion,1,0,0,899,3.9,537,70,,1,537
290,B08VWQCK75,Eco-Friendly Men's 50/50 Blend Double Coloured Polo T-Shirt,ECOLINE Clothing,1,0,0,609,4.1,15,21,,1,15
291,B08662JK2H,Men's Slim Fit Polo T-Shirt,Alan Jones Clothing,1,0,0,419,3.9,865,58,,0,865
292,B073X4VJNH,Men's Regular Fit T-Shirt,Amazon Brand - Symbol,0,0,0,319,3.7,152,64,,0,152
293,B07RS3VG9R,Men's Solid Regular Fit T-Shirt,EYEBOGLER,0,0,0,430,3.7,"2,932",67,,0,"2,932"
294,B07FLT438N,Men's Regular Fit T-Shirt (Pack of 4),London Hills,0,0,0,899,3.9,"3,869",83,,1,"3,869"
295,B08KS3KCKL,Men's Cotton Half Sleeve Printed Polo T-Shirt,Veirdo,0,0,0,399,4.1,552,67,,0,552
296,B00RJV5WSI,Men's Polo,U.S. POLO ASSN.,0,0,0,679,4.0,225,51,,1,225
297,B09LR6DV5P,Men Black Cotton Blend Solid T-Shirt 221054323-1,Monte Carlo,0,0,0,708,0,0,25,,1,"₹708
₹945 Save ₹237 (25%)"
298,B093SQLCV8,0017 T-Shirts for Men's,THE BLAZZE,0,0,0,399,3.3,633,64,,1,633
299,B09NRYNSYR,Men's Slim fit Round Neck T-Shirt | Men's Casual t-Shirt Round-Neck Full Sleeve Fully Cotton Blend T-Shirts- 1PC,TRUE BASKET,0,0,0,299,4.6,5,57,,1,5
300,B08PBY1CYP,Men's Solid Henley Neck Slim Fit Cotton T-Shirt,Urbano Fashion,0,0,0,375,3.8,213,66,,0,213
301,B099F9SXWW,Men's Slim T-Shirt,Jack & Jones,0,0,0,217,3.0,2,78,,0,2
302,B0846CZ6ZY,Men's Regular fit T-Shirt,U.S. POLO ASSN.,0,0,0,760,3.6,33,60,,1,33
303,B09N6KG7CY,Stylish Men's Regular Fit Collared Full Sleeve Polo T-Shirt Real Matty Cotton Blend with Pocket for Winter (Multicolors),SMAN,0,0,0,499,3.4,9,67,,1,9
304,B098TZ4DJQ,Mens Cotton Half Sleeve Branded Polo T Shirt with Collar,fanideaz,0,0,0,499,3.9,115,80,,1,115
305,B08V5KW88J,Men's Regular T-Shirt,Puma,0,0,0,519,3.0,2,60,,1,2
306,B08KTYQH36,Men Polo,Allen Solly,0,0,0,698,4.3,338,42,,1,338
307,B08TMRTKNB,Men's Cotton Regular Fit Printed Sleeveless T-Shirt (TSH_G4AMERICN_P_Multicolored_P),Veirdo,0,0,0,279,4.1,172,72,,0,172
308,B095Y9243V,Supima: Burgundy Mens and Boys Solid Cotton T-Shirts,The Souled Store,1,0,0,734,3.3,6,51,,1,6
309,B09KBZ6JSS,Official Black Panther: T'Challa's Necklace Mens and Boys Graphic Printed Cotton T-Shirts Black,The Souled Store,1,0,0,629,5.0,1,30,,1,1
310,B09BZW2V86,Men's Solid Regular Fit Polo,PRINTOCTOPUS,1,0,0,798,1.0,1,50,,1,1
311,B09S9PV1VY,Men's Color Block Color T-Shirts,ADRO,1,0,0,399,0,0,73,,1,"₹399
₹1,499 Save ₹1,100 (73%)"
312,B09BFV47WM,Men's Regular T-Shirt,Levi's,0,0,0,669,4.3,14,44,,1,14
313,B07QD6T7CV,Men's Slim Fit T-Shirt,Maniac,0,0,0,350,4.0,262,67,,0,262
314,B0867BTLFW,Men's Solid Regular Fit V-Neck Cotton T-Shirt,Urbano Plus,0,0,0,449,4.0,281,59,,0,281
315,B09HS586DT,Men's All Over Printed Round Neck Fullsleeve Black & Grey Cotton Tshirt,Jump Cuts,0,0,0,299,0,0,80,,0,"₹299
₹1,519 Save ₹1,220 (80%)"
316,B07FLHZ3SM,Men's Plain Regular Fit Polo,Parx,0,0,0,649,4.0,69,41,,1,69
317,B093LM9DNJ,Men's Regular T-Shirt,Amazon Brand - Symbol,0,0,0,535,4.5,4,40,,1,4
318,B07J1L1C51,Men's Regular fit T-Shirt,Puma,0,0,0,607,4.1,74,62,,1,74
319,B07MFVD3LJ,Winter Wear Cotton Plain Full Sleeve Turtle Neck T Shirt for Men,CHKOKKO,0,0,0,645,4.0,"3,306",77,,1,"3,306"
320,B07PNPKLHT,Men's Slim Fit T-Shirt,Maniac,0,0,0,294,3.7,514,77,,0,514
321,B09M464H9B,Printed Cotton T-Shirt for Men Combo Pack of 2,Boodbuck,0,0,0,499,3.1,17,75,,1,17
322,B07WVBPTFS,Men's Regular Fit T-Shirt,Fashion Gallery,0,0,0,299,3.5,376,80,,1,376
323,B08THSSHQD,Men's Cotton Regular Fit Color Blocked Sleeveless T-Shirt,Veirdo,0,0,0,249,4.2,611,75,,0,611
324,B093XTSKZV,Mens Cotton Half Sleeve Striped Polo T Shirt with Collar,Lyned,0,0,0,599,3.6,607,76,,1,607
325,B095CMZH8N,Men's Slim Fit Polo Collar Half Sleeve Solid Cotton White T-Shirt (PRISTO-White SF,Classic Polo,0,0,0,629,3.7,22,10,,1,22
326,B099FC1D9C,Men's Slim T-Shirt,Jack & Jones,0,0,0,254,3.7,8,77,,0,8
327,B09C6734GX,Men's Regular T-Shirt,Max,0,0,0,749,4.0,233,17,,1,233
328,B09G72R3LF,Tokyo Revengers Anime Tokyo Manji T Shirt,ComicSense.xyz,0,0,0,899,4.3,135,31,,0,135
329,B0819ZM8SV,Men's Printed Regular fit T-Shirt,U.S. POLO ASSN.,0,0,0,691,4.0,482,11,,1,482
330,B07F8SNLD7,Men's Regular T-Shirt,Amazon Brand - Symbol,0,0,0,449,4.1,532,62,,0,532
331,B08TV3JB4K,Avengers T-Shirt for Men Half Sleave Solid White Graphic Printed Funny Typography Casual Round Neck. Sports & Gym wear Stylish Cotton Branded Tshirt for Attitude Boys,Tocayo,0,0,0,229,3.7,102,77,,1,102
332,B082Y5QGC7,Men's Regular fit T-Shirt,Max,0,0,0,209,3.0,2,65,,0,2
333,B08YYHTJKY,Mens Polo Neck Half Sleeve Black Cotton T-Shirt,Classic Polo,0,0,0,629,4.2,26,10,,1,26
334,B07BFDQZFT,Men's Sport Jersey T-Shirt,Campus Sutra,0,0,0,474,4.0,"1,604",57,,0,"1,604"
335,B08V5KQ2Y2,Men's Regular T-Shirt,Puma,0,0,0,835,3.8,23,58,,1,23
336,B08Z78PMJY,Men's Round Neck Full Sleeves Regular Dry Fit Gym Sports T-Shirt,CHKOKKO,0,0,0,332,3.9,849,80,,0,849
337,B083Y88QRW,Men's Slim Fit T-Shirts,Spykar,0,0,0,469,2.1,2,61,,0,2
338,B09PLHGS8P,Men's Cotton Solid Full Sleeve Turtle Neck T Shirt,UZARUS,0,0,0,649,4.7,5,70,,1,5
339,B01N47QLSQ,Men's Regular Fit T Shirt,Veirdo,0,0,0,249,4.1,"1,877",75,,0,"1,877"
340,B08VNNDD7X,Men's Slim T-Shirt,U.S. POLO ASSN.,0,0,0,899,4.0,23,55,,1,23
341,B07Y6LKMKV,Men's Regular Fit T Shirt (Pack of 2),AWG ALL WEATHER GEAR,0,0,0,349,3.5,"1,374",78,,0,"1,374"
342,B08NBTKK9V,Men's T-Shirt,EYEBOGLER,0,0,0,299,3.6,371,77,,0,371
343,B096ZYNLV2,Men's Regular T-Shirt,Levi's,0,0,0,668,3.9,14,55,,1,14
344,B091CQGPNM,Tan Stripes Mens and Boys Solid Cotton T-Shirts Multi-Colored,The Souled Store,1,0,0,629,5.0,1,37,,1,1
345,B075JFQ42T,Men's Regular Fit T-Shirt,AMERICAN CREW,1,0,0,612,3.9,"13,307",69,,1,"13,307"
346,B098L8GLPL,Garfield: Hiding from People Mens and Boys Graphic Printed Cotton T-Shirts Brown,The Souled Store,1,0,0,629,3.7,4,30,,1,4
347,B083C2Z97V,Men's Regular fit T-Shirt,Van Heusen Athleisure,1,0,0,719,4.1,840,0,,1,840
348,B07L6XTQWY,Men's Solid Slim fit T-Shirt,U.S. POLO ASSN.,1,0,0,"1,019",3.9,92,46,,1,92
349,B08YYHQ66D,Mens Polo Neck Half Sleeve Truquiose Cotton T-Shirt,Classic Polo,1,0,0,629,3.6,17,10,,1,17
350,B0912L7WQT,Men's Polycotton Collar Neck Polo T-Shirt Combo Pack of 3,Wear Your Opinion,1,0,0,899,3.9,537,70,,1,537
351,B07MZJTG62,Men's Regular Polo Shirt,Amazon Brand - Symbol,1,0,0,309,3.9,"12,393",61,,0,"12,393"
352,B08NBTKK9V,Men's T-Shirt,EYEBOGLER,0,0,0,299,3.6,371,77,,0,371
353,B096ZYNLV2,Men's Regular T-Shirt,Levi's,0,0,0,668,3.9,14,55,,1,14
354,B08QDJFXML,Printed Men's Fullsleeve Hooded Neck White Cottton Tshirt,Maniac,0,0,0,390,3.9,24,78,,0,24
355,B082XV7W83,Full Sleeves Polo Collar T-Shirt for Men,AMERICAN CREW,0,0,0,802,4.1,241,68,,1,241
356,B08HLPHB71,Men's Regular Sports T-Shirt,Amazon Brand - Symactive,0,0,0,309,4.1,747,66,,0,747
357,B09GLWFNSH,Mens Regular Fit Fullsleeve Printed Casual Tshirt,BULLMER,0,0,0,458,3.9,24,77,,0,24
358,B00RGVL7XA,Men's Polo Collar Full Sleeves Striped T-Shirt,AMERICAN CREW,0,0,0,802,4.0,944,60,,1,944
359,B08QNGZ1D2,Men's Solid Mandarin Collar Regular Fit Cotton T-Shirt,Urbano Plus,0,0,0,499,3.8,459,58,,1,459
360,B07PCMTJBK,Men's Polyester Round Neck T-Shirts - Pack of 3,AWG ALL WEATHER GEAR,0,0,0,429,3.6,"3,510",82,,0,"3,510"
361,B07HJDTCFD,Men's Solid Regular Fit Polo,Van Heusen,0,0,0,579,4.0,"20,999",36,,1,"20,999"
362,B07QX83TM6,Men's Polycotton Stylist Slim Fit Collar Neck Polo T-Shirt,Wear Your Opinion,0,0,0,379,3.9,"3,953",75,,0,"3,953"
363,B0793NHDYQ,Men's Regular fit T-Shirt,U.S. POLO ASSN.,0,0,0,499,3.8,"6,700",0,,1,"6,700"
364,B01LERJ1BG,Men's Regular Fit T-Shirt,AMERICAN CREW,0,0,0,802,3.8,710,46,,1,710
365,B09797LF7R,Round Neck Regular Fit Cotton T-Shirt,Amazon Brand - Inkast Denim Co.,0,0,0,309,4.5,2,76,,0,2
366,B0892TL8C1,Men's Regular Fit T-Shirt (Pack of 3),BULLMER,0,0,0,589,3.8,385,61,,1,385
367,B092PRGPGR,Men's Printed Halfsleeve Round Neck Olive Cotton Tshirt,Maniac,0,0,0,294,3.7,57,78,,0,57
368,B096KLNZPQ,Men's Slim T-Shirt,Cherokee by Unlimited,1,0,0,479,2.0,2,31,,0,2
369,B09BBDN2K6,Official Iron Man: Arc Reactor Logo Mens and Boys Graphic Printed Cotton Full Sleeve T-Shirts Multi-Colored,The Souled Store,1,0,0,734,4.2,84,43,,1,84
370,B08VVTX1BY,Eco-Friendly Men's 50/50 Blend Double Coloured Polo T-Shirt,ECOLINE Clothing,1,0,0,609,4.1,15,21,,1,15
371,B09FQ866HC,Mushroom Mens and Boys Solid Supima Cotton T-Shirts,The Souled Store,1,0,0,734,0,0,18,,1,"₹734
₹899 Save ₹165 (18%)"
372,B0793FCY3T,Men's Regular fit T-Shirt,U.S. POLO ASSN.,0,0,0,398,4.0,"2,201",20,,0,"2,201"
373,B08ZGQLPTL,Men T-Shirt,EASYBUY,0,0,0,134,3.9,7,55,,0,7
374,B09FLMS5VR,Mushroom Mens and Boys Solid Cotton Supima Drop Cut T-Shirts,The Souled Store,1,0,0,839,0,0,44,,1,"₹839
₹1,499 Save ₹660 (44%)"
375,B0861ZDNDL,Men's Polycotton Stylist Slim Fit Collar Neck Polo T-Shirt Combo Pack of 2,Wear Your Opinion,1,0,0,699,3.8,"2,811",65,,1,"2,811"
376,B094NTG6N8,Supima Cotton: Sage Green Mens and Boys Solid T-Shirts,The Souled Store,1,0,0,734,4.1,11,51,,1,11
377,B09DD56Y2P,Official Rick and Morty: Pounders Mens and Boys Graphic Printed Cotton T-Shirts Green,The Souled Store,1,0,0,629,0,0,37,,1,"₹629
₹999 Save ₹370 (37%)"
