,asin,title,brand,Sponsored,Best Seller,Amazon's Choice,Price,Rating,NoofRatings,Discount,Delivery,Prime Delivery,base
116,B09NR9HTJK,"Shiv baba Enterprises Type C Cable Nylon Braided USB C QC 3.0 Fast Charging Short Power Bank Cable for Samsung Galaxy S10e/S10+/S10/S9/S9+/Note 9/S8/Note 8, LG G7 G5 G6, Moto G6 G7 (0.25M)",Shiv,0,0,0,145,0,0,85,"Thursday, February 17",0,"₹145 (₹24.17/count)
₹999 Save ₹854 (85%)"
117,B09BZR9N7R,"SaiRetail.Com USB 3.1 Type C to Type C Male to Male Cable 1.96ft/60cm, Poyiccot USB C to USB C Sync & Charging Cable Super Speed 10Gbps for MacBook (Pro), Nintendo Switch (USB C M/M)",SaiRetail.Com,0,0,0,180,0,0,76,"Wednesday, February 16",1,"₹180
₹750 Save ₹570 (76%)"
118,B08KSH6JTB,3 in 1 Fast Charging 2.1 amp Nylon Braided Magnetic USB Charging Cable with 3 Magnetic Pin Heads for All Type of Android Mobiles and Devices (All in One Cabel),3,0,0,0,149,2.9,158,70,"Thursday, February 17",0,3
119,B08CDKQ8T6,Portronics Konnect L POR-1079 1.2M Fast Charging 3A Micro USB Cable with Charge & Sync Function (Grey),Portronics,0,0,0,219,4.4,"3,153",45,"Thursday, February 17",0,"3,153"
120,B07D7S9SMS,"AmazonBasics Double Braided Nylon USB Type-C to Type-C 3.1 Gen 1 Cable, 3 Feet (0.9 Meters) - Silver",AmazonBasics,1,0,0,"1,049",4.1,214,25,"Wednesday, February 16",1,214
121,B07PLYW6R7,"UGREEN USB C to USB C Cable Right Angle 90 Degree Type C 60W PD Fast Charging Compatible for Google Pixel 3 2 XL, Samsung Galaxy Note 10 S9 S8 S10, MacBook Air, iPad Pro 2018, Nintendo Switch (3FT)",UGREEN,1,0,0,899,4.6,"3,475",70,"Wednesday, February 16",1,"3,475"
122,B07SMFD1QR,Cablecc USB 3.1 Type C USB-C to DC 4.5x3.0mm Adapter PD Emulator Trigger 90 Degree Angled,Cablecc,0,0,0,788,4.2,55,34,"Thursday, February 17",1,55
123,B08CKFD6TS,"SeCro USB C to Micro B 3.0 Cable (5 Gbps), USB 3.1 External Hard Drive Cable, Compatible with USB C Port Laptops, Galaxy S5 Note 3, etc, 1Mtr /Black",SeCro,0,0,0,575,3.7,49,17,"Thursday, February 17",1,49
124,B09MYQB8JS,"RSC POWER+ Compatible with OnePlus 9 Pro 8T Fast Charging Cable 6.5A Warp Charge USB C to USB C Cable, 1 mtr Super Fast Charging Cord Compatible with Pro 13/16 Air 4 Note 20 S20 FE 5G",RSC,0,0,0,299,0,0,70,"Thursday, February 17",1,"₹299
₹999 Save ₹700 (70%)"
125,B09N7R2XNQ,"Wayona Type C Fast Charging Cable 3A for Oneplus, Samsung M52 5G, M32, M51, M31, A52s, F41, F62, S10/S20 Series, Mi 10/9 Series, K20, Realme Narzo 50A/30, Tecno POVA 2, Oppo A74/54, iQoo Z5/Z3/7 (1M Black)",Wayona,0,0,0,199,4.1,7,75,"Monday, February 14",1,7
126,B0858Y3X49,"Baseus Cafule Charging Cable | 100W Fast Charging | Wide Compatibility | USB for Type-C Cable | 20V 5A, 2m (Red,Black)",Baseus,0,0,0,975,4.3,146,25,"Wednesday, February 16",1,146
127,B084MZYTGR,"Belkin Apple Certified Lightning to Type C Cable, Fast Charging for iPhone, iPad, Air Pods, 3.3 feet (1 Meters) – Black",Belkin,0,0,0,"1,200",4.5,"1,745",40,"Wednesday, February 16",0,"1,745"
128,B09QC4JBNH,"PRIME USB-C to Lightning Cable - 1m (for iPhone, iPad, MacBook, AirPods) 1 m Lightning Cable (Compatible with ioS, White)",PRIME,0,0,0,199,0,0,80,"Wednesday, February 16",0,"₹199
₹999 Save ₹800 (80%)"
129,B08GJZ264B,"Dyazo 2.8 A Nylon Braided Fast Charging Type C USB Cable/USB C/Fast Charging Cord/Type C Wire Supports Data & SYNC Compatible with Samsung Galaxy S10 E S9 S8 Plus Note 8 (1 Meter), Black",Dyazo,0,0,0,299,4.2,961,80,"Wednesday, February 16",1,961
130,B08V52VB5L,"boAt Micro USB 550 Stress Resistant, Tangle-Free, Sturdy Cable with 3A Fast Charging & 480mbps Data Transmission, 10000+ Bends Lifespan and Extended 1.5m Length(Mercurial Black)",boAt,1,0,0,388,4.2,"1,184",61,"Monday, February 14",1,"1,184"
131,B08CF3D7QR,Portronics Konnect L POR-1081 Fast Charging 3A Type-C Cable 1.2Meter with Charge & Sync Function for All Type-C Devices (Grey),Portronics,1,0,1,168,4.4,"5,320",58,"Tuesday, February 15",1,"5,320"
132,B01ASWV6OI,"CableCreation USB C to USB A Cable [3 Pack],4ft USB Type C to USB 2.0 A Fast Charge Cord with 56K Ohm Resistance, Compatible with Galaxy S8 S9 S10,Pixel 3XL 2XL, OnePlus 6 6T, etc 1.2M/Black",CableCreation,1,0,0,669,4.5,124,23,"Thursday, February 17",1,124
133,B08557ZVLV,"Belkin Type C to USB-A 2.0 Male Cable 3.3 feet (1 meter) - Black, USB-IF Certified, Supports Fast Charging",Belkin,1,0,0,449,4.4,"1,086",31,"Monday, February 14",1,"1,086"
134,B09CMPRKKJ,"Ambrane Apple MFI Certified Lightning to Type C Cable, Fast Charging for iPhone, Airpods, iPad & other Apple Devices (1 meter, AMC-10 Black)",Ambrane,0,0,0,"1,299",4.2,20,35,"Monday, February 14",1,20
135,B09317VDLZ,Ant Enterprize® COMBO OFFER LED USB C Type Charging Cable 1 M (white with colour changing light) and 4 Piece Cable Protector Supports Fast Charging With Adapter Output 3V & Above,Ant,0,0,0,229,4.1,40,77,"Sunday, February 20",0,40
136,B09QHV9PRL,"Lowfe Latest Compatible with OnePlus 9 Pro 8T Fast Charging Cable 6.5A Warp Charge USB C to USB C Cable, 1 mtr Super Fast Charging Cord Compatible with Pro 13/16 Air 4 Note 20 S20 FE 5G",Lowfe,0,0,0,249,5.0,2,75,"Wednesday, February 16",1,2
137,B09J8WP5LX,CROSSVOLT USB C to USB C Cable 1 mtr Type-C Charger Warp Charge Dash Charge USB C Cable 65W 6.5A USB-C Long Super Fast Charging Cord Compatible with Pro Air 4 OnePlus 9 8T 8 Pro 7T,CROSSVOLT,0,0,0,249,3.7,4,75,"Thursday, February 17",1,4
138,B09PNP4FC4,"NEWZO Lightning Cable Type C to Lightning 20W Fast Charging Nylon Braided USB C PD Lightning Data Cable for iPhone 12, 12 Pro, 11, 11 Pro Max iPhone 12 Mini",NEWZO,0,0,0,550,0,0,45,"Wednesday, February 16",0,"₹550
₹999 Save ₹449 (45%)"
139,B07PLYW6R7,"UGREEN USB C to USB C Cable Right Angle 90 Degree Type C 60W PD Fast Charging Compatible for Google Pixel 3 2 XL, Samsung Galaxy Note 10 S9 S8 S10, MacBook Air, iPad Pro 2018, Nintendo Switch (3FT)",UGREEN,0,0,0,899,4.6,"3,475",70,"Wednesday, February 16",1,"3,475"
140,B08P8P7PY2,"CABLESETC USB Type C 3.2 Gen 2 Extension Cable 6 feet, CABLESETC Fast Charging Superspeed 10Gbps Data Transfer Power Delivery PD 60W 4K 60Hz Male to Female Cable",CABLESETC,0,0,0,"1,199",4.0,26,52,"Wednesday, February 16",1,26
141,B08DP1GRBM,A K R Type-c Data Cable Type-c Charging Cable Type-c USB Cable Data Cable Connector Fast Charging Sport Color White,A,0,0,0,155,4.2,4,69,"Sunday, February 20",1,4
142,B08H5K2CHK,"Synqe Type C Fast Charging 6ft / 2M USB Cable 3A Data Cord Compatible with Samsung M40 M21 M30 M31 Galaxy S20 Plus Note A50 Realme X Narzo Vivo V19 Oppo Reno (2M, Black)",Synqe,1,0,0,379,4.3,"1,888",66,"Tuesday, February 15",1,"1,888"
143,B01LYYT3N3,"CableCreation [2-Pack Short (0.5ft) Right Angle Micro USB 2.0 Braided Cable, 90 Degree Vertical Right Short USB 2.0 A Male to Micro USB Male with Aluminium Case,15cm, Space Gray",CableCreation,1,0,0,469,4.2,368,64,"Thursday, February 17",1,368
144,B0722LN3HD,Allocacoc USB C Cable 3 in 1 Fast Charging White,Allocacoc,0,0,0,149,3.0,10,83,"Saturday, February 19",0,10
145,B08KQBHRY7,BLENDIA Set of 1 2 in 1 Type C to USB Power Bank Data Adapter Sync and Charging USB C Type Cable 0.2 m USB Type C Cable,BLENDIA,0,0,0,149,3.5,2,50,"Thursday, February 17",0,2
146,B08MZ21DBH,iEDS Right Angle USB 3.1 Type C to USB C Female Extension Cable 100W 10Gbps 4K Video (1 M),iEDS,0,0,0,"1,099",4.1,15,45,"Wednesday, February 16",1,15
147,B09QL31WV6,"ONCRO® Type C Cable, OnePlus 8T Charging Cable 6.5A Warp Charge USB C to USB C Cable Male, Replacement 1m 65W Fast Charger Cord",ONCRO®,0,0,0,355,0,0,61,"Wednesday, February 16",1,"₹355
₹899 Save ₹544 (61%)"
148,B09LYL9NC2,"rts 3 Meter USB 3.0 Male A to Female A Extension Cable Speed 5GBps for Laptop, Television Computer Printer, Scanner, Camera, Smartphone USB Flash Pen Drive, Card Reader, Hard Drive, Keyboard,Mouse",rts,0,0,0,499,4.2,8,90,"Wednesday, February 16",1,8
149,B07232M876,"AmazonBasics Micro USB Charging Cable for Android Phones with Gold Plated Connectors (6 Feet, Black)",AmazonBasics,0,0,0,269,4.1,"64,759",32,"Monday, February 14",1,"64,759"
150,B098XLDMRS,INICIO 100W USB-C to Type C Power Delivery Cable Extra Long 2m Fast Charging Compatible For MacBook Pro Air iPad Pro XPS Galaxy S21 S20 Note 20 Spectre Envy Zenbook,INICIO,0,0,0,649,5.0,2,50,"Wednesday, February 16",1,2
151,B09B1ZKX56,"FOX MICRO Charging Cable Compatible for PS5 Controller/Xbox Series X/Xbox Series S Controller Replacement USB C Type Cord-(1 Meter),(Black)",FOX,0,0,0,399,1.0,1,50,"Wednesday, February 16",1,1
152,B08DTFZ6CZ,"CableCreation USB Type C Cable 3A Fast Charging, USB-A to USB-C Cable, Compatible with MacBook (Pro), Galaxy S20/S10/S9/S9+, Pixel 3 XL, GoPro Hero 8 7,6.6ft /Black",CableCreation,1,0,0,799,4.5,85,50,"Thursday, February 17",1,85
153,B07232M876,"AmazonBasics Micro USB Charging Cable for Android Phones with Gold Plated Connectors (6 Feet, Black)",AmazonBasics,1,0,0,269,4.1,"64,759",32,"Monday, February 14",1,"64,759"
154,B013G4CK68,"CableCreation USB C to USB 3.0 B Cable, 4ft USB 3.1 Type C to USB 3.0 Type B Cable, Compatible with MacBook Pro, External Hard Drive, Docking Station, 1.2M, Black",CableCreation,1,0,0,559,4.5,"2,014",53,"Thursday, February 17",1,"2,014"
155,B01GGKYN0A,AmazonBasics USB Type-C to USB-A 2.0 Male Cable - 6 Feet (1.8 Meters) - Black,AmazonBasics,1,0,0,449,4.3,"55,035",44,"Wednesday, February 16",1,"55,035"
156,B07PFJ5VQD,AGARO USBA to Micro +Type C Nylon Braided 1.2M Cable,AGARO,0,0,0,269,3.9,"1,112",55,"Monday, February 14",1,"1,112"
157,B08RB56L9C,iEDS USB 3.1 Gen 2 Type C PD 20 Gbps 100W 5A 4K Video USB-C to USB-C Cable with E-Marker Chip 2M Grey,iEDS,0,0,0,"1,399",4.3,37,30,"Wednesday, February 16",1,37
158,B07NCYMGJ7,"Wayona Nylon Braided Charging Cable (5V/4A) and Data Sync Fast Charge Type C Cable for OnePlus 7, 6T,6,5,5T, 3T, 3 (Nylon Dash 3FT, Red)",Wayona,0,0,0,379,4.0,"5,538",62,"Monday, February 14",1,"5,538"
159,B096MJRWMX,"FEDUS Short USB C Cable, Power Bank Charging Cable Data Sync, USB A to USB Type C, 9 Inch USB Type C Cable Fast Charge Cord Sync Compatible with Samsung, HTC, Motorola, Nokia, Android",FEDUS,0,0,0,199,0,0,60,"Wednesday, February 16",1,"₹199
₹499 Save ₹300 (60%)"
160,B08BS1R9HF,"Jetloop USB-C to USB-C 2.0, Fast Charging 60W Data cable (1 Meter, Black, Nylon Braided) | For USB C Laptops, iPads, Smartphones, Charger Adapters| Compatible with Nexus 6p, Google Pixel 2, Pixel 3, Pixel 4, Pixel 5, Samsung Galaxy S20 Ultra, S20+ Note10 Plus",Jetloop,0,0,0,279,3.9,17,44,"Friday, February 18",0,17
161,B09GNY1749,"PiBOX India , USB Type C Cable 1 meter Double Nylon Braided , Aluminium shell head Fast Charging Cable 3.3 ft USB A to C Nylon Braided 1 M Long Cable Compatible with All Type C Smartphones (Rose Gold)",PiBOX,0,0,0,159,3.8,84,77,"Tuesday, February 15",0,84
162,B07PMQBHNK,C10C3 Dura Sync USB-C to USB-C 3.2 Gen 1 Cable(1m) - White,C10C3,0,0,0,899,4.6,45,50,"Monday, February 14",1,C10C3
163,B07N2QMS1R,"ESR USB-C to Lightning Cable, (2 meter, MFi-Certified), PD Fast Charging Cable for iPhone 13/13 mini/13 Pro/13 Pro Max/12/12 mini/12 Pro/12 Pro Max/11/XR/XS Max/XS/X/8, Braided Nylon, Silver",ESR,0,0,0,"1,499",4.4,"12,814",12,"Thursday, February 17",1,"12,814"
164,B08H5L8V1L,"Synqe 2 m / 6ft USB Type C Fast Charging Cord Data Cable Compatible with Samsung Galaxy M51, Galaxy M31S, S10e S10 S9 S20 Plus, Note10 9 8, M40 A50 A70, Redmi Note 9, Moto G7 , POCO F1 (Grey)",Synqe,1,0,0,379,4.3,"1,888",66,"Tuesday, February 15",1,"1,888"
165,B08DTTCGXB,"CableCreation Short USB C Cable, 6 inch USB C to USB Cable 3A Fast Charge, Compatible with MacBook (Pro), Galaxy S20/S10/S9/S9+, Pixel 3 XL, GoPro Hero 8 7, 15cm /0.5ft Black",CableCreation,1,0,0,499,4.5,85,71,"Thursday, February 17",1,85
166,B08PG4KTP4,"ICALL Presenting USB-C to USB-C Cable, USB Type-C to USB Type-C 2.0 Cable, 3.3 feet (1 Meter) Multicolor",ICALL,0,0,0,248,5.0,1,38,"Wednesday, February 16",1,1
167,B09FHZJVJB,"GROFL® Type C Cable, OnePlus 8T/9/9pro Charging Cable 6.5A Warp Charge USB C to USB C Cable Male, Replacement 1m 65W Fast Charger Cable(65W C Cable)",GROFL®,0,0,0,249,3.5,17,64,"Wednesday, February 16",1,17
168,B077GRXXYV,CableCreation USB C to Mini USB Cable 3.3FT USB Mini B Charging Cable for GoPro Hero 3+ PS3 Controller MP3 Player Digital Camera other USB Mini B Devices Black,CableCreation,0,0,0,699,4.5,295,65,"Thursday, February 17",1,295
169,B07CM6PLB3,"Wayona USB Type C Cable, 2.4A Metal Spring USB A to USB C Fast Charging Cable for Samsung S8 / S8+ /One Plus/Google Pixel/LG/Le Eco (Pack of 2, Black)",Wayona,0,0,0,399,5.0,1,80,"Thursday, February 17",0,1
170,B09DDGC4NS,Lightning Cables Electronics USB Type C Charging Cable [CTL1M],Lightning,0,0,0,159,1.0,1,80,"Friday, February 18",0,1
171,B07X4JLK9X,INICIO 60W PD USB-C to Type C Power Delivery Cable Compatible for MacBook Pro Air Galaxy Note 20 S21 S20 Ultra Plus Pixel P20 Mate Pro Redmi [ 1.2m Black],INICIO,0,0,0,349,4.4,12,50,"Wednesday, February 16",1,12
172,B09NPTQDGF,Sachdeal Type-C to USB Type-C Cable For Samsung Galaxy A71 5G Original Type-C To Type C USB Data & Charging Cable | PD Charger Cable | Dash WRAP Charging Cable | USB 3.1 type C Fast Charging Cable 60W 3A High Speed Rapid Fast Turbo QC 3.0 Charging Cable (3.1 Ampere),Sachdeal,0,0,0,399,0,0,50,"Wednesday, February 16",1,"₹399
₹799 Save ₹400 (50%)"
173,B09HXLSMKX,"Sortd Fast Charging Cable USB Type C to Type C, 100W 5A,Strong Braided, Tangle Free Adapter Cable with E-Marker Smart Chip, 3ft, Grey, for USB C Gaming Laptops, Mobiles, Earphones and more. CE, FCC, ROHS and BIS Certified",Sortd,0,0,0,695,5.0,10,42,"Friday, February 18",1,10
174,B09M9SWJK4,Portronics Konnect J5 20W PD 4-in-1 Mobile Charging Cable (USB-A + Type-C to Type-C + 8 Pin USB Cable),Portronics,1,0,0,634,3.8,13,51,"Monday, February 14",1,13
175,B07YB9R3W2,Tarkan 6 ft Long Rugged Dash & Warp Charging Type C Cable for All USB-C Android Mobile Phones (Red) Supports 5V 6A & 5V 4A (20W & 30W),Tarkan,1,0,0,449,4.0,"2,377",50,"Friday, February 18",1,"2,377"
176,B09MNK7NM1,UltraProlink UL1065 Zync 3A/15W USB-A to Type C Male Fast Charging & Data Transfer 480mbps Nylon Braided Durable Tough zync Alloy Metal Cable -1.5m/4.92ft Long,UltraProlink,1,0,0,499,3.7,17,17,"Monday, February 14",1,17
177,B09NKZGKS8,La' Forte Data Cable USB A to Type C Cable Fast Charging (Black 1 Mtr),La',1,0,0,179,0,0,70,"Wednesday, February 16",1,"₹179
₹599 Save ₹420 (70%)"
178,B08WKH3BNF,"ONCRO� Type C cable, OnePlus 8T Charging Cable 6.5A Warp Charge USB C to USB C Cable male, Replacement 1m 65W Fast charger Cord",ONCRO�,0,0,0,365,3.7,745,59,"Wednesday, February 16",1,745
179,B083GMCJSQ,Dyazo 4 ft / 1.2 m 2 in 1 Cable [ Micro USB & Type C ] Nylon Braided Fast Charging with Flexi Head Technology Compatible with All Type c & Micro USB Phones,Dyazo,0,0,0,529,4.5,187,71,"Tuesday, February 15",1,187
180,B09K6BRYXY,"rts (2-Pack) Type C USB C to USB Female Adapter, USB-C to USB 3.0 Adapter, USB Type-C to USB, Thunderbolt 3 to USB Female OTG Adapter OTG for Compatible with Macbook, Laptops, Tablets And Smartphones, USB Flash Disk, USB Cable, Keyboard, Mouse, Printer USB Hub, etc (Space Gray)",rts,0,0,0,499,5.0,1,90,"Wednesday, February 16",1,1
181,B06Y2HG7JB,"Belkin USB-IF Certified 2.0 USB-A to USB Type C (USB-C) Charge Cable, 4 Feet / 1.2 Meters",Belkin,0,0,0,497,4.5,322,62,"Friday, February 18",1,322
182,B08334RTFV,Mi Braided USB Type-C Cable (Black),Mi,0,0,0,349,4.4,"4,905",13,"Monday, February 14",1,"4,905"
183,B091YWCGGC,"Fast Type-C USB Cable For Xiaomi Redmi K20,Xiaomi Redmi K20 Pro,Xiaomi Redmi K30 USB Cable Original Like Type-C Cable | C-Type Charger Cable | Type C Rapid Quick Dash Fast Charging Cable | Type-C Data Sync Cable | Type C to USB-A Cable (3.1 Amp, 1 Meter/3.2 Feet, Black)",Fast,0,0,0,289,3.9,22,71,"Wednesday, February 16",1,22
184,B083PCFQNL,URBN Type-C USB 3 Amp Fast Charging Data and Sync Cable Extra Tough Quick Charge 18W Compatible (4 Feet) 1.2M - Black,URBN,0,0,0,199,3.9,"6,815",72,"Monday, February 14",1,"6,815"
185,B00WJSPB5A,"Belkin Type C to USB-A Super Speed 10Gbps Transfer Speed for MacBook, Chromebook Pixel, laptops, Hard Drives, Desktop Computer and More, 3A Power Output, Black",Belkin,0,0,0,"1,269",4.3,581,37,"Monday, February 14",1,581
186,B082LZGK39,"Ambrane Unbreakable 3A Fast Charging Braided Micro USB Cable for Android Devices – 1.5 Meter (RCM15, Black)",Ambrane,1,0,0,179,4.0,"21,363",40,"Monday, February 14",1,"21,363"
187,B08R69WBN7,"Pinnaclz Original Made in India Combo of 2 USB Type C Fast Charging Cable, USB C Data Cable for Data Transfer Perfect for Mi & Samsung Smart Phones White 1.2 Meter (Pack of 2)",Pinnaclz,1,0,0,149,4.1,"4,924",75,"Monday, February 14",1,"4,924"
188,B07D7S9SMS,"AmazonBasics Double Braided Nylon USB Type-C to Type-C 3.1 Gen 1 Cable, 3 Feet (0.9 Meters) - Silver",AmazonBasics,0,0,0,"1,049",4.1,214,25,"Wednesday, February 16",1,214
189,B09LHZJMQZ,[Pack of 2] AGNILLE USB Type-C Double Braided 3.1A Fast Charging & Data Transfer Cable for all C-Port Android Devices - (2m x 2)[Black],[Pack,0,0,0,299,4.1,7,70,"Wednesday, February 16",1,7
190,B097F39P82,eLzzi USB C to Lightning Fast Charger Cable Compatible with iPhone 12/12 Mini/12 PRO/Max/11/11PRO/XS/Max/XR/X/8/8Plus/AirPods (Pack of 2),eLzzi,0,0,0,299,3.5,2,80,"Wednesday, February 16",1,2
191,B09D7NY5F3,"PEATOP TYPE-C Cable, USB Type C, Nylon Braided (1.0 Meter, Golden)",PEATOP,0,0,0,179,3.9,30,78,"Tuesday, February 22",1,30
192,B086QR4VS9,"Kinsound USB Type-C to Lightning Cable, Apple MFi Certified Data Sync Original Cord Nylon Braided Fast Charging Cable for iPhone12/11/XS/XR/8/7, iPad, MacBook (4ft/1.2m)",Kinsound,0,0,0,699,4.1,37,83,"Wednesday, February 16",1,37
193,B09BNSYLD7,"PEATOP® Nylon Braided Multifunction Charging Cable for Android, iOS and Type C Devices, 3 in 1/Triple Charging Cable, 3.6A, (3 Feet)",PEATOP®,0,0,0,299,3.5,158,70,"Wednesday, February 16",1,158
194,B07D7RWPWF,"AmazonBasics Double Braided Nylon USB Type-C to Type-C 3.1 Gen 1 Cable, 6 Feet (1.8 Meters) - Dark Grey",AmazonBasics,0,0,0,"1,509",4.3,320,37,"Wednesday, February 16",1,320
195,B081M658W5,"MoArmouz USB-C to USB-C 100W Fast Charging 20V/5A Rugged Braided 6.6ft/2m E-Marker PD Cable for MacBook Pro 2021-2016, Air 2021-2018, iPad Pro 12.9/11/Air 4, Dell XPS 13/15, Samsung S21/Tab S7+/FE/S7",MoArmouz,0,0,0,"1,999",4.4,47,20,"Wednesday, February 16",1,47
196,B01M1KKJ7S,"CableCreation Short USB 3.0 Extension Cable, USB 3.0 A Male to Female Extension Cable USB 3.0 Extender Cord Compatible Oculus VR, Playstation, Xbox, Keyboard, Printer, Scanner Space Gray Aluminum 15CM",CableCreation,1,0,0,599,4.3,"1,528",52,"Thursday, February 17",1,"1,528"
197,B07D7RWPWF,"AmazonBasics Double Braided Nylon USB Type-C to Type-C 3.1 Gen 1 Cable, 6 Feet (1.8 Meters) - Dark Grey",AmazonBasics,1,0,0,"1,509",4.3,320,37,"Wednesday, February 16",1,320
198,B09MNKG5PX,UltraProlink UL1065 Zync 3A/15W USB-A to Type C Male Fast Charging & Data Transfer 480mbps Nylon Braided Durable Tough zync Alloy Metal Cable -1.5m/4.92ft Long,UltraProlink,1,0,0,499,3.7,17,17,"Monday, February 14",1,17
199,B083X3WLMP,"Maono UC201R-P3 Micro USB Fast Charging Cable, with High Speed Data Syncs for Android, 0.5m+1.5m+2m, Red, Pack of 1 with 3 Charging Cables",Maono,1,0,0,509,4.0,199,36,"Monday, February 14",1,199
200,B01A6FTE5K,"Anker PowerLine USB-C to USB 2.0 Cable (3ft) with 56k Ohm Pull-up Resistor for USB Type-C Devices Including the new MacBook, ChromeBook Pixel, Nexus 5X, Nexus 6P, Nokia N1 Tablet, OnePlus 2 and More",Anker,0,0,0,969,5.0,1,39,"Friday, February 18",1,1
201,B092ZCCJVK,UNIQUE KING NAME OF TRUST USB-C to Lightning Cable,UNIQUE,0,0,0,199,0,0,72,"Wednesday, February 16",0,"₹199
₹699 Save ₹500 (72%)"
202,B09JG4TZR2,ZOXOWA CA-01 USB Fast Charger Magnetic Charging Cable Adapter for Noise Colorfit Pro 2 only,ZOXOWA,0,0,0,109,0,0,78,"Wednesday, February 16",0,"₹109
₹499 Save ₹390 (78%)"
203,B08V4ZVDWN,"boAt Micro USB 550 Stress Resistant, Tangle-Free, Sturdy Cable with 3A Fast Charging & 480mbps Data Transmission, 10000+ Bends Lifespan and Extended 1.5m Length(Martian Red)",boAt,0,0,0,387,4.2,"1,184",61,"Monday, February 14",1,"1,184"
204,B089FJPN4D,Hottech 3 Mtr Long Rugged Dash & Warp Charging Type C Cable for All USB-C Android Mobile Phones,Hottech,0,0,0,450,5.0,2,65,"Wednesday, February 16",1,2
205,B0858VG2RP,"Baseus Cafule Data Cable | Fast Charge & Transfer | USB for Type-C | Tangle Free | Durable 3A, 0.5M (Red,Black)",Baseus,0,0,0,549,4.3,48,45,"Tuesday, February 15",1,48
206,B075FMPV3S,Amkette Charge Pro Extra Tough Fast Charging Flat Type C Cable - 1.5 Meter (Space Grey),Amkette,0,0,0,268,4.2,"1,122",55,"Monday, February 14",1,"1,122"
207,B088NRLMPV,"Anker New Nylon USB C to USB C Cable (6ft 60W, 2-Pack), USB 2.0 Type C Charging Cable for iPad Mini 6, iPad Pro 2020, iPad Air 4, MacBook Pro 2020, Samsung Galaxy S21, Switch, Pixel, LG (Black)",Anker,0,0,0,"1,599",4.7,"7,098",16,"Wednesday, February 16",1,"7,098"
208,B09HZM6MSZ,"Mcdodo 2 IN1 3 A 1m 60W SuperFast Output USB Type C Cable, Type C Fast Charging Cable With LED Indicator (Compatible with PD 3.0Q ALL IPHONE AND TYPE C DEVICE, Black)",Mcdodo,1,0,0,699,5.0,1,46,"Wednesday, February 16",0,1
209,B09N1NJ2S8,"I Kall IK M30 Metallic 3A USB Type-C to USB-A 2.0 Male Cable for Type C Phones, 1 Meter (3.3 Feet) -(Black)",I,1,0,0,299,5.0,2,50,"Wednesday, February 16",1,2
210,B09BVY69PQ,That Brand USB C to Lightning Cable – Nylon Braided Lightning Cable – Mfi Certified – 18W PD USB C Fast Charging Cable with Tie Organizer - Compatible with iPhone/iPad/Macbook (2 Metre),That,0,0,0,949,4.1,12,53,"Wednesday, February 16",1,12
211,B09MZ8JG9R,,,0,0,0,0,0,0,0,,0,
212,B0964ZQFLR,DMS 20W Quick Charging l PD Cable l USB C to USB C CAHRGING Cable for MacBook Air 2020/2018 Laptop l C to C l C2C l Phone C to Phone C Charging Cable l C Type Adapter Cable l PD Cable for PD Charger,DMS,0,0,0,299,3.0,2,63,"Thursday, February 17",1,2
213,B01LONPUM4,AmazonBasics USB Type-C to USB Type-C 2.0 Cable - 6 Inches (15.2 Centimeters) - Black,AmazonBasics,0,0,0,539,4.2,"2,414",9,"Wednesday, February 16",1,"2,414"
214,B07DHM9JZW,Spigen MFi Certified 3 in 1 Braided Fast Charging Multi Cable (USB-C | Micro USB | Lightning) 1.5 Meters - Black,Spigen,0,0,0,"1,599",4.2,"1,529",30,"Wednesday, February 16",1,"1,529"
215,B09PZ15PQX,Vancuver USB C to USB C Cable 1 mtr Type-C Charger Warp Charge Dash Charge USB C Cable 65W 6.5A USB-C Long Super Fast Charging Cord Compatible with Pro Air 4 OnePlus 9 8T 8 Pro 7T,Vancuver,0,0,0,299,0,0,70,"Wednesday, February 16",1,"₹299
₹999 Save ₹700 (70%)"
216,B09NPT32T9,Sachdeal Type-C to USB Type-C Cable For Apple iPad Pro 12.9 (2021) Original Type-C To Type C USB Data & Charging Cable | PD Charger Cable | Dash WRAP Charging Cable | USB 3.1 type C Fast Charging Cable 60W 3A High Speed Rapid Fast Turbo QC 3.0 Charging Cable (3.1 Ampere),Sachdeal,0,0,0,399,5.0,1,50,"Wednesday, February 16",1,1
217,B09Q6HTX9G,JVN Nylon Braided Type C Fast Charging Cable USB-C Data Cable for SYNC for Smartphones (1 Meter Multicolour) By 2 get 1 Free,JVN,0,0,0,199,1.0,1,75,"Thursday, February 17",1,1
218,B086H49DQ3,"Belkin Type C to USB-A 2.0 Male Cable 6.6 feet (2 meter) - White, USB-IF Certified, Supports Fast Charging",Belkin,1,0,0,649,4.4,"1,086",35,"Monday, February 14",1,"1,086"
219,B01N1RHEQ6,"CableCreation USB Type C Cable[3-Pack], 4 ft USB C to USB 2.0 A Braided Cord, Compatible with MacBook, Nexus 5X/ 6P, OnePlus 2/3/5/5T, Galaxy S9/S9+/S8/S8 Plus, etc, 1.2 M/Space Gray",CableCreation,1,0,0,829,4.6,238,7,"Thursday, February 17",1,238
220,B08RB56L9C,iEDS USB 3.1 Gen 2 Type C PD 20 Gbps 100W 5A 4K Video USB-C to USB-C Cable with E-Marker Chip 2M Grey,iEDS,1,0,0,"1,399",4.3,37,30,"Wednesday, February 16",1,37
221,B01M1KINRO,"CableCreation Short USB 3.0 Extension Cable,USB 3.0 A Male to Female Extension Cable USB 3.0 Extender Cord Compatible Oculus VR, Playstation, Xbox, Keyboard, Printer, Scanner Space Gray Aluminum 1FT 30CM",CableCreation,1,0,0,569,4.3,"1,528",48,"Thursday, February 17",1,"1,528"
222,B09LYKQCSY,Starkwoood Type-C to Type-C 3.0 Cable for Samsung Galaxy M31s Data & Charging Cable PD Charger Cable USB 3.1 Type C Fast Charging Cable 60W 3A Turbo QC 3.0 Charging Cable - White,Starkwoood,0,0,0,399,5.0,2,50,"Wednesday, February 16",1,2
223,B095N6ZMBF,"LIRAMARK USB-C to USB 2.0 B, Type C Printer & Scanner Cable, Compatible for Macbook Pro, Canon, Brother, Samsung Printers etc, 1M/Black",LIRAMARK,0,0,0,608,0,0,39,"Monday, February 14",1,"₹608
₹999 Save ₹391 (39%)"
224,B01GGKYUKI,AmazonBasics USB 3.1 type C to Type C Gen1 Cable -3Feet -White,AmazonBasics,0,0,0,"1,189",4.3,"1,415",19,"Monday, February 14",1,"1,415"
225,B08P5MFNRF,"Stuffcool Quad 4 in 1 Cable 65W PD USB to Lightning, USB to Type-C, Type-C to Lightning & Type C to Type-C Sync and Charge Nylon Braided Fast Charging Cable Compatible with iPhone 12, 1M - Black",Stuffcool,0,0,0,999,4.0,581,55,"Wednesday, February 16",1,581
226,B0964ZSD46,"DMS 20W QUICK Charging l PD Cable l USB C TO USB C CAHRGING CABLE FOR iPad Pro 11""/ 12.9"" 2020/2018 Laptop l C TO C l C2C l Phone C To Phone C Charging Cable l C Type Adapter Cable l PD Cable For PD Charger",DMS,0,0,0,299,3.5,3,63,"Thursday, February 17",1,3
227,B01N1RHEQ6,"CableCreation USB Type C Cable[3-Pack], 4 ft USB C to USB 2.0 A Braided Cord, Compatible with MacBook, Nexus 5X/ 6P, OnePlus 2/3/5/5T, Galaxy S9/S9+/S8/S8 Plus, etc, 1.2 M/Space Gray",CableCreation,0,0,0,829,4.6,238,7,"Thursday, February 17",1,238
228,B09R1T2YBH,"Starkwoood Type C (Pack 2) Usb Cable For LG G8s Original USB Type C Sync Cable Quick Charge Cable Speed Upto 3.1 Amp Strong & Durable High Speed Data Sync Transfer Cable Best Tangle Free Cable ( 2.4 Amp,White )",Starkwoood,0,0,0,399,0,0,50,"Wednesday, February 16",1,"₹399
₹799 Save ₹400 (50%)"
