,asin,title,brand,Sponsored,Best Seller,Amazon's Choice,Price,Rating,NoofRatings,Discount,Delivery,Prime Delivery,base
0,B093BCQY2Q,Men's Regular Fit Organic Cotton T-Shirt,Woodwose Organic Clothing,1,0,0,569,4.2,65,5,,1,65
1,B07RXZT62Q,Men's Regular Fit T-Shirt,Wrath,1,0,0,324,3.7,"2,731",75,,0,"2,731"
2,B09BZZRBWH,Men's Regular Fit Polo T-Shirt,PRINTOCTOPUS,1,0,0,798,0,0,50,,1,"₹798
₹1,599 Save ₹801 (50%)"
3,B082DFJBNL,Polo Collar T-Shirt for Plus Size Men,AMERICAN CREW,1,0,0,802,4.1,568,60,,1,568
4,B09CNYR7ZS,Men's Cotton Half Sleeve Regular Fit Striped T-Shirt,RodZen,0,0,0,299,3.8,22,80,,0,22
5,B084L8XZTV,Men's Regular Fit T-Shirt (Pack of 3),Scott International,0,1,0,429,3.8,"24,945",82,,0,"24,945"
6,B06Y2BZJN6,Men's Polo,Allen Solly,0,1,0,570,4.1,"43,721",37,,1,"43,721"
7,B09CV152WG,Regular Fit Half Sleeve Men's T-Shirt,LEOTUDE,0,0,0,329,3.4,"1,546",70,,0,"1,546"
8,B09QHRDB82,Regular Fit Half Sleeve Polo Men's T-Shirt,LEOTUDE,0,0,0,299,1.4,3,73,,0,3
9,B09QHWDSKJ,Regular Fit Full Sleeve Men's T-Shirt,LEOTUDE,0,0,0,299,3.1,5,73,,0,5
10,B085612STT,Band Collar Men's T-Shirt(EBT325 & EBT325HS),EYEBOGLER,0,0,0,416,3.6,"3,213",68,,0,"3,213"
11,B08L9FWQ3G,Regular Fit Half Sleeve Men's Polo T-Shirt,LEOTUDE,0,0,0,329,3.6,331,70,,0,331
12,B08JQKJ5FH,Men's Printed Full Sleeve Slim Fit Cotton T-Shirt,Urbano Fashion,0,0,0,399,3.8,"1,862",64,,0,"1,862"
13,B0922TZG2K,KiwiCaves Polo Collar Neck Sports Cotton T-Shirt for Men and Boys,Generic,0,0,0,348,3.4,117,68,,1,117
14,B089B3C74D,Regular Men's Cotton Designer T-Shirt (EB1T67),EYEBOGLER,0,0,0,320,3.4,"2,173",75,,0,"2,173"
15,B07BQCVTSS,Men's Solid Regular Fit T-Shirt,EYEBOGLER,0,0,0,335,3.8,"7,362",74,,0,"7,362"
16,B098TQW7NZ,Men's Regular T-Shirt,Puma,0,0,0,524,4.1,30,65,,1,30
17,B07W1FFQ7Z,Men's Regular Fit T-Shirt,GRITSTONES,0,0,0,309,3.8,"1,077",76,,0,"1,077"
18,B07B2XWRBW,Men's Regular Fit T-Shirt (Pack of 4),AWG ALL WEATHER GEAR,0,0,0,499,3.5,"6,973",84,,1,"6,973"
19,B08662JK2H,Men's Slim Fit Polo T-Shirt,Alan Jones Clothing,0,0,0,419,4.0,856,58,,0,856
20,B073X32VWS,Men's Regular T-Shirt,Amazon Brand - Symbol,1,0,0,569,4.0,"10,842",73,,1,"10,842"
21,B07TK4RHXF,Men's Regular fit T-Shirt,U.S. POLO ASSN.,1,0,0,558,4.0,81,44,,1,81
22,B099QWT99X,Men's Regular T-Shirt,Amazon Brand - Symbol,1,0,0,699,3.0,3,53,,1,3
23,B092ZWY17Z,Supima Cotton Mens and Boys Solid Cotton Drop Cut T-Shirts,The Souled Store,1,0,0,839,4.2,12,44,,1,12
24,B08TH92K4Q,Regular Fit Half Sleeve Polo Men's T-Shirt,LEOTUDE,0,0,0,329,3.6,"1,074",70,,0,"1,074"
25,B09C2JBSSC,Men's Slim T Shirt (Pack of 3),BULLMER,0,0,0,599,3.5,656,60,,1,656
26,B07YDHXM5P,Regular Fit Men's Cotton T-Shirt (EBT229-NBLM),EYEBOGLER,0,0,0,359,3.8,"3,613",72,,0,"3,613"
27,B098L9LJT8,"Men's Hooded Cotton Blend Checked T-Shirt : Black, White",LEWEL,0,0,0,349,3.6,170,83,,0,170
28,B096VX79X2,Men's Slim T-Shirt,Integriti,0,0,0,117,3.7,31,88,,0,31
29,B09LM6YYV5,181920 Men's Basic Printed Cotton Regular T-Shirts for Men Combo,THE BLAZZE,0,0,0,499,2.8,13,50,,1,13
30,B084GB4K2B,Men's Regular Fit T-Shirt,Austin Wood,0,0,0,399,3.8,"1,047",73,,1,"1,047"
31,B08CDR6T1M,Men T-Shirt,EYEBOGLER,0,0,0,369,3.9,"6,286",72,,0,"6,286"
32,B09KBJY64Y,Men's T Shirt-(Amt250105-P_Green),AELOMART,0,0,0,447,4.0,83,70,,0,83
33,B09MTTCJQ2,Printed Men's Round Neck Black T-Shirt,London Hills,0,0,0,349,4.4,6,73,,0,6
34,B098K2L2P5,Regular Fit Cotton Printed Men's T-Shirt,LEOTUDE,0,0,0,299,3.4,971,73,,0,971
35,B09QHR398W,Regular Fit Half Sleeve Men's Polo T-Shirt,LEOTUDE,0,0,0,299,4.2,3,73,,0,3
36,B08JQLCS7Y,Men's Dark Green Printed Slim Fit Cotton T-Shirt,Urbano Fashion,0,0,0,359,4.0,117,64,,0,117
37,B08N55WRSX,Men's Regular Fit T-Shirt,EYEBOGLER,0,0,0,318,3.8,824,76,,0,824
38,B09N3L78CN,Regular Fit Full Sleeve Men's T-Shirt (Color : Maroon),LEOTUDE,0,0,0,299,3.6,39,73,,0,39
39,B08SHTK9WD,Mens Regular Fit Printed Cotton Polo Tshirt,BULLMER,0,0,0,439,4.1,852,56,,0,852
40,B096SKLZJM,"Cotton Regular Fit Half Sleeves Basic Printed T-Shirt T-Shirt for Mens - Yellow, Black (Large, Combo of 2)",STATUS MANTRA,0,0,0,479,3.5,159,72,,0,159
41,B08VN24M92,Men's Slim T-Shirt,Pepe Jeans,0,0,0,629,4.0,34,37,,1,34
42,B0892VNQP7,Men's Slim Fit T-Shirt (Pack of 3),BULLMER,0,0,0,589,3.5,"1,157",61,,1,"1,157"
43,B012STP7EO,Men's Regular Fit Round Neck Half Sleeved T-Shirt,Jockey,0,0,0,321,4.3,"14,574",36,,0,"14,574"
44,B07DPRGX1N,Men's Regular Fit Polos,AMERICAN CREW,0,0,0,612,4.1,"6,664",59,,1,"6,664"
45,B06W9HQHBW,Men's Regular Fit T-Shirt (Pack of 3),Scott International,0,0,0,429,3.6,"4,723",82,,0,"4,723"
46,B08353X5G8,Men's Slim Polo,Max,0,0,0,399,4.1,"7,983",11,,0,"7,983"
47,B08KTZDXMG,Men's Regular Fit Polo,Allen Solly,0,0,0,659,4.2,278,45,,1,278
48,B01HTCFYZ2,Mens Polyester Printed Round Neck Short Sleeves Tshirt - Multicolour (CST188),wear your mind,0,0,0,599,1.0,1,45,,1,1
49,B09RK9BNRM,Polyester Men's Solid Pattern Regular Fit Round Neck Half Sleelve T-Shirt for Gym |Sports | Running | Casual Wear H/H,ADDIZ,0,0,0,171,0,0,83,,0,"₹171
₹999 Save ₹828 (83%)"
50,B07MXJDQTC,Men's Regular Fit T-Shirt,Veirdo,0,0,0,199,3.7,"1,255",83,,0,"1,255"
51,B07RTQB4DH,Men's Regular Fit T-Shirt,Madwares,0,0,0,190,3.3,331,62,,1,331
52,B096VYFNGL,Men's Slim T-Shirt (Pack of 3),Integriti,0,0,0,325,3.8,184,86,,0,184
53,B09H7JP1HV,Printed Men Round Neck Full Sleeve T-Shirt,London Hills,0,0,0,349,3.6,459,73,,0,459
54,B08PV6S2WF,Regular Fit Cotton Men's T-Shirt Combo (Pack of 2),LEOTUDE,0,0,0,499,3.7,"2,897",55,,1,"2,897"
55,B08HNB7WR7,AWG Men's Cotton Regular Fit Solid Polo Neck T-Shirt,AWG ALL WEATHER GEAR,0,0,0,349,3.6,"6,845",77,,0,"6,845"
56,B07794R5ZP,Men's Regular T-Shirt,Amazon Brand - Symbol,1,0,0,219,3.9,"1,620",45,,0,"1,620"
57,B07F8SK165,Men's Regular T-Shirt,Amazon Brand - Symbol,1,0,0,449,4.1,531,62,,0,531
58,B09MQW1SCY,"Mens Polo T-Shirt Emb,",Clothe Funn,1,0,0,499,4.4,9,75,,1,9
59,B07WX54SRY,Men's Regular T-Shirt,Amazon Brand - Symbol,1,0,0,569,4.0,"6,122",73,,1,"6,122"
60,B09JZDP78S,Oversized Mens Cotton Blend Half Sleeve Mens T-Shirts,LEOTUDE,0,0,0,299,3.5,162,73,,0,162
61,B09QSYS2WD,Oversized t-Shirt for Men,Veirdo,0,0,0,299,5.0,1,75,,0,1
62,B096VXSFPN,Men's Slim T-Shirt,Integriti,0,0,0,144,3.7,40,86,,0,40
63,B09JZGPXL3,Men Cotton Black/Maroon Hooded T-Shirt,GRITSTONES,0,0,0,332,4.2,40,63,,0,40
64,B08T7G1QFR,Men's Regular Fit Printed Full Sleeve Soft & Strong Hooded T-Shirt,London Hills,0,0,0,399,3.8,625,69,,0,625
65,B099FC2ZWV,Men's Slim T-Shirt,Jack & Jones,0,0,0,299,4.2,10,70,,0,10
66,B075J4SGZT,Men’s Round Neck Full Sleeve T-Shirt with Sports Trim - Grey Melange,Thread Swag,0,0,0,179,3.3,20,78,,1,20
67,B0819ZQM5G,Men's Striped Regular fit T-Shirt,U.S. POLO ASSN.,0,0,0,639,4.0,"1,210",20,,1,"1,210"
68,B08V5LCW5D,Men's Regular T-Shirt,Puma,0,0,0,519,3.0,1,60,,1,1
69,B08Z41K8HV,Mens Regular Fit Striped Cotton Polo Tshirt/Collared Tshirt,BULLMER,0,0,0,439,4.0,114,56,,0,114
70,B09DCS9PDY,Men's High Turtle Neck Cotton T-Shirt,NORTHWIND,0,0,0,795,4.0,499,60,,1,499
71,B08T5RKG52,Round Neck Men's Cotton T-Shirt(AMT039-P),AELOMART,0,0,0,499,3.7,161,67,,1,161
72,B06XHFTP47,Men's 100% Cotton Biowash Round Neck T-Shirt,Scott International,0,0,0,299,3.9,"1,388",70,,0,"1,388"
73,B07TRF9S3V,Men's Cotton T-Shirt,AELOMART,0,0,0,447,3.9,"7,831",70,,0,"7,831"
74,B07BDZ75YG,Men's Regular Polo Shirt,Amazon Brand - Symbol,0,0,0,589,3.9,"5,408",41,,1,"5,408"
75,B099FBXYM2,Men's Slim T-Shirt,Jack & Jones,0,0,0,229,3.7,251,79,,0,251
76,B08R5WR668,"Men's Cotton T Shirt (AWT1272-PN,Green)",AELOMART,0,0,0,448,3.9,618,70,,0,618
77,B096VZFV16,Men's Slim T-Shirt,Integriti,0,0,0,252,3.6,38,75,,0,38
78,B08MCDPX8B,Men's Cotton Regular Fit Full Sleeves T-Shirt,CHKOKKO,0,0,0,189,3.9,"1,838",91,,0,"1,838"
79,B07CXXHLY2,Men's Regular fit T-Shirt,U.S. POLO ASSN.,0,0,0,411,4.0,"5,205",31,,0,"5,205"
80,B0862D2D64,Men's Slim Fit Polo T-Shirt,GHPC,0,0,0,399,4.0,384,60,,0,384
81,B07JJ2CBND,Men's Slim Fit T-Shirt,WC Right,0,0,0,365,3.8,"2,079",63,,0,"2,079"
82,B0855CGJY5,Mens Cotton Half Sleeve Striped Polo T Shirt with Collar,fanideaz,0,0,0,712,3.7,"3,386",72,,1,"3,386"
83,B07XVM5D9S,Men's Round Neck Regular Fit T-Shirt (Pack of 2),London Hills,0,0,0,399,3.9,473,69,,0,473
84,B08NXHW761,Batman: 3D Logo Mens and Womens 3D Embossed Cotton T-Shirt Black,The Souled Store,0,0,0,629,4.3,284,30,,1,284
85,B09PHBZ3H2,"Men Performance TEE,Blue",Puma,0,0,0,579,0,0,55,,1,"₹579
₹1,299 Save ₹720 (55%)"
86,B08N72L1RV,Men's Solid Regular fit T-Shirt,EYEBOGLER,0,0,0,349,3.7,"3,876",73,,0,"3,876"
87,B079W561LM,Multicolour Cotton Full Sleeve T-Shirt for Men,ADRO,0,0,0,449,4.0,"2,241",75,,0,"2,241"
88,B07NKKYN2D,Men's Polyester Round Neck T-Shirts - Pack of 2,AWG ALL WEATHER GEAR,0,0,0,349,3.5,"3,843",78,,0,"3,843"
89,B08Z44SKBM,Mens Regular Fit Striped Cotton Polo Tshirt/Collared Tshirt,BULLMER,0,0,0,439,4.0,530,56,,0,530
90,B0828NYSFM,Regular Fit Full Sleeve Men's T-Shirt,LEOTUDE,0,0,0,329,3.6,635,70,,0,635
91,B00W05Z52G,Men's Cotton T-Shirt,Jockey,0,0,0,399,4.3,"11,594",20,,0,"11,594"
92,B09P1GVV8S,Men's t-Shirt Combo Pack of 5 Original 100% Cotton Blended,CUSTOMSCART,0,0,0,699,0,0,72,,0,"₹699
₹2,499 Save ₹1,800 (72%)"
93,B07FBK4B54,Men's Slim Fit T-Shirt,Maniac,0,0,0,356,3.8,"5,569",71,,0,"5,569"
94,B01HTCHFIG,Men's Printed Regular fit T-Shirt,wear your mind,0,0,0,359,0,0,67,,0,"₹359
₹1,099 Save ₹740 (67%)"
95,B09B9ZJHTM,Men's Slim Polo Shirt,Peter England,0,0,0,552,3.9,525,39,,1,525
96,B07DWJWNCY,Men's Solid Regular Fit T-Shirt,U.S. POLO ASSN.,0,0,0,949,4.0,285,53,,1,285
97,B08QDJFXML,Printed Men's Fullsleeve Hooded Neck White Cottton Tshirt,Maniac,0,0,0,390,3.9,23,78,,0,23
98,B094RG6KCZ,Men's Slim Polo Shirt,Reebok,0,0,0,499,4.0,10,50,,1,10
99,B073WCLVSC,Men's Solid Regular fit T-Shirt,Van Heusen Athleisure,0,0,0,500,4.1,"1,713",27,,1,"1,713"
100,B08475MJY5,"Men's Blended Polo T-Shirt (Bbsie-Sky,Sizes 2XL-6XL)",Bigbanana,0,0,0,499,2.1,5,58,,1,5
101,B093SQLCV8,0017 T-Shirts for Men's,THE BLAZZE,0,0,0,448,3.3,622,59,,1,622
102,B08N5SVFQ4,Men's Regular Fit Striped Round Neck T-Shirt,EYEBOGLER,0,0,0,380,3.9,"7,668",71,,0,"7,668"
103,B08SW3YNM9,Justice League: Logo Mens and Boys Graphic Printed Cotton Drop Cut T-Shirts Navy Blue,The Souled Store,0,0,0,734,4.0,442,18,,1,442
104,B09796WVQH,Round Neck Regular Fit Cotton T-Shirt,Amazon Brand - Inkast Denim Co.,0,0,0,409,4.4,22,69,,0,22
105,B07KRZ1JTT,Men's Plain Regular Fit T-Shirt,GRITSTONES,0,0,0,349,4.0,807,65,,0,807
106,B082G3S7GC,"Men's Cotton Full Sleeve T Shirt-(Amt1125-N,Olive)",AELOMART,0,0,0,497,4.0,"3,692",67,,0,"3,692"
107,B08VDVMXRC,Men's Cotton Henley Neck Full Sleeve Regular Fit T-Shirt,Veirdo,0,0,0,299,4.2,307,75,,0,307
108,B07TL4X59G,Men's Regular fit T-Shirt,U.S. POLO ASSN.,1,0,0,547,4.0,81,45,,1,81
109,B076CJMHBC,Men's Solid Regular Fit Polo,Van Heusen,1,0,0,618,4.0,"20,872",38,,1,"20,872"
110,B09RP5BCR3,Men's 100% Cotton T-Shirts,TRU-TEES,1,0,0,499,0,0,62,,0,"₹499
₹1,299 Save ₹800 (62%)"
111,B085NTYVRC,Men's Regular Fit T-Shirt,VIMAL JONNEY,1,0,0,299,4.0,15,70,,1,15
112,B07RMYK9Z5,Men's Slim Fit T-Shirt,JUGULAR,0,0,0,266,3.6,"1,273",0,,0,"1,273"
113,B08SW3YNM9,Justice League: Logo Mens and Boys Graphic Printed Cotton Drop Cut T-Shirts Navy Blue,The Souled Store,0,0,0,734,4.0,442,18,,1,442
114,B09796WVQH,Round Neck Regular Fit Cotton T-Shirt,Amazon Brand - Inkast Denim Co.,0,0,0,409,4.4,22,69,,0,22
115,B07KRZ1JTT,Men's Plain Regular Fit T-Shirt,GRITSTONES,0,0,0,349,4.0,807,65,,0,807
116,B082G3S7GC,"Men's Cotton Full Sleeve T Shirt-(Amt1125-N,Olive)",AELOMART,0,0,0,497,4.0,"3,692",67,,0,"3,692"
117,B08VDVMXRC,Men's Cotton Henley Neck Full Sleeve Regular Fit T-Shirt,Veirdo,0,0,0,299,4.2,307,75,,0,307
118,B07MQ11SMH,Men's Plain Vest,Jockey,0,0,0,279,4.2,698,15,,0,698
119,B09135B8CK,Regular Fit Full Sleeve Men's T-Shirt,LEOTUDE,0,0,0,329,3.4,387,70,,0,387
120,B095CMZH8N,Men's Slim Fit Polo Collar Half Sleeve Solid Cotton White T-Shirt (PRISTO-White SF,Classic Polo,0,0,0,629,3.8,21,10,,1,21
121,B07MFVCK67,Winter Wear Cotton Plain Full Sleeve Turtle Neck T Shirt for Men,CHKOKKO,0,0,0,645,4.0,"3,238",77,,1,"3,238"
122,B0793FCY3T,Men's Regular fit T-Shirt,U.S. POLO ASSN.,0,0,0,398,4.0,"2,185",20,,0,"2,185"
123,B09CNKG4ZX,Men's High and Turtle Neck Cotton T-Shirt,NORTHWIND,0,0,0,795,4.0,649,47,,1,649
124,B01F0XE7FU,Men's Organic Cotton Polo T-Shirt,Scott International,0,0,0,449,4.1,42,70,,0,42
125,B09CH1M878,Men's Regular T-Shirt,Arrow,0,0,0,806,4.7,4,53,,1,4
126,B07W1FG2P2,Men's Regular Fit T-Shirt,GRITSTONES,0,0,0,309,3.7,200,76,,0,200
127,B08PSY32ZZ,Regular fit Solid Men's Henley Neck Full Sleeve Cotton Blend T Shirts,BLIVE,0,0,0,299,3.4,"3,482",79,,0,"3,482"
128,B07RY2N76L,Men's Regular Fit T-Shirt,Wrath,1,0,0,324,3.7,"2,731",78,,0,"2,731"
129,B08662XVDJ,Men's Slim Fit Polo T-Shirt,Alan Jones Clothing,1,0,0,419,4.0,856,58,,0,856
130,B098LBT95T,Step Hem T-Shirt: Grey Melange Mens and Boys Solid Cotton Grey,The Souled Store,1,0,0,419,5.0,1,58,,0,1
131,B09DD3BGXZ,Step Hem T-Shirt: Olive Green Mens and Boys Solid Cotton T-Shirts,The Souled Store,1,0,0,432,0,0,57,,0,"₹432
₹999 Save ₹567 (57%)"
132,B079KFXZX5,Men's Polyester Round Neck T-Shirts - Pack of 5,AWG ALL WEATHER GEAR,0,0,0,649,3.5,"1,065",78,,1,"1,065"
133,B092SN5GYJ,Cotton Camouflage Printed Regular Fit Men's Tshirt,LEOTUDE,0,0,0,299,3.8,"2,255",81,,0,"2,255"
134,B08S31CBWN,Mens Cotton Mask Hooded T-Shirt,Katso,0,0,0,299,3.9,283,79,,0,283
135,B0953S12SZ,Marvel: Comic Strip Mens and Boys Graphic Printed Cotton T-Shirts Multi-Colored,The Souled Store,0,0,0,734,4.4,28,18,,1,28
136,B08N71VMWX,Regular Fit Men's Cotton T-Shirt,EYEBOGLER,0,0,0,299,3.8,"3,157",77,,0,"3,157"
137,B07T9GHB59,Men's Regular T-Shirt,Deniklo,0,0,0,169,4.1,75,86,,0,75
138,B08V51478C,Regular Fit Full Sleeve Men's T-Shirt Combo (Pack of 2),LEOTUDE,0,0,0,549,3.6,923,66,,1,923
139,B07WRS2FXT,Men's Regular T-Shirt,Amazon Brand - Symbol,0,0,0,569,4.0,"6,122",73,,1,"6,122"
140,B09C8JYGJS,Regular Fit Half Sleeve Men's T-Shirt Cotton Blend Combo (Pack of 2),LEOTUDE,0,0,0,499,3.4,196,55,,1,196
141,B08D7NPNZR,Men's Solid Mandarin Collar Slim Fit Cotton T-Shirt,Urbano Fashion,0,0,0,365,3.8,636,67,,0,636
142,B083C2TDPW,Men's Regular fit T-Shirt,Van Heusen Athleisure,0,0,0,649,4.1,826,0,,1,826
143,B07PCMTJBK,Men's Polyester Round Neck T-Shirts - Pack of 3,AWG ALL WEATHER GEAR,0,0,0,429,3.6,"3,496",82,,0,"3,496"
144,B07B6RPYHQ,Boy's Slim Fit T-shirt,Maniac,0,0,0,334,3.7,"9,537",69,,0,"9,537"
145,B08QDJFXML,Printed Men's Fullsleeve Hooded Neck White Cottton Tshirt,Maniac,0,0,0,390,3.9,23,78,,0,23
146,B0979975N6,Round Neck Regular Fit Cotton T-Shirt,Amazon Brand - Inkast Denim Co.,0,0,0,409,4.1,12,69,,0,12
147,B08KFHGLZC,Men T-Shirt,Allen Solly,0,0,0,476,4.1,143,32,,0,143
148,B08KTWJZCQ,Men T-Shirt,Allen Solly,0,0,0,629,4.3,229,48,,1,229
149,B07MQDJ54N,Tshirts for Men Man's Clothing Gents Stylish Tees Cotton Regular Branded T-Shirt Latest Collection Men's Cotton Half Sleeve Combo Pack Plain T-Shirt,STATUS MANTRA,0,0,0,139,3.5,183,85,,0,183
150,B07VR12VST,Men's Regular Fit T-Shirt,Veirdo,0,0,0,299,3.9,"2,847",75,,0,"2,847"
151,B01HTCFYG6,Men's Regular fit T-Shirt,wear your mind,0,0,0,499,4.7,4,55,,1,4
152,B08THBBBHY,Regular Fit Half Sleeve Men's Polo T-Shirt,LEOTUDE,0,0,0,299,3.6,"1,342",73,,0,"1,342"
153,B08RDV81ND,Men's Half Sleeve Regular Fit T-Shirt,Veirdo,0,0,0,399,4.0,660,67,,0,660
154,B09BJ2FQGW,Men's White Full Sleeve T-Shirt,Austin Wood,0,0,0,349,0,0,78,,1,"₹349
₹1,599 Save ₹1,250 (78%)"
155,B08KRW25GM,Men's Regular Fit Polo Multi Color T Shirt (Pack of 3),LEOTUDE,0,0,0,799,3.5,"1,268",50,,1,"1,268"
156,B08543MWQN,Scott Men's Basic Cotton Round Neck Half Sleeve Solid T-Shirts - Pack of 2,Scott International,0,0,0,329,3.6,"2,423",79,,0,"2,423"
157,B07L2J15BM,Plus Size Men's Regular Fit Polo,Bigbanana,0,0,0,675,4.1,"1,796",60,,0,"1,796"
158,B07NF8D4J9,Men's Regular T-Shirt,Amazon Brand - Symbol,0,0,0,899,4.1,"3,593",40,,1,"3,593"
159,B07L58CNQL,Men's Regular Fit T-Shirt (Pack of 2),London Hills,0,0,0,454,3.8,746,83,,0,746
160,B08M9MXBB6,Men's Full Sleeve Regular Fit T-Shirt,Veirdo,0,0,0,199,4.1,169,83,,0,169
161,B08CKZYDNP,Mens Cotton Hooded T-Shirt,Katso,0,0,0,299,3.8,649,71,,0,649
162,B097R96DJY,Men's Classic T-Shirt,U.S. POLO ASSN.,0,0,0,779,4.0,4,40,,1,4
163,B081VM5MZW,Men's Regular T-Shirt,Amazon Brand - Symbol,0,0,0,899,4.1,"9,034",74,,1,"9,034"
164,B092R8NYCS,"Men's Polo T-Shirt, Solids, Regular Fit (Pack of 2)",Clothe Funn,1,0,0,499,4.0,1,72,,1,1
165,B082KW8VS8,Polo Collar T-Shirt for Plus Size Men,AMERICAN CREW,1,0,0,707,4.1,568,65,,1,568
166,B083C2KRJN,Men's Solid Regular Fit T-Shirt,Van Heusen Athleisure,1,0,0,715,4.0,"2,635",2,,1,"2,635"
167,B08SW76XXZ,Justice League: Logo Mens and Boys Graphic Printed Cotton Drop Cut T-Shirts Navy Blue,The Souled Store,1,0,0,734,4.0,442,76,,1,442
168,B076CJH7QT,Men's Solid Regular Fit Polo,Van Heusen,1,0,0,655,4.0,"20,872",34,,1,"20,872"
169,B08662GXMK,Men's Slim Fit Polo T-Shirt,Alan Jones Clothing,1,0,0,419,4.0,856,58,,0,856
170,B09RPSPG8P,Men's 100% Cotton T-Shirts,TRU-TEES,1,0,0,499,0,0,62,,0,"₹499
₹1,299 Save ₹800 (62%)"
171,B083C2Z97V,Men's Regular fit T-Shirt,Van Heusen Athleisure,1,0,0,719,4.1,826,0,,1,826
172,B07L58CNQL,Men's Regular Fit T-Shirt (Pack of 2),London Hills,0,0,0,454,3.8,746,83,,0,746
173,B08M9MXBB6,Men's Full Sleeve Regular Fit T-Shirt,Veirdo,0,0,0,199,4.1,169,83,,0,169
174,B094CWJ8NT,"Men's Tie Dye Halfsleeve Round Neck Grey, Blue and Dgrey Cotton Tshirt",Maniac,0,0,0,331,4.4,16,77,,0,16
175,B08CKZYDNP,Mens Cotton Hooded T-Shirt,Katso,0,0,0,299,3.8,649,71,,0,649
176,B097R96DJY,Men's Classic T-Shirt,U.S. POLO ASSN.,0,0,0,779,4.0,4,40,,1,4
177,B081VM5MZW,Men's Regular T-Shirt,Amazon Brand - Symbol,0,0,0,899,4.1,"9,034",74,,1,"9,034"
178,B094TTKGL7,Men's Regular T-Shirt,Arrow,0,0,0,307,4.2,107,49,,0,107
179,B07RC1JWHK,Men's Solid Regular Fit Polo,Van Heusen Athleisure,0,0,0,899,4.1,"1,798",10,,1,"1,798"
180,B098TR46Z9,Men's Regular T-Shirt,Puma,0,0,0,599,3.8,17,60,,1,17
181,B09PNJNGTM,Oversized Mens Cotton Blend Half Sleeve T-Shirts,LEOTUDE,0,0,0,299,1.0,1,73,,0,1
182,B095SW13JR,Men's Slim Fit T-Shirts,Spykar,0,0,0,370,4.1,90,63,,0,90
183,B073X4KMH6,Men's Regular T-Shirt,Amazon Brand - Symbol,0,0,0,299,3.9,"1,620",57,,0,"1,620"
184,B076CJMHBC,Men's Solid Regular Fit Polo,Van Heusen,0,0,0,618,4.0,"20,872",38,,1,"20,872"
185,B09FLBC4JG,Men's Combo Polo Neck Cotton Blend Solid T-Shirt (Pack of 2),INKKR,0,0,0,439,3.3,398,66,,0,398
186,B07NDYK421,Men's Regular Fit Polos,AMERICAN CREW,0,0,0,649,3.8,557,57,,1,557
187,B08XMH1FCC,All Over Printed Men's Halfsleeve Round Neck White Cotton Tshirt,Maniac,0,0,0,314,3.8,49,76,,0,49
188,B08HNCNJ3Q,AWG Men's Cotton Regular Fit Solid Polo Neck T-Shirt,AWG ALL WEATHER GEAR,1,0,0,349,3.6,"6,845",77,,0,"6,845"
189,B0833DQ9X9,Men's Regular Fit T-Shirt,AMERICAN CREW,1,0,0,649,3.9,"13,207",68,,1,"13,207"
190,B09C3SNKT7,Official The Flintstones: Pattern Mens and Boys Graphic Printed Cotton Oversized T-Shirts White,The Souled Store,1,0,0,734,4.6,3,43,,1,3
191,B097DVH768,Don't Make Me Do Stuff Mens and Boys Graphic Printed Cotton T-Shirts Blue,The Souled Store,1,0,0,524,0,0,42,,1,"₹524
₹899 Save ₹375 (42%)"
192,B09JKPSZ43,Military/Army Dark Green Collared Uri Style Zip T-Shirt for Men,OMEE GOLD,0,0,0,498,4.0,39,62,,0,39
193,B09FHYVB4J,Feel Good King Multi Colored Printed Dri Fit T-Shirt for Adults,GAZELLE ACTIVE,0,0,0,199,4.3,3,60,,1,3
194,B08HQMWB4H,Men's Cotton Regular Fit Solid Polo Neck T-Shirt,Scott International,0,0,0,349,3.5,"8,093",77,,0,"8,093"
195,B097R7T4BC,Men's Classic T-Shirt,U.S. POLO ASSN.,0,0,0,989,0,0,55,,1,"₹989
₹2,199 Save ₹1,210 (55%)"
196,B0793HPJTG,Men's Regular fit T-Shirt,U.S. POLO ASSN.,0,0,0,489,3.8,"6,647",2,,1,"6,647"
197,B08ZG9337F,Men's Slim T-Shirt,EASYBUY,0,0,0,155,3.5,7,48,,0,7
198,B08KS3KCKL,Men's Cotton Half Sleeve Printed Polo T-Shirt,Veirdo,0,0,0,399,4.1,549,67,,0,549
199,B08PBXL9CX,Men's Solid Henley Neck Slim Fit Cotton T-Shirt,Urbano Fashion,0,0,0,375,3.7,203,66,,0,203
200,B07WVBPTFS,Men's Regular Fit T-Shirt,Fashion Gallery,0,0,0,299,3.4,367,80,,1,367
201,B072PZCK5W,Men's T-Shirt,United Colors of Benetton,0,0,0,350,3.9,10,75,,0,10
202,B08SBTSVJM,Men's Regular Fit T-Shirt (Pack of 3),fanideaz,0,0,0,949,3.8,146,73,,1,146
203,B08YYHKJ55,Mens Polo Neck Half Sleeve Musturd Cotton T-Shirt,Classic Polo,0,0,0,629,3.9,40,10,,1,40
204,B076T54DCF,Polo Collar Cotton Poly Striped T-Shirt for Men,AMERICAN CREW,0,0,0,612,4.0,"3,300",59,,1,"3,300"
205,B073FKXQ9H,Solid Men's Shawl Collar Regular Fit T-Shirt,EYEBOGLER,0,0,0,329,3.6,"10,633",77,,1,"10,633"
206,B00SYP3GVS,Polo Collar Half Sleeve T Shirt for Men,AMERICAN CREW,0,0,0,595,4.1,684,60,,1,684
207,B08XXWKHLY,Regular Fit Men's Cotton T-Shirt(AMT2301-P),AELOMART,0,0,0,498,4.1,164,67,,0,164
208,B01DT8KDOW,Men's Classic Fit T-Shirt,ARISE,0,0,0,399,0,0,20,,0,"₹399
₹499 Save ₹100 (20%)"
209,B09MF84L42,"Men's Cotton Printed Round Neck Loose Fit Oversized T-Shirt | Hip Hop Casual T-Shirt (Black-Red, X-Large)",JUGULAR,0,0,0,369,5.0,2,58,,0,2
210,B092PSZHLG,Men's Printed Halfsleeve Round Neck Olive Cotton Tshirt,Maniac,0,0,0,294,3.7,57,78,,0,57
211,B08KG4DTPL,Men's Regular Fit T-Shirt,Allen Solly,0,0,0,419,4.1,"2,070",40,,0,"2,070"
212,B07XK8L65L,Levi’s Men’s Ultra-Soft Cotton 300 LS Classic Round Neck T-Shirts (Pack of 2),Levi's,0,0,0,698,4.2,442,30,,1,442
213,B09PNR3YYP,Money Heist Mens Printed Hoodies/Mens Sweatshirts,ADRO,0,0,0,349,4.1,125,77,,0,125
214,B07F8SNLD7,Men's Regular T-Shirt,Amazon Brand - Symbol,0,0,0,449,4.1,531,62,,0,531
215,B073X4KMYM,Men's Regular Polo Shirt,Amazon Brand - Symbol,0,0,0,329,3.9,"12,297",34,,0,"12,297"
216,B085BM8FYZ,Men's Classic Fit T-Shirt,Jockey,0,0,0,562,4.3,955,6,,1,955
217,B075JF9TFN,Men's Regular Fit T-Shirt,AMERICAN CREW,0,0,0,612,3.9,"13,207",69,,1,"13,207"
218,B073X1Q7HB,Men's Regular T-Shirt,Amazon Brand - Symbol,0,0,0,569,4.0,"10,842",73,,1,"10,842"
219,B09774GPMG,Men's Color Block Round Neck Multi-Colored T-Shirt,London Hills,0,0,0,499,3.2,132,81,,1,132
220,B07SSW2BYQ,Plus Size Men's Henley T-Shirt,Bigbanana,0,0,0,699,3.9,680,53,,0,680
221,B08KTYMMTL,Men's Plain Regular Fit Polo,Allen Solly,0,0,0,648,4.2,"1,905",44,,1,"1,905"
222,B07NQHCPWR,"Men's Stylish Full Sleeve Hooded T-Shirt (Grey, White, Black)",LEWEL,0,0,0,407,3.9,587,80,,0,587
223,B08NVN4DWJ,Men's Gym Regular Fit Sports High Neck Full Sleeves T-Shirt,CHKOKKO,0,0,0,289,4.0,158,89,,0,158
224,B09JP52KXY,Black Camo Mens and Boys Solids Cotton Full Sleeve T-Shirts,The Souled Store,1,0,0,629,5.0,1,37,,1,1
225,B09JP5WDSH,Official Courage: Face Mens and Boys Graphic Printed Cotton T-Shirts Blue,The Souled Store,1,0,0,629,0,0,37,,1,"₹629
₹999 Save ₹370 (37%)"
226,B082KW8L9N,Polo Collar T-Shirt for Plus Size Men,AMERICAN CREW,1,0,0,707,4.1,568,65,,1,568
227,B08GLLH92N,Men's Regular fit T-Shirt,Cherokee by Unlimited,1,0,0,268,3.5,101,33,,0,101
228,B07HJ99JJ5,Men's Solid Regular Fit Polo,Van Heusen,1,0,0,617,4.0,"20,872",31,,1,"20,872"
229,B09RP8BZZ3,Men's 100% Cotton T-Shirts,TRU-TEES,1,0,0,499,0,0,62,,0,"₹499
₹1,299 Save ₹800 (62%)"
230,B08SW5KJKX,Justice League: Logo Mens and Boys Graphic Printed Cotton Drop Cut T-Shirts Navy Blue,The Souled Store,1,0,0,734,4.0,442,18,,1,442
231,B08D7NWPBH,Men's Slim Fit Polo T-Shirt,Alan Jones Clothing,1,0,0,469,4.0,856,53,,0,856
232,B08CMTX687,Men's Classic Fit T-Shirt (Pack of 3),London Hills,0,0,0,674,3.8,697,83,,1,697
233,B07PBBN5N8,Men T-Shirt(134MTS4_P$_Pack of 4),SHAUN,0,0,0,799,4.2,118,76,,1,118
234,B07P66F2RT,Men's Polyester Round Neck T-Shirts - Pack of 3,AWG ALL WEATHER GEAR,0,0,0,449,3.4,"1,201",81,,0,"1,201"
235,B093BZZBGF,Men's Cotton Round Neck Regular Fit Tshirt (Set of2),Smartees,0,0,0,399,4.2,12,60,,0,12
236,B09RSTM57S,Couple Men's & Women's Cotton Striped Regular Fit Tshirt - Pack of 2,RodZen,0,0,0,499,0,0,67,,1,"₹499
₹1,499 Save ₹1,000 (67%)"
237,B082R9SR9L,Men's Slim Fit T-Shirt,Maniac,0,0,0,359,3.8,166,70,,0,166
238,B09BFWXX9Y,Men's Regular T-Shirt,Levi's,0,0,0,539,4.0,193,55,,1,193
239,B095N8T63K,Men's Regular T-Shirt,Adidas,0,0,0,779,3.8,10,40,,1,10
240,B08RWVZPSR,Men's Slim Fit T-Shirt,Maniac,0,0,0,285,3.9,244,70,,0,244
241,B08KQF2RC4,"Solid, Striped, Sports Men Round Neck T-Shirt (Pack of 2)",London Hills,0,0,0,399,3.8,214,85,,0,214
242,B085W2VWJS,Men's Cotton Sleeveless Regular Fit Printed T-Shirt - Pack of 3,Veirdo,0,0,0,699,4.4,191,77,,1,191
243,B09795GTZH,Round Neck Regular Fit Cotton T-Shirt,Amazon Brand - Symbol,0,0,0,301,3.8,72,70,,0,72
244,B09B4YFR9W,Men Half Sleeve Round Neck White,Pepe Jeans,0,0,0,500,3.0,4,50,,1,4
245,B08SCDW7J8,"Men's Polo T-Shirt Regular fit, Polyester, Half Sleeve, with Pocket Combo Pack of 2 | Maroon, Sky-Blue |",SMAN,0,0,0,499,3.8,384,83,,1,384
246,B083FHPYRQ,Regular Fit Men's Cotton T-Shirt,EYEBOGLER,0,0,0,349,3.5,533,73,,0,533
247,B073X1MR29,Men's Regular T-Shirt,Amazon Brand - Symbol,0,0,0,279,4.0,"5,560",53,,0,"5,560"
248,B097DW8PSL,Don't Make Me Do Stuff Mens and Boys Graphic Printed Cotton T-Shirts Blue,The Souled Store,1,0,0,524,0,0,42,,1,"₹524
₹899 Save ₹375 (42%)"
249,B093BS51JH,Tie Dye : Faded Teal Mens and Boys Cotton T-Shirts Multi-Colored,The Souled Store,1,0,0,629,4.3,5,37,,1,5
250,B085NV229X,Cotton Blended Regular Fit Round Neck Color Block T-Shirt for Men's,VIMAL JONNEY,1,0,0,299,3.8,18,70,,1,18
251,B09QYV3XVQ,Men's Solid Colour Round Neck T-Shirt,Generic,1,0,0,399,0,0,60,,0,"₹399
₹999 Save ₹600 (60%)"
252,B00W066T66,Men's Gym Vest,Jockey,0,0,0,299,4.2,"7,517",17,,0,"7,517"
253,B078GDLFBN,Men's Regular Fit Polo,U.S. POLO ASSN.,0,0,0,719,4.0,67,64,,1,67
254,B09CH2VPRC,Men T-Shirt,Maniac,0,0,0,474,3.9,36,78,,0,36
255,B08Z78PMJY,Men's Round Neck Full Sleeves Regular Dry Fit Gym Sports T-Shirt,CHKOKKO,0,1,0,332,3.9,830,80,,0,830
256,B099JK6XHW,Men T-Shirt,Pepe Jeans,0,0,0,480,0,0,63,,0,"₹480
₹1,299 Save ₹819 (63%)"
