,asin,title,brand,Sponsored,Best Seller,Amazon's Choice,Price,Rating,NoofRatings,Discount,Delivery,Prime Delivery,base
280,B08GL42V3J,"Amazon Brand - Solimo 12-inch Contemporary Plastic & Glass Wall Clock - Designer (Silent Movement, Black Frame)",Amazon,0,0,0,386,3.9,130,65,"Thursday, February 17",0,130
281,B07GRQW4G6,"Creative Creation Customized Square Wood Wall Clock (Multicolour, 11x11 inch)",Creative,0,0,0,399,4.4,174,67,"Saturday, February 19",1,174
282,B09Q7XT3VG,"About Space Antique Wall Clock 12"" Decorative Vintage Clock for Home Living Room Office - Brass Finish",About,0,0,0,679,3.0,1,43,"Friday, February 18",1,1
283,B09B2JDYMN,"Oreva Plastic Wooden Look Designer Wall Clock (27.5 x 27.5 x 4.3 cm, Cola, AQ-7297), Small",Oreva,0,0,0,345,4.5,22,0,"Sunday, February 20",0,22
284,B09FJP88N5,"The Next Decor Elegant Simple Roman Metal Wall Clock with Silent Machine Wall Décor for Home Kitchen and Living Room (Matte Black, 15 Inch)",The,1,0,0,"1,799",4.8,8,18,"Friday, February 18",1,8
285,B098QF2XPW,"Metal Tripod Clock with Stand for Home Decor, Living Room, Bedroom || 49 cm || 1 Pc",,1,0,0,0,0,0,0,,0,
286,B09KPQRKVN,Classic Art Wood Wall Clock Brown Roman Triangle Shape Wall Clock(Used as Table Also) Long Run Plane Glass Wall Decor,Classic,1,0,0,948,0,0,44,"Tuesday, February 22",0,"₹948
₹1,699 Save ₹751 (44%)"
287,B091P84YL5,Metal Iron Wall Mounted Cycle Style Designer Handicraft Clock (Black),Metal,1,0,0,"1,099",0,0,52,"Tuesday, February 22",0,"₹1,099
₹2,299 Save ₹1,200 (52%)"
288,B01MT11MKL,"ANTIQUE Plastic Round Shape Wall Clock with Glass (Black Frame, Mix color)",ANTIQUE,1,0,0,339,3.2,13,77,"Tuesday, February 22",0,13
289,B09DJ8C1N8,"ANTIQUE 10 inch Round Shape Wall Clock with Plastic and Glass for Home/Kitchen/Living Room/Bedroom/Office, Black Multicolor (25.4 x 25.4 x 4 cm)",ANTIQUE,1,0,0,348,4.1,59,77,"Tuesday, February 22",0,59
290,B09R457BF7,"Village Clockworks Large Handcrafted Indian Brass Wall Clock (18x18 Inch, Multi Colored)",Village,1,0,0,"2,599",0,0,76,"Sunday, February 20",0,"₹2,599
₹10,999 Save ₹8,400 (76%)"
291,B09R457FQG,"Village Clockworks Large Handcrafted Snak Skin Design Indian Brass Wall Clock (18x18 Inch, Multi Colored)",Village,1,0,0,"2,599",0,0,76,"Sunday, February 20",0,"₹2,599
₹10,999 Save ₹8,400 (76%)"
292,B09PZ6JNL8,Squar Round Shape Wall Clock with Glass for Home/Kitchen/Living Room/Bedroom/Office-Black-Orange (24 cm x 24 cm 3.4 cm),Squar,0,0,0,299,4.0,2,79,"Tuesday, February 22",0,2
293,B07TKKDKJB,"Oreva Plastic Wooden Look Designer Abstract Wall Clock (32 x 32 x 4 cm, Cola, AQ 6217)",Oreva,0,0,0,311,4.2,"1,959",16,"Sunday, February 20",0,"1,959"
294,B09B2FJRW4,"Oreva Plastic Wooden Look Designer Wall Clock (31 x 31 x 4.5 cm, D Wood, AQ-6017), Medium",Oreva,0,0,0,475,4.5,2,0,"Monday, February 21",0,2
295,B076V9MWFL,"Amazon Brand - Solimo - Paramount Dark Paneling Abstract Plastic Wall Clock (12"", Silent Movement, Black Frame)",Amazon,0,0,0,584,4.0,824,51,"Wednesday, February 16",1,824
296,B09MPK3DSC,"Starmoon Analog Wooden Wall Watch for for Home -Wall Clock for Living Room Hall Bedroom Office Stylish (12 x 12 inch) Wall Clock (Black, Without Glass)",Starmoon,0,0,0,399,5.0,1,77,"Saturday, February 19",0,1
297,B09NMDH475,"Gift Lena Unique Wooden Personalized/Customized Wall Clock Photo Frames with Message (14x14 inch) for Couple,Birthday Gifts for Girlfriend , Wife , Boyfriend , Husband , Parents 48",Gift,0,0,0,695,0,0,65,"Tuesday, February 22",0,"₹695
₹1,999 Save ₹1,304 (65%)"
298,B09BFRN3M6,"12"" Inch Modern Wall Clock , Silent Non-Ticking Decorative Battery Operated Wall Clocks for Living Room, Office, Bathroom, Kitchen Clock","12""",0,0,0,349,5.0,5,61,"Saturday, February 19",1,5
299,B08GL18SG4,"Amazon Brand - Solimo 12-inch Plastic & Glass Wall Clock - Colorful Leaves (Silent Movement, Black Frame)",Amazon,0,0,0,253,3.9,306,77,"Thursday, February 17",0,306
300,B09FLWQ769,"DARSHAN EXIM Handicrafts Round Roman Wood Carving MDF Design Wall Clock, Perfect for Office, Classroom, Bedroom, Living Room, Restaurant, Hotel.",DARSHAN,0,0,0,295,0,0,70,"Saturday, February 19",0,"₹295
₹999 Save ₹704 (70%)"
301,B098P32WF1,"KK Craft Wall Clocks for Living Room, Wall Clocks for Home Decor, Stylish Wall Clock, 28cm X 28cm Size",KK,0,0,0,349,4.5,4,71,"Saturday, February 19",1,4
302,B09B2GRYNW,"Oreva Plastic Wooden Look Designer Wall Clock (30 x 30 x 4.2 cm, Brown Wood, AQ-6537), Medium",Oreva,0,0,0,414,3.0,1,0,"Friday, February 18",0,1
303,B07S2ZN85P,"Oreva AQ 1467 Plastic Round Analog Wall Clock with LED Back Light (35.5 cm x 35.5 cm x 4 cm, Green)",Oreva,0,0,0,920,4.1,132,0,"Sunday, February 20",1,132
304,B09B4W44CH,EFINITO Antique Pendulum Wall Clock (Anchor Ship Design) for Home/ Living Room Stylish/ Bedroom/ Offices,EFINITO,0,0,0,999,4.4,10,70,"Saturday, February 19",1,10
305,B09Q38VT74,Sandrose Designer Analogue Round Wall Clock with Glass for Home/Kitchen Clock Size 24 cm (3D-WOOD-61),Sandrose,0,0,0,345,5.0,2,51,"Tuesday, February 22",0,2
306,B08LHB6Z61,"Ajanta Night Glow Radium Plastic Wall Clock (Black, 310x44x310mm)",Ajanta,0,0,0,970,4.0,664,11,"Saturday, February 19",1,664
307,B09RG487MV,Aayog Creations Bold and Beautiful' Big Number Wood Designer Wall Clock for Home Decor (30cm x30cm) (Red Bird),Aayog,0,0,0,349,0,0,73,"Saturday, February 19",1,"₹349
₹1,299 Save ₹950 (73%)"
308,B076VCK58B,"Amazon Brand - Solimo 12-inch Plastic & Glass Wall Clock - Coloured Stripes (Step Movement, Black Frame)",Amazon,1,0,0,639,4.3,820,36,"Wednesday, February 16",1,820
309,B09RH9Q8N7,"KLOFIRA Designer Stylish Metal Wall Clock for Living Room, Bedroom, Office, Kitchen, Home and Hall, Fancy Big Size Modern Wall Watch for Home Décor by KLOFIRA",KLOFIRA,1,0,0,"1,299",0,0,35,"Saturday, February 19",1,"₹1,299
₹1,999 Save ₹700 (35%)"
310,B092R4KWWM,"The Next Decor Abstract Round Metal with Silent Machine Wall Clock for Living Study Hall Dining and Bedroom (Matte Black, 15 Inches)",The,1,0,0,"1,799",4.3,230,10,"Friday, February 18",1,230
311,B09FF59KPS,R INTERNATIONAL Wooden Beautiful Wall Clock Antique Style Decoration for Home Study Living Room Office (8 inch),R,1,0,0,849,0,0,29,"Tuesday, February 22",0,"₹849
₹1,200 Save ₹351 (29%)"
312,B09MC17345,"E DEALS Marvels Spider Print Round Shaped Designer Silent Movement Wall Clock with Glass for Kids Room Home , School, Office , Living Room Small - PWC-749",E,0,0,0,349,0,0,65,"Saturday, February 19",1,"₹349
₹999 Save ₹650 (65%)"
313,B01718WT7U,Vintage Clock Double Side Iron Wall Clock / 8 Inches Size / 1 Year Warranty,Vintage,0,0,0,"1,495",4.4,"3,221",74,"Saturday, February 19",1,"3,221"
314,B07M7ZXJRR,"VIREO Plastic Kids Designer Wall Clock for Kid's Home/Living Room/Bedroom/Kitchen and Office -5105, 11.20 Inches, Design 4",VIREO,0,0,0,429,3.6,71,67,"Sunday, February 20",0,71
315,B07K88R6MG,"Oreva Abstract Plastic Wooden Look Designer Wall Clock (32 x 32 x 4 cm, Brown Red, AQ 5927)",Oreva,0,0,0,339,4.1,"1,848",0,"Thursday, February 17",0,"1,848"
316,B09Q7Y1T3Y,Rangat Craft Stylish 10 INCH Multicolor Wall Clock | Diwali Gift | Diwali Decor | Corporate Gift | Analogue Wall Clock | Kitchen Wall Clock | Living Room Wall Clock | Bedroom Wall Clock,Rangat,0,0,0,299,1.0,1,77,"Saturday, February 19",1,1
317,B07T51MK6D,Creative Creation Wood Customized Wall Clock (Multi_28 x 28 cm),Creative,0,0,0,399,4.1,38,68,"Saturday, February 19",1,38
318,B08GL2VM53,"Amazon Brand - Solimo 12-inch Plastic & Glass Wall Clock - Sober (Silent Movement, Black Frame)",Amazon,0,0,0,639,4.1,205,42,,1,205
319,B09B2G9PCH,"Oreva Plastic Wooden Look Designer Wall Clock (27.5 x 27.5 x 4.3 cm, D Wood, AQ-7297), Small",Oreva,0,0,0,345,4.1,43,0,"Sunday, February 20",0,43
320,B00X6IJDPG,RoyalsCart Floral Design Painting Wooden Antique Analog Wall Clock for Home (18 x 18 Inch) [KTWC281] (KTWC281),RoyalsCart,0,0,0,"1,749",4.3,"1,237",77,"Friday, February 18",1,"1,237"
321,B08X4T7NDN,"E DEALS Silent Movement Black Frame Printed Round Shaped Designer Plastic Wall Clock with Glass (10 Inches, Small, PWC-126)",E,0,0,0,349,3.5,21,65,"Saturday, February 19",1,21
322,B09P1PK845,"E DEALS MDF Wooden Analog Wall Clock for Home Living Room Bed Room Office Kids Room, Antique Ticking Movement Wall Clock for Home Décor, Office and Hall MDF_03",E,0,0,0,249,0,0,50,"Saturday, February 19",1,"₹249
₹499 Save ₹250 (50%)"
323,B09DX5RR67,Faiza Global Wooden Wall Clock Antique Look 12 inche,Faiza,0,0,0,"1,199",5.0,1,48,"Tuesday, February 22",0,1
324,B0965KGRRG,"CLOTIX 3D Digital @ Shape Designer Large Decorative Modern Design Big Silent Acrylic Wall Clock for Living Room, Bedroom Wall, Home and Office (Black)",CLOTIX,0,0,0,698,4.0,143,50,"Saturday, February 19",1,143
325,B09GP7NBPH,"D'CLOCK Quartz Machine for Big Size Wall Clock,Battery Operated,Clock Movement Machine with Needles and Hook 28 MM (100% Made in India)",D'CLOCK,0,0,0,259,2.8,5,44,"Saturday, February 19",0,5
326,B089LQ1V4T,Circadian Ajanta Wooden Analog Wall Clock Design for Home Hall Living Room Decor Office Kids Bedroom Stylish Ethnic Antique Decorative White Colour Peacock 36 * 36 cm (Pack of 1),Circadian,0,0,0,595,3.5,15,60,"Saturday, February 19",1,15
327,B09R1NP7W7,CRAFTSIAN Decor Metal Iron Hanging Universe TIME Wall Decor Hanging Clock for Living Room & Home Decoration [ L*W*H 54*4*92 ] Centimetre [ L*W*H 21*1.5*36 ] INCH,,0,0,0,0,0,0,0,,0,
328,B09B59FTH2,"Aayog creations Wooden Print Bird Silent Quartz Movement Wall Clock for Home Big Size Living Room Hall Bedroom Stylish Clock Without Glass (12 X 12 Inch, Black, Pink)",Aayog,0,0,0,369,3.5,90,75,"Saturday, February 19",1,90
329,B09GKQFNXM,"EFINITO Silent Movement Plastic Wall Clock Different Strokes for Home Living Room Bedroom Office (Multicolor, 12.5 Inch)",EFINITO,0,0,0,594,3.6,24,70,"Saturday, February 19",1,24
330,B07NGV6HY6,"Ajanta Quartz Glass Abstract Digital LED Rectangle Wall Clock OLC - 104 (Green, 39.6 cm x 29.6 cm x 4.5 cm)",Ajanta,0,0,0,"1,865",4.2,619,22,"Saturday, February 19",1,619
331,B09BX5CY9Y,VASTVA Antique Wooden Wall Clock for Home/Living Room/Bedroom/Kitchen Style-487,VASTVA,0,0,0,449,4.2,5,36,"Saturday, February 19",0,5
332,B0987GZN5W,"Ajanta Plastic Night Glow Radium Silent Non Ticking Wall Clock with Large Numbers (36.5 x 36.5 x 4.5 cm, Quartz, White)",Ajanta,0,0,0,"1,095",3.6,37,8,"Saturday, February 19",1,37
333,B097YNHMWX,"IndianEcraft Ajanta Mfg. Plastic Quartz Battery Operated Plastic Ticking Movement Machine with Antique Needles Hands for Wall Clock (Golden, 55x55x16mm)",IndianEcraft,0,0,0,199,4.0,46,67,"Saturday, February 19",1,46
334,B07TRLNL2Q,"Home Centre Estelle Plastic Vintage Abstract Round Wall Clock ( Golden , 30 cm x 30 cm x 4 cm )",Home,0,0,0,449,4.0,119,0,"Sunday, February 20",0,119
335,B07ZTTPL12,"Vintage Product Antique Double Sided Railway Station/Platform Analogue Iron Metal Wall Clock (Black, 8 X 8 Inch)",Vintage,0,0,0,996,4.4,395,60,"Saturday, February 19",1,395
336,B09NSVF78X,"Ajanta Wall Clock 16 Inches Vintage Wall Clock for Bedroom, Hall, Office and Drawing Room (Ivory Dial)",Ajanta,0,0,0,995,5.0,1,17,"Saturday, February 19",1,1
337,B097GV8BD7,Plastic Modern Womaniya Designer 3D DIY Wall Clock Self Adhesive Wall Sticker of Large Size DIY Frameless (Black) 10cm,Plastic,0,0,0,530,3.6,11,59,"Tuesday, February 15",0,11
338,B0974VP35Q,Nutts Black Iron 6 Inches Victoria Station Clock London Vintage Wall Clock Retro Wall Clock Double Sided Wall Clock Antique Clock (White),Nutts,0,0,0,799,3.1,7,60,"Saturday, February 19",1,7
339,B09HC8L1WQ,"President Wooden Look Round Home Fancy Big Size Wood Finish Latest Antique Design Ticking Movement Wall Clock Frame 18-inch, 28, Black",President,0,0,0,785,3.7,284,61,"Friday, February 18",1,284
340,B09BFYLZTV,ROYAL STEP DIY Wall Clock with Frameless 3D Mirror Surface Decorative Adhesive Stickers for Home Living Room Office Wall Decoration (Gold),ROYAL,0,0,0,599,3.2,31,74,"Sunday, February 20",1,31
341,B0816XT82V,"CHRONIKLE Classic Pendulum Plastic Wall Clock with Striking Movement (54 x 33 x 5.5 cm, Brown)",CHRONIKLE,0,0,0,"1,104",3.8,140,54,,1,140
342,B09NVRLYBF,"Odlora Big Size Allah Wall Clock Analogue Round (Silent Movement, 12 x 12 Inch, ALH-002)",Odlora,0,0,0,499,3.5,3,67,"Saturday, February 19",0,3
343,B076VG6LF3,"Amazon Brand - Solimo 12-inch Plastic & Glass Wall Clock - Different Strokes (Step Movement, Black Frame)",Amazon,0,0,0,639,4.3,"3,848",36,"Friday, February 18",1,"3,848"
344,B09LSGLQXG,Naturel Plastic Round Shape Flower Designer Wall Clock with Black Frame ( (2028),Naturel,1,0,0,339,0,0,74,"Tuesday, February 22",0,"₹339
₹1,329 Save ₹990 (74%)"
345,B09MM7MXZ6,"Naturel 10 inch Round Shaped Wall Clock with Glass for Home/Living Room/Bedroom/Kitchen/Office-Simpal White (Black Frame,24 cm x 24 cm x 3.5 cm)",Naturel,1,0,0,345,4.6,6,74,"Tuesday, February 22",0,6
346,B08M3B95WX,"Wooded Home™ Wooden Handcrafted Antique Decorative Wall Clock (Natural Brown, 40 x 40 cm)",Wooded,1,0,0,"1,350",3.9,17,29,"Tuesday, February 22",0,17
347,B09HN7BVM7,SANDROSE 10-inch Analogue Round Plastic Wall Clock with Black Frame (25.4 x 25.4 x 4.5 cm),SANDROSE,1,0,0,349,3.3,12,77,"Tuesday, February 22",0,12
348,B08GKZ3354,"Amazon Brand - Solimo 12-inch Contemporary Plastic & Glass Wall Clock - Designer (Silent Movement, Black Frame)",Amazon,1,0,0,639,4.3,"3,848",42,,1,"3,848"
349,B08GL2CGTH,"Amazon Brand - Solimo 12-inch Plastic & Glass Wall Clock - Kids tutor Wall Clock (Silent Movement, Black Frame)",Amazon,1,0,0,629,4.3,820,58,,1,820
350,B076VCHY3K,"Amazon Brand - Solimo 12-inch Kids' Plastic & Glass Wall Clock (Silent Movement, Black Frame)",Amazon,1,0,0,592,3.9,545,46,"Friday, February 18",1,545
351,B092TMDZ2P,"Starmoon Silent Quartz Movement Wood Wall Clock (57 x 13 cm, Brown)",Starmoon,1,0,0,"1,249",0,0,69,"Saturday, February 19",0,"₹1,249
₹3,999 Save ₹2,750 (69%)"
352,B097GV8BD7,Plastic Modern Womaniya Designer 3D DIY Wall Clock Self Adhesive Wall Sticker of Large Size DIY Frameless (Black) 10cm,Plastic,0,0,0,530,3.6,11,59,"Tuesday, February 15",0,11
353,B08ZKGQ39X,SELLY CART Acrylic Offical Neon Offical Wall Clock (Matte Black),SELLY,0,0,0,999,3.7,11,50,"Wednesday, February 23",1,11
354,B0974VP35Q,Nutts Black Iron 6 Inches Victoria Station Clock London Vintage Wall Clock Retro Wall Clock Double Sided Wall Clock Antique Clock (White),Nutts,0,0,0,799,3.1,7,60,"Saturday, February 19",1,7
355,B09HC8L1WQ,"President Wooden Look Round Home Fancy Big Size Wood Finish Latest Antique Design Ticking Movement Wall Clock Frame 18-inch, 28, Black",President,0,0,0,785,3.7,284,61,"Friday, February 18",1,284
356,B076VG6LF3,"Amazon Brand - Solimo 12-inch Plastic & Glass Wall Clock - Different Strokes (Step Movement, Black Frame)",Amazon,0,0,0,639,4.3,"3,848",36,"Friday, February 18",1,"3,848"
357,B09LT8NW2R,Naturel Plastic Round Shape Black Printed Multicolor Wall Clock with Black Frame ( 24 cm x 24 cm x 3.5 cm) (2035),Naturel,0,0,0,339,0,0,75,"Tuesday, February 22",0,"₹339
₹1,349 Save ₹1,010 (75%)"
358,B09DHL5F6C,"Vintage Product Antique Vintage Black Railway Station Double Sided Metal Wall Clock (8 Inch, Black)",Vintage,0,0,0,996,4.3,20,60,"Saturday, February 19",1,20
359,B09HH22QF1,"Efinito 12.5 Inches Wall Clock for Home Living Room Bedroom Office Hall Kids Room (Silent Movement, Black Frame) IT-123",Efinito,0,0,0,594,0,0,70,"Saturday, February 19",1,"₹594
₹1,999 Save ₹1,405 (70%)"
360,B09Q91SD44,Craftel Metal Analog Double Sided Vintage Station Roman Wall Clock (Golden_8 Inches),Craftel,0,0,0,"1,549",3.0,3,79,"Friday, February 18",1,3
361,B08W3KMFX2,"Faiza International Wooden Vintage Look Wall Clock (Brown, 6 Inch, Small)",Faiza,0,0,0,786,4.2,6,21,"Tuesday, February 22",0,6
362,B091FLC9Z2,"The Next Decor Metal Heavy Analog Wall Clock with Silent Sweep Noiseless Technology Wall Decor for Home and Office (Matte Black, 15 Inch)",The,0,0,0,"1,799",4.4,19,10,"Friday, February 18",1,19
363,B09DWH4S2S,"VASTVA Peacock Wall Wooden Antique Designer Wooden 13 Inch Wall Clock for Home, Living Room, and Office Fancy Big Size-WC-520",VASTVA,0,0,0,449,4.0,3,55,"Saturday, February 19",0,3
364,B09MB54YSB,Naturel Plastic Round Shape Black Printed Multicolor Wall Clock with Black Frame ( 24 cm x 24 cm x 3.5 cm) (1083),Naturel,0,0,0,299,2.9,6,78,"Tuesday, February 22",0,6
365,B09DWGSJWX,"VASTVA Dragon Peacock Antique Designer Wooden 14 Inch Wall Clock for Home, Living Room, and Office Fancy Big Size-WC-512",VASTVA,0,0,0,449,3.4,15,55,"Saturday, February 19",0,15
366,B09PZ1QQ4W,Squar Round Shape Wall Clock with Glass for Home/Kitchen/Living Room/Bedroom/Office-Golden and Dark Blue (24 cm x 24 cm 3.4 cm),Squar,0,0,0,299,0,0,79,"Tuesday, February 22",0,"₹299
₹1,400 Save ₹1,101 (79%)"
367,B093HCN49Z,Elica Home and Office Designer Plastic Analog Wall Clock (Wood),Elica,0,0,0,545,3.9,81,64,"Friday, February 18",1,81
368,B09Q94LC3J,"Morden Frameless 3D DIY Wall Clock, Big Size MDF Geometry Sticker Numbers Wall Clock Self Adhesive for Living Room Bedroom Office, School and Home DIY-MDF-CLOCK-02",Morden,1,0,0,599,0,0,50,"Saturday, February 19",1,"₹599
₹1,199 Save ₹600 (50%)"
369,B096MCQDHD,Home Decor Instrument Antique Style Wooden Wall Clock ( 8 inch ),Home,1,0,0,700,4.6,3,63,"Tuesday, February 22",0,3
370,B09RH8FQYQ,"KLOFIRA Stylish Big Size Metal Wall Clock for Home, Office , Kitchen, Bed Room ( KLOFIRA )",KLOFIRA,1,0,0,"1,299",0,0,35,"Saturday, February 19",1,"₹1,299
₹1,999 Save ₹700 (35%)"
371,B0967RXQ6G,Delight Enterprises Wooden Clock Antique Look 12 inches,Delight,1,0,0,999,3.7,22,45,"Tuesday, February 22",0,22
372,B07MKK78YC,"Oreva Round Plastic Analog Abstract Wall Clock (28 cm x 28 cm x 3.9 cm, D Wood, AQ-1457)",Oreva,0,0,0,425,4.0,84,0,"Sunday, February 20",0,84
373,B08GL1DNV7,"Amazon Brand - Solimo 12-inch Contemporary Plastic & Glass Wall Clock - Designer (Silent Movement, Black Frame)",Amazon,0,0,0,639,4.2,542,57,,1,542
374,B08GKZZKPY,"Amazon Brand - Solimo 12-inch Plastic & Glass Wall Clock - Colorful Rangoli (Silent Movement, Black Frame)",Amazon,1,0,0,629,4.1,"2,389",43,"Thursday, February 17",1,"2,389"
375,B09N7RHFKC,Sandrose 10 inch Plastic Wall Clock for Home and Office Decor Living Room Bedroom Hall - Color Rock Stone Print (24 x 24 x 4 cm),Sandrose,1,0,0,299,0,0,80,"Tuesday, February 22",0,"₹299
₹1,499 Save ₹1,200 (80%)"
376,B076VF41DV,"Amazon Brand - Solimo 12-inch Plastic & Glass Wall Clock - Checkered (Silent Movement, Black Frame)",Amazon,1,0,0,527,4.0,"2,535",52,"Thursday, February 17",1,"2,535"
377,B09QJRZBWB,"Shivik Industries Retro Metal ( Iron ) Wall Clock , Multicolour ( RED , Black , White, Silver, Grey) Size 40X60 cm ,Weight 1.5 KG",Shivik,1,0,0,"2,699",0,0,46,"Tuesday, February 22",0,"₹2,699
₹4,999 Save ₹2,300 (46%)"
