,asin,title,brand,Sponsored,Best Seller,Amazon's Choice,Price,Rating,NoofRatings,Discount,Delivery,Prime Delivery,base
119,B0937FX1QX,"RIVUGJA Mini Handheld Vacuum Cordless Keyboard Vacuum Cleaner with LED Light, Pet Hair Vacuum with Powerful Cyclonic, Portable USB Vacuum Cleaner for Car and Home",RIVUGJA,0,0,0,"1,249",1.0,1,65,"Sunday, February 13",1,1
120,B07DS6GBBY,"Osmon OS 1400BL by American Micronic,1400 Watts Bagless Cyclonic Vacuum Cleaner with HEPA Filter, 25Kpa suction (Red & Black)",Osmon,1,0,0,"4,486",4.1,236,30,"Friday, February 11",1,236
121,B088XJ89F8,"AmazonBasics Vacuum Cleaner with Power Suction, Low Sound, High Energy Efficiency and 2 Years Warran & CW190423D_EU Microfiber Cleaning Cloth - 222 GSM (Pack of 6), Multicolor Combo",AmazonBasics,1,0,0,"3,908",3.9,3,33,,1,3
122,B08JCQ475H,"INALSA Vacuum Cleaner Commercial/ Industrial Wet and Dry Ultra WD21 -1600W with 3 in 1 Multifunction Wet/Dry/Blowing|Hepa Filteration & 21KPA Powerful Suction,(Black/Blue)",INALSA,0,0,0,"5,890",3.5,217,62,"Friday, February 11",1,217
123,B09717HPD7,Miss Queen Multi-Functional Portable Blowing and Sucking Dual Purpose Handheld Car Electric Dust Dry Cleaning Multipurpose Vacuum Cleaner,Miss,0,0,0,"2,145",5.0,2,46,"Sunday, February 13",1,2
124,B089QNL61F,"Croma 60 Watts Car Vacuum Cleaner with HEPA Filter and 3 Multi Purpose Accessories, 2 Years Warranty (CRAV0058, Black and Grey)",Croma,0,0,0,"1,990",4.2,11,20,"Sunday, February 13",1,11
125,B082XDXHD4,LIONFOR Multi-Functional Home and Kitchen Electric Vacuum Cleaner Noise Cancellation Blowing and Sucking Dual Purpose (JK-8) Hand-held Vacuum Cleaner (Red),LIONFOR,0,0,0,"1,899",3.8,13,24,"Sunday, February 13",1,13
126,B08CL2WQKT,BLACK+DECKER WDBDS20 20-Litre 1600 Watt 16 KPa High Suction Wet and Dry Stainless Steel Vacuum Cleaner and Blower with HEPA Filter and Reusable Dustbag (Red),BLACK+DECKER,0,0,0,"8,707",4.1,"2,370",38,"Friday, February 11",1,"2,370"
127,B09BZKMLYF,"Roboson C3 Robot Vacuum Cleaner, 2-in-1 Sweeping and Mopping, 2000Pa Strong Suction With Quiet and Max Mode,600 ml Dustbox and 350 ml Electronic Watertank, Gyroscopic Navigation System,1 Year Warranty",Roboson,0,0,0,"17,999",5.0,1,33,"Sunday, February 13",1,1
128,B09ND86KPH,"SCILLA Vacuum Cleaner |Multi-Functional Portable Vacuum Cleaner for Home, Office Garage Sucking Dual Purpose, Home Blowing (220-240 V, 50 HZ, 1000 W) Multicolor",SCILLA,0,0,0,"1,799",0,0,33,"Sunday, February 13",1,"₹1,799
₹2,699 Save ₹900 (33%)"
129,B08THWLNJ7,"Euroclean Vacuum Cleaner Spray jar Model (Black, White)",Euroclean,0,0,0,460,3.2,26,23,"Saturday, February 12",1,26
130,B00RIH9DK6,American MICRONIC - AMI-VC1-10DX- 1000 Watt (1200w Max) Vacuum Cleaner 100% Copper Motor 19 Kpa-AMI-VC1-10Dx-Blue,American,1,0,0,"3,501",3.9,639,30,"Sunday, February 13",1,639
131,B09CLGNCNG,"Geek Schoner A10 1400W Cyclonic Bagless Vacuum Cleaner for Home with 20 kPa Strong Suction Power, 3L Dust Container, 8M Power Cord, HEPA Filter, Blue",Geek,1,0,0,"4,749",4.3,107,41,"Tuesday, February 8",1,107
132,B08LF7KL5J,ROIDMI Xiaomi Eco-System F8 Fastest Charging Storm Cordless Vacuum Cleaner (1.3kg Weight),ROIDMI,1,0,0,"17,999",4.0,13,33,"Tuesday, February 15",1,13
133,B08SJRWD79,BRAMHANI ENTERPRISE Power Vacuum Cleaner for Car Multipurpose Vacuum Cleaner Powerful Portable and High Power 12V Wet and Dry Multipurpose use.,BRAMHANI,1,0,0,599,2.8,3,40,"Sunday, February 13",0,3
134,B07CG5PJ9V,Prestige Wet&Dry Vacuum Cleaner Typhoon -05,Prestige,0,0,0,"4,690",3.8,"4,065",41,"Tuesday, February 8",1,"4,065"
135,B082PB3R9T,"Inalsa Bagless Cordless Vacuum Cleaner Kardia with Hepa Filtration System and Cyclone System| 1L Dust Collector Capacity| Includes Motorized Floor Brush, (White/Grey)",Inalsa,0,0,0,"6,704",3.1,60,55,"Tuesday, February 8",1,60
136,B09P8MCFYB,Revin Enterprise 2 in 1 Vacuum Cleaner 120w||Handheld Vacuum Car Cleaner Air Duster Wireless Rechargeable Home Pet Hair Vacuum with Powerful Cyclonic|| Portable USB Vacuum Cleaner.,Revin,0,0,0,"1,099",0,0,52,"Sunday, February 13",1,"₹1,099
₹2,299 Save ₹1,200 (52%)"
137,B09GRCLF26,"HOLYZON Handheld Vacuum Car Cleaner Air Duster Wireless Rechargeable Home Pet Hair Vacuum with Powerful Cyclonic, Portable USB Vacuum Cleaner with LED Light for Home (2 in 1 Vaccum Cleaner 120w)",HOLYZON,0,0,0,"1,199",0,0,48,"Sunday, February 13",1,"₹1,199
₹2,299 Save ₹1,100 (48%)"
138,B07BK2YG9N,"JIYA ENTERPRISE Dual Purpose Plastic Vacuum Cleaner Blowing and Sucking (220-240 V, 50 HZ, 1000 W, Multicolour)",JIYA,0,0,0,"1,799",3.8,21,28,"Sunday, February 13",1,21
139,B09J587TJH,"MG MART® Mini Handheld Vacuum Cordless,Led Light, Pet Hair Vacuum Powerful Cyclonic, Portable Keyboard Cleaner Vacuum USB Vacuum Cleaner for Car and Home",MG,0,0,0,"1,349",0,0,33,"Sunday, February 13",1,"₹1,349
₹1,999 Save ₹650 (33%)"
140,B09FYCH1GZ,"AGARO Royal Upright Vacuum Cleaner, Swivel Steering, 2L Bagless Bin, Light Weight, Pet Hair, Home, Office Use, Grey and Red, Medium (33606)",AGARO,0,0,0,"4,499",4.4,12,55,"Sunday, February 13",1,12
141,B00IY90THS,Eureka Forbes Trendy Wet and Dry DX1150-Watt Powerful Suction and Blower Function Vacuum Cleaner (Black and Red),Eureka,0,0,0,"7,940",3.9,"1,134",19,"Sunday, February 13",1,"1,134"
142,B08W32FKWT,"Amtidy A590 Local Home Voice Robotic Vacuum with Light, Robot Vacuum Cleaner with WiFi APP Control, Auto Recharging, Compatible with Alexa/Google Asisstant.",Amtidy,1,0,0,"7,999",3.4,14,70,"Sunday, February 13",1,14
143,B08BTLXTJR,"AmazonBasics Vacuum Cleaner with Power Suction, Low Sound, High Energy Efficiency & 2 Yrs Warranty + AmazonBasics Cylinder Bagless Vacuum Cleaner with Power Suction, Low Sound, High Energy Efficiency",AmazonBasics,1,0,0,"7,498",0,0,34,,1,"₹7,498
₹11,400 Save ₹3,902 (34%)"
144,B092R48XXB,"Mi Robot Vacuum-Mop P, 2100 Pa Strong Suction Robotic Floor Cleaner with 2 in 1 Mopping and Vacuum, Intelligent floor mapping (LDS Navigation), App Control (WiFi Connectivity, Google Assistant)",Mi,0,1,0,"24,999",4.2,"1,068",17,"Friday, February 11",1,"1,068"
145,B077481D45,KENT - KSL-612 Wet and Dry Vacuum Cleaner 1200-Watt (Metallic Silver),KENT,0,0,0,"5,999",4.0,675,40,"Wednesday, February 9",1,675
146,B07BNQXQK4,Wet & Dry Vacuum Cleaner (Makage-15),Wet,0,0,0,"11,001",5.0,1,35,"Sunday, February 13",0,1
147,B09DXD6CF8,"CloudShopz 0295 USB Computer Mini Vacuum Cleaner, Car Vacuum Cleaner (Pack of 2)",CloudShopz,0,0,0,399,0,0,50,"Thursday, February 10",0,"₹399
₹799 Save ₹400 (50%)"
148,B07VHL72XM,"ECOVACS Deebot 500 Robotic Vacuum Cleaner with App & Voice Control, Strong Suction and Multiple Cleaning Modes, Self-Charging for Carpets & Hard Floors,Work with Alexa (Black)",ECOVACS,0,0,0,"11,800",3.9,"1,382",58,"Sunday, February 13",1,"1,382"
149,B09B7GQVFC,"(Renewed) Viomi SE Robot Vacuum Cleaner and Mop with Intelligent Laser Navigation, 2200Pa Strong Suction, 200ml Smart Water Tank, 3200mAH Long Lasting Battery, Works with MiHome App (White)",(Renewed),0,0,0,"15,999",4.6,18,27,"Friday, February 11",1,18
150,B08887ZJN2,"INSE Cordless Vacuum Cleaner, 23Kpa 250W Powerful Suction Stick Vacuum Cleaner, Up to 45min Runtime 2500mAh Rechargeable Battery, 10-in-1 Lightweight Vacuum for Carpet Hard Floor Pet Hair Car, Blue S6",INSE,0,0,0,"13,590",4.0,"3,124",35,"Sunday, February 13",1,"3,124"
151,B01JM0XW1W,Eureka Forbes Super Clean Handheld Vacuum Cleaner (Red/Black),Eureka,0,0,0,"3,339",3.7,"2,771",7,"Tuesday, February 15",1,"2,771"
152,B088ZTSG9R,"Osmon Powerspeed -OS 26UBL by American Micronic, Powerful Upright Bagless Multi Purpose Vacuum Cleaner for Home 100% Copper Motor 19 KPa Suction (Red & Black)",Osmon,1,0,0,"6,541",3.8,128,35,"Friday, February 11",1,128
153,B00U4W6DA0,American MICRONIC - AMI-VC1-10DX- 1000 Watt (1200w Max) Imported Vacuum Cleaner 100% Copper Motor 19 Kpa (Red),American,1,0,0,"3,501",3.9,528,30,"Friday, February 11",1,528
154,B096SJNKGL,iGRiD Handheld Cordless Vacuum Cleaner | Powerful Suction | Lithium Battery | Stainless Steel HEPA Filter | Cyclone Technology | Light Weight| Black| IG1025B |,iGRiD,1,0,0,"7,189",3.8,29,20,"Tuesday, February 8",1,29
155,B09QT31J5L,Haden Bag Less Cylinder Vacuum Cleaner (Black),Haden,1,0,0,"5,499",0,0,45,"Sunday, February 13",0,"₹5,499
₹9,999 Save ₹4,500 (45%)"
156,B09GFXVSB9,Jugaadify Portable Cordless Mini Desktop Vacuum Desk Dust Cleaner/Dust Sweeper for Home Office Keyboard & Laptop (Blue),Jugaadify,0,0,0,849,4.0,1,43,"Friday, February 11",1,1
157,B01N3KN011,"Panasonic MC-DL201B14B Plastic Vacuum Cleaner, medium",Panasonic,0,0,0,"3,490",4.3,12,9,"Tuesday, February 15",1,12
158,B082PB6B8N,"Inalsa Corded Bagless Vacuum Cleaner Xander with Hepa Filtration System and Powerful Cyclone System| 1L Dust Collector Capacity, (Red/Grey)",Inalsa,0,0,0,"3,559",3.6,153,55,"Tuesday, February 8",1,153
159,B09JK97B5D,"Aepigo Multi-Functional Portable Vacuum Cleaner for Home, Office Garage Sucking Dual Purpose (JK-8), (220-240 V, 50 HZ, 1000 W)",Aepigo,0,0,0,0,5.0,2,0,,0,2
160,B08V88KQJV,"Keviou 1000 W Vacuum Cleaner Dual Purpose (Blowing and Sucking) for Home Vacuums 220-240 V, 50 Hz- Standard Size",Keviou,0,0,0,"1,999",5.0,1,33,"Sunday, February 13",1,1
161,B09PN2DFKX,"Aetrius Handheld Vacuums Cordless, 120W Handheld Vacuum Cleaner with Powerful Suction, Portable Rechargeable Car Vacuum Cleaner, Lightweight Wet Dry Vacuum for Home, Office, Car and Pet",Aetrius,0,0,0,"2,299",0,0,54,"Sunday, February 13",0,"₹2,299
₹4,999 Save ₹2,700 (54%)"
162,B08YWLVPHS,"ILIFE V5s Pro with App, WiFi, Smart 2-in-1 Robotic Vacuum Cleaner and Water Mopping,Alexa & Google Home Enabled, Slim, Automatic Self-Charging, Home, Schedule, Cliff Detection (V5x)",ILIFE,0,0,0,"15,900",4.0,"7,850",41,"Tuesday, February 8",1,"7,850"
163,B07ZCW9GPW,"Eufy HomeVac H11, Cordless Handheld Vacuum Cleaner, Ultra-Lightweight 1.2lbs, 5500Pa Suction Power, USB Charging, for Home Cleaning |Black",Eufy,0,0,0,"3,399",3.9,"1,525",15,"Saturday, February 12",1,"1,525"
164,B08F7FZ5WX,"Proscenic P11 Cordless Vacuum, Stick Vacuum with 25000pa Powerful Suction, Touch Screen, Removable Battery, 3 Adjustable Suction Modes for Hard Floor, Carpet, Pet Hair",Proscenic,1,0,0,"28,990",4.2,"2,069",3,"Friday, February 11",1,"2,069"
165,B092SBSY1J,"Hanutech Hot Air Blower with Vacuum Dust Collecting Bag, 1100 Watt/Copper Rotor/RPM 16000/Blow Rate 3.3 Meter/Minute",Hanutech,1,0,0,"1,739",0,0,13,"Saturday, February 12",1,"₹1,739
₹1,999 Save ₹260 (13%)"
166,B09815SW5Y,"CHECK AND SHOP Mini Vacuum Cleaner, Portable Cartoon Animal Shaped Table Vacuum Cleaner Desk Dust Cleaning Tool",CHECK,0,0,0,549,0,0,58,"Saturday, February 12",0,"₹549
₹1,299 Save ₹750 (58%)"
167,B08PCCCQQY,"Viomi SE Robot Vacuum Cleaner and Mop with Intelligent Laser Navigation, 2200Pa Strong Suction, 200ml Smart Water Tank, 3200mAH Long Lasting Battery, Works with MiHome App (White)",Viomi,0,0,0,"21,990",4.2,596,45,"Friday, February 11",1,596
168,B09NQ8RNC2,PRACHAND Multi-Functional Portable Handheld Car Electric Dust Dry Cleaning Multipurpose Stainless Steel Vacuum Cleaner,PRACHAND,0,0,0,"1,999",0,0,50,"Sunday, February 13",1,"₹1,999
₹3,999 Save ₹2,000 (50%)"
169,B08CL15MXL,"BLACK+DECKER BSV2020G-B1 Power Series Cordless Stick Vacuum Cleaner with Floorhead LEDs, For Cleaning Hard Floors, Area Rugs & Carpet, 20V Li-ion 40 AW, 1 Year Warranty",BLACK+DECKER,0,0,0,"12,443",3.7,86,36,"Tuesday, February 8",1,86
170,B08CH3QWHC,"ECOVACS DEEBOT U2 Pro Robotic Vacuum Cleaner and OZMO Mopping,Large Dust Bin & Water Tank with App & Voice Control,4-Stage Cleaning System for Carpets & Hard Floors",ECOVACS,0,0,0,"17,900",3.6,"1,583",71,"Sunday, February 13",1,"1,583"
171,B08911MN5H,"Osmon OS 2000BL by American Micronic- 2000 Watts Bagless Cyclonic Vacuum Cleaner with HEPA Filter, 30Kpa Suction (Purple & Black)",Osmon,0,0,0,"5,591",4.3,134,44,"Friday, February 11",1,134
172,B08KTCQQNX,"Viomi A9 Handheld Wireless Vacuum Cleaner, 23kPa Suction, 60 mins Worktime, Clean 2150sq.ft. in Single Charge, 2500mAh Battery, 400ml Dust Capacity, Gray and Blue",Viomi,0,0,0,"17,990",4.0,3,40,"Saturday, February 12",1,3
173,B07XLXGC2K,Eureka Forbes Multi Clean Vacuum Cleaner,Eureka,0,0,0,"3,299",3.9,550,40,"Friday, February 11",1,550
174,B086M9R2YH,"Eufy by Anker HomeVac S11 Go Lightweight Cordless 120AW Suction Power Stick-Vacuum Cleaner with Detachable Battery (Black, Deep Clean Carpet to Hard Floor)",Eufy,1,0,0,"14,999",3.9,91,40,"Monday, February 14",1,91
175,B07NCH7S4B,"AMERICAN MICRONIC INSTRUMENTS - Vacuum Cleaner with Variable Speed Control, 100% Copper Motor 24 KPa Suction (AMI-VCC-1400WDx- 1400 Watts, Yellow & Gray)",AMERICAN,1,0,0,"4,286",3.7,181,39,"Friday, February 11",1,181
176,B09PD8GJ81,CLEANGEN 130P,CLEANGEN,1,0,0,"19,000",0,0,17,"Wednesday, February 9",0,"₹19,000
₹23,000 Save ₹4,000 (17%)"
177,B09RKB9TWW,"DishanKart Portable Mini Cordless Vacuum Cleaner, Car Wireless Vacuum Cleaner, 7000PA Powerful Cyclone Suction Home Portable Handheld Vacuum Cleaner (Wireless Vacuum Cleaner)",DishanKart,1,0,0,"2,499",0,0,50,"Wednesday, February 9",1,"₹2,499
₹4,999 Save ₹2,500 (50%)"
178,B09PNFL6QL,"REMAXX Mini Portable Desktop Vacuum Cleaner | Cordless Table Dust Sweeper Design for Cleaning Desktop, Crumbs, Computer Keyboard, Pet Hairs",REMAXX,0,0,0,599,0,0,74,"Monday, February 14",0,"₹599
₹2,299 Save ₹1,700 (74%)"
179,B096SJNKGL,iGRiD Handheld Cordless Vacuum Cleaner | Powerful Suction | Lithium Battery | Stainless Steel HEPA Filter | Cyclone Technology | Light Weight| Black| IG1025B |,iGRiD,0,0,0,"7,189",3.8,29,20,"Tuesday, February 8",1,29
180,B078HL7QMB,"JM SELLER New Vacuum Cleaner Blowing and Sucking Dual Purpose, 220-240 V, 50 HZ, 1000 W",JM,0,0,0,"1,999",3.9,272,33,"Sunday, February 13",1,272
181,B06X9P8144,Eureka Forbes Jazz Multipurpose Vacuum Cleaner with Suction & Blower.,Eureka,0,0,0,"4,244",3.6,160,23,"Sunday, February 13",1,160
182,B07SCP37ZC,"Balzano Wet and Dry Professional K-606 1600 Watt Vacuum Cleaner with Blower Function, 25-litres (Silver)",Balzano,0,0,0,"6,290",3.9,461,30,"Friday, February 11",1,461
183,B09GFW8QPX,Jugaadify Portable Cordless Mini Desktop Vacuum Desk Dust Cleaner/Dust Sweeper for Home Office Keyboard & Laptop (Black),Jugaadify,0,0,0,849,2.9,3,43,"Friday, February 11",1,3
184,B07GFQ27PY,"ILIFE V80 Robotic Vacuum Cleaner, Smart 2-in-1 Dry & Wet, Automatic Self-Charging, Anti Stuck Side Brush, Schedule, Cliff Detection with Electronically controlled Water Tank",ILIFE,0,0,0,"19,900",4.3,924,41,"Tuesday, February 8",1,924
185,B08RBYC9Y2,"Easymart 220-240 V, 50 Hz, 1000 W Vacuum Cleaner for Home Blowing and Sucking Dual Purpose Vacuum Cleaner (Standard Size, Red)",Easymart,0,0,0,"1,999",3.8,101,60,"Sunday, February 13",1,101
186,B08D9D98B1,"Tineco Floor One S3 Smart Cordless Broom Vacuum Cleaner, Wet and Dry Function, Double Tank, Self-Cleaning, LED Display, Application Control, Powerful, Light and Silent",Tineco,1,0,0,"27,900",4.3,79,53,"Sunday, February 13",1,79
187,B07ZCW9GPW,"Eufy HomeVac H11, Cordless Handheld Vacuum Cleaner, Ultra-Lightweight 1.2lbs, 5500Pa Suction Power, USB Charging, for Home Cleaning |Black",Eufy,1,0,0,"3,399",3.9,"1,525",15,"Saturday, February 12",1,"1,525"
188,B08WXQY135,AGARO ICON 1800Watt Bagless Vacuum Cleaner with Suction Controller and 1.5L Dust Collector (Red/Black),AGARO,0,0,0,"4,999",3.2,7,44,"Saturday, February 12",1,7
189,B07L7V2SPP,"Shopmart Plastic Vacuum Cleaner for Home and Car Blowing and Sucking, 220-240 V, 50 HZ, 1000W, Medium, Red (Red)",Shopmart,0,0,0,"1,999",4.5,17,13,"Sunday, February 13",1,17
190,B082PGMVD2,"ILIFE A9s Robot Vacuum Cleaner Replacement Set, Vibrating Water Tank, 10.1 fl oz (300 ml), Mop (Pack of 2)",ILIFE,0,0,0,"2,150",3.8,15,28,"Tuesday, February 15",1,15
191,B098B218SH,Verilux® ILIFE Robot Vacuum Cleaner Accessories Replacement 3 Pcs Mop Cloth Pads for ILIFE V8S X750 X785 Robotic Vacuum Cleaner,Verilux®,0,0,0,369,5.0,2,23,"Sunday, February 13",1,2
192,B088ZTSG9R,"Osmon Powerspeed -OS 26UBL by American Micronic, Powerful Upright Bagless Multi Purpose Vacuum Cleaner for Home 100% Copper Motor 19 KPa Suction (Red & Black)",Osmon,0,0,0,"6,541",3.8,128,35,"Friday, February 11",1,128
193,B09PNJS81B,"Credicus Handheld Vacuums Cordless, 120W Handheld Vacuum Cleaner with Powerful Suction, Portable Rechargeable Car Vacuum Cleaner, Lightweight Wet Dry Vacuum for Home, Office, Car and Pet",Credicus,0,0,0,"2,299",0,0,54,"Sunday, February 13",1,"₹2,299
₹4,999 Save ₹2,700 (54%)"
194,B08X8LLNKG,"SAGUN Mini Vacuum Desktop Cleaner, Portable Desktop Crumb Vacuum Sweeper, Handheld Cordless Vacuum Cleaning for Office Car Home Keyboard, White",SAGUN,0,0,0,398,3.0,8,67,"Saturday, February 12",1,8
195,B07PQSZLRY,Haden Bagless Cylinder Vacuum Cleaner (Black),Haden,0,0,0,"4,999",3.6,4,50,"Sunday, February 13",1,4
196,B098S5YDHP,"Koonie Compressed Air Duster, Air Blower & Vacuum 2-in-1, Mini Cordless Vacuum Cleaner for Computer, Keyboard, Cameras, Fans, Cars, Powerful 60000 RPM, Replaces Compressed Air Cans",Koonie,1,0,0,"8,672",4.5,14,0,"Monday, February 14",1,14
197,B07SWS82L6,"AGARO Regent 1600-Watts Dry Vacuum Cleaner with 20 kPa Suction Power, 3 litres dust Bag, Variable Power Settings (Black)",AGARO,1,0,0,"5,999",4.0,62,14,"Sunday, February 13",1,62
198,B092VBCYVD,"INSE Cordless Vacuum Cleaner Powerful Suction, 6-in-1 Lightweight Handheld Stick Vacuum, Up to 45 Mins Runtime, with Quiet Rechargeable Battery for Home Hard Floor Carpet Pet Hair Car - N5 Light Blue",INSE,1,0,0,"8,490",3.8,56,35,"Sunday, February 13",1,56
199,B01D9QV1G8,Euroclean Forbes Prime Vacuum Cleaner,Euroclean,1,0,0,"8,000",4.2,5,20,"Saturday, February 12",0,5
200,B07F7B5MWQ,"American MICRONIC - AMI-VCD15-1600WDx- 15 Litre Wet & Dry Vacuum Cleaner with Blower & HEPA Filter, 1600 Watts 100% Copper Motor, 28 KPa Suction with Washable dust Bag (Red/Black)",American,0,0,0,"7,486",4.2,799,24,"Sunday, February 13",1,799
201,B08NG12PMG,"INSE S6P Cordless Vacuum Cleaner with 2 Batteries, Up to 80min Run-time Rechargeable Stick Vacuum, Lightweight Powerful Suction Handheld Vac , Blue",INSE,0,0,0,"16,990",4.1,764,35,"Sunday, February 13",1,764
202,B07P1GFTG4,"BROGBUS Multi-Functional Portable Vacuum Cleaner for Home, Office Garage Sucking Dual Purpose (JK-8), (220-240 V, 50 HZ, 1000 W)",BROGBUS,0,0,0,"2,099",4.2,983,30,"Sunday, February 13",1,983
203,B07D2C27N7,"BLACK+DECKER NV1200AV Powerful Dustbuster Car Vacuum Cleaner (12V, Red and Black)",BLACK+DECKER,0,0,0,"2,497",3.5,76,0,"Tuesday, February 8",1,76
204,B00RIH9DK6,American MICRONIC - AMI-VC1-10DX- 1000 Watt (1200w Max) Vacuum Cleaner 100% Copper Motor 19 Kpa-AMI-VC1-10Dx-Blue,American,0,0,0,"3,501",3.9,639,30,"Sunday, February 13",1,639
205,B00B1AO82O,"Panasonic MC-CG303R14C 1.2-Litre Canister Vacuum Cleaner (Red), Standard",Panasonic,0,0,0,"5,670",4.2,463,19,"Saturday, February 12",1,463
206,B09H6TBN8C,Aimex Wet and Dry Professional 1500 Watt Vacuum Cleaner with Blower Function (25 Litre),Aimex,0,0,0,"4,999",3.8,84,38,"Monday, February 14",1,84
207,B09MNF97LD,"HEATHER Multi-Functional Portable Vacuum Cleaner Blowing and Sucking Dual Purpose 220-240 V, 50 HZ, 1000 W",HEATHER,0,0,0,"1,649",0,0,41,"Sunday, February 13",1,"₹1,649
₹2,799 Save ₹1,150 (41%)"
208,B07VBS92ZR,Miss Queen New Multi-Functional Portable Blowing and Sucking Dual Purpose Handheld Car Electric Dust Dry Cleaning Multipurpose Stainless Steel Vacuum Cleaner,Miss,1,0,0,"2,149",1.0,1,46,"Sunday, February 13",1,1
209,B09QQDB7TG,"Qiwa® Robotic Vacuum + Mop Cleaner, 1600pa Strong Suction, Cleans Pet Hair, Dust, Paper Scraps and Rice, Quiet, APP Remote Control, Anti-Collision, Suitable for Hard Floors",Qiwa®,1,0,0,"9,999",0,0,50,"Saturday, February 12",1,"₹9,999
₹19,999 Save ₹10,000 (50%)"
210,B083RBLJ9V,"RUilY® ABS, PP Handheld Cordless Rechargeable; Low Noise; Light and Portable; Lithium; Lightweight Vacuum Cleaner with Quick Charge for Home/Car Cleaning (Black)",RUilY®,0,0,0,"2,899",3.8,146,41,"Saturday, February 12",1,146
211,B08WXPTG1N,AGARO Empire 2200Watt Bagless Vacuum Cleaner with 3L Dust Collector (Orange/Ash),AGARO,0,0,0,"4,690",3.9,31,41,"Sunday, February 13",1,31
212,B071XCK51Q,"Maharsh enterprise 220-240 V, 50 Hz, 1000 W Blowing and Sucking Dual Purpose Vacuum Cleaner (Standard size, Red)",Maharsh,0,0,0,"1,860",3.7,"1,462",38,"Sunday, February 13",0,"1,462"
213,B08J952R74,"KARCHER VC 4i Cordless Plus *SEA Cordless Vacuum Cleaner, White, 1 Pack",KARCHER,0,0,0,"22,200",3.9,21,26,"Friday, February 11",1,21
214,B07GYW3NJ5,"Eureka Forbes Handy Clean 0.8-litres, 600Watts, Stick Vacuum Cleaner (Black)",Eureka,0,0,0,"2,999",3.5,177,40,"Friday, February 11",1,177
215,B07L74N213,LAFILLETTE LALA Life Handheld Powerful Suction Low Noise Dust Collector Home Rod Aspirator Swipe Vacuum Cleaner for Carpet,LAFILLETTE,0,0,0,"1,790",3.3,10,49,"Sunday, February 13",1,10
216,B072F7RGHW,Panasonic MC-CL163RL4X 2000W 3.0L Canister Vacuum Cleaner with HEPA Filter,Panasonic,0,0,0,"7,697",4.2,70,23,"Tuesday, February 8",1,70
217,B00JGHF9LI,Karcher WD 4 Wet and Dry Vacuum Cleaner (Yellow and Black),Karcher,0,0,0,"9,999",4.0,187,41,"Friday, February 11",1,187
218,B08MF8N8SD,"eufy by Anker, RoboVac G30 Hybrid, 2-in-1 Robot Vacuum, Mop and Sweep with Smart Dynamic Navigation 2.0, 2000Pa Suction, Wi-Fi, Boundary Strips",eufy,1,0,0,"19,999",4.3,274,50,"Monday, February 14",1,274
219,B01LX04EFO,"XTRA POWER XP-VC-20 L Vacuum Cleaner, Red",XTRA,1,0,0,"4,750",1.0,1,31,"Wednesday, February 16",0,1
220,B09NPS3ZGB,"Bletilla Multi-Functional Portable Vacuum Cleaner Blowing and Sucking Dual Purpose, 220-240 V, 50 HZ, 1000 W (Multicolor)",Bletilla,1,0,0,"1,799",0,0,28,"Sunday, February 13",1,"₹1,799
₹2,499 Save ₹700 (28%)"
221,B09PNJS81B,"Credicus Handheld Vacuums Cordless, 120W Handheld Vacuum Cleaner with Powerful Suction, Portable Rechargeable Car Vacuum Cleaner, Lightweight Wet Dry Vacuum for Home, Office, Car and Pet",Credicus,1,0,0,"2,299",0,0,54,"Sunday, February 13",1,"₹2,299
₹4,999 Save ₹2,700 (54%)"
222,B09FTF5DW4,"OLAHRAGA 2 in 1 Lightweight, 500W, Upright Stick Vacuum Cleaner for Home, Mini Corded Handheld Vacuum for Car, Ideal for Floor, Pet Hair, Sofa, Window, Car (3.5M Cord Length)",OLAHRAGA,0,0,0,"1,799",3.1,8,67,"Sunday, February 13",1,8
223,B0957VCKQY,"Prestige CleanHome Typhoon 11 Bagless Vacuum Cleaner, 1600 Watts",Prestige,0,0,0,"5,500",2.4,15,35,"Friday, February 11",1,15
224,B08NF3K84P,Smiledrive Window Vacuum Cleaner Handheld Rechargeable Glass Mirror Cleaning Wiper Machine - Yellow,Smiledrive,0,0,0,"2,299",0,0,34,"Sunday, February 13",1,"₹2,299
₹3,499 Save ₹1,200 (34%)"
225,B09D9NQLD9,"TIEXA® Multi-Functional Portable Vacuum Cleaner Blowing and Sucking Dual Purpose (JK-8), 220-240 V, 50 HZ, 1000 W",TIEXA®,0,0,0,"1,799",4.7,7,28,"Sunday, February 13",1,7
226,B098S5YDHP,"Koonie Compressed Air Duster, Air Blower & Vacuum 2-in-1, Mini Cordless Vacuum Cleaner for Computer, Keyboard, Cameras, Fans, Cars, Powerful 60000 RPM, Replaces Compressed Air Cans",Koonie,0,0,0,"8,672",4.5,14,0,"Monday, February 14",1,14
227,B07NZV15ZR,"Mamibot Robot Vacuum Sweeping and Mopping 2in1 Vacuum Cleaner with 2800 Suction Power,370ML Water Tank, 3 Adjustable Suction Self-Charging for Pet Hair,Carpets,Hard Floors",Mamibot,0,0,0,"11,999",3.7,72,68,"Sunday, February 13",1,72
228,B09BL3C8YW,"INALSA Vacuum Cleaner Homeasy WD10 with 3 functions Wet/Dry/Blow| 1200W Motor, 10L Tank Capacity & 1.8m Hose Pipe with Handle Grip (Yellow/Black)",INALSA,0,0,0,"4,199",3.9,126,59,"Friday, February 11",1,126
229,B08CL2YM4H,BLACK+DECKER WW100 3.6V Li-ion Cordless Window and Glass Vacuum Cleaner,BLACK+DECKER,0,0,0,"4,798",3.9,5,47,"Tuesday, February 8",1,5
230,B09RKB6Z3V,"DishanKart Portable Mini Wired Vacuum Cleaner, Car Vacuum Cleaner, 7000PA Powerful Cyclone Suction Home Portable Handheld Vacuum Cleaner (Wired Vacuum Cleaner)",DishanKart,1,0,0,"1,299",0,0,74,"Wednesday, February 9",1,"₹1,299
₹4,999 Save ₹3,700 (74%)"
231,B09FTF5DW4,"OLAHRAGA 2 in 1 Lightweight, 500W, Upright Stick Vacuum Cleaner for Home, Mini Corded Handheld Vacuum for Car, Ideal for Floor, Pet Hair, Sofa, Window, Car (3.5M Cord Length)",OLAHRAGA,1,0,0,"1,799",3.1,8,67,"Sunday, February 13",1,8
232,B00LFKG3CI,Karcher WD 1 1000-Watt Wet and Dry Vacuum Cleaner (Yellow/Black),Karcher,0,0,0,"5,799",4.0,499,17,"Wednesday, February 9",1,499
233,B08MXY6SN3,"AASTIK Multi-Purpose 12V DC Portable Home, Car Wash Dust Booster Collector Handheld Vacuum Cleaner Tool Kit Machine with Stainless Steel Filter",AASTIK,0,0,0,"1,340",2.9,6,55,"Sunday, February 13",1,6
234,B07YRK6GP3,Prestige Clean Home Typhoon 06 Wet and Dry Vacuum Cleaner (Black),Prestige,0,0,0,"4,490",4.0,222,36,"Saturday, February 12",1,222
235,B09PL31M18,"ANIRUDHA Handheld Vacuum Cleaner Cordless - Mini Car Vacuum Cleaner Rechargeable for Car, Home, Office, Pet Hair Travel Cleaning",ANIRUDHA,0,0,0,"1,799",0,0,64,"Sunday, February 13",1,"₹1,799
₹4,999 Save ₹3,200 (64%)"
236,B09MWFNH5D,"KNYUC MART Multi-Functional Portable Vacuum Cleaner Blowing and Sucking Dual Purpose (JK-8), 220-240 V, 50 HZ, 1000 W",KNYUC,0,0,0,"1,998",0,0,26,"Sunday, February 13",1,"₹1,998
₹2,699 Save ₹701 (26%)"
237,B09GMD2KZ4,"DIGILIO Multi-Functional Portable Vacuum Cleaner Blowing and Sucking Dual Purpose, 220-240 V, 50 HZ, 1000 W",DIGILIO,0,0,0,"2,150",3.5,6,14,"Sunday, February 13",1,6
238,B08D6R72C9,"By-Logic BVC 600 Portable 2 in1 Handheld Vacuum Cleaner (600 Watts, White and Blue)",By-Logic,0,0,0,"2,999",3.8,62,46,"Wednesday, February 16",1,62
239,B08W5B6ZQB,"Logicmart Multi-Purpose Vacuum Cleaner Blowing and Sucking Dual Purpose for Car and Home(220-240 V, 50 HZ, 1000 W)",Logicmart,0,0,0,"1,785",4.2,3,29,"Sunday, February 13",1,3
240,B09717HPD7,Miss Queen Multi-Functional Portable Blowing and Sucking Dual Purpose Handheld Car Electric Dust Dry Cleaning Multipurpose Vacuum Cleaner,Miss,1,0,0,"2,145",5.0,2,46,"Sunday, February 13",1,2
