,asin,title,brand,Sponsored,Best Seller,Amazon's Choice,Price,Rating,NoofRatings,Discount,Delivery,Prime Delivery,base
0,B091FLT2YK,Men's Polycotton Collar Neck Polo T-Shirt Combo Pack of 3,Wear Your Opinion,1,0,0,999,3.9,537,67,,1,537
1,B09DD2WHW5,Step Hem T-Shirt: Olive Green Mens and Boys Solid Cotton T-Shirts,The Souled Store,1,0,0,432,0,0,57,,0,"₹432
₹999 Save ₹567 (57%)"
2,B092SR1JG9,Men's Marvels Badge Polo Collar Neck T-Shirt Combo Pack of 2,Wear Your Opinion,1,0,0,699,4.0,69,65,,1,69
3,B07TFH5MYQ,Polo T-Shirt Short Sleeves for Men,NASH,1,0,0,999,0,0,29,,0,"₹999
₹1,399 Save ₹400 (29%)"
4,B09CNYR7ZS,Men's Cotton Half Sleeve Regular Fit Striped T-Shirt,RodZen,0,0,0,349,3.9,26,77,,0,26
5,B084L8XZTV,Men's Regular Fit T-Shirt (Pack of 3),Scott International,0,1,0,429,3.8,"25,269",82,,0,"25,269"
6,B06Y2BZJN6,Men's Polo,Allen Solly,0,1,0,539,4.1,"44,018",40,,1,"44,018"
7,B07B2X6LDJ,Men's Regular Fit T-Shirt (Pack of 4),AWG ALL WEATHER GEAR,0,0,0,499,3.5,"7,036",84,,1,"7,036"
8,B09QHRCN48,Regular Fit Half Sleeve Polo Men's T-Shirt,LEOTUDE,0,0,0,299,3.2,8,73,,0,8
9,B079KGF18M,Men's Regular Fit T Shirt (Pack of 5),AWG ALL WEATHER GEAR,0,0,0,649,3.4,631,78,,1,631
10,B07L58BFXT,Men's Regular Fit T-Shirt (Pack of 2),London Hills,0,0,0,454,3.8,774,83,,0,774
11,B07B2VVHNT,Men's Regular Fit T-Shirt,Maniac,0,0,0,217,4.0,"1,493",79,,0,"1,493"
12,B09CV399D5,Regular Fit Half Sleeve Men's T-Shirt,LEOTUDE,0,0,0,329,3.4,"1,637",70,,0,"1,637"
13,B073X1MR71,Men's Regular T-Shirt,Amazon Brand - Symbol,0,0,0,369,4.0,"5,614",74,,0,"5,614"
14,B084GB4K2B,Men's Regular Fit T-Shirt,Austin Wood,0,0,0,399,3.8,"1,080",73,,1,"1,080"
15,B089B3NSKX,Regular Men's Cotton Designer T-Shirt (EB1T67),EYEBOGLER,0,0,0,320,3.4,"2,211",75,,0,"2,211"
16,B08N714Q2T,Men's Solid Regular fit T-Shirt,EYEBOGLER,0,0,0,390,3.7,"3,910",70,,0,"3,910"
17,B07W1FDP11,Men's Regular Fit T-Shirt,GRITSTONES,0,0,0,309,3.9,"1,137",76,,0,"1,137"
18,B08662JK2H,Men's Slim Fit Polo T-Shirt,Alan Jones Clothing,0,0,0,419,3.9,865,58,,0,865
19,B08L9FWQ3G,Regular Fit Half Sleeve Men's Polo T-Shirt,LEOTUDE,0,0,0,329,3.6,354,70,,0,354
20,B08Y6QCHLJ,Mens and Boys Graphic Printed Cotton Drop Cut T-Shirts,The Souled Store,1,0,0,524,3.8,88,42,,1,88
21,B083F494BL,Men's Regular Polo Shirt,Amazon Brand - Symbol,1,0,0,309,4.0,245,61,,0,245
22,B09K5LF9NB,Feel- Mens Polo - Maroon,RARE RABBIT,1,0,0,"1,499",0,0,50,,1,"₹1,499
50
₹2,999 Save ₹1,499.50 (50%)"
23,B095W7G444,Men's Slim Fit Mesh Solid Textured Polo T-Shirt,RARE RABBIT,1,0,0,"1,319",4.6,3,40,,1,3
24,B08THCQLCM,Regular Fit Half Sleeve Men's Polo T-Shirt,LEOTUDE,0,0,0,299,3.6,"1,367",73,,0,"1,367"
25,B096VZGRTK,Men's Slim T-Shirt,Integriti,0,0,0,330,3.6,39,67,,0,39
26,B09C2JBSSC,Men's Slim T Shirt (Pack of 3),BULLMER,0,0,0,599,3.6,682,60,,1,682
27,B09QHWDSKJ,Regular Fit Full Sleeve Men's T-Shirt,LEOTUDE,0,0,0,299,3.3,6,73,,0,6
28,B08JQKJ5FH,Men's Printed Full Sleeve Slim Fit Cotton T-Shirt,Urbano Fashion,0,0,0,420,3.8,"1,932",62,,0,"1,932"
29,B07BQCVTSS,Men's Solid Regular Fit T-Shirt,EYEBOGLER,0,0,0,335,3.8,"7,436",74,,0,"7,436"
30,B09KBXL6QX,Men's T Shirt-(Amt250105-P_Green),AELOMART,0,0,0,447,4.1,101,70,,0,101
31,B08CDRGNHH,Regular Fit Men's Cotton T-Shirt,EYEBOGLER,0,0,0,369,3.8,"9,567",72,,0,"9,567"
32,B08TH92K4Q,Regular Fit Half Sleeve Polo Men's T-Shirt,LEOTUDE,0,0,0,329,3.6,"1,120",70,,0,"1,120"
33,B098K1DKLJ,Regular Fit Cotton Printed Men's T-Shirt,LEOTUDE,0,0,0,299,3.4,989,73,,0,989
34,B08XXVFHXH,Regular Fit Men's Cotton T-Shirt(AMT2301-P),AELOMART,0,0,0,498,4.1,177,67,,0,177
35,B07VJNQYDM,"Men Polo Neck Graphic Print Half Sleeve Sports,Gym, Football Jersey T-Shirt",Campus Sutra,0,0,0,379,3.9,168,62,,0,168
36,B09N3NHLVF,Regular Fit Full Sleeve Men's T-Shirt (Color : Maroon),LEOTUDE,0,0,0,299,3.7,53,73,,0,53
37,B09BFVQTJH,Men's Regular T-Shirt,Levi's,0,0,0,669,4.1,15,44,,1,15
38,B08KTZDXMG,Men's Regular Fit Polo,Allen Solly,0,0,0,649,4.2,294,46,,1,294
39,B0992CRKSR,Men's Regular Short Sleeve T-Shirt,Nike,0,0,0,669,0,0,25,,1,"₹669
₹895 Save ₹226 (25%)"
40,B08HNC1K6B,AWG Men's Cotton Regular Fit Solid Polo Neck T-Shirt,AWG ALL WEATHER GEAR,0,0,0,349,3.6,"6,946",77,,0,"6,946"
41,B099FCJC5D,Men's Slim Fit T-Shirt,Jack & Jones,0,0,0,237,3.4,20,76,,0,20
42,B09D3P834S,Men's Regular T-Shirt,OOBANI,0,0,0,319,3.9,11,68,,0,11
43,B0862RFQ1K,Men's Printed Slim fit T-Shirt,AEROPOSTALE,0,0,0,648,4.2,32,35,,1,32
44,B09B9ZJHTM,Men's Slim Polo Shirt,Peter England,0,0,0,552,4.0,561,39,,1,561
45,B01LB53TCI,Men's Regular Fit T-Shirt,AMERICAN CREW,0,0,0,564,3.9,"13,307",72,,1,"13,307"
46,B08KTYMMTL,Men's Plain Regular Fit Polo,Allen Solly,0,0,0,648,4.2,"1,929",44,,0,"1,929"
47,B092SN5GYJ,Cotton Camouflage Printed Regular Fit Men's Tshirt,LEOTUDE,0,0,0,299,3.8,"2,275",81,,0,"2,275"
48,B09FLBC4JG,Men's Combo Polo Neck Cotton Blend Solid T-Shirt (Pack of 2),INKKR,0,0,0,439,3.3,420,66,,0,420
49,B012STP7EO,Men's Regular Fit Round Neck Half Sleeved T-Shirt,Jockey,0,0,0,474,4.3,"14,708",5,,0,"14,708"
50,B01HTCHFIG,Men's Printed Regular fit T-Shirt,wear your mind,0,0,0,0,0,0,0,,0,
51,B099FDCZY7,Men T-Shirt,Jack & Jones,0,0,0,271,5.0,5,79,,0,5
52,B07KN85VVX,Men's Slim Fit T-Shirt,Maniac,0,0,0,334,3.8,"5,590",73,,0,"5,590"
53,B08N55WRSX,Men's Regular Fit T-Shirt,EYEBOGLER,0,0,0,318,3.8,859,76,,0,859
54,B081B1B1S3,Men's Printed Regular fit T-Shirt,U.S. POLO ASSN.,0,0,0,699,4.0,"1,321",0,,1,"1,321"
55,B08KTYS48F,Men T-Shirt,Allen Solly,0,0,0,649,4.3,241,46,,1,241
56,B076T74BHV,Polo Collar Cotton Poly Striped T-Shirt for Men,AMERICAN CREW,1,0,0,612,4.0,"3,322",59,,1,"3,322"
57,B07J4Q7RRZ,Regular Fit Mens Tshirts,Chromozome,1,0,0,699,3.9,"2,982",30,,1,"2,982"
58,B08Q5G7FPH,Men's Regular fit Polo,Van Heusen Athleisure,1,0,0,930,4.1,257,24,,1,257
59,B08H7VR7RH,Men's Regular Fit Polo T-Shirt,Knight & Rook,1,0,0,648,3.9,132,35,,1,132
60,B0922W9LGR,KiwiCaves Polo Collar Neck Sports Cotton T-Shirt for Men and Boys,Generic,0,0,0,299,3.5,120,70,,0,120
61,B09QMG146G,Men T-Shirt (N704MT3_$P_Pack of 3),SHAUN,0,0,0,499,5.0,1,58,,1,1
62,B08N236FC3,Men's Regular Fit T-Shirt,EYEBOGLER,0,0,0,299,3.8,"2,341",77,,0,"2,341"
63,B08MCDPX8B,Men's Cotton Regular Fit Full Sleeves T-Shirt,CHKOKKO,0,0,0,189,3.9,"1,860",91,,0,"1,860"
64,B09FL9VQ9C,Men's Combo Polo Neck Cotton Blend Solid T-Shirt (Pack of 2),INKKR,0,0,0,439,3.3,420,66,,0,420
65,B0979649SZ,Round Neck Regular Fit Cotton T-Shirt,Amazon Brand - Inkast Denim Co.,0,0,0,369,3.6,16,72,,0,16
66,B073WB9BM6,Men's Printed Regular fit T-Shirt,Van Heusen Athleisure,0,0,0,549,4.0,650,0,,1,650
67,B096VZ9KYT,Men's Slim T-Shirt,Integriti,0,0,0,211,3.6,41,79,,0,41
68,B07CXXHLY2,Men's Regular fit T-Shirt,U.S. POLO ASSN.,0,0,0,384,4.0,"5,253",36,,0,"5,253"
69,B083C2TDPW,Men's Regular fit T-Shirt,Van Heusen Athleisure,0,0,0,649,4.1,840,0,,1,840
70,B08T7LRZ9D,Men's Regular Fit Printed Full Sleeve Soft & Strong Hooded T-Shirt,London Hills,0,0,0,399,3.8,685,69,,0,685
71,B08N664R36,Men's Regular Fit T-Shirt,EYEBOGLER,0,0,0,410,3.8,327,68,,0,327
72,B09RK9BNRM,Polyester Men's Solid Pattern Regular Fit Round Neck Half Sleelve T-Shirt for Gym |Sports | Running | Casual Wear H/H,ADDIZ,0,0,0,181,0,0,82,,0,"₹181
₹999 Save ₹818 (82%)"
73,B073X4YGZM,Men's Regular T-Shirt,Amazon Brand - Symbol,0,0,0,299,3.9,"1,640",0,,0,"1,640"
74,B073X2SPFB,Men's Regular T-Shirt,Amazon Brand - Symbol,0,0,0,529,4.0,"6,204",75,,1,"6,204"
75,B099F9KW9R,Men's Slim Fit T-Shirt,Jack & Jones,0,0,0,234,4.5,4,77,,0,4
76,B08RDVJPS2,Men's Half Sleeve Regular Fit T-Shirt,Veirdo,0,0,0,399,4.0,669,67,,0,669
77,B07MSJJWGK,Men's Plain Vest,Jockey,0,0,0,299,4.2,705,9,,0,705
78,B06XBXRLX4,Men's Cotton T-Shirt,fanideaz,0,0,0,499,3.5,"3,419",80,,1,"3,419"
79,B082G3S7GC,"Men's Cotton Full Sleeve T Shirt-(Amt1125-N,Olive)",AELOMART,0,0,0,497,4.0,"3,732",67,,0,"3,732"
80,B08353M893,Men's Slim Polo,Max,0,0,0,399,4.1,"8,047",11,,0,"8,047"
81,B07DPR2Y9W,Men's Regular Fit Polos,AMERICAN CREW,0,0,0,612,4.1,"6,712",59,,1,"6,712"
82,B01EUQJ3B6,Men's Cotton T-Shirt,Jockey,0,0,0,549,4.3,"7,751",8,,1,"7,751"
83,B073X4KMYM,Men's Regular Polo Shirt,Amazon Brand - Symbol,0,0,0,309,3.9,"12,393",38,,0,"12,393"
84,B09C8N45JJ,Regular Fit Half Sleeve Men's T-Shirt Cotton Blend Combo (Pack of 2),LEOTUDE,0,0,0,499,3.5,206,55,,1,206
85,B07JJ2CBND,Men's Slim Fit T-Shirt,WC Right,0,0,0,365,3.8,"2,100",63,,0,"2,100"
86,B00W062FSM,Men's Cotton T-Shirt,Jockey,0,0,0,411,4.3,"11,654",16,,0,"11,654"
87,B08XW6QR8S,Men's Solid Cotton Round Neck Regular Fit Half Sleeves T-Shirt,CHKOKKO,0,0,0,199,4.0,693,90,,1,693
88,B07YDHXM5P,Regular Fit Men's Cotton T-Shirt (EBT229-NBLM),EYEBOGLER,0,0,0,359,3.8,"3,651",72,,0,"3,651"
89,B07NL7HD5H,Men's Regular Fit T-Shirt,Veirdo,0,0,0,299,4.1,"2,717",70,,0,"2,717"
90,B095SXRBD6,Men's Slim Fit T-Shirts,Spykar,0,0,0,459,4.1,104,54,,0,104
91,B079W7H3FB,Multicolour Cotton Full Sleeve T-Shirt for Men,ADRO,0,0,0,449,4.0,"2,279",75,,0,"2,279"
92,B09LM6YYV5,181920 Men's Basic Printed Cotton Regular T-Shirts for Men Combo,THE BLAZZE,0,0,0,499,2.9,15,50,,1,15
93,B08FTCCNQV,Spider-Man: The Suit Mens Graphic Printed Cotton Drop Cut T-Shirt Red,The Souled Store,0,0,0,649,4.3,177,78,,1,177
94,B09JZGPXL3,Men Cotton Black/Maroon Hooded T-Shirt,GRITSTONES,0,0,0,332,4.2,43,63,,0,43
95,B099FC9WT5,Men's Slim T-Shirt,Jack & Jones,0,0,0,241,3.7,258,78,,0,258
96,B08SC2PDDJ,"Men's Polo T-Shirt Regular fit, Polyester, Half Sleeve, with Pocket Combo Pack of 2 | Maroon, Sky-Blue |",SMAN,0,0,0,499,3.8,392,83,,1,392
97,B08HQMWB4H,Men's Cotton Regular Fit Solid Polo Neck T-Shirt,Scott International,0,0,0,349,3.5,"8,169",77,,0,"8,169"
98,B083FHPYRQ,Regular Fit Men's Cotton T-Shirt,EYEBOGLER,0,0,0,299,3.5,549,77,,0,549
99,B01HTCFYG6,Men's Regular fit T-Shirt,wear your mind,0,0,0,499,4.7,5,55,,1,5
100,B01LERKMAU,Men's Polo Collar Half Sleeve Striped Cotton Melange Colors T Shirts for Men,AMERICAN CREW,0,0,0,707,3.8,912,65,,1,912
101,B07GNGG23G,Men’s Cotton Navy Blue Striped Polo T Shirt with Collar and Pocket,fanideaz,0,0,0,799,3.7,966,68,,1,966
102,B09GG36YZK,Better Basics Half Crew Solid T Shirt - (100% Guarantee if not Satisfied)- Made in India,DAMENSCH,0,0,0,599,4.1,107,0,,1,107
103,B09QSXKTW5,Oversized t-Shirt for Men,Veirdo,0,0,0,399,5.0,3,67,,0,3
104,B09MTTCJQ2,Printed Men's Round Neck Black T-Shirt,London Hills,0,0,0,349,4.0,9,73,,0,9
105,B09H4BCKMY,Men's Cotton Printed Round Neck Loose Fit Oversized T-Shirt | Hip Hop Casual T-Shirt,JUGULAR,0,0,0,369,3.6,62,58,,0,62
106,B0867H512G,Men's Regular Fit T-Shirt,EYEBOGLER,0,0,0,430,3.7,613,67,,0,613
107,B079KFXZX5,Men's Polyester Round Neck T-Shirts - Pack of 5,AWG ALL WEATHER GEAR,0,0,0,649,3.5,"1,077",78,,1,"1,077"
108,B076T54DCF,Polo Collar Cotton Poly Striped T-Shirt for Men,AMERICAN CREW,1,0,0,612,4.0,"3,322",59,,1,"3,322"
109,B075JFQ8KH,Men's Regular Fit T-Shirt,AMERICAN CREW,1,0,0,612,3.9,"13,307",69,,1,"13,307"
110,B015OES37I,Men's Regular Fit T-Shirt (Multicolor_Large),Classic Polo,1,0,0,653,3.7,62,10,,1,62
111,B07M83N211,Men's Solid Regular Fit T-Shirt,Red Tape,1,0,0,459,3.9,121,77,,0,121
112,B07GNGG23G,Men’s Cotton Navy Blue Striped Polo T Shirt with Collar and Pocket,fanideaz,0,0,0,799,3.7,966,68,,1,966
113,B072N81GWM,Men's Regular T-Shirt,Amazon Brand - Symactive,0,0,0,349,4.2,"1,322",56,,0,"1,322"
114,B09GG36YZK,Better Basics Half Crew Solid T Shirt - (100% Guarantee if not Satisfied)- Made in India,DAMENSCH,0,0,0,599,4.1,107,0,,1,107
115,B09N3WY7J5,Unisex Cotton Half Sleeve Oversized Cow Printed T-Shirt,Veirdo,0,0,0,399,3.9,59,67,,0,59
116,B09QSXKTW5,Oversized t-Shirt for Men,Veirdo,0,0,0,399,5.0,3,67,,0,3
117,B09MTTCJQ2,Printed Men's Round Neck Black T-Shirt,London Hills,0,0,0,349,4.0,9,73,,0,9
118,B09H4BCKMY,Men's Cotton Printed Round Neck Loose Fit Oversized T-Shirt | Hip Hop Casual T-Shirt,JUGULAR,0,0,0,369,3.6,62,58,,0,62
119,B0867H512G,Men's Regular Fit T-Shirt,EYEBOGLER,0,0,0,430,3.7,613,67,,0,613
120,B079KFXZX5,Men's Polyester Round Neck T-Shirts - Pack of 5,AWG ALL WEATHER GEAR,0,0,0,649,3.5,"1,077",78,,1,"1,077"
121,B09QHR5GK1,Regular Fit Half Sleeve Men's Polo T-Shirt,LEOTUDE,0,0,0,299,4.4,7,73,,0,7
122,B0819ZQM5G,Men's Striped Regular fit T-Shirt,U.S. POLO ASSN.,0,0,0,639,4.0,"1,222",20,,1,"1,222"
123,B073X4H65C,Men's Regular T-Shirt,Amazon Brand - Symbol,0,0,0,219,3.9,"1,990",45,,0,"1,990"
124,B08SHNCBMG,Mens Regular Fit Printed Cotton Polo Tshirt,BULLMER,0,0,0,439,4.1,883,56,,0,883
125,B098L9GM95,"Men's Hooded Cotton Blend Checked T-Shirt : Black, White",LEWEL,0,0,0,349,3.6,181,83,,0,181
126,B08W5CB6TT,Men's Captain America Design Printed T-Shirts,ADRO,0,0,0,349,3.8,63,77,,0,63
127,B09H7KDGYJ,Printed Men Round Neck Full Sleeve T-Shirt,London Hills,0,0,0,349,3.6,499,73,,0,499
128,B08HNCG4YP,AWG Men's Cotton Regular Fit Solid Polo Neck T-Shirt,AWG ALL WEATHER GEAR,1,0,0,349,3.6,"6,946",77,,0,"6,946"
129,B07RXZT62Q,Men's Regular Fit T-Shirt,Wrath,1,0,0,324,3.7,"2,747",75,,0,"2,747"
130,B08662GXMK,Men's Slim Fit Polo T-Shirt,Alan Jones Clothing,1,0,0,419,3.9,865,58,,0,865
131,B0912RLG3D,Men's Polycotton Collar Neck Polo T-Shirt Combo Pack of 3,Wear Your Opinion,1,0,0,999,3.9,537,67,,1,537
132,B08KG357B1,Men's Regular Fit T-Shirt,Allen Solly,0,0,0,419,4.1,"2,087",40,,0,"2,087"
133,B09797RTMZ,Round Neck Regular Fit Cotton T-Shirt,Amazon Brand - Symbol,0,0,0,349,3.8,72,65,,0,72
134,B094FKYKDR,Men's Plus Size Polo Collar Neck T-Shirt,Wear Your Opinion,0,0,0,499,4.0,291,67,,1,291
135,B00RGV7W0C,Polo T-Shirts for Men,AMERICAN CREW,0,0,0,517,4.0,"1,932",74,,1,"1,932"
136,B08T5RKG52,Round Neck Men's Cotton T-Shirt(AMT039-P),AELOMART,0,0,0,499,3.6,180,67,,1,180
137,B09DCS9PDY,Men's High Turtle Neck Cotton T-Shirt,NORTHWIND,0,0,0,795,4.0,572,60,,1,572
138,B08NXGVH86,Batman: Wayne Industries Mens Graphic Printed Cotton Drop Cut T-Shirt Black,The Souled Store,0,0,0,734,4.3,438,18,,1,438
139,B098TR8J2X,Men's Regular T-Shirt,Puma,0,0,0,809,4.1,36,55,,1,36
140,B08RWZ9XD6,Men's Slim Fit T-Shirt,Maniac,0,0,0,285,3.9,247,70,,0,247
141,B07CQMYJC7,Men's Regular Fit OS 10 Pack of 3,Chromozome,0,0,0,600,3.9,"4,787",34,,1,"4,787"
142,B08FXF9LY3,Men's Half Sleeve Printed Round Neck Tshirt,Dagcros,0,0,0,332,3.3,83,78,,0,83
143,B096VH5GPZ,Men's Regular T-Shirt,Arrow,0,0,0,607,3.0,1,62,,1,1
144,B07PNC3CM2,Men's Polo T-Shirts,ADRO,0,0,0,449,4.0,"1,339",75,,0,"1,339"
145,B09D3N7D4H,Men's Regular Fit Tshirt&Polo,OOBANI,0,0,0,189,4.0,11,79,,0,11
146,B09BG8ZY3C,Men's Regular Polo Shirt,Levi's,0,0,0,629,4.2,44,55,,1,44
147,B09814JKBG,"Colorblock Men's Zip Round Neck Black, Dgrey Polyester T-Shirt",Maniac,0,0,0,376,4.1,18,74,,0,18
148,B08JHX6F6W,"Men's Round Neck Full Sleeves Tshirt Navyblue,Maroon,Grey (Pack of 2)",BLIVE,0,0,0,472,3.8,495,76,,0,495
149,B09BFVR2G5,Men's Regular Polo Shirt,Levi's,0,0,0,629,3.8,25,55,,1,25
150,B09CGQZWRK,Men T-Shirt,Maniac,0,0,0,317,4.2,4,80,,0,4
151,B08BVV1SYX,Men's Regular T-Shirt,Reebok,0,0,0,649,4.1,99,35,,1,99
152,B00YUNGPNE,Men's Slim Fit T Shirt,Maniac,0,0,0,372,3.6,"2,185",56,,0,"2,185"
153,B07DDD4MLJ,Men's Regular Fit Polo T-Shirt,Scott International,0,0,0,449,3.7,683,70,,0,683
154,B07VPW43VK,Men's Regular Fit T-Shirt,Veirdo,0,0,0,311,3.9,"2,824",74,,0,"2,824"
155,B09JZCNP9J,Oversized Mens Cotton Blend Half Sleeve Mens T-Shirts,LEOTUDE,0,0,0,299,3.5,173,73,,0,173
156,B07R7QDQ7C,Men's Solid Regular Fit T-Shirt,Van Heusen Athleisure,0,0,0,699,4.0,"2,676",0,,1,"2,676"
157,B099F9XL3W,Men's Slim T-Shirt,Jack & Jones,0,0,0,228,4.0,14,79,,0,14
158,B01DT8KDOW,Men's Classic Fit T-Shirt,ARISE,0,0,0,399,0,0,20,,0,"₹399
₹499 Save ₹100 (20%)"
159,B099FBS22T,Men's Slim T-Shirt,Jack & Jones,0,0,0,253,3.5,28,79,,0,28
160,B0876SZ1NJ,Men's Regular T-Shirt,Max,0,0,0,179,3.7,37,49,,0,37
161,B097DYCH7T,Men's Regular Fit AS M NK DF SUPERSET TOP SS,Nike,0,0,0,706,3.8,51,58,,1,51
162,B08ZL5Z4W5,Men’s Full Sleeve Cotton Black and White Striped Polo T Shirt,fanideaz,0,0,0,799,3.6,293,68,,1,293
163,B09M8P4Q8L,Men's Solid Full Sleeve high-Neck T Shirt,GRITSTONES,0,0,0,349,4.4,6,77,,0,6
164,B08WRNL4J9,Double Collar Men's Round Neck T-Shirt,Alan Jones Clothing,1,0,0,379,3.8,371,68,,0,371
165,B083C2KRJN,Men's Solid Regular Fit T-Shirt,Van Heusen Athleisure,1,0,0,715,4.0,"2,676",2,,1,"2,676"
166,B0793JLJXV,US Polo Association Men's Regular fit T-Shirt,U.S. POLO ASSN.,1,0,0,499,4.0,"2,327",0,,1,"2,327"
167,B08R8ZM1FB,Printed T Shirt for Men Combo Pack of 3,Boodbuck,1,0,0,999,3.5,170,67,,1,170
168,B0793JLK9L,Men's Regular fit T-Shirt,U.S. POLO ASSN.,1,0,0,548,3.8,"6,700",0,,1,"6,700"
169,B07NDDF66V,Polo Collar Cotton Poly Striped T-Shirt for Men,AMERICAN CREW,1,0,0,707,4.0,"3,322",53,,1,"3,322"
170,B07RXYRMLF,Men's Regular Fit T-Shirt,Wrath,1,0,0,324,3.7,"2,747",78,,0,"2,747"
171,B07P7NF48P,Men's Solid Regular Fit T-Shirt,Red Tape,1,0,0,739,3.7,25,66,,1,25
172,B09M8P4Q8L,Men's Solid Full Sleeve high-Neck T Shirt,GRITSTONES,0,0,0,349,4.4,6,77,,0,6
173,B099F8W34L,Men's Slim T-Shirt,Jack & Jones,0,0,0,283,3.9,81,78,,0,81
174,B0892SL2RX,Men's Regular Fit T-shirt (Set of 3),BULLMER,0,0,0,589,3.6,"1,447",61,,1,"1,447"
175,B09HGJDQBW,Regular Fit Half Sleeve Men's Polo T-Shirt,LEOTUDE,0,0,0,299,3.0,13,73,,0,13
176,B0855MKXPT,Band Collar Men's T-Shirt(EBT325 & EBT325HS),EYEBOGLER,0,0,0,390,3.6,"3,243",70,,0,"3,243"
177,B07PCHH8GK,Men's Polyester Round Neck T-Shirts - Pack of 3,AWG ALL WEATHER GEAR,0,0,0,449,3.4,"1,211",81,,0,"1,211"
178,B08CTY4CQK,Men's Regular fit T-Shirt,Solefit,0,0,0,158,3.3,20,87,,0,20
179,B07L5BD26B,Men's Regular Fit T-Shirt,London Hills,0,0,0,259,3.5,81,80,,0,81
180,B08V5L5TZY,Men's Regular T-Shirt,Puma,0,0,0,690,4.0,7,54,,1,7
181,B073X4QPY7,Men's Regular Polo Shirt,Amazon Brand - Symbol,0,0,0,319,4.0,"7,938",68,,0,"7,938"
182,B08Z435JHJ,Mens Regular Fit Striped Cotton Polo Tshirt/Collared Tshirt,BULLMER,0,0,0,439,4.0,551,56,,0,551
183,B07S15TXMP,Men's Regular Fit Pyjama Top,U.S. POLO ASSN.,0,0,0,428,3.9,70,22,,0,70
184,B07YXJBN88,Men's Regular Fit Vest,Jockey,0,0,0,479,4.2,"2,475",0,,0,"2,475"
185,B083C2KRLD,Men's Regular fit T-Shirt,Van Heusen Athleisure,0,0,0,849,4.1,402,0,,1,402
186,B06VV4T5PZ,Men's Regular Fit T-Shirt (Pack of 3),Scott International,0,0,0,429,3.6,"4,755",82,,0,"4,755"
187,B08Z43VBVG,Mens Regular Fit Striped Cotton Polo Tshirt/Collared Tshirt,BULLMER,0,0,0,439,4.0,120,56,,0,120
188,B09137V9MN,Men's Polycotton Collar Neck Polo T-Shirt Combo Pack of 3,Wear Your Opinion,1,0,0,999,3.9,537,67,,1,537
189,B08662V8WL,Men's Slim Fit Polo T-Shirt,Alan Jones Clothing,1,0,0,419,3.9,865,58,,0,865
190,B07PPZP7FS,Navy Blue House Keeping Uniform for Men,JSM Fab,1,0,0,649,3.4,6,35,,0,6
191,B09C113X2R,Men's Solid Regular Fit Polo,PRINTOCTOPUS,1,0,0,798,1.0,1,50,,1,1
192,B08N5SSGZ4,Men's Regular Fit Striped Round Neck T-Shirt,EYEBOGLER,0,0,0,380,3.9,"7,788",71,,0,"7,788"
193,B08B3YGVSZ,Yellow Men T-Shirt,Pepe Jeans,0,0,0,519,3.2,9,60,,1,9
194,B07BDZ75YG,Men's Regular Polo Shirt,Amazon Brand - Symbol,0,0,0,589,3.9,"5,443",41,,1,"5,443"
195,B09D3QV24D,Men's Regular Fit Tshirt&Polo,OOBANI,0,0,0,639,4.1,34,64,,1,34
196,B096ZY6S6X,Men's Regular T-Shirt,Levi's,0,0,0,891,3.8,97,55,,1,97
197,B08V55FXS8,Regular Fit Full Sleeve Men's T-Shirt Combo (Pack of 2),LEOTUDE,0,0,0,549,3.6,943,66,,1,943
198,B01J3VFCWM,Men's Cotton Poly Blend Polo Regular Fit T-Shirt,AMERICAN CREW,0,0,0,802,4.1,"1,149",46,,1,"1,149"
199,B07XVM5D9S,Men's Round Neck Regular Fit T-Shirt (Pack of 2),London Hills,0,0,0,399,3.8,482,69,,0,482
200,B09FKJL5YJ,Men's Regular T-Shirt,Adidas,0,0,0,749,3.6,6,50,,1,6
201,B09CNKG4ZX,Men's High and Turtle Neck Cotton T-Shirt,NORTHWIND,0,0,0,795,4.0,703,47,,1,703
202,B094VB51F2,Men's Regular T-Shirt,Arrow,0,0,0,375,4.2,110,37,,0,110
203,B096VX622L,Men's Slim T-Shirt,Integriti,0,0,0,171,3.6,42,83,,0,42
204,B08VDVMXRC,Men's Cotton Henley Neck Full Sleeve Regular Fit T-Shirt,Veirdo,0,0,0,299,4.2,315,75,,0,315
205,B07TFRQBTH,Men's Regular Polo Shirt,Deniklo,0,0,0,331,3.8,375,72,,0,375
206,B073X4GC5Y,Men's Regular T-Shirt,Amazon Brand - Symbol,0,0,0,849,4.1,"3,629",43,,1,"3,629"
207,B09M46F5L6,Printed Cotton T-Shirt for Men Combo Pack of 2,Boodbuck,0,0,0,499,5.0,1,75,,1,1
208,B073X2X1Q8,Men's Regular T-Shirt,Amazon Brand - Symbol,0,0,0,529,4.0,"10,919",75,,1,"10,919"
209,B07RBYS3N3,Men's Solid Regular Fit Polo,Van Heusen Athleisure,0,0,0,928,4.1,"1,815",16,,1,"1,815"
210,B071J5S21R,Scott Men's Basic Cotton Round Neck Half Sleeve Solid T-Shirts - Pack of 2,Scott International,0,0,0,329,3.6,"2,445",82,,0,"2,445"
211,B08BV581B2,Men's Regular T-Shirt,Adidas,0,0,0,649,3.8,236,35,,1,236
212,B07XTC11H4,Men's Slim fit Sports T-Shirt,Fusefit,0,0,0,184,0,0,77,,0,"₹184
₹799 Save ₹615 (77%)"
213,B08S474LLF,Regular Men's T Shirts,Reebok,0,0,0,517,4.0,17,53,,1,17
214,B08R5J1BDW,"Men's Cotton T Shirt (AWT1272-PN,Green)",AELOMART,0,0,0,448,3.9,631,70,,0,631
215,B07MXK3HC5,Men's Regular Fit T-Shirt,Veirdo,0,0,0,199,3.7,"1,260",83,,0,"1,260"
216,B0721SVDG3,Men's Regular T-Shirt,Amazon Brand - Symactive,0,0,0,349,4.2,306,56,,0,306
217,B01HTCHRHK,Men's Regular Fit T-Shirt,wear your mind,0,0,0,499,0,0,55,,1,"₹499
₹1,099 Save ₹600 (55%)"
218,B081VM5MZW,Men's Regular T-Shirt,Amazon Brand - Symbol,0,0,0,849,4.1,"9,107",76,,1,"9,107"
219,B0793HJ739,US Polo Association Men's Regular fit T-Shirt,U.S. POLO ASSN.,0,0,0,449,4.0,"2,327",10,,0,"2,327"
220,B0872L6JZD,Men's Printed Regular Fit Polo T-shirt,Max,0,0,0,169,3.8,65,66,,0,65
221,B09FL8YBTF,Men's Combo Polo Neck Cotton Blend Solid T-Shirt (Pack of 2),INKKR,0,0,0,439,3.3,420,66,,0,420
222,B09PYTRM7J,Men Mauve Brown Solid Oversized T-Shirts,The Souled Store,0,0,0,839,0,0,16,,1,"₹839
₹999 Save ₹160 (16%)"
223,B09RSXSJ2J,Full Sleeve Men's Cotton Round Neck Regular Fit T-Shirt,TLF,0,0,0,349,0,0,65,,1,"₹349
₹999 Save ₹650 (65%)"
224,B098LBLP18,Step Hem T-Shirt: Grey Camo Mens and Boys Solid Cotton Multi-Colored,The Souled Store,1,0,0,524,4.5,4,48,,1,4
225,B08Q5DPVR6,Men's Regular fit Polo,Van Heusen Athleisure,1,0,0,834,4.1,257,30,,1,257
226,B08WK7Z27X,Men's Classic Polo Shirt,Amazon Brand - Symbol,1,0,0,309,4.2,3,38,,0,3
227,B098QBCNLR,Don't Even Fold Laundry Mens and Boys Graphic Printed Cotton T-Shirts Black,The Souled Store,1,0,0,524,0,0,48,,1,"₹524
₹999 Save ₹475 (48%)"
228,B08D7NWPBH,Men's Slim Fit Polo T-Shirt,Alan Jones Clothing,1,0,0,469,3.9,865,53,,0,865
229,B08YYHYPNL,Mens Polo Neck Half Sleeve Yellow Cotton T-Shirt,Classic Polo,1,0,0,629,2.9,3,10,,1,3
230,B09133Q16X,Men's Polycotton Collar Neck Polo T-Shirt Combo Pack of 3,Wear Your Opinion,1,0,0,999,3.9,537,67,,1,537
231,B07L6PK8V8,Men's Solid Regular fit T-Shirt,U.S. POLO ASSN.,1,0,0,919,3.9,82,49,,1,82
232,B09FL8YBTF,Men's Combo Polo Neck Cotton Blend Solid T-Shirt (Pack of 2),INKKR,0,0,0,439,3.3,420,66,,0,420
233,B09PYTRM7J,Men Mauve Brown Solid Oversized T-Shirts,The Souled Store,0,0,0,839,0,0,16,,1,"₹839
₹999 Save ₹160 (16%)"
234,B09RSXSJ2J,Full Sleeve Men's Cotton Round Neck Regular Fit T-Shirt,TLF,0,0,0,349,0,0,65,,1,"₹349
₹999 Save ₹650 (65%)"
235,B08NXHW761,Batman: 3D Logo Mens and Womens 3D Embossed Cotton T-Shirt Black,The Souled Store,0,0,0,629,4.3,288,30,,1,288
236,B07RMYK9Z5,Men's Slim Fit T-Shirt,JUGULAR,0,0,0,266,3.6,"1,289",0,,0,"1,289"
237,B085BM8FYZ,Men's Classic Fit T-Shirt,Jockey,0,0,0,562,4.3,961,6,,1,961
238,B07Q1YCK97,Men's Regular Fit Pyjama Top,U.S. POLO ASSN.,0,0,0,509,4.0,654,15,,1,654
239,B085QZBK5K,Men's Regular fit T-Shirt,Cherokee by Unlimited,0,0,0,289,3.9,139,28,,0,139
240,B095HZ4SVM,Men's Regular T-Shirt,Fusefit,0,0,0,340,5.0,2,74,,0,2
241,B073WBYVMR,Men's Solid Regular fit T-Shirt,Van Heusen Athleisure,0,0,0,500,4.1,"1,726",25,,1,"1,726"
242,B0972VXFLY,Men's Loose Fit Printed Oversized T-Shirt,FUBURA,0,0,0,479,3.6,257,52,,1,257
243,B08RBXVYT2,Men's Regular Fit Full Sleeves Gym T-Shirt,CHKOKKO,0,1,0,332,4.0,"3,322",80,,0,"3,322"
244,B07T9FVXV4,Men's Sports T-Shirt,Fusefit,0,0,0,285,3.8,64,71,,0,64
245,B098L6JXK5,Regular Fit Half Sleeve Men's T-Shirt Combo (Pack of 3),LEOTUDE,0,0,0,749,3.4,137,32,,1,137
246,B08RS35G68,Mens Cotton Hooded Printed T-Shirt,Katso,0,0,0,299,3.6,112,77,,0,112
247,B098TRNVZ9,Men's Regular T-Shirt,Puma,0,0,0,569,4.8,15,62,,1,15
248,B09DD3KWRT,Step Hem T-Shirt: Olive Green Mens and Boys Solid Cotton T-Shirts,The Souled Store,1,0,0,432,0,0,57,,0,"₹432
₹999 Save ₹567 (57%)"
249,B09SB72WJR,Color Block Cotton T-Shirts for Men,ADRO,1,0,0,399,0,0,73,,1,"₹399
₹1,499 Save ₹1,100 (73%)"
250,B09BZVWR48,Men's Solid Regular Fit Polo,PRINTOCTOPUS,1,0,0,798,1.0,1,50,,1,1
251,B0995Q2W22,Step Hem T-Shirt: Black Mens and Boys Solid Cotton T-Shirts,The Souled Store,1,0,0,419,5.0,1,58,,0,1
252,B081VL54LN,Men's Regular T-Shirt,Amazon Brand - Inkast Denim Co.,0,0,0,339,3.9,510,72,,0,510
253,B0995NMB2P,Men's Regular T-Shirt,Amazon Brand - Inkast Denim Co.,0,0,0,369,5.0,2,72,,0,2
254,B0925Y92GL,Moonssoil Men Stretchable Gym and Sports Wear T-Shirt | Body fit Skinny T-Shirt for Gymming and Sports (Black),Generic,0,0,0,499,3.7,30,58,,0,30
255,B08H63WD4D,Men's Regular fit T-Shirt,Amazon Brand - Symbol,0,0,0,339,3.9,146,58,,0,146
256,B081JMTB2P,Men's Solid Regular Fit Sports T-Shirt,CHKOKKO,0,0,0,299,4.0,"2,074",82,,0,"2,074"
257,B096VHD9SC,Men's Regular T-Shirt,Arrow,0,0,0,887,5.0,3,51,,1,3
258,B0892VNQP7,Men's Slim Fit T-Shirt (Pack of 3),BULLMER,0,0,0,589,3.5,"1,169",61,,1,"1,169"
259,B08XMH1FCC,All Over Printed Men's Halfsleeve Round Neck White Cotton Tshirt,Maniac,0,0,0,314,3.8,56,76,,0,56
260,B08TC7GJX4,Regular Fit Cotton Blend Printed Men's T-Shirt,LEOTUDE,0,0,0,299,3.4,104,73,,0,104
261,B09P1GVV8S,Men's t-Shirt Combo Pack of 5 Original 100% Cotton Blended,CUSTOMSCART,0,0,0,699,4.0,1,72,,0,1
262,B014LBVEUI,Men's Plain Regular Fit T-Shirt,Tinted,0,0,0,549,4.0,663,31,,1,663
263,B06XHFTP47,Men's 100% Cotton Biowash Round Neck T-Shirt,Scott International,0,0,0,299,3.9,"1,404",70,,0,"1,404"
264,B07NDYK421,Men's Regular Fit Polos,AMERICAN CREW,0,0,0,649,3.8,562,57,,1,562
