,asin,title,brand,Sponsored,Best Seller,Amazon's Choice,Price,Rating,NoofRatings,Discount,Delivery,Prime Delivery,base
339,B07KGM9SZC,Kramer USB2.0 Type-A to Micro-B cable - 3 feet,Kramer,0,0,0,331,0,0,42,"Monday, February 14",1,"₹331
₹566 Save ₹235 (42%)"
340,B09MW7P6FP,"AXL Nylon Braided 3 in 1 Multifunction Charging Cable for Android, iOS and Type C Devices with 3A High Speed Charging – 1.2 Meter",AXL,1,0,0,239,3.5,33,73,"Wednesday, February 16",1,33
341,B08QMGR72L,INICIO Quad 4 in 1 60W PD Cable Dual USB-C / A To Type C / iP Power Delivery Compatible For Mac-Book iPad Pro Air iPhone 13 12 Pro Max XS 11 XR SE iPad Air Galaxy S21 S20 Note 20 Ultra Pixel Redmi,INICIO,1,0,0,899,4.4,35,40,"Wednesday, February 16",1,35
342,B07Z6FH6FX,"ShopMagics Type C USB Cable for Xiaomi Mi Max 2 USB Cable | Data Sync Cable | Rapid Quick Dash Fast Charging Cable | Charger Cable | Type-C to USB-A Cable (3.1 Amp, 1 Meter/3.2 Feet, Black)",ShopMagics,0,0,0,279,3.9,24,60,"Wednesday, February 16",1,24
343,B081GFKZR9,"UGREEN Charger Cable for iPhone 12, USB-C to Lightning Cable Right Angle 90 Degree [6FT MFi-Certified] Braided Power Delivery for iPhone 12 Pro SE 11 Pro Max X XR XS Max 8 Plus, AirPods, iPad",UGREEN,0,0,0,"1,579",4.0,"1,072",39,"Friday, February 18",1,"1,072"
344,B091YS59SR,"USB Type-C Cable for Samsung Galaxy A20s,A21,A21s ,A30 ,A30sA31,A41 ,A42,A50,A50s,A51,A52,A70,A71,A81,A9,A91 USB Cable Original Like Type-C Cable | C-Type Charger Cable | Type C Rapid Quick Dash Fast Charging Cable | Type-C Data Sync Cable | Type C to USB-A Cable (3.1 Amp, 1 Meter/3.2 Feet, Black)",USB,0,0,0,289,5.0,3,71,"Wednesday, February 16",1,3
345,B0995FFGZD,"Ultra Fast Type C Charging & Sync Data Cable For Samsung Galaxy A21s / A 21 s Original High Quality USB Type C to USB A Male Cable | Sync Cable | Quick Charge Cable Speed Upto 3.1 Amp | High Speed Data Transfer Cable Best Tangle Free Heavy Duty High Speed Cable ( 3.1 Amp, 1 Meter , White )",Ultra,0,0,0,299,0,0,63,"Wednesday, February 16",1,"₹299
₹799 Save ₹500 (63%)"
346,B08RB83GVS,iEDS USB C Cable for iPhone 12 11 20W PD Fast Charge USB C to Lighting Cable for iPhone 8 Xr Charger Data USB Type C Cable 1.5 Meters (Pack of Two Cables),iEDS,0,0,0,699,3.6,6,65,"Wednesday, February 16",1,6
347,B099RV7CXV,"Ultra Fast Type C Charging & Sync Data Cable For Sony Xperia R1 Plus Original High Quality USB Type C to USB A Male Cable | Sync Cable | Quick Charge Cable Speed Upto 3.1 Amp | High Speed Data Transfer Cable Best Tangle Free Heavy Duty High Speed Cable ( 3.1 Amp, 1 Meter , Black )",Ultra,0,0,0,299,5.0,2,63,"Wednesday, February 16",1,2
348,B09QHZ6FCY,Sachdeal Type-C to USB Type-C Cable For Samsung Galaxy S10 Lite Original Type-C To Type C USB Data & Charging Cable | PD Charger Cable | Dash WRAP Charging Cable | USB 3.1 type C Fast Charging Cable 60W 3A High Speed Rapid Fast Turbo QC 3.0 Charging Cable A (3.1 Ampere),Sachdeal,0,0,0,399,0,0,50,"Wednesday, February 16",1,"₹399
₹799 Save ₹400 (50%)"
349,B07RG9TQT7,Astrum UT312 USB-C Cable 1.2M Type A-Type C Male (Black),Astrum,0,0,0,149,0,0,50,"Friday, February 18",0,"₹149
₹299 Save ₹150 (50%)"
350,B07D7PM3S9,"AmazonBasics Double Braided Nylon USB Type-C to Type-A 3.1 Gen 2 Cable, 3 Feet (0.9 Meters) - Silver",AmazonBasics,1,0,0,789,4.4,605,44,"Thursday, February 17",1,605
351,B07N2PKF4G,"ESR USB-C to Lightning Cable, (1 meter, MFi-Certified), PD Fast Charging Cable for iPhone 13/13 mini/13 Pro/13 Pro Max/12/12 mini/12 Pro/12 Pro Max/11/XR/XS Max/XS/X/8,Braided Nylon,Black",ESR,1,0,0,"1,499",4.4,"12,814",6,"Thursday, February 17",1,"12,814"
352,B07XY973VB,"WeCool Nylon Braided 3A Type c Charger Cable or c Type Data Cable for Data SYNC Fast Charging for Smartphones (1 Meter, Black)",WeCool,1,0,0,179,3.7,860,82,"Tuesday, February 15",1,860
353,B09D7NY5F3,"PEATOP TYPE-C Cable, USB Type C, Nylon Braided (1.0 Meter, Golden)",PEATOP,1,0,0,179,3.9,30,78,"Tuesday, February 22",1,30
354,B0966CVLLM,"Ultra Fast Type C Charging & Sync Data Cable For Lenovo Yoga Tab 3 Plus Original High Quality USB Type C to USB A Male Cable | Sync Cable | Quick Charge Cable Speed Upto 3.1 Amp | High Speed Data Transfer Cable With Mobile Tablet PC Laptop Android Smartphone C type Cable | Best Tangle Free Heavy Duty High Speed Cable @ 349 ( 3.1 Amp, 1 Meter , White )",Ultra,0,0,0,349,0,0,65,"Wednesday, February 16",0,"₹349
₹999 Save ₹650 (65%)"
355,B099VV787F,"Ultra Fast Type C Charging & Sync Data Cable For Samsung Galaxy S20 FE 5G Original High Quality USB Type C to USB A Male Cable | Sync Cable | Quick Charge Cable Speed Upto 3.1 Amp | High Speed Data Transfer Cable Best Tangle Free Heavy Duty High Speed Cable ( 3.1 Amp, 1 Meter , White )",Ultra,0,0,0,299,5.0,1,63,"Wednesday, February 16",1,1
356,B0822QSL9W,"Portronics Konnect Flat POR-520, 2.4A 1Meter Type-C Cable with Charge & Sync Function for Type-C Devices (White)",Portronics,0,0,0,229,4.2,18,62,"Wednesday, February 16",1,18
357,B09BF6D4GH,"Muvit 8 Pin USB C Cable Compatible with iPhone 12/12 Mini/12 Pro Max, Power Delivery 3.0 Fast Charging Cable (iphne_USB C Cable)",Muvit,0,0,0,299,0,0,70,"Wednesday, February 16",1,"₹299
₹999 Save ₹700 (70%)"
358,B08P8S7SPC,"MM BRAND USB Type C Charger Cable Fast Charging USB C Cable Compatible for Samsung Galaxy S10e S10 S9 S8 Plus S10+, Note 10 Note 9 Note 8 All Smartphone Type C (1M, Black)",MM,0,0,0,249,0,0,69,"Wednesday, February 16",1,"₹249
₹799 Save ₹550 (69%)"
359,B00GGGOYEU,Storite USB 2.0 A to Mini 5 pin B Cable for External HDDS/Camera/Card Readers (150cm - 1.5M),Storite,0,0,0,269,4.0,666,62,"Monday, February 14",1,666
360,B08SMKJDLX,"ShopMagics Type-C USB Cable for Samsung Galaxy M31 / M 31 USB Cable Original Like | Charger Cable | Rapid Quick Dash Fast Charging Cable | Data Sync Cable | Type C to USB-A Cable (3.1 Amp, 1 Meter/3.2 Feet, TC2, Black)",ShopMagics,0,0,0,349,3.8,4,50,"Wednesday, February 16",1,4
361,B09R1S2XPZ,"Starkwoood Type C (Pack 2) Usb Cable For Samsung Galaxy A32 Original USB Type C Sync Cable Quick Charge Cable Speed Upto 3.1 Amp Strong & Durable High Speed Data Sync Transfer Cable Best Tangle Free Cable ( 2.4 Amp,White )",Starkwoood,0,0,0,399,0,0,50,"Wednesday, February 16",1,"₹399
₹799 Save ₹400 (50%)"
362,B09Q6HTX9G,JVN Nylon Braided Type C Fast Charging Cable USB-C Data Cable for SYNC for Smartphones (1 Meter Multicolour) By 2 get 1 Free,JVN,1,0,0,199,1.0,1,75,"Thursday, February 17",1,1
363,B0853F738X,"NUUAH Metal Braided Made in India Micro USB Charging Data Cable for Android Phones and Tablets, 2.4A Fast Charging and 480 Mbps High Speed Data Transmission,3.3 Feet (Silver)",NUUAH,1,0,0,399,3.8,302,50,"Tuesday, February 15",1,302
364,B095STFKP6,"( Pack of 2 ) Ultra Fast Type C Charging & Sync Data Cable For vivo V20 Pro Original High Quality USB Type C to USB A Male Cable | Sync Cable | Quick Charge Cable Speed Upto 3.1 Amp | High Speed Data Transfer Cable With Mobile Tablet PC Laptop Android Smartphone C type Cable | Best Tangle Free Heavy Duty High Speed Cable ( 3.1 Amp, 1 Meter , White )",(,0,0,0,499,0,0,50,"Wednesday, February 16",1,"₹499
₹999 Save ₹500 (50%)"
365,B09PKFN9X1,"T3S C to C Data Cable Compatible with OnePlus 9 Pro 8T Fast Charging Cable 6.5A Warp Charge USB C to USB C Cable, 1 mtr Super Fast Charging Cord Compatible with Pro 13/16 Air 4 Note 20 S20 FE 5G",T3S,0,0,0,299,3.7,16,50,"Wednesday, February 16",1,T3S
366,B095PL4QX9,"Ultra Fast Type C Charging & Sync Data Cable For Xiaomi Poco X2 Original USB Type C to USB A Male Cable | Sync Cable | Quick Charge Cable Speed Upto 3.1 Amp | High Speed Data Transfer Cable With Mobile Tablet PC Laptop Android Smartphone C type Cable | Best Tangle Free Heavy Duty High Speed Cable ( 3.1 Amp, 1 Meter , White )",Ultra,0,0,0,349,4.0,3,56,"Wednesday, February 16",1,3
367,B0995D47SW,"Ultra Fast Type C Charging & Sync Data Cable For vivo S1 Pro Original High Quality USB Type C to USB A Male Cable | Sync Cable | Quick Charge Cable Speed Upto 3.1 Amp | High Speed Data Transfer Cable Best Tangle Free Heavy Duty High Speed Cable ( 3.1 Amp, 1 Meter , White )",Ultra,0,0,0,299,3.4,3,63,"Wednesday, February 16",1,3
368,B0832DC7W8,"USB C to USB C Cable, Anker Powerline III USB-C to USB-C Fast Charging Cord (10 ft), 60W Power Delivery PD Charging for Apple MacBook, iPad Pro, Samsung Galaxy S10 Plus S9 S8 Plus, Pixel, and More",USB,0,0,0,"4,299",4.7,"1,613",14,"Thursday, March 3",0,"1,613"
369,B076HRZYJ8,"Soopii USB Type C Cable, SooPii 2 Cable (4ft + 1ft) Nylon Braided USB C to USB A Fast Charger Cord Sync Cable for Samsung, LG/G5/G6, HTC 10, One Plus, Nokia and More USB Type C Devices.( 1.2M and 30 cm )(Red and Blue)",Soopii,0,0,0,566,3.7,59,62,"Wednesday, February 16",1,59
370,B09657RBY6,"Fast Type-C Cable For Samsung Galaxy A20 Original Cable Type-C USB Cable | Data Sync Cable | Rapid Quick Dash Fast Charging Cable | Charger Cable | Type C to USB-A Cable (3.1 Amp, 1 Meter/3.2 Feet, LY1, White)",Fast,0,0,0,298,4.4,8,63,"Wednesday, February 16",1,8
371,B07FYX7F8J,Zoook ICHARGE PD USB C to Lightning Cable (White),Zoook,0,0,0,675,2.8,7,3,"Tuesday, February 15",1,7
372,B09MNHVSTF,"AXL Nylon Braided 3 in 1 Multifunction Charging Cable for Android, iOS and Type C Devices with 3A High Speed Charging – 1.2 Meter",AXL,1,0,0,239,3.5,33,73,"Wednesday, February 16",1,33
373,B08DTPHD7M,"CableCreation USB C to USB C Charger Cable 60W, 3ft Type C 3A Fast Charging Cable, Compatible with MacBook Pro 13”, iPad Pro 2020/2018, Galaxy S20/S10/S9/S9+, Pixel 3 XL, 1M/ Black",CableCreation,1,0,0,559,4.5,48,63,"Thursday, February 17",1,48
374,B08MZL1DSX,iEDS USB C 3.1 Braided Male to Female USB-C Extension Cable 100W 10Gbps Supports 4K Video (0.6 M),iEDS,1,0,0,979,4.5,18,51,"Wednesday, February 16",1,18
375,B08HWHC89K,Dyazo 1 M Nylon Braided 5.0 Amp Type C Cable Data Sync Fast Charging Type-C Cord With Flexi Head Technology Compatible With Samsung Galaxy S10 Note 10 S9 S8 Pixel 3 Xl Google Pixel And More,Dyazo,1,0,0,499,4.2,961,75,"Monday, February 14",1,961
376,B06XFXDHTM,"RS3 Type C Fast Charging Cable | QUICK Charging |USB C Compatible with Samsung Galaxy A80 A51 S21 Ultra, S20 S10 lite, Note 20 Note10 (Black TYPE C 2 TYPE C)",RS3,0,0,0,399,5.0,2,80,"Wednesday, February 16",1,RS3
377,B09R1SFQ93,"Starkwoood Type C Usb Cable For OnePlus 9RT 5G Original USB Type C Sync Cable Quick Charge Cable Speed Upto 3.1 Amp Strong & Durable High Speed Data Sync Transfer Cable Best Tangle Free Cable ( 2.4 Amp,RED )",Starkwoood,0,0,0,399,0,0,50,"Wednesday, February 16",1,"₹399
₹799 Save ₹400 (50%)"
378,B09R1SQ9VD,"Starkwoood Type C Usb Cable For Xiaomi Poco M2 Pro Original USB Type C Sync Cable Quick Charge Cable Speed Upto 3.1 Amp Strong & Durable High Speed Data Sync Transfer Cable Best Tangle Free Cable ( 2.4 Amp,White )",Starkwoood,0,0,0,299,0,0,63,"Wednesday, February 16",1,"₹299
₹799 Save ₹500 (63%)"
379,B09R1SH189,"Starkwoood Type C Usb Cable For vivo Y72 5G (India) Original USB Type C Sync Cable Quick Charge Cable Speed Upto 3.1 Amp Strong & Durable High Speed Data Sync Transfer Cable Best Tangle Free Cable ( 2.4 Amp,White )",Starkwoood,0,0,0,299,0,0,63,"Wednesday, February 16",1,"₹299
₹799 Save ₹500 (63%)"
380,B08SMK2MTD,"ShopMagics Type-C USB Cable for Xiaomi Mi 8 Youth (Mi 8 Lite) USB Cable Original Like | Charger Cable | Rapid Quick Dash Fast Charging Cable | Data Sync Cable | Type C to USB-A Cable (3.1 Amp, 1 Meter/3.2 Feet, TC2, Black)",ShopMagics,0,0,0,349,3.5,6,50,"Wednesday, February 16",1,6
381,B09FHX7GLW,"CROGIEType C Cable, Compatible with OnePlus 9 it Supports 65w Adapter Charging Cable 6.5A Warp Charge USB C to USB C Cable Male",CROGIEType,0,0,0,249,0,0,38,"Wednesday, February 16",1,"₹249
₹399 Save ₹150 (38%)"
382,B0995F2JNX,"Ultra Fast Type C Charging & Sync Data Cable For vivo Z1x Original High Quality USB Type C to USB A Male Cable | Sync Cable | Quick Charge Cable Speed Upto 3.1 Amp | High Speed Data Transfer Cable Best Tangle Free Heavy Duty High Speed Cable ( 3.1 Amp, 1 Meter , White )",Ultra,0,0,0,299,5.0,1,63,"Wednesday, February 16",1,1
383,B0725DW6D3,Belkin F2CD084BT0.5MBK 100W Thunderbolt 3 USB-C to USB-C Cable (Black),Belkin,0,0,0,"2,899",4.4,479,68,"Friday, February 18",1,479
384,B09R1TTQ56,Infinizy Lightweight Magnetic Type Mic cro USB-C Charging Cable for All Type Mic Devices with 1 Year Warranty,Infinizy,1,0,0,499,0,0,50,"Wednesday, February 16",0,"₹499
₹999 Save ₹500 (50%)"
385,B081ZCZKSQ,INICIO 4 in 1 60W PD Cable Dual USB-C/A to Type C/IP Power Delivery Data Sync Compatible for iPhone 13 12 11 XR XS Max Pro MacBook iPad Air Galaxy S21 S20 Note 20 S10 Redmi & Other Phones,INICIO,1,0,0,899,4.4,8,40,"Wednesday, February 16",1,8
386,B09NPTJSNM,Sachdeal Type-C to USB Type-C Cable For Samsung Galaxy F62 Original Type-C To Type C USB Data & Charging Cable | PD Charger Cable | Dash WRAP Charging Cable | USB 3.1 type C Fast Charging Cable 60W 3A High Speed Rapid Fast Turbo QC 3.0 Charging Cable (3.1 Ampere),Sachdeal,0,0,0,399,5.0,2,50,"Wednesday, February 16",1,2
387,B08NZHMQSW,Honeywell Type C to Type C USB 3.1 Cable 1.2mtr - (Braided) - Grey,Honeywell,0,0,0,"1,200",4.8,15,8,"Wednesday, February 16",0,15
388,B099QRKF85,Type C To Type C 60W 5A PD 100cm TPE Fast Charging Data Cable White USB C Cable,Type,0,0,0,275,0,0,68,"Wednesday, February 16",0,"₹275
₹850 Save ₹575 (68%)"
389,B09MNP5LZ4,"Detro Type C cable, Compatible with OnePlus Nord CE 5G/ Nord/ 7/ 7T/ 7 Pro/ 7T Pro, 6T McLaren Charging Cable 6A Warp/Dash Charge USB C to USB male, Replacement 1m 30W Fast charger Cord",Detro,0,0,0,315,0,0,68,"Thursday, February 17",0,"₹315
₹993 Save ₹678 (68%)"
390,B09DVZ6BJ8,"Detro Type C Cable, Compatible with OnePlus Nord/Nord 2/ Nord C Supports 65w Adapter Charging Cable 6.5A Warp Charge USB C to USB C Cable Male",Detro,0,0,0,355,0,0,49,"Thursday, February 17",0,"₹355
₹694 Save ₹339 (49%)"
391,B09MNMRFX2,"Detro Type C cable, Compatible with OnePlus 3/ 3T/5/ 5T Charging Cable 6A Warp/Dash Charge USB C to USB male, Replacement 1m 30W Fast charger Cord",Detro,0,0,0,312,0,0,68,"Tuesday, February 15",0,"₹312
₹979 Save ₹667 (68%)"
392,B08SQ992KP,"ShopMagics Type-C USB Cable for Xiaomi Mi 10 Pro / Mi10 Pro USB Cable Original Like | Charger Cable | Rapid Quick Dash Fast Charging Cable | Data Sync Cable | Type C to USB-A Cable (3.1 Amp, 1 Meter/3.2 Feet, TC2, White)",ShopMagics,0,0,0,349,5.0,1,50,"Wednesday, February 16",1,1
393,B0964ZNXYW,DMS 20W QUICK Charging l PD Cable l USB C TO USB C CAHRGING CABLE FOR Samsung Galaxy M20 Mobile Phone l C TO C l C2C l Phone C To Phone C Charging Cable l C Type Adapter Cable l PD Cable For PD Charger,DMS,0,0,0,299,0,0,63,"Thursday, February 17",1,"₹299
₹799 Save ₹500 (63%)"
394,B07DDPNBJZ,"AmazonBasics Apple Certified Lightning to USB Charge and Sync Cable, 6 Feet (1.8 Meters) - Red",AmazonBasics,1,0,0,649,4.1,"166,141",50,"Monday, February 14",1,"166,141"
395,B076HMXH5G,"Soopii Original Type c Fast Charging USB Data Cable - Reversible Charger, 1.2 Meter Long, Nylon Braided, Aluminum Connector Support .(Red)",Soopii,1,0,0,330,3.7,5,67,"Wednesday, February 16",1,5
396,B085Y8LRDS,"Belkin Type C to USB-A 2.0 Tough Unbreakable Braided Nylon Cable 6.6 feet (2 meter) – Black, USB-IF Certified, Supports Fast Charging",Belkin,1,0,0,650,4.4,"1,086",41,"Tuesday, February 15",1,"1,086"
397,B013G4ECF0,"CableCreation USB C to Ethernet, Type-C (Thunderbolt 3 Compatible) to RJ45 Gigabit LAN Network Adapter,Compatible with MacBook Pro, iPad Pro/MacBook Air 2018, Surface Book 2,Dell XPS 13/15,Black",CableCreation,1,0,0,919,4.4,815,54,"Thursday, February 17",1,815
398,B093XSC4N6,"Fast Type C Cable For Xiaomi Redmi Note 9 Pro Max Original Cable Type-C USB Cable | Data Sync Cable | Rapid Quick Dash Fast Charging Cable | Charger Cable | Type C to USB-A Cable By K N DIGITAL (3.1 Amp, 1 Meter/3.2 Feet, KH4-White)",Fast,0,0,0,280,5.0,1,65,"Wednesday, February 16",1,1
399,B0868P5DC1,ALOGIC Super Ultra USB 2.0 USB-C to USB-C Cable - 5A/480Mbps - Space Grey - 30 cm,ALOGIC,0,0,0,"1,290",0,0,0,"Friday, February 18",1,"₹1,290"
400,B07YC4S6DK,"ESR USB-C to Lightning Cable, (1 meter, MFi-Certified), PD Fast Charging Cable for iPhone 13/13 mini/13 Pro/13 Pro Max/12/12 mini/12 Pro/12 Pro Max/11/XR/XS Max/XS/X/8, Braided Nylon, (2 Pack), Black",ESR,0,0,0,"1,799",4.5,"1,324",22,"Friday, February 18",1,"1,324"
401,B08GZKDLJ4,"BLENDIA 5V USB-C USB 3.1 Type C Female to USB 3.0 Male Adapter Connector Converter USB 3.1 Type C Adapter 0m USB Type C Cable(Compatiable with Mobile,Blue,one Cable)",BLENDIA,0,0,0,149,3.4,40,63,"Thursday, February 17",0,40
402,B091YVHFZL,"C Type USB Data Sync Cable for Samsung Galaxy A50,Samsung Galaxy A50s,Samsung Galaxy A51 USB Cable Original Like Type-C Cable | C-Type Charger Cable | Type C Rapid Quick Dash Fast Charging Cable | Type-C Data Sync Cable | Type C to USB-A Cable (3.1 Amp, 1 Meter/3.2 Feet, White)",C,0,0,0,265,4.4,9,67,"Wednesday, February 16",1,9
403,B081ZCZKSQ,INICIO 4 in 1 60W PD Cable Dual USB-C/A to Type C/IP Power Delivery Data Sync Compatible for iPhone 13 12 11 XR XS Max Pro MacBook iPad Air Galaxy S21 S20 Note 20 S10 Redmi & Other Phones,INICIO,0,0,0,899,4.4,8,40,"Wednesday, February 16",1,8
404,B08SR1G9Y3,"ShopMagics Type-C USB Cable for Samsung Galaxy M41 / M 41 USB Cable Original Like | Charger Cable | Rapid Quick Dash Fast Charging Cable | Data Sync Cable | Type C to USB-A Cable (3.1 Amp, 1 Meter/3.2 Feet, TC2, White)",ShopMagics,0,0,0,349,4.0,2,50,"Wednesday, February 16",1,2
405,B092MN295V,"Siwi Type-C USB Cable for Realme 8 Pro USB Cable Original Like | Charger Cable | Rapid Quick Dash Fast Charging Cable | Data Sync Cable | Type C to USB-A Cable (3.1 Amp, 1 Meter/3.2 Feet, TC3, Black)",Siwi,0,0,0,269,0,0,62,"Wednesday, February 16",1,"₹269
₹699 Save ₹430 (62%)"
406,B08RP2L2NL,"King Shine Multi Retractable 3.0A Fast Charger Cord, Multiple Charging Cable 4Ft/1.2m 3-in-1 USB Charge Cord Compatible with Phone/Type C/Micro USB for All Android and iOS Smartphones (Random Colour)",King,1,0,0,349,3.6,354,73,"Wednesday, February 16",1,354
407,B09Q8CDLZF,"WeCool Unbreakable Soft PVC 5V/3A Type C Cable Supports Fast Charging, Quick Charging, Dash Charging and Warp Charging, 1 Mtr Charging Cable, Compatible with OnePlus, Oppo and VIVO Smartphones",WeCool,1,0,0,499,0,0,75,"Wednesday, February 16",1,"₹499
₹1,999 Save ₹1,500 (75%)"
408,B08DTKZTLH,"USB C to USB C Cable 100W 6FT, LYWHL Type C Fast Charging Cable, PD Fast Charger Power Cord for Samsung Galaxy Note 20 Ultra, Note 20 10 Plus, S20 10 Plus, iPad pro 12.9 11 2020, MacBook Pro",USB,0,0,0,"5,107",4.6,35,47,"Friday, February 18",0,35
409,B09R1T4HBS,"Starkwoood Type C Usb Cable For vivo Y51 (2020, December) Original USB Type C Sync Cable Quick Charge Cable Speed Upto 3.1 Amp Strong & Durable High Speed Data Sync Transfer Cable Best Tangle Free Cable ( 2.4 Amp,RED )",Starkwoood,0,0,0,399,0,0,50,"Wednesday, February 16",1,"₹399
₹799 Save ₹400 (50%)"
410,B08KSM2FWR,[Intel Thunderbolt Certified] Cable Matters 40Gbps USB4 Thunderbolt 4 Cable with 8K Video and 100W Charging in 2.6 ft - Backwards Compatible with Thunderbolt 3 and USB-C,[Intel,0,0,0,"3,299",4.4,203,30,"Wednesday, February 16",1,203
411,B091HXRBHW,"ClickTell Fast charging Cable for Samsung Galaxy A30s Compatible USB Cable | Data Sync Cable | Rapid Quick Dash Fast Charging Cable | Charger Cable | Type C to USB-A Cable (3.1 Amp, 1 Meter/3.2 Feet,OB5, WHITE)",ClickTell,0,0,0,260,4.1,6,67,"Wednesday, February 16",1,6
412,B09K3S9CL2,"Shopdeal Ultra Fast Type C Charging & Sync Data Cable For Xiaomi Poco X3 Pro Original USB Type C | Sync Cable | Quick Charge Cable Speed Upto 3.1 Amp | High Speed Data Transfer Cable Best Tangle Free Cable ( 3.1 Amp, 1 Meter , White )",Shopdeal,0,0,0,299,1.0,1,63,"Wednesday, February 16",1,1
413,B08ZB17FT6,WRENS Type-C to Type-C Data Cable 45W/3A Supports Ultra-Fast Charging & High-Speed Data Transmission up to 480mbps PD 3 feet (0.9 m)-Black,WRENS,0,0,0,198,5.0,1,80,"Wednesday, February 16",1,1
414,B09PBWM24Z,AGNILLE Micro USB Double Braided 3.1A Fast Charging & Data Transfer Cable for all Android Devices - [Black] (2M),AGNILLE,0,0,0,299,4.5,2,70,"Wednesday, February 16",1,2
415,B07QNHSN63,AICase Multi Charger Cable(4ft) Nylon Braided Universal 3 in 1 Multiple USB Charging Cord Adapter 2.4A Current with 8Pin Plug/USB Type C/Micro USB Connector Ports for Cell Phones Tablets and More,AICase,0,0,0,"1,257",4.2,18,80,"Wednesday, February 16",1,18
416,B08W56TMGQ,"Multi 3.0A Fast Charger Cord, Multiple Charging Cable 4Ft/1.2m 3-in-1 USB Charge Cord Compatible with Phone/Type C/Micro USB for All Android and iOS Smartphones (Random Colour)",Multi,1,0,0,325,3.8,13,67,"Wednesday, February 16",1,13
417,B09K781W21,Portronics Konnect 3 Way 3-in-1 Multi Functional Cable (Micro USB+8Pin+Type C) 3Amp I 1.2m Length,Portronics,1,0,0,458,3.9,43,24,"Friday, February 18",0,43
418,B072J1BSV6,"AmazonBasics Micro USB Charging Cable for Android Phones with Gold Plated Connectors (3 Feet, Black) - 3 Pack",AmazonBasics,1,0,0,679,4.1,"64,759",2,"Monday, February 14",1,"64,759"
419,B01LONPUM4,AmazonBasics USB Type-C to USB Type-C 2.0 Cable - 6 Inches (15.2 Centimeters) - Black,AmazonBasics,1,0,0,539,4.2,"2,414",9,"Wednesday, February 16",1,"2,414"
420,B07FDMF7RR,"Wayona USB Type C Cable, [3Ft, 6Ft,10Ft] Nylon Brained USB C Charger Fast Charging Data Cord (Black, Pack of 3)",Wayona,0,0,0,799,4.4,17,60,"Monday, February 14",1,17
421,B08RWGKM82,Retractable Multi Charging Cable | 3-in-1 USB Charging Cord Compatible with Phone/Type C/Micro USB for All Android and iOS Smartphones (Random Colour) by King Shine,Retractable,1,0,0,329,3.6,19,67,"Wednesday, February 16",1,19
422,B09R27XH5X,Plutonic Lightweight Magnetic Type Mic cro USB-C Charging Cable for All Type Mic Devices with 1 Year Warranty,Plutonic,1,0,0,399,0,0,60,"Wednesday, February 16",0,"₹399
₹999 Save ₹600 (60%)"
423,B07RHV8MRN,"Blendia Type C to USB Power Bank Adapter Sync and Charging USB C Type Cable USB Type C Cable (All Phones with Type C Port, White, Sync and Charge Cable)",Blendia,0,0,0,249,0,0,50,"Friday, February 18",0,"₹249
₹499 Save ₹250 (50%)"
424,B09CMP1SC8,"Ambrane ABDC-10 2 in 1 Type-C & Micro USB Cable with 3A Fast Charging, 480 mbps High Data Transmission Speed, Compatible with All Type-C & MIcro USB Devices (Black/Grey)",Ambrane,1,0,0,229,4.2,24,54,"Tuesday, February 15",1,24
425,B013G4EAEI,"CableCreation Mirco USB Short 2.0 A Male to Micro B USB Triple Shielded Wire Fast Charge Cable, 0.5 Feet-Black",CableCreation,1,0,0,399,4.2,"4,896",13,"Thursday, February 17",1,"4,896"
