,asin,title,brand,Sponsored,Best Seller,Amazon's Choice,Price,Rating,NoofRatings,Discount,Delivery,Prime Delivery,base
242,B083R8L8RF,"HEERA MOTI CORPORATION Sample Engineered Wood TV Entertainment Unit ,White",HEERA,1,0,0,"2,999",3.5,171,50,"Monday, February 21",1,171
243,B09MRVS7NV,Heera Moti Corporation Rock TV Entertainment Wall Mount Unit (White),Heera,1,0,0,"1,999",4.0,1,50,"Monday, February 21",1,1
244,B07MZNVQS9,"Bluewud Gautier Engineered Wood Tv Entertainment Unit Cabinet with Storage, Wenge, for Upto 32""",Bluewud,0,0,0,"4,399",4.0,109,23,"Tuesday, February 22",1,109
245,B09HCHYN34,"Furnifry Wooden TV Stand Table with 3 Tier Storage Shelves & Door for Home Living Room Bedroom/Modern TV Entertainment Stand Base Perfect for Cable Box (73x34x68.4 cm, Walnut Finish)",Furnifry,0,0,0,"4,599",5.0,1,23,"Wednesday, February 23",1,1
246,B08622F411,Anikaa Revolt Engineered Wood Wall Mount TV Unit/TV Stand/Wall Set Top Box Stand/TV Cabinet/TV Entertainment Unit (Walnut)(Ideal for 42.52 Inch)(D.I.Y),Anikaa,0,0,0,"2,774",3.9,44,55,"Monday, February 21",1,44
247,B09HQ1KDLK,"BlukWood TV Entertainment | Wall Unit Engineered Wood, Wall Set-top Box Stand, Modern TV Cabinet, Living Room Storage Space (Color - Black",BlukWood,0,0,0,999,3.0,1,47,"Tuesday, February 22",0,1
248,B07N3WCZFH,"Bluewud Charley Engineered Wood Tv Entertainment Unit Cabinet with Storage, Wenge, for Upto 50""",Bluewud,0,0,0,"5,899",3.9,226,31,"Tuesday, February 22",0,226
249,B09NNWPX6G,"YAGVIZ TV Stand Wooden Media Storage TV Console Living Room Entertainment Center, Home Television Stands with Drawers and Open Storage Shelves, Low Profile Media Console Bedside Table",YAGVIZ,0,0,0,"1,199",3.0,1,54,"Monday, February 21",1,1
250,B09GKN25Z2,"Anikaa Charley Engineered Wood Wall Mount TV Unit/TV Stand/Wall Set Top Box Stand/TV Cabinet/TV Entertainment Unit (Wenge)(Ideal for Upto 52"")(D.I.Y)",Anikaa,0,0,0,"4,349",4.0,15,64,"Monday, February 21",1,15
251,B07VY489FK,Anikaa Rizos Engineered Wood Wall Mount TV Unit/TV Stand/Wall Set Top Box Stand/TV Cabinet/TV Entertainment Unit (Walnut)(D.I.Y),Anikaa,0,0,0,"1,494",4.2,14,75,"Monday, February 21",1,14
252,B07CXW3QXM,"DeckUp Reno Engineered Wood 2 door TV Stand and Home Entertainment Unit (Dark Wenge, Matte Finish)",DeckUp,0,0,0,"6,839",4.4,189,53,"Saturday, February 26",0,189
253,B08WRM88JN,"Anikaa Jadis Engineered Wood Wall Mount TV Unit/TV Stand/Wall Set Top Box Stand/TV Cabinet/TV Entertainment Unit (Walnut)(Ideal for Upto 52"")(D.I.Y)",Anikaa,0,0,0,"3,014",3.5,8,54,"Monday, February 21",1,8
254,B08RWQJP54,"Bros Moon International TV Entertainment Unit Set Top Box Glossy Wall Stand Home Decor Wall Shelf Wooden Racks 1 Set Top Box Stand and 2 Interconnect (Now Rings Included, Black and White)",Bros,0,0,0,"1,579",3.7,9,80,"Friday, February 25",0,9
255,B0761VTGS7,"Anikaa Vactor Engineered Wood TV Unit/TV Stand/Floor Standing TV Unit/TV Cabinet/TV Entertainment Unit (Wenge)(Ideal for Upto 52"")(D.I.Y)",Anikaa,0,0,0,"4,374",4.0,32,71,"Monday, February 21",1,32
256,B08VGS3GZD,Brown Art Shoppee Set Top Box Stand Wall Shelf & WiFi Modem Rack for Living Room (Brown),Brown,0,0,0,424,4.1,166,47,"Tuesday, February 22",1,166
257,B09ND7T2QS,Redwud Ancor Engineered Wood TV Entertainment Unit/TV Cabinet for Wall/Set Top Box Holder/TV Stand Unit for Wall for Living Room (Wenge White)(Ideal for 42-52 Inch) (D.I.Y),Redwud,0,0,0,"3,799",0,0,40,"Monday, February 21",1,"₹3,799
₹6,299 Save ₹2,500 (40%)"
258,B09BF5XK65,"Anikaa Betty Engineered Wood TV Unit/TV Stand/Floor Standing TV Unit/TV Cabinet/TV Entertainment Unit (White) - Ideal for Upto 52""(D.I.Y)",Anikaa,0,0,0,"4,014",0,0,60,"Monday, February 21",1,"₹4,014
₹9,999 Save ₹5,985 (60%)"
259,B08R2PB3WQ,Heera Moti Corporation Max TV Entertainment Tv Stand/Set Top Box Stand (Finish :- White Matt),Heera,0,0,0,"3,499",3.4,3,42,"Monday, February 21",1,3
260,B09Q8W7NGT,Heera Moti Corporation Panela TV Entertainment Wall Mount Unit/Wall Panels for Tv Unit up to 43 inches (Finish: - Black Matt),Heera,1,0,0,"5,499",3.4,12,45,"Monday, February 21",1,12
261,B09PHN7D4Z,Heera Moti Corporation MRC TV Entertainment Wall Mount Unit/Wall Panel for tv Unit up to 43 inch(Black),Heera,1,0,0,"2,999",2.5,4,40,"Monday, February 21",1,4
262,B08337SMRY,"HEERA MOTI CORPORATION Mac Metal Wall Mount TV Unit (Brown, Finish:-Pre-Laminated Wenge)",HEERA,1,0,0,"1,499",4.0,65,0,"Monday, February 21",1,65
263,B08PZJBTGF,"Dime Store Wooden Wall Mounted TV Unit, TV Cabinet for Wall, TV Stand for Wall, TV Stand Unit Wall Shelf for Living Room, Set Top Box Stand (Large, Total Brown)",Dime,1,0,0,"2,199",3.8,"1,013",56,"Wednesday, February 23",1,"1,013"
264,B08XWB6RDQ,"Bluewud Rowlet Engineered Wood Tv Entertainment Unit Cabinet with Storage, Wenge & White, for Upto 50""",Bluewud,0,0,0,"12,999",4.3,211,13,"Tuesday, February 22",0,211
265,B093BJ61H4,Redwud Nixon Wooden TV Entertainment Unit/Set Top Box Holder for Home/TV Cabinet for Wall/TV Stand Unit for Wall for Living Room (Wenge/White) (Ideal for 32-40 Inch),Redwud,0,0,0,"1,599",3.9,5,16,"Monday, February 21",1,5
266,B08VS1DC9W,TG Furniture Sheesham Wood TV Stand Cabinet Home Entertainment Unit with 2 Door and Shelf Storage for Living Room Bedroom Hall Wooden Furniture (Honey Finish),TG,0,0,0,"11,279",5.0,5,68,,1,5
267,B08LNXRNP9,"DAS Wall Mount TV Entertainment Unit/with Set Top Box Stand for Living Room Classic Walnut (Ideal for up to 42"") Screen- Alfric",DAS,0,0,0,"1,449",3.3,8,53,"Monday, February 21",1,8
268,B08DL5Q1SM,"Heera Moti Corporation Bruna TV Stand Entertainment Center Unit for Decorative Furniture Standard, Upto 50 in(Finish :-White pre- laminted Matt)",Heera,0,0,0,"3,999",3.3,9,43,"Monday, February 21",1,9
269,B09NDMN93G,ESTANTERIA Bezel Engineered Wood Wall Mount TV Entertainment Unit with Set Top Box Stand and 2 Wall Shelves Display Rack (Wenge Finish),ESTANTERIA,0,0,0,"1,999",0,0,44,"Tuesday, February 22",1,"₹1,999
₹3,599 Save ₹1,600 (44%)"
270,B09R1W5N5T,"Furnifry Wall Mounted 3 Tier TV Entertainment Unit/Table Storage & Decor Wood TV Cabinet for Living Room/Wall Set Top Box Floating Shelf Nightstand Cabinet with Open Center Shelf (36x8x4.5 in, White)",Furnifry,0,0,0,"1,794",5.0,1,64,"Wednesday, February 23",1,1
271,B091DZT38C,Redwud Taxin Wooden TV Entertainment Unit/Wall Set Top Box Shelf Stand/Set Top Box Holder for Home/TV Cabinet for Wall/TV Stand Unit for Wall for Living Room (Wenge/White),Redwud,0,0,0,"1,999",2.2,4,60,"Monday, February 21",1,4
272,B093BHVY21,Redwud Nixon Wooden Wall Set Top Box Shelf Stand/Wooden TV Entertainment Unit/Set Top Box Holder for Home/TV Cabinet for Wall/TV Stand Unit for Wall for Living Room (Walnut) (Ideal for 32-40 Inch),Redwud,0,0,0,"1,599",4.0,2,16,"Monday, February 21",1,2
273,B096P3Y31F,"Heera Moti Corporation Oliver TV Stand Entertainment Center Unit for Decorative Furniture (Standard, Upto 50 Inches, Finish :-White Pre- lamented Matt)",Heera,0,0,0,"4,999",5.0,1,29,"Monday, February 21",1,1
274,B082NJV3ZD,redwud flair standard wall mounted tv unit shelf/set top box stand (wenge),redwud,0,0,0,979,3.5,11,62,"Monday, February 21",1,11
275,B07BZVMC75,"DeckUp Awana TV Stand and Engineered Wood TV Entertainment Unit Walnut , 2 Doors",DeckUp,0,0,0,"5,224",4.4,381,53,"Saturday, February 26",0,381
276,B082FLK1C3,"G Fine Furniture Wooden TV Stand Unit for Living Room with 2 Cabinets, 2 Drawers & Shelf Storage | Sheesham, Brown",G,0,0,0,"21,999",4.5,16,34,,1,16
277,B09754XZ5D,Studio Crafts Shoppee Tv Cabinet Shelves Set-Top Box WiFi Router Rack Wooden Floating Wall Shelf Wall-Mounted Tv Console Router DVD Player Media Equipment Storage Shelf (Brown),Studio,0,0,0,425,4.2,85,47,"Tuesday, February 22",1,85
278,B099RVTZ15,"Anikaa Tyson Engineered Wood Wall Mount TV Unit/TV Stand/Wall Set Top Box Stand/TV Cabinet/TV Entertainment Unit (Wenge)(Ideal for Upto 52"")(D.I.Y)",Anikaa,0,0,0,"5,299",3.8,14,47,"Monday, February 21",1,14
279,B07N41C315,"Bluewud Harmond Engineered Wood Tv Entertainment Unit Cabinet with Storage, Wenge, for Upto 50""",Bluewud,0,0,0,"6,199",4.0,134,14,"Tuesday, February 22",0,134
280,B09364QYKL,Anikaa Cruze Engineered Wood Wall Mount TV Unit/TV Stand/Wall Set Top Box Stand/TV Cabinet/TV Entertainment Unit (Wenge/White)(Ideal for 32-40 Inch)(D.I.Y),Anikaa,0,0,0,"1,599",4.0,1,60,"Monday, February 21",1,1
281,B0982DFT1B,"DAS Wall Mount TV Entertainment Unit/with Set Top Box Stand and 3 Wall Shelves Display Rack Frosty White (Ideal for up to 40"") Screen- Zeenat",DAS,0,0,0,"1,849",3.6,11,63,"Monday, February 21",1,11
282,B08RSN2VBR,aaRF Engineered Wood TV Entertainment Wall Unit/Set-Top Box Stand Engineered Wood TV Entertainment Wall Unit/Set-Top Box Stand (Standard Black),aaRF,0,0,0,918,3.1,2,69,"Tuesday, February 22",0,2
283,B09C6C35KY,Klaxon Crocus Engineered Wood TV Entertainment Unit - Black,Klaxon,0,0,0,"3,316",0,0,63,"Friday, February 25",0,"₹3,316
₹8,999 Save ₹5,683 (63%)"
284,B097QDCMY5,"Wooden Set Top Box Stand Wall Mounted TV Cabinets Wall Selves Holds Speaker, Cable Boxes, Streaming Device, Game Console, Remote, WiFi Router",Wooden,0,0,0,396,3.8,3,60,"Tuesday, February 22",1,3
285,B07R4CJ6QY,Anikaa Aura Engineered Wood Wall Mount TV Unit/TV Stand/Wall Set Top Box Stand/TV Cabinet/TV Entertainment Unit (Walnut)(D.I.Y),Anikaa,0,0,0,514,0,0,57,"Monday, February 21",1,"₹514
₹1,199 Save ₹685 (57%)"
286,B096ZZ3T8W,"DAS Christiano Wall Mount TV Entertainment Unit/with Set Top Box Stand for Living Room Frosty White (Ideal for up to 32"") Screen",DAS,0,0,0,949,3.7,7,57,"Monday, February 21",1,7
287,B07JH4GNNT,Madhuran Wall Mounted Set Top Box Stand Prelaminated Wooden Wenge Set of 1 Perfect Organizer Tv Entertainment Unit Stand,Madhuran,0,0,0,753,4.0,55,37,"Monday, February 21",1,55
288,B0834B496N,Fabwud TV Entertainment Unit Set Top Box Wall Stand Home Decor Wall Shelves Wooden Racks Wall Decor White & Black,Fabwud,0,0,0,"1,499",3.9,24,32,"Wednesday, February 23",0,24
289,B09S3GPLKV,Redwud James Wooden TV Entertainment Unit/Set Top Box Holder for Home/TV Cabinet for Wall/TV Stand Unit for Wall for Living Room (White) (Ideal Upto 60 Inch),,0,0,0,0,0,0,0,,0,
290,B09S3BM6RL,Redwud James Wooden Wall Set Top Box Shelf Stand/Wooden TV Entertainment Unit/Set Top Box Holder for Home/TV Cabinet for Wall/TV Stand Unit for Wall for Living Room (Walnut) (Ideal Upto 60 Inch),Redwud,0,0,0,"2,449",0,0,59,"Monday, February 21",1,"₹2,449
₹5,999 Save ₹3,550 (59%)"
291,B08L9J3XLN,"Anikaa Taina Engineered Wood Wall Mount TV Unit/TV Stand/Wall Set Top Box Stand/TV Cabinet/TV Entertainment Unit (Ideal for Upto 52"")(Wenge)(D.I.Y)",Anikaa,0,0,0,"1,849",3.6,22,63,"Monday, February 21",1,22
292,B09S3CQYCL,Redwud Nixon Wooden TV Entertainment Unit/Set Top Box Holder for Home/TV Cabinet for Wall/TV Stand Unit for Wall for Living Room (White) (Ideal for 32-40 Inch),Redwud,0,0,0,"1,599",0,0,16,"Monday, February 21",1,"₹1,599
₹1,899 Save ₹300 (16%)"
293,B08L1QYJHF,"DAS Wall Mount TV Entertainment Unit/with Set Top Box Stand and 3 Wall Shelves Display Rack Classic Walnut (Ideal for up to 48"") Screen- Bolivar",DAS,0,0,0,"2,699",4.6,11,61,"Monday, February 21",1,11
294,B09S3PVZ2N,Redwud Austin Wooden Wall Set Top Box Shelf Stand/Wooden TV Entertainment Unit/Set Top Box Holder for Home/TV Cabinet for Wall/TV Stand Unit for Wall for Living Room (Walnut) (Ideal Upto 75 Inch),Redwud,0,0,0,"2,999",0,0,50,,1,"₹2,999
₹5,999 Save ₹3,000 (50%)"
295,B09S3JSLMS,Redwud James Wooden TV Entertainment Unit/Set Top Box Holder for Home/TV Cabinet for Wall/TV Stand Unit for Wall for Living Room (Wenge/White) (Ideal Upto 60 Inch),Redwud,0,0,0,"2,449",0,0,59,"Monday, February 21",1,"₹2,449
₹5,999 Save ₹3,550 (59%)"
296,B09BL71Z4X,"Redwud Parker Engineered Wood TV Entertainment Unit TV Cabinet with Wall Shelves Wall Mounted TV Unit TV Cabinet with Shelf (Wenge) - Ideal for Upto 52""",Redwud,1,0,0,"4,899",3.7,12,51,"Monday, February 21",1,12
297,B09H69M2VX,Kundi Floating TV Stand Wall Mounted Media Console Entertainment Storage Shelf Black,Kundi,1,0,0,"1,199",4.1,"1,282",40,"Wednesday, February 23",0,"1,282"
298,B09R81XHZ2,"Dime Store Wooden Wall Mounted TV Unit Cabinet for Wall, TV Stand for Wall, TV Stand Unit Wall Shelf for Living Room, Set Top Box Stand (Standard, Brown)",Dime,1,0,0,"1,599",0,0,54,"Wednesday, February 23",1,"₹1,599
₹3,499 Save ₹1,900 (54%)"
299,B0994LYBH2,Heera Moti Corporation Dep TV Entertainment Wall Mount Unit/Wall Panel for tv Unit up to 55 inch (Finish :- White Matt),Heera,1,0,0,"5,499",2.5,3,45,"Monday, February 21",1,3
300,B08B4Z3WJQ,"HEERA MOTI CORPORATION Engineered Wood Open Multi Functional White Finish L Shape TV Stands Furniture Unit (White, Finish :- Pre- laminated Matt)",HEERA,1,0,0,"8,999",3.5,15,25,"Monday, February 21",1,15
301,B0994LRV9T,Heera Moti Corporation Anent Engineered Wood TV Entertainment Wall Mount Unit/Wall Panel for tv Unit up to 50 inch (Finish :- White Matt),Heera,1,0,0,"2,999",3.4,46,50,"Monday, February 21",1,46
302,B08P9F91H5,"Heera Moti Corporation Sample TV Stand Entertainment Center Unit for Decorative Furniture Standard, Upto 43 Inch (Finish :-Black pre- laminted Matt)",Heera,1,0,0,"2,999",3.5,171,50,"Monday, February 21",1,171
303,B08DL7SYGF,"Heera Moti Corporation Anamic TV Stand Entertainment Center Unit for Decorative Furniture Standard, Upto 50 in(Finish :-White pre- laminted Matt)",Heera,1,0,0,"2,999",3.7,14,57,"Monday, February 21",1,14
304,B097YCC1B5,"Anikaa Tyler Engineered Wood TV Unit/TV Stand/Floor Standing TV Unit/TV Cabinet/TV Entertainment Unit (Wenge)(Ideal for Upto 52"")(D.I.Y)",Anikaa,0,0,0,"4,014",3.7,12,67,"Monday, February 21",1,12
305,B08J7KYWS3,"Inmarwar Solid Wood Entertainment TV Unit for Living Room | TV Stand with 2 Doors Cabinet Storage| Acacia Wood & Iron, Walnut Acacia",Inmarwar,0,0,0,"12,299",5.0,7,40,,1,7
306,B07X2L4Z7B,The Wood Concept Multipurpose Wooden Wall Shelf 2 Interlock and A Set Top Box Stand TV Entertainment Unit Black & White,The,0,0,0,"1,713",3.7,86,79,"Friday, February 25",0,86
307,B09RWPQSH4,Anikaa Cruze Engineered Wood Wall Mount TV Unit/TV Stand/Wall Set Top Box Stand/TV Cabinet/TV Entertainment Unit (White)(Ideal for 32-40 Inch)(D.I.Y),Anikaa,0,0,0,"1,599",0,0,60,"Monday, February 21",1,"₹1,599
₹3,999 Save ₹2,400 (60%)"
308,B09S3KBP3V,Redwud James Wooden Wall Set Top Box Shelf Stand/Wooden TV Entertainment Unit/Set Top Box Holder for Home/TV Cabinet for Wall/TV Stand Unit for Wall for Living Room (Wenge) (Ideal Upto 60 Inch),Redwud,0,0,0,"2,449",0,0,59,"Monday, February 21",1,"₹2,449
₹5,999 Save ₹3,550 (59%)"
309,B08Q7W4RVL,Redwud Oscar Wooden TV Entertainment Unit/Wall Set Top Box Shelf Stand/TV Cabinet for Wall/Set Top Box Holder for Home/TV Stand Unit for Wall for Living Room (Wenge),Redwud,0,0,0,"2,583",4.4,6,58,"Monday, February 21",1,6
310,B09KPXLMDG,Orrda Foldable Screen Top || Stand Screen Top Shelf Computer Monitor Set-Up Box Riser Desktop Stand TV Wall Mount Rack Display Shelf Storage Rack (Black),Orrda,0,0,0,389,0,0,29,"Monday, February 21",1,"₹389
₹549 Save ₹160 (29%)"
311,B09S34JC3R,Redwud Tracy Wooden TV Entertainment Unit/Wall Set Top Box Shelf Stand/TV Cabinet for Wall/Set Top Box Holder for Home/TV Stand Unit for Wall for Living Room (White),Redwud,0,0,0,"2,299",0,0,59,"Monday, February 21",1,"₹2,299
₹5,599 Save ₹3,300 (59%)"
312,B09RWR5DLG,Anikaa James Engineered Wood Wall Mount TV Unit/TV Stand/Wall Set Top Box Stand/TV Cabinet/TV Entertainment Unit (Wenge/White)(Upto 60 Inch)(D.I.Y),Anikaa,0,0,0,"2,449",0,0,73,"Monday, February 21",1,"₹2,449
₹8,999 Save ₹6,550 (73%)"
313,B07L33VP63,Worthy Shoppee Wrought Iron and Wooden Double Holder Set Top Box Stand for Wall Tv Remote Holder,Worthy,0,0,0,599,2.7,3,54,"Friday, February 18",0,3
314,B09PJFLRWF,"Anikaa Finn Engineered Wood Wall Mount TV Unit/TV Stand/Wall Set Top Box Stand/TV Cabinet/TV Entertainment Unit (Walnut)(Ideal for Upto 40"")(D.I.Y)",Anikaa,0,0,0,"1,424",0,0,72,"Monday, February 21",1,"₹1,424
₹4,999 Save ₹3,575 (72%)"
315,B091DZ19DC,Redwud Taxin Wooden TV Entertainment Unit/Wall Set Top Box Shelf Stand/Set Top Box Holder for Home/TV Cabinet for Wall/TV Stand Unit for Wall for Living Room (Wenge),Redwud,0,0,0,"1,999",5.0,1,60,"Monday, February 21",1,1
316,B09PYZB7N1,"Bluewud Anatdol Engineered Wood TV Entertainment Unit/Cabinet (Wenge & White) - for Upto 50""",Bluewud,0,0,0,"4,449",0,0,31,,1,"₹4,449
₹6,449 Save ₹2,000 (31%)"
317,B07J4ZKZSJ,Anikaa Aly Engineered Wood TV Entertainment Unit/TV Stand/Wall Set Top Box Shelf Stand/TV Cabinet for Wall/Set Top Box Holder for Home/TV Stand Unit for Wall for Living Room (Walnut) (D.I.Y),Anikaa,0,0,0,713,3.5,8,64,"Monday, February 21",1,8
318,B09G99BHLX,"Furnifry Wall Mounted TV Entertainment Unit with 2 Drawers/Table Storage & Decor Wood TV Cabinet for Living Room, Drawing Room, Bedroom/Wall Set Top Box Floating Shelf Stand(24 x 8 x 4.5 inches,White)",Furnifry,0,0,0,"1,399",3.7,13,53,"Wednesday, February 23",1,13
319,B097Q5881R,"Wooden Set Top Box Stand Wall Mounted TV Cabinets Wall Selves Holds Speaker, Cable Boxes, Streaming Device, Game Console, Remote, WiFi Router",Wooden,0,0,0,649,0,0,35,"Tuesday, February 22",1,"₹649
₹999 Save ₹350 (35%)"
320,B09Q8W6S2R,Heera Moti Corporation Panela TV Entertainment Wall Mount Unit/Wall Panels for Tv Unit up to 43 inches (Finish: - White Matt),Heera,1,0,0,"5,499",3.4,12,45,"Monday, February 21",1,12
321,B09MRV89TD,Heera Moti Corporation Rock TV Entertainment Wall Mount Unit (Black),Heera,1,0,0,"1,999",4.0,1,50,"Monday, February 21",1,1
322,B089P2CGKR,"HEERA MOTI CORPORATION Flexible Multi-Purpose Engineered Wood TV Entertainment Unit White , 1 Door",HEERA,1,0,0,"5,499",3.7,17,45,"Monday, February 21",1,17
323,B09R83DS3X,"Dime Store Wooden Wall Mounted TV Unit Cabinet for Wall, TV Stand for Wall, TV Stand Unit Wall Shelf for Living Room, Set Top Box Stand (Standard, Black)",Dime,1,0,0,"1,599",0,0,54,"Wednesday, February 23",1,"₹1,599
₹3,499 Save ₹1,900 (54%)"
324,B08RSNW64D,aaRF Engineered Wood TV Entertainment Wall Unit/Set-Top Box Stand Engineered Wood TV Entertainment Wall Unit/Set-Top Box Stand (Standard Black),aaRF,0,0,0,918,5.0,1,69,"Tuesday, February 22",0,1
325,B07P8SZH28,Anikaa Vincent Engineered Wood Wall Mount TV Unit/TV Stand/Wall Set Top Box Stand/TV Cabinet/TV Entertainment Unit (Wenge)(D.I.Y),Anikaa,0,0,0,"1,314",3.9,152,49,"Monday, February 21",1,152
326,B09DSRT8J5,Heera Moti Corporation Nent Tv Stand up to 50 Inches (Finish :-White pre- Laminated Matt),Heera,0,0,0,"5,999",0,0,40,"Monday, February 21",1,"₹5,999
₹10,000 Save ₹4,001 (40%)"
327,B0941RBRTL,"DAS Oscar Wall Mount TV Entertainment Unit/with Set Top Box Stand for Living Room Wenge (Ideal for up to 43"") Screen",DAS,0,0,0,"1,649",4.0,1,68,"Monday, February 21",1,1
328,B08XQFL8W2,UCrafts Wooden Carved Wall shelve for WiFi & Set top Box Wall Mount Stand or Shelf Red Home Sparkle TV Entertainment Unit ( Brown)(25*19*7),UCrafts,0,0,0,299,3.5,2,57,"Wednesday, February 23",0,2
329,B08BZPG2SK,DAS Wall Mounted Engineered Wood TV Entertainment Unit/Set Top Box Stand Classic Walnut - Ariann,DAS,0,0,0,499,4.0,1,50,"Monday, February 21",1,1
330,B09QYHN6HY,"Anikaa Heider Engineered Wood TV Unit/TV Stand/Floor Standing TV Unit/TV Cabinet/TV Entertainment Unit (Wenge) - Ideal for Upto 52"" (D.I.Y) Matte Finish",Anikaa,0,0,0,"6,749",0,0,58,"Monday, February 21",1,"₹6,749
₹15,999 Save ₹9,250 (58%)"
331,B09QMGR5HP,Citaaz Wooden TV Stand Media Storage TV Console Living Room Entertainment Center Home Television Stands with Drawers and Open Storage Shelves Low Profile Media Console Bedside Table End Table,Citaaz,0,0,0,"1,199",0,0,50,"Monday, February 21",1,"₹1,199
₹2,399 Save ₹1,200 (50%)"
332,B08QD8J7M4,Redwud Tracy Wooden TV Entertainment Unit/Wall Set Top Box Shelf Stand/TV Cabinet for Wall/Set Top Box Holder for Home/TV Stand Unit for Wall for Living Room (Wenge),Redwud,0,0,0,0,3.6,7,0,,0,7
333,B08L82LNJD,Redwud Axcel Wooden TV Entertainment Unit/Wall Set Top Box Shelf Stand/TV Cabinet for Wall/Set Top Box Holder for Home/TV Stand Unit for Wall for Living Room (Wenge),Redwud,0,0,0,984,3.9,26,61,"Monday, February 21",1,26
334,B075FWZB2V,"DeckUp Bei Engineered Wood / Particle Board TV Entertainment Unit Dark Wenge , 2 Doors",DeckUp,0,0,0,"5,499",4.2,145,56,"Saturday, February 26",0,145
335,B09NY99YJC,Gvnd Wooden TV Stand Media Storage TV Console Living Room Entertainment Center Home Television Stands with Drawers and Open Storage Shelves Low Profile Media Console Bedside Table End Table,Gvnd,0,0,0,"1,193",0,0,59,"Monday, February 21",1,"₹1,193
₹2,899 Save ₹1,706 (59%)"
336,B09DVVC2HL,"Furnifry Wooden Wall Mounted Floating TV Stand/TV Entertainment Unit/TV Cabinet with Racks for Set Top Box & Decorative Objects/TV Stand Unit for Living Room with Storage Shelf(43.3x9.2x9.2 In, Wenge)",Furnifry,0,0,0,"1,779",5.0,4,70,"Wednesday, February 23",1,4
337,B083J4MVW8,Ganpati Arts Solid Sheesham Wood Cosmos TV Stand Cabinet with Storage for Living Room Home Entertainment Unit Wooden Bedroom Furniture (Natural Finish),Ganpati,0,0,0,"19,999",4.0,3,36,"Saturday, February 26",0,3
338,B07STHJSTT,Decostyle Engineered Wood Wall Mounted TV Entertainment Unit/Set Top Box Stand (Wenge),Decostyle,0,0,0,"1,899",3.9,86,50,"Tuesday, February 22",1,86
339,B07J2LN7ML,Anikaa Perry Engineered Wood Wall Mount TV Unit/ TV Stand/ Wall Set Top Box Stand / TV Cabinet/ TV Entertainment Unit (Walnut)(D.I.Y),Anikaa,0,0,0,644,5.0,1,75,"Monday, February 21",1,1
340,B099RWM3YP,"Anikaa Tyson Engineered Wood Wall Mount TV Unit/TV Stand/Wall Set Top Box Stand/TV Cabinet/TV Entertainment Unit (Walnut)(Ideal for Upto 52"")(D.I.Y)",Anikaa,0,0,0,"4,874",5.0,6,51,"Monday, February 21",1,6
341,B09LLHT8BF,"Anikaa Jasper Engineered Wood Wall Mount TV Unit/TV Stand/Wall Set Top Box Stand/TV Cabinet/TV Entertainment Unit (Wenge)(Ideal for Upto 52"")(D.I.Y)",Anikaa,0,0,0,"3,474",0,0,61,"Monday, February 21",1,"₹3,474
₹8,999 Save ₹5,525 (61%)"
342,B081S1GKQ2,"HEERA MOTI CORPORATION Gun Pre-laminated board TV Entertainment Unit ,White",HEERA,0,0,0,"3,499",3.3,44,53,"Monday, February 21",1,44
343,B08MTQ8WKK,Madhuran Aai Set Top Box Stand Wooden Wall Mounted Red/Perfect Organizer Tv Entertainment Unit Stand,Madhuran,0,0,0,747,3.4,7,38,"Monday, February 21",1,7
344,B08JV9NGTC,"Furnifry Wooden Wall Mounted TV Cabinet with Racks for Set Top Box and Decorative Objects for Living Room - Accessories Included (29.8"" x 9.25'' x 3.7'', White)",Furnifry,0,0,0,979,3.6,35,39,"Wednesday, February 23",1,35
345,B08RP6HHL3,Craftcity TV Entertainment Unit Set Top Box Wall Stand Home Decor Wall Shelf Wooden Racks Wall D�cor Black & White 1 Set Top Box Stand and 2 Interconnect & 10 Wall Stickers Rings (Interconnect),Craftcity,0,0,0,"1,740",3.4,56,21,"Wednesday, February 23",0,56
346,B0863B6QP7,Anikaa Crystal Engineered Wood Wall Mount TV Unit/TV Stand/Wall Set Top Box Stand/TV Cabinet/TV Entertainment Unit (Walnut)(Ideal for 42.52 Inch)(D.I.Y),Anikaa,0,0,0,"3,199",4.1,69,54,"Monday, February 21",1,69
347,B07P2WV7ZW,Anikaa Ester Engineered Wood Wall Mount TV Unit/TV Stand/Wall Set Top Box Stand/TV Cabinet/TV Entertainment Unit (Wenge)(D.I.Y),Anikaa,0,0,0,"1,114",3.9,7,55,"Monday, February 21",1,7
348,B084FC2YDL,AMAZE SHOPPEE MDF Wall Shelf for Set Top Box/WiFi Router/TV Entertainment Unit (White),AMAZE,0,0,0,549,4.2,614,45,"Thursday, February 17",0,614
349,B08R3WW9MN,"GION Foldable Screen Top Shelf Adjustable Stand Computer Monitor Riser TV Screen Remote Set Up Box Top Storage Stand Shelf Computer Display Storage Desk,Home Office Desktop Organizer Shelf",GION,0,0,0,519,0,0,28,"Monday, February 21",1,"₹519
₹719 Save ₹200 (28%)"
350,B08XXR5J1S,Anikaa Ancort Engineered Wood Wall Mount TV Unit/TV Stand/Wall Set Top Box Stand/TV Cabinet/TV Entertainment Unit (Walnut)(Ideal for 42-52 Inch)(D.I.Y),Anikaa,0,0,0,"3,814",4.2,14,39,"Monday, February 21",1,14
351,B097Y9WNVR,"Anikaa Tessa Engineered Wood TV Unit/TV Stand/Floor Standing TV Unit/TV Cabinet/TV Entertainment Unit(Walnut)(Ideal for Upto 52"")(D.I.Y)",Anikaa,0,0,0,"5,924",5.0,3,63,"Monday, February 21",1,3
352,B08TBPTD93,"SAMISHI Wooden TV Setup Box Stand/Holder, TV Entertainment Unit Shelf 60x21x12 cm (Black)",SAMISHI,0,0,0,772,3.4,4,52,"Wednesday, February 23",0,4
353,B08YNHYLGT,Lignum Pro Walnut Wooden TV Cabinet Unit with Set Top Box Shelf Stand.,Lignum,0,0,0,"2,099",0,0,48,"Tuesday, February 22",0,"₹2,099
₹3,999 Save ₹1,900 (48%)"
354,B08GSCVRC2,HomeStrap Trends Engineered Wood TV Unit/Set top Box Stand with Storage Shelves (Urban Teak),HomeStrap,0,0,0,"2,499",4.1,14,50,"Tuesday, February 22",1,14
355,B09L64MGBS,"Anikaa Jasper Engineered Wood Wall Mount TV Unit/TV Stand/Wall Set Top Box Stand/TV Cabinet/TV Entertainment Unit (White)(Ideal for Upto 52"")(D.I.Y)",Anikaa,0,0,0,"3,474",0,0,61,"Monday, February 21",1,"₹3,474
₹8,999 Save ₹5,525 (61%)"
356,B07QLF2CGR,santosha decor sheesham wood standard tv stand and home entertainment unit (teak finish),santosha,1,0,0,"10,999",2.7,9,45,"Monday, March 7",0,9
357,B09B3Y86DC,"Redwud Skyler Engineered Wood TV Entertainment Unit/TV Cabinet/TV Stand/Entertainment Center Table/Display Storage Cabinet Rack (Wenge) - Ideal for Upto 52""",Redwud,1,0,0,"3,999",3.4,9,67,"Monday, February 21",1,9
358,B08R2N3YBT,Heera Moti Corporation Max TV Entertainment Tv Stand/Set Top Box Stand (Finish :- Walnut Matt),Heera,1,0,0,"4,999",3.4,3,17,"Monday, February 21",1,3
359,B09B3XRYT3,"Redwud Teresa Engineered Wood TV Entertainment Unit/TV Cabinet with Wall Shelves/Display Storage Cabinet Rack (White) - Ideal for Upto 52""",Redwud,1,0,0,"5,999",0,0,60,"Monday, February 21",1,"₹5,999
₹14,999 Save ₹9,000 (60%)"
