,asin,title,brand,Sponsored,Best Seller,Amazon's Choice,Price,Rating,NoofRatings,Discount,Delivery,Prime Delivery,base
0,B09MDQJDYK,"Mush Extra Large Cabana Style Turkish Towel 100% Bamboo - (90 x 160 cms) - Ideal for Beach, Bath, Pool etc (Peach & Turquoise, 1)",Mush,1,0,0,999,4.4,10,23,"Sunday, February 13",1,10
1,B0166CPBJA,"Amazon Brand - Solimo 100% Cotton 6 Piece Towel Set, 500 GSM (Iris Blue and Spanish Red)",Amazon,1,0,0,"1,011",4.3,"3,794",33,"Tuesday, February 8",1,"3,794"
2,B071P9YL2H,"Amazon Brand - Solimo 100% Cotton 2 Piece Bath Towel Set, 500 GSM (Olive Green and Turquoise Blue)",Amazon,1,1,0,899,4.3,"15,969",28,"Friday, February 11",1,"15,969"
3,B08FMSD7LQ,"Cloth Fusion Brookwella 100% Cotton 2 Piece Bath Towel Set ,500 GSM (Grey & Beige)",Cloth,1,0,0,699,4.1,443,46,"Friday, February 11",1,443
4,B07ZHDXW7X,Roseate Elegance 100% Cotton (550 GSM / 70x140 cm) Large Bath Towel Ultra Soft Super Absorbent/Anti Bacterial (Grey) Pack of 1,Roseate,0,0,0,399,4.0,"2,444",50,"Friday, February 11",0,"2,444"
5,B071P9YL2H,"Amazon Brand - Solimo 100% Cotton 2 Piece Bath Towel Set, 500 GSM (Olive Green and Turquoise Blue)",Amazon,0,1,0,899,4.3,"15,969",28,"Friday, February 11",1,"15,969"
6,B08WJ8RVQT,"Kuber Industries Cotton Towel (Set of 1, White)",Kuber,0,0,0,134,3.2,83,10,"Tuesday, February 8",0,83
7,B07Z42NPLL,"COMFORT WEAVE Cotton Bath Towels 250 GSM Multicolor(Set of 5, 31 X 62 Inch)",COMFORT,0,0,0,469,4.2,"3,710",22,"Wednesday, February 16",0,"3,710"
8,B0199X8KJQ,"Story@Home Sensational 100% Cotton Soft Bath Towel Single Piece, 450 GSM - Men and Women Bath Towel -Navy Blue",Story@Home,0,0,0,399,4.0,"2,286",69,,0,"2,286"
9,B0899RLBDR,"Yellow Weaves Super Soft Microfiber Hand Towels, Gym & Workout Towels 400 GSM(4 Pieces, Multi Colors)",Yellow,0,0,0,429,4.2,"2,155",32,"Saturday, February 12",0,"2,155"
10,B08DYDTR4T,"HOME CHOICE Cotton Bath Towel 250 GSM (Set Of 2, Multicolour)",HOME,0,0,0,199,3.7,799,50,"Thursday, February 10",0,799
11,B09MF9XXQF,Fezora Hair Towel Wrap Absorbent Towel Hair-Drying Bathrobe Magic Hair Warp Towel Super Quick-Drying Microfiber 500 GSM Bath Towel Hair Dry Cap Salon Towel (Multicolor),Fezora,0,0,0,159,3.9,78,68,"Sunday, February 13",1,78
12,B0996527BR,"UrbanLeaf Super Soft Microfiber Hand Towels, Gym & Workout Towels (4 Pieces, Multi Colors)",UrbanLeaf,0,0,0,459,4.1,198,33,"Saturday, February 12",0,198
13,B01J16F18O,"SOFTSPUN Microfiber Bath and Hair Care Towel, 60x120 Cms, 1 Piece Towel Set, 340 GSM (Grey). Soft and Comfortable, Extra Large Multi-Purpose Highly Absorbent.",SOFTSPUN,0,0,0,359,4.2,"1,921",35,"Saturday, February 12",0,"1,921"
14,B09PH9QSD9,Soheta Hair Towel Wrap Absorbent Towel Hair-Drying Bathrobe Magic Hair Warp Towel Super Quick-Drying Microfiber Bath Towel Hair Dry Cap Salon Towel (Multicolor) Set of 1,Soheta,0,0,0,184,4.4,33,54,"Sunday, February 13",1,33
15,B07V7FLHNQ,"COMFORT WEAVE Cotton Hand Towel 250 GSM (Set of 8 Pieces, Multicolor)",COMFORT,0,0,0,239,4.1,"4,216",20,"Wednesday, February 16",0,"4,216"
16,B09DF634TG,Skevera Super Quick-Drying Microfiber Bath Towel (Set of 2),Skevera,0,0,0,299,4.2,212,70,"Sunday, February 13",0,212
17,B08Q468NVY,"Ayus Cotton Hand Towel 450 GSM, Multicolour Ultra Soft and Super Absorbent (Set of 6)",Ayus,0,0,0,269,3.8,463,73,"Wednesday, February 16",0,463
18,B09P7J55BX,Khillayox Cotton Dark Extra Large Size Bath Towel 400 GSM | for Men & Women Set of 1 (30x60 inch) (Blue),Khillayox,0,0,0,299,2.0,3,40,"Saturday, February 12",1,3
19,B09MSB7FBQ,Casa Copenhagen Germany Design - He & She Collection 100% Super Soft Cotton Bath Towel Set - Spring Green & Iris Blue,Casa,0,0,0,799,3.9,61,60,"Tuesday, February 15",1,61
20,B07N45P441,"Haber Premium Light Weight 100% Cotton Bath Towel with Unique Micro Waffle Texture for Active Feel, Quick Absorption and Faster Drying Towel, 200 GSM Pack of 1- Myriad Collection, Green",Haber,1,0,0,699,4.0,198,7,"Friday, February 11",1,198
21,B07HMBMP24,Haber - Turkish Style Premium Cotton Bath Towel - White with Grey Stripe,Haber,1,0,0,"1,199",4.2,"1,220",14,"Friday, February 11",1,"1,220"
22,B09NRKZT6W,"Casa Copenhagen - Egyptian Cotton Eternal 2 Pcs Large Bath Towel (75 x 150 cm) Colour : - Mirage Grey, Flamingo Pink",Casa,1,0,0,799,4.2,50,0,"Tuesday, February 15",1,50
23,B07JFBZBQY,"Amazon Brand - Solimo 100% Cotton 3 Piece Towel Set, 500 GSM (Spanish Red)",Amazon,1,0,0,729,4.3,500,27,"Tuesday, February 8",1,500
24,B09JLMJPBZ,"UrbanLeaf Super Soft Microfiber Bath Towel Pack of 2 s- 70 x 140 cm, (Brown and Pink)",UrbanLeaf,0,0,0,769,4.5,81,36,"Saturday, February 12",1,81
25,B08NYW9JGC,"Wakefit Terry 100% Cotton 2 Piece Bath Towel Set, 500 GSM (Cafe Noir and Grape Wine)",Wakefit,0,0,0,698,4.2,"1,063",27,"Tuesday, February 15",1,"1,063"
26,B09PC5N1YX,PADHUMAM Cotton Bath Towels Large Size 80cm x 160cm - Pack of 2 pcs,PADHUMAM,0,0,0,420,4.0,2,53,"Wednesday, February 16",1,2
27,B09DSHK4S7,Skevera Set of 2 Hair Towel Wrap Absorbent Towel Hair-Drying Quick Dry Shower Caps Bathrobe Magic Hair Warp Towel Super Quick-Drying Microfiber Bath Towel Hair Dry Cap Salon Towel (pack of 2)multi colour,Skevera,0,0,0,299,3.9,317,67,"Sunday, February 13",0,317
28,B08XVVXC6M,Sipson Microfibre Bath Towel (Multicolor).,Sipson,0,0,0,199,3.8,215,60,"Sunday, February 13",0,215
29,B08Y7SKTX2,"House Beauty Anti-Bacterial Microfiber Bath Towel 300 gsm (Pack of 2, Multicolor)",House,0,0,0,699,4.0,678,56,"Friday, February 11",1,678
30,B09DWVW3DY,"GROWTH ALLEY Set of 2 Cotton Hair Towel Wrap for Women for Medium Hair, Quick Drying, Anti Frizz, Super Absorbent, (Blue-Grey)",GROWTH,0,0,0,340,4.4,99,72,"Sunday, February 13",1,99
31,B088P5PL69,"Kuber Industries Cotton Hand Towel 50 GSM (Set of 2, Multicolour)",Kuber,0,0,0,129,3.5,"1,177",24,"Tuesday, February 8",0,"1,177"
32,B09MS4Z8G5,Virovi Cotton Quick Absorbent Hair Drying Magic Hair Towel Wrap for Women,Virovi,0,0,0,159,4.4,90,68,"Sunday, February 13",1,90
33,B09N1C6Q3C,"Shopperszen Free Delivered 100% Cotton Bath Towel (450 GSM, 140 X 70 cm) Bath Towel Large Size for Men & Women - Multicolor",Shopperszen,0,0,0,139,2.5,4,65,"Saturday, February 12",0,4
34,B09MKGVV6K,selinta Hair Towel Wrap Absorbent Towel Hair-Drying Bathrobe Magic Hair Warp Towel Super Quick-Drying Microfiber Bath Towel Hair Dry Cap Salon Towel (Multicolor) Set of 1,selinta,0,0,0,149,3.8,57,70,"Sunday, February 13",1,57
35,B09Q1CG9Z5,Skylike Hair Towel Wrap Absorbent Towel Hair-Drying Bathrobe Magic Hair Warp Towel Super Quick-Drying Microfiber 500 GSM Bath Towel Hair Dry Cap Salon Towel (Multicolor) Set of 1,Skylike,0,0,0,148,4.1,17,70,"Sunday, February 13",1,17
36,B09RP8KL6R,"Reny trade Hair Towel Wrap for Women, Drying Towel Cotton Quick Absorbent 380 GSM 27x9 inches (Grey::RED)",Reny,0,0,0,199,0,0,85,"Sunday, February 13",1,"₹199
₹1,299 Save ₹1,100 (85%)"
37,B09NM3ZKDT,Mungat Cotton Quick Absorbent Hair Drying Magic Hair Towel Wrap for Women,Mungat,0,0,0,149,0,0,63,"Sunday, February 13",1,"₹149
₹399 Save ₹250 (63%)"
38,B09QZRXWGT,Tharunsha Elite Pure Cotton 500 GSM Large Size Terry Towel / Bath Towel / Beach Towel / Hair Towel / Gym Towel /Swimming Pool Towel - Combo 2 pc( 140 cm x 70 cm ) Biscuit Navy Blue,Tharunsha,0,0,0,548,0,0,73,"Tuesday, February 15",0,"₹548
₹2,000 Save ₹1,452 (73%)"
39,B09QYM6R8C,"SANSKARI Baba Soft Cotton Bath Towel for Men and Women (Full Size, 500 GSM) (Blue)",SANSKARI,0,0,0,299,0,0,50,"Saturday, February 12",1,"₹299
₹599 Save ₹300 (50%)"
40,B09Q18PWNV,ADRIAN Hair Towel Wrap Absorbent Towel Hair-Drying Quick Dry Shower Caps Bathrobe Magic Hair Warp Towel Super Quick-Drying Microfiber Bath Towel Hair Dry Cap Salon Towel (1),ADRIAN,0,0,0,249,4.9,14,75,,0,14
41,B01DW2SE28,Story@Home Cotton Bath Towel 450 GSM (Pink),Story@Home,0,0,0,379,3.9,765,68,"Saturday, February 12",0,765
42,B09PK5HZCQ,Soheta Microfiber Absorbent Hair-Drying Quick Dry Shower Caps Bathrobe Magic Warp Super Quick-Drying Bath Cap Salon Towel (Multicolor),Soheta,0,0,0,171,4.4,42,66,"Sunday, February 13",1,42
43,B09BMBF1Q6,"Ayus Cotton Hand Towel 450 GSM, Multicolour Ultra Soft and Super Absorbent (Set of 6)",Ayus,0,0,0,249,3.8,146,38,"Wednesday, February 16",0,146
44,B09NBZPXZ9,Khillayox Microfiber Large Size Bath Towel 400 GSM | for Men & Women Set of 1 (140x70 cm_Sky Blue),Khillayox,0,0,0,369,4.7,9,26,"Saturday, February 12",1,9
45,B09QCPPY9K,Sellsfly Hair Towel Wrap Absorbent Towel Hair-Drying Bathrobe Magic Hair Warp Towel Super Quick-Drying Microfiber Bath Towel Hair Dry Cap Salon Towel (Multicolor-400gsm)(Set of 1),Sellsfly,0,0,0,149,0,0,75,"Sunday, February 13",1,"₹149
₹599 Save ₹450 (75%)"
46,B07YDLLD6B,SAI BALAJI Handloom Towels 100% Pure Cotton (Pack of 3) with 1 Year Guarantee XXXL Size 36/72Inch(90/180cm) 3/6feet 800 GSM Heavy Quality(Multi Color) MNB:8,SAI,0,0,0,370,4.0,406,63,"Thursday, February 10",0,406
47,B09GXDK1RK,"Haus & Kinder 100% Cotton 2 Piece Bath Towel Set, 550 GSM (Blue & Navy)",Haus,0,0,0,899,4.6,16,40,"Sunday, February 13",1,16
48,B09GLWDB4B,"Mahaluxmi Creations 100% Cotton Hand Towels Set - Ultrasoft & Absorbent Wash Basin Wipe Napkins for Bathroom Kitchen Hotel - Stripes Small Towel for Face Hair Gym Spa, 13 x 20 Inches, Pack of 6",Mahaluxmi,0,0,0,279,4.8,8,33,"Wednesday, February 16",0,8
49,B09BBCMBLK,"HSR Collection Microfiber wash Basin Hanging Hand Kitchen Towel Napkin with Ties (44x24 cm, Pack of 4, Multicolor)",HSR,0,0,0,275,3.8,114,66,"Monday, February 14",0,114
50,B09QZMHCWF,Tharunsha Elite Pure Cotton 500 GSM Large Size Terry Towel /Bath Towel/Beach Towel/Hair Towel / Gym Towel /Swimming Pool Towel - Set of 1 pc( 140 cm x 70 cm ) Cabana Purple,Tharunsha,0,0,0,286,0,0,71,"Tuesday, February 15",0,"₹286
₹1,000 Save ₹714 (71%)"
51,B084DR2H1Q,JRM's Microfiber Soft Bath Towel Fashion Women Wearable Quick Dry Magic Bathing Beach Spa Bathrobes Wash Clothing Beach Dresses (Light Pink),JRM's,0,0,0,269,3.5,194,66,"Sunday, February 13",0,194
52,B071ZJ126R,"Amazon Brand - Solimo 100% Cotton 4 Piece Hand Towel Set, 500 GSM (Sepia Brown and Olive Green)",Amazon,0,1,0,559,4.3,"8,384",38,"Tuesday, February 8",1,"8,384"
53,B09LSGHNQ2,"Ultica Fab 550 GSM 100% Export Quality Cotton Bath Towels | Large Size Full Body Towel for Men and Women | Soft and Highly Absorbant Towels for Gym Pool Spa, 70 x 140 cm, Black, Pack of 1",Ultica,0,0,0,299,2.9,9,80,"Monday, February 14",1,9
54,B09QW717Q6,"Growth Alley Cotton Quick Absorbent Hair Drying Magic Hair Towel Wrap for Women (Grey, Blue, Dark Blue, White, Coral, Sea Green, Vine)",Growth,0,0,0,149,0,0,70,"Sunday, February 13",1,"₹149
₹499 Save ₹350 (70%)"
55,B07VJ6WJ31,"MorningVale 200gsm Cotton Printed Bath Towel (White, Full Size, 30x60inch, 3)",MorningVale,0,0,0,285,4.0,466,48,"Tuesday, February 15",1,466
56,B08P3FLYWJ,"Mush Bamboo-derived Rayon Towel (Set of 1, Dark Green) |Ultra Soft, Absorbent & Quick Dry Towel for Bath, Beach, Pool, Travel, Spa and Yoga | 29 x 59 Inches, 250 gsm",Mush,1,0,0,799,4.3,"1,576",20,"Saturday, February 12",1,"1,576"
57,B07JFBZM4B,"Amazon Brand - Solimo 100% Cotton Bath Towel, 500 GSM (Spanish Red)",Amazon,1,0,0,559,4.3,"1,308",30,"Sunday, February 13",1,"1,308"
58,B07Z42NPLL,"COMFORT WEAVE Cotton Bath Towels 250 GSM Multicolor(Set of 5, 31 X 62 Inch)",COMFORT,1,0,0,469,4.2,"3,710",22,"Wednesday, February 16",0,"3,710"
59,B07JG6V3GF,"Amazon Brand - Solimo 100% Cotton Bath Towel, 575 GSM (Almond Brown)",Amazon,1,0,0,729,4.1,310,34,"Tuesday, February 8",1,310
60,B07HM5WKT9,"Haber 100% Cotton Bath Towel | Quick Absorption and Faster Drying Towel | Pure Cotton | Multipurpose Bath Towels(Pack of 1, Sea Glass)",Haber,1,0,0,649,4.2,"1,220",7,"Friday, February 11",1,"1,220"
61,B01HBPKENO,"Amazon Brand - Solimo 100% Cotton 2 Piece Bath Towel Set, 500 GSM (Iris Blue and Sunshine Yellow)",Amazon,1,1,0,899,4.3,"15,969",28,"Friday, February 11",1,"15,969"
62,B071SHDWBN,"Amazon Brand - Solimo 100% Cotton 6 Piece Towel Set, 500 GSM (Sepia Brown and Olive Green)",Amazon,1,0,0,"1,229",4.3,"3,794",18,"Tuesday, February 8",1,"3,794"
63,B07JWKT9VZ,"Amazon Brand - Solimo 100% Cotton Bath Towel, 575 GSM (Drizzle Grey)",Amazon,1,0,0,729,4.1,310,34,,0,310
64,B08VJDQFPC,"Kuber Industries Cotton Bath Towel Super Soft, Fluffy, and Absorbent, Perfect for Daily Use 100% Cotton Towels, 500 GSM (Brown)-KUBMART16051",Kuber,0,0,0,249,3.3,57,17,"Tuesday, February 8",0,57
65,B0928WD3N1,Sellsfly Set of 2 Hair Towel Wrap Absorbent Towel Hair-Drying Hair Warp Towel Super Quick-Drying Microfiber Bath Towel Hair Dry Cap Salon Towel {Pack of 2-Multi Colour},Sellsfly,0,0,0,299,3.8,310,57,"Sunday, February 13",1,310
66,B08RMNBQL1,Keniro Hair Towel Wrap Absorbent Towel Hair-Drying Bathrobe Magic Hair Warp Towel Super Quick-Drying Microfiber 500 gsm Bath Towel Hair Dry Cap Salon Towel (Multicolor) Set of 1,Keniro,0,0,0,199,3.7,750,67,"Monday, February 14",0,750
67,B09B7K48QK,"AMRO HOME NEEDS Home Needs ¢ Soft and Highly Water Absorbent Cotton Bath Towel Full Size : 70 X 140 cm, Blue & RED, Combo Set of 2",AMRO,0,0,0,225,3.8,28,72,"Tuesday, February 15",1,28
68,B0865PHSLN,Roseate? Supreme Turkish Cotton Towel Gamcha (480 GSM/ 70x140 cm) for Men & Women Skin Friendly Shrink Proof (Red & Blue) Pack of 2,Roseate?,0,0,0,349,4.0,335,42,"Tuesday, February 8",0,335
69,B09LT2VQZH,"House Beauty Luxury Microfiber Anti-Bacterial, Super Absorbent, Ultra Soft Bath Towel for Men, Women, Kids Pack of 2 Solid(Grey and Blue)",House,0,0,0,699,4.4,12,56,"Monday, February 14",1,12
70,B08B1FT639,VEL TEXTILE Cotton Bath Towel (Green),VEL,0,0,0,185,3.7,36,54,"Tuesday, February 15",1,36
71,B09M9WYQLR,Styxon Microfiber Soft Bath Towel and Lady Spa Shower Towel Fashion Women Wearable Quick Dry Magic Bathing Beach Spa Bathrobes Wash Clothing Beach Dresses - (Multicolor),Styxon,0,0,0,295,3.0,1,67,"Sunday, February 13",1,1
72,B09HL673XK,H World Women's Cotton Quick Absorbent Hair Drying Magic Hair Towel Wrap,H,0,0,0,169,3.7,135,83,"Sunday, February 13",1,135
73,B09FSZPSDD,"Welspun 100% Cotton Quik Dry Bath Towel (Solid, 70CMX150CM) - Grey, Standard (1054466)",Welspun,0,0,0,329,4.6,3,0,"Tuesday, February 8",0,3
74,B09FSZMSF2,"Welspun 100% Cotton Quik Dry Bath Towel (Solid, 70CMX150CM) - Dark Magenta, Standard",Welspun,0,0,0,329,3.5,5,0,"Friday, February 11",0,5
75,B09GYG21GX,"Cloth Fusion Brookwella 100% Cotton Bath Towel Set of 1, 500 GSM (Teal)",Cloth,0,0,0,399,4.2,9,43,"Sunday, February 13",0,9
76,B097NBD8QM,Suratware Quick Turban Hair-Drying Absorbent Microfiber Towel/Dry Shower Caps/Bathrobe Hat/Magic Hair Wrap for Women,Suratware,0,0,0,229,2.0,4,62,"Sunday, February 13",1,4
77,B09H541NYK,"AYUS Soft and Super Absorbent 450 GSM Cotton Kitchen Hand Towels (Multicolor, Size: Medium, 30 x 52 cm) - Set of 4 Pieces",AYUS,0,0,0,299,4.3,18,40,"Wednesday, February 16",0,18
78,B09QKTRTRP,Sellsworld Hair Towel Wrap Absorbent Towel Hair-Drying Bathrobe Magic Hair Warp Towel Super Drying Microfiber Bath Towel Hair Dry Cap (Multicolor-Set of 1),Sellsworld,0,0,0,148,4.8,20,75,"Sunday, February 13",1,20
79,B09MZ5DLHL,Roseate Super Soft 100% Cotton (500 GSM) Magic Hair Towel Wrap Super Absorbent Quick Dry Shower Cap Bath Towel (Pink) Pack of 1,Roseate,0,0,0,169,4.2,21,72,"Monday, February 14",0,21
80,B09D3W489S,"Haber Light Weight 100% Cotton Bath Towel with Super Absorb Texture, Quick Absorption and Faster Drying Towel- Chevron Collection (Sea Glass, Pack of 1)",Haber,1,0,0,699,4.1,334,7,"Friday, February 11",1,334
81,B07N41N614,"Haber Aura 100% Cotton Extra Large Bath Towel, Quick Absorption and Faster Drying Towel | Blue, Pack of 1",Haber,1,0,0,799,4.3,80,6,"Friday, February 11",1,80
82,B07N41GJZZ,"Haber Aura Collection 100% Cotton Extra Large Bath Towel / Beach Towel, Quick Absorption and Faster Drying Towel, Pack of 1- Aura Collection | Mint",Haber,1,0,0,799,4.4,35,6,"Friday, February 11",1,35
83,B09NRNLJKD,"Casa Copenhagen - Egyptian Cotton Eternal 2 Pcs Large Bath Towel (75 x 150 cm) Colour : - Beige, Toffee",Casa,1,0,0,799,4.2,50,0,"Tuesday, February 15",1,50
84,B09K4MCWW3,"Heelium Bamboo Bath Towel - 400 GSM, Ultra Soft, Quick Dry, Lightweight & Odour Free, 140 x 70 cm, Pack of 1, Blue",Heelium,0,0,0,790,4.1,338,44,"Tuesday, February 8",1,338
85,B09HM4ZFGY,"Swimming Microfibre Towel (Dark Blue, 42 X 55)",Swimming,0,0,0,299,3.4,9,57,"Wednesday, February 16",0,9
86,B09CZB4RY4,KNSS Handloom 100% Pure Cotton Towels XXXL Size 36/72Inch(90/180cm) 3/6feet Heavy Quality( Pack of 4) Multi Color,KNSS,0,0,0,465,4.3,12,61,"Tuesday, February 15",0,12
87,B085FZN5Z9,"ABONY Cotton Hand Towel 500 GSM (Set of 1, White)",ABONY,0,0,0,89,4.1,22,70,"Tuesday, February 15",0,22
88,B08P4X9Y9B,"Mush Bamboo Face Towel Set of 3 - Multicolor| 100% Bamboo |Ultra Soft, Absorbent & Quick Dry Towel for facewash, Gym, Pool, Travel, Spa, Beauty Salon and Yoga | 14 x 14 Inches, 200 gsm",Mush,0,1,0,499,4.3,891,38,"Sunday, February 13",1,891
89,B0995H9FFL,"STAMIO 390 GSM Cotton Hand Towels Luxury 13 X 21 Inch (Santino Gold Border), Pack of 6 (Multicolored)",STAMIO,0,0,0,499,4.0,250,63,"Friday, February 11",1,250
90,B09R4VXFTW,Zuvexa Cotton Quick Absorbent Hair Drying Magic Hair Towel Wrap for Women,Zuvexa,0,0,0,149,0,0,70,"Sunday, February 13",1,"₹149
₹499 Save ₹350 (70%)"
91,B09PQJ4FKB,Bhairav Enterprises Soft and Highly Absordent 550 GSM 100% Cotton Large Size Full Body Black Bath Towel for Men and Women 70x140 cm||Pack of 1,Bhairav,0,0,0,349,5.0,1,65,"Monday, February 14",1,1
92,B01E5QOT2Y,Kuber Industries 2 Piece 500 GSM Cotton Bath Towel Set - White,Kuber,0,0,0,452,3.1,69,56,"Friday, February 11",0,69
93,B09KC98SCW,Sellsworld Hair Towel Wrap Absorbent Towel Hair-Drying Bathrobe Magic Hair Warp Towel Super Quick-Drying Microfiber Bath Towel Hair Dry Cap Salon Towel (Multicolor)( Set of 1),Sellsworld,0,0,0,189,4.0,70,68,"Sunday, February 13",1,70
94,B08P7SSYTL,Khadi Cotton bath towels Manufacturing inSIRCILLA 36 * 72 inches (Pack of 2).Large Size Pure Cotton Multi Colour Towels Suitable for All Men and Women,Khadi,0,0,0,320,3.4,15,42,"Tuesday, February 15",0,15
95,B09Q69VGV5,"Hand Towels Set of 4 Piece for Kitchen, wash Basin & Gym, Soft & Super Absorbent, Multicolor Napkins (4 Sheets)",Hand,0,0,0,219,0,0,69,"Saturday, February 12",0,"₹219
₹699 Save ₹480 (69%)"
96,B018M442KO,"Sathiyas Supreme 480 GSM Cotton Bath Towel (Set of 2, Lavender and Pink)",Sathiyas,0,0,0,349,3.9,"2,471",56,"Wednesday, February 16",0,"2,471"
97,B09BYX6KS8,"PADHUMAM Cotton Bath Towels (75cm x 150cm, Multicolour) Set of 3",PADHUMAM,0,0,0,490,4.0,69,53,"Wednesday, February 16",1,69
98,B09Q5YD491,Orchid Petals Ultra Soft Highly Absorbent Hand Towel Set- Pack of 4 (Pink & Navy Blue),Orchid,0,0,0,449,5.0,1,44,"Saturday, February 12",0,1
99,B01DQYI8I2,"Sathiyas 480 GSM 4 Piece Bath Cotton Towel (Blue, Lavender, Pink, Orange 75 cm X 150 cm)",Sathiyas,0,0,0,699,4.0,"4,985",50,"Wednesday, February 16",1,"4,985"
100,B09QCG7ZL4,"Couer Cotton Hair Towel Wrap for Women with Long Hairs Super Absorbent Quick Dry Stylish Lightweight Salon Shower Turban Cap. (Pulpy Peach, Without Comb.)…",Couer,0,0,0,399,3.9,124,60,"Saturday, February 12",0,124
101,B092DF386D,Sellsfly Absorbent Super Quick Dry Microfiber Magic Hair Towel Wrap Shower Caps (Multicolor),Sellsfly,0,0,0,189,3.6,360,62,"Sunday, February 13",1,360
102,B06Y1NGDPB,"Fancyadda Cotton Bath Towel Combo 300 GSM (Set of 4, White, 75 cm x 150 cm, Light Weight, Fast Absorbing)",Fancyadda,0,0,0,499,4.0,710,17,"Friday, February 11",1,710
103,B0111PHH0I,"Fresh from Loom Towel for face 6 Piece 450 GSM Cotton Face Towel Set - White, Size - 12x12 inch, Rumal",Fresh,0,0,0,296,4.1,501,26,"Monday, February 14",0,501
104,B06XGT4MRS,"Story@Home 100% Cotton Ultra Soft, Super Absorbent, Antibacterial, Hand Towel Set, 450 GSM, 40 cm x 60 cm, (Red)- Pack of 2",Story@Home,0,0,0,227,4.1,"1,545",68,"Saturday, February 12",0,"1,545"
105,B09PZ1KBSH,Freshlife Set of 1 Hair Towel Wrap Absorbent Towel Hair-Drying Quick Dry Shower Caps Bathrobe Magic Hair Towel Super Quick-Drying Microfiber Bath Towel Hair Dry Cap Salon Towel (pack of 1)multi color,Freshlife,0,0,0,199,0,0,78,"Sunday, February 13",1,"₹199
₹899 Save ₹700 (78%)"
106,B09QM64QVY,"Haarviik Hair Towel Wrap Turban Microfiber Drying Bath Shower Head Towel with Buttons, Quick Magic Dryer, Dry Hair Hat, Wrapped Bath Cap by Duomishu",Haarviik,0,0,0,199,0,0,60,"Sunday, February 13",0,"₹199
₹499 Save ₹300 (60%)"
107,B09HXBRL5L,AMAZON BRAND - UMI 155 GSM 100% Cotton Quick-Dry Bath Towel Soft Lightweight & Highly Absorbent Towels for Home and Kitchen - 30 X 60 Inch (Pack of 3),AMAZON,0,0,0,799,0,0,50,"Wednesday, February 16",0,"₹799
₹1,599 Save ₹800 (50%)"
108,B09NM76G39,"Home Cloud Towel Strip Towel, Colorful ,Coral Velvet Women Bath Towel Sets ,Soft Fluffy, face Wash | Hair Towel Includes Grey",Home,0,0,0,489,3.9,17,51,"Sunday, February 13",0,17
109,B084WRJYK2,"Bellbird Fab Hair wrap Towel for women 500 GSM (Cotton, Pack of 2, Multicolor)…",Bellbird,0,0,0,375,4.2,12,62,"Sunday, February 13",1,12
110,B09NNL8C9R,"Casa Copenhagen - Egyptian Cotton Ecstatic 6pcs Hand Towel (40 X 60 cm) Colour : HawainOcean,Limegreen,ButtercupYellow,Orange,WindsorWine,Toffee",Casa,0,0,0,599,4.2,23,0,"Tuesday, February 15",1,23
111,B09FXY417S,Bombay Dyeing Santino Reversible 100% Cotton Printed Bath Towel Large Size (Sea Green),Bombay,0,0,0,899,0,0,5,"Saturday, February 12",0,"₹899
₹949 Save ₹50 (5%)"
112,B08ZKFPZJY,"Yellow Weaves Super Soft Microfiber Hand Towels, Gym & Workout Towels 400 GSM(2 Pieces, Grey Colors)",Yellow,0,0,0,309,4.3,91,52,"Saturday, February 12",0,91
113,B09N3S3R9P,"WiseLife 100% Cotton Premium Fouta Towel | Extra Large Full Size Cotton Bath Towel | Bath, Beach, Pool, Travel, Spa and Yoga | 76 x 152 cm Daily Use Shower Towel (Yellow Cyan)",WiseLife,0,0,0,445,4.4,34,36,"Saturday, February 12",0,34
114,B09PFSYD17,"BLACK GOLD Premium Microfiber Bath / Bathroom Towels Ladies / Gents / Adult / XL Super Absorbent, Lightweight Ultra-Soft, 400 GSM , Fade Resistant , Plain BG54 (Size 75X150) Purple",BLACK,0,0,0,575,0,0,48,"Tuesday, February 15",0,"₹575
₹1,106 Save ₹531 (48%)"
115,B09P7KH3RJ,"Outlay Home 100% Cotton Hand Towels Set - Ultrasoft & Absorbent - Leaf Design Pattern Small Towel for Face, Hair, Gym, Spa - 14 x 21 Inches, 6 Pieces",Outlay,0,0,0,269,2.7,3,73,"Monday, February 14",0,3
116,B07JWKSL35,"Amazon Brand - Solimo 100% Cotton 3 Piece Towel Set, 500 GSM (Turquoise Blue)",Amazon,1,0,0,729,4.3,500,27,"Saturday, February 12",1,500
117,B08Y365QSF,"Mush Bamboo-derived Rayon Face Towel (Set of 3, Grey)",Mush,1,1,0,499,4.3,891,38,"Sunday, February 13",1,891
118,B09JP1F8L6,"Haber Premium Light Weight 100% Cotton Bath Towel with Unique Micro Waffle Texture for Active Feel, Quick Absorption and Faster Drying Towel (Aqua, Pack of 1)",Haber,1,0,0,699,4.2,719,7,"Saturday, February 12",1,719
119,B093GYBM7R,"SPACES Atrium Plus 100% Cotton Hand Towel High Absorbency Soft Feel Quik to Dry Easy Care (Solid, 40CMX60CM) - White/Midnight Blue",SPACES,1,0,0,701,5.0,6,50,"Tuesday, February 8",1,6
120,B0166CPU5A,"Amazon Brand - Solimo Cotton 2 Piece Bath Towel Set, 500 GSM (Spring Green and Paradise Pink)",Amazon,1,1,0,899,4.3,"15,969",28,"Friday, February 11",1,"15,969"
121,B09NRKW1XJ,"Casa Copenhagen - Egyptian Cotton Exotic 2 Pcs Large Bath Towel (75 x 150 cm) Colour : - Skyway, Pink",Casa,1,0,0,799,4.2,50,0,"Tuesday, February 15",1,50
122,B09D3T4ZMC,"Haber Light Weight 100% Cotton Bath Towel with Super Absorb Texture, Quick Absorption and Faster Drying Towel- Chevron Collection (Mint, Pack of 1)",Haber,1,0,0,699,4.1,334,7,,0,334
123,B09CD3FMQH,"Haber - Turkish Style Premium Cotton Bath Towel - Aura Collection (Pack of 3, Yellow, Mint & Purple)",Haber,1,0,0,"1,649",4.2,"1,220",21,"Friday, February 11",1,"1,220"
124,B09DBVF2WN,"N G Products® 100% Cotton Large Full Size White Bath Towels for Hotel and Spa, Super Soft Absorbent Antibacterial, 300 GSM, Full Large Size-60 inch x 30 inch or 152 cm x 76 cm ( 6 Piece)",N,0,0,0,"1,049",3.7,20,42,"Tuesday, February 15",0,20
125,B09B7T8GPR,"Outfit Collections Luxury Microfiber Bath Towel, Super Absorbent, Lightweight Ultra-Soft, 300 GSM , Fade Resistant, Zig-Zag Design , 70 cm x 140 cm ( 27"" x 54"" inch ) , for Men , Women & Kids",Outfit,0,0,0,360,4.2,341,60,"Thursday, February 10",0,341
126,B09M3YNQZV,"THEODORE Hair-Drying Absorbent Microfiber Towel,Dry Shower Caps,Bathrobe Hat,Magic Hair Wrap for Women Hair wrap (Variant, 1) (1)",THEODORE,0,0,0,199,4.2,62,50,"Sunday, February 13",0,62
127,B08JZ36JGQ,"SBS Enterprise Full Soft Stylish Large Size Bengali Towels 150 GSM, Light Weight & Unique Design, Quick Absorption & Faster Drying Gamcha, Cotton Bath Towel Set for Men & Women (Multicolour, Set of 3)",SBS,0,0,0,380,4.3,31,58,"Friday, February 11",0,31
128,B08THCZS1X,"Cotton Bolls Textiles 400 GSM Cotton Kitchen Hand Towel (Multicolour, 35 x 50 cm)",Cotton,0,0,0,399,3.7,422,72,"Monday, February 14",0,422
129,B09MJNWH2B,"Patvy Bath Towels| Light Weight Turkish Style Bath Towels for Men Large Size Cotton|75 x 150 cm Soft, Quick Absorption & Faster Drying Bath Towel for Women| 100% Cotton, Yellow (Pack of 1)",Patvy,0,0,0,399,4.6,9,50,,0,9
130,B08Z3R9TL2,"Leaf Dew 100% Cotton Bath Towels (400GSM/140 x 70CM) Set of 4 Piece Large Size Towel for Men & Women (Navyblue,Pink,Brown,SkyBlue)",Leaf,0,0,0,999,4.0,796,50,"Tuesday, February 15",1,796
131,B09P3WNPTJ,QUALITTO Microfibre Soft Cotton Bathrobe for Girls & Women || Bath Robe Towel for Women ||Quick Dry Dress Towel for Ladies | Assured Color( Pink),QUALITTO,0,0,0,258,0,0,83,"Saturday, February 12",0,"₹258
₹1,499 Save ₹1,241 (83%)"
132,B08LB9N7Z7,Sellsworld Set of 2 Hair Towel Wrap Absorbent Towel Hair-Drying Towel Magic Hair Warp Towel Super Drying Microfiber Bath Towel Hair Dry Cap Salon Towel (Multicolor-Set of 2),Sellsworld,0,0,0,299,4.0,280,50,"Sunday, February 13",1,280
