,asin,title,brand,Sponsored,Best Seller,Amazon's Choice,Price,Rating,NoofRatings,Discount,Delivery,Prime Delivery,base
0,B08558LLWJ,"Belkin Type C to USB-A 2.0 Tough Unbreakable Braided Nylon Cable 3.3 feet (1 meter) – White, USB-IF Certified, Supports Fast Charging",Belkin,1,0,0,499,4.4,"1,086",33,"Monday, February 14",1,"1,086"
1,B08H5JWXTW,"Synqe USB Type C Fast Charging Cable Nylon Braided Cable Compatible with All Type C Smartphones (1M, Red)",Synqe,1,0,0,349,4.3,"1,888",68,"Wednesday, February 16",1,"1,888"
2,B0825D8KNS,boAt A 350 Type C Cable 1.5m (Black),boAt,0,1,0,299,4.4,"22,520",63,"Monday, February 14",1,"22,520"
3,B01GGKYKQM,AmazonBasics USB Type-C to USB-A 2.0 Male Cable - 3 Feet (0.9 Meters) - Black,AmazonBasics,0,0,0,329,4.3,"55,035",53,"Monday, February 14",1,"55,035"
4,B08CF3D7QR,Portronics Konnect L POR-1081 Fast Charging 3A Type-C Cable 1.2Meter with Charge & Sync Function for All Type-C Devices (Grey),Portronics,0,0,1,168,4.4,"5,320",58,"Tuesday, February 15",1,"5,320"
5,B07BYST8WR,"Wayona USB Type C Long Charger Cable Fast Charging USB C Cable 2meter/ 6ft for Samsung Galaxy S10e S10 S9 S8 Plus S10+, Note 10 Note 9 Note 8,S20,M20s,M40, Realme X3 (6 FT Pack of 1, Black)",Wayona,0,0,0,349,4.2,"7,849",65,"Monday, February 14",1,"7,849"
6,B08DDRGWTJ,Mi USB Type-C Cable,Mi,0,0,0,229,4.3,"21,422",23,"Monday, February 14",1,"21,422"
7,B083342NKJ,Mi Braided USB Type-C Cable (Red),Mi,0,0,0,299,4.4,"7,823",25,"Monday, February 14",1,"7,823"
8,B071SDRGWL,"boAt Indestructible USB Type-C to USB-A 2.0 Male Cable for Type C Phones, 1 Meter (3.3 Feet) -(Black)",boAt,0,0,0,349,4.3,"25,732",50,"Monday, February 14",1,"25,732"
9,B08R69WBN7,"Pinnaclz Original Made in India Combo of 2 USB Type C Fast Charging Cable, USB C Data Cable for Data Transfer Perfect for Mi & Samsung Smart Phones White 1.2 Meter (Pack of 2)",Pinnaclz,0,0,0,149,4.1,"4,924",75,"Monday, February 14",1,"4,924"
10,B08HDJ86NZ,"boAt Deuce USB 300 2 in 1 Type-C & Micro USB Stress Resistant, Tangle-Free, Sturdy Cable with 3A Fast Charging & 480mbps Data Transmission, 10000+ Bends Lifespan and Extended 1.5m Length(Martian Red)",boAt,1,0,0,329,4.2,"74,349",53,"Monday, February 14",1,"74,349"
11,B08V4ZVDWN,"boAt Micro USB 550 Stress Resistant, Tangle-Free, Sturdy Cable with 3A Fast Charging & 480mbps Data Transmission, 10000+ Bends Lifespan and Extended 1.5m Length(Martian Red)",boAt,1,0,0,387,4.2,"1,184",61,"Monday, February 14",1,"1,184"
12,B08Y1TFSP6,"pTron Solero TB301 3A Type-C Data & Fast Charging Cable, Made in India, 480Mbps Data Sync, Strong & Durable 1.5-Meter Nylon Braided USB Cable for Type-C Devices - (Black)",pTron,0,0,0,199,3.9,"15,950",80,"Monday, February 14",1,"15,950"
13,B081FG1QYX,"Wayona Type C Cable Nylon Braided USB C QC 3.0 Fast Charging Short Power Bank Cable for Samsung Galaxy S10e/S10+/S10/S9/S9+/Note 9/S8/Note 8, LG G7 G5 G6, Moto G6 G7 (0.25M, Black)",Wayona,0,0,0,339,4.3,"4,658",66,"Monday, February 14",1,"4,658"
14,B08558B183,"Belkin Type C to USB-A 2.0 Tough Unbreakable Braided Nylon Cable 3.3 feet (1 meter) – Black, USB-IF Certified, Supports Fast Charging",Belkin,0,0,0,499,4.4,"1,086",33,"Thursday, February 17",1,"1,086"
15,B08N1VXXVQ,"FLiX (Beetel) USB to Type C Textured Pattern Data Sync & 2A Fast Charging Cable, Made in India, 480Mbps Data Sync, Tough Cable, 1 Meter Long USB Cable for USB Type C Devices (Black)(XCD-C102)",FLiX,0,0,0,149,4.0,"3,069",40,"Monday, February 14",1,"3,069"
16,B085DTN6R2,"Portronics Konnect CL 18W POR-1067 Type-C to 8 Pin USB 1.2M Cable with Power Delivery & 3A Quick Charge Support, Nylon Braided for All Type-C and 8 Pin Devices, Green",Portronics,0,0,0,369,4.2,819,47,"Monday, February 14",1,819
17,B08H4T6B2M,"Synqe USB Type C Cable Fast Charging Charger Cord 3A QC 3.0 Data Cable Compatible for Samsung Galaxy M31S M30 S10 S9 S20 Plus, Note 10 9 8, A20e A40 A50 A70 Flash Charge (1M, Grey)",Synqe,0,0,0,349,4.3,"1,888",68,"Tuesday, February 15",1,"1,888"
18,B01GGKZ0V6,AmazonBasics USB Type-C to USB Type-C 2.0 Cable - 3 Feet (0.9 Meters) - White,AmazonBasics,0,0,0,549,4.1,"18,340",35,"Thursday, February 17",1,"18,340"
19,B08NWF6GHM,"Synqe USB C to USB C 60W Nylon Braided Fast Charging Type C to Type C Cable Compatible with Samsung Galaxy Note 20/Ultra/S20 Ultra/Note10 A51/A86 (2M, Grey)",Synqe,0,0,0,399,4.2,123,60,"Tuesday, February 15",0,123
20,B086YVMV7Z,"CableCreation Short USB C Cable, 5 inch USB C to USB 3.0 Cable 3A Fast Charge with 56K Resistor, 5Gbps Data, Compatible with MacBook, iPad Pro, Galaxy S20, SSD, Oculus Quest Link etc, 12cm/0.4ft Black",CableCreation,1,0,0,899,4.1,703,67,"Friday, February 18",1,703
21,B07D7R8PNM,"AmazonBasics Double Braided Nylon USB Type-C to Type-C 3.1 Gen 1 Cable, 3 Feet (0.9 Meters) - Dark Grey",AmazonBasics,1,0,0,999,4.1,174,29,"Wednesday, February 16",1,174
22,B08H5K7JJQ,"Synqe USB Type C Cable Nylon Braided USB C QC 3.0 Fast Charging Short Power Bank Cable Compatible with Samsung Galaxy S10e S10 S9 S8 S20 Plus, Note 10 9 8, A20e A40 A50 A70, Moto G7 G8 (0.25M, Grey)",Synqe,1,0,0,325,4.3,"1,888",70,"Wednesday, February 16",1,"1,888"
23,B01D3095RW,"CableCreation USB Type C Cable, CableCreation 10ft Braided USB C to USB A Fast Cord, with 56K Ohm Resistor, Compatible Galaxy S8/S8+/S9/S9+/S10, Pixel 3XL 2XL & More, 3M / Gray",CableCreation,1,0,0,713,4.5,736,45,"Thursday, February 17",1,736
24,B08WKG2MWT,"Wayona USB C to USB C 60W Fast Charging Cable Type C Charger Cord Compatible with Samsung S21 Ultra A70 A51 (1M, Black)",Wayona,0,0,0,399,4.4,456,64,"Monday, February 14",1,456
25,B09J4W2MW6,"Storite 1m USB Type-C to Micro-B USB 3.0 Cable, 10Gbps Fast Charging & Syncing Cord Compatible with Windows/Mac & External Hard Drive - Black",Storite,0,0,0,399,4.3,8,87,"Monday, February 14",1,8
26,B084N18QZY,"Belkin Type C to Type-C Fast Charging Cable 3.3 feet (1 Meter) - Black, USB-IF Certified",Belkin,0,0,0,599,4.5,230,29,"Monday, February 14",1,230
27,B09D826XMP,"Eazories Compatible with OnePlus 9 Pro 8T Fast Charging Cable 6.5A Warp Charge USB C to USB C Cable, 1 mtr Super Fast Charging Cord Compatible with Pro 13/16 Air 4 Note 20 S20 FE 5G",Eazories,0,0,0,297,4.0,128,70,"Wednesday, February 16",1,128
28,B07XDRVFMC,Mi 2-in-1 USB Cable (Micro USB to Type-C) 100cm,Mi,0,0,0,269,4.2,"12,981",33,"Monday, February 14",1,"12,981"
29,B09CMQRQM6,"Ambrane Fast 100W Output Cable with Type-C to Type-C for Mobile & Laptop Charging, 480mbps Data Sync Speed, Braided Cable, 1.5m Length (ABCC-100, Black-Grey)",Ambrane,0,0,0,499,4.3,42,44,"Wednesday, February 16",1,42
30,B08XC7X6KD,elevn flex Type C cable Rugged Braided Type-C to USB-A Male 3.0A Fast Charge short Power Bank Cable & 5Gbps Data Sync & Charging Cable – 0.5m (1.6 feet) Black & Grey,elevn,0,0,0,171,4.1,612,66,"Tuesday, February 15",1,612
31,B07RG9Z86C,Portronics POR-656 Konnect Core 1M Type C Cable with Charge & Sync Function (Black),Portronics,0,0,0,139,4.1,383,54,"Monday, February 14",1,383
32,B0974CXTGV,"boAt Micro Axis 1.5 m Cable with Rotating Connector, 3A Fast Charging, Stress Resistance & Tangle-Free Cable Organizer(Mercurial Black)",boAt,1,0,0,499,4.2,"74,349",50,"Monday, February 14",1,"74,349"
33,B086H3M59C,"Belkin Type C to USB-A 2.0 Male Cable 6.6 feet (2 Meter) - Black, USB-IF Certified, Supports Fast Charging",Belkin,1,0,0,599,4.4,"1,086",40,"Monday, February 14",1,"1,086"
34,B07XJYYH7L,"WeCool Nylon Braided Multifunction Fast Charging Cable for Android, iOS and Type C Devices, 3 in 1 Charging Cable, 3A, (3 Feet) (Black)",WeCool,0,1,0,349,3.3,"6,455",65,"Monday, February 14",1,"6,455"
35,B09BW4HHS3,"Croma 2.4A Fast charge 1.2m Type-C sync and charge cable, Made in India, 480Mbps Data transfer rate, Tested Durability with 8000+ bends (12 months warranty) (CRCMA0102sTC12, Black)",Croma,0,0,0,135,4.1,137,81,"Monday, February 14",1,137
36,B098L9HSKR,"Tukzer Type C to Type A USB 2.0 Cable (40W~5V/3.1A) Fast Charging & Data Sync, Cotton Braided (Black - 1M/ 3.3Ft) (TZ-CC-01)",Tukzer,0,0,0,199,4.0,126,50,"Monday, February 14",1,126
37,B097XYJDLP,elevn flex USB Type-C to USB-A Male 3.0A Fast Charge & up-to 5Gbps Data Sync & Charging Cable - 1m (3.2 feet) – Grey,elevn,0,0,0,121,4.1,417,51,"Wednesday, February 16",1,417
38,B0789LZTCJ,boAt Rugged v3 Extra Tough Unbreakable Braided Micro USB Cable 1.5 Meter (Black),boAt,0,0,0,299,4.2,"74,349",63,"Monday, February 14",1,"74,349"
39,B08WRWPM22,boAt Micro USB 55 Tangle-Free Cable with 3A Fast Charging & 480mbps Data Transmission(Black),boAt,0,0,0,199,4.1,"8,838",60,"Monday, February 14",1,"8,838"
40,B082LZGK39,"Ambrane Unbreakable 3A Fast Charging Braided Micro USB Cable for Android Devices – 1.5 Meter (RCM15, Black)",Ambrane,0,0,0,179,4.0,"21,363",40,"Monday, February 14",1,"21,363"
41,B09RQHNBF1,"FEDUS Short USB C Cable, Power Bank Charging Cable Data Sync, USB A to USB Type C, 9 Inch USB Type C Cable Fast Charge Cord Sync Compatible with Samsung, HTC, Motorola, Nokia, Android, Pack of 1",FEDUS,0,0,0,199,4.5,2,60,"Wednesday, February 16",1,2
42,B077XYVJ8N,"Wayona USB Type C Cable, 2.4A Metal Spring USB A to USB C Fast Charging Cable for Samsung S8 / S8+ /One Plus/Google Pixel/LG/Le Eco (Silver)",Wayona,1,0,0,399,4.0,65,69,"Thursday, February 17",0,65
43,B07CWFNZZF,"AmazonBasics Double Braided Nylon USB Type-C to Type-A 2.0 Male Cable, 3 feet, Gold",AmazonBasics,1,0,0,539,4.2,593,55,"Monday, February 14",1,593
44,B08H4T6B2M,"Synqe USB Type C Cable Fast Charging Charger Cord 3A QC 3.0 Data Cable Compatible for Samsung Galaxy M31S M30 S10 S9 S20 Plus, Note 10 9 8, A20e A40 A50 A70 Flash Charge (1M, Grey)",Synqe,1,0,0,349,4.3,"1,888",68,"Tuesday, February 15",1,"1,888"
45,B08HDH26JX,"boAt Deuce USB 300 2 in 1 Type-C & Micro USB Stress Resistant, Sturdy Cable with 3A Fast Charging & 480mbps Data Transmission, 10000+ Bends Lifespan and Extended 1.5m Length(Mercurial Black)",boAt,1,0,0,299,4.2,"74,349",57,"Monday, February 14",1,"74,349"
46,B08XYVR7LY,"Storite 2 Pack Nylon Braided Type C Fast Charging Cable USB-C Data Cable for SYNC for Smartphones (1 Meter, GoldBlack)",Storite,0,0,0,199,3.5,65,87,"Monday, February 14",1,65
47,B08XC8YHVQ,elven flex Type-C to USB-A Male Ultra-Fast Premium 65-Watt Warp Charge 5Gbps Data Sync & Charging Cable – 1.5m (5 feet) Superior Rugged Braided – Anthracite,elven,0,0,0,171,3.8,400,83,"Tuesday, February 15",1,400
48,B01GGKYR2O,AmazonBasics USB Type-C to USB-A Male 3.1 Gen2 Adapter Charger Cable - 3 Feet (0.9 Meters) - Black,AmazonBasics,0,0,0,589,4.3,"10,325",55,"Monday, February 14",1,"10,325"
49,B07XY973VB,"WeCool Nylon Braided 3A Type c Charger Cable or c Type Data Cable for Data SYNC Fast Charging for Smartphones (1 Meter, Black)",WeCool,0,0,0,179,3.7,860,82,"Tuesday, February 15",1,860
50,B076CMPWB4,"Pinnaclz Original Made in India USB Type C Fast Charging Cable, USB C Data Cable for Data Transfer Perfect for Mi & Samsung Smart Phones White 3 feet",Pinnaclz,0,0,0,99,3.7,319,75,"Monday, February 14",1,319
51,B08PSSGQ1N,"Zoul Type C to Type C Fast Charging Cable 60W/3A USB C Nylon Braided Cord Compatible with Samsung Galaxy S20 Ultra S20+ Note10 Plus Google Pixel Huawei P30 / P30 Pro / P20 / P20 Pro (1M, Grey)",Zoul,0,0,0,399,4.1,"1,266",64,"Wednesday, February 16",1,"1,266"
52,B09H31HLFQ,DUPER Unbreakable Fast USB C Charging Cable for Data Transfer (Rad) Made in India,DUPER,0,0,0,299,5.0,20,31,"Wednesday, February 16",1,20
53,B09NGB6MW4,"MYVN Compatible with OnePlus 9 Pro 9 8T Fast Charging Cable 6.5A Warp Charge USB C to USB C Cable, 1 mtr Super Fast Charging Cord Compatible with S21 S21 Ultra Fold 3",MYVN,0,0,0,299,4.6,25,77,"Thursday, February 17",1,25
54,B01GGKZ0V6,AmazonBasics USB Type-C to USB Type-C 2.0 Cable - 3 Feet (0.9 Meters) - White,AmazonBasics,1,0,0,549,4.1,"18,340",35,"Thursday, February 17",1,"18,340"
55,B01ESX3G50,"CableCreation USB C Cable 10ft 60W, Braided USB C to USB C 3A Fast Charger Cable, Compatible with MacBook(Pro), Galaxy S20/S10/S9/S9+, Pixel 3 XL, etc (Blue)",CableCreation,1,0,0,691,4.5,702,37,"Thursday, February 17",1,702
56,B08QSC1XY8,"Zoul USB C Fast Charging 3A 6ft/2M Long Type C Nylon Braided Data Cable Quick Charger Cable QC 3.0 for Samsung Galaxy M31S M30 S10 S9 S20 Plus, Note 10 9 8, A20e A40 A50 A70 (2M, Grey)",Zoul,0,0,0,389,4.4,150,65,"Wednesday, February 16",1,150
57,B09D81FL2W,"Eazories 6.5A Fast Charging Type-C to Type-C Data & Charging Cable, Data Sync, Strong & Durable Compatible with Oneplus 9/9pro with USB C Female to USB Male Adapter Type C to A Charger Cable Adapter",Eazories,0,0,0,299,3.6,14,70,"Wednesday, February 16",1,14
58,B01ESX3G50,"CableCreation USB C Cable 10ft 60W, Braided USB C to USB C 3A Fast Charger Cable, Compatible with MacBook(Pro), Galaxy S20/S10/S9/S9+, Pixel 3 XL, etc (Blue)",CableCreation,0,0,0,691,4.5,702,37,"Thursday, February 17",1,702
59,B09J1D7XNY,"SYGA USB Type-C Cable, 6A - 6.6 Feet (2 Meters) - Green",SYGA,0,0,0,399,5.0,2,33,"Thursday, February 17",1,2
60,B08W25JTJJ,Tizum USB Type-C to Micro-B USB 3.0 (Gen 2/10 Gbps) Charger Cable - Thunderbolt 3 Compatible for Windows/Mac etc. 3 Feet (1 Meters) - Black,Tizum,0,0,0,499,4.4,120,50,"Monday, February 14",1,120
61,B081YBKSJD,"iVoltaa 2m USB C to USB C Cable, PD 100W USB Type C Fast Charging Cable (20V 5A - 2M / 6.6 Ft Long) Compatible with Galaxy Note10/10+, MacBook Pro 2019 2018 2017, MacBook Air, iPad Pro 2018",iVoltaa,0,0,0,599,4.2,166,40,"Monday, February 14",1,166
62,B088NWZJ1N,"Playa by Belkin Super-Fast Charging USB to USB-C Cable, USB Type-C to USB A 2.0 Mail Cable for Huawei,Honor, Note10, S10,S10 Plus, Pixel 3, iPad Pro and More, 5amp, 3.3 Feet (1 Meter), White",Playa,0,0,0,299,4.0,127,50,"Tuesday, February 15",1,127
63,B0769DMN7R,"CableCreation USB C Printer Cable 6.6FT, USB C to USB B 2.0 Printer Cable, Scanner Printer Cable to USB C MIDI Cable Compatible with Yamaha Casio Digital Piano MIDI Controller DJ Controller, HP, Canon, Brother, Samsung Printers 2M Black PVC w/Aluminum Shell",CableCreation,0,0,0,657,4.4,"1,484",61,"Thursday, February 17",1,"1,484"
64,B08Y1TFSP6,"pTron Solero TB301 3A Type-C Data & Fast Charging Cable, Made in India, 480Mbps Data Sync, Strong & Durable 1.5-Meter Nylon Braided USB Cable for Type-C Devices - (Black)",pTron,1,0,0,199,3.9,"15,950",80,"Monday, February 14",1,"15,950"
65,B085585Y3D,"Belkin Type C to USB-A 2.0 Male Cable 3.3 feet (1 meter) - White, USB-IF Certified, Supports Fast Charging",Belkin,1,0,0,449,4.4,"1,086",31,"Wednesday, February 16",1,"1,086"
66,B08H5L2X5H,"Synqe USB Type C Fast Charging Data Cable Data Cable Compatible with Real Me X Nokia 6.1 Plus Nokia 5.1 Plus Redmi Note 7 Samsung Galaxy M Series (1M, Blue)",Synqe,1,0,0,349,4.3,"1,888",68,"Wednesday, February 16",1,"1,888"
67,B08WRWPM22,boAt Micro USB 55 Tangle-Free Cable with 3A Fast Charging & 480mbps Data Transmission(Black),boAt,1,0,0,199,4.1,"8,838",60,"Monday, February 14",1,"8,838"
68,B09QHRGTMZ,"GO SHOPS Compatible with OnePlus 9 Pro 8T Fast Charging Cable 6.5A Warp Charge USB C to USB C Cable, 1 mtr Super Fast Charging Cord Compatible with Pro 13/16 Air 4 Note 20 S20 FE 5G",GO,0,0,0,149,5.0,1,85,"Wednesday, February 16",1,1
69,B0839JR3GY,"Wayona USB C to USB C Fast Charging Type C Cable 3A Braided Cord Compatible with Samsung S20 S21 Ultra A80 Galaxy A51 Note10 Plus, Macbook iPad pro 2018 (1M, Black)",Wayona,0,0,0,399,4.0,"1,050",64,"Monday, February 14",1,"1,050"
70,B07XBKKF33,Baseus Type C to Type C 60W (PD 2.0) Flash Charging high Density Braided Cable Supports QC 3.0 (1mt) I Even Charges Laptops*,Baseus,0,0,0,689,4.5,166,31,"Wednesday, February 16",1,166
71,B09BW442YW,"Croma Braided 2.4A Fast charge 1.2m Micro USB sync and charge cable, Made in India, 480Mbps Data transfer rate, Tested Durability with 8000+ bends (12 months warranty)(CRCMA0104sMU12, Black)",Croma,0,0,0,129,3.9,52,84,"Monday, February 14",1,52
72,B08SQTLJKL,"CZARTECH USB Type C to USB Type C Fast Charging Cable 60W/3 Amp -1 Feet (30 cm), 480 mbps Data Transfer Speed (Black)",CZARTECH,0,0,0,275,4.2,71,61,"Monday, February 14",1,71
73,B09NQ6PY7Y,"rts (5 Meter / 16.40 Feet / 500 CM ) SuperSpeed USB 3.0 Male A to Female A Extension Cable Speed 5GBps for Laptop, Television Computer Printer, Scanner, Camera, Smartphone USB Flash Pen Drive, Card Reader, Hard Drive, Keyboard,Mouse",rts,0,0,0,598,5.0,1,88,"Wednesday, February 16",1,1
74,B01CZVH8GU,"USB Type C 3A Fast Charging Cable 4ft, CableCreation Braided USB C to A Cable 480Mbps Data, Compatible with New MacBook(Pro), Google Pixel 3XL 2XL, Galaxy S10 S9, 1.2M Gray [56K Ohm Resistor]",USB,0,0,0,499,4.5,300,17,"Thursday, February 17",1,300
75,B09JM5SMWD,"Wayona Type C to Lightning MFI Certified 20W Fast charging Nylon Braided USB C Cable with Charging Adapter for iPhone 12, 12 Pro, 11, 11 Pro Max iPhone 12 Mini (2M, Black)",Wayona,0,0,0,"1,249",4.1,435,38,"Monday, February 14",1,435
76,B01GGKYKQM,AmazonBasics USB Type-C to USB-A 2.0 Male Cable - 3 Feet (0.9 Meters) - Black,AmazonBasics,1,0,0,329,4.3,"55,035",53,"Monday, February 14",1,"55,035"
77,B07PGNMNQX,AGARO - 33280 USBA to TypeC Nylon Braided 1.2M Cable,AGARO,1,0,0,219,4.2,224,56,"Monday, February 14",1,224
78,B093DTND5H,"ERD UC-31 4mm High Speed USB-C Data Cable,1Meter (2.4 Amp)",ERD,0,0,0,185,4.2,4,5,"Saturday, February 19",0,4
79,B07PT3T9NM,Spigen Apple MFi Certified USB C to Lightning Charge Sync Cable 0.9 Meters - White,Spigen,0,0,0,"1,299",4.1,"1,350",48,"Wednesday, February 16",1,"1,350"
80,B09M9SWJK4,Portronics Konnect J5 20W PD 4-in-1 Mobile Charging Cable (USB-A + Type-C to Type-C + 8 Pin USB Cable),Portronics,0,0,0,634,3.8,13,51,"Monday, February 14",1,13
81,B07CWFNZZF,"AmazonBasics Double Braided Nylon USB Type-C to Type-A 2.0 Male Cable, 3 feet, Gold",AmazonBasics,0,0,0,539,4.2,593,55,"Monday, February 14",1,593
82,B08R3YH6C9,Amkette Type C to iPhone (8 Pin) PD Fast Charge & Sync Cable - 20W (Black),Amkette,0,0,0,499,4.0,129,38,"Monday, February 14",1,129
83,B09PVG4TQD,NYC 8A/6.5A/6A Dash/Warp Type-C Cable (Support USB 2.0) Compatible with 65W Power Adapter. 8 A 1 m USB Type C Cable For Oneplus || White-Red,NYC,0,0,0,299,5.0,1,57,"Wednesday, February 16",0,1
84,B01CZVEUIE,"CableCreation Short 0.5ft Braided Type C to A USB Cable for Macbook 12-inch, Google ChromeBook Pixel,Nexus 5X/6P, and More (15cm, Grey)",CableCreation,0,0,0,459,4.2,"6,465",36,"Thursday, February 17",1,"6,465"
85,B09BW36YFR,"Croma Braided 2.4A Fast charge 1.2m Type-C sync and charge cable, Made in India, 480Mbps Data transfer rate, Tested Durability with 8000+ bends (12 months warranty) (CRCMA0105sTC12, Black)",Croma,0,0,0,159,3.7,28,80,"Monday, February 14",1,28
86,B09FY2V1VN,"boAt Micro USB 600 Stress Resistant, Smart Auto Disconnecting Cable with LED Indicator, 3A Fast Charging & 480mbps Data Transmission, 10000+ Bends Lifespan & Extended 1.5m Length(Mercurial Black)",boAt,1,0,0,524,4.2,"74,349",48,"Wednesday, February 16",1,"74,349"
87,B07XJYYH7L,"WeCool Nylon Braided Multifunction Fast Charging Cable for Android, iOS and Type C Devices, 3 in 1 Charging Cable, 3A, (3 Feet) (Black)",WeCool,1,1,0,349,3.3,"6,455",65,"Monday, February 14",1,"6,455"
88,B08H5K84SM,"Synqe USB Type C Fast Charging Cable Power Bank Short Cable 3A QC 3.0 Data Cable Compatible with Samsung Galaxy M31 Poco F1, Nokia 5.1, Redmi Note 8 9, Realme 6(0.25M, Red)",Synqe,1,0,0,325,4.3,"1,888",70,"Wednesday, February 16",1,"1,888"
89,B09NFT556T,"I Kall IKT3 Premium Braided 3 in 1 USB Cable, 5AMP with Data Transfer (Black)",I,1,0,0,299,3.6,15,57,"Wednesday, February 16",1,15
90,B012V563B6,"CableCreation USB C Printer Cable 6.6FT, USB C to USB B Printer Cable, Scanner Printer Cable to USB C MIDI Cable Compatible with Yamaha Casio Digital Piano MIDI Controller DJ Controller, HP, Canon, Brother, Samsung Printers 2M Black",CableCreation,0,0,0,599,4.5,"2,014",40,"Thursday, February 17",1,"2,014"
91,B08Z7GTFBP,"ZEBRONICS Zeb-TU300C USB to Type C Cable, Charge and Sync, 1 Meter Length (White)",ZEBRONICS,0,0,0,175,4.0,183,56,"Monday, February 21",0,183
92,B097YVT484,"Surface Connect to USB-C Charging Cable 15V / 3A, Compatible with Microsoft Surface Pro 7/6/5/4/3, Surface Laptop 3/2/1, Surface Go, Surface Book (6FT)",Surface,0,0,0,"1,400",3.4,9,65,"Wednesday, February 16",1,9
93,B09JSK93CG,ILT Retail - Type-C (C Type) Cable USB C to USB A Fast-Charging Data Cable for Mobile Fast-Charger,ILT,0,0,0,63,3.7,5,60,"Saturday, February 19",0,5
94,B01FM4ZWV0,"CableCreation USB C Extension Cable (Gen 2/10Gbps), USB 3.1 Type C Male to Female Extension Cable 3.3ft, Support 4K Video Audio Transfer,Compatible with Macbook Pro, Samsung Note 8, 1M/Black and White",CableCreation,0,0,0,899,4.2,"1,195",67,"Thursday, February 17",1,"1,195"
95,B074K318JK,UGREEN USB C Extension Cable - USB 3.1 Gen 2 10Gbps USB C Extender 100W Fast Charging Male to Female Thunderbolt 3 Compatible for Nintendo Switch MacBook Pro iPad Pro Dell XPS Surface Go Hub 0.5M,UGREEN,0,0,0,869,4.1,"2,474",33,"Friday, February 18",1,"2,474"
96,B09RBB4VWX,"DUETMI Compatible with OnePlus 9 Pro 8T Fast Charging Cable 6.5A Warp Charge USB C to USB C Cable, 1 mtr Super Fast Charging Cord Compatible with Pro 13/16 Air 4 Note 20 S20 FE 5G",DUETMI,0,0,0,149,0,0,85,"Wednesday, February 16",1,"₹149
₹999 Save ₹850 (85%)"
97,B07V5MKXJ1,"UGREEN USB-C to USB-C Cable, USB Type C 100W Power Delivery PD Charging Cord for Apple MacBook Pro, Huawei Matebook, iPad Pro 2018, Chromebook, Pixel 3 XL, Samsung Note 10 S10 (3FT)",UGREEN,0,0,0,839,4.5,519,27,"Friday, February 18",1,519
98,B08Y5KXR6Z,"pTron Solero T241 2.4A Type-C Data & Charging USB Cable, Made in India, 480Mbps Data Sync, Durable 1-Meter Long USB Cable for Type-C USB Devices - (Black)",pTron,1,0,0,149,3.9,"15,950",81,"Monday, February 14",1,"15,950"
99,B086YYWL4T,"CableCreation Short USB C to USB C 3.1 Gen 2 Cable, Compatible with MacBook Pro, Galaxy S20, iPad Pro/Air, Supports Fast Charge and Video Output, 0.4Feet/0.12m",CableCreation,1,0,0,999,4.1,703,63,"Thursday, February 17",1,703
100,B08R682JMR,"Type-C Charger Cable USB C Cable 1 Pack 3ft USB-A to Type-C Cable Fast Charging, White",Type-C,0,0,0,135,0,0,32,"Friday, February 18",0,"₹135
₹199 Save ₹64 (32%)"
101,B08S8S8YMX,"pTron Solero 3.1A (15W) Type-C Data & Fast Charging Cable, 480Mbps Data Sync, Strong & Durable 1-Meter Long USB Cable for Type-C Devices - (Blue)",pTron,0,0,0,219,4.0,"6,490",73,"Monday, February 14",1,"6,490"
102,B07D7R8PNM,"AmazonBasics Double Braided Nylon USB Type-C to Type-C 3.1 Gen 1 Cable, 3 Feet (0.9 Meters) - Dark Grey",AmazonBasics,0,0,0,999,4.1,174,29,"Wednesday, February 16",1,174
103,B07PHK9BWL,Stuffcool Minima 3Amp USB Type-C to USB-C Fast Charging Data Cable - 15cm All Type C Devices - Black (Ideal for Power Banks),Stuffcool,0,0,0,269,3.9,267,46,"Wednesday, February 16",1,267
104,B08P5GVNTH,"Fast Charging USB Type C Cable USB C Quick Charger Fast Charging Cord for Samsung Galaxy S10e/S10+/S10/S9/S9+/Note 9/S8/Note 8, LG G7 G5 G6, Moto G6 G7 (1M, Black)",Fast,0,0,0,249,0,0,69,"Wednesday, February 16",1,"₹249
₹799 Save ₹550 (69%)"
105,B08G1S6MY8,"CZARTECH USB-C Cable Compatible with i-Phone 13,12,12 Mini,12 Pro/Max, 11, 11 Pro, 11 Pro Max, XS, XS Max, XR, X, i-Pad and More, 20W Fast Charging ,Power Delivery Cable (Nylon Braided, 4 ft/1.2 Mt), Black)",CZARTECH,0,0,0,499,4.1,290,75,"Monday, February 14",1,290
106,B09NFT556T,"I Kall IKT3 Premium Braided 3 in 1 USB Cable, 5AMP with Data Transfer (Black)",I,0,0,0,299,3.6,15,57,"Wednesday, February 16",1,15
107,B0817ZH439,INICIO Type C to USB-C 3.1 Gen 2 Cable 100W PD Power Delivery 10Gbps Data 4K@60Hz DP1.2 Video Compatible for MacBook iPad Pro Air Galaxy S21 S20 Ultra Note 20 XPS 13 Spectre Envy Monitor - 2m,INICIO,0,0,0,"1,199",4.0,46,50,"Wednesday, February 16",1,46
108,B01CZVEUIE,"CableCreation Short 0.5ft Braided Type C to A USB Cable for Macbook 12-inch, Google ChromeBook Pixel,Nexus 5X/6P, and More (15cm, Grey)",CableCreation,1,0,0,459,4.2,"6,465",36,"Thursday, February 17",1,"6,465"
109,B01M0LD97X,"CableCreation [2-Pack 10 Feet Right Angle Micro USB 2.0 Braided Cable, 90 Degree Vertical Right USB 2.0 A Male to Micro USB Male with Aluminium Case,3 Meters, Space Gray",CableCreation,1,0,0,702,4.5,"1,418",38,"Thursday, February 17",1,"1,418"
110,B08H5KLDSD,"Synqe USB Type C Fast Charging Cable Charger Cord 3A QC 3.0 Data Cable Compatible with Samsung Galaxy S10e S10 S9 S8 S20 Plus, Note 10 9 8, A20e A40 A50 A70, Moto G7 G8 (1M, Black)",Synqe,1,0,0,349,4.3,"1,888",68,"Wednesday, February 16",1,"1,888"
111,B09MDBM8XT,"Techati 1mtr USB C to USB C cable supports 100 Watts 5A fast charging, 8K video signal, 40Gbps data transfer USB 4 grade cable compatible with MacBook, iPad Pro, Samsung Dex, Chromebook, OnePlus",Techati,1,0,0,"1,399",5.0,31,44,"Friday, February 18",1,31
112,B07D7PM3S9,"AmazonBasics Double Braided Nylon USB Type-C to Type-A 3.1 Gen 2 Cable, 3 Feet (0.9 Meters) - Silver",AmazonBasics,0,0,0,789,4.4,605,44,"Thursday, February 17",1,605
113,B07P6QV9GB,UGREEN Double Nylon Braided QC 3.0 USB Type C to USB-A Right Angle 90 Degree Fast Charging Male Data Cable with Nickel Plated Connector Aluminum Shell -Space Gray Black [3.3 Feet / 1 Metres],UGREEN,0,0,0,589,4.4,122,21,"Friday, February 18",1,122
114,B08ND359W9,"Amoner USB C to Lightning Cable, [2Pack 3FT Apple Mfi Certified] iPhone 11 Lightning to USB-C Fast Charging Cable Compatible with iPhone 11/11Pro/11Pro MAX/XS/XS MAX/XR/X/8/8Plus",Amoner,0,0,0,799,4.5,308,87,"Wednesday, February 16",1,308
115,B09RB1PTSZ,INICIO Hexa 6 in 1 PD Cable USB C / A to 100W Type C / 18W Micro / 20W iOS Power Delivery Compatible for MacBook iPad Pro Air iPhone 13 12 11 XPS HP Spectre Envy Galaxy S22 S21 Note Redmi OnePlus etc,INICIO,0,0,0,"1,499",0,0,50,"Wednesday, February 16",1,"₹1,499
₹2,999 Save ₹1,500 (50%)"
