,asin,title,brand,Sponsored,Best Seller,Amazon's Choice,Price,Rating,NoofRatings,Discount,Delivery,Prime Delivery,base
142,B09NDXZ6CQ,Squar Round Shape Plastic White Wall Clock with Glass for Home/Kitchen/Living Room/Bedroom/Office (24 cm x 24 cm 3.4 cm) Blue Print,Squar,0,0,0,299,5.0,1,79,"Tuesday, February 22",0,1
143,B09J561NTR,"Freny Exim 10"" Inch Wooden Wall Clock (Wenge, Small Size, 25cm x 25cm)-027",Freny,0,0,0,348,3.0,6,77,"Saturday, February 19",0,6
144,B07BK39PM2,"Oreva AQ-4177 Plastic Pendulum Wall Clock with Cuckoo (36 cm x 12 cm x 40 cm, Brown)",Oreva,0,0,0,"2,745",3.6,224,15,"Monday, February 21",0,224
145,B08D9L5KR6,"Clarco Brand Big Size Designer Analogue Round Plastic Wall Clock with Glass (12 x 12 Inch/30 x 30 cm, WL_779L, Dark Blue)",Clarco,0,0,0,589,3.9,270,61,"Saturday, February 19",1,270
146,B09BL9GH9W,"Roopam Wood Peacock Design Heritage Finish Half Metal Wall Clock (Multicolour, 18 inch)",Roopam,0,0,0,"2,949",4.6,42,66,"Sunday, February 20",0,42
147,B09PZ2T93S,SANDROSE Ajanta Mfg. Quartz Battery Operated Plastic Ticking Movement Machine with Antique Needle Hands for Wall Clock for Home|Office|Restaurant(M-514-SAKUNTALA),SANDROSE,0,0,0,199,5.0,2,67,"Tuesday, February 22",0,2
148,B09KDZ73QC,"Craftowl Metal Vintage Round Ship Antique Wall Clock with Showpiece Sculpture Art for Home Decor and Living Room (17 x 2 x 17 Inch, Multicolor)(Design 2)",Craftowl,0,0,0,"1,499",3.9,11,50,"Saturday, February 19",0,11
149,B08GL2CH2C,"Amazon Brand - Solimo 12-inch Contemporary Plastic & Glass Wall Clock - Designer (Silent Movement, Black Frame)",Amazon,0,0,0,639,4.1,657,42,,1,657
150,B09C6CLRGM,Exim Decor Metal Vintage Style Pattern Victoria Wall Clock with Metal & Glass Wall Clock | Design - Victoria Roman Dial with Golden Metal Frame | Designer clock for Home and Office Decor | Wall Clock for Living Room | Roman Dial Pattern,Exim,0,0,0,"1,399",0,0,30,"Friday, February 18",1,"₹1,399
₹1,999 Save ₹600 (30%)"
151,B09MPK3DSC,"Starmoon Analog Wooden Wall Watch for for Home -Wall Clock for Living Room Hall Bedroom Office Stylish (12 x 12 inch) Wall Clock (Black, Without Glass)",Starmoon,0,0,0,399,5.0,1,77,"Saturday, February 19",0,1
152,B09Q376T6J,Sandrose Plastic Wall Clock with World Map Print Blue 24 cm (WORLD-MAP-62),Sandrose,0,0,0,339,3.0,2,52,"Saturday, February 19",0,2
153,B09NRBYQSG,"BOXHUM Wooden Decorative Wall Clock Quartz Battery Operated 12 "" Wall Clocks Vintage Rustic Concise Style Wooden Home Decor Round Wall Clock - [Pack of 1 | Black Letter]",BOXHUM,0,0,0,449,4.4,25,55,"Sunday, February 20",1,25
154,B096QP9W1R,"ColorSplash Customized/Personalized Wooden Wall Clock with 8 Photos for Birthday for Your Love (30cm x 1cm x 30cm, Black)",ColorSplash,0,0,0,730,3.5,8,44,"Saturday, February 19",1,8
155,B09BKVV9PC,Efinito Sun Flaming Wall Clock - (17 INCH) (Silent Movement) (Brown),Efinito,0,0,0,999,4.5,2,70,"Saturday, February 19",1,2
156,B09P6N4TM5,Ajanta Designer MDF Wooden 35x43 cm Lord Krishna and Peacock Wall Clock for Home and Office Blue Color,Ajanta,0,0,0,599,3.8,9,40,"Saturday, February 19",1,9
157,B08KFKW1LN,"Simran Handicrafts Round Roman Wood Carving MDF Design Wall Clock, Brown",Simran,0,0,0,349,3.5,"1,484",77,"Saturday, February 19",1,"1,484"
158,B07R2YJD7J,"Amazon Brand - Solimo 12-inch Classic Plastic Wall Clock, Black",Amazon,0,0,0,545,4.2,481,50,"Friday, February 18",1,481
159,B09RPV5DSC,Ajanta Quartz Real Step Movement Premium Finish 12 Inches Wall Clock for Home and Offices (Blue),Ajanta,0,0,0,795,0,0,11,"Saturday, February 19",1,"₹795
₹895 Save ₹100 (11%)"
160,B01LVYTXIA,"Ajanta Abstract Plastic Fancy Wall Clock (28 cm x 16.7 cm x 3.5 cm, Ivory)",Ajanta,0,0,0,215,3.9,462,0,"Saturday, February 19",0,462
161,B09DWGWX6M,"VASTVA Krishna pankh Antique Designer Wooden 12Inch Wall Clock for Home, Living Room, and Office Fancy Big Size-WC-495",VASTVA,0,0,0,449,2.9,10,55,"Saturday, February 19",0,10
162,B09MB19T4W,"Ingo creation Analog Wooden Wall Watch for for Home -Wall Clock for Living Room Hall Bedroom Office Stylish (30.48 cm X 30.48 cm Wall Clock (Black, Without Glass)",Ingo,0,0,0,388,3.5,18,57,"Saturday, February 19",1,18
163,B082DS85FQ,"Amazon Brand - Solimo Engineered Wood, Glass Vivid 12-inch Silent Movement Wall Clock (Black)",Amazon,0,0,0,427,4.2,348,72,"Friday, February 18",0,348
164,B08GL2CH2C,"Amazon Brand - Solimo 12-inch Contemporary Plastic & Glass Wall Clock - Designer (Silent Movement, Black Frame)",Amazon,1,0,0,639,4.1,657,42,,1,657
165,B092R64F9Z,"The Next Decor Roman Modern Round Metal with Noiseless Machine Wall Clock for Wall Decor (Matte Black, 15 Inch)",The,1,0,0,"1,799",4.3,230,10,"Friday, February 18",1,230
166,B076V9MWFL,"Amazon Brand - Solimo - Paramount Dark Paneling Abstract Plastic Wall Clock (12"", Silent Movement, Black Frame)",Amazon,1,0,0,584,4.0,824,51,"Wednesday, February 16",1,824
167,B0968D9FRH,"Sky Instrument Wooden Handmade Vintage Style Wall Clock for Home Decor, Office Decor (15 inch)",Sky,1,0,0,"1,650",3.8,20,48,"Monday, February 21",1,20
168,B09HW93573,Cool Wall Clock,Cool,1,0,0,"1,199",0,0,0,"Friday, February 25",0,"₹1,199
₹1,200"
169,B07VCXQQDG,Vintage Clock Wooden Hand-Crafted Wall Clock / 1 Year Warranty / 16 Inches (40 CM's),Vintage,1,0,0,"1,849",4.4,960,74,"Saturday, February 19",1,960
170,B078RPTT4G,Story@Home Round Shape Wall Clock with Glass for Home/Kitchen/Living Room/Bedroom/Office (Light Blue),Story@Home,1,0,0,199,3.6,"2,597",75,"Saturday, February 19",0,"2,597"
171,B092TF6NPC,"Starmoon Silent Quartz Movement Wood Wall Clock (58 X 26 cm, Brown)",Starmoon,1,0,0,"1,249",0,0,69,"Saturday, February 19",0,"₹1,249
₹3,999 Save ₹2,750 (69%)"
172,B00PXJSIIE,"Ajanta Quartz OLC - 302 Plastic Digital Red LED Square Wall Clock (Black, 25.4 cm x 25.4 cm x 3.5 cm)",Ajanta,0,0,0,"1,425",3.9,"2,446",14,"Saturday, February 19",1,"2,446"
173,B09KRZD29Y,"MYPAINTBRUSHTALES 12-Inch Modern Plastic Decorative Vintage Wall Clocks for Home, Living Room, Bedroom, Office (Wooden Finish Wall Clock)",MYPAINTBRUSHTALES,0,0,0,628,5.0,3,37,"Friday, February 18",1,3
174,B07C9F3C5D,Bhavnath Creation Acrylic Love Wall Clock (Black Red_36 Inch X 24 Inch),Bhavnath,0,0,0,444,4.1,64,51,"Monday, February 21",0,64
175,B09RZKHDK5,"APS Art Plus Store 5 Face Golden Wall Clock for Home and Office Decor, Wall Clock for Decor Stylish, Wall Clock for Living Room",APS,0,0,0,349,0,0,77,"Saturday, February 19",0,"₹349
₹1,499 Save ₹1,150 (77%)"
176,B08Z2ZYXQJ,C H Clock Handicraft Wooden Antique Roman Number Wall Clock (12 Inches),C,0,0,0,799,3.8,68,56,"Tuesday, February 22",0,68
177,B07NXFQRF8,"Ajanta Plastic Wall Clock (245 cm x 205 cm x 40 cm, Blue)",Ajanta,0,0,0,190,3.7,"1,608",0,"Sunday, February 20",0,"1,608"
178,B09M7DK2JW,Ajanta Designer MDF Wooden 33*34 Flower Peacock Wall Clock for Home and Office Red Color,Ajanta,0,0,0,599,3.0,2,40,"Saturday, February 19",1,2
179,B09R7WBZMB,"Nozvera Wooden Wall Clock for Home Decor Vintage Wall Clock for Home Antique Wooden Big Size Wall Clock for Home Stylish , Living Room, Office and Hall (15 Inch X 15 Inch) (WD&BG)",Nozvera,0,0,0,999,0,0,50,"Saturday, February 19",0,"₹999
₹1,999 Save ₹1,000 (50%)"
180,B07S2ZN85P,"Oreva AQ 1467 Plastic Round Analog Wall Clock with LED Back Light (35.5 cm x 35.5 cm x 4 cm, Green)",Oreva,0,0,0,920,4.1,132,0,"Sunday, February 20",1,132
181,B09DWH8JS3,"VASTVA Antique six Peacock Designer Wooden 16 Inch Wall Clock for Home, Living Room, and Office Fancy Big Size-WC-498",VASTVA,0,0,0,349,0,0,65,"Saturday, February 19",0,"₹349
₹999 Save ₹650 (65%)"
182,B09FPR3MZR,Harbour Analog Latest Stylish New Models Wall Clock with Photo Frames for Home Living Room Hall Bedroom (Size Height 58 cm X Width 48CM)- Home Decor Big Size Wall Clock Mz WL 2,Harbour,0,0,0,895,0,0,75,"Saturday, February 19",1,"₹895
₹3,599 Save ₹2,704 (75%)"
183,B08ZL3KLHV,Circadian Ajanta Wooden Hand Painted Designer Wall Clock for Home Decorative Wall Clocks for Home Living Room Office Bedroom White Colour (White Colour Round Clock Design) (13 in*13 in),Circadian,0,0,0,489,3.8,141,62,"Saturday, February 19",0,141
184,B082DRZ3PD,"Amazon Brand - Solimo 12-inch Plastic & Glass Wall Clock - Victorian Bliss (Silent Movement), Black",Amazon,0,0,0,639,3.9,"2,005",57,,1,"2,005"
185,B092TLB99C,"HUMPBACK Acrylic Reverse Frameless Creative Wall Clock (Black, 76.2 x 2.5 x 33 Cms)",HUMPBACK,0,0,0,694,4.2,123,47,"Sunday, February 20",1,123
186,B09KM3NYBC,VintCraft Dial Vintage Antique Black Station Double Sided Metal Wall Clock (Multi) (8 inch),VintCraft,0,0,0,594,3.3,3,77,"Saturday, February 19",0,3
187,B08HD9RY1L,"SellPlus Iron London Victoria Station Retro Vintage Antique Double Sided Wall Clock (8 Inch, White, Black)",SellPlus,0,0,0,599,3.9,116,70,"Saturday, February 19",0,116
188,B09NDWBPBC,CIRCADIAN Handicrafts Round Roman Wood Carving MDF Design Wall Clock (Black),CIRCADIAN,1,0,0,799,0,0,64,"Saturday, February 19",1,"₹799
₹2,199 Save ₹1,400 (64%)"
189,B08ZKGQ39X,SELLY CART Acrylic Offical Neon Offical Wall Clock (Matte Black),SELLY,1,0,0,999,3.7,11,50,"Wednesday, February 23",1,11
190,B09RW5BWPK,KROGGER Large Modern Metal Wall Clocks Rustic Round Silent Non Ticking Battery Operated Black Roman Numerals Clock for Living Room/Bedroom/Kitchen Wall Decor- 18 Inch,KROGGER,1,0,0,"1,899",0,0,68,"Sunday, February 20",0,"₹1,899
₹5,999 Save ₹4,100 (68%)"
191,B09SDC3K46,Ginnihandicrafts Wooden Multicolour high Durable Wall Click,Ginnihandicrafts,1,0,0,699,0,0,65,"Monday, February 21",0,"₹699
₹1,999 Save ₹1,300 (65%)"
192,B09JP59NLQ,"Ajanta Real Silent Sweep Movement Plastic Designer Wall Clock (338x51x338mm, Brown)",Ajanta,0,0,0,989,4.3,99,17,"Saturday, February 19",1,99
193,B09Q3G3PMV,Elica Radium Night Glow Wall Clock (Jet Black),Elica,0,0,0,590,3.8,317,51,"Friday, February 18",1,317
194,B09PHLW2JG,MOXTER Flower Shape Personalized and Customized Photo Premium Hanging Wall Décor Clock/Home Clock/Living Room Clock/Bedroom Clock Pack of 1 (13x13 inch ),MOXTER,0,0,0,489,5.0,1,51,"Monday, February 21",1,1
195,B07NYYTG7K,Ajanta Abstract Plastic Wall Clock (260 cm x 260 cm x 33 cm 957- IVORY_ajanta),Ajanta,0,0,0,0,4.0,806,0,,0,806
196,B09B3ZN97J,"Oreva Roman Figure Round Plastic Analog Silent Movement Wall Clock (35.5 x 4 x 35.5 cm, Silver RF, AQ-1467 SS), Large",Oreva,0,0,0,524,4.2,59,0,"Sunday, February 20",1,59
197,B07MCPQV55,"Ajanta Quartz OLC - 302 Plastic Abstract Digital LED Square Wall Clock (White, 25.4 cm x 25.4 cm x 3.5 cm)",Ajanta,0,0,0,"1,615",3.8,"3,460",19,"Monday, February 21",0,"3,460"
198,B09JZ6HX3F,"Dinine Craft ® Plastic Big Wall Designer Big Size Wall Clock, 28Cm X 28Cm, Golden, with Glass",Dinine,0,0,0,399,3.4,95,60,"Saturday, February 19",1,95
199,B09MBZPNF8,"E DEALS Avengers Marvels Print Round Shaped Designer Silent Movement Wall Clock with Glass for Kids Room Home , School, Office , Living Room SMALL-PWC-748",E,0,0,0,349,0,0,65,"Saturday, February 19",1,"₹349
₹999 Save ₹650 (65%)"
200,B08TWNN9DS,"MANN KI CHOICE Plastic Classic Design Colourful Peacock Designed Wall Clock with Wooden Touch (26cm X 26cm, Silver)",MANN,0,0,0,270,3.3,21,66,"Saturday, February 19",1,21
201,B094ZSVX46,"Option Gallery London Vintage Victoria Metal Double Sided Station Wall Clock with dial (White Dial, 8 inches)",Option,0,0,0,880,4.3,40,56,"Saturday, February 19",1,40
202,B09MJD5TLY,"NATUREL Chai Tea Printed Round Shaped Designer Wall Clock with Glass for Home/Living Room/Bedroom/Kitchen/Office (Black Frame,24 cm x 24 cm x 3.5 cm)",NATUREL,0,0,0,345,3.3,19,74,"Tuesday, February 22",0,19
203,B09HH133GQ,Efinito 12.5 Inches Time Teaching Wall Clock for Kids That Helps time Learning Faster and Fun- Silent Movement,Efinito,0,0,0,594,3.6,10,70,"Saturday, February 19",1,10
204,B08J7WSKMF,TOWN CRAFTS Plastic Wall Clock (Brown),TOWN,0,0,0,279,3.5,186,72,"Saturday, February 19",0,186
205,B09MCSCFYC,999Store Honeycomb and Hexagon Yellow Grey and White Modern Stylish Wall Clock for Kitchen/Living Room/Bedroom/Office (Round 12- Inch Ticking Movement Black Frame(ClockBL2P177),999Store,0,0,0,399,1.0,1,80,"Saturday, February 19",0,1
206,B09PHB13G5,Anchor Shape Copper Color Pendulum Wall Clock,Anchor,0,0,0,389,4.3,3,74,"Saturday, February 19",0,3
207,B08ZSWSCK8,"ARTINEST Wood Stylish Allah, Zua-ad Round Design Wall Clock (Black, 12.50 x 12.50 Inch)",ARTINEST,0,0,0,350,0,0,73,"Saturday, February 19",1,"₹350
₹1,299 Save ₹949 (73%)"
208,B07D4CFTC2,"Ajanta Quartz Plastic Digital LED Rectangle Wall Clock (DC 017, 39.5 cm x 29.5 cm x 3.5 cm, Red, Black)",Ajanta,0,0,0,"1,595",3.7,194,0,"Saturday, February 19",1,194
209,B096MK8DH5,"Sketchfab Wall Clock Wooden Hair Dresser Hair Stylist MDF Design Decorative Non-Ticking Digital, Perfect 12 Inch Round Easy to Read for Home/Office/Kitchen/Bedroom/Hall Way/Classroom, Hotel - Black",Sketchfab,0,0,0,399,1.0,1,73,"Saturday, February 19",1,1
210,B097435X73,"Elica Plastic Antique Designer Sweep Silent Pendulum Wall Clock (Copper, 49 x 0.2 x 31 cm)",Elica,0,0,0,899,4.0,433,61,"Friday, February 18",1,433
211,B07VKP2RC9,"CREATIVE HUB DECOR MDF Wood Personalized Wall Clock with Picture and Message (Multicolour, 11x11 inch)",CREATIVE,0,0,0,399,4.1,690,70,"Monday, February 21",0,690
212,B09CLMZSPP,EFINITO Plastic 17 Inch Classic Roulette Designer Silent Movement Wall Clock (Brown),EFINITO,0,0,0,990,3.8,233,60,"Saturday, February 19",1,233
213,B098BQPZZ4,"SK multi store world Krishna Radha Design Plastic Analog Wall Clock ( 25 cm X 25 cm , , Multicolour )",SK,0,0,0,280,3.5,18,72,"Saturday, February 19",1,18
214,B09Q5RGW7P,About Space Cutlery Wall Clock Silent Movement Non Ticking Unique Clock for Home Dining Living Room Decor Creative Fork and Spoon Design Kitchen Wall Clock,About,0,0,0,"1,099",0,0,35,"Friday, February 18",1,"₹1,099
₹1,699 Save ₹600 (35%)"
215,B09PTZ5SYL,Rangat Craft Plastic 10 inch Wall Clock with Glass | Corporate Gift | Analogue Wall Clock | Ganesh Wall Clock | Living Room Wall Clock (10 inch),Rangat,0,0,0,299,0,0,67,"Saturday, February 19",1,"₹299
₹899 Save ₹600 (67%)"
216,B09NPCSPSZ,Oreva Sweep Radium Clock Wall Clock(12 Inches_Ajanta MFG Pvt. Ltd.) Night Glow Clock,Oreva,0,0,0,890,5.0,2,25,"Saturday, February 19",1,2
217,B09H38WQGG,"E DEALS Designer Wooden Wall Clocks for Home, Bedroom, Living Room Decor (12 Inch, Brown)",E,0,0,0,299,3.2,32,70,"Saturday, February 19",1,32
218,B09RH1K44J,Acrylic DIY Frameless 3D Mirror Sticker Large Wall Clock for Home Office Decorations (Black),Acrylic,0,0,0,599,0,0,40,"Saturday, February 19",1,"₹599
₹999 Save ₹400 (40%)"
219,B08GKXX3Z6,"Amazon Brand - Solimo 12-inch Contemporary Plastic & Glass Wall Clock - Designer (Silent Movement, Black Frame)",Amazon,0,0,0,375,3.9,291,66,"Thursday, February 17",0,291
220,B07GTMD4DQ,"Oreva AQ-1837 Night Glow Round Plastic Analog Wall Clock (30.6 cm x 4.25 cm x 30.6 cm, Black)",Oreva,0,0,0,555,3.7,"4,683",0,"Sunday, February 20",1,"4,683"
221,B09DCL3N6P,Efinito 45 cm Wall Clock Classic Roulette Designer for Home Living Room Bedroom Office Kids Room - Silent Movement,Efinito,0,0,0,990,3.5,7,60,"Saturday, February 19",1,7
222,B08DD8MQV2,"EFINITO Metal Dial Vintage Antique Black Station Double Sided Wall Clock, 8 Inch , Multicolour",EFINITO,0,0,0,"1,099",4.0,183,61,"Saturday, February 19",1,183
223,B08TWNXLXZ,"MANN KI CHOICE Plastic Classic Stylish Stone Ganesha Designed Wall Clock with Beautiful Work, Golden",MANN,0,0,0,349,3.7,46,77,"Saturday, February 19",1,46
224,B0974VP35Q,Nutts Black Iron 6 Inches Victoria Station Clock London Vintage Wall Clock Retro Wall Clock Double Sided Wall Clock Antique Clock (White),Nutts,1,0,0,799,3.1,7,60,"Saturday, February 19",1,7
225,B076VGMFRY,"Amazon Brand - Solimo 12 inch Plastic & Glass Wall Clock - Paramount Paneling (Silent Movement, Black Frame)",Amazon,1,0,0,679,4.3,566,43,"Wednesday, February 16",1,566
226,B09LT8NW2R,Naturel Plastic Round Shape Black Printed Multicolor Wall Clock with Black Frame ( 24 cm x 24 cm x 3.5 cm) (2035),Naturel,1,0,0,339,0,0,75,"Tuesday, February 22",0,"₹339
₹1,349 Save ₹1,010 (75%)"
227,B09MJD5TLY,"NATUREL Chai Tea Printed Round Shaped Designer Wall Clock with Glass for Home/Living Room/Bedroom/Kitchen/Office (Black Frame,24 cm x 24 cm x 3.5 cm)",NATUREL,1,0,0,345,3.3,19,74,"Tuesday, February 22",0,19
228,B07TH7BXTG,"A One Shoppe MDF Engineered Wood Wall Clock for Living Room Bedroom (White Floral, 16 x16 Inches)",A,1,0,0,947,4.0,511,68,"Monday, February 21",1,511
229,B09LT7QSKT,Naturel Plastic Round Shape Printed FloweTree Design Wall Clock with Black Frame (24 cm x 24 cm x 3.5 cm) (2019),Naturel,1,0,0,339,0,0,74,"Tuesday, February 22",0,"₹339
₹1,329 Save ₹990 (74%)"
230,B09F6HQV7K,Antique 10 inch Round Shape Wall Clock with Glass for Home Kitchen Living Room Bedroom Office Classic Roulette (Black Frame),Antique,1,0,0,339,4.4,7,77,"Tuesday, February 22",0,7
231,B09MWKK6CC,Sandrose 10 Inch Plastic Designer Wall Clock with Glass for Home Kitchen Living Room Bedroom Office (25 x 25 x 4 cm,Sandrose,1,0,0,339,0,0,77,"Saturday, February 19",0,"₹339
₹1,499 Save ₹1,160 (77%)"
232,B09GSBD3VP,Wooden Wall Clock Antique Style Art Unique Home Office Decor Colour Brown 12 inch by Faiza Global,Wooden,0,0,0,991,3.5,4,50,"Wednesday, February 16",0,4
233,B09NDYY4N5,Sandrose 10 inch Plastic White Wall Clock for Home and Office Decor Living Room Bedroom Hall (24 x 24 x 4 cm),Sandrose,0,0,0,345,3.3,3,77,"Tuesday, February 22",0,3
234,B09NDS1CG1,Layba Creations Wall Clock for Home Living Room Office Wooden(Multi Color Peacock) (15 inches*13 inches),Layba,0,0,0,589,5.0,5,61,"Saturday, February 19",0,5
235,B01B94M8OQ,"GIFTWITHSWAGGER Metal Abstract Double-sided Wall Clock (Black, 12 Inch X 3 Inch X 12 Inch)",GIFTWITHSWAGGER,0,0,0,758,4.1,571,62,"Saturday, February 19",1,571
236,B07NPBMT7G,"Kartik Digital Zodiac Sign Print/Designer Wood Wall Clock (Multicolor, 11X11 Inches)",Kartik,0,0,0,475,3.5,11,52,"Saturday, February 19",0,11
237,B08B8PCN52,Circadian Ajanta Wooden Analog Wall Clock Design for Home Hall Living Room Decor Office Kids Bedroom Stylish Ethnic Antique Decorative Multi colour Peacock 33*33 cm ( Pack Of 1 ),Circadian,0,0,0,470,3.7,107,71,"Saturday, February 19",1,107
238,B09GP7NBPH,"D'CLOCK Quartz Machine for Big Size Wall Clock,Battery Operated,Clock Movement Machine with Needles and Hook 28 MM (100% Made in India)",D'CLOCK,0,0,0,259,2.8,5,44,"Saturday, February 19",0,5
239,B07BJ93ZM8,"Ajanta Quartz Abstract Plastic Rectangle Digital Alarm Wall Clock ODC 120 (22.5 cm x 25.5 cm x 2.5 cm, Black)",Ajanta,0,0,0,0,3.6,66,0,,0,66
240,B09R7VQ4H3,"Nozvera Wooden Wall Clock for Home Decor Vintage Wall Clock for Home Antique Wooden Big Size Wall Clock for Home Stylish , Living Room, Office and Hall (37X31 Centimeter) (BG&WD)",Nozvera,0,0,0,899,0,0,55,"Saturday, February 19",1,"₹899
₹1,999 Save ₹1,100 (55%)"
241,B071NRKJPW,"Ajanta Plastic Abstract Theme Wall Clock (20.5 cm x 20.5 cm x 3.5 cm, Blue)",Ajanta,0,0,0,185,4.0,"6,523",0,"Friday, February 18",0,"6,523"
242,B09NTHVWV2,"Ingo creation Wood Stylish Allah, Zua-ad Round Design Wall Clock for Home Living Room Office Bedroom Decor (Black, 12 x12 Inch)",Ingo,0,0,0,389,0,0,57,"Saturday, February 19",1,"₹389
₹899 Save ₹510 (57%)"
243,B09NMDKDB5,"Gift Lena Best MDF Wood Personalized Wall Clock with Picture and Message (Multicolour, 14x14 inch,Gift for Family,Aniversary Gift,Mother ,Father,Gifts for Brother ,Sister,Gift Your Dear one 53",Gift,0,0,0,695,0,0,65,"Tuesday, February 22",0,"₹695
₹1,999 Save ₹1,304 (65%)"
244,B07TWXBVMG,"LYONIC Beautiful Royal Look Roman Numbered Big Size Sweep & Silent Wall Clock for Home,Hall,Office (35 X 35 cm Color - WoodCooper) Made in India",LYONIC,0,0,0,790,3.8,15,47,"Friday, February 18",1,15
245,B09Q38VT74,Sandrose Designer Analogue Round Wall Clock with Glass for Home/Kitchen Clock Size 24 cm (3D-WOOD-61),Sandrose,0,0,0,345,5.0,2,51,"Tuesday, February 22",0,2
246,B0758QLDV7,DESIGN CONNECTION Wooden I Love Jesus with Painting Wall Clock (Pink),DESIGN,0,0,0,399,3.9,6,60,"Saturday, February 19",1,6
247,B09MPS9L2K,ZIQFIDS Clocks for Living Room Stylish Design Home Office Decor | Designer Wall Clocks for Bedroom | 25.4 cm X 25.4 cm Big Size Wall Clock | Modern Style & Easy to Read Cartoon Print Clocks,ZIQFIDS,0,0,0,299,4.6,4,80,"Saturday, February 19",1,4
248,B07XSCXX4Q,"A One Shoppe Wood Carved Round Abstract Analogue Wall Clock (Brown, 16 X 16 X 2.5 Inches)",A,1,0,0,948,3.9,278,53,"Monday, February 21",1,278
249,B076VF41DW,"Amazon Brand - Solimo Plastic Galaxy Step Movement Wall Clock - (White Frame, 12-inch )",Amazon,1,0,0,478,4.2,348,52,"Friday, February 18",0,348
250,B09LTFC8VG,is International Wall Clock,is,1,0,0,"1,999",0,0,31,"Monday, February 21",0,"₹1,999
₹2,900 Save ₹901 (31%)"
251,B091FJZ6Q1,"The Next Decor Heavy Metal Analog Wall Clock with Silent Sweep Noiseless Technology Wall Décor for Home & Office(Matte Black, 15 Inch)",The,1,0,0,"1,799",4.4,19,10,"Sunday, February 20",0,19
252,B09FC1K6BT,Efinito 12 inch Wall Clock with World map Print Silent for Room Home Kitchen Bedroom Office,Efinito,0,0,0,694,3.4,3,65,"Saturday, February 19",1,3
253,B097S3WNJ1,Caihong Metal Double Side Iron Wall Clock (10 Inches),Caihong,0,0,0,"1,689",4.2,23,49,"Saturday, February 19",1,23
254,B07PWQFGQR,"AmazonBasics Numbered Plastic Wall Clock - 12 inches, Black",AmazonBasics,0,0,0,669,4.2,707,44,"Sunday, February 20",1,707
255,B09HN6VXX5,"SANDROSE 10-inch Plastic Wall Clock with Black Frame (25.4 x 25.4 x 4.5 cm, White)",SANDROSE,0,0,0,339,3.6,17,77,"Saturday, February 19",0,17
256,B09JMH23B7,Black Muslim Allah Wall Clock,Black,0,0,0,292,5.0,1,71,"Saturday, February 19",0,1
257,B09J54T23L,"Freny Exim 10 Inches Antique Wooden Wall Clock (Wenge, Small Size, 25cm x 25cm)-001",Freny,0,0,0,349,3.7,51,77,"Saturday, February 19",0,51
258,B07V533HH8,"STAR WORK -Battery Operated Easy to Read Plastic, Glass Silent Non Ticking Quality Quartz Decorative Modern Design Wall Clock , Rose Gold , Black.",STAR,0,0,0,595,4.1,169,54,"Saturday, February 19",1,169
259,B081B6N49R,"LYONIC Plastic Battery Operated Active Quartz Ticking Machine for Wall Clock (Needle Color -Black, Made in India)",LYONIC,0,0,0,175,3.9,77,71,"Saturday, February 19",1,77
260,B099QJJ6GR,ORCA 3D Acrylic Wall Clock Design for Living Room Bed Room (Design 01),ORCA,0,0,0,899,4.4,23,31,"Sunday, February 20",0,23
261,B09FGDJCJC,"HUMPBACK 3D DIY Deer face Shape Acrylic Wall Clock Antique Design for Living Room, Bed Room, Home and Office on Wall Decoration (Black)",HUMPBACK,0,0,0,899,5.0,5,31,"Sunday, February 20",1,5
262,B08FG58JQ1,IndiA Craft Jaipur KDS Ajanta Mfg. Quartz Plastic Superhero themed Ticking Movement Machine for Wall Clock (Black),IndiA,0,0,0,198,3.8,643,67,"Friday, February 18",0,643
263,B07J4M8FTH,"ARCHIES Buddha Clock | Analog Table Clocks, Desk Top, Wall Hanging Facility |Silent Non Ticking Quartz Movement | Battery Operated for Bedroom, Living Room, Office, Home Decor Decoration Items ()(25.5 X 3.5 X 18 Cm,Bronze,Wooden Frame with Brass Idol)",ARCHIES,0,0,0,699,1.9,3,73,"Saturday, February 19",1,3
264,B081B2NHKD,"Trency Round Dial Pendulum Plastic Wall Clock for Home Office Decor (25 * 43 cm, Black)",Trency,0,0,0,"1,299",4.7,7,46,"Saturday, February 19",1,7
265,B089LMQWWW,Circadian Ajanta Wooden Analog Wall Clock Design for Home Hall Living Room Decor Office Kids Bedroom Stylish Ethnic Antique Decorative Red Colour Peacock 36 * 33 cm (Pack of 1),Circadian,0,0,0,589,3.7,35,61,"Saturday, February 19",1,35
266,B07CWCLM42,"Ajanta Plastic Abstract Sweep Clock (30 cm x 30 cm x 5 cm, White)",Ajanta,0,0,0,665,4.0,122,0,"Wednesday, February 16",1,122
267,B098K8DWGL,"SK multi store world Boxes Design Plastic Analog Wall Clock (25 cm X 25 cm , Black)",SK,0,0,0,280,3.4,23,72,"Saturday, February 19",1,23
268,B09QL4SZNS,OREX Round Plastic Abstract Multicolor Wall Clock (30*30*4 cm) for Living Room||Home||School||Office(OC-058),OREX,0,0,0,499,0,0,50,"Tuesday, February 22",0,"₹499
₹999 Save ₹500 (50%)"
269,B09QMMBVZL,"Xiqarn 12"" Silent Quartz Decorative Wall Clock Classic Digital Clock Battery Operated Round Easy to Read Room/Home/Kitchen/Bedroom/Office/School (Classic) (Wall Clock)",Xiqarn,0,0,0,649,4.8,81,35,"Saturday, February 19",1,81
270,B09Q1CTVFV,Ajanta Quartz Wall Clock with Square Dial Shape 677 Dark Blue for Office and Home,Ajanta,0,0,0,380,0,0,11,"Tuesday, February 22",0,"₹380
₹425 Save ₹45 (11%)"
271,B08VHKTQFP,SAREE HOUSE 10 Inch Metal Analog Vintage Railway Station Antique Style Double Sided Wall Clock (Black),SAREE,0,0,0,"1,449",5.0,4,44,"Saturday, February 19",1,4
272,B09C4QQXLB,Milto 3D Digital @ Shape Designer Big Silent Acrylic Wall Clock (Black),Milto,0,0,0,699,3.4,15,53,"Saturday, February 19",1,15
273,B08LQV552C,Sapphire Quartz Home and Office Designer Analogue Wall Clock (Brown),Sapphire,0,0,0,399,4.2,66,62,"Friday, February 18",0,66
274,B08BZSLPX3,"Color Splash, Customized Wooden Photo Clock with 8 Photos (12x12 inch, Multicolor)",Color,0,0,0,769,3.6,109,52,"Saturday, February 19",1,109
275,B07CQ157G5,"EFINITO Dial Vintage Antique Station Abstract Double Sided Metal Wall Clock (Multicolour, 6 Inch)",EFINITO,0,0,0,999,3.9,236,60,"Monday, February 21",0,236
276,B07ZYYHMB6,"Click n ship Plastic Wall Hanging No Sound Pendulum Clock (Brown, Small)",Click,0,0,0,405,3.7,200,66,"Saturday, February 19",1,200
277,B099WNRXKN,SEMITO Decorative Wall Clock for Living Room Bedroom Kitchen Study Room and Office Non Ticking Silent Movement (Multi Color with White Frame),SEMITO,0,0,0,449,3.6,17,55,"Saturday, February 19",0,17
278,B09Q16K2BV,Golden Color Executive Look Wall Clock(Gold) Color…,Golden,0,0,0,312,0,0,65,"Saturday, February 19",0,"₹312
₹899 Save ₹587 (65%)"
279,B07TJG8Q9W,"Oreva Plastic Abstract Vintage Wall Clock (Brown, 32 x 4 x 32 cm)",Oreva,0,0,0,355,4.2,"2,162",10,"Wednesday, February 23",0,"2,162"
