,asin,title,brand,Sponsored,Best Seller,Amazon's Choice,Price,Rating,NoofRatings,Discount,Delivery,Prime Delivery,base
198,B07KXL1Q5Z,RFID Blocking Automatic Pop-Up Money Holding Smart Pocket Aluminum Metal Front Pocket Wallet Cardholder,Stealodeal,0,0,0,299,3.7,360,40,"Wednesday, February 16",1,360
199,B07BTL9398,RFID Protected Wallet High Quality Genuine Leather Men's Wallet (857 Brown),mtuggar,0,0,0,590,4.3,"1,071",61,,1,"1,071"
200,B086D718GC,Florence RFID Blocking Leather Men's Wallet (Brown),GETOREE,1,0,0,440,4.1,48,79,,0,48
201,B09Q2X8ZKF,"Genuine Leather RFID Blocking Wallet for Men, Bifold Men's Leather Wallet with Detachable Card Case Including Zipper Coin Pocket | 2 ID Windows (14 Card Slots)",FOXHACKLE,1,0,0,899,0,0,31,,1,"₹899
₹1,299 Save ₹400 (31%)"
202,B07GCLDN9Q,Florence Men's Wallet - Leather Mens Purse - Leather Wallet for Men's & RFID Blocking Genuine Branded Leather Wallet for Men's (Black),GETOREE,1,0,0,440,4.0,778,78,,0,778
203,B09J2S24TR,RFID Protected Genuine Leather Wallet for Men (Coffee Brown),Black Shadow,1,0,0,694,4.7,11,65,,1,11
204,B07KT66DNR,Stealodeal RFID Blocking Automatic Pop-Up Money Holding Smart Pocket Aluminum Metal Front Pocket Wallet,Stealodeal,0,0,0,289,3.8,73,42,"Wednesday, February 16",1,73
205,B09P892LQ5,"10 Slots Metal RFID Blocking Metal Credit Card Holder Wallet for Men Women (10cm x 7cm x 1.5cm ,Black)",DAHSHA,0,0,0,595,3.9,252,70,,1,252
206,B084ZZX3QH,Black & Tan Leather Unisex RFID Blocking Wallet (BLW002AAA),FASHION FREAK,0,0,0,699,3.9,950,59,,1,950
207,B093H5LDGV,Leather Men's Wallet,Tommy Hilfiger,0,0,0,"1,733",4.3,85,49,,1,85
208,B083ZFMP2C,Black Leather Men's Wallet (NPH013),NAPA HIDE,0,0,0,399,4.0,169,73,,0,169
209,B08HTSRLF3,Men Casual Brown Genuine Leather RFID Wallet for Men's Bi-fold Purse (14 Card Slots),CLUBHIDE,0,0,0,579,4.1,21,74,,0,21
210,B09JBPVV5J,"Personalized Wallet + Customized Keychain with Name Tag and Charms, Combo Valentines Day Gift Set for Men- Dark Brown",The Junket,0,0,0,999,5.0,2,5,,1,2
211,B093H7M7DR,Tan & Blue Leather Men's Wallet (8903496159646),Tommy Hilfiger,0,0,0,"1,985",4.5,35,34,,1,35
212,B00Q4NJKOY,Black Leather Men's Wallet (TW112LM1BK),TITAN,0,0,0,"1,315",4.4,486,25,,1,486
213,B06XPD19SG,Leather Wallet for Men | Navy Mens Leather Wallet,WildHorn,0,0,0,412,4.3,"3,827",73,,0,"3,827"
214,B0944BKWZP,Tan Leather Wallet,Peter England,0,0,0,599,4.5,2,40,,1,2
215,B07BMPFL68,Brown Leather Men's Wallet (WH2060A),WildHorn,0,0,0,404,4.2,969,73,,0,969
216,B093H5HPS8,Wine Leather Men's Wallet (8903496160000),Tommy Hilfiger,0,0,0,"2,153",4.3,45,33,,1,45
217,B09NYGT2G7,Top Grain Portrait Leather Wallet for Men | Ultra Strong Stitching | Handcrafted | RFID Blocking | 2 ID Slots | 11 Card Slots | Zip Compartment,WildHorn,0,0,0,499,5.0,1,67,,1,1
218,B08GL13TX5,RFID Blocking 13 Slot Leather Zipper Credit Card Holder Wallet for Men & Women (Black),TEC TAVAKKAL,0,0,0,289,4.4,73,74,,0,73
219,B099PZ41JG,Men's 2 Fold Wallet (Blue),Baggit,0,0,0,531,3.7,7,33,,1,7
220,B079P6WCJZ,Blue Ballistic Nylon Skinny Fit Card Wallet,DailyObjects,0,0,0,399,4.0,254,50,,0,254
221,B0897JLM7S,"SYALKA Slim and Sleek Minimalist PU Leather Lightweight ATM | Visiting | Credit | Debit Card Holder Wallet, Megnatic Closing System with RFID Blocking for Mens & Womens (Black)",Generic,0,0,0,198,3.8,75,49,"Thursday, February 17",1,75
222,B0843CXZKT,GVN-BLU2LIN01 Blue Genuine Leather Wallet for Men,GIOVANNY,0,0,0,299,3.9,365,81,,0,365
223,B09HXZVHTV,Men's Trifold Genuine Leather Wallet | RFID Blocking Wallet for Men (Brown),Contacts,0,0,0,498,4.1,16,79,,0,16
224,B07MPXLH5Z,Teak RFID Blocking Leather Wallet for Men (TAN),GETOREE,0,0,0,440,4.2,656,78,,0,656
225,B085Y8WLTR,Genuine Leather Wallet for Men | Men's RFID Blocking Wallet (Brown),Contacts,0,0,0,"1,080",4.1,307,57,,1,307
226,B07BXLSGQB,Black Ballistic Nylon Slim Classic Men'S Wallet-Black,DailyObjects,0,0,0,799,4.1,146,53,,1,146
227,B00OXU1EGM,Classic Black Leather Wallet for Men (Black),WildHorn,0,0,0,399,4.1,764,73,,0,764
228,B08T6H4MFC,Black Men's Wallet,MINISO,0,0,0,460,4.1,18,8,,1,18
229,B07HD1L9LV,Leather Wallet for Men | Men's Genuine Leather RFID Blocking Wallet (Brown),Contacts,0,0,0,897,4.1,902,64,,1,902
230,B0957SCDD8,Personalized Custom Genuine Leather Wallet for Men with Name and Charm (HB-WL-0070 Black),The Bling Stores,0,0,0,499,4.1,18,38,,0,18
231,B09PKN9BKT,Men Formal Cherry Artificial Leather Customized Wallet,Generic,0,0,0,299,0,0,70,,0,"₹299
₹999 Save ₹700 (70%)"
232,B08W2CJPFK,BLUSHD01 Blue Suade Leather Wallet for Men,GIOVANNY,0,0,0,299,3.9,125,81,,0,125
233,B07PRKBL18,RFID Protected Tan NDM Leather Wallet for Men|9 Card Slots| 1 Coin Pocket|6 Hidden Compartment|2 Currency Slots|1 ID Slot,HAMMONDS FLYCATCHER,0,0,0,393,4.1,84,75,,0,84
234,B07HJ9MYCL,Black Men's Wallet Stylish Genuine Leather Wallets for Men Latest Gents Purse with Money Coin and Card Holder Compartment (AC1458072_1-1),Cross,0,0,0,"1,099",4.1,46,54,,1,46
235,B078XN1G5N,Brown Synthetic Men's Wallet (804600082967),TnW,0,0,0,211,4.0,131,82,,0,131
236,B086C98ZN2,Florence RFID Blocking Leather Wallet for Men (Blue),GETOREE,1,0,0,440,3.8,79,79,,0,79
237,B09GMF54YZ,RFID Protected Handmade Vegan Leather ATM Card Holder Wallet for Men & Women with Up to 42 Cards Chocolate Brown,Brooklyn Bridge,1,0,0,836,4.2,5,50,,1,5
238,B099MP9SKB,RFID Blocking Genuine Leather Premium Luxurious Stylish Branded Wallet for Men with Coin Pocket and Credit Card Holder (Brown),SUKAS,1,0,0,428,5.0,6,71,,0,6
239,B07HD1L9LV,Leather Wallet for Men | Men's Genuine Leather RFID Blocking Wallet (Brown),Contacts,1,0,0,897,4.1,902,64,,1,902
240,B07KG3G57V,RFID Protected Genuine Leather Tri-Fold Wallet with Ten Card Slots and a Coin Pocket for Men (Dark Brown),ANNODYNE,1,0,0,749,4.3,83,66,,0,83
241,B092JG3GQ2,Men's Pure Leather Tri-Fold Wallet with Card Holder | Advanced RFID Shield Technology | Standard Quality (Olive Green Combo),Corvo,1,0,0,499,4.1,6,71,,1,6
242,B07KG3J7YR,RFID Protected Genuine Leather Zip Around Wallet with 14 Card Slots & a Coin Pocket for Men (Charcoal Black),ANNODYNE,1,0,0,899,3.7,8,64,,0,8
243,B00WJIADIU,Genuine Leather RFID Protected Wallet for Men,Le Craf,1,0,0,579,3.8,167,86,,1,167
244,B07NYQYNVT,Leather Men's Wallet (5136ABDQ3_Brown),ABYS,0,0,0,236,3.8,617,70,,0,617
245,B07THDR6WW,"Men's Hunter Leather RFID Blocking Wallet, Big Size (Brown)",Goatter,0,0,0,"1,100",3.9,341,63,,1,341
246,B07DK8DXKL,Men's Artificial Leather Wallet(Tan),TnW,0,0,0,169,4.2,33,83,,0,33
247,B08WJ477GL,Tan Brown Leather Men's RFID Wallet (WLT_440_TAN),TEAKWOOD LEATHERS,0,0,0,549,4.4,18,66,,1,18
248,B072MV7JCH,Leather Black Men's Wallet (LW35),Swiss Military,0,0,0,619,4.4,224,43,,1,224
249,B09M7GS1PJ,Gannet Dark Brown Leather Wallet for Men,Generic,0,0,0,189,3.9,408,89,,1,408
250,B09NY9LZPH,Card Holder Authentic Minimalist Metal RFID Blocking Wallet with Cash Strap Slim Wallet (COPOP14-NEW1 with Free Keyring)…,Contacts,0,0,0,699,3.8,57,61,,1,57
251,B07QJXC63X,Jinbaolai Double Zipper Multipurpose Stylish Casual Artificial Leather Wallet for Men (Black),Kraptick,0,0,0,699,3.9,246,13,,1,246
252,B0824S126B,Metal Slim Wallet Stylish Genuine Leather Wallets for Men Latest Gents Purse with Card Holder Compartment - Black,POLICE,0,0,0,949,4.2,49,47,,1,49
253,B097T7JDTB,Men's Western (Brown),Van Heusen,0,0,0,908,0,0,39,,1,"₹908
₹1,499 Save ₹591 (39%)"
254,B07GCLDN9Q,Florence Men's Wallet - Leather Mens Purse - Leather Wallet for Men's & RFID Blocking Genuine Branded Leather Wallet for Men's (Black),GETOREE,0,0,0,440,4.0,778,78,,0,778
255,B07T8YF4MS,Marty Grey Leather Wallet + Pen + Keyring Combo Gift Set for Men,URBAN FOREST,0,0,0,563,4.1,168,72,,1,168
256,B07NCKKPNN,Navy Leather Men's Wallet (8903496127461),Tommy Hilfiger,0,0,0,"1,450",4.3,46,50,,1,46
257,B07RF93LMY,Black Men's & Boy's Wallet (WL-18),LORENZ,0,0,0,198,4.1,60,80,,0,60
258,B07FL9RSHJ,RFID Protected Leather Brown Men's Wallet (WH1255 Crunch)…,WildHorn,0,0,0,449,4.1,"2,125",70,,0,"2,125"
259,B084ZPSZXZ,Navy & White Leather Men's Wallet (8903496147544),Tommy Hilfiger,0,0,0,"2,122",4.2,25,29,,1,25
260,B08VNM38NK,"Bifold Pure Leather Wallet for Men with Coin Pocket and Two ID Windows (Smooth Leather, Smooth Black 1)",Brooklyn Bridge,1,0,0,"1,064",0,0,66,,1,"₹1,064
₹3,150 Save ₹2,086 (66%)"
261,B09Q6BGHWS,"Taha Mark Men's Wallet Leather Formal Casual Regular Travel Mini Wallet (Plain 1, Black)",Generic,1,0,0,269,0,0,73,,1,"₹269
₹999 Save ₹730 (73%)"
262,B07HF75WHC,Leather RFID Blocking Wallet for Men | Men's Genuine Leather Wallet | Beige,Contacts,1,0,0,897,4.0,"1,995",64,,1,"1,995"
263,B07SXR159V,Men's Genuine Leather RFID Protection Wallet | Wallet for Men,Contacts,1,0,0,798,3.8,"4,038",68,,1,"4,038"
264,B07PQMZ18B,RFID Protected Prussian Blue Vintage Leather Wallet for Men|6 Card Slots| 1 Coin Pocket|2 Hidden Compartment|2 Currency Slots|1 ID Slot|Loop to Lock The Wallet.,HAMMONDS FLYCATCHER,0,0,0,431,4.2,169,73,,0,169
265,B09N7B65KP,"9 Slot Pu Leather Credit Debit Zipper Card Holder Wallet for Men & Women - (11.5 X 9 x 3 cm, Black)",NISUN,0,0,0,599,3.9,854,70,,1,854
266,B091Z3N6PF,Wallet for Men and Boys Stylish Trendy (Brown),TnW,0,0,0,178,3.8,6,82,,0,6
267,B09J2CV166,Slim Wallet for Men Leather (Brown),GlidingGear Co.,0,0,0,"1,149",5.0,2,32,,0,2
268,B09Q994NQ4,Steve Green RFID Blocking Leather Wallet for Men | Vertical Credit Debit Card Holder,HORNBULL,0,0,0,499,4.3,56,80,,1,56
269,B07RD7RL74,Grey Men's Wallet (WL-17),LORENZ,0,0,0,269,4.0,140,73,,0,140
270,B09MC2GR3Q,Bi Fold & Light Weight Leather Men's Stylish Casual Wallet Purse with Card Holder Compartment (Brown),Allen Solly,0,0,0,699,5.0,1,46,,0,1
271,B096VZDDZL,Oswald RFID Blocking Blue Leather Wallet for Men,URBAN FOREST,0,0,0,455,4.3,322,77,,0,322
272,B08RBT7LVT,Leather World Leatherite Wallet for Men (Black),Blissburry,0,0,0,182,3.8,"2,236",82,,1,"2,236"
273,B084BW7DGW,Brown Leather Wallet for Men,GANNET,0,0,0,199,4.1,114,80,,1,114
274,B085ZYQ9D3,Dark Denim Polyester Unisex Wallet (5356810),Puma,0,0,0,489,3.6,15,30,,0,15
275,B07HJ9QPNZ,Green Leather Men's Wallet (AC1458121_1-33),Cross,0,0,0,899,4.3,338,55,,1,338
276,B083TS3TK4,Napa Hide Blue Leather Men's Wallet (NPH),NAPA HIDE,0,0,0,440,3.9,175,71,,0,175
277,B08JHV8T7S,Brown Leather Men's Wallet Gift Set,Allen Solly,0,0,0,"1,169",4.4,85,10,,1,85
278,B09HMMNRMB,Credit/Debit Card Holder 11 Slot PU Leather Small Zipper Wallet for Men & Women (Square-Brown),Generic,0,0,0,369,4.4,10,75,,0,10
279,B082SSCG3W,Men's Genuine Leather RFID Blocking Wallet (Brown),Contacts,0,0,0,897,3.7,272,64,,1,272
280,B09BB5JS7K,Artificial Leather Wallet (Black),TnW,0,0,0,179,4.6,16,85,,0,16
281,B07Z87VQBY,Autumn-Winter Brown Leather Men's Wallet (8903439772031),Hidesign,0,0,0,859,5.0,6,52,,1,6
282,B093H527N6,Brown Leather Men's Wallet (8903496160598),Tommy Hilfiger,0,0,0,"1,623",4.6,51,44,,1,51
283,B0933JZV5K,"Jaxen Mens Passcase Wallet Black/Navy (8903496156980), (11.5X2.5X9.5)cm",Tommy Hilfiger,0,0,0,"1,551",0,0,53,,1,"₹1,551
₹3,299 Save ₹1,748 (53%)"
284,B093H5Q529,Tan Leather Men's Wallet,Tommy Hilfiger,0,0,0,"1,650",4.4,45,50,,1,45
285,B074W85NGS,Brown Leather Wallet & Black Reversible Belt Combo Gift Set for Men (MAX-2202 NL-0102),MARKQUES,0,0,0,549,3.8,276,75,,1,276
286,B09MQYKCQJ,Genuine Leather Slim Wallet for Men | RFID Protection Minimal Thin Front Pocket Wallet Sleeve Card Holder for Men (Brown),Contacts,0,0,0,498,4.5,3,69,,0,3
287,B09P3YXK7T,Men's Genuine Leather RFID Blocking Wallet | Round Zip Wallet (Brown),Generic,0,0,0,499,0,0,83,,1,"₹499
₹2,999 Save ₹2,500 (83%)"
288,B07K6GD82L,Men's PU Leather Money Wallet (Black),SAMTROH,0,0,0,199,4.1,144,80,,1,144
289,B078NCMKN8,Navy Men's Wallet (8903496110494),Tommy Hilfiger,0,0,0,"1,550",4.4,100,50,,1,100
290,B09FDS4HXK,Brown & Black Leather Men's Wallet Gift Set,Allen Solly,0,0,0,999,4.0,2,41,,1,2
291,B09NBNJ61K,"Carbon Fiber Minimalist Wallets for Men Slim Metal PFID Wallets with Money Clip, Credit Card Holder Wallet - Black",VOGARD,0,0,0,499,3.0,2,72,,1,2
292,B07YQ3VRRS,Black Synthetic Men's Wallet (2112957),Baggit,0,0,0,552,4.5,46,20,,1,46
293,B07BW2H8XX,Leather Men's Wallet (js007_Black),Jade Spade,0,0,0,523,3.7,912,67,,1,912
294,B093H6NP6P,Navy & Brown Leather Men's Wallet (8903496159899),Tommy Hilfiger,0,0,0,"1,961",4.2,43,30,,1,43
295,B08JM511WX,Genuine Leather Men Wallet||ATM Card Case||Money Purse||Card Holder with Zip Closure (Tan-HJ),ABYS,0,0,0,473,4.0,"1,643",64,,0,"1,643"
296,B086C976V8,Florence RFID Blocking Leather Wallet for Mens (Blue),GETOREE,1,0,0,440,4.2,9,79,,0,9
297,B09CNVTB6X,Brown Genuine Hunter Leather Wallet for Men with ATM Card Wallet Men's Wallet Purse,Addition,1,0,0,599,4.6,3,50,,1,3
298,B086C8ZRG8,Teak Tan RFID Blocking Leather Wallet for Men's,GETOREE,1,0,0,440,4.0,22,79,,0,22
299,B07PQKFKK6,RFID Protected Light Turquoise Leather Wallet for Men|6 Card Slots| 1 Coin Pocket|2 Hidden Compartment|2 Currency Slots|1 ID Slot|Easy Access Card.,HAMMONDS FLYCATCHER,1,0,0,431,4.1,"1,382",73,,0,"1,382"
300,B09Q6D1R5J,"Taha Mark Men's Wallet Leather Formal Casual Regular Travel Mini Wallet (Plain 1, Brown)",Generic,1,0,0,269,0,0,73,,1,"₹269
₹999 Save ₹730 (73%)"
301,B08ZYNLPS3,Men's Bi- Fold Leather Wallet (Dark Blue),DENZO,1,0,0,699,3.8,12,30,,1,12
302,B08XZJJD84,Black Leather Men's RFID Blocking Wallet (372),succor,1,0,0,599,4.3,6,63,,1,6
303,B09J2QKSYT,RFID Protected Genuine Leather Wallet for Men (Tan Brown),Black Shadow,1,0,0,649,5.0,5,68,,1,5
304,B00ZDZ6KFQ,"Men's Leather Wallet (LW-19, Brown Color)",Swiss Military,0,0,0,880,4.3,56,41,,1,56
305,B09NBNJ61K,"Carbon Fiber Minimalist Wallets for Men Slim Metal PFID Wallets with Money Clip, Credit Card Holder Wallet - Black",VOGARD,0,0,0,499,3.0,2,72,,1,2
306,B093H6NP6P,Navy & Brown Leather Men's Wallet (8903496159899),Tommy Hilfiger,0,0,0,"1,961",4.2,43,30,,1,43
307,B083RX2CLS,Synthetic Men's Wallet (CHAIN_Camouflage),DESIGNER BUGS,0,0,0,269,3.9,278,79,,1,278
308,B08JM511WX,Genuine Leather Men Wallet||ATM Card Case||Money Purse||Card Holder with Zip Closure (Tan-HJ),ABYS,0,0,0,473,4.0,"1,643",64,,0,"1,643"
309,B07NYZYJH1,"11 Slot PU Leather Credit Zipper Card Holder Wallet Zipper Coin Purse for Men (Dark Brown,12x4x8cm)",Storite,0,0,0,699,3.8,200,72,,1,200
310,B07NCJJ2KX,Brown Leather Men's Wallet (8903496127768),Tommy Hilfiger,0,0,0,"2,173",4.4,66,34,,1,66
311,B08JD2JG8Z,Men's RFID Protected Genuine Leather Wallet Keychain and Pen Combo (BLUE83),WildHorn,0,0,0,630,4.2,"6,797",68,,1,"6,797"
312,B0954665VJ,"PU Leather Men's Belt & RFID Blocking Wallet Set, Brandy",Amazon Brand - Solimo,0,0,0,499,0,0,50,,1,"₹499
₹1,000 Save ₹501 (50%)"
313,B082P13778,Men's RFID Protected Leather Wallet (Green Hunter),WildHorn,0,0,0,480,4.0,92,68,,0,92
314,B0998KNPSC,"RFID Blocking Tri Fold Leather Wallet for Men Napa Black ( 4 Card Slots, 2 Currency Slots, 2 Hidden Compartment, 1 ID Slot )",Husk N Hoof,0,0,0,679,3.8,16,48,,1,16
315,B078S6XQLW,"Bicast Leather Credit Card Holder Wallet 13 Card Slots & 2 Money Pocket for Men and Women (Brown,10.5x7.5x2.6 cm)",DAHSHA,0,0,0,395,4.1,954,78,,0,954
316,B00V3BYY4I,"Leather Men's Wallet (UBF101DBL1005_Transparent, Dark Blue & Black)",URBAN FOREST,0,0,0,449,4.2,"5,895",78,,0,"5,895"
317,B07NJ41FPC,Maddison Men's Brown Genuine Leather Wallet,HORNBULL,0,0,0,399,4.1,"5,215",84,,0,"5,215"
318,B09NBLC8YM,"10 Slot PU Leather Credit Debit Zipper Card Holder Wallet with Cash & Coin Pocket for Men & Women (12 X 9 X 3 cm, Chocolate Brown)",DAHSHA,0,0,0,498,4.0,2,67,,0,2
319,B01H7PEJ0W,Multicolored Canvas Men's Wallet (DESGINER BROWN-721),Shoprider,0,0,0,299,4.1,69,50,,1,69
320,B099SGZT7F,Olive Leather Men's RFID Blocking Wallet (MKW-2062),IMPERIOUS - THE ROYAL WAY,1,0,0,729,4.6,7,82,,1,7
321,B09BVX2P6C,Florence RFID Blocking Leather Men's Wallet (Black),GETOREE,1,0,0,379,3.9,27,80,,0,27
322,B098XN4V5C,Mushroom Leather Men's RFID Blocking Wallet (2070),IMPERIOUS - THE ROYAL WAY,1,0,0,699,3.4,9,83,,1,9
323,B09DGNMX16,Florence RFID Blocking Leather Men's Wallet (Beige),GETOREE,1,0,0,440,4.1,187,79,,0,187
324,B084G4WSGB,Mark Navy/Red Men's Genuine Leather BI Fold Coin Wallet,Swiss Military,0,0,0,"1,099",4.3,9,54,,1,9
325,B0987XM1FS,Personalized RFID Wallets for Men - Custom Photo on Man Made Leather Purse Birthday Gift for Men (Tan),GFTBX,0,0,0,699,4.3,418,42,,1,418
326,B099PZGWLP,Blue Faux Leather Men's Wallet (2121553),Baggit,0,0,0,551,4.4,9,20,,1,9
327,B089VRGK9H,Boss Men's Leather Wallets with RFID (PT2978999_5-56_Navy/Black),POLICE,0,0,0,"1,139",4.5,64,68,,1,64
328,B089T8KTY5,Blue Polyester Unisex Wallet (5405103_Blue_X),Puma,0,0,0,499,4.1,32,62,,1,32
329,B07FHZD8Z1,Tan Leather Men's Wallet (783611160904),HIDE & SLEEK,0,0,0,319,4.0,210,75,,1,210
330,B07DS8V2VX,Bi-Fold Cherry Color Faux-Leather Wallet for Men/Boys with Multiple Card Slots(Color-Cherry||WL-052),CREATURE,0,0,0,279,4.1,144,79,,1,144
331,B0933JZV5K,"Jaxen Mens Passcase Wallet Black/Navy (8903496156980), (11.5X2.5X9.5)cm",Tommy Hilfiger,0,0,0,"1,551",0,0,53,,1,"₹1,551
₹3,299 Save ₹1,748 (53%)"
332,B09Q2X8ZKF,"Genuine Leather RFID Blocking Wallet for Men, Bifold Men's Leather Wallet with Detachable Card Case Including Zipper Coin Pocket | 2 ID Windows (14 Card Slots)",FOXHACKLE,0,0,0,899,0,0,31,,1,"₹899
₹1,299 Save ₹400 (31%)"
333,B093H527N6,Brown Leather Men's Wallet (8903496160598),Tommy Hilfiger,0,0,0,"1,623",4.6,51,44,,1,51
334,B07D421D7B,Navy Men's Wallet (TH/ROMOMCCW08/SCP2018),Tommy Hilfiger,0,0,0,"1,740",4.5,177,40,,1,177
335,B072SQ5GB1,Brown Leather Men's Wallet & Belt Combo set (HBCM16BW6995),HORNBULL,0,0,0,898,4.1,"2,270",73,,1,"2,270"
336,B091P9C2MC,RFID Protected Fabric Wallet Light Blue Khadi Polyester Water Resistance - No Leather,Kelile India,0,0,0,"1,299",4.8,11,0,,0,11
337,B07MR3QF3J,"Canvas Wallet for Men,Boys.6 Card Holder Wallet Black,Genuine Leather Stylish bi-fold Canvas Printed Designer Multicolor Genuine Leather Wallet and Purse Card Holder",Fashionduet,0,0,0,299,4.2,125,67,,0,125
338,B089T8YFRT,Autumn-Winter 20 Black Polyester Unisex Wallet (5405301_Black_X),Puma,0,0,0,574,4.1,27,56,,1,27
339,B01MCYCGOY,Black Leather Unisex RFID Blocking Wallet (BLCH002),FASHION FREAK,0,0,0,399,4.0,"1,527",77,,0,"1,527"
340,B08HRWDPR2,"PU Leather Steel Business Visiting Credit Debit Card Holder Wallet for Men & Women (Black, 10 x 6 x1.4 cm)",Storite,0,0,0,299,4.1,125,70,,0,125
341,B09FKB3MGV,Combo Gift Set - Leather Global Coin Wallet + Card Holder + Key Fob with Hilfiger Embossing Across Everywhere Navy Color (TH/BRIAN/WALL/CC/KF/08),Tommy Hilfiger,0,0,0,"2,389",4.3,7,43,,1,7
342,B09BNKGM3H,Hunter Brown Leather Unisex Wallet (RBXCH3HB),SKiDE,0,0,0,499,4.2,131,69,,1,131
343,B086C7X41H,Florence RFID Blocking Leather Wallet for Men (Blue),GETOREE,0,0,0,440,3.9,51,79,,0,51
344,B0919SBPHT,"RFID Protected Brown Nappa Genuine Leather 6 Card Slots, 1 Coin Pocket, 4 Hidden Compartment, 2 Currency Slots, 3 ID Compartment, Men's Wallet",HAMMONDS FLYCATCHER,0,0,0,431,4.1,173,73,,0,173
345,B072FV7PX3,Burgundy Leather Men's Wallet (TW102LM2BY),TITAN,0,0,0,"1,399",4.2,177,20,,1,177
346,B07GBR2M3G,Denim Blue Fabric Unisex Wallet,CLUB TWENTY ONE,0,0,0,405,4.2,87,73,,0,87
347,B07XTLS9H9,Blue Polyester Unisex Wallet (Marbelous),Supervek,0,0,0,474,3.7,10,5,,1,10
348,B09CV5ZVFQ,PU Leather 9 Slot Vertical Credit Debit Card Holder Money Wallet Zipper Coin Purse for Men Women (Tan),FUR JADEN,0,0,0,399,4.0,135,60,,0,135
349,B09FKCQJC5,Combo Gift Set - Leather Global Coin Wallet + Card Holder + Key Fob Navy Color (TH/STALIN/WALL/CC/KF/08),Tommy Hilfiger,0,0,0,"2,549",5.0,1,39,,1,1
350,B07WL2Z2VG,Black Men's Wallet (RCW1017),Royster Callus,0,0,0,328,3.9,108,79,,0,108
351,B08ZVBV8SL,; 6* Card Poket Brown; Artificial Leather Men's Wallet,Loscco,0,0,0,230,3.8,9,81,,1,9
352,B08YK72NZN,Black Faux Leather Men's Two Fold Wallet (2120802),Baggit,0,0,0,482,4.4,17,30,,0,17
353,B091SVW2M8,Men's Faux Leather Wallet ( Tan ) (0IP6WRLA2117I-12F-ST),United Colors of Benetton,0,0,0,645,5.0,1,57,,1,1
354,B0928FM3V3,Zeke RFID Blocking Vintage Brown Leather Wallet & Casual Grey Leather Belt Combo Gift Set for Men,URBAN FOREST,0,0,0,939,4.3,31,62,,1,31
355,B08G5FS819,Genuine Leather Men's Wallet & Belt Combo set (100-39),Amazon Brand - Solimo,0,0,0,696,3.5,32,13,,1,32
356,B07DVGTQRT,RFID Safe Men Wallet Leather (Black),Am leather,1,0,0,418,3.5,49,79,,0,49
357,B082SSH6CJ,"Leather Wallet for Men | Men's Genuine Leather RFID Blocking Wallet, Brown)",Contacts,1,0,0,897,4.1,902,64,,1,902
358,B09CZBRHRN,Florence RFID Blocking Leather Men's Wallet (Brown),GETOREE,1,0,0,440,4.0,778,78,,0,778
359,B092J8S39V,Men's Leather Bi-Fold Wallet (Olive Green),Corvo,1,0,0,499,2.8,2,67,,1,2
360,B09Q6BF72H,"Taha Mark Men's Wallet Leather Formal Casual Regular Travel Mini Wallet (Croco, Brown)",Generic,1,0,0,269,0,0,73,,1,"₹269
₹999 Save ₹730 (73%)"
361,B08ZYPF1S2,Men's Bi- Fold Leather Wallet (Trendy Tan),DENZO,1,0,0,699,3.8,12,30,,1,12
362,B07LG816C2,Leather Men's Wallet (W4234229_Blue),Le Craf,1,0,0,399,3.4,13,73,,0,13
363,B07PS98164,Red Men's Leather Wallet,WILDBUFF,1,0,0,499,4.0,5,75,,0,5
364,B06X9PH5ZF,"Printed Multicolor Genuine Leather Black Men Wallet,Canvas Printed Wallet for Men & Boys Multicolor Men Wallet",Shoprider,0,0,0,299,4.2,168,50,,1,168
365,B08W8W6GC2,Black Leather Unisex Wallet (SBBLFW),Shutterbugs,0,0,0,99,3.5,11,80,,0,11
366,B07C3XX6WB,Tan Leather Men's Wallet (Woo-inn-BR53),Woodland,0,0,0,390,3.9,307,34,,0,307
367,B08NHCGW3G,"Themes Brown Mens Leather Wallet, Keyring & Pen Combo Gift Set for Men | Wallet Men Leather Branded",HORNBULL,0,0,0,659,4.2,"1,083",74,,1,"1,083"
368,B097YDHM3M,"WildHornGift Hamper for Men - Classic Men's Combo/Gift Set of Leather Wallet, Keyring & Pen",WildHorn,0,0,0,749,4.2,158,63,,1,158
369,B06XQ7NZ34,Oscar Wash Brown Leather Wallet for Men | RFID Blocking Wallets for Men | Mens Wallet,HORNBULL,0,0,0,449,4.1,"4,460",70,,0,"4,460"
370,B07SYLCM71,Money Clip Wallet for Men Genuine Leather Branded Stylish Bi-Fold Slim Coal Black Handmade Genuine Leather with Card Holders.,Allen Solly,0,0,0,599,3.9,668,54,,1,668
371,B086B1L7QG,Brown Leather Men's Wallet (8903496150391),Tommy Hilfiger,0,0,0,"2,022",4.3,93,8,,1,93
372,B08MWHVM2D,Men's TAN Leather Wallet,HIDEMADE,0,0,0,199,3.8,4,88,,0,4
373,B00I3WV182,Black Leather Men's Wallet (TW111LM1BK),TITAN,0,0,0,"1,165",4.1,266,3,,1,266
374,B07D9LVRN9,"NISUN PU Leather Pocket Sized Business/Credit/ATM Card Holder Case Wallet with Magnetic Shut for Men & Women (Brown,9.5 X 6.5 X 1.5 cm)",NISUN,0,0,0,299,4.2,"1,250",70,,0,"1,250"
375,B08Y899DRT,Wild Bison - Genuine Leather Wallet for Men (Oil Pullup),WILDBISON,0,0,0,799,5.0,1,60,,0,1
376,B07SGDTC3Q,Black Unisex RFID Protected Minimalistic Metal Wallet(2-Pack),HIDE & SKIN,0,0,0,557,4.2,750,54,,1,750
377,B08RZ7NVG4,Leather Series RFID Blocking Bifold Wallet for Men Soft Genuine Leather-Brown,Bacca Bucci,0,0,0,599,4.1,15,70,,1,15
378,B081VR82DM,Manchester Genuine Leather Wallet with Detachable Card Case for Men (Vintage Navy),HIDE & SKIN,0,0,0,743,4.2,"4,239",81,,1,"4,239"
379,B01M5H2LIP,"Printed Multicolor Genuine Leather Black Men Wallet,Canvas Printed Wallet for Men & Boys Multicolor Genuine Leather,Canvas Printed Black Wallet for Men & Boys by Shoprider",Shoprider,0,0,0,299,3.6,55,50,,1,55
380,B098XPSF7P,Olive Leather Men's RFID Blocking Wallet (2070),IMPERIOUS - THE ROYAL WAY,1,0,0,699,3.4,9,83,,1,9
381,B09NQL565V,Genuine Vintage Brown Themed Leather Men’s Wallet | RFID Blocking Men’s Wallet (WW-MW-KB03_VBWN),WILDWINGS (LABEL),1,0,0,699,0,0,65,,1,"₹699
₹1,999 Save ₹1,300 (65%)"
382,B09D3K817Z,Florence RFID Blocking Leather Men's Wallet Beige,GETOREE,1,0,0,440,4.0,778,78,,0,778
383,B082SSCG3W,Men's Genuine Leather RFID Blocking Wallet (Brown),Contacts,1,0,0,897,3.7,272,64,,1,272
384,B0768PBY2Y,Genuine Leather RFID Blocking Wallet for Men's - Antique Brown,RUGE,0,0,0,489,3.7,698,76,,0,698
385,B07CKH74Y8,"Purse for men, Gent wallet, Brown Color",Urban alfami,0,0,0,149,3.7,257,81,,0,257
386,B09BVZSBS3,Florence RFID Blocking Leather Men's Wallet (Tan),GETOREE,1,0,0,379,3.9,27,80,,0,27
387,B09N75R99N,Bifold Money Wallet for Men | Long Wallets for Men | Mens Wallet Branded | RFID Protected Wallets for Men Branded | Bifold Leather Wallet for Men | RBXW5PUB (Brandy Helsinki),SKiDE,1,0,0,749,4.1,72,70,,1,72
388,B08349LTQL,Florence RFID Blocking Leather Men's Wallet BrownGETOREE Florence RFID Blocking Leather Men's Wallet Brown,GETOREE,1,0,0,440,4.1,187,79,,0,187
389,B0992PQLPN,Brown Leather Men's Wallet (MKW-2068),IMPERIOUS - THE ROYAL WAY,1,0,0,699,4.5,11,83,,1,11
