,asin,title,brand,Sponsored,Best Seller,Amazon's Choice,Price,Rating,NoofRatings,Discount,Delivery,Prime Delivery,base
0,B09RMHTJ3D,"Valentine’s Day Magic | Veleno EDT Perfume and leather wallet Combo | Valentine Day Gift For Husband , Boyfriend",Bombay Shaving Company,1,0,0,599,0,0,54,,0,"₹599 (₹1,996.67/100 ml)
₹1,295 Save ₹696 (54%)"
1,B09547M6J1,"PU Leather Men's Belt & RFID Blocking Wallet Set, Chocolate Brown",Amazon Brand - Solimo,1,0,0,499,2.0,1,50,,1,1
2,B095488586,"PU Leather Men's Belt & RFID Blocking Wallet Set, Fossil",Amazon Brand - Solimo,1,0,0,499,0,0,50,,1,"₹499
₹1,000 Save ₹501 (50%)"
3,B09QQM6ZRM,TRI-FOLD Brown Leather Wallet for Men (RZWLT_NDMWOF_04),ROZET,1,0,0,449,0,0,78,,0,"₹449
₹1,999 Save ₹1,550 (78%)"
4,B083TJBKCQ,Leather Wallet for Men (Brown),NAPA HIDE,0,0,0,352,4.0,"20,749",77,,0,"20,749"
5,B07QBQ127Y,Blue Hunter Leather Men's Wallet,WildHorn,0,0,1,540,4.0,"16,089",64,,1,"16,089"
6,B07C3VH84K,Brown Leather Men's LEATHER WALLET(WH2052 CRACKLE),WildHorn,0,0,0,390,4.0,"22,534",74,,0,"22,534"
7,B07XTJDJHN,Oliver Black RFID Blocking Leather Wallet for Men,URBAN FOREST,0,0,0,455,4.3,"5,580",77,,0,"5,580"
8,B07MX26G8P,Oliver Blue RFID Blocking Leather Wallet for Men,URBAN FOREST,0,0,0,455,4.3,"28,621",77,,0,"28,621"
9,B08ZNKR6BQ,Black Leather Men's Wallet (tnw90),TnW,0,0,0,153,4.0,451,85,,0,451
10,B083ZMYK85,Napa Hide MAROON Leather Men's LEATHER WALLET(NPH013 MRN),NAPA HIDE,0,0,0,399,4.1,"7,645",73,,0,"7,645"
11,B07B7J7FFH,Stylish RFID Protected Genuine Leather Wallets for Mens,AL FASCINO,0,0,0,470,4.1,"7,069",84,,0,"7,069"
12,B07PB423Z8,Brown Genuine Hunter Leather Wallet for Men with ATM Card Wallet Men's Wallet Purse,Spiffy,0,0,0,675,4.0,"3,435",66,,1,"3,435"
13,B076ZJQWGK,RFID Protected Genuine High Quality Leather Wallet for Men (Black),WildHorn,0,0,0,542,4.1,"2,160",64,,1,"2,160"
14,B085LFPKQB,Denial Navy Leather Wallet for Men | Wallets Men with RFID Blocking | Mens Wallet,HORNBULL,0,0,0,448,4.3,"5,280",82,,0,"5,280"
15,B08XBCYVY2,Elk Vintage Brown RFID Blocking Men's Leather Wallet,LONDON ALLEY,0,0,0,499,4.1,"2,612",75,,0,"2,612"
16,B0786X6BP6,Brown Synthetic Men's Wallet (804600082509),TnW,0,0,0,207,4.1,701,83,,0,701
17,B07X8XCR5F,"10 Slot PU Leather Credit Debit Zipper Card Holder Wallet Coin Purse with 2 ID Window for Men & Women (12 X 9.5 X 2 cm, Brown)",DAHSHA,0,0,0,645,4.1,"1,131",74,,1,"1,131"
18,B082SKY3CT,PU Leather 9 Slot Vertical Credit Debit Card Holder Money Wallet Zipper Coin Purse for Men Women - Light Brown,Storite,0,0,0,495,4.1,"3,213",75,,0,"3,213"
19,B07TDH6MJV,Wildhorn India Matte Black Leather Men's RFID Wallet (WH1173),WildHorn,0,0,0,432,4.1,"5,227",71,,0,"5,227"
20,B08F52S9L2,Men's Removable ID Card Premium Leather Wallet RFID SIM Holder (Chocolate),Jacky Bull,1,0,0,599,2.8,4,60,,1,4
21,B08F53BZJ2,Men's Premium Leather Wallet (Tan),Jacky Bull,1,0,0,599,4.6,3,60,,1,3
22,B08F7V4DXV,Men's Removable ID Card Premium Leather Wallet RFID SIM Holder (Black) for Men Stylish | Branded | Original | RFID | Box | Branded Original | Stylish Wallet | Combo wallet | Under 500 | Under 200 | Box | Gift for Men| currency holder | Coin Pocket | Card holder | ID Card wallet | Secret Wallet,Jacky Bull,1,0,0,599,3.7,4,60,,1,4
23,B08R7NPW3N,"Brown Leather Men's Smart Bluetooth Wallet, Separation Alert, GPS Last Seen Location, RFID, Anti Theft Wallet for Men | Android and iOS Compatible",Brown,1,0,0,"2,499",3.8,128,17,,1,tag8
24,B09LHJBH4D,Giftorious Customized Wallet for Men with Coin Pouch ( Navy Blue) - Best Gifts for Men,Generic,0,0,0,699,4.3,57,65,,0,57
25,B07BMT1VSS,RFID Protected Genuine High Quality Leather Wallet for Men(Brown)…,WildHorn,0,0,0,396,4.2,"14,019",74,,0,"14,019"
26,B07HD1H1RH,Men's Genuine Leather RFID Blocking Wallet (Brown),Contacts,0,0,0,"1,080",4.1,"4,050",57,,1,"4,050"
27,B07D7RC7BX,black wallets for men,Woodland,0,0,0,399,3.5,17,27,,0,17
28,B07DK7DF4H,Men's Artificial Leather Designer Wallet with Flap Closure Tan,TnW,0,0,0,200,4.1,816,83,,0,816
29,B07WZ9TRW3,Men's Money Clip Leather Bi-Fold Slim Wallet with Card Holder & Money Clipper. (Dark Grey),Allen Solly,0,0,0,599,4.0,819,54,,1,819
30,B09F3CLSHH,Bi Fold Slim & Light Weight Leather Men's Stylish Casual Wallet Purse with Card Holder Compartment (Chocolate Brown),Allen Solly,0,0,0,699,4.1,182,46,,1,182
31,B0719BDVB2,Men's Stella Brown Genuine Leather RFID Blocking Wallet,HORNBULL,0,0,0,448,4.2,"9,032",82,,0,"9,032"
32,B097PKY7TR,Leo RFID Blocking Vintage Brown Leather Wallet for Men,URBAN FOREST,0,0,0,499,4.2,963,75,,1,963
33,B01B4J0PKU,Brown Leather Men's Wallet (TW184LM1BR),TITAN,0,0,0,935,4.2,"1,172",25,,1,"1,172"
34,B08CJSHPZR,Men's Leather Wallet (TAN Crunch Brown),Generic,0,0,0,209,3.7,266,70,,1,266
35,B094FMRCXG,Bi Fold Slim & Light Weight Leather Men's Stylish Casual Wallet Purse with Card Holder Compartment (Denim Blue),Allen Solly,0,0,0,699,4.1,131,46,,1,131
36,B08QHQTJHS,Zeus Vintage Brown RFID Blocking Leather Wallet for Men,URBAN FOREST,0,0,0,499,4.1,"3,825",75,,1,"3,825"
37,B08V4VWZ3C,"Highlghly Finished Leather Wallet for Men, Men’s Wallet, Durable and Comfortable, Coin,Credit,Debit Card Wallet",Generic,0,0,0,168,3.5,49,83,,0,49
38,B0919TRXYZ,Genuine Leather Wallet for Men| RFID Protected| Trifold Wallet (Black),HAMMONDS FLYCATCHER,0,0,0,416,4.0,333,74,,0,333
39,B076FQMZZ1,Gift Hamper for Men | Brown Wallet and Brown Belt Men's Combo Gift Set | Leather Wallets for Men | Men's Wallet,HORNBULL,0,0,0,898,4.0,"8,388",73,,1,"8,388"
40,B01G55GYOE,RFID Protected Genuine High Quality Leather Wallet for Men(Black),WildHorn,0,0,0,410,4.1,"4,899",73,,0,"4,899"
41,B07C1J2XFT,Men Tan Artificial Leather Wallets for Men,ibex,0,0,0,169,4.1,"2,133",79,,0,"2,133"
42,B09CPJMQCS,RFID Protected Slim Bifold Men Purse Genuine Leather Wallets for Men,AL FASCINO,0,0,0,359,3.9,44,82,,0,44
43,B072MFVNML,Themes Brown Mens Leather Wallet | Stylish Leather Wallet for Mens | RFID Blocking Genuine Leather Mens Wallet,HORNBULL,0,0,0,448,4.2,"10,821",76,,0,"10,821"
44,B07RF7MT6R,Grey Fabric Men's Wallet (1955),LORENZ,0,0,0,239,4.0,"1,836",76,,0,"1,836"
45,B076ZM9M1R,Brown Leather Men's LEATHER WALLET(WH2010),WildHorn,0,0,0,432,4.1,"4,447",71,,0,"4,447"
46,B07S81GNQ9,Men's Money Clip Leather Bi-Fold Slim Wallet with Card Holders (Chocolate Brown),Allen Solly,0,0,0,599,4.0,866,54,,1,866
47,B07L91DSYT,Buttler Navy RFID Blocking Leather Wallet for Men | Genuine Leather Mens Wallet,HORNBULL,0,0,0,448,4.2,"6,825",82,,0,"6,825"
48,B0833JC34N,Navy Leather Men's Wallet (8903496153415),Tommy Hilfiger,0,0,0,"1,700",4.5,176,35,,1,176
49,B01MTJED9K,Brown Leather Men's Wallet (AFS041),Woodland,0,0,0,390,3.9,"1,007",29,,0,"1,007"
50,B07DK29SN7,Men Artificial Leather Wallet(Black),TnW,0,0,0,199,3.9,101,80,,0,101
51,B08F5L31F3,Wildhorn India Bombay Bron Leather Men's Wallet & Belt Combo Set (NEWGIFT1173BB),WildHorn,0,0,0,999,4.2,"1,454",55,,1,"1,454"
52,B084ZPZFCB,Kyle RFID Blocking Black/Redwood Leather Wallet for Men,URBAN FOREST,0,0,0,450,4.2,"1,220",78,,0,"1,220"
53,B07B8DG86C,PU Leather Pocket Sized Credit Card Holder Name Card Case Wallet with Magnetic Shut for Men & Women Brown (100 X 65 X 14 mm),NISUN,0,0,0,299,4.0,"4,351",80,,0,"4,351"
54,B08DCL2YM7,Wildhorn India Brown 1 Leather Men's Men's Wallet(CUSTOMIZED1173BRN),WildHorn,0,0,0,540,4.2,"1,128",64,,1,"1,128"
55,B07Y1ZNPK5,Men's Aluminium Metal RFID Protected Smart Pop Up Wallet (Black),VOGARD,0,0,0,297,4.1,615,75,,0,615
56,B095481JBG,"PU Leather Men's Belt & RFID Blocking Wallet Set, Tan",Amazon Brand - Solimo,1,0,0,449,5.0,1,55,,1,1
57,B0972XQG5T,Vintage Navy Leather Men's Wallet (IR3P-1),IMPERIOUS - THE ROYAL WAY,1,0,0,729,3.3,34,82,,1,34
58,B093H69XFD,Tommy Hilfiger,Tommy Hilfiger,1,0,0,"1,769",4.5,35,34,,1,35
59,B09Q5DNWYN,Belton Stylish Handcrafted Leather Wallet for Men (Tan),Beltons,1,0,0,249,0,0,0,,0,₹249
60,B0954665VJ,"PU Leather Men's Belt & RFID Blocking Wallet Set, Brandy",Amazon Brand - Solimo,1,0,0,499,0,0,50,,1,"₹499
₹1,000 Save ₹501 (50%)"
61,B098QFQLYD,Maroon Leather wallet with Tin Box for men (Garnet Maroon),WildHorn,1,0,0,490,4.2,"14,019",84,,0,"14,019"
62,B092JDGX49,Men's Pure Leather Bi-Fold Long Wallet/Pocket Organizer with RFID Shield Protection (Brown),Corvo,1,0,0,"1,999",3.5,23,20,,1,23
63,B09QQMZNHN,TRI-FOLD Black Leather Wallet for Men (RZWLT_NDMWOF_04),ROZET,1,0,0,449,0,0,78,,0,"₹449
₹1,999 Save ₹1,550 (78%)"
64,B08Y1NFTLY,Genuine Leather Slim Wallet | RFID Blocking Skinny Minimal Thin Front Pocket Wallet Sleeve Card Holder for Men (Tan),Contacts,0,0,0,399,4.1,291,84,,0,291
65,B076ZMLBJJ,RFID Protected Genuine High Quality Leather Wallet for Men… (Blue),WildHorn,0,0,0,499,4.0,"2,398",67,,1,"2,398"
66,B08Z387RXH,Doger Olive Green Mens Leather Wallet | Leather Wallet for Men | RFID Mens Wallet,RIGOHILL,0,0,0,499,4.1,193,80,,1,193
67,B01GRJGM0Y,"Blue Leather Wallet ,Keychain & Pen Combo for Men I Gift Hamper I Gift for Friend, Boyfriend ,Husband ,Father",WildHorn,0,0,0,595,4.2,"1,792",70,,1,"1,792"
68,B00I3WUZVQ,Brown Leather Men's Wallet (TW106LM1DB),TITAN,0,0,0,"1,315",4.3,"1,844",25,,1,"1,844"
69,B017IY31X8,"Black Leather Wallet, Blue Keychain and Black Diamond Pen for Men I Gift Hamper",WildHorn,0,0,0,802,4.2,"1,693",60,,1,"1,693"
70,B078N8WNJW,Navy Men's Wallet (8903496110418),Tommy Hilfiger,0,0,0,"1,639",4.3,39,37,,1,39
71,B07XNRX7SY,"Sherlock Blue Leather Wallet, Keyring & Pen Combo Gift Set for Men",URBAN FOREST,0,0,0,610,4.3,75,70,,1,75
72,B079TN3GCD,Bombay Brown Leather Men's Leather Wallet(WH2055 Bombay Brown),WildHorn,0,0,0,390,4.0,"2,568",74,,0,"2,568"
73,B07V7TVDJ3,Carl Chocolate Brown Mens Leather Wallet for Men,URBAN FOREST,0,0,0,424,4.1,"2,978",79,,0,"2,978"
74,B07M8S7KYB,"Classic Century Branded Bi-Fold Coin Wallets for Men Leather with Luxury Agenda Pen, Easy Compartment for Card and Money Storage - Black",Cross,0,0,0,"1,499",4.2,83,55,,1,83
75,B085LH2SPS,Denial Black Mens Leather Wallet – Leather Wallet for Mens and RFID Blocking Genuine Leather Mens Wallet,HORNBULL,0,0,0,448,4.2,"1,378",82,,0,"1,378"
76,B08FT27H1K,Leather Credit Card Holder -Slim Minimalist Front Pocket RFID Blocking Leather Wallets for Men Women,AL FASCINO,0,0,0,269,4.1,489,87,,0,489
77,B0833JGQB1,Navy Leather Men's Wallet (8903496153569),Tommy Hilfiger,0,0,0,"1,400",4.4,45,50,,1,45
78,B09PGD5D5N,Top Grain Leather Wallet for Men | Ultra Strong Stitching | Handcrafted | RFID Blocking | Zip Wallet with 9 Card Slots | 2 ID Slots (Green Hunter),WildHorn,0,0,0,499,3.0,3,83,,1,3
79,B0138NU6EA,Black Men's Wallet (8903338052395),Wildcraft,0,0,0,389,4.3,369,3,,0,369
80,B09F9WGFSP,Imperious Unisex Genuine Leather Debit Credit RFID Blocking Card Holder Wallet for Men Women,IMPERIOUS - THE ROYAL WAY,1,0,0,799,3.8,9,73,,1,9
81,B099SGZT7F,Olive Leather Men's RFID Blocking Wallet (MKW-2062),IMPERIOUS - THE ROYAL WAY,1,0,0,729,4.6,7,82,,1,7
82,B0972XFRJK,Black Leather Men's Trifold Wallet (IR3P-1),IMPERIOUS - THE ROYAL WAY,1,0,0,729,3.3,34,82,,1,34
83,B098XN4V5C,Mushroom Leather Men's RFID Blocking Wallet (2070),IMPERIOUS - THE ROYAL WAY,1,0,0,699,3.4,9,83,,1,9
84,B075F45CGB,"6 Slots RFID Blocking Metal Credit Card Holder Wallet for Men & Women(Black,9.5 x 6.5 x 1.3 cm )",Storite,0,1,0,359,4.0,"5,437",80,,0,"5,437"
85,B08Y5799YT,Men's Genuine Leather RFID Blocking Large Capacity Wallet | Bifold Wallet for Men (Black),Contacts,0,0,0,798,4.1,347,68,,1,347
86,B08V8C1PJM,Personalized Custom Genuine Leather Wallet for Men with Name and Charm (Black),The Bling Stores,0,0,0,499,4.1,77,45,,0,77
87,B07BKYB2DX,Brown Leather Men's Wallet (C0408LBR01),Fastrack,0,0,0,876,4.4,"1,303",20,,0,"1,303"
88,B09R49P8GR,Miller Brown RFID Blocking Leather Wallet for Men,HORNBULL,0,0,0,499,0,0,80,,1,"₹499
₹2,499 Save ₹2,000 (80%)"
89,B08CVMFM5Q,Genuine Leather Wallet for Men | RFID Protected for Daily use (Black),HAMMONDS FLYCATCHER,0,0,0,349,4.1,"2,439",78,,0,"2,439"
90,B09DVYG9WS,Men's Genuine Leather Wallet | RFID Blocking Card Holder Wallet Case (Black),Contacts,0,0,0,498,3.8,51,79,,0,51
91,B00Q4NJOU4,Semi Formal Tan Leather Men's Wallet (TW135LM1TN),TITAN,0,0,0,"1,315",4.4,992,25,,1,992
92,B0746HMZVG,Naruto Shippuden Graphics Design Printed Pu Leather Men's & Boy's Wallet (WT00005237),ShopMantra,0,0,0,349,4.4,55,56,,0,55
93,B07HCZZP5T,Men's Genuine Leather RFID Protection Wallet | Wallet for Men,Contacts,0,0,0,798,3.8,"4,038",68,,1,"4,038"
94,B07QC5YF2W,Make in India Maroon Black Leather Men's Wallet,AL FASCINO,0,0,0,449,4.2,"1,566",85,,1,"1,566"
95,B07PNTF6Z1,Brown Minimalist Slim Leather Wallet/Purse for Men with RFID Protection,AL FASCINO,0,0,0,399,4.0,"1,008",78,,0,"1,008"
96,B079P4CNCM,Blue Nylon Unisex Card Wallet,DailyObjects,0,0,0,399,4.1,256,27,,0,256
97,B07BYZL579,Blue Men's Wallet Stylish Genuine Leather Wallets for Men Latest Gents Purse with Card Holder Compartment (AC798555),Cross,0,0,0,849,4.3,73,53,,1,73
98,B09MCZ6N1W,Bi Fold & Light Weight Leather Men's Stylish Casual Wallet Purse with Card Holder Compartment (Blue),Allen Solly,0,0,0,699,5.0,2,46,,0,2
99,B0741F6TWP,Men's Genuine Leather Leather Brown Tri Fold RFID Blocking Wallet,HORNBULL,0,0,0,399,4.2,"3,114",73,,0,"3,114"
100,B071FQ8CJV,Black Leather Wallet & Pen Combo for Men I Gift Hamper,WildHorn,0,0,0,431,4.2,"2,861",78,,0,"2,861"
101,B083TGJXZG,Leather Wallet for Men (Black) (Black),NAPA HIDE,0,0,0,542,4.1,735,64,,1,735
102,B011292ZI2,Toronto Brown Leather Wallet for Men,URBAN FOREST,0,0,0,449,4.2,"3,208",78,,0,"3,208"
103,B08QCRT4PY,Men's Genuine Leather Wallet | RFID Blocking Wallet for Men (Beige),Contacts,0,0,0,897,4.0,"1,351",64,,1,"1,351"
104,B07WX1NSR6,Brown Faux Leather Men's Wallet (GVN-BRWLHAR01),GIOVANNY,0,0,0,249,3.9,508,79,,0,508
105,B093H527MP,Navy Leather Men's Wallet (8903496159660),Tommy Hilfiger,0,0,0,"1,938",4.5,41,31,,1,41
106,B093CLM9JN,Genuine Leather Wallet for Men | RFID Protected for Daily use (Brown),HAMMONDS FLYCATCHER,0,0,0,366,4.1,"1,382",77,,0,"1,382"
107,B07JDVFMSW,PU Leather Men's Wallet (ALW-31K_Black),ZORO,0,0,0,159,3.5,847,88,,0,847
108,B07RGKCJJH,"11 Slot PU Leather Credit/Debit Cards Zipper Holder Wallet Coin Purse with 3 ID Window for Men & Women (12 x 4 x 8 cm, Grey)",DAHSHA,0,0,0,695,3.8,606,77,,1,606
109,B089T9VP7F,Brown Polyester Unisex Wallet (5405202_Brown_X),Puma,0,0,0,449,3.9,51,65,,0,51
110,B01BXYVY06,Leather Men's Wallet (C0368LBK02_Black),Fastrack,0,0,0,876,4.4,459,20,,1,459
111,B08HTSRLF3,Men Casual Brown Genuine Leather RFID Wallet for Men's Bi-fold Purse (14 Card Slots),CLUBHIDE,0,0,0,579,4.1,21,74,,0,21
112,B09K4B41XH,Men's Wallet (Blue-BLUTNSCRD),GIOVANNY,0,0,0,299,4.4,4,81,,0,4
113,B08FH4JV5K,Long Leather Clutch Crown Wallet | Unisex Wallet with Credit Card & Mobile Holder (Brown),Brand Conquer,0,0,0,549,4.2,424,73,,1,424
114,B01K5B69IK,Brown Men's leather Wallet,Woodland,0,0,0,399,3.6,259,33,,0,259
115,B07RJ1NX7G,Blue Leather Men's Wallet (1955),GANNET,0,0,0,199,3.8,534,83,,1,534
116,B09MRQWX4Q,Genuine Leather Men Modern and Stylish Wallet(CBWL8),Cabretta,1,0,0,399,0,0,60,,0,"₹399
₹999 Save ₹600 (60%)"
117,B095467LXZ,"PU Leather Men's Belt & RFID Blocking Wallet Set, Brown",Amazon Brand - Solimo,1,0,0,499,0,0,50,,1,"₹499
₹1,000 Save ₹501 (50%)"
118,B092JLG5JK,Men's Pure Leather Tri-Fold Wallet with Advanced RFID Shield (Brown),Corvo,1,0,0,499,4.1,6,67,,1,6
119,B09P1GN4QZ,Leather Slim Men’S Wallet VLHMW010,VLH,1,0,0,435,5.0,1,0,,0,1
120,B09QS5BRJT,Leather Wallet for Men | Brown Mens Leather Wallet (RZWLT_NDMWOF_01),ROZET,1,0,0,449,0,0,78,,0,"₹449
₹1,999 Save ₹1,550 (78%)"
121,B09QS5FZMR,Leather Wallet for Men | Brown Mens Leather Wallet (RZWLT_NDMWOF_03),ROZET,1,0,0,449,0,0,78,,0,"₹449
₹1,999 Save ₹1,550 (78%)"
122,B09QS6DQXB,Leather Wallet for Men | Tan Mens Leather Wallet (RZWLT_NDMWOF_02),ROZET,1,0,0,449,0,0,78,,0,"₹449
₹1,999 Save ₹1,550 (78%)"
123,B01H7PGH98,Multicolor Men's Wallet,Shoprider,1,0,0,299,4.5,3,50,,1,3
124,B09NR7Q653,Wrap Bi-fold Navy Mens Wallet (8903338157731),Wildcraft,0,0,0,695,4.0,1,1,,1,1
125,B08245VBYC,Genuine Leather Wallet for Men | RFID Protected for Daily use (Brown),HAMMONDS FLYCATCHER,0,0,0,393,4.2,"5,977",75,,0,"5,977"
126,B07GDP3T4D,Black Men's Wallet Stylish Genuine Leather Wallets for Men Latest Gents Purse with Card Holder Compartment (AC948799_3-1),Cross,0,0,0,"1,299",4.3,499,57,,1,499
127,B077TZN4P8,"13 Slots Leather Credit Card Holder Wallet for Men & Women (10.5 x 7.5 x 2.6 cm, Brown)",Storite,0,0,0,399,4.2,"5,567",80,,0,"5,567"
128,B08KYKLRNQ,Gannet Mens Brown Leather Wallet-GT22,Generic,0,0,0,199,3.8,43,87,,1,43
129,B0846HL2MT,Olive Leather Men's Wallet (8903496147490),Tommy Hilfiger,0,0,0,"2,144",4.5,96,35,,1,96
130,B07FXH49MY,Leather Men's Wallet & Belt Combo Set (STARBLCKCMBO),Amicraft,0,0,0,499,3.9,54,72,,1,54
131,B098NLB257,Luke Brown RFID Blocking Leather Wallet & Brown Casual Belt Combo Gift Set for Men,URBAN FOREST,0,0,0,939,4.1,331,62,,1,331
132,B082H2Z2TH,RFID Protected Genuine Leather Men's Money Clip Wallet (WL-M-900-blk),mtuggar,0,0,0,286,4.0,397,64,,0,397
133,B09RWRGG5N,Bi Fold Slim & Light Weight Leather Men's Stylish Casual Wallet Purse with Card Holder Compartment (Dark Brown),Allen Solly,0,0,0,699,0,0,46,,1,"₹699
₹1,299 Save ₹600 (46%)"
134,B085RXN18J,Groix men's Leather Over Flap Coin Wallet -Black,POLICE,0,0,0,"1,259",4.4,14,40,,1,14
135,B01MQKZL3F,Black Leather Men's Wallet (LW29),Swiss Military,0,0,0,834,4.3,"1,156",40,,1,"1,156"
136,B077KBRBJ8,Taylor Navy/Mud Mens Leather Wallet – Premium Quality Leather Wallet for Mens & RFID Blocking Genuine Leather Mens Wallet,HORNBULL,0,0,0,449,4.2,"2,069",82,,0,"2,069"
137,B08YK17GG4,Blue Faux Leather Men's 3 Fold Wallet (2120384),Baggit,0,0,0,327,4.4,59,53,,0,59
138,B07DNSQTM4,Brown Leather Men's Leather Wallet(WH559 Bombay Brown Full Zip_1),WildHorn,0,0,0,449,4.2,"1,763",70,,0,"1,763"
139,B097YJDY9D,Gift Hamper for Men - Premium Men's Combo | Gift Set of Leather Wallet & Belt,WildHorn,0,0,0,949,4.0,48,53,,1,48
140,B09HC1XWS3,Imperious Genuine Leather Unisex RFID Blocking Slim Men Women Wallet-(Battle Green),IMPERIOUS - THE ROYAL WAY,1,0,0,699,0,0,77,,1,"₹699
₹2,999 Save ₹2,300 (77%)"
141,B098XPSF7P,Olive Leather Men's RFID Blocking Wallet (2070),IMPERIOUS - THE ROYAL WAY,1,0,0,699,3.4,9,83,,1,9
142,B0972Z97BZ,Black Leather Men's Wallet (IRCT-4),IMPERIOUS - THE ROYAL WAY,1,0,0,799,3.6,9,80,,1,9
143,B096SBH5Z3,Italian Brown Leather Men's Wallet (IRBC-1),IMPERIOUS - THE ROYAL WAY,1,0,0,799,3.9,10,80,,1,10
144,B06XNWG5S8,Oliver Black Leather Wallet for Men,WildHorn,0,0,0,455,4.1,"2,586",49,,0,"2,586"
145,B09DZ3FMVK,PU Leather 9 Slot Credit Debit Card Holder Money Wallet Zipper Coin Purse for Men Women (Black),FUR JADEN,0,0,0,399,4.0,36,60,,0,36
146,B09L72JKZ2,Giftorious Customized Wallet for Men Navy Blue Color ( Best Gift for Mens ),Generic,0,0,0,699,4.5,27,65,,0,27
147,B07RRWF588,"10 Slot Pu Leather Credit Debit Zipper Card Holder Wallet Coin Purse for Men & Women - (12 x 9.5 X 3 cm, Dark Brown)",NISUN,0,0,0,599,4.1,896,70,,1,896
148,B07JHJ4T73,RFID Blocking 10 Slot Vertical PU Leather Credit Debit Zipper Card Holder Money Wallet Zipper Coin Purse for Men & Women -(Chocolate Brown),Storite,0,0,0,599,4.3,"2,259",70,,1,"2,259"
149,B085ZWWQ63,L 6* Card Pokit Brown Artificial Leather Men's Wallet,Loscco,0,0,0,240,3.8,86,82,,1,86
150,B079M38S6K,Blue Nylon Men's Wallet,DailyObjects,0,0,0,599,4.0,173,60,,1,173
151,B01JRZX4PG,Dark Brown Leather Men's RFID Wallet (Two Tone),Am leather,0,0,0,499,4.1,"2,944",75,,1,"2,944"
152,B07HM25QPG,Branded Men's Wallets Stylish RFID Protected Genuine Leather Brown Bifold Front Pocket Wallet for Men Below 500 with Card Slots and Special Gift Slim Minimalist,AL FASCINO,0,0,0,399,3.8,"1,210",78,,1,"1,210"
153,B086MKVGC4,Men Tan Artificial Leather Wallet for Men (Tan),ibex,0,0,0,174,4.2,169,78,,0,169
154,B07HF9RMM5,Leather RFID Blocking Wallet for Men | Men's Genuine Leather Wallet [Beige],Contacts,0,0,0,897,4.0,"1,994",64,,1,"1,994"
155,B093H5HPS8,Wine Leather Men's Wallet (8903496160000),Tommy Hilfiger,0,0,0,"2,153",4.3,45,33,,1,45
156,B08D7PP7L4,"12 Slot PU Leather Credit/Debit Card Holder Money Wallet Zipper Purse for Men & Women - (Brown,10.75 x 8 x 2.5 cm)",Storite,0,0,0,499,4.4,"1,565",75,,1,"1,565"
157,B084ZPFLLQ,Navy Leather Men's Wallet (8903496147384),Tommy Hilfiger,0,0,0,"1,409",4.2,86,48,,1,86
158,B078NCR961,Black Leather Men's Wallet (8903496110487),Tommy Hilfiger,0,0,0,"1,450",4.5,48,53,,1,48
159,B08L7XJGND,Billy Navy/Mud RFID Blocking Leather Wallet for Men,HORNBULL,0,0,0,449,4.2,"1,737",82,,0,"1,737"
160,B07JGNJDZ9,"8 Slots Steel RFID Blocking Metal Credit Card Holder Wallet for Men & Women (9.5cm x 6.7cm x 1.5cm ,Black)",Storite,0,0,0,499,4.0,"1,935",75,,1,"1,935"
161,B09QPS3VYN,"10 Slot PU Leather Textured Vertical Credit Debit Card Holder Money Wallet Zipper for Men & Women - (8 X 2 X 11.5 cm,Brown)",NISUN,0,0,0,399,0,0,69,,0,"₹399
₹1,299 Save ₹900 (69%)"
162,B06XPF43DD,BLUE Leather Men's LEATHER WALLET(WH1251),WildHorn,0,0,0,455,4.2,"12,333",70,,0,"12,333"
163,B07SCQHFKR,Eddy RFID Blocking Black/Orange Money Clip Leather Wallet for Men - Minimal Leather Wallet for Men,URBAN FOREST,0,0,0,450,4.2,"3,908",78,,0,"3,908"
164,B091Z3N6PF,Wallet for Men and Boys Stylish Trendy (Brown),TnW,0,0,0,178,3.8,6,82,,0,6
165,B08GL13TX5,RFID Blocking 13 Slot Leather Zipper Credit Card Holder Wallet for Men & Women (Black),TEC TAVAKKAL,0,0,0,289,4.4,73,74,,0,73
166,B093H58DBD,Black Leather Men's Wallet (8903496156669),Tommy Hilfiger,0,0,0,"1,218",3.7,7,58,,1,7
167,B09HZZSWJS,Men's Genuine Leather Wallet | RFID Blocking Aluminum Automatic Pop Up Credit Card Holder Case (Black),VOGARD,0,0,0,499,3.5,30,72,,1,30
168,B099QXJW3N,Amnee ATM Men and Women Slim Synthetic Wallet Card Case/Card Holder with 12 Card Slots (Black),Generic,0,0,0,153,3.8,62,74,,0,62
169,B084ZQ1BGP,Tan & Navy Leather Men's Wallet (8903496147452),Tommy Hilfiger,0,0,0,"1,650",4.4,61,50,,1,61
170,B07T7GFFDS,"11 Slot PU Leather Credit Zipper Card Holder Wallet Zipper Coin Purse for Men & Women (Dark Brown,12 x 8 x 4 cm)",Storite,0,0,0,699,4.0,674,70,,1,674
171,B093H66RW2,Leather Men's Wallet,Tommy Hilfiger,0,0,0,"2,099",4.4,94,30,,1,94
172,B06XPD19SG,Leather Wallet for Men | Navy Mens Leather Wallet,WildHorn,0,0,0,412,4.3,"3,827",73,,0,"3,827"
173,B07X4XWQN9,Men's Money Clip Leather Bi-Fold Slim Wallet with Card Holders (Chocolate Brown) (Ash Grey),Allen Solly,0,0,0,599,3.8,282,54,,1,282
174,B0824SHY52,Spike Slim Wallet Stylish Genuine Leather Wallets for Men Latest Gents Purse with Card Holder Compartment -Black,POLICE,0,0,0,"1,099",4.4,144,48,,1,144
175,B08WPLWLH9,RFID Protected Brown NDM Leather Wallet for Men|9 Card Slots| 1 Coin Pocket|6 Hidden Compartment|2 Currency Slots|1 ID Slot,HAMMONDS FLYCATCHER,0,0,0,393,4.1,781,75,,0,781
176,B09QS5BR2Y,Leather Wallet for Men | Brown Mens Leather Wallet (RZWLT_NDMWOF_05),ROZET,1,0,0,449,5.0,1,78,,0,1
177,B0837KQ3C2,The Gusto Vegan Leather Wallet for Women (Black),Gusto,1,0,0,"1,099",0,0,15,,0,"₹1,099
₹1,299 Save ₹200 (15%)"
178,B0972Y3W75,Italian Brown Leather Men's RFID Blocking Wallet (IRCT-1),IMPERIOUS - THE ROYAL WAY,1,0,0,799,3.6,11,80,,1,11
179,B09RQP5F92,NKSK Craft Pure Leather Card Holder (Grey),Generic,1,0,0,415,0,0,36,,1,"₹415
₹651 Save ₹236 (36%)"
180,B08Y899DRT,Wild Bison - Genuine Leather Wallet for Men (Oil Pullup),WILDBISON,1,0,0,799,5.0,1,60,,0,1
181,B095493N6G,"PU Leather Men's Belt & RFID Blocking Wallet Set, Chestnut",Amazon Brand - Solimo,1,0,0,449,0,0,55,,1,"₹449
₹1,000 Save ₹551 (55%)"
182,B09P2JVXB8,Leather Bifold Men’S Wallet VLHMW13,VLH,1,0,0,550,0,0,0,,0,₹550
183,B09RQNYPBV,NKSK Craft Pure Leather Card Holder (Black),Generic,1,0,0,415,0,0,36,,1,"₹415
₹651 Save ₹236 (36%)"
184,B093KG6QGM,Antlers Hunter Leather Wallet for Men (Dark Brown),WildHorn,0,0,0,399,4.1,38,87,,0,38
185,B07BMPFL68,Brown Leather Men's Wallet (WH2060A),WildHorn,0,0,0,404,4.2,969,73,,0,969
186,B07W1XDTQ8,Leather Men's Wallet (UBF147BBL1028_Blue),URBAN FOREST,0,0,0,455,4.3,"1,448",77,,0,"1,448"
187,B09HXZVHTV,Men's Trifold Genuine Leather Wallet | RFID Blocking Wallet for Men (Brown),Contacts,0,0,0,498,4.1,16,79,,0,16
188,B09P892LQ5,"10 Slots Metal RFID Blocking Metal Credit Card Holder Wallet for Men Women (10cm x 7cm x 1.5cm ,Black)",DAHSHA,0,0,0,595,3.9,252,70,,1,252
189,B07GCLDN9Q,Florence Men's Wallet - Leather Mens Purse - Leather Wallet for Men's & RFID Blocking Genuine Branded Leather Wallet for Men's (Black),GETOREE,0,0,0,580,4.0,778,71,,1,778
190,B093H5VBRL,Leather Men's Wallet,Tommy Hilfiger,0,0,0,"1,999",4.5,76,31,,1,76
191,B085G4DW64,Front Pocket Money Bifold Wallet PU Leather Purse Credit Card Holder for Men - Brown,NISUN,0,0,0,299,3.8,240,70,,0,240
192,B093H5LDGV,Leather Men's Wallet,Tommy Hilfiger,0,0,0,"1,733",4.3,85,49,,1,85
193,B08D99KV8G,"9 Slot Vertical PU Leather Pocket Sized Credit Debit ATM Card Holder Wallet & 2 Money Pocket for Men & Women (Coffee Brown,10.5 X 7 X 3 cm)",DAHSHA,0,0,0,395,4.0,570,74,,0,570
194,B07M9BNQ1B,"Genuine Leather Bifold RFID Blocking Slim Stylish Credit Debit ATM Card Holder Wallet for Men Women with Gift Box, Brown",Portlee,0,0,0,339,4.1,"3,408",58,,0,"3,408"
195,B0944BKWZP,Tan Leather Wallet,Peter England,0,0,0,599,4.5,2,40,,1,2
196,B07VZWLCYG,Men's Money Clip Leather Bi-Fold Slim Wallet with Card Holder & Money Clipper (Denim Blue)…,Allen Solly,0,0,0,599,4.0,244,54,,1,244
197,B00OXU1EGM,Classic Black Leather Wallet for Men (Black),WildHorn,0,0,0,399,4.1,764,73,,0,764
198,B079P6WCJZ,Blue Ballistic Nylon Skinny Fit Card Wallet,DailyObjects,0,0,0,399,4.0,254,50,,0,254
199,B08RS22YHR,Black Polyurethane Men's Wallet (PU511 Animie 13) | Genuine Quality Leather | Slim and Stylish Casual Wallet,ASPENLEATHER,0,0,0,99,4.0,16,90,,0,16
200,B0992PQLPN,Brown Leather Men's Wallet (MKW-2068),IMPERIOUS - THE ROYAL WAY,1,0,0,699,4.5,11,83,,1,11
