,asin,title,brand,Sponsored,Best Seller,Amazon's Choice,Price,Rating,NoofRatings,Discount,Delivery,Prime Delivery,base
360,B07KV18JQV,"THD The Home Dekor Gamini Solid Wood Oval Shaped TV Cabinet Entertainment Unit Wooden Stand with Multipurpose Shelves Drawers for Storage, Natural Finish",THD,1,0,0,"27,500",0,0,21,"Tuesday, March 1",0,"₹27,500
₹34,999 Save ₹7,499 (21%)"
361,B08R2PB3WQ,Heera Moti Corporation Max TV Entertainment Tv Stand/Set Top Box Stand (Finish :- White Matt),Heera,1,0,0,"3,499",3.4,3,42,"Monday, February 21",1,3
362,B08P9HFDL2,"Heera Moti Corporation Sample TV Stand Entertainment Center Unit for Decorative Furniture Standard, Upto 43 Inch (Finish :-White & Black pre- laminted Matt)",Heera,1,0,0,"2,999",3.5,171,50,"Monday, February 21",1,171
363,B09Q8W6LPV,Heera Moti Corporation Panela TV Entertainment Wall Mount Unit/Wall Panels for Tv Unit up to 55 inches (Finish: - Black Matt),Heera,1,0,0,"7,999",3.4,12,47,"Monday, February 21",1,12
364,B0761XCNKB,Anikaa Saffron Engineered Wood Wall Mount TV Unit/TV Stand/Wall Set Top Box Stand/TV Cabinet/TV Entertainment Unit (Wenge)(D.I.Y),Anikaa,0,0,0,"1,014",3.6,17,66,"Monday, February 21",1,17
365,B08JXW62T9,DDS Dream Decor Shoppee Multipurpose Set Top Box Holder Wall Shelf Beauty at its Best for WiFi Modem Display Rack Living Room Bedroom and Side Cutting Design (Black),DDS,0,0,0,439,4.1,21,56,"Tuesday, February 22",1,21
366,B09NDGWDSF,"Redwud Victoria Engineered Wooden TV Entertainment Unit/TV Stand/Floor Standing TV Unit/TV Cabinet/Floor TV Unit for Home Living Room Bedroom (White) - Ideal for Upto 52"" (D.I.Y) Matte Finish",Redwud,0,0,0,"4,399",0,0,71,"Monday, February 21",1,"₹4,399
₹14,999 Save ₹10,600 (71%)"
367,B09364FFMZ,Anikaa Cruze Engineered Wood Wall Mount TV Unit/TV Stand/Wall Set Top Box Stand/TV Cabinet/TV Entertainment Unit (Walnut)(Ideal for 32-40 Inch)(D.I.Y),Anikaa,0,0,0,"1,599",0,0,60,"Monday, February 21",1,"₹1,599
₹3,999 Save ₹2,400 (60%)"
368,B014FNLW0Y,HomeTown Lynton Engineered Wood TV Unit in Brown Colour,HomeTown,0,0,0,"6,990",3.7,221,13,"Thu, 3 Mar, 7:00 am - 9:00 pm",0,221
369,B08W3DLCV7,Star Shoppee TV Entertainment Unit Set Top Box Stand Wall Mounted Shelf Racks Wooden tv cabinets for Home Living Room Floating Shelves for Bedroom Brown,Star,0,0,0,0,4.0,12,0,,0,12
370,B09P9ZPJ5D,ESTANTERIA Unico Engineered Wood Wall Mount TV Entertainment Unit with Set Top Box Stand and Wall Shelves Display Rack for Living Room and Bedroom (Wenge Finish),ESTANTERIA,0,0,0,"2,199",0,0,42,"Tuesday, February 22",1,"₹2,199
₹3,799 Save ₹1,600 (42%)"
371,B08B4Z3WJQ,"HEERA MOTI CORPORATION Engineered Wood Open Multi Functional White Finish L Shape TV Stands Furniture Unit (White, Finish :- Pre- laminated Matt)",HEERA,0,0,0,"8,999",3.5,15,25,"Monday, February 21",1,15
372,B097YBH1HH,"Anikaa Tessa Engineered Wood TV Unit/TV Stand/Floor Standing TV Unit/TV Cabinet/TV Entertainment Unit (Wenge)(Ideal for Upto 52"")(D.I.Y)",Anikaa,0,0,0,"6,014",4.0,10,62,"Monday, February 21",1,10
373,B09RV2WR7T,Fine Engineered Wood Entertainment Unit Wall Mounted TV Stand for Set Top Box Brown,Fine,0,0,0,"52,000",0,0,48,"Thursday, February 17",0,"₹52,000
₹99,999 Save ₹47,999 (48%)"
374,B08L6TFLZB,"DAS Wall Mount TV Entertainment Unit/with Set Top Box Stand and 3 Wall Shelves Display Rack Wenge & White (Ideal for up to 48"") Screen- Bolivar",DAS,0,0,0,"2,699",1.0,1,61,"Monday, February 21",1,1
375,B09QD6GFL7,ESTANTERIA White Stack Engineered Wood Wall Mount TV Entertainment Unit with Set Top Box Stand and Wall Shelves Display Rack (Wenge & Frosty),ESTANTERIA,0,0,0,"2,149",0,0,42,"Tuesday, February 22",1,"₹2,149
₹3,699 Save ₹1,550 (42%)"
376,B073TJCP9H,"DeckUp Cove Engineered Wood TV Stand and Home Entertainment Unit (Wenge, Matte Finish)",DeckUp,0,0,0,"4,749",4.1,199,57,"Saturday, February 26",0,199
377,B07J2M7T3Z,Anikaa Aster Engineered Wood Wall Mount TV Unit/TV Stand/Wall Set Top Box Stand/TV Cabinet/TV Entertainment Unit (Wenge)(D.I.Y),Anikaa,0,0,0,"1,414",3.2,23,61,"Monday, February 21",1,23
378,B09421VD6Q,"DAS Ambros Wall Mount TV Entertainment Unit/with Set Top Box Stand for Living Room Wenge (Ideal for up to 43"") Screen",DAS,0,0,0,"1,449",3.9,2,62,"Monday, February 21",1,2
379,B097LWCQ86,"Wooden Set Top Box Stand Wall Mounted TV Cabinets Wall Selves Holds Speaker, Cable Boxes, Streaming Device, Game Console, Remote, WiFi Router and More. (White)",Wooden,0,0,0,399,0,0,60,"Tuesday, February 22",1,"₹399
₹999 Save ₹600 (60%)"
380,B09J4SBBRB,Heera Moti Corporation Power TV Entertainment Wall Mount Unit/Wall Panels for Tv Unit up to 50 to 60 inches (Finish: - Black Matt),Heera,1,0,0,"2,999",0,0,54,"Monday, February 21",1,"₹2,999
₹6,500 Save ₹3,501 (54%)"
381,B09ND7XRBC,"Redwud Victoria Engineered Wooden TV Entertainment Unit/TV Stand/Floor Standing TV Unit/TV Cabinet/Floor TV Unit for Home Living Room Bedroom (Flowery Wenge) - Ideal for Upto 52"" (D.I.Y) Matte Finish",Redwud,1,0,0,"4,399",0,0,71,,1,"₹4,399
₹14,999 Save ₹10,600 (71%)"
382,B09NDGWDSF,"Redwud Victoria Engineered Wooden TV Entertainment Unit/TV Stand/Floor Standing TV Unit/TV Cabinet/Floor TV Unit for Home Living Room Bedroom (White) - Ideal for Upto 52"" (D.I.Y) Matte Finish",Redwud,1,0,0,"4,399",0,0,71,"Monday, February 21",1,"₹4,399
₹14,999 Save ₹10,600 (71%)"
383,B082KN22K9,MODWAY Solid Sheesham Wood Multipurpose TV Cabinet Entertainment Unit with 4 Drawer and 1 Shelf for Living Room Home (Natural Finish),MODWAY,1,0,0,"18,999",0,0,36,"Tuesday, March 1",0,"₹18,999
₹29,865 Save ₹10,866 (36%)"
384,B09PYZKX8L,Madhuran Ridhi Wall Mount TV Entertainment Unit Stand Wall Set Top Box Stand Cabinet Engineered Wood Ideal Size 129X24X15.4 cm Color Red and White,Madhuran,0,0,0,"3,399",0,0,38,"Monday, February 21",1,"₹3,399
₹5,499 Save ₹2,100 (38%)"
385,B09HQWSZTM,"Anikaa Vactor Engineered Wood TV Unit/TV Stand/Floor Standing TV Unit/TV Cabinet/TV Entertainment Unit (White)(Ideal for Upto 52"")(D.I.Y)",Anikaa,0,0,0,"4,374",3.3,5,71,"Monday, February 21",1,5
386,B09BBKNTB6,Heera Moti Corporation Mazon TV Entertainment Wall Mount Unit/Wall Panel for Tv Unit up to 55 inches (Finish: - White Black Matt),Heera,1,0,0,"2,999",1.6,3,70,"Monday, February 21",1,3
387,B07HKXP3CG,"Bluewud Aero Engineered Wood Tv Entertainment Wall Unit Wenge, Large, for Upto 50""",Bluewud,1,0,0,"1,699",4.1,298,32,"Wednesday, February 23",1,298
388,B07YHYNH87,"Bluewud Relo Engineered Wood Tv Wall Unit with Display Shelves, Wenge, for Upto 50""",Bluewud,1,0,0,"3,799",4.1,21,53,"Tuesday, February 22",1,21
389,B08R2XD8WK,Heera Moti Corporation Sun TV Entertainment Tv Stand/Set Top Box Stand (Finish :-White&BlackMatt),Heera,1,0,0,"4,999",4.6,7,17,"Monday, February 21",1,7
