,asin,title,brand,Sponsored,Best Seller,Amazon's Choice,Price,Rating,NoofRatings,Discount,Delivery,Prime Delivery,base
269,B07MFVD3LJ,Winter Wear Cotton Plain Full Sleeve Turtle Neck T Shirt for Men,CHKOKKO,0,0,0,645,4.0,"3,267",77,,1,"3,267"
270,B08M9MXBB6,Men's Full Sleeve Regular Fit T-Shirt,Veirdo,0,0,0,299,4.1,169,75,,0,169
271,B09PNJNGTM,Oversized Mens Cotton Blend Half Sleeve T-Shirts,LEOTUDE,0,0,0,299,1.0,1,73,,0,1
272,B08B3YGVSZ,Yellow Men T-Shirt,Pepe Jeans,0,0,0,467,3.2,9,64,,0,9
273,B07CQN23VG,Men's Plain Regular Fit T-Shirt,Chromozome,0,0,0,501,4.0,"4,376",28,,1,"4,376"
274,B083C2KRLD,Men's Regular fit T-Shirt,Van Heusen Athleisure,0,0,0,799,4.1,399,6,,1,399
275,B09BFXDFY1,Men's Regular T-Shirt,Levi's,0,0,0,719,4.0,195,40,,1,195
276,B0879642D9,Tom and Jerry: Ew People Mens and Womens Graphic Printed Cotton T-Shirt Black,The Souled Store,0,0,0,576,4.4,57,36,,1,57
277,B08YX417MR,Regular Fit Cotton Men's T-Shirt Combo (Pack of 2),LEOTUDE,0,0,0,499,3.7,"2,905",69,,1,"2,905"
278,B08BV581B2,Men's Regular T-Shirt,Adidas,0,0,0,649,3.8,234,35,,1,234
279,B09MK9S9QS,Men Mushroom Solid Oversized T-Shirts,The Souled Store,0,0,0,734,4.0,1,43,,1,1
280,B07SLCMSVB,Men' & Women's T-Shirt,GameReserves,0,0,0,199,3.9,356,78,,0,356
281,B0819ZSZHZ,Men's Regular fit T-Shirt,U.S. POLO ASSN.,0,0,0,569,4.1,"1,502",19,,1,"1,502"
282,B08W5CB6TT,Men's Captain America Design Printed T-Shirts,ADRO,0,0,0,349,3.8,63,77,,0,63
283,B09BFW41WM,Men's Regular T-Shirt,Levi's,0,0,0,647,4.0,25,46,,1,25
284,B0793JX9J2,Men's Regular fit T-Shirt,U.S. POLO ASSN.,1,0,0,579,3.8,"6,665",0,,0,"6,665"
285,B093LNN4H7,Men's Regular T-Shirt,U.S. POLO ASSN.,1,0,0,569,3.4,6,5,,1,6
286,B07GNFM4PG,Men’s Cotton Navy Blue Striped Polo T Shirt with Collar and Pocket,fanideaz,1,0,0,679,3.7,962,73,,1,962
287,B092SR1JG9,Men's Marvels Badge Polo Collar Neck T-Shirt Combo Pack of 2,Wear Your Opinion,1,0,0,699,4.0,69,65,,1,69
288,B0819ZVB7W,Men's Printed Regular fit T-Shirt,U.S. POLO ASSN.,1,0,0,671,4.0,"1,367",4,,1,"1,367"
289,B09MD4J7DV,Unisex Cotton Embriodered Spilt Milk Art T-Shirt (Black),DCBC,1,0,0,"1,199",0,0,0,,0,"₹1,199"
290,B08662JK2H,Men's Slim Fit Polo T-Shirt,Alan Jones Clothing,1,0,0,419,4.0,863,58,,0,863
291,B093LNSKZS,Men's Regular Fit T-Shirt,U.S. POLO ASSN.,1,0,0,547,5.0,5,9,,1,5
292,B08W5CB6TT,Men's Captain America Design Printed T-Shirts,ADRO,0,0,0,349,3.8,63,77,,0,63
293,B09BFW41WM,Men's Regular T-Shirt,Levi's,0,0,0,647,4.0,25,46,,1,25
294,B096ZYLD93,Men's Regular T-Shirt,Levi's,0,0,0,989,4.3,26,55,,1,26
295,B08N71VMWX,Regular Fit Men's Cotton T-Shirt,EYEBOGLER,0,0,0,299,3.8,"3,178",77,,0,"3,178"
296,B073X4BN8V,Men's Regular T-Shirt,Amazon Brand - Symbol,0,0,0,899,4.1,"3,608",74,,1,"3,608"
297,B07M83N53S,Men's Solid Regular Fit T-Shirt,Red Tape,0,0,0,459,3.9,80,77,,0,80
298,B09774GPMG,Men's Color Block Round Neck Multi-Colored T-Shirt,London Hills,0,0,0,499,3.2,135,81,,1,135
299,B07SDPKMT2,Men's Regular T-Shirt,Puma,0,0,0,449,3.5,2,70,,0,2
300,B09C67Z9JL,Men's Regular T-Shirt,Max,0,0,0,749,4.0,227,17,,1,227
301,B00RGVL7XA,Men's Polo Collar Full Sleeves Striped T-Shirt,AMERICAN CREW,0,0,0,802,4.0,938,60,,1,938
302,B08PL32B57,Men's Cotton Solid Baby Full Sleeves | Round Neck | Regular Fit T-Shirt/Tee,Bewakoof,0,0,0,449,4.0,29,10,,0,29
303,B09KPXLGGL,"Hip-hop T-Shirt with Hood Black and Steel Grey Color 100% Pure Cotton Oversize Trendy Unisex T-Shirt Small, Medium, Large, Extra Large, 2X-Large",Patche,0,0,0,399,4.2,8,73,,1,8
304,B093SQLCV8,0017 T-Shirts for Men's,THE BLAZZE,0,0,0,399,3.3,626,64,,1,626
305,B07KRZ1JTT,Men's Plain Regular Fit T-Shirt,GRITSTONES,0,0,0,349,4.0,809,65,,0,809
306,B099FCLYN5,Men's Slim Fit T-Shirt,Jack & Jones,0,0,0,226,3.3,5,77,,0,5
307,B079T43KJB,Polo Neck Full Sleeve Cotton Solid Regular Fit T Shirt for Men,Polo,0,0,0,399,3.6,"4,397",67,,0,V3Squared
308,B09DQRN89C,Men's Plain Regular Fit T-Shirt,Chromozome,1,0,0,719,4.0,"4,376",28,,1,"4,376"
309,B09133Q16X,Men's Polycotton Collar Neck Polo T-Shirt Combo Pack of 3,Wear Your Opinion,1,0,0,999,3.9,528,67,,1,528
310,B09D3BVBVC,Mens Regular Fit Cotton Striped Polo Tshirt/Collared Tshirt - Yellow,BULLMER,1,0,0,439,3.8,36,56,,0,36
311,B08HNBWM6V,AWG Men's Cotton Regular Fit Solid Polo Neck T-Shirt,AWG ALL WEATHER GEAR,1,0,0,349,3.6,"6,885",77,,0,"6,885"
312,B09FLBRWPK,Men's Combo Polo Neck Cotton Blend Solid T-Shirt (Pack of 2),INKKR,0,0,0,439,3.3,405,66,,0,405
313,B09BFV47WM,Men's Regular T-Shirt,Levi's,0,0,0,669,4.3,14,44,,1,14
314,B09CNKG4ZX,Men's High and Turtle Neck Cotton T-Shirt,NORTHWIND,0,0,0,795,4.0,666,47,,1,666
315,B09CH1N889,Men T-Shirt,Maniac,0,0,0,474,3.9,37,78,,0,37
316,B09PJ9DHDV,Men's 3/4 Sleeves Hip hop t Shirt,clafoutis,0,0,0,279,2.5,2,72,,0,2
317,B09B4YFR9W,Men Half Sleeve Round Neck White,Pepe Jeans,0,0,0,500,3.0,4,50,,1,4
318,B09DSMFPL8,Regular Fit Half Sleeve Men's T-Shirt,LEOTUDE,0,0,0,299,3.7,100,73,,0,100
319,B099FDZHGB,Men's Slim T-Shirt,Jack & Jones,0,0,0,198,3.0,2,80,,0,2
320,B08TC4T51J,Men's Slim T-Shirt,U.S. POLO ASSN.,0,0,0,790,4.0,364,51,,1,364
321,B09BFVR2G5,Men's Regular Polo Shirt,Levi's,0,0,0,699,3.6,21,50,,1,21
322,B07NDYK421,Men's Regular Fit Polos,AMERICAN CREW,0,0,0,649,3.8,559,57,,1,559
323,B09NPS452N,Full Sleeves Cotton Printed Regular Tshirt Long Sleeve Tee for Unisex Adults,STATUS MANTRA,0,0,0,359,1.0,2,64,,1,2
324,B07NKKYN2D,Men's Polyester Round Neck T-Shirts - Pack of 2,AWG ALL WEATHER GEAR,0,0,0,349,3.5,"3,847",78,,0,"3,847"
325,B099FBP59F,Men's Slim Polo Shirt (136619101_Cloud Dancer Small),Jack & Jones,0,0,0,414,3.8,10,77,,0,10
326,B0917S6XNN,Plain Black T-Shirt for Men | 100% Cotton | Sports-Wear,Decathlon,0,0,0,199,4.0,34,0,,0,34
327,B09FL9SFB8,Men's Combo Polo Neck Cotton Blend Solid T-Shirt (Pack of 2),INKKR,0,0,0,439,3.3,405,66,,0,405
328,B08THPGMNW,Men's Cotton Regular Fit Color Blocked Sleeveless T-Shirt,Veirdo,0,0,0,249,4.2,601,75,,0,601
329,B099992MVP,Men's Half Sleeve Regular Fit Combo Polo T-Shirt-Pack of 2,Veirdo,0,0,0,699,4.1,57,71,,1,57
330,B09B38ZZ2J,London Crew Round Neck Full Sleeve Plain-Solid Men's 100% Cotton T-Shirt,Generic,0,0,0,349,0,0,77,,1,"₹349
₹1,499 Save ₹1,150 (77%)"
331,B08GYSVB8T,Men Orange Ribbed Neck Logo T-Shirt,AEROPOSTALE,0,0,0,395,5.0,3,60,,0,3
332,B08VDVMXRC,Men's Cotton Henley Neck Full Sleeve Regular Fit T-Shirt,Veirdo,0,0,0,299,4.2,311,75,,0,311
333,B08KFHGLZC,Men T-Shirt,Allen Solly,0,0,0,476,4.1,143,32,,0,143
334,B073X1Q7HB,Men's Regular T-Shirt,Amazon Brand - Symbol,0,0,0,569,4.0,"10,870",73,,1,"10,870"
335,B07RWKFMF3,Men's Regular Fit T-Shirt,Wrath,0,0,0,324,3.7,"2,737",78,,0,"2,737"
336,B08VMV4TB4,Men's Slim T-Shirt,U.S. POLO ASSN.,0,0,0,799,4.0,16,60,,1,16
337,B07L2J15BM,Plus Size Men's Regular Fit Polo,Bigbanana,0,0,0,675,4.1,"1,807",60,,1,"1,807"
338,B07YXJBN88,Men's Regular Fit Vest,Jockey,0,0,0,449,4.2,"2,465",6,,0,"2,465"
339,B099FC9WT5,Men's Slim T-Shirt,Jack & Jones,0,0,0,243,3.7,254,78,,0,254
340,B08TV2VT97,Avengers T-Shirt for Men Half Sleave Solid White Graphic Printed Funny Typography Casual Round Neck. Sports & Gym wear Stylish Cotton Branded Tshirt for Attitude Boys,Tocayo,0,0,0,229,3.7,98,77,,0,98
341,B073FKXQ9H,Solid Men's Shawl Collar Regular Fit T-Shirt,EYEBOGLER,0,0,0,329,3.6,"10,650",77,,1,"10,650"
342,B08H64HFNS,Men's Regular fit T-Shirt,Amazon Brand - Symbol,0,0,0,190,3.8,143,76,,0,143
343,B07RC1JWHK,Men's Solid Regular Fit Polo,Van Heusen Athleisure,0,0,0,899,4.1,"1,804",10,,1,"1,804"
344,B0861ZDNDL,Men's Polycotton Stylist Slim Fit Collar Neck Polo T-Shirt Combo Pack of 2,Wear Your Opinion,1,0,0,699,3.8,"2,795",65,,1,"2,795"
345,B099ZYV3LP,Men's Regular T-Shirt,Amazon Brand - House & Shields,1,0,0,319,3.9,141,60,,0,141
346,B0839NBPYL,Men's Regular Fit T-Shirt,AMERICAN CREW,1,0,0,564,3.9,"13,244",72,,1,"13,244"
347,B09M447ZYP,Printed Cotton T-Shirt for Men Combo Pack of 2,Boodbuck,1,0,0,499,5.0,1,75,,1,1
348,B0793NHDYQ,Men's Regular fit T-Shirt,U.S. POLO ASSN.,1,0,0,498,3.8,"6,665",0,,1,"6,665"
349,B093LNR3N1,Men's Regular T-Shirt,U.S. POLO ASSN.,1,0,0,569,3.7,9,5,,1,9
350,B09QYS2DBH,Men's Solid Colour Round Neck T-Shirt,Generic,1,0,0,399,0,0,60,,0,"₹399
₹999 Save ₹600 (60%)"
351,B09RP9VNR2,Men's 100% Cotton T-Shirts,TRU-TEES,1,0,0,499,0,0,62,,0,"₹499
₹1,299 Save ₹800 (62%)"
352,B07RC1JWHK,Men's Solid Regular Fit Polo,Van Heusen Athleisure,0,0,0,899,4.1,"1,804",10,,1,"1,804"
353,B09F658GJW,Men's Regular Button Down Shirt,U.S. POLO ASSN.,0,0,0,599,5.0,1,50,,1,1
354,B08B3Y7PX9,Blue Men T-Shirt,Pepe Jeans,0,0,0,599,3.9,9,40,,1,9
355,B09QG8HRZQ,Men's Full Sleeves Round Neck T Shirt,clafoutis,0,0,0,229,0,0,77,,0,"₹229
₹999 Save ₹770 (77%)"
356,B07ZQJYMB4,Men's Slim Fit T-Shirt,Zesteez,0,0,0,399,3.2,71,20,,1,71
357,B09PNQZBGC,Men's Cotton Hooded Sweatshirt,ADRO,0,0,0,349,4.1,245,77,,0,245
358,B08VN3PH1C,Men's Regular T-Shirt,U.S. POLO ASSN.,0,0,0,989,4.1,5,55,,1,5
359,B08S474LLF,Regular Men's T Shirts,Reebok,0,0,0,517,3.9,16,53,,1,16
360,B01MTCSBVX,Men's Solid Regular Fit T-Shirt,GRITSTONES,0,0,0,299,4.1,"2,619",60,,0,"2,619"
361,B09PNT2NP6,Captain America Mens Printed Hoodies/Mens Sweatshirts,ADRO,0,0,0,349,3.9,138,77,,0,138
362,B08YYHQLX7,Mens Polo Neck Half Sleeve Blue Cotton T-Shirt,Classic Polo,0,0,0,629,3.4,22,10,,1,22
363,B09FLB3BLS,Men's Combo Polo Neck Cotton Blend Solid T-Shirt (Pack of 2),INKKR,0,0,0,439,3.3,405,66,,0,405
364,B0721SW1YT,Men's Regular T-Shirt,Amazon Brand - Symactive,0,0,0,349,4.2,"1,316",56,,0,"1,316"
365,B08Y6QCHLJ,Mens and Boys Graphic Printed Cotton Drop Cut T-Shirts,The Souled Store,0,0,0,524,3.8,87,42,,1,87
366,B08797XFDC,Iron Man: Signature Stark Mens Graphic Printed Cotton Drop Cut T-Shirt Red,The Souled Store,0,0,0,734,4.2,296,51,,1,296
367,B08SVW33Z4,Justice League: Logo Mens and Boys Graphic Printed Cotton Drop Cut T-Shirts Navy Blue,The Souled Store,0,0,0,734,4.0,444,18,,1,444
368,B09DT1SS48,Men's Plain Regular Fit T-Shirt,Chromozome,1,0,0,719,4.0,"4,376",28,,1,"4,376"
369,B08R91H9P8,Printed T Shirt for Men Combo Pack of 3,Boodbuck,1,0,0,999,3.5,352,67,,1,352
370,B083F47Q6P,Men's Regular Polo Shirt,Amazon Brand - Symbol,1,0,0,329,4.0,244,59,,0,244
371,B0833DMV7H,Men's Regular Fit T-Shirt,AMERICAN CREW,1,0,0,612,3.9,"13,244",69,,1,"13,244"
372,B07Y6LKMKV,Men's Regular Fit T Shirt (Pack of 2),AWG ALL WEATHER GEAR,0,0,0,349,3.5,"1,369",78,,0,"1,369"
373,B07SSW2BYQ,Plus Size Men's Henley T-Shirt,Bigbanana,0,0,0,699,3.9,682,53,,0,682
374,B093LMHBTR,Men's Regular T-Shirt,U.S. POLO ASSN.,1,0,0,474,4.4,22,5,,0,22
375,B07HGBHF1X,Regular Fit Mens Tshirts,Chromozome,1,0,0,559,3.9,"2,971",44,,1,"2,971"
376,B073X33F68,Men's Regular Polo Shirt,Amazon Brand - Symbol,1,0,0,369,4.0,"7,897",63,,0,"7,897"
377,B0819ZZKF2,Men's Printed Regular fit T-Shirt,U.S. POLO ASSN.,1,0,0,649,4.0,"1,367",7,,1,"1,367"
