,asin,title,brand,Sponsored,Best Seller,Amazon's Choice,Price,Rating,NoofRatings,Discount,Delivery,Prime Delivery,base
0,B08K2RH3MN,Sophie Womens Fashion Sportswear Tshirt,LAYA,1,0,0,329,3.9,117,81,,1,117
1,B09NK98PZ7,Women's Regular T-Shirt,TAILRED,1,0,0,199,3.8,3,75,,0,3
2,B08BLN373N,Women's T-Shirt (Pack of 3),LAYA,1,0,0,699,4.0,"1,388",65,,1,"1,388"
3,B09KFLW4RX,Women's Round Neck Regular Sportswear T-Shirt (Pack of 5),PRANERA,1,0,0,949,5.0,1,53,,1,1
4,B08W9G5Z78,Tie Dye T-Shirt for Women/Girls,JUNEBERRY,0,0,0,329,4.0,"2,286",73,,0,"2,286"
5,B089FMP157,Stylish Plain Up and Down Cotton Tshirt for Women,Fabricorn,0,0,0,379,4.0,"8,083",68,,0,"8,083"
6,B09Q335CXG,Regular Fit Half Sleeve Acid Wash Printed Women's Tshirt,LEOTUDE,0,0,0,299,3.6,6,73,,0,6
7,B097RPXCZ1,Women's Regular T-Shirt,VERO MODA,0,0,0,244,3.9,"1,212",69,,0,"1,212"
8,B0832NZ1W8,Stylish Plain Green Long Sleeve Cotton Tshirt for Women (Green),Fabricorn,0,0,0,379,3.8,"1,954",68,,0,"1,954"
9,B08QD8FLJJ,Women's T-Shirt,Fabricorn,0,0,0,299,4.0,"1,000",75,,0,"1,000"
10,B098QF9BJ7,Women's Regular T-Shirt,Desi Belle,0,0,0,302,4.6,6,85,,0,6
11,B07TZN3XDW,Women's Loose Fit T-Shirt,Amazon Brand - Symbol,0,0,0,739,4.0,373,59,,1,373
12,B092JBSR2F,Cotton Full Sleeve Regular Fit T-Shirt for Women/Girls,JUNEBERRY,0,0,0,349,4.0,337,71,,0,337
13,B088TPFZRL,Women's T-Shirt (Pack of 3),SHAUN,0,0,0,719,4.0,"4,583",64,,1,"4,583"
14,B07V9CPVJL,Women's Regular Fit T-Shirt,JUNEBERRY,0,0,0,299,4.1,793,75,,0,793
15,B09Q3BCML1,Regular Fit Half Sleeve Camo Print Women's Tshirt,LEOTUDE,0,0,0,299,4.2,5,73,,0,5
16,B09H2N4TFP,Cotton Half Sleeve Oversized Zebra Printed T-Shirt for Women/Girls (X-Large) White,Veirdo,0,0,0,399,3.6,22,67,,0,22
17,B08P7H5CS8,Women's Cotton Regular Fit Half Sleeves Printed T-Shirt,JUNEBERRY,0,0,0,349,4.2,884,71,,0,884
18,B08GLQJD9K,Women's Regular T-Shirt,Amazon Brand - Symbol,0,0,0,244,4.1,"1,138",69,,0,"1,138"
19,B09H2NSQ9D,Cotton Half Sleeve Drop-Shoulder Oversized Printed T-Shirt for Women/Girls,JUNEBERRY,0,0,0,349,4.1,40,71,,0,40
20,B07MM1X6KB,Women's Regular T-Shirt,Amazon Brand - Symbol,1,1,0,439,4.2,"23,499",27,,0,"23,499"
21,B095LY5VWP,Women's Regular T-Shirt,ONLY,1,0,0,599,3.6,4,40,,1,4
22,B08BTMMBFF,Women's Loose Fit T-Shirt,Amazon Brand - Symbol,1,0,0,315,4.0,79,68,,0,79
23,B08BTSX9HW,Women's Regular T-Shirt,Amazon Brand - Symbol,1,0,0,334,3.8,70,63,,0,70
24,B09GKNH2N7,Casual Full Sleeve High Neck | Turtle Neck Cotton T-Shirt for Women/Girls,DIAZ,0,0,0,305,3.7,68,67,,0,68
25,B08CSK1Q1N,Women's Cotton 3/4 Sleeve Regular Fit T-Shirt,Veirdo,0,0,0,284,3.9,235,76,,0,235
26,B079Z5CCLV,Women's Black Cotton Round Neck Basic T-Shirt,Miss Chase,0,0,0,449,4.0,288,40,,1,288
27,B09D3TRJ8B,Women's & Girls' Solid Long Sleeve Top/T-Shirt,Aahwan,0,0,0,337,3.2,143,83,,0,143
28,B08BW32F25,Women's Slim T-Shirt,Adidas,0,0,0,599,3.9,87,50,,1,87
29,B09Q2XLNHG,Regular Fit Half Sleeve Printed Women's Tshirt,LEOTUDE,0,0,0,299,3.6,4,73,,0,4
30,B09DPYKY4P,Women's Cotton Half Sleeve Round Neck Combo T-Shirt- Pack of 2,JUNEBERRY,0,0,0,649,4.0,111,73,,1,111
31,B09Q2ZYM1W,Regular Fit Half Sleeve Printed Women's Tshirt,LEOTUDE,0,0,0,299,5.0,2,73,,0,2
32,B08RC432MN,Women's Regular T-Shirt,Harpa Basics,0,0,0,375,3.9,110,62,,0,110
33,B09H2HWTWL,Cotton Half Sleeve Oversized Cow & Zebra Printed T-Shirt for Women/Girls,Veirdo,0,0,0,399,3.9,82,67,,0,82
34,B08QWVD38S,Women's Regular fit T-Shirt,Styleville.in,0,0,0,211,3.8,12,79,,0,12
35,B07JQ48CG7,Women's Regular T-Shirt,Amazon Brand - Symbol,0,0,0,294,4.2,"4,595",51,,0,"4,595"
36,B081QJ141F,"Women Printed Top with Half Sleeves for Office Wear, Casual Wear, Under 399 Top for Women/Girls Top",DHRUVI TRENDZ,0,0,0,299,3.9,462,85,,0,462
37,B09B7D95YT,1019 T-Shirts for Women,THE BLAZZE,0,0,0,449,3.5,193,55,,1,193
38,B08DLV4S8X,Women's T-Shirt,VIMAL JONNEY,0,0,0,299,3.7,438,70,,0,438
39,B08W27QDHF,Looney Tunes: Tweety Pattern Womens and Girls Graphic Printed Cotton T-Shirts Multi-Colored,The Souled Store,0,0,0,524,4.5,54,42,,1,54
40,B09PBXTBL3,Women's Regular T-Shirt,Lymio,0,0,0,249,4.8,38,88,,0,38
41,B07M7K7KHW,Women's Regular T-Shirt,Amazon Brand - Symbol,0,1,0,249,4.2,"23,499",58,,0,"23,499"
42,B098LTK6DW,Women's Regular T-Shirt,Mirako by Van Heusen,0,0,0,447,4.7,7,44,,0,7
43,B08W581V3K,Cotton Half Sleeve Regular Fit Printed Half Sleeves T-Shirt for Women/Girls,JUNEBERRY,0,0,0,299,3.7,192,75,,0,192
44,B07XP769YJ,100% Cotton Multicolored Stylish Round Neck T-Shirt for Women/Girls,JUNEBERRY,0,0,0,299,3.6,"1,191",75,,0,"1,191"
45,B08W3LJ8MR,Believe Tshirt for Women,ABSOLUTE DEFENSE,0,0,0,299,3.8,800,70,,1,800
46,B084V1H1GW,Women's & Girl's Classic Fit T-shirt (Set of 5),NIVIK,0,0,0,798,4.0,"1,245",43,,1,"1,245"
47,B07H8SMN27,Women's Thermal Quilt- Extra warm with heat wrap tech 3/4 Sleeve Solid T-shirt,Dixcy Slimz,0,0,0,199,4.0,519,60,,0,519
48,B097YNDBRC,Fitness Women V-Neck Yoga T-Shirt,DECISIVE,0,0,0,499,3.9,50,55,,1,50
49,B07HFS8MWP,Women's T-Shirt,MIDAAS,0,0,0,180,4.0,400,64,,0,400
50,B084P1RXZ1,504 69GAL Women Round Neck T-Shirt(Pack of 1),SHAUN,0,0,0,319,3.9,"1,626",73,,1,"1,626"
51,B09C6PHMKC,Women's Regular T-Shirt (Pack of 2),Max,0,0,0,399,4.3,468,20,,0,468
52,B08CVKQTKQ,Women's T-Shirts,Broadstar,0,0,0,499,3.5,398,75,,1,398
53,B09NRD3HP9,Graphic Printed T-Shirt for Women Funny Quote BTS| English Slogan Stylish T Shirt | Round Neck Stylish Tees | 100% Cotton T Shirts | Half Sleeve Office tees,Tee Stores,0,0,0,199,4.7,5,80,,0,5
54,B08GCHMLMZ,Women's Cotton Tie-Dye Regular Fit T-Shirt,JUNEBERRY,0,0,0,299,3.9,646,75,,0,646
55,B08H8NB39J,Women's T-Shirt,Veirdo,0,0,0,329,4.1,"1,572",73,,0,"1,572"
56,B083JMNWW8,Women's Regular T-Shirt,Amazon Brand - Symbol,1,0,0,603,4.3,"1,764",33,,1,"1,764"
57,B09P43HPQJ,Women's Regular T-Shirt,Puma,1,0,0,"1,499",0,0,0,,1,"₹1,499"
58,B09PHBFW27,"Women Heather Cat Tee,Black",Puma,1,0,0,629,5.0,1,65,,1,1
59,B08JHVPKMT,Women's Regular Work Utility T-Shirt,Amazon Brand - Inkast Denim Co.,1,0,0,384,4.1,249,36,,0,249
60,B08JHV7G9Q,Women's Regular Work Utility T-Shirt,Amazon Brand - Inkast Denim Co.,0,0,0,384,4.2,286,36,,0,286
61,B07XT8894Y,Women's Cotton Half Sleeve Crop T-Shirt,JUNEBERRY,0,0,0,299,4.1,690,75,,0,690
62,B08T5W5VZD,404 Women T-Shirt(404WTSN1_P$_Pack of 1),SHAUN,0,0,0,239,4.0,32,70,,1,32
63,B098LVP4WT,Women's Regular T-Shirt,Mirako by Van Heusen,0,0,0,464,4.5,16,42,,0,16
64,B014CLKSLS,Women's Cotton V-neck Tee,Jockey,0,0,0,499,4.1,"1,922",0,,0,"1,922"
65,B075LCM6GK,Women's T-Shirt,MIDAAS,0,0,0,219,4.0,851,56,,0,851
66,B09Q2ZRN7G,Regular Fit Half Sleeve Printed Women's Tshirt,LEOTUDE,0,0,0,299,3.0,2,73,,0,2
67,B08GJRX67F,Women's Regular fit T-Shirt,Van Heusen Woman,0,0,0,399,3.9,49,50,,0,49
68,B07BHJQ8CT,Women's T-Shirt,Veirdo,0,0,0,299,3.9,"2,410",75,,0,"2,410"
69,B08HMPVWGY,Women's Regular T-Shirt,VERO MODA,0,0,0,193,3.9,365,81,,0,365
70,B09JSQ1VJ3,Cotton Drop Shoulder Half Sleeve Printed Crop T-Shirt for Women/Girls,JUNEBERRY,0,0,0,299,3.7,18,75,,0,18
71,B08ZVC2DQL,Women's Regular T-Shirt,Max,0,0,0,239,4.1,71,20,,0,71
72,B083T3H14Y,Women's Regular T-Shirt,Harpa,0,0,0,503,3.9,143,66,,1,143
73,B097ZWZRRC,Women's Cotton Long/Knee Length T-Shirt,JUNEBERRY,0,0,0,499,4.2,131,75,,1,131
74,B09KL9LG4J,Cotton Maroon and Black Coloured Raglan Full Sleeve Up and Down Tshirt for Women,Fabricorn,0,0,0,379,3.9,94,68,,0,94
75,B075LB5R2B,Women's T-Shirt,MIDAAS,0,0,0,180,3.9,223,64,,0,223
76,B098QCJLXW,Women's Regular T-Shirt,Desi Belle,0,0,0,153,5.0,2,85,,0,2
77,B083C6VXVP,Women's Regular T-Shirt,Amazon Brand - Eden & Ivy,0,0,0,262,4.3,"2,984",74,,0,"2,984"
78,B08FYC8PH1,Women's Regular Fit T-Shirt,Van Heusen Woman,0,0,0,445,3.9,318,36,,0,318
79,B08H1TGWX7,Regular Fit Printed Cotton Half Sleeve T-Shirt for Women (JB_TSH_54_Wow_P),JUNEBERRY,0,0,0,299,3.8,500,75,,0,500
80,B08BY7975J,Women's Regular fit T-Shirt,Women's,0,0,0,224,4.2,"1,488",88,,0,T2F
81,B09FPM8SDT,Black Cotton Blended Fullsleeve Round Neck T-Shirt for Women(Pack of 1)-T_9_BLK01-P,VIMAL JONNEY,0,0,0,349,0,0,65,,1,"₹349
₹999 Save ₹650 (65%)"
82,B07DQT72TK,Womens' Plain Regular Fit T-Shirt,Styleville.in,0,0,0,210,3.9,213,74,,0,213
83,B08ZL3JYXJ,Women Bio Wash Full Sleeve V-Neck Black Color T-Shirt,TRENDS TOWER,0,0,0,349,3.9,128,61,,1,128
84,B08BTTFZHC,Women's Regular T-Shirt,Amazon Brand - Symbol,0,0,0,155,4.2,412,83,,0,412
85,B08FGBXZT6,Women's Long T-Shirt,RG,0,0,0,260,3.8,684,74,,1,684
86,B08SSD9ZBK,Women's Regular T-Shirt,Max,0,0,0,265,3.9,99,24,,0,99
87,B07RWJJK6X,Women's & Girls' T-Shirt,Veirdo,0,0,0,349,3.9,568,71,,0,568
88,B07TWMZ2QY,Women's Slim Fit T-Shirt,Amazon Brand - Symactive,0,0,0,499,4.2,104,64,,1,104
89,B07TS7MXVY,Women's Regular T-Shirt,Amazon Brand - Symbol,0,0,0,491,4.1,416,59,,0,416
90,B01G3MRENE,"Ladies Polyester Dry Fit Western Shirts & Tshirts for Women, Quick Drying & Breathable Fabric, Gym Wear Tees & Workout Tops (Navy Colour)",berge',0,0,0,795,4.0,133,0,,1,133
91,B08JHV81HP,Women's Regular Work Utility T-Shirt,Amazon Brand - Eden & Ivy,0,0,0,467,4.1,717,22,,0,717
92,B07K4XF7XN,Women's T-Shirt,Fruit of the Loom,0,0,0,239,4.0,144,47,,0,144
93,B08KXSGQ5H,Full Sleeves 100% Cotton Elegant Casual Round Neck T-Shirt for Women's,Full,0,0,0,315,3.7,"1,881",74,,0,V3Squared
94,B075KY3V6B,Women's T-Shirt,MIDAAS,0,0,0,196,4.1,"1,284",61,,0,"1,284"
95,B08JHW1KVR,Women's Regular Work Utility T-Shirt,Amazon Brand - Eden & Ivy,0,0,0,450,4.0,865,25,,0,865
96,B07WZNZTTM,Cotton T-Shirt for Women/Girls,JUNEBERRY,0,0,0,349,3.9,450,71,,0,450
97,B08TC5VPNF,Tie Dye Regular Fit Half Sleeves T-Shirts for Women,JUNEBERRY,0,0,0,349,4.0,478,71,,0,478
98,B08N564ZLF,"Women Printed Top with Half Sleeves for Office Wear, Casual Wear, Under 399 Top for Women/Girls Top(Red&Red) (Red&Red, Large)",DHRUVI TRENDZ,0,0,0,399,3.9,"3,785",80,,0,"3,785"
99,B07NSWRG1Z,Women's T-Shirt,WC Right,0,0,0,375,4.0,859,62,,0,859
100,B09Q662R2H,1330 Women's Cotton Regular Fit Round Neck Half Sleeve Utility T-Shirts for Women Combo,THE BLAZZE,0,0,0,299,3.0,1,70,,1,1
101,B09CKKKG4X,Women's Cotton Combo T-Shirt-Pack of 2,JUNEBERRY,0,0,0,699,4.0,187,71,,1,187
102,B09KHDK3Z4,Plain High Low Hem Cotton Tshirt for Women,Fabricorn,0,0,0,299,4.0,890,75,,0,890
103,B07PFWFGFK,Women's Top,AELOMART,0,0,0,394,4.0,"2,093",75,,0,"2,093"
104,B094N6GNZH,Women's Cotton Solid Boyfriend Plus Size Half Sleeve | Round Neck | Regular Fit T-Shirt/Tee,Bewakoof,0,0,0,449,5.0,1,40,,0,1
105,B08CXR37YZ,Women's Slim Fit T-Shirts,Spykar,0,0,0,368,4.1,32,47,,0,32
106,B099RJT7MB,Women's Cotton Long/Knee Length Combo T-Shirt-Pack of 2,JUNEBERRY,0,0,0,799,4.2,88,60,,1,88
107,B09C6QQZKL,Women's Regular T-Shirt (Pack of 2),Max,0,0,0,439,4.1,119,20,,0,119
108,B07BHBRSGW,Women's Regular T-Shirt,Amazon Brand - Symbol,1,1,0,439,4.2,"23,499",27,,0,"23,499"
109,B098LWBHNC,Women's Regular T-Shirt,Mirako by Van Heusen,1,0,0,410,3.7,18,41,,0,18
110,B07PZNJMZN,Women's Regular T-Shirt,Amazon Brand - Symbol,1,0,0,359,4.0,370,64,,0,370
111,B09F33PWH7,Women's Regular T-Shirt,ONLY,1,0,0,"1,259",5.0,1,30,,1,1
112,B07PFWFGFK,Women's Top,AELOMART,0,0,0,394,4.0,"2,093",75,,0,"2,093"
113,B094N6GNZH,Women's Cotton Solid Boyfriend Plus Size Half Sleeve | Round Neck | Regular Fit T-Shirt/Tee,Bewakoof,0,0,0,449,5.0,1,40,,0,1
114,B099RJT7MB,Women's Cotton Long/Knee Length Combo T-Shirt-Pack of 2,JUNEBERRY,0,0,0,799,4.2,88,60,,1,88
115,B09C6QQZKL,Women's Regular T-Shirt (Pack of 2),Max,0,0,0,439,4.1,119,20,,0,119
116,B07JP11GJZ,Women's Solid Regular Fit Half Sleeve T-Shirt (Combo Pack of 3),Amazon Brand - Symbol,0,0,0,629,4.2,"4,068",30,,1,"4,068"
117,B08ZL3JYXJ,Women Bio Wash Full Sleeve V-Neck Black Color T-Shirt,TRENDS TOWER,0,0,0,349,3.9,128,61,,1,128
118,B09FJXWC4N,Women's Pure Cotton Casual Oversized Printed Daisy Round Neck Drop Shoulder Loose Tshirt,BLANCD,0,0,0,499,2.8,5,67,,1,5
119,B08GJGJY6T,Women's Long T-Shirt,RG,0,0,0,260,3.5,186,74,,1,186
120,B08SSD9NLV,Women's Regular T-Shirt,Max,0,0,0,168,3.8,136,33,,0,136
121,B08LH82JYT,Women's T-Shirt,SHAUN,0,0,0,799,4.2,149,64,,1,149
122,B07Q3KD1K9,Women's Long Trendy T-Shirt,Broadstar,0,0,0,499,3.7,"1,837",75,,1,"1,837"
123,B07PK697ZW,Women's Cotton Regular Top(AWT2053-Pn),AELOMART,0,0,0,394,4.1,"4,490",74,,0,"4,490"
124,B08D8N31QG,Women's Slim T-Shirt,Reebok,0,0,0,849,3.7,6,50,,1,6
125,B08FY88VW8,Women's Regular fit T-Shirt,Van Heusen Woman,0,0,0,369,4.1,801,26,,0,801
126,B07LFTB86G,Women's T-Shirt,MIDAAS,0,0,0,209,3.7,162,70,,0,162
127,B07BK3G4VM,Women's T-Shirt (Pack of 2),MIDAAS,0,0,0,399,3.9,"1,295",56,,0,"1,295"
128,B09PHBTS1B,"Women Active Heather Tee,Pink",Puma,1,0,0,579,0,0,68,,1,"₹579
₹1,799 Save ₹1,220 (68%)"
129,B09HTC559V,Women's T-Shirt (Pack of 3),LAYA,1,0,0,699,4.0,"1,388",46,,1,"1,388"
130,B09G77R48H,Women Puma INTL Graphic Tee -Black (53165851,Puma,1,0,0,739,0,0,51,,1,"₹739
₹1,499 Save ₹760 (51%)"
131,B08WPZL5CP,Womens Printed Round Neck Tshirt | Top | Tee (Pack of 3),Womens,1,0,0,699,4.1,47,61,,1,Club A9
132,B09MTTR75L,"Women's Hooded Tie & Dye Full Sleeve T-Shirt (White, Dark Blue)",LEWEL,0,0,0,369,3.0,15,82,,0,15
133,B099NHD1D2,Tie-Dye: Hue Away Womens and Girls Solid Cotton Dolman Sleeve T-Shirts Multi-Colored,The Souled Store,0,0,0,629,3.9,25,30,,1,25
134,B085L7D4CR,Women's Regular Fit T-Shirt,SHETRACTIVE,0,0,0,295,3.3,37,63,,1,37
135,B097DDSBBD,"Women Printed Top with Half Sleeves for Office Wear, Casual Wear,Top for Women/Girls Top",DHRUVI TRENDZ,0,0,0,299,4.0,204,85,,0,204
136,B09FPM8SDT,Black Cotton Blended Fullsleeve Round Neck T-Shirt for Women(Pack of 1)-T_9_BLK01-P,VIMAL JONNEY,0,0,0,349,0,0,65,,1,"₹349
₹999 Save ₹650 (65%)"
137,B07K4XF7XN,Women's T-Shirt,Fruit of the Loom,0,0,0,239,4.0,144,47,,0,144
138,B09GG5N2GV,Women Round Neck Polo Tshirt,CRAFTLY,0,0,0,289,3.8,251,78,,1,251
139,B09BFWTG25,Women's Regular T-Shirt,Levi's,0,0,0,659,4.1,29,45,,1,29
140,B08KXSGQ5H,Full Sleeves 100% Cotton Elegant Casual Round Neck T-Shirt for Women's,Full,0,0,0,315,3.7,"1,881",74,,0,V3Squared
141,B07K9TXJJ9,Women Loose Home WEAR T-Shirt (Size S to 5XL) Black,Women,0,0,0,499,3.5,34,17,,1,Easy 2 Wear
142,B097RVGFC5,Women's Loose Fit T-Shirt,Amazon Brand - Myx,0,0,0,799,4.0,447,11,,1,447
143,B08WS3258F,Women's Regular Fit T-Shirt,Nefies,0,0,0,299,3.7,"1,353",70,,1,"1,353"
144,B07QRZB6QJ,Women Full Sleeve V-Neck Black Color,TRENDS TOWER,0,0,0,349,4.1,954,61,,1,954
145,B0936S5WFR,Women Round Neck Polo Full Sleeve Tshirt,CRAFTLY,0,0,0,498,4.1,84,55,,0,84
146,B08QPF5N6Q,Women's Regular T-Shirt,Max,0,0,0,359,4.1,199,10,,0,199
147,B07Q1QGLC1,Women's Regular T-Shirt,Amazon Brand - Symbol,0,0,0,568,4.3,801,29,,1,801
148,B0963YRLS4,Women T-Shirt (103WTS1_$P_Pack of 1),SHAUN,0,0,0,239,3.3,9,80,,1,9
149,B08Y8R22VS,F.R.I.E.N.D.S: The Six Friends Womens and Girls Graphic Printed Cotton Women's T-Shirts White,The Souled Store,0,0,0,629,4.2,88,30,,1,88
150,B092VYSBVW,Daisy Duck: All About Me Womens and Girls Graphic Printed Cotton T-Shirts Blue,The Souled Store,0,0,0,524,4.4,12,42,,1,12
151,B08KJQ6LCV,Women's Regular fit T-Shirt,Van Heusen Woman,0,0,0,499,4.1,438,0,,1,438
152,B07PFBR7DS,Women T-Shirt (104WN1_P$_Pack of 1),SHAUN,0,0,0,295,3.8,145,63,,1,145
153,B08D8MMX89,Women's Regular T-Shirt,Reebok,0,0,0,520,3.6,11,71,,1,11
154,B01M7PGBKC,Women's Modal V - Neck T-Shirt,Jockey,0,0,0,459,4.2,"1,185",0,,0,"1,185"
155,B085BHN9FK,Stylish Black White Grey Melange Cotton Tshirt for Women,Fabricorn,0,0,0,399,4.1,59,67,,0,59
156,B08BY7YCVS,Women's Regular fit T-Shirt (Pack of 2),Women's,0,0,0,331,4.3,"2,074",67,,0,T2F
157,B08CZV4HWG,Women's T-Shirt,Plush,0,0,0,349,3.6,736,61,,0,736
158,B07D38T71W,Women's Maroon Super Soft V-Neck Short Sleeves Cotton Solid Regular Fit T-Shirt,Miss Chase,0,0,0,399,4.1,"2,293",27,,1,"2,293"
159,B09D4HZ1TX,"Ladies T-Shirts Tops for Women Western, Printed Cotton Tops for Girls Stylish in Regular Fit (Sizes S- 4XL)",Stories.Label,0,0,0,399,4.1,649,69,,0,649
160,B093C9NH4F,Women's Loose Fit T-shirt (Set of 2),CRAFTLY,0,0,0,488,4.2,16,62,,0,16
161,B09GKMFHZY,Casual Full Sleeve High Neck | Turtle Neck Cotton T-Shirt for Women/Girls,MYO,0,0,0,299,3.7,41,67,,1,41
162,B09DYGJKF9,Women's Regular T-Shirt - Oversize T-Shirt Pure Cotton Solid Color Baggy Tee Loose Fitting Short Sleeve Wide fit Oversized Long T-Shirt for Women 2 Pack,Stable Impex,0,0,0,449,3.9,37,55,,1,37
163,B093DQY9SL,Women's Regular T-Shirt,Puma,0,0,0,599,4.4,29,60,,1,29
164,B08WPGY2P4,Womens Printed Round Neck Tshirt | Top | Tee (Pack of 3),Womens,1,0,0,699,4.3,52,61,,1,Club A9
165,B09F3365PB,Women's Slim T-Shirt,ONLY,1,0,0,"1,052",0,0,38,,1,"₹1,052
₹1,699 Save ₹647 (38%)"
166,B08K9PDRQK,Women's Classic T-Shirt,honeysuckle by Cotton Colors,1,0,0,343,4.0,500,14,,0,500
167,B08WNGRW3P,Womens Round Neck Tshirt | Top | Tee (Pack of 2),Womens,1,0,0,469,4.2,17,61,,0,Club A9
168,B083JMRS6V,Women's Regular T-Shirt,Amazon Brand - Symbol,1,1,0,445,4.2,"23,499",44,,0,"23,499"
169,B09P41R1LX,Women's Regular T-Shirt,Puma,1,0,0,"1,499",0,0,0,,1,"₹1,499"
170,B094N5PHDZ,Women's Cotton Solid Aqua Boyfriend Half Sleeve | Round Neck | Regular Fit T-Shirt/Tee,Bewakoof,1,0,0,349,4.1,95,22,,0,95
171,B08WQ7XWQ9,Womens Embroidered Round Neck Tshirt | Top | Tee (Pack of 3),Womens,1,0,0,699,4.0,135,61,,1,Club A9
172,B097TNYL9V,"Women Plus Size Long Top n Tees/Night, Yoga, Gym Wear T-Shirt/Ladies Lounge/Sleep Wear 2 Pc Pack Combo Offer",CUPID,0,0,0,999,4.1,192,29,,1,192
173,B08FMTVBYH,Womens' Long T-Shirt,RG,0,0,0,260,3.8,207,74,,1,207
174,B09GPWJBBZ,Women's Long Stylish and Casual T-Shirt Beautiful Print Cotton Round Neck T-Shirt,DUSCHO,0,0,0,270,4.4,7,46,,0,7
175,B09BR79B3X,Women's Cotton V Neck Combo T-Shirt Plain | Regular Fit Casual Full Sleeves | 100% Cotton (Pack of 2),FLEXIMAA,0,0,0,476,4.1,368,60,,0,368
176,B09Q29TFJ4,Vogue Index Women Multicoloured Tie and Dye T-Shirt,Generic,0,0,0,349,0,0,65,,0,"₹349
₹999 Save ₹650 (65%)"
177,B08R9YG35D,Women's High Neck Full Sleeve T-Shirt,Nefies,0,0,0,379,3.9,249,62,,1,249
178,B08J4KWXL8,Women's Regular T-Shirt,Amazon Brand - Inkast Denim Co.,0,0,0,199,3.9,541,67,,0,541
179,B07K8SMN3R,Women's Regular T-Shirt,Amazon Brand - Symbol,0,0,0,207,3.8,266,65,,0,266
180,B07CVBGR7V,Womens V Neck T-Shirts (Size S to 4XL) Loose and Long Fit T-Shirt,Womens,0,0,0,499,4.0,31,29,,1,Easy 2 Wear
181,B08D3SZJZ7,Women's Regular Fit T-Shirt,Plush,0,0,0,319,3.9,"3,469",65,,0,"3,469"
182,B08QWX8XFM,Women's Regular fit T-Shirt,Styleville.in,0,0,0,141,5.0,1,86,,0,1
183,B06XK1XH2M,Black and Grey Stripe Round Neck Thumb Insert Cotton Blend T-Shirt for Women(HYPW01355),HYPERNATION,0,0,0,699,4.1,573,29,,1,573
184,B09BNR73ZC,Women's Cotton Gold Foil Printed Round Neck T-Shirt,FLEXIMAA,0,0,0,424,3.3,3,58,,0,3
185,B08SKD9SMX,Women Tshirt Combo Pack of 2 | Regular Fit Half Sleeves Round Neck Cotton Tops Combo for Women/Girls,Reifica,0,0,0,389,4.0,971,76,,0,971
186,B09BFVRP4M,Women's Regular T-Shirt,Levi's,0,0,0,599,4.5,10,50,,1,10
187,B08P4SVB1Z,Women's Cotton Regular Fit T-Shirt (GL33_Anthra_110_PP_Multicolored_P),JUNEBERRY,0,0,0,349,3.9,643,71,,0,643
188,B07PH27RY4,Graphic Printed T-Shirt for Women | Drunk T-Shirt | Funny Quote Tshirt | Half Sleeve Womens Tshirt | Round Neck T Shirt for Girls | 100% Cotton Ladies Tops,PRINTOCTOPUS,1,0,0,298,3.7,9,70,,0,9
189,B09B5HX4JC,Cotton V-Neck Up Down Short Sleeve Tshirt for Women,Fabricorn,1,0,0,399,4.0,138,67,,0,138
190,B07PF16K93,Regular Fit T-Shirt for Women,PRINTOCTOPUS,1,0,0,298,4.1,64,70,,0,64
191,B09RJ7GB25,Women Printed Tshirts Combo Pack of 2,Reifica,1,0,0,499,0,0,62,,1,"₹499
₹1,299 Save ₹800 (62%)"
192,B0797T179Y,Women T-Shirts (Sizes S to 5XL) Loose and Long Fit,Women,0,0,0,499,3.8,600,29,,1,Easy 2 Wear
193,B08PWVHCXQ,Women's Regular fit T-Shirt,Pepe Jeans,0,0,0,550,0,0,54,,1,"₹550
₹1,199 Save ₹649 (54%)"
194,B07T9FVJNY,Women's Sports T-Shirt,Fusefit,0,0,0,275,4.1,623,66,,0,623
195,B075KXQB8Y,Women's T-Shirt,MIDAAS,0,0,0,209,4.0,521,16,,0,521
196,B0982Z8FGT,Plus Size White Pure Cotton T-Shirt for Women,PINKSHINK,0,0,0,499,4.2,7,50,,0,7
197,B08LD2LXYB,Women's Slim fit T-Shirt,Adidas,0,0,0,839,4.4,"1,312",30,,1,"1,312"
198,B08K2RH3MN,Sophie Womens Fashion Sportswear Tshirt,LAYA,0,0,0,329,3.9,117,81,,1,117
199,B09HWX6CXW,Women T-Shirts (Sizes S to 4XL) Loose and Long Fit,Women,0,0,0,499,3.8,65,29,,1,Easy 2 Wear
200,B07TDMJFDH,Women's Sports T-Shirt,Fusefit,0,0,0,313,3.7,63,69,,0,63
201,B082NVNCGB,Women's Regular Fit T-Shirt,Amazon Brand - Symactive,0,0,0,178,4.4,48,88,,0,48
202,B07TYNWCJ1,Women's Regular T-Shirt,Amazon Brand - Symbol,0,0,0,311,4.1,259,61,,0,259
203,B099PQ65J8,Women's Regular T-Shirt,Fusefit,0,0,0,269,4.3,11,73,,0,11
204,B09LHCV8TG,Women Leopard Cat Logo Tee (67173927),Puma,0,0,0,579,5.0,1,55,,1,1
205,B07PZNJMZN,Women's Regular T-Shirt,Amazon Brand - Symbol,0,0,0,359,4.0,370,64,,0,370
206,B07V7G3HWJ,Women's Regular T-Shirt,Amazon Brand - Symbol,0,0,0,474,4.2,"2,503",21,,0,"2,503"
207,B082NVB3L6,Women's Regular Fit T-Shirt,Amazon Brand - Symactive,0,0,0,202,4.2,129,87,,0,129
208,B0859XQKPG,Women Hooded T-Shirt (134W4_P$_Pack of 4),SHAUN,0,0,0,799,4.2,80,64,,1,80
209,B08N55SN1V,"Women Printed Top with Half Sleeves for Office Wear, Casual Wear, Under 399 Top for Women/Girls Top",DHRUVI TRENDZ,0,0,0,399,3.9,810,80,,0,810
210,B09MJ43SBQ,Women's Cotton Tie Dye Long/Knee Length T-Shirt/T-Dress,JUNEBERRY,0,0,0,499,3.8,5,69,,1,5
211,B08QWW3B1C,Women's Regular fit T-Shirt,Styleville.in,0,0,0,147,3.5,9,87,,0,9
212,B07RQCN5DJ,"24 Womens Cotton Roundneck Tshirt,Black",Herbalife,0,0,0,299,3.9,29,63,,0,29
213,B08JHVYXRJ,Women's Regular Work Utility T-Shirt,Amazon Brand - Symbol,0,0,0,155,4.0,592,69,,0,592
214,B08LV8JX68,Perfect Printed Long Tee,Van Heusen Athleisure,0,0,0,659,4.1,121,0,,0,121
215,B098LW1DP3,Women's Regular T-Shirt,Mirako by Van Heusen,0,0,0,576,4.5,2,56,,1,2
216,B097YLF1XV,Fitness Women V-Neck Yoga T-Shirt,DECISIVE,0,0,0,499,3.9,50,55,,1,50
217,B08FYDC8W7,Women's Regular Fit T-Shirt,Van Heusen Woman,0,0,0,499,4.1,440,0,,1,440
218,B08B85B14M,Women's T-Shirt,Midaas,0,0,0,187,4.0,292,69,,0,292
219,B07Q1YVW1F,Women's Slim T-Shirt,Amazon Brand - Symbol,0,0,0,543,4.2,335,32,,1,335
220,B08LQNMWSC,Women T-Shirt(104WTS1_P$_Pack of 1),SHAUN,0,0,0,295,4.2,57,63,,1,57
221,B07VNKXQ8G,Women's Loose Fit Long T-Shirt (RG502_Red_Free Size),Generic,0,0,0,349,3.6,52,50,,1,52
222,B09LH4C3XQ,Women Leopard Cat Logo Tee (67173904),Puma,0,0,0,579,4.0,6,55,,1,6
223,B095LVXXPD,Round Neck Plain Cotton T-Shirt for Women & Girls,PUNTO UNO,0,0,0,199,3.8,116,80,,0,116
224,B09P69QW1Z,Women's Bamboo Rich Cotton Blend Round Neck Full Sleeve Skins | Inbuilt Gloves T-Shirt for Women's,FREECULTR,1,0,0,"1,698",5.0,1,39,,0,1
225,B083JMZMP5,Women's Regular T-Shirt,Amazon Brand - Symbol,1,0,0,603,4.3,"1,764",45,,1,"1,764"
226,B09GXY7RYY,"Women Studio Tri Blend Relaxed Tee,Black -Medium (52109301)",Puma,1,0,0,"2,499",0,0,0,,1,"₹2,499"
227,B09BB81HP9,Women's Regular T-Shirt,ONLY,1,0,0,"1,189",0,0,30,,1,"₹1,189
₹1,699 Save ₹510 (30%)"
228,B07BHBDM2J,Women's Regular T-Shirt,Amazon Brand - Symbol,1,1,0,439,4.2,"23,499",27,,0,"23,499"
229,B08BTXFW16,Women's Regular T-Shirt,Amazon Brand - Symbol,1,0,0,391,4.1,172,64,,0,172
230,B08BTRX7KW,Women's Regular T-Shirt,Amazon Brand - Symbol,1,0,0,212,4.2,412,76,,0,412
231,B0964L2117,Women's Cotton Solid Aqua Boyfriend Half Sleeve | Round Neck | Regular Fit T-Shirt/Tee,Bewakoof,1,0,0,349,4.1,95,13,,0,95
232,B07Q1YVW1F,Women's Slim T-Shirt,Amazon Brand - Symbol,0,0,0,543,4.2,335,32,,1,335
233,B07VNKXQ8G,Women's Loose Fit Long T-Shirt (RG502_Red_Free Size),Generic,0,0,0,349,3.6,52,50,,1,52
234,B09LH4C3XQ,Women Leopard Cat Logo Tee (67173904),Puma,0,0,0,579,4.0,6,55,,1,6
235,B095LVXXPD,Round Neck Plain Cotton T-Shirt for Women & Girls,PUNTO UNO,0,0,0,199,3.8,116,80,,0,116
236,B08K9L637Z,Women's Classic T-Shirt (Pack of 2),honeysuckle by Cotton Colors,0,0,0,353,4.0,935,56,,0,935
237,B094RQG4LK,Women's Regular T-Shirt,Reebok,0,0,0,649,4.1,6,50,,1,6
238,B08ZV86CHH,Women's Slim T-Shirt,Max,0,0,0,199,4.0,77,20,,0,77
239,B094DB43G4,Women's Pure Cotton Casual Oversized Round Neck Slogan Print Self Love Short Sleeve Summer Tshirt,BLANCD,0,0,0,499,4.1,246,64,,1,246
240,B08ZVFHPZ9,Women's Slim T-Shirt,Max,0,0,0,349,4.1,93,0,,0,93
241,B084DTMGN9,Women's Regular fit T-Shirt,ONLY,0,0,0,399,0,0,60,,0,"₹399
₹999 Save ₹600 (60%)"
242,B08JHTH422,Women's Regular Work Utility T-Shirt,Amazon Brand - Inkast Denim Co.,0,0,0,134,4.1,249,78,,0,249
243,B08LQNMWSC,Women T-Shirt(104WTS1_P$_Pack of 1),SHAUN,0,0,0,295,4.2,57,63,,1,57
244,B099PQ65J8,Women's Regular T-Shirt,Fusefit,0,0,0,269,4.3,11,73,,0,11
245,B07D5RK8QR,Women's Regular fit T-Shirt,Puma,0,0,0,669,4.2,38,33,,1,38
246,B095LTKTN4,Round Neck Solid Regular Dry Fit T-Shirt for Women & Girls,PUNTO UNO,0,0,0,249,3.8,85,75,,1,85
247,B07WTWTCKF,"Women's Polo T-Shirt, Plain Cotton Half Sleeves Tshirt for Women",Malachi,0,0,0,369,3.2,30,63,,1,30
248,B09F32F2DJ,Women's Regular T-Shirt,ONLY,1,0,0,909,0,0,30,,1,"₹909
₹1,299 Save ₹390 (30%)"
249,B08XZGNXWB,Supima T-Shirt Womens and Girls Solid Cotton Women's T-Shirts,The Souled Store,1,0,0,734,3.9,15,43,,1,15
250,B08LB2PCWT,Womens Sports Raglan Tee,LAYA,1,0,0,349,4.0,171,65,,1,171
251,B08W3MSV7T,Womens Desire Cotton Spandex Tanktop Pack of 1,T.T.,1,0,0,182,4.4,12,25,,0,12
252,B09RF17T6N,Women Turtle Neck t Shirt Pack of 2-LIGHT FABRIC FOR ALL SEASONS PURPOSE,MANTEULA,0,0,0,249,0,0,50,,1,"₹249
₹499 Save ₹250 (50%)"
253,B07K9TXJJ9,Women Loose Home WEAR T-Shirt (Size S to 5XL) Black,Women,0,0,0,499,3.5,34,17,,1,Easy 2 Wear
254,B07KMJGYW5,Women's Regular fit T-Shirt,Jockey,0,0,0,819,3.8,20,0,,0,20
255,B0794PG11L,DJ&C by fbb Women's Floral Regular Fit T-Shirt,DJ & C,0,0,0,199,3.6,209,60,,0,209
256,B07HFR8B7T,Women's T-Shirt,MIDAAS,0,0,0,206,3.9,"1,392",59,,0,"1,392"
257,B09D9C13GJ,"Women's Lycra Office Wear, Yoga,Sports T-Shirt, Casual Regular Fit T-Shirt",DHRUVI TRENDZ,0,0,0,299,4.5,6,85,,0,6
