,asin,title,brand,Sponsored,Best Seller,Amazon's Choice,Price,Rating,NoofRatings,Discount,Delivery,Prime Delivery,base
0,B07J4Q433K,Men's Regular Fit OS 10 Pack of 3,Chromozome,1,0,0,729,3.9,"4,775",27,,1,"4,775"
1,B07HGHGJBC,Regular Fit Mens Tshirts,Chromozome,1,0,0,559,3.9,"2,971",39,,1,"2,971"
2,B091FLT2YK,Men's Polycotton Collar Neck Polo T-Shirt Combo Pack of 3,Wear Your Opinion,1,0,0,999,3.9,528,67,,1,528
3,B07RXZT62Q,Men's Regular Fit T-Shirt,Wrath,1,0,0,324,3.7,"2,737",75,,0,"2,737"
4,B06Y2BZJN6,Men's Polo,Allen Solly,0,1,0,570,4.1,"43,828",37,,1,"43,828"
5,B084L8XZTV,Men's Regular Fit T-Shirt (Pack of 3),Scott International,0,0,0,429,3.8,"25,072",82,,0,"25,072"
6,B09CNYR7ZS,Men's Cotton Half Sleeve Regular Fit Striped T-Shirt,RodZen,0,0,0,299,3.8,23,80,,0,23
7,B09QHR3GQ1,Regular Fit Half Sleeve Polo Men's T-Shirt,LEOTUDE,0,0,0,299,2.7,5,73,,0,5
8,B07B2X6LDJ,Men's Regular Fit T-Shirt (Pack of 4),AWG ALL WEATHER GEAR,0,0,0,499,3.5,"6,994",84,,1,"6,994"
9,B09D3QV24D,Men's Regular Fit Tshirt&Polo,OOBANI,0,0,0,639,4.1,32,64,,1,32
10,B092SN5GYJ,Cotton Camouflage Printed Regular Fit Men's Tshirt,LEOTUDE,0,0,0,299,3.8,"2,266",81,,0,"2,266"
11,B09CV152WG,Regular Fit Half Sleeve Men's T-Shirt,LEOTUDE,0,0,0,329,3.4,"1,586",70,,0,"1,586"
12,B08JHX6F6W,"Men's Round Neck Full Sleeves Tshirt Navyblue,Maroon,Grey (Pack of 2)",BLIVE,0,0,0,472,3.8,486,76,,0,486
13,B0819ZPKGG,Men's Striped Regular fit T-Shirt,U.S. POLO ASSN.,0,0,0,633,4.0,"1,214",21,,1,"1,214"
14,B07W1FDP11,Men's Regular Fit T-Shirt,GRITSTONES,0,0,0,309,3.8,"1,102",76,,0,"1,102"
15,B08TH92K4Q,Regular Fit Half Sleeve Polo Men's T-Shirt,LEOTUDE,0,0,0,329,3.6,"1,086",70,,0,"1,086"
16,B08L9FWQ3G,Regular Fit Half Sleeve Men's Polo T-Shirt,LEOTUDE,0,0,0,329,3.6,340,70,,0,340
17,B096VZGRTK,Men's Slim T-Shirt,Integriti,0,0,0,159,3.6,34,84,,0,34
18,B089B3C74D,Regular Men's Cotton Designer T-Shirt (EB1T67),EYEBOGLER,0,0,0,320,3.4,"2,190",75,,0,"2,190"
19,B08HQSTWJT,Men's Cotton Regular Fit Solid Polo Neck T-Shirt,Scott International,0,0,0,349,3.5,"8,122",77,,0,"8,122"
20,B09M45RKDM,Printed Cotton T-Shirt for Men Combo Pack of 2,Boodbuck,1,0,0,499,3.9,6,75,,1,6
21,B099ZYWRTZ,Men's Regular T-Shirt,Amazon Brand - House & Shields,1,0,0,399,3.9,20,69,,0,20
22,B09M44HG4N,Printed Cotton T-Shirt for Men Combo Pack of 2,Boodbuck,1,0,0,499,3.9,4,75,,1,4
23,B073X4H6BH,Men's Regular Polo Shirt,Amazon Brand - Symbol,1,0,0,329,3.9,"12,333",59,,0,"12,333"
24,B08MCDPX8B,Men's Cotton Regular Fit Full Sleeves T-Shirt,CHKOKKO,0,0,0,189,3.9,"1,845",91,,0,"1,845"
25,B09QHWDSKJ,Regular Fit Full Sleeve Men's T-Shirt,LEOTUDE,0,0,0,299,3.1,5,73,,0,5
26,B07C9BDYHV,Men's Solid Regular Fit T-Shirt,EYEBOGLER,0,0,0,335,3.8,"7,383",74,,0,"7,383"
27,B08JQKJ5FH,Men's Printed Full Sleeve Slim Fit Cotton T-Shirt,Urbano Fashion,0,0,0,399,3.8,"1,891",64,,0,"1,891"
28,B08HNC1K6B,AWG Men's Cotton Regular Fit Solid Polo Neck T-Shirt,AWG ALL WEATHER GEAR,0,0,0,349,3.6,"6,885",77,,0,"6,885"
29,B098K1DKLJ,Regular Fit Cotton Printed Men's T-Shirt,LEOTUDE,0,0,0,299,3.4,979,73,,0,979
30,B084GB4K2B,Men's Regular Fit T-Shirt,Austin Wood,0,0,0,399,3.8,"1,060",73,,1,"1,060"
31,B09C2JBSSC,Men's Slim T Shirt (Pack of 3),BULLMER,0,0,0,599,3.5,667,60,,1,667
32,B08N714Q2T,Men's Solid Regular fit T-Shirt,EYEBOGLER,0,0,0,349,3.7,"3,893",73,,0,"3,893"
33,B09N3NHLVF,Regular Fit Full Sleeve Men's T-Shirt (Color : Maroon),LEOTUDE,0,0,0,299,3.7,44,73,,0,44
34,B073X4KMYM,Men's Regular Polo Shirt,Amazon Brand - Symbol,0,0,0,329,3.9,"12,333",34,,0,"12,333"
35,B08CDR6T1M,Men T-Shirt,EYEBOGLER,0,0,0,339,3.9,"6,307",74,,0,"6,307"
36,B09KBJY64Y,Men's T Shirt-(Amt250105-P_Green),AELOMART,0,0,0,447,4.0,88,70,,0,88
37,B08KTZDXMG,Men's Regular Fit Polo,Allen Solly,0,0,0,659,4.1,283,45,,1,283
38,B096B86739,T-Shirt WMN SG RN WTESSC106 ORANGE M- Polyester,SG,0,0,0,123,0,0,75,"Thursday, February 17",0,"₹123
₹499 Save ₹376 (75%)"
39,B07MSJJWGK,Men's Plain Vest,Jockey,0,0,0,279,4.2,702,15,,0,702
40,B096VZY3GX,Men's Slim T-Shirt,Integriti,0,0,0,133,3.6,42,87,,0,42
41,B0862RFQ1K,Men's Printed Slim fit T-Shirt,AEROPOSTALE,0,0,0,548,4.2,32,45,,1,32
42,B08T7LRZ9D,Men's Regular Fit Printed Full Sleeve Soft & Strong Hooded T-Shirt,London Hills,0,0,0,399,3.8,650,69,,0,650
43,B08KTYMMTL,Men's Plain Regular Fit Polo,Allen Solly,0,0,0,648,4.2,"1,911",44,,1,"1,911"
44,B00W062FSM,Men's Cotton T-Shirt,Jockey,0,0,0,399,4.3,"11,618",20,,0,"11,618"
45,B094RGJG6T,Men's Slim Polo Shirt,Reebok,0,0,0,499,4.0,12,50,,1,12
46,B08JQLKQLG,Men's Dark Green Printed Slim Fit Cotton T-Shirt,Urbano Fashion,0,0,0,359,3.9,120,64,,0,120
47,B08SHTK9WD,Mens Regular Fit Printed Cotton Polo Tshirt,BULLMER,0,0,0,439,4.1,865,56,,0,865
48,B09JZJ2RWQ,Men Cotton Black/Maroon Hooded T-Shirt,GRITSTONES,0,0,0,332,4.2,42,63,,0,42
49,B01HTCFYG6,Men's Regular fit T-Shirt,wear your mind,0,0,0,499,4.7,5,55,,1,5
50,B08FTCCNQV,Spider-Man: The Suit Mens Graphic Printed Cotton Drop Cut T-Shirt Red,The Souled Store,0,0,0,649,4.3,176,78,,1,176
51,B08Z41K8HV,Mens Regular Fit Striped Cotton Polo Tshirt/Collared Tshirt,BULLMER,0,0,0,439,3.9,115,56,,0,115
52,B07B2VVHNT,Men's Regular Fit T-Shirt,Maniac,0,0,0,217,4.0,"1,489",79,,0,"1,489"
53,B08N55WRSX,Men's Regular Fit T-Shirt,EYEBOGLER,0,0,0,318,3.8,838,76,,0,838
54,B083C2TDPW,Men's Regular fit T-Shirt,Van Heusen Athleisure,0,0,0,649,4.1,829,0,,1,829
55,B08KTYS48F,Men T-Shirt,Allen Solly,0,0,0,659,4.3,233,45,,1,233
56,B09M441YWT,Printed Cotton T-Shirt for Men Combo Pack of 2,Boodbuck,1,0,0,499,2.5,2,75,,1,2
57,B099YMDPSS,Solid Men Round Neck Multicolor T-Shirt (Pack of 4),INKKR,1,0,0,799,3.8,38,60,,1,38
58,B09M44WV42,Printed Cotton T-Shirt for Men Combo Pack of 2,Boodbuck,1,0,0,499,5.0,1,75,,1,1
59,B08BZGJFNQ,Men's Regular Fit Polo T-Shirt,Knight & Rook,1,0,0,749,3.9,132,70,,1,132
60,B09QHR5GK1,Regular Fit Half Sleeve Men's Polo T-Shirt,LEOTUDE,0,0,0,299,4.4,7,73,,0,7
61,B07GNGG23G,Men’s Cotton Navy Blue Striped Polo T Shirt with Collar and Pocket,fanideaz,0,0,0,679,3.7,962,73,,1,962
62,B08TH9VSHW,Regular Fit Half Sleeve Men's Polo T-Shirt,LEOTUDE,0,0,0,299,3.6,"1,349",73,,0,"1,349"
63,B08662JK2H,Men's Slim Fit Polo T-Shirt,Alan Jones Clothing,0,0,0,419,4.0,863,58,,0,863
64,B08XXVFHXH,Regular Fit Men's Cotton T-Shirt(AMT2301-P),AELOMART,0,0,0,498,4.1,170,67,,0,170
65,B00YUNGPNE,Men's Slim Fit T Shirt,Maniac,0,0,0,372,3.6,"2,176",56,,0,"2,176"
66,B079KGBGZV,Men's Regular Fit T Shirt (Pack of 5),AWG ALL WEATHER GEAR,0,0,0,649,3.5,630,78,,1,630
67,B081B1B1S3,Men's Printed Regular fit T-Shirt,U.S. POLO ASSN.,0,0,0,699,4.0,"1,313",0,,1,"1,313"
68,B098L9LJT8,"Men's Hooded Cotton Blend Checked T-Shirt : Black, White",LEWEL,0,0,0,349,3.6,175,83,,0,175
69,B08ZG9337F,Men's Slim T-Shirt,EASYBUY,0,0,0,174,3.5,7,42,,0,7
70,B07NL7HD5H,Men's Regular Fit T-Shirt,Veirdo,0,0,0,289,4.1,"2,706",71,,0,"2,706"
71,B0979649SZ,Round Neck Regular Fit Cotton T-Shirt,Amazon Brand - Inkast Denim Co.,0,0,0,409,3.9,14,69,,0,14
72,B06W9HQHBW,Men's Regular Fit T-Shirt (Pack of 3),Scott International,0,0,0,429,3.6,"4,734",82,,0,"4,734"
73,B00O102P7Q,Men's Regular Fit T-Shirt,AMERICAN CREW,0,0,0,517,3.9,"13,244",74,,1,"13,244"
74,B079W7H3FB,Multicolour Cotton Full Sleeve T-Shirt for Men,ADRO,0,0,0,449,4.0,"2,257",75,,0,"2,257"
75,B0892VNQP7,Men's Slim Fit T-Shirt (Pack of 3),BULLMER,0,0,0,589,3.5,"1,161",61,,1,"1,161"
76,B09MTTCJQ2,Printed Men's Round Neck Black T-Shirt,London Hills,0,0,0,349,4.4,6,73,,0,6
77,B07YDHXM5P,Regular Fit Men's Cotton T-Shirt (EBT229-NBLM),EYEBOGLER,0,0,0,359,3.8,"3,628",72,,0,"3,628"
78,B012STP7EO,Men's Regular Fit Round Neck Half Sleeved T-Shirt,Jockey,0,1,0,349,4.3,"14,615",30,,0,"14,615"
79,B09C8N45JJ,Regular Fit Half Sleeve Men's T-Shirt Cotton Blend Combo (Pack of 2),LEOTUDE,0,0,0,499,3.5,200,55,,1,200
80,B089Z7BJ3T,Men's' Regular T-Shirt,Puma,0,0,0,579,3.9,44,55,,1,44
81,B07DPR2Y9W,Men's Regular Fit Polos,AMERICAN CREW,0,0,0,612,4.1,"6,680",59,,1,"6,680"
82,B0855MKXPT,Band Collar Men's T-Shirt(EBT325 & EBT325HS),EYEBOGLER,0,0,0,416,3.6,"3,228",68,,0,"3,228"
83,B07JJ2CBND,Men's Slim Fit T-Shirt,WC Right,0,0,0,365,3.8,"2,083",63,,0,"2,083"
84,B0867H512G,Men's Regular Fit T-Shirt,EYEBOGLER,0,0,0,430,3.7,609,67,,0,609
85,B08ZL5Z4W5,Men’s Full Sleeve Cotton Black and White Striped Polo T Shirt,fanideaz,0,0,0,679,3.6,286,73,,1,286
86,B08N236FC3,Men's Regular Fit T-Shirt,EYEBOGLER,0,0,0,299,3.8,"2,315",77,,0,"2,315"
87,B082XV7W83,Men's Regular Fit T-Shirt,AMERICAN CREW,0,0,0,802,4.1,236,68,,1,236
88,B07PNC3CM2,Men's Polo T-Shirts,ADRO,0,0,0,449,4.0,"1,331",75,,0,"1,331"
89,B073X2SPFB,Men's Regular T-Shirt,Amazon Brand - Symbol,0,0,0,569,4.0,"6,159",73,,1,"6,159"
90,B08NXHW761,Batman: 3D Logo Mens and Womens 3D Embossed Cotton T-Shirt Black,The Souled Store,0,0,0,629,4.3,285,30,,1,285
91,B09DCS9PDY,Men's High Turtle Neck Cotton T-Shirt,NORTHWIND,0,0,0,795,4.0,524,60,,1,524
92,B07FBK49KT,Men's Slim Fit T-Shirt,Maniac,0,0,0,358,3.8,"5,576",71,,0,"5,576"
93,B08TC7GJX4,Regular Fit Cotton Blend Printed Men's T-Shirt,LEOTUDE,0,0,0,299,3.4,103,73,,0,103
94,B09BG8ZY3C,Men's Regular Polo Shirt,Levi's,0,0,0,629,4.2,44,55,,1,44
95,B08F2C76Q2,Men's Regular Fit Striped Round Neck T-Shirt,EYEBOGLER,0,0,0,343,3.9,"7,712",74,,0,"7,712"
96,B09JZDP78S,Oversized Mens Cotton Blend Half Sleeve Mens T-Shirts,LEOTUDE,0,0,0,299,3.5,166,73,,0,166
97,B07R7QDQ7C,Men's Solid Regular Fit T-Shirt,Van Heusen Athleisure,0,0,0,680,4.0,"2,654",3,,1,"2,654"
98,B09H7JP1HV,Printed Men Round Neck Full Sleeve T-Shirt,London Hills,0,0,0,349,3.6,471,73,,0,471
99,B096VH5GPZ,Men's Regular T-Shirt,Arrow,0,0,0,607,3.0,1,62,,1,1
100,B073X1MR29,Men's Regular T-Shirt,Amazon Brand - Symbol,0,0,0,279,4.0,"5,583",53,,0,"5,583"
101,B01HTCHPVI,Men's Regular Fit T-Shirt,wear your mind,0,0,0,499,0,0,55,,1,"₹499
₹1,099 Save ₹600 (55%)"
102,B07KRYBNSV,Tan dye Hooded T-Shirt GSHDOMB2029-P,GRITSTONES,0,0,0,349,3.9,"1,871",65,,0,"1,871"
103,B06XBXRLX4,Men's Cotton T-Shirt,fanideaz,0,0,0,499,3.5,"3,413",80,,1,"3,413"
104,B07CXSH99J,Men's Regular fit T-Shirt,U.S. POLO ASSN.,0,0,0,384,4.0,"5,221",49,,0,"5,221"
105,B01EUQJ3B6,Men's Cotton T-Shirt,Jockey,0,0,0,599,4.3,"7,731",0,,0,"7,731"
106,B09GLYBKR8,Mens Regular Fit Fullsleeve Printed Casual Tshirt,BULLMER,0,0,0,458,4.0,21,77,,0,21
107,B098TQW7NZ,Men's Regular T-Shirt,Puma,0,0,0,599,4.1,31,60,,1,31
108,B09MWL2YFS,Men's Cotton Regular Fit Half Sleeve Plain Solid Casual Wear Round Neck Tshirt (Pack of 7),Men's,1,0,0,"1,299",3.6,6,74,,0,RZERO9
109,B09DQ8WC4H,Men's Plain Regular Fit T-Shirt,Chromozome,1,0,0,719,4.0,"4,376",28,,1,"4,376"
110,B082GK4GYB,Men's Regular T-Shirt,Puma,1,0,0,751,3.9,24,58,,1,24
111,B08662GXMK,Men's Slim Fit Polo T-Shirt,Alan Jones Clothing,1,0,0,419,4.0,863,58,,0,863
112,B096VH5GPZ,Men's Regular T-Shirt,Arrow,0,0,0,607,3.0,1,62,,1,1
113,B073X1MR29,Men's Regular T-Shirt,Amazon Brand - Symbol,0,0,0,279,4.0,"5,583",53,,0,"5,583"
114,B07KRYBNSV,Tan dye Hooded T-Shirt GSHDOMB2029-P,GRITSTONES,0,0,0,349,3.9,"1,871",65,,0,"1,871"
115,B06XBXRLX4,Men's Cotton T-Shirt,fanideaz,0,0,0,499,3.5,"3,413",80,,1,"3,413"
116,B07CXSH99J,Men's Regular fit T-Shirt,U.S. POLO ASSN.,0,0,0,384,4.0,"5,221",49,,0,"5,221"
117,B01EUQJ3B6,Men's Cotton T-Shirt,Jockey,0,0,0,599,4.3,"7,731",0,,0,"7,731"
118,B09GLYBKR8,Mens Regular Fit Fullsleeve Printed Casual Tshirt,BULLMER,0,0,0,458,4.0,21,77,,0,21
119,B098TQW7NZ,Men's Regular T-Shirt,Puma,0,0,0,599,4.1,31,60,,1,31
120,B01N1Q4OYU,Men's Cotton Polo,United Colors of Benetton,0,0,0,374,3.5,53,71,,0,53
121,B098TZ4DJQ,Mens Cotton Half Sleeve Branded Polo T Shirt with Collar,fanideaz,0,0,0,499,3.9,111,80,,1,111
122,B072BBS66K,Men's Regular Fit Polos,CHKOKKO,0,0,0,667,3.9,"1,230",74,,1,"1,230"
123,B08VN24M92,Men's Slim T-Shirt,Pepe Jeans,0,0,0,629,4.0,34,37,,1,34
124,B07MXJDQTC,Men's Regular Fit T-Shirt,Veirdo,0,0,0,199,3.7,"1,256",83,,0,"1,256"
125,B094TTKGL7,Men's Regular T-Shirt,Arrow,0,0,0,307,4.2,108,49,,0,108
126,B01LERKMAU,Men's Polo Collar Half Sleeve Striped Cotton Melange Colors T Shirts for Men,AMERICAN CREW,0,0,0,707,3.8,907,65,,1,907
127,B09GG1DZRV,Better Basics Half Crew Solid T Shirt - (100% Guarantee if not Satisfied)- Made in India,DAMENSCH,0,0,0,479,4.1,102,20,,0,102
128,B08WRVWRVD,Double Collar Men's Round Neck T-Shirt,Alan Jones Clothing,1,0,0,379,3.8,366,68,,0,366
129,B09BZZ79MV,100% Cotton Polo T Shirt for Men,PRINTOCTOPUS,1,0,0,798,0,0,50,,1,"₹798
₹1,599 Save ₹801 (50%)"
130,B07RXYRMLF,Men's Regular Fit T-Shirt,Wrath,1,0,0,324,3.7,"2,737",78,,0,"2,737"
131,B01DQS7P9G,Men's Regular Fit T-Shirt,AMERICAN CREW,1,0,0,564,3.9,"13,244",72,,1,"13,244"
132,B084P83K4G,Men's Regular fit T-Shirt,Puma,0,0,0,891,3.2,10,50,,1,10
133,B08KG357B1,Men's Regular Fit T-Shirt,Allen Solly,0,0,0,419,4.1,"2,073",40,,0,"2,073"
134,B0937JX11Q,Men's Printed Sleeveless Round Neck Purple Cotton Tshirt,Maniac,0,0,0,258,4.0,88,76,,0,88
135,B08353M893,Men's Slim Polo,Max,0,0,0,379,4.1,"8,009",16,,0,"8,009"
136,B07PCHH8GK,Men's Polyester Round Neck T-Shirts - Pack of 3,AWG ALL WEATHER GEAR,0,0,0,449,3.4,"1,205",81,,0,"1,205"
137,B096VHD9SC,Men's Regular T-Shirt,Arrow,0,0,0,887,5.0,3,51,,1,3
138,B096VYFNGL,Men's Slim T-Shirt (Pack of 3),Integriti,0,0,0,325,3.8,184,86,,0,184
139,B07XVM5D9S,Men's Round Neck Regular Fit T-Shirt (Pack of 2),London Hills,0,0,0,399,3.9,474,69,,0,474
140,B094FJ62Y7,Men's Plus Size Polo Collar Neck T-Shirt,Wear Your Opinion,0,0,0,499,4.0,287,67,,1,287
141,B08R5WR668,"Men's Cotton T Shirt (AWT1272-PN,Green)",AELOMART,0,0,0,448,3.9,622,70,,0,622
142,B07TRF9S3V,Men's Cotton T-Shirt,AELOMART,0,0,0,447,3.9,"7,847",70,,0,"7,847"
143,B08SC2PDDJ,"Men's Polo T-Shirt Regular fit, Polyester, Half Sleeve, with Pocket Combo Pack of 2 | Maroon, Sky-Blue |",SMAN,0,0,0,499,3.8,388,83,,1,388
144,B08KS3KCKL,Men's Cotton Half Sleeve Printed Polo T-Shirt,Veirdo,0,0,0,399,4.1,550,67,,0,550
145,B08T6HJNWQ,Round Neck Men's Cotton T-Shirt(AMT039-P),AELOMART,0,0,0,499,3.6,168,67,,1,168
146,B07L58BFXT,Men's Regular Fit T-Shirt (Pack of 2),London Hills,0,0,0,454,3.8,758,83,,0,758
147,B09QSXKTW5,Oversized t-Shirt for Men,Veirdo,0,0,0,399,5.0,2,67,,0,2
148,B085QZKGQW,Men's Regular fit T-Shirt,Cherokee by Unlimited,0,0,0,269,3.9,138,33,,0,138
149,B095SXRBD6,Men's Slim Fit T-Shirts,Spykar,0,0,0,350,4.1,97,65,,0,97
150,B07MQDJ54N,Tshirts for Men Man's Clothing Gents Stylish Tees Cotton Regular Branded T-Shirt Latest Collection Men's Cotton Half Sleeve Combo Pack Plain T-Shirt,STATUS MANTRA,0,0,0,139,3.5,187,85,,0,187
151,B0793HPJTD,Men's Regular fit T-Shirt,U.S. POLO ASSN.,0,0,0,494,3.8,"6,665",1,,0,"6,665"
152,B079KFXZX5,Men's Polyester Round Neck T-Shirts - Pack of 5,AWG ALL WEATHER GEAR,0,0,0,649,3.5,"1,068",78,,1,"1,068"
153,B099FC2HL1,Men's Slim T-Shirt,Jack & Jones,0,0,0,286,3.9,77,78,,0,77
154,B08PBZRNXF,Men's Solid Henley Neck Slim Fit Cotton T-Shirt,Urbano Fashion,0,0,0,339,3.8,207,69,,0,207
155,B09B9ZJHTM,Men's Slim Polo Shirt,Peter England,0,0,0,552,3.9,536,39,,1,536
156,B01HTCH3KQ,Men's Printed Regular fit T-Shirt,wear your mind,0,0,0,649,0,0,59,,1,"₹649
₹1,599 Save ₹950 (59%)"
157,B08NXGVH86,Batman: Wayne Industries Mens Graphic Printed Cotton Drop Cut T-Shirt Black,The Souled Store,0,0,0,734,4.3,432,18,,1,432
158,B07Q1YCK97,Men's Regular Fit Pyjama Top,U.S. POLO ASSN.,0,0,0,509,4.0,650,15,,1,650
159,B09FL8YBTF,Men's Combo Polo Neck Cotton Blend Solid T-Shirt (Pack of 2),INKKR,0,0,0,439,3.3,405,66,,0,405
160,B07VJNQYDM,"Men Polo Neck Graphic Print Half Sleeve Sports,Gym, Football Jersey T-Shirt",Campus Sutra,0,0,0,379,4.0,356,62,,0,356
161,B09HKZMTQJ,Men's Multicolour Polo T-Shirt-4421A,AUSTIVO,0,0,0,549,4.1,12,70,,1,12
162,B08V55FXS8,Regular Fit Full Sleeve Men's T-Shirt Combo (Pack of 2),LEOTUDE,0,0,0,549,3.6,931,66,,1,931
163,B09N3WY7J5,Unisex Cotton Half Sleeve Oversized Cow Printed T-Shirt,Veirdo,0,0,0,399,3.8,48,67,,0,48
164,B09137V9MN,Men's Polycotton Collar Neck Polo T-Shirt Combo Pack of 3,Wear Your Opinion,1,0,0,999,3.9,528,67,,1,528
165,B0936RWGJK,Men's Regular Fit OS 10 Pack of 3,Chromozome,1,0,0,689,3.9,"4,775",31,,1,"4,775"
166,B07HGGF5RX,Regular Fit Mens Tshirts,Chromozome,1,0,0,595,3.9,"2,971",35,,1,"2,971"
167,B09M43DBKM,Printed Cotton T-Shirt for Men Combo Pack of 2,Boodbuck,1,0,0,499,3.9,4,75,,1,4
168,B093LM4FVF,Men's Regular T-Shirt,U.S. POLO ASSN.,1,0,0,474,4.4,22,5,,0,22
169,B08662V8WL,Men's Slim Fit Polo T-Shirt,Alan Jones Clothing,1,0,0,419,4.0,863,58,,0,863
170,B0912L7WQT,Men's Polycotton Collar Neck Polo T-Shirt Combo Pack of 3,Wear Your Opinion,1,0,0,899,3.9,528,70,,1,528
171,B09DQ5RG87,Men's Plain Regular Fit T-Shirt,Chromozome,1,0,0,719,4.0,"4,376",28,,1,"4,376"
172,B09N3WY7J5,Unisex Cotton Half Sleeve Oversized Cow Printed T-Shirt,Veirdo,0,0,0,399,3.8,48,67,,0,48
173,B09BFSX6B3,Men's Regular Polo Shirt,Levi's,0,0,0,632,4.1,7,55,,1,7
174,B08RDVR739,Men's Half Sleeve Regular Fit T-Shirt,Veirdo,0,0,0,399,4.0,661,67,,0,661
175,B09HGJDQBW,Regular Fit Half Sleeve Men's Polo T-Shirt,LEOTUDE,0,0,0,299,3.0,13,73,,0,13
176,B084G4QR52,Men's Slim Fit T-Shirt,Maniac,0,0,0,324,3.7,"2,467",66,,0,"2,467"
177,B0862D2D64,Men's Slim Fit Polo T-Shirt,GHPC,0,0,0,399,4.0,387,60,,0,387
178,B09GRDYVCS,Men's Cotton Printed Round Neck Loose Fit Oversized T-Shirt | Hip Hop Casual T-Shirt,JUGULAR,0,0,0,369,3.6,59,58,,0,59
179,B08FXF9LY3,Men's Half Sleeve Printed Round Neck Tshirt,Dagcros,0,0,0,332,3.3,82,78,,0,82
180,B0922WCMBF,KiwiCaves Polo Collar Neck Sports Cotton T-Shirt for Men and Boys,Generic,0,0,0,348,3.5,118,65,,0,118
181,B073WB9BM6,Men's Printed Regular fit T-Shirt,Van Heusen Athleisure,0,0,0,549,4.1,648,0,,1,648
182,B08RRX4BYK,Mens Cotton Hooded Printed T-Shirt,Katso,0,0,0,299,3.6,108,77,,0,108
183,B0846CZ6ZY,Men's Regular fit T-Shirt,U.S. POLO ASSN.,0,0,0,760,3.6,33,60,,1,33
184,B08Z435JHJ,Mens Regular Fit Striped Cotton Polo Tshirt/Collared Tshirt,BULLMER,0,0,0,439,4.0,537,56,,0,537
185,B09F6MTJQM,Regular Fit Full Sleeve Men's T-Shirt,LEOTUDE,0,0,0,329,3.6,642,79,,0,642
186,B09MPJWSFT,Men's Loose Fit Round Neck Cotton Fabric Tshirt,BlackLadder,0,0,0,389,3.5,4,61,,0,4
187,B09GKDFW9J,Regular Fit Half Sleeve Men's Polo T-Shirt,LEOTUDE,0,0,0,549,3.5,"2,124",66,,1,"2,124"
188,B0936Q4LNN,Men's Regular Fit OS 10 Pack of 3,Chromozome,1,0,0,649,3.9,"4,775",35,,1,"4,775"
189,B085NTYVRC,Men's Regular Fit T-Shirt,VIMAL JONNEY,1,0,0,299,4.0,15,70,,1,15
190,B08VVTSLFP,Eco-Friendly Men's 50/50 Blend Double Coloured Polo T-Shirt,ECOLINE Clothing,1,0,0,609,4.1,15,21,,1,15
191,B07J5PBH13,Regular Fit Mens Tshirts,Chromozome,1,0,0,938,3.9,"2,971",6,,1,"2,971"
192,B0855CGJY5,Mens Cotton Half Sleeve Striped Polo T Shirt with Collar,fanideaz,0,0,0,712,3.7,"3,394",72,,1,"3,394"
193,B099F9XL3W,Men's Slim T-Shirt,Jack & Jones,0,0,0,238,4.0,14,78,,0,14
194,B082G3S7GC,"Men's Cotton Full Sleeve T Shirt-(Amt1125-N,Olive)",AELOMART,0,0,0,497,4.0,"3,706",67,,0,"3,706"
195,B07BDZ75YG,Men's Regular Polo Shirt,Amazon Brand - Symbol,0,0,0,589,3.9,"5,420",41,,1,"5,420"
196,B08V5RNWDX,Men's Regular T-Shirt,Puma,0,0,0,519,3.0,1,60,,1,1
197,B07R8HQJX3,Men's Regular Fit T-Shirt (Pack of 2),London Hills,0,0,0,449,3.9,363,83,,0,363
198,B09P1GVV8S,Men's t-Shirt Combo Pack of 5 Original 100% Cotton Blended,CUSTOMSCART,0,0,0,699,4.0,1,72,,0,1
199,B00RGV7U8G,Polo T-Shirts for Men,AMERICAN CREW,0,0,0,517,4.0,"1,928",74,,1,"1,928"
200,B098FC6ZKR,Men's Regular Fit Polo Multi Color T Shirt (Pack of 3),LEOTUDE,0,0,0,799,3.5,"1,274",50,,1,"1,274"
201,B09M46F5L6,Printed Cotton T-Shirt for Men Combo Pack of 2,Boodbuck,0,0,0,499,5.0,1,75,,1,1
202,B08RZJ5747,Men's Round Neck Full Sleeve T Shirt | (White),SWIFTLY,0,0,0,349,3.6,394,71,,0,394
203,B07RTQB4DH,Men's Regular Fit T-Shirt,Madwares,0,0,0,190,3.3,333,62,,1,333
204,B08QDJFXML,Printed Men's Fullsleeve Hooded Neck White Cottton Tshirt,Maniac,0,0,0,390,3.9,24,78,,0,24
205,B08XMH1FCC,All Over Printed Men's Halfsleeve Round Neck White Cotton Tshirt,Maniac,0,0,0,314,3.8,50,76,,0,50
206,B07T9GHB59,Men's Regular T-Shirt,Deniklo,0,0,0,324,4.1,77,73,,0,77
207,B09LM6YYV5,181920 Men's Basic Printed Cotton Regular T-Shirts for Men Combo,THE BLAZZE,0,0,0,499,2.8,13,50,,1,13
208,B073WBYVMR,Men's Solid Regular fit T-Shirt,Van Heusen Athleisure,0,0,0,500,4.1,"1,719",25,,1,"1,719"
209,B071J5S21R,Scott Men's Basic Cotton Round Neck Half Sleeve Solid T-Shirts - Pack of 2,Scott International,0,0,0,329,3.6,"2,434",82,,0,"2,434"
210,B019OM1198,Men's Polo Shirt,Puma,0,0,0,539,3.7,112,70,,1,112
211,B07WVBPTFS,Men's Regular Fit T-Shirt,Fashion Gallery,0,0,0,299,3.4,369,80,,1,369
212,B07CQMYJC7,Men's Regular Fit OS 10 Pack of 3,Chromozome,0,0,0,600,3.9,"4,775",34,,1,"4,775"
213,B097DYCH7T,Men's Regular Fit AS M NK DF SUPERSET TOP SS,Nike,0,0,0,699,3.8,51,59,,1,51
214,B07FLT438N,Men's Regular Fit T-Shirt (Pack of 4),London Hills,0,0,0,899,3.9,"3,857",83,,1,"3,857"
215,B07N8T4BFL,Men's Regular Fit T-Shirt,LAZYCHUNKS,0,0,0,449,3.8,942,55,,1,942
216,B08D7NPNZR,Men's Solid Mandarin Collar Slim Fit Cotton T-Shirt,Urbano Fashion,0,0,0,365,3.8,642,67,,0,642
217,B01DT8KDVU,Men's Classic Fit T-Shirt,ARISE,0,0,0,399,0,0,20,,0,"₹399
₹499 Save ₹100 (20%)"
218,B08YYHKJ55,Mens Polo Neck Half Sleeve Musturd Cotton T-Shirt,Classic Polo,0,0,0,629,3.9,40,10,,1,40
219,B085HR95N7,Men's Classic Fit T-shirt,GRITSTONES,0,0,0,279,3.2,38,83,,0,38
220,B073X32W26,Men's Regular T-Shirt,Amazon Brand - Symbol,0,0,0,829,4.1,"9,060",62,,1,"9,060"
221,B073X4VJNH,Men's Regular Fit T-Shirt,Amazon Brand - Symbol,0,0,0,319,3.7,150,64,,0,150
222,B098TNXJZF,Men's Relaxed T-Shirt,Peter England,0,0,0,489,2.9,3,39,,0,3
223,B07S15TXMP,Men's Regular Fit Pyjama Top,U.S. POLO ASSN.,0,0,0,430,3.9,70,22,,0,70
224,B093LNWQ4J,Men's Regular T-Shirt,U.S. POLO ASSN.,1,0,0,573,4.1,12,4,,1,12
225,B08Q5DPVR6,Men's Regular fit Polo,Van Heusen Athleisure,1,0,0,834,4.1,256,30,,1,256
226,B07CXSH99J,Men's Regular fit T-Shirt,U.S. POLO ASSN.,1,0,0,384,4.0,"5,221",49,,0,"5,221"
227,B08WRZP6RK,Double Collar Men's Round Neck T-Shirt,Alan Jones Clothing,1,0,0,369,3.8,366,69,,0,366
228,B08D7NWPBH,Men's Slim Fit Polo T-Shirt,Alan Jones Clothing,1,0,0,469,4.0,863,53,,0,863
229,B09M43RF44,Printed Cotton T-Shirt for Men Combo Pack of 2,Boodbuck,1,0,0,499,4.0,1,75,,1,1
230,B09DQ5KK5T,Men's Plain Regular Fit T-Shirt,Chromozome,1,0,0,719,4.0,"4,376",28,,1,"4,376"
231,B0793JLJXV,US Polo Association Men's Regular fit T-Shirt,U.S. POLO ASSN.,1,0,0,499,4.0,"2,311",0,,1,"2,311"
232,B08N664R36,Men's Regular Fit T-Shirt,EYEBOGLER,0,0,0,410,3.8,318,68,,0,318
233,B07RMYK9Z5,Men's Slim Fit T-Shirt,JUGULAR,0,0,0,284,3.6,"1,280",0,,0,"1,280"
234,B073X4QPY7,Men's Regular Polo Shirt,Amazon Brand - Symbol,0,0,0,319,4.0,"7,897",68,,0,"7,897"
235,B09PYTRM7J,Men Mauve Brown Solid Oversized T-Shirts,The Souled Store,0,0,0,839,0,0,16,,1,"₹839
₹999 Save ₹160 (16%)"
236,B07JK1H6S3,Mens Round Neck T-Shirts (Size L to 4XL) Plus Sizes,Mens,0,0,0,499,3.7,104,29,,1,Easy 2 Wear
237,B078D757V6,Men's Solid Regular Fit Polo,U.S. POLO ASSN.,0,1,0,"1,499",4.0,"4,956",0,,1,"4,956"
238,B0842HCX9Q,Men's Regular Fit T-Shirt,Jockey,0,0,0,649,4.2,"1,048",0,,1,"1,048"
239,B08CMSZHLX,Men's Classic Fit T-Shirt (Pack of 3),London Hills,0,0,0,674,3.8,699,83,,1,699
240,B085BM8FYZ,Men's Classic Fit T-Shirt,Jockey,0,0,0,562,4.3,958,6,,1,958
241,B0972VXFLY,Men's Loose Fit Printed Oversized T-Shirt,FUBURA,0,0,0,479,3.6,253,52,,1,253
242,B09QMG146G,Men T-Shirt (N704MT3_$P_Pack of 3),SHAUN,0,0,0,399,5.0,1,67,,1,1
243,B07PNPKLHT,Men's Slim Fit T-Shirt,Maniac,0,0,0,294,3.7,513,77,,0,513
244,B08CTTVVFK,Men's Regular fit T-Shirt,Solefit,0,0,0,185,3.7,16,86,,0,16
245,B08BG4MLQY,Men's Regular Fit T-Shirt (Pack of 3),BULLMER,0,0,0,589,3.7,382,61,,1,382
246,B076T54DCF,Polo Collar Cotton Poly Striped T-Shirt for Men,AMERICAN CREW,0,0,0,612,4.0,"3,306",59,,1,"3,306"
247,B081JMTB2P,Men's Solid Regular Fit Sports T-Shirt,CHKOKKO,0,0,0,299,4.0,"2,060",82,,0,"2,060"
248,B0912RLG3D,Men's Polycotton Collar Neck Polo T-Shirt Combo Pack of 3,Wear Your Opinion,1,0,0,999,3.9,528,67,,1,528
249,B0936TLJ7V,Men's Regular Fit OS 10 Pack of 3,Chromozome,1,0,0,663,3.9,"4,775",34,,1,"4,775"
250,B09QYV3XVQ,Men's Solid Colour Round Neck T-Shirt,Generic,1,0,0,399,0,0,60,,0,"₹399
₹999 Save ₹600 (60%)"
251,B07RY1KQZY,Men's Regular Fit T-Shirt,Wrath,1,0,0,324,3.7,"2,737",78,,0,"2,737"
252,B099FCWT3F,Men's Slim T-Shirt,Jack & Jones,0,0,0,269,3.5,28,78,,0,28
253,B07VR12VST,Men's Regular Fit T-Shirt,Veirdo,0,0,0,339,3.9,"2,816",72,,0,"2,816"
254,B085WWXW7B,N404 Men T-Shirt(N404M3_P$_Pack of 3),ACTIQUE,0,0,0,614,3.9,667,69,,1,667
255,B092RMLKVZ,Men's Regular Fit T-Shirt (NM143_Dark Green ),Generic,0,0,0,479,3.7,309,70,,1,309
256,B07HJDTCFD,Men's Solid Regular Fit Polo,Van Heusen,0,0,0,579,4.0,"20,915",36,,1,"20,915"
257,B06XHFTP47,Men's 100% Cotton Biowash Round Neck T-Shirt,Scott International,0,0,0,299,3.9,"1,396",70,,0,"1,396"
258,B08WQ19H7H,Typography Men's Cotton Round Neck Full Sleeve Printed Respect T-Shirt,JUGULAR,0,0,0,299,4.0,75,66,,0,75
259,B094CTLLDF,"Men's Tie Dye Halfsleeve Round Neck Grey, Blue and Dgrey Cotton Tshirt",Maniac,0,0,0,331,4.4,16,77,,0,16
260,B073X4YGZM,Men's Regular T-Shirt,Amazon Brand - Symbol,0,0,0,299,3.9,"1,630",0,,0,"1,630"
261,B083FHPYRQ,Regular Fit Men's Cotton T-Shirt,EYEBOGLER,0,0,0,349,3.5,539,73,,0,539
262,B096VZ9KYT,Men's Slim T-Shirt,Integriti,0,0,0,200,3.6,41,80,,0,41
263,B0979539JT,Round Neck Regular Fit Cotton T-Shirt,Amazon Brand - Symbol,0,0,0,349,3.8,72,65,,0,72
264,B09HS586DT,Men's All Over Printed Round Neck Fullsleeve Black & Grey Cotton Tshirt,Jump Cuts,0,0,0,299,0,0,80,,0,"₹299
₹1,519 Save ₹1,220 (80%)"
265,B07F8S4C5H,Men's Regular T-Shirt,Amazon Brand - Symbol,0,0,0,449,4.1,531,79,,0,531
266,B014LBVGI8,Men's Plain Regular Fit T-Shirt,Tinted,0,0,0,549,4.0,661,31,,1,661
267,B09135B8CK,Regular Fit Full Sleeve Men's T-Shirt,LEOTUDE,0,0,0,329,3.4,391,70,,0,391
268,B08RWZ9XD6,Men's Slim Fit T-Shirt,Maniac,0,0,0,285,3.9,244,70,,0,244
