,asin,title,brand,Sponsored,Best Seller,Amazon's Choice,Price,Rating,NoofRatings,Discount,Delivery,Prime Delivery,base
0,B09PRJXC37,Dyson V8 Absolute Cord-Free Vacuum Cleaner,Dyson,1,0,0,"34,900",5.0,4,21,"Sunday, February 13",1,4
1,B07H3X5GTL,"AmazonBasics Vacuum Cleaner with Power Suction, Low Sound, High Energy Efficiency and 2 Years Warranty (1.5L Reusable Dust Bag, Black)",AmazonBasics,1,0,0,"3,609",4.2,"8,542",33,"Friday, February 11",1,"8,542"
2,B00F3ABSXU,"Eureka Forbes Quick Clean DX Vacuum Cleaner with 1200 Watts Powerful Suction Control, 3 Free Reusable dust Bag worth Rs 500, comes with multiple accessories, dust bag full indicator (Red), standerd",Eureka,0,0,0,"3,499",3.8,"14,521",22,"Tuesday, February 8",1,"14,521"
3,B07H3X5GTL,"AmazonBasics Vacuum Cleaner with Power Suction, Low Sound, High Energy Efficiency and 2 Years Warranty (1.5L Reusable Dust Bag, Black)",AmazonBasics,0,0,0,"3,609",4.2,"8,542",33,"Friday, February 11",1,"8,542"
4,B072J83V9W,Philips PowerPro FC9352/01 Compact Bagless Vacuum Cleaner (Blue),Philips,0,0,1,"7,473",4.4,"13,294",25,"Tuesday, February 8",1,"13,294"
5,B08L3Q4W4H,"TUSA Wireless Handheld Vacuum Cleaner, High Power Cordless Mini Vacuum Cleaner (Black)",TUSA,0,1,0,"2,999",4.4,"1,859",33,"Friday, February 11",1,"1,859"
6,B07SRM58TP,"AGARO Regal 800 Watts Handheld Vacuum Cleaner, Lightweight & Durable Body, Small/Mini Size ( Black)",AGARO,0,0,0,"1,699",4.1,"8,091",19,"Saturday, February 12",1,"8,091"
7,B07DX2W1LL,"Maharsh Multi-Functional Portable Vacuum Cleaner Blowing and Sucking Dual Purpose (JK-8), 220-240 V, 50 HZ, 1000 W",Maharsh,0,0,0,"1,899",3.8,814,37,"Sunday, February 13",1,814
8,B07SLNG3LW,"Inalsa Vacuum Cleaner Wet and Dry Micro WD10 with 3in1 Multifunction Wet/Dry/Blowing| 14KPA Suction and Impact Resistant Polymer Tank,(Yellow/Black)",Inalsa,0,0,0,"3,999",3.9,"7,457",43,"Saturday, February 12",1,"7,457"
9,B08HDCWDXD,"Eureka Forbes Active Clean Handheld Vacuum Cleaner with 700 Watts Powerful Suction & Blower, Washable HEPA Filter, Comes with Multiple Accessories",Eureka,0,0,0,"2,599",3.9,192,21,"Saturday, February 12",1,192
10,B084HZPLD2,"AmazonBasics Wet and Dry Vacuum Cleaner with Power Suction, Low Sound, High Energy Efficiency and 1 Year Warranty (15L, Plastic Body)",AmazonBasics,1,1,0,"4,199",4.1,"2,567",40,"Friday, February 11",1,"2,567"
11,B07Z51CGGH,"Eureka Forbes Wet and Dry Ultimo Vacuum Cleaner with 1400 Watts High Power Suction and Blower, 20 litres Tank Capacity, Comes with Multiple Accessories (Red)",Eureka,0,0,0,"6,999",3.9,"1,165",30,"Tuesday, February 8",1,"1,165"
12,B09FZ89DK6,"Eureka Forbes Super Vac 1600W Bagless Vacuum Cleaner with Powerful Cyclonic Technology (Black & Red), Small (GFCDSFSVL00000)",Eureka,0,0,0,"7,499",4.4,135,25,"Tuesday, February 8",1,135
13,B08M1G4YTB,Karcher Cordless Handheld Vacuum Cleaner - VCH2,Karcher,0,0,0,"2,190",3.9,149,56,"Friday, February 11",1,149
14,B08J7VCT12,"KENT Zoom Vacuum Cleaner, Cordless, Hoseless, Rechargeable 130Watt Vacuum Cleaner with Cyclonic Technology, Bagless Design and Multi Nozzle Operation",KENT,0,0,0,"6,999",4.1,869,53,"Saturday, February 12",1,869
15,B083M7WPZD,"AGARO 33398 Rapid 1000-Watt, 10-Litre Wet & Dry Vacuum Cleaner, with Blower Function (Red & Black)",AGARO,0,0,0,"3,899",4.1,"1,600",35,"Sunday, February 13",1,"1,600"
16,B084HZPLD2,"AmazonBasics Wet and Dry Vacuum Cleaner with Power Suction, Low Sound, High Energy Efficiency and 1 Year Warranty (15L, Plastic Body)",AmazonBasics,0,1,0,"4,199",4.1,"2,567",40,"Friday, February 11",1,"2,567"
17,B07C1C5BLV,"Inalsa Spruce-1200W Vacuum Cleaner for Home with Blower Function and Reusable dust Bag (Red/Black), Standard",Inalsa,0,0,0,"3,310",3.9,"10,038",28,"Friday, February 11",1,"10,038"
18,B08TR5TQZJ,"Inalsa Vacuum Cleaner Gusto Pro-1200W with Powerful Blower Function and 1.5L Reusable Cloth Dust Bag, Powerful 16KPA Suction, Lightweight & Compact, (Red/Black)",Inalsa,0,0,0,"2,874",3.7,325,42,"Friday, February 11",1,325
19,B08L3Q4W4H,"TUSA Wireless Handheld Vacuum Cleaner, High Power Cordless Mini Vacuum Cleaner (Black)",TUSA,1,1,0,"2,999",4.4,"1,859",33,"Friday, February 11",1,"1,859"
20,B09HHM28MC,Eureka Forbes Wet&Dry Xpert Multipurpose Vacuum Cleaner with High Power Suction&Blower| HEPA Filter|Auto Clean|Intelligent Dustbag Full Indicator|Vario Power|Wide Range of Accessories (Black & Red),Eureka,1,0,0,"15,010",3.5,59,4,"Tuesday, February 15",0,59
21,B08J7VCT12,"KENT Zoom Vacuum Cleaner, Cordless, Hoseless, Rechargeable 130Watt Vacuum Cleaner with Cyclonic Technology, Bagless Design and Multi Nozzle Operation",KENT,1,0,0,"6,999",4.1,869,53,"Saturday, February 12",1,869
22,B07H3N8RJH,"AmazonBasics Cylinder Bagless Vacuum Cleaner with Power Suction, Low Sound, High Energy Efficiency and 2 Years Warranty (1.5L, Black)",AmazonBasics,1,0,0,"3,889",4.2,"8,542",35,"Tuesday, February 8",1,"8,542"
23,B084HZSLLS,AmazonBasics 1400 W 21L Wet and Dry Vacuum Cleaner with Blower Function and Steel Drum,AmazonBasics,1,1,0,"5,219",4.1,"2,567",39,"Tuesday, February 15",1,"2,567"
24,B00V9NHDI4,"Eureka Forbes Trendy Zip Vacuum Cleaner with 1000 Watts Powerful Suction Control, Reusable dust Bag, comes with multiple accessories, dust bag full indicator (Black)",Eureka,0,0,0,"3,299",3.9,"10,043",13,"Tuesday, February 8",1,"10,043"
25,B07RCGTZ4M,"AGARO Ace 1600 Watts, 21.5 kPa Suction Power, 21 litres Wet & Dry Stainless Steel Vacuum Cleaner with Blower Function and Washable Dust Bag",AGARO,0,0,0,"6,313",4.2,"1,388",37,"Tuesday, February 8",1,"1,388"
26,B09NNTWMPL,SHOPKART® Car Vacuum 2 in 1 Cleaner Advanced Design Portable Pet Hair Vacuum with Powerful Cyclonic Cordless Keyboard Vacuum Wet and Dry Cleaner (Black),SHOPKART®,0,0,0,"1,199",0,0,40,"Sunday, February 13",0,"₹1,199
₹1,999 Save ₹800 (40%)"
27,B09HRVLZY6,"OSMON - OS WD12 by American Micronic, Wet and Dry Vacuum Cleaner with Blower 19 KPa Suction Power, 100% Copper Motor with auto Cutoff and HEPA Filter (Grey & Orange)",OSMON,0,0,0,"4,071",4.4,51,41,"Sunday, February 13",1,51
28,B08GQCZMX2,BLACK+DECKER WDC215WA-QW 7.2 V10.8W Lithium-Ion Wet and Dry Cordless Dustbuster Handheld Vacuum Cleaner (Blue)-Charge Fully Before Using,BLACK+DECKER,0,0,0,"3,197",3.9,222,36,"Tuesday, February 8",1,222
29,B08VWNDDTF,"Inalsa Vacuum Cleaner 1400W Bagless - Aristo | HEPA Filter, Powerful Suction & High Energy Efficiency| 1.5 L Dust Collector, 2 Years Warranty (Red/Black)",Inalsa,0,0,0,"3,999",3.8,"1,060",40,"Saturday, February 12",1,"1,060"
30,B09QD7BHCZ,RNG EKO GREEN Wireless 12V DC + AC Rechargeable Wet/Dry Car & Home Vacuum Cleaner with Dual Filter- White,RNG,0,0,0,"3,075",5.0,1,32,"Friday, February 11",1,1
31,B08CL18DF1,BLACK+DECKER WDBD10 10-Litre 1200 Watt 16 KPa High Suction Wet and Dry Vacuum Cleaner and Blower with HEPA Filter and Reusable Dustbag (Red),BLACK+DECKER,0,0,0,"4,539",4.2,414,43,"Tuesday, February 8",1,414
32,B091DW5117,"SmartAI Robotic Vacuum Cleaner with Mopping, App and Remote Control, 90mins Runtime, 2600Pa Adjustable Suction Smart Visual Navigation, Multi Cleaning Modes",SmartAI,1,0,0,"19,900",3.9,8,34,"Friday, February 11",1,8
33,B072NCN9M4,"AMERICAN MICRONIC - AMI-VCD21-1600WDx- 21 Litre Stainless Steel Wet & Dry Vacuum Cleaner with Blower & HEPA filter, 1600 Watts 100% Copper Motor 28 KPa suction with washable reusable dust bag (Red/Black/Steel)",AMERICAN,1,0,0,"8,441",4.1,"2,225",29,"Sunday, February 13",1,"2,225"
34,B00B1AO7RA,Panasonic MC-DL201 700-Watt Vacuum Cleaner (Blue),Panasonic,0,0,0,"3,308",4.0,721,5,"Sunday, February 13",0,721
35,B09PNHF2VP,"Credicus Handheld Vacuum Cleaner Cordless - Mini Car Vacuum Cleaner Rechargeable for Car, Home, Office, Pet Hair Travel Cleaning",Credicus,0,0,0,"1,799",0,0,64,"Sunday, February 13",1,"₹1,799
₹4,999 Save ₹3,200 (64%)"
36,B09NPR52Z7,SHOPKART® Vacuum Cleaner 120W High-Power Handheld Wireless 2 in 1 Vacuum Cleaner Dust Collection/Lighting Car Pet Hair Vacuum with Powerful Cyclonic Dual-use Portable USB Rechargeable (Black),SHOPKART®,0,0,0,999,1.0,1,50,"Sunday, February 13",0,1
37,B09PZDHCQT,"USB Computer Mini Vacuum Cleaner, CAR Vacuum Cleaner",USB,0,0,0,250,0,0,29,"Friday, February 11",0,"₹250
₹350 Save ₹100 (29%)"
38,B088NN7LPT,"Lifelong Aspire 1000-Watt, 10-Litre Wet & Dry Vacuum Cleaner, Blower Function - for Home/Office/Car use with High Power Suction; with Multiple Accessories; 1 Year Warranty (Red & Black)",Lifelong,0,0,0,"3,469",3.8,367,37,"Tuesday, February 8",1,367
39,B09D3D4VSV,"VOVOSO Premium Cordless Vacuum Cleaner for Car and Home - Portable, Powerful Suction, w/ 3 Attachments, Carrying Bag and Two Extra HEPA Filter for Deep Cleaning (Black)",VOVOSO,0,0,0,"2,499",4.6,24,50,"Monday, February 14",0,24
40,B007NFN5TS,BLACK+DECKER ADV1210 12V Powerful Dustbuster Automatic Car Vacuum Cleaner with 4 accessories (Black and Orange),BLACK+DECKER,0,0,0,"1,852",3.7,300,31,"Tuesday, February 8",1,300
41,B09QYFFFM9,Krishna Enterprise 2 in 1 Vacuum Cleaner Dust Collection/Lighting Car Vacuum Cleaner 120W High-Power Handheld Wireless Vacuum Cleaner Home Car Dual-use Portable USB Rechargeable Set of 1 Black,Krishna,0,0,0,799,0,0,68,"Sunday, February 13",1,"₹799
₹2,499 Save ₹1,700 (68%)"
42,B07SRM58TP,"AGARO Regal 800 Watts Handheld Vacuum Cleaner, Lightweight & Durable Body, Small/Mini Size ( Black)",AGARO,1,0,0,"1,699",4.1,"8,091",19,"Saturday, February 12",1,"8,091"
43,B088NN7LPT,"Lifelong Aspire 1000-Watt, 10-Litre Wet & Dry Vacuum Cleaner, Blower Function - for Home/Office/Car use with High Power Suction; with Multiple Accessories; 1 Year Warranty (Red & Black)",Lifelong,1,0,0,"3,469",3.8,367,37,"Tuesday, February 8",1,367
44,B082PB4MY4,"AmazonBasics Cylinder Bagless Vacuum Cleaner with Power Suction, Low Sound, High Energy Efficiency and 2 Years Warranty (2L, Black)",AmazonBasics,1,0,0,"5,029",4.2,"8,542",34,"Tuesday, February 8",1,"8,542"
45,B08HP7KS7G,"AGARO Galaxy 1000-Watts Dry Vacuum Cleaner with 19 kPa Suction Power, 3.5 litres dust Bag, Variable Power Settings (Black)",AGARO,1,0,0,"3,799",3.8,37,31,"Tuesday, February 8",1,37
46,B09QQFWJMN,"M2 ENTERPRISE Handheld Vacuum Car Cleaner Air Duster Wireless Rechargeable Home Pet Hair Vacuum with Powerful Cyclonic, Portable USB Vacuum Cleaner with LED Light for Home (2 in 1 Vaccum Cleaner 120w)",M2,0,0,0,699,0,0,42,"Sunday, February 13",0,M2
47,B09J57B25C,"BHRAKUTI Handheld Vacuum Car Cleaner Air Duster Wireless Rechargeable Home Pet Hair Vacuum with Powerful Cyclonic, Portable USB Vacuum Cleaner with LED Light for Home (2 in 1 Vaccum Cleaner 120 w)",BHRAKUTI,0,0,0,999,0,0,49,"Sunday, February 13",1,"₹999
₹1,948 Save ₹949 (49%)"
48,B09N9XF2DZ,"Perfect Pricee Handheld Vacuum Car Cleaner Air Duster Wireless Rechargeable Home Pet Hair Vacuum with Powerful Cyclonic, Portable USB Vacuum Cleaner with LED Light for Home",Perfect,0,0,0,0,5.0,1,0,,0,1
49,B08QMVTT7X,"GOBBLER PowerVac-1000 Vacuum Cleaner with 1.5L Large Reusable Dust Bag, 1000W Powerful Suction, Comes with Multiple Accessories, Bin-Full Indicator, Compact & Lightweight (GB-820B)",GOBBLER,0,0,0,"2,399",5.0,2,73,"Tuesday, February 8",1,2
50,B08X4D1LXN,"BROGBUS Portable Multi-Functional Vacuum Cleaner for Home (JK-8), (220-240 V, 50 HZ, 1000 W)",BROGBUS,0,0,0,"2,099",4.2,590,30,"Sunday, February 13",1,590
51,B09GFXV5NC,Jugaadify Portable Cordless Mini Desktop Vacuum Desk Dust Cleaner/Dust Sweeper for Home Office Keyboard & Laptop (Pink),Jugaadify,0,0,0,849,5.0,1,43,"Friday, February 11",1,1
52,B09PN3193L,"Aetrius Handheld Vacuum Cleaner Cordless - Mini Car Vacuum Cleaner Rechargeable for Car, Home, Office, Pet Hair Travel Cleaning",Aetrius,0,0,0,"1,799",0,0,64,"Sunday, February 13",0,"₹1,799
₹4,999 Save ₹3,200 (64%)"
53,B09B277N6S,"Eureka Forbes Sure from Forbes Wet & Dry Zest Multipurpose Vacuum Cleaner with High Power Suction and Blower, 7 litres Tank Capacity, Comes with Multiple Accessories (Red & Black)",Eureka,0,0,0,"5,499",3.5,194,21,"Tuesday, February 8",1,194
54,B07SVMKKVP,"AGARO Twister 2200 Watts Dry Vacuum Cleaner with Powerful 25 kPa Suction Power & in-Built Blower, 6 litres dust Bag (Grey)",AGARO,1,0,0,"8,999",4.0,241,18,"Sunday, February 13",1,241
55,B08WXPTG1N,AGARO Empire 2200Watt Bagless Vacuum Cleaner with 3L Dust Collector (Orange/Ash),AGARO,1,0,0,"4,690",3.9,31,41,"Sunday, February 13",1,31
56,B09MW96XNP,"SCILLA Vacuum Cleaner |Multi-Functional Portable Vacuum Cleaner for Home, Office Garage Sucking Dual Purpose (220-240 V, 50 HZ, 1000 W) Multicolor",SCILLA,0,0,0,"1,749",5.0,1,35,"Sunday, February 13",1,1
57,B09G32PQ91,"Eureka Forbes Robo iVac with Powerful Suction 2 in 1 (Dry Suction+Mopping) Robotic Vacuum Cleaner with Mapping Intelligent Laser Navigation+Remote Control,(Tiles,Carpets and Wooden Floors)(Black)",Eureka,0,0,0,"15,999",3.9,999,11,"Friday, February 11",1,999
58,B09D3D7Q5K,"VOVOSO Premium Cordless Vacuum Cleaner for Home and car- Portable, Powerful Suction, Wet and Dry, w/ 3 Attachments, Carrying Bag and Two Extra HEPA Filter for Deep Cleaning (White)",VOVOSO,0,0,0,"3,499",4.2,37,42,"Monday, February 14",0,37
59,B09CLGNCNG,"Geek Schoner A10 1400W Cyclonic Bagless Vacuum Cleaner for Home with 20 kPa Strong Suction Power, 3L Dust Container, 8M Power Cord, HEPA Filter, Blue",Geek,0,0,0,"4,749",4.3,107,41,"Tuesday, February 8",1,107
60,B072NCN9M4,"AMERICAN MICRONIC - AMI-VCD21-1600WDx- 21 Litre Stainless Steel Wet & Dry Vacuum Cleaner with Blower & HEPA filter, 1600 Watts 100% Copper Motor 28 KPa suction with washable reusable dust bag (Red/Black/Steel)",AMERICAN,0,0,0,"8,441",4.1,"2,225",29,"Sunday, February 13",1,"2,225"
61,B09NJMHSQS,"MELLERWARE Vacuum Cleaner 1400 Watt Bagless Cylinder Vacuum Cleaner MWVC 02 with Powerful Suction & High Energy Efficiency| 1.5L Dust Box Capacity, (Aqua Green/Black)",MELLERWARE,0,0,0,"3,799",0,0,40,"Friday, February 11",1,"₹3,799
₹6,345 Save ₹2,546 (40%)"
62,B081T2YXGK,"Geek Renere N6, 600W Wired Handheld Vacuum Cleaner with NanoDuzt Filtration Technology, 17 KPa Strong Suction, 0.5L Dust Container, (Blush Red)",Geek,0,0,0,"3,039",3.4,92,32,"Monday, February 14",1,92
63,B09PRJXC37,Dyson V8 Absolute Cord-Free Vacuum Cleaner,Dyson,0,0,0,"34,900",5.0,4,21,"Sunday, February 13",1,4
64,B07DS7GPY7,"Osmon -OS 800BL by American Micronic, 2in1 Vacuum Cleaner (Handheld and Upright) 800 Watts Bagless (White & Pink)",Osmon,1,0,0,"2,741",4.2,278,19,"Sunday, February 13",1,278
65,B07RCGZFL9,"AGARO Storm 2000 Watts Vacuum Cleaner with Powerful 24 kPa Suction Power, Dry vacuuming, 4 litres dust Bag (Black)",AGARO,1,0,0,"5,899",4.1,460,26,"Tuesday, February 8",1,460
66,B082PBK27K,"AmazonBasics Vacuum Cleaner with Power Suction, Low Sound, High Energy Efficiency and 2 Years Warranty (3L Reusable Dust Bag, Black)",AmazonBasics,1,0,0,"4,079",4.2,"8,542",42,"Friday, February 11",1,"8,542"
67,B07RCGTZ4M,"AGARO Ace 1600 Watts, 21.5 kPa Suction Power, 21 litres Wet & Dry Stainless Steel Vacuum Cleaner with Blower Function and Washable Dust Bag",AGARO,1,0,0,"6,313",4.2,"1,388",37,"Tuesday, February 8",1,"1,388"
68,B077467KFX,KENT Force Cyclonic Vacuum Cleaner 2000-Watt (White and Silver),KENT,0,0,0,"5,750",3.9,"1,618",23,"Wednesday, February 9",1,"1,618"
69,B00JBNZPFM,Karcher WD 3 *EU Wet & Dry Vacuum Cleaner (Yellow/Black),Karcher,0,0,0,"6,740",4.2,"9,076",39,"Tuesday, February 8",1,"9,076"
70,B07PSJXZ7Z,Balzano Aero Vac GW902K 600-Watt Stick Vacuum Cleaner (Blue),Balzano,0,0,0,"2,290",4.0,"1,190",71,"Sunday, February 13",1,"1,190"
71,B08WRKPZRJ,"Deerma DX118C Vacuum Cleaner for Home Mini 2-in-1 Pushrod/Handheld Cleaner with 1.2L dust Capacity & 16000Pa Super Suction, 600 Watts",Deerma,0,0,0,"2,150",4.3,100,11,"Friday, February 11",1,100
72,B09NQ1X63S,DKEXL Car Vacuum Cleaner Portable Wet Dry Handheld High Power Strong Suction Advanced Design Wireless Rechargeable Home Pet Hair Vacuum with Powerful Cyclonic with Portable USB & LED Light (Black),DKEXL,0,0,0,"1,149",0,0,43,"Sunday, February 13",1,"₹1,149
₹1,999 Save ₹850 (43%)"
73,B09PLGQM2J,,,0,0,0,0,0,0,0,,0,
74,B09NPS3ZGB,"Bletilla Multi-Functional Portable Vacuum Cleaner Blowing and Sucking Dual Purpose, 220-240 V, 50 HZ, 1000 W (Multicolor)",Bletilla,0,0,0,"1,799",0,0,28,"Sunday, February 13",1,"₹1,799
₹2,499 Save ₹700 (28%)"
75,B07MWDJMY2,BLACK+DECKER VM1680 1600-Watt 20 Kpa High Suction 2.5L dustbowl Bagless Multicyclonic Vacuum Cleaner with 6 stage Filteration (Red and Black),BLACK+DECKER,0,0,0,"4,804",4.0,650,43,"Tuesday, February 8",1,650
76,B08WXPJKWY,"AGARO Regal Plus Upright Vacuum Cleaner, 2-in-1, Handheld & Stick for Home and Office Use, 800 Watts",AGARO,1,0,0,"2,279",4.1,"8,091",24,"Tuesday, February 8",1,"8,091"
77,B08911MN5H,"Osmon OS 2000BL by American Micronic- 2000 Watts Bagless Cyclonic Vacuum Cleaner with HEPA Filter, 30Kpa Suction (Purple & Black)",Osmon,1,0,0,"5,591",4.3,134,44,"Friday, February 11",1,134
78,B01F8OWMD0,Karcher WD3 Premium Wet and Dry Vacuum Cleaner (Yellow),Karcher,0,0,0,"7,990",4.2,"1,492",31,"Tuesday, February 8",1,"1,492"
79,B085DYKCQR,"70mai Cordless Portable Car Vacuum Cleaner Swift, 5000Pa 120 Watt Suction, 24min Long Runtime, Innovative Ventilation Design with Nozzle Set",70mai,0,0,0,"4,199",4.0,247,53,"Friday, February 11",1,70mai
80,B09NKZT5RN,"MELLERWARE Vacuum Cleaner Wet and Dry 1200 Watt- MWVC 01 with 3in1 Multifunction Wet/Dry/Blowing| 14KPA Suction and Impact Resistant Polymer Tank,(Black/Red)",MELLERWARE,0,0,0,"4,090",0,0,58,"Saturday, February 12",1,"₹4,090
₹9,795 Save ₹5,705 (58%)"
81,B01BDQG4VI,Kent Bed and Upholstery Vacuum Cleaner,Kent,0,0,0,"6,999",4.4,308,7,"Sunday, February 13",1,308
82,B07SVMKKVP,"AGARO Twister 2200 Watts Dry Vacuum Cleaner with Powerful 25 kPa Suction Power & in-Built Blower, 6 litres dust Bag (Grey)",AGARO,0,0,0,"8,999",4.0,241,18,"Sunday, February 13",1,241
83,B09PY9SZ73,"ANIRUDHA Handheld Vacuums Cordless, 120W Handheld Vacuum Cleaner with Powerful Suction, Portable Rechargeable Car Vacuum Cleaner, Lightweight Wet Dry Vacuum for Home, Office, Car and Pet",ANIRUDHA,0,0,0,"2,299",0,0,54,"Sunday, February 13",1,"₹2,299
₹4,999 Save ₹2,700 (54%)"
84,B097Y2QXQ5,"ILIFE G80 Cordless Stick Vacuum,250 Watt, 22000Pa Powerful Suction, 45mins Runtime,4 Stage Cyclone Filtration,Special Side Brush Design to Clean All Corners.Lightweight 1.95 kg",ILIFE,0,0,0,"10,900",3.9,111,39,"Tuesday, February 8",1,111
85,B07VBS92ZR,Miss Queen New Multi-Functional Portable Blowing and Sucking Dual Purpose Handheld Car Electric Dust Dry Cleaning Multipurpose Stainless Steel Vacuum Cleaner,Miss,0,0,0,"2,149",1.0,1,46,"Sunday, February 13",1,1
86,B09HRVLZY6,"OSMON - OS WD12 by American Micronic, Wet and Dry Vacuum Cleaner with Blower 19 KPa Suction Power, 100% Copper Motor with auto Cutoff and HEPA Filter (Grey & Orange)",OSMON,1,0,0,"4,071",4.4,51,41,"Sunday, February 13",1,51
87,B08CH2D67F,"ECOVACS DEEBOT OZMO T8 dToF 2-in-1 Robotic Vacuum Cleaner with dToF 3D & OZMO Mopping Technology, Multi-Floor Mapping, Virtual Boundary,Work on Carpets & Hard Floors.",ECOVACS,1,0,0,"39,900",4.0,"1,085",60,"Sunday, February 13",1,"1,085"
88,B083M7WPZD,"AGARO 33398 Rapid 1000-Watt, 10-Litre Wet & Dry Vacuum Cleaner, with Blower Function (Red & Black)",AGARO,1,0,0,"3,899",4.1,"1,600",35,"Sunday, February 13",1,"1,600"
89,B077467KFX,KENT Force Cyclonic Vacuum Cleaner 2000-Watt (White and Silver),KENT,1,0,0,"5,750",3.9,"1,618",23,"Wednesday, February 9",1,"1,618"
90,B08VHD3P9S,"GROWING BUSINESS Multi-Functional Portable Vacuum Cleaner Blowing and Sucking Dual Purpose Vacuum Cleaner Used for Floor/Sofa/Chair Cleaning | Portable Vacuum Cleaner (220-240 V, 50 Hz, 1000 W)",GROWING,0,0,0,"1,799",4.6,5,49,"Sunday, February 13",0,5
91,B09JWBVC8Y,"Deerma VC20 Plus 7000Pa Handheld Cordless Vacuum Cleaner with Rechargeable Battery, 20 Minutes Run Time",Deerma,0,0,0,"6,999",4.4,6,53,"Monday, February 14",1,6
92,B094QZDVM2,"RIVUGJA Keyboard Cleaner, Hand Held Cordless Computer Vacuum Cleaner Air Duster Handheld Wireless Car Cleaner with Battery Operated with LED Light for Home Car Pet Gift Cleaning Gel(Black)",RIVUGJA,0,0,0,"1,249",2.4,4,65,"Sunday, February 13",1,4
93,B092VBCYVD,"INSE Cordless Vacuum Cleaner Powerful Suction, 6-in-1 Lightweight Handheld Stick Vacuum, Up to 45 Mins Runtime, with Quiet Rechargeable Battery for Home Hard Floor Carpet Pet Hair Car - N5 Light Blue",INSE,0,0,0,"8,490",3.8,56,35,"Sunday, February 13",1,56
94,B074183D89,GOCART WITH G LOGO Vacuum Cleaner,GOCART,0,0,0,"1,799",3.9,235,38,"Sunday, February 13",1,235
95,B08JYZWFQ9,"kadeau Mini Desktop Sweeper Vacuum Cleaner Portable Handheld Cordless Tabletop Crumb for Home, Office, Cars, Pet Hairs - Beige (Battery Operated)",kadeau,0,0,0,389,3.2,63,68,"Friday, February 11",0,63
96,B082KZNDQ6,"INALSA Vacuum Cleaner Gusto-1000W with Blower Function and 1.5L Reusable Cloth Dust Bag, Powerful 16KPA Suction, Lightweight & Compact, (Blue/Grey)",INALSA,0,0,0,"2,906",3.6,409,32,"Friday, February 11",1,409
97,B09NYFR173,Deerma 2-in1 Vacuum Cleaner with Large Capacity Separable Dust Box Low Noise Triple Filter Handheld Vertical Cleaning Tool (Vacuum Cleaner),Deerma,0,0,0,"4,831",0,0,15,"Saturday, February 12",1,"₹4,831
₹5,669 Save ₹838 (15%)"
98,B09QD7BHCZ,RNG EKO GREEN Wireless 12V DC + AC Rechargeable Wet/Dry Car & Home Vacuum Cleaner with Dual Filter- White,RNG,1,0,0,"3,075",5.0,1,32,"Friday, February 11",1,1
99,B08WXQY135,AGARO ICON 1800Watt Bagless Vacuum Cleaner with Suction Controller and 1.5L Dust Collector (Red/Black),AGARO,1,0,0,"4,999",3.2,7,44,"Saturday, February 12",1,7
100,B07X8XSHQR,Crownish Handheld car and Home use Powerful Portable & High Power Vacuum Cleaner for Home Wet & Dry Vacuum Cleaner Multipurpose Vaccum Cleaner for Office Vacuum Cleaner (JK 8),Crownish,0,0,0,"1,870",3.8,268,28,"Sunday, February 13",1,268
101,B07DS7GPY7,"Osmon -OS 800BL by American Micronic, 2in1 Vacuum Cleaner (Handheld and Upright) 800 Watts Bagless (White & Pink)",Osmon,0,0,0,"2,741",4.2,278,19,"Sunday, February 13",1,278
102,B08QFVKWVW,Probus W11 600W Handheld Vacuum Cleaner with HEPA Filtration and Powerful Cyclone System | Large Capacity Dust Collector | Wet and Dry Multifunction 15000 Pa High Suction - (White/Grey),Probus,0,0,0,"2,989",3.9,150,50,"Sunday, February 13",1,150
103,B08W32FKWT,"Amtidy A590 Local Home Voice Robotic Vacuum with Light, Robot Vacuum Cleaner with WiFi APP Control, Auto Recharging, Compatible with Alexa/Google Asisstant.",Amtidy,0,0,0,"7,999",3.4,14,70,"Sunday, February 13",1,14
104,B07F42FCZG,"T TOPLINE New Household Vacuum Cleaner Used for Blowing, Sucking, Dust Cleaning, Dry Cleaning Multipurpose Use (Jk-8)",T,0,0,0,"1,999",3.9,742,33,"Sunday, February 13",1,742
105,B09F9HYSZL,Car Vacuum Cleaner - DEESSE Powerful Portable & High Power 120w 12v Black Car Handheld Vacuum Cleaner for Car and Home Wet and Dry Car Vacuum Cleaner Car Copper Power (Orenge-Black),Car,0,0,0,949,3.1,96,81,"Tuesday, February 15",1,96
106,B08ZYLF36G,Portable Vacuum Cleaner Blowing and Sucking Dual Purpose Vacuum Cleaner-Gold,Portable,0,0,0,"1,343",0,0,16,"Monday, February 14",0,"₹1,343
₹1,599 Save ₹256 (16%)"
107,B09N8NBN6G,"AAA STORE® 1000 Watts Handheld Vacuum Cleaner for House Suitable for Car, Floors, Carpet, Etc",AAA,0,0,0,"2,849",0,0,72,"Sunday, February 13",1,"₹2,849
₹9,999 Save ₹7,150 (72%)"
108,B077481D45,KENT - KSL-612 Wet and Dry Vacuum Cleaner 1200-Watt (Metallic Silver),KENT,1,0,0,"5,999",4.0,675,40,"Wednesday, February 9",1,675
109,B07F6YX38W,American MICRONIC - AMI-VCC-2200WDx- 2200 Watts Vacuum Cleaner with HEPA Filter and 100% Copper Motor 32KPa Suction (Red),American,1,0,0,"7,111",4.2,327,32,"Sunday, February 13",1,327
110,B097NH816V,"ILIFE B5Max Robot Vacuum,Wi-Fi Connected, 2000Pa Strong Suction,Path Pattern, 50ml Water Tank, Large Dustbin & Vacuum Bags, Zigzag Path Cleaning,Self-Charging",ILIFE,1,0,0,"15,900",4.2,181,34,"Tuesday, February 8",1,181
111,B07F7B5MWQ,"American MICRONIC - AMI-VCD15-1600WDx- 15 Litre Wet & Dry Vacuum Cleaner with Blower & HEPA Filter, 1600 Watts 100% Copper Motor, 28 KPa Suction with Washable dust Bag (Red/Black)",American,1,0,0,"7,486",4.2,799,24,"Sunday, February 13",1,799
112,B09LV8MBYS,"GOBBLER DustBuddy Pro Handheld Wireless Vacuum Cleaner, Light Weight and Durable Small Cordless Vacuum for Home, Office & Car (GB-51)",GOBBLER,0,0,0,"1,790",3.0,1,57,"Tuesday, February 8",1,1
113,B08WN3GJQG,"RitEmart Robotic Vacuum Floor Cleaner with UV Disinfects Lights for Home USB Rechargeable Dry Cleaning Sweeper for Tiles/Marble/Wooden Floor, High Suction Quiet Mini Sweeping Machine (Multicolour)",RitEmart,0,0,0,"2,499",1.3,4,69,"Wednesday, February 23",0,4
114,B08D9D98B1,"Tineco Floor One S3 Smart Cordless Broom Vacuum Cleaner, Wet and Dry Function, Double Tank, Self-Cleaning, LED Display, Application Control, Powerful, Light and Silent",Tineco,0,0,0,"27,900",4.3,79,53,"Sunday, February 13",1,79
115,B083P2P4TS,"WATERTECH SYSTEMS Professional Swimming Pool Flexible Weighted Vacuum Head Cleaner with Side And Bottom Brushes (14 Inch, Navy Blue)",WATERTECH,0,0,0,"1,410",4.1,69,46,"Monday, February 14",0,69
116,B09GJQ33RW,"Inalsa Robot Vacuum Cleaner Homeland Gyro- 4in1 Function|Vacuum,Scrub,Mop & Sweep|1800Pa Strong Suction,Smart Navigation & 7 Cleaning Modes| 120 Min Runtime, Alexa & Google Assistant Connectivity",Inalsa,0,0,0,"10,999",3.8,34,72,"Saturday, February 12",1,34
117,B081CJFTQT,"Eureka Forbes Wet and Dry Bold Vacuum Cleaner with 1400 Watts Powerful Suction and Blower, 20 litres Tank Capacity, Comes with Multiple Accessories (Blue), Standard",Eureka,0,0,0,"6,899",3.7,641,31,"Friday, February 11",1,641
118,B09NNS6GTX,Divyabhav® Vacuum Cleaner 120W High-Power Handheld Wireless 2 in 1 Vacuum Cleaner Dust Collection/Lighting Car Pet Hair Vacuum with Powerful Cyclonic Dual-use Portable USB Rechargeable (Black),Divyabhav®,0,0,0,999,0,0,50,"Sunday, February 13",1,"₹999
₹1,999 Save ₹1,000 (50%)"
