,asin,title,brand,Sponsored,Best Seller,Amazon's Choice,Price,Rating,NoofRatings,Discount,Delivery,Prime Delivery,base
253,B09CQBQRKJ,Men's Cotton Sleeveless Hooded Printed T-Shirt,Veirdo,0,0,0,199,3.0,4,83,,0,4
254,B07WRS2FXT,Men's Regular T-Shirt,Amazon Brand - Symbol,0,0,0,529,4.0,"6,122",75,,1,"6,122"
255,B08KTWJZFG,Men Polo,Allen Solly,0,0,0,629,4.1,265,48,,1,265
256,B014LBVGI8,Men's Plain Regular Fit T-Shirt,Tinted,0,0,0,549,4.0,659,31,,1,659
257,B073X4BMJR,Men's Regular T-Shirt,Amazon Brand - Symbol,0,0,0,369,4.0,"5,561",59,,0,"5,561"
258,B01HTCFOTS,Mens Polyester Printed Round Neck Short Sleeves Tshirt - Multicolour (CST188),wear your mind,0,0,0,799,1.0,1,50,,1,1
259,B09R7GZCQX,Oswal Garments Men's Regular Fit Camo Half Sleeves 100% Cotton Round Neck T-Shirts,ESCONE,0,0,0,599,0,0,37,,0,"₹599
₹949 Save ₹350 (37%)"
260,B07QD6T7CV,Men's Slim Fit T-Shirt,Maniac,0,0,0,350,4.0,257,67,,0,257
261,B082R8R6RJ,Men's Slim Fit T-Shirt,Maniac,0,0,0,393,3.8,166,67,,0,166
262,B09M44RM7X,Printed Cotton T-Shirt for Men Combo Pack of 2,Boodbuck,0,0,0,499,3.9,4,75,,1,4
263,B09GG63Y25,Better Basics Half Crew Printed T Shirt - (100% Guarantee if NOT satisfied)-Made in India,DAMENSCH,0,0,0,679,3.9,20,15,,1,20
264,B09QMG146G,Men T-Shirt (N704MT3_$P_Pack of 3),SHAUN,0,0,0,399,5.0,1,67,,1,1
265,B01MTCSBVX,Men's Solid Regular Fit T-Shirt,GRITSTONES,0,0,0,299,4.1,"2,611",60,,0,"2,611"
266,B08XXX4QPK,Regular Fit Men's Cotton T-Shirt(AMT2301-P),AELOMART,0,0,0,498,4.1,164,67,,0,164
267,B01LERJ1BG,Men's Regular Fit T-Shirt,AMERICAN CREW,0,0,0,802,3.8,703,46,,1,703
268,B08YYJQC6L,Mens Polo Neck Half Sleeve Pink Cotton T-Shirt,Classic Polo,0,0,0,629,3.8,24,10,,1,24
269,B08KTYMLPY,Men Polo,Allen Solly,0,0,0,659,4.2,296,45,,1,296
270,B08TC7GJX4,Regular Fit Cotton Blend Printed Men's T-Shirt,LEOTUDE,0,0,0,299,3.5,102,73,,0,102
271,B08SK3FCK9,Men T-Shirt,Red Tape,0,0,0,500,2.4,5,64,,1,5
272,B071J5S21R,Scott Men's Basic Cotton Round Neck Half Sleeve Solid T-Shirts - Pack of 2,Scott International,0,0,0,329,3.6,"2,423",82,,0,"2,423"
273,B07PCMTJBK,Men's Polyester Round Neck T-Shirts - Pack of 3,AWG ALL WEATHER GEAR,0,0,0,429,3.6,"3,496",82,,0,"3,496"
274,B07TFRGCVD,Men's Polo Collar T-Shirt,Deniklo,0,0,0,469,4.0,"2,916",61,,0,"2,916"
275,B08X7ZLGFB,Men's Regular T-Shirt,Adidas,0,0,0,699,3.9,49,50,,1,49
276,B07CQN23VG,Men's Plain Regular Fit T-Shirt,Chromozome,0,0,0,501,4.0,"4,373",28,,1,"4,373"
277,B08NVN4DWJ,Men's Gym Regular Fit Sports High Neck Full Sleeves T-Shirt,CHKOKKO,0,0,0,289,4.0,158,89,,0,158
278,B0793NHJZJ,Men's Regular fit T-Shirt,U.S. POLO ASSN.,0,0,0,549,3.8,"6,647",0,,0,"6,647"
279,B096VH3JTF,Men's Regular T-Shirt,Arrow,0,0,0,607,3.0,1,62,,1,1
280,B076T54DCF,Polo Collar Cotton Poly Striped T-Shirt for Men,AMERICAN CREW,0,0,0,612,4.0,"3,301",59,,1,"3,301"
281,B098TR46Z9,Men's Regular T-Shirt,Puma,0,0,0,599,3.8,17,60,,1,17
282,B08SBTSVJM,Men's Regular Fit T-Shirt (Pack of 3),fanideaz,0,0,0,949,3.8,146,73,,1,146
283,B07P82C3SQ,Men T-Shirt(134MTS4_P$_Pack of 4),SHAUN,0,0,0,799,4.2,118,68,,1,118
284,B098LBZJSS,Garfield: Don't Care Mens and Boys Graphic Printed Cotton T-Shirts Black,The Souled Store,1,0,0,629,5.0,3,30,,1,3
285,B095K132DW,Supima Cotton Half Sleeve Mens and Womens Solid Cotton T-Shirts,The Souled Store,1,0,0,839,3.6,35,44,,1,35
286,B08Y6T7XWC,Superman: Logo (Solar Activated) Mens and Boys Graphic Printed Cotton Full Sleeve T-Shirts Multi-Colored,The Souled Store,1,0,0,734,3.7,35,27,,1,35
287,B096Y2NV1T,Ghost Rider: The Spirit of Vengeance Mens and Boys Graphic Printed Cotton Drop Cut T-Shirts Black,The Souled Store,1,0,0,430,3.6,3,52,,0,3
288,B0861YS5XZ,Men's Polycotton Stylist Slim Fit Collar Neck Polo T-Shirt Combo Pack of 2,Wear Your Opinion,1,0,0,699,3.8,"2,780",65,,1,"2,780"
289,B098L9RX8S,Step Hem T-Shirt: Grey Melange Mens and Boys Solid Cotton Grey,The Souled Store,1,0,0,419,5.0,1,58,,0,1
290,B08HNCYYYJ,AWG Men's Cotton Regular Fit Solid Polo Neck T-Shirt,AWG ALL WEATHER GEAR,1,0,0,349,3.6,"6,845",77,,0,"6,845"
291,B096VD9GT1,Mortal Kombat: Scorpian Mens and Boys Graphic Printed Cotton T-Shirts Black,The Souled Store,1,0,0,420,4.0,1,53,,0,1
292,B08SBTSVJM,Men's Regular Fit T-Shirt (Pack of 3),fanideaz,0,0,0,949,3.8,146,73,,1,146
293,B07P82C3SQ,Men T-Shirt(134MTS4_P$_Pack of 4),SHAUN,0,0,0,799,4.2,118,68,,1,118
294,B08YYHKJ55,Mens Polo Neck Half Sleeve Musturd Cotton T-Shirt,Classic Polo,0,0,0,629,3.9,40,10,,1,40
295,B079118GCQ,Men's Solid Regular Fit T-Shirt,Jockey,0,0,0,409,4.3,219,21,,0,219
296,B073WC7L52,Men's Solid Regular Fit T-Shirt,Van Heusen Athleisure,0,0,0,494,4.1,"3,539",10,,1,"3,539"
297,B07L2J15BM,Plus Size Men's Regular Fit Polo,Bigbanana,0,0,0,699,4.1,"1,797",59,,1,"1,797"
298,B073FKXQ9H,Solid Men's Shawl Collar Regular Fit T-Shirt,EYEBOGLER,0,0,0,329,3.6,"10,633",77,,1,"10,633"
299,B07M7P388S,Tshirts for Men Man's Clothing Gents Stylish Tees Cotton Regular Branded T-Shirt Latest Collection Men's Cotton Half Sleeve Combo Pack Plain T-Shirt,STATUS MANTRA,0,0,0,209,3.6,36,87,,0,36
300,B09PNQZBGC,Men's Cotton Hooded Sweatshirt,ADRO,0,0,0,349,4.1,242,77,,0,242
301,B09BG8ZY3C,Men's Regular Polo Shirt,Levi's,0,0,0,629,4.2,44,55,,1,44
302,B08Z78PMJY,Men's Round Neck Full Sleeves Regular Dry Fit Gym Sports T-Shirt,CHKOKKO,0,0,0,332,3.9,830,80,,0,830
303,B00W066T66,Men's Gym Vest,Jockey,0,0,0,299,4.2,"7,517",17,,0,"7,517"
304,B08M9MXBB6,Men's Full Sleeve Regular Fit T-Shirt,Veirdo,0,0,0,199,4.1,169,83,,0,169
305,B00YUNH6VO,Men's Slim Fit T Shirt,Maniac,0,0,0,365,3.6,"2,165",57,,0,"2,165"
306,B07P66F2RT,Men's Polyester Round Neck T-Shirts - Pack of 3,AWG ALL WEATHER GEAR,0,0,0,449,3.4,"1,201",81,,0,"1,201"
307,B094CWJ8NT,"Men's Tie Dye Halfsleeve Round Neck Grey, Blue and Dgrey Cotton Tshirt",Maniac,0,0,0,331,4.4,16,77,,0,16
308,B095S3HK7M,Marvel: Vision of Hope Mens and Boys Graphic Printed Cotton T-Shirts Grey,The Souled Store,1,0,0,525,0,0,42,,1,"₹525
₹899 Save ₹374 (42%)"
309,B09KBZL9X9,Bottle Green Mens and Boys Solid Supima Cotton Full Sleeve Henley T-Shirts,The Souled Store,1,0,0,839,4.6,3,44,,1,3
310,B09JP5KZMM,Neon Orange Mens and Boys Solid Cotton Drop Cut T-Shirts,The Souled Store,1,0,0,524,0,0,42,,1,"₹524
₹899 Save ₹375 (42%)"
311,B098LBSYJ2,Garfield: Weekend Plans Mens and Boys Graphic Printed Cotton T-Shirts Blue,The Souled Store,1,0,0,734,4.4,9,18,,1,9
312,B07NQHCPWR,"Men's Stylish Full Sleeve Hooded T-Shirt (Grey, White, Black)",LEWEL,0,0,0,407,3.9,587,80,,0,587
313,B07NTPDGB7,Men's Slim Fit T-Shirt,Maniac,0,0,0,394,3.7,"1,029",61,,0,"1,029"
314,B07Y6LKMKV,Men's Regular Fit T Shirt (Pack of 2),AWG ALL WEATHER GEAR,0,0,0,349,3.5,"1,366",78,,0,"1,366"
315,B08THPGMNW,Men's Cotton Regular Fit Color Blocked Sleeveless T-Shirt,Veirdo,0,0,0,249,4.2,596,75,,0,596
316,B0819ZM8SV,Men's Printed Regular fit T-Shirt,U.S. POLO ASSN.,0,0,0,702,4.0,478,10,,1,478
317,B0831M2BDJ,Men's T-Shirt,SKYBEN,0,0,0,280,3.8,644,69,,1,644
318,B07SSW1NJC,Plus Size Men's Henley T-Shirt,Bigbanana,0,0,0,645,3.9,680,57,,1,680
319,B099FCWT3F,Men's Slim T-Shirt,Jack & Jones,0,0,0,269,3.5,28,78,,0,28
320,B09BJ7SCMC,Men's Navy Half Polo Neck T-Shirt,Austivo,0,0,0,485,3.7,9,73,,0,9
321,B0819ZKV4J,Men's Printed Regular fit T-Shirt,U.S. POLO ASSN.,0,0,0,699,4.0,"1,310",0,,1,"1,310"
322,B07RC1JWHK,Men's Solid Regular Fit Polo,Van Heusen Athleisure,0,0,0,899,4.1,"1,798",10,,1,"1,798"
323,B08P5SN3CJ,Men's Winter Wear Cotton High Neck Full Sleeves T-Shirt,CHKOKKO,0,0,0,645,3.9,839,77,,1,839
324,B073X1Q7HB,Men's Regular T-Shirt,Amazon Brand - Symbol,0,0,0,529,4.0,"10,842",75,,1,"10,842"
325,B099FC9WT5,Men's Slim T-Shirt,Jack & Jones,0,0,0,243,3.7,251,78,,0,251
326,B07NL7HD5H,Men's Regular Fit T-Shirt,Veirdo,0,0,0,249,4.1,"2,697",75,,0,"2,697"
327,B08Y56VDSM,Cotton Casual Printed Round Neck Full Sleeve Tshirts for Men,CHKOKKO,0,0,0,199,3.8,377,90,,0,377
328,B098TRZHQH,Men's Regular T-Shirt,Puma,0,0,0,524,0,0,65,,1,"₹524
₹1,499 Save ₹975 (65%)"
329,B07L6X2RN6,Men's Solid Slim fit T-Shirt,U.S. POLO ASSN.,0,0,0,"1,099",4.0,193,45,,1,193
330,B099QSKG86,Men's Regular T-Shirt,Amazon Brand - Symbol,0,0,0,359,0,0,74,,0,"₹359
₹1,398 Save ₹1,039 (74%)"
331,B09NNXL8Z8,Plus Size Men's Regular Fit Polo,Bigbanana,0,0,0,499,0,0,74,,1,"₹499
₹1,899 Save ₹1,400 (74%)"
332,B09QSXZWSG,0132 Regular Fit T-Shirts for Men,THE BLAZZE,0,0,0,299,0,0,63,,1,"₹299
₹799 Save ₹500 (63%)"
333,B07XJ4R2WB,Levi’s Men’s Ultra-Soft Cotton 300 LS Classic Round Neck T-Shirts (Pack of 2),Levi's,0,0,0,698,4.2,442,30,,1,442
334,B07YXJCTD7,Men's Regular fit T-Shirt,Jockey,0,0,0,429,4.2,135,14,,0,135
335,B08PSY32ZZ,Regular fit Solid Men's Henley Neck Full Sleeve Cotton Blend T Shirts,BLIVE,0,0,0,299,3.4,"3,482",79,,0,"3,482"
336,B07DDJD9HT,"Men's Black, Yellow, Grey Round Neck Full Sleeve Cotton T-Shirt",Urbano Fashion,0,0,0,359,4.0,"1,363",64,,0,"1,363"
337,B095CMZH8N,Men's Slim Fit Polo Collar Half Sleeve Solid Cotton White T-Shirt (PRISTO-White SF,Classic Polo,0,0,0,629,3.8,21,10,,1,21
338,B08RZJ5747,Men's Round Neck Full Sleeve T Shirt | (White),SWIFTLY,0,0,0,349,3.6,393,71,,0,393
339,B09RP66N4H,Dot Net Dri-Fit Full Sleeves Tshirt for Mens,FARROWX,0,0,0,299,5.0,1,50,,1,1
340,B09MB5FC3K,Men Batman: 3D Logo Black Printed Full Sleeve T-Shirts,The Souled Store,0,0,0,734,5.0,3,27,,1,3
341,B07XK9H5KF,Levi’s Men’s Ultra-Soft Cotton 300 LS Classic Round Neck T-Shirts (Pack of 1),Levi's,0,0,0,474,4.1,"1,102",5,,0,"1,102"
342,B073X2QWYT,Men's Regular Polo Shirt,Amazon Brand - Symbol,0,0,0,319,4.0,"7,879",68,,0,"7,879"
343,B07VY6XLD3,Men's Regular Fit T-Shirt,GRITSTONES,0,0,0,309,3.7,201,76,,0,201
344,B098LB68GL,Rick and Morty: Pickle Rick Mens and Boys Graphic Printed Cotton Oversized T-Shirts Multi-Colored,The Souled Store,1,0,0,735,3.4,5,43,,1,5
345,B095JZZS12,Supima Cotton Half Sleeve Mens and Womens Solid Cotton T-Shirts,The Souled Store,1,0,0,839,3.6,35,44,,1,35
346,B09DD4RQRT,Rust Red Mens and Boys Solid Supima Cotton Drop Cut T-Shirts,The Souled Store,1,0,0,839,5.0,2,44,,1,2
347,B09GFZBSV7,TSS: Follow Your Soul (Supima) Mens and Boys Graphic Printed Cotton Supima T-Shirts Blue,The Souled Store,1,0,0,642,0,0,29,,1,"₹642
₹899 Save ₹257 (29%)"
348,B0861Y3FGS,Men's Polycotton Stylist Slim Fit Collar Neck Polo T-Shirt Combo Pack of 2,Wear Your Opinion,1,0,0,699,3.8,"2,780",65,,1,"2,780"
349,B08HNCTPB5,AWG Men's Cotton Regular Fit Solid Polo Neck T-Shirt,AWG ALL WEATHER GEAR,1,0,0,349,3.6,"6,845",77,,0,"6,845"
350,B0793P1GQ3,Men's Regular fit T-Shirt,U.S. POLO ASSN.,1,0,0,478,3.8,"6,647",4,,1,"6,647"
351,B07QW95YJ2,Men's Polycotton Stylist Slim Fit Collar Neck Polo T-Shirt,Wear Your Opinion,1,0,0,379,3.9,"3,917",75,,0,"3,917"
352,B07VY6XLD3,Men's Regular Fit T-Shirt,GRITSTONES,0,0,0,309,3.7,201,76,,0,201
353,B08ZJ322PK,Men's Polo T-Shirt Regular Fit Half Sleeves with Pocket and Bottom Neck Collar for Casual and Daily Use.,SMAN,0,0,0,322,3.6,377,79,,1,377
354,B00JLJRCUW,Pume Men's T-Shirt,Puma,0,0,0,"1,092",4.2,322,71,,1,322
355,B07GNGG23G,Men’s Cotton Navy Blue Striped Polo T Shirt with Collar and Pocket,fanideaz,0,0,0,679,3.7,961,73,,1,961
356,B0995MPKZG,Men's Regular T-Shirt,Amazon Brand - House & Shields,0,0,0,289,4.0,163,64,,0,163
357,B072PZCK5W,Men's T-Shirt,United Colors of Benetton,0,0,0,350,3.9,10,75,,0,10
358,B08DG6SP5G,F.R.I.E.N.D.S: The Six Friends Mens and Womens Graphic Printed Cotton T-Shirt Navy Blue,The Souled Store,0,0,0,576,4.4,160,36,,1,160
359,B00SYP38CA,Polo Collar Half Sleeve T Shirt for Men,AMERICAN CREW,0,0,0,595,4.1,684,60,,1,684
360,B07PP7W9KZ,Men's Regular Fit Pyjama Top,U.S. POLO ASSN.,0,0,0,449,4.0,645,25,,0,645
361,B08NBV4R5Q,Men's T-Shirt,EYEBOGLER,0,0,0,299,3.6,368,77,,0,368
362,B08KTYQH36,Men Polo,Allen Solly,0,0,0,698,4.2,332,42,,1,332
363,B08CMSZHLX,Men's Classic Fit T-Shirt (Pack of 3),London Hills,0,0,0,674,3.8,698,83,,1,698
364,B01J3VFNT4,Men's Cotton Poly Blend Polo Regular Fit T-Shirt,AMERICAN CREW,0,0,0,802,4.1,"1,143",46,,1,"1,143"
365,B09FLC9QRN,Men's Combo Polo Neck Cotton Blend Solid T-Shirt (Pack of 2),INKKR,0,0,0,439,3.3,398,66,,0,398
366,B08SCDW7J8,"Men's Polo T-Shirt Regular fit, Polyester, Half Sleeve, with Pocket Combo Pack of 2 | Maroon, Sky-Blue |",SMAN,0,0,0,499,3.8,384,83,,1,384
367,B08CKZYDNP,Mens Cotton Hooded T-Shirt,Katso,0,0,0,299,3.8,649,71,,0,649
368,B091CPKHQB,Tan Stripes Mens and Boys Solid Cotton T-Shirts Multi-Colored,The Souled Store,1,0,0,629,0,0,37,,1,"₹629
₹999 Save ₹370 (37%)"
369,B09DD1SHY9,Mint Green Mens and Boys Solid Cotton Supima Drop Cut T-Shirts,The Souled Store,1,0,0,839,3.0,1,44,,1,1
370,B095K1VGB1,Supima Cotton Half Sleeve Mens and Womens Solid Cotton T-Shirts,The Souled Store,1,0,0,839,3.6,35,44,,1,35
371,B092L7XPG3,Superman & Darkseid - Arch-Nemesis Limited Collection Mens and Boys Graphic Printed Cotton T-Shirts Black,The Souled Store,1,0,0,434,0,0,52,,0,"₹434
₹899 Save ₹465 (52%)"
372,B0793LFJZM,US Polo Association Men's Regular fit T-Shirt,U.S. POLO ASSN.,0,0,0,448,4.0,"2,301",10,,0,"2,301"
373,B08X7ZLGH3,Regular Men's T Shirts,Adidas,0,0,0,700,4.1,89,50,,1,89
374,B09DYW8XMQ,Official Peanuts: Pawfect Mens and Boys Graphic Printed Cotton T-Shirts Pink,The Souled Store,1,0,0,629,5.0,3,30,,1,3
375,B08ZNG9YLJ,Supima Cotton Half Sleeve: Denim Blue Mens and Boys Solid Cotton T-Shirts,The Souled Store,1,0,0,734,3.6,10,51,,1,10
376,B0912RLG3D,Men's Polycotton Collar Neck Polo T-Shirt Combo Pack of 3,Wear Your Opinion,1,0,0,999,3.9,527,67,,1,527
377,B08SW5KJKX,Justice League: Logo Mens and Boys Graphic Printed Cotton Drop Cut T-Shirts Navy Blue,The Souled Store,1,0,0,734,4.0,442,18,,1,442
