,asin,title,brand,Sponsored,Best Seller,Amazon's Choice,Price,Rating,NoofRatings,Discount,Delivery,Prime Delivery,base
201,B0972XC62G,Tan Leather Men's Tri Fold RFID Blocking Wallet (IR3P-4),IMPERIOUS - THE ROYAL WAY,1,0,0,699,4.0,16,83,,1,16
202,B09RQQZ2PR,NKSK CRAFT Men's Stylish Pure Leather Wallet (Black),Generic,1,0,0,495,0,0,55,,1,"₹495
₹1,099 Save ₹604 (55%)"
203,B09F9TSD8H,Italian Brown Leather Unisex RFID Blocking Card Holder (IRS-5),IMPERIOUS - THE ROYAL WAY,1,0,0,799,3.8,9,73,,1,9
204,B07GK33337,Green Leather Men's Wallet (UBF130GRN1018),URBAN FOREST,0,0,0,494,4.2,"2,885",75,,0,"2,885"
205,B07WX7PYMJ,RFID Credit Card Holder Protector Stainless Steel Credit Card Wallet Slim RFID Metal Credit Card Case for Women or Men (Silver),OFIXO,0,0,0,279,4.0,"5,623",65,"Wednesday, February 16",1,"5,623"
206,B07JJ812H6,"Men's PU Leather Wallet, Multicolour",SAMTROH,0,0,0,189,3.8,14,81,,1,14
207,B00HZDZ0Q4,Chrome Tri-fold Blue Mens Wallet (8903338523505),Wildcraft,0,0,0,344,4.3,66,0,,0,66
208,B09FLCGDLZ,Personalized Custom Genuine Leather Wallet for Men with Name and Charm (Brown),The Bling Stores,0,0,0,449,3.6,58,10,,0,58
209,B07KT66DNR,Stealodeal RFID Blocking Automatic Pop-Up Money Holding Smart Pocket Aluminum Metal Front Pocket Wallet,Stealodeal,0,0,0,289,3.8,73,42,"Wednesday, February 16",1,73
210,B083ZFMP2C,Black Leather Men's Wallet (NPH013),NAPA HIDE,0,0,0,436,4.0,169,71,,0,169
211,B07ZPXW4KY,Unisex Leather RFID Blocking Card Holder Cum Minimalistic Wallet (Battle Green),HIDE & SKIN,0,0,0,557,4.1,"1,582",72,,1,"1,582"
212,B07YQ3VRRS,Black Synthetic Men's Wallet (2112957),Baggit,0,0,0,552,4.5,46,20,,1,46
213,B09NYGT2G7,Top Grain Portrait Leather Wallet for Men | Ultra Strong Stitching | Handcrafted | RFID Blocking | 2 ID Slots | 11 Card Slots | Zip Compartment,WildHorn,0,0,0,499,5.0,1,67,,1,1
214,B0954665VJ,"PU Leather Men's Belt & RFID Blocking Wallet Set, Brandy",Amazon Brand - Solimo,0,0,0,499,0,0,50,,1,"₹499
₹1,000 Save ₹501 (50%)"
215,B09JBPVV5J,"Personalized Wallet + Customized Keychain with Name Tag and Charms, Combo Valentines Day Gift Set for Men- Dark Brown",The Junket,0,0,0,999,5.0,2,5,,1,2
216,B07PRKBL18,RFID Protected Tan NDM Leather Wallet for Men|9 Card Slots| 1 Coin Pocket|6 Hidden Compartment|2 Currency Slots|1 ID Slot,HAMMONDS FLYCATCHER,0,0,0,393,4.1,84,75,,0,84
217,B085Y8WLTR,Genuine Leather Wallet for Men | Men's RFID Blocking Wallet (Brown),Contacts,0,0,0,"1,080",4.1,307,57,,1,307
218,B075V31WWL,Metal RFID Protected Pop Up Credit Debit Card Holder for Men Women - Black,SNDIA,0,0,0,379,3.9,"2,492",62,,0,"2,492"
219,B07MGBJXW7,Brown Leather Men's RFID Blocking Wallet (WLT_339_SA_BROWN_HUNTER),TEAKWOOD LEATHERS,0,0,0,499,3.9,76,71,,1,76
220,B07BTL9398,RFID Protected Wallet High Quality Genuine Leather Men's Wallet (857 Brown),mtuggar,0,0,0,590,4.3,"1,071",61,,1,"1,071"
221,B07N5J58S1,Tan PU Leather Men's Card Wallet,ZORO,0,0,0,165,3.9,53,87,,0,53
222,B09NY9LZPH,Card Holder Authentic Minimalist Metal RFID Blocking Wallet with Cash Strap Slim Wallet (COPOP14-NEW1 with Free Keyring)…,Contacts,0,0,0,699,3.8,57,61,,1,57
223,B09Q994NQ4,Steve Green RFID Blocking Leather Wallet for Men | Vertical Credit Debit Card Holder,HORNBULL,0,0,0,499,4.3,56,80,,1,56
224,B07DK8DXKL,Men's Artificial Leather Wallet(Tan),TnW,0,0,0,169,4.2,33,83,,0,33
225,B07NCKKPNN,Navy Leather Men's Wallet (8903496127461),Tommy Hilfiger,0,0,0,"1,450",4.3,46,50,,1,46
226,B07BXLSGQB,Black Ballistic Nylon Slim Classic Men'S Wallet-Black,DailyObjects,0,0,0,799,4.1,146,53,,1,146
227,B07RD7RL74,Grey Men's Wallet (WL-17),LORENZ,0,0,0,299,4.0,140,70,,0,140
228,B07MPXLH5Z,Teak RFID Blocking Leather Wallet for Men (TAN),GETOREE,0,0,0,580,4.2,656,71,,1,656
229,B07PQMZ18B,RFID Protected Prussian Blue Vintage Leather Wallet for Men|6 Card Slots| 1 Coin Pocket|2 Hidden Compartment|2 Currency Slots|1 ID Slot|Loop to Lock The Wallet.,HAMMONDS FLYCATCHER,0,0,0,431,4.2,169,73,,0,169
230,B07NCJJ2KX,Brown Leather Men's Wallet (8903496127768),Tommy Hilfiger,0,0,0,"2,173",4.4,66,34,,1,66
231,B08W2CJPFK,BLUSHD01 Blue Suade Leather Wallet for Men,GIOVANNY,0,0,0,339,3.9,125,79,,0,125
232,B07BFX86HG,"Bolt Men's Leather Slim Card Wallet, Latest Gents Purse for Card Holder, Gifts for Men - Navy",POLICE,0,0,0,899,4.2,42,53,,1,42
233,B09QSLYMBZ,"Card Case for AirTag Tag, Stainless Steel Card Size Wallet Case Holder for AirTag for Purse, Handbag, Backpack Wallet, Clutch, School Bag (Brushed Silver)",bracket,0,0,0,699,5.0,1,22,,1,1
234,B09N7B65KP,"9 Slot Pu Leather Credit Debit Zipper Card Holder Wallet for Men & Women - (11.5 X 9 x 3 cm, Black)",NISUN,0,0,0,599,3.9,854,70,,1,854
235,B09MCXBMXF,Levin Credit Card Holder Protector Stainless Steel Credit Card Wallet Slim RFID Metal Credit Card Case for Women or Men (RED ATM),Levin THE NEXT LEVEL IN OFFICE STATIONERY,0,0,0,250,4.8,11,75,,0,11
236,B09J3R97D4,Genuine Leather Men Modern and Stylish Wallet(CBWL4),Cabretta,1,0,0,499,0,0,50,,0,"₹499
₹999 Save ₹500 (50%)"
237,B09JWJ37Q4,"MBS - Mens Wallet Genuine Leather Bifold with ID Window, Card Holder Bill Slot & Coin Pocket | Stylish Slim and Light Weight Leather Wallet Form Men with Extra Storage Capacity - Black",Generic,1,0,0,499,5.0,1,44,,1,1
238,B09FK953DT,Combo Gift Set - Black Leather Global Coin Wallet + Black and Brown Reversible Leather Belt X-Large Size,Tommy Hilfiger,1,0,0,"4,099",5.0,1,32,,1,1
239,B09MRSSNFR,Genuine Leather Men Modern and Stylish Wallet(CBGWL10),Cabretta,1,0,0,499,0,0,64,,0,"₹499
₹1,399 Save ₹900 (64%)"
240,B09RQNG4RF,NKSK Craft Pure Leather Card Holder (Dark Brown),Generic,1,0,0,415,0,0,36,,1,"₹415
₹651 Save ₹236 (36%)"
241,B09RQNDJB4,NKSK Craft Mens Pure Leather Wallet (Black),Generic,1,0,0,479,0,0,52,,1,"₹479
₹999 Save ₹520 (52%)"
242,B09RQP4WQ5,NKSK CRAFT Men's Stylish Pure Leather Wallet (Brown),Generic,1,0,0,495,0,0,55,,1,"₹495
₹1,099 Save ₹604 (55%)"
243,B098S81HFV,Garnet Maroon Leather Men's Wallet (699709),WildHorn,1,0,0,490,4.2,"1,763",67,,0,"1,763"
244,B084ZZX3QH,Black & Tan Leather Unisex RFID Blocking Wallet (BLW002AAA),FASHION FREAK,0,0,0,699,3.9,950,59,,1,950
245,B09P3YXK7T,Men's Genuine Leather RFID Blocking Wallet | Round Zip Wallet (Brown),Generic,0,0,0,499,0,0,83,,1,"₹499
₹2,999 Save ₹2,500 (83%)"
246,B07QJXC63X,Jinbaolai Double Zipper Multipurpose Stylish Casual Artificial Leather Wallet for Men (Black),Kraptick,0,0,0,699,3.9,246,13,,1,246
247,B09LS9C867,Giftorious Customized Wallet for Men with Coin Pouch ( Olive Green ) - Best Gifts for Men,Generic,0,0,0,699,4.6,15,65,,0,15
248,B09PKN9BKT,Men Formal Cherry Artificial Leather Customized Wallet,Generic,0,0,0,299,0,0,70,,0,"₹299
₹999 Save ₹700 (70%)"
249,B093H7M7DR,Tan & Blue Leather Men's Wallet (8903496159646),Tommy Hilfiger,0,0,0,"1,985",4.5,35,34,,1,35
250,B084ZPSZXZ,Navy & White Leather Men's Wallet (8903496147544),Tommy Hilfiger,0,0,0,"2,122",4.2,25,29,,1,25
251,B07BXD8PS4,Black Ballistic Nylon Coin Classic Men's Wallet - Black,DailyObjects,0,0,0,549,4.2,79,68,,1,79
252,B0843CXZKT,GVN-BLU2LIN01 Blue Genuine Leather Wallet for Men,GIOVANNY,0,0,0,299,3.9,365,81,,0,365
253,B07FPKHTMS,Synthetic Men's Leather Wallet (Tan),Blissburry,0,0,0,182,3.8,"2,236",82,,1,"2,236"
254,B08BBXJ7P9,Geneva Leather Brown Credit Card Holder - Leather Wallet for Men & Mens Leather Wallet,HORNBULL,0,0,0,449,3.7,16,82,,0,16
255,B08JM65PVF,Black Leather Wallet for Men-WL,GANNET,0,0,0,179,3.8,137,82,,1,137
256,B099PZ41JG,Men's 2 Fold Wallet (Blue),Baggit,0,0,0,531,3.7,7,33,,1,7
257,B07BW2H8XX,Leather Men's Wallet (js007_Black),Jade Spade,0,0,0,523,3.7,912,67,,1,912
258,B00Q4NJKOY,Black Leather Men's Wallet (TW112LM1BK),TITAN,0,0,0,"1,315",4.4,486,25,,1,486
259,B07C3XX6WB,Tan Leather Men's Wallet (Woo-inn-BR53),Woodland,0,0,0,390,3.9,307,34,,0,307
260,B0972YD5ZV,Black Leather Men's Tri Fold RFID Blocking Wallet (IR3P-4),IMPERIOUS - THE ROYAL WAY,1,0,0,699,4.0,16,83,,1,16
261,B09D99RGXD,Leather Men's RFID Card Holder (010LW - BK),ARCADIO,1,0,0,"1,250",4.0,8,36,,1,8
262,B08M3F9QNM,"Blue Leather Magnet Money Clip Wallet and Card Holder for Men, Strong and Durable Wallet, 5 Slots",Adamis,1,0,0,"1,450",3.2,3,0,,1,3
263,B09QS561WS,Leather Wallet for Men | Black Mens Leather Wallet (RZWLT_NDMWOF_03),ROZET,1,0,0,449,0,0,78,,0,"₹449
₹1,999 Save ₹1,550 (78%)"
264,B078S6XQLW,"Bicast Leather Credit Card Holder Wallet 13 Card Slots & 2 Money Pocket for Men and Women (Brown,10.5x7.5x2.6 cm)",DAHSHA,0,0,0,395,4.1,954,78,,0,954
265,B07KXL1Q5Z,RFID Blocking Automatic Pop-Up Money Holding Smart Pocket Aluminum Metal Front Pocket Wallet Cardholder,Stealodeal,0,0,0,299,3.7,360,40,"Wednesday, February 16",1,360
266,B09MQYKCQJ,Genuine Leather Slim Wallet for Men | RFID Protection Minimal Thin Front Pocket Wallet Sleeve Card Holder for Men (Brown),Contacts,0,0,0,498,4.5,3,72,,0,3
267,B07PPFJT46,Puma Black Synthetic Men's Wallets-Woven(5358201_X_Puma Black),Puma,0,0,0,"1,049",4.0,403,65,,1,403
268,B07NYQYNVT,Leather Men's Wallet (5136ABDQ3_Brown),ABYS,0,0,0,236,3.8,617,70,,0,617
269,B0824S126B,Metal Slim Wallet Stylish Genuine Leather Wallets for Men Latest Gents Purse with Card Holder Compartment - Black,POLICE,0,0,0,949,4.2,49,47,,1,49
270,B07NYZYJH1,"11 Slot PU Leather Credit Zipper Card Holder Wallet Zipper Coin Purse for Men (Dark Brown,12x4x8cm)",Storite,0,0,0,699,3.8,200,72,,1,200
271,B07QYHQBGW,Gannet Leather Wallet for Men- Tan Wallets for Men,Generic,0,0,0,189,3.4,23,81,,1,23
272,B099PZGWLP,Blue Faux Leather Men's Wallet (2121553),Baggit,0,0,0,551,4.4,9,20,,1,9
273,B09HXYDRGB,Men's Bifold Genuine Leather Wallet | RFID Blocking Wallet for Men (Brown),Contacts,0,0,0,498,3.7,6,79,,0,6
274,B096VZDDZL,Oswald RFID Blocking Blue Leather Wallet for Men,URBAN FOREST,0,0,0,455,4.3,322,77,,0,322
275,B08VR5VX21,Coffee PU Leather Unisex Wallet (CC-HCCOLR-1),TASLAR,0,0,0,449,3.6,36,25,,0,36
276,B07HD1L9LV,Leather Wallet for Men | Men's Genuine Leather RFID Blocking Wallet (Brown),Contacts,0,0,0,897,4.1,902,64,,1,902
277,B07BXNBVMW,Black Ballistic Nylon Skinny Fit Card Wallet-Black,DailyObjects,0,0,0,449,3.7,72,33,,0,72
278,B07FHZD8Z1,Tan Leather Men's Wallet (783611160904),HIDE & SLEEK,0,0,0,319,4.0,210,75,,1,210
279,B07FL9RSHJ,RFID Protected Leather Brown Men's Wallet (WH1255 Crunch)…,WildHorn,0,0,0,449,4.1,"2,125",70,,0,"2,125"
280,B08WJ477GL,Tan Brown Leather Men's RFID Wallet (WLT_440_TAN),TEAKWOOD LEATHERS,0,0,0,549,4.4,18,66,,1,18
281,B01H7PG1SU,Multicolored Canvas Men's & Boy's Wallet (DESGINER BROWN-090),Shoprider,0,0,0,299,4.0,58,50,,1,58
282,B01H7PEJ0W,Multicolored Canvas Men's Wallet (DESGINER BROWN-721),Shoprider,0,0,0,299,4.1,69,50,,1,69
283,B09N977Q8V,RFID Protection PU Leather Credit Debit Card Holder Money Slim Zipper Wallet for Men & Women – (Coffee Brown-11 x 8 x 2.5Cm),Storite,0,0,0,599,4.0,1,70,,1,1
284,B08W1MHY6V,Green Leather Men's RFID Wallet (WLT_487_GREEN),TEAKWOOD LEATHERS,0,0,0,799,3.3,9,60,,1,9
285,B07DK5GW3M,Men's Brown Artificial Leather Wallet with Detachable Card Holder(7 Card Slots),TnW,0,0,0,172,4.1,252,86,,0,252
286,B09CV5ZVFQ,PU Leather 9 Slot Vertical Credit Debit Card Holder Money Wallet Zipper Coin Purse for Men Women (Tan),FUR JADEN,0,0,0,399,4.0,135,60,,0,135
287,B089VRGK9H,Boss Men's Leather Wallets with RFID (PT2978999_5-56_Navy/Black),POLICE,0,0,0,"1,139",4.5,64,68,,1,64
288,B0919SBPHT,"RFID Protected Brown Nappa Genuine Leather 6 Card Slots, 1 Coin Pocket, 4 Hidden Compartment, 2 Currency Slots, 3 ID Compartment, Men's Wallet",HAMMONDS FLYCATCHER,0,0,0,431,4.1,173,73,,0,173
289,B07CKH74Y8,"Purse for men, Gent wallet, Brown Color",Urban alfami,0,0,0,149,3.7,257,81,,0,257
290,B083TS3TK4,Napa Hide Blue Leather Men's Wallet (NPH),NAPA HIDE,0,0,0,440,3.9,175,71,,0,175
291,B07T8YF4MS,Marty Grey Leather Wallet + Pen + Keyring Combo Gift Set for Men,URBAN FOREST,0,0,0,563,4.1,168,72,,1,168
292,B072SQ5GB1,Brown Leather Men's Wallet & Belt Combo set (HBCM16BW6995),HORNBULL,0,0,0,898,4.1,"2,270",73,,1,"2,270"
293,B07HJ9QPNZ,Green Leather Men's Wallet (AC1458121_1-33),Cross,0,0,0,899,4.3,338,55,,1,338
294,B0897JLM7S,"SYALKA Slim and Sleek Minimalist PU Leather Lightweight ATM | Visiting | Credit | Debit Card Holder Wallet, Megnatic Closing System with RFID Blocking for Mens & Womens (Black)",Generic,0,0,0,198,3.9,74,49,"Thursday, February 17",1,74
295,B079XX7MRD,Black Synthetic Men's Wallet (PW4),Swiss Military,0,0,0,"1,065",3.7,206,23,,1,206
296,B09Q2X8ZKF,"Genuine Leather RFID Blocking Wallet for Men, Bifold Men's Leather Wallet with Detachable Card Case Including Zipper Coin Pocket | 2 ID Windows (14 Card Slots)",FOXHACKLE,1,0,0,899,0,0,31,,1,"₹899
₹1,299 Save ₹400 (31%)"
297,B09J3QKKV9,Genuine Leather Men Modern and Stylish Wallet(CBWL2),Cabretta,1,0,0,399,0,0,50,,0,"₹399
₹799 Save ₹400 (50%)"
298,B09CNVTB6X,Brown Genuine Hunter Leather Wallet for Men with ATM Card Wallet Men's Wallet Purse,Addition,1,0,0,599,4.6,3,50,,1,3
299,B09FK8TNDD,Combo Gift Set - Black Leather Global Coin Wallet + Black and Tan Reversible Leather Belt X-Large Size,Tommy Hilfiger,1,0,0,"4,099",4.0,1,32,,1,1
300,B08R5VSGR4,Brown Leather Men's Wallet (WB-WAL004),WILDBISON,1,0,0,499,4.1,11,50,,0,11
301,B07PLHDW22,Brown Leather Men's Wallet (Wallet Brown 3 Fold),ESSEMM,1,0,0,475,4.1,495,60,,1,495
302,B09RQP17WR,NKSK Craft Mens Pure Leather Wallet (Brown),Generic,1,0,0,479,0,0,52,,1,"₹479
₹999 Save ₹520 (52%)"
303,B07W425LT2,Royster Callus Brown Leather Men's Wallet (RCW1022-2),Royster Callus,1,0,0,399,3.7,305,73,,0,305
304,B078NCMKN8,Navy Men's Wallet (8903496110494),Tommy Hilfiger,0,0,0,"1,550",4.4,100,50,,1,100
305,B07NJ41FPC,Maddison Men's Brown Genuine Leather Wallet,HORNBULL,0,0,0,399,4.1,"5,215",84,,0,"5,215"
306,B09FDS4HXK,Brown & Black Leather Men's Wallet Gift Set,Allen Solly,0,0,0,999,4.0,2,41,,1,2
307,B09M7GS1PJ,Gannet Dark Brown Leather Wallet for Men,Generic,0,0,0,189,3.9,408,89,,1,408
308,B072FV7PX3,Burgundy Leather Men's Wallet (TW102LM2BY),TITAN,0,0,0,"1,399",4.2,177,20,,1,177
309,B08JM511WX,Genuine Leather Men Wallet||ATM Card Case||Money Purse||Card Holder with Zip Closure (Tan-HJ),ABYS,0,0,0,473,4.0,"1,643",64,,0,"1,643"
310,B07RF93LMY,Black Men's & Boy's Wallet (WL-18),LORENZ,0,0,0,299,4.1,60,70,,0,60
311,B085R8WW1K,Erie men's Leather Tri-Fold Wallet -Black,Cross,0,0,0,"1,149",5.0,3,45,,1,3
312,B084BW7DGW,Brown Leather Wallet for Men,GANNET,0,0,0,199,4.1,114,80,,1,114
313,B09Q2X8ZKF,"Genuine Leather RFID Blocking Wallet for Men, Bifold Men's Leather Wallet with Detachable Card Case Including Zipper Coin Pocket | 2 ID Windows (14 Card Slots)",FOXHACKLE,0,0,0,899,0,0,31,,1,"₹899
₹1,299 Save ₹400 (31%)"
314,B07SGDTC3Q,Black Unisex RFID Protected Minimalistic Metal Wallet(2-Pack),HIDE & SKIN,0,0,0,557,4.2,750,54,,1,750
315,B0957SCDD8,Personalized Custom Genuine Leather Wallet for Men with Name and Charm (HB-WL-0070 Black),The Bling Stores,0,0,0,499,4.1,18,38,,0,18
316,B089T8YFRT,Autumn-Winter 20 Black Polyester Unisex Wallet (5405301_Black_X),Puma,0,0,0,574,4.1,27,56,,1,27
317,B07DHT7FCT,Brown PU Artificial Leather Men's Wallet (ZR-ALW-6R),ZORO,0,0,0,139,4.1,243,86,,0,243
318,B07RQGQMMS,"Branded Stylish Men's PU Leather Wallet, Purse (Black)",SAMTROH,0,0,0,189,4.0,16,81,,1,16
319,B08T6H4MFC,Black Men's Wallet,MINISO,0,0,0,460,4.1,18,8,,1,18
320,B09PGD5D5N,Top Grain Leather Wallet for Men | Ultra Strong Stitching | Handcrafted | RFID Blocking | Zip Wallet with 9 Card Slots | 2 ID Slots (Green Hunter),WildHorn,1,0,0,499,3.0,3,83,,1,3
321,B09RRHVKFC,NKSK Craft Men's RFID Blocking Leather Wallet for Men (Black),Generic,1,0,0,431,0,0,52,,1,"₹431
₹899 Save ₹468 (52%)"
322,B096S9WV6Q,Vintage Navy Leather Men's Wallet (IRBC-1),IMPERIOUS - THE ROYAL WAY,1,0,0,799,3.9,10,80,,1,10
323,B09D9B8TZL,Leather Men's RFID Card Holder (010LW - CO),ARCADIO,1,0,0,"1,250",4.0,8,36,,1,8
324,B07Z87VQBY,Autumn-Winter Brown Leather Men's Wallet (8903439772031),Hidesign,0,0,0,"1,256",5.0,6,30,,1,6
325,B00ZDZ6KFQ,"Men's Leather Wallet (LW-19, Brown Color)",Swiss Military,0,0,0,880,4.3,55,41,,1,55
326,B09NBLC8YM,"10 Slot PU Leather Credit Debit Zipper Card Holder Wallet with Cash & Coin Pocket for Men & Women (12 X 9 X 3 cm, Chocolate Brown)",DAHSHA,0,0,0,498,4.0,2,67,,0,2
327,B097T7JDTB,Men's Western (Brown),Van Heusen,0,0,0,908,0,0,39,,1,"₹908
₹1,499 Save ₹591 (39%)"
328,B082SSCG3W,Men's Genuine Leather RFID Blocking Wallet (Brown),Contacts,0,0,0,897,3.7,272,64,,1,272
329,B08JD2JG8Z,Men's RFID Protected Genuine Leather Wallet Keychain and Pen Combo (BLUE83),WildHorn,0,0,0,630,4.2,"6,796",68,,1,"6,796"
330,B07BYJK2LR,Black Men's Wallet Stylish Genuine Leather Wallets for Men Latest Gents Purse with Card Holder Compartment (AC948008_2-1),Cross,0,0,0,"1,199",4.3,38,56,,1,38
331,B086B1BQLZ,Leather Men's Wallet (Black),Tommy Hilfiger,0,0,0,"1,999",4.4,112,9,,1,112
332,B09MC2GR3Q,Bi Fold & Light Weight Leather Men's Stylish Casual Wallet Purse with Card Holder Compartment (Brown),Allen Solly,0,0,0,699,5.0,1,46,,0,1
333,B083RX2CLS,Synthetic Men's Wallet (CHAIN_Camouflage),DESIGNER BUGS,0,0,0,269,3.9,278,79,,1,278
334,B07HJ9MYCL,Black Men's Wallet Stylish Genuine Leather Wallets for Men Latest Gents Purse with Money Coin and Card Holder Compartment (AC1458072_1-1),Cross,0,0,0,"1,099",4.1,46,54,,1,46
335,B082P13778,Men's RFID Protected Leather Wallet (Green Hunter),WildHorn,0,0,0,480,4.0,92,68,,0,92
336,B0998KNPSC,"RFID Blocking Tri Fold Leather Wallet for Men Napa Black ( 4 Card Slots, 2 Currency Slots, 2 Hidden Compartment, 1 ID Slot )",Husk N Hoof,0,0,0,679,3.8,16,48,,1,16
337,B08LL96Q47,Genuine Leather RFID Protected Premium Oliver Brown Wallet for Unisex….(WTRIFOLD-BB),LEADERACHI,0,0,0,397,3.8,"1,077",80,,0,"1,077"
338,B086C7X41H,Florence RFID Blocking Leather Wallet for Men (Blue),GETOREE,0,0,0,580,3.9,51,72,,1,51
339,B01MCYCGOY,Black Leather Unisex RFID Blocking Wallet (BLCH002),FASHION FREAK,0,0,0,399,4.0,"1,527",77,,0,"1,527"
340,B09FKB3MGV,Combo Gift Set - Leather Global Coin Wallet + Card Holder + Key Fob with Hilfiger Embossing Across Everywhere Navy Color (TH/BRIAN/WALL/CC/KF/08),Tommy Hilfiger,0,0,0,"2,539",4.3,7,40,,1,7
341,B0987XM1FS,Personalized RFID Wallets for Men - Custom Photo on Man Made Leather Purse Birthday Gift for Men (Tan),GFTBX,0,0,0,699,4.3,418,42,,1,418
342,B09BB5JS7K,Artificial Leather Wallet (Black),TnW,0,0,0,179,4.7,15,85,,0,15
343,B07RBB34HQ,Drogon Brown Printed RFID Blocking Leather Wallet for Men,URBAN FOREST,0,0,0,497,4.3,547,75,,0,547
344,B09549DSKS,"PU Leather Men's Belt & RFID Blocking Wallet Set, Charcoal Black",Amazon Brand - Solimo,0,0,0,449,0,0,55,,1,"₹449
₹1,000 Save ₹551 (55%)"
345,B08KSM1ZBD,Brown Leather Men's Wallet (USAW0061),US Polo Association,0,0,0,796,4.2,14,28,,1,14
346,B0933JZV5K,"Jaxen Mens Passcase Wallet Black/Navy (8903496156980), (11.5X2.5X9.5)cm",Tommy Hilfiger,0,0,0,"1,551",0,0,53,,1,"₹1,551
₹3,299 Save ₹1,748 (53%)"
347,B09MG75LZ6,Joseph Navy RFID Blocking Leather Wallet for Men,HORNBULL,0,0,0,449,4.3,346,82,,0,346
348,B093H527N6,Brown Leather Men's Wallet (8903496160598),Tommy Hilfiger,0,0,0,"1,623",4.6,51,44,,1,51
349,B089T8KTY5,Blue Polyester Unisex Wallet (5405103_Blue_X),Puma,0,0,0,499,4.1,32,62,,1,32
350,B00V3BYY4I,"Leather Men's Wallet (UBF101DBL1005_Transparent, Dark Blue & Black)",URBAN FOREST,0,0,0,449,4.2,"5,894",78,,0,"5,894"
351,B08HRWDPR2,"PU Leather Steel Business Visiting Credit Debit Card Holder Wallet for Men & Women (Black, 10 x 6 x1.4 cm)",Storite,0,0,0,299,4.1,125,70,,0,125
352,B099Q14DMR,Men's 3 Fold Wallet (Yellow),Baggit,0,0,0,456,5.0,1,34,,0,1
353,B09J2CV166,Slim Wallet for Men Leather (Brown),GlidingGear Co.,0,0,0,"1,149",5.0,2,32,,0,2
354,B07THDR6WW,"Men's Hunter Leather RFID Blocking Wallet, Big Size (Brown)",Goatter,0,0,0,"1,100",3.9,341,63,,1,341
355,B097YDHM3M,"WildHornGift Hamper for Men - Classic Men's Combo/Gift Set of Leather Wallet, Keyring & Pen",WildHorn,0,0,0,749,4.2,158,63,,1,158
356,B098QB3TN1,Hunter Blue Leather Men's Wallet (WH1173),WildHorn,1,1,0,455,4.0,"16,089",82,,0,"16,089"
357,B08YNQ7SRZ,RFID Protected Genuine Leather Tri-Fold Wallet with Ten Card Slots and a Coin Pocket for Men (Vintage Brown),ANNODYNE,1,0,0,799,4.3,83,64,,0,83
358,B0965RMTM8,Leather Travel Passport Holder Wallet for Men and Women (PC3),Cabretta,1,0,0,499,0,0,62,,0,"₹499
₹1,299 Save ₹800 (62%)"
359,B09J3PRLH1,Genuine Leather Men Modern and Stylish Wallet(CBWL1),Cabretta,1,0,0,399,0,0,60,,0,"₹399
₹999 Save ₹600 (60%)"
360,B081CYGP28,Brown Leather Men's Wallet (654695),WildHorn,1,0,0,455,4.0,"22,534",70,,0,"22,534"
361,B092JG3GQ2,Men's Pure Leather Tri-Fold Wallet with Card Holder | Advanced RFID Shield Technology | Standard Quality (Olive Green Combo),Corvo,1,0,0,499,4.1,6,71,,1,6
362,B08ZYPF1S2,Men's Bi- Fold Leather Wallet (Trendy Tan),DENZO,1,0,0,699,3.8,12,30,,1,12
363,B098XNQXD6,Imperious RFID Protected Genuine Leather Wallet for Men (Navy),IMPERIOUS - THE ROYAL WAY,1,0,0,699,3.4,9,83,,1,9
364,B07DXQH5VT,RFID Blocking Leather Bifold Credit Card Holder Wallet for Men Women Hunter Brown,Husk N Hoof,0,0,0,489,3.8,114,62,,0,114
365,B094HXQQ33,"Premium Bifold Full Grain Genuine Leather Handmade Money Clip Wallet for Men (Oil Pull Up Leather + RFID, Oil Pull UP Brown 1)",Brooklyn Bridge,0,0,0,844,4.2,10,54,,1,10
366,B093H5Q529,Tan Leather Men's Wallet,Tommy Hilfiger,0,0,0,"1,650",4.4,45,50,,1,45
367,B09FF97GV5,Tan Leather Men's Wallet Gift Set,Allen Solly,0,0,0,999,5.0,1,41,,1,1
368,B07D9LVRN9,"NISUN PU Leather Pocket Sized Business/Credit/ATM Card Holder Case Wallet with Magnetic Shut for Men & Women (Brown,9.5 X 6.5 X 1.5 cm)",NISUN,0,0,0,299,4.2,"1,250",70,,0,"1,250"
369,B09BNKGM3H,Hunter Brown Leather Unisex Wallet (RBXCH3HB),SKiDE,0,0,0,499,4.2,130,69,,1,130
370,B098K8BJNY,"8 Slot Metal RFID Blocking Credit / Debit Card Holder Wallet for Men & Women (9.5cm x 6.7cm x 1.5cm, Black)",NISUN,0,0,0,399,4.1,151,73,,0,151
371,B00SGLSDYU,Black Polypropylene Men's Wallet (7322101),Puma,0,0,0,0,3.1,56,0,,0,56
372,B07XCLWK9Q,Brown Leather Unisex Wallet And Card Case (UBF000DVC4050),URBAN FOREST,0,0,0,"1,362",4.4,101,55,,1,101
373,B07PF3Q8SJ,Blue Ballistic Nylon Coin Classic Billfold Wallet for Men,DailyObjects,0,0,0,599,3.9,47,54,,0,47
374,B09FKCQJC5,Combo Gift Set - Leather Global Coin Wallet + Card Holder + Key Fob Navy Color (TH/STALIN/WALL/CC/KF/08),Tommy Hilfiger,0,0,0,"2,549",5.0,1,39,,1,1
375,B08CBBWMD2,Pyramid Slim Leather Wallet For Men - Black,POLICE,0,0,0,999,4.3,63,55,,1,63
376,B08W8W6GC2,Black Leather Unisex Wallet (SBBLFW),Shutterbugs,0,0,0,99,3.5,11,80,,0,11
377,B092SFVP17,"Men Black Leather Wallet, One Size (RWL400)",Red Tape,0,0,0,628,5.0,2,65,,1,2
378,B07WL2Z2VG,Black Men's Wallet (RCW1017),Royster Callus,0,0,0,328,3.9,108,79,,0,108
379,B09HMKGQFD,Credit/Debit Card Holder 11 Slot PU Leather Small Zipper Wallet for Men & Women (Unique-Brown),Generic,0,0,0,369,4.4,10,75,,0,10
380,B09RRZL6G7,NKSK Craft Men's RFID Blocking Leather Wallet for Men (Black),Generic,1,0,0,431,0,0,52,,1,"₹431
₹899 Save ₹468 (52%)"
381,B09NKRWXR8,Greens Inc Black Leatherette All Occasional Casual Men Wallet Purse (Pack of 1) (Tan),Generic,1,0,0,329,1.0,1,45,,1,1
382,B09FK8JZ53,Combo Gift Set - Black Leather Global Coin Wallet + Black and Brown Reversible Leather Belt X-Large Size,Tommy Hilfiger,1,0,0,"4,099",5.0,2,32,,1,2
383,B098R44G4G,Imperious Mens Leather Wallet | Stylish Leather Wallet for Mens | RFID Blocking Genuine Leather Mens Wallet,IMPERIOUS - THE ROYAL WAY,1,0,0,799,0,0,80,,1,"₹799
₹3,999 Save ₹3,200 (80%)"
384,B07DS8V2VX,Bi-Fold Cherry Color Faux-Leather Wallet for Men/Boys with Multiple Card Slots(Color-Cherry||WL-052),CREATURE,0,0,0,279,4.1,144,79,,1,144
385,B082X1W7QY,Army Green & Black Leather Men's Wallet (PT038),POLICE,0,0,0,849,4.3,45,53,,1,45
386,B09FKB4S35,Combo Gift Set - Tan Leather Multicard Coin Wallet + Black and Tan Reversible Leather Belt X-Large Size,Tommy Hilfiger,1,0,0,"4,099",0,0,32,,1,"₹4,099
₹5,999 Save ₹1,900 (32%)"
387,B07KG3G57V,RFID Protected Genuine Leather Tri-Fold Wallet with Ten Card Slots and a Coin Pocket for Men (Dark Brown),ANNODYNE,1,0,0,749,4.3,83,66,,0,83
388,B0965TJ28V,Leather Travel Passport Holder Wallet Credit Debit Card Holder Organizer for Men and Women (PC2),Cabretta,1,0,0,499,0,0,67,,0,"₹499
₹1,499 Save ₹1,000 (67%)"
389,B086D718GC,Florence RFID Blocking Leather Men's Wallet (Brown),GETOREE,1,0,0,580,4.1,48,72,,1,48
