,asin,title,brand,Sponsored,Best Seller,Amazon's Choice,Price,Rating,NoofRatings,Discount,Delivery,Prime Delivery,base
257,B07NL7HD5H,Men's Regular Fit T-Shirt,Veirdo,0,0,0,249,4.1,"2,697",75,,0,"2,697"
258,B096VY54JT,Men's Slim Polo,Integriti,0,0,0,169,3.8,124,88,,0,124
259,B09BJ7SCMC,Men's Navy Half Polo Neck T-Shirt,Austivo,0,0,0,485,3.7,9,73,,0,9
260,B099FDZHGB,Men's Slim T-Shirt,Jack & Jones,0,0,0,198,3.0,2,80,,0,2
261,B08NBV4R5Q,Men's T-Shirt,EYEBOGLER,0,0,0,299,3.6,368,77,,0,368
262,B081B1B1S3,Men's Printed Regular fit T-Shirt,U.S. POLO ASSN.,0,0,0,699,4.0,"1,310",0,,1,"1,310"
263,B09LH5WCD9,Men T-Shirt Camo Box,Puma,0,0,0,599,4.0,37,60,,1,37
264,B099FBK629,Men T-Shirt,Jack & Jones,0,0,0,254,0,0,80,,0,"₹254
₹1,299 Save ₹1,045 (80%)"
265,B09RK4PMBZ,Color Block Men Round Neck Sports T-Shirt (Pack of 3),London Hills,0,0,0,449,0,0,88,,0,"₹449
₹3,897 Save ₹3,448 (88%)"
266,B083V1WTT3,Men's Plain Regular Fit T-Shirt,Cazibe,0,0,0,331,3.8,706,78,,0,706
267,B01HTCHPVI,Men's Regular Fit T-Shirt,wear your mind,0,0,0,499,0,0,55,,1,"₹499
₹1,099 Save ₹600 (55%)"
268,B097DYCH7T,Men's Regular Fit AS M NK DF SUPERSET TOP SS,Nike,0,0,0,613,3.8,51,64,,1,51
269,B09GG4B4L3,Better Basics Half Crew Solid T Shirt - (100% Guarantee if not Satisfied)- Made in India,DAMENSCH,0,0,0,479,4.1,100,20,,0,100
270,B083F47Q6N,Men's Regular Polo Shirt,Amazon Brand - Symbol,0,0,0,329,3.8,881,59,,0,881
271,B08WQ35F73,Typography Men's Cotton Round Neck Full Sleeve Printed Respect T-Shirt,JUGULAR,0,0,0,299,4.0,73,66,,0,73
272,B095HZ4SVM,Men's Regular T-Shirt,Fusefit,0,0,0,207,5.0,2,84,,0,2
273,B09PBKS6M6,Regular Fit Full Sleeve T Shirt for Men,LEOTUDE,0,0,0,299,3.3,35,73,,0,35
274,B0876SW6DK,Men's Regular T-Shirt,Max,0,0,0,309,3.7,37,11,,0,37
275,B08RZJ5747,Men's Round Neck Full Sleeve T Shirt | (White),SWIFTLY,0,0,0,349,3.6,393,71,,0,393
276,B09CZ6RMHG,Regular Fit Half Sleeve Men's T-Shirt (Pack of Two),LEOTUDE,0,0,0,279,3.6,81,75,,0,81
277,B08HLPZLDR,Men's Regular T-Shirt,Amazon Brand - Symactive,0,0,0,329,4.5,35,67,,0,35
278,B083V2VJ2R,Men's T-Shirt,Cazibe,0,0,0,826,4.0,106,59,,1,106
279,B0842HDPVX,Men's Regular Fit T-Shirt,Jockey,0,0,0,649,4.2,"1,047",0,,1,"1,047"
280,B096VHR4GX,Men's Regular T-Shirt,Arrow,0,0,0,607,3.0,1,62,,1,1
281,B01LERJ724,Men's Regular Fit T-Shirt,AMERICAN CREW,0,0,0,802,3.8,703,46,,1,703
282,B08FTCCNQV,Spider-Man: The Suit Mens Graphic Printed Cotton Drop Cut T-Shirt Red,The Souled Store,0,0,0,649,4.3,176,78,,1,176
283,B08Y55SNNG,Mens Regular Fit Printed Cotton Polo Tshirt/Collared Tshirt,BULLMER,0,0,0,439,3.5,13,56,,0,13
284,B0964Z3PNN,Marvel: Wanda Vision Mens and Boys Graphic Printed Cotton T-Shirts Black,The Souled Store,1,0,0,420,5.0,1,53,,0,1
285,B08Y6T7XWC,Superman: Logo (Solar Activated) Mens and Boys Graphic Printed Cotton Full Sleeve T-Shirts Multi-Colored,The Souled Store,1,0,0,734,3.7,35,27,,1,35
286,B09BZZF8F5,100% Cotton Polo T Shirt for Men,PRINTOCTOPUS,1,0,0,798,0,0,50,,1,"₹798
₹1,599 Save ₹801 (50%)"
287,B0974PDCDQ,Supima Cotton Mens and Boys Solid Cotton Drop Cut T-Shirts,The Souled Store,1,0,0,839,4.2,12,44,,1,12
288,B098TNMNKQ,WWE: Triple H The King's Skull Mens and Boys Graphic Printed Cotton T-Shirts Black,The Souled Store,1,0,0,382,5.0,6,58,,0,6
289,B09RPHLB6Q,Men's 100% Cotton T-Shirts,TRU-TEES,1,0,0,499,0,0,62,,0,"₹499
₹1,299 Save ₹800 (62%)"
290,B08662V8WL,Men's Slim Fit Polo T-Shirt,Alan Jones Clothing,1,0,0,419,4.0,856,58,,0,856
291,B0974MZ1DF,Supima Cotton Mens and Boys Solid Cotton Drop Cut T-Shirts,The Souled Store,1,0,0,839,4.2,12,44,,1,12
292,B096VHR4GX,Men's Regular T-Shirt,Arrow,0,0,0,607,3.0,1,62,,1,1
293,B01LERJ724,Men's Regular Fit T-Shirt,AMERICAN CREW,0,0,0,802,3.8,703,46,,1,703
294,B08FTCCNQV,Spider-Man: The Suit Mens Graphic Printed Cotton Drop Cut T-Shirt Red,The Souled Store,0,0,0,649,4.3,176,78,,1,176
295,B08Y55SNNG,Mens Regular Fit Printed Cotton Polo Tshirt/Collared Tshirt,BULLMER,0,0,0,439,3.5,13,56,,0,13
296,B07B2WLLV1,Men's Regular Fit T-Shirt,Maniac,0,0,0,217,4.0,"1,489",79,,0,"1,489"
297,B098TYXVXH,Mens Cotton Half Sleeve Branded Polo T Shirt with Collar,fanideaz,0,0,0,499,3.9,111,80,,1,111
298,B08KTWJZFG,Men Polo,Allen Solly,0,0,0,629,4.1,265,48,,1,265
299,B08KTYMLPY,Men Polo,Allen Solly,0,0,0,659,4.2,296,45,,1,296
300,B09797GWKP,Men's Regular T-Shirt,Amazon Brand - Inkast Denim Co.,0,0,0,299,4.0,28,63,,0,28
301,B082XVPSSD,Men's Regular Fit T-Shirt,AMERICAN CREW,0,0,0,802,4.1,232,68,,1,232
302,B08XW1CQL2,Men's Solid Cotton Round Neck Regular Fit Half Sleeves T-Shirt,CHKOKKO,0,0,0,199,4.0,688,90,,0,688
303,B08N5957JM,Men's Regular Fit Polo T-Shirt,Peppyzone,0,0,0,399,4.0,123,67,,0,123
304,B07911VHLV,Men's Solid Regular Fit T-Shirt,Jockey,0,0,0,409,4.3,219,21,,0,219
305,B07XK9H5KF,Levi’s Men’s Ultra-Soft Cotton 300 LS Classic Round Neck T-Shirts (Pack of 1),Levi's,0,0,0,449,4.1,"1,101",10,,0,"1,101"
306,B014LBVGI8,Men's Plain Regular Fit T-Shirt,Tinted,0,0,0,549,4.0,659,31,,1,659
307,B07HQP22DC,Men's Regular Fit T Shirt,THE ARCHER,0,0,0,299,3.8,117,70,,0,117
308,B09D38XT36,Mens Regular Fit Cotton Striped Polo Tshirt/Collared Tshirt - Yellow,BULLMER,1,0,0,439,3.8,35,56,,0,35
309,B098LCF1R9,Rick and Morty: Get Schwifty Mens and Boys Graphic Printed Cotton Oversized T-Shirts Multi-Colored,The Souled Store,1,0,0,944,4.9,4,27,,1,4
310,B09FLMM937,Mushroom Mens and Boys Solid Cotton Supima Drop Cut T-Shirts,The Souled Store,1,0,0,839,0,0,44,,1,"₹839
₹1,499 Save ₹660 (44%)"
311,B096Y4ZJL4,Loki: for President! Mens and Boys Graphic Printed Cotton T-Shirts Black,The Souled Store,1,0,0,629,4.7,6,30,,1,6
312,B0892TL8C1,Men's Regular Fit T-Shirt (Pack of 3),BULLMER,0,0,0,589,3.7,381,61,,1,381
313,B08RRTCM9N,Captain America: The First Avenger Mens and Boys Graphic Printed Cotton Full Sleeve T-Shirts Multi-Colored,The Souled Store,0,0,0,629,4.0,82,37,,1,82
314,B086HX51HN,Men's Regular Fit T-Shirt,SKYBEN,0,0,0,280,3.8,371,69,,1,371
315,B08X4WC1GN,Mens Regular Fit Printed Cotton Collared Tshirt/Polo Tshirt,BULLMER,0,0,0,439,3.6,80,56,,0,80
316,B08JHX6F6W,"Men's Round Neck Full Sleeves Tshirt Navyblue,Maroon,Grey (Pack of 2)",BLIVE,0,0,0,472,3.8,480,76,,0,480
317,B0769YLJPS,Men’s Cotton Full Sleeve High Neck T-Shirt,DENIMHOLIC,0,0,0,549,3.8,571,63,,1,571
318,B07CQN23VG,Men's Plain Regular Fit T-Shirt,Chromozome,0,0,0,501,4.0,"4,373",28,,1,"4,373"
319,B08Y56VDSM,Cotton Casual Printed Round Neck Full Sleeve Tshirts for Men,CHKOKKO,0,0,0,199,3.8,377,90,,0,377
320,B08XQTSYFF,Men's Regular Polo Shirt,Van Heusen,0,0,0,618,4.0,497,48,,1,497
321,B07DL8YF6J,Men's Regular Fit T-Shirt,THE ARCHER,0,0,0,299,3.7,93,66,,0,93
322,B09FL8YBTF,Men's Combo Polo Neck Cotton Blend Solid T-Shirt (Pack of 2),INKKR,0,0,0,439,3.3,398,66,,0,398
323,B07CK7BPQF,Men's Regular Fit T Shirt (Pack of 3),AWG ALL WEATHER GEAR,0,0,0,449,3.4,593,81,,0,593
324,B084G4QR52,Men's Slim Fit T-Shirt,Maniac,0,0,0,324,3.7,"2,464",66,,0,"2,464"
325,B07R7QDQ7C,Men's Solid Regular Fit T-Shirt,Van Heusen Athleisure,0,0,0,699,4.0,"2,635",0,,1,"2,635"
326,B09MK9GH29,Men Denim Blue Solid Oversized T-Shirts,The Souled Store,0,0,0,734,0,0,43,,1,"₹734
₹1,299 Save ₹565 (43%)"
327,B09BBDN2K6,Official Iron Man: Arc Reactor Logo Mens and Boys Graphic Printed Cotton Full Sleeve T-Shirts Multi-Colored,The Souled Store,0,0,0,734,4.2,80,43,,1,80
328,B07F6KZK1D,Men's Solid Regular Fit Polo,Puma,0,0,0,509,3.7,216,61,,1,216
329,B073WB7385,Men's Printed Regular fit T-Shirt,Van Heusen Athleisure,0,0,0,549,4.1,646,0,,1,646
330,B085WWXW7B,N404 Men T-Shirt(N404M3_P$_Pack of 3),ACTIQUE,0,0,0,614,3.9,665,69,,1,665
331,B08W9TXSN3,Men's Slim T-Shirt,U.S. POLO ASSN.,0,0,0,720,4.1,40,60,,1,40
332,B09PJ9DHDV,Men's 3/4 Sleeves Hip hop t Shirt,clafoutis,0,0,0,279,2.5,2,72,,0,2
333,B092RMLKVZ,Men's Regular Fit T-Shirt (NM143_Dark Green ),Generic,0,0,0,479,3.7,308,70,,1,308
334,B09M42WYZK,Printed Cotton T-Shirt for Men Combo Pack of 2,Boodbuck,0,0,0,499,3.9,4,75,,1,4
335,B09FLB3BLS,Men's Combo Polo Neck Cotton Blend Solid T-Shirt (Pack of 2),INKKR,0,0,0,439,3.3,398,66,,0,398
336,B083C2P764,Men T-Shirt,Van Heusen Athleisure,0,0,0,799,4.2,572,11,,0,572
337,B075893ZTF,Men's Solid Regular Fit Cotton Polo,U.S. POLO ASSN.,0,0,0,750,4.0,"2,042",53,,1,"2,042"
338,B088BMKLXW,Men's Regular Fit T Shirt,VIMAL JONNEY,0,0,0,299,3.5,246,70,,1,246
339,B09HGRMQLX,Regular Fit Half Sleeve Men's Polo T-Shirt,LEOTUDE,0,0,0,299,3.0,13,73,,0,13
340,B08B3YNSX1,Yellow Men T-Shirt,Pepe Jeans,0,0,0,467,3.2,9,64,,0,9
341,B07RTX3V1R,Men's Slim Fit T-Shirt,Maniac,0,0,0,224,4.1,506,64,,0,506
342,B08DG6SP5G,F.R.I.E.N.D.S: The Six Friends Mens and Womens Graphic Printed Cotton T-Shirt Navy Blue,The Souled Store,0,0,0,576,4.4,160,36,,1,160
343,B00YUNH6VO,Men's Slim Fit T Shirt,Maniac,0,0,0,365,3.6,"2,165",57,,0,"2,165"
344,B07THKZRB3,Men's Regular Fit T-Shirt,U.S. POLO ASSN.,1,0,0,628,4.1,81,37,,1,81
345,B07CXXHLY2,Men's Regular fit T-Shirt,U.S. POLO ASSN.,1,0,0,411,4.0,"5,205",31,,0,"5,205"
346,B09QYS2DBH,Men's Solid Colour Round Neck T-Shirt,Generic,1,0,0,399,0,0,60,,0,"₹399
₹999 Save ₹600 (60%)"
347,B082DF7CQY,Polo Collar T-Shirt for Plus Size Men,AMERICAN CREW,1,0,0,707,4.1,568,65,,1,568
348,B096VD9GT1,Mortal Kombat: Scorpian Mens and Boys Graphic Printed Cotton T-Shirts Black,The Souled Store,1,0,0,420,4.0,1,53,,0,1
349,B098L9RX8S,Step Hem T-Shirt: Grey Melange Mens and Boys Solid Cotton Grey,The Souled Store,1,0,0,419,5.0,1,58,,0,1
350,B098LB68GL,Rick and Morty: Pickle Rick Mens and Boys Graphic Printed Cotton Oversized T-Shirts Multi-Colored,The Souled Store,1,0,0,735,3.4,5,43,,1,5
351,B09RP7Z3JY,Men's 100% Cotton T-Shirts,TRU-TEES,1,0,0,499,0,0,62,,0,"₹499
₹1,299 Save ₹800 (62%)"
352,B07RTX3V1R,Men's Slim Fit T-Shirt,Maniac,0,0,0,224,4.1,506,64,,0,506
353,B08DG6SP5G,F.R.I.E.N.D.S: The Six Friends Mens and Womens Graphic Printed Cotton T-Shirt Navy Blue,The Souled Store,0,0,0,576,4.4,160,36,,1,160
354,B00YUNH6VO,Men's Slim Fit T Shirt,Maniac,0,0,0,365,3.6,"2,165",57,,0,"2,165"
355,B083C28YK4,Men T-Shirt,Van Heusen Athleisure,0,0,0,599,4.2,"2,175",0,,1,"2,175"
356,B08YYHPMFK,Mens Polo Neck Half Sleeve Maroon Cotton T-Shirt,Classic Polo,0,0,0,899,4.1,10,10,,1,10
357,B08XMJBMN6,"ActiWear Polyester Muscle Tee for Men - Sleeveless Sports T-Shirt for Gym, Running, Cycling, Football, Basketball - 4 Way Stretch Lycra Sando Top Tank",ATICX,0,0,0,399,4.3,28,43,,0,28
358,B093T7HV4F,Men's Plus Size Polo Collar Neck T-Shirt,Wear Your Opinion,0,0,0,499,4.0,285,67,,1,285
359,B075B44WW2,Men's Polo Collar Half Sleeve Striped Cotton Melange Colors T Shirts for Men,AMERICAN CREW,0,0,0,707,3.8,902,65,,1,902
360,B08FXCT3LB,Men's Half Sleeve Printed Round Neck Tshirt,Dagcros,0,0,0,332,3.3,82,78,,0,82
361,B08PL6741X,Men's Cotton Solid Full Sleeves | Round Neck | Regular Fit T-Shirt/Tee,Bewakoof,0,0,0,449,3.9,165,10,,0,165
362,B08QNJ45LN,Men's Solid Mandarin Collar Regular Fit Cotton T-Shirt,Urbano Plus,0,0,0,469,3.8,447,61,,0,447
363,B07W3BBHVM,Men Multicolor Stylish Sleeveless Tshirt -Get-Bike-Play,hotfits,0,0,0,599,3.8,163,60,,1,163
364,B08GYNWDFG,Men's Slim Fit T-Shirts,Spykar,0,0,0,404,3.0,2,69,,0,2
365,B07PP7W9KZ,Men's Regular Fit Pyjama Top,U.S. POLO ASSN.,0,0,0,479,4.0,645,20,,0,645
366,B0951CMK39,Printed Cotton Mens T-Shirt (S21FAHP000021OR-P),Free Authority,0,0,0,309,4.3,4,48,,0,4
367,B0862RFQ1K,Men's Printed Slim fit T-Shirt,AEROPOSTALE,0,0,0,548,4.2,32,45,,1,32
368,B08662JK2H,Men's Slim Fit Polo T-Shirt,Alan Jones Clothing,1,0,0,419,4.0,856,58,,0,856
369,B098LBSYJ2,Garfield: Weekend Plans Mens and Boys Graphic Printed Cotton T-Shirts Blue,The Souled Store,1,0,0,734,4.4,9,18,,1,9
370,B0793JLJXV,US Polo Association Men's Regular fit T-Shirt,U.S. POLO ASSN.,1,0,0,499,4.0,"2,301",0,,1,"2,301"
371,B08HND5YD3,AWG Men's Cotton Regular Fit Solid Polo Neck T-Shirt,AWG ALL WEATHER GEAR,1,0,0,349,3.6,"6,845",77,,0,"6,845"
372,B078WCCJ5T,Men's Solid Slim Fit T-Shirt,blackberrys,0,0,0,444,1.7,3,56,,0,3
373,B07T8C5BLP,Men's Polo Collar T-Shirt,Deniklo,0,0,0,499,4.0,"2,916",58,,1,"2,916"
374,B095K132DW,Supima Cotton Half Sleeve Mens and Womens Solid Cotton T-Shirts,The Souled Store,1,0,0,839,3.6,35,44,,1,35
375,B08VN2W5PZ,Men's Regular T-Shirt,U.S. POLO ASSN.,1,0,0,"1,219",3.5,26,39,,1,26
376,B073X4K327,Men's Regular T-Shirt,Amazon Brand - Symbol,1,0,0,569,4.0,"10,842",37,,1,"10,842"
377,B09QYTH1VT,Men's Solid Colour Round Neck T-Shirt,Generic,1,0,0,399,0,0,60,,0,"₹399
₹999 Save ₹600 (60%)"
