,asin,title,brand,Sponsored,Best Seller,Amazon's Choice,Price,Rating,NoofRatings,Discount,Delivery,Prime Delivery,base
382,B084QGMWSW,"Kubra KB-1016 USB Fast charging, 90 min runtime, Adjustable 20 Length Setting, Ultra Sleek Beard Trimmer for Men (Black)",Kubra,1,0,0,699,3.9,536,30,"Friday, February 18",1,536
383,B07BLZTN3B,Philips BT1215/15 USB Cordless Beard Trimmer (Black),Philips,1,0,0,"1,185",4.1,175,1,"Wednesday, February 23",1,175
384,B00TYSQXIC,"Philips Bikini Genie BRT383 Cordless Women's Trimmer for Bikini Line, with Shaving Head & Comb",Philips,0,0,0,"2,089",4.3,"5,299",5,"Saturday, February 19",1,"5,299"
385,B09L76LVLL,"PROFESSIONAL TRIMMER NS-216 RECHARGEABLE TRIMMER,COARDLESS HAIR TRIMMER FOR MEN WITH FREE HAIR COMB & SCISSOR",PROFESSIONAL,0,0,0,369,1.0,1,54,"Tuesday, February 22",0,1
386,B09DMM7L3J,"VEGA Men 10-in-1 EZY Multi-Grooming Set with Beard/Hair Trimmer, Nose Trimmer & Body Groomer And Shaver, (VHTH-22), White & Black",VEGA,1,0,0,"1,644",3.8,47,25,,1,47
387,B08DG3SXZ2,"VGR Electric Rechargeable Cordless Hair, Beard Trimmer for Men",VGR,1,0,0,"1,234",4.1,328,44,"Tuesday, February 22",1,328
388,B09Q68N8GB,Twonzilla Multipurpose Cordless Nose Hair Trimmer | Electronic Stainless Steel Nose Ear Eyebrow Side burn and Beard Hair Clipper with LED Light for (Men/Women),Twonzilla,1,0,0,299,5.0,4,47,"Monday, February 21",1,4
389,B084YZT8BT,"Swiss Military Compact Travel Friendly Trimmer for Men, Rechargeable Base for Charging and Storage, Water Resistant Detachable Stainless Steel Blades, 90 minutes Run Time with Trimming Range upto 9 mm, 2 Years Warranty SHV-9 (Black)",Swiss,1,0,0,"1,299",4.1,79,7,"Saturday, February 19",1,79
