,asin,title,brand,Sponsored,Best Seller,Amazon's Choice,Price,Rating,NoofRatings,Discount,Delivery,Prime Delivery,base
119,B08Q1RDKVK,"Dime Store Wooden Wall Mounted TV Unit, TV Cabinet for Wall, TV Stand for Wall, TV Stand Unit Wall Shelf for Living Room, Set Top Box Stand (Large, White Shelves)",Dime,1,0,0,"2,199",3.8,"1,013",56,"Wednesday, February 23",1,"1,013"
120,B0994NRTNX,Heera Moti Corporation Happy TV Entertainment Wall Mount Unit/Wall Panel for Tv Unit up to 55 inches (Finish: - White Matt),Heera,1,0,0,"3,999",3.1,4,50,"Monday, February 21",1,4
121,B08J7MBTMB,"Inmarwar Wooden Entertainment TV Unit for Living Room | TV Stand with 2 Drawers & Shelf Storage| Mango Wood & Iron, Light Agara Brown",Inmarwar,1,0,0,"14,899",5.0,7,40,,1,7
122,B09JSK36Z8,Heera Moti Corporation Prides TV Entertainment Wall Mount Unit/Wall Panel for tv Unit (Finish : White Matt),Heera,1,0,0,"7,999",3.1,3,47,"Monday, February 21",1,3
123,B09PHMXVVY,Heera Moti Corporation MRC TV Entertainment Wall Mount Unit/Wall Panel for tv Unit up to 43 inch (White),Heera,1,0,0,"2,999",2.5,4,40,"Monday, February 21",1,4
124,B09B3XS4QY,"Redwud Skyler Engineered Wood TV Entertainment Unit/TV Cabinet/TV Stand/Entertainment Center Table/Display Storage Cabinet Rack (White) - Ideal for Upto 52""",Redwud,0,0,0,"3,999",3.4,3,67,"Monday, February 21",1,3
125,B097YC1J85,"Anikaa Tyler Engineered Wood TV Unit/TV Stand/Floor Standing TV Unit/TV Cabinet/TV Entertainment Unit (White)(Ideal for Upto 52"")(D.I.Y)",Anikaa,0,0,0,"4,014",4.2,7,67,"Monday, February 21",1,7
126,B07CY1C2XH,"Bluewud Stellar Plus Engineered Wood Tv Wall Unit, Set Top Box Stand Walnut, for Upto 32""",Bluewud,0,0,0,799,4.0,64,20,"Wednesday, February 23",1,64
127,B09DQCCYVN,"Lu Sea Wud TV Cabinet Wall Shelves, Smart LED TV Entertainment Unit Wooden Set Top Box Stand | TV Stand Wall Shelf for Living Room Stylish | Hanging Rack Organizer | Home Decor Furniture - Ideal Upto 32"" LED TV (Colour- Brown)",Lu,0,0,0,748,2.8,8,75,"Wednesday, February 23",0,8
128,B07CZM9SPZ,"Bluewud Stellar Plus Engineered Wood Tv Wall Unit, Set Top Box Stand Wenge, for Upto 32""",Bluewud,0,0,0,799,4.0,210,20,"Wednesday, February 23",1,210
129,B08B1HRFBQ,"Demiwall Wooden Entertainment Tv Unit for Living Room | Television Stand with 3 Drawer & Shelf Storage for Home | Mango Wood, Natural Teak Finish",Demiwall,0,0,0,"18,500",3.8,5,47,,1,5
130,B09RWRTSCW,Anikaa James Engineered Wood Wall Mount TV Unit/TV Stand/Wall Set Top Box Stand/TV Cabinet/TV Entertainment Unit (Walnut)(Upto 60 Inch)(D.I.Y),Anikaa,0,0,0,"2,449",0,0,73,"Monday, February 21",1,"₹2,449
₹8,999 Save ₹6,550 (73%)"
131,B09655462S,"R K Enterprises Engineered Wood TV Entertainment Unit Setup Box Stand/Holder, 60 x 24x12 cm, Matte Brown",R,0,0,0,899,3.0,4,55,"Wednesday, February 23",0,4
132,B08KFGXCRD,"Simran Handicrafts THEWOODMART Wall Mounted Wooden TV Entertainment Unit Set Top Box Stand Shelf Racks TV cabinets Floating Shelves for Home Living Room , Bedroom",Simran,0,0,0,0,3.5,325,0,,0,325
133,B08TLWP5MP,AAFIYA HANDICRAFTS Engineered Wood Floating TV Shelf/Wall Mounted Media Console/Router DVD Shelves/Cable Box/DVD Players/Game Console Streaming Media Equipment cb (Black),AAFIYA,0,0,0,695,3.0,74,54,"Tuesday, February 22",0,74
134,B09F94Q882,"Kanha Handicraft Wooden Tv Cabinet Wall Shelves ,Smart LED TV Entertainment Unit Set top Box Stands TV Stand Wall Shelf for Living Room Stylish Home Decor Furniture (Colour Brown )",Kanha,0,0,0,749,3.2,7,75,"Tuesday, February 22",0,7
135,B08621HPCN,"Modstyle Foldable Screen Top, Stand Screen Top Shelf Computer Monitor Riser, Desktop Stand TV Wall Mount Rack Display Shelf Storage Rack 811-4",Modstyle,0,0,0,399,3.7,46,43,"Monday, February 21",1,46
136,B07YTJ3L3H,"DeckUp Cannes Engineered Wood 2-Door TV Stand and Home Entertainment Unit (Dark Wenge, Matte Finish)",DeckUp,0,0,0,"6,649",4.6,239,45,"Saturday, February 26",0,239
137,B09N3VQQNZ,"INDIAN DECOR 46120 TV Stand, Soundbar Riser. HI-FI Media Storage Shelf. Sound System Docking Station. Industrial, Heavy-Duty Furniture. Modern Minimal Style - Black",INDIAN,0,0,0,"4,999",0,0,50,"Friday, February 25",0,"₹4,999
₹9,999 Save ₹5,000 (50%)"
138,B09LQQ59CL,"Anikaa Dustin Engineered Wood TV Unit/TV Stand/Floor Standing TV Unit/TV Cabinet/TV Entertainment Unit (Wenge) - Ideal for Upto 52"" (D.I.Y) Matte Finish",Anikaa,0,0,0,"6,999",0,0,56,"Monday, February 21",1,"₹6,999
₹15,999 Save ₹9,000 (56%)"
139,B093DVF497,Wooden Cart TV Entertainment/Unit Set Top Box/Stand Wall Mounted Shelf Wooden TV cabinets for Home Living Room Floating Shelves for Bedroom (Brown),Wooden,0,0,0,599,3.3,8,60,"Wednesday, February 23",0,8
140,B097YC1J85,"Anikaa Tyler Engineered Wood TV Unit/TV Stand/Floor Standing TV Unit/TV Cabinet/TV Entertainment Unit (White)(Ideal for Upto 52"")(D.I.Y)",Anikaa,1,0,0,"4,014",4.2,7,67,"Monday, February 21",1,7
141,B081S1GKQ2,"HEERA MOTI CORPORATION Gun Pre-laminated board TV Entertainment Unit ,White",HEERA,1,0,0,"3,499",3.3,44,53,"Monday, February 21",1,44
142,B08PZKWX3Z,"Dime Store Wooden Wall Mounted TV Unit, TV Cabinet for Wall, TV Stand for Wall, TV Stand Unit Wall Shelf for Living Room, Set Top Box Stand (Large, Total Black)",Dime,1,0,0,"2,199",3.8,"1,013",56,"Wednesday, February 23",1,"1,013"
143,B082FLK1C3,"G Fine Furniture Wooden TV Stand Unit for Living Room with 2 Cabinets, 2 Drawers & Shelf Storage | Sheesham, Brown",G,1,0,0,"21,999",4.5,16,34,,1,16
144,B09822V7KG,"DAS Bellatrix Wall Mount TV Entertainment Unit/with Set Top Box Stand and Wall Shelf Display Rack for Living Room Black & White (Ideal for up to 55"") Screen",DAS,0,0,0,"4,399",4.4,38,51,"Monday, February 21",1,38
145,B08622MT3H,Anikaa Revolt Engineered Wood Wall Mount TV Unit/TV Stand/Wall Set Top Box Stand/TV Cabinet/TV Entertainment Unit (Wenge/White)(Ideal for 42.52 Inch)(D.I.Y),Anikaa,0,0,0,"2,774",3.9,101,55,"Monday, February 21",1,101
146,B09RMKTXL4,"DecorNation Berel Solid Wood TV Unit Table - Two Compartment with Door and Shelf for Living Room, Bedroom, Office Furniture Stand (58 x 14 x 18 inches, Brown)",DecorNation,0,0,0,"10,999",5.0,2,48,"Thursday, March 3",0,2
147,B07DTFGLYL,"DeckUp Versa Engineered Wood TV Entertainment Unit ,Dark Wenge, Set of 1",DeckUp,0,0,0,"8,074",4.4,620,50,"Saturday, February 26",0,620
148,B07FLLMG95,"Bluewud Aero Engineered Wood Tv Entertainment Wall Unit Wenge, Standard, for Upto 32""",Bluewud,0,0,0,"1,149",4.1,765,54,"Wednesday, February 23",1,765
149,B09RWPB694,Anikaa Zion Engineered Wood Wall Mount TV Unit/TV Stand/Wall Set Top Box Stand/TV Cabinet/TV Entertainment Unit (White)(D.I.Y),Anikaa,0,0,0,"2,299",0,0,59,"Monday, February 21",1,"₹2,299
₹5,599 Save ₹3,300 (59%)"
150,B09GKLRTCB,"Anikaa Charley Engineered Wood Wall Mount TV Unit/TV Stand/Wall Set Top Box Stand/TV Cabinet/TV Entertainment Unit (White)(Ideal for Upto 52"")(D.I.Y)",Anikaa,0,0,0,"4,349",3.3,19,64,"Monday, February 21",1,19
151,B07CZJMTT1,"Bluewud Tital Engineered Wood Tv Unit, Set Top Box Stand, Walnut, Standard",Bluewud,0,0,0,649,4.1,51,50,"Wednesday, February 23",1,51
152,B09C36NN8Z,"Aparios Wud V Entertainment Unit Set Top Box Stand Wall Mounted Shelf Racks Wooden TV cabinets for Home Living Room Floating Shelves for Living Room, Bedroom (Brown) Original by APARIOS®",Aparios,0,0,0,799,2.6,5,60,"Tuesday, February 22",1,5
153,B08ZJG9FH9,Anikaa Carlet Engineered Wood Wall Mount TV Unit/TV Stand/Wall Set Top Box Stand/TV Cabinet/TV Entertainment Unit (Wenge)(Ideal for 32-40 Inch)(D.I.Y),Anikaa,0,0,0,"2,174",3.9,49,57,"Monday, February 21",1,49
154,B09NC234T8,"Redwud Tainy Engineered Wooden Wall Mounted TV Unit/TV Stand/Set Top Box Stand/TV Cabinet/Set Top Box Holder for Home/TV Stand for Home Living Room - Ideal for TV Upto 52"" (White)",Redwud,0,0,0,"1,689",0,0,66,"Monday, February 21",1,"₹1,689
₹4,999 Save ₹3,310 (66%)"
155,B09PBQV99Y,"Bluewud Primax Solo Engineered Wood Tv Wall Unit, Set Top Box Stand, Wenge & White, Standard, for Upto 50""",Bluewud,0,0,0,"2,449",5.0,1,35,"Thursday, February 24",0,1
156,B014FNKFO8,HomeTown Pacific Engineered Wood TV Unit in Walnut Colour,HomeTown,0,0,0,0,4.0,22,0,,0,22
157,B07YHYNH87,"Bluewud Relo Engineered Wood Tv Wall Unit with Display Shelves, Wenge, for Upto 50""",Bluewud,0,0,0,"3,799",4.1,21,53,"Tuesday, February 22",1,21
158,B09QX8RMLM,"Furnifry Wall Mounted 3 Tier TV Entertainment Unit/Table Storage & Decor Wood TV Cabinet for Living Room/Wall Set Top Box Floating Shelf Nightstand Cabinet with All Open Shelves (36x8x4.5 in, Brown)",Furnifry,0,0,0,"1,449",5.0,1,71,"Wednesday, February 23",1,1
159,B08XXS7GPY,Anikaa Ancort Engineered Wood Wall Mount TV Unit/TV Stand/Wall Set Top Box Stand/TV Cabinet/TV Entertainment Unit (Wenge)(Ideal for 42-52 Inch)(D.I.Y),Anikaa,0,0,0,"3,814",4.0,44,39,"Monday, February 21",1,44
160,B099DT5CR3,"Bluewud Estoye Engineered Wood Tv Entertainment Wall Unit, Wenge, Large,for Upto 50""",Bluewud,0,0,0,"2,999",4.4,146,25,"Tuesday, February 22",1,146
161,B08WR73WQG,"Anikaa Jadis Engineered Wood Wall Mount TV Unit/TV Stand/Wall Set Top Box Stand/TV Cabinet/TV Entertainment Unit (Wenge White) (Ideal for Upto 52"")(D.I.Y)",Anikaa,0,0,0,"3,014",3.9,30,54,"Monday, February 21",1,30
162,B09PJBDG71,"Anikaa Riley Engineered Wood Wall Mount TV Unit/TV Stand/Wall Set Top Box Stand/TV Cabinet/TV Entertainment Unit (Wenge)(Ideal for Upto 52"")(D.I.Y)",Anikaa,0,0,0,"1,724",1.0,1,75,"Monday, February 21",1,1
163,B09NDMMYD3,ESTANTERIA Crochet Engineered Wood Wall Mount TV Entertainment Unit with Set Top Box Stand and Wall Shelves Display Rack (Wenge Finish),ESTANTERIA,0,0,0,"1,949",5.0,1,44,"Tuesday, February 22",1,1
164,B08LQ1645J,Redwud Galvin Wooden TV Entertainment Unit/Wall Set Top Box Shelf Stand/TV Cabinet for Wall/Set Top Box Holder for Home/TV Stand Unit for Wall for Living Room (Standard Walnut),Redwud,0,0,0,"1,486",5.0,2,68,"Monday, February 21",1,2
165,B09P47JM5G,ESTANTERIA Pantorilla Engineered Wood Wall Mount TV Entertainment Unit with Set Top Box Stand and Wall Shelves Display Rack for Living Room and Bedroom (Wenge Finish),ESTANTERIA,0,0,0,"2,649",0,0,44,"Tuesday, February 22",1,"₹2,649
₹4,699 Save ₹2,050 (44%)"
166,B09RWRW5Z8,Anikaa James Engineered Wood Wall Mount TV Unit/TV Stand/Wall Set Top Box Stand/TV Cabinet/TV Entertainment Unit (White)(Upto 60 Inch)(D.I.Y),Anikaa,0,0,0,"2,449",0,0,73,"Monday, February 21",1,"₹2,449
₹8,999 Save ₹6,550 (73%)"
167,B08VD834QH,"Urban Guru TV Entertainment Wall Unit Engineered Wood, Wall Set-top Box Stand, Modern TV Cabinet, Living Room Storage Space Home Decor (Black) (1)",Urban,0,0,0,999,3.3,25,64,"Wednesday, February 23",0,25
168,B09LVBWYF4,"Redwud Hazel Engineered Wood TV Entertainment Unit/TV Cabinet/Wall Mounted TV Unit/TV Stand for Wall/TV Stand Unit Wall Shelf for Home Living Room(Wenge) - Ideal for Upto 50"" (D.I.Y)",Redwud,0,0,0,"2,998",0,0,67,"Monday, February 21",1,"₹2,998
₹8,999 Save ₹6,001 (67%)"
169,B08WJD4V2Q,DOBARIYA SMIT Monitor Stand Adjustable Durable TV Screen Top Shelf Storage Rack Display Holding Wall Set top Box Stand PC Laptop TV Screen Riser Desk with Storage Shelf for Home Office,DOBARIYA,0,0,0,399,3.6,32,60,"Monday, February 21",1,32
170,B097CFWPBQ,AAROORA Sandy TV Table Centre Unit (Engineered Wood Matte Finish Wenge),AAROORA,0,0,0,"2,499",3.7,11,69,"Tuesday, February 22",1,11
171,B098LWG9VV,wooden cave tv Unit Wall Mount Wooden Glossy Finish | Wooden Setup Box Stand | Brown,wooden,0,0,0,649,4.5,2,57,"Tuesday, February 22",0,2
172,B09LVBWHCJ,"Redwud Elina Engineered Wood TV Entertainment Unit/TV Cabinet with Wall Shelves/Floor Standing TV Unit/TV Cabinet with Shelf/TV Stand Unit for Home Living Room(White) - Ideal for Upto 52"" (D.I.Y)",Redwud,0,0,0,"6,999",1.0,1,56,"Monday, February 21",1,1
173,B09M83MBFX,Wooden Floating TV Shelf/ Hanging Set Top Box Stand/ TV Entertainment Unit/ Wall Mount TV Shelf/TV Unit Made of MDF Wood for Home Decor.,Wooden,0,0,0,"1,699",0,0,43,"Tuesday, February 22",0,"₹1,699
₹3,000 Save ₹1,301 (43%)"
174,B098MTXF1X,"Wooden Cave tv Cabinet for 32 inch led tv Wall Mounted | Wooden Stand for Speaker, WiFi Router, Set top Box Holder, Remote and Showcase Items | Brown",Wooden,0,0,0,639,3.6,8,57,"Tuesday, February 22",0,8
175,B00OCY45NS,"AVF SDC600-A TV Stand for up to 32-inch TVs, Black Glass, Chrome Legs",AVF,0,0,0,0,4.3,182,0,,0,182
176,B06W57VGJ1,"Bluewud Oliver Engineered Wood Tv Entertainment Unit Cabinet with Storage, Walnut, for Upto 42""",Bluewud,1,0,0,"2,699",4.0,702,59,"Tuesday, February 22",1,702
177,B07RRYJ31V,"Bluewud Millie Engineered Wood Tv Wall Unit, Set Top Box Stand Wenge, for Upto 42""",Bluewud,1,0,0,"1,249",4.2,176,42,"Wednesday, February 23",1,176
178,B08QVSHPWL,Roundhill Sheesham Wood TV,Roundhill,1,0,0,"13,499",3.9,40,46,,1,40
179,B08258V7DX,"indian decor. charter oak finish standard tv stand, for up to 36""",indian,1,0,0,"4,999",0,0,38,"Friday, February 25",0,"₹4,999
₹7,999 Save ₹3,000 (38%)"
180,B0994N4CF8,Heera Moti Corporation Panel TV Entertainment Wall Mount Unit/Wall Panel for Tv Unit up to 50 inch (Finish :- White Matt),Heera,1,0,0,"2,999",2.6,9,50,"Monday, February 21",1,9
181,B08R2PGM9N,Heera Moti Corporation Max TV Entertainment Tv Stand/Set Top Box Stand (Finish :- Black Matt),Heera,1,0,0,"4,999",3.4,3,17,"Monday, February 21",1,3
182,B0897BHWF4,"HEERA MOTI CORPORATION Deccan Engineered Wood TV Entertainment Unit White,1 door",HEERA,1,0,0,"4,999",3.3,31,33,"Monday, February 21",1,31
183,B097CFWPBQ,AAROORA Sandy TV Table Centre Unit (Engineered Wood Matte Finish Wenge),AAROORA,1,0,0,"2,499",3.7,11,69,"Tuesday, February 22",1,11
184,B0936RF43Z,Anikaa Cruze Engineered Wood Wall Mount TV Unit/TV Stand/Wall Set Top Box Stand/TV Cabinet/TV Entertainment Unit (Wenge)(Ideal for 32-40 Inch)(D.I.Y),Anikaa,0,0,0,"1,599",2.0,1,60,"Monday, February 21",1,1
185,B08XXT63KN,Anikaa Ancort Engineered Wood Wall Mount TV Unit/TV Stand/Wall Set Top Box Stand/TV Cabinet/TV Entertainment Unit (Wenge/White)(Ideal for 42-52 Inch)(D.I.Y),Anikaa,0,0,0,"3,814",4.1,145,39,"Monday, February 21",1,145
186,B08CKYY256,"Klaxon Engineered Wood, Matt Finish Bisnoa TV Unit/Display Storage Cabinet Rack with Decor Shelf (Asian Walnut & Black, Set of 1)",Klaxon,0,0,0,"1,002",3.7,45,77,,1,45
187,B08QRZJBW1,"Namra Arts Wooden TV Setup Box Stand/Holder, 60 x 24x12 cm, Matte Brown",Namra,0,0,0,799,3.5,35,60,"Wednesday, February 23",0,35
188,B09QXC6QBC,"Furnifry Wall Mounted 3 Tier TV Entertainment Unit/Table Storage & Decor Wood TV Cabinet for Living Room/Wall Set Top Box Floating Shelf Nightstand Cabinet with All Open Shelves (36x8x4.5 in, White)",Furnifry,0,0,0,"1,449",5.0,1,71,"Wednesday, February 23",1,1
189,B08NPFK17V,"Reshuz® TV Entertainment Unit Engineered Wooden Wall Mounted TV Unit, TV Cabinet for Wall, TV Stand for Wall, TV Stand Unit Wall Shelf for Living Room, Set Top Box Stand with Black and White Combination Semi Glossy Finished Multiple Style 2 Wall Shelves (Set of 6) and 1 Set top Box Stand ( FREE RINGS INCLUDED)",Reshuz®,0,0,0,"1,695",4.0,107,76,"Sunday, February 27",0,107
190,B00OCY45NS,"AVF SDC600-A TV Stand for up to 32-inch TVs, Black Glass, Chrome Legs",AVF,0,0,0,0,4.3,182,0,,0,182
191,B09PJFMQRN,"Anikaa Finn Engineered Wood Wall Mount TV Unit/TV Stand/Wall Set Top Box Stand/TV Cabinet/TV Entertainment Unit (Wenge)(Ideal for Upto 40"")(D.I.Y)",Anikaa,0,0,0,"1,424",0,0,72,"Monday, February 21",1,"₹1,424
₹4,999 Save ₹3,575 (72%)"
192,B07KPMMTPM,onlinecraft tv entertainment unit table with standard set top box stand,onlinecraft,0,0,0,499,5.0,1,50,"Tuesday, February 22",0,1
193,B097KQPT9Q,TV Setup Box & Remote Stand Wooden Wall Shelf,TV,0,0,0,676,4.0,1,32,"Wednesday, February 23",0,1
194,B08PG1J8SY,"ETIQUETTE ART TV Entertainment Unit/Wall Set Top Box Stand Shelf (Standard,Brown)",ETIQUETTE,0,0,0,"1,799",3.6,4,49,"Tuesday, February 22",0,4
195,B07J4QYK7V,Anikaa Aly Engineered Wood TV Entertainment Unit/TV Stand/Wall Set Top Box Shelf Stand/TV Cabinet for Wall/Set Top Box Holder for Home/TV Stand Unit for Wall for Living Room (Wenge) (D.I.Y),Anikaa,0,0,0,713,3.9,98,64,"Monday, February 21",1,98
196,B07P7QX1DJ,Anikaa Archie Engineered Wood Wall Mount TV Unit/TV Stand/Wall Set Top Box Stand/TV Cabinet/TV Entertainment Unit (Wenge)(Ideal for 42.52 Inch)(D.I.Y),Anikaa,0,0,0,"1,574",4.0,495,61,"Monday, February 21",1,495
197,B09PJCX7FZ,"Anikaa Riley Engineered Wood Wall Mount TV Unit/TV Stand/Wall Set Top Box Stand/TV Cabinet/TV Entertainment Unit (White)(Ideal for Upto 52"")(D.I.Y)",Anikaa,0,0,0,"1,724",0,0,75,"Monday, February 21",1,"₹1,724
₹6,999 Save ₹5,275 (75%)"
198,B08XPD4WZH,Wood Carver Wall Mounted TV Cabinet Home Decor Shelf/TV Entertainment Unit/TV Console Stand Display Unit White & Brown,Wood,0,0,0,"1,099",1.8,3,31,"Tuesday, February 22",0,3
199,B09FL8T7HY,Klaxon Crocus Engineered Wood TV Entertainment Unit - Wenge,Klaxon,0,0,0,"3,530",3.6,3,47,"Tuesday, February 22",1,3
200,B09RMNL8CX,LADOYA ART Sheesham Wooden Smart Tv Entertainment Unit | Tv Unit for Living Room with Storage | Stone Finish,LADOYA,1,0,0,"13,999",0,0,52,"Wednesday, February 23",0,"₹13,999
₹29,000 Save ₹15,001 (52%)"
201,B09PFWDGH3,AAROORA White Sandy TV Table Centre Unit (Engineered Wood Matte Finish Wenge),AAROORA,1,0,0,"2,499",5.0,1,69,"Tuesday, February 22",1,1
202,B096P3Y31F,"Heera Moti Corporation Oliver TV Stand Entertainment Center Unit for Decorative Furniture (Standard, Upto 50 Inches, Finish :-White Pre- lamented Matt)",Heera,1,0,0,"4,999",5.0,1,29,"Monday, February 21",1,1
203,B07B2YN3BH,AAROORA Engineered Wood TV Table Unit Display Storage Cabinet Rack with Decor Shelf (Wenge Finish),AAROORA,1,0,0,"2,199",4.0,484,68,"Thursday, February 24",1,484
204,B08635ZX4S,Anikaa Crystal Engineered Wood Wall Mount TV Unit/TV Stand/Wall Set Top Box Stand/TV Cabinet/TV Entertainment Unit (Wenge/White)(Ideal for 42.52 Inch)(D.I.Y),Anikaa,0,0,0,"2,974",4.1,274,58,"Monday, February 21",1,274
205,B09N7GLKC8,Anikaa Vincent Engineered Wood Wall Mount TV Unit/TV Stand/Wall Set Top Box Stand/TV Cabinet/TV Entertainment Unit (Wenge/White)(D.I.Y),Anikaa,0,0,0,"1,314",0,0,49,"Monday, February 21",1,"₹1,314
₹2,599 Save ₹1,285 (49%)"
206,B099RWYJQX,"Anikaa Tyron Engineered Wood Wall Mount TV Unit/TV Stand/Wall Set Top Box Stand/TV Cabinet/TV Entertainment Unit (Wenge White)(Ideal for Upto 42"")(D.I.Y)",Anikaa,0,0,0,"4,299",3.8,11,52,"Monday, February 21",1,11
207,B07WCX827C,Anikaa Bryan Engineered Wood Wall Mount TV Unit/TV Stand/Wall Set Top Box Stand/TV Cabinet/TV Entertainment Unit (Wenge)(D.I.Y),Anikaa,0,0,0,"1,064",3.9,56,56,"Monday, February 21",1,56
208,B09GKM16Z5,"Redwud Henley Engineered Wood TV Entertainment Unit, TV Cabinet with Wall Shelves, Wall Mounted TV Unit, TV Cabinet with Shelf (Wenge) - Ideal for Upto 52""",Redwud,0,0,0,"4,339",3.9,11,64,"Monday, February 21",1,11
209,B09RWRX34X,Anikaa James Engineered Wood Wall Mount TV Unit/TV Stand/Wall Set Top Box Stand/TV Cabinet/TV Entertainment Unit (Wenge)(Upto 60 Inch)(D.I.Y),Anikaa,0,0,0,"2,449",0,0,73,"Monday, February 21",1,"₹2,449
₹8,999 Save ₹6,550 (73%)"
210,B08ZSSFXNW,Anikaa Roxy Engineered Wood Wall Mount TV Unit/TV Stand/Wall Set Top Box Stand/TV Cabinet/TV Entertainment Unit (Wenge)(Ideal for 32-40 Inch)(D.I.Y),Anikaa,0,0,0,"1,874",3.2,12,63,"Monday, February 21",1,12
211,B08N6BW2TQ,"Anikaa Alfric Engineered Wood TV Unit/TV Stand/Floor Standing TV Unit/TV Cabinet/TV Entertainment Unit (Wenge) - Ideal for Upto 39""(D.I.Y)",Anikaa,0,0,0,"4,511",3.6,26,50,"Monday, February 21",1,26
212,B08R9VX6RW,"Namra Arts Wooden TV Setup Box Stand/Holder, 60x21x12 cm, (White)",Namra,0,0,0,549,2.1,7,73,"Wednesday, February 23",0,7
213,B08YWV5WK8,"Bluewud Kyvid Engineered Wood Tv Wall Unit, Set Top Box Stand, Wenge, Large, for Upto 50""",Bluewud,0,0,0,"1,449",4.5,12,50,"Wednesday, February 23",1,12
214,B091DZ19DC,Redwud Taxin Wooden TV Entertainment Unit/Wall Set Top Box Shelf Stand/Set Top Box Holder for Home/TV Cabinet for Wall/TV Stand Unit for Wall for Living Room (Wenge),Redwud,0,0,0,"1,999",5.0,1,60,"Monday, February 21",1,1
215,B099RWMQRV,"Anikaa Tyron Engineered Wood Wall Mount TV Unit/TV Stand/Wall Set Top Box Stand/TV Cabinet/TV Entertainment Unit (Walnut)(Ideal for Upto 42"")(D.I.Y)",Anikaa,0,0,0,"4,174",3.5,8,54,"Monday, February 21",1,8
216,B092HJV5PR,"THEWOODMART Wooden Wall Mounted TV Unit, TV Cabinet for Wall, TV Stand for Wall, TV Stand Unit Wall Shelf for Living Room, Set Top Box Stand (Black)",THEWOODMART,0,0,0,0,3.3,21,0,,0,21
217,B097YCTL33,"Anikaa Tyler Engineered Wood TV Unit/TV Stand/Floor Standing TV Unit/TV Cabinet/TV Entertainment Unit(Walnut)(Ideal for Upto 52"")(D.I.Y)",Anikaa,0,0,0,"4,014",3.4,8,67,"Monday, February 21",1,8
218,B08N6C7F24,"Anikaa Alfric Engineered Wood TV Unit/TV Stand/Floor Standing TV Unit/TV Cabinet/TV Entertainment Unit (Walnut) - Ideal for Upto 39""(D.I.Y)",Anikaa,0,0,0,"4,410",4.0,14,51,"Monday, February 21",1,14
219,B0863BSGN1,Anikaa Crystal Engineered Wood Wall Mount TV Unit/TV Stand/Wall Set Top Box Stand/TV Cabinet/TV Entertainment Unit (Wenge)(Ideal for 42.52 Inch)(D.I.Y),Anikaa,0,0,0,"2,974",4.2,132,58,"Monday, February 21",1,132
220,B09NDQ3PHZ,QBISTARO Wall Mounted TV Unit with Wall Shelves / TV & Entertainment Units / Wall Mounted TV Unit / TV Stand for Wall / Setup Box Stand for Living Room Bedroom Home Decor (Black & White),QBISTARO,0,0,0,"1,949",0,0,35,"Tuesday, February 22",0,"₹1,949
₹2,989 Save ₹1,040 (35%)"
221,B09PJCYDNC,"Anikaa Finn Engineered Wood Wall Mount TV Unit/TV Stand/Wall Set Top Box Stand/TV Cabinet/TV Entertainment Unit (White)(Ideal for Upto 40"")(D.I.Y)",Anikaa,0,0,0,"1,424",0,0,72,"Monday, February 21",1,"₹1,424
₹4,999 Save ₹3,575 (72%)"
222,B08TB19BRR,"DAS Engineered Wood Wall Mount TV Entertainment Unit with Set Top Box Stand and Wall Shelf Display Rack for Living Room Wenge (Ambient, Wenge, Ideal for up to 43 Inch Screen)",DAS,0,0,0,"4,199",3.7,32,51,"Monday, February 21",1,32
223,B084FFPY4K,Amaze Shoppee Wall Shelf for Set Top Box/WiFi Router/tv Entertainment Unit (Walnut),Amaze,0,0,0,549,4.1,184,45,"Tuesday, February 22",1,184
224,B07Z22N5W6,Captiver King Engineered Wood Wall Mount Set Top Box Stand Shelf Rack Shelves (Wenge),Captiver,0,0,0,"1,044",4.2,30,58,"Monday, February 21",1,30
225,B08MTL39PT,"Heera Moti Corporation Flexible Multi-Purpose Shelf Entertainment Unit, Tv Stand,Tv Unit,Console Table(Finish :-Black pre- Laminated Matt)",Heera,0,0,0,"5,999",3.7,17,40,"Monday, February 21",1,17
226,B0855G9MNY,"FABULO Wooden Floating TV Entertainment Unit - Wall Mounted Stand for Set Top Box, Wall Hanging Storage Shelf/Cabinet/Rack for Home, Bedroom, Living Room – Black - (10 X 7 X 4 Inch)",FABULO,0,0,0,599,4.4,8,45,"Tuesday, February 22",0,8
227,B08LQ3MR8S,Redwud Galvin Wooden TV Entertainment Unit/Wall Set Top Box Shelf Stand/TV Cabinet for Wall/Set Top Box Holder for Home/TV Stand Unit for Wall for Living Room (Standard Wenge),Redwud,0,0,0,"1,486",3.7,20,68,"Monday, February 21",1,20
228,B07SB3Y7SF,FITUEYES Wall Mounted TV Media Console Floating Desk Storage Hutch for Home and Office DS211001WB,FITUEYES,0,0,0,0,4.5,"1,002",0,,0,"1,002"
229,B08T9ZYX4P,"DAS Wall Mount TV Entertainment Unit/with Set Top Box Stand and Wall Shelf Display Rack for Living Room Wenge & White (Ideal for up to 43"") Screen- Ambienc",DAS,0,0,0,"4,199",3.9,29,51,"Monday, February 21",1,29
230,B07HKXP3CG,"Bluewud Aero Engineered Wood Tv Entertainment Wall Unit Wenge, Large, for Upto 50""",Bluewud,0,0,0,"1,699",4.1,298,32,"Wednesday, February 23",1,298
231,B06WVF2JFF,"Bluewud Reynold Engineered Wood Tv Entertainment Wall Unit Wenge, Standard, for Upto 32""",Bluewud,0,0,0,"2,049",4.4,714,43,"Tuesday, February 22",1,714
232,B07MZNVQS9,"Bluewud Gautier Engineered Wood Tv Entertainment Unit Cabinet with Storage, Wenge, for Upto 32""",Bluewud,0,0,0,"4,399",4.0,109,23,"Tuesday, February 22",1,109
233,B08LH6BX8C,Redwud Sang Wooden TV Entertainment Unit/Wall Set Top Box Shelf Stand/TV Cabinet for Wall/Set Top Box Holder for Home/TV Stand Unit for Wall for Living Room (Wenge),Redwud,0,0,0,"1,186",3.7,6,54,"Monday, February 21",1,6
234,B09HCHYN34,"Furnifry Wooden TV Stand Table with 3 Tier Storage Shelves & Door for Home Living Room Bedroom/Modern TV Entertainment Stand Base Perfect for Cable Box (73x34x68.4 cm, Walnut Finish)",Furnifry,0,0,0,"4,599",5.0,1,23,"Wednesday, February 23",1,1
235,B08622F411,Anikaa Revolt Engineered Wood Wall Mount TV Unit/TV Stand/Wall Set Top Box Stand/TV Cabinet/TV Entertainment Unit (Walnut)(Ideal for 42.52 Inch)(D.I.Y),Anikaa,0,0,0,"2,774",3.9,44,55,"Monday, February 21",1,44
236,B09PBS69KR,"Bluewud Primax Neo Engineered Wood Tv Wall Unit, Set Top Box Stand, Wenge & White, Large, for Upto 55""",Bluewud,1,0,0,"3,899",0,0,15,"Tuesday, February 22",1,"₹3,899
₹4,599 Save ₹700 (15%)"
237,B09QD6GFL7,ESTANTERIA White Stack Engineered Wood Wall Mount TV Entertainment Unit with Set Top Box Stand and Wall Shelves Display Rack (Wenge & Frosty),ESTANTERIA,1,0,0,"2,149",0,0,42,"Tuesday, February 22",1,"₹2,149
₹3,699 Save ₹1,550 (42%)"
238,B09RMWYBKN,LADOYA ART Sheesham Wooden Smart Tv Entertainment Unit | Tv Unit for Living Room with Storage | Natural Finish,LADOYA,1,0,0,"16,499",0,0,48,"Wednesday, February 23",0,"₹16,499
₹32,000 Save ₹15,501 (48%)"
239,B06VX47DM9,"Bluewud Reynold Engineered Wood Tv Entertainment Wall Unit Walnut, Large, for Upto 50""",Bluewud,1,0,0,"2,949",4.4,"1,266",44,"Tuesday, February 22",1,"1,266"
240,B08MTL39PT,"Heera Moti Corporation Flexible Multi-Purpose Shelf Entertainment Unit, Tv Stand,Tv Unit,Console Table(Finish :-Black pre- Laminated Matt)",Heera,1,0,0,"5,999",3.7,17,40,"Monday, February 21",1,17
241,B083R916XB,"HEERA MOTI CORPORATION Line Engineered Wood TV Entertainment Unit White,2 door",HEERA,1,0,0,"3,999",3.3,45,43,"Monday, February 21",1,45
