,asin,title,brand,Sponsored,Best Seller,Amazon's Choice,Price,Rating,NoofRatings,Discount,Delivery,Prime Delivery,base
0,B09PRJXC37,Dyson V8 Absolute Cord-Free Vacuum Cleaner,Dyson,1,0,0,"34,900",5.0,5,21,"Monday, February 14",1,5
1,B08VWNDDTF,"Inalsa Vacuum Cleaner 1400W Bagless - Aristo | HEPA Filter, Powerful Suction & High Energy Efficiency| 1.5 L Dust Collector, 2 Years Warranty (Red/Black)",Inalsa,1,0,0,"3,999",3.8,"1,061",40,"Sunday, February 13",1,"1,061"
2,B00F3ABSXU,"Eureka Forbes Quick Clean DX Vacuum Cleaner with 1200 Watts Powerful Suction Control, 3 Free Reusable dust Bag worth Rs 500, comes with multiple accessories, dust bag full indicator (Red), standerd",Eureka,0,1,0,"3,499",3.8,"14,542",22,"Thursday, February 10",1,"14,542"
3,B07H3X5GTL,"AmazonBasics Vacuum Cleaner with Power Suction, Low Sound, High Energy Efficiency and 2 Years Warranty (1.5L Reusable Dust Bag, Black)",AmazonBasics,0,0,0,"2,399",4.2,"8,558",56,"Saturday, February 12",1,"8,558"
4,B072J83V9W,Philips PowerPro FC9352/01 Compact Bagless Vacuum Cleaner (Blue),Philips,0,0,1,"7,890",4.4,"13,311",21,"Thursday, February 10",1,"13,311"
5,B08L3Q4W4H,"TUSA Wireless Handheld Vacuum Cleaner, High Power Cordless Mini Vacuum Cleaner (Black)",TUSA,0,1,0,"2,999",4.4,"1,870",33,"Saturday, February 12",1,"1,870"
6,B07SRM58TP,"AGARO Regal 800 Watts Handheld Vacuum Cleaner, Lightweight & Durable Body, Small/Mini Size ( Black)",AGARO,0,0,0,"1,770",4.1,"8,119",41,"Monday, February 14",1,"8,119"
7,B07DX2W1LL,"Maharsh Multi-Functional Portable Vacuum Cleaner Blowing and Sucking Dual Purpose (JK-8), 220-240 V, 50 HZ, 1000 W",Maharsh,0,0,0,"1,899",3.8,815,37,"Monday, February 14",1,815
8,B07SLNG3LW,"Inalsa Vacuum Cleaner Wet and Dry Micro WD10 with 3in1 Multifunction Wet/Dry/Blowing| 14KPA Suction and Impact Resistant Polymer Tank,(Yellow/Black)",Inalsa,0,0,0,"3,999",3.9,"7,460",61,"Saturday, February 12",1,"7,460"
9,B08HDCWDXD,"Eureka Forbes Active Clean Handheld Vacuum Cleaner with 700 Watts Powerful Suction & Blower, Washable HEPA Filter, Comes with Multiple Accessories",Eureka,0,0,0,"2,599",3.9,192,21,"Sunday, February 13",1,192
10,B09FZ89DK6,"Eureka Forbes Super Vac 1600W Bagless Vacuum Cleaner with Powerful Cyclonic Technology (Black & Red), Small (GFCDSFSVL00000)",Eureka,1,0,0,"7,499",4.4,141,25,"Thursday, February 10",1,141
11,B07H3X5GTL,"AmazonBasics Vacuum Cleaner with Power Suction, Low Sound, High Energy Efficiency and 2 Years Warranty (1.5L Reusable Dust Bag, Black)",AmazonBasics,1,0,0,"2,399",4.2,"8,558",56,"Saturday, February 12",1,"8,558"
12,B08M1G4YTB,Karcher Cordless Handheld Vacuum Cleaner - VCH2,Karcher,0,0,0,"2,190",3.9,149,56,"Thursday, February 10",1,149
13,B07C1C5BLV,"Inalsa Spruce-1200W Vacuum Cleaner for Home with Blower Function and Reusable dust Bag (Red/Black), Standard",Inalsa,0,0,0,"3,154",3.9,"10,041",31,"Saturday, February 12",1,"10,041"
14,B083M7WPZD,"AGARO 33398 Rapid 1000-Watt, 10-Litre Wet & Dry Vacuum Cleaner, with Blower Function (Red & Black)",AGARO,0,0,0,"3,899",4.1,"1,602",35,"Monday, February 14",1,"1,602"
15,B07Z51CGGH,"Eureka Forbes Wet and Dry Ultimo Vacuum Cleaner with 1400 Watts High Power Suction and Blower, 20 litres Tank Capacity, Comes with Multiple Accessories (Red)",Eureka,0,0,0,"7,800",3.9,"1,166",22,"Thursday, February 10",1,"1,166"
16,B09FZ89DK6,"Eureka Forbes Super Vac 1600W Bagless Vacuum Cleaner with Powerful Cyclonic Technology (Black & Red), Small (GFCDSFSVL00000)",Eureka,0,0,0,"7,499",4.4,141,25,"Thursday, February 10",1,141
17,B08TR5TQZJ,"Inalsa Vacuum Cleaner Gusto Pro-1200W with Powerful Blower Function and 1.5L Reusable Cloth Dust Bag, Powerful 16KPA Suction, Lightweight & Compact, (Red/Black)",Inalsa,0,0,0,"2,859",3.7,328,43,"Saturday, February 12",1,328
18,B084HZPLD2,"AmazonBasics Wet and Dry Vacuum Cleaner with Power Suction, Low Sound, High Energy Efficiency and 1 Year Warranty (15L, Plastic Body)",AmazonBasics,0,1,0,"4,369",4.1,"2,575",38,"Saturday, February 12",1,"2,575"
19,B08J7VCT12,"KENT Zoom Vacuum Cleaner, Cordless, Hoseless, Rechargeable 130Watt Vacuum Cleaner with Cyclonic Technology, Bagless Design and Multi Nozzle Operation",KENT,0,0,0,"6,999",4.1,869,53,"Sunday, February 13",1,869
20,B07C1C5BLV,"Inalsa Spruce-1200W Vacuum Cleaner for Home with Blower Function and Reusable dust Bag (Red/Black), Standard",Inalsa,1,0,0,"3,154",3.9,"10,041",31,"Saturday, February 12",1,"10,041"
21,B084HZPLD2,"AmazonBasics Wet and Dry Vacuum Cleaner with Power Suction, Low Sound, High Energy Efficiency and 1 Year Warranty (15L, Plastic Body)",AmazonBasics,1,1,0,"4,369",4.1,"2,575",38,"Saturday, February 12",1,"2,575"
22,B07H3N8RJH,"AmazonBasics Cylinder Bagless Vacuum Cleaner with Power Suction, Low Sound, High Energy Efficiency and 2 Years Warranty (1.5L, Black)",AmazonBasics,1,0,0,"3,889",4.2,"8,558",35,"Thursday, February 10",1,"8,558"
23,B084HZSLLS,AmazonBasics 1400 W 21L Wet and Dry Vacuum Cleaner with Blower Function and Steel Drum,AmazonBasics,1,1,0,"5,319",4.1,"2,575",37,"Wednesday, February 16",1,"2,575"
24,B07RCGTZ4M,"AGARO Ace 1600 Watts, 21.5 kPa Suction Power, 21 litres Wet & Dry Stainless Steel Vacuum Cleaner with Blower Function and Washable Dust Bag",AGARO,0,0,0,"6,313",4.2,"1,389",37,"Thursday, February 10",1,"1,389"
25,B00V9NHDI4,"Eureka Forbes Trendy Zip Vacuum Cleaner with 1000 Watts Powerful Suction Control, Reusable dust Bag, comes with multiple accessories, dust bag full indicator (Black)",Eureka,0,0,0,"3,299",3.9,"10,050",13,"Thursday, February 10",1,"10,050"
26,B08GQCZMX2,BLACK+DECKER WDC215WA-QW 7.2 V10.8W Lithium-Ion Wet and Dry Cordless Dustbuster Handheld Vacuum Cleaner (Blue)-Charge Fully Before Using,BLACK+DECKER,0,0,0,"3,197",3.9,223,36,"Thursday, February 10",1,223
27,B00JBNZPFM,Karcher WD 3 *EU Wet & Dry Vacuum Cleaner (Yellow/Black),Karcher,0,0,0,"6,739",4.2,"9,079",39,"Thursday, February 10",1,"9,079"
28,B09HRVLZY6,"OSMON - OS WD12 by American Micronic, Wet and Dry Vacuum Cleaner with Blower 19 KPa Suction Power, 100% Copper Motor with auto Cutoff and HEPA Filter (Grey & Orange)",OSMON,0,0,0,"4,071",4.4,51,41,"Sunday, February 13",1,51
29,B09QD7BHCZ,RNG EKO GREEN Wireless 12V DC + AC Rechargeable Wet/Dry Car & Home Vacuum Cleaner with Dual Filter- White,RNG,0,0,0,"3,075",5.0,1,32,"Saturday, February 12",1,1
30,B077467KFX,KENT Force Cyclonic Vacuum Cleaner 2000-Watt (White and Silver),KENT,0,0,0,"5,750",3.9,"1,620",23,"Friday, February 11",1,"1,620"
31,B09B277N6S,"Eureka Forbes Sure from Forbes Wet & Dry Zest Multipurpose Vacuum Cleaner with High Power Suction and Blower, 7 litres Tank Capacity, Comes with Multiple Accessories (Red & Black)",Eureka,0,0,0,"5,499",3.5,194,21,"Thursday, February 10",1,194
32,B08J7VCT12,"KENT Zoom Vacuum Cleaner, Cordless, Hoseless, Rechargeable 130Watt Vacuum Cleaner with Cyclonic Technology, Bagless Design and Multi Nozzle Operation",KENT,1,0,0,"6,999",4.1,869,53,"Sunday, February 13",1,869
33,B091DW5117,"SmartAI Robotic Vacuum Cleaner with Mopping, App and Remote Control, 90mins Runtime, 2600Pa Adjustable Suction Smart Visual Navigation, Multi Cleaning Modes",SmartAI,1,0,0,"19,900",3.9,8,34,"Sunday, February 13",1,8
34,B08VWNDDTF,"Inalsa Vacuum Cleaner 1400W Bagless - Aristo | HEPA Filter, Powerful Suction & High Energy Efficiency| 1.5 L Dust Collector, 2 Years Warranty (Red/Black)",Inalsa,0,0,0,"3,999",3.8,"1,061",40,"Sunday, February 13",1,"1,061"
35,B07HJGMPJQ,"BLACK+DECKER WDBD15-IN High Suction Wet & Dry Vacuum Cleaner & Blower With HEPA Filter & Reusable Dustbag Suitable For Both Household & Professional Use, 15-Litre 1400 Watt 16 Kpa, 1 Year Warranty (Red/Grey)",BLACK+DECKER,0,0,0,"6,221",4.1,"2,371",46,"Thursday, February 10",1,"2,371"
36,B08X4D1LXN,"BROGBUS Portable Multi-Functional Vacuum Cleaner for Home (JK-8), (220-240 V, 50 HZ, 1000 W)",BROGBUS,0,0,0,"2,099",4.2,592,30,"Monday, February 14",1,592
37,B088NN7LPT,"Lifelong Aspire 1000-Watt, 10-Litre Wet & Dry Vacuum Cleaner, Blower Function - for Home/Office/Car use with High Power Suction; with Multiple Accessories; 1 Year Warranty (Red & Black)",Lifelong,0,0,0,"3,469",3.8,367,37,"Thursday, February 10",1,367
38,B09CLGNCNG,"Geek Schoner A10 1400W Cyclonic Bagless Vacuum Cleaner for Home with 20 kPa Strong Suction Power, 3L Dust Container, 8M Power Cord, HEPA Filter, Blue",Geek,0,0,0,"4,749",4.3,109,41,"Thursday, February 10",1,109
39,B09PNHF2VP,"Credicus Handheld Vacuum Cleaner Cordless - Mini Car Vacuum Cleaner Rechargeable for Car, Home, Office, Pet Hair Travel Cleaning",Credicus,0,0,0,"1,799",0,0,64,"Monday, February 14",1,"₹1,799
₹4,999 Save ₹3,200 (64%)"
40,B09QYFFFM9,Krishna Enterprise 2 in 1 Vacuum Cleaner Dust Collection/Lighting Car Vacuum Cleaner 120W High-Power Handheld Wireless Vacuum Cleaner Home Car Dual-use Portable USB Rechargeable Set of 1 Black,Krishna,0,0,0,799,0,0,68,"Monday, February 14",1,"₹799
₹2,499 Save ₹1,700 (68%)"
41,B09N9XF2DZ,"Perfect Pricee Handheld Vacuum Car Cleaner Air Duster Wireless Rechargeable Home Pet Hair Vacuum with Powerful Cyclonic, Portable USB Vacuum Cleaner with LED Light for Home",Perfect,0,0,0,0,5.0,1,0,,0,1
42,B088NN7LPT,"Lifelong Aspire 1000-Watt, 10-Litre Wet & Dry Vacuum Cleaner, Blower Function - for Home/Office/Car use with High Power Suction; with Multiple Accessories; 1 Year Warranty (Red & Black)",Lifelong,1,0,0,"3,469",3.8,367,37,"Thursday, February 10",1,367
43,B09NKZT5RN,"MELLERWARE Vacuum Cleaner Wet and Dry 1200 Watt- MWVC 01 with 3in1 Multifunction Wet/Dry/Blowing| 14KPA Suction and Impact Resistant Polymer Tank,(Black/Red)",MELLERWARE,1,0,0,"4,099",0,0,58,"Sunday, February 13",1,"₹4,099
₹9,795 Save ₹5,696 (58%)"
44,B082PB4MY4,"AmazonBasics Cylinder Bagless Vacuum Cleaner with Power Suction, Low Sound, High Energy Efficiency and 2 Years Warranty (2L, Black)",AmazonBasics,1,0,0,"3,810",4.2,"8,558",50,"Thursday, February 10",1,"8,558"
45,B08WXPTG1N,AGARO Empire 2200Watt Bagless Vacuum Cleaner with 3L Dust Collector (Orange/Ash),AGARO,1,0,0,"4,690",3.9,31,41,"Monday, February 14",1,31
46,B09JWPTKBY,Desktop Vacuum Cleaner Handheld Household Mini USB Rechargeable Electrical Table Dust Sweeper for Home (Green),Desktop,0,0,0,499,0,0,50,"Wednesday, February 9",0,"₹499
₹999 Save ₹500 (50%)"
47,B09PZDHCQT,"USB Computer Mini Vacuum Cleaner, CAR Vacuum Cleaner",USB,0,0,0,250,0,0,29,"Saturday, February 12",0,"₹250
₹350 Save ₹100 (29%)"
48,B072NCN9M4,"AMERICAN MICRONIC - AMI-VCD21-1600WDx- 21 Litre Stainless Steel Wet & Dry Vacuum Cleaner with Blower & HEPA filter, 1600 Watts 100% Copper Motor 28 KPa suction with washable reusable dust bag (Red/Black/Steel)",AMERICAN,0,0,0,"8,441",4.2,"2,227",29,"Monday, February 14",1,"2,227"
49,B08ZYLF36G,Portable Vacuum Cleaner Blowing and Sucking Dual Purpose Vacuum Cleaner-Gold,Portable,0,0,0,"1,343",0,0,16,"Tuesday, February 15",0,"₹1,343
₹1,599 Save ₹256 (16%)"
50,B074183D89,GOCART WITH G LOGO Vacuum Cleaner,GOCART,0,0,0,"1,799",3.9,235,38,"Monday, February 14",1,235
51,B09D3D4VSV,"VOVOSO Premium Cordless Vacuum Cleaner for Car and Home - Portable, Powerful Suction, w/ 3 Attachments, Carrying Bag and Two Extra HEPA Filter for Deep Cleaning (Black)",VOVOSO,0,0,0,"2,499",4.6,24,50,"Tuesday, February 15",0,24
52,B09NPS3ZGB,"Bletilla Multi-Functional Portable Vacuum Cleaner Blowing and Sucking Dual Purpose, 220-240 V, 50 HZ, 1000 W (Multicolor)",Bletilla,0,0,0,"1,799",0,0,28,"Monday, February 14",1,"₹1,799
₹2,499 Save ₹700 (28%)"
53,B07X8XSHQR,Crownish Handheld car and Home use Powerful Portable & High Power Vacuum Cleaner for Home Wet & Dry Vacuum Cleaner Multipurpose Vaccum Cleaner for Office Vacuum Cleaner (JK 8),Crownish,0,0,0,"1,870",3.8,269,28,"Monday, February 14",1,269
54,B08HP7KS7G,"AGARO Galaxy 1000-Watts Dry Vacuum Cleaner with 19 kPa Suction Power, 3.5 litres dust Bag, Variable Power Settings (Black)",AGARO,1,0,0,"3,799",3.8,37,31,"Thursday, February 10",1,37
55,B07SVMKKVP,"AGARO Twister 2200 Watts Dry Vacuum Cleaner with Powerful 25 kPa Suction Power & in-Built Blower, 6 litres dust Bag (Grey)",AGARO,1,0,0,"8,999",4.0,242,18,"Monday, February 14",1,242
56,B078HL7QMB,"JM SELLER New Vacuum Cleaner Blowing and Sucking Dual Purpose, 220-240 V, 50 HZ, 1000 W",JM,0,0,0,"1,999",3.9,273,33,"Monday, February 14",1,273
57,B00B1AO7RA,Panasonic MC-DL201 700-Watt Vacuum Cleaner (Blue),Panasonic,0,0,0,"3,250",4.0,721,12,"Monday, February 14",0,721
58,B09NNTWMPL,SHOPKART® Car Vacuum 2 in 1 Cleaner Advanced Design Portable Pet Hair Vacuum with Powerful Cyclonic Cordless Keyboard Vacuum Wet and Dry Cleaner (Black),SHOPKART®,0,0,0,"1,199",0,0,40,"Monday, February 14",0,"₹1,199
₹1,999 Save ₹800 (40%)"
59,B07CG5PJ9V,Prestige Wet&Dry Vacuum Cleaner Typhoon -05,Prestige,0,0,0,"4,640",3.8,"4,067",42,"Thursday, February 10",1,"4,067"
60,B082KZNDQ6,"INALSA Vacuum Cleaner Gusto-1000W with Blower Function and 1.5L Reusable Cloth Dust Bag, Powerful 16KPA Suction, Lightweight & Compact, (Blue/Grey)",INALSA,0,0,0,"2,906",3.6,409,32,"Saturday, February 12",1,409
61,B08QMVTT7X,"GOBBLER PowerVac-1000 Vacuum Cleaner with 1.5L Large Reusable Dust Bag, 1000W Powerful Suction, Comes with Multiple Accessories, Bin-Full Indicator, Compact & Lightweight (GB-820B)",GOBBLER,0,0,0,"2,399",4.6,3,73,"Thursday, February 10",1,3
62,B01F8OWMD0,Karcher WD3 Premium Wet and Dry Vacuum Cleaner (Yellow),Karcher,0,0,0,"7,990",4.2,"1,493",31,"Thursday, February 10",1,"1,493"
63,B09QQFWJMN,"M2 ENTERPRISE Handheld Vacuum Car Cleaner Air Duster Wireless Rechargeable Home Pet Hair Vacuum with Powerful Cyclonic, Portable USB Vacuum Cleaner with LED Light for Home (2 in 1 Vaccum Cleaner 120w)",M2,0,0,0,699,0,0,42,"Monday, February 14",0,M2
64,B07SRM58TP,"AGARO Regal 800 Watts Handheld Vacuum Cleaner, Lightweight & Durable Body, Small/Mini Size ( Black)",AGARO,1,0,0,"1,770",4.1,"8,119",41,"Monday, February 14",1,"8,119"
65,B072NCN9M4,"AMERICAN MICRONIC - AMI-VCD21-1600WDx- 21 Litre Stainless Steel Wet & Dry Vacuum Cleaner with Blower & HEPA filter, 1600 Watts 100% Copper Motor 28 KPa suction with washable reusable dust bag (Red/Black/Steel)",AMERICAN,1,0,0,"8,441",4.2,"2,227",29,"Monday, February 14",1,"2,227"
66,B082PBK27K,"AmazonBasics Vacuum Cleaner with Power Suction, Low Sound, High Energy Efficiency and 2 Years Warranty (3L Reusable Dust Bag, Black)",AmazonBasics,1,0,0,"3,497",4.2,"8,558",50,"Saturday, February 12",1,"8,558"
67,B08WXPJKWY,"AGARO Regal Plus Upright Vacuum Cleaner, 2-in-1, Handheld & Stick for Home and Office Use, 800 Watts",AGARO,1,0,0,"2,279",4.1,"8,119",24,"Thursday, February 10",1,"8,119"
68,B00IY90THS,Eureka Forbes Trendy Wet and Dry DX1150-Watt Powerful Suction and Blower Function Vacuum Cleaner (Black and Red),Eureka,0,0,0,"7,930",3.9,"1,134",19,"Tuesday, February 15",1,"1,134"
69,B08W32FKWT,"Amtidy A590 Local Home Voice Robotic Vacuum with Light, Robot Vacuum Cleaner with WiFi APP Control, Auto Recharging, Compatible with Alexa/Google Asisstant.",Amtidy,0,0,0,"7,999",3.4,14,70,"Tuesday, February 15",1,14
70,B08CL18DF1,BLACK+DECKER WDBD10 10-Litre 1200 Watt 16 KPa High Suction Wet and Dry Vacuum Cleaner and Blower with HEPA Filter and Reusable Dustbag (Red),BLACK+DECKER,0,0,0,"4,539",4.2,414,43,"Thursday, February 10",1,414
71,B09PN2DFKX,"Aetrius Handheld Vacuums Cordless, 120W Handheld Vacuum Cleaner with Powerful Suction, Portable Rechargeable Car Vacuum Cleaner, Lightweight Wet Dry Vacuum for Home, Office, Car and Pet",Aetrius,0,0,0,"2,299",0,0,54,"Monday, February 14",0,"₹2,299
₹4,999 Save ₹2,700 (54%)"
72,B09NPR52Z7,SHOPKART® Vacuum Cleaner 120W High-Power Handheld Wireless 2 in 1 Vacuum Cleaner Dust Collection/Lighting Car Pet Hair Vacuum with Powerful Cyclonic Dual-use Portable USB Rechargeable (Black),SHOPKART®,0,0,0,999,1.0,1,50,"Monday, February 14",0,1
73,B08D9D98B1,"Tineco Floor One S3 Smart Cordless Vacuum Cleaner, Powerful 2-in-1 Wet & Dry Function, Full LCD Screen, Smart Slef-Cleaning Roller Brush, APP Enabled, Light & Silent",Tineco,0,0,0,"27,900",4.3,79,53,"Monday, February 14",1,79
74,B08WRKPZRJ,"Deerma DX118C Vacuum Cleaner for Home Mini 2-in-1 Pushrod/Handheld Cleaner with 1.2L dust Capacity & 16000Pa Super Suction, 600 Watts",Deerma,0,0,0,"2,150",4.3,100,11,"Saturday, February 12",1,100
75,B09J57B25C,"BHRAKUTI Handheld Vacuum Car Cleaner Air Duster Wireless Rechargeable Home Pet Hair Vacuum with Powerful Cyclonic, Portable USB Vacuum Cleaner with LED Light for Home (2 in 1 Vaccum Cleaner 120 w)",BHRAKUTI,0,0,0,999,0,0,49,"Monday, February 14",1,"₹999
₹1,948 Save ₹949 (49%)"
76,B09B9NW9X7,"Tefal Power XXL Vacuum Cleaner with Silent Performance, Bag XXL Capacity 4.5L, 5 Handy Attachments, TW317101, Blue & Aqua",Tefal,1,0,0,"10,999",4.6,8,0,"Thursday, February 10",1,8
77,B09HRVLZY6,"OSMON - OS WD12 by American Micronic, Wet and Dry Vacuum Cleaner with Blower 19 KPa Suction Power, 100% Copper Motor with auto Cutoff and HEPA Filter (Grey & Orange)",OSMON,1,0,0,"4,071",4.4,51,41,"Sunday, February 13",1,51
78,B09PN3193L,"Aetrius Handheld Vacuum Cleaner Cordless - Mini Car Vacuum Cleaner Rechargeable for Car, Home, Office, Pet Hair Travel Cleaning",Aetrius,0,0,0,"1,799",0,0,64,"Monday, February 14",0,"₹1,799
₹4,999 Save ₹3,200 (64%)"
79,B09NQ1X63S,DKEXL Car Vacuum Cleaner Portable Wet Dry Handheld High Power Strong Suction Advanced Design Wireless Rechargeable Home Pet Hair Vacuum with Powerful Cyclonic with Portable USB & LED Light (Black),DKEXL,0,0,0,"1,149",0,0,43,"Monday, February 14",1,"₹1,149
₹1,999 Save ₹850 (43%)"
80,B09FTF5DW4,"OLAHRAGA 2 in 1 Lightweight, 500W, Upright Stick Vacuum Cleaner for Home, Mini Corded Handheld Vacuum for Car, Ideal for Floor, Pet Hair, Sofa, Window, Car (3.5M Cord Length)",OLAHRAGA,0,0,0,"1,799",3.4,9,67,"Monday, February 14",1,9
81,B071XCK51Q,"Maharsh enterprise 220-240 V, 50 Hz, 1000 W Blowing and Sucking Dual Purpose Vacuum Cleaner (Standard size, Red)",Maharsh,0,0,0,"1,860",3.7,"1,462",38,"Monday, February 14",0,"1,462"
82,B09QYY1NHG,V88R® Robotic Vacuum Cleaner K235 Cleaner 3-in-1 USB Rechargeable Smart Sweeping + Mopping + Vacuum,V88R®,0,0,0,"3,499",0,0,65,"Sunday, February 13",1,V88R®
83,B08JYZWFQ9,"kadeau Mini Desktop Sweeper Vacuum Cleaner Portable Handheld Cordless Tabletop Crumb for Home, Office, Cars, Pet Hairs - Beige (Battery Operated)",kadeau,0,0,0,389,3.2,63,68,"Saturday, February 12",0,63
84,B09FYCH1GZ,"AGARO Royal Upright Vacuum Cleaner, Swivel Steering, 2L Bagless Bin, Light Weight, Pet Hair, Home, Office Use, Grey and Red, Medium (33606)",AGARO,0,0,0,"4,499",4.4,12,55,"Monday, February 14",1,12
85,B07XLXGC2K,Eureka Forbes Multi Clean Vacuum Cleaner,Eureka,0,0,0,"3,299",3.9,550,40,"Saturday, February 12",1,550
86,B0829JLBC5,"Proscenic P10 Cordless Vacuum Cleaner, 22000Pa Powerful, LED Touch Screen, 4 Adjustable Suction Modes, Removable Battery, 4-in-1 Handheld for Carpet Hard Floor Car Pet Hair, Blue",Proscenic,1,0,0,"25,990",3.9,"6,223",4,"Saturday, February 12",1,"6,223"
87,B07DS7GPY7,"Osmon -OS 800BL by American Micronic, 2in1 Vacuum Cleaner (Handheld and Upright) 800 Watts Bagless (White & Pink)",Osmon,1,0,0,"2,741",4.2,278,19,"Monday, February 14",1,278
88,B09QD7BHCZ,RNG EKO GREEN Wireless 12V DC + AC Rechargeable Wet/Dry Car & Home Vacuum Cleaner with Dual Filter- White,RNG,1,0,0,"3,075",5.0,1,32,"Saturday, February 12",1,1
89,B077467KFX,KENT Force Cyclonic Vacuum Cleaner 2000-Watt (White and Silver),KENT,1,0,0,"5,750",3.9,"1,620",23,"Friday, February 11",1,"1,620"
90,B007NFN5TS,BLACK+DECKER ADV1210 12V Powerful Dustbuster Automatic Car Vacuum Cleaner with 4 accessories (Black and Orange),BLACK+DECKER,0,0,0,"1,852",3.7,301,31,"Thursday, February 10",1,301
91,B09BL3C8YW,"INALSA Vacuum Cleaner Homeasy WD10 with 3 functions Wet/Dry/Blow| 1200W Motor, 10L Tank Capacity & 1.8m Hose Pipe with Handle Grip (Yellow/Black)",INALSA,0,0,0,"4,199",3.9,126,59,"Saturday, February 12",1,126
92,B081T2YXGK,"Geek Renere N6, 600W Wired Handheld Vacuum Cleaner with NanoDuzt Filtration Technology, 17 KPa Strong Suction, 0.5L Dust Container, (Blush Red)",Geek,0,0,0,"3,039",3.4,92,32,"Tuesday, February 15",1,92
93,B087BWZTRN,"Deerma DX900 2 in 1 Vacuum Cleaner, Handheld Lightweight Vacuum Cleaner (Vacuum Cleaner)",Deerma,0,0,0,"2,842",3.6,144,15,"Sunday, February 13",1,144
94,B098B218SH,Verilux® ILIFE Robot Vacuum Cleaner Accessories Replacement 3 Pcs Mop Cloth Pads for ILIFE V8S X750 X785 Robotic Vacuum Cleaner,Verilux®,0,0,0,369,5.0,2,23,"Monday, February 14",1,2
95,B09GFXV5NC,Jugaadify Portable Cordless Mini Desktop Vacuum Desk Dust Cleaner/Dust Sweeper for Home Office Keyboard & Laptop (Pink),Jugaadify,0,0,0,849,5.0,1,43,"Saturday, February 12",1,1
96,B085DYKCQR,"70mai Cordless Portable Car Vacuum Cleaner Swift, 5000Pa 120 Watt Suction, 24min Long Runtime, Innovative Ventilation Design with Nozzle Set",70mai,0,0,0,"4,199",4.0,247,53,"Saturday, February 12",1,70mai
97,B08QFVKWVW,Probus W11 600W Handheld Vacuum Cleaner with HEPA Filtration and Powerful Cyclone System | Large Capacity Dust Collector | Wet and Dry Multifunction 15000 Pa High Suction - (White/Grey),Probus,0,0,0,"2,989",3.9,150,50,"Monday, February 14",1,150
98,B07RCGTZ4M,"AGARO Ace 1600 Watts, 21.5 kPa Suction Power, 21 litres Wet & Dry Stainless Steel Vacuum Cleaner with Blower Function and Washable Dust Bag",AGARO,1,0,0,"6,313",4.2,"1,389",37,"Thursday, February 10",1,"1,389"
99,B08CH2D67F,"ECOVACS DEEBOT OZMO T8 dToF 2-in-1 Robotic Vacuum Cleaner with dToF 3D & OZMO Mopping Technology, Multi-Floor Mapping, Virtual Boundary,Work on Carpets & Hard Floors.",ECOVACS,1,0,0,"39,900",4.0,"1,085",60,"Monday, February 14",1,"1,085"
100,B09D3D7Q5K,"VOVOSO Premium Cordless Vacuum Cleaner for Home and car- Portable, Powerful Suction, Wet and Dry, w/ 3 Attachments, Carrying Bag and Two Extra HEPA Filter for Deep Cleaning (White)",VOVOSO,0,0,0,"3,499",4.2,37,42,"Tuesday, February 15",0,37
101,B07SVMKKVP,"AGARO Twister 2200 Watts Dry Vacuum Cleaner with Powerful 25 kPa Suction Power & in-Built Blower, 6 litres dust Bag (Grey)",AGARO,0,0,0,"8,999",4.0,242,18,"Monday, February 14",1,242
102,B09MWFNH5D,"KNYUC MART Multi-Functional Portable Vacuum Cleaner Blowing and Sucking Dual Purpose (JK-8), 220-240 V, 50 HZ, 1000 W",KNYUC,0,0,0,"1,998",0,0,26,"Monday, February 14",1,"₹1,998
₹2,699 Save ₹701 (26%)"
103,B07PSJXZ7Z,Balzano Aero Vac GW902K 600-Watt Stick Vacuum Cleaner (Blue),Balzano,0,0,0,"2,490",4.0,"1,190",69,"Monday, February 14",1,"1,190"
104,B09PL31M18,"ANIRUDHA Handheld Vacuum Cleaner Cordless - Mini Car Vacuum Cleaner Rechargeable for Car, Home, Office, Pet Hair Travel Cleaning",ANIRUDHA,0,0,0,"1,799",0,0,64,"Monday, February 14",1,"₹1,799
₹4,999 Save ₹3,200 (64%)"
105,B09LV8MBYS,"GOBBLER DustBuddy Pro Handheld Wireless Vacuum Cleaner, Light Weight and Durable Small Cordless Vacuum for Home, Office & Car (GB-51)",GOBBLER,0,0,0,"1,790",3.0,1,57,"Thursday, February 10",1,1
106,B09NJMHSQS,"MELLERWARE Vacuum Cleaner 1400 Watt Bagless Cylinder Vacuum Cleaner MWVC 02 with Powerful Suction & High Energy Efficiency| 1.5L Dust Box Capacity, (Aqua Green/Black)",MELLERWARE,0,0,0,"3,799",0,0,40,"Sunday, February 13",1,"₹3,799
₹6,345 Save ₹2,546 (40%)"
107,B08WXPTG1N,AGARO Empire 2200Watt Bagless Vacuum Cleaner with 3L Dust Collector (Orange/Ash),AGARO,0,0,0,"4,690",3.9,31,41,"Monday, February 14",1,31
108,B07RCGZFL9,"AGARO Storm 2000 Watts Vacuum Cleaner with Powerful 24 kPa Suction Power, Dry vacuuming, 4 litres dust Bag (Black)",AGARO,1,0,0,"5,899",4.1,461,26,"Thursday, February 10",1,461
109,B083M7WPZD,"AGARO 33398 Rapid 1000-Watt, 10-Litre Wet & Dry Vacuum Cleaner, with Blower Function (Red & Black)",AGARO,1,0,0,"3,899",4.1,"1,602",35,"Monday, February 14",1,"1,602"
110,B08W32FKWT,"Amtidy A590 Local Home Voice Robotic Vacuum with Light, Robot Vacuum Cleaner with WiFi APP Control, Auto Recharging, Compatible with Alexa/Google Asisstant.",Amtidy,1,0,0,"7,999",3.4,14,70,"Tuesday, February 15",1,14
111,B077481D45,KENT - KSL-612 Wet and Dry Vacuum Cleaner 1200-Watt (Metallic Silver),KENT,1,0,0,"5,999",4.0,675,40,"Friday, February 11",1,675
112,B09NYFR173,Deerma 2-in1 Vacuum Cleaner with Large Capacity Separable Dust Box Low Noise Triple Filter Handheld Vertical Cleaning Tool (Vacuum Cleaner),Deerma,0,0,0,"4,831",0,0,15,"Sunday, February 13",1,"₹4,831
₹5,669 Save ₹838 (15%)"
113,B077481D45,KENT - KSL-612 Wet and Dry Vacuum Cleaner 1200-Watt (Metallic Silver),KENT,0,0,0,"5,999",4.0,675,40,"Friday, February 11",1,675
114,B09JK97B5D,"Aepigo Multi-Functional Portable Vacuum Cleaner for Home, Office Garage Sucking Dual Purpose (JK-8), (220-240 V, 50 HZ, 1000 W)",Aepigo,0,0,0,0,5.0,2,0,,0,2
115,B08RBYC9Y2,"Easymart 220-240 V, 50 Hz, 1000 W Vacuum Cleaner for Home Blowing and Sucking Dual Purpose Vacuum Cleaner (Standard Size, Red)",Easymart,0,0,0,"1,999",3.8,101,60,"Monday, February 14",1,101
116,B09DXD6CF8,"CloudShopz 0295 USB Computer Mini Vacuum Cleaner, Car Vacuum Cleaner (Pack of 2)",CloudShopz,0,0,0,399,0,0,50,"Friday, February 11",0,"₹399
₹799 Save ₹400 (50%)"
117,B09ND86KPH,"SCILLA Vacuum Cleaner |Multi-Functional Portable Vacuum Cleaner for Home, Office Garage Sucking Dual Purpose, Home Blowing (220-240 V, 50 HZ, 1000 W) Multicolor",SCILLA,0,0,0,"1,799",0,0,33,"Monday, February 14",1,"₹1,799
₹2,699 Save ₹900 (33%)"
118,B09PNJS81B,"Credicus Handheld Vacuums Cordless, 120W Handheld Vacuum Cleaner with Powerful Suction, Portable Rechargeable Car Vacuum Cleaner, Lightweight Wet Dry Vacuum for Home, Office, Car and Pet",Credicus,0,0,0,"2,299",0,0,54,"Monday, February 14",1,"₹2,299
₹4,999 Save ₹2,700 (54%)"
119,B07MWDJMY2,BLACK+DECKER VM1680 1600-Watt 20 Kpa High Suction 2.5L dustbowl Bagless Multicyclonic Vacuum Cleaner with 6 stage Filteration (Red and Black),BLACK+DECKER,0,0,0,"4,804",4.0,650,43,"Thursday, February 10",1,650
